,frame_num,environment,places
2524,60576,indoor,"clean_room, bow_window/indoor, dressing_room, living_room, artists_loft"
2525,60600,indoor,"clean_room, dressing_room, shower, discotheque, chemistry_lab"
2526,60624,indoor,"dressing_room, clean_room, beauty_salon, closet, discotheque"
2527,60648,indoor,"airplane_cabin, clean_room, dressing_room, hospital_room, attic"
2528,60672,indoor,"clean_room, dressing_room, museum/indoor, hospital_room, banquet_hall"
2529,60696,indoor,"clean_room, discotheque, dressing_room, basement, chemistry_lab"
2530,60720,indoor,"discotheque, chemistry_lab, clean_room, dressing_room, banquet_hall"
2531,60744,indoor,"discotheque, dressing_room, clean_room, chemistry_lab, banquet_hall"
2532,60768,indoor,"discotheque, dressing_room, clean_room, chemistry_lab, banquet_hall"
2533,60792,indoor,"dressing_room, discotheque, clean_room, chemistry_lab, nursery"
2534,60816,indoor,"dressing_room, discotheque, clean_room, chemistry_lab, nursery"
2535,60840,indoor,"discotheque, clean_room, dressing_room, stage/indoor, chemistry_lab"
2536,60864,indoor,"discotheque, stage/indoor, clean_room, dressing_room, music_studio"
2537,60888,indoor,"discotheque, clean_room, stage/indoor, dressing_room, music_studio"
2538,60912,indoor,"discotheque, dressing_room, clean_room, stage/indoor, chemistry_lab"
2539,60936,indoor,"discotheque, dressing_room, stage/indoor, clean_room, chemistry_lab"
2540,60960,indoor,"discotheque, stage/indoor, dressing_room, clean_room, music_studio"
2541,60984,indoor,"discotheque, clean_room, stage/indoor, dressing_room, chemistry_lab"
2542,61008,indoor,"discotheque, stage/indoor, clean_room, dressing_room, chemistry_lab"
2543,61032,indoor,"discotheque, clean_room, dressing_room, stage/indoor, chemistry_lab"
2544,61056,indoor,"discotheque, clean_room, chemistry_lab, dressing_room, stage/indoor"
2545,61080,indoor,"clean_room, boxing_ring, shower, bowling_alley, hospital_room"
2546,61104,indoor,"discotheque, stage/indoor, chemistry_lab, clean_room, museum/indoor"
2547,61128,indoor,"museum/indoor, dressing_room, clean_room, stage/indoor, ballroom"
2548,61152,indoor,"clean_room, museum/indoor, dressing_room, stage/indoor, discotheque"
2549,61176,indoor,"dressing_room, clean_room, stage/indoor, museum/indoor, discotheque"
2550,61200,indoor,"stage/indoor, discotheque, dressing_room, clean_room, music_studio"
2551,61224,indoor,"discotheque, dressing_room, stage/indoor, music_studio, clean_room"
2552,61248,indoor,"discotheque, dressing_room, stage/indoor, music_studio, nursing_home"
2553,61272,indoor,"discotheque, dressing_room, stage/indoor, music_studio, chemistry_lab"
2554,61296,indoor,"discotheque, dressing_room, stage/indoor, music_studio, nursing_home"
2555,61320,indoor,"discotheque, dressing_room, stage/indoor, music_studio, nursing_home"
2556,61344,indoor,"discotheque, dressing_room, stage/indoor, music_studio, chemistry_lab"
2557,61368,indoor,"stage/indoor, discotheque, clean_room, music_studio, dressing_room"
2558,61392,indoor,"stage/indoor, discotheque, music_studio, clean_room, museum/indoor"
2559,61416,indoor,"stage/indoor, dressing_room, clean_room, discotheque, music_studio"
2560,61440,indoor,"dressing_room, discotheque, clean_room, stage/indoor, music_studio"
2561,61464,indoor,"dressing_room, discotheque, stage/indoor, clean_room, locker_room"
2562,61488,indoor,"dressing_room, discotheque, stage/indoor, clean_room, music_studio"
2563,61512,indoor,"dressing_room, discotheque, stage/indoor, clean_room, locker_room"
2564,61536,indoor,"dressing_room, discotheque, stage/indoor, clean_room, music_studio"
2565,61560,indoor,"discotheque, stage/indoor, clean_room, museum/indoor, music_studio"
2566,61584,indoor,"discotheque, stage/indoor, dressing_room, museum/indoor, ballroom"
2567,61608,indoor,"chemistry_lab, discotheque, clean_room, dressing_room, stage/indoor"
2568,61632,indoor,"discotheque, museum/indoor, stage/indoor, clean_room, music_studio"
2569,61656,indoor,"clean_room, chemistry_lab, discotheque, stage/indoor, museum/indoor"
2570,61680,indoor,"clean_room, museum/indoor, chemistry_lab, art_gallery, science_museum"
2571,61704,indoor,"museum/indoor, clean_room, art_gallery, iceberg, science_museum"
2572,61728,indoor,"discotheque, stage/indoor, music_studio, museum/indoor, bowling_alley"
2573,61752,indoor,"clean_room, shower, jail_cell, chemistry_lab, basement"
2574,61776,indoor,"dressing_room, bowling_alley, clean_room, boxing_ring, nursery"
2575,61800,indoor,"clean_room, discotheque, basement, chemistry_lab, archive"
2576,61824,indoor,"clean_room, archive, dressing_room, museum/indoor, nursing_home"
2577,61848,indoor,"dressing_room, discotheque, stage/indoor, ballroom, martial_arts_gym"
2578,61872,indoor,"martial_arts_gym, nursing_home, stage/indoor, ballroom, discotheque"
2579,61896,indoor,"martial_arts_gym, stage/indoor, archive, boxing_ring, ballroom"
2580,61920,indoor,"nursery, museum/indoor, martial_arts_gym, stage/indoor, archive"
2581,61944,indoor,"museum/indoor, stage/indoor, martial_arts_gym, music_studio, archive"
2582,61968,indoor,"stage/indoor, music_studio, martial_arts_gym, archive, discotheque"
2583,61992,indoor,"stage/indoor, museum/indoor, ballroom, archive, martial_arts_gym"
2584,62016,indoor,"stage/indoor, discotheque, music_studio, archive, nursing_home"
2585,62040,indoor,"archive, museum/indoor, stage/indoor, nursery, music_studio"
2586,62064,indoor,"martial_arts_gym, stage/indoor, archive, music_studio, museum/indoor"
2587,62088,indoor,"staircase, mezzanine, entrance_hall, corridor, atrium/public"
2588,62112,indoor,"staircase, mezzanine, entrance_hall, atrium/public, lobby"
2589,62136,indoor,"staircase, mezzanine, entrance_hall, artists_loft, atrium/public"
2590,62160,indoor,"nursery, dressing_room, entrance_hall, clean_room, living_room"
2591,62184,indoor,"nursery, dressing_room, dining_room, living_room, entrance_hall"
2592,62208,indoor,"nursery, dressing_room, childs_room, living_room, bedroom"
2593,62232,indoor,"clean_room, nursery, entrance_hall, dressing_room, staircase"
2594,62256,indoor,"escalator/indoor, staircase, atrium/public, subway_station/platform, archive"
2595,62280,indoor,"staircase, entrance_hall, corridor, atrium/public, jail_cell"
2596,62304,indoor,"entrance_hall, staircase, atrium/public, mezzanine, corridor"
2597,62328,indoor,"staircase, mezzanine, entrance_hall, museum/indoor, artists_loft"
2598,62352,indoor,"staircase, entrance_hall, mezzanine, museum/indoor, atrium/public"
2599,62376,indoor,"bow_window/indoor, chemistry_lab, dining_room, shower, bathroom"
2600,62400,indoor,"chemistry_lab, bow_window/indoor, dining_room, bar, shower"
2601,62424,indoor,"chemistry_lab, biology_laboratory, bar, clean_room, wet_bar"
2602,62448,indoor,"chemistry_lab, banquet_hall, dining_room, bar, bow_window/indoor"
2603,62472,outdoor,"chemistry_lab, industrial_area, lighthouse, alcove, tower"
2604,62496,indoor,"clean_room, staircase, dressing_room, corridor, hospital_room"
2605,62520,indoor,"clean_room, shower, igloo, staircase, airport_terminal"
2606,62544,indoor,"staircase, mezzanine, corridor, entrance_hall, attic"
2607,62568,indoor,"staircase, mezzanine, attic, corridor, balcony/interior"
2608,62592,indoor,"bow_window/indoor, shower, bathroom, chemistry_lab, clean_room"
2609,62616,indoor,"clean_room, chemistry_lab, nursery, bow_window/indoor, locker_room"
2610,62640,indoor,"clean_room, museum/indoor, chemistry_lab, dressing_room, stage/indoor"
2611,62664,indoor,"museum/indoor, art_gallery, clean_room, stage/indoor, shower"
2612,62688,indoor,"staircase, museum/indoor, art_gallery, corridor, entrance_hall"
2613,62712,outdoor,"mosque/outdoor, tower, water_tower, lighthouse, skyscraper"
2614,62736,outdoor,"tower, skyscraper, office_building, hospital, hospital_room"
2615,62760,outdoor,"sky, tower, water_tower, wind_farm, skyscraper"
2616,62784,outdoor,"shower, igloo, sky, ice_shelf, bathroom"
2617,62808,outdoor,"sky, shower, igloo, ice_shelf, ice_floe"
2618,62832,outdoor,"sky, ice_floe, ice_shelf, shower, iceberg"
2619,62856,outdoor,"sky, ice_floe, igloo, ice_shelf, iceberg"
2620,62880,outdoor,"tower, skyscraper, sky, office_building, water_tower"
2621,62904,outdoor,"sky, ice_shelf, snowfield, tower, ice_floe"
2622,62928,outdoor,"sky, basement, hot_spring, discotheque, lighthouse"
2623,62952,indoor,"museum/indoor, desert/sand, art_gallery, ice_shelf, clean_room"
2624,62976,indoor,"martial_arts_gym, stage/indoor, clean_room, museum/indoor, dressing_room"
2625,63000,indoor,"stage/indoor, discotheque, museum/indoor, iceberg, clean_room"
2626,63024,indoor,"clean_room, stage/indoor, martial_arts_gym, iceberg, museum/indoor"
2627,63048,indoor,"discotheque, shower, chemistry_lab, museum/indoor, science_museum"
2628,63072,indoor,"discotheque, shower, stage/indoor, museum/indoor, chemistry_lab"
2629,63096,indoor,"discotheque, shower, museum/indoor, science_museum, chemistry_lab"
2630,63120,indoor,"discotheque, museum/indoor, science_museum, stage/indoor, natural_history_museum"
2631,63144,indoor,"discotheque, chemistry_lab, shower, bar, stage/indoor"
2632,63168,indoor,"discotheque, clean_room, chemistry_lab, basement, stage/indoor"
2633,63192,indoor,"clean_room, discotheque, chemistry_lab, art_gallery, basement"
2634,63216,indoor,"clean_room, chemistry_lab, discotheque, biology_laboratory, art_gallery"
2635,63240,indoor,"clean_room, discotheque, stage/indoor, chemistry_lab, runway"
2636,63264,outdoor,"iceberg, clean_room, ice_shelf, ice_floe, ice_cream_parlor"
2637,63288,outdoor,"igloo, iceberg, ice_floe, ice_shelf, clean_room"
2638,63312,indoor,"shower, clean_room, chemistry_lab, discotheque, basement"
2639,63336,indoor,"discotheque, clean_room, chemistry_lab, basement, music_studio"
2640,63360,indoor,"discotheque, shower, clean_room, stage/indoor, chemistry_lab"
2641,63384,outdoor,"sky, shower, igloo, ice_floe, snowfield"
2642,63408,outdoor,"sky, shower, ice_floe, igloo, underwater/ocean_deep"
2643,63432,indoor,"iceberg, ice_floe, museum/indoor, clean_room, discotheque"
2644,63456,outdoor,"museum/indoor, ice_floe, clean_room, igloo, iceberg"
2645,63480,outdoor,"ice_floe, iceberg, martial_arts_gym, ice_shelf, clean_room"
2646,63504,outdoor,"ice_floe, iceberg, clean_room, ice_shelf, museum/indoor"
2647,63528,outdoor,"ice_floe, iceberg, clean_room, museum/indoor, ice_shelf"
2648,63552,indoor,"locker_room, shower, clean_room, basement, discotheque"
2649,63576,indoor,"shower, locker_room, basement, clean_room, atrium/public"
2650,63600,indoor,"shower, clean_room, bathroom, locker_room, discotheque"
2651,63624,indoor,"shower, basement, discotheque, jail_cell, attic"
2652,63648,indoor,"shower, discotheque, sky, basement, elevator/door"
2653,63672,indoor,"igloo, discotheque, shower, basement, sky"
2654,63696,indoor,"igloo, shower, discotheque, bathroom, burial_chamber"
2655,63720,indoor,"shower, elevator/door, tower, cemetery, clean_room"
2656,63744,indoor,"hospital, discotheque, motel, locker_room, server_room"
2657,63768,indoor,"discotheque, motel, locker_room, bar, hospital"
2658,63792,indoor,"discotheque, locker_room, server_room, stage/indoor, bar"
2659,63816,outdoor,"sky, igloo, ice_floe, iceberg, ice_shelf"
2660,63840,outdoor,"sky, igloo, ice_floe, aquarium, ice_shelf"
2661,63864,outdoor,"sky, ice_floe, igloo, aquarium, discotheque"
2662,63888,outdoor,"sky, ice_floe, aquarium, igloo, discotheque"
2663,63912,outdoor,"sky, igloo, ice_floe, wheat_field, aquarium"
2664,63936,outdoor,"sky, aquarium, ice_floe, igloo, wheat_field"
2665,63960,outdoor,"sky, ice_floe, igloo, aquarium, iceberg"
2666,63984,outdoor,"sky, igloo, aquarium, ice_floe, discotheque"
2667,64008,outdoor,"sky, igloo, ice_floe, aquarium, water_tower"
2668,64032,outdoor,"sky, ice_floe, igloo, aquarium, ice_shelf"
2669,64056,outdoor,"sky, igloo, ice_floe, aquarium, ice_shelf"
2670,64080,outdoor,"sky, igloo, ice_floe, aquarium, ice_shelf"
2671,64104,outdoor,"sky, igloo, ice_floe, aquarium, discotheque"
2672,64128,outdoor,"sky, ice_floe, igloo, aquarium, wind_farm"
2673,64152,outdoor,"sky, igloo, ice_floe, aquarium, ice_shelf"
2674,64176,outdoor,"sky, igloo, ice_floe, aquarium, ice_shelf"
2675,64200,outdoor,"sky, igloo, ice_floe, aquarium, ice_shelf"
2676,64224,outdoor,"sky, igloo, ice_floe, aquarium, ice_shelf"
2677,64248,outdoor,"sky, igloo, ice_floe, aquarium, ice_shelf"
2678,64272,outdoor,"sky, igloo, ice_floe, aquarium, iceberg"
2679,64296,outdoor,"sky, ice_floe, igloo, iceberg, ice_shelf"
2680,64320,outdoor,"sky, ice_floe, igloo, aquarium, ice_shelf"
2681,64344,outdoor,"sky, ice_floe, igloo, aquarium, ice_shelf"
2682,64368,outdoor,"sky, ice_floe, igloo, aquarium, wheat_field"
2683,64392,outdoor,"sky, ice_floe, aquarium, igloo, underwater/ocean_deep"
2684,64416,outdoor,"sky, ice_floe, aquarium, igloo, ice_shelf"
2685,64440,outdoor,"sky, ice_floe, igloo, aquarium, ice_shelf"
2686,64464,outdoor,"sky, ice_floe, igloo, aquarium, iceberg"
2687,64488,outdoor,"sky, aquarium, ice_floe, igloo, underwater/ocean_deep"
2688,64512,outdoor,"sky, igloo, ice_floe, aquarium, ice_shelf"
2689,64536,outdoor,"sky, igloo, ice_floe, aquarium, fountain"
2690,64560,outdoor,"sky, igloo, ice_floe, ice_shelf, discotheque"
2691,64584,outdoor,"sky, igloo, ice_floe, ice_shelf, discotheque"
2692,64608,outdoor,"sky, igloo, ice_floe, ice_shelf, aquarium"
2693,64632,outdoor,"sky, ice_floe, igloo, ice_shelf, aquarium"
2694,64656,outdoor,"sky, igloo, ice_floe, aquarium, discotheque"
2695,64680,outdoor,"sky, igloo, ice_floe, discotheque, ice_shelf"
2696,64704,indoor,"sky, discotheque, chemistry_lab, tower, shower"
2697,64728,indoor,"discotheque, sky, chemistry_lab, tower, museum/indoor"
2698,64752,indoor,"discotheque, chemistry_lab, shower, sky, museum/indoor"
2699,64776,indoor,"discotheque, shower, chemistry_lab, museum/indoor, stage/indoor"
2700,64800,indoor,"discotheque, sky, shower, stage/indoor, museum/indoor"
2701,64824,indoor,"sky, shower, discotheque, museum/indoor, tower"
2702,64848,indoor,"sky, discotheque, shower, museum/indoor, tower"
2703,64872,indoor,"discotheque, chemistry_lab, dressing_room, shower, stage/indoor"
2704,64896,indoor,"discotheque, dressing_room, chemistry_lab, shower, hospital_room"
2705,64920,indoor,"museum/indoor, discotheque, chemistry_lab, tower, science_museum"
2706,64944,indoor,"museum/indoor, sky, discotheque, chemistry_lab, tower"
2707,64968,indoor,"museum/indoor, tower, sky, chemistry_lab, discotheque"
2708,64992,outdoor,"discotheque, tower, sky, museum/indoor, skyscraper"
2709,65016,indoor,"discotheque, museum/indoor, tower, stage/indoor, sky"
2710,65040,indoor,"museum/indoor, discotheque, tower, sky, chemistry_lab"
2711,65064,indoor,"discotheque, museum/indoor, sky, tower, stage/indoor"
2712,65088,indoor,"sky, discotheque, tower, museum/indoor, shower"
2713,65112,indoor,"discotheque, sky, stage/indoor, tower, museum/indoor"
2714,65136,indoor,"discotheque, museum/indoor, sky, stage/indoor, tower"
2715,65160,indoor,"sky, discotheque, tower, museum/indoor, stage/indoor"
2716,65184,outdoor,"sky, tower, museum/indoor, discotheque, skyscraper"
2717,65208,outdoor,"sky, tower, museum/indoor, discotheque, skyscraper"
2718,65232,outdoor,"museum/indoor, discotheque, tower, sky, mosque/outdoor"
2719,65256,indoor,"museum/indoor, discotheque, art_gallery, tower, chemistry_lab"
2720,65280,indoor,"museum/indoor, tower, discotheque, sky, chemistry_lab"
2721,65304,outdoor,"sky, igloo, ice_floe, aquarium, iceberg"
2722,65328,outdoor,"sky, igloo, aquarium, discotheque, ice_floe"
2723,65352,outdoor,"sky, igloo, aquarium, ice_floe, discotheque"
2724,65376,outdoor,"sky, discotheque, igloo, aquarium, ice_floe"
2725,65400,indoor,"discotheque, clean_room, music_studio, bowling_alley, physics_laboratory"
2726,65424,indoor,"discotheque, clean_room, music_studio, bowling_alley, physics_laboratory"
2727,65448,indoor,"discotheque, clean_room, bowling_alley, airport_terminal, music_studio"
2728,65472,indoor,"discotheque, clean_room, bowling_alley, physics_laboratory, chemistry_lab"
2729,65496,indoor,"discotheque, clean_room, bowling_alley, airport_terminal, music_studio"
2730,65520,indoor,"clean_room, discotheque, museum/indoor, tower, airport_terminal"
2731,65544,indoor,"museum/indoor, science_museum, discotheque, natural_history_museum, clean_room"
2732,65568,indoor,"science_museum, clean_room, natural_history_museum, discotheque, museum/indoor"
2733,65592,indoor,"clean_room, science_museum, chemistry_lab, shower, discotheque"
2734,65616,indoor,"shower, clean_room, science_museum, discotheque, chemistry_lab"
2735,65640,indoor,"clean_room, shower, science_museum, museum/indoor, chemistry_lab"
2736,65664,indoor,"clean_room, chemistry_lab, discotheque, shower, igloo"
2737,65688,outdoor,"sky, discotheque, igloo, wind_farm, ice_floe"
2738,65712,outdoor,"discotheque, sky, igloo, wind_farm, ice_floe"
2739,65736,outdoor,"sky, discotheque, igloo, wind_farm, ice_floe"
2740,65760,outdoor,"sky, igloo, discotheque, ice_floe, wind_farm"
2741,65784,outdoor,"sky, igloo, discotheque, ice_floe, iceberg"
2742,65808,outdoor,"sky, discotheque, igloo, ice_floe, wind_farm"
2743,65832,outdoor,"sky, discotheque, igloo, wind_farm, ice_floe"
2744,65856,outdoor,"sky, igloo, iceberg, discotheque, ice_floe"
2745,65880,outdoor,"sky, igloo, iceberg, ice_floe, ice_shelf"
2746,65904,outdoor,"sky, discotheque, igloo, iceberg, stage/indoor"
2747,65928,outdoor,"sky, discotheque, igloo, aquarium, iceberg"
2748,65952,outdoor,"sky, aquarium, ice_floe, discotheque, igloo"
2749,65976,indoor,"clean_room, chemistry_lab, tower, science_museum, shower"
2750,66000,indoor,"airport_terminal, clean_room, science_museum, shower, airplane_cabin"
2751,66024,outdoor,"iceberg, ice_shelf, clean_room, ice_floe, museum/indoor"
2752,66048,outdoor,"clean_room, iceberg, ice_shelf, ice_floe, igloo"
2753,66072,indoor,"museum/indoor, clean_room, iceberg, art_gallery, stage/indoor"
2754,66096,indoor,"clean_room, museum/indoor, art_gallery, martial_arts_gym, discotheque"
2755,66120,indoor,"sky, clean_room, ice_floe, museum/indoor, discotheque"
2756,66144,indoor,"discotheque, museum/indoor, ice_floe, boxing_ring, hot_spring"
2757,66168,indoor,"igloo, clean_room, shower, iceberg, discotheque"
2758,66192,indoor,"clean_room, shower, airport_terminal, runway, stage/indoor"
2759,66216,outdoor,"runway, ice_shelf, shower, airport_terminal, wind_farm"
2760,66240,indoor,"server_room, discotheque, archive, shower, basement"
2761,66264,indoor,"clean_room, chemistry_lab, art_gallery, archive, discotheque"
2762,66288,outdoor,"shower, ice_shelf, ice_floe, pond, art_gallery"
2763,66312,indoor,"archive, discotheque, ice_shelf, iceberg, lecture_room"
2764,66336,indoor,"ice_shelf, archive, discotheque, iceberg, museum/indoor"
2765,66360,indoor,"discotheque, iceberg, archive, ice_shelf, stage/indoor"
2766,66384,outdoor,"iceberg, ice_shelf, ice_floe, pond, sky"
2767,66408,outdoor,"pond, ice_shelf, museum/indoor, airport_terminal, ice_floe"
2768,66432,outdoor,"iceberg, ice_shelf, ice_floe, igloo, pond"
2769,66456,indoor,"clean_room, discotheque, museum/indoor, igloo, archive"
2770,66480,indoor,"clean_room, archive, museum/indoor, igloo, airport_terminal"
2771,66504,indoor,"archive, clean_room, igloo, museum/indoor, ice_shelf"
2772,66528,indoor,"science_museum, clean_room, museum/indoor, discotheque, shower"
2773,66552,indoor,"bowling_alley, museum/indoor, clean_room, archive, art_gallery"
2774,66576,indoor,"clean_room, bowling_alley, museum/indoor, art_gallery, corridor"
2775,66600,indoor,"museum/indoor, bowling_alley, art_gallery, clean_room, science_museum"
2776,66624,indoor,"bowling_alley, clean_room, museum/indoor, staircase, art_gallery"
2777,66648,indoor,"clean_room, bowling_alley, museum/indoor, chemistry_lab, archive"
2778,66672,indoor,"bowling_alley, clean_room, staircase, corridor, basement"
2779,66696,indoor,"bowling_alley, clean_room, corridor, staircase, archive"
2780,66720,indoor,"clean_room, museum/indoor, bowling_alley, art_gallery, science_museum"
2781,66744,indoor,"museum/indoor, bowling_alley, art_gallery, clean_room, staircase"
2782,66768,indoor,"bowling_alley, museum/indoor, clean_room, art_gallery, science_museum"
2783,66792,indoor,"museum/indoor, bowling_alley, clean_room, art_gallery, archive"
2784,66816,indoor,"museum/indoor, bowling_alley, clean_room, art_gallery, staircase"
2785,66840,indoor,"clean_room, museum/indoor, bowling_alley, art_gallery, archive"
2786,66864,indoor,"museum/indoor, clean_room, bowling_alley, art_gallery, archive"
2787,66888,indoor,"museum/indoor, bowling_alley, clean_room, art_gallery, martial_arts_gym"
2788,66912,indoor,"museum/indoor, art_gallery, bowling_alley, staircase, clean_room"
2789,66936,indoor,"childs_room, nursery, iceberg, art_gallery, clean_room"
2790,66960,indoor,"shower, aquarium, science_museum, museum/indoor, art_gallery"
2791,66984,indoor,"museum/indoor, art_gallery, science_museum, clean_room, ice_floe"
2792,67008,indoor,"shower, alcove, art_gallery, basement, igloo"
2793,67032,indoor,"shower, basement, jail_cell, attic, bathroom"
2794,67056,indoor,"shower, basement, igloo, art_gallery, attic"
2795,67080,indoor,"shower, basement, art_gallery, wind_farm, attic"
2796,67104,indoor,"shower, basement, art_gallery, museum/indoor, attic"
2797,67128,indoor,"basement, shower, art_gallery, elevator/door, bathroom"
2798,67152,indoor,"basement, clean_room, shower, art_gallery, server_room"
2799,67176,indoor,"basement, clean_room, art_gallery, wind_farm, discotheque"
2800,67200,indoor,"discotheque, basement, art_gallery, clean_room, shower"
2801,67224,indoor,"basement, discotheque, shower, art_gallery, clean_room"
2802,67248,indoor,"shower, clean_room, museum/indoor, science_museum, art_gallery"
2803,67272,indoor,"museum/indoor, art_gallery, basement, clean_room, archive"
2804,67296,indoor,"art_gallery, shower, clean_room, discotheque, museum/indoor"
2805,67320,indoor,"clean_room, igloo, discotheque, art_gallery, shower"
2806,67344,indoor,"art_gallery, clean_room, basement, discotheque, museum/indoor"
2807,67368,indoor,"art_gallery, basement, discotheque, attic, nursery"
2808,67392,indoor,"art_gallery, clean_room, basement, museum/indoor, igloo"
2809,67416,indoor,"museum/indoor, archive, art_gallery, science_museum, art_studio"
2810,67440,indoor,"museum/indoor, archive, art_gallery, science_museum, lecture_room"
2811,67464,indoor,"museum/indoor, archive, art_gallery, science_museum, art_studio"
2812,67488,indoor,"museum/indoor, archive, art_gallery, science_museum, art_studio"
2813,67512,indoor,"museum/indoor, art_gallery, archive, science_museum, art_studio"
2814,67536,indoor,"museum/indoor, shower, discotheque, basement, clean_room"
2815,67560,indoor,"discotheque, stage/indoor, bar, bowling_alley, martial_arts_gym"
2816,67584,indoor,"chemistry_lab, clean_room, museum/indoor, discotheque, biology_laboratory"
2817,67608,indoor,"discotheque, museum/indoor, stage/indoor, wind_farm, chemistry_lab"
2818,67632,indoor,"discotheque, museum/indoor, wind_farm, tower, stage/indoor"
2819,67656,outdoor,"museum/indoor, wind_farm, tower, mosque/outdoor, skyscraper"
2820,67680,indoor,"museum/indoor, wind_farm, clean_room, discotheque, archive"
2821,67704,indoor,"wind_farm, museum/indoor, archive, clean_room, windmill"
2822,67728,indoor,"museum/indoor, wind_farm, clean_room, windmill, natural_history_museum"
2823,67752,indoor,"museum/indoor, art_gallery, clean_room, archive, natural_history_museum"
2824,67776,indoor,"museum/indoor, art_gallery, clean_room, natural_history_museum, archive"
2825,67800,indoor,"art_gallery, museum/indoor, clean_room, natural_history_museum, archive"
2826,67824,indoor,"art_gallery, museum/indoor, clean_room, natural_history_museum, archive"
2827,67848,indoor,"clean_room, museum/indoor, art_gallery, natural_history_museum, archive"
2828,67872,indoor,"museum/indoor, art_gallery, clean_room, natural_history_museum, archive"
2829,67896,indoor,"museum/indoor, art_gallery, clean_room, natural_history_museum, science_museum"
2830,67920,indoor,"museum/indoor, clean_room, wind_farm, discotheque, archive"
2831,67944,indoor,"museum/indoor, clean_room, discotheque, archive, wind_farm"
2832,67968,indoor,"museum/indoor, wind_farm, archive, discotheque, clean_room"
2833,67992,indoor,"museum/indoor, wind_farm, clean_room, discotheque, art_gallery"
2834,68016,indoor,"museum/indoor, wind_farm, clean_room, science_museum, discotheque"
2835,68040,indoor,"museum/indoor, wind_farm, clean_room, discotheque, archive"
2836,68064,indoor,"museum/indoor, wind_farm, clean_room, discotheque, art_gallery"
2837,68088,outdoor,"museum/indoor, wind_farm, tower, discotheque, windmill"
2838,68112,outdoor,"wind_farm, museum/indoor, tower, discotheque, windmill"
2839,68136,indoor,"discotheque, wind_farm, stage/indoor, museum/indoor, tower"
2840,68160,indoor,"museum/indoor, discotheque, archive, stage/indoor, classroom"
2841,68184,indoor,"museum/indoor, discotheque, archive, igloo, bowling_alley"
2842,68208,indoor,"clean_room, basement, art_gallery, archive, igloo"
2843,68232,indoor,"basement, art_gallery, shower, attic, igloo"
2844,68256,indoor,"basement, attic, art_gallery, locker_room, jail_cell"
2845,68280,outdoor,"iceberg, ice_floe, art_gallery, ice_shelf, ocean"
2846,68304,indoor,"basement, igloo, art_gallery, clean_room, shower"
2847,68328,indoor,"shower, basement, igloo, art_gallery, skyscraper"
2848,68352,indoor,"shower, basement, art_gallery, museum/indoor, igloo"
2849,68376,indoor,"basement, shower, igloo, art_gallery, museum/indoor"
2850,68400,indoor,"shower, wind_farm, basement, art_gallery, clean_room"
2851,68424,indoor,"shower, clean_room, igloo, bathroom, nursery"
2852,68448,indoor,"discotheque, basement, shower, stage/indoor, archive"
2853,68472,indoor,"museum/indoor, science_museum, natural_history_museum, archive, art_gallery"
2854,68496,indoor,"museum/indoor, art_gallery, discotheque, science_museum, archive"
2855,68520,indoor,"museum/indoor, discotheque, science_museum, art_gallery, archive"
