,frame_num,environment,places
0,0,outdoor,"desert/sand, sky, beach, ocean, ice_shelf"
1,24,indoor,"shower, staircase, museum/indoor, water_tower, tower"
2,48,indoor,"staircase, museum/indoor, bank_vault, nursery, shower"
3,72,indoor,"museum/indoor, staircase, bank_vault, science_museum, nursery"
4,96,indoor,"museum/indoor, staircase, bank_vault, science_museum, nursery"
5,120,indoor,"museum/indoor, bank_vault, staircase, science_museum, shower"
6,144,indoor,"museum/indoor, science_museum, gift_shop, natural_history_museum, coffee_shop"
7,168,indoor,"motel, coffee_shop, bowling_alley, drugstore, pharmacy"
8,192,indoor,"motel, coffee_shop, drugstore, bowling_alley, pharmacy"
9,216,indoor,"motel, coffee_shop, bowling_alley, drugstore, pharmacy"
10,240,indoor,"motel, coffee_shop, bowling_alley, drugstore, pharmacy"
11,264,indoor,"motel, coffee_shop, drugstore, bowling_alley, pharmacy"
12,288,indoor,"motel, coffee_shop, drugstore, pharmacy, beauty_salon"
13,312,indoor,"museum/indoor, nursery, archive, motel, bow_window/indoor"
14,336,indoor,"nursery, museum/indoor, archive, motel, ice_cream_parlor"
15,360,indoor,"nursery, museum/indoor, archive, bow_window/indoor, motel"
16,384,indoor,"nursery, museum/indoor, archive, motel, ice_cream_parlor"
17,408,indoor,"nursery, museum/indoor, archive, motel, ice_cream_parlor"
18,432,indoor,"pharmacy, drugstore, beauty_salon, museum/indoor, hospital_room"
19,456,indoor,"pharmacy, drugstore, motel, beauty_salon, hospital_room"
20,480,indoor,"pharmacy, drugstore, motel, beauty_salon, hospital_room"
21,504,indoor,"pharmacy, drugstore, motel, beauty_salon, hospital_room"
22,528,indoor,"pharmacy, drugstore, beauty_salon, motel, hospital_room"
23,552,indoor,"museum/indoor, pharmacy, drugstore, beauty_salon, ice_cream_parlor"
24,576,indoor,"motel, coffee_shop, drugstore, bowling_alley, ice_cream_parlor"
25,600,indoor,"motel, coffee_shop, drugstore, bowling_alley, ice_cream_parlor"
26,624,indoor,"motel, coffee_shop, bowling_alley, drugstore, pharmacy"
27,648,indoor,"motel, coffee_shop, drugstore, bowling_alley, ice_cream_parlor"
28,672,indoor,"motel, coffee_shop, drugstore, bowling_alley, pharmacy"
29,696,indoor,"motel, coffee_shop, drugstore, bowling_alley, pharmacy"
30,720,indoor,"museum/indoor, archive, science_museum, booth/indoor, art_gallery"
31,744,indoor,"museum/indoor, science_museum, natural_history_museum, archive, art_gallery"
32,768,indoor,"museum/indoor, science_museum, natural_history_museum, archive, art_gallery"
33,792,indoor,"museum/indoor, science_museum, natural_history_museum, archive, art_gallery"
34,816,indoor,"museum/indoor, science_museum, natural_history_museum, archive, art_gallery"
35,840,indoor,"museum/indoor, science_museum, natural_history_museum, archive, art_gallery"
36,864,indoor,"museum/indoor, science_museum, natural_history_museum, archive, art_gallery"
37,888,indoor,"museum/indoor, science_museum, natural_history_museum, archive, art_gallery"
38,912,indoor,"archive, museum/indoor, drugstore, science_museum, pharmacy"
39,936,indoor,"museum/indoor, art_gallery, archive, art_studio, office"
40,960,indoor,"museum/indoor, art_gallery, archive, art_studio, artists_loft"
41,984,indoor,"museum/indoor, art_gallery, archive, art_studio, science_museum"
42,1008,indoor,"museum/indoor, dressing_room, archive, art_gallery, stage/indoor"
43,1032,indoor,"museum/indoor, archive, dressing_room, art_gallery, bookstore"
44,1056,indoor,"museum/indoor, archive, dressing_room, stage/indoor, art_gallery"
45,1080,indoor,"stage/indoor, discotheque, museum/indoor, music_studio, archive"
46,1104,indoor,"museum/indoor, stage/indoor, art_gallery, dressing_room, music_studio"
47,1128,indoor,"museum/indoor, stage/indoor, art_gallery, music_studio, dressing_room"
48,1152,indoor,"museum/indoor, stage/indoor, discotheque, archive, dressing_room"
49,1176,indoor,"museum/indoor, archive, dressing_room, art_gallery, bookstore"
50,1200,indoor,"museum/indoor, archive, dressing_room, art_gallery, bookstore"
51,1224,indoor,"museum/indoor, archive, art_gallery, dressing_room, music_studio"
52,1248,indoor,"museum/indoor, archive, dressing_room, art_gallery, television_studio"
53,1272,indoor,"beauty_salon, drugstore, pharmacy, bookstore, museum/indoor"
54,1296,indoor,"museum/indoor, pharmacy, drugstore, beauty_salon, coffee_shop"
55,1320,indoor,"museum/indoor, beauty_salon, drugstore, pharmacy, coffee_shop"
56,1344,indoor,"pharmacy, beauty_salon, drugstore, museum/indoor, reception"
57,1368,indoor,"pharmacy, drugstore, reception, hospital, beauty_salon"
58,1392,indoor,"attic, jail_cell, alcove, basement, shower"
59,1416,indoor,"attic, airplane_cabin, basement, igloo, shower"
60,1440,outdoor,"sky, waterfall, ice_shelf, crevasse, glacier"
61,1464,outdoor,"sky, ice_shelf, ice_floe, iceberg, wind_farm"
62,1488,outdoor,"sky, ice_shelf, tower, skyscraper, igloo"
63,1512,outdoor,"sky, wind_farm, fountain, discotheque, ice_floe"
64,1536,indoor,"discotheque, clean_room, shower, sky, hospital_room"
65,1560,indoor,"sky, igloo, shower, aquarium, discotheque"
66,1584,outdoor,"sky, shower, hot_spring, wheat_field, wind_farm"
67,1608,outdoor,"sky, volcano, tower, skyscraper, industrial_area"
68,1632,outdoor,"sky, hot_spring, wind_farm, shower, tower"
69,1656,outdoor,"fountain, iceberg, ice_shelf, sky, skyscraper"
70,1680,outdoor,"sky, desert/sand, igloo, iceberg, hot_spring"
71,1704,outdoor,"sky, hot_spring, wind_farm, shower, tower"
72,1728,outdoor,"sky, hot_spring, tower, shower, wind_farm"
73,1752,outdoor,"sky, fountain, hot_spring, shower, tower"
74,1776,outdoor,"sky, shower, wind_farm, tower, skyscraper"
75,1800,outdoor,"sky, tower, hot_spring, water_tower, lighthouse"
76,1824,outdoor,"sky, wind_farm, ice_floe, windmill, igloo"
77,1848,outdoor,"iceberg, ice_shelf, sky, ice_floe, wave"
78,1872,outdoor,"sky, volcano, hot_spring, mountain_snowy, mountain"
79,1896,outdoor,"sky, hot_spring, wind_farm, shower, desert/sand"
80,1920,outdoor,"iceberg, sky, ice_floe, igloo, ice_shelf"
81,1944,indoor,"clean_room, discotheque, museum/indoor, stage/indoor, art_gallery"
82,1968,indoor,"clean_room, museum/indoor, operating_room, art_gallery, science_museum"
83,1992,indoor,"clean_room, stage/indoor, museum/indoor, discotheque, music_studio"
84,2016,indoor,"clean_room, museum/indoor, art_gallery, discotheque, dressing_room"
85,2040,indoor,"clean_room, museum/indoor, chemistry_lab, operating_room, art_gallery"
86,2064,indoor,"clean_room, chemistry_lab, biology_laboratory, operating_room, restaurant_kitchen"
87,2088,indoor,"clean_room, martial_arts_gym, clothing_store, dressing_room, locker_room"
88,2112,indoor,"clean_room, clothing_store, discotheque, stage/indoor, dressing_room"
89,2136,indoor,"clean_room, stage/indoor, discotheque, clothing_store, martial_arts_gym"
90,2160,indoor,"clean_room, discotheque, stage/indoor, museum/indoor, clothing_store"
91,2184,indoor,"clean_room, stage/indoor, museum/indoor, discotheque, dressing_room"
92,2208,indoor,"clean_room, museum/indoor, dressing_room, art_gallery, operating_room"
93,2232,indoor,"clean_room, operating_room, dressing_room, hospital_room, museum/indoor"
94,2256,indoor,"clean_room, operating_room, museum/indoor, hospital_room, dressing_room"
95,2280,indoor,"clean_room, operating_room, dressing_room, hospital_room, museum/indoor"
96,2304,indoor,"clean_room, operating_room, hospital_room, dressing_room, chemistry_lab"
97,2328,indoor,"clean_room, operating_room, dressing_room, hospital_room, chemistry_lab"
98,2352,indoor,"clean_room, operating_room, discotheque, hospital_room, stage/indoor"
99,2376,indoor,"clean_room, operating_room, martial_arts_gym, museum/indoor, discotheque"
100,2400,indoor,"clean_room, operating_room, discotheque, stage/indoor, hospital_room"
101,2424,indoor,"museum/indoor, martial_arts_gym, art_gallery, clothing_store, clean_room"
102,2448,indoor,"museum/indoor, martial_arts_gym, clothing_store, art_gallery, science_museum"
103,2472,indoor,"martial_arts_gym, museum/indoor, clothing_store, art_gallery, stage/indoor"
104,2496,indoor,"museum/indoor, martial_arts_gym, stage/indoor, dressing_room, nursery"
105,2520,indoor,"clean_room, discotheque, dressing_room, clothing_store, stage/indoor"
106,2544,indoor,"clean_room, discotheque, ice_floe, stage/indoor, museum/indoor"
107,2568,indoor,"clean_room, museum/indoor, operating_room, art_gallery, archive"
108,2592,indoor,"clean_room, operating_room, chemistry_lab, hospital_room, biology_laboratory"
109,2616,indoor,"clean_room, operating_room, chemistry_lab, biology_laboratory, hospital_room"
110,2640,indoor,"clean_room, operating_room, chemistry_lab, hospital_room, biology_laboratory"
111,2664,indoor,"clean_room, operating_room, chemistry_lab, hospital_room, biology_laboratory"
112,2688,indoor,"clean_room, operating_room, hospital_room, dressing_room, clothing_store"
113,2712,indoor,"clean_room, operating_room, museum/indoor, dressing_room, art_gallery"
114,2736,indoor,"clean_room, museum/indoor, operating_room, martial_arts_gym, art_gallery"
115,2760,indoor,"clean_room, operating_room, chemistry_lab, hospital_room, biology_laboratory"
116,2784,indoor,"bathroom, shower, clean_room, chemistry_lab, locker_room"
117,2808,indoor,"shower, basement, clean_room, bathroom, art_gallery"
118,2832,indoor,"clean_room, elevator/door, locker_room, discotheque, elevator_lobby"
119,2856,indoor,"clean_room, shower, dressing_room, ballroom, museum/indoor"
120,2880,indoor,"clean_room, shower, discotheque, ballroom, dressing_room"
121,2904,indoor,"clean_room, martial_arts_gym, museum/indoor, operating_room, chemistry_lab"
122,2928,indoor,"clean_room, museum/indoor, operating_room, martial_arts_gym, chemistry_lab"
123,2952,indoor,"clean_room, operating_room, museum/indoor, martial_arts_gym, stage/indoor"
124,2976,indoor,"clean_room, museum/indoor, martial_arts_gym, operating_room, stage/indoor"
125,3000,indoor,"clean_room, operating_room, martial_arts_gym, museum/indoor, chemistry_lab"
126,3024,indoor,"clean_room, martial_arts_gym, museum/indoor, operating_room, chemistry_lab"
127,3048,indoor,"clean_room, museum/indoor, operating_room, stage/indoor, art_gallery"
128,3072,indoor,"clean_room, museum/indoor, martial_arts_gym, operating_room, stage/indoor"
129,3096,indoor,"clean_room, museum/indoor, martial_arts_gym, operating_room, art_gallery"
130,3120,indoor,"clean_room, museum/indoor, martial_arts_gym, operating_room, stage/indoor"
131,3144,indoor,"clean_room, shower, discotheque, ballroom, dressing_room"
132,3168,indoor,"shower, discotheque, clean_room, ballroom, stage/indoor"
133,3192,indoor,"clean_room, locker_room, museum/indoor, shower, ballroom"
134,3216,indoor,"shower, clean_room, ballroom, locker_room, bathroom"
135,3240,indoor,"shower, bathroom, clean_room, sauna, locker_room"
136,3264,indoor,"chemistry_lab, shower, clean_room, physics_laboratory, bar"
137,3288,indoor,"discotheque, swimming_pool/indoor, stage/indoor, shower, music_studio"
138,3312,indoor,"discotheque, igloo, nursery, hospital_room, banquet_hall"
139,3336,indoor,"discotheque, beauty_salon, restaurant, bar, banquet_hall"
140,3360,indoor,"discotheque, beauty_salon, restaurant, conference_center, bar"
141,3384,indoor,"clean_room, discotheque, chemistry_lab, music_studio, ballroom"
142,3408,indoor,"clean_room, discotheque, music_studio, chemistry_lab, stage/indoor"
143,3432,indoor,"clean_room, museum/indoor, dressing_room, chemistry_lab, discotheque"
144,3456,indoor,"discotheque, clean_room, ballroom, stage/indoor, music_studio"
145,3480,indoor,"discotheque, beauty_salon, bar, restaurant, bathroom"
146,3504,indoor,"operating_room, hospital_room, clean_room, discotheque, beauty_salon"
147,3528,indoor,"stage/indoor, hospital_room, discotheque, beauty_salon, clean_room"
148,3552,indoor,"discotheque, clean_room, museum/indoor, stage/indoor, art_gallery"
149,3576,indoor,"discotheque, museum/indoor, clean_room, stage/indoor, art_gallery"
150,3600,indoor,"clean_room, museum/indoor, discotheque, art_gallery, science_museum"
151,3624,indoor,"discotheque, museum/indoor, clean_room, stage/indoor, art_gallery"
152,3648,indoor,"museum/indoor, discotheque, clean_room, stage/indoor, art_gallery"
153,3672,indoor,"discotheque, museum/indoor, clean_room, stage/indoor, art_gallery"
154,3696,indoor,"clean_room, dressing_room, discotheque, shower, music_studio"
155,3720,indoor,"clean_room, dressing_room, discotheque, music_studio, shower"
156,3744,indoor,"clean_room, dressing_room, discotheque, shower, music_studio"
157,3768,indoor,"clean_room, dressing_room, discotheque, shower, music_studio"
158,3792,indoor,"clean_room, dressing_room, shower, discotheque, museum/indoor"
159,3816,indoor,"discotheque, stage/indoor, museum/indoor, clean_room, ballroom"
160,3840,indoor,"discotheque, clean_room, stage/indoor, museum/indoor, shower"
161,3864,indoor,"clean_room, shower, dressing_room, bathroom, museum/indoor"
162,3888,indoor,"clean_room, dressing_room, shower, museum/indoor, discotheque"
163,3912,indoor,"clean_room, dressing_room, museum/indoor, chemistry_lab, discotheque"
164,3936,indoor,"clean_room, dressing_room, museum/indoor, shower, chemistry_lab"
165,3960,indoor,"clean_room, dressing_room, shower, museum/indoor, bathroom"
166,3984,indoor,"clean_room, dressing_room, shower, museum/indoor, chemistry_lab"
167,4008,indoor,"clean_room, museum/indoor, discotheque, art_gallery, natural_history_museum"
168,4032,indoor,"clean_room, museum/indoor, discotheque, stage/indoor, art_gallery"
169,4056,indoor,"clean_room, museum/indoor, discotheque, art_gallery, botanical_garden"
170,4080,indoor,"clean_room, museum/indoor, discotheque, stage/indoor, shower"
171,4104,indoor,"clean_room, museum/indoor, discotheque, shower, art_gallery"
172,4128,indoor,"clean_room, dressing_room, shower, museum/indoor, discotheque"
173,4152,indoor,"clean_room, shower, dressing_room, discotheque, ball_pit"
174,4176,indoor,"clean_room, shower, dressing_room, discotheque, bathroom"
175,4200,indoor,"clean_room, shower, dressing_room, discotheque, bathroom"
176,4224,indoor,"clean_room, shower, dressing_room, discotheque, museum/indoor"
177,4248,indoor,"clean_room, dressing_room, discotheque, chemistry_lab, candy_store"
178,4272,indoor,"clean_room, dressing_room, discotheque, chemistry_lab, museum/indoor"
179,4296,indoor,"clean_room, dressing_room, discotheque, chemistry_lab, biology_laboratory"
180,4320,indoor,"clean_room, museum/indoor, discotheque, science_museum, shower"
181,4344,indoor,"clean_room, museum/indoor, discotheque, art_gallery, chemistry_lab"
182,4368,indoor,"clean_room, museum/indoor, discotheque, chemistry_lab, stage/indoor"
183,4392,indoor,"clean_room, museum/indoor, discotheque, chemistry_lab, art_gallery"
184,4416,indoor,"clean_room, museum/indoor, discotheque, art_gallery, chemistry_lab"
185,4440,indoor,"clean_room, museum/indoor, discotheque, art_gallery, iceberg"
186,4464,indoor,"clean_room, museum/indoor, discotheque, chemistry_lab, art_gallery"
187,4488,indoor,"clean_room, museum/indoor, art_gallery, chemistry_lab, discotheque"
188,4512,indoor,"clean_room, museum/indoor, discotheque, art_gallery, iceberg"
189,4536,indoor,"clean_room, museum/indoor, art_gallery, discotheque, iceberg"
190,4560,indoor,"clean_room, museum/indoor, discotheque, chemistry_lab, art_gallery"
191,4584,indoor,"clean_room, museum/indoor, discotheque, chemistry_lab, florist_shop/indoor"
192,4608,indoor,"clean_room, discotheque, museum/indoor, florist_shop/indoor, stage/indoor"
193,4632,indoor,"operating_room, discotheque, clean_room, stage/indoor, ballroom"
194,4656,indoor,"discotheque, operating_room, bar, hospital_room, clean_room"
195,4680,indoor,"discotheque, chemistry_lab, operating_room, bar, clean_room"
196,4704,indoor,"discotheque, chemistry_lab, bar, beauty_salon, restaurant"
197,4728,indoor,"discotheque, clean_room, stage/indoor, music_studio, chemistry_lab"
198,4752,indoor,"discotheque, stage/indoor, music_studio, clean_room, chemistry_lab"
199,4776,indoor,"discotheque, stage/indoor, music_studio, clean_room, chemistry_lab"
200,4800,indoor,"discotheque, stage/indoor, clean_room, music_studio, chemistry_lab"
201,4824,indoor,"operating_room, hospital_room, discotheque, restaurant, chemistry_lab"
202,4848,indoor,"operating_room, chemistry_lab, bar, hospital_room, discotheque"
203,4872,indoor,"discotheque, clean_room, chemistry_lab, classroom, bowling_alley"
204,4896,indoor,"clean_room, archive, classroom, chemistry_lab, library/indoor"
205,4920,indoor,"chemistry_lab, clean_room, biology_laboratory, discotheque, hospital_room"
206,4944,indoor,"clean_room, chemistry_lab, locker_room, bowling_alley, biology_laboratory"
207,4968,indoor,"clean_room, operating_room, locker_room, dressing_room, chemistry_lab"
208,4992,indoor,"archive, chemistry_lab, biology_laboratory, dressing_room, clean_room"
209,5016,indoor,"chemistry_lab, biology_laboratory, clean_room, dressing_room, archive"
210,5040,indoor,"clean_room, biology_laboratory, chemistry_lab, operating_room, pharmacy"
211,5064,indoor,"clean_room, biology_laboratory, chemistry_lab, operating_room, pharmacy"
212,5088,indoor,"clean_room, biology_laboratory, chemistry_lab, pharmacy, operating_room"
213,5112,indoor,"dressing_room, stage/indoor, discotheque, music_studio, bar"
214,5136,indoor,"dressing_room, stage/indoor, discotheque, music_studio, bar"
215,5160,indoor,"dressing_room, stage/indoor, discotheque, music_studio, bar"
216,5184,indoor,"dressing_room, stage/indoor, discotheque, music_studio, bar"
217,5208,indoor,"dressing_room, stage/indoor, discotheque, music_studio, bar"
218,5232,indoor,"dressing_room, music_studio, clean_room, stage/indoor, discotheque"
219,5256,indoor,"archive, biology_laboratory, classroom, clean_room, dressing_room"
220,5280,indoor,"archive, biology_laboratory, chemistry_lab, clean_room, classroom"
221,5304,indoor,"archive, biology_laboratory, clean_room, chemistry_lab, classroom"
222,5328,indoor,"clean_room, chemistry_lab, operating_room, biology_laboratory, hospital_room"
223,5352,indoor,"clean_room, dressing_room, clothing_store, archive, chemistry_lab"
224,5376,indoor,"clean_room, corridor, dressing_room, biology_laboratory, operating_room"
225,5400,indoor,"chemistry_lab, clean_room, biology_laboratory, discotheque, bar"
226,5424,indoor,"clean_room, dressing_room, hospital_room, phone_booth, operating_room"
227,5448,indoor,"dressing_room, clean_room, hospital_room, operating_room, chemistry_lab"
228,5472,indoor,"clean_room, chemistry_lab, dressing_room, hospital_room, biology_laboratory"
229,5496,indoor,"clean_room, dressing_room, operating_room, hospital_room, classroom"
230,5520,indoor,"kindergarden_classroom, hospital_room, nursery, classroom, archive"
231,5544,indoor,"clean_room, sauna, shower, museum/indoor, hospital_room"
232,5568,indoor,"discotheque, clean_room, hospital_room, igloo, nursery"
233,5592,indoor,"clean_room, discotheque, dressing_room, ice_floe, igloo"
234,5616,indoor,"discotheque, shower, museum/indoor, hospital_room, clean_room"
235,5640,indoor,"clean_room, discotheque, banquet_hall, chemistry_lab, shower"
236,5664,indoor,"clean_room, igloo, banquet_hall, discotheque, ice_floe"
237,5688,indoor,"clean_room, banquet_hall, discotheque, igloo, hospital_room"
238,5712,indoor,"clean_room, banquet_hall, discotheque, igloo, ice_floe"
239,5736,indoor,"clean_room, discotheque, shower, banquet_hall, museum/indoor"
240,5760,indoor,"clean_room, banquet_hall, igloo, ice_floe, discotheque"
241,5784,indoor,"clean_room, banquet_hall, igloo, discotheque, ice_floe"
242,5808,indoor,"discotheque, stage/indoor, dressing_room, music_studio, shower"
243,5832,indoor,"discotheque, stage/indoor, shower, clean_room, music_studio"
244,5856,indoor,"discotheque, clean_room, stage/indoor, chemistry_lab, shower"
245,5880,indoor,"discotheque, clean_room, stage/indoor, chemistry_lab, shower"
246,5904,indoor,"discotheque, stage/indoor, clean_room, dressing_room, music_studio"
247,5928,indoor,"clean_room, schoolhouse, discotheque, chemistry_lab, hospital_room"
248,5952,indoor,"clean_room, banquet_hall, discotheque, dressing_room, hospital_room"
249,5976,indoor,"clean_room, igloo, ice_floe, nursery, discotheque"
250,6000,indoor,"clean_room, igloo, ice_floe, shower, chemistry_lab"
251,6024,indoor,"hospital_room, discotheque, shower, clean_room, restaurant"
252,6048,indoor,"shower, clean_room, ice_floe, igloo, bathroom"
253,6072,outdoor,"shower, ice_floe, igloo, ice_shelf, discotheque"
254,6096,indoor,"bow_window/indoor, jail_cell, shower, alcove, artists_loft"
255,6120,indoor,"bow_window/indoor, shower, bathroom, jail_cell, airport_terminal"
256,6144,indoor,"bow_window/indoor, airport_terminal, lobby, shower, chemistry_lab"
257,6168,indoor,"clean_room, shower, greenhouse/outdoor, chemistry_lab, hospital_room"
258,6192,indoor,"clean_room, elevator/door, chemistry_lab, locker_room, airport_terminal"
259,6216,indoor,"clean_room, office, corridor, office_cubicles, jail_cell"
260,6240,indoor,"clean_room, jail_cell, chemistry_lab, locker_room, classroom"
261,6264,indoor,"clean_room, bow_window/indoor, office, nursery, office_cubicles"
262,6288,indoor,"clean_room, bow_window/indoor, nursery, jail_cell, office"
263,6312,indoor,"bow_window/indoor, clean_room, office, artists_loft, office_cubicles"
264,6336,indoor,"clean_room, bow_window/indoor, closet, elevator/door, nursery"
265,6360,indoor,"clean_room, bow_window/indoor, bedroom, alcove, nursery"
266,6384,indoor,"clean_room, hospital_room, chemistry_lab, ice_cream_parlor, shower"
267,6408,indoor,"clean_room, shower, hospital_room, chemistry_lab, biology_laboratory"
268,6432,outdoor,"shower, bridge, arch, bathroom, wind_farm"
269,6456,indoor,"staircase, jail_cell, entrance_hall, clean_room, corridor"
270,6480,indoor,"jail_cell, clean_room, nursery, staircase, shower"
271,6504,indoor,"nursery, playground, jail_cell, clean_room, coffee_shop"
272,6528,indoor,"jail_cell, playground, hospital_room, clean_room, closet"
273,6552,indoor,"clean_room, jail_cell, chemistry_lab, hospital_room, coffee_shop"
274,6576,indoor,"clean_room, nursery, hospital_room, bedroom, hotel_room"
275,6600,indoor,"hospital_room, nursery, playground, bedroom, hotel_room"
276,6624,indoor,"clean_room, ice_floe, nursery, aquarium, hospital_room"
277,6648,indoor,"clean_room, ice_floe, ice_cream_parlor, biology_laboratory, hospital_room"
278,6672,indoor,"clean_room, ice_floe, hospital_room, biology_laboratory, chemistry_lab"
279,6696,indoor,"ice_floe, clean_room, hospital_room, biology_laboratory, florist_shop/indoor"
280,6720,indoor,"ice_floe, iceberg, clean_room, hospital_room, biology_laboratory"
281,6744,indoor,"bow_window/indoor, nursery, clean_room, bedroom, archive"
282,6768,indoor,"jail_cell, nursery, playground, locker_room, hospital_room"
283,6792,indoor,"jail_cell, clean_room, hospital_room, chemistry_lab, biology_laboratory"
284,6816,indoor,"staircase, jail_cell, basement, fire_escape, corridor"
285,6840,indoor,"clean_room, shower, hospital_room, nursery, operating_room"
286,6864,indoor,"clean_room, nursery, clothing_store, ice_shelf, shower"
287,6888,outdoor,"sky, wheat_field, wind_farm, snowfield, tower"
288,6912,outdoor,"sky, ice_floe, hot_spring, snowfield, ice_shelf"
289,6936,outdoor,"snowfield, sky, mountain_snowy, hot_spring, ski_slope"
290,6960,outdoor,"sky, snowfield, hot_spring, mountain_snowy, closet"
291,6984,indoor,"elevator/door, sky, snowfield, shower, closet"
292,7008,outdoor,"sky, hot_spring, snowfield, mountain, mountain_snowy"
293,7032,outdoor,"sky, hot_spring, snowfield, rainforest, forest/broadleaf"
294,7056,indoor,"bow_window/indoor, elevator/door, closet, clean_room, locker_room"
295,7080,indoor,"bow_window/indoor, corridor, clean_room, elevator/door, hospital_room"
296,7104,indoor,"elevator/door, dressing_room, shower, elevator_lobby, sauna"
297,7128,indoor,"bow_window/indoor, library/indoor, clean_room, archive, museum/indoor"
298,7152,indoor,"clean_room, bow_window/indoor, chemistry_lab, physics_laboratory, dining_room"
299,7176,indoor,"classroom, library/indoor, dining_hall, dining_room, lecture_room"
300,7200,indoor,"banquet_hall, dining_hall, library/indoor, classroom, chemistry_lab"
301,7224,indoor,"classroom, lecture_room, library/indoor, clean_room, archive"
302,7248,indoor,"clean_room, classroom, archive, lecture_room, chemistry_lab"
303,7272,indoor,"clean_room, archive, library/indoor, classroom, dining_hall"
304,7296,indoor,"library/indoor, dining_hall, classroom, archive, living_room"
305,7320,indoor,"shower, aquarium, sky, arch, museum/indoor"
306,7344,outdoor,"iceberg, ice_floe, ice_shelf, igloo, aquarium"
307,7368,indoor,"igloo, nursery, childs_room, bedroom, iceberg"
308,7392,indoor,"classroom, lecture_room, library/indoor, archive, dining_hall"
309,7416,indoor,"clean_room, archive, dressing_room, chemistry_lab, classroom"
310,7440,indoor,"clean_room, dressing_room, classroom, lecture_room, archive"
311,7464,indoor,"nursery, art_school, kindergarden_classroom, pharmacy, art_studio"
312,7488,indoor,"nursery, archive, childs_room, bedroom, kindergarden_classroom"
313,7512,indoor,"childs_room, kindergarden_classroom, nursery, art_school, art_studio"
314,7536,indoor,"childs_room, kindergarden_classroom, nursery, art_school, art_studio"
315,7560,indoor,"childs_room, kindergarden_classroom, nursery, art_school, art_studio"
316,7584,indoor,"childs_room, kindergarden_classroom, nursery, art_school, art_studio"
317,7608,indoor,"kindergarden_classroom, childs_room, nursery, art_school, art_studio"
318,7632,indoor,"childs_room, kindergarden_classroom, nursery, art_school, beauty_salon"
319,7656,indoor,"kindergarden_classroom, childs_room, art_school, nursery, art_studio"
320,7680,indoor,"kindergarden_classroom, childs_room, nursery, art_school, beauty_salon"
321,7704,indoor,"kindergarden_classroom, childs_room, nursery, art_school, beauty_salon"
322,7728,indoor,"discotheque, stage/indoor, shower, chemistry_lab, dressing_room"
