,frame_num,environment,places
1899,45576,indoor,"classroom, archive, library/indoor, clean_room, kindergarden_classroom"
1900,45600,indoor,"classroom, archive, library/indoor, clean_room, lecture_room"
1901,45624,indoor,"office, clean_room, office_cubicles, computer_room, archive"
1902,45648,indoor,"nursery, bookstore, archive, coffee_shop, childs_room"
1903,45672,indoor,"bookstore, nursery, archive, drugstore, coffee_shop"
1904,45696,indoor,"clean_room, office, archive, office_cubicles, computer_room"
1905,45720,indoor,"clean_room, server_room, elevator/door, office, science_museum"
1906,45744,indoor,"clean_room, server_room, office, office_cubicles, computer_room"
1907,45768,indoor,"clean_room, server_room, archive, office, computer_room"
1908,45792,indoor,"clean_room, server_room, office, office_cubicles, archive"
1909,45816,indoor,"server_room, office, clean_room, office_cubicles, archive"
1910,45840,indoor,"clean_room, office, server_room, office_cubicles, music_studio"
1911,45864,indoor,"office_cubicles, art_gallery, clean_room, office, science_museum"
1912,45888,indoor,"clean_room, office_cubicles, archive, art_gallery, museum/indoor"
1913,45912,indoor,"chemistry_lab, bar, hospital_room, office, living_room"
1914,45936,indoor,"bar, chemistry_lab, pub/indoor, discotheque, airplane_cabin"
1915,45960,indoor,"nursery, archive, ice_cream_parlor, bookstore, clean_room"
1916,45984,indoor,"nursery, archive, ice_cream_parlor, bookstore, hospital_room"
1917,46008,indoor,"nursery, archive, staircase, ice_cream_parlor, hospital_room"
1918,46032,indoor,"classroom, lecture_room, archive, chemistry_lab, biology_laboratory"
1919,46056,indoor,"classroom, lecture_room, archive, chemistry_lab, biology_laboratory"
1920,46080,indoor,"classroom, lecture_room, clean_room, biology_laboratory, chemistry_lab"
1921,46104,indoor,"chemistry_lab, clean_room, biology_laboratory, hospital_room, discotheque"
1922,46128,indoor,"bar, chemistry_lab, airplane_cabin, discotheque, hospital_room"
1923,46152,indoor,"archive, classroom, lecture_room, chemistry_lab, library/indoor"
1924,46176,indoor,"lecture_room, classroom, archive, conference_center, restaurant"
1925,46200,indoor,"archive, classroom, lecture_room, restaurant, boxing_ring"
1926,46224,indoor,"staircase, escalator/indoor, bowling_alley, airport_terminal, airplane_cabin"
1927,46248,indoor,"staircase, escalator/indoor, airport_terminal, bowling_alley, airplane_cabin"
1928,46272,indoor,"staircase, escalator/indoor, airplane_cabin, airport_terminal, bowling_alley"
1929,46296,indoor,"staircase, escalator/indoor, airplane_cabin, laundromat, airport_terminal"
1930,46320,indoor,"clean_room, chemistry_lab, biology_laboratory, airplane_cabin, beauty_salon"
1931,46344,indoor,"clean_room, iceberg, ice_floe, science_museum, museum/indoor"
1932,46368,indoor,"clean_room, office_cubicles, office, museum/indoor, science_museum"
1933,46392,indoor,"clean_room, classroom, archive, chemistry_lab, lecture_room"
1934,46416,indoor,"classroom, archive, lecture_room, chemistry_lab, clean_room"
1935,46440,indoor,"classroom, lecture_room, restaurant, chemistry_lab, coffee_shop"
1936,46464,indoor,"classroom, lecture_room, archive, chemistry_lab, restaurant"
1937,46488,indoor,"escalator/indoor, staircase, airport_terminal, airplane_cabin, hospital_room"
1938,46512,indoor,"staircase, escalator/indoor, laundromat, airplane_cabin, clean_room"
1939,46536,indoor,"library/indoor, archive, office, dining_room, clean_room"
1940,46560,indoor,"archive, clean_room, library/indoor, dining_room, classroom"
1941,46584,indoor,"archive, museum/indoor, library/indoor, recreation_room, classroom"
1942,46608,indoor,"archive, library/indoor, classroom, museum/indoor, recreation_room"
1943,46632,indoor,"archive, library/indoor, recreation_room, museum/indoor, classroom"
1944,46656,indoor,"archive, office, library/indoor, museum/indoor, recreation_room"
1945,46680,indoor,"archive, library/indoor, classroom, office, museum/indoor"
1946,46704,indoor,"classroom, library/indoor, archive, lecture_room, recreation_room"
1947,46728,indoor,"archive, library/indoor, clean_room, classroom, biology_laboratory"
1948,46752,indoor,"clean_room, biology_laboratory, chemistry_lab, archive, library/indoor"
1949,46776,indoor,"archive, library/indoor, classroom, restaurant, clean_room"
1950,46800,indoor,"archive, clean_room, library/indoor, classroom, kitchen"
1951,46824,indoor,"archive, clean_room, classroom, biology_laboratory, library/indoor"
1952,46848,indoor,"archive, bowling_alley, classroom, lecture_room, clean_room"
1953,46872,indoor,"museum/indoor, archive, clean_room, office, lecture_room"
1954,46896,indoor,"museum/indoor, archive, clean_room, art_gallery, office"
1955,46920,indoor,"museum/indoor, archive, clean_room, library/indoor, lecture_room"
1956,46944,indoor,"museum/indoor, archive, classroom, lecture_room, art_gallery"
1957,46968,indoor,"clean_room, classroom, dressing_room, museum/indoor, archive"
1958,46992,indoor,"archive, clean_room, dressing_room, classroom, office_cubicles"
1959,47016,indoor,"clean_room, archive, classroom, dressing_room, museum/indoor"
1960,47040,indoor,"archive, clean_room, classroom, lecture_room, dressing_room"
1961,47064,indoor,"classroom, archive, dressing_room, clean_room, office"
1962,47088,indoor,"classroom, archive, dressing_room, lecture_room, office"
1963,47112,indoor,"classroom, dressing_room, ballroom, martial_arts_gym, clean_room"
1964,47136,indoor,"clean_room, operating_room, chemistry_lab, biology_laboratory, archive"
1965,47160,indoor,"clean_room, archive, classroom, operating_room, chemistry_lab"
1966,47184,indoor,"clean_room, archive, museum/indoor, dressing_room, locker_room"
1967,47208,indoor,"dressing_room, clean_room, locker_room, ballroom, sauna"
1968,47232,indoor,"dressing_room, clean_room, elevator/door, shower, locker_room"
1969,47256,indoor,"shower, locker_room, bathroom, elevator/door, clean_room"
1970,47280,indoor,"elevator/door, locker_room, clean_room, elevator_lobby, museum/indoor"
1971,47304,indoor,"lecture_room, classroom, office, archive, office_cubicles"
1972,47328,indoor,"classroom, lecture_room, office, office_cubicles, archive"
1973,47352,indoor,"classroom, chemistry_lab, lecture_room, biology_laboratory, office"
1974,47376,indoor,"locker_room, elevator_lobby, elevator/door, museum/indoor, lobby"
1975,47400,indoor,"locker_room, elevator_lobby, clean_room, airport_terminal, elevator/door"
1976,47424,indoor,"clean_room, shower, bathroom, locker_room, hospital_room"
1977,47448,indoor,"clean_room, nursery, locker_room, hospital_room, office_cubicles"
1978,47472,indoor,"clean_room, locker_room, bathroom, nursery, shower"
1979,47496,indoor,"clean_room, locker_room, nursery, bathroom, dressing_room"
1980,47520,indoor,"clean_room, locker_room, shower, bathroom, dressing_room"
1981,47544,indoor,"clean_room, shower, locker_room, bathroom, dressing_room"
1982,47568,indoor,"clean_room, locker_room, nursery, kindergarden_classroom, archive"
1983,47592,indoor,"clean_room, locker_room, nursery, dressing_room, hospital_room"
1984,47616,indoor,"locker_room, clean_room, elevator/door, archive, classroom"
1985,47640,indoor,"clean_room, locker_room, nursery, dressing_room, bathroom"
1986,47664,indoor,"clean_room, dressing_room, shower, discotheque, chemistry_lab"
1987,47688,indoor,"clean_room, dressing_room, shower, museum/indoor, art_gallery"
1988,47712,indoor,"clean_room, elevator/door, elevator_lobby, dressing_room, locker_room"
1989,47736,indoor,"elevator/door, elevator_lobby, clean_room, museum/indoor, lobby"
1990,47760,indoor,"dressing_room, locker_room, bathroom, clean_room, elevator/door"
1991,47784,indoor,"clean_room, office, dressing_room, locker_room, reception"
1992,47808,indoor,"archive, clean_room, museum/indoor, elevator_lobby, dressing_room"
1993,47832,indoor,"clean_room, dressing_room, museum/indoor, archive, elevator_lobby"
1994,47856,indoor,"dressing_room, shower, clean_room, bathroom, locker_room"
1995,47880,indoor,"clean_room, dressing_room, museum/indoor, elevator/door, archive"
1996,47904,indoor,"archive, clean_room, locker_room, office, lecture_room"
1997,47928,indoor,"archive, clean_room, pharmacy, drugstore, library/indoor"
1998,47952,indoor,"pharmacy, archive, drugstore, chemistry_lab, library/indoor"
1999,47976,indoor,"archive, playroom, bow_window/indoor, nursery, kindergarden_classroom"
2000,48000,indoor,"entrance_hall, clean_room, museum/indoor, living_room, ballroom"
2001,48024,indoor,"clean_room, physics_laboratory, archive, office, library/indoor"
2002,48048,indoor,"classroom, lecture_room, archive, physics_laboratory, conference_center"
2003,48072,indoor,"classroom, archive, lecture_room, physics_laboratory, clean_room"
2004,48096,indoor,"clean_room, chemistry_lab, biology_laboratory, classroom, physics_laboratory"
2005,48120,indoor,"clean_room, archive, classroom, office, biology_laboratory"
2006,48144,indoor,"clean_room, archive, biology_laboratory, office, dressing_room"
2007,48168,outdoor,"iceberg, ice_floe, igloo, aquarium, clean_room"
2008,48192,outdoor,"ice_floe, igloo, clean_room, iceberg, hospital_room"
2009,48216,indoor,"clean_room, hotel_room, bedroom, hospital_room, nursery"
2010,48240,indoor,"hotel_room, clean_room, nursery, bedroom, hospital_room"
2011,48264,indoor,"clean_room, hotel_room, nursery, hospital_room, bedroom"
2012,48288,indoor,"chemistry_lab, archive, office, clean_room, nursing_home"
2013,48312,indoor,"archive, clean_room, office, chemistry_lab, locker_room"
2014,48336,indoor,"archive, clean_room, office, chemistry_lab, music_studio"
2015,48360,indoor,"archive, clean_room, office, chemistry_lab, museum/indoor"
2016,48384,indoor,"archive, clean_room, office, dressing_room, chemistry_lab"
2017,48408,indoor,"clean_room, office, archive, nursing_home, chemistry_lab"
2018,48432,indoor,"archive, office, nursing_home, clean_room, chemistry_lab"
2019,48456,indoor,"archive, clean_room, dressing_room, office, music_studio"
2020,48480,indoor,"archive, clean_room, museum/indoor, office, locker_room"
2021,48504,indoor,"archive, clean_room, office, hospital_room, chemistry_lab"
2022,48528,indoor,"clean_room, hospital_room, office, nursing_home, dressing_room"
2023,48552,indoor,"office, clean_room, hospital_room, dressing_room, archive"
2024,48576,indoor,"nursing_home, office, clean_room, hospital_room, archive"
2025,48600,indoor,"archive, clean_room, office, locker_room, dressing_room"
2026,48624,indoor,"archive, clean_room, office, locker_room, museum/indoor"
2027,48648,indoor,"archive, clean_room, office, music_studio, locker_room"
2028,48672,indoor,"archive, clean_room, office, dressing_room, chemistry_lab"
2029,48696,indoor,"archive, clean_room, office, dressing_room, museum/indoor"
2030,48720,indoor,"archive, clean_room, office, locker_room, dressing_room"
2031,48744,indoor,"archive, clean_room, office, dressing_room, locker_room"
2032,48768,indoor,"archive, clean_room, office, dressing_room, locker_room"
2033,48792,indoor,"archive, clean_room, office, dressing_room, locker_room"
2034,48816,indoor,"office, clean_room, nursing_home, chemistry_lab, hospital_room"
2035,48840,indoor,"office, chemistry_lab, clean_room, nursing_home, hospital_room"
2036,48864,indoor,"discotheque, nursery, clean_room, chemistry_lab, hospital_room"
2037,48888,indoor,"clean_room, nursery, archive, dressing_room, nursing_home"
2038,48912,indoor,"clean_room, bow_window/indoor, chemistry_lab, archive, office"
2039,48936,indoor,"bow_window/indoor, jail_cell, elevator/door, locker_room, shower"
2040,48960,indoor,"bow_window/indoor, hospital_room, clean_room, jail_cell, nursing_home"
2041,48984,indoor,"bow_window/indoor, nursery, jail_cell, dressing_room, clean_room"
2042,49008,indoor,"stage/indoor, dressing_room, jail_cell, discotheque, music_studio"
2043,49032,indoor,"clean_room, ballroom, museum/indoor, bow_window/indoor, corridor"
2044,49056,indoor,"dressing_room, clean_room, nursery, locker_room, hospital_room"
2045,49080,indoor,"dressing_room, nursery, clean_room, office, dining_room"
2046,49104,indoor,"clean_room, dressing_room, elevator/door, bathroom, office"
2047,49128,indoor,"office, clean_room, dressing_room, classroom, office_cubicles"
2048,49152,indoor,"clean_room, office, office_cubicles, archive, classroom"
2049,49176,indoor,"clean_room, office, archive, nursing_home, office_cubicles"
2050,49200,indoor,"clean_room, office, archive, office_cubicles, operating_room"
2051,49224,indoor,"clean_room, office, archive, nursing_home, office_cubicles"
2052,49248,indoor,"clean_room, office, nursing_home, office_cubicles, archive"
2053,49272,indoor,"clean_room, office, nursing_home, office_cubicles, archive"
2054,49296,indoor,"clean_room, office, office_cubicles, archive, nursing_home"
2055,49320,indoor,"clean_room, office, archive, office_cubicles, nursing_home"
2056,49344,indoor,"clean_room, nursing_home, museum/indoor, hospital_room, science_museum"
2057,49368,indoor,"clean_room, museum/indoor, ice_cream_parlor, science_museum, operating_room"
2058,49392,indoor,"clean_room, museum/indoor, archive, science_museum, office_cubicles"
2059,49416,indoor,"clean_room, archive, museum/indoor, science_museum, discotheque"
2060,49440,indoor,"clean_room, archive, museum/indoor, library/indoor, science_museum"
2061,49464,indoor,"archive, clean_room, museum/indoor, office, music_studio"
2062,49488,indoor,"clean_room, archive, museum/indoor, locker_room, dressing_room"
2063,49512,indoor,"archive, clean_room, locker_room, music_studio, museum/indoor"
2064,49536,indoor,"archive, clean_room, locker_room, museum/indoor, dressing_room"
2065,49560,indoor,"archive, clean_room, locker_room, museum/indoor, physics_laboratory"
2066,49584,indoor,"clean_room, operating_room, museum/indoor, veterinarians_office, nursing_home"
2067,49608,indoor,"clean_room, museum/indoor, science_museum, nursing_home, archive"
2068,49632,indoor,"clean_room, museum/indoor, science_museum, archive, martial_arts_gym"
2069,49656,indoor,"clean_room, ice_cream_parlor, museum/indoor, archive, operating_room"
2070,49680,indoor,"clean_room, ice_cream_parlor, museum/indoor, science_museum, operating_room"
2071,49704,indoor,"clean_room, museum/indoor, archive, science_museum, operating_room"
2072,49728,indoor,"clean_room, archive, museum/indoor, nursing_home, science_museum"
2073,49752,indoor,"clean_room, museum/indoor, archive, nursing_home, science_museum"
2074,49776,indoor,"clean_room, museum/indoor, science_museum, archive, martial_arts_gym"
2075,49800,indoor,"clean_room, museum/indoor, archive, nursing_home, science_museum"
2076,49824,indoor,"clean_room, archive, museum/indoor, library/indoor, nursery"
2077,49848,indoor,"clean_room, archive, museum/indoor, library/indoor, operating_room"
2078,49872,indoor,"archive, clean_room, museum/indoor, library/indoor, office"
2079,49896,indoor,"clean_room, archive, museum/indoor, library/indoor, clothing_store"
2080,49920,indoor,"archive, clean_room, museum/indoor, library/indoor, nursery"
2081,49944,indoor,"archive, clean_room, library/indoor, museum/indoor, office"
2082,49968,indoor,"archive, clean_room, library/indoor, pharmacy, chemistry_lab"
2083,49992,indoor,"archive, library/indoor, museum/indoor, clean_room, chemistry_lab"
2084,50016,indoor,"archive, clean_room, museum/indoor, physics_laboratory, music_studio"
2085,50040,indoor,"archive, museum/indoor, clean_room, nursing_home, music_studio"
2086,50064,indoor,"archive, museum/indoor, nursing_home, clean_room, library/indoor"
2087,50088,indoor,"archive, museum/indoor, nursing_home, clean_room, library/indoor"
2088,50112,indoor,"archive, museum/indoor, nursing_home, clean_room, library/indoor"
2089,50136,indoor,"archive, museum/indoor, nursing_home, clean_room, library/indoor"
2090,50160,indoor,"archive, museum/indoor, clean_room, nursing_home, library/indoor"
2091,50184,indoor,"archive, museum/indoor, clean_room, nursing_home, library/indoor"
2092,50208,indoor,"archive, museum/indoor, nursing_home, clean_room, library/indoor"
2093,50232,indoor,"archive, museum/indoor, clean_room, nursing_home, library/indoor"
2094,50256,indoor,"archive, clean_room, library/indoor, nursing_home, office"
2095,50280,indoor,"clean_room, archive, physics_laboratory, office, nursing_home"
2096,50304,indoor,"archive, museum/indoor, clean_room, library/indoor, locker_room"
2097,50328,indoor,"archive, museum/indoor, library/indoor, lecture_room, clean_room"
2098,50352,indoor,"archive, clean_room, library/indoor, pharmacy, museum/indoor"
2099,50376,indoor,"clean_room, museum/indoor, science_museum, chemistry_lab, art_gallery"
2100,50400,indoor,"living_room, beauty_salon, waiting_room, dressing_room, lobby"
2101,50424,indoor,"dressing_room, living_room, waiting_room, clean_room, beauty_salon"
2102,50448,indoor,"clean_room, archive, airport_terminal, server_room, locker_room"
2103,50472,indoor,"clean_room, drugstore, archive, server_room, airport_terminal"
2104,50496,indoor,"clean_room, archive, drugstore, pharmacy, airport_terminal"
2105,50520,indoor,"clean_room, archive, drugstore, pharmacy, chemistry_lab"
2106,50544,indoor,"dressing_room, clean_room, bathroom, beauty_salon, shower"
2107,50568,indoor,"dressing_room, clean_room, chemistry_lab, beauty_salon, museum/indoor"
2108,50592,indoor,"dressing_room, clean_room, museum/indoor, archive, lobby"
2109,50616,indoor,"library/indoor, archive, clean_room, living_room, entrance_hall"
2110,50640,indoor,"library/indoor, archive, living_room, entrance_hall, waiting_room"
2111,50664,indoor,"archive, library/indoor, office, lobby, waiting_room"
2112,50688,indoor,"dressing_room, archive, office, library/indoor, beauty_salon"
2113,50712,indoor,"dressing_room, archive, museum/indoor, clean_room, locker_room"
2114,50736,indoor,"clean_room, dressing_room, archive, museum/indoor, locker_room"
2115,50760,indoor,"clean_room, museum/indoor, dressing_room, archive, nursing_home"
2116,50784,indoor,"clean_room, archive, office, hospital_room, chemistry_lab"
2117,50808,indoor,"clean_room, hospital_room, museum/indoor, science_museum, nursing_home"
2118,50832,indoor,"clean_room, archive, museum/indoor, nursing_home, office"
2119,50856,indoor,"clean_room, archive, museum/indoor, nursing_home, hospital_room"
2120,50880,indoor,"clean_room, archive, nursing_home, museum/indoor, hospital_room"
2121,50904,indoor,"clean_room, archive, nursing_home, hospital_room, museum/indoor"
2122,50928,indoor,"archive, clean_room, nursing_home, museum/indoor, dressing_room"
2123,50952,indoor,"clean_room, office, archive, nursing_home, hospital_room"
2124,50976,indoor,"clean_room, office, archive, nursing_home, dressing_room"
2125,51000,indoor,"clean_room, nursing_home, archive, hospital_room, office"
2126,51024,indoor,"clean_room, hospital_room, nursing_home, archive, office"
2127,51048,indoor,"clean_room, dressing_room, nursing_home, hospital_room, nursery"
2128,51072,indoor,"clean_room, nursing_home, dressing_room, nursery, hospital_room"
2129,51096,indoor,"archive, classroom, nursing_home, museum/indoor, clean_room"
2130,51120,indoor,"archive, museum/indoor, classroom, natural_history_museum, nursery"
2131,51144,indoor,"archive, nursing_home, museum/indoor, clean_room, classroom"
2132,51168,indoor,"archive, nursing_home, clean_room, museum/indoor, classroom"
2133,51192,indoor,"archive, nursing_home, clean_room, classroom, nursery"
2134,51216,indoor,"archive, classroom, nursing_home, clean_room, museum/indoor"
2135,51240,indoor,"clean_room, archive, chemistry_lab, hospital_room, nursery"
2136,51264,indoor,"clean_room, dressing_room, chemistry_lab, archive, hospital_room"
2137,51288,indoor,"clean_room, chemistry_lab, archive, dressing_room, biology_laboratory"
2138,51312,indoor,"clean_room, chemistry_lab, archive, dressing_room, biology_laboratory"
2139,51336,indoor,"clean_room, dressing_room, chemistry_lab, archive, locker_room"
2140,51360,indoor,"clean_room, archive, chemistry_lab, dressing_room, locker_room"
2141,51384,indoor,"archive, museum/indoor, nursing_home, classroom, lecture_room"
2142,51408,indoor,"archive, nursing_home, museum/indoor, classroom, clean_room"
2143,51432,indoor,"archive, classroom, nursing_home, lecture_room, museum/indoor"
2144,51456,indoor,"archive, classroom, nursing_home, lecture_room, nursery"
2145,51480,indoor,"archive, nursing_home, classroom, museum/indoor, lecture_room"
2146,51504,indoor,"archive, nursing_home, classroom, lecture_room, nursery"
2147,51528,indoor,"archive, nursing_home, museum/indoor, classroom, lecture_room"
2148,51552,indoor,"archive, classroom, nursing_home, nursery, dressing_room"
2149,51576,indoor,"archive, museum/indoor, nursing_home, classroom, lecture_room"
2150,51600,indoor,"archive, museum/indoor, classroom, nursing_home, office"
2151,51624,indoor,"archive, museum/indoor, classroom, nursing_home, clean_room"
2152,51648,indoor,"nursing_home, archive, classroom, lecture_room, office"
2153,51672,indoor,"clean_room, archive, office, dressing_room, hospital_room"
2154,51696,indoor,"clean_room, dressing_room, office, archive, hospital_room"
2155,51720,indoor,"clean_room, dressing_room, archive, office, hospital_room"
2156,51744,indoor,"clean_room, archive, dressing_room, office, hospital_room"
2157,51768,indoor,"clean_room, nursing_home, archive, hospital_room, office"
2158,51792,indoor,"clean_room, archive, dressing_room, hospital_room, chemistry_lab"
2159,51816,indoor,"nursing_home, clean_room, classroom, archive, office"
2160,51840,indoor,"clean_room, archive, nursing_home, dressing_room, classroom"
2161,51864,indoor,"clean_room, classroom, lecture_room, museum/indoor, archive"
2162,51888,indoor,"clean_room, classroom, lecture_room, nursery, museum/indoor"
2163,51912,indoor,"nursing_home, archive, classroom, clean_room, nursery"
2164,51936,indoor,"archive, classroom, nursing_home, nursery, clean_room"
2165,51960,indoor,"classroom, archive, clean_room, nursing_home, lecture_room"
2166,51984,indoor,"clean_room, archive, museum/indoor, office, nursery"
2167,52008,indoor,"clean_room, museum/indoor, archive, classroom, science_museum"
2168,52032,indoor,"classroom, restaurant, lecture_room, cafeteria, chemistry_lab"
2169,52056,indoor,"classroom, dressing_room, archive, lecture_room, chemistry_lab"
2170,52080,indoor,"bathroom, dressing_room, beauty_salon, shower, classroom"
2171,52104,indoor,"classroom, dining_room, restaurant, chemistry_lab, office"
2172,52128,indoor,"classroom, restaurant, dressing_room, dining_room, chemistry_lab"
2173,52152,indoor,"art_gallery, classroom, clean_room, dressing_room, museum/indoor"
2174,52176,indoor,"classroom, archive, art_gallery, museum/indoor, clean_room"
2175,52200,indoor,"classroom, art_gallery, art_studio, clean_room, archive"
2176,52224,indoor,"classroom, art_gallery, lecture_room, archive, art_studio"
2177,52248,indoor,"art_gallery, classroom, clean_room, archive, museum/indoor"
2178,52272,indoor,"classroom, art_gallery, archive, museum/indoor, clean_room"
2179,52296,indoor,"classroom, lecture_room, office, archive, conference_center"
2180,52320,indoor,"shower, bathroom, basement, jail_cell, locker_room"
2181,52344,indoor,"locker_room, clean_room, jail_cell, bathroom, basement"
2182,52368,indoor,"archive, clean_room, dressing_room, physics_laboratory, museum/indoor"
2183,52392,indoor,"clean_room, archive, chemistry_lab, dressing_room, physics_laboratory"
2184,52416,indoor,"clean_room, art_gallery, archive, museum/indoor, locker_room"
2185,52440,indoor,"clean_room, dressing_room, archive, hospital_room, locker_room"
2186,52464,indoor,"dressing_room, archive, hospital_room, clean_room, clothing_store"
2187,52488,indoor,"archive, clean_room, nursery, museum/indoor, hospital_room"
2188,52512,indoor,"archive, nursery, clean_room, museum/indoor, dressing_room"
2189,52536,indoor,"archive, museum/indoor, bow_window/indoor, bookstore, clean_room"
2190,52560,indoor,"archive, museum/indoor, bow_window/indoor, nursery, art_gallery"
2191,52584,indoor,"archive, museum/indoor, nursery, clean_room, clothing_store"
2192,52608,indoor,"archive, museum/indoor, bow_window/indoor, clean_room, nursery"
2193,52632,indoor,"archive, museum/indoor, nursery, clean_room, bow_window/indoor"
2194,52656,indoor,"archive, museum/indoor, clean_room, bow_window/indoor, pet_shop"
2195,52680,indoor,"archive, clean_room, museum/indoor, nursery, hospital_room"
2196,52704,indoor,"archive, museum/indoor, nursery, clean_room, bow_window/indoor"
2197,52728,indoor,"archive, museum/indoor, clean_room, nursery, alcove"
2198,52752,indoor,"clean_room, archive, museum/indoor, nursery, alcove"
2199,52776,indoor,"clean_room, museum/indoor, nursery, archive, dressing_room"
2200,52800,indoor,"archive, museum/indoor, clean_room, airport_terminal, shower"
2201,52824,indoor,"archive, clean_room, museum/indoor, bow_window/indoor, porch"
2202,52848,indoor,"archive, clean_room, museum/indoor, nursery, bookstore"
2203,52872,indoor,"archive, museum/indoor, clean_room, nursery, library/indoor"
2204,52896,indoor,"archive, museum/indoor, nursery, clean_room, bookstore"
2205,52920,indoor,"archive, clean_room, museum/indoor, nursery, bookstore"
2206,52944,indoor,"archive, clean_room, nursing_home, library/indoor, museum/indoor"
2207,52968,indoor,"archive, clean_room, library/indoor, nursing_home, museum/indoor"
2208,52992,indoor,"archive, clean_room, biology_laboratory, chemistry_lab, nursing_home"
2209,53016,indoor,"bow_window/indoor, shower, living_room, bathroom, waiting_room"
2210,53040,indoor,"bow_window/indoor, living_room, shower, bathroom, dining_room"
2211,53064,indoor,"bow_window/indoor, living_room, classroom, waiting_room, sauna"
2212,53088,indoor,"bow_window/indoor, waiting_room, lobby, living_room, office"
2213,53112,indoor,"classroom, lecture_room, office, bathroom, conference_room"
2214,53136,indoor,"classroom, bow_window/indoor, lecture_room, jail_cell, artists_loft"
2215,53160,indoor,"archive, library/indoor, clean_room, biology_laboratory, chemistry_lab"
