,frame_num,environment,places
0,0,indoor,"locker_room, basement, server_room, jail_cell, archive"
1,24,indoor,"booth/indoor, natural_history_museum, museum/indoor, elevator_lobby, elevator/door"
2,48,indoor,"elevator_lobby, booth/indoor, elevator/door, museum/indoor, natural_history_museum"
3,72,indoor,"elevator_lobby, elevator/door, museum/indoor, natural_history_museum, booth/indoor"
4,96,indoor,"museum/indoor, natural_history_museum, elevator_lobby, elevator/door, booth/indoor"
5,120,indoor,"museum/indoor, elevator_lobby, natural_history_museum, elevator/door, booth/indoor"
6,144,indoor,"museum/indoor, elevator_lobby, natural_history_museum, booth/indoor, elevator/door"
7,168,indoor,"elevator_lobby, museum/indoor, elevator/door, natural_history_museum, booth/indoor"
8,192,indoor,"museum/indoor, elevator_lobby, natural_history_museum, elevator/door, booth/indoor"
9,216,indoor,"booth/indoor, natural_history_museum, museum/indoor, elevator_lobby, elevator/door"
10,240,indoor,"booth/indoor, natural_history_museum, museum/indoor, elevator_lobby, elevator/door"
11,264,indoor,"basement, locker_room, clean_room, jail_cell, archive"
12,288,outdoor,"underwater/ocean_deep, aquarium, sky, hot_spring, discotheque"
13,312,indoor,"hospital_room, hospital, pharmacy, beauty_salon, reception"
14,336,indoor,"beauty_salon, hospital_room, reception, pharmacy, laundromat"
15,360,indoor,"beauty_salon, hospital_room, reception, pharmacy, laundromat"
16,384,indoor,"beauty_salon, hospital_room, reception, pharmacy, laundromat"
17,408,indoor,"hospital_room, beauty_salon, reception, laundromat, pharmacy"
18,432,indoor,"beauty_salon, hospital_room, reception, pharmacy, laundromat"
19,456,indoor,"hospital_room, beauty_salon, reception, pharmacy, laundromat"
20,480,indoor,"reception, hospital_room, beauty_salon, pharmacy, laundromat"
21,504,indoor,"hospital_room, beauty_salon, reception, pharmacy, laundromat"
22,528,indoor,"laundromat, hospital_room, beauty_salon, pharmacy, hospital"
23,552,indoor,"pharmacy, drugstore, hospital_room, hospital, beauty_salon"
24,576,indoor,"pharmacy, drugstore, clothing_store, gift_shop, hospital"
25,600,indoor,"pharmacy, drugstore, clothing_store, gift_shop, nursery"
26,624,indoor,"pharmacy, drugstore, clothing_store, gift_shop, hospital"
27,648,indoor,"pharmacy, clothing_store, drugstore, gift_shop, nursery"
28,672,indoor,"museum/indoor, pharmacy, cemetery, hospital_room, drugstore"
29,696,indoor,"hospital, hospital_room, natural_history_museum, pharmacy, museum/indoor"
30,720,indoor,"hospital, hospital_room, pharmacy, natural_history_museum, drugstore"
31,744,indoor,"hospital, hospital_room, natural_history_museum, pharmacy, museum/indoor"
32,768,indoor,"hospital, hospital_room, natural_history_museum, pharmacy, museum/indoor"
33,792,indoor,"hospital, hospital_room, natural_history_museum, pharmacy, drugstore"
34,816,indoor,"hospital, hospital_room, natural_history_museum, pharmacy, drugstore"
35,840,indoor,"cemetery, hospital, pharmacy, natural_history_museum, museum/indoor"
36,864,indoor,"pharmacy, drugstore, cemetery, hospital, beauty_salon"
37,888,indoor,"pharmacy, drugstore, hospital, cemetery, beauty_salon"
38,912,indoor,"pharmacy, drugstore, hospital, beauty_salon, cemetery"
39,936,indoor,"pharmacy, drugstore, hospital, hospital_room, cemetery"
40,960,indoor,"pharmacy, drugstore, hospital, hospital_room, beauty_salon"
41,984,indoor,"pharmacy, drugstore, hospital, cemetery, hospital_room"
42,1008,indoor,"pharmacy, drugstore, hospital, cemetery, hospital_room"
43,1032,indoor,"pharmacy, drugstore, hospital, cemetery, hospital_room"
44,1056,indoor,"pharmacy, drugstore, hospital, cemetery, hospital_room"
45,1080,indoor,"pharmacy, drugstore, beauty_salon, cemetery, hospital"
46,1104,indoor,"pharmacy, drugstore, museum/indoor, beauty_salon, natural_history_museum"
47,1128,indoor,"drugstore, pharmacy, museum/indoor, hospital, hospital_room"
48,1152,indoor,"drugstore, pharmacy, hospital, museum/indoor, hospital_room"
49,1176,indoor,"drugstore, pharmacy, hospital, museum/indoor, hospital_room"
50,1200,indoor,"drugstore, pharmacy, hospital, museum/indoor, hospital_room"
51,1224,indoor,"drugstore, pharmacy, hospital, museum/indoor, hospital_room"
52,1248,indoor,"drugstore, pharmacy, hospital, museum/indoor, hospital_room"
53,1272,indoor,"drugstore, pharmacy, hospital, museum/indoor, hospital_room"
54,1296,indoor,"drugstore, pharmacy, hospital, museum/indoor, hospital_room"
55,1320,indoor,"pharmacy, drugstore, hospital, hospital_room, beauty_salon"
56,1344,indoor,"pharmacy, hospital, drugstore, hospital_room, ice_shelf"
57,1368,indoor,"pharmacy, hospital, drugstore, hospital_room, clothing_store"
58,1392,indoor,"pharmacy, hospital, drugstore, hospital_room, clothing_store"
59,1416,indoor,"pharmacy, drugstore, hospital, hospital_room, clothing_store"
60,1440,indoor,"pharmacy, drugstore, hospital, reception, hospital_room"
61,1464,indoor,"pharmacy, drugstore, museum/indoor, booth/indoor, hospital"
62,1488,indoor,"drugstore, museum/indoor, pharmacy, booth/indoor, natural_history_museum"
63,1512,indoor,"drugstore, pharmacy, booth/indoor, museum/indoor, hospital"
64,1536,indoor,"drugstore, pharmacy, booth/indoor, museum/indoor, natural_history_museum"
65,1560,indoor,"drugstore, pharmacy, booth/indoor, museum/indoor, natural_history_museum"
66,1584,indoor,"drugstore, pharmacy, booth/indoor, museum/indoor, natural_history_museum"
67,1608,indoor,"drugstore, pharmacy, booth/indoor, museum/indoor, hospital"
68,1632,indoor,"drugstore, pharmacy, booth/indoor, museum/indoor, natural_history_museum"
69,1656,indoor,"drugstore, pharmacy, museum/indoor, booth/indoor, natural_history_museum"
70,1680,indoor,"drugstore, pharmacy, booth/indoor, museum/indoor, natural_history_museum"
71,1704,indoor,"drugstore, pharmacy, booth/indoor, museum/indoor, natural_history_museum"
72,1728,indoor,"drugstore, museum/indoor, booth/indoor, pharmacy, natural_history_museum"
73,1752,indoor,"drugstore, pharmacy, booth/indoor, museum/indoor, natural_history_museum"
74,1776,indoor,"drugstore, pharmacy, booth/indoor, museum/indoor, natural_history_museum"
75,1800,indoor,"drugstore, pharmacy, booth/indoor, museum/indoor, natural_history_museum"
76,1824,indoor,"drugstore, booth/indoor, pharmacy, museum/indoor, natural_history_museum"
77,1848,indoor,"museum/indoor, pharmacy, natural_history_museum, booth/indoor, science_museum"
78,1872,indoor,"drugstore, booth/indoor, pharmacy, hospital, museum/indoor"
79,1896,indoor,"drugstore, booth/indoor, pharmacy, conference_center, hospital"
80,1920,indoor,"drugstore, booth/indoor, pharmacy, hospital, conference_center"
81,1944,indoor,"drugstore, booth/indoor, pharmacy, museum/indoor, conference_center"
82,1968,indoor,"drugstore, booth/indoor, pharmacy, museum/indoor, conference_center"
83,1992,indoor,"drugstore, booth/indoor, pharmacy, conference_center, museum/indoor"
84,2016,indoor,"drugstore, booth/indoor, pharmacy, hospital, museum/indoor"
85,2040,indoor,"drugstore, booth/indoor, pharmacy, hospital, conference_center"
86,2064,indoor,"drugstore, booth/indoor, pharmacy, hospital, conference_center"
87,2088,indoor,"drugstore, booth/indoor, pharmacy, conference_center, hospital"
88,2112,indoor,"drugstore, booth/indoor, pharmacy, museum/indoor, conference_center"
89,2136,indoor,"drugstore, booth/indoor, pharmacy, hospital, museum/indoor"
90,2160,indoor,"drugstore, booth/indoor, pharmacy, hospital, conference_center"
91,2184,indoor,"drugstore, booth/indoor, pharmacy, hospital, conference_center"
92,2208,indoor,"drugstore, booth/indoor, pharmacy, conference_center, hospital"
93,2232,indoor,"drugstore, booth/indoor, pharmacy, conference_center, hospital"
94,2256,indoor,"booth/indoor, natural_history_museum, drugstore, museum/indoor, pharmacy"
95,2280,outdoor,"lake/natural, hot_spring, basement, underwater/ocean_deep, pond"
96,2304,outdoor,"synagogue/outdoor, mosque/outdoor, arch, building_facade, church/outdoor"
97,2328,indoor,"drugstore, mosque/outdoor, pharmacy, archive, bookstore"
98,2352,indoor,"classroom, archive, chemistry_lab, coffee_shop, computer_room"
99,2376,indoor,"clean_room, archive, phone_booth, ticket_booth, airport_terminal"
100,2400,outdoor,"archive, office_building, courthouse, building_facade, fire_station"
101,2424,indoor,"parking_garage/indoor, clean_room, airport_terminal, lobby, waiting_room"
102,2448,indoor,"clean_room, chemistry_lab, airport_terminal, biology_laboratory, locker_room"
103,2472,indoor,"parking_garage/indoor, locker_room, airport_terminal, bank_vault, elevator/door"
104,2496,indoor,"parking_garage/indoor, airport_terminal, office_cubicles, corridor, basement"
105,2520,indoor,"parking_garage/indoor, parking_lot, airport_terminal, office_cubicles, basement"
106,2544,indoor,"server_room, storage_room, basement, clean_room, locker_room"
107,2568,indoor,"server_room, locker_room, archive, clean_room, office_cubicles"
108,2592,indoor,"office_cubicles, locker_room, archive, office, server_room"
109,2616,indoor,"locker_room, office_cubicles, server_room, clean_room, office"
110,2640,indoor,"classroom, lecture_room, library/indoor, waiting_room, kindergarden_classroom"
111,2664,indoor,"classroom, library/indoor, lecture_room, clean_room, waiting_room"
112,2688,indoor,"library/indoor, waiting_room, living_room, recreation_room, classroom"
113,2712,indoor,"classroom, cafeteria, library/indoor, lecture_room, waiting_room"
114,2736,indoor,"archive, clean_room, library/indoor, classroom, dressing_room"
115,2760,indoor,"clean_room, library/indoor, chemistry_lab, archive, classroom"
116,2784,indoor,"clean_room, dressing_room, archive, classroom, chemistry_lab"
117,2808,indoor,"clean_room, chemistry_lab, swimming_pool/indoor, classroom, dressing_room"
118,2832,indoor,"swimming_pool/indoor, staircase, entrance_hall, corridor, museum/indoor"
119,2856,indoor,"clean_room, chemistry_lab, art_gallery, physics_laboratory, corridor"
120,2880,indoor,"gymnasium/indoor, classroom, clean_room, chemistry_lab, basement"
121,2904,indoor,"elevator/door, bow_window/indoor, elevator_lobby, doorway/outdoor, corridor"
122,2928,indoor,"elevator/door, bow_window/indoor, corridor, elevator_lobby, alcove"
123,2952,indoor,"elevator/door, corridor, dressing_room, bow_window/indoor, recreation_room"
124,2976,indoor,"elevator/door, reception, classroom, office, lecture_room"
125,3000,indoor,"classroom, lecture_room, clean_room, elevator/door, recreation_room"
126,3024,indoor,"classroom, lecture_room, dressing_room, clean_room, office"
127,3048,indoor,"classroom, dressing_room, clean_room, lecture_room, office"
128,3072,indoor,"classroom, waiting_room, lecture_room, ballroom, dressing_room"
129,3096,indoor,"classroom, lecture_room, dressing_room, office, computer_room"
130,3120,indoor,"waiting_room, dressing_room, classroom, office, lecture_room"
131,3144,indoor,"dressing_room, playroom, shower, waiting_room, kindergarden_classroom"
132,3168,indoor,"shower, water_tower, chemistry_lab, bathroom, biology_laboratory"
133,3192,indoor,"locker_room, dressing_room, waiting_room, clean_room, office_cubicles"
134,3216,indoor,"dressing_room, discotheque, beauty_salon, basement, locker_room"
135,3240,indoor,"library/indoor, conference_room, dining_room, dining_hall, cafeteria"
136,3264,indoor,"library/indoor, dining_room, jewelry_shop, restaurant, recreation_room"
137,3288,indoor,"library/indoor, chemistry_lab, clean_room, archive, biology_laboratory"
138,3312,indoor,"chemistry_lab, library/indoor, biology_laboratory, archive, clean_room"
139,3336,indoor,"library/indoor, chemistry_lab, biology_laboratory, coffee_shop, physics_laboratory"
140,3360,indoor,"library/indoor, chemistry_lab, biology_laboratory, archive, physics_laboratory"
141,3384,indoor,"clean_room, bow_window/indoor, dressing_room, locker_room, corridor"
142,3408,indoor,"dressing_room, clean_room, archive, elevator/door, elevator_lobby"
143,3432,indoor,"bow_window/indoor, living_room, waiting_room, hospital_room, hotel_room"
144,3456,indoor,"bow_window/indoor, living_room, waiting_room, hospital_room, hotel_room"
145,3480,indoor,"clean_room, bow_window/indoor, dressing_room, entrance_hall, archive"
146,3504,indoor,"clean_room, dressing_room, bow_window/indoor, waiting_room, office"
147,3528,indoor,"clean_room, dressing_room, office, beauty_salon, waiting_room"
148,3552,indoor,"clean_room, office, beauty_salon, dressing_room, archive"
149,3576,indoor,"bow_window/indoor, living_room, waiting_room, artists_loft, library/indoor"
150,3600,indoor,"bow_window/indoor, living_room, library/indoor, dining_room, artists_loft"
151,3624,indoor,"bow_window/indoor, living_room, library/indoor, dining_room, artists_loft"
152,3648,indoor,"bow_window/indoor, living_room, library/indoor, lobby, waiting_room"
153,3672,indoor,"bow_window/indoor, living_room, dining_room, library/indoor, office"
154,3696,indoor,"bow_window/indoor, office, dining_room, living_room, conference_room"
155,3720,indoor,"bow_window/indoor, living_room, dining_room, waiting_room, lobby"
156,3744,indoor,"bow_window/indoor, living_room, office, library/indoor, home_office"
157,3768,indoor,"bow_window/indoor, living_room, home_office, office, library/indoor"
158,3792,indoor,"bow_window/indoor, living_room, dining_room, library/indoor, entrance_hall"
159,3816,indoor,"bow_window/indoor, library/indoor, living_room, archive, home_office"
160,3840,indoor,"bow_window/indoor, living_room, library/indoor, home_office, office"
161,3864,indoor,"bow_window/indoor, living_room, library/indoor, home_office, waiting_room"
162,3888,indoor,"bow_window/indoor, living_room, library/indoor, waiting_room, home_office"
163,3912,indoor,"bow_window/indoor, living_room, nursery, waiting_room, bedroom"
164,3936,indoor,"bow_window/indoor, living_room, nursery, waiting_room, bedroom"
165,3960,indoor,"bow_window/indoor, living_room, waiting_room, nursery, hospital_room"
166,3984,indoor,"bow_window/indoor, waiting_room, living_room, nursery, hospital_room"
167,4008,indoor,"bow_window/indoor, waiting_room, living_room, nursery, hospital_room"
168,4032,indoor,"bow_window/indoor, living_room, nursery, waiting_room, bedroom"
169,4056,indoor,"bow_window/indoor, living_room, waiting_room, nursery, bedroom"
170,4080,indoor,"bow_window/indoor, living_room, nursery, waiting_room, childs_room"
171,4104,indoor,"bathroom, jacuzzi/indoor, shower, swimming_pool/indoor, beauty_salon"
172,4128,indoor,"bathroom, shower, jacuzzi/indoor, beauty_salon, swimming_pool/indoor"
173,4152,indoor,"bathroom, shower, jacuzzi/indoor, swimming_pool/indoor, locker_room"
174,4176,indoor,"bow_window/indoor, nursery, waiting_room, living_room, hotel_room"
175,4200,indoor,"nursery, bow_window/indoor, living_room, hotel_room, hospital_room"
176,4224,indoor,"bow_window/indoor, nursery, living_room, hotel_room, waiting_room"
177,4248,indoor,"nursery, bow_window/indoor, hospital_room, hotel_room, living_room"
178,4272,indoor,"bow_window/indoor, nursery, living_room, waiting_room, bedroom"
179,4296,indoor,"bow_window/indoor, nursery, living_room, waiting_room, bedroom"
180,4320,indoor,"bow_window/indoor, nursery, living_room, playroom, childs_room"
181,4344,indoor,"waiting_room, living_room, office, bow_window/indoor, hospital_room"
182,4368,indoor,"office, home_office, waiting_room, clean_room, hospital_room"
183,4392,indoor,"office, hospital_room, bow_window/indoor, waiting_room, home_office"
184,4416,indoor,"office, hospital_room, bow_window/indoor, waiting_room, nursery"
185,4440,indoor,"clean_room, office, hospital_room, computer_room, nursery"
186,4464,indoor,"hospital_room, clean_room, nursery, operating_room, office"
187,4488,indoor,"hospital_room, office, nursery, bow_window/indoor, clean_room"
188,4512,indoor,"hospital_room, locker_room, clean_room, nursery, sauna"
189,4536,indoor,"hospital_room, clean_room, locker_room, office, bowling_alley"
190,4560,indoor,"hospital_room, office, clean_room, locker_room, music_studio"
191,4584,indoor,"bathroom, shower, jacuzzi/indoor, elevator/door, locker_room"
192,4608,indoor,"bathroom, shower, jacuzzi/indoor, beauty_salon, airplane_cabin"
193,4632,indoor,"bathroom, shower, jacuzzi/indoor, airplane_cabin, beauty_salon"
194,4656,indoor,"bathroom, shower, jacuzzi/indoor, airplane_cabin, swimming_pool/indoor"
195,4680,indoor,"hospital_room, nursery, office, clean_room, bowling_alley"
196,4704,indoor,"office, home_office, archive, computer_room, office_cubicles"
197,4728,indoor,"office, home_office, archive, office_cubicles, conference_room"
198,4752,indoor,"office, conference_room, conference_center, lecture_room, waiting_room"
199,4776,indoor,"office, conference_room, waiting_room, conference_center, lecture_room"
200,4800,indoor,"office, waiting_room, conference_room, computer_room, office_cubicles"
201,4824,indoor,"clean_room, bathroom, locker_room, hospital_room, operating_room"
202,4848,indoor,"clean_room, bathroom, dressing_room, locker_room, shower"
203,4872,indoor,"office, computer_room, waiting_room, office_cubicles, hospital_room"
204,4896,indoor,"office, computer_room, conference_room, office_cubicles, waiting_room"
205,4920,indoor,"office, waiting_room, office_cubicles, computer_room, bow_window/indoor"
206,4944,indoor,"office, waiting_room, living_room, bow_window/indoor, computer_room"
207,4968,indoor,"office, locker_room, jail_cell, music_studio, dressing_room"
208,4992,indoor,"music_studio, stage/indoor, clean_room, office, conference_center"
209,5016,indoor,"locker_room, clean_room, office, nursery, dressing_room"
210,5040,indoor,"bow_window/indoor, living_room, dining_room, lobby, entrance_hall"
211,5064,indoor,"archive, library/indoor, bow_window/indoor, office, nursery"
212,5088,indoor,"office, archive, bow_window/indoor, library/indoor, home_office"
213,5112,indoor,"office, bow_window/indoor, clean_room, archive, computer_room"
214,5136,indoor,"archive, library/indoor, office, dressing_room, bow_window/indoor"
215,5160,indoor,"dressing_room, library/indoor, archive, living_room, office"
216,5184,indoor,"dressing_room, clean_room, bow_window/indoor, nursery, archive"
217,5208,indoor,"clean_room, dressing_room, playroom, archive, bow_window/indoor"
218,5232,indoor,"archive, library/indoor, bow_window/indoor, office, dressing_room"
219,5256,indoor,"library/indoor, archive, office, bow_window/indoor, dining_room"
220,5280,indoor,"archive, library/indoor, bow_window/indoor, office, dressing_room"
221,5304,indoor,"archive, office, library/indoor, home_office, bow_window/indoor"
222,5328,indoor,"archive, library/indoor, office, clean_room, bow_window/indoor"
223,5352,indoor,"archive, library/indoor, office, bow_window/indoor, home_office"
224,5376,indoor,"archive, library/indoor, office, home_office, bow_window/indoor"
225,5400,indoor,"archive, library/indoor, office, home_office, dressing_room"
226,5424,indoor,"archive, office, library/indoor, clean_room, home_office"
227,5448,indoor,"archive, office, home_office, clean_room, dressing_room"
228,5472,indoor,"archive, office, bow_window/indoor, library/indoor, home_office"
229,5496,indoor,"archive, office, clean_room, library/indoor, dressing_room"
230,5520,indoor,"bow_window/indoor, clean_room, archive, dressing_room, nursery"
231,5544,indoor,"archive, locker_room, library/indoor, office, classroom"
232,5568,indoor,"archive, locker_room, library/indoor, pharmacy, kindergarden_classroom"
233,5592,indoor,"locker_room, archive, clean_room, office_cubicles, hospital_room"
234,5616,indoor,"archive, locker_room, laundromat, clean_room, pharmacy"
235,5640,indoor,"locker_room, laundromat, clean_room, office_cubicles, archive"
236,5664,indoor,"laundromat, clean_room, locker_room, dressing_room, office_cubicles"
237,5688,indoor,"locker_room, laundromat, clean_room, archive, dressing_room"
238,5712,indoor,"laundromat, locker_room, clean_room, dressing_room, office_cubicles"
239,5736,indoor,"locker_room, archive, clean_room, dressing_room, chemistry_lab"
240,5760,indoor,"archive, clean_room, locker_room, dressing_room, chemistry_lab"
241,5784,indoor,"locker_room, clean_room, archive, basement, nursery"
242,5808,indoor,"clean_room, archive, doorway/outdoor, physics_laboratory, playroom"
243,5832,indoor,"clean_room, archive, office, physics_laboratory, bow_window/indoor"
244,5856,indoor,"clean_room, physics_laboratory, archive, office, bow_window/indoor"
245,5880,indoor,"clean_room, archive, bow_window/indoor, physics_laboratory, doorway/outdoor"
246,5904,indoor,"clean_room, bow_window/indoor, playroom, archive, doorway/outdoor"
247,5928,indoor,"clean_room, bow_window/indoor, archive, doorway/outdoor, physics_laboratory"
248,5952,indoor,"clean_room, bow_window/indoor, physics_laboratory, chemistry_lab, office"
249,5976,indoor,"office, bow_window/indoor, clean_room, nursing_home, playroom"
250,6000,indoor,"bow_window/indoor, clean_room, office, playroom, dressing_room"
251,6024,indoor,"bow_window/indoor, clean_room, office, archive, dressing_room"
252,6048,indoor,"bow_window/indoor, archive, clean_room, library/indoor, office"
253,6072,indoor,"clean_room, bow_window/indoor, archive, office, playroom"
254,6096,indoor,"clean_room, archive, bow_window/indoor, office, physics_laboratory"
255,6120,indoor,"clean_room, archive, bow_window/indoor, playroom, office"
256,6144,indoor,"clean_room, archive, bow_window/indoor, elevator/door, office"
257,6168,indoor,"clean_room, bow_window/indoor, archive, physics_laboratory, office"
258,6192,indoor,"clean_room, archive, bow_window/indoor, dressing_room, physics_laboratory"
259,6216,indoor,"clean_room, bow_window/indoor, archive, dressing_room, office"
260,6240,indoor,"clean_room, archive, dressing_room, bow_window/indoor, office"
261,6264,indoor,"playroom, clean_room, bow_window/indoor, archive, office"
262,6288,indoor,"clean_room, dressing_room, bow_window/indoor, office, archive"
263,6312,indoor,"bow_window/indoor, office, dressing_room, clean_room, elevator/door"
264,6336,indoor,"clean_room, elevator/door, bow_window/indoor, dressing_room, office"
265,6360,indoor,"bow_window/indoor, playroom, clean_room, elevator/door, doorway/outdoor"
266,6384,indoor,"bow_window/indoor, playroom, nursery, clean_room, living_room"
267,6408,indoor,"bow_window/indoor, dining_room, living_room, playroom, office"
268,6432,indoor,"bow_window/indoor, living_room, office, dining_room, home_office"
269,6456,indoor,"bow_window/indoor, living_room, playroom, nursery, hospital_room"
270,6480,indoor,"playroom, clean_room, office, science_museum, waiting_room"
271,6504,indoor,"clean_room, shower, waiting_room, lobby, chemistry_lab"
272,6528,indoor,"waiting_room, clean_room, classroom, kindergarden_classroom, office_cubicles"
273,6552,indoor,"waiting_room, classroom, clean_room, office_cubicles, computer_room"
274,6576,indoor,"classroom, waiting_room, lecture_room, conference_center, gymnasium/indoor"
275,6600,indoor,"classroom, archive, chemistry_lab, office, clean_room"
276,6624,indoor,"clean_room, chemistry_lab, office, classroom, biology_laboratory"
277,6648,indoor,"archive, classroom, clean_room, kindergarden_classroom, chemistry_lab"
278,6672,indoor,"classroom, kindergarden_classroom, lecture_room, computer_room, waiting_room"
279,6696,indoor,"classroom, clean_room, kindergarden_classroom, chemistry_lab, lecture_room"
280,6720,indoor,"classroom, clean_room, kindergarden_classroom, archive, office"
281,6744,indoor,"classroom, kindergarden_classroom, computer_room, office, clean_room"
282,6768,indoor,"classroom, clean_room, archive, kindergarden_classroom, office"
283,6792,indoor,"classroom, clean_room, lecture_room, computer_room, kindergarden_classroom"
284,6816,indoor,"clean_room, classroom, kindergarden_classroom, lecture_room, waiting_room"
285,6840,indoor,"discotheque, clean_room, beauty_salon, martial_arts_gym, dressing_room"
286,6864,indoor,"discotheque, dressing_room, clean_room, classroom, chemistry_lab"
287,6888,indoor,"discotheque, clean_room, dressing_room, biology_laboratory, chemistry_lab"
288,6912,indoor,"discotheque, clean_room, chemistry_lab, dressing_room, biology_laboratory"
289,6936,indoor,"clean_room, discotheque, dressing_room, biology_laboratory, chemistry_lab"
290,6960,indoor,"discotheque, clean_room, dressing_room, chemistry_lab, operating_room"
291,6984,indoor,"clean_room, discotheque, music_studio, chemistry_lab, biology_laboratory"
292,7008,indoor,"nursery, discotheque, clean_room, classroom, science_museum"
293,7032,indoor,"discotheque, classroom, kindergarden_classroom, nursery, conference_center"
294,7056,indoor,"conference_center, discotheque, office, classroom, nursery"
295,7080,indoor,"discotheque, clean_room, nursery, dressing_room, airplane_cabin"
296,7104,indoor,"nursery, clean_room, discotheque, hospital_room, dressing_room"
297,7128,indoor,"clean_room, discotheque, conference_center, classroom, chemistry_lab"
298,7152,indoor,"clean_room, discotheque, music_studio, locker_room, hospital_room"
299,7176,indoor,"clean_room, discotheque, hospital_room, music_studio, nursery"
300,7200,indoor,"clean_room, corridor, office, office_cubicles, locker_room"
301,7224,indoor,"conference_room, dining_room, clean_room, office, corridor"
302,7248,indoor,"office, conference_room, clean_room, computer_room, living_room"
303,7272,indoor,"clean_room, office, conference_room, operating_room, computer_room"
304,7296,indoor,"clean_room, office, computer_room, conference_room, office_cubicles"
305,7320,indoor,"clean_room, office, computer_room, archive, conference_room"
306,7344,indoor,"clean_room, office, dressing_room, locker_room, archive"
307,7368,indoor,"clean_room, classroom, operating_room, office, chemistry_lab"
308,7392,indoor,"archive, clean_room, classroom, basement, attic"
309,7416,indoor,"archive, clean_room, classroom, library/indoor, office"
310,7440,indoor,"clean_room, archive, classroom, operating_room, dressing_room"
311,7464,indoor,"clean_room, archive, locker_room, dressing_room, operating_room"
