,frame_num,environment,places
1526,36624,outdoor,"wind_farm, lighthouse, ocean, sky, oilrig"
1527,36648,outdoor,"oilrig, lighthouse, ocean, sky, ice_shelf"
1528,36672,outdoor,"oilrig, lighthouse, ocean, ice_shelf, beach"
1529,36696,outdoor,"oilrig, lighthouse, ocean, sky, wind_farm"
1530,36720,outdoor,"oilrig, lighthouse, ocean, wind_farm, sky"
1531,36744,outdoor,"oilrig, lighthouse, ocean, sky, wind_farm"
1532,36768,indoor,"clean_room, airplane_cabin, airport_terminal, natural_history_museum, operating_room"
1533,36792,indoor,"airplane_cabin, airport_terminal, clean_room, discotheque, natural_history_museum"
1534,36816,indoor,"airplane_cabin, clean_room, discotheque, operating_room, airport_terminal"
1535,36840,indoor,"discotheque, airplane_cabin, clean_room, bowling_alley, airport_terminal"
1536,36864,indoor,"clean_room, operating_room, airplane_cabin, airport_terminal, hospital_room"
1537,36888,indoor,"airplane_cabin, clean_room, operating_room, discotheque, airport_terminal"
1538,36912,indoor,"airplane_cabin, discotheque, ballroom, banquet_hall, clean_room"
1539,36936,indoor,"discotheque, airplane_cabin, ballroom, airport_terminal, banquet_hall"
1540,36960,indoor,"clean_room, airplane_cabin, airport_terminal, banquet_hall, ballroom"
1541,36984,outdoor,"ocean, oilrig, coast, harbor, beach"
1542,37008,outdoor,"oilrig, ocean, harbor, ice_shelf, boat_deck"
1543,37032,outdoor,"ocean, oilrig, harbor, coast, boat_deck"
1544,37056,indoor,"clean_room, operating_room, shower, hospital_room, elevator/door"
1545,37080,indoor,"clean_room, operating_room, hospital_room, shower, elevator/door"
1546,37104,indoor,"clean_room, operating_room, shower, hospital_room, elevator/door"
1547,37128,indoor,"clean_room, elevator/door, shower, operating_room, hospital_room"
1548,37152,indoor,"clean_room, operating_room, shower, hospital_room, elevator/door"
1549,37176,indoor,"clean_room, operating_room, shower, elevator/door, hospital_room"
1550,37200,outdoor,"oilrig, ocean, harbor, boat_deck, coast"
1551,37224,outdoor,"oilrig, harbor, ocean, boat_deck, coast"
1552,37248,outdoor,"oilrig, harbor, ocean, boat_deck, ice_shelf"
1553,37272,outdoor,"oilrig, ocean, harbor, boat_deck, ice_shelf"
1554,37296,outdoor,"oilrig, ocean, harbor, boat_deck, ice_shelf"
1555,37320,indoor,"clean_room, operating_room, shower, elevator/door, hospital_room"
1556,37344,indoor,"clean_room, operating_room, shower, hospital_room, elevator/door"
1557,37368,indoor,"clean_room, operating_room, shower, hospital_room, elevator/door"
1558,37392,outdoor,"oilrig, boat_deck, ocean, harbor, ice_shelf"
1559,37416,outdoor,"oilrig, ocean, boat_deck, harbor, ice_shelf"
1560,37440,indoor,"clean_room, operating_room, hospital_room, shower, chemistry_lab"
1561,37464,indoor,"clean_room, operating_room, hospital_room, shower, beauty_salon"
1562,37488,indoor,"clean_room, hospital_room, operating_room, beauty_salon, veterinarians_office"
1563,37512,indoor,"clean_room, operating_room, hospital_room, shower, beauty_salon"
1564,37536,indoor,"clean_room, operating_room, hospital_room, shower, beauty_salon"
1565,37560,outdoor,"shower, greenhouse/outdoor, utility_room, boat_deck, barndoor"
1566,37584,indoor,"shower, utility_room, boat_deck, closet, wind_farm"
1567,37608,outdoor,"shower, bow_window/indoor, boat_deck, greenhouse/outdoor, wind_farm"
1568,37632,outdoor,"bridge, wind_farm, rope_bridge, viaduct, windmill"
1569,37656,outdoor,"bridge, rope_bridge, wind_farm, windmill, viaduct"
1570,37680,outdoor,"rope_bridge, bridge, sky, boat_deck, amusement_park"
1571,37704,outdoor,"bridge, rope_bridge, boat_deck, sky, viaduct"
1572,37728,outdoor,"rope_bridge, bridge, wind_farm, boat_deck, playground"
1573,37752,outdoor,"rope_bridge, wind_farm, boat_deck, bridge, ice_shelf"
1574,37776,indoor,"biology_laboratory, chemistry_lab, aquarium, clean_room, science_museum"
1575,37800,indoor,"clean_room, car_interior, science_museum, engine_room, operating_room"
1576,37824,indoor,"clean_room, engine_room, bank_vault, biology_laboratory, chemistry_lab"
1577,37848,indoor,"clean_room, science_museum, biology_laboratory, chemistry_lab, aquarium"
1578,37872,indoor,"discotheque, swimming_pool/indoor, aquarium, clean_room, shower"
1579,37896,indoor,"clean_room, hospital_room, operating_room, chemistry_lab, beauty_salon"
1580,37920,indoor,"clean_room, nursery, dressing_room, chemistry_lab, hospital_room"
1581,37944,indoor,"clean_room, biology_laboratory, chemistry_lab, operating_room, hospital_room"
1582,37968,indoor,"clean_room, biology_laboratory, chemistry_lab, engine_room, restaurant_kitchen"
1583,37992,indoor,"clean_room, biology_laboratory, chemistry_lab, hospital_room, operating_room"
1584,38016,indoor,"clean_room, laundromat, chemistry_lab, biology_laboratory, hospital_room"
1585,38040,outdoor,"oilrig, lighthouse, ocean, harbor, boat_deck"
1586,38064,outdoor,"oilrig, ocean, harbor, lighthouse, boat_deck"
1587,38088,outdoor,"oilrig, ocean, boat_deck, harbor, lighthouse"
1588,38112,outdoor,"oilrig, ocean, harbor, boat_deck, lighthouse"
1589,38136,indoor,"swimming_pool/indoor, chemistry_lab, airport_terminal, clean_room, biology_laboratory"
1590,38160,indoor,"clean_room, chemistry_lab, airport_terminal, swimming_pool/indoor, biology_laboratory"
1591,38184,outdoor,"bridge, rope_bridge, boat_deck, wind_farm, viaduct"
1592,38208,outdoor,"rope_bridge, bridge, wind_farm, viaduct, boat_deck"
1593,38232,outdoor,"bridge, rope_bridge, viaduct, boat_deck, wind_farm"
1594,38256,outdoor,"oilrig, harbor, boat_deck, ocean, coast"
1595,38280,outdoor,"oilrig, boat_deck, harbor, ocean, coast"
1596,38304,outdoor,"oilrig, harbor, boat_deck, ocean, lighthouse"
1597,38328,outdoor,"oilrig, boat_deck, harbor, ocean, ice_floe"
1598,38352,indoor,"laundromat, clean_room, hospital_room, greenhouse/outdoor, car_interior"
1599,38376,indoor,"clean_room, shower, hospital_room, greenhouse/outdoor, bathroom"
1600,38400,indoor,"clean_room, operating_room, laundromat, hospital_room, boat_deck"
1601,38424,indoor,"clean_room, laundromat, operating_room, assembly_line, hospital_room"
1602,38448,indoor,"clean_room, operating_room, hospital_room, atrium/public, laundromat"
1603,38472,indoor,"clean_room, laundromat, operating_room, hospital_room, staircase"
1604,38496,indoor,"clean_room, chemistry_lab, operating_room, shower, biology_laboratory"
1605,38520,indoor,"clean_room, operating_room, chemistry_lab, biology_laboratory, hospital_room"
1606,38544,indoor,"clean_room, chemistry_lab, music_studio, dressing_room, physics_laboratory"
1607,38568,indoor,"hangar/indoor, auto_factory, clean_room, assembly_line, airport_terminal"
1608,38592,indoor,"hangar/indoor, clean_room, auto_factory, assembly_line, airport_terminal"
1609,38616,indoor,"clean_room, hangar/indoor, auto_factory, assembly_line, operating_room"
1610,38640,indoor,"hangar/indoor, clean_room, auto_factory, assembly_line, operating_room"
1611,38664,indoor,"airplane_cabin, clean_room, laundromat, locker_room, elevator/door"
1612,38688,indoor,"airplane_cabin, clean_room, laundromat, bathroom, locker_room"
1613,38712,indoor,"airplane_cabin, car_interior, bathroom, laundromat, locker_room"
1614,38736,indoor,"airplane_cabin, laundromat, car_interior, auto_factory, gas_station"
1615,38760,indoor,"airplane_cabin, bowling_alley, locker_room, laundromat, car_interior"
1616,38784,indoor,"car_interior, clean_room, airplane_cabin, auto_factory, hospital_room"
1617,38808,indoor,"laundromat, clean_room, hospital_room, car_interior, airplane_cabin"
1618,38832,indoor,"car_interior, airplane_cabin, hospital_room, clean_room, laundromat"
1619,38856,indoor,"laundromat, clean_room, auto_factory, chemistry_lab, airplane_cabin"
1620,38880,indoor,"clean_room, laundromat, hospital_room, swimming_pool/indoor, car_interior"
1621,38904,indoor,"clean_room, hospital_room, laundromat, locker_room, car_interior"
1622,38928,indoor,"clean_room, airplane_cabin, auto_factory, car_interior, boat_deck"
1623,38952,indoor,"clean_room, airplane_cabin, hospital_room, car_interior, gymnasium/indoor"
1624,38976,indoor,"clean_room, elevator/door, ballroom, entrance_hall, dressing_room"
1625,39000,indoor,"clean_room, ballroom, elevator/door, entrance_hall, lobby"
1626,39024,indoor,"clean_room, entrance_hall, elevator/door, escalator/indoor, atrium/public"
1627,39048,indoor,"clean_room, airplane_cabin, hospital_room, operating_room, auto_factory"
1628,39072,indoor,"clean_room, airplane_cabin, auto_factory, hospital_room, car_interior"
1629,39096,indoor,"clean_room, airplane_cabin, car_interior, auto_factory, boat_deck"
1630,39120,indoor,"clean_room, airplane_cabin, hospital_room, operating_room, boat_deck"
1631,39144,indoor,"clean_room, operating_room, hospital_room, shower, chemistry_lab"
1632,39168,indoor,"clean_room, shower, operating_room, chemistry_lab, bathroom"
1633,39192,indoor,"clean_room, chemistry_lab, operating_room, utility_room, laundromat"
1634,39216,indoor,"clean_room, laundromat, subway_station/platform, locker_room, bowling_alley"
1635,39240,indoor,"airplane_cabin, laundromat, clean_room, coffee_shop, bowling_alley"
1636,39264,indoor,"clean_room, airplane_cabin, laundromat, bowling_alley, airport_terminal"
1637,39288,indoor,"airplane_cabin, clean_room, laundromat, car_interior, bowling_alley"
1638,39312,indoor,"airplane_cabin, clean_room, locker_room, laundromat, bowling_alley"
1639,39336,indoor,"airplane_cabin, laundromat, clean_room, car_interior, bathroom"
1640,39360,indoor,"classroom, lecture_room, kindergarden_classroom, archive, conference_center"
1641,39384,indoor,"classroom, kindergarden_classroom, lecture_room, archive, museum/indoor"
1642,39408,indoor,"classroom, lecture_room, kindergarden_classroom, discotheque, archive"
1643,39432,indoor,"classroom, kindergarden_classroom, lecture_room, museum/indoor, discotheque"
1644,39456,indoor,"classroom, kindergarden_classroom, lecture_room, chemistry_lab, discotheque"
1645,39480,indoor,"classroom, lecture_room, kindergarden_classroom, conference_center, chemistry_lab"
1646,39504,indoor,"classroom, lecture_room, conference_center, archive, museum/indoor"
1647,39528,indoor,"classroom, lecture_room, museum/indoor, chemistry_lab, kindergarden_classroom"
1648,39552,indoor,"museum/indoor, classroom, shower, lecture_room, bathroom"
1649,39576,indoor,"classroom, museum/indoor, shower, lecture_room, kindergarden_classroom"
1650,39600,indoor,"classroom, museum/indoor, lecture_room, kindergarden_classroom, conference_center"
1651,39624,indoor,"classroom, lecture_room, museum/indoor, conference_center, shower"
1652,39648,indoor,"classroom, lecture_room, museum/indoor, conference_center, shower"
1653,39672,indoor,"classroom, lecture_room, museum/indoor, conference_center, kindergarden_classroom"
1654,39696,indoor,"restaurant, cafeteria, bar, pub/indoor, dining_hall"
1655,39720,indoor,"cafeteria, restaurant, dining_hall, food_court, classroom"
1656,39744,indoor,"cafeteria, classroom, dining_hall, food_court, restaurant"
1657,39768,indoor,"food_court, cafeteria, restaurant, dining_hall, coffee_shop"
1658,39792,indoor,"clean_room, discotheque, dressing_room, chemistry_lab, locker_room"
1659,39816,indoor,"discotheque, chemistry_lab, banquet_hall, stage/indoor, biology_laboratory"
1660,39840,indoor,"dressing_room, discotheque, chemistry_lab, clean_room, biology_laboratory"
1661,39864,indoor,"dressing_room, discotheque, chemistry_lab, biology_laboratory, clean_room"
1662,39888,indoor,"clean_room, chemistry_lab, biology_laboratory, restaurant_kitchen, restaurant"
1663,39912,indoor,"clean_room, chemistry_lab, restaurant_kitchen, biology_laboratory, dressing_room"
1664,39936,indoor,"clean_room, chemistry_lab, restaurant_kitchen, biology_laboratory, dressing_room"
1665,39960,indoor,"clean_room, chemistry_lab, bar, pub/indoor, biology_laboratory"
1666,39984,indoor,"discotheque, dressing_room, classroom, clean_room, chemistry_lab"
1667,40008,indoor,"discotheque, dressing_room, classroom, stage/indoor, chemistry_lab"
1668,40032,indoor,"discotheque, dressing_room, classroom, clean_room, chemistry_lab"
1669,40056,indoor,"dressing_room, discotheque, clean_room, hospital_room, classroom"
1670,40080,indoor,"dressing_room, discotheque, nursery, clean_room, classroom"
1671,40104,indoor,"discotheque, clean_room, iceberg, dressing_room, ice_shelf"
1672,40128,indoor,"clean_room, discotheque, biology_laboratory, iceberg, ice_shelf"
1673,40152,indoor,"discotheque, clean_room, chemistry_lab, biology_laboratory, hospital_room"
1674,40176,indoor,"discotheque, clean_room, biology_laboratory, chemistry_lab, iceberg"
1675,40200,indoor,"discotheque, clean_room, chemistry_lab, biology_laboratory, hospital_room"
1676,40224,indoor,"chemistry_lab, discotheque, clean_room, biology_laboratory, candy_store"
1677,40248,indoor,"clean_room, hospital_room, dressing_room, classroom, chemistry_lab"
1678,40272,indoor,"discotheque, pub/indoor, bowling_alley, restaurant, cafeteria"
1679,40296,indoor,"discotheque, bar, martial_arts_gym, dressing_room, classroom"
1680,40320,indoor,"dressing_room, clean_room, locker_room, hospital_room, beauty_salon"
1681,40344,indoor,"clean_room, operating_room, hospital_room, chemistry_lab, biology_laboratory"
1682,40368,indoor,"clean_room, operating_room, chemistry_lab, hospital_room, biology_laboratory"
1683,40392,indoor,"clean_room, chemistry_lab, biology_laboratory, operating_room, hospital_room"
1684,40416,indoor,"clean_room, operating_room, chemistry_lab, biology_laboratory, hospital_room"
1685,40440,indoor,"clean_room, operating_room, chemistry_lab, biology_laboratory, hospital_room"
1686,40464,indoor,"clean_room, chemistry_lab, operating_room, biology_laboratory, hospital_room"
1687,40488,indoor,"clean_room, operating_room, chemistry_lab, biology_laboratory, hospital_room"
1688,40512,indoor,"clean_room, chemistry_lab, operating_room, biology_laboratory, hospital_room"
1689,40536,indoor,"clean_room, operating_room, chemistry_lab, biology_laboratory, hospital_room"
1690,40560,indoor,"clean_room, chemistry_lab, biology_laboratory, operating_room, hospital_room"
1691,40584,indoor,"clean_room, chemistry_lab, biology_laboratory, operating_room, restaurant"
1692,40608,indoor,"clean_room, chemistry_lab, biology_laboratory, operating_room, hospital_room"
1693,40632,indoor,"clean_room, operating_room, hospital_room, chemistry_lab, biology_laboratory"
1694,40656,indoor,"clean_room, operating_room, chemistry_lab, biology_laboratory, hospital_room"
1695,40680,indoor,"clean_room, operating_room, hospital_room, chemistry_lab, biology_laboratory"
1696,40704,indoor,"clean_room, operating_room, chemistry_lab, hospital_room, biology_laboratory"
1697,40728,indoor,"clean_room, operating_room, chemistry_lab, hospital_room, biology_laboratory"
1698,40752,indoor,"clean_room, operating_room, chemistry_lab, hospital_room, biology_laboratory"
1699,40776,indoor,"clean_room, operating_room, chemistry_lab, biology_laboratory, hospital_room"
1700,40800,indoor,"clean_room, biology_laboratory, chemistry_lab, restaurant_kitchen, pharmacy"
1701,40824,indoor,"clean_room, pharmacy, drugstore, biology_laboratory, chemistry_lab"
1702,40848,indoor,"clean_room, biology_laboratory, chemistry_lab, pharmacy, operating_room"
1703,40872,indoor,"clean_room, pharmacy, biology_laboratory, drugstore, chemistry_lab"
1704,40896,indoor,"clean_room, restaurant, chemistry_lab, biology_laboratory, pharmacy"
1705,40920,indoor,"clean_room, chemistry_lab, biology_laboratory, operating_room, restaurant_kitchen"
1706,40944,indoor,"clean_room, hospital_room, operating_room, airport_terminal, engine_room"
1707,40968,indoor,"clean_room, subway_station/platform, bowling_alley, escalator/indoor, staircase"
1708,40992,indoor,"clean_room, staircase, bank_vault, shower, museum/indoor"
1709,41016,indoor,"clean_room, engine_room, staircase, bowling_alley, operating_room"
1710,41040,indoor,"clean_room, staircase, locker_room, gymnasium/indoor, bowling_alley"
1711,41064,indoor,"clean_room, gymnasium/indoor, locker_room, engine_room, bowling_alley"
1712,41088,indoor,"clean_room, gymnasium/indoor, staircase, bowling_alley, locker_room"
1713,41112,indoor,"clean_room, staircase, airport_terminal, boxing_ring, subway_station/platform"
1714,41136,outdoor,"ice_shelf, ice_floe, wind_farm, snowfield, ski_slope"
1715,41160,outdoor,"ice_shelf, ice_floe, wind_farm, snowfield, ski_resort"
1716,41184,outdoor,"ice_shelf, ice_floe, snowfield, wind_farm, iceberg"
1717,41208,outdoor,"ice_shelf, ice_floe, snowfield, iceberg, wind_farm"
1718,41232,indoor,"airport_terminal, staircase, clean_room, hospital_room, entrance_hall"
1719,41256,indoor,"boxing_ring, archive, airport_terminal, classroom, clean_room"
1720,41280,indoor,"hangar/indoor, runway, hangar/outdoor, operating_room, hospital_room"
1721,41304,outdoor,"hangar/indoor, hangar/outdoor, runway, landing_deck, auto_factory"
1722,41328,indoor,"hangar/indoor, runway, auto_factory, airport_terminal, landing_deck"
1723,41352,outdoor,"airport_terminal, runway, hangar/indoor, hangar/outdoor, landing_deck"
1724,41376,indoor,"gymnasium/indoor, airport_terminal, classroom, conference_room, waiting_room"
1725,41400,indoor,"gymnasium/indoor, boxing_ring, airport_terminal, clean_room, runway"
1726,41424,outdoor,"runway, hangar/indoor, landing_deck, hangar/outdoor, auto_factory"
1727,41448,outdoor,"sky, beach, ocean, runway, ice_shelf"
1728,41472,outdoor,"lake/natural, marsh, beach, swamp, river"
1729,41496,outdoor,"snowfield, marsh, beach, golf_course, pasture"
1730,41520,outdoor,"snowfield, beach, lake/natural, ice_shelf, marsh"
1731,41544,outdoor,"runway, snowfield, windmill, wind_farm, beach"
1732,41568,outdoor,"beach, ocean, snowfield, marsh, coast"
1733,41592,outdoor,"snowfield, desert/sand, beach, ice_shelf, pasture"
1734,41616,outdoor,"snowfield, ice_shelf, pasture, hayfield, field/cultivated"
1735,41640,outdoor,"runway, snowfield, ice_shelf, ice_floe, field/cultivated"
1736,41664,outdoor,"ice_shelf, beach, lake/natural, ice_floe, snowfield"
1737,41688,outdoor,"ice_shelf, elevator/door, clean_room, runway, iceberg"
1738,41712,outdoor,"runway, pier, landing_deck, harbor, bridge"
1739,41736,outdoor,"runway, landing_deck, pier, hangar/outdoor, hangar/indoor"
1740,41760,outdoor,"hangar/outdoor, windmill, runway, hangar/indoor, boathouse"
1741,41784,indoor,"locker_room, windmill, hangar/indoor, closet, runway"
1742,41808,outdoor,"water_tower, sky, shower, ice_floe, server_room"
1743,41832,indoor,"shoe_shop, gymnasium/indoor, playground, bowling_alley, runway"
1744,41856,outdoor,"sky, skyscraper, windmill, closet, clothing_store"
1745,41880,indoor,"gymnasium/indoor, sky, wind_farm, conference_room, recreation_room"
1746,41904,outdoor,"runway, airfield, wind_farm, windmill, landing_deck"
1747,41928,outdoor,"runway, airfield, windmill, hangar/indoor, wind_farm"
1748,41952,outdoor,"ski_slope, windmill, sky, wind_farm, snowfield"
1749,41976,indoor,"hangar/indoor, locker_room, runway, wind_farm, clean_room"
1750,42000,outdoor,"ski_slope, wind_farm, snowfield, windmill, sky"
1751,42024,outdoor,"locker_room, snowfield, closet, ice_shelf, wind_farm"
1752,42048,outdoor,"closet, locker_room, ice_shelf, wind_farm, snowfield"
1753,42072,indoor,"elevator/door, locker_room, shower, ice_shelf, closet"
1754,42096,outdoor,"hot_spring, sky, shower, lake/natural, ocean"
1755,42120,outdoor,"sky, hot_spring, shower, ocean, lake/natural"
1756,42144,outdoor,"sky, shower, hot_spring, lake/natural, ocean"
1757,42168,outdoor,"hot_spring, shower, sky, elevator/door, lake/natural"
1758,42192,indoor,"elevator/door, sky, hot_spring, shower, closet"
1759,42216,indoor,"elevator/door, closet, barndoor, sky, bow_window/indoor"
1760,42240,outdoor,"ice_shelf, iceberg, elevator/door, barndoor, sky"
1761,42264,outdoor,"elevator/door, ice_shelf, barndoor, iceberg, sky"
1762,42288,outdoor,"elevator/door, ice_shelf, bow_window/indoor, barndoor, iceberg"
1763,42312,outdoor,"sky, wind_farm, ice_floe, water_tower, windmill"
1764,42336,outdoor,"sky, wind_farm, windmill, ice_floe, water_tower"
1765,42360,outdoor,"sky, wind_farm, windmill, wheat_field, water_tower"
1766,42384,outdoor,"sky, wind_farm, windmill, wheat_field, water_tower"
1767,42408,outdoor,"sky, wind_farm, windmill, wheat_field, water_tower"
1768,42432,outdoor,"sky, wind_farm, windmill, ice_floe, bridge"
1769,42456,outdoor,"landing_deck, airfield, runway, hangar/indoor, heliport"
1770,42480,outdoor,"landing_deck, airfield, heliport, hangar/indoor, runway"
1771,42504,outdoor,"landing_deck, airfield, runway, hangar/indoor, heliport"
1772,42528,outdoor,"landing_deck, airfield, runway, heliport, hangar/indoor"
1773,42552,indoor,"museum/indoor, art_gallery, natural_history_museum, science_museum, clean_room"
1774,42576,indoor,"museum/indoor, art_gallery, natural_history_museum, science_museum, clean_room"
1775,42600,indoor,"art_gallery, museum/indoor, clean_room, science_museum, art_studio"
1776,42624,outdoor,"ice_shelf, iceberg, glacier, ice_floe, closet"
1777,42648,outdoor,"ice_shelf, iceberg, ice_floe, closet, glacier"
1778,42672,outdoor,"ice_shelf, iceberg, ice_floe, glacier, closet"
1779,42696,outdoor,"iceberg, ice_shelf, shower, ice_floe, bathroom"
1780,42720,outdoor,"clean_room, iceberg, shower, ice_floe, ice_shelf"
1781,42744,indoor,"clean_room, iceberg, shoe_shop, shower, jewelry_shop"
1782,42768,indoor,"clean_room, shoe_shop, chemistry_lab, shower, natural_history_museum"
1783,42792,indoor,"clean_room, museum/indoor, science_museum, laundromat, art_gallery"
1784,42816,indoor,"clean_room, museum/indoor, laundromat, shower, science_museum"
1785,42840,indoor,"clean_room, museum/indoor, shower, laundromat, science_museum"
1786,42864,outdoor,"snowfield, beach, ice_floe, desert/sand, ocean"
1787,42888,outdoor,"beach, desert/sand, snowfield, ice_floe, ocean"
1788,42912,outdoor,"beach, snowfield, ice_floe, desert/sand, ocean"
1789,42936,outdoor,"hangar/indoor, runway, airport_terminal, landing_deck, airfield"
1790,42960,outdoor,"hangar/indoor, airport_terminal, runway, landing_deck, airfield"
1791,42984,outdoor,"runway, hangar/indoor, landing_deck, hangar/outdoor, airfield"
1792,43008,outdoor,"hangar/outdoor, runway, landing_deck, museum/indoor, hangar/indoor"
1793,43032,indoor,"airplane_cabin, cockpit, attic, airport_terminal, bus_interior"
1794,43056,indoor,"shower, wind_farm, laundromat, clean_room, greenhouse/outdoor"
1795,43080,outdoor,"wind_farm, shower, laundromat, water_tower, playground"
1796,43104,outdoor,"wind_farm, shower, water_tower, playground, bridge"
1797,43128,outdoor,"shower, wind_farm, water_tower, bridge, greenhouse/outdoor"
1798,43152,indoor,"shower, clean_room, wind_farm, greenhouse/outdoor, greenhouse/indoor"
1799,43176,outdoor,"ocean, snowfield, beach, desert/sand, ice_shelf"
1800,43200,outdoor,"ocean, beach, ice_shelf, ice_floe, snowfield"
1801,43224,outdoor,"ocean, sky, beach, shower, lake/natural"
1802,43248,indoor,"clean_room, discotheque, hospital_room, operating_room, beauty_salon"
1803,43272,indoor,"clean_room, discotheque, hospital_room, operating_room, airplane_cabin"
1804,43296,indoor,"discotheque, clean_room, hospital_room, operating_room, dressing_room"
1805,43320,indoor,"clean_room, discotheque, hospital_room, dressing_room, operating_room"
1806,43344,indoor,"clean_room, discotheque, hospital_room, operating_room, dressing_room"
1807,43368,indoor,"discotheque, clean_room, hospital_room, operating_room, dressing_room"
1808,43392,indoor,"discotheque, clean_room, hospital_room, operating_room, dressing_room"
1809,43416,indoor,"discotheque, clean_room, hospital_room, operating_room, dressing_room"
1810,43440,indoor,"discotheque, clean_room, hospital_room, operating_room, airplane_cabin"
1811,43464,indoor,"discotheque, clean_room, airplane_cabin, hospital_room, dressing_room"
1812,43488,indoor,"shower, wind_farm, greenhouse/outdoor, greenhouse/indoor, clean_room"
1813,43512,outdoor,"shower, wind_farm, clean_room, greenhouse/outdoor, water_tower"
1814,43536,outdoor,"shower, water_tower, wind_farm, clean_room, greenhouse/outdoor"
1815,43560,indoor,"clean_room, office_cubicles, reception, office, locker_room"
1816,43584,indoor,"clean_room, reception, operating_room, office_cubicles, hospital_room"
1817,43608,indoor,"clean_room, reception, office_cubicles, office, locker_room"
1818,43632,indoor,"clean_room, reception, office, hospital_room, office_cubicles"
1819,43656,indoor,"clean_room, reception, hospital_room, operating_room, office"
1820,43680,indoor,"clean_room, reception, locker_room, office_cubicles, office"
1821,43704,indoor,"clean_room, office_cubicles, reception, office, hospital_room"
1822,43728,indoor,"clean_room, office_cubicles, locker_room, reception, office"
1823,43752,outdoor,"ice_shelf, shower, ice_floe, iceberg, sky"
1824,43776,outdoor,"sky, shower, tower, amusement_park, skyscraper"
1825,43800,outdoor,"shower, wind_farm, ice_floe, amusement_park, sky"
1826,43824,indoor,"clean_room, discotheque, operating_room, hospital_room, dressing_room"
1827,43848,indoor,"discotheque, clean_room, airplane_cabin, hospital_room, operating_room"
1828,43872,indoor,"clean_room, discotheque, hospital_room, dressing_room, operating_room"
1829,43896,indoor,"discotheque, clean_room, shower, airplane_cabin, bathroom"
1830,43920,indoor,"clean_room, operating_room, hospital_room, chemistry_lab, biology_laboratory"
1831,43944,indoor,"wind_farm, shower, elevator/door, clean_room, natural_history_museum"
1832,43968,indoor,"wind_farm, shower, elevator/door, closet, natural_history_museum"
1833,43992,indoor,"wind_farm, elevator/door, playground, closet, shower"
1834,44016,indoor,"clean_room, natural_history_museum, elevator/door, science_museum, museum/indoor"
1835,44040,indoor,"clean_room, chemistry_lab, shower, biology_laboratory, locker_room"
1836,44064,indoor,"bow_window/indoor, living_room, waiting_room, dressing_room, dining_room"
1837,44088,indoor,"bow_window/indoor, living_room, dining_room, waiting_room, lobby"
