,frame_num,environment,places
3053,73272,indoor,"dressing_room, clean_room, museum/indoor, art_gallery, art_studio"
3054,73296,indoor,"dressing_room, museum/indoor, clean_room, art_gallery, art_studio"
3055,73320,indoor,"dressing_room, clean_room, art_gallery, museum/indoor, art_studio"
3056,73344,indoor,"dressing_room, clean_room, museum/indoor, art_gallery, art_studio"
3057,73368,indoor,"dressing_room, clean_room, museum/indoor, art_gallery, art_studio"
3058,73392,indoor,"dressing_room, museum/indoor, clean_room, art_gallery, art_studio"
3059,73416,indoor,"dressing_room, clean_room, museum/indoor, locker_room, art_gallery"
3060,73440,indoor,"museum/indoor, clean_room, locker_room, dressing_room, martial_arts_gym"
3061,73464,indoor,"museum/indoor, dressing_room, clean_room, art_gallery, archive"
3062,73488,indoor,"museum/indoor, dressing_room, art_gallery, clean_room, sauna"
3063,73512,indoor,"television_studio, music_studio, stage/indoor, ballroom, dressing_room"
3064,73536,indoor,"classroom, dressing_room, music_studio, waiting_room, lecture_room"
3065,73560,indoor,"dressing_room, dining_room, classroom, museum/indoor, living_room"
3066,73584,indoor,"dressing_room, clean_room, music_studio, stage/indoor, discotheque"
3067,73608,indoor,"museum/indoor, dressing_room, ballroom, classroom, archive"
3068,73632,indoor,"clean_room, music_studio, discotheque, classroom, television_studio"
3069,73656,indoor,"dressing_room, clean_room, music_studio, hospital_room, classroom"
3070,73680,indoor,"music_studio, television_studio, stage/indoor, clean_room, discotheque"
3071,73704,indoor,"clean_room, dressing_room, beauty_salon, bow_window/indoor, hospital_room"
3072,73728,indoor,"clean_room, beauty_salon, dressing_room, hospital_room, bow_window/indoor"
3073,73752,indoor,"clean_room, beauty_salon, bow_window/indoor, dressing_room, hospital_room"
3074,73776,indoor,"clean_room, hospital_room, beauty_salon, dressing_room, operating_room"
3075,73800,indoor,"clean_room, hospital_room, beauty_salon, operating_room, bow_window/indoor"
3076,73824,indoor,"clean_room, hospital_room, beauty_salon, bow_window/indoor, operating_room"
3077,73848,indoor,"clean_room, hospital_room, beauty_salon, operating_room, bow_window/indoor"
3078,73872,indoor,"clean_room, hospital_room, beauty_salon, bow_window/indoor, operating_room"
3079,73896,indoor,"dressing_room, clean_room, museum/indoor, discotheque, art_gallery"
3080,73920,indoor,"dressing_room, museum/indoor, shower, art_gallery, clean_room"
3081,73944,indoor,"dressing_room, discotheque, clean_room, shower, airplane_cabin"
3082,73968,indoor,"dressing_room, shower, clean_room, discotheque, museum/indoor"
3083,73992,indoor,"dressing_room, clean_room, chemistry_lab, beauty_salon, office"
3084,74016,indoor,"dressing_room, clean_room, chemistry_lab, hospital_room, beauty_salon"
3085,74040,indoor,"dressing_room, clean_room, nursery, hospital_room, bedroom"
3086,74064,indoor,"dressing_room, clean_room, beauty_salon, chemistry_lab, hospital_room"
3087,74088,indoor,"dressing_room, bow_window/indoor, hotel_room, bedroom, beauty_salon"
3088,74112,indoor,"dressing_room, clean_room, hospital_room, bedroom, nursery"
3089,74136,indoor,"dressing_room, clean_room, hospital_room, hotel_room, nursery"
3090,74160,indoor,"dressing_room, bedroom, hotel_room, hospital_room, clean_room"
3091,74184,indoor,"dressing_room, clean_room, hospital_room, bow_window/indoor, hotel_room"
3092,74208,indoor,"dressing_room, clean_room, beauty_salon, archive, hospital_room"
3093,74232,indoor,"dressing_room, clean_room, beauty_salon, archive, martial_arts_gym"
3094,74256,indoor,"dressing_room, clean_room, archive, beauty_salon, locker_room"
3095,74280,indoor,"dressing_room, clean_room, archive, beauty_salon, locker_room"
3096,74304,indoor,"dressing_room, clean_room, archive, beauty_salon, locker_room"
3097,74328,indoor,"dressing_room, clean_room, office, coffee_shop, living_room"
3098,74352,indoor,"dressing_room, chemistry_lab, beauty_salon, bedroom, clean_room"
3099,74376,indoor,"dressing_room, beauty_salon, clean_room, office, music_studio"
3100,74400,indoor,"bow_window/indoor, dressing_room, hotel_room, sauna, clean_room"
3101,74424,indoor,"bow_window/indoor, clean_room, dressing_room, hospital_room, bathroom"
3102,74448,indoor,"bow_window/indoor, dressing_room, living_room, clean_room, beauty_salon"
3103,74472,indoor,"dressing_room, bow_window/indoor, clean_room, hotel_room, beauty_salon"
3104,74496,indoor,"ice_cream_parlor, coffee_shop, restaurant, clean_room, banquet_hall"
3105,74520,indoor,"ice_cream_parlor, coffee_shop, clean_room, nursery, restaurant"
3106,74544,indoor,"dressing_room, nursery, ice_cream_parlor, discotheque, coffee_shop"
3107,74568,indoor,"coffee_shop, dressing_room, restaurant, ice_cream_parlor, nursery"
3108,74592,indoor,"ice_cream_parlor, coffee_shop, restaurant, clean_room, dressing_room"
3109,74616,indoor,"ice_cream_parlor, coffee_shop, restaurant, banquet_hall, clean_room"
3110,74640,indoor,"ice_cream_parlor, coffee_shop, dressing_room, nursery, restaurant"
3111,74664,indoor,"ice_cream_parlor, coffee_shop, restaurant, clean_room, dressing_room"
3112,74688,indoor,"ice_cream_parlor, dressing_room, coffee_shop, nursery, restaurant"
3113,74712,indoor,"coffee_shop, dressing_room, ice_cream_parlor, nursery, clean_room"
3114,74736,indoor,"coffee_shop, ice_cream_parlor, restaurant, dressing_room, nursery"
3115,74760,indoor,"coffee_shop, ice_cream_parlor, restaurant, clean_room, nursery"
3116,74784,indoor,"dressing_room, clean_room, chemistry_lab, hospital_room, office"
3117,74808,indoor,"clean_room, dressing_room, locker_room, music_studio, hospital_room"
3118,74832,indoor,"clean_room, office, hospital_room, chemistry_lab, nursing_home"
3119,74856,indoor,"clean_room, hospital_room, dressing_room, chemistry_lab, nursery"
3120,74880,indoor,"hospital_room, jail_cell, shower, bathroom, elevator/door"
3121,74904,indoor,"clean_room, nursery, dressing_room, discotheque, museum/indoor"
3122,74928,indoor,"dressing_room, clean_room, nursery, discotheque, hospital_room"
3123,74952,indoor,"dressing_room, clean_room, discotheque, locker_room, nursery"
3124,74976,indoor,"clean_room, dressing_room, nursery, discotheque, ice_cream_parlor"
3125,75000,indoor,"dressing_room, nursery, clean_room, discotheque, hospital_room"
3126,75024,indoor,"archive, museum/indoor, clean_room, office, office_cubicles"
3127,75048,indoor,"archive, clean_room, museum/indoor, office, art_gallery"
3128,75072,indoor,"clean_room, dressing_room, martial_arts_gym, discotheque, nursery"
3129,75096,indoor,"clean_room, dressing_room, martial_arts_gym, nursery, discotheque"
3130,75120,indoor,"dressing_room, clean_room, nursery, discotheque, hospital_room"
3131,75144,indoor,"dressing_room, clean_room, locker_room, nursery, hospital_room"
3132,75168,indoor,"dressing_room, clean_room, nursery, locker_room, hospital_room"
3133,75192,indoor,"clean_room, dressing_room, nursery, locker_room, hospital_room"
3134,75216,indoor,"clean_room, locker_room, dressing_room, nursery, hospital_room"
3135,75240,indoor,"clean_room, dressing_room, locker_room, nursery, hospital_room"
3136,75264,indoor,"dressing_room, clean_room, nursery, locker_room, discotheque"
3137,75288,indoor,"archive, museum/indoor, clean_room, office, office_cubicles"
3138,75312,indoor,"archive, museum/indoor, clean_room, office, art_gallery"
3139,75336,indoor,"archive, museum/indoor, clean_room, art_gallery, office"
3140,75360,indoor,"archive, museum/indoor, clean_room, art_gallery, office_cubicles"
3141,75384,indoor,"clean_room, museum/indoor, archive, art_gallery, locker_room"
3142,75408,indoor,"bow_window/indoor, living_room, dressing_room, dorm_room, nursery"
3143,75432,indoor,"dressing_room, hospital_room, hotel_room, living_room, bow_window/indoor"
3144,75456,indoor,"hotel_room, dressing_room, bow_window/indoor, hospital_room, bedroom"
3145,75480,indoor,"hospital_room, hotel_room, bow_window/indoor, dorm_room, bedroom"
3146,75504,indoor,"hospital_room, bow_window/indoor, dressing_room, hotel_room, dorm_room"
3147,75528,indoor,"hospital_room, bow_window/indoor, clean_room, living_room, dressing_room"
3148,75552,indoor,"living_room, dressing_room, hospital_room, hotel_room, bedroom"
3149,75576,indoor,"living_room, hospital_room, dressing_room, hotel_room, bow_window/indoor"
3150,75600,indoor,"living_room, dressing_room, hospital_room, bow_window/indoor, hotel_room"
3151,75624,indoor,"dressing_room, living_room, clean_room, hospital_room, bow_window/indoor"
3152,75648,indoor,"living_room, bow_window/indoor, dressing_room, dorm_room, hospital_room"
3153,75672,indoor,"clean_room, dressing_room, music_studio, hospital_room, beauty_salon"
3154,75696,indoor,"clean_room, dressing_room, locker_room, museum/indoor, hospital_room"
3155,75720,indoor,"dressing_room, clean_room, ballroom, hospital_room, music_studio"
3156,75744,indoor,"dressing_room, television_studio, clean_room, music_studio, ballroom"
3157,75768,indoor,"dressing_room, clean_room, hospital_room, beauty_salon, operating_room"
3158,75792,indoor,"dressing_room, clean_room, music_studio, television_studio, living_room"
3159,75816,indoor,"bow_window/indoor, museum/indoor, television_studio, living_room, office"
3160,75840,indoor,"clean_room, museum/indoor, dressing_room, operating_room, locker_room"
3161,75864,indoor,"dressing_room, museum/indoor, sauna, clean_room, television_studio"
3162,75888,indoor,"clean_room, dressing_room, operating_room, museum/indoor, hospital_room"
3163,75912,indoor,"dressing_room, museum/indoor, clean_room, ballroom, music_studio"
3164,75936,indoor,"clean_room, dressing_room, chemistry_lab, archive, physics_laboratory"
3165,75960,indoor,"clean_room, dressing_room, discotheque, music_studio, chemistry_lab"
3166,75984,indoor,"clean_room, dressing_room, chemistry_lab, music_studio, archive"
3167,76008,indoor,"clean_room, dressing_room, museum/indoor, art_gallery, discotheque"
3168,76032,indoor,"dressing_room, clean_room, discotheque, art_gallery, museum/indoor"
3169,76056,indoor,"clean_room, discotheque, dressing_room, museum/indoor, music_studio"
3170,76080,indoor,"office, dressing_room, archive, television_studio, museum/indoor"
3171,76104,indoor,"dressing_room, office, archive, elevator/door, clean_room"
3172,76128,indoor,"elevator/door, dressing_room, office, archive, elevator_lobby"
3173,76152,indoor,"dressing_room, clean_room, ballroom, nursery, hospital_room"
3174,76176,indoor,"dressing_room, clean_room, ballroom, museum/indoor, music_studio"
3175,76200,indoor,"clean_room, ballroom, office, classroom, dressing_room"
3176,76224,indoor,"dressing_room, museum/indoor, music_studio, clean_room, stage/indoor"
3177,76248,indoor,"dressing_room, locker_room, discotheque, museum/indoor, music_studio"
3178,76272,indoor,"dressing_room, discotheque, museum/indoor, clean_room, music_studio"
3179,76296,indoor,"dressing_room, clean_room, discotheque, museum/indoor, locker_room"
3180,76320,indoor,"clean_room, dressing_room, museum/indoor, discotheque, music_studio"
3181,76344,indoor,"living_room, bow_window/indoor, nursery, childs_room, bedroom"
3182,76368,indoor,"waiting_room, classroom, living_room, jail_cell, lecture_room"
3183,76392,indoor,"clean_room, locker_room, dressing_room, classroom, jail_cell"
3184,76416,indoor,"staircase, martial_arts_gym, bow_window/indoor, locker_room, dressing_room"
3185,76440,indoor,"bow_window/indoor, elevator/door, closet, doorway/outdoor, artists_loft"
3186,76464,indoor,"living_room, bow_window/indoor, waiting_room, dining_room, recreation_room"
3187,76488,indoor,"living_room, bow_window/indoor, waiting_room, dining_room, recreation_room"
3188,76512,indoor,"living_room, bow_window/indoor, waiting_room, nursery, recreation_room"
3189,76536,indoor,"dressing_room, clean_room, office, museum/indoor, music_studio"
3190,76560,indoor,"dressing_room, office, archive, museum/indoor, elevator/door"
3191,76584,indoor,"dressing_room, clean_room, office, museum/indoor, archive"
3192,76608,indoor,"dressing_room, museum/indoor, elevator/door, archive, clean_room"
3193,76632,indoor,"museum/indoor, office, dressing_room, archive, clean_room"
3194,76656,indoor,"office, dressing_room, clean_room, museum/indoor, music_studio"
3195,76680,indoor,"dressing_room, office, clean_room, museum/indoor, archive"
3196,76704,indoor,"dressing_room, museum/indoor, office, clean_room, archive"
3197,76728,indoor,"dressing_room, elevator/door, office, clean_room, museum/indoor"
3198,76752,indoor,"dressing_room, office, archive, elevator/door, music_studio"
3199,76776,indoor,"dressing_room, office, home_office, archive, nursing_home"
3200,76800,indoor,"office, dressing_room, archive, nursing_home, home_office"
3201,76824,indoor,"dressing_room, office, archive, museum/indoor, nursing_home"
3202,76848,indoor,"dressing_room, office, archive, museum/indoor, nursing_home"
3203,76872,indoor,"dressing_room, office, archive, bar, discotheque"
3204,76896,indoor,"dressing_room, office, nursing_home, archive, discotheque"
3205,76920,indoor,"office, dressing_room, archive, nursing_home, museum/indoor"
3206,76944,indoor,"office, dressing_room, archive, nursing_home, home_office"
3207,76968,indoor,"office, dressing_room, archive, nursing_home, museum/indoor"
3208,76992,indoor,"office, dressing_room, archive, nursing_home, museum/indoor"
3209,77016,indoor,"dressing_room, museum/indoor, elevator/door, office, archive"
3210,77040,indoor,"dressing_room, museum/indoor, archive, elevator/door, sauna"
3211,77064,indoor,"dressing_room, elevator/door, archive, office, museum/indoor"
3212,77088,indoor,"dressing_room, office, archive, elevator/door, museum/indoor"
3213,77112,indoor,"dressing_room, office, nursing_home, museum/indoor, archive"
3214,77136,indoor,"dressing_room, office, archive, elevator/door, music_studio"
3215,77160,indoor,"dressing_room, office, archive, museum/indoor, nursing_home"
3216,77184,indoor,"dressing_room, office, archive, museum/indoor, nursing_home"
3217,77208,indoor,"dressing_room, office, museum/indoor, archive, bar"
3218,77232,indoor,"dressing_room, discotheque, bar, ballroom, office"
3219,77256,indoor,"dressing_room, office, archive, bar, nursing_home"
3220,77280,indoor,"dressing_room, office, museum/indoor, archive, nursing_home"
3221,77304,indoor,"dressing_room, museum/indoor, office, archive, music_studio"
3222,77328,indoor,"dressing_room, museum/indoor, office, archive, elevator/door"
3223,77352,indoor,"dressing_room, museum/indoor, archive, office, elevator/door"
3224,77376,indoor,"dressing_room, museum/indoor, archive, office, sauna"
3225,77400,indoor,"dressing_room, museum/indoor, archive, discotheque, stage/indoor"
3226,77424,indoor,"dressing_room, museum/indoor, archive, office, music_studio"
3227,77448,indoor,"dressing_room, archive, museum/indoor, office, elevator/door"
3228,77472,indoor,"dressing_room, museum/indoor, archive, music_studio, office"
3229,77496,indoor,"dressing_room, archive, museum/indoor, music_studio, elevator/door"
3230,77520,indoor,"dressing_room, museum/indoor, archive, sauna, music_studio"
3231,77544,indoor,"dressing_room, archive, museum/indoor, music_studio, office"
3232,77568,indoor,"office, dressing_room, archive, museum/indoor, nursing_home"
3233,77592,indoor,"office, dressing_room, archive, museum/indoor, music_studio"
3234,77616,indoor,"office, dressing_room, television_studio, museum/indoor, nursing_home"
3235,77640,indoor,"aquarium, pond, natural_history_museum, lake/natural, science_museum"
3236,77664,outdoor,"iceberg, ice_floe, clean_room, pond, museum/indoor"
3237,77688,indoor,"iceberg, ice_floe, florist_shop/indoor, museum/indoor, clean_room"
3238,77712,outdoor,"ice_floe, iceberg, pond, clean_room, museum/indoor"
3239,77736,indoor,"dressing_room, music_studio, archive, stage/indoor, clean_room"
3240,77760,indoor,"dressing_room, music_studio, stage/indoor, discotheque, ballroom"
3241,77784,indoor,"coffee_shop, art_school, ice_cream_parlor, art_studio, art_gallery"
3242,77808,indoor,"art_school, coffee_shop, ice_cream_parlor, art_studio, art_gallery"
3243,77832,indoor,"art_school, coffee_shop, ice_cream_parlor, art_studio, art_gallery"
3244,77856,indoor,"art_school, coffee_shop, ice_cream_parlor, art_studio, kindergarden_classroom"
3245,77880,indoor,"art_school, coffee_shop, ice_cream_parlor, art_studio, art_gallery"
3246,77904,indoor,"living_room, bow_window/indoor, waiting_room, recreation_room, dining_room"
3247,77928,indoor,"living_room, bow_window/indoor, waiting_room, recreation_room, lobby"
3248,77952,indoor,"living_room, bow_window/indoor, waiting_room, recreation_room, nursery"
3249,77976,indoor,"living_room, bow_window/indoor, waiting_room, recreation_room, ballroom"
3250,78000,indoor,"bow_window/indoor, living_room, dressing_room, museum/indoor, recreation_room"
3251,78024,indoor,"clean_room, living_room, dressing_room, office, museum/indoor"
3252,78048,indoor,"living_room, artists_loft, waiting_room, clean_room, dressing_room"
3253,78072,indoor,"living_room, home_office, waiting_room, clean_room, bedroom"
3254,78096,indoor,"living_room, dressing_room, home_office, museum/indoor, artists_loft"
3255,78120,indoor,"living_room, waiting_room, dressing_room, home_office, artists_loft"
3256,78144,indoor,"living_room, dressing_room, waiting_room, home_office, bedroom"
3257,78168,indoor,"living_room, waiting_room, home_office, artists_loft, lobby"
3258,78192,indoor,"living_room, waiting_room, artists_loft, lobby, television_room"
3259,78216,indoor,"living_room, waiting_room, artists_loft, lobby, bathroom"
3260,78240,indoor,"living_room, artists_loft, waiting_room, bathroom, home_office"
3261,78264,indoor,"clean_room, living_room, shoe_shop, waiting_room, lobby"
3262,78288,indoor,"wet_bar, pantry, kitchen, clean_room, jewelry_shop"
3263,78312,indoor,"wet_bar, clean_room, jewelry_shop, pantry, kitchen"
3264,78336,indoor,"wet_bar, jewelry_shop, clean_room, pantry, kitchen"
3265,78360,indoor,"wet_bar, jewelry_shop, clean_room, pantry, kitchen"
3266,78384,indoor,"wet_bar, kitchen, clean_room, pantry, jewelry_shop"
3267,78408,indoor,"wet_bar, jewelry_shop, kitchen, clean_room, pantry"
3268,78432,indoor,"wet_bar, clean_room, jewelry_shop, kitchen, pantry"
3269,78456,indoor,"clean_room, jewelry_shop, archive, wet_bar, reception"
3270,78480,indoor,"clean_room, archive, reception, jewelry_shop, locker_room"
3271,78504,indoor,"clean_room, archive, chemistry_lab, wet_bar, reception"
3272,78528,indoor,"clean_room, reception, kitchen, archive, wet_bar"
3273,78552,indoor,"clean_room, archive, chemistry_lab, kitchen, reception"
3274,78576,indoor,"clean_room, dressing_room, archive, museum/indoor, locker_room"
3275,78600,indoor,"clean_room, locker_room, sauna, youth_hostel, nursery"
3276,78624,indoor,"locker_room, jail_cell, dressing_room, archive, clean_room"
3277,78648,indoor,"clean_room, archive, locker_room, dressing_room, nursery"
3278,78672,indoor,"clean_room, archive, dressing_room, locker_room, sauna"
3279,78696,indoor,"clean_room, dressing_room, archive, locker_room, sauna"
3280,78720,indoor,"dressing_room, locker_room, clean_room, archive, sauna"
3281,78744,indoor,"clean_room, jail_cell, operating_room, locker_room, dressing_room"
3282,78768,indoor,"clean_room, dressing_room, locker_room, nursery, jail_cell"
3283,78792,indoor,"clean_room, locker_room, archive, nursery, dressing_room"
3284,78816,indoor,"clean_room, archive, locker_room, dressing_room, nursery"
3285,78840,indoor,"clean_room, locker_room, archive, dressing_room, nursery"
3286,78864,indoor,"clean_room, locker_room, dressing_room, archive, operating_room"
3287,78888,indoor,"clean_room, locker_room, archive, dressing_room, nursery"
3288,78912,indoor,"clean_room, locker_room, archive, nursery, dressing_room"
3289,78936,indoor,"clean_room, locker_room, archive, jail_cell, dressing_room"
3290,78960,indoor,"clean_room, locker_room, archive, jail_cell, nursery"
3291,78984,indoor,"clean_room, locker_room, dressing_room, nursery, museum/indoor"
3292,79008,indoor,"clean_room, locker_room, archive, museum/indoor, operating_room"
3293,79032,indoor,"clean_room, archive, locker_room, museum/indoor, dressing_room"
3294,79056,indoor,"clean_room, locker_room, sauna, dressing_room, museum/indoor"
3295,79080,indoor,"clean_room, locker_room, dressing_room, sauna, nursery"
3296,79104,indoor,"clean_room, locker_room, dressing_room, sauna, youth_hostel"
3297,79128,indoor,"clean_room, locker_room, archive, dressing_room, nursery"
3298,79152,indoor,"clean_room, archive, dressing_room, locker_room, operating_room"
3299,79176,indoor,"clean_room, dressing_room, operating_room, nursery, locker_room"
3300,79200,indoor,"clean_room, archive, operating_room, nursery, locker_room"
3301,79224,indoor,"clean_room, operating_room, dressing_room, locker_room, archive"
3302,79248,indoor,"clean_room, locker_room, operating_room, jail_cell, hospital_room"
3303,79272,indoor,"clean_room, locker_room, archive, nursery, dressing_room"
3304,79296,indoor,"clean_room, locker_room, museum/indoor, dressing_room, archive"
3305,79320,indoor,"clean_room, locker_room, archive, dressing_room, operating_room"
3306,79344,indoor,"locker_room, clean_room, dressing_room, archive, sauna"
3307,79368,indoor,"clean_room, locker_room, dressing_room, archive, closet"
3308,79392,indoor,"clean_room, locker_room, dressing_room, jail_cell, archive"
3309,79416,indoor,"clean_room, locker_room, dressing_room, shower, jail_cell"
3310,79440,indoor,"locker_room, dressing_room, clean_room, archive, shower"
3311,79464,indoor,"clean_room, locker_room, dressing_room, archive, nursery"
3312,79488,indoor,"clean_room, locker_room, dressing_room, nursery, archive"
3313,79512,indoor,"clean_room, locker_room, dressing_room, closet, archive"
3314,79536,indoor,"clean_room, locker_room, dressing_room, archive, closet"
3315,79560,indoor,"clean_room, locker_room, dressing_room, archive, sauna"
3316,79584,indoor,"dressing_room, clean_room, locker_room, shower, sauna"
3317,79608,indoor,"clean_room, locker_room, dressing_room, museum/indoor, archive"
3318,79632,indoor,"clean_room, locker_room, dressing_room, archive, nursery"
3319,79656,indoor,"clean_room, locker_room, dressing_room, archive, museum/indoor"
3320,79680,indoor,"clean_room, dressing_room, locker_room, operating_room, hospital_room"
3321,79704,indoor,"jail_cell, locker_room, clean_room, martial_arts_gym, bathroom"
3322,79728,indoor,"clean_room, subway_station/platform, elevator/door, locker_room, museum/indoor"
3323,79752,indoor,"clean_room, art_gallery, museum/indoor, artists_loft, office"
3324,79776,indoor,"bank_vault, elevator/door, clean_room, art_gallery, elevator_lobby"
3325,79800,indoor,"stage/indoor, boxing_ring, music_studio, discotheque, ballroom"
3326,79824,indoor,"dressing_room, discotheque, music_studio, stage/indoor, bathroom"
3327,79848,indoor,"discotheque, stage/indoor, staircase, escalator/indoor, corridor"
3328,79872,indoor,"clean_room, music_studio, stage/indoor, science_museum, staircase"
3329,79896,indoor,"museum/indoor, clean_room, subway_station/platform, art_gallery, elevator/door"
3330,79920,indoor,"clean_room, museum/indoor, archive, art_gallery, dressing_room"
3331,79944,indoor,"clean_room, locker_room, hospital_room, martial_arts_gym, dressing_room"
3332,79968,indoor,"clean_room, museum/indoor, operating_room, art_gallery, martial_arts_gym"
3333,79992,indoor,"clean_room, museum/indoor, physics_laboratory, music_studio, art_gallery"
3334,80016,indoor,"clean_room, dressing_room, museum/indoor, art_gallery, music_studio"
3335,80040,indoor,"dressing_room, clean_room, museum/indoor, locker_room, art_gallery"
3336,80064,indoor,"nursery, hospital_room, staircase, childs_room, clean_room"
3337,80088,indoor,"nursery, dressing_room, hospital_room, nursing_home, music_studio"
3338,80112,indoor,"nursery, dressing_room, hospital_room, playroom, bedroom"
3339,80136,indoor,"dressing_room, nursery, hospital_room, clean_room, nursing_home"
3340,80160,indoor,"nursery, hospital_room, dressing_room, clean_room, nursing_home"
3341,80184,indoor,"nursery, hospital_room, dressing_room, bedroom, clean_room"
3342,80208,indoor,"dressing_room, beauty_salon, discotheque, office, music_studio"
3343,80232,indoor,"dressing_room, discotheque, television_studio, beauty_salon, office"
3344,80256,indoor,"dressing_room, office, beauty_salon, airplane_cabin, office_cubicles"
3345,80280,indoor,"dressing_room, office, beauty_salon, office_cubicles, airplane_cabin"
3346,80304,indoor,"dressing_room, clean_room, beauty_salon, office, discotheque"
3347,80328,indoor,"dressing_room, television_studio, beauty_salon, office, music_studio"
3348,80352,indoor,"dressing_room, airport_terminal, office, airplane_cabin, television_studio"
3349,80376,indoor,"dressing_room, airplane_cabin, office, beauty_salon, airport_terminal"
3350,80400,indoor,"dressing_room, office, beauty_salon, television_studio, discotheque"
3351,80424,indoor,"dressing_room, clean_room, airplane_cabin, office, airport_terminal"
3352,80448,indoor,"television_studio, office, airport_terminal, dressing_room, office_cubicles"
3353,80472,indoor,"locker_room, server_room, clean_room, computer_room, biology_laboratory"
3354,80496,indoor,"locker_room, shower, dressing_room, clean_room, bathroom"
3355,80520,indoor,"dressing_room, locker_room, clothing_store, shower, closet"
3356,80544,indoor,"locker_room, clean_room, dressing_room, jail_cell, hospital_room"
3357,80568,indoor,"dressing_room, locker_room, archive, martial_arts_gym, clean_room"
3358,80592,indoor,"dressing_room, locker_room, clean_room, beauty_salon, archive"
3359,80616,indoor,"dressing_room, clean_room, locker_room, archive, beauty_salon"
3360,80640,indoor,"locker_room, dressing_room, shower, clean_room, closet"
3361,80664,indoor,"dressing_room, locker_room, clothing_store, closet, clean_room"
3362,80688,indoor,"locker_room, clothing_store, dressing_room, closet, shower"
