,frame_num,environment,places,imdb_id
2333,55992,indoor,"hospital_room, bow_window/indoor, clean_room, bedroom, nursing_home",31204
2334,56016,indoor,"clean_room, hospital_room, shower, operating_room, bedroom",31204
2335,56040,indoor,"hospital_room, clean_room, operating_room, bedroom, beauty_salon",31204
2336,56064,indoor,"nursery, hospital_room, bedroom, bow_window/indoor, beauty_salon",31204
2337,56088,indoor,"hospital_room, clean_room, shower, beauty_salon, operating_room",31204
2338,56112,indoor,"hospital_room, clean_room, nursing_home, operating_room, bow_window/indoor",31204
2339,56136,indoor,"atrium/public, shopping_mall/indoor, staircase, archive, clean_room",31204
2340,56160,indoor,"staircase, atrium/public, museum/indoor, art_gallery, bathroom",31204
2341,56184,indoor,"museum/indoor, hangar/outdoor, clean_room, airport_terminal, art_gallery",31204
2342,56208,indoor,"clean_room, airport_terminal, hangar/outdoor, elevator/door, archive",31204
2343,56232,indoor,"hospital_room, clean_room, nursing_home, bow_window/indoor, nursery",31204
2344,56256,indoor,"hospital_room, clean_room, operating_room, nursing_home, bedroom",31204
2345,56280,indoor,"hospital_room, clean_room, nursing_home, operating_room, shower",31204
2346,56304,indoor,"clean_room, hospital_room, shower, operating_room, bow_window/indoor",31204
2347,56328,indoor,"clean_room, physics_laboratory, operating_room, bank_vault, chemistry_lab",31204
2348,56352,indoor,"clean_room, physics_laboratory, operating_room, bank_vault, chemistry_lab",31204
2349,56376,indoor,"hospital_room, clean_room, nursing_home, beauty_salon, operating_room",31204
2350,56400,indoor,"hospital_room, clean_room, bedroom, beauty_salon, hotel_room",31204
2351,56424,indoor,"hospital_room, clean_room, bedroom, beauty_salon, bow_window/indoor",31204
2352,56448,indoor,"hospital_room, bedroom, clean_room, bow_window/indoor, childs_room",31204
2353,56472,indoor,"hospital_room, clean_room, nursing_home, bedroom, bow_window/indoor",31204
2354,56496,indoor,"hospital_room, clean_room, bedroom, hotel_room, bow_window/indoor",31204
2355,56520,indoor,"hospital_room, clean_room, childs_room, bedroom, bow_window/indoor",31204
2356,56544,indoor,"clean_room, hospital_room, childs_room, bedroom, bow_window/indoor",31204
2357,56568,indoor,"hospital_room, clean_room, bedroom, beauty_salon, operating_room",31204
2358,56592,indoor,"hospital_room, clean_room, bow_window/indoor, operating_room, nursing_home",31204
2359,56616,indoor,"hospital_room, bedroom, childs_room, clean_room, bedchamber",31204
2360,56640,outdoor,"ice_floe, iceberg, ice_shelf, snowfield, glacier",31204
2361,56664,outdoor,"runway, airfield, sky, landing_deck, hangar/indoor",31204
2362,56688,outdoor,"runway, landing_deck, airfield, sky, hangar/outdoor",31204
2363,56712,outdoor,"runway, airfield, landing_deck, sky, hangar/indoor",31204
2364,56736,outdoor,"runway, landing_deck, airfield, sky, iceberg",31204
2365,56760,outdoor,"boat_deck, gymnasium/indoor, runway, landing_deck, gas_station",31204
2366,56784,outdoor,"boat_deck, runway, schoolhouse, playground, landing_deck",31204
2367,56808,outdoor,"boat_deck, runway, playground, schoolhouse, gymnasium/indoor",31204
2368,56832,outdoor,"runway, gymnasium/indoor, gas_station, schoolhouse, boat_deck",31204
2369,56856,outdoor,"schoolhouse, boat_deck, runway, gymnasium/indoor, gas_station",31204
2370,56880,outdoor,"boat_deck, archive, playground, runway, schoolhouse",31204
2371,56904,outdoor,"runway, hangar/indoor, hangar/outdoor, shower, airfield",31204
2372,56928,outdoor,"runway, shower, bank_vault, landing_deck, airfield",31204
2373,56952,outdoor,"runway, airfield, landing_deck, shower, hangar/outdoor",31204
2374,56976,outdoor,"runway, shower, airfield, hangar/indoor, landing_deck",31204
2375,57000,outdoor,"runway, landing_deck, shower, hangar/outdoor, airfield",31204
2376,57024,indoor,"archive, dressing_room, clean_room, locker_room, martial_arts_gym",31204
2377,57048,indoor,"dressing_room, clean_room, archive, boxing_ring, operating_room",31204
2378,57072,indoor,"dressing_room, clean_room, chemistry_lab, archive, locker_room",31204
2379,57096,indoor,"clean_room, gymnasium/indoor, locker_room, assembly_line, archive",31204
2380,57120,indoor,"clean_room, archive, chemistry_lab, operating_room, biology_laboratory",31204
2381,57144,indoor,"clean_room, archive, chemistry_lab, biology_laboratory, physics_laboratory",31204
2382,57168,indoor,"clean_room, archive, operating_room, chemistry_lab, physics_laboratory",31204
2383,57192,indoor,"clean_room, archive, operating_room, chemistry_lab, physics_laboratory",31204
2384,57216,indoor,"archive, clean_room, locker_room, operating_room, library/indoor",31204
2385,57240,indoor,"clean_room, archive, locker_room, gymnasium/indoor, operating_room",31204
2386,57264,indoor,"archive, locker_room, clean_room, chemistry_lab, classroom",31204
2387,57288,indoor,"archive, clean_room, chemistry_lab, cafeteria, dining_hall",31204
2388,57312,indoor,"archive, clean_room, chemistry_lab, biology_laboratory, operating_room",31204
2389,57336,indoor,"clean_room, operating_room, archive, hospital_room, chemistry_lab",31204
2390,57360,indoor,"clean_room, museum/indoor, art_gallery, artists_loft, dressing_room",31204
2391,57384,indoor,"clean_room, museum/indoor, art_gallery, dressing_room, operating_room",31204
2392,57408,indoor,"clean_room, dressing_room, archive, martial_arts_gym, locker_room",31204
2393,57432,indoor,"martial_arts_gym, clean_room, dressing_room, boxing_ring, ballroom",31204
2394,57456,indoor,"clean_room, martial_arts_gym, dressing_room, clothing_store, ballroom",31204
2395,57480,outdoor,"hangar/outdoor, schoolhouse, racecourse, stable, corral",31204
2396,57504,outdoor,"hangar/outdoor, schoolhouse, stable, racecourse, gas_station",31204
2397,57528,outdoor,"hangar/outdoor, residential_neighborhood, schoolhouse, manufactured_home, gas_station",31204
2398,57552,outdoor,"hangar/outdoor, schoolhouse, clean_room, fire_station, archive",31204
2399,57576,indoor,"martial_arts_gym, clean_room, dressing_room, ballroom, operating_room",31204
2400,57600,indoor,"dressing_room, clean_room, martial_arts_gym, clothing_store, operating_room",31204
2401,57624,indoor,"clean_room, martial_arts_gym, dressing_room, operating_room, clothing_store",31204
2402,57648,indoor,"martial_arts_gym, clean_room, boxing_ring, operating_room, hospital_room",31204
2403,57672,indoor,"martial_arts_gym, clean_room, boxing_ring, dressing_room, operating_room",31204
2404,57696,indoor,"clean_room, martial_arts_gym, boxing_ring, operating_room, dressing_room",31204
2405,57720,indoor,"martial_arts_gym, boxing_ring, dressing_room, clean_room, bowling_alley",31204
2406,57744,indoor,"martial_arts_gym, clean_room, boxing_ring, dressing_room, museum/indoor",31204
2407,57768,indoor,"martial_arts_gym, clean_room, dressing_room, boxing_ring, art_gallery",31204
2408,57792,indoor,"martial_arts_gym, clean_room, boxing_ring, dressing_room, operating_room",31204
2409,57816,indoor,"martial_arts_gym, clean_room, boxing_ring, dressing_room, operating_room",31204
2410,57840,indoor,"martial_arts_gym, boxing_ring, clean_room, dressing_room, bowling_alley",31204
2411,57864,indoor,"martial_arts_gym, dressing_room, clean_room, boxing_ring, locker_room",31204
2412,57888,indoor,"clean_room, martial_arts_gym, dressing_room, operating_room, boxing_ring",31204
2413,57912,indoor,"clean_room, dressing_room, martial_arts_gym, ice_cream_parlor, office_cubicles",31204
2414,57936,indoor,"clean_room, dressing_room, martial_arts_gym, nursing_home, locker_room",31204
2415,57960,indoor,"clean_room, dressing_room, martial_arts_gym, nursing_home, locker_room",31204
2416,57984,indoor,"clean_room, dressing_room, martial_arts_gym, nursing_home, hospital_room",31204
2417,58008,indoor,"clean_room, martial_arts_gym, dressing_room, operating_room, art_gallery",31204
2418,58032,indoor,"clean_room, dressing_room, martial_arts_gym, operating_room, art_gallery",31204
2419,58056,indoor,"clean_room, dressing_room, laundromat, martial_arts_gym, operating_room",31204
2420,58080,indoor,"clean_room, dressing_room, laundromat, office_cubicles, art_gallery",31204
2421,58104,indoor,"clean_room, dressing_room, office_cubicles, laundromat, art_gallery",31204
2422,58128,indoor,"clean_room, dressing_room, office_cubicles, laundromat, art_gallery",31204
2423,58152,indoor,"clean_room, dressing_room, office_cubicles, art_gallery, laundromat",31204
2424,58176,indoor,"clean_room, dressing_room, art_gallery, laundromat, office_cubicles",31204
2425,58200,indoor,"clean_room, dressing_room, art_gallery, office_cubicles, laundromat",31204
2426,58224,indoor,"clean_room, dressing_room, martial_arts_gym, hospital_room, office_cubicles",31204
2427,58248,indoor,"clean_room, dressing_room, ice_cream_parlor, office_cubicles, martial_arts_gym",31204
2428,58272,indoor,"clean_room, dressing_room, martial_arts_gym, office_cubicles, hospital_room",31204
2429,58296,indoor,"clean_room, dressing_room, ice_cream_parlor, martial_arts_gym, office_cubicles",31204
2430,58320,indoor,"clean_room, dressing_room, ice_cream_parlor, martial_arts_gym, art_gallery",31204
2431,58344,indoor,"clean_room, martial_arts_gym, dressing_room, boxing_ring, locker_room",31204
2432,58368,indoor,"clean_room, martial_arts_gym, boxing_ring, dressing_room, locker_room",31204
2433,58392,indoor,"junkyard, raceway, auto_factory, assembly_line, car_interior",31204
2434,58416,indoor,"junkyard, auto_factory, car_interior, assembly_line, raceway",31204
2435,58440,outdoor,"parking_lot, playground, runway, picnic_area, promenade",31204
2436,58464,outdoor,"parking_lot, pier, promenade, picnic_area, boathouse",31204
2437,58488,outdoor,"picnic_area, pier, volleyball_court/outdoor, parking_lot, playground",31204
2438,58512,outdoor,"playground, picnic_area, pier, parking_lot, volleyball_court/outdoor",31204
2439,58536,outdoor,"playground, picnic_area, pier, promenade, boathouse",31204
2440,58560,outdoor,"promenade, picnic_area, pier, playground, volleyball_court/outdoor",31204
2441,58584,indoor,"clean_room, museum/indoor, science_museum, car_interior, clothing_store",31204
2442,58608,indoor,"clean_room, museum/indoor, science_museum, ice_cream_parlor, clothing_store",31204
2443,58632,indoor,"clean_room, museum/indoor, science_museum, clothing_store, car_interior",31204
2444,58656,indoor,"clean_room, museum/indoor, science_museum, clothing_store, natural_history_museum",31204
2445,58680,indoor,"clean_room, museum/indoor, science_museum, clothing_store, ice_cream_parlor",31204
2446,58704,indoor,"clean_room, science_museum, car_interior, museum/indoor, ice_cream_parlor",31204
2447,58728,indoor,"clean_room, museum/indoor, science_museum, operating_room, ice_cream_parlor",31204
2448,58752,indoor,"clean_room, car_interior, science_museum, museum/indoor, ice_cream_parlor",31204
2449,58776,indoor,"clean_room, science_museum, museum/indoor, car_interior, operating_room",31204
2450,58800,indoor,"clean_room, science_museum, museum/indoor, ice_cream_parlor, operating_room",31204
2451,58824,indoor,"clean_room, science_museum, museum/indoor, ice_cream_parlor, car_interior",31204
2452,58848,indoor,"clean_room, science_museum, museum/indoor, ice_cream_parlor, car_interior",31204
2453,58872,indoor,"clean_room, science_museum, museum/indoor, clothing_store, dressing_room",31204
2454,58896,indoor,"clean_room, science_museum, museum/indoor, operating_room, natural_history_museum",31204
2455,58920,indoor,"clean_room, science_museum, museum/indoor, operating_room, ice_cream_parlor",31204
2456,58944,indoor,"clean_room, science_museum, museum/indoor, operating_room, ice_cream_parlor",31204
2457,58968,indoor,"clean_room, science_museum, museum/indoor, operating_room, ice_cream_parlor",31204
2458,58992,indoor,"clean_room, science_museum, ice_cream_parlor, operating_room, museum/indoor",31204
2459,59016,indoor,"clean_room, ice_cream_parlor, science_museum, car_interior, operating_room",31204
2460,59040,indoor,"science_museum, clean_room, museum/indoor, car_interior, operating_room",31204
2461,59064,indoor,"clean_room, ice_cream_parlor, science_museum, car_interior, operating_room",31204
2462,59088,indoor,"clean_room, car_interior, science_museum, operating_room, ice_cream_parlor",31204
2463,59112,outdoor,"junkyard, auto_factory, boat_deck, raceway, clean_room",31204
2464,59136,outdoor,"junkyard, auto_factory, raceway, boat_deck, clean_room",31204
2465,59160,outdoor,"junkyard, raceway, clean_room, auto_factory, boat_deck",31204
2466,59184,outdoor,"junkyard, auto_factory, raceway, boat_deck, assembly_line",31204
2467,59208,outdoor,"junkyard, raceway, boat_deck, auto_factory, clean_room",31204
2468,59232,indoor,"junkyard, car_interior, auto_factory, assembly_line, clean_room",31204
2469,59256,indoor,"junkyard, auto_factory, car_interior, auto_showroom, assembly_line",31204
2470,59280,outdoor,"ice_skating_rink/outdoor, baseball_field, racecourse, football_field, runway",31204
2471,59304,outdoor,"baseball_field, ice_skating_rink/outdoor, racecourse, runway, football_field",31204
2472,59328,outdoor,"racecourse, baseball_field, football_field, runway, raceway",31204
2473,59352,outdoor,"racecourse, baseball_field, runway, raceway, football_field",31204
2474,59376,outdoor,"racecourse, baseball_field, runway, ice_skating_rink/outdoor, football_field",31204
2475,59400,outdoor,"runway, racecourse, baseball_field, ice_skating_rink/outdoor, ice_floe",31204
2476,59424,outdoor,"runway, baseball_field, promenade, racecourse, landing_deck",31204
2477,59448,outdoor,"runway, landing_deck, racecourse, airfield, baseball_field",31204
2478,59472,outdoor,"runway, promenade, baseball_field, racecourse, ice_skating_rink/outdoor",31204
2479,59496,outdoor,"runway, racecourse, promenade, landing_deck, baseball_field",31204
2480,59520,outdoor,"racecourse, runway, baseball_field, corral, arena/rodeo",31204
2481,59544,outdoor,"racecourse, ice_skating_rink/outdoor, runway, baseball_field, ice_floe",31204
2482,59568,outdoor,"volleyball_court/outdoor, kennel/outdoor, corral, rice_paddy, baseball_field",31204
2483,59592,outdoor,"volleyball_court/outdoor, baseball_field, stadium/baseball, soccer_field, athletic_field/outdoor",31204
2484,59616,outdoor,"volleyball_court/outdoor, kennel/outdoor, industrial_area, baseball_field, beach_house",31204
2485,59640,outdoor,"volleyball_court/outdoor, baseball_field, boxing_ring, playground, boardwalk",31204
2486,59664,outdoor,"volleyball_court/outdoor, playground, baseball_field, boxing_ring, corral",31204
2487,59688,outdoor,"baseball_field, volleyball_court/outdoor, schoolhouse, stadium/baseball, archive",31204
2488,59712,outdoor,"stadium/baseball, boxing_ring, baseball_field, clean_room, volleyball_court/outdoor",31204
2489,59736,outdoor,"stadium/baseball, volleyball_court/outdoor, baseball_field, boxing_ring, supermarket",31204
2490,59760,outdoor,"stadium/baseball, clean_room, baseball_field, volleyball_court/outdoor, assembly_line",31204
2491,59784,indoor,"stadium/baseball, clean_room, boxing_ring, hospital_room, assembly_line",31204
2492,59808,indoor,"stadium/baseball, clean_room, operating_room, baseball_field, hospital_room",31204
2493,59832,indoor,"stadium/baseball, clean_room, operating_room, hospital_room, pharmacy",31204
2494,59856,outdoor,"stadium/baseball, boxing_ring, volleyball_court/outdoor, clean_room, baseball_field",31204
2495,59880,indoor,"stadium/baseball, assembly_line, clean_room, hospital_room, boxing_ring",31204
2496,59904,indoor,"stadium/baseball, clean_room, chemistry_lab, hospital_room, boxing_ring",31204
2497,59928,outdoor,"stadium/baseball, clean_room, boxing_ring, volleyball_court/outdoor, baseball_field",31204
2498,59952,indoor,"stadium/baseball, clean_room, chemistry_lab, operating_room, boxing_ring",31204
2499,59976,indoor,"stadium/baseball, boxing_ring, archive, clean_room, volleyball_court/outdoor",31204
2500,60000,outdoor,"stadium/baseball, boxing_ring, baseball_field, volleyball_court/outdoor, supermarket",31204
2501,60024,outdoor,"stadium/baseball, volleyball_court/outdoor, boxing_ring, baseball_field, hospital_room",31204
2502,60048,indoor,"stadium/baseball, pharmacy, clean_room, assembly_line, supermarket",31204
2503,60072,indoor,"stadium/baseball, baseball_field, clean_room, supermarket, archive",31204
2504,60096,outdoor,"stadium/baseball, volleyball_court/outdoor, baseball_field, clean_room, boxing_ring",31204
2505,60120,indoor,"stadium/baseball, clean_room, assembly_line, chemistry_lab, operating_room",31204
2506,60144,outdoor,"stadium/baseball, boxing_ring, volleyball_court/outdoor, baseball_field, amusement_park",31204
2507,60168,indoor,"chemistry_lab, pharmacy, cafeteria, drugstore, biology_laboratory",31204
2508,60192,indoor,"assembly_line, archive, clean_room, chemistry_lab, pharmacy",31204
2509,60216,indoor,"stadium/baseball, clean_room, supermarket, volleyball_court/outdoor, pharmacy",31204
2510,60240,indoor,"stadium/baseball, clean_room, assembly_line, chemistry_lab, operating_room",31204
2511,60264,outdoor,"stadium/baseball, baseball_field, volleyball_court/outdoor, hospital_room, boxing_ring",31204
2512,60288,indoor,"stadium/baseball, clean_room, archive, pharmacy, assembly_line",31204
2513,60312,indoor,"assembly_line, stadium/baseball, clean_room, supermarket, archive",31204
2514,60336,indoor,"stadium/baseball, pharmacy, clean_room, chemistry_lab, assembly_line",31204
2515,60360,indoor,"stadium/baseball, assembly_line, baseball_field, chemistry_lab, clean_room",31204
2516,60384,outdoor,"stadium/baseball, volleyball_court/outdoor, baseball_field, boxing_ring, football_field",31204
2517,60408,outdoor,"stadium/baseball, baseball_field, volleyball_court/outdoor, boxing_ring, assembly_line",31204
2518,60432,indoor,"chemistry_lab, assembly_line, clean_room, biology_laboratory, archive",31204
2519,60456,outdoor,"lake/natural, marsh, shower, basement, beach",31204
2520,60480,indoor,"junkyard, railroad_track, car_interior, train_interior, subway_station/platform",31204
2521,60504,indoor,"car_interior, junkyard, railroad_track, ice_cream_parlor, train_interior",31204
2522,60528,indoor,"junkyard, car_interior, railroad_track, train_interior, laundromat",31204
2523,60552,indoor,"junkyard, car_interior, ice_cream_parlor, railroad_track, train_interior",31204
2524,60576,indoor,"junkyard, car_interior, auto_factory, auto_showroom, boat_deck",31204
2525,60600,indoor,"car_interior, junkyard, auto_factory, engine_room, boat_deck",31204
2526,60624,outdoor,"playground, auto_factory, junkyard, car_interior, boat_deck",31204
2527,60648,outdoor,"playground, clean_room, boat_deck, raft, car_interior",31204
2528,60672,indoor,"playground, clean_room, raft, auto_factory, gymnasium/indoor",31204
2529,60696,outdoor,"playground, runway, raft, raceway, airfield",31204
2530,60720,outdoor,"playground, raceway, railroad_track, raft, racecourse",31204
2531,60744,outdoor,"playground, raceway, racecourse, field/cultivated, sandbox",31204
2532,60768,outdoor,"playground, raceway, field/cultivated, racecourse, runway",31204
2533,60792,outdoor,"playground, raceway, runway, field/cultivated, racecourse",31204
2534,60816,outdoor,"playground, raceway, runway, racecourse, raft",31204
2535,60840,indoor,"ice_cream_parlor, botanical_garden, florist_shop/indoor, clean_room, coffee_shop",31204
2536,60864,indoor,"ice_cream_parlor, coffee_shop, botanical_garden, museum/indoor, florist_shop/indoor",31204
2537,60888,indoor,"ice_cream_parlor, coffee_shop, florist_shop/indoor, botanical_garden, museum/indoor",31204
2538,60912,outdoor,"botanical_garden, orchard, florist_shop/indoor, ice_cream_parlor, park",31204
2539,60936,indoor,"clean_room, auto_factory, assembly_line, operating_room, engine_room",31204
2540,60960,indoor,"clean_room, auto_factory, assembly_line, engine_room, operating_room",31204
2541,60984,indoor,"clean_room, auto_factory, assembly_line, operating_room, engine_room",31204
2542,61008,indoor,"clean_room, auto_factory, operating_room, assembly_line, physics_laboratory",31204
2543,61032,indoor,"clean_room, operating_room, auto_factory, assembly_line, hospital_room",31204
2544,61056,indoor,"clean_room, operating_room, hospital_room, ice_cream_parlor, assembly_line",31204
2545,61080,indoor,"clean_room, operating_room, hospital_room, assembly_line, chemistry_lab",31204
2546,61104,indoor,"clean_room, operating_room, ice_cream_parlor, hospital_room, assembly_line",31204
2547,61128,indoor,"clean_room, operating_room, ice_cream_parlor, assembly_line, hospital_room",31204
2548,61152,indoor,"clean_room, operating_room, hospital_room, ice_cream_parlor, chemistry_lab",31204
2549,61176,indoor,"clean_room, operating_room, ice_cream_parlor, chemistry_lab, hospital_room",31204
2550,61200,indoor,"clean_room, operating_room, chemistry_lab, ice_cream_parlor, biology_laboratory",31204
2551,61224,indoor,"clean_room, operating_room, assembly_line, auto_factory, ice_cream_parlor",31204
2552,61248,indoor,"clean_room, auto_factory, assembly_line, operating_room, engine_room",31204
2553,61272,indoor,"clean_room, auto_factory, assembly_line, operating_room, television_studio",31204
2554,61296,indoor,"clean_room, auto_factory, assembly_line, physics_laboratory, engine_room",31204
2555,61320,indoor,"clean_room, auto_factory, assembly_line, engine_room, operating_room",31204
2556,61344,indoor,"clean_room, auto_factory, assembly_line, playground, science_museum",31204
2557,61368,indoor,"clean_room, playground, auto_factory, engine_room, operating_room",31204
2558,61392,indoor,"shower, dressing_room, chemistry_lab, music_studio, clean_room",31204
2559,61416,indoor,"shower, chemistry_lab, dressing_room, music_studio, beauty_salon",31204
2560,61440,indoor,"shower, dressing_room, music_studio, chemistry_lab, discotheque",31204
2561,61464,indoor,"dressing_room, chemistry_lab, discotheque, shower, clean_room",31204
2562,61488,indoor,"dressing_room, shower, discotheque, music_studio, chemistry_lab",31204
2563,61512,indoor,"shower, dressing_room, discotheque, music_studio, beauty_salon",31204
2564,61536,indoor,"shower, dressing_room, chemistry_lab, discotheque, music_studio",31204
2565,61560,indoor,"shower, music_studio, dressing_room, chemistry_lab, discotheque",31204
2566,61584,indoor,"dressing_room, discotheque, shower, music_studio, chemistry_lab",31204
2567,61608,indoor,"shower, discotheque, chemistry_lab, music_studio, dressing_room",31204
2568,61632,indoor,"shower, discotheque, dressing_room, chemistry_lab, music_studio",31204
2569,61656,indoor,"clean_room, car_interior, operating_room, ice_cream_parlor, nursing_home",31204
2570,61680,indoor,"clean_room, car_interior, operating_room, ice_cream_parlor, clothing_store",31204
2571,61704,indoor,"clean_room, car_interior, operating_room, nursing_home, clothing_store",31204
2572,61728,indoor,"clean_room, operating_room, car_interior, nursing_home, ice_cream_parlor",31204
2573,61752,indoor,"clean_room, operating_room, nursing_home, car_interior, ice_cream_parlor",31204
2574,61776,indoor,"clean_room, car_interior, operating_room, nursing_home, ice_cream_parlor",31204
2575,61800,indoor,"clean_room, car_interior, nursing_home, operating_room, clothing_store",31204
2576,61824,indoor,"clean_room, nursing_home, operating_room, car_interior, ice_cream_parlor",31204
2577,61848,indoor,"clean_room, nursing_home, car_interior, operating_room, clothing_store",31204
2578,61872,indoor,"clean_room, car_interior, ice_cream_parlor, nursing_home, operating_room",31204
2579,61896,indoor,"clean_room, dressing_room, chemistry_lab, discotheque, shower",31204
2580,61920,indoor,"clean_room, dressing_room, shower, chemistry_lab, discotheque",31204
2581,61944,indoor,"dressing_room, discotheque, music_studio, shower, clean_room",31204
2582,61968,indoor,"airplane_cabin, clean_room, car_interior, laundromat, ice_cream_parlor",31204
2583,61992,indoor,"airplane_cabin, clean_room, car_interior, laundromat, ice_cream_parlor",31204
2584,62016,indoor,"airplane_cabin, clean_room, car_interior, laundromat, beauty_salon",31204
2585,62040,indoor,"airplane_cabin, clean_room, car_interior, laundromat, beauty_salon",31204
2586,62064,indoor,"airplane_cabin, clean_room, car_interior, laundromat, escalator/indoor",31204
2587,62088,indoor,"airplane_cabin, clean_room, car_interior, laundromat, beauty_salon",31204
2588,62112,indoor,"airplane_cabin, car_interior, clean_room, laundromat, bank_vault",31204
2589,62136,indoor,"airplane_cabin, clean_room, car_interior, laundromat, beauty_salon",31204
2590,62160,indoor,"clean_room, shower, dressing_room, ice_shelf, music_studio",31204
2591,62184,indoor,"shower, clean_room, dressing_room, music_studio, chemistry_lab",31204
2592,62208,indoor,"shower, music_studio, clean_room, chemistry_lab, dressing_room",31204
2593,62232,indoor,"shower, clean_room, music_studio, chemistry_lab, dressing_room",31204
2594,62256,indoor,"car_interior, airplane_cabin, clean_room, laundromat, beauty_salon",31204
2595,62280,indoor,"car_interior, airplane_cabin, clean_room, laundromat, beauty_salon",31204
2596,62304,indoor,"car_interior, airplane_cabin, clean_room, laundromat, ice_cream_parlor",31204
2597,62328,indoor,"car_interior, airplane_cabin, clean_room, laundromat, ice_cream_parlor",31204
2598,62352,indoor,"shower, music_studio, dressing_room, beauty_salon, chemistry_lab",31204
2599,62376,indoor,"shower, music_studio, chemistry_lab, dressing_room, museum/indoor",31204
2600,62400,indoor,"shower, dressing_room, music_studio, discotheque, clean_room",31204
2601,62424,indoor,"clean_room, dressing_room, shower, museum/indoor, chemistry_lab",31204
2602,62448,indoor,"ice_cream_parlor, coffee_shop, orchard, botanical_garden, florist_shop/indoor",31204
2603,62472,outdoor,"ice_cream_parlor, orchard, coffee_shop, botanical_garden, desert/sand",31204
2604,62496,indoor,"ice_cream_parlor, orchard, botanical_garden, florist_shop/indoor, coffee_shop",31204
