,frame_num,environment,places,imdb_id
1153,27672,indoor,"discotheque, clean_room, airport_terminal, locker_room, stage/indoor",31204
1154,27696,indoor,"discotheque, stage/indoor, art_gallery, natural_history_museum, airport_terminal",31204
1155,27720,indoor,"discotheque, stage/indoor, shower, art_gallery, museum/indoor",31204
1156,27744,indoor,"music_studio, dressing_room, stage/indoor, discotheque, television_studio",31204
1157,27768,indoor,"music_studio, stage/indoor, discotheque, dressing_room, television_studio",31204
1158,27792,indoor,"stage/indoor, music_studio, dressing_room, discotheque, clean_room",31204
1159,27816,indoor,"dressing_room, stage/indoor, music_studio, discotheque, clean_room",31204
1160,27840,indoor,"dressing_room, music_studio, stage/indoor, discotheque, clean_room",31204
1161,27864,indoor,"music_studio, dressing_room, discotheque, stage/indoor, clean_room",31204
1162,27888,indoor,"dressing_room, music_studio, clean_room, stage/indoor, discotheque",31204
1163,27912,indoor,"discotheque, stage/indoor, music_studio, arena/performance, chemistry_lab",31204
1164,27936,indoor,"discotheque, stage/indoor, escalator/indoor, airport_terminal, airplane_cabin",31204
1165,27960,indoor,"discotheque, stage/indoor, escalator/indoor, elevator_shaft, shower",31204
1166,27984,indoor,"discotheque, stage/indoor, shower, clean_room, chemistry_lab",31204
1167,28008,indoor,"clean_room, dressing_room, music_studio, stage/indoor, chemistry_lab",31204
1168,28032,indoor,"music_studio, stage/indoor, dressing_room, discotheque, clean_room",31204
1169,28056,indoor,"music_studio, stage/indoor, dressing_room, discotheque, clean_room",31204
1170,28080,indoor,"music_studio, stage/indoor, discotheque, dressing_room, clean_room",31204
1171,28104,indoor,"music_studio, stage/indoor, discotheque, dressing_room, clean_room",31204
1172,28128,indoor,"music_studio, stage/indoor, discotheque, dressing_room, clean_room",31204
1173,28152,outdoor,"iceberg, sky, ice_floe, wind_farm, ocean",31204
1174,28176,outdoor,"sky, iceberg, ocean, wind_farm, runway",31204
1175,28200,outdoor,"iceberg, sky, ocean, lake/natural, ice_floe",31204
1176,28224,outdoor,"wind_farm, sky, hangar/indoor, runway, marsh",31204
1177,28248,outdoor,"runway, hangar/indoor, wind_farm, airfield, sky",31204
1178,28272,outdoor,"shower, wind_farm, glacier, sky, mountain_snowy",31204
1179,28296,outdoor,"shower, sky, wind_farm, water_tower, tower",31204
1180,28320,outdoor,"shower, sky, bathroom, igloo, ice_floe",31204
1181,28344,outdoor,"shower, igloo, snowfield, bathroom, sky",31204
1182,28368,indoor,"museum/indoor, stage/indoor, natural_history_museum, art_gallery, science_museum",31204
1183,28392,indoor,"discotheque, stage/indoor, chemistry_lab, music_studio, clean_room",31204
1184,28416,indoor,"stage/indoor, discotheque, museum/indoor, toyshop, music_studio",31204
1185,28440,indoor,"stage/indoor, museum/indoor, art_gallery, discotheque, clean_room",31204
1186,28464,indoor,"museum/indoor, stage/indoor, discotheque, art_gallery, playroom",31204
1187,28488,indoor,"stage/indoor, museum/indoor, discotheque, archive, toyshop",31204
1188,28512,indoor,"stage/indoor, museum/indoor, clean_room, art_gallery, archive",31204
1189,28536,indoor,"stage/indoor, discotheque, auditorium, clean_room, art_gallery",31204
1190,28560,indoor,"stage/indoor, museum/indoor, natural_history_museum, discotheque, art_gallery",31204
1191,28584,indoor,"stage/indoor, discotheque, arena/performance, music_studio, auditorium",31204
1192,28608,outdoor,"shower, sky, hot_spring, snowfield, glacier",31204
1193,28632,outdoor,"shower, sky, bathroom, hot_spring, snowfield",31204
1194,28656,indoor,"shower, sky, bathroom, elevator/door, hot_spring",31204
1195,28680,outdoor,"clean_room, discotheque, sky, igloo, tower",31204
1196,28704,outdoor,"tower, wheat_field, lighthouse, sky, discotheque",31204
1197,28728,indoor,"igloo, shower, science_museum, museum/indoor, art_gallery",31204
1198,28752,indoor,"discotheque, shower, clean_room, airport_terminal, fountain",31204
1199,28776,indoor,"corridor, shower, tower, skyscraper, clean_room",31204
1200,28800,outdoor,"tower, mosque/outdoor, skyscraper, sky, wheat_field",31204
1201,28824,indoor,"clean_room, chemistry_lab, shower, discotheque, stage/indoor",31204
1202,28848,outdoor,"sky, shower, hot_spring, snowfield, igloo",31204
1203,28872,outdoor,"sky, hot_spring, ice_shelf, volcano, waterfall",31204
1204,28896,outdoor,"arch, rock_arch, sky, igloo, viaduct",31204
1205,28920,indoor,"discotheque, escalator/indoor, stage/indoor, airport_terminal, elevator_shaft",31204
1206,28944,indoor,"discotheque, escalator/indoor, stage/indoor, airplane_cabin, airport_terminal",31204
1207,28968,indoor,"discotheque, stage/indoor, escalator/indoor, music_studio, ballroom",31204
1208,28992,outdoor,"sky, water_tower, wind_farm, lighthouse, tower",31204
1209,29016,outdoor,"sky, hot_spring, ocean, shower, ice_floe",31204
1210,29040,outdoor,"igloo, shower, sky, ice_floe, aquarium",31204
1211,29064,outdoor,"sky, ice_floe, shower, igloo, ice_shelf",31204
1212,29088,indoor,"stage/indoor, discotheque, music_studio, arena/performance, natural_history_museum",31204
1213,29112,indoor,"stage/indoor, discotheque, music_studio, arena/performance, museum/indoor",31204
1214,29136,indoor,"stage/indoor, discotheque, arena/performance, auditorium, music_studio",31204
1215,29160,indoor,"stage/indoor, discotheque, auditorium, music_studio, museum/indoor",31204
1216,29184,indoor,"discotheque, stage/indoor, arena/performance, museum/indoor, auditorium",31204
1217,29208,outdoor,"shower, hot_spring, sky, lake/natural, ice_shelf",31204
1218,29232,outdoor,"sky, shower, hot_spring, ice_shelf, water_tower",31204
1219,29256,outdoor,"sky, shower, hot_spring, lighthouse, lake/natural",31204
1220,29280,indoor,"discotheque, clean_room, stage/indoor, chemistry_lab, bowling_alley",31204
1221,29304,indoor,"dressing_room, clean_room, basement, discotheque, locker_room",31204
1222,29328,indoor,"clean_room, locker_room, airplane_cabin, chemistry_lab, shower",31204
1223,29352,indoor,"shower, discotheque, clean_room, museum/indoor, chemistry_lab",31204
1224,29376,indoor,"discotheque, clean_room, locker_room, chemistry_lab, stage/indoor",31204
1225,29400,indoor,"discotheque, clean_room, stage/indoor, shower, museum/indoor",31204
1226,29424,indoor,"clean_room, shower, museum/indoor, art_gallery, dressing_room",31204
1227,29448,indoor,"clean_room, operating_room, museum/indoor, archive, hospital_room",31204
1228,29472,indoor,"clean_room, operating_room, museum/indoor, archive, hospital_room",31204
1229,29496,indoor,"clean_room, museum/indoor, operating_room, archive, art_gallery",31204
1230,29520,indoor,"clean_room, museum/indoor, operating_room, archive, art_gallery",31204
1231,29544,indoor,"shower, art_gallery, museum/indoor, lake/natural, pond",31204
1232,29568,indoor,"clean_room, shower, discotheque, museum/indoor, chemistry_lab",31204
1233,29592,indoor,"clean_room, shower, museum/indoor, science_museum, discotheque",31204
1234,29616,indoor,"clean_room, museum/indoor, operating_room, hospital_room, science_museum",31204
1235,29640,indoor,"clean_room, museum/indoor, operating_room, television_studio, science_museum",31204
1236,29664,indoor,"clean_room, museum/indoor, operating_room, natural_history_museum, dressing_room",31204
1237,29688,indoor,"clean_room, museum/indoor, operating_room, science_museum, natural_history_museum",31204
1238,29712,indoor,"clean_room, museum/indoor, operating_room, archive, dressing_room",31204
1239,29736,indoor,"tower, art_gallery, science_museum, sky, museum/indoor",31204
1240,29760,indoor,"corridor, elevator_lobby, airport_terminal, sky, elevator/door",31204
1241,29784,indoor,"corridor, sky, art_gallery, tower, shower",31204
1242,29808,indoor,"shower, discotheque, clean_room, museum/indoor, art_gallery",31204
1243,29832,indoor,"shower, discotheque, clean_room, museum/indoor, bathroom",31204
1244,29856,indoor,"shower, clean_room, discotheque, basement, corridor",31204
1245,29880,indoor,"clean_room, operating_room, museum/indoor, dressing_room, hospital_room",31204
1246,29904,indoor,"clean_room, museum/indoor, operating_room, dressing_room, science_museum",31204
1247,29928,indoor,"museum/indoor, clean_room, dressing_room, operating_room, science_museum",31204
1248,29952,indoor,"clean_room, operating_room, museum/indoor, dressing_room, hospital_room",31204
1249,29976,indoor,"clean_room, museum/indoor, operating_room, dressing_room, archive",31204
1250,30000,outdoor,"sky, hot_spring, shower, water_tower, wind_farm",31204
1251,30024,outdoor,"sky, shower, hot_spring, lake/natural, pond",31204
1252,30048,outdoor,"wheat_field, sky, barndoor, desert/sand, shower",31204
1253,30072,indoor,"museum/indoor, stage/indoor, natural_history_museum, discotheque, science_museum",31204
1254,30096,indoor,"museum/indoor, stage/indoor, natural_history_museum, discotheque, science_museum",31204
1255,30120,indoor,"stage/indoor, discotheque, museum/indoor, chemistry_lab, natural_history_museum",31204
1256,30144,outdoor,"sky, hot_spring, shower, lake/natural, water_tower",31204
1257,30168,indoor,"sky, hot_spring, shower, basement, elevator/door",31204
1258,30192,indoor,"clean_room, chemistry_lab, discotheque, shower, biology_laboratory",31204
1259,30216,indoor,"clean_room, discotheque, igloo, chemistry_lab, stage/indoor",31204
1260,30240,indoor,"igloo, clean_room, discotheque, museum/indoor, burial_chamber",31204
1261,30264,indoor,"clean_room, shower, chemistry_lab, museum/indoor, discotheque",31204
1262,30288,indoor,"discotheque, tower, shower, stage/indoor, skyscraper",31204
1263,30312,indoor,"shower, discotheque, elevator_lobby, elevator/door, corridor",31204
1264,30336,indoor,"shower, sky, elevator/door, art_gallery, bathroom",31204
1265,30360,indoor,"discotheque, museum/indoor, stage/indoor, natural_history_museum, shower",31204
1266,30384,outdoor,"sky, hot_spring, shower, water_tower, tower",31204
1267,30408,outdoor,"sky, hot_spring, shower, snowfield, ocean",31204
1268,30432,outdoor,"sky, hot_spring, shower, beach, ocean",31204
1269,30456,outdoor,"sky, discotheque, tower, shower, gas_station",31204
1270,30480,indoor,"museum/indoor, shower, clean_room, igloo, arch",31204
1271,30504,outdoor,"ice_shelf, shower, iceberg, ice_floe, waterfall",31204
1272,30528,indoor,"discotheque, clean_room, science_museum, igloo, museum/indoor",31204
1273,30552,indoor,"discotheque, clean_room, science_museum, museum/indoor, chemistry_lab",31204
1274,30576,indoor,"tower, shower, sky, discotheque, museum/indoor",31204
1275,30600,indoor,"clean_room, corridor, art_gallery, museum/indoor, sky",31204
1276,30624,indoor,"shower, art_gallery, museum/indoor, clean_room, elevator/door",31204
1277,30648,indoor,"clean_room, elevator/door, discotheque, corridor, science_museum",31204
1278,30672,indoor,"elevator_shaft, clean_room, tower, corridor, elevator/door",31204
1279,30696,indoor,"museum/indoor, dressing_room, stage/indoor, clean_room, music_studio",31204
1280,30720,indoor,"museum/indoor, art_gallery, clean_room, stage/indoor, natural_history_museum",31204
1281,30744,indoor,"museum/indoor, art_gallery, clean_room, stage/indoor, dressing_room",31204
1282,30768,indoor,"museum/indoor, clean_room, art_gallery, dressing_room, stage/indoor",31204
1283,30792,indoor,"museum/indoor, dressing_room, music_studio, stage/indoor, clean_room",31204
1284,30816,indoor,"museum/indoor, dressing_room, art_gallery, clean_room, stage/indoor",31204
1285,30840,indoor,"museum/indoor, art_gallery, clean_room, natural_history_museum, stage/indoor",31204
1286,30864,indoor,"museum/indoor, dressing_room, stage/indoor, music_studio, discotheque",31204
1287,30888,indoor,"museum/indoor, dressing_room, clean_room, stage/indoor, music_studio",31204
1288,30912,indoor,"museum/indoor, clean_room, dressing_room, stage/indoor, boxing_ring",31204
1289,30936,indoor,"museum/indoor, dressing_room, clean_room, stage/indoor, discotheque",31204
1290,30960,indoor,"clean_room, operating_room, dressing_room, museum/indoor, nursing_home",31204
1291,30984,indoor,"boxing_ring, martial_arts_gym, stage/indoor, dressing_room, museum/indoor",31204
1292,31008,indoor,"boxing_ring, stage/indoor, museum/indoor, music_studio, dressing_room",31204
1293,31032,indoor,"archive, server_room, lake/natural, basement, hospital",31204
1294,31056,outdoor,"shower, wind_farm, sky, windmill, wheat_field",31204
1295,31080,outdoor,"wind_farm, shower, windmill, wheat_field, runway",31204
1296,31104,outdoor,"shower, sky, wheat_field, snowfield, hot_spring",31204
1297,31128,outdoor,"shower, wheat_field, sky, marsh, hot_spring",31204
1298,31152,indoor,"clean_room, airport_terminal, atrium/public, discotheque, elevator_lobby",31204
1299,31176,indoor,"greenhouse/outdoor, elevator/door, escalator/indoor, greenhouse/indoor, airport_terminal",31204
1300,31200,indoor,"airport_terminal, elevator_lobby, escalator/indoor, atrium/public, shopping_mall/indoor",31204
1301,31224,indoor,"airport_terminal, elevator_lobby, elevator/door, escalator/indoor, clean_room",31204
1302,31248,indoor,"discotheque, clean_room, science_museum, elevator_shaft, stage/indoor",31204
1303,31272,indoor,"bow_window/indoor, elevator_shaft, greenhouse/outdoor, shower, greenhouse/indoor",31204
1304,31296,indoor,"atrium/public, discotheque, staircase, airport_terminal, subway_station/platform",31204
1305,31320,indoor,"stage/indoor, discotheque, museum/indoor, natural_history_museum, arena/performance",31204
1306,31344,indoor,"stage/indoor, discotheque, arena/performance, natural_history_museum, museum/indoor",31204
1307,31368,indoor,"discotheque, stage/indoor, music_studio, auditorium, clean_room",31204
1308,31392,indoor,"stage/indoor, discotheque, arena/performance, museum/indoor, auditorium",31204
1309,31416,outdoor,"shower, ice_floe, snowfield, desert/sand, ice_shelf",31204
1310,31440,outdoor,"shower, water_tower, bathroom, igloo, sky",31204
1311,31464,outdoor,"shower, ice_floe, bathroom, ice_shelf, igloo",31204
1312,31488,indoor,"airport_terminal, atrium/public, elevator_lobby, corridor, escalator/indoor",31204
1313,31512,indoor,"corridor, escalator/indoor, elevator_lobby, airport_terminal, atrium/public",31204
1314,31536,indoor,"discotheque, stage/indoor, ballroom, escalator/indoor, wheat_field",31204
1315,31560,indoor,"elevator/door, escalator/indoor, airport_terminal, elevator_lobby, natural_history_museum",31204
1316,31584,outdoor,"aquarium, shower, iceberg, ice_floe, ice_shelf",31204
1317,31608,outdoor,"shower, aquarium, sky, igloo, underwater/ocean_deep",31204
1318,31632,outdoor,"sky, shower, fountain, aquarium, skyscraper",31204
1319,31656,indoor,"discotheque, stage/indoor, natural_history_museum, museum/indoor, archive",31204
1320,31680,indoor,"stage/indoor, discotheque, music_studio, auditorium, ballroom",31204
1321,31704,indoor,"stage/indoor, discotheque, music_studio, auditorium, museum/indoor",31204
1322,31728,indoor,"stage/indoor, museum/indoor, discotheque, art_gallery, airport_terminal",31204
1323,31752,indoor,"discotheque, wheat_field, aquarium, stage/indoor, elevator_shaft",31204
1324,31776,indoor,"art_gallery, ballroom, stage/indoor, museum/indoor, natural_history_museum",31204
1325,31800,outdoor,"sky, hot_spring, ice_floe, igloo, fountain",31204
1326,31824,outdoor,"sky, igloo, ice_floe, shower, hot_spring",31204
1327,31848,outdoor,"shower, sky, igloo, ice_floe, ice_shelf",31204
1328,31872,indoor,"shower, igloo, aquarium, catacomb, ice_floe",31204
1329,31896,indoor,"shower, sky, aquarium, pond, bathroom",31204
1330,31920,outdoor,"shower, sky, pond, aquarium, lake/natural",31204
1331,31944,outdoor,"shower, sky, ice_floe, lake/natural, pond",31204
1332,31968,outdoor,"sky, shower, ice_floe, hot_spring, lake/natural",31204
1333,31992,indoor,"discotheque, stage/indoor, museum/indoor, art_gallery, clean_room",31204
1334,32016,outdoor,"sky, art_gallery, wind_farm, wheat_field, hot_spring",31204
1335,32040,outdoor,"sky, valley, mountain, desert/sand, glacier",31204
1336,32064,indoor,"greenhouse/indoor, greenhouse/outdoor, atrium/public, florist_shop/indoor, airport_terminal",31204
1337,32088,outdoor,"iceberg, ice_floe, igloo, ice_shelf, glacier",31204
1338,32112,outdoor,"iceberg, ice_floe, pond, lake/natural, igloo",31204
1339,32136,outdoor,"sky, water_tower, tower, shower, skyscraper",31204
1340,32160,outdoor,"fountain, tower, mosque/outdoor, amusement_park, bridge",31204
1341,32184,indoor,"ice_shelf, iceberg, museum/indoor, natural_history_museum, chemistry_lab",31204
1342,32208,outdoor,"tower, skyscraper, discotheque, sky, stage/indoor",31204
1343,32232,outdoor,"tower, skyscraper, mosque/outdoor, lighthouse, sky",31204
1344,32256,outdoor,"tower, skyscraper, sky, lighthouse, mosque/outdoor",31204
1345,32280,outdoor,"tower, skyscraper, mosque/outdoor, sky, office_building",31204
1346,32304,outdoor,"shower, sky, barndoor, wheat_field, art_gallery",31204
1347,32328,outdoor,"sky, wheat_field, shower, field/wild, hot_spring",31204
1348,32352,indoor,"discotheque, stage/indoor, clean_room, chemistry_lab, classroom",31204
1349,32376,indoor,"museum/indoor, stage/indoor, clean_room, music_studio, television_studio",31204
1350,32400,indoor,"museum/indoor, television_studio, stage/indoor, music_studio, archive",31204
1351,32424,indoor,"museum/indoor, clean_room, television_studio, operating_room, stage/indoor",31204
1352,32448,indoor,"museum/indoor, clean_room, television_studio, music_studio, stage/indoor",31204
1353,32472,indoor,"museum/indoor, television_studio, stage/indoor, clean_room, music_studio",31204
1354,32496,indoor,"museum/indoor, clean_room, television_studio, stage/indoor, archive",31204
1355,32520,indoor,"museum/indoor, clean_room, television_studio, stage/indoor, music_studio",31204
1356,32544,indoor,"museum/indoor, clean_room, television_studio, archive, stage/indoor",31204
1357,32568,indoor,"museum/indoor, clean_room, television_studio, stage/indoor, music_studio",31204
1358,32592,indoor,"shower, bathroom, runway, skyscraper, bank_vault",31204
1359,32616,indoor,"shower, basement, art_gallery, skyscraper, bathroom",31204
1360,32640,indoor,"shower, basement, art_gallery, skyscraper, bathroom",31204
1361,32664,indoor,"clean_room, corridor, elevator/door, elevator_lobby, locker_room",31204
1362,32688,indoor,"clean_room, chemistry_lab, tower, science_museum, skyscraper",31204
1363,32712,indoor,"clean_room, museum/indoor, art_gallery, shower, science_museum",31204
1364,32736,indoor,"clean_room, shower, science_museum, museum/indoor, locker_room",31204
1365,32760,indoor,"clean_room, shower, art_gallery, museum/indoor, science_museum",31204
1366,32784,indoor,"clean_room, shower, art_gallery, elevator/door, chemistry_lab",31204
1367,32808,indoor,"museum/indoor, clean_room, television_studio, operating_room, archive",31204
1368,32832,indoor,"clean_room, dressing_room, locker_room, operating_room, museum/indoor",31204
1369,32856,indoor,"museum/indoor, dressing_room, clean_room, stage/indoor, discotheque",31204
1370,32880,indoor,"clean_room, dressing_room, hospital_room, music_studio, nursing_home",31204
1371,32904,indoor,"clean_room, dressing_room, hospital_room, music_studio, stage/indoor",31204
1372,32928,indoor,"dressing_room, clean_room, music_studio, hospital_room, stage/indoor",31204
1373,32952,indoor,"clean_room, dressing_room, hospital_room, music_studio, stage/indoor",31204
1374,32976,indoor,"dressing_room, clean_room, music_studio, hospital_room, stage/indoor",31204
1375,33000,indoor,"sky, shower, hot_spring, elevator/door, bathroom",31204
1376,33024,outdoor,"sky, shower, hot_spring, water_tower, tower",31204
1377,33048,indoor,"sky, shower, hot_spring, elevator/door, basement",31204
1378,33072,indoor,"clean_room, elevator/door, elevator_lobby, locker_room, airport_terminal",31204
1379,33096,indoor,"clean_room, museum/indoor, shower, science_museum, art_gallery",31204
1380,33120,indoor,"discotheque, clean_room, chemistry_lab, museum/indoor, stage/indoor",31204
1381,33144,indoor,"clean_room, museum/indoor, chemistry_lab, science_museum, shower",31204
1382,33168,indoor,"clean_room, museum/indoor, shower, art_gallery, archive",31204
1383,33192,indoor,"clean_room, museum/indoor, art_gallery, science_museum, clothing_store",31204
1384,33216,indoor,"clean_room, museum/indoor, archive, music_studio, science_museum",31204
1385,33240,indoor,"clean_room, museum/indoor, art_gallery, science_museum, archive",31204
1386,33264,indoor,"clean_room, archive, operating_room, museum/indoor, physics_laboratory",31204
1387,33288,indoor,"clean_room, museum/indoor, archive, art_gallery, martial_arts_gym",31204
1388,33312,indoor,"clean_room, archive, operating_room, museum/indoor, martial_arts_gym",31204
1389,33336,indoor,"shower, bow_window/indoor, subway_station/platform, ice_shelf, bowling_alley",31204
1390,33360,indoor,"clean_room, shower, art_gallery, ice_floe, museum/indoor",31204
1391,33384,indoor,"museum/indoor, clean_room, boxing_ring, lecture_room, stage/indoor",31204
1392,33408,indoor,"clean_room, museum/indoor, art_gallery, shower, wind_farm",31204
1393,33432,indoor,"boxing_ring, stage/indoor, museum/indoor, lecture_room, ballroom",31204
1394,33456,indoor,"museum/indoor, boxing_ring, stage/indoor, art_gallery, clean_room",31204
1395,33480,indoor,"museum/indoor, boxing_ring, stage/indoor, art_gallery, clean_room",31204
1396,33504,indoor,"museum/indoor, stage/indoor, art_gallery, music_studio, boxing_ring",31204
1397,33528,indoor,"museum/indoor, art_gallery, clean_room, dressing_room, science_museum",31204
1398,33552,indoor,"museum/indoor, dressing_room, art_gallery, science_museum, clean_room",31204
1399,33576,indoor,"museum/indoor, art_gallery, dressing_room, science_museum, clean_room",31204
1400,33600,indoor,"museum/indoor, art_gallery, dressing_room, clean_room, science_museum",31204
1401,33624,indoor,"museum/indoor, art_gallery, dressing_room, science_museum, art_studio",31204
1402,33648,indoor,"museum/indoor, art_gallery, dressing_room, science_museum, natural_history_museum",31204
1403,33672,indoor,"museum/indoor, art_gallery, dressing_room, science_museum, clean_room",31204
1404,33696,indoor,"museum/indoor, art_gallery, clean_room, dressing_room, operating_room",31204
1405,33720,indoor,"museum/indoor, dressing_room, art_gallery, clean_room, boxing_ring",31204
1406,33744,indoor,"shower, basement, art_gallery, bathroom, jail_cell",31204
1407,33768,indoor,"shower, bathroom, ice_shelf, art_gallery, bank_vault",31204
1408,33792,outdoor,"wind_farm, shower, sky, windmill, hot_spring",31204
1409,33816,indoor,"shower, clean_room, dressing_room, chemistry_lab, art_gallery",31204
1410,33840,indoor,"locker_room, shower, clean_room, corridor, elevator/door",31204
1411,33864,indoor,"shower, clean_room, science_museum, art_gallery, museum/indoor",31204
1412,33888,indoor,"museum/indoor, stage/indoor, locker_room, clean_room, dressing_room",31204
1413,33912,indoor,"tower, discotheque, skyscraper, science_museum, elevator/door",31204
1414,33936,outdoor,"tower, elevator/door, elevator_lobby, sky, skyscraper",31204
1415,33960,outdoor,"sky, shower, wind_farm, water_tower, tower",31204
1416,33984,outdoor,"sky, shower, hot_spring, wind_farm, water_tower",31204
1417,34008,outdoor,"sky, hot_spring, shower, ice_floe, iceberg",31204
1418,34032,outdoor,"sky, iceberg, ice_shelf, ice_floe, igloo",31204
1419,34056,indoor,"clean_room, operating_room, dressing_room, archive, museum/indoor",31204
1420,34080,indoor,"clean_room, dressing_room, martial_arts_gym, locker_room, archive",31204
1421,34104,indoor,"clean_room, museum/indoor, operating_room, television_studio, dressing_room",31204
1422,34128,indoor,"clean_room, museum/indoor, operating_room, television_studio, archive",31204
1423,34152,indoor,"clean_room, museum/indoor, archive, art_gallery, operating_room",31204
1424,34176,indoor,"clean_room, museum/indoor, television_studio, archive, dressing_room",31204
1425,34200,indoor,"museum/indoor, clean_room, dressing_room, archive, art_gallery",31204
1426,34224,indoor,"clean_room, museum/indoor, archive, dressing_room, physics_laboratory",31204
1427,34248,indoor,"clean_room, museum/indoor, television_studio, physics_laboratory, dressing_room",31204
1428,34272,indoor,"clean_room, museum/indoor, dressing_room, archive, art_gallery",31204
1429,34296,indoor,"clean_room, museum/indoor, dressing_room, operating_room, physics_laboratory",31204
1430,34320,indoor,"clean_room, museum/indoor, dressing_room, operating_room, television_studio",31204
1431,34344,indoor,"clean_room, dressing_room, martial_arts_gym, locker_room, operating_room",31204
1432,34368,indoor,"clean_room, locker_room, martial_arts_gym, operating_room, music_studio",31204
1433,34392,indoor,"archive, martial_arts_gym, museum/indoor, clean_room, library/indoor",31204
1434,34416,indoor,"clean_room, locker_room, dressing_room, archive, museum/indoor",31204
1435,34440,indoor,"clean_room, entrance_hall, lobby, locker_room, dressing_room",31204
1436,34464,outdoor,"mosque/outdoor, tower, oast_house, wheat_field, skyscraper",31204
1437,34488,indoor,"discotheque, airport_terminal, elevator/door, elevator_lobby, escalator/indoor",31204
1438,34512,outdoor,"escalator/indoor, tower, oast_house, airport_terminal, skyscraper",31204
1439,34536,indoor,"escalator/indoor, discotheque, airport_terminal, stage/indoor, elevator_lobby",31204
1440,34560,indoor,"clean_room, museum/indoor, dressing_room, art_gallery, nursery",31204
1441,34584,indoor,"clean_room, museum/indoor, art_gallery, dressing_room, nursery",31204
1442,34608,indoor,"museum/indoor, clean_room, art_gallery, dressing_room, archive",31204
1443,34632,indoor,"museum/indoor, art_gallery, dressing_room, clean_room, locker_room",31204
1444,34656,indoor,"museum/indoor, dressing_room, art_gallery, nursery, clean_room",31204
1445,34680,indoor,"museum/indoor, dressing_room, clean_room, art_gallery, nursery",31204
