,frame_num,environment,places,imdb_id
3179,76296,indoor,"discotheque, orchard, bar, sky, stage/indoor",31204
3180,76320,outdoor,"orchard, playground, corral, sandbox, yard",31204
3181,76344,outdoor,"picnic_area, orchard, park, snowfield, yard",31204
3182,76368,outdoor,"snowfield, orchard, sandbox, ski_slope, picnic_area",31204
3183,76392,outdoor,"orchard, snowfield, sandbox, ski_slope, igloo",31204
3184,76416,outdoor,"corral, snowfield, ski_slope, orchard, igloo",31204
3185,76440,outdoor,"snowfield, ski_slope, orchard, igloo, forest_path",31204
3186,76464,outdoor,"airfield, ski_slope, sky, hangar/indoor, snowfield",31204
3187,76488,outdoor,"ski_slope, airfield, sky, hangar/indoor, snowfield",31204
3188,76512,outdoor,"airfield, hangar/indoor, sky, army_base, ski_slope",31204
3189,76536,outdoor,"corral, pasture, tree_farm, ski_slope, racecourse",31204
3190,76560,outdoor,"ski_slope, tree_farm, orchard, corral, snowfield",31204
3191,76584,outdoor,"corral, pasture, tree_farm, ski_slope, orchard",31204
3192,76608,outdoor,"pasture, field/wild, yard, wheat_field, lawn",31204
3193,76632,outdoor,"rice_paddy, corral, wheat_field, farm, stable",31204
3194,76656,outdoor,"ice_shelf, lake/natural, pond, iceberg, wheat_field",31204
3195,76680,outdoor,"soccer_field, tree_farm, rice_paddy, wheat_field, golf_course",31204
3196,76704,outdoor,"baseball_field, golf_course, rice_paddy, field/cultivated, cemetery",31204
3197,76728,outdoor,"wheat_field, rice_paddy, pasture, corral, shower",31204
3198,76752,outdoor,"campsite, orchard, ice_shelf, wheat_field, schoolhouse",31204
3199,76776,indoor,"ice_shelf, museum/indoor, iceberg, clothing_store, dressing_room",31204
3200,76800,outdoor,"schoolhouse, museum/indoor, orchard, racecourse, volleyball_court/outdoor",31204
3201,76824,outdoor,"schoolhouse, orchard, museum/indoor, volleyball_court/outdoor, playground",31204
3202,76848,outdoor,"schoolhouse, orchard, campsite, volleyball_court/outdoor, museum/indoor",31204
3203,76872,indoor,"schoolhouse, museum/indoor, stage/indoor, dressing_room, campsite",31204
3204,76896,outdoor,"pasture, tree_farm, farm, corral, yard",31204
3205,76920,outdoor,"pasture, tree_farm, field/wild, farm, corral",31204
3206,76944,outdoor,"pasture, tree_farm, field/wild, corral, farm",31204
3207,76968,outdoor,"pasture, tree_farm, farm, field/wild, corral",31204
3208,76992,outdoor,"volcano, sky, wheat_field, tree_farm, field/wild",31204
3209,77016,outdoor,"sky, ski_slope, wheat_field, amusement_park, stage/indoor",31204
3210,77040,outdoor,"sky, shower, amusement_park, tower, stage/indoor",31204
3211,77064,outdoor,"amusement_park, sky, tower, pagoda, palace",31204
3212,77088,outdoor,"sky, tower, shower, amusement_park, water_tower",31204
3213,77112,outdoor,"airfield, ski_slope, sky, hangar/indoor, hangar/outdoor",31204
3214,77136,outdoor,"airfield, ski_slope, sky, hangar/indoor, hangar/outdoor",31204
3215,77160,outdoor,"shower, bridge, balcony/interior, clean_room, lake/natural",31204
3216,77184,outdoor,"bridge, museum/indoor, boat_deck, wind_farm, airport_terminal",31204
3217,77208,outdoor,"runway, bridge, wind_farm, clean_room, ice_floe",31204
3218,77232,indoor,"shower, clean_room, museum/indoor, hospital_room, natural_history_museum",31204
3219,77256,indoor,"natural_history_museum, museum/indoor, art_gallery, science_museum, airport_terminal",31204
3220,77280,outdoor,"runway, shower, airfield, landing_deck, bathroom",31204
3221,77304,outdoor,"runway, landing_deck, airfield, shower, ice_floe",31204
3222,77328,outdoor,"runway, ice_floe, airfield, landing_deck, shower",31204
3223,77352,outdoor,"runway, hangar/outdoor, airfield, landing_deck, shower",31204
3224,77376,indoor,"clean_room, bank_vault, locker_room, shower, elevator/door",31204
3225,77400,indoor,"shower, clean_room, bathroom, elevator/door, bank_vault",31204
3226,77424,indoor,"shower, clean_room, bathroom, sauna, airplane_cabin",31204
3227,77448,indoor,"clean_room, shower, airplane_cabin, airport_terminal, bathroom",31204
3228,77472,outdoor,"airfield, army_base, runway, ski_slope, heliport",31204
3229,77496,outdoor,"airfield, sky, hangar/outdoor, runway, heliport",31204
3230,77520,outdoor,"airfield, sky, army_base, hangar/indoor, heliport",31204
3231,77544,indoor,"dressing_room, museum/indoor, stage/indoor, discotheque, archive",31204
3232,77568,indoor,"museum/indoor, archive, stage/indoor, dressing_room, schoolhouse",31204
3233,77592,indoor,"dressing_room, museum/indoor, stage/indoor, discotheque, archive",31204
3234,77616,indoor,"museum/indoor, dressing_room, archive, stage/indoor, schoolhouse",31204
3235,77640,indoor,"museum/indoor, dressing_room, archive, schoolhouse, stage/indoor",31204
3236,77664,indoor,"museum/indoor, dressing_room, archive, stage/indoor, discotheque",31204
3237,77688,indoor,"museum/indoor, dressing_room, stage/indoor, archive, music_studio",31204
3238,77712,indoor,"museum/indoor, dressing_room, stage/indoor, archive, discotheque",31204
3239,77736,indoor,"museum/indoor, dressing_room, stage/indoor, schoolhouse, archive",31204
3240,77760,outdoor,"ski_slope, snowfield, airfield, mountain_snowy, sky",31204
3241,77784,outdoor,"sky, airfield, hangar/indoor, hangar/outdoor, elevator/door",31204
3242,77808,outdoor,"sky, ice_floe, snowfield, ice_shelf, wheat_field",31204
3243,77832,outdoor,"sky, airfield, runway, ice_floe, underwater/ocean_deep",31204
3244,77856,outdoor,"runway, airfield, landing_deck, hangar/outdoor, shower",31204
3245,77880,outdoor,"runway, landing_deck, airfield, hangar/outdoor, ice_floe",31204
3246,77904,outdoor,"runway, shower, landing_deck, bathroom, airfield",31204
3247,77928,indoor,"shower, bathroom, runway, bank_vault, airfield",31204
3248,77952,indoor,"science_museum, museum/indoor, clean_room, natural_history_museum, art_gallery",31204
3249,77976,indoor,"airport_terminal, clean_room, museum/indoor, arch, airplane_cabin",31204
3250,78000,indoor,"airport_terminal, museum/indoor, clean_room, office_cubicles, airplane_cabin",31204
3251,78024,indoor,"clean_room, airport_terminal, museum/indoor, stable, archive",31204
3252,78048,indoor,"clean_room, museum/indoor, airport_terminal, stage/indoor, science_museum",31204
3253,78072,indoor,"clean_room, airport_terminal, office_cubicles, laundromat, bowling_alley",31204
3254,78096,outdoor,"ice_shelf, tree_farm, snowfield, forest/broadleaf, mountain_snowy",31204
3255,78120,outdoor,"forest/broadleaf, ice_shelf, tree_farm, mountain_snowy, schoolhouse",31204
3256,78144,outdoor,"tree_farm, forest/broadleaf, orchard, mountain_snowy, snowfield",31204
3257,78168,outdoor,"forest/broadleaf, tree_farm, ice_shelf, mountain_snowy, snowfield",31204
3258,78192,outdoor,"forest/broadleaf, orchard, tree_farm, ice_shelf, mountain_snowy",31204
3259,78216,indoor,"clean_room, museum/indoor, elevator_lobby, locker_room, jewelry_shop",31204
3260,78240,indoor,"clean_room, museum/indoor, corridor, art_gallery, elevator_lobby",31204
3261,78264,indoor,"dressing_room, clean_room, archive, museum/indoor, physics_laboratory",31204
3262,78288,indoor,"dressing_room, clean_room, archive, beauty_salon, physics_laboratory",31204
3263,78312,indoor,"dressing_room, clean_room, operating_room, beauty_salon, archive",31204
3264,78336,indoor,"dressing_room, clean_room, beauty_salon, physics_laboratory, museum/indoor",31204
3265,78360,indoor,"dressing_room, clean_room, beauty_salon, physics_laboratory, museum/indoor",31204
3266,78384,indoor,"dressing_room, clean_room, beauty_salon, operating_room, physics_laboratory",31204
3267,78408,indoor,"dressing_room, clean_room, beauty_salon, physics_laboratory, operating_room",31204
3268,78432,indoor,"clean_room, natural_history_museum, archive, museum/indoor, airport_terminal",31204
3269,78456,indoor,"clean_room, natural_history_museum, museum/indoor, science_museum, shower",31204
3270,78480,indoor,"clean_room, museum/indoor, stage/indoor, music_studio, shower",31204
3271,78504,indoor,"clean_room, museum/indoor, airport_terminal, music_studio, natural_history_museum",31204
3272,78528,indoor,"museum/indoor, clean_room, music_studio, stage/indoor, natural_history_museum",31204
3273,78552,indoor,"museum/indoor, stable, clean_room, bank_vault, natural_history_museum",31204
3274,78576,indoor,"stable, natural_history_museum, bank_vault, museum/indoor, clean_room",31204
3275,78600,outdoor,"tree_farm, ski_slope, pasture, snowfield, racecourse",31204
3276,78624,outdoor,"tree_farm, orchard, ski_slope, ice_floe, snowfield",31204
3277,78648,outdoor,"rice_paddy, field/wild, tree_farm, corn_field, swamp",31204
3278,78672,indoor,"natural_history_museum, bank_vault, museum/indoor, stable, art_gallery",31204
3279,78696,indoor,"natural_history_museum, museum/indoor, science_museum, clean_room, airport_terminal",31204
3280,78720,indoor,"museum/indoor, bow_window/indoor, airport_terminal, clean_room, living_room",31204
3281,78744,indoor,"dressing_room, clean_room, operating_room, physics_laboratory, beauty_salon",31204
3282,78768,indoor,"clean_room, dressing_room, operating_room, hospital_room, nursing_home",31204
3283,78792,indoor,"clean_room, dressing_room, operating_room, hospital_room, physics_laboratory",31204
3284,78816,indoor,"clean_room, hospital_room, operating_room, jail_cell, shower",31204
3285,78840,indoor,"stage/indoor, clean_room, music_studio, runway, airport_terminal",31204
3286,78864,indoor,"clean_room, operating_room, museum/indoor, airport_terminal, hospital_room",31204
3287,78888,indoor,"clean_room, shower, operating_room, natural_history_museum, bathroom",31204
3288,78912,indoor,"clean_room, dressing_room, operating_room, hospital_room, nursing_home",31204
3289,78936,indoor,"clean_room, dressing_room, operating_room, hospital_room, nursing_home",31204
3290,78960,indoor,"clean_room, dressing_room, operating_room, hospital_room, beauty_salon",31204
3291,78984,indoor,"clean_room, dressing_room, operating_room, hospital_room, nursing_home",31204
3292,79008,indoor,"clean_room, dressing_room, operating_room, hospital_room, nursing_home",31204
3293,79032,indoor,"clean_room, dressing_room, operating_room, hospital_room, archive",31204
3294,79056,indoor,"clean_room, dressing_room, operating_room, hospital_room, archive",31204
3295,79080,indoor,"dressing_room, clean_room, operating_room, hospital_room, beauty_salon",31204
3296,79104,indoor,"clean_room, dressing_room, operating_room, hospital_room, nursing_home",31204
3297,79128,indoor,"clean_room, dressing_room, operating_room, museum/indoor, hospital_room",31204
3298,79152,outdoor,"wind_farm, shower, hangar/outdoor, sky, closet",31204
3299,79176,indoor,"shower, closet, barndoor, hangar/indoor, hangar/outdoor",31204
3300,79200,outdoor,"hangar/outdoor, closet, wind_farm, barndoor, airfield",31204
3301,79224,outdoor,"sky, ski_slope, snowfield, ice_floe, ice_shelf",31204
3302,79248,outdoor,"army_base, runway, airfield, landing_deck, fire_station",31204
3303,79272,outdoor,"industrial_area, windmill, oilrig, wind_farm, sky",31204
3304,79296,outdoor,"wind_farm, windmill, sky, wheat_field, tree_farm",31204
3305,79320,outdoor,"ice_floe, sky, ice_shelf, mountain_snowy, snowfield",31204
3306,79344,outdoor,"ice_shelf, museum/indoor, field/cultivated, ice_floe, orchard",31204
3307,79368,outdoor,"iceberg, ice_shelf, fountain, cemetery, stage/indoor",31204
3308,79392,outdoor,"ice_shelf, ice_floe, igloo, iceberg, wave",31204
3309,79416,outdoor,"ice_floe, ice_shelf, iceberg, igloo, schoolhouse",31204
3310,79440,outdoor,"schoolhouse, tree_farm, barn, chalet, mansion",31204
3311,79464,outdoor,"tree_farm, yard, residential_neighborhood, orchard, driveway",31204
3312,79488,outdoor,"yard, tree_farm, residential_neighborhood, lawn, orchard",31204
3313,79512,outdoor,"tree_farm, pasture, yard, golf_course, orchard",31204
3314,79536,outdoor,"runway, airfield, heliport, tree_farm, wind_farm",31204
3315,79560,outdoor,"tree_farm, runway, heliport, airfield, hayfield",31204
3316,79584,outdoor,"snowfield, playground, soccer_field, volleyball_court/outdoor, ski_slope",31204
3317,79608,outdoor,"ice_floe, snowfield, playground, beach, ocean",31204
3318,79632,outdoor,"ice_floe, ice_shelf, iceberg, pond, lake/natural",31204
3319,79656,outdoor,"ice_floe, ice_shelf, iceberg, snowfield, igloo",31204
3320,79680,outdoor,"ice_floe, ice_shelf, ocean, coast, snowfield",31204
3321,79704,outdoor,"museum/indoor, iceberg, stage/indoor, schoolhouse, cemetery",31204
3322,79728,outdoor,"ocean, iceberg, ice_floe, wave, ice_shelf",31204
3323,79752,outdoor,"corral, hayfield, runway, pasture, mountain_snowy",31204
3324,79776,outdoor,"corral, hayfield, mountain_snowy, runway, airfield",31204
3325,79800,outdoor,"mountain_snowy, corral, ice_shelf, snowfield, balcony/interior",31204
3326,79824,outdoor,"mountain_snowy, corral, runway, hangar/outdoor, ice_shelf",31204
3327,79848,outdoor,"mountain_snowy, heliport, ice_shelf, corral, runway",31204
3328,79872,outdoor,"mountain_snowy, ice_shelf, ice_floe, iceberg, snowfield",31204
3329,79896,outdoor,"mountain_snowy, ice_shelf, ice_floe, snowfield, iceberg",31204
3330,79920,outdoor,"ice_shelf, ice_floe, boat_deck, runway, dam",31204
3331,79944,outdoor,"campsite, runway, desert/sand, airfield, hangar/outdoor",31204
3332,79968,outdoor,"runway, campsite, boat_deck, landing_deck, heliport",31204
3333,79992,outdoor,"runway, landing_deck, boat_deck, heliport, airfield",31204
3334,80016,outdoor,"heliport, runway, boat_deck, airfield, landing_deck",31204
3335,80040,outdoor,"heliport, runway, airfield, landing_deck, hangar/outdoor",31204
3336,80064,outdoor,"runway, campsite, heliport, construction_site, hangar/outdoor",31204
3337,80088,indoor,"bathroom, airplane_cabin, shower, clean_room, laundromat",31204
3338,80112,indoor,"clean_room, shower, bathroom, dressing_room, airplane_cabin",31204
3339,80136,indoor,"clean_room, airplane_cabin, operating_room, hospital_room, car_interior",31204
3340,80160,indoor,"clean_room, operating_room, airplane_cabin, hospital_room, discotheque",31204
3341,80184,indoor,"clean_room, operating_room, martial_arts_gym, boxing_ring, gymnasium/indoor",31204
3342,80208,indoor,"clean_room, operating_room, martial_arts_gym, hospital_room, discotheque",31204
3343,80232,indoor,"clean_room, airplane_cabin, operating_room, hospital_room, dressing_room",31204
3344,80256,indoor,"clean_room, airplane_cabin, operating_room, hospital_room, biology_laboratory",31204
3345,80280,indoor,"clean_room, airplane_cabin, operating_room, beauty_salon, hospital_room",31204
3346,80304,indoor,"clean_room, operating_room, hospital_room, airplane_cabin, beauty_salon",31204
3347,80328,indoor,"clean_room, operating_room, hospital_room, airplane_cabin, dressing_room",31204
3348,80352,indoor,"clean_room, airplane_cabin, operating_room, hospital_room, biology_laboratory",31204
3349,80376,indoor,"clean_room, airplane_cabin, hospital_room, operating_room, dressing_room",31204
3350,80400,indoor,"clean_room, operating_room, airplane_cabin, hospital_room, chemistry_lab",31204
3351,80424,indoor,"clean_room, airplane_cabin, hospital_room, operating_room, biology_laboratory",31204
3352,80448,indoor,"airplane_cabin, clean_room, operating_room, hospital_room, beauty_salon",31204
3353,80472,indoor,"clean_room, beauty_salon, operating_room, hospital_room, airplane_cabin",31204
3354,80496,indoor,"clean_room, operating_room, hospital_room, beauty_salon, biology_laboratory",31204
3355,80520,indoor,"dressing_room, beauty_salon, clean_room, shower, bathroom",31204
3356,80544,indoor,"beauty_salon, dressing_room, clean_room, bathroom, operating_room",31204
3357,80568,indoor,"airplane_cabin, clean_room, bathroom, dressing_room, shower",31204
3358,80592,indoor,"shower, bathroom, airplane_cabin, dressing_room, clean_room",31204
3359,80616,indoor,"beauty_salon, shower, clean_room, dressing_room, operating_room",31204
3360,80640,indoor,"clean_room, airplane_cabin, operating_room, dressing_room, beauty_salon",31204
3361,80664,indoor,"dressing_room, shower, beauty_salon, clean_room, airplane_cabin",31204
3362,80688,indoor,"museum/indoor, locker_room, clean_room, music_studio, dressing_room",31204
3363,80712,indoor,"museum/indoor, clean_room, music_studio, dressing_room, physics_laboratory",31204
3364,80736,indoor,"museum/indoor, clean_room, locker_room, dressing_room, archive",31204
3365,80760,indoor,"museum/indoor, clean_room, locker_room, archive, dressing_room",31204
3366,80784,indoor,"museum/indoor, archive, clean_room, locker_room, music_studio",31204
3367,80808,indoor,"dressing_room, clean_room, closet, clothing_store, beauty_salon",31204
3368,80832,indoor,"dressing_room, clean_room, beauty_salon, bathroom, hospital_room",31204
3369,80856,indoor,"dressing_room, clean_room, beauty_salon, airplane_cabin, hospital_room",31204
3370,80880,indoor,"clean_room, dressing_room, bathroom, beauty_salon, hospital_room",31204
3371,80904,indoor,"dressing_room, shower, bathroom, clean_room, chemistry_lab",31204
3372,80928,indoor,"airplane_cabin, shower, dressing_room, music_studio, discotheque",31204
3373,80952,indoor,"airplane_cabin, dressing_room, clean_room, shower, beauty_salon",31204
3374,80976,indoor,"dressing_room, clean_room, discotheque, airplane_cabin, shower",31204
3375,81000,indoor,"dressing_room, airplane_cabin, bathroom, discotheque, shower",31204
3376,81024,indoor,"dressing_room, discotheque, beauty_salon, clean_room, locker_room",31204
3377,81048,indoor,"dressing_room, clean_room, discotheque, beauty_salon, airplane_cabin",31204
3378,81072,indoor,"dressing_room, airplane_cabin, clean_room, beauty_salon, shower",31204
3379,81096,indoor,"dressing_room, clean_room, airplane_cabin, beauty_salon, shower",31204
3380,81120,indoor,"museum/indoor, dressing_room, clean_room, art_gallery, stage/indoor",31204
3381,81144,indoor,"museum/indoor, stage/indoor, art_gallery, dressing_room, clean_room",31204
3382,81168,indoor,"museum/indoor, art_gallery, stage/indoor, clean_room, dressing_room",31204
3383,81192,indoor,"museum/indoor, art_gallery, stage/indoor, dressing_room, clean_room",31204
3384,81216,indoor,"museum/indoor, art_gallery, stage/indoor, dressing_room, art_studio",31204
3385,81240,indoor,"museum/indoor, art_gallery, clean_room, dressing_room, stage/indoor",31204
3386,81264,indoor,"museum/indoor, dressing_room, art_gallery, clean_room, stage/indoor",31204
3387,81288,indoor,"museum/indoor, art_gallery, stage/indoor, dressing_room, clean_room",31204
3388,81312,indoor,"clean_room, museum/indoor, dressing_room, sauna, archive",31204
3389,81336,indoor,"museum/indoor, clean_room, art_gallery, martial_arts_gym, office_cubicles",31204
3390,81360,indoor,"clean_room, museum/indoor, art_gallery, martial_arts_gym, archive",31204
3391,81384,indoor,"television_studio, museum/indoor, music_studio, science_museum, archive",31204
3392,81408,indoor,"museum/indoor, clean_room, art_gallery, martial_arts_gym, television_studio",31204
3393,81432,indoor,"museum/indoor, clean_room, art_gallery, archive, martial_arts_gym",31204
3394,81456,indoor,"clean_room, museum/indoor, operating_room, stage/indoor, art_gallery",31204
3395,81480,indoor,"museum/indoor, clean_room, stage/indoor, art_gallery, martial_arts_gym",31204
3396,81504,indoor,"museum/indoor, clean_room, martial_arts_gym, art_gallery, stage/indoor",31204
3397,81528,indoor,"museum/indoor, clean_room, martial_arts_gym, stage/indoor, music_studio",31204
3398,81552,indoor,"clean_room, museum/indoor, martial_arts_gym, art_gallery, stage/indoor",31204
3399,81576,indoor,"boxing_ring, stage/indoor, dressing_room, music_studio, museum/indoor",31204
3400,81600,indoor,"dressing_room, clean_room, operating_room, boxing_ring, stage/indoor",31204
3401,81624,indoor,"clean_room, museum/indoor, operating_room, stage/indoor, martial_arts_gym",31204
3402,81648,indoor,"clean_room, museum/indoor, operating_room, dressing_room, art_gallery",31204
3403,81672,indoor,"museum/indoor, clean_room, stage/indoor, art_gallery, martial_arts_gym",31204
3404,81696,indoor,"clean_room, museum/indoor, stage/indoor, art_gallery, martial_arts_gym",31204
3405,81720,indoor,"clean_room, museum/indoor, art_gallery, martial_arts_gym, stage/indoor",31204
3406,81744,indoor,"clean_room, museum/indoor, martial_arts_gym, operating_room, dressing_room",31204
3407,81768,indoor,"clean_room, museum/indoor, martial_arts_gym, stage/indoor, art_gallery",31204
3408,81792,indoor,"clean_room, museum/indoor, martial_arts_gym, art_gallery, stage/indoor",31204
3409,81816,indoor,"clean_room, museum/indoor, martial_arts_gym, stage/indoor, art_gallery",31204
3410,81840,indoor,"clean_room, museum/indoor, stage/indoor, martial_arts_gym, art_gallery",31204
3411,81864,indoor,"clean_room, museum/indoor, martial_arts_gym, stage/indoor, art_gallery",31204
3412,81888,indoor,"clean_room, museum/indoor, stage/indoor, martial_arts_gym, art_gallery",31204
3413,81912,indoor,"museum/indoor, art_gallery, clean_room, dressing_room, science_museum",31204
3414,81936,indoor,"museum/indoor, art_gallery, clean_room, natural_history_museum, science_museum",31204
3415,81960,indoor,"museum/indoor, clean_room, art_gallery, science_museum, natural_history_museum",31204
3416,81984,indoor,"museum/indoor, art_gallery, clean_room, science_museum, natural_history_museum",31204
3417,82008,indoor,"clothing_store, jewelry_shop, department_store, museum/indoor, atrium/public",31204
3418,82032,indoor,"banquet_hall, atrium/public, archive, jewelry_shop, ballroom",31204
3419,82056,indoor,"airport_terminal, clean_room, atrium/public, shopping_mall/indoor, museum/indoor",31204
3420,82080,indoor,"clean_room, museum/indoor, airport_terminal, atrium/public, science_museum",31204
3421,82104,indoor,"museum/indoor, ballroom, banquet_hall, clean_room, atrium/public",31204
3422,82128,indoor,"banquet_hall, atrium/public, ballroom, museum/indoor, dining_hall",31204
3423,82152,indoor,"banquet_hall, atrium/public, jewelry_shop, museum/indoor, clean_room",31204
3424,82176,indoor,"martial_arts_gym, boxing_ring, ballroom, bowling_alley, stage/indoor",31204
3425,82200,indoor,"banquet_hall, airport_terminal, dining_hall, ballroom, clean_room",31204
3426,82224,indoor,"banquet_hall, atrium/public, airport_terminal, shopping_mall/indoor, dining_hall",31204
3427,82248,indoor,"banquet_hall, airport_terminal, ballroom, atrium/public, clean_room",31204
3428,82272,indoor,"ballroom, clean_room, banquet_hall, museum/indoor, martial_arts_gym",31204
3429,82296,indoor,"dressing_room, clean_room, locker_room, airplane_cabin, chemistry_lab",31204
3430,82320,indoor,"dressing_room, locker_room, clean_room, airplane_cabin, beauty_salon",31204
3431,82344,indoor,"clean_room, banquet_hall, boxing_ring, operating_room, archive",31204
3432,82368,indoor,"boxing_ring, martial_arts_gym, banquet_hall, airport_terminal, ballroom",31204
3433,82392,indoor,"clean_room, operating_room, biology_laboratory, hospital_room, chemistry_lab",31204
3434,82416,indoor,"clean_room, operating_room, hospital_room, biology_laboratory, chemistry_lab",31204
3435,82440,indoor,"clean_room, operating_room, hospital_room, biology_laboratory, chemistry_lab",31204
3436,82464,indoor,"clean_room, operating_room, biology_laboratory, hospital_room, chemistry_lab",31204
3437,82488,indoor,"clean_room, operating_room, biology_laboratory, hospital_room, chemistry_lab",31204
3438,82512,indoor,"clean_room, operating_room, biology_laboratory, hospital_room, chemistry_lab",31204
3439,82536,indoor,"dressing_room, beauty_salon, ice_shelf, shower, bar",31204
3440,82560,indoor,"dressing_room, shower, beauty_salon, ice_shelf, bar",31204
3441,82584,indoor,"dressing_room, beauty_salon, ice_shelf, shower, bar",31204
3442,82608,indoor,"dressing_room, beauty_salon, ice_shelf, shower, bar",31204
3443,82632,indoor,"dressing_room, shower, museum/indoor, art_gallery, bathroom",31204
3444,82656,indoor,"shower, airport_terminal, natural_history_museum, kennel/outdoor, balcony/interior",31204
3445,82680,indoor,"clean_room, dressing_room, beauty_salon, operating_room, discotheque",31204
3446,82704,indoor,"clean_room, discotheque, dressing_room, beauty_salon, shower",31204
3447,82728,indoor,"clean_room, chemistry_lab, discotheque, biology_laboratory, dressing_room",31204
3448,82752,indoor,"clean_room, ice_shelf, dressing_room, shower, museum/indoor",31204
3449,82776,indoor,"clean_room, ice_shelf, shower, dressing_room, museum/indoor",31204
3450,82800,indoor,"clean_room, ice_shelf, shower, museum/indoor, dressing_room",31204
3451,82824,indoor,"clean_room, ice_shelf, shower, museum/indoor, dressing_room",31204
3452,82848,indoor,"airport_terminal, clean_room, clothing_store, boxing_ring, museum/indoor",31204
3453,82872,indoor,"clean_room, airport_terminal, clothing_store, archive, museum/indoor",31204
3454,82896,indoor,"clean_room, airport_terminal, clothing_store, archive, boxing_ring",31204
3455,82920,indoor,"clean_room, archive, martial_arts_gym, operating_room, hangar/indoor",31204
3456,82944,indoor,"clean_room, boxing_ring, windmill, banquet_hall, wind_farm",31204
3457,82968,indoor,"clean_room, museum/indoor, boxing_ring, operating_room, airport_terminal",31204
3458,82992,indoor,"jewelry_shop, banquet_hall, bakery/shop, clean_room, ice_cream_parlor",31204
3459,83016,indoor,"shower, swimming_pool/indoor, atrium/public, airport_terminal, clean_room",31204
3460,83040,indoor,"discotheque, stage/indoor, dressing_room, shower, music_studio",31204
3461,83064,outdoor,"sandbox, kennel/outdoor, igloo, jacuzzi/indoor, aquarium",31204
3462,83088,outdoor,"sandbox, igloo, volleyball_court/outdoor, aquarium, ice_floe",31204
3463,83112,indoor,"shower, jacuzzi/indoor, ice_floe, swimming_pool/indoor, boxing_ring",31204
3464,83136,outdoor,"ice_floe, ice_shelf, beach, tundra, ocean",31204
3465,83160,outdoor,"ice_floe, ice_shelf, corral, hot_spring, water_tower",31204
3466,83184,indoor,"martial_arts_gym, nursery, golf_course, clean_room, museum/indoor",31204
3467,83208,indoor,"boxing_ring, volleyball_court/outdoor, museum/indoor, ice_floe, nursery",31204
