,frame_num,environment,places,imdb_id
0,0,outdoor,"desert/sand, beach, ocean, sky, shower",31204
1,24,outdoor,"desert/sand, beach, sky, lake/natural, marsh",31204
2,48,indoor,"bank_vault, science_museum, clean_room, museum/indoor, physics_laboratory",31204
3,72,indoor,"clothing_store, gift_shop, department_store, drugstore, candy_store",31204
4,96,indoor,"beauty_salon, drugstore, pharmacy, bookstore, clothing_store",31204
5,120,indoor,"beauty_salon, drugstore, pharmacy, bookstore, hospital",31204
6,144,indoor,"beauty_salon, drugstore, pharmacy, bookstore, clothing_store",31204
7,168,indoor,"beauty_salon, bookstore, drugstore, pharmacy, hospital",31204
8,192,indoor,"beauty_salon, drugstore, bookstore, pharmacy, hospital",31204
9,216,indoor,"drugstore, pharmacy, beauty_salon, bookstore, clothing_store",31204
10,240,indoor,"drugstore, pharmacy, beauty_salon, bookstore, clothing_store",31204
11,264,indoor,"beauty_salon, drugstore, pharmacy, bookstore, clothing_store",31204
12,288,indoor,"beauty_salon, drugstore, pharmacy, bookstore, clothing_store",31204
13,312,indoor,"beauty_salon, drugstore, pharmacy, bookstore, clothing_store",31204
14,336,indoor,"bookstore, drugstore, beauty_salon, department_store, pharmacy",31204
15,360,indoor,"pharmacy, drugstore, clothing_store, department_store, airport_terminal",31204
16,384,indoor,"pharmacy, drugstore, bookstore, airport_terminal, department_store",31204
17,408,indoor,"pharmacy, drugstore, bookstore, department_store, airport_terminal",31204
18,432,indoor,"pharmacy, drugstore, bookstore, department_store, clothing_store",31204
19,456,indoor,"pharmacy, bookstore, drugstore, clothing_store, supermarket",31204
20,480,indoor,"pharmacy, drugstore, department_store, clothing_store, airport_terminal",31204
21,504,indoor,"pharmacy, drugstore, bookstore, department_store, clothing_store",31204
22,528,indoor,"pharmacy, drugstore, bookstore, department_store, clothing_store",31204
23,552,indoor,"pharmacy, drugstore, bookstore, department_store, clothing_store",31204
24,576,indoor,"drugstore, pharmacy, bookstore, gift_shop, department_store",31204
25,600,indoor,"pharmacy, drugstore, beauty_salon, elevator/door, elevator_lobby",31204
26,624,indoor,"drugstore, beauty_salon, pharmacy, elevator/door, elevator_lobby",31204
27,648,indoor,"drugstore, pharmacy, beauty_salon, elevator/door, elevator_lobby",31204
28,672,indoor,"drugstore, pharmacy, beauty_salon, elevator/door, elevator_lobby",31204
29,696,indoor,"drugstore, pharmacy, beauty_salon, elevator/door, natural_history_museum",31204
30,720,indoor,"drugstore, pharmacy, beauty_salon, elevator/door, elevator_lobby",31204
31,744,indoor,"drugstore, pharmacy, beauty_salon, jewelry_shop, elevator/door",31204
32,768,indoor,"elevator/door, elevator_lobby, beauty_salon, drugstore, pharmacy",31204
33,792,indoor,"drugstore, pharmacy, beauty_salon, booth/indoor, natural_history_museum",31204
34,816,indoor,"booth/indoor, science_museum, museum/indoor, natural_history_museum, elevator/door",31204
35,840,indoor,"booth/indoor, science_museum, museum/indoor, elevator/door, server_room",31204
36,864,indoor,"booth/indoor, science_museum, museum/indoor, server_room, bank_vault",31204
37,888,indoor,"booth/indoor, science_museum, museum/indoor, natural_history_museum, server_room",31204
38,912,indoor,"booth/indoor, science_museum, museum/indoor, server_room, elevator/door",31204
39,936,indoor,"booth/indoor, science_museum, museum/indoor, server_room, elevator/door",31204
40,960,indoor,"booth/indoor, science_museum, museum/indoor, server_room, elevator/door",31204
41,984,indoor,"booth/indoor, science_museum, museum/indoor, server_room, elevator/door",31204
42,1008,indoor,"booth/indoor, science_museum, museum/indoor, server_room, elevator/door",31204
43,1032,indoor,"booth/indoor, science_museum, museum/indoor, natural_history_museum, bank_vault",31204
44,1056,indoor,"booth/indoor, science_museum, museum/indoor, server_room, natural_history_museum",31204
45,1080,indoor,"booth/indoor, science_museum, server_room, museum/indoor, elevator/door",31204
46,1104,indoor,"booth/indoor, science_museum, museum/indoor, server_room, elevator/door",31204
47,1128,indoor,"booth/indoor, science_museum, server_room, museum/indoor, elevator/door",31204
48,1152,indoor,"booth/indoor, science_museum, museum/indoor, server_room, elevator/door",31204
49,1176,indoor,"booth/indoor, science_museum, museum/indoor, server_room, elevator/door",31204
50,1200,indoor,"booth/indoor, science_museum, museum/indoor, server_room, natural_history_museum",31204
51,1224,indoor,"booth/indoor, science_museum, museum/indoor, server_room, elevator/door",31204
52,1248,indoor,"booth/indoor, science_museum, museum/indoor, server_room, bank_vault",31204
53,1272,indoor,"booth/indoor, science_museum, museum/indoor, server_room, natural_history_museum",31204
54,1296,indoor,"science_museum, booth/indoor, natural_history_museum, museum/indoor, elevator/door",31204
55,1320,indoor,"server_room, science_museum, pharmacy, natural_history_museum, drugstore",31204
56,1344,indoor,"server_room, pharmacy, science_museum, drugstore, elevator/door",31204
57,1368,indoor,"server_room, pharmacy, science_museum, drugstore, elevator/door",31204
58,1392,indoor,"server_room, pharmacy, science_museum, drugstore, elevator/door",31204
59,1416,indoor,"server_room, pharmacy, drugstore, science_museum, elevator/door",31204
60,1440,indoor,"server_room, pharmacy, drugstore, science_museum, elevator/door",31204
61,1464,indoor,"server_room, pharmacy, science_museum, drugstore, natural_history_museum",31204
62,1488,indoor,"server_room, pharmacy, elevator/door, science_museum, drugstore",31204
63,1512,indoor,"server_room, pharmacy, science_museum, drugstore, elevator/door",31204
64,1536,indoor,"server_room, pharmacy, science_museum, drugstore, elevator/door",31204
65,1560,indoor,"server_room, pharmacy, science_museum, drugstore, elevator/door",31204
66,1584,indoor,"server_room, pharmacy, science_museum, drugstore, elevator/door",31204
67,1608,indoor,"server_room, pharmacy, drugstore, science_museum, elevator/door",31204
68,1632,indoor,"server_room, pharmacy, science_museum, elevator/door, drugstore",31204
69,1656,indoor,"server_room, pharmacy, science_museum, drugstore, natural_history_museum",31204
70,1680,indoor,"server_room, pharmacy, drugstore, science_museum, elevator/door",31204
71,1704,indoor,"server_room, pharmacy, science_museum, drugstore, elevator/door",31204
72,1728,indoor,"server_room, science_museum, pharmacy, elevator/door, natural_history_museum",31204
73,1752,indoor,"server_room, science_museum, pharmacy, elevator/door, drugstore",31204
74,1776,indoor,"server_room, pharmacy, science_museum, drugstore, elevator/door",31204
75,1800,indoor,"server_room, pharmacy, drugstore, science_museum, elevator/door",31204
76,1824,indoor,"science_museum, archive, natural_history_museum, drugstore, pharmacy",31204
77,1848,outdoor,"lake/natural, marsh, pond, ocean, beach",31204
78,1872,outdoor,"sky, water_tower, lighthouse, pier, ocean",31204
79,1896,outdoor,"water_tower, sky, arch, pier, boathouse",31204
80,1920,outdoor,"sky, water_tower, shower, tower, igloo",31204
81,1944,outdoor,"igloo, sky, water_tower, lighthouse, shower",31204
82,1968,outdoor,"water_tower, arch, shower, igloo, pier",31204
83,1992,indoor,"gymnasium/indoor, museum/indoor, archive, television_studio, music_studio",31204
84,2016,indoor,"gymnasium/indoor, music_studio, museum/indoor, television_studio, archive",31204
85,2040,indoor,"gymnasium/indoor, television_studio, archive, museum/indoor, boxing_ring",31204
86,2064,indoor,"shower, bathroom, jacuzzi/indoor, nursery, bedroom",31204
87,2088,outdoor,"shower, water_tower, sky, hangar/outdoor, tower",31204
88,2112,outdoor,"water_tower, shower, tower, lighthouse, ice_floe",31204
89,2136,indoor,"gymnasium/indoor, television_studio, boxing_ring, music_studio, classroom",31204
90,2160,indoor,"dressing_room, television_studio, museum/indoor, music_studio, gymnasium/indoor",31204
91,2184,indoor,"dressing_room, museum/indoor, television_studio, locker_room, music_studio",31204
92,2208,indoor,"dressing_room, television_studio, museum/indoor, clothing_store, gymnasium/indoor",31204
93,2232,indoor,"dressing_room, museum/indoor, clothing_store, locker_room, art_gallery",31204
94,2256,indoor,"dressing_room, museum/indoor, art_gallery, archive, art_studio",31204
95,2280,indoor,"dressing_room, museum/indoor, television_studio, music_studio, gymnasium/indoor",31204
96,2304,indoor,"museum/indoor, dressing_room, clothing_store, television_studio, archive",31204
97,2328,indoor,"dressing_room, museum/indoor, television_studio, music_studio, gymnasium/indoor",31204
98,2352,indoor,"museum/indoor, dressing_room, television_studio, gymnasium/indoor, art_gallery",31204
99,2376,indoor,"dressing_room, museum/indoor, television_studio, beauty_salon, music_studio",31204
100,2400,indoor,"museum/indoor, television_studio, waiting_room, dressing_room, archive",31204
101,2424,indoor,"museum/indoor, nursery, dressing_room, waiting_room, living_room",31204
102,2448,indoor,"dressing_room, museum/indoor, gymnasium/indoor, bowling_alley, archive",31204
103,2472,indoor,"dressing_room, museum/indoor, archive, gymnasium/indoor, nursery",31204
104,2496,indoor,"museum/indoor, nursery, archive, dressing_room, waiting_room",31204
105,2520,indoor,"museum/indoor, dressing_room, nursery, art_gallery, gymnasium/indoor",31204
106,2544,indoor,"museum/indoor, gymnasium/indoor, dressing_room, television_studio, music_studio",31204
107,2568,indoor,"water_tower, shower, conference_room, reception, hospital_room",31204
108,2592,indoor,"conference_room, hospital_room, office, reception, home_office",31204
109,2616,outdoor,"sky, water_tower, shower, igloo, alcove",31204
110,2640,indoor,"clean_room, beauty_salon, dressing_room, operating_room, hospital_room",31204
111,2664,indoor,"clean_room, operating_room, hospital_room, beauty_salon, nursing_home",31204
112,2688,indoor,"clean_room, operating_room, hospital_room, nursing_home, dressing_room",31204
113,2712,indoor,"clean_room, operating_room, hospital_room, beauty_salon, dressing_room",31204
114,2736,indoor,"clean_room, operating_room, hospital_room, dressing_room, nursing_home",31204
115,2760,indoor,"banquet_hall, restaurant, dining_hall, dining_room, dressing_room",31204
116,2784,indoor,"restaurant, banquet_hall, dressing_room, dining_hall, cafeteria",31204
117,2808,indoor,"restaurant, banquet_hall, dressing_room, cafeteria, dining_hall",31204
118,2832,indoor,"restaurant, banquet_hall, dining_hall, dressing_room, cafeteria",31204
119,2856,indoor,"restaurant, cafeteria, banquet_hall, dining_hall, food_court",31204
120,2880,indoor,"dressing_room, restaurant, pub/indoor, banquet_hall, classroom",31204
121,2904,indoor,"restaurant, banquet_hall, hospital_room, classroom, dressing_room",31204
122,2928,indoor,"dressing_room, museum/indoor, clean_room, sauna, nursery",31204
123,2952,indoor,"dressing_room, museum/indoor, nursery, stage/indoor, clean_room",31204
124,2976,indoor,"dressing_room, clean_room, museum/indoor, sauna, archive",31204
125,3000,indoor,"dressing_room, clean_room, museum/indoor, art_gallery, archive",31204
126,3024,indoor,"restaurant, banquet_hall, dining_hall, dining_room, pub/indoor",31204
127,3048,indoor,"restaurant, banquet_hall, pub/indoor, coffee_shop, dining_hall",31204
128,3072,indoor,"hospital_room, restaurant, dressing_room, cafeteria, coffee_shop",31204
129,3096,indoor,"clean_room, operating_room, hospital_room, beauty_salon, dressing_room",31204
130,3120,indoor,"clean_room, operating_room, hospital_room, dressing_room, beauty_salon",31204
131,3144,indoor,"clean_room, operating_room, beauty_salon, dressing_room, hospital_room",31204
132,3168,indoor,"clean_room, dressing_room, operating_room, hospital_room, beauty_salon",31204
133,3192,indoor,"clean_room, operating_room, hospital_room, dressing_room, beauty_salon",31204
134,3216,indoor,"clean_room, operating_room, hospital_room, dressing_room, beauty_salon",31204
135,3240,indoor,"clean_room, dressing_room, operating_room, hospital_room, beauty_salon",31204
136,3264,outdoor,"balcony/interior, racecourse, hangar/outdoor, runway, balcony/exterior",31204
137,3288,indoor,"clean_room, archive, museum/indoor, jewelry_shop, science_museum",31204
138,3312,indoor,"archive, clean_room, chemistry_lab, biology_laboratory, classroom",31204
139,3336,indoor,"locker_room, clean_room, music_studio, archive, museum/indoor",31204
140,3360,indoor,"dressing_room, music_studio, discotheque, physics_laboratory, archive",31204
141,3384,indoor,"dressing_room, discotheque, locker_room, music_studio, museum/indoor",31204
142,3408,indoor,"clean_room, archive, chemistry_lab, museum/indoor, biology_laboratory",31204
143,3432,indoor,"clean_room, archive, dressing_room, chemistry_lab, museum/indoor",31204
144,3456,indoor,"clean_room, chemistry_lab, biology_laboratory, dressing_room, archive",31204
145,3480,indoor,"clean_room, biology_laboratory, restaurant_kitchen, archive, chemistry_lab",31204
146,3504,outdoor,"gymnasium/indoor, gas_station, boat_deck, construction_site, playground",31204
147,3528,indoor,"gymnasium/indoor, clean_room, archive, music_studio, operating_room",31204
148,3552,indoor,"gymnasium/indoor, boxing_ring, music_studio, museum/indoor, clean_room",31204
149,3576,indoor,"gymnasium/indoor, archive, museum/indoor, boxing_ring, music_studio",31204
150,3600,indoor,"gymnasium/indoor, museum/indoor, music_studio, archive, boxing_ring",31204
151,3624,indoor,"gymnasium/indoor, archive, music_studio, museum/indoor, orchestra_pit",31204
152,3648,indoor,"gymnasium/indoor, museum/indoor, archive, music_studio, television_studio",31204
153,3672,indoor,"archive, clean_room, physics_laboratory, office, reception",31204
154,3696,indoor,"clean_room, archive, physics_laboratory, office, biology_laboratory",31204
155,3720,indoor,"clean_room, physics_laboratory, office, archive, museum/indoor",31204
156,3744,indoor,"clean_room, physics_laboratory, office, archive, biology_laboratory",31204
157,3768,indoor,"clean_room, archive, jewelry_shop, science_museum, museum/indoor",31204
158,3792,indoor,"clean_room, archive, museum/indoor, science_museum, jewelry_shop",31204
159,3816,indoor,"clean_room, archive, biology_laboratory, physics_laboratory, restaurant_kitchen",31204
160,3840,indoor,"clean_room, jewelry_shop, biology_laboratory, operating_room, physics_laboratory",31204
161,3864,indoor,"clean_room, biology_laboratory, archive, physics_laboratory, operating_room",31204
162,3888,indoor,"clean_room, archive, museum/indoor, dressing_room, science_museum",31204
163,3912,indoor,"clean_room, museum/indoor, archive, science_museum, physics_laboratory",31204
164,3936,indoor,"clean_room, museum/indoor, science_museum, archive, art_gallery",31204
165,3960,indoor,"clean_room, museum/indoor, science_museum, art_gallery, archive",31204
166,3984,indoor,"clean_room, museum/indoor, science_museum, art_gallery, physics_laboratory",31204
167,4008,indoor,"clean_room, museum/indoor, physics_laboratory, science_museum, archive",31204
168,4032,indoor,"clean_room, museum/indoor, physics_laboratory, archive, chemistry_lab",31204
169,4056,indoor,"clean_room, physics_laboratory, chemistry_lab, museum/indoor, archive",31204
170,4080,indoor,"clean_room, museum/indoor, archive, physics_laboratory, science_museum",31204
171,4104,indoor,"museum/indoor, clean_room, archive, physics_laboratory, science_museum",31204
172,4128,indoor,"museum/indoor, clean_room, archive, science_museum, physics_laboratory",31204
173,4152,indoor,"museum/indoor, clean_room, archive, science_museum, art_gallery",31204
174,4176,indoor,"office, classroom, office_cubicles, dressing_room, archive",31204
175,4200,indoor,"archive, dressing_room, office, classroom, office_cubicles",31204
176,4224,indoor,"archive, dressing_room, art_gallery, clean_room, classroom",31204
177,4248,indoor,"dressing_room, archive, classroom, office, clean_room",31204
178,4272,indoor,"dressing_room, clean_room, nursing_home, archive, museum/indoor",31204
179,4296,indoor,"museum/indoor, art_gallery, clean_room, dressing_room, art_studio",31204
180,4320,indoor,"clean_room, dressing_room, museum/indoor, nursing_home, art_gallery",31204
181,4344,indoor,"clean_room, dressing_room, museum/indoor, art_gallery, archive",31204
182,4368,indoor,"clean_room, dressing_room, museum/indoor, nursing_home, art_gallery",31204
183,4392,indoor,"clean_room, dressing_room, museum/indoor, archive, nursing_home",31204
184,4416,indoor,"clean_room, dressing_room, museum/indoor, nursing_home, archive",31204
185,4440,indoor,"clean_room, chemistry_lab, physics_laboratory, biology_laboratory, museum/indoor",31204
186,4464,indoor,"museum/indoor, clean_room, art_gallery, archive, physics_laboratory",31204
187,4488,indoor,"museum/indoor, clean_room, archive, art_gallery, science_museum",31204
188,4512,indoor,"clean_room, museum/indoor, archive, physics_laboratory, art_gallery",31204
189,4536,indoor,"clean_room, museum/indoor, archive, art_gallery, science_museum",31204
190,4560,indoor,"clean_room, museum/indoor, art_gallery, archive, physics_laboratory",31204
191,4584,indoor,"museum/indoor, clean_room, art_gallery, science_museum, archive",31204
192,4608,indoor,"clean_room, museum/indoor, archive, art_gallery, science_museum",31204
193,4632,indoor,"clean_room, museum/indoor, physics_laboratory, archive, operating_room",31204
194,4656,indoor,"archive, office, office_cubicles, classroom, dressing_room",31204
195,4680,indoor,"archive, classroom, office, office_cubicles, dressing_room",31204
196,4704,indoor,"archive, office, classroom, dressing_room, office_cubicles",31204
197,4728,indoor,"clean_room, museum/indoor, operating_room, archive, physics_laboratory",31204
198,4752,indoor,"clean_room, archive, museum/indoor, operating_room, art_gallery",31204
199,4776,indoor,"clean_room, archive, museum/indoor, operating_room, art_gallery",31204
200,4800,indoor,"clean_room, museum/indoor, archive, art_gallery, operating_room",31204
201,4824,indoor,"clean_room, museum/indoor, archive, art_gallery, operating_room",31204
202,4848,indoor,"bank_vault, locker_room, music_studio, archive, physics_laboratory",31204
203,4872,indoor,"clean_room, museum/indoor, art_gallery, operating_room, hospital_room",31204
204,4896,indoor,"clean_room, martial_arts_gym, dressing_room, hospital_room, operating_room",31204
205,4920,indoor,"clean_room, dressing_room, museum/indoor, archive, martial_arts_gym",31204
206,4944,indoor,"clean_room, museum/indoor, archive, operating_room, art_gallery",31204
207,4968,indoor,"clean_room, museum/indoor, archive, art_gallery, dressing_room",31204
208,4992,indoor,"clean_room, archive, martial_arts_gym, museum/indoor, dressing_room",31204
209,5016,indoor,"clean_room, archive, martial_arts_gym, museum/indoor, dressing_room",31204
210,5040,indoor,"clean_room, archive, martial_arts_gym, dressing_room, museum/indoor",31204
211,5064,indoor,"clean_room, museum/indoor, archive, art_gallery, dressing_room",31204
212,5088,indoor,"clean_room, archive, museum/indoor, dressing_room, art_gallery",31204
213,5112,indoor,"clean_room, museum/indoor, archive, dressing_room, art_gallery",31204
214,5136,indoor,"clean_room, dressing_room, archive, museum/indoor, martial_arts_gym",31204
215,5160,indoor,"clean_room, archive, museum/indoor, dressing_room, art_gallery",31204
216,5184,indoor,"clean_room, archive, museum/indoor, dressing_room, art_gallery",31204
217,5208,indoor,"clean_room, archive, museum/indoor, dressing_room, art_gallery",31204
218,5232,indoor,"clean_room, archive, museum/indoor, martial_arts_gym, dressing_room",31204
219,5256,indoor,"clean_room, martial_arts_gym, archive, museum/indoor, operating_room",31204
220,5280,indoor,"clean_room, archive, dressing_room, martial_arts_gym, locker_room",31204
221,5304,indoor,"archive, martial_arts_gym, clean_room, dressing_room, museum/indoor",31204
222,5328,indoor,"clean_room, archive, martial_arts_gym, museum/indoor, dressing_room",31204
223,5352,indoor,"archive, clean_room, dressing_room, martial_arts_gym, music_studio",31204
224,5376,indoor,"clean_room, dressing_room, martial_arts_gym, archive, boxing_ring",31204
225,5400,indoor,"archive, dressing_room, martial_arts_gym, clean_room, locker_room",31204
226,5424,indoor,"archive, dressing_room, martial_arts_gym, clean_room, boxing_ring",31204
227,5448,indoor,"museum/indoor, clean_room, dressing_room, martial_arts_gym, art_gallery",31204
228,5472,indoor,"gymnasium/indoor, archive, television_studio, classroom, music_studio",31204
229,5496,indoor,"gymnasium/indoor, television_studio, boxing_ring, museum/indoor, archive",31204
230,5520,indoor,"gymnasium/indoor, boxing_ring, television_studio, martial_arts_gym, bowling_alley",31204
231,5544,indoor,"gymnasium/indoor, museum/indoor, television_studio, archive, boxing_ring",31204
232,5568,outdoor,"runway, ice_floe, ice_shelf, iceberg, airfield",31204
233,5592,outdoor,"ice_floe, runway, ice_shelf, ski_slope, snowfield",31204
234,5616,outdoor,"snowfield, ski_slope, runway, ice_shelf, mountain_snowy",31204
235,5640,outdoor,"runway, ski_slope, snowfield, ice_shelf, ice_floe",31204
236,5664,indoor,"clean_room, hangar/outdoor, landing_deck, bank_vault, engine_room",31204
237,5688,indoor,"clean_room, engine_room, bank_vault, auto_factory, server_room",31204
238,5712,indoor,"airplane_cabin, clean_room, escalator/indoor, engine_room, auto_factory",31204
239,5736,indoor,"airplane_cabin, clean_room, escalator/indoor, engine_room, server_room",31204
240,5760,indoor,"archive, clean_room, operating_room, gymnasium/indoor, museum/indoor",31204
241,5784,indoor,"gymnasium/indoor, television_studio, archive, classroom, boxing_ring",31204
242,5808,indoor,"gymnasium/indoor, archive, clean_room, operating_room, boxing_ring",31204
243,5832,indoor,"gymnasium/indoor, television_studio, archive, boxing_ring, operating_room",31204
244,5856,indoor,"archive, television_studio, gymnasium/indoor, operating_room, physics_laboratory",31204
245,5880,indoor,"gymnasium/indoor, television_studio, archive, music_studio, boxing_ring",31204
246,5904,indoor,"gymnasium/indoor, operating_room, television_studio, archive, boxing_ring",31204
247,5928,indoor,"archive, gymnasium/indoor, television_studio, clean_room, operating_room",31204
248,5952,indoor,"gymnasium/indoor, television_studio, boxing_ring, museum/indoor, archive",31204
249,5976,indoor,"archive, gymnasium/indoor, operating_room, clean_room, physics_laboratory",31204
250,6000,outdoor,"schoolhouse, corral, arena/rodeo, racecourse, ski_resort",31204
251,6024,outdoor,"schoolhouse, playground, racecourse, corral, arena/rodeo",31204
252,6048,outdoor,"schoolhouse, playground, corral, picnic_area, yard",31204
253,6072,outdoor,"playground, corral, arena/rodeo, racecourse, volleyball_court/outdoor",31204
254,6096,outdoor,"corral, racecourse, arena/rodeo, schoolhouse, farm",31204
255,6120,outdoor,"arena/rodeo, corral, racecourse, schoolhouse, stable",31204
256,6144,outdoor,"corral, arena/rodeo, racecourse, schoolhouse, stable",31204
257,6168,outdoor,"mountain_snowy, snowfield, ski_slope, glacier, sky",31204
258,6192,outdoor,"water_tower, tower, mountain_snowy, sky, ice_shelf",31204
259,6216,outdoor,"courthouse, mosque/outdoor, tower, mausoleum, building_facade",31204
260,6240,outdoor,"lighthouse, water_tower, beach_house, tower, windmill",31204
261,6264,outdoor,"arena/rodeo, racecourse, corral, schoolhouse, golf_course",31204
262,6288,outdoor,"playground, arena/rodeo, corral, racecourse, campsite",31204
263,6312,outdoor,"corral, arena/rodeo, racecourse, schoolhouse, playground",31204
264,6336,outdoor,"arena/rodeo, corral, racecourse, playground, campsite",31204
265,6360,outdoor,"playground, racecourse, corral, arena/rodeo, ice_shelf",31204
266,6384,outdoor,"playground, arena/rodeo, corral, racecourse, stable",31204
267,6408,outdoor,"arena/rodeo, racecourse, corral, playground, stable",31204
268,6432,outdoor,"corral, playground, arena/rodeo, racecourse, farm",31204
269,6456,outdoor,"playground, racecourse, arena/rodeo, carrousel, schoolhouse",31204
270,6480,outdoor,"playground, racecourse, arena/rodeo, corral, football_field",31204
271,6504,outdoor,"playground, racecourse, amusement_park, baseball_field, raceway",31204
272,6528,outdoor,"racecourse, arena/rodeo, playground, corral, volleyball_court/outdoor",31204
273,6552,outdoor,"playground, racecourse, arena/rodeo, corral, schoolhouse",31204
274,6576,outdoor,"playground, racecourse, arena/rodeo, corral, raceway",31204
275,6600,outdoor,"shower, airfield, runway, hangar/indoor, sky",31204
276,6624,outdoor,"water_tower, sky, airfield, hangar/indoor, windmill",31204
277,6648,outdoor,"water_tower, airfield, sky, hangar/indoor, bank_vault",31204
278,6672,indoor,"discotheque, archive, nursing_home, museum/indoor, bar",31204
279,6696,indoor,"discotheque, dressing_room, archive, clean_room, bar",31204
280,6720,indoor,"discotheque, nursing_home, hospital_room, operating_room, banquet_hall",31204
281,6744,indoor,"operating_room, clean_room, hospital_room, nursing_home, schoolhouse",31204
282,6768,indoor,"boxing_ring, stage/indoor, clean_room, schoolhouse, operating_room",31204
283,6792,outdoor,"water_tower, airfield, sky, wind_farm, hangar/outdoor",31204
284,6816,outdoor,"water_tower, sky, conference_room, airfield, wind_farm",31204
285,6840,indoor,"ice_skating_rink/indoor, ice_skating_rink/outdoor, ballroom, martial_arts_gym, bowling_alley",31204
286,6864,indoor,"martial_arts_gym, ice_skating_rink/indoor, ice_skating_rink/outdoor, ballroom, museum/indoor",31204
287,6888,outdoor,"snowfield, beach, ice_shelf, sky, beach_house",31204
288,6912,outdoor,"snowfield, parking_lot, volleyball_court/outdoor, ice_shelf, farm",31204
289,6936,outdoor,"snowfield, parking_lot, ice_shelf, harbor, beach",31204
290,6960,outdoor,"snowfield, parking_lot, ice_shelf, mountain_snowy, ice_floe",31204
