,frame_num,environment,places
2998,71952,indoor,"ice_cream_parlor, art_gallery, gift_shop, beauty_salon, art_studio"
2999,71976,indoor,"gift_shop, art_studio, beauty_salon, department_store, art_gallery"
3000,72000,indoor,"gift_shop, art_studio, ice_cream_parlor, beauty_salon, nursery"
3001,72024,indoor,"ice_cream_parlor, art_studio, gift_shop, nursery, art_gallery"
3002,72048,indoor,"ice_cream_parlor, art_studio, art_gallery, gift_shop, department_store"
3003,72072,indoor,"ice_cream_parlor, nursery, department_store, gift_shop, art_studio"
3004,72096,indoor,"ice_cream_parlor, nursery, art_studio, department_store, butchers_shop"
3005,72120,indoor,"ice_cream_parlor, nursery, art_studio, gift_shop, clothing_store"
3006,72144,indoor,"ice_cream_parlor, nursery, art_studio, beauty_salon, artists_loft"
3007,72168,indoor,"ice_cream_parlor, butchers_shop, nursery, art_studio, bakery/shop"
3008,72192,indoor,"beauty_salon, ice_cream_parlor, art_gallery, gift_shop, art_studio"
3009,72216,indoor,"beauty_salon, art_gallery, dressing_room, reception, nursing_home"
3010,72240,indoor,"beauty_salon, art_gallery, reception, dressing_room, nursing_home"
3011,72264,indoor,"beauty_salon, dressing_room, art_gallery, reception, museum/indoor"
3012,72288,indoor,"art_studio, art_gallery, art_school, gift_shop, museum/indoor"
3013,72312,indoor,"art_studio, art_gallery, art_school, museum/indoor, gift_shop"
3014,72336,indoor,"art_studio, ice_cream_parlor, beauty_salon, art_gallery, gift_shop"
3015,72360,indoor,"ice_cream_parlor, department_store, bakery/shop, reception, art_studio"
3016,72384,indoor,"ice_cream_parlor, bakery/shop, department_store, butchers_shop, general_store/indoor"
3017,72408,indoor,"ice_cream_parlor, department_store, bakery/shop, art_studio, gift_shop"
3018,72432,indoor,"ice_cream_parlor, beauty_salon, gift_shop, art_studio, jewelry_shop"
3019,72456,indoor,"department_store, gift_shop, ice_cream_parlor, art_studio, general_store/indoor"
3020,72480,indoor,"ice_cream_parlor, department_store, gift_shop, clothing_store, art_studio"
3021,72504,indoor,"department_store, gift_shop, clothing_store, art_studio, ice_cream_parlor"
3022,72528,indoor,"art_studio, ice_cream_parlor, nursery, chemistry_lab, department_store"
3023,72552,indoor,"art_studio, gift_shop, department_store, nursery, general_store/indoor"
3024,72576,indoor,"art_studio, nursery, ice_cream_parlor, gift_shop, general_store/indoor"
3025,72600,indoor,"nursery, ice_cream_parlor, art_studio, biology_laboratory, gift_shop"
3026,72624,indoor,"art_studio, gift_shop, general_store/indoor, department_store, nursery"
3027,72648,indoor,"nursery, art_studio, gift_shop, general_store/indoor, department_store"
3028,72672,indoor,"art_studio, gift_shop, ice_cream_parlor, art_gallery, museum/indoor"
3029,72696,indoor,"art_studio, art_gallery, nursery, art_school, nursing_home"
3030,72720,indoor,"nursing_home, biology_laboratory, nursery, hospital_room, office"
3031,72744,indoor,"ice_cream_parlor, pharmacy, gift_shop, beauty_salon, drugstore"
3032,72768,indoor,"nursery, childs_room, playroom, artists_loft, art_studio"
3033,72792,indoor,"beauty_salon, ice_cream_parlor, chemistry_lab, art_studio, biology_laboratory"
3034,72816,indoor,"beauty_salon, ice_cream_parlor, nursery, gift_shop, chemistry_lab"
3035,72840,indoor,"biology_laboratory, chemistry_lab, ice_cream_parlor, beauty_salon, art_studio"
3036,72864,indoor,"art_studio, chemistry_lab, biology_laboratory, art_gallery, gift_shop"
3037,72888,indoor,"beauty_salon, chemistry_lab, biology_laboratory, pharmacy, drugstore"
3038,72912,indoor,"chemistry_lab, ice_cream_parlor, biology_laboratory, art_school, coffee_shop"
3039,72936,indoor,"atrium/public, mezzanine, shopping_mall/indoor, staircase, airport_terminal"
3040,72960,indoor,"mezzanine, atrium/public, fire_escape, staircase, balcony/interior"
3041,72984,outdoor,"balcony/interior, porch, balcony/exterior, mezzanine, patio"
3042,73008,outdoor,"balcony/interior, boat_deck, lake/natural, picnic_area, beach"
3043,73032,outdoor,"boat_deck, pier, lake/natural, river, balcony/interior"
3044,73056,outdoor,"pier, boat_deck, lake/natural, river, balcony/interior"
3045,73080,outdoor,"boat_deck, pier, balcony/interior, lake/natural, river"
3046,73104,outdoor,"pier, lake/natural, boat_deck, river, balcony/interior"
3047,73128,outdoor,"lake/natural, boat_deck, pier, river, balcony/interior"
3048,73152,outdoor,"boat_deck, pier, lake/natural, river, balcony/interior"
3049,73176,outdoor,"pier, lake/natural, boat_deck, river, balcony/interior"
3050,73200,outdoor,"pier, boat_deck, lake/natural, balcony/interior, river"
3051,73224,outdoor,"pier, boat_deck, balcony/interior, lake/natural, promenade"
3052,73248,outdoor,"pier, boat_deck, lake/natural, balcony/interior, river"
3053,73272,outdoor,"pier, lake/natural, boat_deck, river, balcony/interior"
3054,73296,outdoor,"pier, lake/natural, boat_deck, river, balcony/interior"
3055,73320,outdoor,"pier, boat_deck, lake/natural, river, balcony/interior"
3056,73344,outdoor,"boat_deck, balcony/interior, pier, promenade, lake/natural"
3057,73368,outdoor,"pier, lake/natural, river, promenade, boat_deck"
3058,73392,outdoor,"pier, boat_deck, lake/natural, bridge, beach"
3059,73416,outdoor,"pier, boat_deck, lake/natural, harbor, lagoon"
3060,73440,outdoor,"boat_deck, pier, harbor, lake/natural, beach"
3061,73464,outdoor,"boat_deck, pier, harbor, lake/natural, beach"
3062,73488,outdoor,"pier, boat_deck, harbor, promenade, lake/natural"
3063,73512,outdoor,"boat_deck, pier, harbor, lake/natural, promenade"
3064,73536,outdoor,"boat_deck, pier, harbor, lake/natural, lagoon"
3065,73560,outdoor,"boat_deck, pier, harbor, lake/natural, lagoon"
3066,73584,outdoor,"pier, boat_deck, harbor, promenade, lake/natural"
3067,73608,outdoor,"pier, boat_deck, harbor, promenade, lagoon"
3068,73632,outdoor,"pier, boat_deck, harbor, lake/natural, lagoon"
3069,73656,outdoor,"boat_deck, pier, harbor, lake/natural, beach"
3070,73680,outdoor,"boat_deck, pier, harbor, lake/natural, promenade"
3071,73704,outdoor,"boat_deck, pier, harbor, beach, promenade"
3072,73728,outdoor,"pier, boat_deck, harbor, promenade, boardwalk"
3073,73752,outdoor,"boat_deck, pier, harbor, lake/natural, lagoon"
3074,73776,outdoor,"boat_deck, pier, lagoon, lake/natural, beach"
3075,73800,outdoor,"lake/natural, pier, bridge, river, boathouse"
3076,73824,outdoor,"lake/natural, boathouse, pier, bridge, river"
3077,73848,outdoor,"bridge, lake/natural, pier, boathouse, river"
3078,73872,outdoor,"bridge, pier, boathouse, lake/natural, river"
3079,73896,outdoor,"lake/natural, river, bridge, pier, harbor"
3080,73920,outdoor,"bridge, arch, viaduct, lagoon, harbor"
3081,73944,outdoor,"boat_deck, balcony/interior, pier, promenade, harbor"
3082,73968,outdoor,"boat_deck, pier, harbor, lake/natural, beach"
3083,73992,outdoor,"boat_deck, pier, lake/natural, harbor, lagoon"
3084,74016,outdoor,"boat_deck, pier, harbor, lake/natural, beach"
3085,74040,outdoor,"boat_deck, pier, lake/natural, harbor, beach"
3086,74064,outdoor,"boat_deck, pier, harbor, lake/natural, lagoon"
3087,74088,outdoor,"oast_house, sky, mosque/outdoor, ocean, volleyball_court/outdoor"
3088,74112,outdoor,"oast_house, sky, wheat_field, conference_center, mosque/outdoor"
3089,74136,outdoor,"oast_house, sky, conference_center, mosque/outdoor, conference_room"
3090,74160,outdoor,"oast_house, sky, mosque/outdoor, conference_center, wheat_field"
3091,74184,outdoor,"oast_house, sky, mosque/outdoor, wheat_field, conference_center"
3092,74208,outdoor,"oast_house, sky, conference_center, mosque/outdoor, wheat_field"
3093,74232,outdoor,"oast_house, sky, conference_center, mosque/outdoor, wheat_field"
3094,74256,outdoor,"oast_house, sky, wheat_field, conference_center, mosque/outdoor"
3095,74280,outdoor,"oast_house, sky, wheat_field, mosque/outdoor, conference_center"
3096,74304,outdoor,"oast_house, sky, conference_center, mosque/outdoor, wheat_field"
3097,74328,outdoor,"oast_house, sky, conference_center, mosque/outdoor, wheat_field"
3098,74352,outdoor,"oast_house, sky, conference_center, wheat_field, mosque/outdoor"
3099,74376,outdoor,"oast_house, sky, conference_center, wheat_field, mosque/outdoor"
3100,74400,outdoor,"oast_house, sky, conference_center, wheat_field, mosque/outdoor"
3101,74424,outdoor,"oast_house, sky, mosque/outdoor, skyscraper, wheat_field"
3102,74448,outdoor,"oast_house, sky, mosque/outdoor, skyscraper, wheat_field"
3103,74472,outdoor,"oast_house, mosque/outdoor, sky, volleyball_court/outdoor, ocean"
3104,74496,indoor,"balcony/interior, porch, classroom, beauty_salon, nursery"
3105,74520,indoor,"balcony/interior, beauty_salon, porch, swimming_pool/indoor, nursery"
3106,74544,indoor,"balcony/interior, hospital_room, classroom, nursery, greenhouse/indoor"
3107,74568,indoor,"balcony/interior, nursery, greenhouse/indoor, classroom, porch"
3108,74592,indoor,"balcony/interior, classroom, bow_window/indoor, greenhouse/indoor, beauty_salon"
3109,74616,indoor,"balcony/interior, bow_window/indoor, porch, greenhouse/indoor, nursery"
3110,74640,indoor,"balcony/interior, beauty_salon, classroom, porch, waiting_room"
3111,74664,indoor,"balcony/interior, classroom, lecture_room, waiting_room, porch"
3112,74688,indoor,"balcony/interior, porch, bow_window/indoor, greenhouse/indoor, beauty_salon"
3113,74712,indoor,"balcony/interior, porch, bow_window/indoor, beauty_salon, dining_room"
3114,74736,outdoor,"balcony/interior, porch, bow_window/indoor, beauty_salon, patio"
3115,74760,indoor,"balcony/interior, nursing_home, porch, office, office_cubicles"
3116,74784,indoor,"balcony/interior, beauty_salon, nursing_home, coffee_shop, restaurant"
3117,74808,indoor,"balcony/interior, restaurant, cafeteria, coffee_shop, dining_room"
3118,74832,indoor,"balcony/interior, airport_terminal, beauty_salon, office, office_cubicles"
3119,74856,indoor,"balcony/interior, beauty_salon, porch, bow_window/indoor, hospital_room"
3120,74880,indoor,"balcony/interior, airport_terminal, greenhouse/indoor, porch, beauty_salon"
3121,74904,indoor,"balcony/interior, airport_terminal, greenhouse/indoor, office_cubicles, office"
3122,74928,indoor,"balcony/interior, airport_terminal, office, office_cubicles, greenhouse/indoor"
3123,74952,indoor,"balcony/interior, airport_terminal, office, office_cubicles, lobby"
3124,74976,indoor,"balcony/interior, airport_terminal, greenhouse/indoor, porch, beauty_salon"
3125,75000,indoor,"oast_house, conference_center, sky, conference_room, office"
3126,75024,indoor,"oast_house, conference_center, conference_room, sky, office"
3127,75048,indoor,"oast_house, conference_center, conference_room, sky, office"
3128,75072,indoor,"oast_house, conference_center, sky, conference_room, office"
3129,75096,indoor,"oast_house, conference_center, sky, conference_room, office"
3130,75120,outdoor,"oast_house, conference_center, sky, conference_room, mosque/outdoor"
3131,75144,outdoor,"oast_house, conference_center, sky, conference_room, wheat_field"
3132,75168,indoor,"oast_house, conference_center, sky, conference_room, office"
3133,75192,indoor,"conference_center, volleyball_court/outdoor, office, museum/indoor, conference_room"
3134,75216,outdoor,"shower, volleyball_court/outdoor, dressing_room, sky, wind_farm"
3135,75240,indoor,"shower, volleyball_court/outdoor, dressing_room, sky, museum/indoor"
3136,75264,outdoor,"volleyball_court/outdoor, shower, wind_farm, sky, mosque/outdoor"
3137,75288,outdoor,"volleyball_court/outdoor, shower, mosque/outdoor, museum/indoor, wind_farm"
3138,75312,outdoor,"oast_house, volleyball_court/outdoor, mosque/outdoor, conference_center, beauty_salon"
3139,75336,outdoor,"oast_house, sky, conference_center, mosque/outdoor, wind_farm"
3140,75360,outdoor,"oast_house, mosque/outdoor, sky, conference_center, wind_farm"
3141,75384,outdoor,"oast_house, mosque/outdoor, sky, tower, wind_farm"
3142,75408,outdoor,"balcony/interior, balcony/exterior, porch, beach_house, lake/natural"
3143,75432,outdoor,"balcony/interior, porch, balcony/exterior, patio, beach_house"
3144,75456,outdoor,"balcony/interior, porch, patio, balcony/exterior, pier"
3145,75480,outdoor,"balcony/interior, porch, boat_deck, mezzanine, patio"
3146,75504,outdoor,"balcony/interior, porch, patio, boat_deck, mezzanine"
3147,75528,outdoor,"lock_chamber, bridge, harbor, lake/natural, pier"
3148,75552,outdoor,"lock_chamber, bridge, pier, harbor, balcony/interior"
3149,75576,outdoor,"lock_chamber, bridge, harbor, pier, boat_deck"
3150,75600,outdoor,"lock_chamber, bridge, lake/natural, harbor, pier"
3151,75624,outdoor,"lock_chamber, bridge, balcony/interior, lake/natural, boat_deck"
3152,75648,indoor,"shower, jail_cell, bow_window/indoor, balcony/interior, fire_escape"
3153,75672,indoor,"shower, jail_cell, bow_window/indoor, balcony/interior, fire_escape"
3154,75696,indoor,"shower, jail_cell, bow_window/indoor, balcony/interior, fire_escape"
3155,75720,indoor,"shower, jail_cell, bow_window/indoor, balcony/interior, fire_escape"
3156,75744,indoor,"shower, jail_cell, bow_window/indoor, balcony/interior, fire_escape"
3157,75768,indoor,"shower, jail_cell, bow_window/indoor, balcony/interior, fire_escape"
3158,75792,indoor,"shower, jail_cell, bow_window/indoor, balcony/interior, fire_escape"
3159,75816,indoor,"shower, jail_cell, bow_window/indoor, balcony/interior, fire_escape"
3160,75840,indoor,"shower, jail_cell, bow_window/indoor, balcony/interior, fire_escape"
3161,75864,indoor,"shower, jail_cell, bow_window/indoor, balcony/interior, fire_escape"
3162,75888,indoor,"shower, jail_cell, bow_window/indoor, balcony/interior, fire_escape"
3163,75912,indoor,"balcony/interior, bow_window/indoor, airport_terminal, staircase, shower"
3164,75936,outdoor,"lock_chamber, bridge, harbor, pier, boat_deck"
3165,75960,outdoor,"lock_chamber, bridge, harbor, balcony/interior, lake/natural"
3166,75984,outdoor,"lock_chamber, bridge, harbor, balcony/interior, lake/natural"
3167,76008,outdoor,"lock_chamber, bridge, harbor, balcony/interior, lake/natural"
3168,76032,outdoor,"lock_chamber, bridge, harbor, boat_deck, pier"
3169,76056,outdoor,"jewelry_shop, lock_chamber, balcony/interior, bridge, boat_deck"
3170,76080,indoor,"wet_bar, dining_room, bathroom, reception, dressing_room"
3171,76104,indoor,"dressing_room, reception, locker_room, elevator_lobby, lobby"
3172,76128,indoor,"dressing_room, music_studio, locker_room, television_studio, clean_room"
3173,76152,indoor,"dressing_room, music_studio, clean_room, reception, television_studio"
3174,76176,indoor,"dressing_room, clean_room, music_studio, reception, locker_room"
3175,76200,indoor,"dressing_room, music_studio, clean_room, television_studio, locker_room"
3176,76224,indoor,"clean_room, dressing_room, music_studio, locker_room, reception"
3177,76248,indoor,"dressing_room, clean_room, music_studio, nursing_home, locker_room"
3178,76272,indoor,"dressing_room, music_studio, clean_room, locker_room, clothing_store"
3179,76296,indoor,"dressing_room, music_studio, locker_room, clean_room, clothing_store"
3180,76320,indoor,"dressing_room, television_studio, reception, shower, beauty_salon"
3181,76344,indoor,"dressing_room, shower, clothing_store, beauty_salon, discotheque"
3182,76368,indoor,"dressing_room, beauty_salon, shower, clothing_store, discotheque"
3183,76392,indoor,"dressing_room, shower, beauty_salon, clothing_store, science_museum"
3184,76416,indoor,"locker_room, dressing_room, office, beauty_salon, archive"
3185,76440,indoor,"dressing_room, locker_room, office, beauty_salon, archive"
3186,76464,indoor,"dressing_room, shower, beauty_salon, bathroom, clothing_store"
3187,76488,indoor,"dressing_room, shower, beauty_salon, clothing_store, science_museum"
3188,76512,indoor,"dressing_room, shower, beauty_salon, bathroom, clothing_store"
3189,76536,indoor,"dressing_room, locker_room, office, beauty_salon, archive"
3190,76560,indoor,"locker_room, dressing_room, archive, office, office_cubicles"
3191,76584,indoor,"dressing_room, shower, beauty_salon, discotheque, clothing_store"
3192,76608,indoor,"dressing_room, beauty_salon, shower, television_studio, discotheque"
3193,76632,indoor,"dressing_room, beauty_salon, shower, clothing_store, television_studio"
3194,76656,indoor,"dressing_room, television_studio, reception, shower, discotheque"
3195,76680,indoor,"dressing_room, youth_hostel, music_studio, locker_room, shower"
3196,76704,indoor,"dressing_room, clean_room, locker_room, music_studio, sauna"
3197,76728,indoor,"dressing_room, museum/indoor, art_gallery, clothing_store, artists_loft"
3198,76752,indoor,"dressing_room, museum/indoor, clean_room, locker_room, music_studio"
3199,76776,indoor,"dressing_room, museum/indoor, locker_room, art_gallery, clean_room"
3200,76800,indoor,"dressing_room, locker_room, art_gallery, museum/indoor, clothing_store"
3201,76824,indoor,"art_gallery, museum/indoor, archive, office, office_cubicles"
3202,76848,indoor,"art_gallery, archive, office, dressing_room, museum/indoor"
3203,76872,indoor,"museum/indoor, balcony/interior, art_gallery, clean_room, mezzanine"
3204,76896,indoor,"art_gallery, balcony/interior, mezzanine, museum/indoor, archive"
3205,76920,indoor,"museum/indoor, balcony/interior, archive, art_gallery, bow_window/indoor"
3206,76944,indoor,"dressing_room, jail_cell, office_cubicles, office, locker_room"
3207,76968,indoor,"dressing_room, balcony/interior, museum/indoor, art_gallery, bow_window/indoor"
3208,76992,indoor,"museum/indoor, dressing_room, art_gallery, bow_window/indoor, jewelry_shop"
3209,77016,indoor,"dressing_room, museum/indoor, bow_window/indoor, art_gallery, shower"
3210,77040,indoor,"dressing_room, museum/indoor, bow_window/indoor, art_gallery, clean_room"
3211,77064,indoor,"dressing_room, museum/indoor, jewelry_shop, bow_window/indoor, art_gallery"
3212,77088,indoor,"dressing_room, museum/indoor, bow_window/indoor, art_gallery, jewelry_shop"
3213,77112,indoor,"dressing_room, museum/indoor, art_gallery, science_museum, bow_window/indoor"
3214,77136,indoor,"dressing_room, museum/indoor, bow_window/indoor, art_gallery, clothing_store"
3215,77160,indoor,"dressing_room, museum/indoor, art_gallery, bow_window/indoor, art_studio"
3216,77184,indoor,"dressing_room, museum/indoor, art_gallery, bow_window/indoor, art_studio"
3217,77208,indoor,"dressing_room, museum/indoor, art_gallery, art_studio, science_museum"
3218,77232,indoor,"dressing_room, museum/indoor, art_gallery, bow_window/indoor, art_studio"
3219,77256,indoor,"dressing_room, museum/indoor, art_gallery, art_studio, science_museum"
3220,77280,indoor,"dressing_room, physics_laboratory, chemistry_lab, clean_room, television_studio"
3221,77304,indoor,"dressing_room, physics_laboratory, chemistry_lab, television_studio, music_studio"
3222,77328,indoor,"dressing_room, physics_laboratory, chemistry_lab, clean_room, music_studio"
3223,77352,indoor,"dressing_room, physics_laboratory, chemistry_lab, clothing_store, music_studio"
3224,77376,indoor,"dressing_room, physics_laboratory, clean_room, chemistry_lab, clothing_store"
3225,77400,indoor,"dressing_room, physics_laboratory, chemistry_lab, clothing_store, television_studio"
3226,77424,indoor,"dressing_room, chemistry_lab, physics_laboratory, clothing_store, clean_room"
3227,77448,indoor,"dressing_room, physics_laboratory, chemistry_lab, clothing_store, television_studio"
3228,77472,indoor,"dressing_room, clothing_store, chemistry_lab, physics_laboratory, clean_room"
3229,77496,indoor,"dressing_room, museum/indoor, bow_window/indoor, science_museum, balcony/interior"
3230,77520,indoor,"dressing_room, museum/indoor, science_museum, bow_window/indoor, office"
3231,77544,indoor,"dressing_room, museum/indoor, art_gallery, science_museum, bow_window/indoor"
3232,77568,indoor,"dressing_room, museum/indoor, bow_window/indoor, science_museum, art_gallery"
3233,77592,indoor,"dressing_room, museum/indoor, bow_window/indoor, balcony/interior, art_gallery"
3234,77616,indoor,"museum/indoor, dressing_room, art_gallery, science_museum, jewelry_shop"
3235,77640,indoor,"museum/indoor, dressing_room, art_gallery, science_museum, jewelry_shop"
3236,77664,indoor,"dressing_room, museum/indoor, balcony/interior, bow_window/indoor, art_gallery"
3237,77688,indoor,"dressing_room, museum/indoor, art_gallery, jewelry_shop, bow_window/indoor"
3238,77712,indoor,"dressing_room, museum/indoor, bow_window/indoor, office, nursing_home"
3239,77736,indoor,"dressing_room, museum/indoor, bow_window/indoor, science_museum, shower"
3240,77760,indoor,"dressing_room, museum/indoor, science_museum, art_gallery, bow_window/indoor"
3241,77784,indoor,"dressing_room, museum/indoor, art_gallery, bow_window/indoor, science_museum"
3242,77808,indoor,"dressing_room, museum/indoor, bow_window/indoor, art_gallery, balcony/interior"
3243,77832,indoor,"dressing_room, museum/indoor, science_museum, balcony/interior, kennel/outdoor"
3244,77856,indoor,"dressing_room, museum/indoor, science_museum, balcony/interior, stable"
3245,77880,indoor,"dressing_room, museum/indoor, nursing_home, bow_window/indoor, art_gallery"
3246,77904,indoor,"dressing_room, museum/indoor, bow_window/indoor, office, art_gallery"
3247,77928,indoor,"dressing_room, museum/indoor, bow_window/indoor, jewelry_shop, art_gallery"
3248,77952,indoor,"dressing_room, bow_window/indoor, museum/indoor, nursing_home, office"
3249,77976,indoor,"dressing_room, museum/indoor, jewelry_shop, clean_room, art_gallery"
3250,78000,indoor,"dressing_room, museum/indoor, bow_window/indoor, jewelry_shop, art_gallery"
3251,78024,indoor,"dressing_room, museum/indoor, nursing_home, bow_window/indoor, jewelry_shop"
3252,78048,indoor,"dressing_room, museum/indoor, nursing_home, office, jewelry_shop"
3253,78072,indoor,"dressing_room, museum/indoor, bow_window/indoor, art_gallery, jewelry_shop"
3254,78096,indoor,"dressing_room, museum/indoor, bow_window/indoor, jewelry_shop, art_gallery"
3255,78120,indoor,"dressing_room, museum/indoor, art_gallery, jewelry_shop, office"
3256,78144,indoor,"dressing_room, museum/indoor, bow_window/indoor, office, art_gallery"
3257,78168,indoor,"dressing_room, museum/indoor, office, bow_window/indoor, art_gallery"
3258,78192,indoor,"dressing_room, museum/indoor, office, bow_window/indoor, archive"
3259,78216,indoor,"dressing_room, museum/indoor, office, art_gallery, jewelry_shop"
3260,78240,indoor,"museum/indoor, dressing_room, kennel/outdoor, balcony/interior, art_gallery"
3261,78264,indoor,"dressing_room, physics_laboratory, chemistry_lab, locker_room, music_studio"
3262,78288,indoor,"dressing_room, physics_laboratory, chemistry_lab, music_studio, nursing_home"
3263,78312,indoor,"dressing_room, physics_laboratory, chemistry_lab, locker_room, clean_room"
3264,78336,indoor,"dressing_room, physics_laboratory, chemistry_lab, clean_room, nursing_home"
3265,78360,indoor,"dressing_room, physics_laboratory, chemistry_lab, nursing_home, office"
3266,78384,indoor,"dressing_room, physics_laboratory, chemistry_lab, nursing_home, biology_laboratory"
3267,78408,indoor,"dressing_room, physics_laboratory, chemistry_lab, nursing_home, clothing_store"
3268,78432,indoor,"dressing_room, physics_laboratory, chemistry_lab, nursing_home, music_studio"
3269,78456,indoor,"dressing_room, physics_laboratory, chemistry_lab, nursing_home, music_studio"
3270,78480,indoor,"dressing_room, physics_laboratory, chemistry_lab, nursing_home, music_studio"
3271,78504,indoor,"dressing_room, physics_laboratory, chemistry_lab, nursing_home, music_studio"
3272,78528,indoor,"dressing_room, physics_laboratory, chemistry_lab, nursing_home, locker_room"
3273,78552,indoor,"dressing_room, physics_laboratory, chemistry_lab, clothing_store, nursing_home"
3274,78576,indoor,"dressing_room, physics_laboratory, chemistry_lab, locker_room, nursing_home"
3275,78600,indoor,"dressing_room, physics_laboratory, chemistry_lab, nursing_home, locker_room"
3276,78624,indoor,"dressing_room, physics_laboratory, chemistry_lab, nursing_home, locker_room"
3277,78648,indoor,"dressing_room, chemistry_lab, physics_laboratory, nursing_home, locker_room"
3278,78672,indoor,"dressing_room, physics_laboratory, chemistry_lab, nursing_home, locker_room"
3279,78696,indoor,"dressing_room, nursing_home, chemistry_lab, clean_room, physics_laboratory"
3280,78720,indoor,"clean_room, art_gallery, jewelry_shop, biology_laboratory, clothing_store"
3281,78744,indoor,"clean_room, chemistry_lab, biology_laboratory, operating_room, lecture_room"
3282,78768,indoor,"clean_room, biology_laboratory, chemistry_lab, art_gallery, jewelry_shop"
3283,78792,indoor,"clean_room, biology_laboratory, chemistry_lab, art_gallery, science_museum"
3284,78816,indoor,"clean_room, biology_laboratory, chemistry_lab, art_gallery, science_museum"
3285,78840,indoor,"clean_room, biology_laboratory, chemistry_lab, art_gallery, science_museum"
3286,78864,indoor,"biology_laboratory, clean_room, chemistry_lab, art_gallery, science_museum"
3287,78888,indoor,"biology_laboratory, chemistry_lab, clean_room, art_gallery, science_museum"
3288,78912,indoor,"biology_laboratory, clean_room, chemistry_lab, physics_laboratory, lecture_room"
3289,78936,indoor,"biology_laboratory, clean_room, chemistry_lab, jewelry_shop, physics_laboratory"
3290,78960,indoor,"clean_room, biology_laboratory, chemistry_lab, nursing_home, physics_laboratory"
3291,78984,indoor,"biology_laboratory, clean_room, chemistry_lab, physics_laboratory, art_gallery"
3292,79008,indoor,"biology_laboratory, chemistry_lab, clean_room, physics_laboratory, nursing_home"
3293,79032,indoor,"biology_laboratory, chemistry_lab, clean_room, physics_laboratory, nursing_home"
3294,79056,indoor,"biology_laboratory, chemistry_lab, clean_room, physics_laboratory, lecture_room"
3295,79080,indoor,"biology_laboratory, clean_room, chemistry_lab, physics_laboratory, operating_room"
3296,79104,indoor,"biology_laboratory, clean_room, chemistry_lab, operating_room, physics_laboratory"
3297,79128,indoor,"clean_room, biology_laboratory, jewelry_shop, chemistry_lab, pharmacy"
