,frame_num,environment,places
1532,36768,indoor,"archive, museum/indoor, jewelry_shop, science_museum, clean_room"
1533,36792,indoor,"archive, jewelry_shop, museum/indoor, beauty_salon, clean_room"
1534,36816,indoor,"archive, museum/indoor, clean_room, jewelry_shop, beauty_salon"
1535,36840,indoor,"museum/indoor, jewelry_shop, archive, clean_room, natural_history_museum"
1536,36864,indoor,"museum/indoor, jewelry_shop, clean_room, archive, beauty_salon"
1537,36888,indoor,"ice_cream_parlor, jewelry_shop, clean_room, museum/indoor, beauty_salon"
1538,36912,indoor,"clean_room, beauty_salon, jewelry_shop, office, archive"
1539,36936,indoor,"dressing_room, beauty_salon, clothing_store, reception, jewelry_shop"
1540,36960,indoor,"reception, nursing_home, dressing_room, beauty_salon, office"
1541,36984,indoor,"reception, elevator_lobby, television_studio, lobby, beauty_salon"
1542,37008,indoor,"dressing_room, nursing_home, beauty_salon, office, hospital_room"
1543,37032,indoor,"elevator/door, nursing_home, office, elevator_lobby, clean_room"
1544,37056,indoor,"elevator/door, elevator_lobby, shower, reception, nursing_home"
1545,37080,indoor,"elevator/door, nursing_home, elevator_lobby, reception, beauty_salon"
1546,37104,indoor,"nursing_home, reception, elevator/door, elevator_lobby, office"
1547,37128,indoor,"nursing_home, elevator/door, beauty_salon, elevator_lobby, reception"
1548,37152,indoor,"nursing_home, beauty_salon, reception, television_studio, clean_room"
1549,37176,indoor,"television_studio, beauty_salon, reception, office, coffee_shop"
1550,37200,indoor,"television_studio, beauty_salon, reception, museum/indoor, nursing_home"
1551,37224,indoor,"television_studio, reception, museum/indoor, conference_center, beauty_salon"
1552,37248,indoor,"television_studio, beauty_salon, conference_center, nursing_home, reception"
1553,37272,indoor,"reception, television_studio, beauty_salon, coffee_shop, conference_center"
1554,37296,indoor,"beauty_salon, natural_history_museum, reception, museum/indoor, science_museum"
1555,37320,indoor,"beauty_salon, reception, television_studio, natural_history_museum, jewelry_shop"
1556,37344,indoor,"beauty_salon, reception, television_studio, jewelry_shop, natural_history_museum"
1557,37368,indoor,"beauty_salon, natural_history_museum, television_studio, science_museum, jewelry_shop"
1558,37392,indoor,"beauty_salon, television_studio, conference_center, lecture_room, nursing_home"
1559,37416,indoor,"nursing_home, dressing_room, hospital_room, clean_room, beauty_salon"
1560,37440,indoor,"dressing_room, nursing_home, clean_room, hospital_room, beauty_salon"
1561,37464,indoor,"dressing_room, nursing_home, hospital_room, beauty_salon, clean_room"
1562,37488,indoor,"dressing_room, clean_room, hospital_room, beauty_salon, nursing_home"
1563,37512,indoor,"dressing_room, nursing_home, hospital_room, beauty_salon, clean_room"
1564,37536,indoor,"dressing_room, beauty_salon, clean_room, hospital_room, jewelry_shop"
1565,37560,indoor,"dressing_room, nursing_home, clean_room, hospital_room, beauty_salon"
1566,37584,indoor,"dressing_room, nursing_home, hospital_room, beauty_salon, jewelry_shop"
1567,37608,indoor,"nursing_home, dressing_room, hospital_room, clean_room, beauty_salon"
1568,37632,indoor,"dressing_room, nursing_home, clean_room, beauty_salon, hospital_room"
1569,37656,indoor,"television_studio, beauty_salon, museum/indoor, reception, natural_history_museum"
1570,37680,indoor,"beauty_salon, natural_history_museum, television_studio, reception, museum/indoor"
1571,37704,indoor,"reception, conference_room, conference_center, science_museum, office"
1572,37728,indoor,"dressing_room, nursing_home, hospital_room, clean_room, beauty_salon"
1573,37752,indoor,"dressing_room, nursing_home, clean_room, art_gallery, beauty_salon"
1574,37776,indoor,"dressing_room, clothing_store, beauty_salon, nursing_home, shower"
1575,37800,indoor,"dressing_room, nursing_home, lecture_room, clean_room, music_studio"
1576,37824,indoor,"dressing_room, beauty_salon, nursing_home, lecture_room, classroom"
1577,37848,indoor,"dressing_room, beauty_salon, nursing_home, lecture_room, clothing_store"
1578,37872,indoor,"dressing_room, nursing_home, beauty_salon, shower, clean_room"
1579,37896,indoor,"dressing_room, nursing_home, beauty_salon, clean_room, hospital_room"
1580,37920,indoor,"dressing_room, nursing_home, beauty_salon, music_studio, chemistry_lab"
1581,37944,indoor,"nursing_home, dressing_room, music_studio, beauty_salon, lecture_room"
1582,37968,indoor,"dressing_room, nursing_home, beauty_salon, music_studio, shower"
1583,37992,indoor,"nursing_home, dressing_room, beauty_salon, clean_room, lecture_room"
1584,38016,indoor,"nursing_home, dressing_room, beauty_salon, chemistry_lab, biology_laboratory"
1585,38040,indoor,"nursing_home, dressing_room, chemistry_lab, clean_room, biology_laboratory"
1586,38064,indoor,"dressing_room, beauty_salon, clothing_store, nursing_home, jewelry_shop"
1587,38088,indoor,"dressing_room, beauty_salon, chemistry_lab, biology_laboratory, bathroom"
1588,38112,indoor,"chemistry_lab, dressing_room, nursing_home, beauty_salon, biology_laboratory"
1589,38136,indoor,"nursing_home, chemistry_lab, conference_center, clean_room, office"
1590,38160,indoor,"nursing_home, jewelry_shop, chemistry_lab, lecture_room, conference_center"
1591,38184,indoor,"jewelry_shop, nursing_home, conference_center, office, chemistry_lab"
1592,38208,indoor,"dressing_room, beauty_salon, jewelry_shop, clothing_store, chemistry_lab"
1593,38232,indoor,"dressing_room, lecture_room, classroom, chemistry_lab, art_gallery"
1594,38256,indoor,"dressing_room, lecture_room, chemistry_lab, beauty_salon, museum/indoor"
1595,38280,indoor,"lecture_room, classroom, nursing_home, conference_center, dressing_room"
1596,38304,indoor,"lecture_room, art_gallery, museum/indoor, dressing_room, classroom"
1597,38328,indoor,"art_gallery, museum/indoor, dressing_room, jewelry_shop, reception"
1598,38352,indoor,"dressing_room, lecture_room, chemistry_lab, beauty_salon, art_gallery"
1599,38376,indoor,"dressing_room, lecture_room, chemistry_lab, office, nursing_home"
1600,38400,indoor,"reception, television_studio, conference_center, beauty_salon, lecture_room"
1601,38424,indoor,"beauty_salon, reception, television_studio, nursing_home, museum/indoor"
1602,38448,indoor,"beauty_salon, reception, conference_center, television_studio, conference_room"
1603,38472,indoor,"reception, beauty_salon, television_studio, conference_center, conference_room"
1604,38496,indoor,"reception, beauty_salon, conference_center, television_studio, conference_room"
1605,38520,indoor,"conference_center, reception, television_studio, beauty_salon, conference_room"
1606,38544,indoor,"conference_center, beauty_salon, television_studio, reception, conference_room"
1607,38568,indoor,"reception, beauty_salon, conference_center, television_studio, conference_room"
1608,38592,indoor,"reception, conference_center, beauty_salon, television_studio, conference_room"
1609,38616,indoor,"reception, conference_center, conference_room, television_studio, beauty_salon"
1610,38640,indoor,"beauty_salon, nursing_home, art_gallery, dressing_room, ice_cream_parlor"
1611,38664,indoor,"nursing_home, hospital_room, dressing_room, beauty_salon, nursery"
1612,38688,indoor,"nursery, hospital_room, nursing_home, childs_room, youth_hostel"
1613,38712,indoor,"nursery, hospital_room, nursing_home, childs_room, bow_window/indoor"
1614,38736,indoor,"nursery, nursing_home, hospital_room, ice_cream_parlor, childs_room"
1615,38760,indoor,"nursing_home, hospital_room, ice_cream_parlor, nursery, beauty_salon"
1616,38784,indoor,"hospital_room, nursing_home, nursery, beauty_salon, youth_hostel"
1617,38808,indoor,"hospital_room, nursery, nursing_home, childs_room, shower"
1618,38832,indoor,"office, conference_room, conference_center, reception, office_cubicles"
1619,38856,indoor,"office, conference_room, conference_center, office_cubicles, reception"
1620,38880,indoor,"office, conference_center, reception, office_cubicles, lecture_room"
1621,38904,indoor,"office, conference_room, reception, home_office, office_cubicles"
1622,38928,indoor,"office, conference_room, reception, conference_center, office_cubicles"
1623,38952,indoor,"office, reception, office_cubicles, conference_center, conference_room"
1624,38976,indoor,"office, conference_room, reception, office_cubicles, conference_center"
1625,39000,indoor,"office, reception, conference_room, conference_center, office_cubicles"
1626,39024,indoor,"office, conference_room, reception, office_cubicles, conference_center"
1627,39048,indoor,"hospital_room, nursery, bow_window/indoor, nursing_home, youth_hostel"
1628,39072,indoor,"hospital_room, dressing_room, nursery, clean_room, nursing_home"
1629,39096,indoor,"dressing_room, hospital_room, clean_room, nursery, butchers_shop"
1630,39120,indoor,"television_studio, lecture_room, art_gallery, office, conference_center"
1631,39144,indoor,"office, television_studio, reception, biology_laboratory, office_cubicles"
1632,39168,indoor,"television_studio, reception, office, art_gallery, physics_laboratory"
1633,39192,indoor,"office, television_studio, biology_laboratory, art_gallery, reception"
1634,39216,indoor,"television_studio, office, reception, art_gallery, clean_room"
1635,39240,indoor,"dressing_room, nursery, butchers_shop, clean_room, natural_history_museum"
1636,39264,indoor,"dressing_room, nursery, clean_room, bathroom, shower"
1637,39288,indoor,"nursery, dressing_room, clean_room, dining_room, hospital_room"
1638,39312,indoor,"dining_room, nursery, home_office, bow_window/indoor, jewelry_shop"
1639,39336,indoor,"sauna, art_studio, shower, chemistry_lab, slum"
1640,39360,indoor,"discotheque, beauty_salon, dressing_room, slum, sauna"
1641,39384,indoor,"beauty_salon, slum, restaurant, discotheque, bar"
1642,39408,indoor,"beauty_salon, slum, restaurant, discotheque, bar"
1643,39432,indoor,"restaurant, beauty_salon, bar, slum, discotheque"
1644,39456,indoor,"beauty_salon, dressing_room, restaurant, discotheque, bar"
1645,39480,indoor,"beauty_salon, dressing_room, restaurant, slum, discotheque"
1646,39504,indoor,"beauty_salon, dressing_room, restaurant, bar, slum"
1647,39528,indoor,"beauty_salon, dressing_room, restaurant, bus_interior, slum"
1648,39552,outdoor,"corn_field, fountain, wheat_field, carrousel, slum"
1649,39576,outdoor,"fire_station, playground, schoolhouse, campus, yard"
1650,39600,indoor,"stage/indoor, bamboo_forest, train_station/platform, campus, subway_station/platform"
1651,39624,outdoor,"campus, playground, fire_station, train_station/platform, railroad_track"
1652,39648,outdoor,"campus, train_station/platform, fire_station, bamboo_forest, rope_bridge"
1653,39672,outdoor,"corn_field, tree_farm, hot_spring, wheat_field, army_base"
1654,39696,outdoor,"tree_farm, desert/vegetation, cemetery, wheat_field, bamboo_forest"
1655,39720,indoor,"clothing_store, jewelry_shop, department_store, dressing_room, gift_shop"
1656,39744,indoor,"chemistry_lab, jewelry_shop, biology_laboratory, stage/outdoor, dressing_room"
1657,39768,indoor,"bazaar/outdoor, jewelry_shop, flea_market/indoor, market/outdoor, clothing_store"
1658,39792,outdoor,"boat_deck, playground, train_interior, bus_interior, wheat_field"
1659,39816,indoor,"boat_deck, train_interior, bus_interior, ticket_booth, balcony/interior"
1660,39840,indoor,"discotheque, stage/outdoor, arena/performance, stage/indoor, yard"
1661,39864,indoor,"market/outdoor, beer_garden, clothing_store, beer_hall, jewelry_shop"
1662,39888,indoor,"clothing_store, jewelry_shop, market/outdoor, flea_market/indoor, bazaar/outdoor"
1663,39912,indoor,"nursing_home, market/outdoor, beer_hall, banquet_hall, conference_center"
1664,39936,indoor,"conference_center, campus, nursing_home, beer_hall, beer_garden"
1665,39960,indoor,"ticket_booth, train_station/platform, boat_deck, subway_station/platform, bus_station/indoor"
1666,39984,outdoor,"campsite, boat_deck, pavilion, gazebo/exterior, ticket_booth"
1667,40008,outdoor,"ticket_booth, boat_deck, hot_spring, pavilion, swimming_pool/outdoor"
1668,40032,indoor,"shower, beer_garden, fountain, beauty_salon, bar"
1669,40056,outdoor,"highway, campsite, train_station/platform, igloo, railroad_track"
1670,40080,outdoor,"campsite, boat_deck, highway, driveway, shed"
1671,40104,indoor,"ticket_booth, train_station/platform, phone_booth, subway_station/platform, igloo"
1672,40128,outdoor,"parking_lot, shower, cemetery, playground, fountain"
1673,40152,outdoor,"beer_hall, volleyball_court/outdoor, slum, water_tower, beach_house"
1674,40176,outdoor,"beach_house, mosque/outdoor, motel, inn/outdoor, amusement_park"
1675,40200,outdoor,"restaurant_patio, diner/outdoor, bazaar/outdoor, promenade, amusement_park"
1676,40224,outdoor,"restaurant_patio, beach_house, bazaar/outdoor, diner/outdoor, inn/outdoor"
1677,40248,outdoor,"bazaar/outdoor, restaurant_patio, stage/outdoor, diner/outdoor, ticket_booth"
1678,40272,outdoor,"bazaar/outdoor, mosque/outdoor, amusement_park, stage/outdoor, kasbah"
1679,40296,outdoor,"bazaar/outdoor, promenade, beach_house, mosque/outdoor, kasbah"
1680,40320,indoor,"assembly_line, auto_factory, carrousel, boat_deck, hardware_store"
1681,40344,indoor,"carrousel, assembly_line, auto_factory, clean_room, amusement_park"
1682,40368,indoor,"auto_factory, assembly_line, clean_room, carrousel, amusement_park"
1683,40392,indoor,"carrousel, auto_factory, assembly_line, amusement_park, clean_room"
1684,40416,indoor,"clean_room, carrousel, auto_factory, assembly_line, amusement_park"
1685,40440,outdoor,"pavilion, restaurant_patio, carrousel, gazebo/exterior, boat_deck"
1686,40464,outdoor,"pavilion, restaurant_patio, carrousel, boat_deck, gazebo/exterior"
1687,40488,outdoor,"pavilion, restaurant_patio, carrousel, boat_deck, gazebo/exterior"
1688,40512,outdoor,"pavilion, restaurant_patio, boat_deck, carrousel, gazebo/exterior"
1689,40536,outdoor,"pavilion, restaurant_patio, carrousel, boat_deck, gazebo/exterior"
1690,40560,outdoor,"pavilion, restaurant_patio, boat_deck, carrousel, amusement_park"
1691,40584,indoor,"assembly_line, auto_factory, carrousel, bus_interior, ice_skating_rink/indoor"
1692,40608,outdoor,"assembly_line, carrousel, bazaar/outdoor, ice_skating_rink/indoor, ice_skating_rink/outdoor"
1693,40632,outdoor,"restaurant_patio, pavilion, airport_terminal, cafeteria, diner/outdoor"
1694,40656,outdoor,"pavilion, restaurant_patio, airport_terminal, cafeteria, amusement_park"
1695,40680,outdoor,"pavilion, restaurant_patio, cafeteria, airport_terminal, carrousel"
1696,40704,indoor,"bazaar/outdoor, shopping_mall/indoor, ice_skating_rink/outdoor, ice_skating_rink/indoor, assembly_line"
1697,40728,indoor,"ice_skating_rink/outdoor, bazaar/outdoor, ice_skating_rink/indoor, shopping_mall/indoor, assembly_line"
1698,40752,outdoor,"pavilion, restaurant_patio, carrousel, cafeteria, airport_terminal"
1699,40776,outdoor,"pavilion, restaurant_patio, cafeteria, diner/outdoor, airport_terminal"
1700,40800,outdoor,"pavilion, restaurant_patio, cafeteria, airport_terminal, gazebo/exterior"
1701,40824,outdoor,"pavilion, restaurant_patio, bridge, cafeteria, carrousel"
1702,40848,outdoor,"pavilion, restaurant_patio, boat_deck, carrousel, gazebo/exterior"
1703,40872,outdoor,"army_base, bazaar/outdoor, plaza, campus, train_station/platform"
1704,40896,outdoor,"bazaar/outdoor, army_base, ice_skating_rink/outdoor, plaza, market/outdoor"
1705,40920,outdoor,"pavilion, restaurant_patio, carrousel, gazebo/exterior, cafeteria"
1706,40944,outdoor,"pavilion, restaurant_patio, carrousel, gazebo/exterior, airport_terminal"
1707,40968,outdoor,"pavilion, restaurant_patio, carrousel, gazebo/exterior, boat_deck"
1708,40992,outdoor,"pavilion, restaurant_patio, carrousel, gazebo/exterior, boat_deck"
1709,41016,outdoor,"pavilion, restaurant_patio, carrousel, gazebo/exterior, boat_deck"
1710,41040,outdoor,"pavilion, restaurant_patio, carrousel, gazebo/exterior, boat_deck"
1711,41064,outdoor,"pavilion, restaurant_patio, gazebo/exterior, carrousel, boat_deck"
1712,41088,outdoor,"pavilion, restaurant_patio, gazebo/exterior, carrousel, boat_deck"
1713,41112,outdoor,"pavilion, restaurant_patio, gazebo/exterior, carrousel, boat_deck"
1714,41136,outdoor,"pavilion, restaurant_patio, gazebo/exterior, carrousel, boat_deck"
1715,41160,outdoor,"pavilion, restaurant_patio, carrousel, gazebo/exterior, boat_deck"
1716,41184,outdoor,"pavilion, restaurant_patio, carrousel, boat_deck, gazebo/exterior"
1717,41208,outdoor,"pavilion, restaurant_patio, carrousel, boat_deck, gazebo/exterior"
1718,41232,outdoor,"pavilion, restaurant_patio, carrousel, boat_deck, gazebo/exterior"
1719,41256,outdoor,"pavilion, restaurant_patio, carrousel, gazebo/exterior, boat_deck"
1720,41280,outdoor,"pavilion, restaurant_patio, gazebo/exterior, carrousel, harbor"
1721,41304,outdoor,"pavilion, restaurant_patio, harbor, boat_deck, cafeteria"
1722,41328,outdoor,"pavilion, restaurant_patio, gazebo/exterior, cafeteria, carrousel"
1723,41352,outdoor,"restaurant_patio, pavilion, cafeteria, gazebo/exterior, boat_deck"
1724,41376,outdoor,"ice_skating_rink/outdoor, army_base, plaza, playground, bazaar/outdoor"
1725,41400,outdoor,"pavilion, restaurant_patio, cafeteria, boat_deck, carrousel"
1726,41424,outdoor,"pavilion, boat_deck, carrousel, cafeteria, restaurant_patio"
1727,41448,outdoor,"boat_deck, pavilion, restaurant_patio, bridge, cafeteria"
1728,41472,outdoor,"pavilion, carrousel, boat_deck, restaurant_patio, airport_terminal"
1729,41496,outdoor,"pavilion, boat_deck, restaurant_patio, carrousel, stage/outdoor"
1730,41520,outdoor,"army_base, promenade, bazaar/outdoor, ice_skating_rink/outdoor, construction_site"
1731,41544,outdoor,"army_base, ice_skating_rink/outdoor, bazaar/outdoor, construction_site, gas_station"
1732,41568,outdoor,"boat_deck, restaurant_patio, pavilion, harbor, bridge"
1733,41592,indoor,"staircase, mezzanine, fire_escape, atrium/public, escalator/indoor"
1734,41616,indoor,"staircase, mezzanine, fire_escape, atrium/public, escalator/indoor"
1735,41640,indoor,"staircase, fire_escape, mezzanine, elevator_shaft, atrium/public"
1736,41664,outdoor,"airport_terminal, restaurant_patio, boat_deck, pavilion, harbor"
1737,41688,outdoor,"boat_deck, pavilion, restaurant_patio, harbor, bridge"
1738,41712,outdoor,"boat_deck, harbor, restaurant_patio, pavilion, bridge"
1739,41736,outdoor,"boat_deck, restaurant_patio, pavilion, harbor, bridge"
1740,41760,outdoor,"boat_deck, restaurant_patio, harbor, pavilion, bridge"
1741,41784,outdoor,"boat_deck, harbor, restaurant_patio, bridge, pavilion"
1742,41808,outdoor,"restaurant_patio, pavilion, beer_garden, cafeteria, boat_deck"
1743,41832,outdoor,"restaurant_patio, cafeteria, pavilion, boat_deck, airport_terminal"
1744,41856,outdoor,"pavilion, pier, gazebo/exterior, bridge, river"
1745,41880,outdoor,"pier, harbor, bridge, river, lake/natural"
1746,41904,outdoor,"bazaar/outdoor, army_base, landfill, construction_site, street"
1747,41928,outdoor,"bazaar/outdoor, army_base, construction_site, junkyard, landfill"
1748,41952,outdoor,"pier, lake/natural, bridge, boat_deck, pavilion"
1749,41976,outdoor,"pavilion, boat_deck, gazebo/exterior, river, lake/natural"
1750,42000,outdoor,"pavilion, river, lake/natural, pier, boathouse"
1751,42024,outdoor,"pavilion, bridge, river, pier, harbor"
1752,42048,indoor,"dressing_room, nursing_home, beauty_salon, bar, bus_interior"
1753,42072,indoor,"dressing_room, beauty_salon, nursing_home, bar, stage/indoor"
1754,42096,indoor,"dressing_room, nursing_home, beauty_salon, bus_interior, bar"
1755,42120,indoor,"nursing_home, bus_interior, beauty_salon, bar, chemistry_lab"
1756,42144,indoor,"nursing_home, chemistry_lab, bar, bus_interior, beauty_salon"
1757,42168,indoor,"beauty_salon, nursing_home, bar, dressing_room, bus_interior"
1758,42192,indoor,"dressing_room, beauty_salon, bus_interior, train_interior, clothing_store"
1759,42216,indoor,"beauty_salon, nursing_home, bus_interior, dressing_room, hospital_room"
1760,42240,indoor,"nursing_home, beauty_salon, bus_interior, dressing_room, train_interior"
1761,42264,indoor,"nursing_home, beauty_salon, bus_interior, dressing_room, train_interior"
1762,42288,indoor,"nursing_home, beauty_salon, dressing_room, throne_room, bus_interior"
1763,42312,indoor,"nursing_home, beauty_salon, dressing_room, butchers_shop, throne_room"
1764,42336,indoor,"nursing_home, beauty_salon, dressing_room, hospital_room, throne_room"
1765,42360,indoor,"nursing_home, beauty_salon, dressing_room, throne_room, hospital_room"
1766,42384,indoor,"nursing_home, dressing_room, beauty_salon, bus_interior, butchers_shop"
1767,42408,indoor,"dressing_room, bus_interior, nursing_home, beauty_salon, butchers_shop"
1768,42432,indoor,"nursing_home, bus_interior, dressing_room, beauty_salon, bar"
1769,42456,indoor,"nursing_home, beauty_salon, dressing_room, bedchamber, living_room"
1770,42480,indoor,"nursing_home, beauty_salon, dressing_room, bus_interior, bedchamber"
1771,42504,indoor,"nursing_home, beauty_salon, bus_interior, dressing_room, hospital_room"
1772,42528,indoor,"nursing_home, beauty_salon, bus_interior, dressing_room, hospital_room"
1773,42552,indoor,"nursing_home, beauty_salon, dressing_room, bus_interior, butchers_shop"
1774,42576,indoor,"beauty_salon, nursing_home, bus_interior, dressing_room, butchers_shop"
1775,42600,indoor,"beauty_salon, nursing_home, bar, dressing_room, bus_interior"
1776,42624,indoor,"nursing_home, beauty_salon, hospital_room, bar, dressing_room"
1777,42648,indoor,"nursing_home, beauty_salon, hospital_room, butchers_shop, bar"
1778,42672,indoor,"nursing_home, beauty_salon, bar, dressing_room, living_room"
1779,42696,indoor,"bar, beauty_salon, nursing_home, bus_interior, dressing_room"
1780,42720,indoor,"dressing_room, bar, chemistry_lab, clothing_store, art_studio"
1781,42744,indoor,"beauty_salon, art_studio, dressing_room, alcove, nursing_home"
1782,42768,indoor,"art_studio, alcove, throne_room, classroom, church/indoor"
1783,42792,indoor,"alcove, church/indoor, art_studio, throne_room, dressing_room"
1784,42816,indoor,"throne_room, stage/indoor, alcove, church/indoor, dressing_room"
1785,42840,indoor,"bus_interior, train_interior, bar, chemistry_lab, nursing_home"
1786,42864,indoor,"bus_interior, nursing_home, train_interior, beauty_salon, hospital_room"
1787,42888,indoor,"nursing_home, bus_interior, train_interior, throne_room, alcove"
1788,42912,indoor,"bus_interior, bar, train_interior, nursing_home, chemistry_lab"
1789,42936,indoor,"bus_interior, train_interior, throne_room, nursing_home, bow_window/indoor"
1790,42960,indoor,"bus_interior, train_interior, alcove, throne_room, nursing_home"
1791,42984,indoor,"bus_interior, beauty_salon, train_interior, bar, nursing_home"
1792,43008,indoor,"nursing_home, bus_interior, train_interior, throne_room, beauty_salon"
1793,43032,indoor,"nursing_home, bus_interior, train_interior, beauty_salon, bow_window/indoor"
1794,43056,indoor,"nursing_home, bus_interior, train_interior, beauty_salon, bar"
1795,43080,indoor,"bus_interior, train_interior, nursing_home, carrousel, beauty_salon"
1796,43104,indoor,"bus_interior, train_interior, nursing_home, beauty_salon, bar"
1797,43128,indoor,"bus_interior, nursing_home, train_interior, beauty_salon, living_room"
1798,43152,indoor,"nursing_home, alcove, bus_interior, throne_room, living_room"
1799,43176,indoor,"bus_interior, train_interior, alcove, nursing_home, throne_room"
1800,43200,indoor,"bus_interior, alcove, train_interior, throne_room, bow_window/indoor"
1801,43224,outdoor,"restaurant_patio, cafeteria, harbor, boat_deck, pavilion"
1802,43248,outdoor,"restaurant_patio, cafeteria, harbor, pavilion, beer_garden"
1803,43272,outdoor,"restaurant_patio, cafeteria, harbor, boat_deck, pavilion"
1804,43296,outdoor,"restaurant_patio, harbor, boat_deck, cafeteria, bridge"
1805,43320,indoor,"jewelry_shop, chemistry_lab, clean_room, bakery/shop, gift_shop"
1806,43344,indoor,"lobby, atrium/public, science_museum, jewelry_shop, restaurant"
1807,43368,indoor,"lobby, atrium/public, cafeteria, shopping_mall/indoor, science_museum"
1808,43392,indoor,"dining_room, bow_window/indoor, dining_hall, nursery, jewelry_shop"
1809,43416,indoor,"bow_window/indoor, dining_room, jewelry_shop, dining_hall, nursery"
1810,43440,indoor,"clean_room, jewelry_shop, bow_window/indoor, nursery, archive"
1811,43464,indoor,"jewelry_shop, clean_room, chemistry_lab, biology_laboratory, ice_cream_parlor"
1812,43488,indoor,"jewelry_shop, biology_laboratory, chemistry_lab, clean_room, beauty_salon"
1813,43512,indoor,"chemistry_lab, jewelry_shop, biology_laboratory, clean_room, dining_hall"
1814,43536,indoor,"jewelry_shop, chemistry_lab, biology_laboratory, clean_room, dining_hall"
1815,43560,indoor,"jewelry_shop, chemistry_lab, biology_laboratory, dining_hall, clean_room"
1816,43584,indoor,"chemistry_lab, biology_laboratory, jewelry_shop, physics_laboratory, dining_hall"
1817,43608,indoor,"jewelry_shop, chemistry_lab, biology_laboratory, clean_room, physics_laboratory"
1818,43632,indoor,"jewelry_shop, chemistry_lab, biology_laboratory, dining_hall, clean_room"
1819,43656,indoor,"jewelry_shop, chemistry_lab, dining_hall, biology_laboratory, clean_room"
1820,43680,indoor,"jewelry_shop, chemistry_lab, biology_laboratory, physics_laboratory, dining_hall"
1821,43704,indoor,"jewelry_shop, biology_laboratory, chemistry_lab, ice_cream_parlor, restaurant"
1822,43728,indoor,"jewelry_shop, chemistry_lab, dining_hall, clean_room, biology_laboratory"
1823,43752,indoor,"jewelry_shop, dining_hall, ice_cream_parlor, chemistry_lab, restaurant"
1824,43776,indoor,"jewelry_shop, chemistry_lab, dining_hall, biology_laboratory, banquet_hall"
1825,43800,indoor,"jewelry_shop, chemistry_lab, dining_hall, biology_laboratory, restaurant"
1826,43824,indoor,"jewelry_shop, chemistry_lab, biology_laboratory, dining_hall, banquet_hall"
