,frame_num,environment,places
0,0,outdoor,"desert/sand, sky, beach, lake/natural, marsh"
1,24,outdoor,"desert/sand, sky, beach, lake/natural, marsh"
2,48,outdoor,"desert/sand, sky, beach, lake/natural, marsh"
3,72,outdoor,"motel, hospital, tower, art_gallery, science_museum"
4,96,outdoor,"motel, tower, drugstore, mosque/outdoor, bowling_alley"
5,120,outdoor,"motel, tower, bowling_alley, mosque/outdoor, drugstore"
6,144,outdoor,"motel, tower, mosque/outdoor, bowling_alley, drugstore"
7,168,outdoor,"motel, tower, mosque/outdoor, bowling_alley, drugstore"
8,192,outdoor,"motel, mosque/outdoor, tower, church/outdoor, bowling_alley"
9,216,outdoor,"motel, tower, mosque/outdoor, bowling_alley, church/outdoor"
10,240,outdoor,"motel, tower, mosque/outdoor, bowling_alley, courthouse"
11,264,outdoor,"motel, tower, mosque/outdoor, drugstore, pharmacy"
12,288,indoor,"pharmacy, hospital, motel, drugstore, hospital_room"
13,312,indoor,"pharmacy, motel, drugstore, hospital, ice_cream_parlor"
14,336,outdoor,"pharmacy, motel, drugstore, hospital, sky"
15,360,outdoor,"pharmacy, drugstore, motel, hospital, sky"
16,384,outdoor,"pharmacy, drugstore, motel, sky, hospital"
17,408,outdoor,"pharmacy, motel, drugstore, sky, hospital"
18,432,outdoor,"pharmacy, drugstore, motel, sky, hospital"
19,456,outdoor,"pharmacy, drugstore, motel, hospital, sky"
20,480,indoor,"hospital, pharmacy, hospital_room, drugstore, motel"
21,504,indoor,"playroom, nursery, childs_room, kindergarden_classroom, science_museum"
22,528,indoor,"recreation_room, office_cubicles, science_museum, office, playroom"
23,552,indoor,"recreation_room, bowling_alley, amusement_arcade, science_museum, reception"
24,576,indoor,"bowling_alley, discotheque, stage/indoor, amusement_arcade, recreation_room"
25,600,indoor,"bowling_alley, discotheque, amusement_arcade, recreation_room, stage/indoor"
26,624,indoor,"bowling_alley, discotheque, stage/indoor, recreation_room, amusement_arcade"
27,648,indoor,"bowling_alley, waiting_room, recreation_room, airport_terminal, amusement_arcade"
28,672,indoor,"bowling_alley, amusement_arcade, conference_center, waiting_room, computer_room"
29,696,outdoor,"office_building, skyscraper, hospital, downtown, sky"
30,720,indoor,"attic, entrance_hall, bow_window/indoor, alcove, skyscraper"
31,744,indoor,"artists_loft, skyscraper, art_gallery, bow_window/indoor, museum/indoor"
32,768,indoor,"staircase, jail_cell, building_facade, office_building, entrance_hall"
33,792,outdoor,"motel, hospital, skyscraper, tower, pharmacy"
34,816,indoor,"artists_loft, museum/indoor, art_gallery, skyscraper, lobby"
35,840,indoor,"server_room, art_gallery, science_museum, museum/indoor, playroom"
36,864,indoor,"hospital, booth/indoor, ticket_booth, reception, hospital_room"
37,888,outdoor,"hospital, pharmacy, kennel/outdoor, hospital_room, shopfront"
38,912,outdoor,"shower, bullring, office_building, jail_cell, hospital"
39,936,outdoor,"hospital, office_building, skyscraper, hotel/outdoor, apartment_building/outdoor"
40,960,outdoor,"office_building, skyscraper, hospital, hotel/outdoor, tower"
41,984,outdoor,"skyscraper, tower, office_building, hotel/outdoor, downtown"
42,1008,indoor,"skyscraper, office_building, archive, art_gallery, elevator/door"
43,1032,outdoor,"skyscraper, office_building, tower, downtown, apartment_building/outdoor"
44,1056,indoor,"pharmacy, drugstore, hospital, elevator/door, motel"
45,1080,indoor,"pharmacy, hospital, drugstore, elevator/door, motel"
46,1104,indoor,"pharmacy, drugstore, hospital, elevator/door, motel"
47,1128,outdoor,"tower, skyscraper, downtown, office_building, server_room"
48,1152,indoor,"computer_room, playroom, skyscraper, office, server_room"
49,1176,indoor,"windmill, wind_farm, computer_room, science_museum, music_studio"
50,1200,indoor,"computer_room, television_studio, music_studio, science_museum, home_theater"
51,1224,indoor,"science_museum, computer_room, home_theater, conference_center, television_studio"
52,1248,indoor,"science_museum, bowling_alley, computer_room, home_theater, airport_terminal"
53,1272,indoor,"science_museum, computer_room, museum/indoor, home_theater, television_studio"
54,1296,indoor,"science_museum, computer_room, television_studio, conference_center, home_theater"
55,1320,indoor,"computer_room, airport_terminal, science_museum, bowling_alley, server_room"
56,1344,indoor,"airport_terminal, artists_loft, computer_room, waiting_room, lobby"
57,1368,indoor,"artists_loft, airport_terminal, lobby, waiting_room, atrium/public"
58,1392,indoor,"artists_loft, art_gallery, waiting_room, computer_room, airport_terminal"
59,1416,indoor,"artists_loft, art_gallery, atrium/public, airport_terminal, hotel/outdoor"
60,1440,indoor,"artists_loft, airport_terminal, atrium/public, lobby, art_gallery"
61,1464,indoor,"artists_loft, bow_window/indoor, atrium/public, airport_terminal, lobby"
62,1488,indoor,"artists_loft, airport_terminal, atrium/public, lobby, hotel/outdoor"
63,1512,outdoor,"artists_loft, hospital, office_building, skyscraper, art_gallery"
64,1536,outdoor,"pharmacy, drugstore, hospital, desert/sand, motel"
65,1560,indoor,"bowling_alley, airport_terminal, parking_garage/indoor, parking_lot, highway"
66,1584,outdoor,"skyscraper, tower, office_building, bridge, attic"
67,1608,outdoor,"skyscraper, office_building, tower, downtown, hotel/outdoor"
68,1632,outdoor,"office_building, skyscraper, atrium/public, downtown, hospital"
69,1656,outdoor,"atrium/public, office_building, hospital, skyscraper, airport_terminal"
70,1680,outdoor,"office_building, skyscraper, hotel/outdoor, tower, hospital"
71,1704,outdoor,"skyscraper, office_building, tower, downtown, server_room"
72,1728,indoor,"pharmacy, drugstore, childs_room, playroom, hospital"
73,1752,indoor,"hospital, pharmacy, drugstore, reception, hospital_room"
74,1776,indoor,"playroom, childs_room, art_gallery, kindergarden_classroom, elevator/door"
75,1800,outdoor,"skyscraper, tower, office_building, hospital, art_gallery"
76,1824,outdoor,"tower, skyscraper, downtown, office_building, server_room"
77,1848,indoor,"pharmacy, drugstore, museum/indoor, elevator/door, elevator_lobby"
78,1872,indoor,"hospital, pharmacy, museum/indoor, highway, elevator/door"
79,1896,indoor,"pharmacy, hospital, server_room, booth/indoor, drugstore"
80,1920,indoor,"server_room, science_museum, airport_terminal, computer_room, office"
81,1944,indoor,"server_room, science_museum, airport_terminal, computer_room, clean_room"
82,1968,indoor,"server_room, computer_room, airport_terminal, science_museum, office"
83,1992,indoor,"server_room, clean_room, museum/indoor, science_museum, office"
84,2016,indoor,"server_room, museum/indoor, science_museum, drugstore, pharmacy"
85,2040,indoor,"museum/indoor, science_museum, server_room, drugstore, natural_history_museum"
86,2064,indoor,"server_room, science_museum, museum/indoor, drugstore, pharmacy"
87,2088,indoor,"museum/indoor, drugstore, pharmacy, science_museum, natural_history_museum"
88,2112,indoor,"nursery, shower, art_gallery, locker_room, archive"
89,2136,outdoor,"office_building, skyscraper, hospital, ball_pit, aquarium"
90,2160,outdoor,"office_building, skyscraper, hospital, sky, airport_terminal"
91,2184,outdoor,"office_building, skyscraper, hospital, sky, airport_terminal"
92,2208,outdoor,"office_building, hospital, skyscraper, ball_pit, aquarium"
93,2232,indoor,"office_building, server_room, bowling_alley, ball_pit, hospital"
94,2256,indoor,"office_building, server_room, bowling_alley, ball_pit, hospital"
95,2280,outdoor,"office_building, hospital, skyscraper, server_room, hospital_room"
96,2304,outdoor,"office_building, airport_terminal, hospital, server_room, skyscraper"
97,2328,outdoor,"office_building, hospital, airport_terminal, server_room, skyscraper"
98,2352,outdoor,"office_building, hospital, skyscraper, server_room, hospital_room"
99,2376,outdoor,"server_room, office_building, hospital, skyscraper, archive"
100,2400,outdoor,"server_room, office_building, hospital, skyscraper, archive"
101,2424,outdoor,"server_room, office_building, hospital, skyscraper, archive"
102,2448,outdoor,"server_room, office_building, hospital, skyscraper, archive"
103,2472,outdoor,"server_room, office_building, hospital, skyscraper, archive"
104,2496,outdoor,"server_room, office_building, hospital, skyscraper, archive"
105,2520,indoor,"skyscraper, home_theater, server_room, office_building, movie_theater/indoor"
106,2544,indoor,"server_room, bowling_alley, home_theater, airport_terminal, computer_room"
107,2568,indoor,"server_room, bowling_alley, home_theater, airport_terminal, computer_room"
108,2592,indoor,"server_room, bowling_alley, home_theater, airport_terminal, computer_room"
109,2616,indoor,"server_room, bowling_alley, home_theater, airport_terminal, computer_room"
110,2640,indoor,"server_room, bowling_alley, home_theater, airport_terminal, computer_room"
111,2664,indoor,"server_room, bowling_alley, home_theater, airport_terminal, computer_room"
112,2688,indoor,"server_room, home_theater, computer_room, bowling_alley, television_studio"
113,2712,indoor,"server_room, home_theater, computer_room, bowling_alley, television_studio"
114,2736,indoor,"server_room, home_theater, computer_room, bowling_alley, television_studio"
115,2760,indoor,"server_room, home_theater, computer_room, bowling_alley, television_studio"
116,2784,outdoor,"skyscraper, office_building, downtown, home_theater, hotel/outdoor"
117,2808,indoor,"computer_room, server_room, home_theater, home_office, skyscraper"
118,2832,outdoor,"tower, skyscraper, shower, closet, wind_farm"
119,2856,indoor,"elevator/door, elevator_lobby, pharmacy, airport_terminal, drugstore"
120,2880,indoor,"elevator/door, elevator_lobby, museum/indoor, pharmacy, drugstore"
121,2904,indoor,"elevator/door, elevator_lobby, pharmacy, drugstore, museum/indoor"
122,2928,indoor,"elevator/door, tower, skyscraper, server_room, art_gallery"
123,2952,indoor,"elevator/door, elevator_lobby, server_room, tower, art_gallery"
124,2976,indoor,"elevator/door, elevator_lobby, server_room, tower, corridor"
125,3000,outdoor,"underwater/ocean_deep, sky, aquarium, ocean, rainforest"
126,3024,outdoor,"shower, office_building, bullring, skyscraper, hospital"
127,3048,outdoor,"office_building, skyscraper, hospital, sky, downtown"
128,3072,outdoor,"office_building, skyscraper, hospital, downtown, server_room"
129,3096,outdoor,"office_building, skyscraper, hospital, downtown, airport_terminal"
130,3120,indoor,"pharmacy, elevator/door, hospital, volcano, discotheque"
131,3144,indoor,"recreation_room, playroom, bowling_alley, amusement_arcade, kindergarden_classroom"
132,3168,indoor,"shower, nursery, elevator/door, closet, basement"
133,3192,outdoor,"bridge, rope_bridge, viaduct, river, ocean"
134,3216,outdoor,"bridge, ocean, viaduct, coast, rope_bridge"
135,3240,outdoor,"bridge, ocean, viaduct, coast, rope_bridge"
136,3264,outdoor,"bridge, ocean, coast, viaduct, rope_bridge"
137,3288,outdoor,"industrial_area, downtown, tower, skyscraper, village"
138,3312,outdoor,"industrial_area, tower, downtown, skyscraper, village"
139,3336,outdoor,"industrial_area, downtown, tower, skyscraper, village"
140,3360,outdoor,"industrial_area, downtown, tower, skyscraper, village"
141,3384,outdoor,"industrial_area, downtown, skyscraper, tower, village"
142,3408,outdoor,"industrial_area, downtown, skyscraper, tower, village"
143,3432,outdoor,"downtown, skyscraper, industrial_area, apartment_building/outdoor, office_building"
144,3456,outdoor,"downtown, skyscraper, industrial_area, apartment_building/outdoor, office_building"
145,3480,outdoor,"downtown, skyscraper, industrial_area, apartment_building/outdoor, office_building"
146,3504,outdoor,"downtown, skyscraper, apartment_building/outdoor, industrial_area, office_building"
147,3528,outdoor,"downtown, skyscraper, apartment_building/outdoor, industrial_area, office_building"
148,3552,outdoor,"village, kasbah, beach_house, desert/sand, valley"
149,3576,outdoor,"village, kasbah, beach_house, promenade, valley"
150,3600,outdoor,"village, kasbah, beach_house, promenade, coast"
151,3624,outdoor,"village, kasbah, beach_house, promenade, valley"
152,3648,outdoor,"village, kasbah, beach_house, valley, desert/sand"
153,3672,outdoor,"village, kasbah, beach_house, promenade, valley"
154,3696,outdoor,"village, kasbah, beach_house, valley, promenade"
155,3720,outdoor,"industrial_area, construction_site, downtown, slum, mosque/outdoor"
156,3744,outdoor,"volleyball_court/outdoor, mosque/outdoor, arena/rodeo, beach_house, promenade"
157,3768,outdoor,"mosque/outdoor, mausoleum, ticket_booth, beach_house, plaza"
158,3792,outdoor,"mosque/outdoor, beach_house, mausoleum, boat_deck, harbor"
159,3816,outdoor,"mosque/outdoor, beach_house, mausoleum, boat_deck, lighthouse"
160,3840,outdoor,"mosque/outdoor, beach_house, inn/outdoor, mansion, playground"
161,3864,outdoor,"mosque/outdoor, playground, beach_house, amusement_park, harbor"
162,3888,outdoor,"mosque/outdoor, playground, amusement_park, mausoleum, construction_site"
163,3912,outdoor,"playground, mosque/outdoor, harbor, beach_house, picnic_area"
164,3936,outdoor,"mosque/outdoor, harbor, promenade, playground, industrial_area"
165,3960,outdoor,"mosque/outdoor, industrial_area, oilrig, beach_house, promenade"
166,3984,outdoor,"mosque/outdoor, promenade, palace, pier, beach_house"
167,4008,outdoor,"mosque/outdoor, promenade, pier, harbor, tower"
168,4032,outdoor,"mosque/outdoor, promenade, beach_house, pier, palace"
169,4056,outdoor,"heliport, army_base, airfield, runway, boat_deck"
170,4080,outdoor,"heliport, runway, army_base, airfield, boat_deck"
171,4104,outdoor,"heliport, runway, army_base, boat_deck, airfield"
172,4128,outdoor,"heliport, runway, airfield, army_base, boat_deck"
173,4152,outdoor,"promenade, mosque/outdoor, beach_house, museum/outdoor, ocean"
174,4176,outdoor,"mosque/outdoor, promenade, beach_house, museum/outdoor, water_park"
175,4200,outdoor,"promenade, mosque/outdoor, beach_house, museum/outdoor, pier"
176,4224,outdoor,"promenade, mosque/outdoor, beach_house, museum/outdoor, water_park"
177,4248,outdoor,"promenade, mosque/outdoor, beach_house, museum/outdoor, ocean"
178,4272,outdoor,"mosque/outdoor, promenade, museum/outdoor, beach_house, water_park"
179,4296,outdoor,"promenade, mosque/outdoor, museum/outdoor, beach_house, harbor"
180,4320,outdoor,"mosque/outdoor, promenade, harbor, pier, boat_deck"
181,4344,outdoor,"promenade, mosque/outdoor, boat_deck, beach_house, playground"
182,4368,outdoor,"promenade, pier, harbor, boat_deck, coast"
183,4392,outdoor,"promenade, mosque/outdoor, pier, harbor, boat_deck"
184,4416,outdoor,"pier, promenade, stage/outdoor, harbor, boat_deck"
185,4440,outdoor,"mosque/outdoor, promenade, pier, harbor, oilrig"
186,4464,outdoor,"mosque/outdoor, oilrig, pier, promenade, harbor"
187,4488,outdoor,"mosque/outdoor, promenade, harbor, pier, oilrig"
188,4512,outdoor,"mosque/outdoor, plaza, oilrig, bridge, harbor"
189,4536,outdoor,"oilrig, mosque/outdoor, amusement_park, ticket_booth, harbor"
190,4560,outdoor,"ticket_booth, mosque/outdoor, harbor, industrial_area, bridge"
191,4584,outdoor,"oilrig, mosque/outdoor, construction_site, water_park, promenade"
192,4608,outdoor,"construction_site, water_park, promenade, playground, industrial_area"
193,4632,outdoor,"promenade, construction_site, ticket_booth, water_park, industrial_area"
194,4656,outdoor,"ticket_booth, oilrig, construction_site, amusement_park, boat_deck"
195,4680,outdoor,"construction_site, amusement_park, industrial_area, playground, mosque/outdoor"
196,4704,indoor,"oilrig, chemistry_lab, mosque/outdoor, bar, biology_laboratory"
197,4728,outdoor,"mosque/outdoor, chemistry_lab, harbor, amusement_park, biology_laboratory"
198,4752,outdoor,"mosque/outdoor, harbor, amusement_park, playground, boat_deck"
199,4776,outdoor,"mosque/outdoor, amusement_park, chemistry_lab, harbor, playground"
200,4800,outdoor,"chemistry_lab, mosque/outdoor, oilrig, harbor, biology_laboratory"
201,4824,outdoor,"mosque/outdoor, harbor, boat_deck, oilrig, bridge"
202,4848,outdoor,"oilrig, amusement_park, water_park, promenade, ticket_booth"
203,4872,outdoor,"amusement_park, oilrig, carrousel, water_park, promenade"
204,4896,outdoor,"amusement_park, promenade, carrousel, oilrig, bridge"
205,4920,outdoor,"amusement_park, carrousel, oilrig, water_park, bridge"
206,4944,outdoor,"amusement_park, oilrig, harbor, ticket_booth, water_park"
207,4968,outdoor,"amusement_park, ticket_booth, bridge, oilrig, carrousel"
208,4992,outdoor,"amusement_park, ticket_booth, oilrig, promenade, harbor"
209,5016,outdoor,"amusement_park, promenade, water_park, ticket_booth, mosque/outdoor"
210,5040,outdoor,"harbor, pier, canal/urban, boardwalk, museum/outdoor"
211,5064,outdoor,"ticket_booth, boat_deck, beach_house, harbor, water_tower"
212,5088,outdoor,"beach_house, balcony/exterior, mosque/outdoor, ticket_booth, museum/outdoor"
213,5112,outdoor,"beach_house, mosque/outdoor, gazebo/exterior, ticket_booth, museum/outdoor"
214,5136,outdoor,"ticket_booth, beach_house, amusement_park, mosque/outdoor, gazebo/exterior"
215,5160,outdoor,"ticket_booth, beach_house, boardwalk, gazebo/exterior, promenade"
216,5184,outdoor,"beach_house, playground, ticket_booth, gazebo/exterior, water_park"
217,5208,outdoor,"beach_house, ticket_booth, playground, gazebo/exterior, amusement_park"
218,5232,outdoor,"ticket_booth, beach_house, gazebo/exterior, mosque/outdoor, boardwalk"
219,5256,outdoor,"ticket_booth, beach_house, gazebo/exterior, boardwalk, mosque/outdoor"
220,5280,outdoor,"ticket_booth, beach_house, gazebo/exterior, amusement_park, mosque/outdoor"
221,5304,outdoor,"ticket_booth, gazebo/exterior, amusement_park, beach_house, mosque/outdoor"
222,5328,outdoor,"ticket_booth, gazebo/exterior, beach_house, amusement_park, playground"
223,5352,outdoor,"beach_house, gazebo/exterior, inn/outdoor, balcony/exterior, pavilion"
224,5376,outdoor,"beach_house, loading_dock, train_station/platform, railroad_track, junkyard"
225,5400,outdoor,"beach_house, loading_dock, museum/outdoor, construction_site, excavation"
226,5424,outdoor,"beach_house, loading_dock, construction_site, junkyard, army_base"
227,5448,outdoor,"beach_house, loading_dock, slum, museum/outdoor, junkyard"
228,5472,indoor,"bus_interior, train_interior, airplane_cabin, porch, car_interior"
229,5496,indoor,"bus_interior, train_interior, porch, airplane_cabin, diner/outdoor"
230,5520,indoor,"bus_interior, train_interior, porch, airplane_cabin, restaurant_patio"
231,5544,outdoor,"beach_house, loading_dock, slum, construction_site, army_base"
232,5568,indoor,"bus_interior, train_interior, porch, airplane_cabin, diner/outdoor"
233,5592,outdoor,"beach_house, loading_dock, construction_site, army_base, slum"
234,5616,outdoor,"beach_house, loading_dock, army_base, construction_site, industrial_area"
235,5640,outdoor,"beach_house, army_base, loading_dock, slum, junkyard"
236,5664,outdoor,"beach_house, army_base, loading_dock, junkyard, railroad_track"
237,5688,outdoor,"beach_house, loading_dock, army_base, construction_site, junkyard"
238,5712,outdoor,"beach_house, loading_dock, junkyard, construction_site, army_base"
239,5736,outdoor,"beach_house, loading_dock, army_base, slum, junkyard"
240,5760,outdoor,"beach_house, army_base, loading_dock, junkyard, excavation"
241,5784,outdoor,"beach_house, loading_dock, army_base, construction_site, slum"
242,5808,outdoor,"beach_house, loading_dock, slum, army_base, train_station/platform"
243,5832,outdoor,"hospital, museum/outdoor, construction_site, courthouse, mosque/outdoor"
244,5856,outdoor,"museum/outdoor, hospital, campus, construction_site, mausoleum"
245,5880,outdoor,"museum/outdoor, hospital, campus, courthouse, mausoleum"
246,5904,outdoor,"museum/outdoor, hospital, courthouse, campus, mausoleum"
247,5928,outdoor,"museum/outdoor, hospital, courthouse, campus, mausoleum"
248,5952,outdoor,"museum/outdoor, beach_house, hospital, schoolhouse, campus"
249,5976,outdoor,"museum/outdoor, hospital, courthouse, campus, mausoleum"
250,6000,outdoor,"hospital, clean_room, courthouse, museum/outdoor, construction_site"
251,6024,outdoor,"museum/outdoor, hospital, mausoleum, hospital_room, construction_site"
252,6048,outdoor,"museum/outdoor, hospital, courthouse, campus, mausoleum"
253,6072,outdoor,"ice_floe, ice_shelf, desert/sand, igloo, iceberg"
254,6096,outdoor,"wheat_field, aquarium, iceberg, igloo, ice_floe"
255,6120,outdoor,"hot_spring, veterinarians_office, wheat_field, canyon, hospital_room"
256,6144,outdoor,"stable, kennel/outdoor, veterinarians_office, pasture, barndoor"
257,6168,indoor,"kennel/outdoor, veterinarians_office, stable, shower, corral"
258,6192,outdoor,"clean_room, construction_site, hospital, museum/outdoor, schoolhouse"
259,6216,indoor,"kennel/outdoor, veterinarians_office, shower, stable, ice_shelf"
260,6240,outdoor,"kennel/outdoor, veterinarians_office, ice_shelf, pasture, stable"
261,6264,outdoor,"museum/outdoor, hospital, campus, mausoleum, courthouse"
262,6288,outdoor,"museum/outdoor, hospital, campus, courthouse, schoolhouse"
263,6312,outdoor,"museum/outdoor, hospital, campus, courthouse, construction_site"
264,6336,outdoor,"museum/outdoor, hospital, courthouse, campus, schoolhouse"
265,6360,outdoor,"hospital, museum/outdoor, courthouse, campus, construction_site"
266,6384,outdoor,"hospital, museum/outdoor, campus, courthouse, schoolhouse"
267,6408,outdoor,"hospital, museum/outdoor, schoolhouse, campus, courthouse"
268,6432,outdoor,"museum/outdoor, hospital, courthouse, campus, schoolhouse"
269,6456,outdoor,"museum/outdoor, hospital, courthouse, campus, schoolhouse"
270,6480,outdoor,"museum/outdoor, hospital, courthouse, campus, mausoleum"
271,6504,outdoor,"hospital, museum/outdoor, construction_site, clean_room, hospital_room"
272,6528,outdoor,"museum/outdoor, hospital, beach_house, courthouse, campus"
273,6552,outdoor,"museum/outdoor, kasbah, mausoleum, mosque/outdoor, office_building"
274,6576,outdoor,"kasbah, mosque/outdoor, village, residential_neighborhood, mausoleum"
275,6600,outdoor,"village, mosque/outdoor, residential_neighborhood, mausoleum, kasbah"
276,6624,outdoor,"village, mosque/outdoor, church/outdoor, mausoleum, kasbah"
277,6648,outdoor,"village, residential_neighborhood, mosque/outdoor, church/outdoor, industrial_area"
278,6672,outdoor,"village, residential_neighborhood, industrial_area, mansion, office_building"
279,6696,outdoor,"village, residential_neighborhood, kasbah, church/outdoor, mosque/outdoor"
280,6720,outdoor,"village, kasbah, residential_neighborhood, slum, church/outdoor"
281,6744,outdoor,"kasbah, palace, castle, mausoleum, hospital"
282,6768,outdoor,"kasbah, palace, mausoleum, courtyard, museum/outdoor"
283,6792,outdoor,"kasbah, palace, courtyard, mausoleum, hospital"
284,6816,outdoor,"barndoor, doorway/outdoor, cabin/outdoor, sauna, office_building"
285,6840,outdoor,"barndoor, doorway/outdoor, cabin/outdoor, kennel/outdoor, greenhouse/outdoor"
286,6864,outdoor,"barndoor, doorway/outdoor, cabin/outdoor, office_building, staircase"
287,6888,outdoor,"barndoor, doorway/outdoor, kennel/outdoor, cabin/outdoor, office_building"
288,6912,outdoor,"staircase, cabin/outdoor, doorway/outdoor, office_building, kennel/outdoor"
289,6936,outdoor,"kennel/outdoor, porch, staircase, office_building, doorway/outdoor"
290,6960,outdoor,"residential_neighborhood, courthouse, manufactured_home, mansion, driveway"
291,6984,outdoor,"residential_neighborhood, courthouse, manufactured_home, mansion, driveway"
292,7008,outdoor,"residential_neighborhood, manufactured_home, courthouse, mansion, schoolhouse"
293,7032,outdoor,"campus, residential_neighborhood, museum/outdoor, courthouse, library/outdoor"
294,7056,outdoor,"campus, residential_neighborhood, plaza, hospital, crosswalk"
295,7080,outdoor,"campus, crosswalk, courtyard, plaza, hospital"
296,7104,outdoor,"courtyard, atrium/public, campus, plaza, shopping_mall/indoor"
297,7128,outdoor,"courtyard, plaza, campus, hospital, atrium/public"
298,7152,outdoor,"courtyard, hospital, patio, office_building, campus"
299,7176,outdoor,"parking_lot, hospital, courtyard, campus, hospital_room"
300,7200,outdoor,"campus, courtyard, parking_lot, hospital_room, hospital"
301,7224,outdoor,"patio, hospital_room, hospital, parking_lot, porch"
302,7248,outdoor,"campus, hospital, parking_lot, plaza, hospital_room"
303,7272,outdoor,"plaza, driveway, picnic_area, parking_lot, campus"
304,7296,outdoor,"parking_lot, driveway, plaza, campus, yard"
305,7320,outdoor,"parking_lot, plaza, campus, auto_factory, bus_station/indoor"
306,7344,outdoor,"plaza, fountain, campus, hospital, parking_lot"
307,7368,outdoor,"plaza, fountain, ice_skating_rink/outdoor, airport_terminal, crosswalk"
308,7392,outdoor,"plaza, fountain, campus, crosswalk, ice_skating_rink/outdoor"
309,7416,outdoor,"plaza, fountain, campus, courtyard, crosswalk"
310,7440,outdoor,"plaza, fountain, crosswalk, campus, amphitheater"
311,7464,outdoor,"plaza, ice_skating_rink/outdoor, parking_lot, fountain, crosswalk"
312,7488,outdoor,"bus_interior, parking_lot, airport_terminal, crosswalk, wind_farm"
313,7512,indoor,"bus_interior, parking_lot, conference_center, park, airport_terminal"
314,7536,indoor,"bus_interior, conference_center, parking_lot, airport_terminal, cemetery"
315,7560,outdoor,"parking_lot, bus_interior, crosswalk, airport_terminal, restaurant_patio"
316,7584,outdoor,"crosswalk, bus_interior, parking_lot, airport_terminal, gas_station"
317,7608,outdoor,"parking_lot, crosswalk, bus_interior, airport_terminal, highway"
318,7632,outdoor,"plaza, ice_skating_rink/outdoor, fountain, campus, crosswalk"
319,7656,outdoor,"plaza, ice_skating_rink/outdoor, fountain, campus, amphitheater"
320,7680,outdoor,"plaza, fountain, ice_skating_rink/outdoor, campus, crosswalk"
321,7704,outdoor,"plaza, fountain, crosswalk, ice_skating_rink/outdoor, downtown"
322,7728,outdoor,"plaza, ice_skating_rink/outdoor, crosswalk, fountain, parking_lot"
