,frame_num,environment,places
4463,107112,outdoor,"playground, mosque/outdoor, amusement_park, volleyball_court/outdoor, mausoleum"
4464,107136,outdoor,"mosque/outdoor, playground, amusement_park, mansion, mausoleum"
4465,107160,outdoor,"mosque/outdoor, amusement_park, carrousel, playground, mansion"
4466,107184,outdoor,"amusement_park, mosque/outdoor, carrousel, mausoleum, playground"
4467,107208,outdoor,"mosque/outdoor, amusement_park, carrousel, mausoleum, gazebo/exterior"
4468,107232,outdoor,"mosque/outdoor, amusement_park, carrousel, mausoleum, palace"
4469,107256,outdoor,"mosque/outdoor, amusement_park, playground, mausoleum, mansion"
4470,107280,outdoor,"amusement_park, playground, water_park, fountain, carrousel"
4471,107304,outdoor,"playground, mosque/outdoor, amusement_park, gazebo/exterior, mausoleum"
4472,107328,outdoor,"playground, amusement_park, water_park, mosque/outdoor, gazebo/exterior"
4473,107352,outdoor,"mosque/outdoor, playground, amusement_park, mausoleum, gazebo/exterior"
4474,107376,outdoor,"mosque/outdoor, playground, amusement_park, mausoleum, water_park"
4475,107400,outdoor,"amusement_park, mosque/outdoor, mausoleum, playground, construction_site"
4476,107424,outdoor,"playground, amusement_park, mausoleum, mosque/outdoor, construction_site"
4477,107448,outdoor,"amusement_park, playground, mosque/outdoor, water_park, carrousel"
4478,107472,outdoor,"mosque/outdoor, amusement_park, playground, carrousel, water_park"
4479,107496,outdoor,"playground, mosque/outdoor, amusement_park, mausoleum, train_station/platform"
4480,107520,outdoor,"carrousel, greenhouse/outdoor, jewelry_shop, playground, clothing_store"
4481,107544,indoor,"jewelry_shop, clean_room, chemistry_lab, biology_laboratory, science_museum"
4482,107568,indoor,"jewelry_shop, shoe_shop, museum/indoor, science_museum, aquarium"
4483,107592,indoor,"clean_room, biology_laboratory, chemistry_lab, jewelry_shop, dining_room"
4484,107616,outdoor,"clean_room, ice_floe, boat_deck, chemistry_lab, oilrig"
4485,107640,outdoor,"ice_floe, pond, lake/natural, banquet_hall, dining_room"
4486,107664,outdoor,"ice_floe, lake/natural, pond, pier, marsh"
4487,107688,outdoor,"ice_floe, lake/natural, pond, marsh, fishpond"
4488,107712,outdoor,"ice_floe, lake/natural, ice_shelf, marsh, iceberg"
4489,107736,outdoor,"ice_floe, lake/natural, harbor, marsh, ice_shelf"
4490,107760,outdoor,"ice_floe, ice_shelf, lake/natural, harbor, iceberg"
4491,107784,outdoor,"ice_floe, oilrig, lake/natural, ice_shelf, harbor"
4492,107808,outdoor,"ice_floe, lake/natural, pond, oilrig, fishpond"
4493,107832,outdoor,"ice_floe, oilrig, lake/natural, pond, fishpond"
4494,107856,outdoor,"sky, hot_spring, ocean, beach, lagoon"
4495,107880,outdoor,"sky, hot_spring, lake/natural, ice_floe, pond"
4496,107904,outdoor,"oast_house, corral, kasbah, mosque/outdoor, village"
4497,107928,outdoor,"kasbah, mosque/outdoor, oast_house, army_base, church/outdoor"
4498,107952,outdoor,"kasbah, mosque/outdoor, ruin, museum/outdoor, mausoleum"
4499,107976,outdoor,"kasbah, ruin, desert/vegetation, desert/sand, mosque/outdoor"
4500,108000,outdoor,"ice_floe, sky, iceberg, ice_shelf, hot_spring"
4501,108024,outdoor,"ice_floe, ice_shelf, iceberg, wave, ocean"
4502,108048,outdoor,"kasbah, desert/vegetation, mosque/outdoor, ruin, desert/sand"
4503,108072,outdoor,"kasbah, ruin, desert/vegetation, desert/sand, cemetery"
4504,108096,outdoor,"kasbah, ruin, desert/vegetation, desert/sand, butte"
4505,108120,outdoor,"kasbah, desert/vegetation, desert/sand, ruin, butte"
4506,108144,outdoor,"kasbah, desert/sand, desert/vegetation, butte, ruin"
4507,108168,outdoor,"kasbah, desert/vegetation, ruin, desert/sand, museum/indoor"
4508,108192,outdoor,"kasbah, desert/vegetation, desert/sand, butte, canyon"
4509,108216,outdoor,"kasbah, butte, desert/sand, canyon, desert/vegetation"
4510,108240,outdoor,"kasbah, desert/sand, butte, canyon, desert/vegetation"
4511,108264,outdoor,"kasbah, desert/vegetation, desert/sand, coast, conference_center"
4512,108288,outdoor,"kasbah, mosque/outdoor, conference_center, desert/sand, desert/vegetation"
4513,108312,outdoor,"kasbah, desert/sand, mosque/outdoor, hot_spring, promenade"
4514,108336,outdoor,"kasbah, desert/sand, desert/vegetation, volleyball_court/outdoor, coast"
4515,108360,outdoor,"kasbah, volleyball_court/outdoor, mosque/outdoor, coast, desert/vegetation"
4516,108384,outdoor,"kasbah, mosque/outdoor, fountain, volleyball_court/outdoor, coast"
4517,108408,outdoor,"kasbah, desert/vegetation, dressing_room, desert/sand, wheat_field"
4518,108432,outdoor,"desert/sand, kasbah, volleyball_court/outdoor, wheat_field, army_base"
4519,108456,outdoor,"kasbah, dressing_room, desert/sand, army_base, wheat_field"
4520,108480,outdoor,"wheat_field, art_gallery, army_base, dressing_room, construction_site"
4521,108504,indoor,"dressing_room, natural_history_museum, corn_field, wheat_field, science_museum"
4522,108528,indoor,"entrance_hall, museum/indoor, living_room, jewelry_shop, alcove"
4523,108552,indoor,"entrance_hall, alcove, living_room, beauty_salon, lobby"
4524,108576,indoor,"clothing_store, dressing_room, beauty_salon, living_room, airplane_cabin"
4525,108600,indoor,"dressing_room, hotel_room, living_room, bathroom, bedroom"
4526,108624,indoor,"dressing_room, beauty_salon, living_room, hotel_room, dining_room"
4527,108648,indoor,"dressing_room, dining_room, beauty_salon, nursery, living_room"
4528,108672,indoor,"dressing_room, nursing_home, beauty_salon, dining_room, nursery"
4529,108696,indoor,"dressing_room, beauty_salon, nursing_home, nursery, clothing_store"
4530,108720,indoor,"nursing_home, dressing_room, hospital_room, beauty_salon, dining_room"
4531,108744,indoor,"nursing_home, dressing_room, beauty_salon, hospital_room, clothing_store"
4532,108768,indoor,"dressing_room, nursing_home, beauty_salon, hospital_room, clothing_store"
4533,108792,indoor,"dressing_room, nursing_home, beauty_salon, hospital_room, nursery"
4534,108816,indoor,"staircase, throne_room, entrance_hall, lobby, living_room"
4535,108840,indoor,"staircase, throne_room, entrance_hall, lobby, living_room"
4536,108864,indoor,"staircase, throne_room, entrance_hall, lobby, living_room"
4537,108888,indoor,"staircase, throne_room, entrance_hall, living_room, lobby"
4538,108912,indoor,"sauna, shower, playroom, childs_room, elevator/door"
4539,108936,indoor,"staircase, entrance_hall, throne_room, escalator/indoor, living_room"
4540,108960,indoor,"staircase, throne_room, entrance_hall, escalator/indoor, lobby"
4541,108984,indoor,"staircase, throne_room, living_room, lobby, porch"
4542,109008,indoor,"staircase, living_room, throne_room, lobby, beauty_salon"
4543,109032,indoor,"staircase, throne_room, living_room, lobby, entrance_hall"
4544,109056,indoor,"sauna, shower, playroom, bathroom, elevator/door"
4545,109080,indoor,"playroom, sauna, shower, elevator/door, childs_room"
4546,109104,indoor,"staircase, lobby, living_room, entrance_hall, throne_room"
4547,109128,indoor,"staircase, entrance_hall, throne_room, lobby, escalator/indoor"
4548,109152,indoor,"dressing_room, beauty_salon, nursing_home, jewelry_shop, hospital_room"
4549,109176,indoor,"dressing_room, nursing_home, beauty_salon, hospital_room, nursery"
4550,109200,indoor,"dressing_room, beauty_salon, nursing_home, hospital_room, living_room"
4551,109224,indoor,"nursing_home, dressing_room, beauty_salon, hospital_room, living_room"
4552,109248,indoor,"dressing_room, nursing_home, beauty_salon, ice_cream_parlor, dining_room"
4553,109272,indoor,"dressing_room, jewelry_shop, clothing_store, beauty_salon, clean_room"
4554,109296,indoor,"jewelry_shop, dressing_room, beauty_salon, clothing_store, biology_laboratory"
4555,109320,indoor,"dressing_room, jewelry_shop, clothing_store, beauty_salon, biology_laboratory"
4556,109344,indoor,"dressing_room, jewelry_shop, clothing_store, beauty_salon, biology_laboratory"
4557,109368,indoor,"dressing_room, jewelry_shop, beauty_salon, clothing_store, biology_laboratory"
4558,109392,indoor,"dressing_room, jewelry_shop, clothing_store, beauty_salon, biology_laboratory"
4559,109416,indoor,"dressing_room, jewelry_shop, clothing_store, beauty_salon, biology_laboratory"
4560,109440,indoor,"dressing_room, jewelry_shop, clothing_store, beauty_salon, nursing_home"
4561,109464,indoor,"dressing_room, jewelry_shop, clothing_store, beauty_salon, nursing_home"
4562,109488,indoor,"dressing_room, jewelry_shop, clothing_store, beauty_salon, nursing_home"
4563,109512,indoor,"dressing_room, jewelry_shop, clothing_store, beauty_salon, nursing_home"
4564,109536,indoor,"dressing_room, clothing_store, jewelry_shop, beauty_salon, nursing_home"
4565,109560,indoor,"dressing_room, clothing_store, locker_room, jewelry_shop, nursing_home"
4566,109584,indoor,"dressing_room, nursing_home, beauty_salon, clothing_store, jewelry_shop"
4567,109608,indoor,"dressing_room, nursing_home, jewelry_shop, clothing_store, beauty_salon"
4568,109632,indoor,"dressing_room, clothing_store, jewelry_shop, nursing_home, beauty_salon"
4569,109656,indoor,"shower, bathroom, sauna, beauty_salon, childs_room"
4570,109680,indoor,"shower, sauna, art_studio, beauty_salon, bathroom"
4571,109704,indoor,"shower, sauna, playroom, bathroom, childs_room"
4572,109728,indoor,"staircase, living_room, lobby, porch, beauty_salon"
4573,109752,indoor,"living_room, staircase, berth, porch, bus_interior"
4574,109776,indoor,"living_room, staircase, berth, porch, bus_interior"
4575,109800,indoor,"living_room, staircase, berth, bus_interior, porch"
4576,109824,indoor,"staircase, living_room, porch, lobby, bus_interior"
4577,109848,indoor,"staircase, living_room, porch, lobby, bus_interior"
4578,109872,indoor,"porch, staircase, living_room, lobby, bus_interior"
4579,109896,indoor,"staircase, porch, living_room, lobby, entrance_hall"
4580,109920,indoor,"staircase, porch, living_room, lobby, entrance_hall"
4581,109944,indoor,"porch, staircase, living_room, lobby, bus_interior"
4582,109968,indoor,"living_room, lobby, staircase, porch, beauty_salon"
4583,109992,indoor,"staircase, porch, lobby, living_room, beauty_salon"
4584,110016,indoor,"staircase, porch, lobby, living_room, beauty_salon"
4585,110040,indoor,"staircase, living_room, lobby, porch, beauty_salon"
4586,110064,indoor,"shower, sauna, beauty_salon, bathroom, elevator/door"
4587,110088,indoor,"shower, sauna, bathroom, beauty_salon, art_studio"
4588,110112,indoor,"sauna, shower, beauty_salon, bathroom, art_studio"
4589,110136,indoor,"shower, sauna, beauty_salon, bathroom, art_studio"
4590,110160,indoor,"shower, sauna, beauty_salon, bathroom, art_studio"
4591,110184,indoor,"shower, sauna, beauty_salon, bathroom, dressing_room"
4592,110208,indoor,"sauna, shower, beauty_salon, bathroom, art_studio"
4593,110232,indoor,"sauna, shower, beauty_salon, bathroom, art_studio"
4594,110256,indoor,"sauna, shower, playroom, bathroom, beauty_salon"
4595,110280,indoor,"sauna, shower, art_studio, playroom, beauty_salon"
4596,110304,indoor,"sauna, shower, art_studio, bathroom, playroom"
4597,110328,indoor,"sauna, shower, bathroom, playroom, beauty_salon"
4598,110352,indoor,"sauna, shower, art_studio, beauty_salon, playroom"
4599,110376,indoor,"sauna, beauty_salon, shower, art_studio, playroom"
4600,110400,indoor,"sauna, beauty_salon, shower, playroom, bathroom"
4601,110424,indoor,"sauna, shower, beauty_salon, bathroom, art_studio"
4602,110448,indoor,"staircase, living_room, lobby, porch, beauty_salon"
4603,110472,indoor,"staircase, living_room, lobby, porch, berth"
4604,110496,indoor,"staircase, living_room, porch, lobby, berth"
4605,110520,indoor,"staircase, porch, living_room, lobby, beauty_salon"
4606,110544,indoor,"staircase, porch, living_room, lobby, beauty_salon"
4607,110568,indoor,"staircase, living_room, lobby, porch, beauty_salon"
4608,110592,indoor,"staircase, throne_room, beauty_salon, living_room, lobby"
4609,110616,indoor,"sauna, beauty_salon, shower, bathroom, art_studio"
4610,110640,indoor,"art_studio, beauty_salon, sauna, playroom, shower"
4611,110664,indoor,"sauna, beauty_salon, art_studio, art_gallery, shower"
4612,110688,indoor,"sauna, beauty_salon, art_studio, shower, dorm_room"
4613,110712,indoor,"sauna, beauty_salon, art_studio, shower, bathroom"
4614,110736,indoor,"sauna, beauty_salon, art_studio, dorm_room, shower"
4615,110760,indoor,"beauty_salon, art_studio, sauna, dorm_room, playroom"
4616,110784,indoor,"art_studio, sauna, beauty_salon, artists_loft, art_gallery"
4617,110808,indoor,"art_studio, sauna, beauty_salon, dorm_room, artists_loft"
4618,110832,indoor,"art_studio, beauty_salon, sauna, shower, playroom"
4619,110856,indoor,"dressing_room, nursing_home, beauty_salon, hospital_room, living_room"
4620,110880,indoor,"nursing_home, dressing_room, beauty_salon, hospital_room, living_room"
4621,110904,indoor,"dressing_room, nursing_home, beauty_salon, clothing_store, jewelry_shop"
4622,110928,indoor,"dressing_room, beauty_salon, living_room, nursing_home, clothing_store"
4623,110952,indoor,"dressing_room, beauty_salon, nursing_home, living_room, hospital_room"
4624,110976,indoor,"beauty_salon, dressing_room, nursing_home, living_room, hospital_room"
4625,111000,indoor,"dressing_room, beauty_salon, nursing_home, living_room, hospital_room"
4626,111024,indoor,"beauty_salon, dressing_room, nursing_home, living_room, hospital_room"
4627,111048,indoor,"dressing_room, nursing_home, clothing_store, beauty_salon, hospital_room"
4628,111072,indoor,"dressing_room, beauty_salon, living_room, jewelry_shop, clothing_store"
4629,111096,indoor,"dressing_room, beauty_salon, jewelry_shop, clothing_store, gift_shop"
4630,111120,indoor,"dressing_room, beauty_salon, clothing_store, nursing_home, living_room"
4631,111144,indoor,"dressing_room, beauty_salon, clothing_store, nursing_home, locker_room"
4632,111168,indoor,"dressing_room, beauty_salon, nursing_home, office, locker_room"
4633,111192,indoor,"dressing_room, beauty_salon, nursing_home, office, hospital_room"
4634,111216,indoor,"staircase, living_room, lobby, throne_room, porch"
4635,111240,indoor,"staircase, living_room, lobby, berth, porch"
4636,111264,indoor,"staircase, living_room, lobby, entrance_hall, porch"
4637,111288,indoor,"sauna, shower, beauty_salon, bathroom, art_studio"
4638,111312,indoor,"sauna, beauty_salon, shower, art_studio, bathroom"
4639,111336,indoor,"sauna, shower, beauty_salon, bathroom, art_studio"
4640,111360,indoor,"sauna, shower, beauty_salon, bathroom, art_studio"
4641,111384,indoor,"staircase, living_room, lobby, entrance_hall, escalator/indoor"
4642,111408,indoor,"staircase, lobby, entrance_hall, living_room, escalator/indoor"
4643,111432,indoor,"staircase, living_room, porch, berth, lobby"
4644,111456,indoor,"staircase, living_room, berth, lobby, porch"
4645,111480,indoor,"staircase, lobby, entrance_hall, living_room, escalator/indoor"
4646,111504,indoor,"staircase, living_room, lobby, berth, porch"
4647,111528,indoor,"staircase, living_room, lobby, berth, entrance_hall"
4648,111552,indoor,"staircase, entrance_hall, living_room, lobby, porch"
4649,111576,indoor,"staircase, entrance_hall, porch, living_room, lobby"
4650,111600,indoor,"staircase, living_room, lobby, entrance_hall, porch"
4651,111624,indoor,"living_room, dressing_room, bedroom, nursing_home, berth"
4652,111648,indoor,"living_room, beauty_salon, dressing_room, bedroom, berth"
4653,111672,indoor,"beauty_salon, living_room, dressing_room, bedroom, bedchamber"
4654,111696,indoor,"beauty_salon, dressing_room, living_room, bedroom, butchers_shop"
4655,111720,indoor,"beauty_salon, dressing_room, living_room, bedroom, butchers_shop"
4656,111744,indoor,"beauty_salon, living_room, dressing_room, bedroom, bedchamber"
4657,111768,indoor,"beauty_salon, living_room, dressing_room, bedroom, butchers_shop"
4658,111792,indoor,"beauty_salon, living_room, dressing_room, bedroom, berth"
4659,111816,indoor,"beauty_salon, living_room, dressing_room, bedroom, berth"
4660,111840,indoor,"beauty_salon, living_room, dressing_room, bedroom, berth"
4661,111864,indoor,"beauty_salon, living_room, dressing_room, bedroom, berth"
4662,111888,indoor,"beauty_salon, living_room, dressing_room, bedroom, sauna"
4663,111912,indoor,"beauty_salon, butchers_shop, dressing_room, living_room, clothing_store"
4664,111936,indoor,"beauty_salon, living_room, dressing_room, butchers_shop, clothing_store"
4665,111960,indoor,"beauty_salon, living_room, dressing_room, bedroom, bedchamber"
4666,111984,indoor,"beauty_salon, butchers_shop, living_room, clothing_store, berth"
4667,112008,indoor,"beauty_salon, living_room, butchers_shop, clothing_store, dressing_room"
4668,112032,indoor,"beauty_salon, living_room, butchers_shop, clothing_store, art_studio"
4669,112056,indoor,"beauty_salon, living_room, clothing_store, butchers_shop, art_studio"
4670,112080,indoor,"beauty_salon, butchers_shop, living_room, clothing_store, art_studio"
4671,112104,indoor,"beauty_salon, butchers_shop, living_room, art_studio, dressing_room"
4672,112128,indoor,"beauty_salon, butchers_shop, living_room, clothing_store, dressing_room"
4673,112152,indoor,"beauty_salon, living_room, butchers_shop, art_studio, clothing_store"
4674,112176,indoor,"beauty_salon, butchers_shop, living_room, art_studio, clothing_store"
4675,112200,indoor,"beauty_salon, butchers_shop, living_room, art_studio, veterinarians_office"
4676,112224,indoor,"beauty_salon, butchers_shop, living_room, clothing_store, art_studio"
4677,112248,indoor,"beauty_salon, living_room, art_studio, clothing_store, butchers_shop"
4678,112272,indoor,"beauty_salon, art_studio, living_room, clothing_store, butchers_shop"
4679,112296,indoor,"beauty_salon, butchers_shop, living_room, art_studio, lobby"
4680,112320,indoor,"beauty_salon, butchers_shop, clothing_store, lobby, living_room"
4681,112344,indoor,"beauty_salon, butchers_shop, clothing_store, lobby, living_room"
4682,112368,indoor,"beauty_salon, butchers_shop, living_room, clothing_store, lobby"
4683,112392,indoor,"beauty_salon, butchers_shop, clothing_store, living_room, art_studio"
4684,112416,indoor,"beauty_salon, clothing_store, butchers_shop, art_studio, living_room"
4685,112440,indoor,"beauty_salon, clothing_store, butchers_shop, art_studio, living_room"
4686,112464,indoor,"beauty_salon, butchers_shop, clothing_store, lobby, living_room"
4687,112488,indoor,"beauty_salon, butchers_shop, clothing_store, art_studio, restaurant"
4688,112512,indoor,"beauty_salon, butchers_shop, clothing_store, veterinarians_office, living_room"
4689,112536,indoor,"beauty_salon, butchers_shop, clothing_store, lobby, living_room"
4690,112560,indoor,"beauty_salon, butchers_shop, clothing_store, lobby, living_room"
4691,112584,indoor,"beauty_salon, clothing_store, butchers_shop, lobby, art_studio"
4692,112608,indoor,"beauty_salon, ice_cream_parlor, clothing_store, reception, coffee_shop"
4693,112632,indoor,"beauty_salon, reception, ice_cream_parlor, clothing_store, lobby"
4694,112656,indoor,"beauty_salon, clothing_store, ice_cream_parlor, reception, lobby"
4695,112680,indoor,"butchers_shop, beauty_salon, clothing_store, ice_cream_parlor, reception"
4696,112704,indoor,"beauty_salon, butchers_shop, ice_cream_parlor, clothing_store, art_gallery"
4697,112728,indoor,"dressing_room, bow_window/indoor, living_room, hotel_room, bedchamber"
4698,112752,indoor,"dressing_room, clothing_store, shower, museum/indoor, closet"
4699,112776,indoor,"artists_loft, living_room, museum/indoor, art_gallery, dressing_room"
4700,112800,indoor,"nursery, living_room, dressing_room, hotel_room, bow_window/indoor"
4701,112824,indoor,"nursery, museum/indoor, hotel_room, bow_window/indoor, beauty_salon"
4702,112848,indoor,"museum/indoor, beauty_salon, dressing_room, lobby, shower"
4703,112872,indoor,"shower, bathroom, sauna, hotel_room, bow_window/indoor"
4704,112896,indoor,"childs_room, dressing_room, hotel_room, bedroom, nursery"
4705,112920,indoor,"dressing_room, childs_room, nursery, bedroom, hotel_room"
4706,112944,indoor,"dressing_room, childs_room, nursery, bedroom, bathroom"
4707,112968,indoor,"childs_room, dressing_room, playroom, nursery, bedroom"
4708,112992,indoor,"jewelry_shop, dining_room, restaurant, dressing_room, gift_shop"
4709,113016,indoor,"clean_room, banquet_hall, jewelry_shop, dining_hall, restaurant_kitchen"
4710,113040,indoor,"clean_room, chemistry_lab, banquet_hall, restaurant_kitchen, biology_laboratory"
4711,113064,indoor,"clean_room, jewelry_shop, chemistry_lab, restaurant_kitchen, biology_laboratory"
4712,113088,indoor,"jewelry_shop, clean_room, beauty_salon, chemistry_lab, biology_laboratory"
4713,113112,indoor,"restaurant_kitchen, clean_room, chemistry_lab, biology_laboratory, jewelry_shop"
4714,113136,indoor,"chemistry_lab, clean_room, biology_laboratory, jewelry_shop, banquet_hall"
4715,113160,indoor,"clean_room, jewelry_shop, chemistry_lab, biology_laboratory, banquet_hall"
4716,113184,indoor,"banquet_hall, chemistry_lab, biology_laboratory, clean_room, dining_hall"
4717,113208,indoor,"nursing_home, clean_room, banquet_hall, chemistry_lab, restaurant"
4718,113232,indoor,"clean_room, banquet_hall, restaurant, nursing_home, biology_laboratory"
4719,113256,indoor,"banquet_hall, restaurant, nursing_home, dining_hall, clean_room"
4720,113280,indoor,"banquet_hall, nursing_home, restaurant, dining_hall, hospital_room"
4721,113304,indoor,"banquet_hall, restaurant, nursing_home, dining_hall, clean_room"
4722,113328,indoor,"banquet_hall, nursing_home, restaurant, dining_hall, clean_room"
4723,113352,indoor,"banquet_hall, restaurant, clean_room, chemistry_lab, dining_hall"
4724,113376,indoor,"banquet_hall, restaurant, dining_hall, nursing_home, chemistry_lab"
4725,113400,indoor,"banquet_hall, restaurant, dining_hall, beer_hall, cafeteria"
4726,113424,indoor,"banquet_hall, restaurant, dining_hall, beer_hall, nursing_home"
4727,113448,indoor,"banquet_hall, restaurant, dining_hall, nursing_home, beer_hall"
4728,113472,indoor,"banquet_hall, restaurant, dining_hall, nursing_home, chemistry_lab"
4729,113496,indoor,"banquet_hall, restaurant, dining_hall, nursing_home, chemistry_lab"
4730,113520,indoor,"banquet_hall, restaurant, nursing_home, chemistry_lab, dining_hall"
4731,113544,indoor,"banquet_hall, restaurant, nursing_home, dining_hall, chemistry_lab"
4732,113568,indoor,"banquet_hall, restaurant, nursing_home, dining_hall, clean_room"
4733,113592,indoor,"banquet_hall, restaurant, dining_hall, nursing_home, chemistry_lab"
4734,113616,indoor,"banquet_hall, restaurant, dining_hall, chemistry_lab, clean_room"
4735,113640,indoor,"banquet_hall, restaurant, chemistry_lab, clean_room, biology_laboratory"
4736,113664,indoor,"banquet_hall, restaurant, dining_hall, clean_room, chemistry_lab"
4737,113688,indoor,"banquet_hall, restaurant, dining_hall, chemistry_lab, nursing_home"
4738,113712,indoor,"banquet_hall, restaurant, clean_room, dining_hall, nursing_home"
4739,113736,indoor,"banquet_hall, restaurant, dining_hall, nursing_home, clean_room"
4740,113760,indoor,"banquet_hall, clean_room, restaurant, nursing_home, chemistry_lab"
4741,113784,indoor,"banquet_hall, restaurant, chemistry_lab, clean_room, dining_hall"
4742,113808,indoor,"chemistry_lab, biology_laboratory, banquet_hall, clean_room, restaurant"
4743,113832,indoor,"banquet_hall, dining_hall, restaurant, chemistry_lab, beer_hall"
4744,113856,indoor,"banquet_hall, restaurant, dining_hall, chemistry_lab, clean_room"
4745,113880,indoor,"banquet_hall, restaurant, dining_hall, clean_room, chemistry_lab"
4746,113904,indoor,"banquet_hall, restaurant, dining_hall, chemistry_lab, biology_laboratory"
4747,113928,indoor,"banquet_hall, restaurant, dining_hall, nursing_home, chemistry_lab"
4748,113952,indoor,"banquet_hall, restaurant, dining_hall, chemistry_lab, clean_room"
4749,113976,indoor,"banquet_hall, restaurant, dining_hall, clean_room, chemistry_lab"
4750,114000,indoor,"banquet_hall, restaurant, dining_hall, chemistry_lab, beer_hall"
4751,114024,indoor,"banquet_hall, restaurant, chemistry_lab, clean_room, biology_laboratory"
4752,114048,indoor,"banquet_hall, clean_room, chemistry_lab, restaurant, nursing_home"
4753,114072,indoor,"banquet_hall, clean_room, nursing_home, chemistry_lab, restaurant"
4754,114096,indoor,"banquet_hall, chemistry_lab, restaurant, clean_room, dining_hall"
4755,114120,indoor,"restaurant, banquet_hall, dining_hall, beer_hall, nursing_home"
4756,114144,indoor,"restaurant, banquet_hall, dining_hall, beer_hall, chemistry_lab"
4757,114168,indoor,"restaurant, banquet_hall, dining_hall, beer_hall, nursing_home"
4758,114192,indoor,"banquet_hall, restaurant, dining_hall, nursing_home, beer_hall"
4759,114216,indoor,"banquet_hall, dining_hall, restaurant, nursing_home, clean_room"
4760,114240,indoor,"restaurant, banquet_hall, nursing_home, clean_room, dining_hall"
4761,114264,indoor,"banquet_hall, dining_hall, restaurant, chemistry_lab, clean_room"
4762,114288,indoor,"banquet_hall, nursing_home, biology_laboratory, restaurant, chemistry_lab"
4763,114312,indoor,"banquet_hall, chemistry_lab, biology_laboratory, restaurant, restaurant_kitchen"
4764,114336,indoor,"banquet_hall, restaurant, biology_laboratory, chemistry_lab, dining_hall"
4765,114360,indoor,"chemistry_lab, banquet_hall, biology_laboratory, clean_room, restaurant"
4766,114384,indoor,"banquet_hall, chemistry_lab, biology_laboratory, clean_room, restaurant"
4767,114408,indoor,"banquet_hall, restaurant, chemistry_lab, dining_hall, biology_laboratory"
4768,114432,indoor,"banquet_hall, dining_hall, jewelry_shop, restaurant, clean_room"
4769,114456,indoor,"beauty_salon, banquet_hall, restaurant, restaurant_kitchen, dining_hall"
4770,114480,indoor,"clean_room, chemistry_lab, jewelry_shop, biology_laboratory, hospital_room"
4771,114504,indoor,"clean_room, chemistry_lab, biology_laboratory, hospital_room, operating_room"
4772,114528,indoor,"clean_room, biology_laboratory, chemistry_lab, hospital_room, operating_room"
