,frame_num,environment,places
0,0,outdoor,"desert/sand, sky, beach, lake/natural, marsh"
1,24,indoor,"server_room, locker_room, parking_garage/indoor, corridor, shower"
2,48,indoor,"corridor, parking_garage/indoor, server_room, locker_room, elevator_lobby"
3,72,indoor,"server_room, corridor, parking_garage/indoor, locker_room, bank_vault"
4,96,indoor,"corridor, server_room, parking_garage/indoor, locker_room, elevator_lobby"
5,120,indoor,"corridor, parking_garage/indoor, server_room, basement, locker_room"
6,144,indoor,"server_room, corridor, bank_vault, locker_room, elevator_lobby"
7,168,indoor,"server_room, locker_room, parking_garage/indoor, bank_vault, shower"
8,192,indoor,"shower, server_room, locker_room, bank_vault, parking_garage/indoor"
9,216,indoor,"corridor, parking_garage/indoor, locker_room, elevator_lobby, server_room"
10,240,indoor,"parking_garage/indoor, corridor, locker_room, elevator_lobby, server_room"
11,264,indoor,"corridor, elevator_lobby, server_room, elevator/door, bank_vault"
12,288,indoor,"corridor, server_room, elevator_lobby, locker_room, parking_garage/indoor"
13,312,indoor,"corridor, parking_garage/indoor, server_room, elevator_lobby, locker_room"
14,336,indoor,"parking_garage/indoor, server_room, elevator_lobby, corridor, basement"
15,360,indoor,"parking_garage/indoor, garage/indoor, parking_lot, airport_terminal, auto_showroom"
16,384,indoor,"parking_garage/indoor, airport_terminal, parking_lot, garage/indoor, auto_showroom"
17,408,indoor,"parking_garage/indoor, parking_lot, garage/indoor, runway, hangar/indoor"
18,432,indoor,"parking_garage/indoor, parking_lot, garage/indoor, runway, hangar/indoor"
19,456,indoor,"parking_garage/indoor, garage/indoor, parking_lot, hangar/indoor, auto_factory"
20,480,indoor,"parking_garage/indoor, parking_lot, airport_terminal, garage/indoor, hangar/indoor"
21,504,indoor,"parking_garage/indoor, parking_lot, garage/indoor, auto_showroom, airplane_cabin"
22,528,indoor,"parking_garage/indoor, airport_terminal, airplane_cabin, runway, shower"
23,552,indoor,"parking_garage/indoor, corridor, basement, server_room, locker_room"
24,576,indoor,"corridor, archive, basement, art_gallery, parking_garage/indoor"
25,600,indoor,"parking_garage/indoor, basement, corridor, garage/indoor, art_gallery"
26,624,indoor,"art_gallery, museum/indoor, basement, archive, server_room"
27,648,indoor,"corridor, basement, parking_garage/indoor, art_gallery, server_room"
28,672,indoor,"corridor, server_room, bank_vault, locker_room, basement"
29,696,indoor,"corridor, basement, bank_vault, elevator_lobby, art_gallery"
30,720,indoor,"museum/indoor, archive, art_gallery, corridor, natural_history_museum"
31,744,indoor,"museum/indoor, art_gallery, archive, clean_room, corridor"
32,768,indoor,"museum/indoor, art_gallery, clean_room, archive, natural_history_museum"
33,792,indoor,"ballroom, basement, discotheque, stage/indoor, bowling_alley"
34,816,outdoor,"discotheque, hot_spring, tower, fountain, mosque/outdoor"
35,840,indoor,"shower, chemistry_lab, fountain, stage/indoor, discotheque"
36,864,indoor,"chemistry_lab, shower, discotheque, hot_spring, basement"
37,888,outdoor,"skyscraper, hot_spring, office_building, downtown, fountain"
38,912,indoor,"discotheque, stage/indoor, music_studio, chemistry_lab, bar"
39,936,indoor,"discotheque, shower, fountain, chemistry_lab, hot_spring"
40,960,indoor,"server_room, corridor, parking_garage/indoor, locker_room, archive"
41,984,indoor,"corridor, server_room, parking_garage/indoor, locker_room, elevator_lobby"
42,1008,indoor,"corridor, server_room, locker_room, parking_garage/indoor, bank_vault"
43,1032,outdoor,"igloo, hot_spring, volcano, shower, natural_history_museum"
44,1056,indoor,"shower, basement, hot_spring, discotheque, bathroom"
45,1080,indoor,"botanical_garden, natural_history_museum, science_museum, museum/indoor, aquarium"
46,1104,indoor,"museum/indoor, art_gallery, natural_history_museum, martial_arts_gym, clean_room"
47,1128,indoor,"motel, bowling_alley, drugstore, hospital, pharmacy"
48,1152,indoor,"motel, bowling_alley, drugstore, pharmacy, hospital"
49,1176,indoor,"motel, bowling_alley, drugstore, pharmacy, hospital"
50,1200,indoor,"motel, bowling_alley, drugstore, pharmacy, hospital"
51,1224,indoor,"motel, bowling_alley, drugstore, pharmacy, hospital"
52,1248,indoor,"motel, bowling_alley, drugstore, pharmacy, hospital"
53,1272,indoor,"motel, hospital, museum/indoor, clean_room, drugstore"
54,1296,indoor,"hospital, hospital_room, museum/indoor, ice_shelf, pharmacy"
55,1320,outdoor,"hospital, ice_shelf, desert/sand, hospital_room, pharmacy"
56,1344,outdoor,"hospital, desert/sand, ice_shelf, pharmacy, hospital_room"
57,1368,outdoor,"hospital, desert/sand, ice_shelf, pharmacy, hospital_room"
58,1392,outdoor,"hospital, desert/sand, ice_shelf, pharmacy, hospital_room"
59,1416,indoor,"hospital, museum/indoor, hospital_room, pharmacy, ice_shelf"
60,1440,indoor,"pharmacy, museum/indoor, drugstore, hospital, natural_history_museum"
61,1464,indoor,"museum/indoor, natural_history_museum, pharmacy, hospital, drugstore"
62,1488,indoor,"museum/indoor, pharmacy, natural_history_museum, drugstore, hospital"
63,1512,indoor,"museum/indoor, natural_history_museum, pharmacy, drugstore, hospital"
64,1536,indoor,"museum/indoor, pharmacy, drugstore, natural_history_museum, hospital"
65,1560,indoor,"museum/indoor, pharmacy, natural_history_museum, drugstore, hospital"
66,1584,indoor,"museum/indoor, pharmacy, booth/indoor, hospital, natural_history_museum"
67,1608,indoor,"museum/indoor, booth/indoor, natural_history_museum, archive, beauty_salon"
68,1632,indoor,"museum/indoor, natural_history_museum, science_museum, booth/indoor, beauty_salon"
69,1656,indoor,"museum/indoor, natural_history_museum, science_museum, archive, elevator/door"
70,1680,indoor,"museum/indoor, natural_history_museum, science_museum, hospital, conference_center"
71,1704,indoor,"museum/indoor, natural_history_museum, pharmacy, science_museum, drugstore"
72,1728,indoor,"museum/indoor, natural_history_museum, science_museum, pharmacy, hospital"
73,1752,indoor,"museum/indoor, natural_history_museum, science_museum, pharmacy, hospital_room"
74,1776,indoor,"museum/indoor, natural_history_museum, pharmacy, science_museum, art_gallery"
75,1800,indoor,"museum/indoor, natural_history_museum, booth/indoor, science_museum, archive"
76,1824,indoor,"museum/indoor, natural_history_museum, archive, science_museum, booth/indoor"
77,1848,indoor,"museum/indoor, natural_history_museum, drugstore, pharmacy, science_museum"
78,1872,indoor,"museum/indoor, natural_history_museum, science_museum, archive, conference_center"
79,1896,indoor,"museum/indoor, natural_history_museum, ice_shelf, science_museum, ice_floe"
80,1920,indoor,"museum/indoor, natural_history_museum, science_museum, booth/indoor, conference_center"
81,1944,indoor,"museum/indoor, drugstore, beauty_salon, natural_history_museum, science_museum"
82,1968,indoor,"pharmacy, drugstore, hospital, museum/indoor, beauty_salon"
83,1992,indoor,"museum/indoor, natural_history_museum, pharmacy, drugstore, science_museum"
84,2016,indoor,"museum/indoor, natural_history_museum, drugstore, science_museum, booth/indoor"
85,2040,indoor,"museum/indoor, natural_history_museum, booth/indoor, science_museum, archive"
86,2064,indoor,"museum/indoor, booth/indoor, science_museum, natural_history_museum, drugstore"
87,2088,indoor,"museum/indoor, natural_history_museum, science_museum, drugstore, pharmacy"
88,2112,indoor,"museum/indoor, drugstore, pharmacy, archive, booth/indoor"
89,2136,indoor,"museum/indoor, archive, natural_history_museum, science_museum, pharmacy"
90,2160,indoor,"museum/indoor, natural_history_museum, booth/indoor, archive, bookstore"
91,2184,indoor,"museum/indoor, natural_history_museum, archive, science_museum, booth/indoor"
92,2208,indoor,"museum/indoor, archive, natural_history_museum, drugstore, science_museum"
93,2232,indoor,"museum/indoor, natural_history_museum, ice_shelf, drugstore, pharmacy"
94,2256,indoor,"museum/indoor, drugstore, booth/indoor, pharmacy, beauty_salon"
95,2280,indoor,"museum/indoor, natural_history_museum, booth/indoor, science_museum, beauty_salon"
96,2304,indoor,"museum/indoor, natural_history_museum, science_museum, drugstore, beauty_salon"
97,2328,indoor,"museum/indoor, pharmacy, drugstore, natural_history_museum, ice_shelf"
98,2352,indoor,"museum/indoor, natural_history_museum, science_museum, booth/indoor, pharmacy"
99,2376,indoor,"museum/indoor, booth/indoor, natural_history_museum, drugstore, science_museum"
100,2400,indoor,"museum/indoor, booth/indoor, natural_history_museum, science_museum, clean_room"
101,2424,indoor,"museum/indoor, natural_history_museum, archive, science_museum, clean_room"
102,2448,indoor,"museum/indoor, natural_history_museum, archive, stage/indoor, art_gallery"
103,2472,indoor,"museum/indoor, natural_history_museum, beauty_salon, gift_shop, art_gallery"
104,2496,indoor,"museum/indoor, ice_shelf, natural_history_museum, booth/indoor, drugstore"
105,2520,indoor,"museum/indoor, natural_history_museum, beauty_salon, stage/indoor, art_gallery"
106,2544,indoor,"museum/indoor, stage/indoor, natural_history_museum, art_gallery, archive"
107,2568,indoor,"museum/indoor, natural_history_museum, pharmacy, stage/indoor, archive"
108,2592,indoor,"museum/indoor, natural_history_museum, pharmacy, stage/indoor, beauty_salon"
109,2616,indoor,"discotheque, music_studio, stage/indoor, chemistry_lab, science_museum"
110,2640,outdoor,"ice_floe, iceberg, clean_room, hospital_room, ice_shelf"
111,2664,indoor,"clean_room, stage/indoor, discotheque, pond, natural_history_museum"
112,2688,indoor,"ice_floe, childs_room, discotheque, stage/indoor, ice_shelf"
113,2712,indoor,"clean_room, discotheque, nursery, childs_room, hospital_room"
114,2736,indoor,"discotheque, clean_room, stage/indoor, iceberg, ice_shelf"
115,2760,indoor,"clean_room, discotheque, pond, ice_floe, stage/indoor"
116,2784,indoor,"discotheque, clean_room, stage/indoor, nursery, childs_room"
117,2808,indoor,"discotheque, clean_room, iceberg, igloo, chemistry_lab"
118,2832,indoor,"clean_room, discotheque, museum/indoor, art_gallery, dressing_room"
119,2856,indoor,"shower, stage/indoor, discotheque, dressing_room, museum/indoor"
120,2880,outdoor,"iceberg, igloo, ice_floe, clean_room, ice_shelf"
121,2904,indoor,"shower, attic, hospital_room, elevator_shaft, clean_room"
122,2928,indoor,"shower, clean_room, hospital_room, chemistry_lab, veterinarians_office"
123,2952,indoor,"shower, hospital_room, clean_room, bathroom, chemistry_lab"
124,2976,indoor,"museum/indoor, clean_room, archive, shower, natural_history_museum"
125,3000,indoor,"clean_room, chemistry_lab, archive, biology_laboratory, igloo"
126,3024,indoor,"clean_room, archive, attic, basement, igloo"
127,3048,indoor,"clean_room, archive, nursery, natural_history_museum, museum/indoor"
128,3072,indoor,"clean_room, shower, archive, nursery, museum/indoor"
129,3096,indoor,"clean_room, nursery, natural_history_museum, museum/indoor, archive"
130,3120,indoor,"clean_room, museum/indoor, natural_history_museum, nursery, archive"
131,3144,indoor,"clean_room, shower, archive, museum/indoor, classroom"
132,3168,indoor,"shower, museum/indoor, archive, clean_room, natural_history_museum"
133,3192,indoor,"museum/indoor, clean_room, discotheque, shower, natural_history_museum"
134,3216,indoor,"shower, clean_room, museum/indoor, basement, nursery"
135,3240,indoor,"clean_room, basement, nursery, shower, museum/indoor"
136,3264,indoor,"shower, discotheque, music_studio, archive, nursery"
137,3288,indoor,"dressing_room, bathroom, shower, locker_room, museum/indoor"
138,3312,indoor,"museum/indoor, art_gallery, shower, bathroom, dressing_room"
139,3336,indoor,"museum/indoor, art_gallery, dressing_room, locker_room, art_studio"
140,3360,indoor,"shower, bathroom, classroom, basement, nursery"
141,3384,indoor,"shower, bathroom, basement, nursery, discotheque"
142,3408,indoor,"shower, discotheque, basement, clean_room, nursery"
143,3432,indoor,"shower, basement, nursery, discotheque, clean_room"
144,3456,indoor,"basement, clean_room, discotheque, archive, chemistry_lab"
145,3480,indoor,"clean_room, archive, discotheque, basement, museum/indoor"
146,3504,indoor,"clean_room, museum/indoor, igloo, basement, art_gallery"
147,3528,indoor,"clean_room, basement, archive, igloo, discotheque"
148,3552,indoor,"clean_room, basement, archive, discotheque, natural_history_museum"
149,3576,indoor,"clean_room, basement, archive, locker_room, shower"
150,3600,indoor,"basement, clean_room, discotheque, archive, shower"
151,3624,indoor,"pharmacy, drugstore, beauty_salon, museum/indoor, science_museum"
152,3648,indoor,"pharmacy, ice_shelf, drugstore, chemistry_lab, museum/indoor"
153,3672,indoor,"pharmacy, drugstore, ice_shelf, beauty_salon, chemistry_lab"
154,3696,outdoor,"igloo, clean_room, iceberg, ice_shelf, ice_floe"
155,3720,indoor,"clean_room, igloo, basement, iceberg, discotheque"
156,3744,outdoor,"clean_room, igloo, iceberg, ice_floe, ice_shelf"
157,3768,indoor,"clean_room, basement, shower, bathroom, archive"
158,3792,indoor,"clean_room, igloo, iceberg, shower, discotheque"
159,3816,indoor,"clean_room, basement, discotheque, igloo, archive"
160,3840,indoor,"clean_room, discotheque, basement, archive, chemistry_lab"
161,3864,indoor,"clean_room, discotheque, igloo, basement, iceberg"
162,3888,indoor,"basement, clean_room, discotheque, archive, chemistry_lab"
163,3912,indoor,"discotheque, clean_room, basement, igloo, archive"
164,3936,indoor,"classroom, kindergarden_classroom, archive, natural_history_museum, nursery"
165,3960,indoor,"classroom, kindergarden_classroom, natural_history_museum, nursery, archive"
166,3984,indoor,"natural_history_museum, classroom, archive, kindergarden_classroom, bathroom"
167,4008,indoor,"classroom, kindergarden_classroom, archive, natural_history_museum, shower"
168,4032,indoor,"attic, classroom, basement, kindergarden_classroom, nursery"
169,4056,indoor,"classroom, kindergarden_classroom, attic, basement, nursery"
170,4080,indoor,"classroom, archive, attic, kindergarden_classroom, natural_history_museum"
171,4104,indoor,"natural_history_museum, classroom, attic, archive, museum/indoor"
172,4128,indoor,"attic, natural_history_museum, archive, basement, classroom"
173,4152,indoor,"attic, natural_history_museum, archive, classroom, nursery"
174,4176,indoor,"natural_history_museum, nursery, attic, classroom, basement"
175,4200,indoor,"nursery, attic, shower, classroom, basement"
176,4224,indoor,"attic, nursery, classroom, basement, natural_history_museum"
177,4248,indoor,"discotheque, basement, stage/indoor, music_studio, classroom"
178,4272,indoor,"discotheque, clean_room, basement, music_studio, chemistry_lab"
179,4296,indoor,"discotheque, basement, clean_room, stage/indoor, music_studio"
180,4320,indoor,"basement, classroom, discotheque, shower, natural_history_museum"
181,4344,indoor,"basement, attic, nursery, classroom, archive"
182,4368,indoor,"attic, natural_history_museum, clean_room, nursery, archive"
183,4392,indoor,"nursery, attic, basement, natural_history_museum, classroom"
184,4416,indoor,"discotheque, basement, attic, shower, nursery"
185,4440,indoor,"attic, basement, discotheque, clean_room, nursery"
186,4464,indoor,"discotheque, basement, shower, attic, clean_room"
187,4488,indoor,"shower, basement, discotheque, clean_room, attic"
188,4512,indoor,"discotheque, basement, shower, nursery, clean_room"
189,4536,indoor,"basement, nursery, discotheque, attic, shower"
190,4560,indoor,"natural_history_museum, attic, shower, basement, nursery"
191,4584,indoor,"natural_history_museum, clean_room, basement, shower, attic"
192,4608,indoor,"clean_room, natural_history_museum, shower, basement, museum/indoor"
193,4632,indoor,"shower, basement, archive, nursery, bathroom"
194,4656,indoor,"natural_history_museum, museum/indoor, archive, nursery, classroom"
195,4680,indoor,"shower, locker_room, bank_vault, clean_room, bathroom"
196,4704,indoor,"bank_vault, locker_room, shower, clean_room, bathroom"
197,4728,indoor,"shower, locker_room, bank_vault, clean_room, bathroom"
198,4752,indoor,"natural_history_museum, basement, archive, museum/indoor, classroom"
199,4776,indoor,"basement, attic, discotheque, shower, nursery"
200,4800,indoor,"clean_room, shower, operating_room, discotheque, museum/indoor"
201,4824,indoor,"clean_room, discotheque, stage/indoor, museum/indoor, basement"
202,4848,indoor,"discotheque, stage/indoor, clean_room, music_studio, basement"
203,4872,indoor,"clean_room, natural_history_museum, museum/indoor, discotheque, basement"
204,4896,indoor,"natural_history_museum, museum/indoor, art_gallery, science_museum, clean_room"
205,4920,indoor,"natural_history_museum, museum/indoor, clean_room, science_museum, art_gallery"
206,4944,indoor,"clean_room, locker_room, archive, bank_vault, jail_cell"
207,4968,indoor,"clean_room, locker_room, archive, art_gallery, basement"
208,4992,indoor,"clean_room, locker_room, archive, jail_cell, basement"
209,5016,indoor,"natural_history_museum, museum/indoor, archive, science_museum, clean_room"
210,5040,indoor,"basement, corridor, jail_cell, locker_room, server_room"
211,5064,indoor,"corridor, basement, locker_room, jail_cell, clean_room"
212,5088,indoor,"corridor, basement, locker_room, server_room, jail_cell"
213,5112,indoor,"locker_room, basement, corridor, parking_garage/indoor, art_gallery"
214,5136,indoor,"locker_room, corridor, basement, parking_garage/indoor, elevator_lobby"
215,5160,indoor,"basement, locker_room, corridor, parking_garage/indoor, storage_room"
216,5184,indoor,"museum/indoor, art_gallery, basement, archive, locker_room"
217,5208,indoor,"art_gallery, museum/indoor, discotheque, basement, archive"
218,5232,indoor,"discotheque, stage/indoor, museum/indoor, basement, art_gallery"
219,5256,indoor,"basement, parking_garage/indoor, locker_room, corridor, storage_room"
220,5280,indoor,"basement, corridor, locker_room, jail_cell, parking_garage/indoor"
221,5304,indoor,"jail_cell, corridor, basement, locker_room, hospital_room"
222,5328,indoor,"corridor, basement, jail_cell, locker_room, bathroom"
223,5352,indoor,"clean_room, natural_history_museum, science_museum, museum/indoor, art_gallery"
224,5376,indoor,"clean_room, science_museum, museum/indoor, natural_history_museum, art_gallery"
225,5400,indoor,"clean_room, science_museum, natural_history_museum, art_gallery, museum/indoor"
226,5424,indoor,"clean_room, natural_history_museum, science_museum, museum/indoor, art_gallery"
227,5448,indoor,"natural_history_museum, clean_room, science_museum, art_gallery, archive"
228,5472,indoor,"museum/indoor, art_gallery, martial_arts_gym, art_studio, stage/indoor"
229,5496,indoor,"art_gallery, museum/indoor, chemistry_lab, art_studio, martial_arts_gym"
230,5520,indoor,"art_gallery, museum/indoor, martial_arts_gym, art_studio, chemistry_lab"
231,5544,indoor,"museum/indoor, art_gallery, chemistry_lab, science_museum, clean_room"
232,5568,indoor,"martial_arts_gym, art_gallery, museum/indoor, discotheque, stage/indoor"
233,5592,indoor,"chemistry_lab, biology_laboratory, clean_room, art_gallery, museum/indoor"
234,5616,indoor,"museum/indoor, art_gallery, martial_arts_gym, art_studio, stage/indoor"
235,5640,indoor,"clean_room, discotheque, natural_history_museum, science_museum, basement"
236,5664,indoor,"art_gallery, museum/indoor, martial_arts_gym, stage/indoor, art_studio"
237,5688,indoor,"art_gallery, museum/indoor, martial_arts_gym, clean_room, art_studio"
238,5712,indoor,"natural_history_museum, clean_room, science_museum, museum/indoor, archive"
239,5736,indoor,"museum/indoor, art_gallery, art_studio, science_museum, archive"
240,5760,indoor,"museum/indoor, art_gallery, science_museum, art_studio, martial_arts_gym"
241,5784,indoor,"museum/indoor, art_gallery, science_museum, martial_arts_gym, art_studio"
242,5808,indoor,"art_gallery, museum/indoor, martial_arts_gym, art_studio, science_museum"
243,5832,indoor,"art_gallery, museum/indoor, martial_arts_gym, art_studio, science_museum"
244,5856,indoor,"art_gallery, museum/indoor, martial_arts_gym, art_studio, science_museum"
245,5880,indoor,"museum/indoor, art_gallery, martial_arts_gym, art_studio, science_museum"
246,5904,indoor,"art_gallery, museum/indoor, martial_arts_gym, clean_room, art_studio"
247,5928,indoor,"art_gallery, museum/indoor, martial_arts_gym, art_studio, clean_room"
248,5952,indoor,"museum/indoor, art_gallery, archive, martial_arts_gym, art_studio"
249,5976,indoor,"clean_room, natural_history_museum, science_museum, museum/indoor, basement"
250,6000,indoor,"clean_room, natural_history_museum, science_museum, museum/indoor, archive"
251,6024,indoor,"clean_room, natural_history_museum, science_museum, museum/indoor, archive"
252,6048,indoor,"art_gallery, museum/indoor, martial_arts_gym, art_studio, science_museum"
253,6072,indoor,"art_gallery, museum/indoor, martial_arts_gym, science_museum, lake/natural"
254,6096,indoor,"martial_arts_gym, art_gallery, chemistry_lab, biology_laboratory, museum/indoor"
255,6120,indoor,"art_gallery, martial_arts_gym, chemistry_lab, museum/indoor, biology_laboratory"
256,6144,indoor,"martial_arts_gym, museum/indoor, art_gallery, art_studio, science_museum"
257,6168,indoor,"art_gallery, museum/indoor, martial_arts_gym, science_museum, discotheque"
258,6192,indoor,"art_gallery, martial_arts_gym, museum/indoor, art_studio, classroom"
259,6216,indoor,"clean_room, natural_history_museum, science_museum, museum/indoor, archive"
260,6240,indoor,"museum/indoor, art_gallery, martial_arts_gym, clean_room, science_museum"
261,6264,indoor,"art_gallery, museum/indoor, martial_arts_gym, clean_room, art_studio"
262,6288,indoor,"museum/indoor, art_gallery, martial_arts_gym, science_museum, art_studio"
263,6312,indoor,"museum/indoor, art_gallery, martial_arts_gym, science_museum, archive"
264,6336,indoor,"martial_arts_gym, museum/indoor, art_gallery, discotheque, science_museum"
265,6360,indoor,"clean_room, natural_history_museum, science_museum, archive, museum/indoor"
266,6384,indoor,"clean_room, natural_history_museum, science_museum, archive, museum/indoor"
267,6408,indoor,"art_gallery, museum/indoor, martial_arts_gym, art_studio, clean_room"
268,6432,indoor,"museum/indoor, art_gallery, martial_arts_gym, science_museum, art_studio"
269,6456,indoor,"museum/indoor, art_gallery, martial_arts_gym, art_studio, science_museum"
270,6480,indoor,"art_gallery, museum/indoor, martial_arts_gym, clean_room, art_studio"
271,6504,indoor,"museum/indoor, art_gallery, art_studio, martial_arts_gym, science_museum"
272,6528,indoor,"museum/indoor, art_gallery, martial_arts_gym, art_studio, science_museum"
273,6552,indoor,"museum/indoor, art_gallery, martial_arts_gym, art_studio, science_museum"
274,6576,indoor,"clean_room, natural_history_museum, science_museum, archive, museum/indoor"
275,6600,indoor,"clean_room, natural_history_museum, science_museum, museum/indoor, art_gallery"
276,6624,indoor,"clean_room, natural_history_museum, science_museum, museum/indoor, art_gallery"
277,6648,indoor,"art_gallery, museum/indoor, art_studio, chemistry_lab, science_museum"
278,6672,indoor,"art_gallery, museum/indoor, martial_arts_gym, art_studio, clean_room"
279,6696,indoor,"natural_history_museum, clean_room, science_museum, museum/indoor, archive"
280,6720,indoor,"clean_room, natural_history_museum, science_museum, museum/indoor, archive"
281,6744,indoor,"art_gallery, museum/indoor, art_studio, chemistry_lab, clean_room"
282,6768,indoor,"art_gallery, museum/indoor, art_studio, clean_room, martial_arts_gym"
283,6792,indoor,"clean_room, museum/indoor, natural_history_museum, art_gallery, science_museum"
284,6816,indoor,"clean_room, operating_room, natural_history_museum, museum/indoor, art_gallery"
285,6840,indoor,"clean_room, museum/indoor, shower, chemistry_lab, discotheque"
286,6864,indoor,"museum/indoor, clean_room, shower, discotheque, archive"
287,6888,indoor,"museum/indoor, clean_room, shower, chemistry_lab, art_gallery"
288,6912,indoor,"clean_room, museum/indoor, igloo, shower, ice_shelf"
289,6936,indoor,"shower, museum/indoor, clean_room, art_gallery, chemistry_lab"
290,6960,indoor,"natural_history_museum, clean_room, museum/indoor, art_gallery, iceberg"
291,6984,indoor,"natural_history_museum, museum/indoor, clean_room, science_museum, art_gallery"
292,7008,indoor,"clean_room, natural_history_museum, museum/indoor, science_museum, art_gallery"
293,7032,indoor,"clean_room, natural_history_museum, museum/indoor, science_museum, art_gallery"
294,7056,indoor,"natural_history_museum, museum/indoor, science_museum, clean_room, archive"
295,7080,indoor,"natural_history_museum, clean_room, museum/indoor, science_museum, art_gallery"
296,7104,indoor,"natural_history_museum, museum/indoor, clean_room, science_museum, art_gallery"
297,7128,indoor,"natural_history_museum, museum/indoor, science_museum, art_gallery, clean_room"
298,7152,indoor,"clean_room, natural_history_museum, museum/indoor, science_museum, art_gallery"
299,7176,indoor,"natural_history_museum, clean_room, museum/indoor, science_museum, archive"
300,7200,indoor,"clean_room, natural_history_museum, museum/indoor, science_museum, art_gallery"
301,7224,indoor,"natural_history_museum, museum/indoor, clean_room, art_gallery, science_museum"
302,7248,indoor,"natural_history_museum, museum/indoor, clean_room, science_museum, archive"
303,7272,indoor,"natural_history_museum, clean_room, museum/indoor, archive, science_museum"
304,7296,indoor,"museum/indoor, art_gallery, martial_arts_gym, science_museum, clean_room"
305,7320,indoor,"museum/indoor, art_gallery, martial_arts_gym, art_studio, stage/indoor"
306,7344,indoor,"museum/indoor, art_gallery, martial_arts_gym, science_museum, art_studio"
307,7368,indoor,"natural_history_museum, museum/indoor, science_museum, art_gallery, clean_room"
