,frame_num,environment,places
1245,29880,indoor,"music_studio, television_studio, clean_room, archive, dressing_room"
1246,29904,indoor,"locker_room, discotheque, dressing_room, bowling_alley, elevator/door"
1247,29928,indoor,"locker_room, discotheque, dressing_room, airplane_cabin, elevator/door"
1248,29952,indoor,"igloo, shower, ice_floe, discotheque, museum/indoor"
1249,29976,outdoor,"shower, igloo, ice_shelf, ice_floe, discotheque"
1250,30000,indoor,"igloo, chemistry_lab, discotheque, clean_room, shower"
1251,30024,indoor,"clean_room, chemistry_lab, igloo, clothing_store, biology_laboratory"
1252,30048,indoor,"clean_room, chemistry_lab, clothing_store, biology_laboratory, igloo"
1253,30072,indoor,"locker_room, clean_room, archive, music_studio, bank_vault"
1254,30096,indoor,"clean_room, locker_room, archive, bank_vault, music_studio"
1255,30120,indoor,"clean_room, locker_room, bowling_alley, discotheque, music_studio"
1256,30144,indoor,"clean_room, locker_room, archive, bank_vault, server_room"
1257,30168,indoor,"locker_room, airplane_cabin, science_museum, basement, archive"
1258,30192,indoor,"science_museum, airplane_cabin, natural_history_museum, discotheque, museum/indoor"
1259,30216,indoor,"science_museum, natural_history_museum, airport_terminal, museum/indoor, locker_room"
1260,30240,indoor,"science_museum, natural_history_museum, airport_terminal, airplane_cabin, museum/indoor"
1261,30264,indoor,"science_museum, airport_terminal, natural_history_museum, airplane_cabin, subway_station/platform"
1262,30288,indoor,"science_museum, airport_terminal, airplane_cabin, jail_cell, museum/indoor"
1263,30312,indoor,"science_museum, airport_terminal, museum/indoor, natural_history_museum, jail_cell"
1264,30336,indoor,"science_museum, archive, jail_cell, airport_terminal, natural_history_museum"
1265,30360,indoor,"airplane_cabin, science_museum, airport_terminal, bowling_alley, locker_room"
1266,30384,indoor,"clean_room, locker_room, dressing_room, archive, operating_room"
1267,30408,indoor,"clean_room, locker_room, operating_room, martial_arts_gym, dressing_room"
1268,30432,indoor,"clean_room, locker_room, museum/indoor, archive, operating_room"
1269,30456,indoor,"clean_room, locker_room, archive, dressing_room, clothing_store"
1270,30480,indoor,"clean_room, locker_room, archive, operating_room, dressing_room"
1271,30504,indoor,"airport_terminal, science_museum, museum/indoor, locker_room, discotheque"
1272,30528,indoor,"science_museum, airport_terminal, subway_station/platform, bowling_alley, airplane_cabin"
1273,30552,indoor,"chemistry_lab, bar, airport_terminal, museum/indoor, bowling_alley"
1274,30576,indoor,"airplane_cabin, locker_room, lobby, science_museum, elevator/door"
1275,30600,indoor,"locker_room, clean_room, archive, bank_vault, jail_cell"
1276,30624,indoor,"locker_room, clean_room, archive, corridor, jail_cell"
1277,30648,indoor,"airplane_cabin, locker_room, chemistry_lab, airport_terminal, archive"
1278,30672,indoor,"science_museum, museum/indoor, airplane_cabin, archive, chemistry_lab"
1279,30696,indoor,"clean_room, chemistry_lab, biology_laboratory, archive, iceberg"
1280,30720,indoor,"clean_room, chemistry_lab, biology_laboratory, locker_room, archive"
1281,30744,indoor,"clean_room, chemistry_lab, iceberg, biology_laboratory, archive"
1282,30768,indoor,"clean_room, chemistry_lab, clothing_store, iceberg, biology_laboratory"
1283,30792,indoor,"clean_room, chemistry_lab, locker_room, biology_laboratory, clothing_store"
1284,30816,indoor,"clean_room, locker_room, archive, nursery, jail_cell"
1285,30840,indoor,"jail_cell, locker_room, bathroom, clean_room, archive"
1286,30864,indoor,"archive, clean_room, locker_room, jail_cell, science_museum"
1287,30888,indoor,"clean_room, shoe_shop, locker_room, department_store, archive"
1288,30912,indoor,"locker_room, airplane_cabin, clean_room, elevator_lobby, elevator/door"
1289,30936,indoor,"archive, clean_room, locker_room, corridor, elevator_lobby"
1290,30960,indoor,"clean_room, hospital_room, nursery, operating_room, dressing_room"
1291,30984,indoor,"clean_room, archive, nursery, chemistry_lab, biology_laboratory"
1292,31008,indoor,"archive, clean_room, chemistry_lab, natural_history_museum, science_museum"
1293,31032,indoor,"clean_room, chemistry_lab, dressing_room, locker_room, biology_laboratory"
1294,31056,indoor,"clean_room, chemistry_lab, biology_laboratory, dressing_room, discotheque"
1295,31080,indoor,"clean_room, chemistry_lab, nursery, hospital_room, biology_laboratory"
1296,31104,indoor,"clean_room, chemistry_lab, hospital_room, biology_laboratory, nursery"
1297,31128,indoor,"natural_history_museum, clean_room, archive, science_museum, atrium/public"
1298,31152,indoor,"archive, clean_room, nursery, chemistry_lab, jail_cell"
1299,31176,indoor,"jail_cell, locker_room, museum/indoor, art_gallery, waiting_room"
1300,31200,indoor,"clean_room, operating_room, hospital_room, jail_cell, locker_room"
1301,31224,indoor,"operating_room, hospital_room, nursery, clean_room, bedchamber"
1302,31248,indoor,"operating_room, hospital_room, clean_room, jail_cell, hotel_room"
1303,31272,indoor,"chemistry_lab, clean_room, biology_laboratory, locker_room, dressing_room"
1304,31296,indoor,"clean_room, chemistry_lab, locker_room, jail_cell, shower"
1305,31320,indoor,"clean_room, locker_room, dressing_room, clothing_store, elevator/door"
1306,31344,indoor,"locker_room, clean_room, dressing_room, archive, closet"
1307,31368,indoor,"clean_room, chemistry_lab, archive, locker_room, hospital_room"
1308,31392,indoor,"clean_room, shower, locker_room, chemistry_lab, archive"
1309,31416,indoor,"waiting_room, jail_cell, classroom, library/indoor, hospital_room"
1310,31440,indoor,"waiting_room, dining_room, airport_terminal, living_room, lobby"
1311,31464,indoor,"archive, bank_vault, art_gallery, jewelry_shop, shower"
1312,31488,indoor,"clean_room, operating_room, shower, hospital_room, clothing_store"
1313,31512,indoor,"clean_room, hospital_room, dressing_room, shower, science_museum"
1314,31536,indoor,"museum/indoor, clean_room, art_gallery, alcove, science_museum"
1315,31560,indoor,"nursery, dining_room, hospital_room, youth_hostel, waiting_room"
1316,31584,indoor,"nursery, dining_room, clean_room, hospital_room, chemistry_lab"
1317,31608,indoor,"dining_room, hospital_room, bathroom, nursery, clean_room"
1318,31632,indoor,"nursery, hospital_room, dining_room, youth_hostel, hotel_room"
1319,31656,indoor,"nursery, youth_hostel, hospital_room, locker_room, bathroom"
1320,31680,indoor,"nursery, hospital_room, dining_room, youth_hostel, locker_room"
1321,31704,indoor,"nursery, youth_hostel, hospital_room, staircase, locker_room"
1322,31728,indoor,"bathroom, clean_room, beauty_salon, shower, operating_room"
1323,31752,indoor,"airplane_cabin, clean_room, dressing_room, hospital_room, hotel_room"
1324,31776,indoor,"dressing_room, clean_room, hospital_room, computer_room, classroom"
1325,31800,indoor,"dressing_room, clean_room, locker_room, discotheque, music_studio"
1326,31824,indoor,"clean_room, dressing_room, chemistry_lab, hospital_room, locker_room"
1327,31848,indoor,"dressing_room, shower, bathroom, music_studio, clean_room"
1328,31872,indoor,"clean_room, dressing_room, art_gallery, artists_loft, locker_room"
1329,31896,indoor,"martial_arts_gym, clean_room, music_studio, dressing_room, office"
1330,31920,indoor,"clean_room, martial_arts_gym, dressing_room, hospital_room, office"
1331,31944,indoor,"clean_room, dressing_room, office, hospital_room, reception"
1332,31968,indoor,"clean_room, dressing_room, martial_arts_gym, hospital_room, operating_room"
1333,31992,indoor,"elevator/door, shower, sauna, dressing_room, bathroom"
1334,32016,indoor,"clean_room, dressing_room, operating_room, hospital_room, beauty_salon"
1335,32040,indoor,"shower, dressing_room, bathroom, elevator/door, sauna"
1336,32064,indoor,"shower, dressing_room, sauna, bathroom, clean_room"
1337,32088,indoor,"shower, dressing_room, sauna, bathroom, elevator/door"
1338,32112,indoor,"clean_room, dressing_room, hospital_room, operating_room, chemistry_lab"
1339,32136,indoor,"shower, sauna, dressing_room, bathroom, elevator/door"
1340,32160,indoor,"clean_room, dressing_room, music_studio, martial_arts_gym, beauty_salon"
1341,32184,indoor,"bathroom, shower, beauty_salon, artists_loft, hotel_room"
1342,32208,indoor,"clean_room, beauty_salon, dressing_room, bathroom, hospital_room"
1343,32232,indoor,"clean_room, dressing_room, artists_loft, beauty_salon, bathroom"
1344,32256,indoor,"dressing_room, music_studio, shower, bathroom, clean_room"
1345,32280,indoor,"clean_room, art_gallery, dressing_room, chemistry_lab, art_studio"
1346,32304,indoor,"clean_room, art_gallery, dressing_room, music_studio, artists_loft"
1347,32328,indoor,"dressing_room, clean_room, beauty_salon, bathroom, music_studio"
1348,32352,indoor,"dressing_room, clean_room, art_studio, artists_loft, art_gallery"
1349,32376,indoor,"dressing_room, art_gallery, clean_room, art_studio, artists_loft"
1350,32400,indoor,"shower, dressing_room, clean_room, bathroom, artists_loft"
1351,32424,indoor,"dressing_room, shower, artists_loft, art_gallery, clean_room"
1352,32448,indoor,"dressing_room, artists_loft, office, clean_room, art_studio"
1353,32472,indoor,"art_gallery, artists_loft, clean_room, shower, dressing_room"
1354,32496,indoor,"clean_room, artists_loft, art_gallery, shower, dressing_room"
1355,32520,indoor,"bathroom, shower, beauty_salon, office, conference_room"
1356,32544,indoor,"nursery, youth_hostel, hospital_room, staircase, jail_cell"
1357,32568,indoor,"hospital_room, nursery, dining_room, youth_hostel, corridor"
1358,32592,indoor,"nursery, dining_room, hospital_room, youth_hostel, bathroom"
1359,32616,indoor,"nursery, dining_room, hospital_room, museum/indoor, youth_hostel"
1360,32640,indoor,"nursery, museum/indoor, locker_room, dining_room, clean_room"
1361,32664,indoor,"hospital_room, dining_room, nursery, restaurant, clean_room"
1362,32688,indoor,"lobby, clean_room, archive, museum/indoor, library/indoor"
1363,32712,indoor,"clean_room, archive, museum/indoor, server_room, art_gallery"
1364,32736,indoor,"clean_room, bank_vault, server_room, archive, lobby"
1365,32760,indoor,"clean_room, bank_vault, museum/indoor, server_room, elevator/door"
1366,32784,indoor,"clean_room, chemistry_lab, museum/indoor, bank_vault, lobby"
1367,32808,indoor,"clean_room, lobby, chemistry_lab, entrance_hall, museum/indoor"
1368,32832,indoor,"clean_room, chemistry_lab, biology_laboratory, physics_laboratory, archive"
1369,32856,indoor,"clean_room, dressing_room, chemistry_lab, biology_laboratory, discotheque"
1370,32880,indoor,"archive, office_cubicles, clean_room, locker_room, airplane_cabin"
1371,32904,indoor,"bow_window/indoor, artists_loft, lobby, living_room, entrance_hall"
1372,32928,indoor,"shower, server_room, bank_vault, locker_room, clean_room"
1373,32952,indoor,"locker_room, shower, bank_vault, server_room, clean_room"
1374,32976,indoor,"clean_room, locker_room, bank_vault, shower, elevator/door"
1375,33000,indoor,"locker_room, bank_vault, shower, elevator/door, archive"
1376,33024,indoor,"shower, bank_vault, locker_room, elevator/door, bathroom"
1377,33048,indoor,"locker_room, shower, jail_cell, elevator/door, bathroom"
1378,33072,indoor,"locker_room, shower, bathroom, clean_room, jail_cell"
1379,33096,indoor,"locker_room, shower, clean_room, bank_vault, archive"
1380,33120,indoor,"shower, locker_room, parking_garage/indoor, bank_vault, bathroom"
1381,33144,outdoor,"shower, basement, beach, skyscraper, sky"
1382,33168,indoor,"shower, basement, art_gallery, tower, skyscraper"
1383,33192,indoor,"nursery, childs_room, museum/indoor, beauty_salon, kindergarden_classroom"
1384,33216,indoor,"childs_room, nursery, pharmacy, drugstore, gift_shop"
1385,33240,indoor,"childs_room, pharmacy, drugstore, nursery, gift_shop"
1386,33264,indoor,"bathroom, shower, parking_garage/indoor, jail_cell, garage/indoor"
1387,33288,indoor,"bathroom, shower, garage/indoor, jail_cell, hangar/indoor"
1388,33312,indoor,"natural_history_museum, pond, museum/indoor, art_gallery, marsh"
1389,33336,indoor,"natural_history_museum, museum/indoor, art_gallery, pond, science_museum"
1390,33360,indoor,"natural_history_museum, museum/indoor, art_gallery, science_museum, pond"
1391,33384,indoor,"natural_history_museum, museum/indoor, pond, marsh, art_gallery"
1392,33408,indoor,"natural_history_museum, museum/indoor, art_gallery, pond, science_museum"
1393,33432,indoor,"natural_history_museum, pond, marsh, museum/indoor, art_gallery"
1394,33456,indoor,"natural_history_museum, museum/indoor, pond, art_gallery, marsh"
1395,33480,outdoor,"natural_history_museum, pond, runway, marsh, fishpond"
1396,33504,outdoor,"pond, natural_history_museum, fishpond, marsh, lake/natural"
1397,33528,indoor,"natural_history_museum, pond, fishpond, science_museum, museum/indoor"
1398,33552,outdoor,"natural_history_museum, pond, marsh, fishpond, lake/natural"
1399,33576,outdoor,"pond, fishpond, natural_history_museum, marsh, lake/natural"
1400,33600,indoor,"natural_history_museum, pond, discotheque, museum/indoor, stage/indoor"
1401,33624,indoor,"natural_history_museum, museum/indoor, art_gallery, pond, science_museum"
1402,33648,indoor,"natural_history_museum, museum/indoor, art_gallery, stage/indoor, gymnasium/indoor"
1403,33672,indoor,"stage/indoor, discotheque, natural_history_museum, gymnasium/indoor, art_gallery"
1404,33696,indoor,"natural_history_museum, pond, art_gallery, science_museum, fishpond"
1405,33720,indoor,"natural_history_museum, museum/indoor, art_gallery, pond, airport_terminal"
1406,33744,indoor,"natural_history_museum, pond, fishpond, art_gallery, museum/indoor"
1407,33768,outdoor,"natural_history_museum, pond, fishpond, marsh, lake/natural"
1408,33792,outdoor,"pond, natural_history_museum, marsh, lake/natural, fishpond"
1409,33816,outdoor,"pond, natural_history_museum, marsh, fishpond, lake/natural"
1410,33840,outdoor,"pond, natural_history_museum, fishpond, marsh, lake/natural"
1411,33864,outdoor,"pond, natural_history_museum, fishpond, marsh, lake/natural"
1412,33888,indoor,"natural_history_museum, pond, marsh, museum/indoor, art_gallery"
1413,33912,indoor,"natural_history_museum, pond, science_museum, museum/indoor, runway"
1414,33936,indoor,"bathroom, shower, garage/indoor, jail_cell, utility_room"
1415,33960,indoor,"garage/indoor, parking_garage/indoor, bathroom, basement, shower"
1416,33984,indoor,"jail_cell, locker_room, shower, basement, clean_room"
1417,34008,indoor,"locker_room, jail_cell, basement, garage/indoor, art_gallery"
1418,34032,indoor,"jail_cell, locker_room, basement, garage/indoor, elevator_lobby"
1419,34056,indoor,"locker_room, jail_cell, basement, clean_room, server_room"
1420,34080,indoor,"locker_room, jail_cell, basement, garage/indoor, shower"
1421,34104,indoor,"jail_cell, locker_room, basement, garage/indoor, shower"
1422,34128,indoor,"clean_room, locker_room, server_room, bank_vault, elevator/door"
1423,34152,indoor,"clean_room, locker_room, bank_vault, elevator/door, server_room"
1424,34176,indoor,"clean_room, bank_vault, locker_room, archive, shower"
1425,34200,indoor,"clean_room, locker_room, bank_vault, archive, server_room"
1426,34224,indoor,"clean_room, locker_room, bank_vault, archive, server_room"
1427,34248,indoor,"clean_room, locker_room, archive, operating_room, bank_vault"
1428,34272,indoor,"clean_room, locker_room, archive, shower, bank_vault"
1429,34296,indoor,"clean_room, locker_room, archive, server_room, bank_vault"
1430,34320,indoor,"clean_room, dressing_room, locker_room, shower, elevator/door"
1431,34344,indoor,"clean_room, dressing_room, museum/indoor, locker_room, elevator/door"
1432,34368,indoor,"clean_room, dressing_room, locker_room, museum/indoor, archive"
1433,34392,indoor,"clean_room, locker_room, dressing_room, archive, closet"
1434,34416,indoor,"dressing_room, locker_room, clean_room, beauty_salon, clothing_store"
1435,34440,indoor,"locker_room, waiting_room, airport_terminal, classroom, archive"
1436,34464,indoor,"discotheque, dressing_room, stage/indoor, bowling_alley, ballroom"
1437,34488,indoor,"discotheque, stage/indoor, dressing_room, clean_room, chemistry_lab"
1438,34512,indoor,"clean_room, discotheque, chemistry_lab, stage/indoor, biology_laboratory"
1439,34536,indoor,"clean_room, discotheque, dressing_room, ballroom, stage/indoor"
1440,34560,indoor,"clean_room, dressing_room, department_store, clothing_store, discotheque"
1441,34584,indoor,"clean_room, dressing_room, locker_room, museum/indoor, beauty_salon"
1442,34608,indoor,"dressing_room, shower, archive, bathroom, wet_bar"
1443,34632,indoor,"archive, clean_room, chemistry_lab, dressing_room, basement"
1444,34656,indoor,"archive, dressing_room, clean_room, basement, shower"
1445,34680,indoor,"dressing_room, bathroom, beauty_salon, shower, clean_room"
1446,34704,indoor,"dressing_room, beauty_salon, shower, bathroom, archive"
1447,34728,indoor,"bathroom, archive, shower, basement, dressing_room"
1448,34752,indoor,"shower, clean_room, bathroom, archive, chemistry_lab"
1449,34776,indoor,"clean_room, shower, archive, jewelry_shop, bank_vault"
1450,34800,indoor,"clean_room, archive, beauty_salon, jewelry_shop, museum/indoor"
1451,34824,indoor,"archive, clean_room, office_cubicles, reception, office"
1452,34848,indoor,"clean_room, archive, physics_laboratory, science_museum, jewelry_shop"
1453,34872,indoor,"clean_room, archive, chemistry_lab, biology_laboratory, physics_laboratory"
1454,34896,indoor,"clean_room, jewelry_shop, chemistry_lab, archive, physics_laboratory"
1455,34920,indoor,"clean_room, chemistry_lab, beauty_salon, biology_laboratory, wet_bar"
1456,34944,indoor,"clean_room, jewelry_shop, beauty_salon, chemistry_lab, archive"
1457,34968,indoor,"clean_room, archive, jewelry_shop, beauty_salon, chemistry_lab"
1458,34992,indoor,"jewelry_shop, archive, clean_room, beauty_salon, chemistry_lab"
1459,35016,indoor,"jewelry_shop, beauty_salon, chemistry_lab, coffee_shop, archive"
1460,35040,indoor,"beauty_salon, chemistry_lab, jewelry_shop, clean_room, coffee_shop"
1461,35064,indoor,"archive, beauty_salon, chemistry_lab, jewelry_shop, clean_room"
1462,35088,indoor,"archive, beauty_salon, chemistry_lab, jewelry_shop, clean_room"
1463,35112,indoor,"archive, clean_room, chemistry_lab, physics_laboratory, biology_laboratory"
1464,35136,indoor,"clean_room, beauty_salon, dressing_room, archive, chemistry_lab"
1465,35160,indoor,"beauty_salon, dressing_room, clean_room, jewelry_shop, reception"
1466,35184,indoor,"beauty_salon, clean_room, dressing_room, archive, restaurant"
1467,35208,indoor,"shower, wet_bar, reception, bathroom, kitchen"
1468,35232,indoor,"wet_bar, shower, reception, bathroom, kitchen"
1469,35256,indoor,"bathroom, chemistry_lab, shower, clean_room, beauty_salon"
1470,35280,indoor,"bathroom, chemistry_lab, shower, coffee_shop, clean_room"
1471,35304,indoor,"bathroom, shower, chemistry_lab, wet_bar, clean_room"
1472,35328,indoor,"bathroom, shower, art_gallery, museum/indoor, reception"
1473,35352,indoor,"art_gallery, clean_room, museum/indoor, shower, airport_terminal"
1474,35376,indoor,"discotheque, dressing_room, stage/indoor, music_studio, clean_room"
1475,35400,indoor,"discotheque, stage/indoor, art_gallery, music_studio, dressing_room"
1476,35424,indoor,"discotheque, clean_room, chemistry_lab, biology_laboratory, bowling_alley"
1477,35448,indoor,"clean_room, bathroom, chemistry_lab, biology_laboratory, office_cubicles"
1478,35472,indoor,"clean_room, chemistry_lab, dressing_room, biology_laboratory, bathroom"
1479,35496,indoor,"chemistry_lab, biology_laboratory, drugstore, pharmacy, clean_room"
1480,35520,indoor,"discotheque, chemistry_lab, shower, stage/indoor, bathroom"
1481,35544,indoor,"discotheque, airplane_cabin, music_studio, airport_terminal, runway"
1482,35568,indoor,"shower, elevator/door, elevator_lobby, art_gallery, atrium/public"
1483,35592,indoor,"shower, art_gallery, clean_room, elevator/door, museum/indoor"
1484,35616,indoor,"shower, elevator/door, art_gallery, science_museum, museum/indoor"
1485,35640,indoor,"shower, elevator/door, science_museum, clean_room, natural_history_museum"
1486,35664,indoor,"airplane_cabin, runway, operating_room, hospital_room, clean_room"
1487,35688,indoor,"airplane_cabin, discotheque, bowling_alley, shower, locker_room"
1488,35712,indoor,"discotheque, bowling_alley, locker_room, martial_arts_gym, ballroom"
1489,35736,indoor,"discotheque, bowling_alley, locker_room, martial_arts_gym, sauna"
1490,35760,indoor,"discotheque, bowling_alley, airplane_cabin, martial_arts_gym, ballroom"
1491,35784,indoor,"bowling_alley, discotheque, airplane_cabin, locker_room, airport_terminal"
1492,35808,indoor,"discotheque, bowling_alley, martial_arts_gym, airplane_cabin, boxing_ring"
1493,35832,indoor,"airplane_cabin, discotheque, bowling_alley, ballroom, martial_arts_gym"
1494,35856,indoor,"shower, art_gallery, elevator/door, museum/indoor, elevator_lobby"
1495,35880,indoor,"shower, art_gallery, elevator/door, museum/indoor, clean_room"
1496,35904,indoor,"clean_room, shower, elevator/door, server_room, archive"
1497,35928,indoor,"shower, elevator/door, art_gallery, clean_room, museum/indoor"
1498,35952,indoor,"discotheque, airplane_cabin, bowling_alley, airport_terminal, ballroom"
1499,35976,indoor,"clean_room, airplane_cabin, hospital_room, operating_room, bowling_alley"
1500,36000,indoor,"elevator/door, art_gallery, shower, clean_room, elevator_lobby"
1501,36024,indoor,"shower, clean_room, closet, elevator/door, basement"
1502,36048,indoor,"discotheque, airplane_cabin, bowling_alley, dressing_room, locker_room"
1503,36072,indoor,"airplane_cabin, locker_room, discotheque, bowling_alley, basement"
1504,36096,indoor,"shower, elevator/door, closet, server_room, elevator_lobby"
1505,36120,indoor,"shower, clean_room, museum/indoor, elevator/door, elevator_lobby"
1506,36144,indoor,"museum/indoor, shower, art_gallery, clean_room, atrium/public"
1507,36168,indoor,"attic, atrium/public, clean_room, museum/indoor, elevator_lobby"
1508,36192,indoor,"clean_room, museum/indoor, airport_terminal, corridor, atrium/public"
1509,36216,indoor,"museum/indoor, clean_room, art_gallery, alcove, airport_terminal"
1510,36240,indoor,"alcove, museum/indoor, church/indoor, arch, clean_room"
1511,36264,indoor,"clean_room, church/indoor, museum/indoor, attic, entrance_hall"
1512,36288,indoor,"bow_window/indoor, elevator/door, elevator_lobby, server_room, shower"
1513,36312,indoor,"shower, hotel_room, bathroom, bow_window/indoor, living_room"
1514,36336,indoor,"shower, bathroom, hotel_room, bedroom, dorm_room"
1515,36360,indoor,"bedroom, hotel_room, shower, bathroom, hospital_room"
1516,36384,indoor,"bedroom, hotel_room, youth_hostel, bedchamber, dorm_room"
1517,36408,indoor,"bedroom, hotel_room, nursery, youth_hostel, bedchamber"
1518,36432,indoor,"airplane_cabin, bowling_alley, locker_room, ballroom, discotheque"
1519,36456,indoor,"locker_room, dressing_room, airplane_cabin, bowling_alley, discotheque"
1520,36480,indoor,"dressing_room, locker_room, clothing_store, discotheque, airplane_cabin"
1521,36504,indoor,"staircase, dressing_room, ballroom, sauna, discotheque"
1522,36528,indoor,"staircase, locker_room, dressing_room, airport_terminal, elevator_lobby"
1523,36552,indoor,"dressing_room, locker_room, bedroom, basement, boxing_ring"
1524,36576,indoor,"airplane_cabin, dressing_room, discotheque, bowling_alley, hospital_room"
1525,36600,indoor,"museum/indoor, art_gallery, archive, stage/indoor, lecture_room"
1526,36624,indoor,"discotheque, locker_room, dressing_room, airplane_cabin, bowling_alley"
1527,36648,indoor,"discotheque, airplane_cabin, dressing_room, bowling_alley, locker_room"
1528,36672,indoor,"discotheque, dressing_room, airplane_cabin, bowling_alley, locker_room"
1529,36696,indoor,"hotel_room, bedroom, shower, beauty_salon, bathroom"
1530,36720,indoor,"hotel_room, shower, bedroom, bathroom, dorm_room"
1531,36744,indoor,"shower, hotel_room, bedroom, bathroom, sauna"
1532,36768,indoor,"shower, hotel_room, bedroom, bathroom, dorm_room"
1533,36792,indoor,"shower, hotel_room, bedroom, bathroom, sauna"
1534,36816,indoor,"shower, hotel_room, bedroom, bathroom, sauna"
1535,36840,indoor,"shower, hotel_room, bathroom, bedroom, sauna"
1536,36864,indoor,"airplane_cabin, bowling_alley, discotheque, locker_room, hospital_room"
1537,36888,indoor,"airplane_cabin, bowling_alley, discotheque, locker_room, hospital_room"
1538,36912,indoor,"bowling_alley, discotheque, airplane_cabin, locker_room, dressing_room"
1539,36936,indoor,"airplane_cabin, bowling_alley, airport_terminal, museum/indoor, nursery"
1540,36960,indoor,"shower, locker_room, elevator/door, elevator_lobby, corridor"
1541,36984,indoor,"hotel_room, living_room, waiting_room, bow_window/indoor, dorm_room"
1542,37008,indoor,"hotel_room, living_room, bow_window/indoor, bedroom, waiting_room"
1543,37032,indoor,"archive, bow_window/indoor, nursery, fabric_store, porch"
1544,37056,indoor,"archive, bow_window/indoor, porch, nursery, balcony/interior"
1545,37080,indoor,"sauna, dressing_room, shower, hotel_room, bedroom"
1546,37104,indoor,"sauna, dressing_room, shower, hotel_room, bedroom"
1547,37128,indoor,"shower, bathroom, elevator/door, locker_room, sauna"
1548,37152,indoor,"shower, alcove, bow_window/indoor, entrance_hall, bathroom"
1549,37176,indoor,"shower, alcove, bow_window/indoor, bathroom, entrance_hall"
1550,37200,indoor,"shower, alcove, bow_window/indoor, bathroom, entrance_hall"
1551,37224,indoor,"shower, alcove, bow_window/indoor, entrance_hall, bathroom"
1552,37248,indoor,"alcove, shower, bow_window/indoor, entrance_hall, living_room"
1553,37272,indoor,"alcove, living_room, bow_window/indoor, museum/indoor, nursery"
1554,37296,indoor,"museum/indoor, alcove, shower, living_room, entrance_hall"
1555,37320,indoor,"alcove, nursery, living_room, hotel_room, hospital_room"
