,frame_num,environment,places,imdb_id
3078,73872,indoor,"elevator_lobby, art_gallery, locker_room, dressing_room, elevator/door",60581
3079,73896,indoor,"art_gallery, elevator_lobby, dressing_room, locker_room, clean_room",60581
3080,73920,indoor,"legislative_chamber, conference_center, banquet_hall, jewelry_shop, beer_hall",60581
3081,73944,indoor,"conference_center, banquet_hall, legislative_chamber, jewelry_shop, bar",60581
3082,73968,indoor,"banquet_hall, conference_center, legislative_chamber, jewelry_shop, bar",60581
3083,73992,indoor,"art_gallery, dressing_room, elevator_lobby, clean_room, locker_room",60581
3084,74016,indoor,"elevator_lobby, office, elevator/door, conference_center, locker_room",60581
3085,74040,indoor,"elevator_lobby, office, art_gallery, dressing_room, nursing_home",60581
3086,74064,indoor,"office, conference_center, music_studio, chemistry_lab, television_studio",60581
3087,74088,indoor,"conference_center, office, music_studio, television_studio, chemistry_lab",60581
3088,74112,indoor,"office, conference_center, chemistry_lab, music_studio, television_studio",60581
3089,74136,indoor,"office, conference_center, music_studio, jail_cell, television_studio",60581
3090,74160,indoor,"beauty_salon, dressing_room, shower, conference_center, stage/indoor",60581
3091,74184,indoor,"dressing_room, beauty_salon, shower, locker_room, music_studio",60581
3092,74208,indoor,"dressing_room, beauty_salon, shower, locker_room, conference_center",60581
3093,74232,indoor,"elevator_lobby, office, locker_room, clean_room, elevator/door",60581
3094,74256,indoor,"elevator_lobby, office, locker_room, clean_room, nursing_home",60581
3095,74280,indoor,"clean_room, locker_room, dressing_room, office, elevator_lobby",60581
3096,74304,indoor,"clean_room, dressing_room, art_gallery, chemistry_lab, beauty_salon",60581
3097,74328,indoor,"clean_room, dressing_room, art_gallery, beauty_salon, chemistry_lab",60581
3098,74352,indoor,"dressing_room, clean_room, office, nursing_home, elevator_lobby",60581
3099,74376,indoor,"beauty_salon, dressing_room, stage/indoor, locker_room, shower",60581
3100,74400,indoor,"discotheque, beauty_salon, stage/indoor, dressing_room, music_studio",60581
3101,74424,indoor,"elevator_lobby, dressing_room, office, art_gallery, reception",60581
3102,74448,indoor,"shower, bathroom, discotheque, dressing_room, airplane_cabin",60581
3103,74472,indoor,"dressing_room, discotheque, shower, bathroom, locker_room",60581
3104,74496,indoor,"beauty_salon, dressing_room, stage/indoor, conference_center, discotheque",60581
3105,74520,indoor,"stage/indoor, beauty_salon, dressing_room, music_studio, shower",60581
3106,74544,indoor,"dressing_room, discotheque, shower, stage/indoor, elevator_lobby",60581
3107,74568,indoor,"discotheque, shower, stage/indoor, dressing_room, ballroom",60581
3108,74592,indoor,"dressing_room, airplane_cabin, stage/indoor, conference_center, discotheque",60581
3109,74616,indoor,"dressing_room, airplane_cabin, stage/indoor, shower, discotheque",60581
3110,74640,indoor,"conference_center, office, music_studio, television_studio, airplane_cabin",60581
3111,74664,indoor,"conference_center, office, television_studio, airplane_cabin, music_studio",60581
3112,74688,indoor,"conference_center, office, television_studio, jail_cell, music_studio",60581
3113,74712,indoor,"conference_center, office, archive, jail_cell, chemistry_lab",60581
3114,74736,indoor,"conference_center, office, archive, jail_cell, music_studio",60581
3115,74760,indoor,"office, archive, conference_center, jail_cell, music_studio",60581
3116,74784,indoor,"conference_center, office, music_studio, discotheque, television_studio",60581
3117,74808,indoor,"discotheque, shower, airplane_cabin, ballroom, stage/indoor",60581
3118,74832,indoor,"discotheque, airplane_cabin, dressing_room, stage/indoor, shower",60581
3119,74856,indoor,"beauty_salon, office, dressing_room, hospital_room, conference_center",60581
3120,74880,indoor,"beauty_salon, hospital_room, office, nursing_home, conference_center",60581
3121,74904,indoor,"discotheque, airplane_cabin, dressing_room, shower, stage/indoor",60581
3122,74928,indoor,"airplane_cabin, discotheque, shower, elevator_lobby, dressing_room",60581
3123,74952,indoor,"nursing_home, conference_center, office, hospital_room, dressing_room",60581
3124,74976,indoor,"conference_center, nursing_home, office, conference_room, hospital_room",60581
3125,75000,indoor,"banquet_hall, dining_hall, conference_room, dining_room, legislative_chamber",60581
3126,75024,indoor,"banquet_hall, dining_hall, dining_room, beer_hall, restaurant",60581
3127,75048,indoor,"banquet_hall, dining_hall, conference_room, legislative_chamber, beer_hall",60581
3128,75072,indoor,"banquet_hall, dining_hall, beer_hall, dining_room, legislative_chamber",60581
3129,75096,indoor,"elevator/door, elevator_lobby, art_gallery, office, conference_center",60581
3130,75120,indoor,"conference_center, elevator/door, lecture_room, office, art_gallery",60581
3131,75144,indoor,"elevator/door, elevator_lobby, conference_center, office, locker_room",60581
3132,75168,indoor,"dressing_room, beauty_salon, office, conference_center, locker_room",60581
3133,75192,indoor,"dressing_room, beauty_salon, office, conference_center, locker_room",60581
3134,75216,indoor,"shower, dressing_room, bathroom, airplane_cabin, elevator_lobby",60581
3135,75240,indoor,"shower, dressing_room, bathroom, airplane_cabin, elevator_lobby",60581
3136,75264,indoor,"shower, dressing_room, bathroom, elevator_lobby, airplane_cabin",60581
3137,75288,indoor,"dressing_room, airplane_cabin, shower, office, bathroom",60581
3138,75312,indoor,"shower, dressing_room, elevator_lobby, elevator/door, bow_window/indoor",60581
3139,75336,indoor,"dressing_room, shower, elevator_lobby, elevator/door, stage/indoor",60581
3140,75360,indoor,"dressing_room, elevator_lobby, elevator/door, stage/indoor, shower",60581
3141,75384,indoor,"dressing_room, elevator_lobby, shower, museum/indoor, locker_room",60581
3142,75408,indoor,"legislative_chamber, conference_center, conference_room, banquet_hall, jewelry_shop",60581
3143,75432,indoor,"conference_center, legislative_chamber, conference_room, jewelry_shop, banquet_hall",60581
3144,75456,indoor,"jewelry_shop, banquet_hall, conference_center, chemistry_lab, bar",60581
3145,75480,indoor,"jewelry_shop, banquet_hall, conference_center, dining_hall, bar",60581
3146,75504,indoor,"dressing_room, clean_room, museum/indoor, stage/indoor, art_gallery",60581
3147,75528,indoor,"dressing_room, elevator_lobby, clean_room, art_gallery, office",60581
3148,75552,indoor,"dressing_room, elevator_lobby, nursing_home, art_gallery, clean_room",60581
3149,75576,indoor,"dressing_room, clean_room, nursing_home, elevator_lobby, art_gallery",60581
3150,75600,indoor,"dressing_room, clean_room, elevator_lobby, art_gallery, museum/indoor",60581
3151,75624,indoor,"dressing_room, elevator_lobby, nursing_home, ballroom, elevator/door",60581
3152,75648,indoor,"conference_center, banquet_hall, jewelry_shop, legislative_chamber, beer_hall",60581
3153,75672,indoor,"dressing_room, nursing_home, chemistry_lab, clean_room, airplane_cabin",60581
3154,75696,indoor,"dressing_room, elevator_lobby, chemistry_lab, locker_room, balcony/interior",60581
3155,75720,indoor,"conference_center, legislative_chamber, jewelry_shop, conference_room, banquet_hall",60581
3156,75744,indoor,"jewelry_shop, conference_center, legislative_chamber, conference_room, banquet_hall",60581
3157,75768,indoor,"dressing_room, elevator_lobby, elevator/door, locker_room, ballroom",60581
3158,75792,indoor,"dressing_room, elevator_lobby, chemistry_lab, locker_room, music_studio",60581
3159,75816,indoor,"office, conference_center, archive, office_cubicles, chemistry_lab",60581
3160,75840,indoor,"elevator_lobby, dressing_room, elevator/door, ballroom, locker_room",60581
3161,75864,indoor,"elevator_lobby, elevator/door, dressing_room, ballroom, locker_room",60581
3162,75888,indoor,"dressing_room, elevator_lobby, ballroom, elevator/door, shower",60581
3163,75912,indoor,"conference_center, office, biology_laboratory, chemistry_lab, nursing_home",60581
3164,75936,indoor,"dressing_room, elevator_lobby, elevator/door, ballroom, locker_room",60581
3165,75960,indoor,"elevator_lobby, dressing_room, elevator/door, ballroom, locker_room",60581
3166,75984,indoor,"conference_center, office, dressing_room, locker_room, beauty_salon",60581
3167,76008,indoor,"elevator_lobby, dressing_room, elevator/door, conference_center, ballroom",60581
3168,76032,indoor,"locker_room, archive, art_gallery, elevator_lobby, dressing_room",60581
3169,76056,indoor,"elevator_lobby, elevator/door, locker_room, archive, art_gallery",60581
3170,76080,indoor,"locker_room, archive, elevator/door, elevator_lobby, art_gallery",60581
3171,76104,indoor,"dressing_room, elevator_lobby, nursing_home, beauty_salon, locker_room",60581
3172,76128,indoor,"nursing_home, dressing_room, elevator_lobby, beauty_salon, jail_cell",60581
3173,76152,indoor,"dressing_room, nursing_home, elevator_lobby, beauty_salon, elevator/door",60581
3174,76176,indoor,"dressing_room, shower, locker_room, elevator_lobby, jail_cell",60581
3175,76200,indoor,"dressing_room, elevator_lobby, bathroom, shower, elevator/door",60581
3176,76224,indoor,"dressing_room, bathroom, shower, discotheque, locker_room",60581
3177,76248,indoor,"dressing_room, elevator_lobby, art_gallery, ballroom, stage/indoor",60581
3178,76272,indoor,"locker_room, archive, elevator/door, elevator_lobby, art_gallery",60581
3179,76296,indoor,"dressing_room, locker_room, beauty_salon, shower, discotheque",60581
3180,76320,indoor,"conference_center, office, archive, jail_cell, television_studio",60581
3181,76344,indoor,"conference_center, office, archive, jail_cell, chemistry_lab",60581
3182,76368,indoor,"office, conference_center, archive, jail_cell, chemistry_lab",60581
3183,76392,indoor,"office, conference_center, archive, jail_cell, chemistry_lab",60581
3184,76416,indoor,"elevator_lobby, elevator/door, dressing_room, shower, art_gallery",60581
3185,76440,indoor,"dressing_room, elevator_lobby, elevator/door, shower, art_gallery",60581
3186,76464,indoor,"conference_center, biology_laboratory, office, beauty_salon, chemistry_lab",60581
3187,76488,indoor,"office, conference_center, biology_laboratory, beauty_salon, chemistry_lab",60581
3188,76512,indoor,"banquet_hall, legislative_chamber, dining_hall, conference_room, conference_center",60581
3189,76536,indoor,"banquet_hall, dining_hall, legislative_chamber, conference_room, conference_center",60581
3190,76560,indoor,"banquet_hall, legislative_chamber, dining_hall, conference_room, conference_center",60581
3191,76584,indoor,"banquet_hall, dining_hall, legislative_chamber, conference_room, dining_room",60581
3192,76608,indoor,"banquet_hall, dining_hall, legislative_chamber, conference_room, dining_room",60581
3193,76632,indoor,"banquet_hall, dining_hall, legislative_chamber, conference_room, dining_room",60581
3194,76656,indoor,"banquet_hall, dining_hall, legislative_chamber, conference_room, dining_room",60581
3195,76680,indoor,"banquet_hall, dining_hall, legislative_chamber, conference_room, dining_room",60581
3196,76704,indoor,"banquet_hall, dining_hall, conference_room, legislative_chamber, conference_center",60581
3197,76728,indoor,"banquet_hall, legislative_chamber, dining_hall, conference_room, conference_center",60581
3198,76752,indoor,"banquet_hall, dining_hall, dining_room, conference_room, legislative_chamber",60581
3199,76776,indoor,"bar, chemistry_lab, wind_farm, dressing_room, lobby",60581
3200,76800,indoor,"bar, mosque/outdoor, tower, chemistry_lab, pub/indoor",60581
3201,76824,indoor,"bar, mosque/outdoor, reception, pub/indoor, lobby",60581
3202,76848,indoor,"bar, reception, lobby, dressing_room, shower",60581
3203,76872,indoor,"bar, dressing_room, reception, chemistry_lab, lobby",60581
3204,76896,indoor,"bar, shower, lobby, dressing_room, ballroom",60581
3205,76920,indoor,"bar, lobby, shower, ballroom, dressing_room",60581
3206,76944,indoor,"bar, discotheque, conference_center, shower, television_studio",60581
3207,76968,indoor,"banquet_hall, dining_hall, conference_room, legislative_chamber, conference_center",60581
3208,76992,indoor,"banquet_hall, dining_hall, conference_room, legislative_chamber, dining_room",60581
3209,77016,indoor,"banquet_hall, dining_hall, legislative_chamber, conference_room, dining_room",60581
3210,77040,indoor,"banquet_hall, dining_hall, legislative_chamber, conference_room, conference_center",60581
3211,77064,indoor,"banquet_hall, legislative_chamber, dining_hall, conference_room, conference_center",60581
3212,77088,indoor,"banquet_hall, dining_hall, legislative_chamber, conference_room, conference_center",60581
3213,77112,indoor,"dressing_room, beauty_salon, art_gallery, bathroom, locker_room",60581
3214,77136,indoor,"dressing_room, art_gallery, beauty_salon, elevator_lobby, locker_room",60581
3215,77160,indoor,"dressing_room, locker_room, art_gallery, elevator_lobby, elevator/door",60581
3216,77184,indoor,"locker_room, discotheque, archive, dressing_room, sauna",60581
3217,77208,indoor,"locker_room, elevator/door, archive, elevator_lobby, art_gallery",60581
3218,77232,indoor,"stage/indoor, arena/performance, stage/outdoor, music_studio, discotheque",60581
3219,77256,indoor,"stage/indoor, arena/performance, stage/outdoor, discotheque, music_studio",60581
3220,77280,indoor,"banquet_hall, dining_hall, jewelry_shop, dining_room, legislative_chamber",60581
3221,77304,indoor,"banquet_hall, dining_hall, dining_room, jewelry_shop, conference_room",60581
3222,77328,indoor,"banquet_hall, dining_hall, dining_room, conference_room, jewelry_shop",60581
3223,77352,indoor,"legislative_chamber, conference_room, banquet_hall, conference_center, dining_hall",60581
3224,77376,indoor,"jewelry_shop, legislative_chamber, banquet_hall, conference_room, dining_hall",60581
3225,77400,indoor,"banquet_hall, dining_hall, dining_room, jewelry_shop, conference_room",60581
3226,77424,indoor,"banquet_hall, dining_hall, dining_room, ballroom, jewelry_shop",60581
3227,77448,indoor,"banquet_hall, dining_hall, dining_room, jewelry_shop, conference_room",60581
3228,77472,indoor,"banquet_hall, jewelry_shop, dining_hall, dining_room, ballroom",60581
3229,77496,indoor,"banquet_hall, dining_hall, jewelry_shop, dining_room, conference_room",60581
3230,77520,indoor,"banquet_hall, dining_hall, dining_room, conference_room, legislative_chamber",60581
3231,77544,indoor,"banquet_hall, dining_hall, dining_room, conference_room, ballroom",60581
3232,77568,indoor,"banquet_hall, dining_hall, dining_room, conference_room, jewelry_shop",60581
3233,77592,indoor,"banquet_hall, dining_hall, dining_room, restaurant, conference_room",60581
3234,77616,indoor,"banquet_hall, dining_hall, dining_room, restaurant, conference_room",60581
3235,77640,indoor,"banquet_hall, dining_hall, dining_room, restaurant, jewelry_shop",60581
3236,77664,indoor,"nursery, throne_room, church/indoor, porch, entrance_hall",60581
3237,77688,indoor,"throne_room, nursery, church/indoor, museum/indoor, entrance_hall",60581
3238,77712,indoor,"nursery, porch, throne_room, church/indoor, staircase",60581
3239,77736,indoor,"throne_room, nursery, church/indoor, porch, mausoleum",60581
3240,77760,indoor,"bow_window/indoor, sauna, locker_room, hospital, mausoleum",60581
3241,77784,indoor,"staircase, entrance_hall, corridor, museum/indoor, mezzanine",60581
3242,77808,indoor,"jewelry_shop, lobby, entrance_hall, museum/indoor, atrium/public",60581
3243,77832,indoor,"staircase, nursery, porch, playground, jewelry_shop",60581
3244,77856,indoor,"staircase, church/indoor, museum/indoor, nursery, entrance_hall",60581
3245,77880,indoor,"church/indoor, museum/indoor, staircase, throne_room, entrance_hall",60581
3246,77904,indoor,"church/indoor, museum/indoor, entrance_hall, clothing_store, department_store",60581
3247,77928,indoor,"church/indoor, museum/indoor, science_museum, entrance_hall, natural_history_museum",60581
3248,77952,indoor,"science_museum, museum/indoor, natural_history_museum, church/indoor, entrance_hall",60581
3249,77976,indoor,"church/indoor, museum/indoor, entrance_hall, natural_history_museum, science_museum",60581
3250,78000,indoor,"church/indoor, museum/indoor, entrance_hall, science_museum, natural_history_museum",60581
3251,78024,indoor,"museum/indoor, church/indoor, clothing_store, department_store, science_museum",60581
3252,78048,indoor,"jewelry_shop, clothing_store, department_store, science_museum, television_studio",60581
3253,78072,indoor,"television_studio, physics_laboratory, booth/indoor, locker_room, legislative_chamber",60581
3254,78096,indoor,"booth/indoor, clothing_store, jewelry_shop, department_store, physics_laboratory",60581
3255,78120,indoor,"airplane_cabin, conference_center, discotheque, science_museum, nursing_home",60581
3256,78144,indoor,"conference_center, legislative_chamber, science_museum, airplane_cabin, conference_room",60581
3257,78168,indoor,"conference_center, legislative_chamber, office, science_museum, conference_room",60581
3258,78192,indoor,"conference_center, legislative_chamber, office, conference_room, airplane_cabin",60581
3259,78216,indoor,"conference_center, legislative_chamber, television_studio, office, airplane_cabin",60581
3260,78240,indoor,"conference_center, legislative_chamber, television_studio, airplane_cabin, office",60581
3261,78264,indoor,"conference_center, legislative_chamber, airplane_cabin, office, television_studio",60581
3262,78288,indoor,"conference_center, airplane_cabin, legislative_chamber, office, television_studio",60581
3263,78312,indoor,"conference_center, airplane_cabin, legislative_chamber, television_studio, office",60581
3264,78336,indoor,"conference_center, airplane_cabin, legislative_chamber, office, television_studio",60581
3265,78360,indoor,"conference_center, science_museum, natural_history_museum, museum/indoor, shower",60581
3266,78384,indoor,"dressing_room, beauty_salon, chemistry_lab, biology_laboratory, art_gallery",60581
3267,78408,indoor,"dressing_room, beauty_salon, art_gallery, science_museum, biology_laboratory",60581
3268,78432,indoor,"dressing_room, beauty_salon, biology_laboratory, chemistry_lab, art_gallery",60581
3269,78456,indoor,"dressing_room, beauty_salon, science_museum, natural_history_museum, art_gallery",60581
3270,78480,indoor,"television_studio, booth/indoor, legislative_chamber, conference_center, music_studio",60581
3271,78504,indoor,"clean_room, museum/indoor, science_museum, server_room, television_studio",60581
3272,78528,outdoor,"bullring, stadium/football, toyshop, candy_store, cemetery",60581
3273,78552,indoor,"gift_shop, toyshop, jewelry_shop, clothing_store, candy_store",60581
3274,78576,indoor,"museum/indoor, art_gallery, throne_room, art_studio, burial_chamber",60581
3275,78600,indoor,"museum/indoor, art_gallery, archive, burial_chamber, jewelry_shop",60581
3276,78624,indoor,"locker_room, archive, museum/indoor, clean_room, bank_vault",60581
3277,78648,indoor,"locker_room, archive, museum/indoor, clean_room, clothing_store",60581
3278,78672,indoor,"museum/indoor, locker_room, clean_room, clothing_store, dressing_room",60581
3279,78696,indoor,"staircase, mezzanine, entrance_hall, basement, locker_room",60581
3280,78720,indoor,"mezzanine, staircase, entrance_hall, locker_room, basement",60581
3281,78744,indoor,"locker_room, mezzanine, staircase, entrance_hall, bank_vault",60581
3282,78768,indoor,"locker_room, entrance_hall, mezzanine, bank_vault, archive",60581
3283,78792,indoor,"locker_room, staircase, entrance_hall, mezzanine, shower",60581
3284,78816,indoor,"locker_room, bank_vault, mezzanine, basement, staircase",60581
3285,78840,indoor,"bank_vault, museum/indoor, shower, church/indoor, auditorium",60581
3286,78864,indoor,"shower, stage/indoor, museum/indoor, science_museum, natural_history_museum",60581
3287,78888,indoor,"shower, stage/indoor, natural_history_museum, bathroom, ballroom",60581
3288,78912,indoor,"shower, elevator_lobby, stage/indoor, ballroom, elevator/door",60581
3289,78936,indoor,"stage/indoor, conference_center, ballroom, arena/performance, elevator_lobby",60581
3290,78960,indoor,"stage/indoor, arena/performance, ballroom, conference_center, stage/outdoor",60581
3291,78984,indoor,"stage/indoor, conference_center, arena/performance, legislative_chamber, ballroom",60581
3292,79008,indoor,"conference_center, legislative_chamber, museum/indoor, lecture_room, stage/indoor",60581
3293,79032,indoor,"legislative_chamber, conference_center, lecture_room, reception, museum/indoor",60581
3294,79056,indoor,"museum/indoor, natural_history_museum, science_museum, legislative_chamber, conference_center",60581
3295,79080,indoor,"stage/indoor, museum/indoor, arena/performance, conference_center, legislative_chamber",60581
3296,79104,indoor,"arena/performance, stage/indoor, museum/indoor, conference_center, ballroom",60581
3297,79128,indoor,"conference_center, legislative_chamber, conference_room, office, lecture_room",60581
3298,79152,indoor,"conference_center, legislative_chamber, museum/indoor, arena/performance, stage/indoor",60581
3299,79176,indoor,"conference_center, arena/performance, museum/indoor, legislative_chamber, stage/indoor",60581
3300,79200,indoor,"conference_center, legislative_chamber, museum/indoor, arena/performance, lecture_room",60581
3301,79224,indoor,"conference_center, legislative_chamber, office, museum/indoor, reception",60581
3302,79248,indoor,"elevator_lobby, elevator/door, office, locker_room, conference_center",60581
3303,79272,indoor,"shower, bathroom, wind_farm, elevator/door, hot_spring",60581
3304,79296,indoor,"shower, alcove, museum/indoor, bathroom, basement",60581
3305,79320,indoor,"shower, alcove, basement, martial_arts_gym, museum/indoor",60581
3306,79344,indoor,"basement, elevator/door, jail_cell, elevator_lobby, martial_arts_gym",60581
3307,79368,indoor,"jail_cell, basement, elevator/door, museum/indoor, elevator_lobby",60581
3308,79392,indoor,"basement, art_gallery, harbor, locker_room, shower",60581
3309,79416,indoor,"basement, art_gallery, jail_cell, locker_room, storage_room",60581
3310,79440,outdoor,"art_gallery, harbor, skyscraper, tower, shower",60581
3311,79464,outdoor,"skyscraper, art_gallery, tower, archive, downtown",60581
3312,79488,outdoor,"skyscraper, tower, downtown, art_gallery, office_building",60581
3313,79512,indoor,"elevator_lobby, elevator/door, alcove, reception, shower",60581
3314,79536,indoor,"reception, elevator_lobby, alcove, elevator/door, art_gallery",60581
3315,79560,indoor,"reception, elevator_lobby, alcove, art_gallery, artists_loft",60581
3316,79584,indoor,"reception, art_gallery, alcove, artists_loft, museum/indoor",60581
3317,79608,indoor,"reception, art_gallery, museum/indoor, lecture_room, office",60581
3318,79632,indoor,"reception, art_gallery, museum/indoor, archive, office",60581
3319,79656,indoor,"art_gallery, reception, museum/indoor, archive, office",60581
3320,79680,indoor,"conference_room, office, lecture_room, reception, conference_center",60581
3321,79704,indoor,"conference_room, conference_center, office, lecture_room, reception",60581
3322,79728,indoor,"conference_center, office, reception, office_cubicles, conference_room",60581
3323,79752,indoor,"conference_center, legislative_chamber, reception, conference_room, office",60581
3324,79776,indoor,"elevator_lobby, office, conference_center, elevator/door, legislative_chamber",60581
3325,79800,indoor,"conference_center, museum/indoor, office, legislative_chamber, reception",60581
3326,79824,indoor,"museum/indoor, conference_center, art_gallery, stage/indoor, science_museum",60581
3327,79848,indoor,"museum/indoor, art_gallery, archive, clean_room, reception",60581
3328,79872,indoor,"elevator_lobby, shower, elevator/door, museum/indoor, art_gallery",60581
3329,79896,indoor,"elevator_lobby, shower, museum/indoor, elevator/door, art_gallery",60581
3330,79920,indoor,"conference_center, elevator_lobby, office, legislative_chamber, lecture_room",60581
3331,79944,indoor,"conference_center, legislative_chamber, lecture_room, office, conference_room",60581
3332,79968,indoor,"elevator_lobby, conference_center, office, legislative_chamber, reception",60581
3333,79992,indoor,"elevator_lobby, conference_center, office, legislative_chamber, lecture_room",60581
3334,80016,indoor,"elevator_lobby, conference_center, legislative_chamber, office, reception",60581
3335,80040,indoor,"elevator_lobby, legislative_chamber, office, conference_center, reception",60581
3336,80064,indoor,"conference_center, legislative_chamber, office, elevator_lobby, reception",60581
3337,80088,indoor,"conference_center, office, elevator_lobby, reception, art_gallery",60581
3338,80112,indoor,"art_gallery, locker_room, elevator_lobby, basement, elevator/door",60581
3339,80136,indoor,"basement, locker_room, shower, elevator_lobby, art_gallery",60581
3340,80160,indoor,"basement, elevator_lobby, art_gallery, elevator/door, museum/indoor",60581
3341,80184,indoor,"conference_center, legislative_chamber, stage/indoor, lecture_room, television_studio",60581
3342,80208,outdoor,"desert/sand, sky, wheat_field, field/wild, rainforest",60581
3343,80232,outdoor,"sky, desert/sand, elevator/door, stage/indoor, wheat_field",60581
3344,80256,outdoor,"desert/sand, sky, wheat_field, desert_road, field/wild",60581
3345,80280,outdoor,"discotheque, botanical_garden, florist_shop/indoor, windmill, wind_farm",60581
3346,80304,outdoor,"discotheque, botanical_garden, stage/indoor, sky, wind_farm",60581
3347,80328,indoor,"chemistry_lab, jewelry_shop, biology_laboratory, banquet_hall, clean_room",60581
3348,80352,indoor,"jewelry_shop, banquet_hall, chemistry_lab, biology_laboratory, dining_hall",60581
3349,80376,indoor,"jewelry_shop, banquet_hall, chemistry_lab, biology_laboratory, dining_hall",60581
