,frame_num,environment,places,imdb_id
4426,106224,indoor,"jewelry_shop, wet_bar, reception, museum/indoor, lobby",60581
4427,106248,indoor,"jewelry_shop, wet_bar, reception, home_office, museum/indoor",60581
4428,106272,indoor,"jewelry_shop, clean_room, banquet_hall, restaurant, chemistry_lab",60581
4429,106296,indoor,"clean_room, locker_room, physics_laboratory, television_studio, chemistry_lab",60581
4430,106320,indoor,"locker_room, clean_room, dressing_room, natural_history_museum, science_museum",60581
4431,106344,indoor,"locker_room, dressing_room, kennel/outdoor, music_studio, science_museum",60581
4432,106368,indoor,"locker_room, elevator/door, dressing_room, jail_cell, stage/indoor",60581
4433,106392,indoor,"jewelry_shop, legislative_chamber, office, science_museum, classroom",60581
4434,106416,indoor,"television_studio, booth/indoor, conference_center, classroom, lecture_room",60581
4435,106440,indoor,"natural_history_museum, museum/indoor, science_museum, dressing_room, clean_room",60581
4436,106464,indoor,"dressing_room, locker_room, jewelry_shop, jail_cell, chemistry_lab",60581
4437,106488,indoor,"elevator_lobby, museum/indoor, locker_room, elevator/door, shower",60581
4438,106512,indoor,"locker_room, elevator_lobby, elevator/door, office, museum/indoor",60581
4439,106536,indoor,"dressing_room, museum/indoor, clean_room, elevator/door, elevator_lobby",60581
4440,106560,indoor,"dressing_room, museum/indoor, clean_room, locker_room, elevator/door",60581
4441,106584,indoor,"dressing_room, museum/indoor, shower, clean_room, elevator/door",60581
4442,106608,indoor,"dressing_room, shower, museum/indoor, locker_room, clean_room",60581
4443,106632,indoor,"dressing_room, shower, museum/indoor, bathroom, elevator/door",60581
4444,106656,indoor,"dressing_room, locker_room, shower, elevator_lobby, clean_room",60581
4445,106680,indoor,"dressing_room, locker_room, shower, elevator_lobby, museum/indoor",60581
4446,106704,indoor,"locker_room, dressing_room, elevator_lobby, shower, elevator/door",60581
4447,106728,indoor,"dressing_room, locker_room, shower, jewelry_shop, museum/indoor",60581
4448,106752,indoor,"shower, dressing_room, elevator_lobby, locker_room, elevator/door",60581
4449,106776,indoor,"dressing_room, locker_room, elevator_lobby, jewelry_shop, shower",60581
4450,106800,indoor,"dressing_room, shower, locker_room, bathroom, beauty_salon",60581
4451,106824,indoor,"dressing_room, shower, locker_room, bathroom, sauna",60581
4452,106848,indoor,"locker_room, dressing_room, elevator_lobby, elevator/door, shower",60581
4453,106872,indoor,"locker_room, dressing_room, elevator_lobby, elevator/door, jail_cell",60581
4454,106896,indoor,"locker_room, dressing_room, elevator_lobby, jail_cell, nursing_home",60581
4455,106920,indoor,"locker_room, elevator_lobby, dressing_room, elevator/door, clean_room",60581
4456,106944,indoor,"dressing_room, elevator/door, elevator_lobby, locker_room, throne_room",60581
4457,106968,indoor,"elevator/door, elevator_lobby, dressing_room, museum/indoor, locker_room",60581
4458,106992,indoor,"elevator/door, elevator_lobby, locker_room, jail_cell, dressing_room",60581
4459,107016,indoor,"elevator/door, elevator_lobby, locker_room, jail_cell, bank_vault",60581
4460,107040,indoor,"elevator_lobby, elevator/door, locker_room, jail_cell, lobby",60581
4461,107064,indoor,"elevator_lobby, elevator/door, locker_room, nursing_home, jail_cell",60581
4462,107088,indoor,"elevator/door, elevator_lobby, locker_room, nursing_home, jail_cell",60581
4463,107112,indoor,"elevator/door, elevator_lobby, dressing_room, locker_room, jail_cell",60581
4464,107136,indoor,"elevator/door, elevator_lobby, locker_room, dressing_room, museum/indoor",60581
4465,107160,indoor,"elevator/door, elevator_lobby, locker_room, dressing_room, museum/indoor",60581
4466,107184,indoor,"elevator_lobby, church/indoor, elevator/door, lobby, dressing_room",60581
4467,107208,indoor,"nursing_home, elevator/door, elevator_lobby, church/indoor, jail_cell",60581
4468,107232,indoor,"dressing_room, nursing_home, church/indoor, elevator/door, elevator_lobby",60581
4469,107256,indoor,"dressing_room, museum/indoor, beauty_salon, ice_cream_parlor, throne_room",60581
4470,107280,indoor,"dressing_room, jewelry_shop, shower, bathroom, elevator/door",60581
4471,107304,indoor,"shower, biology_laboratory, chemistry_lab, bathroom, dressing_room",60581
4472,107328,indoor,"chemistry_lab, science_museum, biology_laboratory, jewelry_shop, art_gallery",60581
4473,107352,indoor,"natural_history_museum, science_museum, art_gallery, jewelry_shop, museum/indoor",60581
4474,107376,indoor,"science_museum, natural_history_museum, conference_room, reception, jewelry_shop",60581
4475,107400,indoor,"sauna, locker_room, bow_window/indoor, shower, bathroom",60581
4476,107424,indoor,"sauna, locker_room, shower, bathroom, bow_window/indoor",60581
4477,107448,indoor,"locker_room, sauna, clean_room, shower, bow_window/indoor",60581
4478,107472,indoor,"sauna, locker_room, clean_room, bow_window/indoor, shower",60581
4479,107496,indoor,"clean_room, locker_room, shower, beauty_salon, sauna",60581
4480,107520,indoor,"locker_room, sauna, clean_room, bow_window/indoor, beauty_salon",60581
4481,107544,indoor,"legislative_chamber, jewelry_shop, conference_center, office, conference_room",60581
4482,107568,indoor,"nursing_home, conference_room, conference_center, office, reception",60581
4483,107592,indoor,"conference_room, conference_center, lecture_room, beauty_salon, office",60581
4484,107616,indoor,"chemistry_lab, restaurant, banquet_hall, dining_room, biology_laboratory",60581
4485,107640,indoor,"chemistry_lab, conference_center, television_studio, beauty_salon, biology_laboratory",60581
4486,107664,indoor,"jewelry_shop, beauty_salon, flea_market/indoor, banquet_hall, art_studio",60581
4487,107688,indoor,"banquet_hall, jewelry_shop, dining_hall, legislative_chamber, conference_center",60581
4488,107712,indoor,"jewelry_shop, legislative_chamber, conference_center, conference_room, music_studio",60581
4489,107736,indoor,"conference_center, conference_room, restaurant, banquet_hall, legislative_chamber",60581
4490,107760,indoor,"conference_room, conference_center, legislative_chamber, banquet_hall, dining_hall",60581
4491,107784,indoor,"legislative_chamber, conference_room, conference_center, office, banquet_hall",60581
4492,107808,indoor,"legislative_chamber, conference_center, conference_room, banquet_hall, office",60581
4493,107832,indoor,"conference_room, legislative_chamber, conference_center, office, banquet_hall",60581
4494,107856,indoor,"conference_room, legislative_chamber, conference_center, banquet_hall, office",60581
4495,107880,indoor,"conference_room, conference_center, banquet_hall, legislative_chamber, dining_hall",60581
4496,107904,indoor,"banquet_hall, conference_room, dining_hall, conference_center, restaurant",60581
4497,107928,indoor,"conference_room, banquet_hall, legislative_chamber, dining_hall, conference_center",60581
4498,107952,indoor,"banquet_hall, conference_room, dining_hall, legislative_chamber, conference_center",60581
4499,107976,indoor,"legislative_chamber, conference_room, conference_center, banquet_hall, dining_hall",60581
4500,108000,indoor,"legislative_chamber, conference_room, banquet_hall, conference_center, dining_hall",60581
4501,108024,indoor,"conference_room, legislative_chamber, conference_center, banquet_hall, dining_hall",60581
4502,108048,indoor,"banquet_hall, legislative_chamber, conference_room, conference_center, dining_hall",60581
4503,108072,indoor,"banquet_hall, conference_room, dining_hall, legislative_chamber, conference_center",60581
4504,108096,indoor,"conference_room, banquet_hall, legislative_chamber, conference_center, dining_hall",60581
4505,108120,indoor,"conference_room, banquet_hall, legislative_chamber, conference_center, dining_hall",60581
4506,108144,indoor,"banquet_hall, conference_room, conference_center, dining_hall, legislative_chamber",60581
4507,108168,indoor,"banquet_hall, conference_room, legislative_chamber, conference_center, dining_hall",60581
4508,108192,indoor,"banquet_hall, conference_room, conference_center, legislative_chamber, dining_hall",60581
4509,108216,indoor,"banquet_hall, conference_room, conference_center, dining_hall, legislative_chamber",60581
4510,108240,indoor,"banquet_hall, conference_room, conference_center, dining_hall, legislative_chamber",60581
4511,108264,indoor,"banquet_hall, conference_room, dining_hall, conference_center, legislative_chamber",60581
4512,108288,indoor,"banquet_hall, dining_hall, conference_room, conference_center, legislative_chamber",60581
4513,108312,indoor,"banquet_hall, conference_room, dining_hall, conference_center, legislative_chamber",60581
4514,108336,indoor,"banquet_hall, conference_room, dining_hall, legislative_chamber, conference_center",60581
4515,108360,indoor,"banquet_hall, legislative_chamber, conference_room, dining_hall, conference_center",60581
4516,108384,indoor,"banquet_hall, conference_room, legislative_chamber, dining_hall, conference_center",60581
4517,108408,indoor,"conference_room, banquet_hall, legislative_chamber, conference_center, dining_hall",60581
4518,108432,indoor,"banquet_hall, conference_room, legislative_chamber, conference_center, dining_hall",60581
4519,108456,indoor,"legislative_chamber, banquet_hall, conference_room, conference_center, dining_hall",60581
4520,108480,indoor,"conference_room, legislative_chamber, conference_center, banquet_hall, dining_hall",60581
4521,108504,indoor,"conference_room, legislative_chamber, conference_center, banquet_hall, dining_hall",60581
4522,108528,indoor,"conference_center, conference_room, banquet_hall, legislative_chamber, dining_hall",60581
4523,108552,indoor,"conference_room, legislative_chamber, banquet_hall, conference_center, dining_hall",60581
4524,108576,indoor,"conference_room, legislative_chamber, conference_center, office, lecture_room",60581
4525,108600,indoor,"conference_room, legislative_chamber, conference_center, office, reception",60581
4526,108624,indoor,"legislative_chamber, conference_center, conference_room, office, booth/indoor",60581
4527,108648,indoor,"legislative_chamber, conference_center, conference_room, office, banquet_hall",60581
4528,108672,indoor,"conference_room, conference_center, legislative_chamber, office, banquet_hall",60581
4529,108696,indoor,"museum/indoor, church/indoor, art_gallery, entrance_hall, art_studio",60581
4530,108720,indoor,"museum/indoor, church/indoor, art_gallery, entrance_hall, bow_window/indoor",60581
4531,108744,indoor,"entrance_hall, museum/indoor, elevator_lobby, bow_window/indoor, elevator/door",60581
4532,108768,indoor,"bow_window/indoor, alcove, church/indoor, museum/indoor, arch",60581
4533,108792,indoor,"alcove, church/indoor, bow_window/indoor, museum/indoor, art_gallery",60581
4534,108816,indoor,"beauty_salon, martial_arts_gym, drugstore, museum/indoor, shoe_shop",60581
4535,108840,indoor,"beauty_salon, biology_laboratory, chemistry_lab, operating_room, clean_room",60581
4536,108864,indoor,"beauty_salon, chemistry_lab, drugstore, biology_laboratory, coffee_shop",60581
4537,108888,indoor,"clean_room, beauty_salon, shower, chemistry_lab, biology_laboratory",60581
4538,108912,indoor,"shoe_shop, beauty_salon, gift_shop, shower, bakery/shop",60581
4539,108936,indoor,"ice_cream_parlor, beauty_salon, chemistry_lab, science_museum, biology_laboratory",60581
4540,108960,indoor,"coffee_shop, beauty_salon, ice_cream_parlor, bar, jewelry_shop",60581
4541,108984,indoor,"museum/indoor, science_museum, art_gallery, beauty_salon, martial_arts_gym",60581
4542,109008,indoor,"beauty_salon, aquarium, coffee_shop, restaurant, ice_cream_parlor",60581
4543,109032,indoor,"elevator_shaft, atrium/public, airport_terminal, elevator/door, staircase",60581
4544,109056,indoor,"atrium/public, shopping_mall/indoor, elevator_lobby, elevator/door, entrance_hall",60581
4545,109080,indoor,"shower, attic, basement, bathroom, mezzanine",60581
4546,109104,indoor,"entrance_hall, corridor, staircase, basement, lobby",60581
4547,109128,indoor,"museum/indoor, archive, atrium/public, art_gallery, entrance_hall",60581
4548,109152,indoor,"clean_room, atrium/public, natural_history_museum, locker_room, mezzanine",60581
4549,109176,indoor,"clean_room, jewelry_shop, shower, locker_room, bathroom",60581
4550,109200,indoor,"jewelry_shop, clean_room, locker_room, science_museum, museum/indoor",60581
4551,109224,indoor,"clean_room, locker_room, jewelry_shop, shower, atrium/public",60581
4552,109248,indoor,"shower, clean_room, bathroom, atrium/public, locker_room",60581
4553,109272,indoor,"clean_room, shower, bathroom, locker_room, archive",60581
4554,109296,indoor,"clean_room, mezzanine, entrance_hall, locker_room, shower",60581
4555,109320,indoor,"locker_room, shower, bathroom, clean_room, elevator_lobby",60581
4556,109344,indoor,"locker_room, shower, bathroom, jail_cell, atrium/public",60581
4557,109368,indoor,"shower, bathroom, locker_room, dressing_room, sauna",60581
4558,109392,indoor,"staircase, entrance_hall, mezzanine, locker_room, archive",60581
4559,109416,indoor,"locker_room, entrance_hall, clean_room, hospital_room, archive",60581
4560,109440,indoor,"clean_room, archive, mezzanine, staircase, hospital_room",60581
4561,109464,indoor,"lobby, entrance_hall, mezzanine, reception, hospital_room",60581
4562,109488,indoor,"chemistry_lab, clean_room, biology_laboratory, airport_terminal, pharmacy",60581
4563,109512,indoor,"atrium/public, archive, clean_room, mezzanine, office_cubicles",60581
4564,109536,indoor,"atrium/public, bank_vault, archive, shopping_mall/indoor, airport_terminal",60581
4565,109560,indoor,"mosque/outdoor, atrium/public, chemistry_lab, hospital, archive",60581
4566,109584,indoor,"atrium/public, mosque/outdoor, engine_room, archive, hardware_store",60581
4567,109608,indoor,"archive, atrium/public, hospital, museum/indoor, shopping_mall/indoor",60581
4568,109632,indoor,"atrium/public, shopping_mall/indoor, archive, science_museum, airport_terminal",60581
4569,109656,indoor,"atrium/public, archive, jail_cell, hospital, shopping_mall/indoor",60581
4570,109680,indoor,"atrium/public, archive, airport_terminal, shopping_mall/indoor, jail_cell",60581
4571,109704,indoor,"archive, atrium/public, hardware_store, kennel/outdoor, bank_vault",60581
4572,109728,indoor,"archive, atrium/public, bank_vault, server_room, clean_room",60581
4573,109752,indoor,"clean_room, locker_room, server_room, mezzanine, lobby",60581
4574,109776,indoor,"clean_room, chemistry_lab, locker_room, music_studio, server_room",60581
4575,109800,indoor,"clean_room, chemistry_lab, locker_room, biology_laboratory, shower",60581
4576,109824,indoor,"locker_room, gymnasium/indoor, clean_room, chemistry_lab, shower",60581
4577,109848,indoor,"locker_room, clean_room, archive, shower, chemistry_lab",60581
4578,109872,indoor,"locker_room, shower, clean_room, chemistry_lab, dressing_room",60581
4579,109896,indoor,"locker_room, chemistry_lab, music_studio, shower, clean_room",60581
4580,109920,indoor,"chemistry_lab, clean_room, archive, locker_room, science_museum",60581
4581,109944,indoor,"locker_room, clean_room, shower, chemistry_lab, archive",60581
4582,109968,indoor,"locker_room, shower, chemistry_lab, clean_room, archive",60581
4583,109992,indoor,"locker_room, clean_room, chemistry_lab, shower, bank_vault",60581
4584,110016,indoor,"clean_room, locker_room, shower, chemistry_lab, archive",60581
4585,110040,indoor,"clean_room, shower, locker_room, chemistry_lab, archive",60581
4586,110064,indoor,"locker_room, clean_room, archive, nursery, shower",60581
4587,110088,indoor,"locker_room, clean_room, shower, archive, bank_vault",60581
4588,110112,indoor,"clean_room, clothing_store, locker_room, utility_room, shower",60581
4589,110136,indoor,"clean_room, clothing_store, locker_room, archive, laundromat",60581
4590,110160,indoor,"locker_room, clothing_store, clean_room, laundromat, dressing_room",60581
4591,110184,indoor,"locker_room, clothing_store, clean_room, laundromat, dressing_room",60581
4592,110208,indoor,"locker_room, clothing_store, clean_room, archive, bank_vault",60581
4593,110232,indoor,"locker_room, shower, clean_room, bank_vault, clothing_store",60581
4594,110256,indoor,"locker_room, music_studio, archive, clean_room, bank_vault",60581
4595,110280,indoor,"locker_room, archive, clean_room, server_room, bank_vault",60581
4596,110304,indoor,"locker_room, clean_room, archive, chemistry_lab, music_studio",60581
4597,110328,indoor,"beauty_salon, pharmacy, clean_room, drugstore, chemistry_lab",60581
4598,110352,indoor,"airplane_cabin, beauty_salon, pharmacy, clean_room, drugstore",60581
4599,110376,indoor,"clean_room, hospital_room, beauty_salon, pharmacy, operating_room",60581
4600,110400,indoor,"pharmacy, beauty_salon, hospital_room, clean_room, reception",60581
4601,110424,indoor,"nursery, archive, museum/indoor, jewelry_shop, science_museum",60581
4602,110448,indoor,"museum/indoor, archive, jewelry_shop, nursery, science_museum",60581
4603,110472,indoor,"museum/indoor, jewelry_shop, archive, nursery, science_museum",60581
4604,110496,indoor,"nursing_home, clothing_store, jewelry_shop, nursery, museum/indoor",60581
4605,110520,indoor,"conference_center, museum/indoor, clothing_store, jewelry_shop, clean_room",60581
4606,110544,indoor,"jewelry_shop, locker_room, reception, dressing_room, clean_room",60581
4607,110568,indoor,"jewelry_shop, dressing_room, locker_room, beauty_salon, clothing_store",60581
4608,110592,indoor,"dressing_room, locker_room, airplane_cabin, reception, jewelry_shop",60581
4609,110616,indoor,"beauty_salon, jewelry_shop, locker_room, dressing_room, bathroom",60581
4610,110640,indoor,"clothing_store, nursing_home, museum/indoor, lobby, airport_terminal",60581
4611,110664,indoor,"legislative_chamber, office, jewelry_shop, conference_center, banquet_hall",60581
4612,110688,indoor,"banquet_hall, jewelry_shop, legislative_chamber, dining_hall, conference_center",60581
4613,110712,indoor,"jewelry_shop, banquet_hall, dining_hall, legislative_chamber, restaurant",60581
4614,110736,indoor,"discotheque, bathroom, shower, dressing_room, beauty_salon",60581
4615,110760,indoor,"chemistry_lab, biology_laboratory, beauty_salon, pharmacy, drugstore",60581
4616,110784,indoor,"beauty_salon, nursery, bakery/shop, dressing_room, ice_cream_parlor",60581
4617,110808,indoor,"beauty_salon, iceberg, biology_laboratory, florist_shop/indoor, chemistry_lab",60581
4618,110832,indoor,"iceberg, beauty_salon, aquarium, bakery/shop, ice_floe",60581
4619,110856,outdoor,"discotheque, sky, hot_spring, stage/indoor, volcano",60581
4620,110880,indoor,"chemistry_lab, discotheque, biology_laboratory, aquarium, candy_store",60581
4621,110904,indoor,"biology_laboratory, clean_room, dressing_room, office, chemistry_lab",60581
4622,110928,indoor,"chemistry_lab, nursing_home, biology_laboratory, office, dressing_room",60581
4623,110952,indoor,"nursing_home, dressing_room, chemistry_lab, beauty_salon, office",60581
4624,110976,outdoor,"iceberg, ice_floe, ice_shelf, bedroom, ice_cream_parlor",60581
4625,111000,indoor,"martial_arts_gym, hospital_room, operating_room, beauty_salon, boxing_ring",60581
4626,111024,indoor,"beauty_salon, dressing_room, chemistry_lab, hotel_room, iceberg",60581
4627,111048,indoor,"beauty_salon, office, nursing_home, television_studio, chemistry_lab",60581
4628,111072,indoor,"beauty_salon, ice_cream_parlor, nursery, martial_arts_gym, office",60581
4629,111096,indoor,"museum/indoor, boxing_ring, martial_arts_gym, ice_cream_parlor, art_gallery",60581
4630,111120,indoor,"bathroom, shower, beauty_salon, jacuzzi/indoor, hospital_room",60581
4631,111144,indoor,"nursing_home, dressing_room, chemistry_lab, beauty_salon, office",60581
4632,111168,indoor,"nursing_home, chemistry_lab, biology_laboratory, office, hospital_room",60581
4633,111192,indoor,"chemistry_lab, reception, booth/indoor, jewelry_shop, television_studio",60581
4634,111216,indoor,"legislative_chamber, conference_center, banquet_hall, office, conference_room",60581
4635,111240,indoor,"conference_room, legislative_chamber, conference_center, banquet_hall, dining_hall",60581
4636,111264,indoor,"conference_room, conference_center, legislative_chamber, banquet_hall, dining_hall",60581
4637,111288,indoor,"conference_room, conference_center, dining_hall, banquet_hall, legislative_chamber",60581
4638,111312,indoor,"conference_room, conference_center, dining_hall, banquet_hall, legislative_chamber",60581
4639,111336,indoor,"conference_room, dining_hall, banquet_hall, conference_center, dining_room",60581
4640,111360,indoor,"conference_room, dining_hall, conference_center, banquet_hall, legislative_chamber",60581
4641,111384,indoor,"conference_room, dining_hall, banquet_hall, conference_center, legislative_chamber",60581
4642,111408,indoor,"conference_room, dining_hall, banquet_hall, conference_center, legislative_chamber",60581
4643,111432,indoor,"conference_room, dining_hall, banquet_hall, conference_center, legislative_chamber",60581
4644,111456,indoor,"conference_room, dining_hall, banquet_hall, conference_center, legislative_chamber",60581
4645,111480,indoor,"conference_room, dining_hall, banquet_hall, conference_center, legislative_chamber",60581
4646,111504,indoor,"conference_room, banquet_hall, dining_hall, conference_center, legislative_chamber",60581
4647,111528,indoor,"jewelry_shop, beauty_salon, dressing_room, shower, bathroom",60581
4648,111552,indoor,"jewelry_shop, beauty_salon, dressing_room, shower, clothing_store",60581
4649,111576,indoor,"jewelry_shop, beauty_salon, dressing_room, shower, clothing_store",60581
4650,111600,indoor,"jewelry_shop, dressing_room, beauty_salon, clothing_store, shower",60581
4651,111624,indoor,"jewelry_shop, dressing_room, beauty_salon, clothing_store, shower",60581
4652,111648,indoor,"jewelry_shop, beauty_salon, dressing_room, clothing_store, shower",60581
4653,111672,indoor,"art_gallery, museum/indoor, coffee_shop, classroom, art_studio",60581
4654,111696,indoor,"bathroom, shower, jail_cell, coffee_shop, beauty_salon",60581
4655,111720,indoor,"art_studio, classroom, airplane_cabin, biology_laboratory, pharmacy",60581
4656,111744,indoor,"waiting_room, classroom, office_cubicles, office, coffee_shop",60581
4657,111768,indoor,"clean_room, art_gallery, museum/indoor, clothing_store, elevator_lobby",60581
4658,111792,indoor,"beauty_salon, dressing_room, art_gallery, bathroom, shower",60581
4659,111816,indoor,"art_gallery, museum/indoor, beauty_salon, clothing_store, florist_shop/indoor",60581
4660,111840,indoor,"martial_arts_gym, art_gallery, museum/indoor, beauty_salon, dressing_room",60581
4661,111864,indoor,"bathroom, shower, hotel_room, beauty_salon, art_gallery",60581
4662,111888,indoor,"beauty_salon, coffee_shop, ice_cream_parlor, drugstore, office",60581
4663,111912,indoor,"beauty_salon, jewelry_shop, bathroom, nursery, childs_room",60581
4664,111936,indoor,"chemistry_lab, biology_laboratory, clean_room, jewelry_shop, ice_cream_parlor",60581
4665,111960,indoor,"archive, airplane_cabin, biology_laboratory, chemistry_lab, restaurant",60581
4666,111984,indoor,"reception, beauty_salon, jewelry_shop, office, bathroom",60581
4667,112008,indoor,"jewelry_shop, beauty_salon, clothing_store, ice_cream_parlor, coffee_shop",60581
4668,112032,indoor,"reception, jewelry_shop, bar, conference_center, chemistry_lab",60581
4669,112056,indoor,"reception, conference_center, jewelry_shop, legislative_chamber, bar",60581
4670,112080,indoor,"reception, conference_center, jewelry_shop, bar, office",60581
4671,112104,indoor,"reception, conference_center, television_studio, office, legislative_chamber",60581
4672,112128,indoor,"reception, jewelry_shop, television_studio, office, conference_center",60581
4673,112152,indoor,"reception, conference_center, office, legislative_chamber, television_studio",60581
4674,112176,indoor,"reception, conference_center, office, beauty_salon, jewelry_shop",60581
4675,112200,indoor,"reception, office, television_studio, conference_center, jewelry_shop",60581
4676,112224,indoor,"reception, jewelry_shop, clean_room, conference_center, television_studio",60581
4677,112248,indoor,"reception, jewelry_shop, conference_center, office, clean_room",60581
4678,112272,indoor,"reception, jewelry_shop, booth/indoor, conference_center, office",60581
4679,112296,indoor,"reception, jewelry_shop, office, conference_center, beauty_salon",60581
4680,112320,indoor,"reception, conference_center, office, jewelry_shop, legislative_chamber",60581
4681,112344,indoor,"reception, conference_center, office, legislative_chamber, conference_room",60581
4682,112368,indoor,"reception, conference_center, office, jewelry_shop, legislative_chamber",60581
4683,112392,indoor,"reception, conference_center, office, jewelry_shop, legislative_chamber",60581
4684,112416,indoor,"reception, jewelry_shop, conference_center, office, clean_room",60581
4685,112440,indoor,"reception, office, conference_center, legislative_chamber, clean_room",60581
4686,112464,indoor,"reception, conference_center, office, booth/indoor, jewelry_shop",60581
4687,112488,indoor,"reception, conference_center, office, booth/indoor, television_studio",60581
4688,112512,indoor,"reception, conference_center, office, booth/indoor, jewelry_shop",60581
4689,112536,indoor,"reception, conference_center, office, legislative_chamber, television_studio",60581
4690,112560,indoor,"reception, conference_center, office, bar, legislative_chamber",60581
4691,112584,indoor,"reception, conference_center, legislative_chamber, office, television_studio",60581
4692,112608,indoor,"reception, office, conference_center, legislative_chamber, television_studio",60581
4693,112632,indoor,"reception, office, conference_center, legislative_chamber, television_studio",60581
4694,112656,indoor,"reception, conference_center, office, jewelry_shop, television_studio",60581
