,frame_num,environment,places,imdb_id
1722,41328,indoor,"childs_room, nursery, bedroom, bedchamber, clean_room",60581
1723,41352,indoor,"childs_room, bedroom, bedchamber, nursery, clean_room",60581
1724,41376,indoor,"childs_room, bedroom, clean_room, nursery, bedchamber",60581
1725,41400,indoor,"childs_room, bedroom, bedchamber, clean_room, nursery",60581
1726,41424,indoor,"childs_room, clean_room, bedroom, bedchamber, nursery",60581
1727,41448,indoor,"childs_room, clean_room, bedroom, nursery, bedchamber",60581
1728,41472,indoor,"childs_room, clean_room, nursery, bedroom, bedchamber",60581
1729,41496,indoor,"childs_room, clean_room, bedroom, nursery, bedchamber",60581
1730,41520,indoor,"childs_room, clean_room, nursery, bedroom, bedchamber",60581
1731,41544,indoor,"childs_room, bedroom, bedchamber, nursery, clean_room",60581
1732,41568,indoor,"childs_room, nursery, bedroom, bedchamber, clean_room",60581
1733,41592,indoor,"childs_room, nursery, bedroom, bedchamber, clean_room",60581
1734,41616,indoor,"childs_room, clean_room, nursery, bakery/shop, bedroom",60581
1735,41640,indoor,"childs_room, clean_room, bedroom, bedchamber, nursery",60581
1736,41664,indoor,"childs_room, bedroom, bedchamber, clean_room, nursery",60581
1737,41688,indoor,"childs_room, bedroom, bedchamber, clean_room, nursery",60581
1738,41712,indoor,"childs_room, nursery, bedroom, bedchamber, clean_room",60581
1739,41736,indoor,"childs_room, nursery, bedchamber, bedroom, clean_room",60581
1740,41760,indoor,"childs_room, nursery, bedchamber, bedroom, clean_room",60581
1741,41784,indoor,"childs_room, nursery, bedchamber, bedroom, clean_room",60581
1742,41808,indoor,"childs_room, nursery, bedchamber, bedroom, clean_room",60581
1743,41832,indoor,"childs_room, nursery, bedchamber, bedroom, courthouse",60581
1744,41856,indoor,"childs_room, nursery, courthouse, bedchamber, mosque/outdoor",60581
1745,41880,indoor,"nursery, childs_room, bedchamber, courthouse, bedroom",60581
1746,41904,indoor,"nursery, childs_room, bedchamber, bedroom, courthouse",60581
1747,41928,indoor,"childs_room, nursery, bedchamber, bedroom, courthouse",60581
1748,41952,indoor,"childs_room, nursery, bedchamber, bedroom, courthouse",60581
1749,41976,indoor,"childs_room, nursery, bedchamber, bedroom, courthouse",60581
1750,42000,indoor,"childs_room, nursery, bedchamber, bedroom, courthouse",60581
1751,42024,indoor,"childs_room, nursery, bedchamber, bedroom, courthouse",60581
1752,42048,indoor,"childs_room, nursery, bedchamber, bedroom, courthouse",60581
1753,42072,indoor,"childs_room, nursery, bedchamber, bedroom, courthouse",60581
1754,42096,indoor,"childs_room, nursery, bedchamber, bedroom, courthouse",60581
1755,42120,indoor,"childs_room, nursery, bedchamber, bedroom, courthouse",60581
1756,42144,indoor,"jewelry_shop, gift_shop, clothing_store, nursery, department_store",60581
1757,42168,indoor,"nursery, gift_shop, jewelry_shop, childs_room, candy_store",60581
1758,42192,indoor,"operating_room, clean_room, hospital_room, nursery, science_museum",60581
1759,42216,indoor,"hospital_room, nursery, nursing_home, childs_room, bedroom",60581
1760,42240,indoor,"bedroom, hospital_room, bedchamber, nursery, childs_room",60581
1761,42264,indoor,"hospital_room, nursery, bedroom, childs_room, bedchamber",60581
1762,42288,indoor,"hospital_room, nursery, bedchamber, operating_room, childs_room",60581
1763,42312,indoor,"nursery, hospital_room, bedchamber, bedroom, operating_room",60581
1764,42336,indoor,"hospital_room, bedroom, childs_room, nursery, bedchamber",60581
1765,42360,indoor,"hospital_room, bedroom, childs_room, bedchamber, nursery",60581
1766,42384,indoor,"hospital_room, bedroom, bedchamber, childs_room, nursing_home",60581
1767,42408,indoor,"hospital_room, bedroom, bedchamber, childs_room, hospital",60581
1768,42432,indoor,"hospital_room, operating_room, nursing_home, bedroom, beauty_salon",60581
1769,42456,indoor,"hospital_room, beauty_salon, operating_room, nursing_home, bedroom",60581
1770,42480,indoor,"hospital_room, nursing_home, bedroom, beauty_salon, operating_room",60581
1771,42504,indoor,"hospital_room, bedroom, nursing_home, beauty_salon, hotel_room",60581
1772,42528,indoor,"hospital_room, bedroom, nursing_home, beauty_salon, operating_room",60581
1773,42552,indoor,"hospital_room, operating_room, nursing_home, beauty_salon, bedroom",60581
1774,42576,indoor,"hospital_room, operating_room, nursing_home, beauty_salon, hospital",60581
1775,42600,indoor,"hospital_room, operating_room, beauty_salon, nursing_home, clean_room",60581
1776,42624,outdoor,"courthouse, church/outdoor, street, plaza, palace",60581
1777,42648,outdoor,"courthouse, synagogue/outdoor, entrance_hall, courtyard, church/outdoor",60581
1778,42672,outdoor,"courthouse, synagogue/outdoor, courtyard, mosque/outdoor, entrance_hall",60581
1779,42696,outdoor,"synagogue/outdoor, mosque/outdoor, courthouse, church/outdoor, kasbah",60581
1780,42720,outdoor,"synagogue/outdoor, church/outdoor, courthouse, mosque/outdoor, kasbah",60581
1781,42744,indoor,"bathroom, shower, jacuzzi/indoor, beauty_salon, chemistry_lab",60581
1782,42768,indoor,"bathroom, shower, discotheque, jacuzzi/indoor, music_studio",60581
1783,42792,indoor,"discotheque, chemistry_lab, conference_center, mosque/outdoor, conference_room",60581
1784,42816,indoor,"entrance_hall, staircase, church/indoor, lobby, mezzanine",60581
1785,42840,indoor,"staircase, entrance_hall, lobby, mezzanine, corridor",60581
1786,42864,indoor,"entrance_hall, staircase, lobby, church/indoor, throne_room",60581
1787,42888,indoor,"church/indoor, mosque/outdoor, staircase, biology_laboratory, chemistry_lab",60581
1788,42912,indoor,"museum/indoor, entrance_hall, staircase, mausoleum, throne_room",60581
1789,42936,indoor,"staircase, entrance_hall, church/indoor, corridor, arch",60581
1790,42960,indoor,"staircase, nursery, auditorium, bridge, church/indoor",60581
1791,42984,indoor,"staircase, bridge, mezzanine, church/indoor, entrance_hall",60581
1792,43008,indoor,"church/indoor, staircase, entrance_hall, museum/indoor, mezzanine",60581
1793,43032,indoor,"entrance_hall, church/indoor, staircase, mezzanine, atrium/public",60581
1794,43056,indoor,"staircase, mezzanine, entrance_hall, escalator/indoor, corridor",60581
1795,43080,indoor,"church/indoor, arch, church/outdoor, throne_room, museum/indoor",60581
1796,43104,indoor,"church/indoor, arch, burial_chamber, atrium/public, lobby",60581
1797,43128,indoor,"church/indoor, arch, burial_chamber, museum/indoor, church/outdoor",60581
1798,43152,indoor,"church/indoor, synagogue/outdoor, arch, entrance_hall, burial_chamber",60581
1799,43176,indoor,"elevator/door, doorway/outdoor, jewelry_shop, bow_window/indoor, church/indoor",60581
1800,43200,indoor,"clean_room, chemistry_lab, jewelry_shop, biology_laboratory, bow_window/indoor",60581
1801,43224,indoor,"shower, bow_window/indoor, sauna, banquet_hall, dressing_room",60581
1802,43248,indoor,"restaurant, shower, sauna, pub/indoor, beer_hall",60581
1803,43272,indoor,"bow_window/indoor, lobby, restaurant, living_room, sushi_bar",60581
1804,43296,indoor,"conference_room, lecture_room, conference_center, legislative_chamber, dining_hall",60581
1805,43320,indoor,"conference_room, conference_center, banquet_hall, lobby, reception",60581
1806,43344,indoor,"lecture_room, conference_center, conference_room, legislative_chamber, classroom",60581
1807,43368,indoor,"conference_center, banquet_hall, legislative_chamber, dining_hall, lecture_room",60581
1808,43392,indoor,"banquet_hall, beauty_salon, dining_hall, cafeteria, restaurant",60581
1809,43416,indoor,"banquet_hall, ballroom, dining_hall, conference_center, beauty_salon",60581
1810,43440,indoor,"banquet_hall, dining_hall, dining_room, conference_room, conference_center",60581
1811,43464,indoor,"banquet_hall, dining_hall, dining_room, conference_room, restaurant",60581
1812,43488,indoor,"banquet_hall, dining_hall, conference_room, restaurant, dining_room",60581
1813,43512,indoor,"banquet_hall, conference_room, dining_hall, conference_center, dining_room",60581
1814,43536,indoor,"banquet_hall, conference_room, conference_center, dining_hall, legislative_chamber",60581
1815,43560,indoor,"banquet_hall, dining_hall, conference_room, conference_center, nursing_home",60581
1816,43584,indoor,"conference_room, banquet_hall, conference_center, dining_hall, nursing_home",60581
1817,43608,indoor,"conference_center, legislative_chamber, office, lecture_room, bow_window/indoor",60581
1818,43632,indoor,"conference_center, legislative_chamber, office, lecture_room, bow_window/indoor",60581
1819,43656,indoor,"museum/indoor, office, legislative_chamber, conference_center, bow_window/indoor",60581
1820,43680,indoor,"legislative_chamber, office, conference_center, museum/indoor, lecture_room",60581
1821,43704,indoor,"elevator/door, elevator_lobby, reception, dressing_room, office",60581
1822,43728,indoor,"museum/indoor, jewelry_shop, elevator/door, church/indoor, throne_room",60581
1823,43752,indoor,"conference_room, conference_center, lecture_room, banquet_hall, dining_hall",60581
1824,43776,indoor,"conference_room, conference_center, lecture_room, banquet_hall, dining_hall",60581
1825,43800,indoor,"banquet_hall, conference_room, conference_center, dining_hall, legislative_chamber",60581
1826,43824,indoor,"conference_room, conference_center, banquet_hall, lecture_room, legislative_chamber",60581
1827,43848,indoor,"conference_room, conference_center, legislative_chamber, lecture_room, banquet_hall",60581
1828,43872,indoor,"conference_center, legislative_chamber, conference_room, lecture_room, banquet_hall",60581
1829,43896,indoor,"conference_center, conference_room, legislative_chamber, lecture_room, banquet_hall",60581
1830,43920,indoor,"beauty_salon, shower, dressing_room, stage/indoor, sauna",60581
1831,43944,indoor,"beauty_salon, nursing_home, bow_window/indoor, elevator/door, ballroom",60581
1832,43968,indoor,"dressing_room, beauty_salon, elevator/door, church/indoor, ballroom",60581
1833,43992,indoor,"beauty_salon, dressing_room, bow_window/indoor, elevator/door, nursing_home",60581
1834,44016,indoor,"dressing_room, elevator/door, beauty_salon, elevator_lobby, clothing_store",60581
1835,44040,indoor,"dressing_room, elevator/door, beauty_salon, elevator_lobby, clothing_store",60581
1836,44064,indoor,"dressing_room, elevator/door, beauty_salon, clothing_store, shower",60581
1837,44088,indoor,"dressing_room, elevator/door, clothing_store, shower, beauty_salon",60581
1838,44112,indoor,"elevator/door, beauty_salon, elevator_lobby, dressing_room, nursing_home",60581
1839,44136,indoor,"dressing_room, beauty_salon, ballroom, clothing_store, jewelry_shop",60581
1840,44160,indoor,"dressing_room, beauty_salon, ballroom, stage/indoor, discotheque",60581
1841,44184,indoor,"shower, beauty_salon, ballroom, dressing_room, childs_room",60581
1842,44208,indoor,"ballroom, stage/indoor, clothing_store, dressing_room, banquet_hall",60581
1843,44232,indoor,"stage/indoor, ballroom, stage/outdoor, arena/performance, auditorium",60581
1844,44256,indoor,"stage/indoor, dressing_room, ballroom, television_studio, arena/performance",60581
1845,44280,indoor,"beauty_salon, banquet_hall, ballroom, television_studio, dressing_room",60581
1846,44304,indoor,"beauty_salon, television_studio, banquet_hall, dressing_room, ballroom",60581
1847,44328,indoor,"television_studio, ballroom, banquet_hall, beauty_salon, stage/indoor",60581
1848,44352,indoor,"banquet_hall, ballroom, dining_hall, beauty_salon, restaurant",60581
1849,44376,indoor,"dressing_room, beauty_salon, bamboo_forest, elevator/door, jail_cell",60581
1850,44400,indoor,"dressing_room, beauty_salon, bamboo_forest, nursery, hospital_room",60581
1851,44424,outdoor,"florist_shop/indoor, botanical_garden, corn_field, wheat_field, greenhouse/indoor",60581
1852,44448,indoor,"candy_store, childs_room, ice_cream_parlor, bakery/shop, playroom",60581
1853,44472,indoor,"beauty_salon, jewelry_shop, childs_room, candy_store, nursery",60581
1854,44496,indoor,"beauty_salon, nursery, nursing_home, ice_cream_parlor, playroom",60581
1855,44520,indoor,"office, television_studio, conference_center, dressing_room, music_studio",60581
1856,44544,indoor,"conference_center, office, conference_room, lecture_room, legislative_chamber",60581
1857,44568,indoor,"legislative_chamber, conference_center, office, reception, elevator_lobby",60581
1858,44592,indoor,"conference_center, legislative_chamber, nursing_home, reception, office",60581
1859,44616,indoor,"television_studio, conference_center, nursing_home, legislative_chamber, reception",60581
1860,44640,indoor,"conference_center, nursing_home, legislative_chamber, reception, television_studio",60581
1861,44664,indoor,"beauty_salon, dressing_room, shower, elevator/door, bathroom",60581
1862,44688,indoor,"dressing_room, beauty_salon, shower, elevator/door, nursery",60581
1863,44712,indoor,"beauty_salon, dressing_room, shower, elevator/door, bathroom",60581
1864,44736,indoor,"beauty_salon, dressing_room, bamboo_forest, elevator/door, shower",60581
1865,44760,indoor,"beauty_salon, dressing_room, bamboo_forest, shower, sauna",60581
1866,44784,indoor,"beauty_salon, dressing_room, shower, bamboo_forest, bathroom",60581
1867,44808,indoor,"nursing_home, reception, jewelry_shop, office, hospital_room",60581
1868,44832,indoor,"nursing_home, conference_center, legislative_chamber, banquet_hall, office",60581
1869,44856,indoor,"elevator_lobby, elevator/door, legislative_chamber, office, conference_center",60581
1870,44880,indoor,"conference_center, legislative_chamber, conference_room, office, reception",60581
1871,44904,indoor,"office, conference_center, legislative_chamber, reception, conference_room",60581
1872,44928,indoor,"office, legislative_chamber, conference_center, conference_room, lecture_room",60581
1873,44952,indoor,"beauty_salon, dressing_room, shower, bathroom, bamboo_forest",60581
1874,44976,indoor,"beauty_salon, dressing_room, bamboo_forest, nursery, shower",60581
1875,45000,indoor,"beauty_salon, dressing_room, bamboo_forest, nursery, shower",60581
1876,45024,indoor,"conference_center, office, nursing_home, lecture_room, dressing_room",60581
1877,45048,indoor,"dressing_room, beauty_salon, shower, bathroom, hospital_room",60581
1878,45072,indoor,"beauty_salon, dressing_room, nursery, childs_room, kindergarden_classroom",60581
1879,45096,indoor,"conference_center, office, elevator/door, nursing_home, lecture_room",60581
1880,45120,indoor,"conference_center, office, dressing_room, nursing_home, beauty_salon",60581
1881,45144,indoor,"beauty_salon, dressing_room, bamboo_forest, shower, hospital_room",60581
1882,45168,indoor,"beauty_salon, dressing_room, bamboo_forest, nursery, hospital_room",60581
1883,45192,indoor,"beauty_salon, dressing_room, bamboo_forest, nursery, hospital_room",60581
1884,45216,indoor,"conference_center, nursing_home, office, lecture_room, dressing_room",60581
1885,45240,indoor,"conference_center, nursing_home, office, lecture_room, conference_room",60581
1886,45264,indoor,"conference_center, nursing_home, office, lecture_room, dressing_room",60581
1887,45288,indoor,"conference_center, nursing_home, office, conference_room, lecture_room",60581
1888,45312,indoor,"conference_center, office, nursing_home, lecture_room, legislative_chamber",60581
1889,45336,indoor,"conference_center, office, nursing_home, dressing_room, lecture_room",60581
1890,45360,indoor,"beauty_salon, dressing_room, shower, hospital_room, bathroom",60581
1891,45384,indoor,"dressing_room, beauty_salon, nursery, hospital_room, nursing_home",60581
1892,45408,indoor,"beauty_salon, dressing_room, shower, hospital_room, nursery",60581
1893,45432,indoor,"beauty_salon, dressing_room, bamboo_forest, hospital_room, nursery",60581
1894,45456,indoor,"beauty_salon, dressing_room, hospital_room, bamboo_forest, nursery",60581
1895,45480,indoor,"beauty_salon, dressing_room, nursery, nursing_home, hospital_room",60581
1896,45504,indoor,"beauty_salon, dressing_room, hospital_room, nursery, nursing_home",60581
1897,45528,indoor,"conference_center, office, nursing_home, legislative_chamber, television_studio",60581
1898,45552,indoor,"conference_center, beauty_salon, office, lecture_room, television_studio",60581
1899,45576,indoor,"shower, bow_window/indoor, sauna, beauty_salon, stage/indoor",60581
1900,45600,indoor,"stage/indoor, beauty_salon, dressing_room, office, conference_center",60581
1901,45624,indoor,"beauty_salon, dressing_room, hospital_room, bamboo_forest, nursing_home",60581
1902,45648,indoor,"beauty_salon, dressing_room, hospital_room, nursery, shower",60581
1903,45672,indoor,"dressing_room, beauty_salon, hospital_room, nursing_home, nursery",60581
1904,45696,indoor,"dressing_room, beauty_salon, hospital_room, nursing_home, nursery",60581
1905,45720,indoor,"dressing_room, beauty_salon, hospital_room, bamboo_forest, shower",60581
1906,45744,indoor,"dressing_room, beauty_salon, shower, nursery, bamboo_forest",60581
1907,45768,indoor,"dressing_room, beauty_salon, nursery, clothing_store, childs_room",60581
1908,45792,indoor,"legislative_chamber, conference_center, office, conference_room, television_studio",60581
1909,45816,indoor,"legislative_chamber, conference_center, office, conference_room, television_studio",60581
1910,45840,indoor,"legislative_chamber, conference_center, office, television_studio, conference_room",60581
1911,45864,indoor,"legislative_chamber, conference_center, office, conference_room, television_studio",60581
1912,45888,indoor,"legislative_chamber, office, conference_center, conference_room, television_studio",60581
1913,45912,indoor,"beauty_salon, office, conference_center, nursing_home, television_studio",60581
1914,45936,indoor,"elevator_lobby, elevator/door, legislative_chamber, dressing_room, conference_center",60581
1915,45960,indoor,"elevator_lobby, elevator/door, legislative_chamber, ballroom, television_studio",60581
1916,45984,indoor,"elevator_lobby, elevator/door, conference_center, legislative_chamber, ballroom",60581
1917,46008,indoor,"legislative_chamber, conference_center, elevator_lobby, ballroom, nursing_home",60581
1918,46032,indoor,"legislative_chamber, conference_center, elevator_lobby, ballroom, elevator/door",60581
1919,46056,indoor,"legislative_chamber, conference_center, ballroom, elevator_lobby, office",60581
1920,46080,indoor,"dressing_room, beauty_salon, bamboo_forest, shower, elevator/door",60581
1921,46104,indoor,"dressing_room, bamboo_forest, beauty_salon, hospital_room, shower",60581
1922,46128,indoor,"conference_center, nursing_home, office, dressing_room, lecture_room",60581
1923,46152,indoor,"conference_center, nursing_home, office, legislative_chamber, stage/indoor",60581
1924,46176,indoor,"dressing_room, beauty_salon, hospital_room, bamboo_forest, nursery",60581
1925,46200,indoor,"dressing_room, beauty_salon, bamboo_forest, hospital_room, nursery",60581
1926,46224,indoor,"dressing_room, beauty_salon, shower, hospital_room, bamboo_forest",60581
1927,46248,indoor,"dressing_room, beauty_salon, shower, hospital_room, nursery",60581
1928,46272,indoor,"dressing_room, beauty_salon, bamboo_forest, hospital_room, shower",60581
1929,46296,indoor,"dressing_room, beauty_salon, bamboo_forest, shower, hospital_room",60581
1930,46320,indoor,"conference_center, stage/indoor, office, nursing_home, television_studio",60581
1931,46344,indoor,"conference_center, stage/indoor, office, dressing_room, lecture_room",60581
1932,46368,indoor,"conference_center, stage/indoor, dressing_room, nursing_home, office",60581
1933,46392,indoor,"conference_center, dressing_room, discotheque, stage/indoor, television_studio",60581
1934,46416,indoor,"nursery, biology_laboratory, beauty_salon, hospital_room, balcony/interior",60581
1935,46440,indoor,"bow_window/indoor, clean_room, beauty_salon, elevator/door, nursing_home",60581
1936,46464,indoor,"nursing_home, bow_window/indoor, clean_room, office, beauty_salon",60581
1937,46488,indoor,"beauty_salon, dressing_room, bow_window/indoor, childs_room, office",60581
1938,46512,indoor,"dressing_room, beauty_salon, nursing_home, childs_room, clean_room",60581
1939,46536,indoor,"beauty_salon, dressing_room, nursing_home, office, art_studio",60581
1940,46560,indoor,"beauty_salon, dressing_room, nursing_home, ice_cream_parlor, coffee_shop",60581
1941,46584,indoor,"dressing_room, beauty_salon, nursing_home, ice_cream_parlor, museum/indoor",60581
1942,46608,indoor,"dressing_room, beauty_salon, ice_cream_parlor, museum/indoor, clothing_store",60581
1943,46632,indoor,"dressing_room, beauty_salon, ice_cream_parlor, nursing_home, clothing_store",60581
1944,46656,indoor,"banquet_hall, conference_center, dining_hall, restaurant, nursing_home",60581
1945,46680,indoor,"banquet_hall, dining_hall, conference_center, nursing_home, conference_room",60581
1946,46704,indoor,"banquet_hall, dining_hall, conference_center, conference_room, nursing_home",60581
1947,46728,indoor,"food_court, restaurant, nursing_home, banquet_hall, television_studio",60581
1948,46752,indoor,"television_studio, conference_center, legislative_chamber, lecture_room, conference_room",60581
1949,46776,indoor,"conference_room, conference_center, legislative_chamber, nursing_home, office",60581
1950,46800,indoor,"conference_center, legislative_chamber, conference_room, reception, office",60581
1951,46824,indoor,"nursing_home, conference_center, banquet_hall, legislative_chamber, conference_room",60581
1952,46848,indoor,"nursing_home, legislative_chamber, conference_center, jewelry_shop, office",60581
1953,46872,indoor,"legislative_chamber, nursing_home, conference_center, conference_room, office",60581
1954,46896,indoor,"conference_center, legislative_chamber, banquet_hall, conference_room, nursing_home",60581
1955,46920,indoor,"jewelry_shop, nursing_home, conference_center, legislative_chamber, banquet_hall",60581
1956,46944,indoor,"jewelry_shop, conference_center, nursing_home, legislative_chamber, banquet_hall",60581
1957,46968,indoor,"jewelry_shop, banquet_hall, legislative_chamber, conference_center, restaurant",60581
1958,46992,indoor,"jewelry_shop, banquet_hall, restaurant, conference_center, dining_hall",60581
1959,47016,indoor,"nursing_home, elevator/door, beauty_salon, elevator_lobby, dressing_room",60581
1960,47040,indoor,"nursing_home, elevator/door, elevator_lobby, conference_center, beauty_salon",60581
1961,47064,indoor,"natural_history_museum, recreation_room, science_museum, jewelry_shop, shoe_shop",60581
1962,47088,indoor,"kindergarden_classroom, playground, classroom, swimming_pool/indoor, office_cubicles",60581
1963,47112,indoor,"childs_room, bakery/shop, jewelry_shop, gift_shop, coffee_shop",60581
1964,47136,indoor,"bakery/shop, coffee_shop, gift_shop, ice_cream_parlor, candy_store",60581
1965,47160,indoor,"elevator/door, beauty_salon, nursing_home, bar, elevator_lobby",60581
1966,47184,indoor,"conference_center, airplane_cabin, discotheque, stage/indoor, auditorium",60581
1967,47208,indoor,"conference_center, stage/indoor, discotheque, television_studio, airplane_cabin",60581
1968,47232,indoor,"conference_center, discotheque, stage/indoor, television_studio, auditorium",60581
1969,47256,indoor,"conference_center, discotheque, stage/indoor, auditorium, television_studio",60581
1970,47280,indoor,"conference_center, discotheque, airplane_cabin, stage/indoor, auditorium",60581
1971,47304,indoor,"conference_center, office, nursing_home, elevator/door, elevator_lobby",60581
1972,47328,indoor,"sauna, conference_center, bow_window/indoor, office, locker_room",60581
1973,47352,indoor,"conference_center, office, bow_window/indoor, sauna, conference_room",60581
1974,47376,indoor,"reception, jewelry_shop, bathroom, lobby, locker_room",60581
1975,47400,indoor,"coffee_shop, nursery, beauty_salon, childs_room, bakery/shop",60581
1976,47424,indoor,"conference_center, office, bow_window/indoor, conference_room, lecture_room",60581
1977,47448,indoor,"conference_center, office, elevator/door, bow_window/indoor, locker_room",60581
1978,47472,indoor,"bow_window/indoor, elevator/door, sauna, locker_room, office",60581
1979,47496,indoor,"bathroom, shower, wind_farm, clean_room, chemistry_lab",60581
1980,47520,indoor,"bathroom, shower, jewelry_shop, beauty_salon, airplane_cabin",60581
1981,47544,indoor,"discotheque, shower, music_studio, basement, bathroom",60581
1982,47568,indoor,"discotheque, shower, bathroom, jewelry_shop, music_studio",60581
1983,47592,indoor,"atrium/public, shopping_mall/indoor, clothing_store, beauty_salon, elevator_lobby",60581
1984,47616,indoor,"beauty_salon, discotheque, conference_center, television_studio, music_studio",60581
1985,47640,indoor,"discotheque, television_studio, jewelry_shop, bar, conference_center",60581
1986,47664,indoor,"conference_center, television_studio, discotheque, bar, auditorium",60581
1987,47688,indoor,"conference_center, television_studio, discotheque, bar, pub/indoor",60581
1988,47712,indoor,"conference_center, bar, television_studio, discotheque, pub/indoor",60581
1989,47736,indoor,"conference_center, bar, discotheque, television_studio, jewelry_shop",60581
1990,47760,indoor,"archive, office, jewelry_shop, kindergarden_classroom, office_cubicles",60581
1991,47784,indoor,"playroom, kindergarden_classroom, nursery, ice_cream_parlor, office",60581
1992,47808,indoor,"ice_cream_parlor, candy_store, nursery, fastfood_restaurant, kindergarden_classroom",60581
1993,47832,indoor,"conference_center, elevator/door, office, locker_room, elevator_lobby",60581
1994,47856,indoor,"conference_center, hospital_room, office, beauty_salon, hospital",60581
1995,47880,indoor,"biology_laboratory, beauty_salon, classroom, chemistry_lab, conference_center",60581
1996,47904,indoor,"conference_center, biology_laboratory, chemistry_lab, classroom, wheat_field",60581
1997,47928,indoor,"conference_center, hospital_room, office, biology_laboratory, classroom",60581
