,frame_num,environment,places,imdb_id
0,0,outdoor,"desert/sand, sky, beach, lake/natural, marsh",60581
1,24,indoor,"gift_shop, water_tower, nursery, museum/indoor, science_museum",60581
2,48,outdoor,"motel, courthouse, water_tower, nursery, tower",60581
3,72,outdoor,"motel, courthouse, water_tower, nursery, amusement_park",60581
4,96,outdoor,"motel, courthouse, water_tower, nursery, amusement_park",60581
5,120,outdoor,"motel, courthouse, water_tower, amusement_park, nursery",60581
6,144,outdoor,"motel, courthouse, water_tower, amusement_park, tower",60581
7,168,outdoor,"motel, water_tower, amusement_park, courthouse, nursery",60581
8,192,indoor,"water_tower, motel, nursery, ice_cream_parlor, gift_shop",60581
9,216,indoor,"auto_factory, assembly_line, parking_garage/indoor, raceway, garage/indoor",60581
10,240,indoor,"auto_factory, auto_showroom, gymnasium/indoor, airport_terminal, assembly_line",60581
11,264,indoor,"auto_factory, assembly_line, auto_showroom, gymnasium/indoor, parking_garage/indoor",60581
12,288,indoor,"auto_factory, assembly_line, auto_showroom, raceway, repair_shop",60581
13,312,indoor,"elevator/door, closet, basement, clean_room, corridor",60581
14,336,outdoor,"iceberg, hot_spring, pond, discotheque, lake/natural",60581
15,360,indoor,"discotheque, beauty_salon, chemistry_lab, stage/indoor, biology_laboratory",60581
16,384,indoor,"discotheque, science_museum, biology_laboratory, fishpond, pond",60581
17,408,outdoor,"sky, tower, skyscraper, office_building, wind_farm",60581
18,432,outdoor,"elevator/door, sky, conference_center, hospital, tower",60581
19,456,indoor,"hospital, pharmacy, conference_center, elevator/door, sky",60581
20,480,indoor,"conference_center, hospital, pharmacy, stage/indoor, reception",60581
21,504,indoor,"hospital, pharmacy, drugstore, conference_center, motel",60581
22,528,outdoor,"wind_farm, windmill, sky, discotheque, stage/indoor",60581
23,552,indoor,"hospital, pharmacy, beauty_salon, discotheque, drugstore",60581
24,576,indoor,"hospital, pharmacy, discotheque, hospital_room, drugstore",60581
25,600,indoor,"hospital, discotheque, pharmacy, stage/indoor, conference_center",60581
26,624,outdoor,"wind_farm, windmill, amusement_park, stage/indoor, tower",60581
27,648,outdoor,"tower, oast_house, skyscraper, temple/asia, church/outdoor",60581
28,672,outdoor,"tower, skyscraper, church/outdoor, arch, mosque/outdoor",60581
29,696,outdoor,"hospital, museum/outdoor, mosque/outdoor, oast_house, tower",60581
30,720,outdoor,"clothing_store, skyscraper, gift_shop, tower, office_building",60581
31,744,outdoor,"skyscraper, tower, office_building, hospital, downtown",60581
32,768,outdoor,"skyscraper, tower, mosque/outdoor, hospital, office_building",60581
33,792,outdoor,"mosque/outdoor, tower, skyscraper, church/outdoor, hospital",60581
34,816,outdoor,"mosque/outdoor, tower, church/outdoor, skyscraper, palace",60581
35,840,outdoor,"mosque/outdoor, tower, church/outdoor, skyscraper, hospital",60581
36,864,outdoor,"mosque/outdoor, ticket_booth, tower, hospital, amusement_park",60581
37,888,outdoor,"hospital, museum/outdoor, office_building, mosque/outdoor, building_facade",60581
38,912,outdoor,"mosque/outdoor, tower, church/outdoor, skyscraper, building_facade",60581
39,936,outdoor,"ski_resort, atrium/public, shopping_mall/indoor, igloo, ski_slope",60581
40,960,indoor,"auto_factory, engine_room, assembly_line, repair_shop, butchers_shop",60581
41,984,outdoor,"ski_slope, ice_shelf, drugstore, ski_resort, glacier",60581
42,1008,outdoor,"ski_slope, ice_shelf, archive, glacier, drugstore",60581
43,1032,indoor,"auto_factory, engine_room, assembly_line, repair_shop, boat_deck",60581
44,1056,indoor,"jewelry_shop, shopping_mall/indoor, atrium/public, art_gallery, natural_history_museum",60581
45,1080,outdoor,"hospital, office_building, atrium/public, elevator_shaft, courtyard",60581
46,1104,outdoor,"hospital, office_building, atrium/public, courtyard, elevator_shaft",60581
47,1128,outdoor,"office_building, hospital, courtyard, atrium/public, elevator_shaft",60581
48,1152,outdoor,"hospital, office_building, atrium/public, skyscraper, elevator_shaft",60581
49,1176,outdoor,"atrium/public, courtyard, office_building, shopping_mall/indoor, plaza",60581
50,1200,outdoor,"hospital, office_building, skyscraper, downtown, elevator_shaft",60581
51,1224,outdoor,"office_building, hospital, skyscraper, courtyard, downtown",60581
52,1248,outdoor,"office_building, hospital, skyscraper, courtyard, downtown",60581
53,1272,outdoor,"hospital, office_building, downtown, courtyard, skyscraper",60581
54,1296,outdoor,"atrium/public, courtyard, downtown, office_building, shopping_mall/indoor",60581
55,1320,indoor,"elevator_shaft, discotheque, office_building, downtown, bus_interior",60581
56,1344,indoor,"discotheque, candy_store, butchers_shop, clean_room, supermarket",60581
57,1368,indoor,"candy_store, butchers_shop, bakery/shop, gift_shop, discotheque",60581
58,1392,indoor,"discotheque, candy_store, butchers_shop, clothing_store, bakery/shop",60581
59,1416,indoor,"discotheque, beauty_salon, candy_store, bar, music_studio",60581
60,1440,indoor,"discotheque, butchers_shop, candy_store, clothing_store, stage/indoor",60581
61,1464,indoor,"ticket_booth, gas_station, reception, beauty_salon, hospital",60581
62,1488,indoor,"ticket_booth, gas_station, pharmacy, beauty_salon, shopfront",60581
63,1512,indoor,"ticket_booth, elevator_lobby, elevator/door, hospital, server_room",60581
64,1536,outdoor,"drugstore, pharmacy, desert/sand, sky, hospital",60581
65,1560,indoor,"drugstore, elevator/door, pharmacy, ticket_booth, beauty_salon",60581
66,1584,indoor,"drugstore, elevator/door, pharmacy, ticket_booth, gas_station",60581
67,1608,indoor,"elevator/door, elevator_lobby, archive, utility_room, natural_history_museum",60581
68,1632,indoor,"staircase, escalator/indoor, lobby, atrium/public, entrance_hall",60581
69,1656,indoor,"discotheque, elevator_shaft, underwater/ocean_deep, escalator/indoor, aquarium",60581
70,1680,outdoor,"underwater/ocean_deep, aquarium, discotheque, rainforest, botanical_garden",60581
71,1704,indoor,"underwater/ocean_deep, discotheque, aquarium, arena/performance, stage/indoor",60581
72,1728,indoor,"discotheque, aquarium, stage/indoor, arena/performance, underwater/ocean_deep",60581
73,1752,indoor,"underwater/ocean_deep, aquarium, discotheque, ocean, arena/performance",60581
74,1776,indoor,"aquarium, discotheque, underwater/ocean_deep, arena/performance, stage/indoor",60581
75,1800,indoor,"arena/performance, stage/indoor, discotheque, underwater/ocean_deep, aquarium",60581
76,1824,indoor,"arena/performance, stage/indoor, discotheque, aquarium, underwater/ocean_deep",60581
77,1848,indoor,"arena/performance, stage/indoor, discotheque, underwater/ocean_deep, aquarium",60581
78,1872,indoor,"discotheque, arena/performance, stage/indoor, aquarium, underwater/ocean_deep",60581
79,1896,indoor,"aquarium, discotheque, underwater/ocean_deep, science_museum, jewelry_shop",60581
80,1920,indoor,"discotheque, arena/performance, stadium/soccer, stage/indoor, stadium/football",60581
81,1944,indoor,"discotheque, beauty_salon, stage/indoor, candy_store, arena/performance",60581
82,1968,indoor,"discotheque, candy_store, beauty_salon, gift_shop, jewelry_shop",60581
83,1992,indoor,"discotheque, stage/indoor, beauty_salon, candy_store, arena/performance",60581
84,2016,indoor,"discotheque, beauty_salon, stage/indoor, arena/performance, candy_store",60581
85,2040,indoor,"beauty_salon, discotheque, candy_store, stage/indoor, gift_shop",60581
86,2064,outdoor,"football_field, stadium/football, discotheque, stadium/soccer, stage/indoor",60581
87,2088,outdoor,"discotheque, football_field, stadium/football, stadium/soccer, soccer_field",60581
88,2112,indoor,"shoe_shop, arena/performance, discotheque, jewelry_shop, football_field",60581
89,2136,indoor,"arena/performance, discotheque, stage/indoor, stadium/soccer, stadium/football",60581
90,2160,outdoor,"arena/performance, football_field, stadium/soccer, stadium/football, racecourse",60581
91,2184,indoor,"candy_store, shoe_shop, discotheque, stadium/soccer, gift_shop",60581
92,2208,indoor,"shoe_shop, jewelry_shop, gift_shop, flea_market/indoor, candy_store",60581
93,2232,indoor,"discotheque, botanical_garden, aquarium, amusement_park, jewelry_shop",60581
94,2256,indoor,"atrium/public, elevator_shaft, science_museum, skyscraper, discotheque",60581
95,2280,indoor,"airport_terminal, discotheque, escalator/indoor, atrium/public, shopping_mall/indoor",60581
96,2304,indoor,"atrium/public, airport_terminal, escalator/indoor, elevator_shaft, skyscraper",60581
97,2328,indoor,"elevator_shaft, atrium/public, shopping_mall/indoor, airport_terminal, bank_vault",60581
98,2352,indoor,"discotheque, botanical_garden, florist_shop/indoor, underwater/ocean_deep, aquarium",60581
99,2376,indoor,"arena/performance, discotheque, stadium/football, plaza, stage/indoor",60581
100,2400,indoor,"arena/performance, discotheque, stadium/football, stage/indoor, plaza",60581
101,2424,indoor,"arena/performance, discotheque, stage/indoor, temple/asia, plaza",60581
102,2448,indoor,"arena/performance, discotheque, stadium/football, stage/indoor, plaza",60581
103,2472,indoor,"arena/performance, discotheque, stage/indoor, plaza, stadium/football",60581
104,2496,indoor,"arena/performance, discotheque, ice_skating_rink/indoor, stage/indoor, auditorium",60581
105,2520,indoor,"discotheque, hospital, arena/performance, gift_shop, candy_store",60581
106,2544,indoor,"arena/performance, discotheque, stadium/football, stage/indoor, candy_store",60581
107,2568,indoor,"discotheque, gift_shop, arena/performance, candy_store, hospital",60581
108,2592,indoor,"arena/performance, discotheque, hospital, stage/indoor, gift_shop",60581
109,2616,indoor,"hospital, pharmacy, candy_store, gift_shop, discotheque",60581
110,2640,indoor,"hospital, arena/performance, gift_shop, discotheque, museum/indoor",60581
111,2664,indoor,"museum/indoor, art_gallery, nursery, art_studio, hangar/indoor",60581
112,2688,outdoor,"drugstore, pharmacy, ice_shelf, hospital, motel",60581
113,2712,outdoor,"ice_shelf, drugstore, hospital, pharmacy, motel",60581
114,2736,indoor,"pharmacy, drugstore, hospital, booth/indoor, motel",60581
115,2760,indoor,"drugstore, pharmacy, ice_cream_parlor, booth/indoor, bookstore",60581
116,2784,indoor,"drugstore, pharmacy, ice_cream_parlor, general_store/outdoor, candy_store",60581
117,2808,indoor,"drugstore, pharmacy, bookstore, ice_cream_parlor, hospital",60581
118,2832,indoor,"bookstore, drugstore, pharmacy, food_court, supermarket",60581
119,2856,indoor,"playroom, art_gallery, nursery, home_office, art_studio",60581
120,2880,indoor,"playroom, office_cubicles, nursery, home_office, attic",60581
121,2904,indoor,"playroom, nursery, childs_room, home_office, attic",60581
122,2928,indoor,"nursery, childs_room, playroom, attic, home_office",60581
123,2952,indoor,"nursery, childs_room, playroom, bedchamber, kindergarden_classroom",60581
124,2976,indoor,"clean_room, office_cubicles, childs_room, attic, nursery",60581
125,3000,indoor,"childs_room, office_cubicles, nursery, playroom, attic",60581
126,3024,outdoor,"bridge, viaduct, tower, arch, river",60581
127,3048,outdoor,"mosque/outdoor, tower, oilrig, harbor, palace",60581
128,3072,outdoor,"tower, mosque/outdoor, church/outdoor, skyscraper, bridge",60581
129,3096,outdoor,"tower, bridge, skyscraper, mosque/outdoor, viaduct",60581
130,3120,indoor,"museum/indoor, kasbah, locker_room, auditorium, alcove",60581
131,3144,outdoor,"hot_spring, sky, lake/natural, tower, pier",60581
132,3168,indoor,"auto_showroom, museum/indoor, auto_factory, atrium/public, science_museum",60581
133,3192,indoor,"auto_showroom, auto_factory, museum/indoor, parking_garage/indoor, assembly_line",60581
134,3216,indoor,"auto_factory, auto_showroom, bridge, assembly_line, museum/indoor",60581
135,3240,indoor,"clean_room, auto_factory, auto_showroom, loading_dock, assembly_line",60581
136,3264,indoor,"hospital, clean_room, mosque/outdoor, hospital_room, science_museum",60581
137,3288,indoor,"clean_room, auto_factory, auto_showroom, loading_dock, server_room",60581
138,3312,outdoor,"mosque/outdoor, clean_room, heliport, boat_deck, science_museum",60581
139,3336,outdoor,"clean_room, fire_station, heliport, mosque/outdoor, science_museum",60581
140,3360,indoor,"laundromat, mosque/outdoor, clean_room, science_museum, utility_room",60581
141,3384,indoor,"auto_factory, clean_room, museum/indoor, train_station/platform, assembly_line",60581
142,3408,indoor,"raceway, museum/indoor, mosque/outdoor, auto_factory, assembly_line",60581
143,3432,outdoor,"forest/broadleaf, orchard, cemetery, tree_farm, kennel/outdoor",60581
144,3456,outdoor,"forest/broadleaf, orchard, cemetery, tree_farm, shower",60581
145,3480,outdoor,"forest/broadleaf, kennel/outdoor, orchard, swamp, field/wild",60581
146,3504,outdoor,"construction_site, amusement_park, industrial_area, water_tower, excavation",60581
147,3528,outdoor,"oilrig, tower, skyscraper, construction_site, industrial_area",60581
148,3552,outdoor,"tower, oilrig, church/outdoor, castle, skyscraper",60581
149,3576,outdoor,"tower, skyscraper, construction_site, oilrig, church/outdoor",60581
150,3600,outdoor,"tower, church/outdoor, skyscraper, mosque/outdoor, construction_site",60581
151,3624,outdoor,"mosque/outdoor, tower, skyscraper, church/outdoor, palace",60581
152,3648,outdoor,"mosque/outdoor, tower, skyscraper, downtown, church/outdoor",60581
153,3672,outdoor,"skyscraper, fire_escape, alley, office_building, downtown",60581
154,3696,outdoor,"skyscraper, downtown, fire_escape, office_building, alley",60581
155,3720,outdoor,"skyscraper, downtown, office_building, tower, alley",60581
156,3744,outdoor,"alley, skyscraper, downtown, office_building, fire_escape",60581
157,3768,indoor,"archive, locker_room, server_room, alley, library/indoor",60581
158,3792,indoor,"archive, locker_room, bathroom, chemistry_lab, library/indoor",60581
159,3816,indoor,"archive, server_room, locker_room, office_building, clean_room",60581
160,3840,indoor,"clean_room, server_room, bathroom, locker_room, chemistry_lab",60581
161,3864,indoor,"clean_room, bathroom, server_room, hospital_room, locker_room",60581
162,3888,indoor,"clean_room, bathroom, operating_room, hospital_room, hospital",60581
163,3912,indoor,"clean_room, boat_deck, medina, airplane_cabin, operating_room",60581
164,3936,indoor,"clean_room, balcony/interior, airplane_cabin, airport_terminal, hospital_room",60581
165,3960,indoor,"clean_room, hospital_room, beauty_salon, operating_room, assembly_line",60581
166,3984,indoor,"clean_room, beauty_salon, operating_room, hospital_room, assembly_line",60581
167,4008,indoor,"clean_room, operating_room, engine_room, hospital_room, auto_factory",60581
168,4032,indoor,"clean_room, operating_room, engine_room, medina, hospital_room",60581
169,4056,indoor,"clean_room, auto_factory, runway, operating_room, assembly_line",60581
170,4080,indoor,"clean_room, operating_room, assembly_line, hangar/indoor, auto_factory",60581
171,4104,indoor,"clean_room, hangar/indoor, operating_room, auto_factory, airport_terminal",60581
172,4128,indoor,"beauty_salon, hospital_room, clean_room, porch, balcony/interior",60581
173,4152,indoor,"clean_room, hospital_room, living_room, porch, beauty_salon",60581
174,4176,indoor,"living_room, hotel_room, bedroom, porch, artists_loft",60581
175,4200,indoor,"balcony/interior, hospital_room, porch, beauty_salon, bus_interior",60581
176,4224,indoor,"hospital_room, balcony/interior, bedroom, nursery, hotel_room",60581
177,4248,indoor,"hospital_room, bus_interior, airplane_cabin, berth, living_room",60581
178,4272,indoor,"hospital_room, ice_cream_parlor, operating_room, clean_room, hospital",60581
179,4296,indoor,"clean_room, hospital_room, airplane_cabin, ice_cream_parlor, operating_room",60581
180,4320,indoor,"clean_room, ice_cream_parlor, beauty_salon, hospital_room, airplane_cabin",60581
181,4344,indoor,"clean_room, operating_room, beauty_salon, hospital_room, clothing_store",60581
182,4368,indoor,"clean_room, laundromat, beauty_salon, shower, atrium/public",60581
183,4392,indoor,"clean_room, archive, atrium/public, beauty_salon, shopping_mall/indoor",60581
184,4416,indoor,"airport_terminal, atrium/public, clean_room, archive, shopping_mall/indoor",60581
185,4440,indoor,"atrium/public, shopping_mall/indoor, clean_room, escalator/indoor, airport_terminal",60581
186,4464,indoor,"escalator/indoor, airport_terminal, archive, clean_room, atrium/public",60581
187,4488,indoor,"hospital_room, bathroom, jacuzzi/indoor, shower, hotel_room",60581
188,4512,indoor,"airplane_cabin, hospital_room, clean_room, train_interior, laundromat",60581
189,4536,indoor,"airplane_cabin, bus_interior, train_interior, hospital_room, clean_room",60581
190,4560,indoor,"clean_room, hospital_room, operating_room, biology_laboratory, hospital",60581
191,4584,indoor,"clean_room, chemistry_lab, biology_laboratory, hospital_room, operating_room",60581
192,4608,indoor,"clean_room, hospital_room, restaurant_kitchen, ice_cream_parlor, biology_laboratory",60581
193,4632,indoor,"airplane_cabin, clean_room, hospital_room, ice_cream_parlor, server_room",60581
194,4656,indoor,"hospital_room, dressing_room, coffee_shop, living_room, beauty_salon",60581
195,4680,indoor,"beauty_salon, coffee_shop, chemistry_lab, ice_cream_parlor, biology_laboratory",60581
196,4704,indoor,"auto_factory, assembly_line, server_room, repair_shop, clean_room",60581
197,4728,indoor,"auto_factory, assembly_line, repair_shop, garage/indoor, clean_room",60581
198,4752,indoor,"auto_showroom, hospital_room, auto_factory, train_interior, bus_interior",60581
199,4776,indoor,"train_interior, medina, loading_dock, auto_factory, bus_interior",60581
200,4800,indoor,"discotheque, stage/indoor, beauty_salon, martial_arts_gym, ballroom",60581
201,4824,indoor,"discotheque, clean_room, arena/performance, chemistry_lab, stage/indoor",60581
202,4848,indoor,"parking_garage/indoor, discotheque, parking_lot, airplane_cabin, beauty_salon",60581
203,4872,outdoor,"medina, loading_dock, alley, auto_factory, train_interior",60581
204,4896,outdoor,"railroad_track, loading_dock, train_interior, medina, auto_factory",60581
205,4920,outdoor,"loading_dock, medina, auto_factory, train_interior, alley",60581
206,4944,outdoor,"alley, loading_dock, repair_shop, street, gas_station",60581
207,4968,indoor,"atrium/public, bathroom, staircase, shopping_mall/indoor, entrance_hall",60581
208,4992,outdoor,"alley, medina, downtown, loading_dock, office_building",60581
209,5016,outdoor,"alley, medina, server_room, downtown, atrium/public",60581
210,5040,outdoor,"alley, medina, downtown, office_building, loading_dock",60581
211,5064,outdoor,"medina, alley, clean_room, server_room, loading_dock",60581
212,5088,outdoor,"server_room, alley, clean_room, medina, loading_dock",60581
213,5112,outdoor,"bazaar/outdoor, medina, plaza, downtown, market/outdoor",60581
214,5136,outdoor,"medina, bazaar/outdoor, plaza, mosque/outdoor, downtown",60581
215,5160,outdoor,"archive, bookstore, construction_site, bazaar/outdoor, plaza",60581
216,5184,outdoor,"bazaar/outdoor, construction_site, plaza, medina, downtown",60581
217,5208,outdoor,"bazaar/outdoor, plaza, downtown, construction_site, medina",60581
218,5232,outdoor,"plaza, bazaar/outdoor, downtown, crosswalk, medina",60581
219,5256,outdoor,"bazaar/outdoor, medina, plaza, downtown, crosswalk",60581
220,5280,outdoor,"bazaar/outdoor, plaza, medina, cemetery, downtown",60581
221,5304,outdoor,"plaza, bazaar/outdoor, construction_site, downtown, medina",60581
222,5328,outdoor,"bazaar/outdoor, plaza, construction_site, medina, downtown",60581
223,5352,outdoor,"plaza, construction_site, bazaar/outdoor, medina, downtown",60581
224,5376,outdoor,"plaza, bazaar/outdoor, downtown, medina, construction_site",60581
225,5400,outdoor,"medina, bazaar/outdoor, plaza, pharmacy, kasbah",60581
226,5424,outdoor,"medina, plaza, campus, laundromat, hospital",60581
227,5448,outdoor,"medina, plaza, pharmacy, bazaar/outdoor, mosque/outdoor",60581
228,5472,outdoor,"campus, pharmacy, medina, office_building, plaza",60581
229,5496,outdoor,"plaza, downtown, medina, office_building, street",60581
230,5520,outdoor,"medina, plaza, mosque/outdoor, campus, downtown",60581
231,5544,outdoor,"museum/outdoor, hospital, plaza, medina, office_building",60581
232,5568,outdoor,"pharmacy, plaza, hospital, campus, hospital_room",60581
233,5592,indoor,"pharmacy, campus, hospital_room, drugstore, hospital",60581
234,5616,outdoor,"hospital, hospital_room, pharmacy, campus, plaza",60581
235,5640,indoor,"pharmacy, drugstore, hospital, hospital_room, biology_laboratory",60581
236,5664,outdoor,"hospital, pharmacy, hospital_room, campus, plaza",60581
237,5688,outdoor,"hospital, mosque/outdoor, campus, hospital_room, medina",60581
238,5712,outdoor,"hospital, campus, hospital_room, plaza, courtyard",60581
239,5736,outdoor,"hospital, campus, mosque/outdoor, office_building, plaza",60581
240,5760,outdoor,"campus, hospital, hospital_room, medina, mosque/outdoor",60581
241,5784,outdoor,"hospital, mosque/outdoor, kasbah, campus, hospital_room",60581
242,5808,indoor,"biology_laboratory, chemistry_lab, hospital_room, campus, mosque/outdoor",60581
243,5832,outdoor,"mosque/outdoor, plaza, mausoleum, campus, kasbah",60581
244,5856,outdoor,"downtown, office_building, medina, kasbah, campus",60581
245,5880,indoor,"campus, hospital, hospital_room, lecture_room, office",60581
246,5904,indoor,"hospital, hospital_room, biology_laboratory, pharmacy, chemistry_lab",60581
247,5928,outdoor,"office_building, skyscraper, hospital, downtown, campus",60581
248,5952,outdoor,"atrium/public, courtyard, shopping_mall/indoor, office_building, courthouse",60581
249,5976,outdoor,"courthouse, office_building, embassy, hospital, building_facade",60581
250,6000,indoor,"alley, medina, bathroom, clean_room, server_room",60581
251,6024,outdoor,"alley, medina, clean_room, coffee_shop, crosswalk",60581
252,6048,indoor,"shoe_shop, airplane_cabin, bathroom, clean_room, beauty_salon",60581
253,6072,indoor,"shower, bathroom, lecture_room, office, laundromat",60581
254,6096,indoor,"martial_arts_gym, clean_room, museum/indoor, gymnasium/indoor, stage/indoor",60581
255,6120,indoor,"conference_center, lecture_room, conference_room, martial_arts_gym, stage/indoor",60581
256,6144,indoor,"bathroom, shower, utility_room, jacuzzi/indoor, laundromat",60581
257,6168,indoor,"office_cubicles, corridor, atrium/public, locker_room, staircase",60581
258,6192,outdoor,"atrium/public, shopping_mall/indoor, alley, courtyard, office_building",60581
259,6216,outdoor,"alley, arcade, medina, street, atrium/public",60581
260,6240,indoor,"shopfront, ticket_booth, atrium/public, shopping_mall/indoor, elevator_lobby",60581
261,6264,outdoor,"hospital, office_building, pharmacy, hospital_room, shopfront",60581
262,6288,outdoor,"alley, medina, arcade, street, courtyard",60581
263,6312,indoor,"alley, arcade, server_room, medina, train_station/platform",60581
264,6336,outdoor,"alley, arcade, medina, street, server_room",60581
265,6360,outdoor,"alley, medina, arcade, street, downtown",60581
266,6384,outdoor,"alley, arcade, medina, street, server_room",60581
267,6408,outdoor,"alley, arcade, street, medina, downtown",60581
268,6432,outdoor,"alley, medina, arcade, server_room, street",60581
269,6456,outdoor,"alley, medina, arcade, shopping_mall/indoor, street",60581
270,6480,outdoor,"alley, street, arcade, medina, downtown",60581
271,6504,outdoor,"alley, street, arcade, medina, downtown",60581
272,6528,outdoor,"alley, street, arcade, medina, downtown",60581
273,6552,indoor,"department_store, clothing_store, shower, lobby, dressing_room",60581
274,6576,indoor,"shower, clothing_store, department_store, lobby, church/indoor",60581
275,6600,indoor,"banquet_hall, shower, restaurant, bathroom, dining_hall",60581
276,6624,indoor,"banquet_hall, dining_hall, restaurant, conference_center, dining_room",60581
277,6648,indoor,"banquet_hall, dining_hall, restaurant, dining_room, bar",60581
278,6672,indoor,"banquet_hall, jewelry_shop, dining_hall, beer_hall, restaurant",60581
279,6696,indoor,"banquet_hall, dining_hall, beer_hall, restaurant, dining_room",60581
280,6720,indoor,"banquet_hall, dining_hall, restaurant, beer_hall, dining_room",60581
281,6744,indoor,"banquet_hall, dining_hall, restaurant, beer_hall, dining_room",60581
282,6768,indoor,"banquet_hall, dining_hall, restaurant, conference_center, beer_hall",60581
283,6792,indoor,"banquet_hall, dining_hall, restaurant, dining_room, beer_hall",60581
284,6816,indoor,"banquet_hall, dining_hall, restaurant, dining_room, ballroom",60581
285,6840,indoor,"banquet_hall, dining_hall, restaurant, beer_hall, dining_room",60581
286,6864,indoor,"banquet_hall, dining_hall, booth/indoor, restaurant, dining_room",60581
287,6888,indoor,"banquet_hall, dining_hall, restaurant, beer_hall, conference_center",60581
288,6912,indoor,"banquet_hall, dining_hall, restaurant, conference_center, beer_hall",60581
289,6936,indoor,"banquet_hall, dining_hall, restaurant, beer_hall, cafeteria",60581
290,6960,indoor,"banquet_hall, dining_hall, restaurant, beer_hall, dining_room",60581
291,6984,indoor,"banquet_hall, dining_hall, restaurant, beer_hall, dining_room",60581
292,7008,indoor,"banquet_hall, dining_hall, restaurant, beer_hall, dining_room",60581
293,7032,indoor,"banquet_hall, dining_hall, restaurant, beer_hall, dining_room",60581
294,7056,indoor,"banquet_hall, dining_hall, restaurant, beer_hall, dining_room",60581
295,7080,indoor,"banquet_hall, dining_hall, restaurant, beer_hall, dining_room",60581
296,7104,indoor,"banquet_hall, dining_hall, restaurant, beer_hall, dining_room",60581
297,7128,indoor,"banquet_hall, dining_hall, restaurant, beer_hall, dining_room",60581
298,7152,indoor,"banquet_hall, dining_hall, booth/indoor, conference_center, restaurant",60581
