,frame_num,environment,places
0,0,outdoor,"desert/sand, sky, beach, lake/natural, marsh"
1,24,outdoor,"desert/sand, sky, beach, lake/natural, marsh"
2,48,indoor,"childs_room, nursery, playroom, art_gallery, museum/indoor"
3,72,indoor,"childs_room, playroom, nursery, gift_shop, art_gallery"
4,96,indoor,"childs_room, gift_shop, nursery, bakery/shop, playroom"
5,120,indoor,"childs_room, museum/indoor, gift_shop, drugstore, reception"
6,144,indoor,"drugstore, pharmacy, hospital, beauty_salon, museum/indoor"
7,168,indoor,"pharmacy, drugstore, hospital, hospital_room, beauty_salon"
8,192,indoor,"pharmacy, drugstore, hospital, hospital_room, beauty_salon"
9,216,indoor,"pharmacy, drugstore, hospital, hospital_room, beauty_salon"
10,240,indoor,"locker_room, basement, archive, server_room, art_gallery"
11,264,indoor,"server_room, basement, locker_room, archive, clean_room"
12,288,indoor,"hospital, pharmacy, museum/indoor, drugstore, reception"
13,312,indoor,"hospital, pharmacy, museum/indoor, drugstore, reception"
14,336,indoor,"hospital, pharmacy, museum/indoor, drugstore, reception"
15,360,indoor,"hospital, pharmacy, drugstore, waiting_room, reception"
16,384,indoor,"hospital, pharmacy, drugstore, museum/indoor, waiting_room"
17,408,indoor,"hospital, pharmacy, drugstore, museum/indoor, waiting_room"
18,432,indoor,"hospital, pharmacy, museum/indoor, drugstore, waiting_room"
19,456,indoor,"hospital, pharmacy, museum/indoor, drugstore, waiting_room"
20,480,indoor,"museum/indoor, hospital, hospital_room, pharmacy, science_museum"
21,504,indoor,"museum/indoor, hospital, hospital_room, pharmacy, clean_room"
22,528,indoor,"museum/indoor, hospital, hospital_room, pharmacy, clean_room"
23,552,indoor,"museum/indoor, hospital, hospital_room, pharmacy, science_museum"
24,576,indoor,"museum/indoor, hospital, hospital_room, pharmacy, science_museum"
25,600,indoor,"museum/indoor, hospital, pharmacy, hospital_room, science_museum"
26,624,indoor,"museum/indoor, hospital, hospital_room, pharmacy, science_museum"
27,648,indoor,"museum/indoor, hospital, hospital_room, pharmacy, science_museum"
28,672,indoor,"museum/indoor, hospital, hospital_room, pharmacy, science_museum"
29,696,indoor,"museum/indoor, hospital, hospital_room, pharmacy, science_museum"
30,720,indoor,"museum/indoor, hospital, hospital_room, pharmacy, science_museum"
31,744,indoor,"museum/indoor, hospital, hospital_room, pharmacy, science_museum"
32,768,indoor,"museum/indoor, hospital, hospital_room, pharmacy, science_museum"
33,792,indoor,"museum/indoor, hospital, hospital_room, pharmacy, science_museum"
34,816,indoor,"museum/indoor, hospital, hospital_room, pharmacy, science_museum"
35,840,indoor,"museum/indoor, hospital, hospital_room, pharmacy, science_museum"
36,864,indoor,"museum/indoor, hospital, hospital_room, pharmacy, science_museum"
37,888,indoor,"booth/indoor, museum/indoor, kindergarden_classroom, nursery, art_school"
38,912,indoor,"booth/indoor, museum/indoor, kindergarden_classroom, nursery, art_school"
39,936,indoor,"booth/indoor, museum/indoor, kindergarden_classroom, nursery, art_school"
40,960,indoor,"booth/indoor, museum/indoor, kindergarden_classroom, nursery, archive"
41,984,indoor,"jewelry_shop, cemetery, bakery/shop, motel, gift_shop"
42,1008,indoor,"jewelry_shop, cemetery, bakery/shop, gift_shop, motel"
43,1032,indoor,"jewelry_shop, cemetery, bakery/shop, gift_shop, motel"
44,1056,indoor,"jewelry_shop, cemetery, bakery/shop, gift_shop, motel"
45,1080,indoor,"jewelry_shop, cemetery, bakery/shop, gift_shop, motel"
46,1104,indoor,"jewelry_shop, cemetery, bakery/shop, gift_shop, motel"
47,1128,indoor,"cemetery, burial_chamber, pharmacy, ice_shelf, drugstore"
48,1152,indoor,"cemetery, burial_chamber, pharmacy, museum/indoor, drugstore"
49,1176,indoor,"cemetery, pharmacy, burial_chamber, drugstore, ice_shelf"
50,1200,indoor,"cemetery, burial_chamber, pharmacy, drugstore, museum/indoor"
51,1224,indoor,"cemetery, burial_chamber, pharmacy, ice_shelf, drugstore"
52,1248,indoor,"cemetery, hospital, jewelry_shop, museum/indoor, bank_vault"
53,1272,indoor,"cemetery, hospital, jewelry_shop, bank_vault, museum/indoor"
54,1296,indoor,"cemetery, hospital, museum/indoor, jewelry_shop, bank_vault"
55,1320,indoor,"cemetery, hospital, jewelry_shop, bank_vault, museum/indoor"
56,1344,outdoor,"cemetery, hospital, hot_spring, bank_vault, jewelry_shop"
57,1368,indoor,"discotheque, volcano, stage/indoor, music_studio, hot_spring"
58,1392,indoor,"shower, dressing_room, bathroom, discotheque, beauty_salon"
59,1416,indoor,"discotheque, dressing_room, stage/indoor, shower, beauty_salon"
60,1440,indoor,"discotheque, shower, beauty_salon, dressing_room, bathroom"
61,1464,indoor,"shower, dressing_room, discotheque, elevator/door, art_gallery"
62,1488,indoor,"pharmacy, hospital, cemetery, drugstore, beauty_salon"
63,1512,indoor,"pharmacy, hospital, cemetery, drugstore, jewelry_shop"
64,1536,indoor,"pharmacy, hospital, cemetery, jewelry_shop, drugstore"
65,1560,indoor,"pharmacy, hospital, cemetery, drugstore, jewelry_shop"
66,1584,indoor,"pharmacy, hospital, cemetery, drugstore, jewelry_shop"
67,1608,indoor,"museum/indoor, art_gallery, shower, beauty_salon, dressing_room"
68,1632,indoor,"museum/indoor, art_gallery, shower, beauty_salon, dressing_room"
69,1656,indoor,"museum/indoor, art_gallery, shower, dressing_room, beauty_salon"
70,1680,indoor,"museum/indoor, art_gallery, shower, dressing_room, beauty_salon"
71,1704,outdoor,"ice_shelf, cemetery, volcano, hot_spring, pharmacy"
72,1728,outdoor,"ice_shelf, cemetery, volcano, hot_spring, pharmacy"
73,1752,outdoor,"cemetery, hospital, pharmacy, drugstore, motel"
74,1776,outdoor,"cemetery, hospital, pharmacy, drugstore, motel"
75,1800,outdoor,"hospital, cemetery, pharmacy, drugstore, motel"
76,1824,indoor,"cemetery, hospital, pharmacy, drugstore, catacomb"
77,1848,indoor,"cemetery, pharmacy, hospital, drugstore, catacomb"
78,1872,indoor,"cemetery, hospital, pharmacy, drugstore, catacomb"
79,1896,indoor,"cemetery, hospital, pharmacy, drugstore, catacomb"
80,1920,indoor,"cemetery, hospital, pharmacy, drugstore, museum/indoor"
81,1944,outdoor,"cemetery, pharmacy, hospital, drugstore, motel"
82,1968,outdoor,"oilrig, islet, tower, harbor, skyscraper"
83,1992,indoor,"lobby, art_gallery, reception, harbor, desert/sand"
84,2016,outdoor,"desert/sand, ice_shelf, valley, harbor, kasbah"
85,2040,outdoor,"desert/sand, ice_shelf, kasbah, home_theater, industrial_area"
86,2064,outdoor,"desert/sand, harbor, ice_shelf, coast, beach"
87,2088,indoor,"archive, chemistry_lab, harbor, lake/natural, museum/indoor"
88,2112,outdoor,"harbor, industrial_area, canal/urban, construction_site, hospital"
89,2136,outdoor,"harbor, canal/urban, industrial_area, drugstore, hospital"
90,2160,outdoor,"harbor, hospital, industrial_area, drugstore, construction_site"
91,2184,outdoor,"harbor, canal/urban, hospital, industrial_area, drugstore"
92,2208,outdoor,"harbor, hospital, canal/urban, industrial_area, boat_deck"
93,2232,outdoor,"harbor, hospital, drugstore, canal/urban, construction_site"
94,2256,outdoor,"harbor, chemistry_lab, hospital, industrial_area, archive"
95,2280,indoor,"pharmacy, drugstore, archive, chemistry_lab, museum/indoor"
96,2304,indoor,"alcove, attic, archive, museum/indoor, burial_chamber"
97,2328,indoor,"alcove, museum/indoor, attic, archive, burial_chamber"
98,2352,indoor,"alcove, museum/indoor, attic, archive, burial_chamber"
99,2376,indoor,"artists_loft, entrance_hall, stable, classroom, jail_cell"
100,2400,indoor,"entrance_hall, porch, waiting_room, artists_loft, classroom"
101,2424,indoor,"medina, jail_cell, entrance_hall, locker_room, corridor"
102,2448,indoor,"artists_loft, classroom, medina, alley, corridor"
103,2472,indoor,"artists_loft, medina, alley, corridor, arcade"
104,2496,indoor,"porch, corridor, entrance_hall, medina, artists_loft"
105,2520,indoor,"entrance_hall, dressing_room, gymnasium/indoor, waiting_room, classroom"
106,2544,outdoor,"cemetery, hospital, pharmacy, volcano, stage/indoor"
107,2568,outdoor,"cemetery, pharmacy, hospital, volcano, stage/indoor"
108,2592,outdoor,"cemetery, hospital, pharmacy, volcano, stage/indoor"
109,2616,outdoor,"cemetery, pharmacy, hospital, volcano, stage/indoor"
110,2640,outdoor,"cemetery, pharmacy, hospital, volcano, stage/indoor"
111,2664,indoor,"museum/indoor, art_gallery, dressing_room, clean_room, science_museum"
112,2688,indoor,"museum/indoor, clean_room, art_gallery, dressing_room, science_museum"
113,2712,indoor,"jewelry_shop, bar, sushi_bar, science_museum, stage/indoor"
114,2736,indoor,"bar, reception, restaurant, jewelry_shop, ice_cream_parlor"
115,2760,indoor,"banquet_hall, bar, restaurant, dining_hall, wet_bar"
116,2784,indoor,"restaurant, bar, banquet_hall, reception, wet_bar"
117,2808,outdoor,"cemetery, pharmacy, drugstore, hospital, volcano"
118,2832,outdoor,"cemetery, pharmacy, volcano, hospital, drugstore"
119,2856,indoor,"cemetery, pharmacy, drugstore, hospital, booth/indoor"
120,2880,outdoor,"cemetery, pharmacy, volcano, hospital, drugstore"
121,2904,outdoor,"cemetery, pharmacy, drugstore, hospital, volcano"
122,2928,outdoor,"cemetery, pharmacy, volcano, drugstore, hospital"
123,2952,outdoor,"cemetery, volcano, pharmacy, drugstore, hot_spring"
124,2976,outdoor,"cemetery, pharmacy, volcano, drugstore, hospital"
125,3000,indoor,"museum/indoor, stage/indoor, art_gallery, arena/performance, music_studio"
126,3024,indoor,"museum/indoor, stage/indoor, art_gallery, arena/performance, music_studio"
127,3048,indoor,"museum/indoor, clean_room, dressing_room, art_gallery, science_museum"
128,3072,indoor,"clean_room, operating_room, museum/indoor, dressing_room, archive"
129,3096,indoor,"shower, museum/indoor, art_gallery, clean_room, locker_room"
130,3120,indoor,"shower, clean_room, museum/indoor, art_gallery, alcove"
131,3144,indoor,"museum/indoor, clean_room, art_gallery, dressing_room, archive"
132,3168,indoor,"museum/indoor, clean_room, art_gallery, archive, art_studio"
133,3192,indoor,"museum/indoor, clean_room, art_gallery, archive, artists_loft"
134,3216,indoor,"museum/indoor, art_gallery, clean_room, natural_history_museum, science_museum"
135,3240,indoor,"museum/indoor, art_gallery, clean_room, natural_history_museum, archive"
136,3264,indoor,"cemetery, art_gallery, pharmacy, hospital, reception"
137,3288,indoor,"cemetery, pharmacy, jewelry_shop, art_gallery, hospital"
138,3312,indoor,"cemetery, jewelry_shop, art_gallery, pharmacy, beauty_salon"
139,3336,indoor,"cemetery, jewelry_shop, pharmacy, art_gallery, hospital"
140,3360,indoor,"cemetery, pharmacy, jewelry_shop, hospital, art_gallery"
141,3384,indoor,"cemetery, jewelry_shop, pharmacy, art_gallery, hospital"
142,3408,indoor,"cemetery, pharmacy, art_gallery, hospital, jewelry_shop"
143,3432,indoor,"cemetery, art_gallery, jewelry_shop, pharmacy, volcano"
144,3456,indoor,"cemetery, jewelry_shop, art_gallery, pharmacy, volcano"
145,3480,indoor,"museum/indoor, art_gallery, natural_history_museum, clean_room, science_museum"
146,3504,indoor,"museum/indoor, art_gallery, natural_history_museum, clean_room, science_museum"
147,3528,outdoor,"cemetery, volcano, hot_spring, bakery/shop, jewelry_shop"
148,3552,outdoor,"cemetery, volcano, hot_spring, pharmacy, bakery/shop"
149,3576,indoor,"cemetery, volcano, pharmacy, bakery/shop, booth/indoor"
150,3600,outdoor,"cemetery, volcano, pharmacy, hot_spring, bakery/shop"
151,3624,outdoor,"cemetery, volcano, hot_spring, pharmacy, field/wild"
152,3648,outdoor,"cemetery, volcano, hot_spring, pharmacy, bakery/shop"
153,3672,outdoor,"cemetery, volcano, pharmacy, hot_spring, bakery/shop"
154,3696,indoor,"cemetery, volcano, jewelry_shop, booth/indoor, pharmacy"
155,3720,outdoor,"cemetery, volcano, pharmacy, hot_spring, bakery/shop"
156,3744,indoor,"museum/indoor, art_gallery, natural_history_museum, clean_room, science_museum"
157,3768,indoor,"museum/indoor, art_gallery, natural_history_museum, clean_room, science_museum"
158,3792,indoor,"pharmacy, cemetery, volcano, beauty_salon, drugstore"
159,3816,outdoor,"pharmacy, cemetery, drugstore, hospital, volcano"
160,3840,outdoor,"pharmacy, cemetery, drugstore, hospital, volcano"
161,3864,outdoor,"pharmacy, cemetery, hospital, volcano, drugstore"
162,3888,outdoor,"pharmacy, cemetery, volcano, hospital, drugstore"
163,3912,indoor,"pharmacy, cemetery, drugstore, beauty_salon, hospital"
164,3936,outdoor,"pharmacy, cemetery, drugstore, hospital, volcano"
165,3960,indoor,"museum/indoor, art_gallery, natural_history_museum, clean_room, science_museum"
166,3984,indoor,"museum/indoor, art_gallery, natural_history_museum, clean_room, science_museum"
167,4008,indoor,"museum/indoor, natural_history_museum, art_gallery, science_museum, clean_room"
168,4032,indoor,"museum/indoor, art_gallery, natural_history_museum, science_museum, shower"
169,4056,indoor,"cemetery, pharmacy, art_gallery, drugstore, hospital"
170,4080,indoor,"cemetery, pharmacy, art_gallery, drugstore, hospital"
171,4104,indoor,"cemetery, pharmacy, hospital, drugstore, art_gallery"
172,4128,indoor,"cemetery, pharmacy, art_gallery, hospital, drugstore"
173,4152,indoor,"cemetery, pharmacy, hospital, art_gallery, burial_chamber"
174,4176,indoor,"cemetery, pharmacy, art_gallery, hospital, drugstore"
175,4200,indoor,"cemetery, pharmacy, hospital, drugstore, burial_chamber"
176,4224,indoor,"cemetery, pharmacy, drugstore, art_gallery, beauty_salon"
177,4248,outdoor,"art_gallery, volcano, hot_spring, museum/indoor, ice_shelf"
178,4272,outdoor,"forest_path, forest/broadleaf, tree_farm, orchard, forest_road"
179,4296,indoor,"museum/indoor, burial_chamber, art_gallery, ice_shelf, cemetery"
180,4320,outdoor,"museum/indoor, orchard, archive, cemetery, yard"
181,4344,outdoor,"doorway/outdoor, porch, bow_window/indoor, bank_vault, mausoleum"
182,4368,indoor,"porch, nursery, clean_room, staircase, playground"
183,4392,outdoor,"mausoleum, porch, doorway/outdoor, nursery, cemetery"
184,4416,outdoor,"cemetery, jewelry_shop, ice_shelf, volcano, stage/indoor"
185,4440,indoor,"cemetery, jewelry_shop, stage/indoor, bar, volcano"
186,4464,outdoor,"cemetery, jewelry_shop, volcano, stage/indoor, ice_shelf"
187,4488,indoor,"dressing_room, clean_room, art_gallery, museum/indoor, clothing_store"
188,4512,indoor,"dressing_room, locker_room, clean_room, clothing_store, museum/indoor"
189,4536,indoor,"dressing_room, clean_room, art_gallery, museum/indoor, clothing_store"
190,4560,indoor,"dressing_room, art_gallery, museum/indoor, clean_room, clothing_store"
191,4584,indoor,"dressing_room, museum/indoor, clean_room, art_gallery, clothing_store"
192,4608,indoor,"dressing_room, clean_room, museum/indoor, clothing_store, art_gallery"
193,4632,indoor,"dressing_room, clean_room, art_gallery, art_studio, shower"
194,4656,indoor,"dressing_room, museum/indoor, clean_room, art_gallery, clothing_store"
195,4680,indoor,"museum/indoor, art_gallery, science_museum, wet_bar, booth/indoor"
196,4704,indoor,"museum/indoor, art_gallery, bedroom, science_museum, booth/indoor"
197,4728,indoor,"museum/indoor, science_museum, art_gallery, natural_history_museum, booth/indoor"
198,4752,indoor,"museum/indoor, science_museum, reception, booth/indoor, art_gallery"
199,4776,indoor,"museum/indoor, science_museum, art_gallery, television_studio, reception"
200,4800,outdoor,"ice_shelf, yard, cemetery, porch, jewelry_shop"
201,4824,outdoor,"yard, cemetery, porch, patio, orchard"
202,4848,outdoor,"yard, cemetery, museum/indoor, orchard, porch"
203,4872,outdoor,"cemetery, museum/indoor, yard, archive, orchard"
204,4896,indoor,"museum/indoor, archive, schoolhouse, clean_room, ice_shelf"
205,4920,indoor,"museum/indoor, butchers_shop, archive, natural_history_museum, yard"
206,4944,indoor,"museum/indoor, cemetery, butchers_shop, yard, archive"
207,4968,indoor,"museum/indoor, dressing_room, clothing_store, art_gallery, jewelry_shop"
208,4992,indoor,"dressing_room, museum/indoor, art_gallery, clothing_store, jewelry_shop"
209,5016,indoor,"dressing_room, museum/indoor, clothing_store, jewelry_shop, art_gallery"
210,5040,indoor,"dressing_room, museum/indoor, jewelry_shop, clothing_store, art_gallery"
211,5064,indoor,"museum/indoor, archive, schoolhouse, burial_chamber, cemetery"
212,5088,outdoor,"ice_shelf, volcano, hot_spring, cemetery, oilrig"
213,5112,outdoor,"volcano, ice_shelf, cemetery, hot_spring, oilrig"
214,5136,outdoor,"volcano, ice_shelf, cemetery, oilrig, hot_spring"
215,5160,outdoor,"iceberg, ice_floe, ice_shelf, igloo, snowfield"
216,5184,outdoor,"ice_shelf, ice_floe, snowfield, iceberg, mountain_snowy"
217,5208,outdoor,"ice_shelf, ice_floe, snowfield, iceberg, mountain_snowy"
218,5232,outdoor,"snowfield, ice_shelf, mountain_snowy, iceberg, ice_floe"
219,5256,outdoor,"snowfield, ice_shelf, mountain_snowy, ski_slope, ice_floe"
220,5280,outdoor,"islet, ice_shelf, iceberg, ice_floe, mountain_snowy"
221,5304,outdoor,"ski_slope, snowfield, ice_shelf, ice_floe, mountain_snowy"
222,5328,indoor,"museum/indoor, clean_room, engine_room, boat_deck, science_museum"
223,5352,indoor,"clean_room, chemistry_lab, engine_room, museum/indoor, boat_deck"
224,5376,indoor,"jewelry_shop, museum/indoor, clean_room, boat_deck, shoe_shop"
225,5400,indoor,"museum/indoor, clean_room, jewelry_shop, boat_deck, science_museum"
226,5424,indoor,"museum/indoor, jewelry_shop, clean_room, boat_deck, physics_laboratory"
227,5448,indoor,"museum/indoor, clean_room, natural_history_museum, jewelry_shop, science_museum"
228,5472,indoor,"clean_room, archive, classroom, chemistry_lab, biology_laboratory"
229,5496,indoor,"clean_room, airport_terminal, cafeteria, assembly_line, food_court"
230,5520,indoor,"clean_room, archive, airport_terminal, classroom, waiting_room"
231,5544,indoor,"cemetery, burial_chamber, catacomb, booth/indoor, museum/indoor"
232,5568,indoor,"cemetery, burial_chamber, catacomb, museum/indoor, booth/indoor"
233,5592,indoor,"cemetery, burial_chamber, catacomb, museum/indoor, booth/indoor"
234,5616,indoor,"cemetery, burial_chamber, catacomb, museum/indoor, booth/indoor"
235,5640,indoor,"cemetery, burial_chamber, catacomb, museum/indoor, booth/indoor"
236,5664,indoor,"cemetery, burial_chamber, catacomb, museum/indoor, booth/indoor"
237,5688,indoor,"cemetery, burial_chamber, catacomb, museum/indoor, booth/indoor"
238,5712,indoor,"cemetery, burial_chamber, catacomb, booth/indoor, museum/indoor"
239,5736,indoor,"cemetery, burial_chamber, catacomb, museum/indoor, booth/indoor"
240,5760,indoor,"cemetery, burial_chamber, booth/indoor, catacomb, museum/indoor"
241,5784,indoor,"cemetery, burial_chamber, catacomb, museum/indoor, booth/indoor"
242,5808,indoor,"cemetery, catacomb, burial_chamber, museum/indoor, booth/indoor"
243,5832,indoor,"museum/indoor, art_gallery, clean_room, science_museum, natural_history_museum"
244,5856,indoor,"museum/indoor, art_gallery, science_museum, natural_history_museum, clean_room"
245,5880,indoor,"clean_room, art_gallery, science_museum, iceberg, natural_history_museum"
246,5904,indoor,"discotheque, science_museum, natural_history_museum, lake/natural, aquarium"
247,5928,indoor,"clean_room, archive, museum/indoor, art_gallery, operating_room"
248,5952,indoor,"clean_room, archive, operating_room, museum/indoor, art_gallery"
249,5976,indoor,"clean_room, archive, museum/indoor, operating_room, art_gallery"
250,6000,indoor,"clean_room, archive, museum/indoor, operating_room, art_gallery"
251,6024,outdoor,"cemetery, hot_spring, motel, hospital, pharmacy"
252,6048,outdoor,"cemetery, hot_spring, motel, hospital, pharmacy"
253,6072,outdoor,"cemetery, hot_spring, motel, hospital, ice_shelf"
254,6096,outdoor,"cemetery, hot_spring, motel, hospital, pharmacy"
255,6120,outdoor,"cemetery, hot_spring, hospital, jewelry_shop, pharmacy"
256,6144,indoor,"clean_room, archive, museum/indoor, art_gallery, operating_room"
257,6168,indoor,"clean_room, museum/indoor, archive, art_gallery, operating_room"
258,6192,indoor,"clean_room, museum/indoor, dressing_room, archive, art_gallery"
259,6216,indoor,"cemetery, booth/indoor, burial_chamber, museum/indoor, catacomb"
260,6240,indoor,"cemetery, booth/indoor, burial_chamber, forest/broadleaf, catacomb"
261,6264,indoor,"cemetery, burial_chamber, booth/indoor, catacomb, museum/indoor"
262,6288,indoor,"cemetery, burial_chamber, booth/indoor, museum/indoor, forest/broadleaf"
263,6312,indoor,"cemetery, burial_chamber, booth/indoor, catacomb, forest/broadleaf"
264,6336,indoor,"cemetery, burial_chamber, catacomb, museum/indoor, booth/indoor"
265,6360,indoor,"cemetery, burial_chamber, catacomb, museum/indoor, booth/indoor"
266,6384,indoor,"cemetery, burial_chamber, booth/indoor, forest/broadleaf, museum/indoor"
267,6408,indoor,"cemetery, catacomb, burial_chamber, museum/indoor, booth/indoor"
268,6432,indoor,"cemetery, burial_chamber, catacomb, museum/indoor, booth/indoor"
269,6456,indoor,"cemetery, burial_chamber, museum/indoor, catacomb, booth/indoor"
270,6480,indoor,"museum/indoor, archive, clean_room, art_gallery, science_museum"
271,6504,indoor,"clean_room, archive, museum/indoor, art_gallery, operating_room"
272,6528,indoor,"clean_room, archive, museum/indoor, art_gallery, operating_room"
273,6552,indoor,"cemetery, hospital, pharmacy, drugstore, art_gallery"
274,6576,outdoor,"cemetery, hospital, pharmacy, drugstore, motel"
275,6600,indoor,"cemetery, hospital, pharmacy, burial_chamber, drugstore"
276,6624,indoor,"cemetery, hospital, pharmacy, burial_chamber, catacomb"
277,6648,indoor,"cemetery, hospital, pharmacy, drugstore, jewelry_shop"
278,6672,indoor,"cemetery, hospital, pharmacy, burial_chamber, drugstore"
279,6696,indoor,"cemetery, hospital, pharmacy, burial_chamber, catacomb"
280,6720,indoor,"cemetery, hospital, pharmacy, drugstore, burial_chamber"
281,6744,indoor,"cemetery, hospital, pharmacy, burial_chamber, catacomb"
282,6768,indoor,"clean_room, archive, museum/indoor, art_gallery, science_museum"
283,6792,indoor,"clean_room, museum/indoor, archive, art_gallery, science_museum"
284,6816,indoor,"clean_room, museum/indoor, archive, art_gallery, dressing_room"
285,6840,indoor,"clean_room, archive, museum/indoor, operating_room, dressing_room"
286,6864,indoor,"museum/indoor, clean_room, ice_shelf, boat_deck, archive"
287,6888,indoor,"museum/indoor, art_gallery, balcony/interior, boat_deck, archive"
288,6912,indoor,"museum/indoor, art_gallery, artists_loft, archive, gymnasium/indoor"
289,6936,indoor,"museum/indoor, art_gallery, science_museum, natural_history_museum, artists_loft"
290,6960,indoor,"museum/indoor, art_gallery, ice_shelf, archive, artists_loft"
291,6984,indoor,"staircase, ice_shelf, closet, balcony/interior, bow_window/indoor"
292,7008,outdoor,"archive, harbor, canal/urban, drugstore, slum"
293,7032,outdoor,"harbor, canal/urban, oilrig, pier, lock_chamber"
294,7056,outdoor,"harbor, lock_chamber, canal/urban, oilrig, pier"
295,7080,outdoor,"harbor, lock_chamber, oilrig, canal/urban, pier"
296,7104,outdoor,"harbor, lock_chamber, canal/urban, pier, boat_deck"
297,7128,outdoor,"harbor, lock_chamber, chemistry_lab, oilrig, pier"
298,7152,indoor,"museum/indoor, clean_room, igloo, nursery, science_museum"
299,7176,indoor,"archive, clean_room, dressing_room, clothing_store, bookstore"
300,7200,indoor,"clean_room, archive, dressing_room, clothing_store, hospital_room"
301,7224,outdoor,"cemetery, hospital, hot_spring, motel, pharmacy"
302,7248,outdoor,"cemetery, hospital, pharmacy, hot_spring, motel"
303,7272,outdoor,"cemetery, hospital, pharmacy, volcano, motel"
304,7296,outdoor,"cemetery, hospital, motel, pharmacy, hot_spring"
305,7320,outdoor,"cemetery, hospital, pharmacy, motel, hot_spring"
306,7344,outdoor,"cemetery, hospital, pharmacy, motel, hot_spring"
307,7368,indoor,"archive, clean_room, pharmacy, drugstore, hospital_room"
308,7392,outdoor,"harbor, pier, boat_deck, chemistry_lab, lock_chamber"
309,7416,indoor,"chemistry_lab, coffee_shop, drugstore, pharmacy, bar"
310,7440,outdoor,"doorway/outdoor, bank_vault, phone_booth, elevator/door, mausoleum"
311,7464,outdoor,"mausoleum, doorway/outdoor, bank_vault, phone_booth, church/indoor"
312,7488,indoor,"museum/indoor, jewelry_shop, bank_vault, clean_room, mausoleum"
313,7512,indoor,"playground, clean_room, museum/indoor, jewelry_shop, mausoleum"
314,7536,indoor,"museum/indoor, bank_vault, clean_room, mausoleum, jewelry_shop"
315,7560,indoor,"mausoleum, museum/indoor, jewelry_shop, bank_vault, clean_room"
316,7584,indoor,"clean_room, museum/indoor, jewelry_shop, clothing_store, art_gallery"
317,7608,indoor,"clean_room, museum/indoor, dressing_room, art_gallery, science_museum"
318,7632,indoor,"museum/indoor, clean_room, dressing_room, clothing_store, jewelry_shop"
319,7656,indoor,"museum/indoor, clean_room, dressing_room, clothing_store, science_museum"
320,7680,indoor,"clean_room, museum/indoor, dressing_room, clothing_store, art_gallery"
321,7704,indoor,"clean_room, museum/indoor, jewelry_shop, clothing_store, dressing_room"
322,7728,indoor,"museum/indoor, clean_room, art_gallery, jewelry_shop, clothing_store"
323,7752,indoor,"museum/indoor, clean_room, dressing_room, clothing_store, jewelry_shop"
324,7776,indoor,"museum/indoor, clean_room, jewelry_shop, dressing_room, clothing_store"
325,7800,indoor,"museum/indoor, clean_room, jewelry_shop, dressing_room, chemistry_lab"
326,7824,indoor,"museum/indoor, clean_room, clothing_store, dressing_room, jewelry_shop"
327,7848,indoor,"museum/indoor, clean_room, jewelry_shop, gift_shop, clothing_store"
328,7872,indoor,"clean_room, museum/indoor, jewelry_shop, art_gallery, beauty_salon"
329,7896,indoor,"clean_room, museum/indoor, jewelry_shop, dressing_room, clothing_store"
330,7920,outdoor,"porch, playground, nursery, clean_room, yard"
331,7944,indoor,"porch, staircase, nursery, museum/indoor, balcony/exterior"
332,7968,outdoor,"ice_shelf, volcano, cemetery, hot_spring, oilrig"
333,7992,outdoor,"ice_shelf, volcano, cemetery, hot_spring, oilrig"
334,8016,outdoor,"ice_shelf, volcano, cemetery, hot_spring, oilrig"
