,frame_num,environment,places
1860,44640,indoor,"dressing_room, clean_room, beauty_salon, jewelry_shop, music_studio"
1861,44664,indoor,"museum/indoor, natural_history_museum, science_museum, art_gallery, jewelry_shop"
1862,44688,indoor,"museum/indoor, art_gallery, science_museum, natural_history_museum, shower"
1863,44712,indoor,"natural_history_museum, museum/indoor, science_museum, aquarium, shower"
1864,44736,outdoor,"ice_floe, iceberg, ice_shelf, igloo, mountain_snowy"
1865,44760,outdoor,"ice_floe, iceberg, ice_shelf, landfill, igloo"
1866,44784,outdoor,"ice_floe, iceberg, ice_shelf, igloo, art_gallery"
1867,44808,outdoor,"volcano, sky, hot_spring, ice_shelf, oilrig"
1868,44832,outdoor,"volcano, hot_spring, ice_shelf, sky, cemetery"
1869,44856,outdoor,"volcano, ice_shelf, hot_spring, sky, cemetery"
1870,44880,outdoor,"volcano, cemetery, hot_spring, sky, ice_shelf"
1871,44904,indoor,"museum/indoor, art_gallery, iceberg, science_museum, desert/sand"
1872,44928,indoor,"iceberg, aquarium, museum/indoor, art_gallery, childs_room"
1873,44952,outdoor,"iceberg, aquarium, lake/natural, pond, shower"
1874,44976,indoor,"iceberg, museum/indoor, art_gallery, aquarium, shower"
1875,45000,indoor,"museum/indoor, natural_history_museum, art_gallery, clean_room, science_museum"
1876,45024,indoor,"museum/indoor, art_gallery, natural_history_museum, clean_room, iceberg"
1877,45048,indoor,"iceberg, museum/indoor, art_gallery, ice_floe, clean_room"
1878,45072,outdoor,"iceberg, ice_floe, clean_room, art_gallery, lake/natural"
1879,45096,indoor,"kindergarden_classroom, booth/indoor, art_school, classroom, museum/indoor"
1880,45120,indoor,"kindergarden_classroom, booth/indoor, art_school, classroom, museum/indoor"
1881,45144,indoor,"kindergarden_classroom, booth/indoor, art_school, museum/indoor, classroom"
1882,45168,indoor,"kindergarden_classroom, booth/indoor, art_school, museum/indoor, classroom"
1883,45192,indoor,"kindergarden_classroom, booth/indoor, art_school, museum/indoor, classroom"
1884,45216,indoor,"kindergarden_classroom, booth/indoor, art_school, classroom, museum/indoor"
1885,45240,indoor,"kindergarden_classroom, booth/indoor, art_school, classroom, museum/indoor"
1886,45264,indoor,"kindergarden_classroom, booth/indoor, art_school, museum/indoor, classroom"
1887,45288,indoor,"kindergarden_classroom, booth/indoor, art_school, classroom, museum/indoor"
1888,45312,indoor,"kindergarden_classroom, booth/indoor, art_school, classroom, museum/indoor"
1889,45336,indoor,"kindergarden_classroom, booth/indoor, art_school, classroom, museum/indoor"
1890,45360,indoor,"kindergarden_classroom, booth/indoor, art_school, classroom, museum/indoor"
1891,45384,indoor,"kindergarden_classroom, booth/indoor, art_school, classroom, museum/indoor"
1892,45408,indoor,"kindergarden_classroom, booth/indoor, art_school, classroom, museum/indoor"
1893,45432,indoor,"kindergarden_classroom, booth/indoor, art_school, classroom, museum/indoor"
1894,45456,indoor,"kindergarden_classroom, booth/indoor, art_school, classroom, museum/indoor"
1895,45480,indoor,"natural_history_museum, museum/indoor, clean_room, art_gallery, science_museum"
1896,45504,indoor,"clean_room, natural_history_museum, museum/indoor, art_gallery, iceberg"
1897,45528,indoor,"natural_history_museum, museum/indoor, art_gallery, iceberg, clean_room"
1898,45552,indoor,"museum/indoor, art_gallery, natural_history_museum, clean_room, iceberg"
1899,45576,indoor,"museum/indoor, art_gallery, clean_room, natural_history_museum, iceberg"
1900,45600,indoor,"museum/indoor, natural_history_museum, art_gallery, clean_room, science_museum"
1901,45624,indoor,"museum/indoor, art_gallery, natural_history_museum, clean_room, science_museum"
1902,45648,outdoor,"cemetery, ice_shelf, hot_spring, volcano, hospital"
1903,45672,outdoor,"cemetery, hot_spring, ice_shelf, volcano, hospital"
1904,45696,outdoor,"cemetery, ice_shelf, hot_spring, hospital, volcano"
1905,45720,outdoor,"cemetery, hot_spring, ice_shelf, volcano, hospital"
1906,45744,outdoor,"cemetery, hot_spring, volcano, ice_shelf, hospital"
1907,45768,indoor,"museum/indoor, art_gallery, natural_history_museum, science_museum, clean_room"
1908,45792,indoor,"museum/indoor, art_gallery, clean_room, natural_history_museum, science_museum"
1909,45816,indoor,"museum/indoor, art_gallery, natural_history_museum, clean_room, science_museum"
1910,45840,indoor,"art_gallery, natural_history_museum, museum/indoor, science_museum, aquarium"
1911,45864,outdoor,"ice_shelf, cemetery, volcano, oilrig, mountain_snowy"
1912,45888,outdoor,"ice_shelf, cemetery, volcano, mountain_snowy, oilrig"
1913,45912,outdoor,"ice_shelf, cemetery, mountain_snowy, volcano, oilrig"
1914,45936,outdoor,"ice_shelf, cemetery, volcano, mountain_snowy, oilrig"
1915,45960,outdoor,"ice_shelf, volcano, cemetery, hot_spring, sky"
1916,45984,outdoor,"ice_shelf, volcano, cemetery, sky, hot_spring"
1917,46008,outdoor,"ice_shelf, hot_spring, oilrig, cemetery, volcano"
1918,46032,outdoor,"ice_shelf, oilrig, hot_spring, cemetery, volcano"
1919,46056,indoor,"museum/indoor, science_museum, natural_history_museum, art_gallery, art_studio"
1920,46080,indoor,"museum/indoor, natural_history_museum, science_museum, art_gallery, jewelry_shop"
1921,46104,indoor,"museum/indoor, science_museum, natural_history_museum, art_gallery, clean_room"
1922,46128,indoor,"museum/indoor, science_museum, natural_history_museum, art_gallery, clean_room"
1923,46152,indoor,"museum/indoor, science_museum, natural_history_museum, art_gallery, clean_room"
1924,46176,indoor,"museum/indoor, science_museum, natural_history_museum, art_gallery, clean_room"
1925,46200,indoor,"dressing_room, beauty_salon, shower, bathroom, clothing_store"
1926,46224,indoor,"dressing_room, beauty_salon, shower, bathroom, clothing_store"
1927,46248,indoor,"dressing_room, beauty_salon, shower, bathroom, clothing_store"
1928,46272,indoor,"dressing_room, beauty_salon, shower, bathroom, art_gallery"
1929,46296,indoor,"shower, bathroom, dressing_room, jacuzzi/indoor, hot_spring"
1930,46320,indoor,"dressing_room, shower, bathroom, art_gallery, clothing_store"
1931,46344,indoor,"dressing_room, shower, beauty_salon, bathroom, natural_history_museum"
1932,46368,indoor,"dressing_room, shower, bathroom, natural_history_museum, art_gallery"
1933,46392,indoor,"dressing_room, beauty_salon, shower, bathroom, jacuzzi/indoor"
1934,46416,indoor,"clean_room, nursery, music_studio, engine_room, physics_laboratory"
1935,46440,indoor,"clean_room, nursery, physics_laboratory, gift_shop, jewelry_shop"
1936,46464,indoor,"physics_laboratory, clean_room, nursery, museum/indoor, chemistry_lab"
1937,46488,indoor,"nursery, clean_room, museum/indoor, jewelry_shop, science_museum"
1938,46512,indoor,"cemetery, burial_chamber, museum/indoor, hospital, booth/indoor"
1939,46536,indoor,"cemetery, burial_chamber, hospital, museum/indoor, art_gallery"
1940,46560,indoor,"cemetery, burial_chamber, museum/indoor, booth/indoor, art_gallery"
1941,46584,indoor,"cemetery, burial_chamber, museum/indoor, hospital, art_gallery"
1942,46608,indoor,"cemetery, burial_chamber, museum/indoor, hospital, booth/indoor"
1943,46632,indoor,"cemetery, burial_chamber, museum/indoor, art_gallery, booth/indoor"
1944,46656,indoor,"cemetery, burial_chamber, museum/indoor, art_gallery, booth/indoor"
1945,46680,indoor,"cemetery, burial_chamber, museum/indoor, booth/indoor, art_gallery"
1946,46704,indoor,"cemetery, burial_chamber, museum/indoor, art_gallery, hospital"
1947,46728,indoor,"nursery, museum/indoor, clean_room, living_room, natural_history_museum"
1948,46752,indoor,"museum/indoor, nursery, natural_history_museum, science_museum, art_gallery"
1949,46776,indoor,"nursery, museum/indoor, jewelry_shop, clean_room, natural_history_museum"
1950,46800,indoor,"clean_room, nursery, museum/indoor, archive, physics_laboratory"
1951,46824,indoor,"clean_room, art_gallery, museum/indoor, nursery, airplane_cabin"
1952,46848,indoor,"locker_room, shower, sauna, elevator/door, bathroom"
1953,46872,indoor,"locker_room, shower, elevator/door, bathroom, bank_vault"
1954,46896,indoor,"locker_room, shower, museum/indoor, bank_vault, elevator/door"
1955,46920,indoor,"shower, locker_room, bathroom, museum/indoor, wet_bar"
1956,46944,indoor,"locker_room, shower, bathroom, sauna, clean_room"
1957,46968,indoor,"shower, locker_room, museum/indoor, science_museum, bathroom"
1958,46992,indoor,"locker_room, shower, museum/indoor, elevator/door, bathroom"
1959,47016,indoor,"museum/indoor, shower, natural_history_museum, art_gallery, science_museum"
1960,47040,indoor,"locker_room, shower, museum/indoor, bathroom, dressing_room"
1961,47064,indoor,"shower, locker_room, dressing_room, museum/indoor, elevator/door"
1962,47088,indoor,"locker_room, dressing_room, shower, clean_room, museum/indoor"
1963,47112,indoor,"locker_room, museum/indoor, science_museum, clean_room, natural_history_museum"
1964,47136,indoor,"martial_arts_gym, museum/indoor, television_studio, stage/indoor, music_studio"
1965,47160,indoor,"stage/indoor, television_studio, orchestra_pit, martial_arts_gym, discotheque"
1966,47184,outdoor,"cemetery, hot_spring, sky, hospital, volcano"
1967,47208,outdoor,"cemetery, hot_spring, hospital, sky, volcano"
1968,47232,outdoor,"cemetery, field/wild, hospital, hot_spring, desert/sand"
1969,47256,outdoor,"cemetery, hot_spring, hospital, field/wild, desert/sand"
1970,47280,outdoor,"cemetery, hot_spring, field/wild, hospital, sky"
1971,47304,outdoor,"cemetery, hot_spring, field/wild, hospital, volcano"
1972,47328,outdoor,"cemetery, hot_spring, field/wild, hospital, volcano"
1973,47352,indoor,"museum/indoor, art_gallery, martial_arts_gym, television_studio, hot_spring"
1974,47376,indoor,"museum/indoor, art_gallery, martial_arts_gym, natural_history_museum, television_studio"
1975,47400,indoor,"television_studio, museum/indoor, art_gallery, natural_history_museum, martial_arts_gym"
1976,47424,outdoor,"cemetery, hospital, motel, pharmacy, desert/sand"
1977,47448,outdoor,"cemetery, hospital, motel, pharmacy, sky"
1978,47472,outdoor,"cemetery, hospital, motel, pharmacy, volcano"
1979,47496,outdoor,"cemetery, hospital, motel, volcano, hot_spring"
1980,47520,outdoor,"cemetery, hospital, motel, hot_spring, pharmacy"
1981,47544,outdoor,"cemetery, hospital, motel, pharmacy, drugstore"
1982,47568,outdoor,"cemetery, hospital, motel, sky, pharmacy"
1983,47592,outdoor,"cemetery, hospital, motel, pharmacy, sky"
1984,47616,indoor,"museum/indoor, natural_history_museum, television_studio, art_gallery, science_museum"
1985,47640,indoor,"museum/indoor, natural_history_museum, science_museum, television_studio, art_gallery"
1986,47664,indoor,"television_studio, museum/indoor, science_museum, art_gallery, stage/indoor"
1987,47688,indoor,"museum/indoor, art_gallery, natural_history_museum, science_museum, art_studio"
1988,47712,indoor,"museum/indoor, art_gallery, natural_history_museum, science_museum, art_studio"
1989,47736,indoor,"museum/indoor, art_gallery, natural_history_museum, science_museum, art_studio"
1990,47760,indoor,"clothing_store, beauty_salon, jewelry_shop, dressing_room, clean_room"
1991,47784,indoor,"clean_room, archive, chemistry_lab, physics_laboratory, art_gallery"
1992,47808,indoor,"museum/indoor, science_museum, art_gallery, natural_history_museum, clean_room"
1993,47832,indoor,"clean_room, museum/indoor, nursery, science_museum, locker_room"
1994,47856,indoor,"natural_history_museum, museum/indoor, music_studio, nursery, dressing_room"
1995,47880,indoor,"clean_room, museum/indoor, nursery, science_museum, archive"
1996,47904,indoor,"locker_room, basement, server_room, jail_cell, clean_room"
1997,47928,outdoor,"cemetery, volcano, hot_spring, pharmacy, hospital"
1998,47952,outdoor,"cemetery, volcano, hot_spring, pharmacy, hospital"
1999,47976,outdoor,"cemetery, volcano, hot_spring, pharmacy, hospital"
2000,48000,outdoor,"cemetery, volcano, hot_spring, hospital, pharmacy"
2001,48024,outdoor,"cemetery, volcano, hot_spring, hospital, sky"
2002,48048,outdoor,"cemetery, volcano, hot_spring, pharmacy, hospital"
2003,48072,outdoor,"cemetery, volcano, hot_spring, pharmacy, hospital"
2004,48096,outdoor,"cemetery, volcano, hot_spring, pharmacy, hospital"
2005,48120,outdoor,"racecourse, bullring, museum/indoor, archive, ice_shelf"
2006,48144,indoor,"museum/indoor, archive, arch, ice_shelf, burial_chamber"
2007,48168,outdoor,"racecourse, bullring, arch, raceway, museum/indoor"
2008,48192,outdoor,"bullring, arch, museum/indoor, racecourse, archive"
2009,48216,outdoor,"field/cultivated, pasture, racecourse, coast, beach"
2010,48240,outdoor,"racecourse, arena/rodeo, corral, stable, farm"
2011,48264,outdoor,"racecourse, arena/rodeo, baseball_field, raceway, corral"
2012,48288,outdoor,"racecourse, stable, runway, raceway, arena/rodeo"
2013,48312,outdoor,"dam, racecourse, bridge, viaduct, aqueduct"
2014,48336,outdoor,"racecourse, arena/rodeo, stable, corral, baseball_field"
2015,48360,outdoor,"racecourse, corral, stable, arena/rodeo, pasture"
2016,48384,indoor,"clean_room, dressing_room, chemistry_lab, beauty_salon, biology_laboratory"
2017,48408,indoor,"clean_room, museum/indoor, chemistry_lab, dressing_room, archive"
2018,48432,indoor,"museum/indoor, archive, dressing_room, chemistry_lab, physics_laboratory"
2019,48456,indoor,"archive, museum/indoor, chemistry_lab, classroom, clean_room"
2020,48480,indoor,"dressing_room, jewelry_shop, museum/indoor, clothing_store, nursery"
2021,48504,indoor,"jewelry_shop, dressing_room, museum/indoor, department_store, clean_room"
2022,48528,indoor,"museum/indoor, clean_room, dressing_room, science_museum, natural_history_museum"
2023,48552,indoor,"museum/indoor, natural_history_museum, archive, clean_room, science_museum"
2024,48576,outdoor,"museum/indoor, field/cultivated, archive, racecourse, ice_shelf"
2025,48600,outdoor,"racecourse, museum/indoor, archive, schoolhouse, field/cultivated"
2026,48624,indoor,"racecourse, archive, schoolhouse, museum/indoor, stable"
2027,48648,outdoor,"archive, museum/indoor, cemetery, schoolhouse, racecourse"
2028,48672,outdoor,"archive, cemetery, field/cultivated, museum/indoor, schoolhouse"
2029,48696,outdoor,"viaduct, aqueduct, archive, ice_shelf, field/cultivated"
2030,48720,outdoor,"field/cultivated, wind_farm, baseball_field, golf_course, stadium/baseball"
2031,48744,indoor,"museum/indoor, clean_room, archive, schoolhouse, clothing_store"
2032,48768,indoor,"clean_room, museum/indoor, archive, clothing_store, operating_room"
2033,48792,indoor,"clean_room, museum/indoor, clothing_store, physics_laboratory, operating_room"
2034,48816,indoor,"dressing_room, clothing_store, ballroom, banquet_hall, discotheque"
2035,48840,indoor,"clothing_store, dressing_room, banquet_hall, ballroom, department_store"
2036,48864,indoor,"dressing_room, clothing_store, nursery, locker_room, ballroom"
2037,48888,indoor,"dressing_room, chemistry_lab, banquet_hall, clean_room, biology_laboratory"
2038,48912,indoor,"chemistry_lab, clean_room, biology_laboratory, dressing_room, ice_cream_parlor"
2039,48936,indoor,"dressing_room, museum/indoor, beauty_salon, clothing_store, art_gallery"
2040,48960,indoor,"dressing_room, museum/indoor, beauty_salon, art_gallery, elevator/door"
2041,48984,indoor,"dressing_room, museum/indoor, art_gallery, beauty_salon, reception"
2042,49008,indoor,"clean_room, museum/indoor, dressing_room, clothing_store, operating_room"
2043,49032,indoor,"museum/indoor, clean_room, art_gallery, archive, operating_room"
2044,49056,indoor,"clean_room, museum/indoor, operating_room, archive, clothing_store"
2045,49080,indoor,"museum/indoor, clean_room, art_gallery, science_museum, martial_arts_gym"
2046,49104,indoor,"museum/indoor, clean_room, science_museum, dressing_room, art_gallery"
2047,49128,indoor,"museum/indoor, clean_room, clothing_store, dressing_room, science_museum"
2048,49152,indoor,"museum/indoor, science_museum, clean_room, art_gallery, martial_arts_gym"
2049,49176,outdoor,"cemetery, ice_shelf, hot_spring, volcano, sky"
2050,49200,outdoor,"cemetery, ice_shelf, hot_spring, volcano, sky"
2051,49224,outdoor,"cemetery, volcano, ice_shelf, hot_spring, sky"
2052,49248,outdoor,"volcano, ice_shelf, cemetery, hot_spring, sky"
2053,49272,indoor,"museum/indoor, clothing_store, dressing_room, martial_arts_gym, jewelry_shop"
2054,49296,indoor,"museum/indoor, martial_arts_gym, clean_room, science_museum, archive"
2055,49320,indoor,"museum/indoor, science_museum, archive, art_gallery, clean_room"
2056,49344,outdoor,"cemetery, hospital, hot_spring, pharmacy, volcano"
2057,49368,outdoor,"cemetery, hospital, hot_spring, pharmacy, volcano"
2058,49392,outdoor,"hospital, cemetery, hot_spring, volcano, pharmacy"
2059,49416,outdoor,"cemetery, hospital, hot_spring, volcano, pharmacy"
2060,49440,outdoor,"hospital, cemetery, hot_spring, volcano, pharmacy"
2061,49464,outdoor,"cemetery, hospital, volcano, hot_spring, pharmacy"
2062,49488,indoor,"museum/indoor, clean_room, archive, science_museum, art_gallery"
2063,49512,indoor,"museum/indoor, clothing_store, jewelry_shop, art_gallery, banquet_hall"
2064,49536,indoor,"museum/indoor, jewelry_shop, art_gallery, science_museum, television_studio"
2065,49560,indoor,"museum/indoor, science_museum, art_gallery, jewelry_shop, clean_room"
2066,49584,outdoor,"bridge, viaduct, pier, beach, wind_farm"
2067,49608,outdoor,"bridge, viaduct, beach, pier, lake/natural"
2068,49632,indoor,"bridge, shower, viaduct, archive, bank_vault"
2069,49656,outdoor,"bridge, viaduct, harbor, motel, amusement_park"
2070,49680,outdoor,"bridge, viaduct, pier, wind_farm, arch"
2071,49704,outdoor,"golf_course, soccer_field, castle, field/cultivated, palace"
2072,49728,outdoor,"bridge, lake/natural, harbor, beach, pier"
2073,49752,outdoor,"water_tower, sky, tower, shower, beach"
2074,49776,indoor,"dressing_room, museum/indoor, chemistry_lab, clean_room, natural_history_museum"
2075,49800,indoor,"chemistry_lab, clean_room, biology_laboratory, dressing_room, archive"
2076,49824,indoor,"dressing_room, museum/indoor, clean_room, locker_room, beauty_salon"
2077,49848,indoor,"dressing_room, museum/indoor, clean_room, chemistry_lab, beauty_salon"
2078,49872,indoor,"dressing_room, museum/indoor, art_gallery, beauty_salon, alcove"
2079,49896,indoor,"museum/indoor, dressing_room, art_gallery, beauty_salon, clothing_store"
2080,49920,indoor,"museum/indoor, art_gallery, dressing_room, beauty_salon, clean_room"
2081,49944,indoor,"museum/indoor, art_gallery, natural_history_museum, science_museum, dressing_room"
2082,49968,indoor,"museum/indoor, art_gallery, natural_history_museum, science_museum, art_studio"
2083,49992,indoor,"museum/indoor, art_gallery, science_museum, natural_history_museum, art_studio"
2084,50016,indoor,"museum/indoor, natural_history_museum, science_museum, jewelry_shop, shoe_shop"
2085,50040,indoor,"museum/indoor, art_gallery, natural_history_museum, science_museum, shoe_shop"
2086,50064,indoor,"museum/indoor, ballroom, stage/indoor, clothing_store, banquet_hall"
2087,50088,indoor,"clean_room, museum/indoor, stage/indoor, dressing_room, ballroom"
2088,50112,indoor,"museum/indoor, ballroom, dressing_room, stage/indoor, discotheque"
2089,50136,indoor,"museum/indoor, clean_room, dressing_room, stage/indoor, archive"
2090,50160,outdoor,"ice_shelf, oilrig, hot_spring, cemetery, volcano"
2091,50184,outdoor,"ice_shelf, volcano, hot_spring, sky, oilrig"
2092,50208,outdoor,"volcano, ice_shelf, hot_spring, sky, oilrig"
2093,50232,outdoor,"volcano, ice_shelf, hot_spring, oilrig, sky"
2094,50256,outdoor,"volcano, hot_spring, ice_shelf, oilrig, sky"
2095,50280,indoor,"dressing_room, museum/indoor, archive, clean_room, clothing_store"
2096,50304,indoor,"clean_room, chemistry_lab, museum/indoor, dressing_room, operating_room"
2097,50328,indoor,"museum/indoor, archive, clean_room, stage/indoor, toyshop"
2098,50352,indoor,"stage/indoor, museum/indoor, clean_room, toyshop, dressing_room"
2099,50376,indoor,"museum/indoor, clean_room, ballroom, stage/indoor, archive"
2100,50400,indoor,"dressing_room, clean_room, clothing_store, toyshop, chemistry_lab"
2101,50424,indoor,"clean_room, clothing_store, museum/indoor, dressing_room, ballroom"
2102,50448,indoor,"dressing_room, clean_room, clothing_store, museum/indoor, chemistry_lab"
2103,50472,indoor,"clean_room, stage/indoor, chemistry_lab, clothing_store, biology_laboratory"
2104,50496,indoor,"clean_room, museum/indoor, science_museum, chemistry_lab, biology_laboratory"
2105,50520,indoor,"museum/indoor, archive, natural_history_museum, clean_room, science_museum"
2106,50544,indoor,"clean_room, museum/indoor, archive, science_museum, physics_laboratory"
2107,50568,indoor,"clean_room, museum/indoor, archive, science_museum, operating_room"
2108,50592,indoor,"clean_room, chemistry_lab, museum/indoor, dressing_room, gymnasium/indoor"
2109,50616,indoor,"museum/indoor, clean_room, archive, natural_history_museum, science_museum"
2110,50640,indoor,"chemistry_lab, clean_room, museum/indoor, biology_laboratory, stage/indoor"
2111,50664,indoor,"museum/indoor, natural_history_museum, archive, science_museum, clean_room"
2112,50688,indoor,"clean_room, museum/indoor, science_museum, archive, physics_laboratory"
2113,50712,indoor,"assembly_line, archive, construction_site, auto_factory, schoolhouse"
2114,50736,outdoor,"archive, construction_site, landfill, schoolhouse, assembly_line"
2115,50760,outdoor,"archive, construction_site, archaelogical_excavation, schoolhouse, trench"
2116,50784,indoor,"archive, assembly_line, schoolhouse, auto_factory, clean_room"
2117,50808,indoor,"archive, auditorium, assembly_line, schoolhouse, conference_center"
2118,50832,indoor,"dressing_room, clothing_store, clean_room, museum/indoor, locker_room"
2119,50856,indoor,"clean_room, dressing_room, museum/indoor, archive, natural_history_museum"
2120,50880,indoor,"museum/indoor, clean_room, art_gallery, archive, natural_history_museum"
2121,50904,indoor,"dressing_room, museum/indoor, clothing_store, clean_room, archive"
2122,50928,indoor,"bow_window/indoor, boat_deck, junkyard, museum/indoor, auto_factory"
2123,50952,indoor,"bow_window/indoor, museum/indoor, boat_deck, living_room, shower"
2124,50976,outdoor,"bow_window/indoor, boat_deck, raceway, museum/indoor, parking_lot"
2125,51000,indoor,"bow_window/indoor, museum/indoor, schoolhouse, clean_room, archive"
2126,51024,indoor,"bow_window/indoor, boat_deck, porch, coffee_shop, museum/indoor"
2127,51048,outdoor,"bow_window/indoor, boat_deck, schoolhouse, museum/indoor, fire_station"
2128,51072,outdoor,"bow_window/indoor, schoolhouse, mosque/outdoor, boat_deck, mausoleum"
2129,51096,indoor,"bow_window/indoor, boat_deck, schoolhouse, museum/indoor, clean_room"
2130,51120,outdoor,"bow_window/indoor, boat_deck, museum/indoor, schoolhouse, mausoleum"
2131,51144,outdoor,"schoolhouse, archive, museum/indoor, mausoleum, mosque/outdoor"
2132,51168,indoor,"museum/indoor, clean_room, archive, schoolhouse, operating_room"
2133,51192,outdoor,"cemetery, hospital, pharmacy, volcano, drugstore"
2134,51216,outdoor,"cemetery, hospital, pharmacy, volcano, drugstore"
2135,51240,outdoor,"hospital, cemetery, pharmacy, drugstore, volcano"
2136,51264,outdoor,"cemetery, hospital, pharmacy, volcano, drugstore"
2137,51288,outdoor,"hospital, cemetery, pharmacy, drugstore, volcano"
2138,51312,outdoor,"cemetery, hospital, pharmacy, drugstore, volcano"
2139,51336,outdoor,"cemetery, hospital, pharmacy, volcano, drugstore"
2140,51360,indoor,"dining_room, museum/indoor, jewelry_shop, science_museum, natural_history_museum"
2141,51384,indoor,"dining_room, jewelry_shop, clean_room, museum/indoor, art_studio"
2142,51408,indoor,"clean_room, museum/indoor, jewelry_shop, science_museum, dining_room"
2143,51432,indoor,"museum/indoor, science_museum, clean_room, natural_history_museum, art_gallery"
2144,51456,indoor,"clean_room, science_museum, museum/indoor, jewelry_shop, natural_history_museum"
2145,51480,indoor,"museum/indoor, science_museum, clean_room, jewelry_shop, natural_history_museum"
2146,51504,indoor,"science_museum, jewelry_shop, clean_room, natural_history_museum, museum/indoor"
2147,51528,indoor,"museum/indoor, science_museum, natural_history_museum, clean_room, jewelry_shop"
2148,51552,indoor,"clean_room, science_museum, museum/indoor, natural_history_museum, jewelry_shop"
2149,51576,indoor,"natural_history_museum, museum/indoor, science_museum, clean_room, music_studio"
2150,51600,indoor,"natural_history_museum, museum/indoor, science_museum, jewelry_shop, art_gallery"
2151,51624,indoor,"museum/indoor, natural_history_museum, science_museum, art_gallery, jewelry_shop"
2152,51648,indoor,"museum/indoor, clean_room, natural_history_museum, science_museum, art_gallery"
2153,51672,outdoor,"cemetery, volcano, hot_spring, pharmacy, hospital"
2154,51696,outdoor,"cemetery, pharmacy, volcano, hot_spring, hospital"
2155,51720,outdoor,"cemetery, pharmacy, volcano, hospital, drugstore"
2156,51744,outdoor,"pharmacy, cemetery, hot_spring, volcano, drugstore"
2157,51768,outdoor,"cemetery, pharmacy, hospital, volcano, drugstore"
2158,51792,outdoor,"cemetery, volcano, pharmacy, hot_spring, hospital"
2159,51816,indoor,"music_studio, museum/indoor, dressing_room, art_gallery, natural_history_museum"
2160,51840,indoor,"music_studio, television_studio, discotheque, clean_room, beauty_salon"
2161,51864,indoor,"clean_room, jewelry_shop, operating_room, dressing_room, department_store"
2162,51888,indoor,"jewelry_shop, clean_room, museum/indoor, science_museum, dressing_room"
2163,51912,indoor,"clean_room, music_studio, dressing_room, clothing_store, television_studio"
2164,51936,indoor,"clean_room, jewelry_shop, clothing_store, dressing_room, museum/indoor"
2165,51960,indoor,"clothing_store, jewelry_shop, clean_room, dressing_room, department_store"
2166,51984,indoor,"clean_room, dressing_room, clothing_store, music_studio, operating_room"
