,frame_num,environment,places,imdb_id
0,0,outdoor,"desert/sand, sky, beach, lake/natural, marsh",25939
1,24,outdoor,"desert/sand, sky, beach, lake/natural, marsh",25939
2,48,indoor,"motel, bookstore, pharmacy, archive, drugstore",25939
3,72,indoor,"bookstore, archive, drugstore, pharmacy, airport_terminal",25939
4,96,indoor,"bookstore, archive, drugstore, pharmacy, airport_terminal",25939
5,120,indoor,"bookstore, archive, drugstore, pharmacy, airport_terminal",25939
6,144,indoor,"bookstore, archive, drugstore, airport_terminal, pharmacy",25939
7,168,indoor,"bookstore, archive, drugstore, pharmacy, airport_terminal",25939
8,192,indoor,"bookstore, archive, drugstore, airport_terminal, pharmacy",25939
9,216,indoor,"bookstore, archive, drugstore, airport_terminal, pharmacy",25939
10,240,indoor,"bookstore, archive, drugstore, pharmacy, airport_terminal",25939
11,264,indoor,"bookstore, archive, drugstore, pharmacy, airport_terminal",25939
12,288,indoor,"bookstore, archive, airport_terminal, drugstore, pharmacy",25939
13,312,indoor,"bookstore, archive, drugstore, airport_terminal, pharmacy",25939
14,336,indoor,"bookstore, archive, drugstore, airport_terminal, pharmacy",25939
15,360,indoor,"bookstore, archive, drugstore, airport_terminal, pharmacy",25939
16,384,indoor,"bookstore, archive, drugstore, pharmacy, airport_terminal",25939
17,408,indoor,"bookstore, archive, drugstore, pharmacy, airport_terminal",25939
18,432,indoor,"bookstore, archive, drugstore, airport_terminal, pharmacy",25939
19,456,indoor,"bookstore, archive, drugstore, airport_terminal, pharmacy",25939
20,480,indoor,"bookstore, archive, drugstore, airport_terminal, pharmacy",25939
21,504,indoor,"bookstore, archive, drugstore, airport_terminal, pharmacy",25939
22,528,outdoor,"bridge, ski_resort, viaduct, ice_floe, chalet",25939
23,552,outdoor,"motel, ski_resort, viaduct, bridge, railroad_track",25939
24,576,indoor,"booth/indoor, hospital, pharmacy, ice_cream_parlor, conference_center",25939
25,600,indoor,"booth/indoor, cemetery, hospital, pharmacy, conference_center",25939
26,624,indoor,"booth/indoor, cemetery, hospital, pharmacy, conference_center",25939
27,648,indoor,"booth/indoor, cemetery, conference_center, pharmacy, hospital",25939
28,672,indoor,"booth/indoor, cemetery, conference_center, hospital, pharmacy",25939
29,696,indoor,"booth/indoor, cemetery, conference_center, pharmacy, hospital",25939
30,720,indoor,"booth/indoor, conference_center, cemetery, hospital, pharmacy",25939
31,744,indoor,"booth/indoor, conference_center, cemetery, hospital, pharmacy",25939
32,768,indoor,"booth/indoor, cemetery, conference_center, hospital, pharmacy",25939
33,792,indoor,"booth/indoor, conference_center, cemetery, hospital, pharmacy",25939
34,816,indoor,"booth/indoor, cemetery, conference_center, hospital, pharmacy",25939
35,840,indoor,"booth/indoor, conference_center, ice_cream_parlor, museum/indoor, drugstore",25939
36,864,indoor,"museum/indoor, science_museum, discotheque, natural_history_museum, stage/indoor",25939
37,888,indoor,"museum/indoor, art_gallery, science_museum, clean_room, natural_history_museum",25939
38,912,indoor,"museum/indoor, science_museum, art_gallery, natural_history_museum, clean_room",25939
39,936,indoor,"museum/indoor, bow_window/indoor, art_gallery, archive, artists_loft",25939
40,960,indoor,"museum/indoor, bow_window/indoor, art_gallery, archive, nursery",25939
41,984,indoor,"bow_window/indoor, museum/indoor, archive, art_gallery, nursery",25939
42,1008,indoor,"museum/indoor, bow_window/indoor, nursery, dressing_room, art_gallery",25939
43,1032,indoor,"museum/indoor, discotheque, beauty_salon, science_museum, drugstore",25939
44,1056,indoor,"museum/indoor, discotheque, science_museum, beauty_salon, natural_history_museum",25939
45,1080,indoor,"museum/indoor, discotheque, nursery, science_museum, natural_history_museum",25939
46,1104,indoor,"discotheque, dressing_room, pub/indoor, bar, museum/indoor",25939
47,1128,indoor,"dressing_room, discotheque, pub/indoor, museum/indoor, bar",25939
48,1152,indoor,"dressing_room, discotheque, pub/indoor, bar, elevator/door",25939
49,1176,indoor,"discotheque, museum/indoor, beauty_salon, dressing_room, stage/indoor",25939
50,1200,indoor,"museum/indoor, art_gallery, natural_history_museum, science_museum, stage/indoor",25939
51,1224,indoor,"museum/indoor, art_gallery, discotheque, stage/indoor, natural_history_museum",25939
52,1248,indoor,"museum/indoor, art_gallery, natural_history_museum, science_museum, discotheque",25939
53,1272,indoor,"dressing_room, discotheque, museum/indoor, beauty_salon, music_studio",25939
54,1296,indoor,"dressing_room, discotheque, locker_room, beauty_salon, museum/indoor",25939
55,1320,indoor,"dressing_room, discotheque, locker_room, beauty_salon, museum/indoor",25939
56,1344,indoor,"museum/indoor, clean_room, discotheque, dressing_room, stage/indoor",25939
57,1368,indoor,"bowling_alley, discotheque, drugstore, bar, pharmacy",25939
58,1392,indoor,"discotheque, bowling_alley, bar, drugstore, beauty_salon",25939
59,1416,indoor,"drugstore, discotheque, pharmacy, bar, ice_cream_parlor",25939
60,1440,indoor,"locker_room, science_museum, natural_history_museum, museum/indoor, subway_station/platform",25939
61,1464,indoor,"locker_room, subway_station/platform, bookstore, discotheque, science_museum",25939
62,1488,indoor,"locker_room, discotheque, science_museum, museum/indoor, bookstore",25939
63,1512,indoor,"discotheque, museum/indoor, bowling_alley, locker_room, archive",25939
64,1536,indoor,"museum/indoor, discotheque, bowling_alley, science_museum, dressing_room",25939
65,1560,indoor,"museum/indoor, discotheque, dressing_room, beauty_salon, bowling_alley",25939
66,1584,indoor,"museum/indoor, discotheque, ice_shelf, dressing_room, science_museum",25939
67,1608,indoor,"museum/indoor, discotheque, dressing_room, beauty_salon, stage/indoor",25939
68,1632,indoor,"museum/indoor, dressing_room, discotheque, martial_arts_gym, ballroom",25939
69,1656,indoor,"discotheque, museum/indoor, dressing_room, beauty_salon, ballroom",25939
70,1680,indoor,"museum/indoor, dressing_room, clean_room, clothing_store, discotheque",25939
71,1704,indoor,"museum/indoor, dressing_room, martial_arts_gym, ballroom, art_gallery",25939
72,1728,indoor,"museum/indoor, dressing_room, martial_arts_gym, ballroom, art_gallery",25939
73,1752,indoor,"museum/indoor, dressing_room, martial_arts_gym, ballroom, natural_history_museum",25939
74,1776,indoor,"stage/indoor, museum/indoor, martial_arts_gym, dressing_room, discotheque",25939
75,1800,indoor,"museum/indoor, dressing_room, clean_room, shower, art_gallery",25939
76,1824,indoor,"discotheque, clean_room, biology_laboratory, chemistry_lab, dressing_room",25939
77,1848,outdoor,"playground, alley, street, residential_neighborhood, courtyard",25939
78,1872,outdoor,"courtyard, yard, alley, residential_neighborhood, street",25939
79,1896,outdoor,"residential_neighborhood, alley, courtyard, yard, street",25939
80,1920,outdoor,"alley, residential_neighborhood, courtyard, yard, street",25939
81,1944,outdoor,"courtyard, residential_neighborhood, alley, yard, street",25939
82,1968,outdoor,"playground, cemetery, carrousel, amusement_park, phone_booth",25939
83,1992,outdoor,"playground, auto_factory, amusement_park, assembly_line, carrousel",25939
84,2016,outdoor,"playground, amusement_park, arena/rodeo, carrousel, boardwalk",25939
85,2040,indoor,"bow_window/indoor, archive, bookstore, library/indoor, elevator/door",25939
86,2064,indoor,"bow_window/indoor, clean_room, airport_terminal, drugstore, locker_room",25939
87,2088,indoor,"playground, bookstore, kindergarden_classroom, archive, bamboo_forest",25939
88,2112,indoor,"bookstore, airport_terminal, archive, drugstore, coffee_shop",25939
89,2136,indoor,"bookstore, coffee_shop, kindergarden_classroom, airport_terminal, library/indoor",25939
90,2160,indoor,"bookstore, archive, coffee_shop, library/indoor, kindergarden_classroom",25939
91,2184,indoor,"bookstore, archive, kindergarden_classroom, coffee_shop, drugstore",25939
92,2208,indoor,"bookstore, airport_terminal, drugstore, archive, coffee_shop",25939
93,2232,indoor,"bookstore, archive, library/indoor, airport_terminal, phone_booth",25939
94,2256,indoor,"bookstore, archive, coffee_shop, library/indoor, phone_booth",25939
95,2280,indoor,"bow_window/indoor, artists_loft, dining_room, library/indoor, archive",25939
96,2304,indoor,"clean_room, locker_room, archive, bow_window/indoor, library/indoor",25939
97,2328,indoor,"clean_room, archive, bow_window/indoor, locker_room, library/indoor",25939
98,2352,indoor,"bow_window/indoor, clean_room, archive, library/indoor, hospital_room",25939
99,2376,indoor,"bow_window/indoor, clean_room, dining_room, artists_loft, sauna",25939
100,2400,indoor,"clean_room, dressing_room, locker_room, museum/indoor, archive",25939
101,2424,indoor,"clean_room, locker_room, dressing_room, archive, hospital_room",25939
102,2448,indoor,"clean_room, museum/indoor, dressing_room, archive, locker_room",25939
103,2472,indoor,"clean_room, dressing_room, museum/indoor, locker_room, archive",25939
104,2496,indoor,"clean_room, archive, locker_room, dressing_room, museum/indoor",25939
105,2520,indoor,"clean_room, locker_room, archive, operating_room, sauna",25939
106,2544,indoor,"clean_room, locker_room, dressing_room, chemistry_lab, archive",25939
107,2568,indoor,"clean_room, locker_room, classroom, dressing_room, chemistry_lab",25939
108,2592,indoor,"science_museum, ice_cream_parlor, coffee_shop, clean_room, museum/indoor",25939
109,2616,indoor,"ice_cream_parlor, science_museum, aquarium, chemistry_lab, coffee_shop",25939
110,2640,indoor,"science_museum, ice_cream_parlor, coffee_shop, clean_room, museum/indoor",25939
111,2664,indoor,"ice_cream_parlor, science_museum, coffee_shop, aquarium, museum/indoor",25939
112,2688,indoor,"clean_room, locker_room, chemistry_lab, physics_laboratory, dressing_room",25939
113,2712,indoor,"clean_room, physics_laboratory, chemistry_lab, locker_room, biology_laboratory",25939
114,2736,indoor,"clean_room, bowling_alley, subway_station/platform, locker_room, physics_laboratory",25939
115,2760,indoor,"clean_room, bowling_alley, stage/indoor, museum/indoor, subway_station/platform",25939
116,2784,indoor,"clean_room, museum/indoor, archive, chemistry_lab, dressing_room",25939
117,2808,indoor,"clean_room, museum/indoor, dressing_room, stage/indoor, art_gallery",25939
118,2832,indoor,"clean_room, museum/indoor, dressing_room, archive, art_gallery",25939
119,2856,indoor,"clean_room, museum/indoor, dressing_room, archive, art_gallery",25939
120,2880,indoor,"clean_room, dressing_room, museum/indoor, art_gallery, clothing_store",25939
121,2904,indoor,"clean_room, dressing_room, museum/indoor, locker_room, archive",25939
122,2928,indoor,"clean_room, museum/indoor, art_gallery, dressing_room, archive",25939
123,2952,indoor,"museum/indoor, clean_room, archive, art_gallery, science_museum",25939
124,2976,indoor,"clean_room, museum/indoor, dressing_room, chemistry_lab, art_gallery",25939
125,3000,indoor,"museum/indoor, clean_room, art_gallery, science_museum, stage/indoor",25939
126,3024,indoor,"museum/indoor, clean_room, art_gallery, science_museum, natural_history_museum",25939
127,3048,indoor,"clean_room, museum/indoor, clothing_store, art_gallery, dressing_room",25939
128,3072,indoor,"beauty_salon, coffee_shop, drugstore, pharmacy, booth/indoor",25939
129,3096,indoor,"beauty_salon, coffee_shop, drugstore, pharmacy, booth/indoor",25939
130,3120,indoor,"beauty_salon, booth/indoor, pharmacy, drugstore, ice_cream_parlor",25939
131,3144,indoor,"beauty_salon, booth/indoor, coffee_shop, drugstore, pharmacy",25939
132,3168,indoor,"beauty_salon, drugstore, reception, booth/indoor, office",25939
133,3192,indoor,"beauty_salon, drugstore, reception, booth/indoor, office",25939
134,3216,indoor,"beauty_salon, reception, drugstore, booth/indoor, office",25939
135,3240,indoor,"beauty_salon, reception, drugstore, booth/indoor, office",25939
136,3264,indoor,"beauty_salon, reception, booth/indoor, office, drugstore",25939
137,3288,indoor,"beauty_salon, reception, drugstore, booth/indoor, office",25939
138,3312,indoor,"beauty_salon, reception, office, booth/indoor, drugstore",25939
139,3336,indoor,"clean_room, museum/indoor, operating_room, locker_room, archive",25939
140,3360,indoor,"clean_room, dressing_room, museum/indoor, locker_room, art_gallery",25939
141,3384,indoor,"clean_room, museum/indoor, dressing_room, locker_room, art_gallery",25939
142,3408,indoor,"clean_room, dressing_room, locker_room, corridor, clothing_store",25939
143,3432,indoor,"clean_room, hospital_room, corridor, operating_room, archive",25939
144,3456,indoor,"clean_room, operating_room, hospital_room, dressing_room, corridor",25939
145,3480,indoor,"clean_room, dressing_room, dining_room, locker_room, art_studio",25939
146,3504,indoor,"clean_room, chemistry_lab, locker_room, physics_laboratory, classroom",25939
147,3528,indoor,"clean_room, dressing_room, dining_room, locker_room, art_studio",25939
148,3552,indoor,"dining_room, dressing_room, clean_room, restaurant, dining_hall",25939
149,3576,indoor,"clean_room, dining_room, dressing_room, museum/indoor, archive",25939
150,3600,indoor,"clean_room, archive, dressing_room, dining_room, museum/indoor",25939
151,3624,indoor,"clean_room, dining_room, dressing_room, archive, museum/indoor",25939
152,3648,indoor,"dining_room, dressing_room, clean_room, archive, restaurant",25939
153,3672,indoor,"dining_room, dressing_room, clean_room, restaurant, library/indoor",25939
154,3696,indoor,"attic, jail_cell, bedroom, bow_window/indoor, dorm_room",25939
155,3720,indoor,"attic, bedroom, jail_cell, dorm_room, alcove",25939
156,3744,indoor,"attic, bedroom, dorm_room, jail_cell, living_room",25939
157,3768,indoor,"bedroom, attic, clean_room, hotel_room, childs_room",25939
158,3792,indoor,"bedroom, clean_room, attic, operating_room, ballroom",25939
159,3816,indoor,"bedroom, clean_room, hospital_room, attic, nursery",25939
160,3840,indoor,"attic, bedroom, clean_room, hospital_room, hotel_room",25939
161,3864,indoor,"bedroom, attic, museum/indoor, living_room, clean_room",25939
162,3888,indoor,"clean_room, discotheque, museum/indoor, chemistry_lab, biology_laboratory",25939
163,3912,indoor,"boxing_ring, martial_arts_gym, museum/indoor, clean_room, airport_terminal",25939
164,3936,indoor,"martial_arts_gym, clean_room, boxing_ring, operating_room, florist_shop/indoor",25939
165,3960,indoor,"martial_arts_gym, boxing_ring, clean_room, museum/indoor, operating_room",25939
166,3984,indoor,"boxing_ring, martial_arts_gym, museum/indoor, florist_shop/indoor, clean_room",25939
167,4008,indoor,"martial_arts_gym, clean_room, boxing_ring, lake/natural, chemistry_lab",25939
168,4032,indoor,"clean_room, museum/indoor, art_gallery, operating_room, dressing_room",25939
169,4056,indoor,"corridor, artists_loft, bow_window/indoor, archive, entrance_hall",25939
170,4080,indoor,"clean_room, elevator/door, corridor, shower, locker_room",25939
171,4104,indoor,"martial_arts_gym, clean_room, boxing_ring, music_studio, bowling_alley",25939
172,4128,indoor,"martial_arts_gym, stage/indoor, boxing_ring, bowling_alley, clean_room",25939
173,4152,indoor,"clean_room, dressing_room, museum/indoor, chemistry_lab, nursery",25939
174,4176,indoor,"museum/indoor, dressing_room, clean_room, art_gallery, shower",25939
175,4200,indoor,"dressing_room, clean_room, shower, museum/indoor, bow_window/indoor",25939
176,4224,indoor,"museum/indoor, art_gallery, clean_room, artists_loft, bow_window/indoor",25939
177,4248,indoor,"nursery, bow_window/indoor, attic, jail_cell, bedroom",25939
178,4272,indoor,"clean_room, nursery, operating_room, museum/indoor, martial_arts_gym",25939
179,4296,indoor,"clean_room, operating_room, museum/indoor, martial_arts_gym, hospital_room",25939
180,4320,indoor,"clean_room, operating_room, hospital_room, archive, museum/indoor",25939
181,4344,indoor,"clean_room, operating_room, hospital_room, museum/indoor, archive",25939
182,4368,indoor,"clean_room, operating_room, museum/indoor, hospital_room, nursing_home",25939
183,4392,indoor,"clean_room, operating_room, museum/indoor, hospital_room, chemistry_lab",25939
184,4416,indoor,"clean_room, operating_room, museum/indoor, science_museum, hospital_room",25939
185,4440,indoor,"clean_room, operating_room, hospital_room, museum/indoor, archive",25939
186,4464,indoor,"clean_room, operating_room, museum/indoor, hospital_room, archive",25939
187,4488,indoor,"clean_room, operating_room, museum/indoor, hospital_room, martial_arts_gym",25939
188,4512,indoor,"clean_room, operating_room, hospital_room, museum/indoor, archive",25939
189,4536,indoor,"clean_room, operating_room, hospital_room, archive, martial_arts_gym",25939
190,4560,indoor,"clean_room, operating_room, hospital_room, museum/indoor, martial_arts_gym",25939
191,4584,indoor,"clean_room, martial_arts_gym, operating_room, dressing_room, museum/indoor",25939
192,4608,indoor,"clean_room, shower, bathroom, sauna, art_gallery",25939
193,4632,indoor,"clean_room, sauna, bathroom, locker_room, chemistry_lab",25939
194,4656,indoor,"clean_room, dressing_room, art_gallery, museum/indoor, chemistry_lab",25939
195,4680,indoor,"clean_room, locker_room, chemistry_lab, museum/indoor, science_museum",25939
196,4704,indoor,"clean_room, museum/indoor, chemistry_lab, science_museum, art_gallery",25939
197,4728,indoor,"clean_room, chemistry_lab, sauna, locker_room, biology_laboratory",25939
198,4752,indoor,"clean_room, operating_room, chemistry_lab, locker_room, museum/indoor",25939
199,4776,indoor,"clean_room, chemistry_lab, sauna, art_gallery, museum/indoor",25939
200,4800,indoor,"clean_room, sauna, locker_room, museum/indoor, chemistry_lab",25939
201,4824,indoor,"clean_room, sauna, museum/indoor, operating_room, locker_room",25939
202,4848,indoor,"clean_room, locker_room, sauna, museum/indoor, operating_room",25939
203,4872,indoor,"clean_room, operating_room, chemistry_lab, locker_room, sauna",25939
204,4896,indoor,"clean_room, operating_room, chemistry_lab, hospital_room, sauna",25939
205,4920,indoor,"clean_room, operating_room, chemistry_lab, museum/indoor, art_gallery",25939
206,4944,indoor,"clean_room, operating_room, hospital_room, sauna, museum/indoor",25939
207,4968,indoor,"clean_room, operating_room, sauna, hospital_room, chemistry_lab",25939
208,4992,indoor,"clean_room, operating_room, museum/indoor, art_gallery, sauna",25939
209,5016,indoor,"clean_room, operating_room, locker_room, art_gallery, museum/indoor",25939
210,5040,indoor,"clean_room, archive, art_gallery, natural_history_museum, museum/indoor",25939
211,5064,indoor,"clean_room, restaurant_kitchen, chemistry_lab, locker_room, archive",25939
212,5088,indoor,"clean_room, dressing_room, chemistry_lab, locker_room, archive",25939
213,5112,indoor,"clean_room, sauna, museum/indoor, operating_room, dressing_room",25939
214,5136,indoor,"clean_room, operating_room, museum/indoor, dressing_room, locker_room",25939
215,5160,indoor,"clean_room, operating_room, museum/indoor, science_museum, hospital_room",25939
216,5184,indoor,"clean_room, operating_room, museum/indoor, hospital_room, physics_laboratory",25939
217,5208,indoor,"clean_room, operating_room, martial_arts_gym, archive, boxing_ring",25939
218,5232,indoor,"clean_room, operating_room, restaurant_kitchen, archive, martial_arts_gym",25939
219,5256,indoor,"clean_room, operating_room, restaurant_kitchen, archive, hospital_room",25939
220,5280,indoor,"clean_room, operating_room, hospital_room, chemistry_lab, biology_laboratory",25939
221,5304,indoor,"clean_room, operating_room, hospital_room, martial_arts_gym, restaurant_kitchen",25939
222,5328,indoor,"clean_room, operating_room, martial_arts_gym, hospital_room, archive",25939
223,5352,indoor,"clean_room, operating_room, archive, museum/indoor, martial_arts_gym",25939
224,5376,indoor,"clean_room, operating_room, hospital_room, museum/indoor, martial_arts_gym",25939
225,5400,indoor,"clean_room, operating_room, hospital_room, archive, martial_arts_gym",25939
226,5424,indoor,"clean_room, operating_room, restaurant_kitchen, hospital_room, archive",25939
227,5448,indoor,"drugstore, archive, pharmacy, booth/indoor, museum/indoor",25939
228,5472,indoor,"archive, drugstore, pharmacy, museum/indoor, booth/indoor",25939
229,5496,indoor,"drugstore, archive, pharmacy, booth/indoor, museum/indoor",25939
230,5520,indoor,"drugstore, archive, pharmacy, booth/indoor, museum/indoor",25939
231,5544,indoor,"drugstore, archive, pharmacy, booth/indoor, classroom",25939
232,5568,indoor,"archive, drugstore, pharmacy, booth/indoor, museum/indoor",25939
233,5592,indoor,"drugstore, archive, pharmacy, museum/indoor, booth/indoor",25939
234,5616,indoor,"archive, drugstore, pharmacy, museum/indoor, classroom",25939
235,5640,indoor,"archive, drugstore, pharmacy, classroom, kindergarden_classroom",25939
236,5664,indoor,"archive, drugstore, pharmacy, museum/indoor, booth/indoor",25939
237,5688,indoor,"drugstore, archive, pharmacy, booth/indoor, classroom",25939
238,5712,indoor,"drugstore, archive, pharmacy, booth/indoor, classroom",25939
239,5736,indoor,"archive, drugstore, pharmacy, museum/indoor, classroom",25939
240,5760,indoor,"clean_room, archive, chemistry_lab, restaurant_kitchen, operating_room",25939
241,5784,indoor,"clean_room, restaurant_kitchen, operating_room, archive, sauna",25939
242,5808,indoor,"clean_room, restaurant_kitchen, operating_room, chemistry_lab, biology_laboratory",25939
243,5832,indoor,"clean_room, restaurant_kitchen, operating_room, martial_arts_gym, archive",25939
244,5856,indoor,"clean_room, restaurant_kitchen, operating_room, hospital_room, martial_arts_gym",25939
245,5880,indoor,"clean_room, archive, operating_room, martial_arts_gym, restaurant_kitchen",25939
246,5904,indoor,"clean_room, martial_arts_gym, archive, operating_room, dressing_room",25939
247,5928,indoor,"clean_room, operating_room, archive, hospital_room, dressing_room",25939
248,5952,indoor,"clean_room, operating_room, martial_arts_gym, archive, hospital_room",25939
249,5976,indoor,"clean_room, martial_arts_gym, boxing_ring, dressing_room, archive",25939
250,6000,indoor,"clean_room, archive, chemistry_lab, biology_laboratory, martial_arts_gym",25939
251,6024,indoor,"martial_arts_gym, clean_room, museum/indoor, boxing_ring, ballroom",25939
252,6048,indoor,"clean_room, dressing_room, hospital_room, operating_room, clothing_store",25939
253,6072,indoor,"clean_room, dressing_room, clothing_store, hospital_room, locker_room",25939
254,6096,indoor,"clean_room, dressing_room, clothing_store, hospital_room, chemistry_lab",25939
255,6120,indoor,"museum/indoor, clean_room, art_gallery, dressing_room, stage/indoor",25939
256,6144,indoor,"museum/indoor, clean_room, art_gallery, discotheque, stage/indoor",25939
257,6168,indoor,"clean_room, operating_room, chemistry_lab, physics_laboratory, biology_laboratory",25939
258,6192,indoor,"clean_room, operating_room, hospital_room, chemistry_lab, biology_laboratory",25939
259,6216,indoor,"clean_room, operating_room, chemistry_lab, biology_laboratory, hospital_room",25939
260,6240,indoor,"clean_room, operating_room, chemistry_lab, biology_laboratory, hospital_room",25939
261,6264,indoor,"clean_room, operating_room, chemistry_lab, physics_laboratory, biology_laboratory",25939
262,6288,indoor,"clean_room, operating_room, chemistry_lab, locker_room, hospital_room",25939
263,6312,indoor,"clean_room, operating_room, hospital_room, sauna, locker_room",25939
264,6336,indoor,"clean_room, operating_room, chemistry_lab, hospital_room, biology_laboratory",25939
265,6360,indoor,"clean_room, operating_room, hospital_room, locker_room, chemistry_lab",25939
266,6384,indoor,"clean_room, operating_room, hospital_room, dressing_room, chemistry_lab",25939
267,6408,indoor,"clean_room, chemistry_lab, restaurant_kitchen, biology_laboratory, dressing_room",25939
268,6432,indoor,"clean_room, dressing_room, restaurant_kitchen, hotel_room, beauty_salon",25939
269,6456,indoor,"clean_room, restaurant_kitchen, restaurant, operating_room, kitchen",25939
270,6480,indoor,"clean_room, restaurant_kitchen, operating_room, dressing_room, hospital_room",25939
271,6504,indoor,"clean_room, restaurant_kitchen, operating_room, dressing_room, hospital_room",25939
272,6528,indoor,"dressing_room, clean_room, restaurant_kitchen, sauna, locker_room",25939
273,6552,indoor,"clean_room, dressing_room, operating_room, hospital_room, hotel_room",25939
274,6576,indoor,"clean_room, dressing_room, restaurant_kitchen, restaurant, operating_room",25939
275,6600,indoor,"clean_room, restaurant_kitchen, dressing_room, chemistry_lab, biology_laboratory",25939
276,6624,indoor,"clean_room, restaurant_kitchen, chemistry_lab, dressing_room, kitchen",25939
277,6648,indoor,"clean_room, restaurant_kitchen, dressing_room, chemistry_lab, biology_laboratory",25939
278,6672,indoor,"clean_room, dressing_room, restaurant_kitchen, sauna, beauty_salon",25939
279,6696,indoor,"clean_room, dressing_room, restaurant_kitchen, chemistry_lab, biology_laboratory",25939
280,6720,indoor,"clean_room, dressing_room, chemistry_lab, restaurant_kitchen, biology_laboratory",25939
281,6744,indoor,"clean_room, restaurant_kitchen, dressing_room, kitchen, chemistry_lab",25939
282,6768,indoor,"clean_room, restaurant_kitchen, dressing_room, restaurant, kitchen",25939
283,6792,indoor,"clean_room, restaurant_kitchen, chemistry_lab, kitchen, operating_room",25939
284,6816,indoor,"clean_room, restaurant_kitchen, chemistry_lab, biology_laboratory, kitchen",25939
285,6840,indoor,"clean_room, restaurant_kitchen, dressing_room, kitchen, galley",25939
286,6864,indoor,"clean_room, restaurant_kitchen, kitchen, galley, biology_laboratory",25939
287,6888,indoor,"clean_room, restaurant_kitchen, biology_laboratory, dressing_room, assembly_line",25939
