,frame_num,environment,places,imdb_id
0,0,indoor,"basement, jail_cell, server_room, archive, art_gallery",45171
1,24,indoor,"jewelry_shop, nursery, gift_shop, museum/indoor, natural_history_museum",45171
2,48,indoor,"jewelry_shop, gift_shop, museum/indoor, flea_market/indoor, nursery",45171
3,72,indoor,"jewelry_shop, gift_shop, museum/indoor, candy_store, shoe_shop",45171
4,96,indoor,"jewelry_shop, gift_shop, candy_store, museum/indoor, beauty_salon",45171
5,120,indoor,"jewelry_shop, gift_shop, candy_store, beauty_salon, museum/indoor",45171
6,144,indoor,"jewelry_shop, gift_shop, candy_store, beauty_salon, pet_shop",45171
7,168,indoor,"jewelry_shop, gift_shop, candy_store, beauty_salon, pet_shop",45171
8,192,indoor,"candy_store, jewelry_shop, bakery/shop, ice_cream_parlor, gift_shop",45171
9,216,indoor,"ice_cream_parlor, kindergarden_classroom, bakery/shop, nursery, candy_store",45171
10,240,indoor,"motel, kindergarden_classroom, ice_cream_parlor, nursery, drugstore",45171
11,264,indoor,"motel, ice_cream_parlor, kindergarden_classroom, nursery, drugstore",45171
12,288,indoor,"motel, ice_cream_parlor, kindergarden_classroom, nursery, drugstore",45171
13,312,indoor,"motel, kindergarden_classroom, nursery, ice_cream_parlor, booth/indoor",45171
14,336,indoor,"motel, ice_cream_parlor, kindergarden_classroom, nursery, drugstore",45171
15,360,indoor,"motel, ice_cream_parlor, kindergarden_classroom, nursery, drugstore",45171
16,384,indoor,"kindergarden_classroom, booth/indoor, nursery, ice_cream_parlor, motel",45171
17,408,indoor,"ice_cream_parlor, kindergarden_classroom, booth/indoor, candy_store, nursery",45171
18,432,indoor,"ice_cream_parlor, motel, kindergarden_classroom, candy_store, nursery",45171
19,456,indoor,"ice_cream_parlor, motel, candy_store, kindergarden_classroom, nursery",45171
20,480,indoor,"ice_cream_parlor, motel, kindergarden_classroom, candy_store, nursery",45171
21,504,indoor,"ice_cream_parlor, motel, candy_store, kindergarden_classroom, fastfood_restaurant",45171
22,528,indoor,"ice_cream_parlor, motel, kindergarden_classroom, candy_store, nursery",45171
23,552,indoor,"ice_cream_parlor, kindergarden_classroom, nursery, motel, candy_store",45171
24,576,indoor,"booth/indoor, ice_cream_parlor, kindergarden_classroom, coffee_shop, nursery",45171
25,600,indoor,"booth/indoor, drugstore, pharmacy, beauty_salon, ice_cream_parlor",45171
26,624,indoor,"booth/indoor, drugstore, pharmacy, beauty_salon, ice_cream_parlor",45171
27,648,indoor,"drugstore, booth/indoor, pharmacy, beauty_salon, coffee_shop",45171
28,672,indoor,"drugstore, booth/indoor, pharmacy, beauty_salon, bookstore",45171
29,696,indoor,"drugstore, booth/indoor, pharmacy, beauty_salon, ice_cream_parlor",45171
30,720,indoor,"drugstore, booth/indoor, pharmacy, beauty_salon, ice_cream_parlor",45171
31,744,indoor,"drugstore, booth/indoor, pharmacy, beauty_salon, ice_cream_parlor",45171
32,768,indoor,"booth/indoor, drugstore, pharmacy, beauty_salon, ice_cream_parlor",45171
33,792,indoor,"booth/indoor, kindergarden_classroom, ice_cream_parlor, beauty_salon, pharmacy",45171
34,816,indoor,"booth/indoor, pharmacy, beauty_salon, drugstore, ice_cream_parlor",45171
35,840,indoor,"booth/indoor, pharmacy, beauty_salon, drugstore, ice_cream_parlor",45171
36,864,indoor,"booth/indoor, pharmacy, beauty_salon, drugstore, nursery",45171
37,888,indoor,"booth/indoor, pharmacy, beauty_salon, drugstore, ice_cream_parlor",45171
38,912,indoor,"booth/indoor, pharmacy, beauty_salon, drugstore, ice_cream_parlor",45171
39,936,indoor,"booth/indoor, pharmacy, beauty_salon, drugstore, ice_cream_parlor",45171
40,960,indoor,"booth/indoor, drugstore, beauty_salon, coffee_shop, pharmacy",45171
41,984,indoor,"booth/indoor, museum/indoor, kindergarden_classroom, drugstore, science_museum",45171
42,1008,indoor,"booth/indoor, drugstore, pharmacy, beauty_salon, coffee_shop",45171
43,1032,indoor,"booth/indoor, pharmacy, drugstore, beauty_salon, ice_cream_parlor",45171
44,1056,indoor,"booth/indoor, pharmacy, drugstore, beauty_salon, ice_cream_parlor",45171
45,1080,indoor,"booth/indoor, pharmacy, drugstore, beauty_salon, hospital",45171
46,1104,indoor,"booth/indoor, pharmacy, drugstore, beauty_salon, ice_cream_parlor",45171
47,1128,indoor,"booth/indoor, pharmacy, drugstore, beauty_salon, ice_cream_parlor",45171
48,1152,indoor,"booth/indoor, lecture_room, conference_center, science_museum, pharmacy",45171
49,1176,indoor,"booth/indoor, pharmacy, drugstore, hospital, hospital_room",45171
50,1200,indoor,"booth/indoor, pharmacy, hospital, drugstore, hospital_room",45171
51,1224,indoor,"booth/indoor, pharmacy, hospital, hospital_room, drugstore",45171
52,1248,indoor,"booth/indoor, pharmacy, drugstore, hospital, hospital_room",45171
53,1272,indoor,"booth/indoor, pharmacy, drugstore, hospital, hospital_room",45171
54,1296,indoor,"booth/indoor, pharmacy, drugstore, hospital, hospital_room",45171
55,1320,indoor,"booth/indoor, pharmacy, drugstore, hospital, hospital_room",45171
56,1344,indoor,"booth/indoor, pharmacy, drugstore, hospital, hospital_room",45171
57,1368,indoor,"booth/indoor, pharmacy, drugstore, kindergarden_classroom, hospital",45171
58,1392,indoor,"booth/indoor, pharmacy, drugstore, kindergarden_classroom, museum/indoor",45171
59,1416,indoor,"booth/indoor, pharmacy, drugstore, kindergarden_classroom, bookstore",45171
60,1440,indoor,"booth/indoor, pharmacy, drugstore, kindergarden_classroom, bookstore",45171
61,1464,indoor,"booth/indoor, pharmacy, drugstore, kindergarden_classroom, bookstore",45171
62,1488,indoor,"booth/indoor, pharmacy, drugstore, kindergarden_classroom, bookstore",45171
63,1512,indoor,"booth/indoor, pharmacy, drugstore, kindergarden_classroom, bookstore",45171
64,1536,indoor,"booth/indoor, pharmacy, drugstore, kindergarden_classroom, bookstore",45171
65,1560,indoor,"booth/indoor, pharmacy, drugstore, kindergarden_classroom, hospital",45171
66,1584,indoor,"booth/indoor, pharmacy, drugstore, kindergarden_classroom, bookstore",45171
67,1608,indoor,"booth/indoor, pharmacy, drugstore, kindergarden_classroom, bookstore",45171
68,1632,indoor,"booth/indoor, kindergarden_classroom, pharmacy, drugstore, bookstore",45171
69,1656,indoor,"booth/indoor, pharmacy, drugstore, kindergarden_classroom, lecture_room",45171
70,1680,indoor,"booth/indoor, pharmacy, drugstore, beauty_salon, coffee_shop",45171
71,1704,indoor,"booth/indoor, pharmacy, drugstore, beauty_salon, coffee_shop",45171
72,1728,indoor,"booth/indoor, pharmacy, drugstore, beauty_salon, coffee_shop",45171
73,1752,indoor,"booth/indoor, drugstore, pharmacy, kindergarden_classroom, beauty_salon",45171
74,1776,indoor,"booth/indoor, pharmacy, drugstore, beauty_salon, hospital",45171
75,1800,indoor,"booth/indoor, coffee_shop, ice_cream_parlor, kindergarden_classroom, beauty_salon",45171
76,1824,indoor,"booth/indoor, pharmacy, drugstore, ice_cream_parlor, coffee_shop",45171
77,1848,indoor,"booth/indoor, pharmacy, drugstore, hospital, ice_cream_parlor",45171
78,1872,indoor,"booth/indoor, drugstore, pharmacy, hospital, ice_cream_parlor",45171
79,1896,indoor,"booth/indoor, pharmacy, drugstore, hospital, ice_cream_parlor",45171
80,1920,indoor,"booth/indoor, drugstore, pharmacy, hospital, beauty_salon",45171
81,1944,indoor,"booth/indoor, pharmacy, drugstore, hospital, ice_cream_parlor",45171
82,1968,indoor,"booth/indoor, pharmacy, drugstore, hospital, ice_cream_parlor",45171
83,1992,indoor,"booth/indoor, pharmacy, drugstore, hospital, ice_cream_parlor",45171
84,2016,indoor,"booth/indoor, drugstore, ice_cream_parlor, pharmacy, kindergarden_classroom",45171
85,2040,indoor,"kindergarden_classroom, booth/indoor, nursery, ice_cream_parlor, coffee_shop",45171
86,2064,indoor,"nursery, kindergarden_classroom, pharmacy, ice_cream_parlor, drugstore",45171
87,2088,indoor,"nursery, kindergarden_classroom, drugstore, pharmacy, ice_cream_parlor",45171
88,2112,indoor,"nursery, kindergarden_classroom, ice_cream_parlor, drugstore, pharmacy",45171
89,2136,indoor,"nursery, kindergarden_classroom, pharmacy, drugstore, ice_cream_parlor",45171
90,2160,indoor,"nursery, kindergarden_classroom, drugstore, ice_cream_parlor, pharmacy",45171
91,2184,indoor,"nursery, kindergarden_classroom, ice_cream_parlor, pharmacy, drugstore",45171
92,2208,indoor,"nursery, ice_cream_parlor, booth/indoor, kindergarden_classroom, coffee_shop",45171
93,2232,indoor,"nursery, kindergarden_classroom, booth/indoor, ice_cream_parlor, coffee_shop",45171
94,2256,indoor,"motel, bowling_alley, drugstore, pharmacy, kindergarden_classroom",45171
95,2280,indoor,"motel, bowling_alley, drugstore, pharmacy, kindergarden_classroom",45171
96,2304,indoor,"motel, pharmacy, drugstore, bowling_alley, beauty_salon",45171
97,2328,indoor,"motel, pharmacy, drugstore, bowling_alley, beauty_salon",45171
98,2352,indoor,"kindergarden_classroom, nursery, motel, booth/indoor, classroom",45171
99,2376,indoor,"chemistry_lab, museum/indoor, drugstore, clean_room, pharmacy",45171
100,2400,indoor,"chemistry_lab, clean_room, mosque/outdoor, biology_laboratory, museum/indoor",45171
101,2424,indoor,"museum/indoor, stage/indoor, chemistry_lab, discotheque, clean_room",45171
102,2448,indoor,"ice_cream_parlor, pharmacy, drugstore, museum/indoor, booth/indoor",45171
103,2472,indoor,"booth/indoor, pharmacy, museum/indoor, hospital, hospital_room",45171
104,2496,indoor,"pharmacy, hospital, booth/indoor, hospital_room, drugstore",45171
105,2520,indoor,"pharmacy, booth/indoor, hospital, drugstore, hospital_room",45171
106,2544,indoor,"pharmacy, hospital, booth/indoor, drugstore, hospital_room",45171
107,2568,indoor,"pharmacy, hospital, booth/indoor, hospital_room, drugstore",45171
108,2592,indoor,"pharmacy, hospital, booth/indoor, hospital_room, drugstore",45171
109,2616,indoor,"booth/indoor, pharmacy, museum/indoor, natural_history_museum, drugstore",45171
110,2640,indoor,"pharmacy, booth/indoor, natural_history_museum, drugstore, museum/indoor",45171
111,2664,indoor,"pharmacy, booth/indoor, drugstore, museum/indoor, hospital",45171
112,2688,indoor,"pharmacy, drugstore, booth/indoor, hospital, hospital_room",45171
113,2712,indoor,"pharmacy, drugstore, booth/indoor, museum/indoor, natural_history_museum",45171
114,2736,indoor,"beauty_salon, dressing_room, office, veterinarians_office, art_gallery",45171
115,2760,indoor,"office, reception, nursery, beauty_salon, bow_window/indoor",45171
116,2784,indoor,"museum/indoor, art_gallery, beauty_salon, childs_room, nursery",45171
117,2808,indoor,"dressing_room, beauty_salon, museum/indoor, art_gallery, alcove",45171
118,2832,indoor,"beauty_salon, art_gallery, dressing_room, museum/indoor, bathroom",45171
119,2856,indoor,"beauty_salon, dressing_room, art_gallery, nursery, bathroom",45171
120,2880,indoor,"beauty_salon, art_studio, art_gallery, childs_room, artists_loft",45171
121,2904,indoor,"beauty_salon, art_studio, art_gallery, artists_loft, dressing_room",45171
122,2928,indoor,"reception, beauty_salon, office, nursing_home, art_studio",45171
123,2952,indoor,"beauty_salon, art_studio, art_school, art_gallery, artists_loft",45171
124,2976,indoor,"art_studio, beauty_salon, art_gallery, art_school, artists_loft",45171
125,3000,indoor,"art_studio, art_gallery, art_school, museum/indoor, office",45171
126,3024,indoor,"nursing_home, art_studio, art_gallery, art_school, beauty_salon",45171
127,3048,indoor,"nursing_home, beauty_salon, art_studio, art_gallery, reception",45171
128,3072,indoor,"dressing_room, nursery, beauty_salon, art_studio, nursing_home",45171
129,3096,indoor,"art_studio, art_gallery, nursery, art_school, artists_loft",45171
130,3120,indoor,"nursery, martial_arts_gym, nursing_home, childs_room, ballroom",45171
131,3144,indoor,"nursery, childs_room, art_studio, nursing_home, art_school",45171
132,3168,indoor,"beauty_salon, art_gallery, art_studio, dressing_room, reception",45171
133,3192,indoor,"reception, beauty_salon, art_gallery, art_studio, artists_loft",45171
134,3216,indoor,"reception, beauty_salon, childs_room, dressing_room, clothing_store",45171
135,3240,indoor,"childs_room, nursery, dressing_room, artists_loft, beauty_salon",45171
136,3264,indoor,"artists_loft, childs_room, art_gallery, nursery, dressing_room",45171
137,3288,indoor,"nursing_home, art_gallery, art_studio, childs_room, art_school",45171
138,3312,indoor,"childs_room, nursery, art_school, art_studio, nursing_home",45171
139,3336,indoor,"art_gallery, art_school, art_studio, nursing_home, lecture_room",45171
140,3360,indoor,"museum/indoor, art_gallery, nursery, bow_window/indoor, art_studio",45171
141,3384,indoor,"nursery, art_gallery, museum/indoor, lecture_room, church/indoor",45171
142,3408,indoor,"museum/indoor, art_gallery, bow_window/indoor, nursery, church/indoor",45171
143,3432,indoor,"museum/indoor, art_gallery, nursery, bow_window/indoor, church/indoor",45171
144,3456,indoor,"church/indoor, museum/indoor, stage/indoor, art_gallery, nursery",45171
145,3480,indoor,"museum/indoor, church/indoor, art_gallery, bow_window/indoor, stage/indoor",45171
146,3504,indoor,"museum/indoor, art_gallery, nursery, church/indoor, artists_loft",45171
147,3528,indoor,"church/indoor, museum/indoor, art_gallery, clothing_store, nursery",45171
148,3552,indoor,"church/indoor, museum/indoor, art_gallery, nursery, stage/indoor",45171
149,3576,indoor,"church/indoor, nursery, museum/indoor, childs_room, art_gallery",45171
150,3600,indoor,"museum/indoor, nursery, art_gallery, church/indoor, childs_room",45171
151,3624,indoor,"museum/indoor, church/indoor, art_gallery, bow_window/indoor, nursery",45171
152,3648,indoor,"church/indoor, museum/indoor, art_gallery, stage/indoor, bow_window/indoor",45171
153,3672,indoor,"art_gallery, museum/indoor, bow_window/indoor, church/indoor, nursery",45171
154,3696,indoor,"nursing_home, art_gallery, reception, museum/indoor, lecture_room",45171
155,3720,indoor,"museum/indoor, church/indoor, art_gallery, nursing_home, stage/indoor",45171
156,3744,indoor,"church/indoor, museum/indoor, stage/indoor, art_gallery, nursery",45171
157,3768,indoor,"beauty_salon, dressing_room, bathroom, shower, art_gallery",45171
158,3792,indoor,"beauty_salon, dressing_room, bathroom, shower, nursery",45171
159,3816,indoor,"shower, dressing_room, bathroom, sauna, beauty_salon",45171
160,3840,indoor,"beauty_salon, shower, bathroom, dressing_room, bow_window/indoor",45171
161,3864,indoor,"dressing_room, bathroom, shower, nursery, beauty_salon",45171
162,3888,indoor,"dressing_room, beauty_salon, shower, childs_room, bathroom",45171
163,3912,indoor,"dressing_room, shower, beauty_salon, bathroom, elevator/door",45171
164,3936,indoor,"discotheque, stage/indoor, banquet_hall, arena/performance, restaurant",45171
165,3960,indoor,"discotheque, stage/indoor, arena/performance, bar, banquet_hall",45171
166,3984,indoor,"discotheque, stage/indoor, banquet_hall, ballroom, bar",45171
167,4008,indoor,"discotheque, stage/indoor, bar, banquet_hall, restaurant",45171
168,4032,indoor,"discotheque, stage/indoor, arena/performance, ballroom, bar",45171
169,4056,indoor,"discotheque, stage/indoor, banquet_hall, ballroom, arena/performance",45171
170,4080,indoor,"discotheque, stage/indoor, arena/performance, ballroom, bar",45171
171,4104,indoor,"stage/indoor, discotheque, arena/performance, ballroom, bar",45171
172,4128,indoor,"dressing_room, shower, locker_room, bathroom, closet",45171
173,4152,indoor,"shower, bathroom, dressing_room, closet, locker_room",45171
174,4176,indoor,"shower, bathroom, dressing_room, discotheque, beauty_salon",45171
175,4200,indoor,"shower, bathroom, dressing_room, discotheque, beauty_salon",45171
176,4224,indoor,"shower, discotheque, bathroom, beauty_salon, dressing_room",45171
177,4248,indoor,"beauty_salon, dressing_room, shower, bathroom, discotheque",45171
178,4272,indoor,"dressing_room, shower, beauty_salon, bathroom, art_studio",45171
179,4296,indoor,"dressing_room, shower, beauty_salon, bathroom, sauna",45171
180,4320,indoor,"discotheque, dressing_room, beauty_salon, music_studio, stage/indoor",45171
181,4344,indoor,"elevator/door, sauna, stage/indoor, dressing_room, beauty_salon",45171
182,4368,indoor,"bow_window/indoor, elevator/door, barndoor, doorway/outdoor, sauna",45171
183,4392,indoor,"shopfront, ticket_booth, butchers_shop, beauty_salon, doorway/outdoor",45171
184,4416,indoor,"butchers_shop, shopfront, beauty_salon, clothing_store, booth/indoor",45171
185,4440,indoor,"clothing_store, booth/indoor, beauty_salon, elevator/door, locker_room",45171
186,4464,indoor,"elevator/door, elevator_lobby, sauna, locker_room, clothing_store",45171
187,4488,indoor,"elevator/door, elevator_lobby, doorway/outdoor, beauty_salon, clothing_store",45171
188,4512,indoor,"ticket_booth, elevator/door, beauty_salon, shopfront, doorway/outdoor",45171
189,4536,indoor,"ticket_booth, shopfront, beauty_salon, booth/indoor, elevator/door",45171
190,4560,indoor,"beauty_salon, elevator/door, ticket_booth, dressing_room, locker_room",45171
191,4584,indoor,"beauty_salon, locker_room, sauna, elevator/door, dressing_room",45171
192,4608,indoor,"beauty_salon, sauna, shower, locker_room, dressing_room",45171
193,4632,indoor,"shower, dressing_room, beauty_salon, bathroom, elevator/door",45171
194,4656,indoor,"dressing_room, shower, bathroom, beauty_salon, locker_room",45171
195,4680,indoor,"dressing_room, sauna, shower, beauty_salon, locker_room",45171
196,4704,indoor,"dressing_room, beauty_salon, shower, sauna, elevator/door",45171
197,4728,indoor,"beauty_salon, dressing_room, nursing_home, childs_room, dorm_room",45171
198,4752,indoor,"dressing_room, beauty_salon, hospital_room, dorm_room, nursing_home",45171
199,4776,indoor,"beauty_salon, dressing_room, hospital_room, nursing_home, childs_room",45171
200,4800,indoor,"beauty_salon, dressing_room, nursing_home, hospital_room, childs_room",45171
201,4824,indoor,"beauty_salon, dressing_room, ballroom, nursing_home, childs_room",45171
202,4848,indoor,"beauty_salon, dressing_room, nursing_home, hospital_room, jewelry_shop",45171
203,4872,indoor,"hospital_room, nursing_home, dressing_room, beauty_salon, clean_room",45171
204,4896,indoor,"beauty_salon, nursing_home, hospital_room, dressing_room, dorm_room",45171
205,4920,indoor,"beauty_salon, nursing_home, dressing_room, elevator_lobby, dorm_room",45171
206,4944,indoor,"beauty_salon, dressing_room, nursing_home, reception, hospital_room",45171
207,4968,indoor,"beauty_salon, dressing_room, nursing_home, reception, hospital_room",45171
208,4992,indoor,"beauty_salon, dressing_room, nursing_home, reception, jewelry_shop",45171
209,5016,indoor,"beauty_salon, dressing_room, nursing_home, reception, ice_cream_parlor",45171
210,5040,indoor,"beauty_salon, nursing_home, dressing_room, ice_cream_parlor, hospital_room",45171
211,5064,indoor,"beauty_salon, dressing_room, ice_cream_parlor, hospital_room, nursing_home",45171
212,5088,indoor,"beauty_salon, dressing_room, elevator_lobby, elevator/door, reception",45171
213,5112,indoor,"beauty_salon, dressing_room, reception, nursing_home, ice_cream_parlor",45171
214,5136,indoor,"beauty_salon, dressing_room, ice_cream_parlor, jewelry_shop, nursing_home",45171
215,5160,indoor,"beauty_salon, discotheque, art_gallery, dressing_room, stage/indoor",45171
216,5184,indoor,"stage/indoor, arena/performance, discotheque, television_studio, music_studio",45171
217,5208,indoor,"stage/indoor, arena/performance, discotheque, music_studio, television_studio",45171
218,5232,indoor,"dressing_room, bathroom, beauty_salon, elevator/door, shower",45171
219,5256,indoor,"dressing_room, elevator/door, beauty_salon, bathroom, shower",45171
220,5280,indoor,"dressing_room, elevator/door, ballroom, shower, sauna",45171
221,5304,indoor,"dressing_room, shower, beauty_salon, elevator/door, sauna",45171
222,5328,indoor,"dressing_room, elevator/door, shower, elevator_lobby, sauna",45171
223,5352,indoor,"dressing_room, elevator/door, shower, elevator_lobby, bathroom",45171
224,5376,indoor,"dressing_room, shower, bathroom, elevator/door, beauty_salon",45171
225,5400,indoor,"dressing_room, shower, bathroom, sauna, beauty_salon",45171
226,5424,indoor,"shower, bathroom, dressing_room, sauna, jacuzzi/indoor",45171
227,5448,indoor,"dressing_room, shower, bathroom, sauna, elevator/door",45171
228,5472,indoor,"shower, dressing_room, sauna, bathroom, beauty_salon",45171
229,5496,indoor,"beauty_salon, dressing_room, butchers_shop, stage/indoor, ballroom",45171
230,5520,indoor,"beauty_salon, dressing_room, television_studio, museum/indoor, art_gallery",45171
231,5544,indoor,"dressing_room, beauty_salon, sauna, museum/indoor, shower",45171
232,5568,indoor,"beauty_salon, dressing_room, jewelry_shop, bathroom, shower",45171
233,5592,indoor,"reception, butchers_shop, beauty_salon, dressing_room, hospital_room",45171
234,5616,indoor,"dressing_room, beauty_salon, biology_laboratory, hospital_room, butchers_shop",45171
235,5640,indoor,"dressing_room, beauty_salon, television_studio, science_museum, reception",45171
236,5664,indoor,"beauty_salon, television_studio, reception, jewelry_shop, dressing_room",45171
237,5688,indoor,"dressing_room, beauty_salon, reception, television_studio, office",45171
238,5712,indoor,"beauty_salon, reception, office, dressing_room, television_studio",45171
239,5736,indoor,"television_studio, reception, office, beauty_salon, elevator_lobby",45171
240,5760,indoor,"television_studio, reception, office, beauty_salon, elevator_lobby",45171
241,5784,indoor,"television_studio, reception, office, server_room, elevator_lobby",45171
242,5808,indoor,"beauty_salon, reception, office, dressing_room, elevator_lobby",45171
243,5832,indoor,"beauty_salon, office, reception, biology_laboratory, dressing_room",45171
244,5856,indoor,"beauty_salon, dressing_room, television_studio, office, reception",45171
245,5880,indoor,"bow_window/indoor, childs_room, playroom, nursery, stage/indoor",45171
246,5904,indoor,"bow_window/indoor, ballroom, elevator/door, stage/indoor, childs_room",45171
247,5928,indoor,"bow_window/indoor, stage/indoor, childs_room, living_room, beauty_salon",45171
248,5952,indoor,"conference_center, lecture_room, office, television_studio, stage/indoor",45171
249,5976,indoor,"stage/indoor, ballroom, beauty_salon, martial_arts_gym, conference_center",45171
250,6000,indoor,"stage/indoor, ballroom, martial_arts_gym, discotheque, beauty_salon",45171
251,6024,indoor,"beauty_salon, conference_center, television_studio, banquet_hall, reception",45171
252,6048,indoor,"beauty_salon, banquet_hall, ballroom, chemistry_lab, stage/indoor",45171
253,6072,indoor,"banquet_hall, dining_hall, beauty_salon, chemistry_lab, conference_center",45171
254,6096,indoor,"chemistry_lab, banquet_hall, nursing_home, conference_center, biology_laboratory",45171
255,6120,indoor,"beauty_salon, nursing_home, clean_room, biology_laboratory, chemistry_lab",45171
256,6144,indoor,"nursing_home, beauty_salon, banquet_hall, chemistry_lab, conference_center",45171
257,6168,indoor,"banquet_hall, beauty_salon, chemistry_lab, art_gallery, jewelry_shop",45171
258,6192,indoor,"nursing_home, chemistry_lab, conference_center, lecture_room, beauty_salon",45171
259,6216,indoor,"art_gallery, science_museum, ice_cream_parlor, bakery/shop, beauty_salon",45171
260,6240,indoor,"stage/indoor, television_studio, conference_center, lecture_room, nursing_home",45171
261,6264,indoor,"beauty_salon, stage/indoor, ballroom, dressing_room, bow_window/indoor",45171
262,6288,indoor,"dressing_room, bow_window/indoor, living_room, beauty_salon, stage/indoor",45171
263,6312,indoor,"shower, bathroom, sauna, jacuzzi/indoor, bow_window/indoor",45171
264,6336,indoor,"beauty_salon, bar, dressing_room, ice_cream_parlor, discotheque",45171
265,6360,indoor,"conference_center, television_studio, lecture_room, restaurant, beauty_salon",45171
266,6384,indoor,"beauty_salon, banquet_hall, restaurant, cafeteria, nursing_home",45171
267,6408,indoor,"reception, television_studio, conference_center, restaurant, beauty_salon",45171
268,6432,indoor,"nursing_home, reception, beauty_salon, conference_center, restaurant",45171
269,6456,indoor,"reception, beauty_salon, restaurant, conference_center, nursing_home",45171
270,6480,indoor,"beauty_salon, reception, ice_cream_parlor, television_studio, nursing_home",45171
271,6504,indoor,"beauty_salon, chemistry_lab, nursing_home, reception, ice_cream_parlor",45171
272,6528,indoor,"beauty_salon, television_studio, ice_cream_parlor, reception, restaurant",45171
273,6552,indoor,"martial_arts_gym, reception, chemistry_lab, booth/indoor, television_studio",45171
274,6576,indoor,"reception, television_studio, beauty_salon, conference_center, ice_cream_parlor",45171
275,6600,indoor,"beauty_salon, reception, television_studio, conference_center, chemistry_lab",45171
276,6624,indoor,"beauty_salon, reception, nursing_home, martial_arts_gym, chemistry_lab",45171
277,6648,indoor,"beauty_salon, nursing_home, reception, chemistry_lab, conference_center",45171
278,6672,indoor,"nursing_home, reception, beauty_salon, chemistry_lab, office",45171
279,6696,indoor,"nursing_home, chemistry_lab, reception, conference_center, booth/indoor",45171
280,6720,indoor,"nursing_home, beauty_salon, reception, television_studio, ice_cream_parlor",45171
281,6744,indoor,"beauty_salon, chemistry_lab, nursing_home, ice_cream_parlor, biology_laboratory",45171
282,6768,indoor,"ice_cream_parlor, nursing_home, chemistry_lab, restaurant, cafeteria",45171
283,6792,indoor,"reception, nursing_home, beauty_salon, ice_cream_parlor, television_studio",45171
284,6816,indoor,"reception, nursing_home, conference_center, television_studio, restaurant",45171
285,6840,indoor,"martial_arts_gym, nursing_home, reception, television_studio, chemistry_lab",45171
286,6864,indoor,"beauty_salon, nursing_home, chemistry_lab, reception, ice_cream_parlor",45171
287,6888,indoor,"beauty_salon, ice_cream_parlor, nursing_home, restaurant, reception",45171
