,frame_num,environment,places,imdb_id
1648,39552,indoor,"booth/indoor, beauty_salon, reception, butchers_shop, jewelry_shop",45171
1649,39576,indoor,"reception, booth/indoor, chemistry_lab, beauty_salon, conference_center",45171
1650,39600,indoor,"conference_center, reception, office, chemistry_lab, booth/indoor",45171
1651,39624,indoor,"television_studio, stage/indoor, discotheque, music_studio, ballroom",45171
1652,39648,indoor,"television_studio, stage/indoor, discotheque, music_studio, ballroom",45171
1653,39672,indoor,"television_studio, discotheque, stage/indoor, music_studio, orchestra_pit",45171
1654,39696,indoor,"restaurant, bar, conference_center, ice_cream_parlor, coffee_shop",45171
1655,39720,indoor,"chemistry_lab, ice_cream_parlor, beauty_salon, restaurant, bar",45171
1656,39744,indoor,"reception, chemistry_lab, office, science_museum, biology_laboratory",45171
1657,39768,indoor,"reception, office, jewelry_shop, biology_laboratory, chemistry_lab",45171
1658,39792,indoor,"office, reception, beauty_salon, dressing_room, chemistry_lab",45171
1659,39816,indoor,"butchers_shop, chemistry_lab, dressing_room, beauty_salon, biology_laboratory",45171
1660,39840,indoor,"clean_room, dressing_room, beauty_salon, chemistry_lab, office",45171
1661,39864,indoor,"chemistry_lab, clean_room, beauty_salon, biology_laboratory, dressing_room",45171
1662,39888,indoor,"clean_room, chemistry_lab, biology_laboratory, office, beauty_salon",45171
1663,39912,indoor,"office, television_studio, conference_center, clean_room, elevator_lobby",45171
1664,39936,indoor,"office, clean_room, nursing_home, locker_room, elevator/door",45171
1665,39960,indoor,"clean_room, office, museum/indoor, nursing_home, jewelry_shop",45171
1666,39984,indoor,"clean_room, office, locker_room, server_room, lecture_room",45171
1667,40008,indoor,"clean_room, butchers_shop, jewelry_shop, office, clothing_store",45171
1668,40032,indoor,"office, locker_room, conference_center, dressing_room, reception",45171
1669,40056,indoor,"jewelry_shop, locker_room, clothing_store, reception, clean_room",45171
1670,40080,indoor,"office, clean_room, office_cubicles, elevator/door, elevator_lobby",45171
1671,40104,indoor,"locker_room, clean_room, server_room, chemistry_lab, office",45171
1672,40128,indoor,"jewelry_shop, chemistry_lab, clean_room, nursery, biology_laboratory",45171
1673,40152,indoor,"jewelry_shop, clean_room, chemistry_lab, locker_room, nursery",45171
1674,40176,indoor,"clean_room, nursery, hospital_room, chemistry_lab, biology_laboratory",45171
1675,40200,indoor,"beauty_salon, hospital_room, nursery, playroom, childs_room",45171
1676,40224,indoor,"playroom, childs_room, nursery, beauty_salon, clothing_store",45171
1677,40248,indoor,"dressing_room, clothing_store, nursery, closet, shower",45171
1678,40272,indoor,"clothing_store, dressing_room, locker_room, butchers_shop, nursery",45171
1679,40296,indoor,"clothing_store, dressing_room, locker_room, stage/indoor, museum/indoor",45171
1680,40320,indoor,"dressing_room, clothing_store, locker_room, television_studio, shower",45171
1681,40344,indoor,"clothing_store, dressing_room, locker_room, museum/indoor, nursery",45171
1682,40368,indoor,"clothing_store, locker_room, dressing_room, nursery, stage/indoor",45171
1683,40392,indoor,"clothing_store, locker_room, dressing_room, butchers_shop, stage/indoor",45171
1684,40416,indoor,"clothing_store, dressing_room, locker_room, museum/indoor, nursery",45171
1685,40440,indoor,"clothing_store, dressing_room, locker_room, shower, stage/indoor",45171
1686,40464,indoor,"clothing_store, art_studio, dressing_room, lecture_room, nursery",45171
1687,40488,indoor,"art_studio, clothing_store, nursery, butchers_shop, art_school",45171
1688,40512,indoor,"locker_room, dressing_room, nursery, shower, closet",45171
1689,40536,indoor,"locker_room, dressing_room, shower, nursery, sauna",45171
1690,40560,indoor,"shower, dressing_room, locker_room, beauty_salon, bathroom",45171
1691,40584,indoor,"shower, sauna, locker_room, dressing_room, closet",45171
1692,40608,indoor,"dressing_room, shower, locker_room, closet, bathroom",45171
1693,40632,indoor,"nursery, playroom, childs_room, dressing_room, hospital_room",45171
1694,40656,indoor,"dressing_room, shower, clean_room, sauna, clothing_store",45171
1695,40680,indoor,"clean_room, hospital_room, beauty_salon, butchers_shop, dressing_room",45171
1696,40704,indoor,"beauty_salon, dressing_room, chemistry_lab, hospital_room, clean_room",45171
1697,40728,indoor,"dressing_room, beauty_salon, locker_room, clothing_store, martial_arts_gym",45171
1698,40752,indoor,"dressing_room, clean_room, hospital_room, beauty_salon, nursing_home",45171
1699,40776,indoor,"hospital_room, dressing_room, clean_room, chemistry_lab, nursing_home",45171
1700,40800,indoor,"dressing_room, beauty_salon, hospital_room, clean_room, nursery",45171
1701,40824,indoor,"dressing_room, beauty_salon, locker_room, clothing_store, clean_room",45171
1702,40848,indoor,"dressing_room, clean_room, hospital_room, locker_room, beauty_salon",45171
1703,40872,indoor,"hospital_room, dressing_room, clean_room, locker_room, beauty_salon",45171
1704,40896,indoor,"hospital_room, clean_room, dressing_room, locker_room, nursing_home",45171
1705,40920,indoor,"dressing_room, beauty_salon, locker_room, clothing_store, hospital_room",45171
1706,40944,indoor,"dressing_room, beauty_salon, hospital_room, clean_room, nursing_home",45171
1707,40968,indoor,"dressing_room, beauty_salon, hospital_room, clothing_store, clean_room",45171
1708,40992,indoor,"dressing_room, beauty_salon, locker_room, clothing_store, hospital_room",45171
1709,41016,indoor,"dressing_room, closet, clothing_store, locker_room, nursery",45171
1710,41040,indoor,"dressing_room, clothing_store, beauty_salon, hospital_room, closet",45171
1711,41064,indoor,"dressing_room, clothing_store, closet, beauty_salon, locker_room",45171
1712,41088,indoor,"dressing_room, locker_room, clothing_store, closet, beauty_salon",45171
1713,41112,indoor,"dressing_room, closet, clothing_store, beauty_salon, hospital_room",45171
1714,41136,indoor,"dressing_room, beauty_salon, clothing_store, closet, dorm_room",45171
1715,41160,indoor,"dressing_room, beauty_salon, clothing_store, locker_room, dorm_room",45171
1716,41184,indoor,"dressing_room, hospital_room, beauty_salon, clean_room, dorm_room",45171
1717,41208,indoor,"beauty_salon, dressing_room, hospital_room, clean_room, reception",45171
1718,41232,indoor,"beauty_salon, dressing_room, reception, clean_room, dorm_room",45171
1719,41256,indoor,"locker_room, closet, dressing_room, clothing_store, nursery",45171
1720,41280,indoor,"dressing_room, closet, locker_room, nursery, clothing_store",45171
1721,41304,indoor,"dressing_room, locker_room, nursery, closet, childs_room",45171
1722,41328,indoor,"dressing_room, locker_room, clean_room, elevator/door, beauty_salon",45171
1723,41352,indoor,"dressing_room, locker_room, elevator/door, beauty_salon, elevator_lobby",45171
1724,41376,indoor,"dressing_room, locker_room, beauty_salon, elevator/door, elevator_lobby",45171
1725,41400,indoor,"dressing_room, elevator/door, locker_room, beauty_salon, elevator_lobby",45171
1726,41424,indoor,"dressing_room, locker_room, beauty_salon, elevator/door, elevator_lobby",45171
1727,41448,indoor,"dressing_room, locker_room, clothing_store, clean_room, elevator/door",45171
1728,41472,indoor,"dressing_room, beauty_salon, clean_room, locker_room, chemistry_lab",45171
1729,41496,indoor,"clean_room, dressing_room, locker_room, chemistry_lab, biology_laboratory",45171
1730,41520,indoor,"locker_room, dressing_room, closet, clean_room, clothing_store",45171
1731,41544,indoor,"dressing_room, locker_room, closet, clothing_store, nursery",45171
1732,41568,indoor,"locker_room, closet, dressing_room, clean_room, clothing_store",45171
1733,41592,indoor,"dressing_room, closet, clothing_store, locker_room, nursery",45171
1734,41616,indoor,"dressing_room, closet, locker_room, shower, clothing_store",45171
1735,41640,indoor,"beauty_salon, shower, dressing_room, elevator/door, closet",45171
1736,41664,indoor,"shower, elevator/door, dressing_room, bathroom, locker_room",45171
1737,41688,indoor,"dressing_room, sauna, closet, locker_room, elevator/door",45171
1738,41712,indoor,"dressing_room, closet, clean_room, elevator/door, locker_room",45171
1739,41736,indoor,"dressing_room, closet, sauna, elevator/door, shower",45171
1740,41760,indoor,"elevator/door, dressing_room, closet, locker_room, shower",45171
1741,41784,indoor,"office, conference_center, chemistry_lab, dressing_room, television_studio",45171
1742,41808,indoor,"office, conference_center, television_studio, lecture_room, reception",45171
1743,41832,indoor,"closet, locker_room, dressing_room, shower, beauty_salon",45171
1744,41856,indoor,"closet, dressing_room, shower, locker_room, beauty_salon",45171
1745,41880,indoor,"closet, dressing_room, shower, locker_room, clothing_store",45171
1746,41904,indoor,"dressing_room, sauna, shower, beauty_salon, bathroom",45171
1747,41928,indoor,"dressing_room, closet, clothing_store, locker_room, shower",45171
1748,41952,indoor,"dressing_room, closet, locker_room, shower, nursery",45171
1749,41976,indoor,"dressing_room, beauty_salon, closet, shower, dorm_room",45171
1750,42000,indoor,"dressing_room, closet, shower, bathroom, locker_room",45171
1751,42024,indoor,"dressing_room, closet, clothing_store, locker_room, clean_room",45171
1752,42048,indoor,"closet, dressing_room, clothing_store, locker_room, nursery",45171
1753,42072,indoor,"dressing_room, clothing_store, closet, department_store, beauty_salon",45171
1754,42096,indoor,"clothing_store, dressing_room, closet, beauty_salon, department_store",45171
1755,42120,indoor,"dressing_room, clothing_store, beauty_salon, closet, jewelry_shop",45171
1756,42144,indoor,"dressing_room, clothing_store, elevator/door, clean_room, closet",45171
1757,42168,indoor,"dressing_room, elevator/door, clothing_store, locker_room, museum/indoor",45171
1758,42192,indoor,"dressing_room, elevator/door, clothing_store, closet, museum/indoor",45171
1759,42216,indoor,"closet, elevator/door, dressing_room, clothing_store, locker_room",45171
1760,42240,indoor,"dressing_room, elevator/door, shower, clothing_store, closet",45171
1761,42264,indoor,"dressing_room, beauty_salon, clothing_store, museum/indoor, shower",45171
1762,42288,indoor,"discotheque, stage/indoor, arena/performance, beauty_salon, dressing_room",45171
1763,42312,indoor,"discotheque, stage/indoor, dressing_room, ballroom, arena/performance",45171
1764,42336,indoor,"dressing_room, stage/indoor, ballroom, television_studio, music_studio",45171
1765,42360,indoor,"dressing_room, stage/indoor, clean_room, music_studio, discotheque",45171
1766,42384,indoor,"dressing_room, stage/indoor, discotheque, nursing_home, ballroom",45171
1767,42408,indoor,"dressing_room, clean_room, stage/indoor, music_studio, beauty_salon",45171
1768,42432,indoor,"stage/indoor, clean_room, dressing_room, music_studio, discotheque",45171
1769,42456,indoor,"stage/indoor, clean_room, music_studio, discotheque, dressing_room",45171
1770,42480,indoor,"stage/indoor, dressing_room, discotheque, butchers_shop, beauty_salon",45171
1771,42504,indoor,"stage/indoor, dressing_room, music_studio, arena/performance, beauty_salon",45171
1772,42528,indoor,"stage/indoor, music_studio, dressing_room, clean_room, arena/performance",45171
1773,42552,indoor,"stage/indoor, dressing_room, music_studio, clean_room, arena/performance",45171
1774,42576,indoor,"dressing_room, stage/indoor, clean_room, martial_arts_gym, music_studio",45171
1775,42600,indoor,"dressing_room, stage/indoor, music_studio, clean_room, beauty_salon",45171
1776,42624,indoor,"clean_room, stage/indoor, music_studio, nursing_home, dressing_room",45171
1777,42648,indoor,"nursing_home, clean_room, dressing_room, chemistry_lab, stage/indoor",45171
1778,42672,indoor,"dressing_room, beauty_salon, ballroom, martial_arts_gym, stage/indoor",45171
1779,42696,indoor,"dressing_room, stage/indoor, beauty_salon, ballroom, discotheque",45171
1780,42720,indoor,"dressing_room, clean_room, martial_arts_gym, stage/indoor, beauty_salon",45171
1781,42744,indoor,"martial_arts_gym, dressing_room, stage/indoor, ballroom, clean_room",45171
1782,42768,indoor,"dressing_room, butchers_shop, stage/indoor, clean_room, beauty_salon",45171
1783,42792,indoor,"butchers_shop, clean_room, chemistry_lab, beauty_salon, dressing_room",45171
1784,42816,indoor,"clean_room, butchers_shop, chemistry_lab, beauty_salon, hospital_room",45171
1785,42840,indoor,"clean_room, beauty_salon, chemistry_lab, stage/indoor, butchers_shop",45171
1786,42864,indoor,"clean_room, butchers_shop, beauty_salon, chemistry_lab, dressing_room",45171
1787,42888,indoor,"clean_room, butchers_shop, beauty_salon, dressing_room, stage/indoor",45171
1788,42912,indoor,"clean_room, beauty_salon, chemistry_lab, dressing_room, butchers_shop",45171
1789,42936,indoor,"clean_room, beauty_salon, butchers_shop, dressing_room, chemistry_lab",45171
1790,42960,indoor,"beauty_salon, dressing_room, stage/indoor, clean_room, clothing_store",45171
1791,42984,indoor,"beauty_salon, clean_room, dressing_room, stage/indoor, chemistry_lab",45171
1792,43008,indoor,"beauty_salon, clean_room, dressing_room, martial_arts_gym, stage/indoor",45171
1793,43032,indoor,"dressing_room, beauty_salon, clean_room, stage/indoor, clothing_store",45171
1794,43056,indoor,"beauty_salon, clean_room, dressing_room, stage/indoor, clothing_store",45171
1795,43080,indoor,"clean_room, dressing_room, butchers_shop, beauty_salon, clothing_store",45171
1796,43104,indoor,"dressing_room, clean_room, clothing_store, butchers_shop, beauty_salon",45171
1797,43128,indoor,"clean_room, dressing_room, clothing_store, locker_room, hospital_room",45171
1798,43152,indoor,"clean_room, dressing_room, locker_room, hospital_room, beauty_salon",45171
1799,43176,indoor,"dressing_room, clean_room, locker_room, hospital_room, martial_arts_gym",45171
1800,43200,indoor,"clean_room, chemistry_lab, dressing_room, clothing_store, biology_laboratory",45171
1801,43224,indoor,"clean_room, dressing_room, locker_room, beauty_salon, chemistry_lab",45171
1802,43248,indoor,"clean_room, beauty_salon, dressing_room, hospital_room, chemistry_lab",45171
1803,43272,indoor,"clean_room, beauty_salon, chemistry_lab, hospital_room, dressing_room",45171
1804,43296,indoor,"clean_room, beauty_salon, hospital_room, chemistry_lab, shower",45171
1805,43320,indoor,"clean_room, hospital_room, beauty_salon, dressing_room, locker_room",45171
1806,43344,indoor,"clean_room, hospital_room, locker_room, dressing_room, operating_room",45171
1807,43368,indoor,"clean_room, hospital_room, locker_room, operating_room, chemistry_lab",45171
1808,43392,indoor,"clean_room, butchers_shop, locker_room, hospital_room, operating_room",45171
1809,43416,indoor,"clean_room, locker_room, hospital_room, beauty_salon, dressing_room",45171
1810,43440,indoor,"dressing_room, beauty_salon, clothing_store, office, conference_center",45171
1811,43464,indoor,"dressing_room, beauty_salon, clothing_store, office, conference_center",45171
1812,43488,indoor,"clean_room, dressing_room, office, martial_arts_gym, office_cubicles",45171
1813,43512,indoor,"office, clean_room, elevator/door, office_cubicles, martial_arts_gym",45171
1814,43536,indoor,"dressing_room, elevator/door, office, elevator_lobby, martial_arts_gym",45171
1815,43560,indoor,"dressing_room, martial_arts_gym, office, reception, ballroom",45171
1816,43584,indoor,"office, dressing_room, martial_arts_gym, office_cubicles, conference_center",45171
1817,43608,indoor,"office, clean_room, martial_arts_gym, office_cubicles, dressing_room",45171
1818,43632,indoor,"office, office_cubicles, conference_center, lecture_room, hospital_room",45171
1819,43656,indoor,"clean_room, beauty_salon, dressing_room, chemistry_lab, office",45171
1820,43680,indoor,"beauty_salon, dressing_room, clothing_store, discotheque, stage/indoor",45171
1821,43704,indoor,"beauty_salon, dressing_room, clothing_store, office, conference_center",45171
1822,43728,indoor,"beauty_salon, dressing_room, clothing_store, conference_center, discotheque",45171
1823,43752,indoor,"beauty_salon, dressing_room, clothing_store, conference_center, discotheque",45171
1824,43776,indoor,"dressing_room, beauty_salon, clothing_store, discotheque, conference_center",45171
1825,43800,indoor,"dressing_room, beauty_salon, clothing_store, discotheque, conference_center",45171
1826,43824,indoor,"dressing_room, beauty_salon, clothing_store, discotheque, office",45171
1827,43848,indoor,"office, reception, office_cubicles, clean_room, hospital_room",45171
1828,43872,indoor,"office, clean_room, reception, office_cubicles, hospital_room",45171
1829,43896,indoor,"office, clean_room, reception, office_cubicles, hospital_room",45171
1830,43920,indoor,"office, office_cubicles, reception, clean_room, hospital_room",45171
1831,43944,indoor,"office, office_cubicles, reception, clean_room, hospital_room",45171
1832,43968,indoor,"beauty_salon, dressing_room, conference_center, clothing_store, discotheque",45171
1833,43992,indoor,"beauty_salon, dressing_room, clothing_store, conference_center, office",45171
1834,44016,indoor,"beauty_salon, dressing_room, clothing_store, conference_center, office",45171
1835,44040,indoor,"beauty_salon, dressing_room, discotheque, conference_center, stage/indoor",45171
1836,44064,indoor,"dressing_room, beauty_salon, conference_center, discotheque, clothing_store",45171
1837,44088,indoor,"beauty_salon, dressing_room, discotheque, stage/indoor, clothing_store",45171
1838,44112,indoor,"office, office_cubicles, clean_room, reception, hospital_room",45171
1839,44136,indoor,"clean_room, office, office_cubicles, conference_center, lecture_room",45171
1840,44160,indoor,"clean_room, martial_arts_gym, office, hospital_room, conference_center",45171
1841,44184,indoor,"clean_room, office, elevator/door, office_cubicles, elevator_lobby",45171
1842,44208,indoor,"beauty_salon, dressing_room, clothing_store, conference_center, discotheque",45171
1843,44232,indoor,"beauty_salon, dressing_room, discotheque, conference_center, office",45171
1844,44256,indoor,"clean_room, martial_arts_gym, hospital_room, nursery, conference_center",45171
1845,44280,indoor,"clean_room, stage/indoor, martial_arts_gym, museum/indoor, church/indoor",45171
1846,44304,indoor,"clean_room, stage/indoor, martial_arts_gym, hospital_room, locker_room",45171
1847,44328,indoor,"stage/indoor, locker_room, clothing_store, arena/performance, lecture_room",45171
1848,44352,indoor,"locker_room, stage/indoor, dressing_room, elevator/door, elevator_lobby",45171
1849,44376,indoor,"locker_room, dressing_room, lecture_room, elevator/door, classroom",45171
1850,44400,indoor,"locker_room, dressing_room, elevator/door, clean_room, lecture_room",45171
1851,44424,indoor,"dressing_room, elevator/door, locker_room, shower, elevator_lobby",45171
1852,44448,indoor,"locker_room, clean_room, elevator/door, dressing_room, butchers_shop",45171
1853,44472,indoor,"dressing_room, clean_room, locker_room, elevator/door, elevator_lobby",45171
1854,44496,indoor,"clean_room, locker_room, chemistry_lab, dressing_room, butchers_shop",45171
1855,44520,indoor,"clean_room, locker_room, elevator/door, dressing_room, lecture_room",45171
1856,44544,indoor,"clean_room, butchers_shop, locker_room, martial_arts_gym, dressing_room",45171
1857,44568,indoor,"clean_room, locker_room, art_gallery, chemistry_lab, elevator/door",45171
1858,44592,indoor,"clean_room, art_gallery, elevator/door, martial_arts_gym, locker_room",45171
1859,44616,indoor,"clean_room, martial_arts_gym, lecture_room, elevator/door, stage/indoor",45171
1860,44640,indoor,"clean_room, martial_arts_gym, lecture_room, dressing_room, chemistry_lab",45171
1861,44664,indoor,"martial_arts_gym, clean_room, biology_laboratory, chemistry_lab, locker_room",45171
1862,44688,indoor,"clean_room, martial_arts_gym, biology_laboratory, chemistry_lab, hospital_room",45171
1863,44712,indoor,"clean_room, locker_room, elevator/door, martial_arts_gym, elevator_lobby",45171
1864,44736,indoor,"clean_room, martial_arts_gym, hospital_room, nursing_home, elevator/door",45171
1865,44760,indoor,"clean_room, butchers_shop, hospital_room, nursing_home, chemistry_lab",45171
1866,44784,indoor,"clean_room, martial_arts_gym, lecture_room, art_gallery, nursing_home",45171
1867,44808,indoor,"clean_room, martial_arts_gym, locker_room, butchers_shop, hospital_room",45171
1868,44832,indoor,"clean_room, martial_arts_gym, nursing_home, dressing_room, stage/indoor",45171
1869,44856,indoor,"clean_room, butchers_shop, martial_arts_gym, chemistry_lab, art_gallery",45171
1870,44880,indoor,"clean_room, butchers_shop, martial_arts_gym, chemistry_lab, art_gallery",45171
1871,44904,indoor,"clean_room, butchers_shop, martial_arts_gym, locker_room, chemistry_lab",45171
1872,44928,indoor,"clean_room, martial_arts_gym, butchers_shop, locker_room, hospital_room",45171
1873,44952,indoor,"locker_room, clean_room, martial_arts_gym, elevator/door, dressing_room",45171
1874,44976,indoor,"clean_room, locker_room, elevator/door, martial_arts_gym, elevator_lobby",45171
1875,45000,indoor,"clean_room, locker_room, dressing_room, martial_arts_gym, elevator/door",45171
1876,45024,indoor,"clean_room, dressing_room, hospital_room, clothing_store, chemistry_lab",45171
1877,45048,indoor,"clean_room, dressing_room, hospital_room, operating_room, biology_laboratory",45171
1878,45072,indoor,"clean_room, dressing_room, art_gallery, biology_laboratory, television_studio",45171
1879,45096,indoor,"dressing_room, clean_room, locker_room, music_studio, chemistry_lab",45171
1880,45120,indoor,"clean_room, dressing_room, biology_laboratory, chemistry_lab, locker_room",45171
1881,45144,indoor,"clean_room, chemistry_lab, biology_laboratory, dressing_room, martial_arts_gym",45171
1882,45168,indoor,"clean_room, dressing_room, art_gallery, chemistry_lab, biology_laboratory",45171
1883,45192,indoor,"clean_room, dressing_room, hospital_room, operating_room, biology_laboratory",45171
1884,45216,indoor,"clean_room, dressing_room, martial_arts_gym, hospital_room, elevator/door",45171
1885,45240,indoor,"clean_room, dressing_room, hospital_room, elevator/door, locker_room",45171
1886,45264,indoor,"clean_room, dressing_room, locker_room, elevator/door, hospital_room",45171
1887,45288,indoor,"dressing_room, clean_room, locker_room, elevator/door, clothing_store",45171
1888,45312,indoor,"dressing_room, clean_room, locker_room, elevator/door, clothing_store",45171
1889,45336,indoor,"dressing_room, locker_room, clean_room, elevator/door, elevator_lobby",45171
1890,45360,indoor,"dressing_room, clothing_store, clean_room, beauty_salon, art_gallery",45171
1891,45384,indoor,"dressing_room, clothing_store, beauty_salon, clean_room, art_gallery",45171
1892,45408,indoor,"dressing_room, clothing_store, beauty_salon, clean_room, hospital_room",45171
1893,45432,indoor,"shower, elevator/door, bow_window/indoor, doorway/outdoor, barndoor",45171
1894,45456,indoor,"shower, bathroom, bow_window/indoor, sauna, elevator/door",45171
1895,45480,indoor,"shower, beauty_salon, bathroom, bow_window/indoor, elevator/door",45171
1896,45504,indoor,"bow_window/indoor, doorway/outdoor, barndoor, elevator/door, closet",45171
1897,45528,indoor,"dressing_room, beauty_salon, elevator_lobby, clean_room, bathroom",45171
1898,45552,indoor,"dressing_room, elevator/door, elevator_lobby, ballroom, stage/indoor",45171
1899,45576,indoor,"ballroom, stage/indoor, arena/performance, dressing_room, music_studio",45171
1900,45600,indoor,"clean_room, beauty_salon, dressing_room, television_studio, reception",45171
1901,45624,indoor,"clean_room, dressing_room, beauty_salon, television_studio, music_studio",45171
1902,45648,indoor,"beauty_salon, dressing_room, clean_room, television_studio, art_gallery",45171
1903,45672,indoor,"dressing_room, beauty_salon, clean_room, art_gallery, reception",45171
1904,45696,indoor,"dressing_room, lecture_room, beauty_salon, clean_room, reception",45171
1905,45720,indoor,"clean_room, beauty_salon, dressing_room, music_studio, biology_laboratory",45171
1906,45744,indoor,"elevator/door, doorway/outdoor, barndoor, shower, elevator_lobby",45171
1907,45768,indoor,"beauty_salon, shower, dressing_room, television_studio, bathroom",45171
1908,45792,indoor,"beauty_salon, shower, dressing_room, elevator/door, art_gallery",45171
1909,45816,indoor,"beauty_salon, shower, stage/indoor, dressing_room, art_gallery",45171
1910,45840,indoor,"beauty_salon, art_gallery, shower, stage/indoor, dressing_room",45171
1911,45864,indoor,"beauty_salon, stage/indoor, television_studio, shower, arena/performance",45171
1912,45888,indoor,"shower, elevator/door, conference_center, bathroom, beauty_salon",45171
1913,45912,indoor,"shower, bathroom, elevator/door, dressing_room, closet",45171
1914,45936,indoor,"shower, bathroom, closet, bow_window/indoor, alcove",45171
1915,45960,indoor,"shower, bathroom, bow_window/indoor, dressing_room, closet",45171
1916,45984,indoor,"clean_room, dressing_room, reception, lecture_room, beauty_salon",45171
1917,46008,indoor,"clean_room, dressing_room, reception, lecture_room, beauty_salon",45171
1918,46032,indoor,"shower, elevator/door, bow_window/indoor, bathroom, barndoor",45171
1919,46056,indoor,"shower, beauty_salon, bathroom, bow_window/indoor, elevator/door",45171
1920,46080,indoor,"dressing_room, clean_room, beauty_salon, reception, martial_arts_gym",45171
1921,46104,indoor,"clean_room, dressing_room, martial_arts_gym, hospital_room, elevator/door",45171
1922,46128,indoor,"clean_room, dressing_room, hospital_room, martial_arts_gym, lecture_room",45171
1923,46152,indoor,"clean_room, dressing_room, discotheque, beauty_salon, stage/indoor",45171
1924,46176,indoor,"shower, bow_window/indoor, bathroom, beauty_salon, elevator/door",45171
