,frame_num,environment,places,imdb_id
3543,85032,indoor,"clean_room, hospital_room, nursing_home, dressing_room, elevator/door",45171
3544,85056,indoor,"dressing_room, clean_room, sauna, locker_room, shower",45171
3545,85080,indoor,"dressing_room, locker_room, clean_room, sauna, elevator/door",45171
3546,85104,indoor,"clean_room, dressing_room, locker_room, elevator/door, elevator_lobby",45171
3547,85128,indoor,"dressing_room, clean_room, sauna, locker_room, elevator/door",45171
3548,85152,indoor,"clean_room, locker_room, hospital_room, hospital, sauna",45171
3549,85176,indoor,"clean_room, dressing_room, hospital_room, locker_room, shower",45171
3550,85200,indoor,"clean_room, dressing_room, hospital_room, sauna, elevator/door",45171
3551,85224,indoor,"clean_room, hospital_room, dressing_room, sauna, locker_room",45171
3552,85248,indoor,"dressing_room, clean_room, sauna, locker_room, hospital_room",45171
3553,85272,indoor,"clean_room, dressing_room, hospital_room, chemistry_lab, beauty_salon",45171
3554,85296,indoor,"locker_room, clean_room, dressing_room, sauna, elevator/door",45171
3555,85320,indoor,"clean_room, dressing_room, sauna, beauty_salon, locker_room",45171
3556,85344,indoor,"dressing_room, sauna, locker_room, clean_room, elevator/door",45171
3557,85368,indoor,"elevator/door, elevator_lobby, shower, bow_window/indoor, jail_cell",45171
3558,85392,indoor,"elevator/door, elevator_lobby, shower, jail_cell, bow_window/indoor",45171
3559,85416,indoor,"elevator/door, elevator_lobby, shower, jail_cell, bow_window/indoor",45171
3560,85440,indoor,"elevator/door, elevator_lobby, shower, bow_window/indoor, jail_cell",45171
3561,85464,indoor,"elevator/door, elevator_lobby, shower, bow_window/indoor, jail_cell",45171
3562,85488,indoor,"clean_room, locker_room, hospital_room, dressing_room, sauna",45171
3563,85512,indoor,"clean_room, locker_room, hospital_room, sauna, pharmacy",45171
3564,85536,indoor,"clean_room, locker_room, dressing_room, hospital_room, elevator/door",45171
3565,85560,indoor,"locker_room, sauna, hospital_room, clean_room, reception",45171
3566,85584,indoor,"clean_room, locker_room, dressing_room, elevator/door, sauna",45171
3567,85608,indoor,"clean_room, dressing_room, locker_room, sauna, chemistry_lab",45171
3568,85632,indoor,"clean_room, dressing_room, locker_room, sauna, chemistry_lab",45171
3569,85656,indoor,"clean_room, dressing_room, locker_room, sauna, museum/indoor",45171
3570,85680,indoor,"clean_room, dressing_room, locker_room, sauna, chemistry_lab",45171
3571,85704,indoor,"clean_room, dressing_room, locker_room, sauna, chemistry_lab",45171
3572,85728,indoor,"clean_room, dressing_room, locker_room, chemistry_lab, biology_laboratory",45171
3573,85752,indoor,"sauna, dressing_room, locker_room, bathroom, shower",45171
3574,85776,indoor,"dressing_room, bathroom, clean_room, shower, locker_room",45171
3575,85800,indoor,"clean_room, dressing_room, shower, bathroom, clothing_store",45171
3576,85824,indoor,"hospital_room, bow_window/indoor, elevator/door, elevator_lobby, hospital",45171
3577,85848,indoor,"bow_window/indoor, shower, elevator/door, dressing_room, elevator_lobby",45171
3578,85872,indoor,"office, elevator/door, bow_window/indoor, locker_room, hospital_room",45171
3579,85896,indoor,"bow_window/indoor, office, elevator/door, elevator_lobby, reception",45171
3580,85920,indoor,"bow_window/indoor, elevator/door, shower, elevator_lobby, locker_room",45171
3581,85944,indoor,"clean_room, elevator/door, elevator_lobby, dressing_room, locker_room",45171
3582,85968,indoor,"clean_room, dressing_room, elevator/door, locker_room, elevator_lobby",45171
3583,85992,indoor,"clean_room, dressing_room, elevator/door, elevator_lobby, beauty_salon",45171
3584,86016,indoor,"clean_room, dressing_room, elevator/door, beauty_salon, elevator_lobby",45171
3585,86040,indoor,"dressing_room, clean_room, clothing_store, bathroom, shower",45171
3586,86064,indoor,"clean_room, dressing_room, biology_laboratory, beauty_salon, office",45171
3587,86088,indoor,"conference_center, clean_room, office, lecture_room, hospital_room",45171
3588,86112,indoor,"locker_room, clean_room, sauna, dressing_room, elevator_lobby",45171
3589,86136,indoor,"dressing_room, clean_room, locker_room, beauty_salon, shower",45171
3590,86160,indoor,"dressing_room, clean_room, locker_room, elevator/door, sauna",45171
3591,86184,indoor,"dressing_room, clean_room, elevator/door, elevator_lobby, sauna",45171
3592,86208,indoor,"clean_room, dressing_room, elevator/door, locker_room, hospital_room",45171
3593,86232,indoor,"clean_room, dressing_room, locker_room, sauna, elevator/door",45171
3594,86256,indoor,"dressing_room, clean_room, elevator/door, locker_room, sauna",45171
3595,86280,indoor,"dressing_room, clean_room, shower, beauty_salon, clothing_store",45171
3596,86304,indoor,"clean_room, dressing_room, locker_room, hospital_room, sauna",45171
3597,86328,indoor,"dressing_room, clean_room, bathroom, shower, beauty_salon",45171
3598,86352,indoor,"dressing_room, beauty_salon, clean_room, sauna, bathroom",45171
3599,86376,indoor,"dressing_room, clean_room, sauna, bathroom, shower",45171
3600,86400,indoor,"dressing_room, clean_room, sauna, beauty_salon, bathroom",45171
3601,86424,indoor,"hospital_room, veterinarians_office, operating_room, beauty_salon, office",45171
3602,86448,indoor,"hospital_room, veterinarians_office, operating_room, clean_room, biology_laboratory",45171
3603,86472,indoor,"office, conference_center, lecture_room, hospital_room, television_studio",45171
3604,86496,indoor,"hospital_room, office, clean_room, operating_room, hospital",45171
3605,86520,indoor,"dressing_room, shower, elevator/door, elevator_lobby, beauty_salon",45171
3606,86544,indoor,"dressing_room, elevator/door, shower, elevator_lobby, beauty_salon",45171
3607,86568,indoor,"hospital_room, clean_room, dressing_room, operating_room, beauty_salon",45171
3608,86592,indoor,"hospital_room, hospital, operating_room, clean_room, veterinarians_office",45171
3609,86616,indoor,"hospital_room, office, clean_room, dressing_room, conference_center",45171
3610,86640,indoor,"beauty_salon, elevator/door, shower, elevator_lobby, veterinarians_office",45171
3611,86664,indoor,"elevator/door, elevator_lobby, shower, locker_room, dressing_room",45171
3612,86688,indoor,"office, bow_window/indoor, elevator/door, elevator_lobby, dressing_room",45171
3613,86712,indoor,"office, elevator_lobby, elevator/door, bow_window/indoor, office_cubicles",45171
3614,86736,indoor,"office, elevator_lobby, elevator/door, reception, bow_window/indoor",45171
3615,86760,indoor,"office, elevator/door, elevator_lobby, bow_window/indoor, reception",45171
3616,86784,indoor,"office, office_cubicles, hospital_room, bow_window/indoor, nursing_home",45171
3617,86808,indoor,"office, office_cubicles, nursing_home, conference_center, hospital_room",45171
3618,86832,indoor,"dressing_room, shower, sauna, clothing_store, elevator/door",45171
3619,86856,indoor,"shower, dressing_room, bathroom, sauna, elevator/door",45171
3620,86880,indoor,"dressing_room, shower, bathroom, clean_room, sauna",45171
3621,86904,indoor,"ice_cream_parlor, beauty_salon, bow_window/indoor, dressing_room, clean_room",45171
3622,86928,indoor,"dressing_room, beauty_salon, veterinarians_office, shower, clothing_store",45171
3623,86952,indoor,"dressing_room, beauty_salon, shower, clothing_store, ice_cream_parlor",45171
3624,86976,indoor,"dressing_room, beauty_salon, ice_cream_parlor, shower, clothing_store",45171
3625,87000,indoor,"bow_window/indoor, hospital_room, nursing_home, veterinarians_office, clean_room",45171
3626,87024,indoor,"hospital_room, office, bow_window/indoor, locker_room, elevator_lobby",45171
3627,87048,indoor,"hospital_room, nursing_home, office, hospital, bow_window/indoor",45171
3628,87072,indoor,"hospital_room, office, bow_window/indoor, nursing_home, hospital",45171
3629,87096,indoor,"hospital_room, elevator/door, dressing_room, hospital, nursing_home",45171
3630,87120,indoor,"hospital_room, elevator/door, nursing_home, hospital, elevator_lobby",45171
3631,87144,indoor,"hospital_room, locker_room, elevator/door, elevator_lobby, office",45171
3632,87168,indoor,"beauty_salon, dressing_room, shower, hospital_room, elevator/door",45171
3633,87192,indoor,"beauty_salon, hospital_room, elevator/door, shower, office",45171
3634,87216,indoor,"beauty_salon, bow_window/indoor, shower, elevator/door, dressing_room",45171
3635,87240,indoor,"beauty_salon, bow_window/indoor, balcony/interior, ice_cream_parlor, dressing_room",45171
3636,87264,indoor,"beauty_salon, office, dressing_room, bow_window/indoor, hospital_room",45171
3637,87288,indoor,"beauty_salon, bow_window/indoor, hospital_room, shower, office",45171
3638,87312,indoor,"beauty_salon, shower, ice_cream_parlor, dressing_room, bow_window/indoor",45171
3639,87336,indoor,"beauty_salon, hospital_room, office, nursing_home, clean_room",45171
3640,87360,indoor,"beauty_salon, dressing_room, bow_window/indoor, shower, hospital_room",45171
3641,87384,indoor,"dressing_room, beauty_salon, clean_room, ice_cream_parlor, chemistry_lab",45171
3642,87408,indoor,"dressing_room, ice_cream_parlor, beauty_salon, clean_room, chemistry_lab",45171
3643,87432,indoor,"ice_cream_parlor, beauty_salon, bakery/shop, dressing_room, chemistry_lab",45171
3644,87456,indoor,"ice_cream_parlor, beauty_salon, dressing_room, bakery/shop, coffee_shop",45171
3645,87480,indoor,"bow_window/indoor, shower, beauty_salon, dressing_room, bathroom",45171
3646,87504,indoor,"balcony/interior, bow_window/indoor, beauty_salon, shower, elevator/door",45171
3647,87528,indoor,"discotheque, stage/indoor, volcano, hot_spring, music_studio",45171
3648,87552,indoor,"elevator/door, art_gallery, bow_window/indoor, nursery, art_studio",45171
3649,87576,indoor,"elevator/door, art_gallery, bow_window/indoor, barndoor, nursery",45171
3650,87600,indoor,"nursery, elevator/door, classroom, bow_window/indoor, kindergarden_classroom",45171
3651,87624,indoor,"museum/indoor, archive, natural_history_museum, science_museum, art_gallery",45171
3652,87648,indoor,"department_store, science_museum, ticket_booth, drugstore, pharmacy",45171
3653,87672,indoor,"department_store, ticket_booth, science_museum, booth/indoor, drugstore",45171
3654,87696,indoor,"beauty_salon, ice_cream_parlor, drugstore, department_store, pharmacy",45171
3655,87720,indoor,"pharmacy, hospital, booth/indoor, beauty_salon, drugstore",45171
3656,87744,indoor,"booth/indoor, pharmacy, beauty_salon, ice_cream_parlor, drugstore",45171
3657,87768,indoor,"booth/indoor, pharmacy, beauty_salon, ice_cream_parlor, drugstore",45171
3658,87792,indoor,"booth/indoor, pharmacy, beauty_salon, ice_cream_parlor, hospital",45171
3659,87816,indoor,"nursery, ice_cream_parlor, beauty_salon, bakery/shop, kindergarden_classroom",45171
3660,87840,indoor,"elevator/door, elevator_lobby, museum/indoor, stage/indoor, sauna",45171
3661,87864,indoor,"wheat_field, elevator/door, elevator_lobby, corn_field, legislative_chamber",45171
3662,87888,indoor,"wheat_field, corn_field, jewelry_shop, elevator/door, museum/indoor",45171
3663,87912,indoor,"legislative_chamber, elevator/door, museum/indoor, lecture_room, wheat_field",45171
3664,87936,indoor,"wheat_field, elevator/door, museum/indoor, elevator_lobby, legislative_chamber",45171
3665,87960,indoor,"wheat_field, museum/indoor, legislative_chamber, elevator/door, stage/indoor",45171
3666,87984,indoor,"wheat_field, corn_field, legislative_chamber, elevator/door, conference_center",45171
3667,88008,indoor,"wheat_field, elevator/door, legislative_chamber, museum/indoor, corn_field",45171
3668,88032,outdoor,"wheat_field, legislative_chamber, corn_field, elevator/door, barndoor",45171
3669,88056,indoor,"wheat_field, legislative_chamber, elevator/door, barndoor, lecture_room",45171
3670,88080,indoor,"wheat_field, legislative_chamber, elevator/door, barndoor, church/indoor",45171
3671,88104,indoor,"wheat_field, museum/indoor, legislative_chamber, corn_field, elevator/door",45171
3672,88128,indoor,"wheat_field, legislative_chamber, museum/indoor, elevator/door, elevator_lobby",45171
3673,88152,indoor,"wheat_field, legislative_chamber, corn_field, conference_center, elevator/door",45171
3674,88176,outdoor,"wheat_field, corn_field, barndoor, elevator/door, stage/indoor",45171
3675,88200,outdoor,"wheat_field, corn_field, barndoor, stage/indoor, elevator/door",45171
3676,88224,outdoor,"wheat_field, corn_field, stage/indoor, rice_paddy, barndoor",45171
3677,88248,outdoor,"wheat_field, corn_field, stage/indoor, rice_paddy, field/wild",45171
3678,88272,indoor,"wheat_field, legislative_chamber, corn_field, conference_center, stage/indoor",45171
3679,88296,indoor,"wheat_field, lecture_room, legislative_chamber, corn_field, conference_center",45171
3680,88320,indoor,"wheat_field, legislative_chamber, conference_center, lecture_room, museum/indoor",45171
3681,88344,indoor,"wheat_field, legislative_chamber, stage/indoor, elevator/door, museum/indoor",45171
3682,88368,indoor,"wheat_field, museum/indoor, elevator/door, corn_field, legislative_chamber",45171
3683,88392,indoor,"wheat_field, elevator/door, stage/indoor, corn_field, bow_window/indoor",45171
3684,88416,indoor,"wheat_field, corn_field, stage/indoor, bow_window/indoor, elevator/door",45171
3685,88440,indoor,"kindergarden_classroom, auditorium, stage/indoor, discotheque, conference_center",45171
3686,88464,indoor,"kindergarden_classroom, auditorium, movie_theater/indoor, stage/indoor, martial_arts_gym",45171
3687,88488,indoor,"kindergarden_classroom, auditorium, stage/indoor, campus, martial_arts_gym",45171
3688,88512,indoor,"wheat_field, stage/indoor, corn_field, jewelry_shop, arena/performance",45171
3689,88536,indoor,"wheat_field, stage/indoor, corn_field, jewelry_shop, ballroom",45171
3690,88560,indoor,"wheat_field, stage/indoor, corn_field, jewelry_shop, museum/indoor",45171
3691,88584,indoor,"wheat_field, stage/indoor, corn_field, jewelry_shop, conference_center",45171
3692,88608,indoor,"stage/indoor, legislative_chamber, conference_center, wheat_field, jewelry_shop",45171
3693,88632,indoor,"stage/indoor, legislative_chamber, jewelry_shop, museum/indoor, wheat_field",45171
3694,88656,indoor,"stage/indoor, legislative_chamber, museum/indoor, conference_center, jewelry_shop",45171
3695,88680,indoor,"martial_arts_gym, kindergarden_classroom, locker_room, booth/indoor, art_gallery",45171
3696,88704,indoor,"martial_arts_gym, kindergarden_classroom, booth/indoor, locker_room, museum/indoor",45171
3697,88728,indoor,"martial_arts_gym, kindergarden_classroom, booth/indoor, locker_room, auditorium",45171
3698,88752,indoor,"kindergarden_classroom, martial_arts_gym, booth/indoor, auditorium, classroom",45171
3699,88776,indoor,"nursery, jewelry_shop, kindergarden_classroom, art_gallery, gift_shop",45171
3700,88800,indoor,"stage/indoor, museum/indoor, wheat_field, elevator/door, elevator_lobby",45171
3701,88824,indoor,"stage/indoor, wheat_field, elevator_lobby, elevator/door, museum/indoor",45171
3702,88848,indoor,"stage/indoor, legislative_chamber, jewelry_shop, conference_center, reception",45171
3703,88872,indoor,"jewelry_shop, wheat_field, museum/indoor, stage/indoor, elevator_lobby",45171
3704,88896,indoor,"wheat_field, aquarium, jewelry_shop, stage/indoor, corn_field",45171
3705,88920,indoor,"wheat_field, jewelry_shop, elevator/door, corn_field, aquarium",45171
3706,88944,indoor,"wheat_field, corn_field, elevator/door, jewelry_shop, stage/indoor",45171
3707,88968,indoor,"wheat_field, jewelry_shop, corn_field, elevator/door, shower",45171
3708,88992,indoor,"stage/indoor, elevator/door, museum/indoor, elevator_lobby, shower",45171
3709,89016,indoor,"stage/indoor, jewelry_shop, elevator_lobby, shower, museum/indoor",45171
3710,89040,indoor,"stage/indoor, jewelry_shop, legislative_chamber, wheat_field, museum/indoor",45171
3711,89064,indoor,"jewelry_shop, stage/indoor, wheat_field, museum/indoor, elevator_lobby",45171
3712,89088,indoor,"conference_center, legislative_chamber, office, lecture_room, conference_room",45171
3713,89112,indoor,"conference_center, lecture_room, legislative_chamber, conference_room, office",45171
3714,89136,indoor,"conference_center, legislative_chamber, conference_room, office, lecture_room",45171
3715,89160,indoor,"conference_center, legislative_chamber, office, conference_room, lecture_room",45171
3716,89184,indoor,"conference_center, legislative_chamber, office, lecture_room, conference_room",45171
3717,89208,indoor,"conference_center, stage/indoor, elevator_lobby, lecture_room, legislative_chamber",45171
3718,89232,indoor,"conference_center, museum/indoor, lecture_room, stage/indoor, legislative_chamber",45171
3719,89256,indoor,"conference_center, lecture_room, stage/indoor, legislative_chamber, elevator_lobby",45171
3720,89280,indoor,"conference_center, legislative_chamber, office, lecture_room, conference_room",45171
3721,89304,indoor,"legislative_chamber, conference_center, office, lecture_room, elevator_lobby",45171
3722,89328,indoor,"legislative_chamber, conference_center, office, lecture_room, elevator_lobby",45171
3723,89352,indoor,"legislative_chamber, conference_center, office, conference_room, lecture_room",45171
3724,89376,indoor,"legislative_chamber, conference_center, office, conference_room, lecture_room",45171
3725,89400,indoor,"legislative_chamber, conference_center, office, conference_room, lecture_room",45171
3726,89424,indoor,"legislative_chamber, conference_center, office, conference_room, lecture_room",45171
3727,89448,indoor,"legislative_chamber, conference_center, office, conference_room, reception",45171
3728,89472,indoor,"legislative_chamber, conference_center, office, conference_room, lecture_room",45171
3729,89496,indoor,"legislative_chamber, conference_center, office, conference_room, lecture_room",45171
3730,89520,indoor,"legislative_chamber, conference_center, office, conference_room, reception",45171
3731,89544,indoor,"legislative_chamber, conference_center, office, conference_room, lecture_room",45171
3732,89568,indoor,"legislative_chamber, conference_center, office, conference_room, lecture_room",45171
3733,89592,indoor,"legislative_chamber, conference_center, office, lecture_room, conference_room",45171
3734,89616,indoor,"legislative_chamber, conference_center, office, conference_room, lecture_room",45171
3735,89640,indoor,"legislative_chamber, conference_center, office, conference_room, lecture_room",45171
3736,89664,indoor,"legislative_chamber, conference_center, office, conference_room, lecture_room",45171
3737,89688,indoor,"legislative_chamber, conference_center, office, lecture_room, conference_room",45171
3738,89712,indoor,"legislative_chamber, conference_center, office, conference_room, lecture_room",45171
3739,89736,indoor,"legislative_chamber, conference_center, office, lecture_room, conference_room",45171
3740,89760,indoor,"legislative_chamber, conference_center, office, conference_room, lecture_room",45171
3741,89784,indoor,"office, reception, classroom, conference_center, lecture_room",45171
3742,89808,indoor,"office, classroom, lecture_room, reception, conference_center",45171
3743,89832,indoor,"reception, office, television_studio, classroom, conference_center",45171
3744,89856,indoor,"stage/indoor, wheat_field, legislative_chamber, jewelry_shop, museum/indoor",45171
3745,89880,indoor,"jewelry_shop, stage/indoor, wheat_field, museum/indoor, corn_field",45171
3746,89904,indoor,"wheat_field, legislative_chamber, stage/indoor, conference_center, jewelry_shop",45171
3747,89928,indoor,"legislative_chamber, wheat_field, stage/indoor, conference_center, museum/indoor",45171
3748,89952,indoor,"legislative_chamber, conference_center, museum/indoor, stage/indoor, lecture_room",45171
3749,89976,indoor,"legislative_chamber, stage/indoor, wheat_field, conference_center, museum/indoor",45171
3750,90000,indoor,"legislative_chamber, jewelry_shop, museum/indoor, church/indoor, bow_window/indoor",45171
3751,90024,indoor,"legislative_chamber, conference_center, jewelry_shop, elevator/door, museum/indoor",45171
3752,90048,indoor,"legislative_chamber, stage/indoor, conference_center, wheat_field, jewelry_shop",45171
3753,90072,indoor,"legislative_chamber, stage/indoor, conference_center, jewelry_shop, wheat_field",45171
3754,90096,indoor,"legislative_chamber, stage/indoor, conference_center, jewelry_shop, museum/indoor",45171
3755,90120,indoor,"legislative_chamber, stage/indoor, jewelry_shop, conference_center, museum/indoor",45171
3756,90144,indoor,"legislative_chamber, conference_center, stage/indoor, jewelry_shop, museum/indoor",45171
3757,90168,indoor,"legislative_chamber, conference_center, stage/indoor, wheat_field, museum/indoor",45171
3758,90192,indoor,"legislative_chamber, stage/indoor, conference_center, jewelry_shop, museum/indoor",45171
3759,90216,indoor,"legislative_chamber, conference_center, stage/indoor, jewelry_shop, lecture_room",45171
3760,90240,indoor,"museum/indoor, legislative_chamber, wheat_field, jewelry_shop, art_gallery",45171
3761,90264,indoor,"legislative_chamber, conference_center, stage/indoor, lecture_room, museum/indoor",45171
3762,90288,indoor,"legislative_chamber, stage/indoor, conference_center, museum/indoor, church/indoor",45171
3763,90312,indoor,"legislative_chamber, conference_center, stage/indoor, museum/indoor, lecture_room",45171
3764,90336,indoor,"legislative_chamber, jewelry_shop, museum/indoor, wheat_field, elevator_lobby",45171
3765,90360,indoor,"legislative_chamber, conference_center, museum/indoor, wheat_field, elevator_lobby",45171
3766,90384,indoor,"legislative_chamber, conference_center, wheat_field, lecture_room, stage/indoor",45171
3767,90408,indoor,"legislative_chamber, conference_center, museum/indoor, elevator_lobby, elevator/door",45171
3768,90432,indoor,"legislative_chamber, conference_center, museum/indoor, stage/indoor, reception",45171
3769,90456,indoor,"legislative_chamber, conference_center, lecture_room, museum/indoor, wheat_field",45171
3770,90480,indoor,"legislative_chamber, conference_center, stage/indoor, reception, lecture_room",45171
3771,90504,indoor,"jewelry_shop, legislative_chamber, stage/indoor, museum/indoor, wheat_field",45171
3772,90528,indoor,"legislative_chamber, museum/indoor, elevator_lobby, jewelry_shop, conference_center",45171
3773,90552,indoor,"legislative_chamber, museum/indoor, reception, jewelry_shop, elevator_lobby",45171
3774,90576,indoor,"legislative_chamber, museum/indoor, conference_center, stage/indoor, jewelry_shop",45171
3775,90600,indoor,"legislative_chamber, conference_center, museum/indoor, stage/indoor, reception",45171
3776,90624,indoor,"legislative_chamber, museum/indoor, conference_center, reception, elevator_lobby",45171
3777,90648,indoor,"legislative_chamber, museum/indoor, conference_center, reception, stage/indoor",45171
3778,90672,indoor,"kindergarden_classroom, art_gallery, museum/indoor, martial_arts_gym, gift_shop",45171
3779,90696,indoor,"art_gallery, kindergarden_classroom, museum/indoor, gift_shop, art_studio",45171
3780,90720,indoor,"art_gallery, kindergarden_classroom, museum/indoor, gift_shop, martial_arts_gym",45171
3781,90744,indoor,"art_gallery, kindergarden_classroom, museum/indoor, art_studio, martial_arts_gym",45171
3782,90768,indoor,"art_gallery, museum/indoor, kindergarden_classroom, art_studio, gift_shop",45171
3783,90792,indoor,"museum/indoor, bow_window/indoor, art_gallery, elevator_lobby, elevator/door",45171
3784,90816,indoor,"bow_window/indoor, museum/indoor, art_gallery, elevator_lobby, reception",45171
3785,90840,indoor,"elevator_lobby, elevator/door, bow_window/indoor, museum/indoor, lobby",45171
3786,90864,indoor,"museum/indoor, bow_window/indoor, art_gallery, elevator_lobby, elevator/door",45171
3787,90888,indoor,"museum/indoor, elevator/door, elevator_lobby, art_gallery, stage/indoor",45171
3788,90912,indoor,"museum/indoor, elevator_lobby, elevator/door, bow_window/indoor, art_gallery",45171
3789,90936,indoor,"museum/indoor, elevator_lobby, art_gallery, elevator/door, bow_window/indoor",45171
3790,90960,indoor,"museum/indoor, elevator_lobby, bow_window/indoor, elevator/door, art_gallery",45171
3791,90984,indoor,"museum/indoor, bow_window/indoor, elevator_lobby, elevator/door, stage/indoor",45171
3792,91008,indoor,"bow_window/indoor, elevator_lobby, elevator/door, museum/indoor, reception",45171
3793,91032,indoor,"museum/indoor, elevator_lobby, bow_window/indoor, elevator/door, reception",45171
3794,91056,indoor,"museum/indoor, bow_window/indoor, elevator_lobby, reception, elevator/door",45171
3795,91080,indoor,"bow_window/indoor, lobby, elevator_lobby, entrance_hall, airport_terminal",45171
3796,91104,indoor,"bow_window/indoor, lobby, entrance_hall, airport_terminal, clean_room",45171
3797,91128,indoor,"bow_window/indoor, lobby, entrance_hall, throne_room, living_room",45171
3798,91152,indoor,"bow_window/indoor, lobby, jewelry_shop, entrance_hall, dining_room",45171
3799,91176,indoor,"bow_window/indoor, lobby, jewelry_shop, reception, entrance_hall",45171
3800,91200,indoor,"bow_window/indoor, lobby, entrance_hall, elevator_lobby, reception",45171
3801,91224,indoor,"bow_window/indoor, lobby, entrance_hall, elevator_lobby, reception",45171
3802,91248,indoor,"bow_window/indoor, lobby, elevator_lobby, entrance_hall, reception",45171
3803,91272,indoor,"bow_window/indoor, lobby, entrance_hall, elevator_lobby, reception",45171
3804,91296,indoor,"bow_window/indoor, lobby, entrance_hall, elevator_lobby, reception",45171
3805,91320,indoor,"bow_window/indoor, lobby, elevator_lobby, entrance_hall, reception",45171
3806,91344,indoor,"bow_window/indoor, lobby, entrance_hall, elevator_lobby, reception",45171
3807,91368,indoor,"bow_window/indoor, lobby, entrance_hall, elevator_lobby, reception",45171
3808,91392,indoor,"bow_window/indoor, lobby, entrance_hall, elevator_lobby, reception",45171
