,frame_num,environment,places,imdb_id
5424,130176,indoor,"museum/indoor, elevator_lobby, art_gallery, artists_loft, elevator/door",45171
5425,130200,indoor,"lecture_room, conference_center, classroom, booth/indoor, office",45171
5426,130224,indoor,"lecture_room, classroom, conference_center, booth/indoor, beauty_salon",45171
5427,130248,indoor,"lecture_room, conference_center, classroom, booth/indoor, nursing_home",45171
5428,130272,indoor,"lecture_room, classroom, conference_center, booth/indoor, beauty_salon",45171
5429,130296,indoor,"lecture_room, beauty_salon, classroom, conference_center, stage/indoor",45171
5430,130320,indoor,"booth/indoor, lecture_room, conference_center, office, classroom",45171
5431,130344,indoor,"beauty_salon, booth/indoor, lecture_room, stage/indoor, clothing_store",45171
5432,130368,indoor,"lecture_room, booth/indoor, conference_center, classroom, beauty_salon",45171
5433,130392,indoor,"lecture_room, booth/indoor, classroom, beauty_salon, conference_center",45171
5434,130416,indoor,"lecture_room, conference_center, classroom, booth/indoor, beauty_salon",45171
5435,130440,indoor,"lecture_room, conference_center, booth/indoor, classroom, television_studio",45171
5436,130464,indoor,"lecture_room, conference_center, booth/indoor, classroom, beauty_salon",45171
5437,130488,indoor,"lecture_room, clean_room, conference_center, stage/indoor, beauty_salon",45171
5438,130512,indoor,"lecture_room, conference_center, classroom, martial_arts_gym, booth/indoor",45171
5439,130536,indoor,"martial_arts_gym, lecture_room, booth/indoor, conference_center, classroom",45171
5440,130560,indoor,"martial_arts_gym, lecture_room, classroom, conference_center, booth/indoor",45171
5441,130584,indoor,"clean_room, lecture_room, booth/indoor, hospital_room, conference_center",45171
5442,130608,indoor,"lecture_room, martial_arts_gym, classroom, clean_room, conference_center",45171
5443,130632,indoor,"lecture_room, booth/indoor, beauty_salon, classroom, conference_center",45171
5444,130656,indoor,"archive, lecture_room, beauty_salon, classroom, booth/indoor",45171
5445,130680,indoor,"beauty_salon, conference_center, lecture_room, archive, booth/indoor",45171
5446,130704,indoor,"lecture_room, booth/indoor, conference_center, classroom, television_studio",45171
5447,130728,indoor,"lecture_room, classroom, booth/indoor, conference_center, beauty_salon",45171
5448,130752,indoor,"lecture_room, classroom, art_school, beauty_salon, locker_room",45171
5449,130776,indoor,"lecture_room, conference_center, booth/indoor, classroom, beauty_salon",45171
5450,130800,indoor,"lecture_room, booth/indoor, conference_center, beauty_salon, classroom",45171
5451,130824,indoor,"lecture_room, classroom, conference_center, booth/indoor, nursing_home",45171
5452,130848,indoor,"lecture_room, conference_center, classroom, nursing_home, beauty_salon",45171
5453,130872,indoor,"lecture_room, locker_room, conference_center, classroom, elevator/door",45171
5454,130896,indoor,"martial_arts_gym, classroom, lecture_room, beauty_salon, hospital_room",45171
5455,130920,indoor,"lecture_room, classroom, conference_center, clean_room, martial_arts_gym",45171
5456,130944,indoor,"nursing_home, hospital_room, airplane_cabin, childs_room, playroom",45171
5457,130968,indoor,"hospital_room, nursing_home, airplane_cabin, nursery, bus_interior",45171
5458,130992,indoor,"nursing_home, hospital_room, conference_center, nursery, playroom",45171
5459,131016,indoor,"nursing_home, hospital_room, conference_center, auditorium, nursery",45171
5460,131040,indoor,"hospital_room, nursing_home, beauty_salon, hotel_room, airplane_cabin",45171
5461,131064,indoor,"nursing_home, hospital_room, beauty_salon, airplane_cabin, nursery",45171
5462,131088,indoor,"hospital_room, beauty_salon, nursing_home, home_theater, airplane_cabin",45171
5463,131112,indoor,"hospital_room, nursing_home, hotel_room, home_theater, beauty_salon",45171
5464,131136,indoor,"hospital_room, hotel_room, bedroom, childs_room, nursing_home",45171
5465,131160,indoor,"bedroom, childs_room, bedchamber, hotel_room, hospital_room",45171
5466,131184,indoor,"nursing_home, hospital_room, hotel_room, bedroom, childs_room",45171
5467,131208,indoor,"childs_room, bedroom, bedchamber, hospital_room, nursing_home",45171
5468,131232,indoor,"bedroom, hospital_room, childs_room, living_room, bedchamber",45171
5469,131256,indoor,"hospital_room, bedroom, hotel_room, bedchamber, childs_room",45171
5470,131280,indoor,"hospital_room, bedroom, hotel_room, bedchamber, childs_room",45171
5471,131304,indoor,"airplane_cabin, bedroom, hotel_room, bedchamber, hospital_room",45171
5472,131328,indoor,"airplane_cabin, hotel_room, bedchamber, bedroom, living_room",45171
5473,131352,indoor,"elevator_lobby, artists_loft, museum/indoor, ballroom, art_gallery",45171
5474,131376,indoor,"elevator_lobby, museum/indoor, artists_loft, locker_room, ballroom",45171
5475,131400,indoor,"elevator_lobby, museum/indoor, artists_loft, elevator/door, art_gallery",45171
5476,131424,indoor,"elevator_lobby, museum/indoor, artists_loft, art_gallery, elevator/door",45171
5477,131448,indoor,"museum/indoor, elevator_lobby, art_gallery, artists_loft, elevator/door",45171
5478,131472,indoor,"museum/indoor, elevator_lobby, art_gallery, artists_loft, elevator/door",45171
5479,131496,indoor,"museum/indoor, elevator_lobby, locker_room, art_gallery, artists_loft",45171
5480,131520,indoor,"museum/indoor, elevator_lobby, art_gallery, artists_loft, locker_room",45171
5481,131544,indoor,"museum/indoor, elevator_lobby, art_gallery, artists_loft, elevator/door",45171
5482,131568,indoor,"museum/indoor, elevator_lobby, art_gallery, artists_loft, elevator/door",45171
5483,131592,indoor,"museum/indoor, elevator_lobby, art_gallery, elevator/door, artists_loft",45171
5484,131616,indoor,"museum/indoor, art_gallery, elevator_lobby, artists_loft, elevator/door",45171
5485,131640,indoor,"museum/indoor, art_gallery, artists_loft, elevator_lobby, locker_room",45171
5486,131664,indoor,"museum/indoor, art_gallery, artists_loft, locker_room, elevator_lobby",45171
5487,131688,indoor,"museum/indoor, elevator_lobby, locker_room, art_gallery, sauna",45171
5488,131712,indoor,"museum/indoor, art_gallery, elevator_lobby, artists_loft, sauna",45171
5489,131736,indoor,"museum/indoor, sauna, elevator_lobby, locker_room, elevator/door",45171
5490,131760,indoor,"museum/indoor, art_gallery, artists_loft, elevator_lobby, locker_room",45171
5491,131784,indoor,"museum/indoor, art_gallery, elevator_lobby, elevator/door, artists_loft",45171
5492,131808,indoor,"museum/indoor, art_gallery, elevator_lobby, artists_loft, elevator/door",45171
5493,131832,indoor,"museum/indoor, art_gallery, elevator_lobby, artists_loft, locker_room",45171
5494,131856,indoor,"museum/indoor, elevator_lobby, art_gallery, locker_room, sauna",45171
5495,131880,indoor,"museum/indoor, art_gallery, elevator_lobby, artists_loft, elevator/door",45171
5496,131904,indoor,"museum/indoor, art_gallery, elevator_lobby, artists_loft, elevator/door",45171
5497,131928,indoor,"museum/indoor, art_gallery, elevator_lobby, artists_loft, elevator/door",45171
5498,131952,indoor,"museum/indoor, art_gallery, elevator_lobby, artists_loft, locker_room",45171
5499,131976,indoor,"museum/indoor, art_gallery, artists_loft, elevator_lobby, sauna",45171
5500,132000,indoor,"museum/indoor, art_gallery, artists_loft, sauna, elevator_lobby",45171
5501,132024,indoor,"museum/indoor, art_gallery, elevator_lobby, sauna, artists_loft",45171
5502,132048,indoor,"museum/indoor, art_gallery, artists_loft, elevator_lobby, locker_room",45171
5503,132072,indoor,"hospital_room, nursing_home, nursery, childs_room, reception",45171
5504,132096,indoor,"hospital_room, reception, childs_room, nursery, nursing_home",45171
5505,132120,indoor,"hospital_room, reception, childs_room, nursery, clean_room",45171
5506,132144,indoor,"hospital_room, reception, childs_room, nursery, nursing_home",45171
5507,132168,indoor,"reception, hospital_room, beauty_salon, nursery, childs_room",45171
5508,132192,indoor,"reception, hospital_room, beauty_salon, clean_room, nursery",45171
5509,132216,indoor,"reception, nursery, clean_room, hospital_room, childs_room",45171
5510,132240,indoor,"reception, beauty_salon, hospital_room, clean_room, office",45171
5511,132264,indoor,"hospital_room, reception, nursery, clean_room, nursing_home",45171
5512,132288,indoor,"reception, hospital_room, nursery, beauty_salon, childs_room",45171
5513,132312,indoor,"beauty_salon, sauna, dressing_room, hospital_room, locker_room",45171
5514,132336,indoor,"clean_room, dressing_room, hospital_room, locker_room, beauty_salon",45171
5515,132360,indoor,"dressing_room, locker_room, clean_room, hospital_room, sauna",45171
5516,132384,indoor,"butchers_shop, locker_room, dressing_room, clean_room, sauna",45171
5517,132408,indoor,"butchers_shop, clothing_store, dressing_room, beauty_salon, locker_room",45171
5518,132432,indoor,"butchers_shop, locker_room, clothing_store, dressing_room, beauty_salon",45171
5519,132456,indoor,"clothing_store, dressing_room, closet, fabric_store, butchers_shop",45171
5520,132480,indoor,"clothing_store, dressing_room, butchers_shop, clean_room, locker_room",45171
5521,132504,indoor,"clothing_store, dressing_room, closet, clean_room, butchers_shop",45171
5522,132528,indoor,"hospital_room, bedroom, hotel_room, bedchamber, childs_room",45171
5523,132552,indoor,"bedroom, hospital_room, hotel_room, bedchamber, childs_room",45171
5524,132576,indoor,"bedroom, hotel_room, hospital_room, bedchamber, living_room",45171
5525,132600,indoor,"hospital_room, bedroom, hotel_room, nursing_home, dorm_room",45171
5526,132624,indoor,"hospital_room, nursing_home, hotel_room, bedroom, bow_window/indoor",45171
5527,132648,indoor,"hospital_room, bedroom, nursing_home, hotel_room, bow_window/indoor",45171
5528,132672,indoor,"hospital_room, bedroom, hotel_room, bow_window/indoor, nursing_home",45171
5529,132696,indoor,"hotel_room, bedroom, hospital_room, nursing_home, dorm_room",45171
5530,132720,indoor,"bedroom, bedchamber, childs_room, hotel_room, berth",45171
5531,132744,indoor,"stage/indoor, conference_center, arena/performance, lecture_room, auditorium",45171
5532,132768,indoor,"conference_center, stage/indoor, lecture_room, discotheque, auditorium",45171
5533,132792,indoor,"conference_center, stage/indoor, lecture_room, arena/performance, discotheque",45171
5534,132816,indoor,"stage/indoor, conference_center, auditorium, arena/performance, lecture_room",45171
5535,132840,indoor,"stage/indoor, discotheque, arena/performance, clean_room, martial_arts_gym",45171
5536,132864,indoor,"jewelry_shop, clothing_store, gift_shop, museum/indoor, dressing_room",45171
5537,132888,indoor,"clothing_store, dressing_room, jewelry_shop, closet, clean_room",45171
5538,132912,indoor,"jewelry_shop, clothing_store, clean_room, dressing_room, closet",45171
5539,132936,indoor,"clothing_store, dressing_room, clean_room, locker_room, beauty_salon",45171
5540,132960,indoor,"dressing_room, clothing_store, stage/indoor, elevator/door, elevator_lobby",45171
5541,132984,indoor,"dressing_room, elevator/door, closet, clothing_store, clean_room",45171
5542,133008,indoor,"dressing_room, clothing_store, clean_room, closet, elevator/door",45171
5543,133032,indoor,"dressing_room, clothing_store, clean_room, closet, elevator/door",45171
5544,133056,indoor,"elevator/door, dressing_room, elevator_lobby, closet, sauna",45171
5545,133080,indoor,"shower, elevator/door, dressing_room, discotheque, locker_room",45171
5546,133104,indoor,"dressing_room, beauty_salon, bathroom, nursery, elevator/door",45171
5547,133128,indoor,"nursery, bathroom, beauty_salon, dressing_room, art_gallery",45171
5548,133152,indoor,"nursery, bathroom, dressing_room, beauty_salon, childs_room",45171
5549,133176,indoor,"dressing_room, closet, alcove, bathroom, bedroom",45171
5550,133200,indoor,"dressing_room, closet, shower, clothing_store, bathroom",45171
5551,133224,indoor,"dressing_room, clothing_store, closet, shower, locker_room",45171
5552,133248,indoor,"clothing_store, dressing_room, closet, beauty_salon, clean_room",45171
5553,133272,indoor,"clothing_store, dressing_room, museum/indoor, sauna, closet",45171
5554,133296,indoor,"clean_room, shower, closet, dressing_room, locker_room",45171
5555,133320,indoor,"dressing_room, shower, closet, clothing_store, locker_room",45171
5556,133344,indoor,"dressing_room, shower, closet, locker_room, clothing_store",45171
5557,133368,indoor,"dressing_room, shower, locker_room, clean_room, closet",45171
5558,133392,indoor,"dressing_room, shower, closet, locker_room, clothing_store",45171
5559,133416,indoor,"dressing_room, shower, closet, locker_room, sauna",45171
5560,133440,indoor,"reception, office, elevator_lobby, dressing_room, conference_center",45171
5561,133464,indoor,"conference_center, television_studio, dressing_room, art_gallery, clothing_store",45171
5562,133488,indoor,"elevator_lobby, elevator/door, clean_room, dressing_room, stage/indoor",45171
5563,133512,indoor,"dressing_room, elevator_lobby, elevator/door, conference_center, clothing_store",45171
5564,133536,indoor,"dressing_room, elevator/door, elevator_lobby, clothing_store, conference_center",45171
5565,133560,indoor,"dressing_room, elevator/door, clothing_store, elevator_lobby, shower",45171
5566,133584,indoor,"dressing_room, elevator/door, elevator_lobby, clothing_store, beauty_salon",45171
5567,133608,indoor,"dressing_room, elevator_lobby, clothing_store, elevator/door, beauty_salon",45171
5568,133632,indoor,"conference_center, elevator_lobby, elevator/door, reception, lecture_room",45171
5569,133656,indoor,"elevator/door, elevator_lobby, conference_center, office, television_studio",45171
5570,133680,indoor,"conference_center, lecture_room, office, dressing_room, beauty_salon",45171
5571,133704,indoor,"dressing_room, elevator/door, elevator_lobby, conference_center, office",45171
5572,133728,indoor,"dressing_room, elevator_lobby, elevator/door, shower, clothing_store",45171
5573,133752,indoor,"elevator_lobby, elevator/door, dressing_room, reception, lecture_room",45171
5574,133776,indoor,"elevator/door, bow_window/indoor, dressing_room, elevator_lobby, alcove",45171
5575,133800,indoor,"dressing_room, clothing_store, shower, closet, elevator/door",45171
5576,133824,indoor,"dressing_room, clean_room, clothing_store, alcove, elevator/door",45171
5577,133848,indoor,"dressing_room, elevator/door, clothing_store, closet, shower",45171
5578,133872,indoor,"dressing_room, elevator/door, shower, elevator_lobby, sauna",45171
5579,133896,indoor,"dressing_room, clothing_store, elevator/door, elevator_lobby, beauty_salon",45171
5580,133920,indoor,"dressing_room, clothing_store, office, office_cubicles, beauty_salon",45171
5581,133944,indoor,"elevator/door, elevator_lobby, clean_room, dressing_room, hospital_room",45171
5582,133968,indoor,"dressing_room, clothing_store, elevator/door, elevator_lobby, closet",45171
5583,133992,indoor,"dressing_room, elevator/door, elevator_lobby, clothing_store, beauty_salon",45171
5584,134016,indoor,"elevator_lobby, elevator/door, dressing_room, clean_room, reception",45171
5585,134040,indoor,"clean_room, office, reception, hospital_room, beauty_salon",45171
5586,134064,indoor,"office, beauty_salon, dressing_room, conference_center, lecture_room",45171
5587,134088,indoor,"clean_room, dressing_room, chemistry_lab, biology_laboratory, server_room",45171
5588,134112,indoor,"clean_room, beauty_salon, office, chemistry_lab, dressing_room",45171
5589,134136,indoor,"elevator/door, elevator_lobby, clean_room, artists_loft, art_gallery",45171
5590,134160,indoor,"dressing_room, office, conference_center, elevator/door, elevator_lobby",45171
5591,134184,indoor,"dressing_room, office, conference_center, clean_room, elevator/door",45171
5592,134208,indoor,"office, reception, beauty_salon, office_cubicles, chemistry_lab",45171
5593,134232,indoor,"office, reception, office_cubicles, beauty_salon, television_studio",45171
5594,134256,indoor,"office, reception, beauty_salon, office_cubicles, lecture_room",45171
5595,134280,indoor,"office, reception, beauty_salon, office_cubicles, chemistry_lab",45171
5596,134304,indoor,"office, beauty_salon, office_cubicles, reception, lecture_room",45171
5597,134328,indoor,"office, reception, beauty_salon, office_cubicles, art_gallery",45171
5598,134352,indoor,"reception, office, beauty_salon, office_cubicles, art_gallery",45171
5599,134376,indoor,"reception, office, beauty_salon, office_cubicles, art_gallery",45171
5600,134400,indoor,"beauty_salon, reception, office, office_cubicles, art_gallery",45171
5601,134424,indoor,"beauty_salon, office, reception, office_cubicles, art_gallery",45171
5602,134448,indoor,"beauty_salon, reception, office, office_cubicles, art_gallery",45171
5603,134472,indoor,"beauty_salon, office, reception, office_cubicles, chemistry_lab",45171
5604,134496,indoor,"office, beauty_salon, reception, office_cubicles, art_gallery",45171
5605,134520,indoor,"office, television_studio, conference_center, dressing_room, reception",45171
5606,134544,indoor,"office, television_studio, conference_center, reception, beauty_salon",45171
5607,134568,indoor,"conference_center, office, television_studio, legislative_chamber, reception",45171
5608,134592,indoor,"beauty_salon, office, reception, art_gallery, office_cubicles",45171
5609,134616,indoor,"beauty_salon, office, reception, office_cubicles, art_gallery",45171
5610,134640,indoor,"beauty_salon, reception, office, art_gallery, office_cubicles",45171
5611,134664,indoor,"reception, beauty_salon, office, office_cubicles, art_gallery",45171
5612,134688,indoor,"beauty_salon, office, reception, office_cubicles, dressing_room",45171
5613,134712,indoor,"beauty_salon, office, reception, office_cubicles, art_gallery",45171
5614,134736,indoor,"dressing_room, clean_room, television_studio, office, conference_center",45171
5615,134760,indoor,"dressing_room, television_studio, art_gallery, clean_room, beauty_salon",45171
5616,134784,indoor,"office, television_studio, reception, conference_center, dressing_room",45171
5617,134808,indoor,"dressing_room, television_studio, office, elevator_lobby, conference_center",45171
5618,134832,indoor,"conference_center, television_studio, office, reception, conference_room",45171
5619,134856,indoor,"conference_center, office, television_studio, reception, legislative_chamber",45171
5620,134880,indoor,"conference_center, television_studio, office, reception, legislative_chamber",45171
5621,134904,indoor,"conference_center, television_studio, office, reception, legislative_chamber",45171
5622,134928,indoor,"conference_center, elevator/door, elevator_lobby, dressing_room, lecture_room",45171
5623,134952,indoor,"conference_center, dressing_room, lecture_room, elevator/door, elevator_lobby",45171
5624,134976,indoor,"elevator/door, elevator_lobby, office, conference_center, dressing_room",45171
5625,135000,indoor,"dressing_room, clean_room, chemistry_lab, biology_laboratory, reception",45171
5626,135024,indoor,"dressing_room, elevator_lobby, elevator/door, conference_center, office",45171
5627,135048,indoor,"reception, office, hospital_room, biology_laboratory, nursing_home",45171
5628,135072,indoor,"reception, office, biology_laboratory, hospital_room, art_gallery",45171
5629,135096,indoor,"reception, hospital_room, beauty_salon, biology_laboratory, office",45171
5630,135120,indoor,"closet, clothing_store, dressing_room, clean_room, bow_window/indoor",45171
5631,135144,indoor,"clean_room, dressing_room, beauty_salon, clothing_store, hotel_room",45171
5632,135168,indoor,"lecture_room, alcove, stage/indoor, reception, conference_center",45171
5633,135192,indoor,"lecture_room, alcove, stage/indoor, elevator/door, conference_center",45171
5634,135216,indoor,"lecture_room, alcove, elevator/door, stage/indoor, conference_center",45171
5635,135240,indoor,"alcove, lecture_room, conference_center, stage/indoor, elevator/door",45171
5636,135264,indoor,"alcove, lecture_room, elevator/door, conference_center, attic",45171
5637,135288,indoor,"alcove, elevator/door, lecture_room, bow_window/indoor, reception",45171
5638,135312,indoor,"alcove, elevator/door, lecture_room, bow_window/indoor, reception",45171
5639,135336,indoor,"alcove, elevator/door, lecture_room, bow_window/indoor, office",45171
5640,135360,indoor,"alcove, elevator/door, reception, elevator_lobby, office",45171
5641,135384,indoor,"stage/indoor, discotheque, ballroom, arena/performance, art_gallery",45171
5642,135408,indoor,"museum/indoor, fountain, chemistry_lab, bow_window/indoor, science_museum",45171
5643,135432,indoor,"living_room, bow_window/indoor, dining_room, artists_loft, alcove",45171
5644,135456,indoor,"living_room, bow_window/indoor, dining_room, artists_loft, alcove",45171
5645,135480,indoor,"living_room, bow_window/indoor, dining_room, artists_loft, waiting_room",45171
5646,135504,indoor,"living_room, bow_window/indoor, dining_room, artists_loft, banquet_hall",45171
5647,135528,indoor,"living_room, dining_room, alcove, childs_room, bedchamber",45171
5648,135552,indoor,"bow_window/indoor, dining_room, living_room, artists_loft, entrance_hall",45171
5649,135576,indoor,"bow_window/indoor, dining_room, living_room, artists_loft, alcove",45171
5650,135600,indoor,"bow_window/indoor, dining_room, living_room, artists_loft, alcove",45171
5651,135624,indoor,"bow_window/indoor, dining_room, living_room, artists_loft, alcove",45171
5652,135648,indoor,"bow_window/indoor, living_room, dining_room, artists_loft, playroom",45171
5653,135672,indoor,"dining_room, bow_window/indoor, living_room, artists_loft, dining_hall",45171
5654,135696,indoor,"dining_room, bow_window/indoor, artists_loft, sauna, home_office",45171
5655,135720,indoor,"bow_window/indoor, dining_room, artists_loft, bathroom, dressing_room",45171
5656,135744,indoor,"dining_room, artists_loft, dressing_room, bow_window/indoor, living_room",45171
5657,135768,indoor,"bathroom, shower, dressing_room, alcove, art_gallery",45171
5658,135792,indoor,"clean_room, dressing_room, nursery, locker_room, closet",45171
5659,135816,indoor,"dressing_room, beauty_salon, hospital_room, clean_room, operating_room",45171
5660,135840,indoor,"clean_room, beauty_salon, museum/indoor, dressing_room, artists_loft",45171
5661,135864,indoor,"beauty_salon, clean_room, dressing_room, hospital_room, jewelry_shop",45171
5662,135888,indoor,"elevator/door, dressing_room, closet, locker_room, barndoor",45171
5663,135912,indoor,"elevator/door, dressing_room, closet, locker_room, elevator_lobby",45171
5664,135936,indoor,"elevator/door, dressing_room, locker_room, closet, elevator_lobby",45171
5665,135960,indoor,"elevator/door, dressing_room, elevator_lobby, locker_room, shower",45171
5666,135984,indoor,"elevator/door, barndoor, elevator_lobby, locker_room, clean_room",45171
5667,136008,indoor,"elevator/door, elevator_lobby, dressing_room, barndoor, clean_room",45171
5668,136032,indoor,"elevator/door, elevator_lobby, dressing_room, locker_room, sauna",45171
5669,136056,indoor,"beauty_salon, dressing_room, clean_room, clothing_store, art_gallery",45171
5670,136080,indoor,"beauty_salon, dressing_room, clothing_store, office, clean_room",45171
5671,136104,indoor,"beauty_salon, dressing_room, stage/indoor, clothing_store, music_studio",45171
5672,136128,indoor,"elevator/door, dressing_room, closet, elevator_lobby, clean_room",45171
5673,136152,indoor,"closet, dressing_room, clean_room, elevator/door, shower",45171
5674,136176,indoor,"elevator/door, elevator_lobby, dressing_room, hospital_room, clean_room",45171
5675,136200,indoor,"clean_room, elevator/door, locker_room, hospital_room, elevator_lobby",45171
5676,136224,indoor,"elevator/door, clean_room, elevator_lobby, art_gallery, museum/indoor",45171
5677,136248,indoor,"elevator/door, elevator_lobby, office, dressing_room, art_gallery",45171
5678,136272,indoor,"nursing_home, elevator/door, office, elevator_lobby, hospital_room",45171
5679,136296,indoor,"elevator/door, office, conference_center, elevator_lobby, reception",45171
5680,136320,indoor,"elevator/door, elevator_lobby, office, reception, nursing_home",45171
5681,136344,indoor,"dressing_room, elevator/door, shower, bow_window/indoor, clothing_store",45171
5682,136368,indoor,"dressing_room, elevator/door, bow_window/indoor, shower, clothing_store",45171
5683,136392,indoor,"elevator/door, shower, bow_window/indoor, dressing_room, clean_room",45171
5684,136416,indoor,"beauty_salon, shower, elevator/door, dressing_room, clean_room",45171
5685,136440,indoor,"beauty_salon, art_gallery, museum/indoor, art_studio, clean_room",45171
5686,136464,indoor,"dressing_room, beauty_salon, stage/indoor, ballroom, music_studio",45171
5687,136488,indoor,"beauty_salon, dressing_room, stage/indoor, bow_window/indoor, ballroom",45171
5688,136512,indoor,"beauty_salon, dressing_room, bow_window/indoor, stage/indoor, shower",45171
5689,136536,indoor,"dressing_room, beauty_salon, bow_window/indoor, shower, sauna",45171
5690,136560,indoor,"beauty_salon, dressing_room, bow_window/indoor, stage/indoor, sauna",45171
5691,136584,indoor,"dressing_room, beauty_salon, art_gallery, stage/indoor, museum/indoor",45171
5692,136608,outdoor,"discotheque, fishpond, science_museum, pond, lake/natural",45171
5693,136632,indoor,"elevator/door, classroom, bow_window/indoor, nursery, basement",45171
5694,136656,indoor,"basement, jail_cell, elevator/door, classroom, locker_room",45171
5695,136680,indoor,"oilrig, jewelry_shop, museum/indoor, clean_room, chemistry_lab",45171
5696,136704,indoor,"jewelry_shop, childs_room, beauty_salon, bakery/shop, nursery",45171
5697,136728,indoor,"jewelry_shop, childs_room, beauty_salon, gift_shop, candy_store",45171
5698,136752,indoor,"jewelry_shop, childs_room, beauty_salon, ice_cream_parlor, bakery/shop",45171
