,frame_num,environment,places
0,0,outdoor,"desert/sand, sky, beach, lake/natural, marsh"
1,24,indoor,"discotheque, beauty_salon, pharmacy, nursery, drugstore"
2,48,indoor,"ice_shelf, beauty_salon, drugstore, pharmacy, motel"
3,72,outdoor,"ice_shelf, corn_field, ice_floe, wheat_field, glacier"
4,96,outdoor,"ice_shelf, corn_field, ice_floe, drugstore, wheat_field"
5,120,outdoor,"ice_shelf, corn_field, ice_floe, wheat_field, field/cultivated"
6,144,outdoor,"corn_field, ice_shelf, drugstore, motel, pharmacy"
7,168,indoor,"ice_shelf, beauty_salon, drugstore, clothing_store, candy_store"
8,192,outdoor,"ice_shelf, corn_field, motel, field/cultivated, drugstore"
9,216,indoor,"drugstore, pharmacy, bookstore, ice_shelf, beauty_salon"
10,240,indoor,"museum/indoor, corn_field, ice_shelf, bookstore, archive"
11,264,indoor,"beauty_salon, ice_shelf, drugstore, pharmacy, motel"
12,288,indoor,"drugstore, ice_shelf, beauty_salon, motel, pharmacy"
13,312,outdoor,"ice_shelf, corn_field, motel, drugstore, beauty_salon"
14,336,outdoor,"corn_field, ice_shelf, field/cultivated, drugstore, archive"
15,360,outdoor,"ice_shelf, corn_field, field/cultivated, ice_floe, drugstore"
16,384,outdoor,"ice_shelf, corn_field, drugstore, pharmacy, field/cultivated"
17,408,indoor,"corn_field, ice_shelf, drugstore, pharmacy, discotheque"
18,432,indoor,"drugstore, pharmacy, beauty_salon, bookstore, ice_shelf"
19,456,indoor,"ice_shelf, drugstore, discotheque, beauty_salon, pharmacy"
20,480,outdoor,"ice_shelf, corn_field, discotheque, cemetery, archive"
21,504,indoor,"booth/indoor, ice_cream_parlor, conference_center, museum/indoor, cemetery"
22,528,indoor,"booth/indoor, pharmacy, conference_center, beauty_salon, drugstore"
23,552,indoor,"booth/indoor, pharmacy, ice_cream_parlor, drugstore, beauty_salon"
24,576,indoor,"booth/indoor, ice_cream_parlor, pharmacy, beauty_salon, drugstore"
25,600,indoor,"booth/indoor, pharmacy, drugstore, ice_cream_parlor, beauty_salon"
26,624,indoor,"booth/indoor, ice_cream_parlor, pharmacy, drugstore, beauty_salon"
27,648,indoor,"booth/indoor, ice_cream_parlor, pharmacy, beauty_salon, drugstore"
28,672,indoor,"booth/indoor, pharmacy, drugstore, ice_cream_parlor, beauty_salon"
29,696,indoor,"booth/indoor, beauty_salon, pharmacy, drugstore, ice_cream_parlor"
30,720,indoor,"booth/indoor, pharmacy, beauty_salon, drugstore, ice_cream_parlor"
31,744,indoor,"booth/indoor, pharmacy, ice_cream_parlor, drugstore, beauty_salon"
32,768,indoor,"booth/indoor, pharmacy, beauty_salon, drugstore, ice_cream_parlor"
33,792,indoor,"booth/indoor, pharmacy, beauty_salon, ice_cream_parlor, drugstore"
34,816,indoor,"booth/indoor, pharmacy, drugstore, ice_cream_parlor, beauty_salon"
35,840,indoor,"booth/indoor, pharmacy, drugstore, ice_cream_parlor, beauty_salon"
36,864,indoor,"booth/indoor, beauty_salon, pharmacy, ice_cream_parlor, conference_center"
37,888,indoor,"booth/indoor, pharmacy, beauty_salon, drugstore, ice_cream_parlor"
38,912,indoor,"booth/indoor, pharmacy, ice_cream_parlor, drugstore, beauty_salon"
39,936,indoor,"museum/indoor, booth/indoor, cemetery, archive, pharmacy"
40,960,indoor,"museum/indoor, science_museum, natural_history_museum, cemetery, pharmacy"
41,984,indoor,"pharmacy, science_museum, natural_history_museum, drugstore, jewelry_shop"
42,1008,indoor,"pharmacy, drugstore, science_museum, museum/indoor, jewelry_shop"
43,1032,indoor,"museum/indoor, science_museum, pharmacy, cemetery, natural_history_museum"
44,1056,indoor,"pharmacy, science_museum, museum/indoor, drugstore, natural_history_museum"
45,1080,indoor,"pharmacy, drugstore, cemetery, science_museum, natural_history_museum"
46,1104,indoor,"science_museum, natural_history_museum, cemetery, museum/indoor, pharmacy"
47,1128,indoor,"science_museum, natural_history_museum, pharmacy, museum/indoor, cemetery"
48,1152,indoor,"pharmacy, science_museum, natural_history_museum, museum/indoor, drugstore"
49,1176,indoor,"science_museum, natural_history_museum, pharmacy, museum/indoor, drugstore"
50,1200,indoor,"pharmacy, drugstore, science_museum, natural_history_museum, museum/indoor"
51,1224,indoor,"cemetery, museum/indoor, pharmacy, science_museum, natural_history_museum"
52,1248,indoor,"science_museum, natural_history_museum, cemetery, pharmacy, museum/indoor"
53,1272,indoor,"science_museum, pharmacy, natural_history_museum, museum/indoor, drugstore"
54,1296,indoor,"pharmacy, science_museum, museum/indoor, drugstore, cemetery"
55,1320,indoor,"pharmacy, drugstore, museum/indoor, science_museum, jewelry_shop"
56,1344,indoor,"pharmacy, drugstore, jewelry_shop, science_museum, natural_history_museum"
57,1368,indoor,"pharmacy, drugstore, booth/indoor, ice_cream_parlor, museum/indoor"
58,1392,indoor,"science_museum, pharmacy, natural_history_museum, museum/indoor, drugstore"
59,1416,indoor,"pharmacy, drugstore, natural_history_museum, museum/indoor, science_museum"
60,1440,indoor,"pharmacy, drugstore, booth/indoor, museum/indoor, cemetery"
61,1464,indoor,"cemetery, museum/indoor, pharmacy, science_museum, drugstore"
62,1488,indoor,"pharmacy, museum/indoor, science_museum, natural_history_museum, cemetery"
63,1512,indoor,"pharmacy, drugstore, museum/indoor, science_museum, natural_history_museum"
64,1536,indoor,"pharmacy, science_museum, drugstore, natural_history_museum, museum/indoor"
65,1560,indoor,"science_museum, natural_history_museum, museum/indoor, cemetery, pharmacy"
66,1584,outdoor,"tower, shower, skyscraper, desert/sand, water_tower"
67,1608,outdoor,"desert/sand, sky, snowfield, beach, ice_shelf"
68,1632,outdoor,"ice_shelf, desert/sand, ice_floe, ocean, beach"
69,1656,outdoor,"hospital, ice_shelf, cemetery, motel, parking_lot"
70,1680,outdoor,"ice_shelf, cemetery, crosswalk, hospital, parking_lot"
71,1704,outdoor,"ice_shelf, crosswalk, cemetery, motel, parking_lot"
72,1728,outdoor,"ice_shelf, cemetery, picnic_area, crosswalk, parking_lot"
73,1752,outdoor,"playground, cemetery, ice_shelf, crosswalk, picnic_area"
74,1776,outdoor,"pavilion, playground, picnic_area, gazebo/exterior, ice_shelf"
75,1800,outdoor,"crosswalk, ski_slope, plaza, ski_resort, stage/indoor"
76,1824,outdoor,"ski_resort, ski_slope, playground, construction_site, staircase"
77,1848,outdoor,"ski_resort, ski_slope, construction_site, fire_escape, oilrig"
78,1872,outdoor,"playground, ice_shelf, ice_floe, boat_deck, oilrig"
79,1896,outdoor,"playground, ski_slope, construction_site, ice_shelf, trench"
80,1920,outdoor,"igloo, sky, tower, ice_shelf, ice_floe"
81,1944,outdoor,"desert/sand, ice_shelf, sky, beach, snowfield"
82,1968,indoor,"pharmacy, drugstore, beauty_salon, reception, clean_room"
83,1992,indoor,"pharmacy, hospital, elevator/door, ticket_booth, drugstore"
84,2016,outdoor,"hospital, pharmacy, ticket_booth, cemetery, courthouse"
85,2040,indoor,"pharmacy, drugstore, ticket_booth, bookstore, candy_store"
86,2064,outdoor,"schoolhouse, mosque/outdoor, mansion, carrousel, courthouse"
87,2088,outdoor,"mosque/outdoor, schoolhouse, museum/indoor, amusement_park, carrousel"
88,2112,outdoor,"mosque/outdoor, carrousel, mansion, amusement_park, courthouse"
89,2136,outdoor,"schoolhouse, mansion, mosque/outdoor, courthouse, boat_deck"
90,2160,outdoor,"mosque/outdoor, porch, courthouse, carrousel, mansion"
91,2184,outdoor,"carrousel, engine_room, amusement_park, clean_room, porch"
92,2208,outdoor,"carrousel, porch, amusement_park, clean_room, engine_room"
93,2232,outdoor,"carrousel, porch, clean_room, amusement_park, boat_deck"
94,2256,outdoor,"carrousel, amusement_park, porch, engine_room, auto_factory"
95,2280,outdoor,"carrousel, courthouse, porch, mansion, boat_deck"
96,2304,outdoor,"carrousel, stage/indoor, clean_room, courthouse, porch"
97,2328,outdoor,"carrousel, schoolhouse, courthouse, stage/indoor, clean_room"
98,2352,outdoor,"carrousel, amusement_park, stage/indoor, mansion, courthouse"
99,2376,outdoor,"carrousel, amusement_park, porch, engine_room, mansion"
100,2400,outdoor,"carrousel, natural_history_museum, mosque/outdoor, museum/indoor, courthouse"
101,2424,indoor,"bow_window/indoor, dining_room, living_room, entrance_hall, waiting_room"
102,2448,indoor,"bow_window/indoor, dining_room, living_room, waiting_room, entrance_hall"
103,2472,indoor,"bow_window/indoor, dining_room, living_room, entrance_hall, waiting_room"
104,2496,indoor,"bow_window/indoor, dining_room, living_room, waiting_room, entrance_hall"
105,2520,indoor,"bow_window/indoor, dining_room, living_room, waiting_room, entrance_hall"
106,2544,indoor,"bow_window/indoor, dining_room, living_room, waiting_room, entrance_hall"
107,2568,indoor,"dining_room, bow_window/indoor, waiting_room, library/indoor, living_room"
108,2592,indoor,"dining_room, bow_window/indoor, waiting_room, living_room, home_office"
109,2616,indoor,"bow_window/indoor, dining_room, living_room, waiting_room, artists_loft"
110,2640,indoor,"dining_room, bow_window/indoor, classroom, artists_loft, office"
111,2664,indoor,"dining_room, bow_window/indoor, waiting_room, library/indoor, office"
112,2688,indoor,"bow_window/indoor, dining_room, gymnasium/indoor, waiting_room, nursery"
113,2712,indoor,"bow_window/indoor, dining_room, gymnasium/indoor, waiting_room, museum/indoor"
114,2736,indoor,"bow_window/indoor, dining_room, porch, living_room, waiting_room"
115,2760,indoor,"bow_window/indoor, museum/indoor, archive, waiting_room, library/indoor"
116,2784,indoor,"museum/indoor, nursery, clean_room, bow_window/indoor, hospital_room"
117,2808,indoor,"museum/indoor, clean_room, schoolhouse, archive, nursery"
118,2832,indoor,"bow_window/indoor, museum/indoor, porch, clean_room, nursery"
119,2856,indoor,"dining_room, bow_window/indoor, museum/indoor, waiting_room, office"
120,2880,indoor,"bow_window/indoor, dining_room, porch, museum/indoor, nursery"
121,2904,indoor,"bow_window/indoor, dining_room, museum/indoor, nursery, waiting_room"
122,2928,indoor,"bow_window/indoor, dining_room, museum/indoor, nursery, porch"
123,2952,indoor,"clean_room, chemistry_lab, biology_laboratory, locker_room, classroom"
124,2976,indoor,"clean_room, martial_arts_gym, dressing_room, clothing_store, locker_room"
125,3000,indoor,"clean_room, dressing_room, clothing_store, operating_room, hospital_room"
126,3024,indoor,"clean_room, dressing_room, locker_room, clothing_store, hospital_room"
127,3048,indoor,"clean_room, dressing_room, clothing_store, hospital_room, operating_room"
128,3072,indoor,"clean_room, dressing_room, locker_room, clothing_store, hospital_room"
129,3096,indoor,"clean_room, dressing_room, locker_room, hospital_room, chemistry_lab"
130,3120,indoor,"clean_room, operating_room, locker_room, hospital_room, chemistry_lab"
131,3144,indoor,"clean_room, chemistry_lab, locker_room, operating_room, biology_laboratory"
132,3168,indoor,"clean_room, dressing_room, locker_room, hospital_room, operating_room"
133,3192,indoor,"clean_room, operating_room, chemistry_lab, locker_room, dressing_room"
134,3216,indoor,"clean_room, shower, chemistry_lab, nursery, dressing_room"
135,3240,indoor,"clean_room, chemistry_lab, nursery, locker_room, operating_room"
136,3264,indoor,"clean_room, shower, bathroom, bow_window/indoor, locker_room"
137,3288,indoor,"clean_room, dining_room, bow_window/indoor, nursery, locker_room"
138,3312,indoor,"nursery, bow_window/indoor, bathroom, shower, locker_room"
139,3336,indoor,"bow_window/indoor, bathroom, dining_room, clean_room, shower"
140,3360,indoor,"clean_room, bow_window/indoor, nursery, dining_room, entrance_hall"
141,3384,indoor,"dressing_room, reception, wet_bar, archive, bathroom"
142,3408,indoor,"dressing_room, archive, nursery, locker_room, museum/indoor"
143,3432,indoor,"dressing_room, archive, clean_room, locker_room, beauty_salon"
144,3456,indoor,"clean_room, martial_arts_gym, locker_room, dressing_room, boxing_ring"
145,3480,indoor,"clean_room, dressing_room, hospital_room, biology_laboratory, pharmacy"
146,3504,indoor,"ice_cream_parlor, coffee_shop, clean_room, bakery/shop, hospital_room"
147,3528,indoor,"clean_room, hospital_room, operating_room, restaurant_kitchen, biology_laboratory"
148,3552,indoor,"clean_room, hospital_room, pharmacy, operating_room, drugstore"
149,3576,indoor,"clean_room, biology_laboratory, office, ice_cream_parlor, pharmacy"
150,3600,indoor,"clean_room, dressing_room, stage/indoor, music_studio, office_cubicles"
151,3624,indoor,"clean_room, dressing_room, archive, music_studio, office_cubicles"
152,3648,indoor,"clean_room, dressing_room, office_cubicles, archive, office"
153,3672,indoor,"clean_room, dressing_room, archive, office_cubicles, shower"
154,3696,indoor,"clean_room, dressing_room, shower, veterinarians_office, office_cubicles"
155,3720,indoor,"clean_room, dressing_room, archive, office_cubicles, museum/indoor"
156,3744,indoor,"clean_room, dressing_room, office_cubicles, discotheque, office"
157,3768,indoor,"clean_room, dressing_room, office_cubicles, archive, office"
158,3792,indoor,"clean_room, dressing_room, office_cubicles, archive, office"
159,3816,indoor,"clean_room, martial_arts_gym, butchers_shop, pharmacy, clothing_store"
160,3840,indoor,"clean_room, martial_arts_gym, pharmacy, operating_room, locker_room"
161,3864,indoor,"clean_room, locker_room, dressing_room, butchers_shop, martial_arts_gym"
162,3888,indoor,"clean_room, operating_room, locker_room, pharmacy, archive"
163,3912,indoor,"clean_room, dressing_room, pharmacy, biology_laboratory, chemistry_lab"
164,3936,indoor,"clean_room, biology_laboratory, chemistry_lab, locker_room, dressing_room"
165,3960,indoor,"restaurant, clean_room, archive, dining_room, library/indoor"
166,3984,indoor,"clean_room, archive, office, chemistry_lab, home_office"
167,4008,indoor,"clean_room, restaurant, archive, chemistry_lab, restaurant_kitchen"
168,4032,indoor,"clean_room, dressing_room, biology_laboratory, archive, classroom"
169,4056,indoor,"clean_room, dressing_room, biology_laboratory, locker_room, chemistry_lab"
170,4080,indoor,"classroom, clean_room, computer_room, office, dressing_room"
171,4104,indoor,"clean_room, classroom, computer_room, hospital_room, lecture_room"
172,4128,indoor,"classroom, clean_room, lecture_room, archive, hospital_room"
173,4152,indoor,"classroom, clean_room, lecture_room, martial_arts_gym, archive"
174,4176,indoor,"classroom, martial_arts_gym, clean_room, lecture_room, archive"
175,4200,indoor,"classroom, lecture_room, martial_arts_gym, archive, computer_room"
176,4224,indoor,"archive, clean_room, classroom, office, computer_room"
177,4248,indoor,"clean_room, biology_laboratory, archive, locker_room, chemistry_lab"
178,4272,indoor,"clean_room, biology_laboratory, archive, classroom, dressing_room"
179,4296,indoor,"clean_room, classroom, biology_laboratory, archive, dressing_room"
180,4320,indoor,"clean_room, biology_laboratory, archive, dressing_room, classroom"
181,4344,indoor,"clean_room, biology_laboratory, classroom, archive, dressing_room"
182,4368,indoor,"clean_room, biology_laboratory, office, archive, dressing_room"
183,4392,indoor,"clean_room, biology_laboratory, classroom, office, archive"
184,4416,indoor,"biology_laboratory, clean_room, coffee_shop, chemistry_lab, dressing_room"
185,4440,indoor,"clean_room, biology_laboratory, dressing_room, chemistry_lab, restaurant_kitchen"
186,4464,indoor,"clean_room, office, dressing_room, computer_room, biology_laboratory"
187,4488,indoor,"clean_room, office, nursing_home, office_cubicles, hospital_room"
188,4512,indoor,"clean_room, biology_laboratory, hospital_room, operating_room, office"
189,4536,indoor,"clean_room, biology_laboratory, hospital_room, office, office_cubicles"
190,4560,indoor,"clean_room, dressing_room, office, computer_room, biology_laboratory"
191,4584,indoor,"clean_room, biology_laboratory, dressing_room, office, hospital_room"
192,4608,indoor,"clean_room, biology_laboratory, office, dressing_room, hospital_room"
193,4632,indoor,"clean_room, dressing_room, biology_laboratory, office, hospital_room"
194,4656,indoor,"clean_room, dressing_room, office, biology_laboratory, computer_room"
195,4680,indoor,"clean_room, dressing_room, biology_laboratory, hospital_room, office"
196,4704,indoor,"clean_room, biology_laboratory, office, computer_room, dressing_room"
197,4728,indoor,"clean_room, dressing_room, biology_laboratory, chemistry_lab, office"
198,4752,indoor,"clean_room, biology_laboratory, chemistry_lab, archive, dressing_room"
199,4776,indoor,"clean_room, dressing_room, biology_laboratory, hospital_room, office"
200,4800,indoor,"clean_room, archive, reception, hospital_room, office"
201,4824,indoor,"clean_room, hospital_room, archive, office, office_cubicles"
202,4848,indoor,"clean_room, restaurant_kitchen, archive, chemistry_lab, hospital_room"
203,4872,indoor,"clean_room, office, hospital_room, reception, office_cubicles"
204,4896,indoor,"clean_room, archive, reception, restaurant_kitchen, hospital_room"
205,4920,indoor,"clean_room, restaurant_kitchen, restaurant, reception, hospital_room"
206,4944,indoor,"restaurant_kitchen, clean_room, restaurant, chemistry_lab, biology_laboratory"
207,4968,indoor,"restaurant_kitchen, clean_room, kitchen, restaurant, archive"
208,4992,indoor,"clean_room, restaurant_kitchen, biology_laboratory, hospital_room, kitchen"
209,5016,indoor,"restaurant_kitchen, clean_room, dressing_room, restaurant, banquet_hall"
210,5040,indoor,"restaurant_kitchen, dressing_room, clean_room, restaurant, biology_laboratory"
211,5064,indoor,"dressing_room, clean_room, restaurant, restaurant_kitchen, reception"
212,5088,indoor,"clean_room, restaurant, restaurant_kitchen, dressing_room, cafeteria"
213,5112,indoor,"clean_room, dressing_room, restaurant_kitchen, restaurant, hospital_room"
214,5136,indoor,"clean_room, restaurant_kitchen, dressing_room, restaurant, biology_laboratory"
215,5160,indoor,"clean_room, restaurant_kitchen, dressing_room, restaurant, hospital_room"
216,5184,indoor,"clean_room, restaurant_kitchen, restaurant, dressing_room, biology_laboratory"
217,5208,indoor,"clean_room, biology_laboratory, restaurant_kitchen, dressing_room, restaurant"
218,5232,indoor,"restaurant_kitchen, clean_room, restaurant, biology_laboratory, dressing_room"
219,5256,indoor,"clean_room, restaurant, restaurant_kitchen, dressing_room, biology_laboratory"
220,5280,indoor,"clean_room, dressing_room, restaurant, restaurant_kitchen, biology_laboratory"
221,5304,indoor,"clean_room, restaurant, dressing_room, restaurant_kitchen, biology_laboratory"
222,5328,indoor,"restaurant_kitchen, restaurant, clean_room, sushi_bar, cafeteria"
223,5352,indoor,"clean_room, restaurant_kitchen, restaurant, biology_laboratory, dressing_room"
224,5376,indoor,"clean_room, restaurant_kitchen, dressing_room, restaurant, biology_laboratory"
225,5400,indoor,"clean_room, restaurant_kitchen, restaurant, dressing_room, biology_laboratory"
226,5424,indoor,"clean_room, restaurant_kitchen, restaurant, dressing_room, biology_laboratory"
227,5448,indoor,"clean_room, restaurant_kitchen, restaurant, dressing_room, hospital_room"
228,5472,indoor,"clean_room, restaurant_kitchen, restaurant, dressing_room, biology_laboratory"
229,5496,indoor,"clean_room, restaurant_kitchen, restaurant, dressing_room, biology_laboratory"
230,5520,indoor,"clean_room, restaurant_kitchen, restaurant, dressing_room, biology_laboratory"
231,5544,indoor,"restaurant, dressing_room, banquet_hall, cafeteria, clean_room"
232,5568,indoor,"restaurant, restaurant_kitchen, dressing_room, cafeteria, sushi_bar"
233,5592,indoor,"restaurant, restaurant_kitchen, dressing_room, cafeteria, banquet_hall"
234,5616,indoor,"clean_room, office, biology_laboratory, computer_room, chemistry_lab"
235,5640,indoor,"clean_room, office, hospital_room, biology_laboratory, computer_room"
236,5664,indoor,"clean_room, office, biology_laboratory, computer_room, office_cubicles"
237,5688,indoor,"clean_room, biology_laboratory, office, chemistry_lab, archive"
238,5712,indoor,"clean_room, biology_laboratory, chemistry_lab, archive, dressing_room"
239,5736,indoor,"clean_room, biology_laboratory, chemistry_lab, office, hospital_room"
240,5760,indoor,"dining_hall, dining_room, classroom, cafeteria, library/indoor"
241,5784,indoor,"classroom, cafeteria, dining_hall, library/indoor, lecture_room"
242,5808,indoor,"classroom, dining_hall, cafeteria, dining_room, library/indoor"
243,5832,indoor,"classroom, library/indoor, lecture_room, dining_hall, cafeteria"
244,5856,indoor,"classroom, library/indoor, cafeteria, lecture_room, dining_hall"
245,5880,indoor,"classroom, dining_hall, library/indoor, cafeteria, dining_room"
246,5904,indoor,"classroom, library/indoor, cafeteria, operating_room, chemistry_lab"
247,5928,indoor,"classroom, dining_hall, cafeteria, dining_room, chemistry_lab"
248,5952,indoor,"clean_room, laundromat, dining_room, office, chemistry_lab"
249,5976,indoor,"laundromat, clean_room, chemistry_lab, dining_hall, archive"
250,6000,indoor,"dining_hall, restaurant, dining_room, laundromat, clean_room"
251,6024,indoor,"dining_room, dining_hall, restaurant, classroom, banquet_hall"
252,6048,indoor,"dining_room, dining_hall, restaurant, cafeteria, banquet_hall"
253,6072,indoor,"dining_hall, dining_room, laundromat, restaurant, cafeteria"
254,6096,indoor,"dining_hall, dining_room, chemistry_lab, restaurant, classroom"
255,6120,indoor,"dining_room, dining_hall, restaurant, cafeteria, library/indoor"
256,6144,indoor,"clean_room, dining_room, classroom, chemistry_lab, office"
257,6168,indoor,"laundromat, clean_room, chemistry_lab, dining_hall, dining_room"
258,6192,indoor,"laundromat, clean_room, chemistry_lab, archive, dining_room"
259,6216,indoor,"laundromat, dining_room, clean_room, chemistry_lab, restaurant"
260,6240,indoor,"dining_room, dining_hall, restaurant, clean_room, laundromat"
261,6264,indoor,"clean_room, laundromat, dining_room, dining_hall, chemistry_lab"
262,6288,indoor,"laundromat, clean_room, dining_hall, dining_room, restaurant"
263,6312,indoor,"clean_room, laundromat, restaurant, biology_laboratory, chemistry_lab"
264,6336,indoor,"clean_room, dining_room, restaurant, dining_hall, archive"
265,6360,indoor,"dining_room, clean_room, restaurant, banquet_hall, dining_hall"
266,6384,indoor,"clean_room, conference_room, classroom, office, dining_room"
267,6408,indoor,"clean_room, laundromat, dressing_room, operating_room, archive"
268,6432,indoor,"clean_room, laundromat, chemistry_lab, biology_laboratory, operating_room"
269,6456,indoor,"clean_room, biology_laboratory, chemistry_lab, beauty_salon, banquet_hall"
270,6480,indoor,"clean_room, banquet_hall, restaurant, chemistry_lab, beauty_salon"
271,6504,indoor,"clean_room, biology_laboratory, beauty_salon, chemistry_lab, banquet_hall"
272,6528,indoor,"clean_room, chemistry_lab, biology_laboratory, beauty_salon, operating_room"
273,6552,indoor,"clean_room, chemistry_lab, biology_laboratory, beauty_salon, operating_room"
274,6576,indoor,"clean_room, chemistry_lab, biology_laboratory, operating_room, hospital_room"
275,6600,indoor,"clean_room, chemistry_lab, biology_laboratory, beauty_salon, banquet_hall"
276,6624,indoor,"clean_room, beauty_salon, chemistry_lab, biology_laboratory, banquet_hall"
277,6648,indoor,"clean_room, banquet_hall, chemistry_lab, biology_laboratory, restaurant"
278,6672,indoor,"clean_room, chemistry_lab, biology_laboratory, operating_room, beauty_salon"
279,6696,indoor,"clean_room, hospital_room, dressing_room, operating_room, nursing_home"
280,6720,indoor,"clean_room, dressing_room, hospital_room, operating_room, archive"
281,6744,indoor,"clean_room, dressing_room, hospital_room, operating_room, nursing_home"
282,6768,indoor,"clean_room, operating_room, dressing_room, hospital_room, archive"
283,6792,indoor,"clean_room, dressing_room, operating_room, hospital_room, chemistry_lab"
284,6816,indoor,"clean_room, dressing_room, operating_room, hospital_room, chemistry_lab"
285,6840,indoor,"clean_room, dressing_room, hospital_room, operating_room, chemistry_lab"
286,6864,indoor,"clean_room, dressing_room, hospital_room, music_studio, operating_room"
287,6888,indoor,"clean_room, dressing_room, operating_room, hospital_room, nursing_home"
288,6912,indoor,"clean_room, nursing_home, music_studio, dressing_room, archive"
289,6936,indoor,"clean_room, operating_room, dressing_room, nursing_home, hospital_room"
290,6960,indoor,"clean_room, nursing_home, dressing_room, hospital_room, operating_room"
291,6984,indoor,"clean_room, nursing_home, dressing_room, hospital_room, operating_room"
292,7008,indoor,"clean_room, dressing_room, nursing_home, hospital_room, operating_room"
293,7032,indoor,"clean_room, operating_room, hospital_room, dressing_room, chemistry_lab"
294,7056,indoor,"clean_room, operating_room, hospital_room, dressing_room, nursing_home"
295,7080,indoor,"clean_room, operating_room, dressing_room, hospital_room, nursing_home"
296,7104,indoor,"dressing_room, clean_room, bedroom, hospital_room, nursing_home"
297,7128,indoor,"clean_room, dressing_room, hospital_room, nursing_home, archive"
298,7152,indoor,"clean_room, hospital_room, nursing_home, operating_room, dressing_room"
299,7176,indoor,"dressing_room, clean_room, banquet_hall, hospital_room, bedroom"
300,7200,indoor,"dressing_room, clean_room, chemistry_lab, nursing_home, nursery"
301,7224,indoor,"clean_room, dressing_room, chemistry_lab, operating_room, hospital_room"
302,7248,indoor,"clean_room, operating_room, dressing_room, hospital_room, nursing_home"
303,7272,indoor,"clean_room, biology_laboratory, chemistry_lab, dressing_room, operating_room"
304,7296,indoor,"clean_room, dressing_room, biology_laboratory, chemistry_lab, operating_room"
305,7320,indoor,"restaurant, banquet_hall, clean_room, dressing_room, cafeteria"
306,7344,indoor,"restaurant, banquet_hall, chemistry_lab, clean_room, dining_hall"
307,7368,indoor,"clean_room, biology_laboratory, chemistry_lab, dressing_room, laundromat"
308,7392,indoor,"clean_room, dressing_room, dining_room, hospital_room, operating_room"
