,frame_num,environment,places
2989,71736,indoor,"clean_room, chemistry_lab, biology_laboratory, archive, operating_room"
2990,71760,indoor,"hospital_room, operating_room, bedroom, hotel_room, chemistry_lab"
2991,71784,indoor,"hospital_room, hotel_room, bedroom, biology_laboratory, operating_room"
2992,71808,indoor,"hotel_room, hospital_room, bedroom, operating_room, biology_laboratory"
2993,71832,indoor,"hospital_room, bedroom, hotel_room, dressing_room, living_room"
2994,71856,indoor,"hotel_room, hospital_room, bedroom, waiting_room, dorm_room"
2995,71880,indoor,"bedroom, dorm_room, hotel_room, living_room, hospital_room"
2996,71904,indoor,"restaurant, hotel_room, dressing_room, conference_center, dining_room"
2997,71928,indoor,"hotel_room, hospital_room, restaurant, beauty_salon, banquet_hall"
2998,71952,indoor,"hotel_room, waiting_room, living_room, hospital_room, dining_room"
2999,71976,indoor,"conference_room, conference_center, classroom, hotel_room, office"
3000,72000,indoor,"office, clean_room, dressing_room, office_cubicles, conference_room"
3001,72024,indoor,"office, clean_room, dressing_room, martial_arts_gym, biology_laboratory"
3002,72048,indoor,"clean_room, office, dressing_room, office_cubicles, martial_arts_gym"
3003,72072,indoor,"clean_room, chemistry_lab, biology_laboratory, igloo, gift_shop"
3004,72096,indoor,"clean_room, jewelry_shop, chemistry_lab, biology_laboratory, nursery"
3005,72120,indoor,"jewelry_shop, beauty_salon, clean_room, gift_shop, museum/indoor"
3006,72144,indoor,"clean_room, jewelry_shop, hospital_room, operating_room, beauty_salon"
3007,72168,indoor,"clean_room, dressing_room, nursery, jewelry_shop, hospital_room"
3008,72192,indoor,"clean_room, nursery, hospital_room, operating_room, dressing_room"
3009,72216,indoor,"jewelry_shop, gift_shop, nursery, museum/indoor, ice_cream_parlor"
3010,72240,indoor,"jewelry_shop, nursery, museum/indoor, gift_shop, science_museum"
3011,72264,indoor,"jewelry_shop, shoe_shop, museum/indoor, gift_shop, bakery/shop"
3012,72288,indoor,"jewelry_shop, shoe_shop, gift_shop, bakery/shop, museum/indoor"
3013,72312,indoor,"jewelry_shop, shoe_shop, gift_shop, museum/indoor, nursery"
3014,72336,indoor,"jewelry_shop, bakery/shop, ice_cream_parlor, shoe_shop, gift_shop"
3015,72360,indoor,"discotheque, igloo, chemistry_lab, iceberg, aquarium"
3016,72384,indoor,"chemistry_lab, ballroom, airport_terminal, dressing_room, shower"
3017,72408,indoor,"shower, clean_room, chemistry_lab, airport_terminal, science_museum"
3018,72432,indoor,"dressing_room, classroom, office, chemistry_lab, clean_room"
3019,72456,indoor,"dressing_room, clothing_store, office, classroom, closet"
3020,72480,indoor,"dressing_room, office, classroom, clothing_store, bow_window/indoor"
3021,72504,indoor,"dressing_room, classroom, office, discotheque, lecture_room"
3022,72528,indoor,"computer_room, chemistry_lab, biology_laboratory, office, classroom"
3023,72552,indoor,"chemistry_lab, computer_room, office, classroom, biology_laboratory"
3024,72576,indoor,"chemistry_lab, banquet_hall, biology_laboratory, iceberg, computer_room"
3025,72600,indoor,"banquet_hall, chemistry_lab, dining_hall, restaurant, bar"
3026,72624,indoor,"banquet_hall, chemistry_lab, dining_hall, restaurant, biology_laboratory"
3027,72648,indoor,"chemistry_lab, banquet_hall, biology_laboratory, dining_hall, restaurant"
3028,72672,indoor,"cafeteria, restaurant, dining_hall, banquet_hall, food_court"
3029,72696,indoor,"cafeteria, restaurant, dining_hall, banquet_hall, food_court"
3030,72720,indoor,"cafeteria, restaurant, dining_hall, banquet_hall, classroom"
3031,72744,indoor,"banquet_hall, chemistry_lab, dining_hall, restaurant, biology_laboratory"
3032,72768,indoor,"banquet_hall, chemistry_lab, dining_hall, restaurant, biology_laboratory"
3033,72792,indoor,"chemistry_lab, banquet_hall, dining_hall, restaurant, biology_laboratory"
3034,72816,indoor,"chemistry_lab, banquet_hall, biology_laboratory, dining_hall, restaurant"
3035,72840,indoor,"chemistry_lab, banquet_hall, biology_laboratory, dining_hall, restaurant"
3036,72864,indoor,"chemistry_lab, banquet_hall, biology_laboratory, restaurant, dining_hall"
3037,72888,indoor,"chemistry_lab, banquet_hall, restaurant, dining_hall, biology_laboratory"
3038,72912,indoor,"banquet_hall, restaurant, dining_hall, chemistry_lab, ballroom"
3039,72936,indoor,"banquet_hall, chemistry_lab, restaurant, dining_hall, biology_laboratory"
3040,72960,indoor,"banquet_hall, chemistry_lab, restaurant, dining_hall, biology_laboratory"
3041,72984,indoor,"jewelry_shop, museum/indoor, nursery, bakery/shop, gift_shop"
3042,73008,indoor,"jewelry_shop, museum/indoor, nursery, gift_shop, bakery/shop"
3043,73032,indoor,"jewelry_shop, biology_laboratory, chemistry_lab, clean_room, beauty_salon"
3044,73056,indoor,"jewelry_shop, nursery, bakery/shop, chemistry_lab, biology_laboratory"
3045,73080,indoor,"jewelry_shop, nursery, kindergarden_classroom, playroom, shoe_shop"
3046,73104,indoor,"jewelry_shop, shoe_shop, gift_shop, museum/indoor, nursery"
3047,73128,indoor,"jewelry_shop, gift_shop, nursery, museum/indoor, bakery/shop"
3048,73152,indoor,"jewelry_shop, gift_shop, museum/indoor, nursery, dressing_room"
3049,73176,indoor,"jewelry_shop, dressing_room, gift_shop, museum/indoor, shoe_shop"
3050,73200,indoor,"clean_room, natural_history_museum, science_museum, dressing_room, museum/indoor"
3051,73224,indoor,"dressing_room, nursery, hospital_room, bowling_alley, clean_room"
3052,73248,indoor,"discotheque, dressing_room, elevator/door, shower, locker_room"
3053,73272,indoor,"shower, museum/indoor, clean_room, playground, science_museum"
3054,73296,indoor,"dressing_room, reception, office, office_cubicles, clothing_store"
3055,73320,indoor,"office, dressing_room, office_cubicles, reception, clean_room"
3056,73344,indoor,"dressing_room, office, reception, office_cubicles, clean_room"
3057,73368,indoor,"dressing_room, office, clean_room, clothing_store, hospital_room"
3058,73392,indoor,"restaurant, banquet_hall, dining_room, dining_hall, conference_room"
3059,73416,indoor,"banquet_hall, chemistry_lab, restaurant, dining_hall, dining_room"
3060,73440,indoor,"restaurant, office, conference_room, chemistry_lab, clean_room"
3061,73464,indoor,"office, restaurant, chemistry_lab, conference_room, classroom"
3062,73488,indoor,"chemistry_lab, restaurant, biology_laboratory, office, classroom"
3063,73512,indoor,"chemistry_lab, restaurant, banquet_hall, biology_laboratory, dining_hall"
3064,73536,indoor,"cafeteria, restaurant, dining_hall, food_court, banquet_hall"
3065,73560,indoor,"cafeteria, restaurant, dining_hall, banquet_hall, food_court"
3066,73584,indoor,"cafeteria, restaurant, banquet_hall, dining_hall, chemistry_lab"
3067,73608,indoor,"cafeteria, restaurant, dining_hall, banquet_hall, food_court"
3068,73632,indoor,"restaurant, cafeteria, dining_hall, banquet_hall, food_court"
3069,73656,indoor,"restaurant, cafeteria, dining_hall, banquet_hall, dining_room"
3070,73680,indoor,"restaurant, cafeteria, dining_hall, banquet_hall, food_court"
3071,73704,indoor,"restaurant, cafeteria, dining_hall, banquet_hall, dining_room"
3072,73728,indoor,"clean_room, dining_room, dining_hall, restaurant, banquet_hall"
3073,73752,indoor,"clean_room, cafeteria, hospital_room, restaurant, classroom"
3074,73776,indoor,"restaurant, cafeteria, clean_room, library/indoor, waiting_room"
3075,73800,indoor,"library/indoor, cafeteria, restaurant, hospital_room, classroom"
3076,73824,indoor,"library/indoor, classroom, cafeteria, dining_hall, restaurant"
3077,73848,indoor,"library/indoor, classroom, cafeteria, dining_hall, dining_room"
3078,73872,indoor,"cafeteria, dining_hall, restaurant, dining_room, food_court"
3079,73896,indoor,"restaurant, cafeteria, dining_hall, dining_room, library/indoor"
3080,73920,indoor,"cafeteria, restaurant, dining_hall, food_court, coffee_shop"
3081,73944,indoor,"restaurant, cafeteria, library/indoor, classroom, food_court"
3082,73968,indoor,"cafeteria, dining_room, dining_hall, classroom, library/indoor"
3083,73992,indoor,"cafeteria, dining_hall, restaurant, food_court, dining_room"
3084,74016,indoor,"library/indoor, cafeteria, classroom, restaurant, dining_hall"
3085,74040,indoor,"cafeteria, classroom, restaurant, food_court, kindergarden_classroom"
3086,74064,indoor,"reception, beauty_salon, hospital_room, lobby, office"
3087,74088,indoor,"chemistry_lab, biology_laboratory, hospital_room, clean_room, martial_arts_gym"
3088,74112,indoor,"martial_arts_gym, hospital_room, clean_room, ballroom, reception"
3089,74136,indoor,"clean_room, hospital_room, ballroom, beauty_salon, martial_arts_gym"
3090,74160,indoor,"clean_room, locker_room, shower, dressing_room, chemistry_lab"
3091,74184,indoor,"locker_room, clean_room, dressing_room, elevator/door, shower"
3092,74208,indoor,"locker_room, clean_room, dressing_room, shower, bathroom"
3093,74232,indoor,"locker_room, clean_room, dressing_room, shower, discotheque"
3094,74256,indoor,"office, classroom, lecture_room, archive, chemistry_lab"
3095,74280,indoor,"office, classroom, lecture_room, pharmacy, chemistry_lab"
3096,74304,indoor,"classroom, dining_room, music_studio, throne_room, television_studio"
3097,74328,indoor,"television_studio, classroom, music_studio, museum/indoor, dining_room"
3098,74352,indoor,"classroom, television_studio, music_studio, museum/indoor, dining_room"
3099,74376,indoor,"television_studio, dressing_room, museum/indoor, music_studio, classroom"
3100,74400,indoor,"television_studio, dressing_room, museum/indoor, music_studio, classroom"
3101,74424,indoor,"museum/indoor, television_studio, dressing_room, dining_room, music_studio"
3102,74448,indoor,"museum/indoor, dressing_room, television_studio, elevator/door, locker_room"
3103,74472,indoor,"dressing_room, museum/indoor, dining_room, elevator/door, sauna"
3104,74496,indoor,"dining_room, dressing_room, television_studio, classroom, music_studio"
3105,74520,indoor,"dressing_room, television_studio, dining_room, elevator/door, phone_booth"
3106,74544,indoor,"dressing_room, dining_room, elevator/door, classroom, music_studio"
3107,74568,indoor,"dressing_room, clean_room, museum/indoor, phone_booth, classroom"
3108,74592,indoor,"clean_room, florist_shop/indoor, dressing_room, beauty_salon, botanical_garden"
3109,74616,indoor,"discotheque, clean_room, nursery, chemistry_lab, dressing_room"
3110,74640,indoor,"clean_room, chemistry_lab, dressing_room, discotheque, ballroom"
3111,74664,indoor,"nursery, clean_room, dressing_room, hospital_room, operating_room"
3112,74688,indoor,"florist_shop/indoor, clean_room, nursery, botanical_garden, dressing_room"
3113,74712,indoor,"nursery, clean_room, florist_shop/indoor, discotheque, stage/indoor"
3114,74736,indoor,"nursery, florist_shop/indoor, playroom, clean_room, discotheque"
3115,74760,indoor,"discotheque, nursery, boxing_ring, playroom, clean_room"
3116,74784,indoor,"clean_room, discotheque, ice_cream_parlor, laundromat, hospital_room"
3117,74808,indoor,"clean_room, ice_cream_parlor, discotheque, museum/indoor, art_gallery"
3118,74832,indoor,"clean_room, discotheque, ice_cream_parlor, museum/indoor, nursery"
3119,74856,indoor,"clean_room, museum/indoor, ice_cream_parlor, discotheque, stage/indoor"
3120,74880,indoor,"clean_room, museum/indoor, ice_cream_parlor, discotheque, art_gallery"
3121,74904,indoor,"clean_room, ice_cream_parlor, museum/indoor, art_gallery, florist_shop/indoor"
3122,74928,indoor,"clean_room, museum/indoor, art_gallery, ice_cream_parlor, florist_shop/indoor"
3123,74952,indoor,"clean_room, nursery, museum/indoor, florist_shop/indoor, hospital_room"
3124,74976,indoor,"clean_room, discotheque, hospital_room, chemistry_lab, biology_laboratory"
3125,75000,indoor,"clean_room, ice_cream_parlor, florist_shop/indoor, nursing_home, hospital_room"
3126,75024,indoor,"clean_room, florist_shop/indoor, ice_cream_parlor, office, office_cubicles"
3127,75048,indoor,"ice_cream_parlor, clean_room, florist_shop/indoor, chemistry_lab, nursing_home"
3128,75072,indoor,"ice_cream_parlor, clean_room, nursing_home, dressing_room, nursery"
3129,75096,indoor,"ice_cream_parlor, clean_room, dressing_room, nursing_home, nursery"
3130,75120,indoor,"clean_room, ice_cream_parlor, dressing_room, nursery, discotheque"
3131,75144,indoor,"clean_room, ice_cream_parlor, chemistry_lab, dressing_room, discotheque"
3132,75168,indoor,"clean_room, ice_cream_parlor, dressing_room, nursery, nursing_home"
3133,75192,indoor,"ice_cream_parlor, nursery, clean_room, dressing_room, nursing_home"
3134,75216,indoor,"dressing_room, discotheque, nursery, ice_cream_parlor, clean_room"
3135,75240,indoor,"dressing_room, clean_room, discotheque, nursery, hospital_room"
3136,75264,indoor,"clean_room, dressing_room, discotheque, nursery, hospital_room"
3137,75288,indoor,"clean_room, dressing_room, hospital_room, nursery, ice_cream_parlor"
3138,75312,indoor,"clean_room, dressing_room, hospital_room, discotheque, ice_cream_parlor"
3139,75336,indoor,"dressing_room, clean_room, laundromat, nursery, discotheque"
3140,75360,indoor,"clean_room, discotheque, dressing_room, ballroom, ice_cream_parlor"
3141,75384,indoor,"dressing_room, clean_room, discotheque, nursing_home, nursery"
3142,75408,indoor,"discotheque, clean_room, dressing_room, nursery, chemistry_lab"
3143,75432,indoor,"dressing_room, clean_room, discotheque, beauty_salon, hospital_room"
3144,75456,indoor,"clean_room, dressing_room, biology_laboratory, chemistry_lab, nursery"
3145,75480,indoor,"clean_room, ice_cream_parlor, nursery, dressing_room, nursing_home"
3146,75504,indoor,"clean_room, nursery, dressing_room, ice_cream_parlor, hospital_room"
3147,75528,indoor,"clean_room, ice_cream_parlor, dressing_room, nursery, hospital_room"
3148,75552,indoor,"clean_room, chemistry_lab, dressing_room, discotheque, biology_laboratory"
3149,75576,indoor,"locker_room, classroom, clean_room, dressing_room, archive"
3150,75600,indoor,"classroom, jail_cell, hospital_room, locker_room, clean_room"
3151,75624,indoor,"discotheque, basement, classroom, locker_room, jail_cell"
3152,75648,outdoor,"slum, ice_shelf, archive, ice_floe, basement"
3153,75672,outdoor,"slum, tower, industrial_area, construction_site, archive"
3154,75696,indoor,"cemetery, museum/indoor, pharmacy, drugstore, beauty_salon"
3155,75720,indoor,"pharmacy, elevator_lobby, drugstore, booth/indoor, museum/indoor"
3156,75744,indoor,"pharmacy, drugstore, booth/indoor, elevator_lobby, museum/indoor"
3157,75768,indoor,"pharmacy, drugstore, booth/indoor, elevator_lobby, museum/indoor"
3158,75792,indoor,"pharmacy, drugstore, booth/indoor, museum/indoor, elevator_lobby"
3159,75816,indoor,"pharmacy, drugstore, booth/indoor, elevator_lobby, museum/indoor"
3160,75840,indoor,"pharmacy, drugstore, booth/indoor, elevator_lobby, museum/indoor"
3161,75864,indoor,"pharmacy, drugstore, booth/indoor, museum/indoor, elevator_lobby"
3162,75888,indoor,"booth/indoor, museum/indoor, kindergarden_classroom, drugstore, pharmacy"
3163,75912,indoor,"classroom, slum, archive, lecture_room, cemetery"
3164,75936,outdoor,"ice_shelf, sky, ocean, beach, lake/natural"
3165,75960,indoor,"cafeteria, classroom, dining_hall, food_court, lecture_room"
3166,75984,indoor,"classroom, cafeteria, kindergarden_classroom, dining_hall, lecture_room"
3167,76008,indoor,"classroom, cafeteria, dining_hall, lecture_room, kindergarden_classroom"
3168,76032,indoor,"classroom, cafeteria, lecture_room, dining_hall, kindergarden_classroom"
3169,76056,indoor,"classroom, cafeteria, dining_hall, lecture_room, kindergarden_classroom"
3170,76080,indoor,"kindergarden_classroom, discotheque, nursery, cafeteria, classroom"
3171,76104,indoor,"clean_room, hospital_room, operating_room, martial_arts_gym, chemistry_lab"
3172,76128,indoor,"clean_room, chemistry_lab, biology_laboratory, operating_room, hospital_room"
3173,76152,indoor,"clean_room, chemistry_lab, biology_laboratory, hospital_room, discotheque"
3174,76176,indoor,"clean_room, biology_laboratory, chemistry_lab, martial_arts_gym, hospital_room"
3175,76200,indoor,"clean_room, chemistry_lab, martial_arts_gym, biology_laboratory, hospital_room"
3176,76224,indoor,"clean_room, chemistry_lab, biology_laboratory, martial_arts_gym, hospital_room"
3177,76248,indoor,"clean_room, chemistry_lab, biology_laboratory, hospital_room, operating_room"
3178,76272,indoor,"clean_room, biology_laboratory, martial_arts_gym, chemistry_lab, operating_room"
3179,76296,indoor,"clean_room, hospital_room, operating_room, martial_arts_gym, biology_laboratory"
3180,76320,indoor,"clean_room, hospital_room, operating_room, biology_laboratory, chemistry_lab"
3181,76344,indoor,"clean_room, biology_laboratory, chemistry_lab, hospital_room, operating_room"
3182,76368,outdoor,"iceberg, ice_floe, botanical_garden, ice_shelf, discotheque"
3183,76392,outdoor,"slum, construction_site, industrial_area, archive, oilrig"
3184,76416,outdoor,"hospital, pharmacy, desert/sand, cemetery, ice_shelf"
3185,76440,outdoor,"desert/sand, pharmacy, hospital, drugstore, ice_shelf"
3186,76464,indoor,"desert/sand, pharmacy, hospital, drugstore, museum/indoor"
3187,76488,indoor,"pharmacy, desert/sand, hospital, drugstore, beauty_salon"
3188,76512,indoor,"desert/sand, pharmacy, hospital, drugstore, museum/indoor"
3189,76536,indoor,"desert/sand, hospital, pharmacy, drugstore, beauty_salon"
3190,76560,outdoor,"ice_shelf, pharmacy, drugstore, cemetery, hospital"
3191,76584,outdoor,"basement, jail_cell, construction_site, ice_shelf, oilrig"
3192,76608,indoor,"restaurant, coffee_shop, classroom, cafeteria, bathroom"
3193,76632,indoor,"restaurant, bathroom, coffee_shop, jail_cell, classroom"
3194,76656,indoor,"restaurant, classroom, coffee_shop, bathroom, cafeteria"
3195,76680,indoor,"classroom, cafeteria, dining_hall, kindergarden_classroom, library/indoor"
3196,76704,indoor,"classroom, kindergarden_classroom, cafeteria, lecture_room, chemistry_lab"
3197,76728,indoor,"classroom, cafeteria, kindergarden_classroom, lecture_room, library/indoor"
3198,76752,indoor,"classroom, cafeteria, kindergarden_classroom, lecture_room, dining_hall"
3199,76776,indoor,"classroom, kindergarden_classroom, cafeteria, library/indoor, lecture_room"
3200,76800,indoor,"classroom, cafeteria, lecture_room, kindergarden_classroom, library/indoor"
3201,76824,indoor,"classroom, kindergarden_classroom, cafeteria, lecture_room, library/indoor"
3202,76848,indoor,"classroom, kindergarden_classroom, cafeteria, lecture_room, dining_hall"
3203,76872,indoor,"classroom, kindergarden_classroom, library/indoor, lecture_room, cafeteria"
3204,76896,indoor,"classroom, kindergarden_classroom, lecture_room, library/indoor, cafeteria"
3205,76920,indoor,"classroom, kindergarden_classroom, library/indoor, lecture_room, cafeteria"
3206,76944,indoor,"classroom, kindergarden_classroom, lecture_room, cafeteria, library/indoor"
3207,76968,indoor,"classroom, kindergarden_classroom, cafeteria, lecture_room, library/indoor"
3208,76992,indoor,"classroom, kindergarden_classroom, lecture_room, cafeteria, library/indoor"
3209,77016,indoor,"classroom, lecture_room, library/indoor, kindergarden_classroom, cafeteria"
3210,77040,indoor,"classroom, kindergarden_classroom, lecture_room, cafeteria, library/indoor"
3211,77064,outdoor,"hot_spring, lake/natural, marsh, ice_shelf, sky"
3212,77088,indoor,"nursery, playground, dressing_room, nursing_home, hospital_room"
3213,77112,indoor,"discotheque, dressing_room, nursery, music_studio, classroom"
3214,77136,indoor,"discotheque, dressing_room, music_studio, classroom, stage/indoor"
3215,77160,indoor,"classroom, hospital_room, restaurant, discotheque, chemistry_lab"
3216,77184,indoor,"restaurant, coffee_shop, cafeteria, bar, dining_room"
3217,77208,indoor,"restaurant, coffee_shop, cafeteria, classroom, bar"
3218,77232,indoor,"restaurant, coffee_shop, cafeteria, dining_room, classroom"
3219,77256,indoor,"dining_room, hospital_room, bow_window/indoor, restaurant, jail_cell"
3220,77280,indoor,"discotheque, chemistry_lab, stage/indoor, biology_laboratory, music_studio"
3221,77304,indoor,"discotheque, chemistry_lab, biology_laboratory, music_studio, dressing_room"
3222,77328,indoor,"discotheque, music_studio, chemistry_lab, dressing_room, stage/indoor"
3223,77352,indoor,"discotheque, chemistry_lab, music_studio, clean_room, biology_laboratory"
3224,77376,indoor,"aquarium, chemistry_lab, clean_room, wheat_field, botanical_garden"
3225,77400,indoor,"discotheque, dressing_room, clean_room, ice_cream_parlor, chemistry_lab"
3226,77424,indoor,"clean_room, discotheque, nursing_home, chemistry_lab, ice_cream_parlor"
3227,77448,indoor,"discotheque, dressing_room, ice_cream_parlor, bar, stage/indoor"
3228,77472,indoor,"ice_cream_parlor, clean_room, hospital_room, chemistry_lab, candy_store"
3229,77496,indoor,"clean_room, chemistry_lab, hospital_room, wheat_field, florist_shop/indoor"
3230,77520,indoor,"clean_room, hospital_room, discotheque, ice_cream_parlor, chemistry_lab"
3231,77544,indoor,"clean_room, discotheque, dressing_room, music_studio, chemistry_lab"
3232,77568,indoor,"clean_room, discotheque, music_studio, stage/indoor, dressing_room"
3233,77592,indoor,"discotheque, stage/indoor, music_studio, ballroom, dressing_room"
3234,77616,indoor,"stage/indoor, discotheque, music_studio, ballroom, orchestra_pit"
3235,77640,indoor,"music_studio, discotheque, stage/indoor, clean_room, ballroom"
3236,77664,indoor,"discotheque, stage/indoor, music_studio, dressing_room, clean_room"
3237,77688,indoor,"discotheque, dressing_room, music_studio, clean_room, stage/indoor"
3238,77712,indoor,"discotheque, stage/indoor, music_studio, dressing_room, ballroom"
3239,77736,indoor,"discotheque, stage/indoor, dressing_room, music_studio, clean_room"
3240,77760,indoor,"discotheque, stage/indoor, music_studio, television_studio, dressing_room"
3241,77784,indoor,"discotheque, stage/indoor, music_studio, clean_room, chemistry_lab"
3242,77808,indoor,"discotheque, stage/indoor, music_studio, dressing_room, clean_room"
3243,77832,indoor,"discotheque, clean_room, stage/indoor, chemistry_lab, music_studio"
3244,77856,indoor,"classroom, boxing_ring, discotheque, airport_terminal, bowling_alley"
3245,77880,indoor,"iceberg, clean_room, discotheque, ice_floe, florist_shop/indoor"
3246,77904,indoor,"clean_room, discotheque, iceberg, dressing_room, hospital_room"
3247,77928,indoor,"discotheque, stage/indoor, wheat_field, music_studio, clean_room"
3248,77952,outdoor,"iceberg, clean_room, ice_floe, discotheque, ice_shelf"
3249,77976,outdoor,"clean_room, chemistry_lab, iceberg, botanical_garden, ice_floe"
3250,78000,indoor,"clean_room, wheat_field, discotheque, iceberg, hospital_room"
3251,78024,outdoor,"clean_room, iceberg, hospital_room, ice_floe, ice_shelf"
3252,78048,indoor,"discotheque, clean_room, iceberg, ice_cream_parlor, ice_floe"
3253,78072,outdoor,"discotheque, wheat_field, botanical_garden, florist_shop/indoor, iceberg"
3254,78096,indoor,"iceberg, ice_floe, aquarium, florist_shop/indoor, clean_room"
3255,78120,indoor,"iceberg, discotheque, clean_room, chemistry_lab, botanical_garden"
3256,78144,indoor,"discotheque, stage/indoor, iceberg, chemistry_lab, botanical_garden"
3257,78168,outdoor,"iceberg, ice_floe, botanical_garden, wheat_field, florist_shop/indoor"
3258,78192,indoor,"discotheque, wheat_field, clean_room, botanical_garden, chemistry_lab"
3259,78216,indoor,"discotheque, dressing_room, clean_room, ballroom, stage/indoor"
3260,78240,indoor,"dressing_room, discotheque, ballroom, hospital_room, banquet_hall"
3261,78264,indoor,"clean_room, dressing_room, hospital_room, chemistry_lab, operating_room"
3262,78288,outdoor,"discotheque, hot_spring, igloo, shower, ice_shelf"
3263,78312,indoor,"shower, archive, hospital, basement, jail_cell"
3264,78336,indoor,"discotheque, shower, bar, hospital_room, stage/indoor"
3265,78360,indoor,"discotheque, pharmacy, bar, stage/indoor, drugstore"
3266,78384,indoor,"clean_room, drugstore, pharmacy, bar, candy_store"
3267,78408,indoor,"discotheque, drugstore, pharmacy, ice_shelf, clean_room"
3268,78432,indoor,"discotheque, pharmacy, clothing_store, drugstore, stage/indoor"
3269,78456,indoor,"discotheque, drugstore, pharmacy, bar, candy_store"
3270,78480,indoor,"pharmacy, drugstore, candy_store, discotheque, clean_room"
3271,78504,indoor,"discotheque, ice_shelf, pharmacy, stage/indoor, candy_store"
3272,78528,indoor,"classroom, laundromat, dressing_room, ballroom, nursery"
3273,78552,indoor,"laundromat, classroom, dressing_room, ballroom, nursery"
3274,78576,indoor,"laundromat, classroom, dressing_room, hospital_room, ballroom"
3275,78600,indoor,"laundromat, dressing_room, nursery, classroom, dining_room"
3276,78624,indoor,"laundromat, dressing_room, nursery, clean_room, dining_room"
3277,78648,indoor,"clean_room, laundromat, dressing_room, hospital_room, nursery"
3278,78672,indoor,"clean_room, laundromat, classroom, hospital_room, dressing_room"
3279,78696,indoor,"clean_room, laundromat, hospital_room, classroom, nursery"
3280,78720,indoor,"classroom, laundromat, clean_room, hospital_room, nursery"
3281,78744,indoor,"clean_room, hospital_room, nursery, classroom, laundromat"
3282,78768,indoor,"clean_room, classroom, laundromat, hospital_room, operating_room"
3283,78792,indoor,"clean_room, laundromat, dressing_room, operating_room, hospital_room"
3284,78816,indoor,"clean_room, laundromat, chemistry_lab, classroom, operating_room"
3285,78840,indoor,"clean_room, classroom, laundromat, operating_room, chemistry_lab"
3286,78864,indoor,"clean_room, laundromat, classroom, chemistry_lab, operating_room"
3287,78888,indoor,"clean_room, laundromat, classroom, dressing_room, chemistry_lab"
3288,78912,indoor,"clean_room, laundromat, classroom, dressing_room, chemistry_lab"
3289,78936,indoor,"clean_room, laundromat, classroom, dressing_room, chemistry_lab"
3290,78960,indoor,"clean_room, laundromat, classroom, dressing_room, chemistry_lab"
