,frame_num,environment,places,imdb_id
0,0,indoor,"hospital, hospital_room, elevator_lobby, pharmacy, drugstore",20436
1,24,indoor,"hospital, hospital_room, elevator_lobby, pharmacy, drugstore",20436
2,48,indoor,"hospital, hospital_room, elevator_lobby, pharmacy, drugstore",20436
3,72,indoor,"hospital, hospital_room, elevator_lobby, pharmacy, drugstore",20436
4,96,indoor,"hospital, hospital_room, elevator_lobby, pharmacy, drugstore",20436
5,120,indoor,"hospital, hospital_room, elevator_lobby, pharmacy, drugstore",20436
6,144,indoor,"hospital, hospital_room, elevator_lobby, pharmacy, drugstore",20436
7,168,indoor,"hospital, hospital_room, elevator_lobby, pharmacy, drugstore",20436
8,192,indoor,"hospital, hospital_room, pharmacy, motel, drugstore",20436
9,216,indoor,"hospital, hospital_room, pharmacy, drugstore, motel",20436
10,240,indoor,"hospital, hospital_room, pharmacy, motel, drugstore",20436
11,264,indoor,"hospital, hospital_room, pharmacy, elevator_lobby, drugstore",20436
12,288,indoor,"hospital, hospital_room, pharmacy, drugstore, elevator_lobby",20436
13,312,indoor,"hospital, hospital_room, pharmacy, elevator_lobby, drugstore",20436
14,336,indoor,"hospital, hospital_room, pharmacy, drugstore, elevator_lobby",20436
15,360,indoor,"hospital, hospital_room, pharmacy, drugstore, elevator_lobby",20436
16,384,indoor,"hospital, hospital_room, pharmacy, elevator_lobby, drugstore",20436
17,408,indoor,"hospital, hospital_room, pharmacy, drugstore, elevator_lobby",20436
18,432,indoor,"hospital, hospital_room, pharmacy, elevator_lobby, drugstore",20436
19,456,indoor,"hospital, hospital_room, pharmacy, drugstore, motel",20436
20,480,indoor,"hospital, hospital_room, pharmacy, drugstore, elevator_lobby",20436
21,504,indoor,"hospital, hospital_room, pharmacy, drugstore, elevator_lobby",20436
22,528,indoor,"hospital, hospital_room, pharmacy, motel, drugstore",20436
23,552,indoor,"hospital, hospital_room, pharmacy, drugstore, elevator_lobby",20436
24,576,indoor,"hospital, hospital_room, pharmacy, drugstore, elevator_lobby",20436
25,600,indoor,"hospital, hospital_room, pharmacy, drugstore, elevator_lobby",20436
26,624,indoor,"hospital, hospital_room, pharmacy, drugstore, elevator_lobby",20436
27,648,indoor,"hospital, hospital_room, elevator_lobby, pharmacy, elevator/door",20436
28,672,indoor,"museum/indoor, cemetery, pharmacy, hospital, hospital_room",20436
29,696,indoor,"museum/indoor, drugstore, booth/indoor, natural_history_museum, pharmacy",20436
30,720,indoor,"drugstore, pharmacy, booth/indoor, hospital, museum/indoor",20436
31,744,indoor,"drugstore, pharmacy, booth/indoor, hospital, museum/indoor",20436
32,768,indoor,"pharmacy, drugstore, booth/indoor, natural_history_museum, ice_cream_parlor",20436
33,792,indoor,"pharmacy, drugstore, booth/indoor, museum/indoor, natural_history_museum",20436
34,816,indoor,"pharmacy, drugstore, ice_cream_parlor, booth/indoor, hospital",20436
35,840,indoor,"drugstore, pharmacy, booth/indoor, natural_history_museum, museum/indoor",20436
36,864,indoor,"drugstore, pharmacy, ice_cream_parlor, booth/indoor, beauty_salon",20436
37,888,indoor,"pharmacy, drugstore, booth/indoor, ice_cream_parlor, natural_history_museum",20436
38,912,indoor,"drugstore, pharmacy, booth/indoor, beauty_salon, ice_cream_parlor",20436
39,936,indoor,"pharmacy, drugstore, booth/indoor, ice_cream_parlor, beauty_salon",20436
40,960,indoor,"drugstore, pharmacy, booth/indoor, museum/indoor, natural_history_museum",20436
41,984,indoor,"pharmacy, drugstore, booth/indoor, natural_history_museum, ice_cream_parlor",20436
42,1008,indoor,"drugstore, pharmacy, booth/indoor, natural_history_museum, museum/indoor",20436
43,1032,indoor,"pharmacy, drugstore, booth/indoor, ice_cream_parlor, natural_history_museum",20436
44,1056,indoor,"drugstore, pharmacy, booth/indoor, natural_history_museum, beauty_salon",20436
45,1080,indoor,"drugstore, pharmacy, ice_cream_parlor, beauty_salon, booth/indoor",20436
46,1104,indoor,"pharmacy, drugstore, hospital, booth/indoor, museum/indoor",20436
47,1128,indoor,"drugstore, museum/indoor, booth/indoor, natural_history_museum, pharmacy",20436
48,1152,indoor,"museum/indoor, natural_history_museum, science_museum, pharmacy, drugstore",20436
49,1176,indoor,"drugstore, pharmacy, museum/indoor, natural_history_museum, booth/indoor",20436
50,1200,indoor,"drugstore, pharmacy, natural_history_museum, museum/indoor, booth/indoor",20436
51,1224,indoor,"drugstore, pharmacy, museum/indoor, booth/indoor, natural_history_museum",20436
52,1248,indoor,"pharmacy, drugstore, booth/indoor, ice_cream_parlor, beauty_salon",20436
53,1272,indoor,"drugstore, pharmacy, museum/indoor, natural_history_museum, booth/indoor",20436
54,1296,indoor,"drugstore, pharmacy, beauty_salon, ice_cream_parlor, booth/indoor",20436
55,1320,indoor,"pharmacy, drugstore, museum/indoor, natural_history_museum, booth/indoor",20436
56,1344,indoor,"pharmacy, drugstore, booth/indoor, museum/indoor, ice_cream_parlor",20436
57,1368,indoor,"drugstore, pharmacy, booth/indoor, ice_cream_parlor, beauty_salon",20436
58,1392,indoor,"drugstore, pharmacy, booth/indoor, beauty_salon, ice_cream_parlor",20436
59,1416,indoor,"drugstore, pharmacy, natural_history_museum, booth/indoor, ice_cream_parlor",20436
60,1440,indoor,"drugstore, pharmacy, booth/indoor, museum/indoor, natural_history_museum",20436
61,1464,indoor,"drugstore, pharmacy, beauty_salon, booth/indoor, museum/indoor",20436
62,1488,indoor,"drugstore, pharmacy, booth/indoor, beauty_salon, ice_cream_parlor",20436
63,1512,indoor,"drugstore, pharmacy, booth/indoor, museum/indoor, beauty_salon",20436
64,1536,indoor,"drugstore, pharmacy, beauty_salon, booth/indoor, ice_cream_parlor",20436
65,1560,indoor,"drugstore, pharmacy, booth/indoor, ice_cream_parlor, museum/indoor",20436
66,1584,indoor,"drugstore, pharmacy, natural_history_museum, museum/indoor, booth/indoor",20436
67,1608,indoor,"drugstore, pharmacy, museum/indoor, natural_history_museum, booth/indoor",20436
68,1632,indoor,"museum/indoor, drugstore, pharmacy, natural_history_museum, booth/indoor",20436
69,1656,indoor,"basement, shower, closet, elevator/door, hot_spring",20436
70,1680,indoor,"closet, basement, shower, hot_spring, elevator/door",20436
71,1704,indoor,"archive, museum/indoor, pharmacy, drugstore, science_museum",20436
72,1728,indoor,"archive, museum/indoor, science_museum, pharmacy, drugstore",20436
73,1752,indoor,"archive, science_museum, museum/indoor, pharmacy, natural_history_museum",20436
74,1776,indoor,"archive, museum/indoor, science_museum, pharmacy, drugstore",20436
75,1800,indoor,"archive, museum/indoor, science_museum, drugstore, pharmacy",20436
76,1824,indoor,"museum/indoor, science_museum, archive, drugstore, natural_history_museum",20436
77,1848,indoor,"science_museum, museum/indoor, archive, drugstore, natural_history_museum",20436
78,1872,indoor,"museum/indoor, science_museum, archive, drugstore, natural_history_museum",20436
79,1896,indoor,"museum/indoor, science_museum, archive, natural_history_museum, drugstore",20436
80,1920,indoor,"archive, museum/indoor, science_museum, pharmacy, drugstore",20436
81,1944,indoor,"archive, museum/indoor, science_museum, pharmacy, drugstore",20436
82,1968,indoor,"archive, museum/indoor, science_museum, pharmacy, drugstore",20436
83,1992,indoor,"archive, museum/indoor, science_museum, drugstore, natural_history_museum",20436
84,2016,indoor,"archive, science_museum, museum/indoor, pharmacy, drugstore",20436
85,2040,indoor,"archive, museum/indoor, science_museum, drugstore, pharmacy",20436
86,2064,indoor,"archive, science_museum, museum/indoor, drugstore, pharmacy",20436
87,2088,indoor,"archive, museum/indoor, science_museum, pharmacy, drugstore",20436
88,2112,indoor,"museum/indoor, science_museum, archive, natural_history_museum, drugstore",20436
89,2136,indoor,"museum/indoor, archive, science_museum, drugstore, pharmacy",20436
90,2160,indoor,"archive, museum/indoor, science_museum, pharmacy, drugstore",20436
91,2184,indoor,"archive, museum/indoor, science_museum, pharmacy, drugstore",20436
92,2208,indoor,"archive, hospital, elevator/door, office_building, hospital_room",20436
93,2232,indoor,"shower, basement, bathroom, jail_cell, elevator/door",20436
94,2256,indoor,"reception, elevator/door, museum/indoor, pharmacy, elevator_lobby",20436
95,2280,indoor,"reception, elevator/door, museum/indoor, art_gallery, elevator_lobby",20436
96,2304,indoor,"reception, elevator/door, pharmacy, elevator_lobby, museum/indoor",20436
97,2328,indoor,"reception, elevator/door, pharmacy, elevator_lobby, museum/indoor",20436
98,2352,indoor,"reception, pharmacy, elevator/door, museum/indoor, elevator_lobby",20436
99,2376,indoor,"reception, elevator/door, museum/indoor, elevator_lobby, art_gallery",20436
100,2400,indoor,"reception, elevator/door, pharmacy, elevator_lobby, museum/indoor",20436
101,2424,indoor,"reception, elevator/door, pharmacy, museum/indoor, elevator_lobby",20436
102,2448,indoor,"reception, elevator/door, pharmacy, elevator_lobby, art_gallery",20436
103,2472,indoor,"reception, pharmacy, elevator/door, museum/indoor, elevator_lobby",20436
104,2496,indoor,"basement, hot_spring, closet, elevator/door, shower",20436
105,2520,outdoor,"hot_spring, sky, ice_shelf, iceberg, ocean",20436
106,2544,indoor,"clean_room, parking_garage/indoor, hospital, archive, crosswalk",20436
107,2568,indoor,"museum/indoor, clean_room, discotheque, archive, music_studio",20436
108,2592,indoor,"museum/indoor, discotheque, clean_room, bowling_alley, music_studio",20436
109,2616,indoor,"museum/indoor, clean_room, bowling_alley, archive, science_museum",20436
110,2640,indoor,"museum/indoor, discotheque, stage/indoor, bowling_alley, runway",20436
111,2664,indoor,"museum/indoor, bowling_alley, discotheque, clean_room, recreation_room",20436
112,2688,indoor,"museum/indoor, bowling_alley, stage/indoor, discotheque, archive",20436
113,2712,indoor,"museum/indoor, discotheque, clean_room, stage/indoor, bowling_alley",20436
114,2736,indoor,"discotheque, bowling_alley, stage/indoor, museum/indoor, music_studio",20436
115,2760,indoor,"museum/indoor, bowling_alley, stage/indoor, discotheque, boxing_ring",20436
116,2784,indoor,"museum/indoor, boxing_ring, bowling_alley, stage/indoor, discotheque",20436
117,2808,indoor,"clean_room, martial_arts_gym, dressing_room, hospital_room, nursery",20436
118,2832,indoor,"clean_room, museum/indoor, dressing_room, stage/indoor, martial_arts_gym",20436
119,2856,indoor,"clean_room, museum/indoor, dressing_room, nursery, martial_arts_gym",20436
120,2880,indoor,"clean_room, dressing_room, museum/indoor, martial_arts_gym, nursery",20436
121,2904,indoor,"clean_room, museum/indoor, art_gallery, science_museum, archive",20436
122,2928,indoor,"clean_room, museum/indoor, stage/indoor, martial_arts_gym, ballroom",20436
123,2952,indoor,"clean_room, dressing_room, locker_room, museum/indoor, discotheque",20436
124,2976,indoor,"dressing_room, museum/indoor, discotheque, sauna, clean_room",20436
125,3000,outdoor,"ice_shelf, iceberg, igloo, ice_floe, discotheque",20436
126,3024,indoor,"boxing_ring, gymnasium/indoor, martial_arts_gym, museum/indoor, ballroom",20436
127,3048,indoor,"discotheque, boxing_ring, museum/indoor, martial_arts_gym, dressing_room",20436
128,3072,indoor,"clean_room, dressing_room, museum/indoor, martial_arts_gym, ballroom",20436
129,3096,indoor,"museum/indoor, clean_room, art_gallery, nursery, archive",20436
130,3120,indoor,"museum/indoor, banquet_hall, clean_room, ice_cream_parlor, discotheque",20436
131,3144,outdoor,"crosswalk, boardwalk, promenade, bowling_alley, museum/indoor",20436
132,3168,indoor,"boxing_ring, museum/indoor, stage/indoor, martial_arts_gym, gymnasium/indoor",20436
133,3192,indoor,"discotheque, museum/indoor, ice_floe, ice_shelf, stage/indoor",20436
134,3216,indoor,"museum/indoor, ice_floe, banquet_hall, dining_hall, dining_room",20436
135,3240,outdoor,"museum/indoor, windmill, stage/indoor, ice_floe, playground",20436
136,3264,indoor,"museum/indoor, ice_shelf, stage/indoor, natural_history_museum, ice_floe",20436
137,3288,indoor,"museum/indoor, watering_hole, stage/indoor, art_gallery, natural_history_museum",20436
138,3312,indoor,"museum/indoor, field/wild, natural_history_museum, ice_floe, art_gallery",20436
139,3336,indoor,"museum/indoor, banquet_hall, dining_room, stage/indoor, natural_history_museum",20436
140,3360,indoor,"museum/indoor, stage/indoor, art_gallery, discotheque, natural_history_museum",20436
141,3384,indoor,"museum/indoor, clean_room, stage/indoor, archive, art_gallery",20436
142,3408,indoor,"museum/indoor, stage/indoor, discotheque, art_gallery, nursery",20436
143,3432,indoor,"museum/indoor, stage/indoor, clean_room, discotheque, gymnasium/indoor",20436
144,3456,indoor,"museum/indoor, stage/indoor, gymnasium/indoor, clean_room, ice_shelf",20436
145,3480,indoor,"museum/indoor, nursery, clean_room, stage/indoor, science_museum",20436
146,3504,indoor,"museum/indoor, stage/indoor, ice_shelf, archive, clothing_store",20436
147,3528,indoor,"clean_room, discotheque, dressing_room, nursery, ice_cream_parlor",20436
148,3552,indoor,"dressing_room, discotheque, shower, nursery, clean_room",20436
149,3576,indoor,"dressing_room, clean_room, sauna, hospital_room, discotheque",20436
150,3600,indoor,"dressing_room, sauna, locker_room, shower, bathroom",20436
151,3624,indoor,"dressing_room, clean_room, museum/indoor, nursery, chemistry_lab",20436
152,3648,indoor,"dressing_room, discotheque, nursery, clean_room, martial_arts_gym",20436
153,3672,indoor,"dressing_room, clean_room, sauna, discotheque, locker_room",20436
154,3696,indoor,"clean_room, museum/indoor, banquet_hall, ballroom, discotheque",20436
155,3720,indoor,"clean_room, museum/indoor, martial_arts_gym, operating_room, nursery",20436
156,3744,indoor,"clean_room, museum/indoor, operating_room, hospital_room, television_studio",20436
157,3768,indoor,"clean_room, museum/indoor, discotheque, stage/indoor, art_gallery",20436
158,3792,indoor,"dressing_room, discotheque, clean_room, shower, nursery",20436
159,3816,indoor,"discotheque, dressing_room, clean_room, shower, sauna",20436
160,3840,indoor,"reception, pharmacy, hospital, museum/indoor, elevator_lobby",20436
161,3864,indoor,"reception, pharmacy, elevator/door, hospital, elevator_lobby",20436
162,3888,indoor,"pharmacy, reception, hospital, drugstore, elevator/door",20436
163,3912,indoor,"reception, pharmacy, elevator_lobby, lobby, elevator/door",20436
164,3936,indoor,"reception, pharmacy, hospital, elevator/door, elevator_lobby",20436
165,3960,indoor,"reception, pharmacy, hospital, museum/indoor, elevator_lobby",20436
166,3984,indoor,"dressing_room, discotheque, clean_room, shower, locker_room",20436
167,4008,indoor,"discotheque, dressing_room, clean_room, sauna, shower",20436
168,4032,indoor,"dressing_room, locker_room, clean_room, discotheque, sauna",20436
169,4056,indoor,"dressing_room, locker_room, shower, sauna, nursery",20436
170,4080,indoor,"clean_room, martial_arts_gym, museum/indoor, operating_room, archive",20436
171,4104,indoor,"clean_room, martial_arts_gym, museum/indoor, operating_room, nursery",20436
172,4128,indoor,"clean_room, martial_arts_gym, toyshop, museum/indoor, nursery",20436
173,4152,indoor,"clean_room, martial_arts_gym, toyshop, kindergarden_classroom, nursery",20436
174,4176,indoor,"martial_arts_gym, clean_room, museum/indoor, gymnasium/indoor, boxing_ring",20436
175,4200,indoor,"clean_room, chemistry_lab, kindergarden_classroom, operating_room, hospital_room",20436
176,4224,indoor,"clean_room, kindergarden_classroom, museum/indoor, toyshop, archive",20436
177,4248,indoor,"clean_room, operating_room, hospital_room, martial_arts_gym, nursery",20436
178,4272,indoor,"clean_room, martial_arts_gym, operating_room, nursing_home, hospital_room",20436
179,4296,indoor,"clean_room, operating_room, martial_arts_gym, hospital_room, nursery",20436
180,4320,indoor,"clean_room, martial_arts_gym, operating_room, hospital_room, dressing_room",20436
181,4344,indoor,"clean_room, martial_arts_gym, operating_room, museum/indoor, archive",20436
182,4368,indoor,"clean_room, martial_arts_gym, operating_room, hospital_room, nursing_home",20436
183,4392,indoor,"clean_room, martial_arts_gym, operating_room, hospital_room, museum/indoor",20436
184,4416,indoor,"clean_room, operating_room, martial_arts_gym, hospital_room, archive",20436
185,4440,indoor,"clean_room, martial_arts_gym, operating_room, hospital_room, nursing_home",20436
186,4464,indoor,"clean_room, martial_arts_gym, operating_room, hospital_room, museum/indoor",20436
187,4488,indoor,"clean_room, martial_arts_gym, operating_room, museum/indoor, hospital_room",20436
188,4512,indoor,"clean_room, museum/indoor, iceberg, natural_history_museum, operating_room",20436
189,4536,indoor,"clean_room, museum/indoor, iceberg, art_gallery, natural_history_museum",20436
190,4560,indoor,"shower, chemistry_lab, clean_room, bathroom, biology_laboratory",20436
191,4584,indoor,"clean_room, chemistry_lab, biology_laboratory, dressing_room, discotheque",20436
192,4608,indoor,"dressing_room, locker_room, clean_room, classroom, bathroom",20436
193,4632,indoor,"dressing_room, operating_room, clean_room, bathroom, locker_room",20436
194,4656,indoor,"boxing_ring, martial_arts_gym, gymnasium/indoor, locker_room, operating_room",20436
195,4680,indoor,"dressing_room, clean_room, beauty_salon, gymnasium/indoor, locker_room",20436
196,4704,indoor,"clean_room, dressing_room, operating_room, beauty_salon, hospital_room",20436
197,4728,indoor,"clean_room, boxing_ring, martial_arts_gym, operating_room, dressing_room",20436
198,4752,indoor,"cafeteria, dining_hall, food_court, banquet_hall, classroom",20436
199,4776,indoor,"cafeteria, dining_hall, food_court, banquet_hall, restaurant",20436
200,4800,indoor,"cafeteria, dining_hall, food_court, banquet_hall, restaurant",20436
201,4824,indoor,"cafeteria, dining_hall, food_court, banquet_hall, chemistry_lab",20436
202,4848,indoor,"cafeteria, dining_hall, food_court, chemistry_lab, biology_laboratory",20436
203,4872,indoor,"cafeteria, dining_hall, chemistry_lab, food_court, biology_laboratory",20436
204,4896,indoor,"clean_room, office_cubicles, chemistry_lab, office, archive",20436
205,4920,indoor,"elevator/door, reception, pharmacy, elevator_lobby, museum/indoor",20436
206,4944,indoor,"elevator/door, reception, pharmacy, beauty_salon, museum/indoor",20436
207,4968,indoor,"elevator/door, reception, alcove, pharmacy, beauty_salon",20436
208,4992,indoor,"clean_room, staircase, museum/indoor, chemistry_lab, office",20436
209,5016,indoor,"clean_room, locker_room, elevator/door, bank_vault, corridor",20436
210,5040,indoor,"office, clean_room, office_cubicles, archive, locker_room",20436
211,5064,indoor,"clean_room, dressing_room, archive, locker_room, nursery",20436
212,5088,indoor,"reception, pharmacy, elevator/door, beauty_salon, museum/indoor",20436
213,5112,indoor,"reception, pharmacy, beauty_salon, drugstore, hospital",20436
214,5136,indoor,"reception, pharmacy, beauty_salon, drugstore, elevator/door",20436
215,5160,indoor,"reception, pharmacy, lobby, elevator_lobby, beauty_salon",20436
216,5184,indoor,"reception, pharmacy, drugstore, museum/indoor, beauty_salon",20436
217,5208,indoor,"dressing_room, clean_room, locker_room, archive, office",20436
218,5232,indoor,"dressing_room, clean_room, locker_room, nursery, bathroom",20436
219,5256,indoor,"dressing_room, clean_room, locker_room, bathroom, shower",20436
220,5280,indoor,"dressing_room, clean_room, locker_room, archive, museum/indoor",20436
221,5304,indoor,"reception, pharmacy, museum/indoor, hospital, art_gallery",20436
222,5328,indoor,"reception, pharmacy, museum/indoor, art_gallery, drugstore",20436
223,5352,indoor,"reception, museum/indoor, pharmacy, art_gallery, beauty_salon",20436
224,5376,indoor,"reception, museum/indoor, pharmacy, art_gallery, beauty_salon",20436
225,5400,indoor,"reception, museum/indoor, pharmacy, beauty_salon, art_gallery",20436
226,5424,indoor,"reception, museum/indoor, pharmacy, art_gallery, beauty_salon",20436
227,5448,indoor,"reception, museum/indoor, pharmacy, art_gallery, drugstore",20436
228,5472,indoor,"dressing_room, clean_room, locker_room, art_gallery, clothing_store",20436
229,5496,indoor,"clean_room, office, dressing_room, locker_room, office_cubicles",20436
230,5520,indoor,"clean_room, chemistry_lab, museum/indoor, ice_cream_parlor, operating_room",20436
231,5544,indoor,"dressing_room, museum/indoor, clean_room, ice_cream_parlor, chemistry_lab",20436
232,5568,indoor,"museum/indoor, clean_room, dressing_room, art_gallery, ice_cream_parlor",20436
233,5592,indoor,"museum/indoor, pharmacy, natural_history_museum, elevator/door, elevator_lobby",20436
234,5616,indoor,"reception, elevator_lobby, natural_history_museum, elevator/door, museum/indoor",20436
235,5640,indoor,"museum/indoor, natural_history_museum, elevator_lobby, pharmacy, reception",20436
236,5664,indoor,"museum/indoor, natural_history_museum, elevator/door, elevator_lobby, pharmacy",20436
237,5688,indoor,"museum/indoor, natural_history_museum, pharmacy, elevator/door, art_gallery",20436
238,5712,indoor,"museum/indoor, natural_history_museum, reception, elevator_lobby, pharmacy",20436
239,5736,indoor,"museum/indoor, natural_history_museum, pharmacy, elevator_lobby, reception",20436
240,5760,indoor,"museum/indoor, dressing_room, clean_room, art_gallery, ice_cream_parlor",20436
241,5784,indoor,"museum/indoor, chemistry_lab, clean_room, dressing_room, ice_cream_parlor",20436
242,5808,indoor,"clean_room, museum/indoor, chemistry_lab, ice_cream_parlor, iceberg",20436
243,5832,indoor,"clean_room, museum/indoor, chemistry_lab, ice_cream_parlor, dressing_room",20436
244,5856,indoor,"clean_room, ice_cream_parlor, chemistry_lab, museum/indoor, operating_room",20436
245,5880,indoor,"clean_room, dressing_room, chemistry_lab, museum/indoor, ice_cream_parlor",20436
246,5904,indoor,"chemistry_lab, clean_room, ice_cream_parlor, museum/indoor, biology_laboratory",20436
247,5928,indoor,"classroom, clean_room, chemistry_lab, biology_laboratory, physics_laboratory",20436
248,5952,indoor,"art_gallery, clean_room, locker_room, elevator/door, museum/indoor",20436
249,5976,indoor,"dressing_room, locker_room, clean_room, bathroom, clothing_store",20436
250,6000,indoor,"dressing_room, clean_room, locker_room, museum/indoor, art_gallery",20436
251,6024,indoor,"clean_room, dressing_room, locker_room, elevator/door, archive",20436
252,6048,indoor,"clean_room, dressing_room, discotheque, locker_room, bowling_alley",20436
253,6072,indoor,"elevator/door, reception, shower, elevator_lobby, hot_spring",20436
254,6096,indoor,"elevator/door, art_gallery, museum/indoor, alcove, elevator_lobby",20436
255,6120,indoor,"elevator/door, art_gallery, shower, museum/indoor, reception",20436
256,6144,indoor,"discotheque, museum/indoor, clean_room, dressing_room, locker_room",20436
257,6168,indoor,"discotheque, clean_room, museum/indoor, dressing_room, stage/indoor",20436
258,6192,indoor,"clean_room, dressing_room, museum/indoor, discotheque, ballroom",20436
259,6216,indoor,"clean_room, discotheque, museum/indoor, dressing_room, stage/indoor",20436
260,6240,indoor,"clean_room, dressing_room, discotheque, locker_room, chemistry_lab",20436
261,6264,indoor,"dressing_room, clean_room, locker_room, clothing_store, art_gallery",20436
262,6288,indoor,"dressing_room, clean_room, museum/indoor, clothing_store, art_gallery",20436
263,6312,indoor,"reception, pharmacy, elevator/door, beauty_salon, drugstore",20436
264,6336,indoor,"pharmacy, reception, elevator/door, hospital, drugstore",20436
265,6360,indoor,"reception, pharmacy, elevator/door, museum/indoor, drugstore",20436
266,6384,indoor,"pharmacy, reception, elevator/door, drugstore, hospital",20436
267,6408,indoor,"pharmacy, reception, elevator/door, drugstore, hospital",20436
268,6432,indoor,"clean_room, dressing_room, ballroom, locker_room, clothing_store",20436
269,6456,indoor,"dressing_room, clean_room, locker_room, clothing_store, ballroom",20436
270,6480,indoor,"dressing_room, clean_room, art_gallery, clothing_store, locker_room",20436
271,6504,indoor,"reception, pharmacy, ice_shelf, art_gallery, museum/indoor",20436
272,6528,indoor,"reception, pharmacy, art_gallery, nursery, museum/indoor",20436
273,6552,indoor,"reception, pharmacy, nursery, art_gallery, museum/indoor",20436
274,6576,indoor,"reception, pharmacy, elevator/door, nursery, museum/indoor",20436
275,6600,indoor,"reception, art_gallery, lobby, elevator_lobby, elevator/door",20436
276,6624,indoor,"reception, pharmacy, art_gallery, ice_shelf, lobby",20436
277,6648,indoor,"dressing_room, clean_room, clothing_store, locker_room, art_gallery",20436
278,6672,indoor,"clean_room, dressing_room, clothing_store, locker_room, elevator/door",20436
279,6696,indoor,"dressing_room, clean_room, locker_room, clothing_store, martial_arts_gym",20436
280,6720,indoor,"clean_room, dressing_room, locker_room, discotheque, chemistry_lab",20436
281,6744,indoor,"museum/indoor, natural_history_museum, pharmacy, cemetery, hospital",20436
282,6768,indoor,"museum/indoor, natural_history_museum, reception, booth/indoor, pharmacy",20436
283,6792,indoor,"museum/indoor, natural_history_museum, reception, pharmacy, booth/indoor",20436
284,6816,indoor,"museum/indoor, natural_history_museum, reception, archive, art_gallery",20436
285,6840,indoor,"museum/indoor, natural_history_museum, cemetery, pharmacy, hospital",20436
286,6864,indoor,"museum/indoor, natural_history_museum, pharmacy, reception, ice_shelf",20436
287,6888,indoor,"museum/indoor, natural_history_museum, pharmacy, art_gallery, cemetery",20436
288,6912,indoor,"museum/indoor, natural_history_museum, pharmacy, reception, booth/indoor",20436
289,6936,indoor,"museum/indoor, natural_history_museum, pharmacy, hospital, cemetery",20436
290,6960,indoor,"clean_room, dressing_room, clothing_store, art_gallery, museum/indoor",20436
