,frame_num,environment,places
0,0,outdoor,"lake/natural, pond, marsh, desert/sand, beach"
1,24,indoor,"shower, museum/indoor, chemistry_lab, art_gallery, tower"
2,48,indoor,"motel, coffee_shop, pharmacy, drugstore, gas_station"
3,72,outdoor,"motel, gas_station, laundromat, courthouse, bowling_alley"
4,96,outdoor,"motel, bowling_alley, gas_station, laundromat, courthouse"
5,120,indoor,"motel, bowling_alley, courthouse, laundromat, coffee_shop"
6,144,outdoor,"motel, bowling_alley, courthouse, gas_station, coffee_shop"
7,168,outdoor,"motel, courthouse, bowling_alley, gas_station, laundromat"
8,192,outdoor,"motel, courthouse, bowling_alley, laundromat, gas_station"
9,216,outdoor,"motel, laundromat, bowling_alley, gas_station, wind_farm"
10,240,outdoor,"motel, bowling_alley, gas_station, courthouse, laundromat"
11,264,outdoor,"motel, courthouse, bowling_alley, gas_station, wind_farm"
12,288,indoor,"motel, bowling_alley, coffee_shop, laundromat, gas_station"
13,312,indoor,"motel, pharmacy, drugstore, coffee_shop, locker_room"
14,336,outdoor,"desert/sand, sky, beach, lake/natural, marsh"
15,360,indoor,"museum/indoor, desert/sand, hospital, reception, hospital_room"
16,384,indoor,"museum/indoor, hospital, reception, hospital_room, art_gallery"
17,408,indoor,"museum/indoor, reception, art_gallery, airport_terminal, hospital"
18,432,indoor,"museum/indoor, reception, hospital, airport_terminal, hospital_room"
19,456,indoor,"museum/indoor, nursery, reception, hospital_room, ice_shelf"
20,480,indoor,"reception, hospital_room, nursery, hospital, museum/indoor"
21,504,outdoor,"hospital, museum/indoor, desert/sand, pharmacy, ice_shelf"
22,528,indoor,"hospital, museum/indoor, archive, pharmacy, ice_shelf"
23,552,indoor,"hospital, museum/indoor, desert/sand, archive, pharmacy"
24,576,indoor,"ice_shelf, museum/indoor, nursery, hospital, archive"
25,600,indoor,"ice_shelf, museum/indoor, nursery, archive, clothing_store"
26,624,indoor,"museum/indoor, attic, art_gallery, artists_loft, nursery"
27,648,indoor,"museum/indoor, art_gallery, attic, nursery, artists_loft"
28,672,indoor,"museum/indoor, attic, art_gallery, artists_loft, nursery"
29,696,indoor,"museum/indoor, ice_shelf, art_gallery, artists_loft, archive"
30,720,outdoor,"ice_shelf, desert/sand, hospital, museum/indoor, ocean"
31,744,indoor,"pharmacy, ice_shelf, hospital, drugstore, gift_shop"
32,768,indoor,"pharmacy, hospital, drugstore, hospital_room, gift_shop"
33,792,indoor,"pharmacy, hospital, drugstore, hospital_room, gift_shop"
34,816,indoor,"pharmacy, hospital, drugstore, hospital_room, gift_shop"
35,840,indoor,"museum/indoor, drugstore, pharmacy, desert/sand, beauty_salon"
36,864,indoor,"drugstore, museum/indoor, pharmacy, elevator/door, desert/sand"
37,888,indoor,"beauty_salon, drugstore, museum/indoor, pharmacy, coffee_shop"
38,912,indoor,"beauty_salon, drugstore, museum/indoor, pharmacy, coffee_shop"
39,936,indoor,"beauty_salon, drugstore, museum/indoor, pharmacy, coffee_shop"
40,960,indoor,"beauty_salon, drugstore, museum/indoor, pharmacy, coffee_shop"
41,984,indoor,"beauty_salon, museum/indoor, drugstore, coffee_shop, pharmacy"
42,1008,indoor,"library/indoor, archive, bookstore, gymnasium/indoor, airport_terminal"
43,1032,indoor,"library/indoor, classroom, gymnasium/indoor, archive, waiting_room"
44,1056,indoor,"library/indoor, archive, classroom, waiting_room, gymnasium/indoor"
45,1080,indoor,"archive, gymnasium/indoor, library/indoor, waiting_room, classroom"
46,1104,indoor,"gymnasium/indoor, library/indoor, archive, classroom, waiting_room"
47,1128,indoor,"classroom, ballroom, gymnasium/indoor, library/indoor, waiting_room"
48,1152,indoor,"gymnasium/indoor, waiting_room, library/indoor, archive, classroom"
49,1176,indoor,"gymnasium/indoor, locker_room, ballroom, waiting_room, kindergarden_classroom"
50,1200,indoor,"gymnasium/indoor, library/indoor, waiting_room, archive, classroom"
51,1224,indoor,"archive, porch, mezzanine, entrance_hall, staircase"
52,1248,indoor,"archive, atrium/public, mezzanine, clean_room, courtyard"
53,1272,indoor,"archive, clean_room, chemistry_lab, library/indoor, drugstore"
54,1296,indoor,"archive, pharmacy, drugstore, library/indoor, chemistry_lab"
55,1320,indoor,"ice_cream_parlor, archive, drugstore, library/indoor, pharmacy"
56,1344,indoor,"archive, clean_room, nursery, chemistry_lab, drugstore"
57,1368,indoor,"pharmacy, drugstore, beauty_salon, archive, clean_room"
58,1392,indoor,"beauty_salon, coffee_shop, drugstore, archive, ice_cream_parlor"
59,1416,indoor,"beauty_salon, coffee_shop, drugstore, ice_cream_parlor, pharmacy"
60,1440,indoor,"pharmacy, drugstore, beauty_salon, archive, bar"
61,1464,indoor,"archive, pharmacy, drugstore, clean_room, library/indoor"
62,1488,indoor,"chemistry_lab, archive, pharmacy, drugstore, clean_room"
63,1512,indoor,"pharmacy, drugstore, coffee_shop, clean_room, beauty_salon"
64,1536,indoor,"clean_room, server_room, atrium/public, lobby, drugstore"
65,1560,indoor,"clean_room, clothing_store, bow_window/indoor, archive, shopfront"
66,1584,indoor,"clean_room, archive, bookstore, shopfront, clothing_store"
67,1608,indoor,"clean_room, beauty_salon, hospital_room, bow_window/indoor, archive"
68,1632,indoor,"beauty_salon, jewelry_shop, clothing_store, coffee_shop, drugstore"
69,1656,indoor,"coffee_shop, beauty_salon, clothing_store, hospital_room, bakery/shop"
70,1680,indoor,"nursery, clean_room, clothing_store, bow_window/indoor, beauty_salon"
71,1704,indoor,"nursery, clothing_store, beauty_salon, elevator/door, bakery/shop"
72,1728,indoor,"nursery, hospital_room, clean_room, clothing_store, locker_room"
73,1752,indoor,"clothing_store, pharmacy, beauty_salon, bakery/shop, jewelry_shop"
74,1776,indoor,"clean_room, beauty_salon, jewelry_shop, pharmacy, bakery/shop"
75,1800,indoor,"beauty_salon, pharmacy, drugstore, jewelry_shop, clothing_store"
76,1824,indoor,"clean_room, beauty_salon, coffee_shop, operating_room, hospital_room"
77,1848,indoor,"coffee_shop, bakery/shop, jewelry_shop, beauty_salon, ice_cream_parlor"
78,1872,indoor,"bakery/shop, jewelry_shop, beauty_salon, nursery, clean_room"
79,1896,indoor,"beauty_salon, bow_window/indoor, reception, ticket_booth, archive"
80,1920,indoor,"clothing_store, locker_room, archive, clean_room, nursery"
81,1944,indoor,"clothing_store, archive, drugstore, department_store, pharmacy"
82,1968,indoor,"drugstore, clothing_store, beauty_salon, pharmacy, airport_terminal"
83,1992,indoor,"booth/indoor, beauty_salon, pharmacy, drugstore, ticket_booth"
84,2016,indoor,"drugstore, pharmacy, clean_room, coffee_shop, archive"
85,2040,indoor,"ticket_booth, pharmacy, clean_room, drugstore, archive"
86,2064,indoor,"ticket_booth, phone_booth, pharmacy, drugstore, shopfront"
87,2088,indoor,"pharmacy, drugstore, ticket_booth, jewelry_shop, shopfront"
88,2112,indoor,"ticket_booth, pharmacy, drugstore, clean_room, shopfront"
89,2136,indoor,"pharmacy, drugstore, archive, hardware_store, ticket_booth"
90,2160,indoor,"drugstore, pharmacy, ice_cream_parlor, booth/indoor, archive"
91,2184,indoor,"pharmacy, drugstore, bar, beauty_salon, chemistry_lab"
92,2208,indoor,"pharmacy, drugstore, beauty_salon, booth/indoor, archive"
93,2232,indoor,"pharmacy, drugstore, bar, beauty_salon, booth/indoor"
94,2256,indoor,"pharmacy, drugstore, beauty_salon, archive, bar"
95,2280,indoor,"drugstore, pharmacy, beauty_salon, ice_cream_parlor, coffee_shop"
96,2304,indoor,"pharmacy, drugstore, beauty_salon, archive, booth/indoor"
97,2328,indoor,"pharmacy, drugstore, beauty_salon, ice_cream_parlor, bar"
98,2352,indoor,"pharmacy, drugstore, booth/indoor, beauty_salon, coffee_shop"
99,2376,indoor,"pharmacy, drugstore, archive, beauty_salon, booth/indoor"
100,2400,indoor,"pharmacy, drugstore, beauty_salon, archive, booth/indoor"
101,2424,indoor,"pharmacy, drugstore, beauty_salon, booth/indoor, archive"
102,2448,indoor,"pharmacy, drugstore, beauty_salon, booth/indoor, ice_cream_parlor"
103,2472,indoor,"natural_history_museum, pharmacy, archive, science_museum, drugstore"
104,2496,indoor,"natural_history_museum, science_museum, archive, museum/indoor, pharmacy"
105,2520,indoor,"science_museum, natural_history_museum, archive, pharmacy, museum/indoor"
106,2544,indoor,"archive, pharmacy, drugstore, museum/indoor, science_museum"
107,2568,indoor,"archive, pharmacy, drugstore, museum/indoor, science_museum"
108,2592,indoor,"archive, pharmacy, drugstore, science_museum, museum/indoor"
109,2616,indoor,"archive, pharmacy, museum/indoor, drugstore, science_museum"
110,2640,indoor,"beauty_salon, hospital_room, dressing_room, office, office_cubicles"
111,2664,indoor,"beauty_salon, conference_center, conference_room, office, office_cubicles"
112,2688,indoor,"beauty_salon, hospital_room, pharmacy, reception, hospital"
113,2712,indoor,"chemistry_lab, discotheque, biology_laboratory, beauty_salon, stage/indoor"
114,2736,indoor,"chemistry_lab, restaurant, bar, stage/indoor, discotheque"
115,2760,indoor,"discotheque, stage/indoor, music_studio, chemistry_lab, ballroom"
116,2784,indoor,"banquet_hall, ballroom, stage/indoor, music_studio, discotheque"
117,2808,indoor,"discotheque, stage/indoor, bar, conference_center, television_studio"
118,2832,indoor,"dressing_room, beauty_salon, chemistry_lab, hospital_room, discotheque"
119,2856,indoor,"dressing_room, clean_room, beauty_salon, nursing_home, hospital_room"
120,2880,indoor,"clean_room, dressing_room, hospital_room, airplane_cabin, nursery"
121,2904,indoor,"discotheque, dressing_room, classroom, hospital_room, nursing_home"
122,2928,indoor,"dressing_room, discotheque, locker_room, clean_room, beauty_salon"
123,2952,indoor,"chemistry_lab, clean_room, biology_laboratory, dressing_room, ice_cream_parlor"
124,2976,indoor,"clean_room, dressing_room, chemistry_lab, hospital_room, operating_room"
125,3000,indoor,"dressing_room, clean_room, biology_laboratory, chemistry_lab, hospital_room"
126,3024,indoor,"clean_room, chemistry_lab, biology_laboratory, physics_laboratory, operating_room"
127,3048,indoor,"chemistry_lab, biology_laboratory, clean_room, beauty_salon, art_studio"
128,3072,indoor,"clean_room, biology_laboratory, chemistry_lab, operating_room, hospital_room"
129,3096,indoor,"clean_room, biology_laboratory, chemistry_lab, hospital_room, operating_room"
130,3120,indoor,"clean_room, biology_laboratory, chemistry_lab, hospital_room, operating_room"
131,3144,indoor,"clean_room, hospital_room, biology_laboratory, chemistry_lab, operating_room"
132,3168,indoor,"chemistry_lab, biology_laboratory, beauty_salon, hospital_room, clean_room"
133,3192,indoor,"dressing_room, beauty_salon, clean_room, chemistry_lab, biology_laboratory"
134,3216,indoor,"dressing_room, clean_room, chemistry_lab, biology_laboratory, hospital_room"
135,3240,indoor,"dressing_room, discotheque, ballroom, music_studio, shower"
136,3264,indoor,"dressing_room, clean_room, chemistry_lab, discotheque, clothing_store"
137,3288,indoor,"dressing_room, clean_room, hospital_room, restaurant, beauty_salon"
138,3312,indoor,"dressing_room, clean_room, beauty_salon, hospital_room, office"
139,3336,indoor,"dressing_room, clean_room, shower, bathroom, locker_room"
140,3360,indoor,"dressing_room, clean_room, beauty_salon, hospital_room, bathroom"
141,3384,indoor,"biology_laboratory, clean_room, chemistry_lab, classroom, dressing_room"
142,3408,indoor,"dressing_room, clean_room, shower, bathroom, museum/indoor"
143,3432,indoor,"dressing_room, shower, clean_room, bathroom, locker_room"
144,3456,indoor,"dressing_room, locker_room, shower, bathroom, clean_room"
145,3480,indoor,"dressing_room, restaurant, bar, office, dorm_room"
146,3504,indoor,"office, dressing_room, archive, home_office, bedroom"
147,3528,indoor,"office, home_office, dressing_room, bedroom, dorm_room"
148,3552,indoor,"office, dressing_room, bedroom, dorm_room, home_office"
149,3576,indoor,"office, dorm_room, home_office, bedroom, dressing_room"
150,3600,indoor,"office, home_office, dressing_room, dorm_room, archive"
151,3624,indoor,"dressing_room, youth_hostel, dorm_room, office, archive"
152,3648,indoor,"dressing_room, bedroom, hotel_room, living_room, bedchamber"
153,3672,indoor,"living_room, youth_hostel, bedroom, dorm_room, alcove"
154,3696,indoor,"dressing_room, clean_room, art_gallery, artists_loft, bow_window/indoor"
155,3720,indoor,"bow_window/indoor, archive, jail_cell, alcove, library/indoor"
156,3744,indoor,"bow_window/indoor, clean_room, archive, nursery, hospital_room"
157,3768,indoor,"bow_window/indoor, dining_room, alcove, jail_cell, living_room"
158,3792,indoor,"bow_window/indoor, alcove, entrance_hall, jail_cell, corridor"
159,3816,indoor,"bow_window/indoor, jail_cell, locker_room, alcove, entrance_hall"
160,3840,indoor,"bow_window/indoor, alcove, jail_cell, locker_room, artists_loft"
161,3864,indoor,"bow_window/indoor, alcove, nursery, entrance_hall, closet"
162,3888,indoor,"nursery, bow_window/indoor, dining_room, living_room, dressing_room"
163,3912,indoor,"nursery, bow_window/indoor, alcove, dining_room, bedroom"
164,3936,indoor,"bow_window/indoor, nursery, archive, bedroom, museum/indoor"
165,3960,indoor,"nursery, bow_window/indoor, bedroom, archive, dressing_room"
166,3984,indoor,"bow_window/indoor, nursery, archive, closet, dining_room"
167,4008,indoor,"nursery, bow_window/indoor, alcove, dining_room, bedroom"
168,4032,indoor,"clean_room, dining_room, bathroom, hospital_room, laundromat"
169,4056,indoor,"classroom, office_cubicles, archive, nursery, office"
170,4080,indoor,"bow_window/indoor, artists_loft, living_room, alcove, jail_cell"
171,4104,indoor,"bow_window/indoor, alcove, shower, kitchen, artists_loft"
172,4128,indoor,"bow_window/indoor, artists_loft, art_gallery, alcove, museum/indoor"
173,4152,indoor,"bow_window/indoor, alcove, artists_loft, living_room, art_gallery"
174,4176,indoor,"bow_window/indoor, shower, bathroom, alcove, sauna"
175,4200,outdoor,"courtyard, archive, locker_room, alley, hospital"
176,4224,outdoor,"archive, courtyard, alley, medina, construction_site"
177,4248,outdoor,"alley, archive, courtyard, office_building, building_facade"
178,4272,outdoor,"atrium/public, office_building, server_room, hospital, apartment_building/outdoor"
179,4296,outdoor,"office_building, hospital, atrium/public, skyscraper, building_facade"
180,4320,outdoor,"atrium/public, building_facade, archive, office_building, hospital"
181,4344,indoor,"atrium/public, archive, shopping_mall/indoor, office_building, server_room"
182,4368,indoor,"clean_room, nursery, doorway/outdoor, bow_window/indoor, archive"
183,4392,indoor,"clean_room, archive, office, nursery, chemistry_lab"
184,4416,indoor,"clean_room, archive, hospital_room, operating_room, bow_window/indoor"
185,4440,indoor,"clean_room, archive, hospital_room, operating_room, bow_window/indoor"
186,4464,indoor,"clean_room, hospital_room, archive, operating_room, beauty_salon"
187,4488,indoor,"clean_room, archive, hospital_room, office, operating_room"
188,4512,indoor,"archive, clean_room, beauty_salon, bar, chemistry_lab"
189,4536,indoor,"clean_room, archive, hospital_room, chemistry_lab, operating_room"
190,4560,indoor,"clean_room, locker_room, dressing_room, hospital_room, operating_room"
191,4584,indoor,"clean_room, dressing_room, locker_room, hospital_room, art_gallery"
192,4608,indoor,"clean_room, hospital_room, locker_room, operating_room, elevator/door"
193,4632,indoor,"clean_room, hospital_room, operating_room, locker_room, dressing_room"
194,4656,indoor,"clean_room, locker_room, dressing_room, shower, elevator/door"
195,4680,indoor,"clean_room, archive, hospital_room, locker_room, dressing_room"
196,4704,indoor,"dressing_room, clean_room, locker_room, hospital_room, shower"
197,4728,indoor,"clean_room, dressing_room, archive, locker_room, hospital_room"
198,4752,indoor,"archive, clean_room, dressing_room, museum/indoor, locker_room"
199,4776,indoor,"archive, clean_room, dressing_room, locker_room, nursery"
200,4800,indoor,"clean_room, archive, museum/indoor, dressing_room, locker_room"
201,4824,indoor,"archive, clean_room, dressing_room, museum/indoor, locker_room"
202,4848,indoor,"archive, clean_room, dressing_room, museum/indoor, locker_room"
203,4872,indoor,"dressing_room, clean_room, sauna, locker_room, closet"
204,4896,indoor,"clean_room, museum/indoor, art_gallery, dressing_room, shower"
205,4920,indoor,"clean_room, dressing_room, locker_room, museum/indoor, shower"
206,4944,indoor,"shower, museum/indoor, clean_room, discotheque, dressing_room"
207,4968,indoor,"clean_room, art_gallery, museum/indoor, shower, hospital_room"
208,4992,indoor,"clean_room, nursery, balcony/interior, staircase, hospital_room"
209,5016,indoor,"dressing_room, locker_room, hospital_room, bow_window/indoor, clean_room"
210,5040,indoor,"museum/indoor, dressing_room, shower, clean_room, natural_history_museum"
211,5064,indoor,"museum/indoor, bow_window/indoor, shower, ballroom, dressing_room"
212,5088,indoor,"clean_room, dressing_room, bow_window/indoor, museum/indoor, shower"
213,5112,indoor,"dressing_room, clean_room, museum/indoor, art_gallery, bow_window/indoor"
214,5136,indoor,"dressing_room, clean_room, shower, museum/indoor, elevator/door"
215,5160,indoor,"dressing_room, clean_room, locker_room, shower, elevator/door"
216,5184,indoor,"bow_window/indoor, clean_room, locker_room, elevator/door, shower"
217,5208,indoor,"clean_room, dressing_room, museum/indoor, shower, locker_room"
218,5232,indoor,"museum/indoor, clean_room, bow_window/indoor, entrance_hall, archive"
219,5256,indoor,"clean_room, museum/indoor, shower, dressing_room, alcove"
220,5280,indoor,"clean_room, museum/indoor, art_gallery, dressing_room, archive"
221,5304,indoor,"clean_room, hospital_room, dressing_room, operating_room, museum/indoor"
222,5328,indoor,"dressing_room, shower, clean_room, bathroom, locker_room"
223,5352,indoor,"clean_room, dressing_room, bathroom, shower, utility_room"
224,5376,indoor,"bow_window/indoor, dressing_room, clean_room, locker_room, bathroom"
225,5400,indoor,"clean_room, dressing_room, shower, bow_window/indoor, locker_room"
226,5424,indoor,"clean_room, dressing_room, bow_window/indoor, shower, closet"
227,5448,indoor,"clean_room, dressing_room, clothing_store, shower, closet"
228,5472,indoor,"clean_room, dressing_room, closet, bow_window/indoor, nursery"
229,5496,indoor,"clean_room, dressing_room, chemistry_lab, bow_window/indoor, archive"
230,5520,indoor,"clean_room, dressing_room, operating_room, chemistry_lab, hospital_room"
231,5544,indoor,"clean_room, dressing_room, operating_room, chemistry_lab, bow_window/indoor"
232,5568,indoor,"clean_room, chemistry_lab, dressing_room, biology_laboratory, bow_window/indoor"
233,5592,indoor,"clean_room, chemistry_lab, dressing_room, biology_laboratory, archive"
234,5616,indoor,"clean_room, chemistry_lab, biology_laboratory, dressing_room, operating_room"
235,5640,indoor,"clean_room, chemistry_lab, dressing_room, biology_laboratory, operating_room"
236,5664,indoor,"clean_room, chemistry_lab, biology_laboratory, dressing_room, bow_window/indoor"
237,5688,indoor,"clean_room, chemistry_lab, bow_window/indoor, dressing_room, biology_laboratory"
238,5712,indoor,"clean_room, chemistry_lab, dressing_room, biology_laboratory, archive"
239,5736,indoor,"clean_room, dressing_room, chemistry_lab, archive, biology_laboratory"
240,5760,indoor,"clean_room, dressing_room, chemistry_lab, archive, bow_window/indoor"
241,5784,indoor,"clean_room, dressing_room, bow_window/indoor, operating_room, chemistry_lab"
242,5808,indoor,"clean_room, dressing_room, chemistry_lab, bow_window/indoor, biology_laboratory"
243,5832,indoor,"clean_room, dressing_room, chemistry_lab, biology_laboratory, operating_room"
244,5856,indoor,"museum/indoor, art_gallery, clean_room, elevator/door, archive"
245,5880,indoor,"museum/indoor, art_gallery, clean_room, elevator/door, art_studio"
246,5904,indoor,"clean_room, dressing_room, chemistry_lab, biology_laboratory, hospital_room"
247,5928,indoor,"clean_room, dressing_room, chemistry_lab, biology_laboratory, hospital_room"
248,5952,indoor,"dressing_room, clean_room, beauty_salon, bathroom, art_studio"
249,5976,indoor,"dressing_room, clean_room, beauty_salon, chemistry_lab, biology_laboratory"
250,6000,indoor,"museum/indoor, art_gallery, clean_room, elevator/door, art_studio"
251,6024,indoor,"museum/indoor, art_gallery, clean_room, elevator/door, archive"
252,6048,indoor,"museum/indoor, art_gallery, clean_room, elevator/door, archive"
253,6072,indoor,"clean_room, dressing_room, hospital_room, nursing_home, operating_room"
254,6096,indoor,"clean_room, dressing_room, hospital_room, operating_room, nursing_home"
255,6120,indoor,"clean_room, dressing_room, beauty_salon, hospital_room, nursing_home"
256,6144,indoor,"clean_room, dressing_room, operating_room, hospital_room, nursing_home"
257,6168,indoor,"clean_room, dressing_room, hospital_room, operating_room, beauty_salon"
258,6192,indoor,"clean_room, dressing_room, operating_room, hospital_room, chemistry_lab"
259,6216,indoor,"clean_room, dressing_room, operating_room, hospital_room, chemistry_lab"
260,6240,indoor,"clean_room, dressing_room, operating_room, hospital_room, beauty_salon"
261,6264,indoor,"clean_room, dressing_room, hospital_room, beauty_salon, operating_room"
262,6288,indoor,"dressing_room, bow_window/indoor, clean_room, locker_room, kitchen"
263,6312,indoor,"dressing_room, shower, museum/indoor, sauna, bathroom"
264,6336,indoor,"dressing_room, clean_room, museum/indoor, shower, locker_room"
265,6360,indoor,"dressing_room, museum/indoor, clean_room, locker_room, shower"
266,6384,indoor,"clean_room, dressing_room, alcove, bathroom, artists_loft"
267,6408,indoor,"clean_room, dressing_room, shower, bathroom, sauna"
268,6432,indoor,"clean_room, sauna, dressing_room, locker_room, shower"
269,6456,indoor,"dressing_room, alcove, museum/indoor, bow_window/indoor, shower"
270,6480,indoor,"bedchamber, bedroom, dressing_room, clean_room, bow_window/indoor"
271,6504,indoor,"bow_window/indoor, bedroom, clean_room, bedchamber, locker_room"
272,6528,indoor,"bow_window/indoor, clean_room, elevator/door, shower, locker_room"
273,6552,indoor,"clean_room, dressing_room, shower, bathroom, elevator/door"
274,6576,indoor,"clean_room, dressing_room, locker_room, jail_cell, clothing_store"
275,6600,indoor,"clean_room, dressing_room, chemistry_lab, nursery, locker_room"
276,6624,indoor,"dressing_room, clothing_store, nursery, clean_room, jail_cell"
277,6648,indoor,"dressing_room, porch, nursery, bow_window/indoor, balcony/interior"
278,6672,indoor,"clean_room, dressing_room, locker_room, closet, clothing_store"
279,6696,indoor,"dressing_room, closet, clean_room, locker_room, clothing_store"
280,6720,indoor,"dressing_room, clean_room, locker_room, hospital_room, closet"
281,6744,indoor,"clean_room, dressing_room, locker_room, hospital_room, nursery"
282,6768,indoor,"clean_room, dressing_room, nursery, hospital_room, locker_room"
283,6792,indoor,"clean_room, locker_room, dressing_room, nursery, hospital_room"
284,6816,indoor,"dressing_room, clean_room, locker_room, closet, nursery"
285,6840,indoor,"dressing_room, clean_room, locker_room, nursery, closet"
286,6864,indoor,"dressing_room, clean_room, locker_room, closet, nursery"
287,6888,indoor,"clean_room, dressing_room, locker_room, closet, hospital_room"
288,6912,indoor,"clean_room, dressing_room, nursery, locker_room, hospital_room"
289,6936,indoor,"clean_room, dressing_room, locker_room, nursery, closet"
290,6960,indoor,"clean_room, locker_room, dressing_room, nursery, hospital_room"
291,6984,indoor,"clean_room, dressing_room, locker_room, nursery, hospital_room"
292,7008,indoor,"dressing_room, locker_room, clean_room, nursery, closet"
293,7032,indoor,"clean_room, locker_room, nursery, dressing_room, closet"
294,7056,indoor,"clean_room, dressing_room, locker_room, nursery, hospital_room"
295,7080,indoor,"clean_room, locker_room, dressing_room, nursery, hospital_room"
296,7104,indoor,"clean_room, dressing_room, locker_room, nursery, hospital_room"
297,7128,indoor,"clean_room, dressing_room, nursery, locker_room, hospital_room"
298,7152,indoor,"clean_room, dressing_room, locker_room, nursery, hospital_room"
299,7176,indoor,"clean_room, dressing_room, locker_room, nursery, hospital_room"
300,7200,indoor,"clean_room, locker_room, nursery, dressing_room, hospital_room"
301,7224,indoor,"nursery, dressing_room, clean_room, locker_room, archive"
302,7248,indoor,"clean_room, dressing_room, nursery, locker_room, hospital_room"
303,7272,indoor,"clean_room, dressing_room, nursery, locker_room, hospital_room"
304,7296,indoor,"dressing_room, clean_room, hospital_room, nursery, locker_room"
305,7320,indoor,"clean_room, dressing_room, hospital_room, operating_room, museum/indoor"
306,7344,indoor,"clean_room, dressing_room, operating_room, hospital_room, biology_laboratory"
307,7368,indoor,"clean_room, operating_room, hospital_room, dressing_room, music_studio"
308,7392,indoor,"clean_room, office, archive, locker_room, hospital_room"
309,7416,indoor,"clean_room, office, nursing_home, office_cubicles, dressing_room"
310,7440,indoor,"clean_room, office, archive, hospital_room, locker_room"
311,7464,indoor,"clean_room, office, operating_room, hospital_room, museum/indoor"
312,7488,indoor,"clean_room, operating_room, hospital_room, museum/indoor, nursing_home"
313,7512,indoor,"clean_room, operating_room, museum/indoor, hospital_room, locker_room"
314,7536,indoor,"clean_room, archive, clothing_store, closet, supermarket"
315,7560,indoor,"dressing_room, clean_room, shower, locker_room, bathroom"
316,7584,indoor,"dressing_room, locker_room, clean_room, shower, bathroom"
317,7608,indoor,"dressing_room, locker_room, clean_room, closet, shower"
318,7632,indoor,"dressing_room, locker_room, clean_room, closet, elevator/door"
319,7656,indoor,"dressing_room, locker_room, clean_room, closet, bathroom"
320,7680,indoor,"dressing_room, clean_room, locker_room, closet, bathroom"
