,frame_num,environment,places,imdb_id
0,0,outdoor,"desert/sand, sky, beach, lake/natural, marsh",35027
1,24,outdoor,"desert/sand, sky, beach, lake/natural, marsh",35027
2,48,outdoor,"desert/sand, sky, beach, lake/natural, marsh",35027
3,72,outdoor,"desert/sand, sky, beach, lake/natural, marsh",35027
4,96,outdoor,"desert/sand, sky, beach, lake/natural, marsh",35027
5,120,indoor,"motel, bowling_alley, gas_station, laundromat, locker_room",35027
6,144,indoor,"motel, bowling_alley, gas_station, locker_room, laundromat",35027
7,168,outdoor,"motel, gas_station, bowling_alley, courthouse, hospital_room",35027
8,192,outdoor,"motel, gas_station, bowling_alley, courthouse, hospital_room",35027
9,216,outdoor,"motel, gas_station, bowling_alley, courthouse, locker_room",35027
10,240,outdoor,"motel, gas_station, bowling_alley, courthouse, laundromat",35027
11,264,outdoor,"motel, gas_station, laundromat, bowling_alley, courthouse",35027
12,288,outdoor,"motel, gas_station, bowling_alley, locker_room, courthouse",35027
13,312,outdoor,"motel, gas_station, bowling_alley, laundromat, courthouse",35027
14,336,indoor,"motel, gas_station, bowling_alley, pharmacy, drugstore",35027
15,360,indoor,"motel, bowling_alley, gas_station, locker_room, pharmacy",35027
16,384,outdoor,"runway, motel, landing_deck, clean_room, museum/indoor",35027
17,408,outdoor,"desert/sand, beach, sky, lake/natural, marsh",35027
18,432,indoor,"pharmacy, drugstore, hospital_room, beauty_salon, museum/indoor",35027
19,456,indoor,"pharmacy, drugstore, hospital_room, beauty_salon, museum/indoor",35027
20,480,indoor,"pharmacy, drugstore, hospital_room, beauty_salon, museum/indoor",35027
21,504,indoor,"pharmacy, drugstore, hospital_room, beauty_salon, museum/indoor",35027
22,528,indoor,"pharmacy, drugstore, hospital_room, beauty_salon, museum/indoor",35027
23,552,indoor,"pharmacy, drugstore, hospital_room, beauty_salon, museum/indoor",35027
24,576,indoor,"hospital_room, pharmacy, drugstore, beauty_salon, museum/indoor",35027
25,600,indoor,"museum/indoor, hospital_room, pharmacy, hospital, drugstore",35027
26,624,outdoor,"ice_floe, museum/indoor, hospital, ice_shelf, oilrig",35027
27,648,outdoor,"ice_floe, ice_shelf, ocean, drugstore, desert/sand",35027
28,672,outdoor,"ice_shelf, ice_floe, drugstore, pharmacy, desert/sand",35027
29,696,outdoor,"ice_floe, ice_shelf, drugstore, ocean, pharmacy",35027
30,720,outdoor,"ice_shelf, ice_floe, ocean, drugstore, desert/sand",35027
31,744,outdoor,"ice_floe, ice_shelf, ocean, iceberg, museum/indoor",35027
32,768,outdoor,"ice_shelf, iceberg, ice_floe, drugstore, museum/indoor",35027
33,792,outdoor,"hospital, skyscraper, downtown, pharmacy, tower",35027
34,816,outdoor,"hospital, skyscraper, downtown, office_building, pharmacy",35027
35,840,outdoor,"hospital, skyscraper, downtown, office_building, pharmacy",35027
36,864,outdoor,"hospital, skyscraper, downtown, office_building, pharmacy",35027
37,888,indoor,"hospital, drugstore, pharmacy, skyscraper, museum/indoor",35027
38,912,indoor,"museum/indoor, drugstore, natural_history_museum, pharmacy, ice_floe",35027
39,936,indoor,"museum/indoor, drugstore, pharmacy, natural_history_museum, hospital",35027
40,960,indoor,"drugstore, pharmacy, museum/indoor, natural_history_museum, hospital",35027
41,984,indoor,"drugstore, pharmacy, museum/indoor, natural_history_museum, hospital",35027
42,1008,indoor,"drugstore, pharmacy, museum/indoor, natural_history_museum, hospital",35027
43,1032,indoor,"drugstore, pharmacy, museum/indoor, natural_history_museum, hospital",35027
44,1056,indoor,"drugstore, pharmacy, museum/indoor, natural_history_museum, hospital",35027
45,1080,indoor,"pharmacy, drugstore, museum/indoor, natural_history_museum, hospital",35027
46,1104,indoor,"museum/indoor, natural_history_museum, science_museum, drugstore, pharmacy",35027
47,1128,indoor,"museum/indoor, science_museum, natural_history_museum, drugstore, pharmacy",35027
48,1152,indoor,"museum/indoor, science_museum, natural_history_museum, drugstore, pharmacy",35027
49,1176,indoor,"museum/indoor, science_museum, drugstore, natural_history_museum, pharmacy",35027
50,1200,indoor,"museum/indoor, science_museum, drugstore, natural_history_museum, pharmacy",35027
51,1224,indoor,"museum/indoor, science_museum, drugstore, natural_history_museum, pharmacy",35027
52,1248,indoor,"museum/indoor, science_museum, drugstore, natural_history_museum, pharmacy",35027
53,1272,indoor,"museum/indoor, science_museum, drugstore, natural_history_museum, pharmacy",35027
54,1296,indoor,"museum/indoor, science_museum, drugstore, natural_history_museum, pharmacy",35027
55,1320,indoor,"museum/indoor, science_museum, drugstore, natural_history_museum, pharmacy",35027
56,1344,indoor,"museum/indoor, science_museum, drugstore, natural_history_museum, pharmacy",35027
57,1368,indoor,"museum/indoor, science_museum, drugstore, natural_history_museum, pharmacy",35027
58,1392,indoor,"museum/indoor, science_museum, drugstore, natural_history_museum, pharmacy",35027
59,1416,indoor,"museum/indoor, science_museum, drugstore, natural_history_museum, pharmacy",35027
60,1440,indoor,"museum/indoor, science_museum, drugstore, natural_history_museum, pharmacy",35027
61,1464,indoor,"museum/indoor, science_museum, drugstore, natural_history_museum, pharmacy",35027
62,1488,indoor,"museum/indoor, science_museum, drugstore, natural_history_museum, pharmacy",35027
63,1512,indoor,"museum/indoor, natural_history_museum, science_museum, drugstore, pharmacy",35027
64,1536,indoor,"pharmacy, hospital, drugstore, museum/indoor, bar",35027
65,1560,indoor,"hospital, pharmacy, drugstore, museum/indoor, skyscraper",35027
66,1584,indoor,"hospital, pharmacy, drugstore, museum/indoor, skyscraper",35027
67,1608,indoor,"hospital, pharmacy, drugstore, museum/indoor, skyscraper",35027
68,1632,outdoor,"hospital, drugstore, pharmacy, skyscraper, downtown",35027
69,1656,indoor,"museum/indoor, pharmacy, drugstore, hospital, ice_shelf",35027
70,1680,outdoor,"oilrig, tower, skyscraper, harbor, chemistry_lab",35027
71,1704,outdoor,"oilrig, chemistry_lab, harbor, tower, islet",35027
72,1728,outdoor,"oilrig, chemistry_lab, tower, wet_bar, harbor",35027
73,1752,outdoor,"oilrig, harbor, tower, chemistry_lab, jewelry_shop",35027
74,1776,indoor,"art_gallery, chemistry_lab, clean_room, shower, server_room",35027
75,1800,indoor,"basement, server_room, locker_room, art_gallery, bank_vault",35027
76,1824,indoor,"basement, bank_vault, server_room, locker_room, elevator/door",35027
77,1848,indoor,"locker_room, underwater/ocean_deep, harbor, shoe_shop, server_room",35027
78,1872,outdoor,"harbor, jewelry_shop, lake/natural, museum/indoor, pond",35027
79,1896,indoor,"server_room, shower, bank_vault, harbor, physics_laboratory",35027
80,1920,indoor,"tower, skyscraper, art_gallery, shower, server_room",35027
81,1944,outdoor,"oilrig, skyscraper, tower, harbor, ocean",35027
82,1968,outdoor,"skyscraper, tower, server_room, downtown, gymnasium/indoor",35027
83,1992,indoor,"skyscraper, chemistry_lab, tower, shower, physics_laboratory",35027
84,2016,indoor,"skyscraper, tower, chemistry_lab, museum/indoor, bar",35027
85,2040,indoor,"skyscraper, tower, chemistry_lab, shower, museum/indoor",35027
86,2064,outdoor,"skyscraper, tower, museum/indoor, chemistry_lab, downtown",35027
87,2088,indoor,"skyscraper, chemistry_lab, shower, tower, museum/indoor",35027
88,2112,indoor,"chemistry_lab, skyscraper, shower, tower, museum/indoor",35027
89,2136,outdoor,"skyscraper, shower, tower, downtown, server_room",35027
90,2160,indoor,"chemistry_lab, bar, oilrig, museum/indoor, physics_laboratory",35027
91,2184,outdoor,"tower, skyscraper, chemistry_lab, oilrig, harbor",35027
92,2208,indoor,"skyscraper, museum/indoor, tower, chemistry_lab, server_room",35027
93,2232,outdoor,"skyscraper, museum/indoor, tower, physics_laboratory, downtown",35027
94,2256,indoor,"skyscraper, shower, tower, chemistry_lab, physics_laboratory",35027
95,2280,indoor,"skyscraper, server_room, museum/indoor, tower, science_museum",35027
96,2304,indoor,"bank_vault, server_room, museum/indoor, skyscraper, science_museum",35027
97,2328,indoor,"server_room, shower, physics_laboratory, museum/indoor, bank_vault",35027
98,2352,indoor,"museum/indoor, server_room, art_gallery, shower, skyscraper",35027
99,2376,indoor,"server_room, bank_vault, museum/indoor, shower, shoe_shop",35027
100,2400,indoor,"server_room, archive, shoe_shop, museum/indoor, shower",35027
101,2424,indoor,"archive, shoe_shop, locker_room, server_room, art_gallery",35027
102,2448,indoor,"server_room, archive, locker_room, bank_vault, shoe_shop",35027
103,2472,indoor,"server_room, archive, locker_room, bank_vault, shoe_shop",35027
104,2496,indoor,"bank_vault, archive, server_room, locker_room, physics_laboratory",35027
105,2520,indoor,"server_room, bank_vault, museum/indoor, locker_room, physics_laboratory",35027
106,2544,indoor,"archive, museum/indoor, skyscraper, art_gallery, shoe_shop",35027
107,2568,indoor,"shower, bathroom, clean_room, beauty_salon, utility_room",35027
108,2592,indoor,"shower, bathroom, clean_room, chemistry_lab, server_room",35027
109,2616,indoor,"bathroom, shower, clean_room, chemistry_lab, beauty_salon",35027
110,2640,indoor,"bathroom, shower, beauty_salon, jacuzzi/indoor, operating_room",35027
111,2664,indoor,"clean_room, reception, elevator_lobby, corridor, basement",35027
112,2688,indoor,"shower, art_gallery, lake/natural, ocean, basement",35027
113,2712,outdoor,"lake/natural, desert/sand, art_gallery, beach, coast",35027
114,2736,indoor,"art_gallery, museum/indoor, clean_room, server_room, clothing_store",35027
115,2760,indoor,"museum/indoor, bank_vault, shower, art_gallery, archive",35027
116,2784,indoor,"museum/indoor, attic, art_gallery, archive, staircase",35027
117,2808,indoor,"museum/indoor, archive, art_gallery, locker_room, bank_vault",35027
118,2832,indoor,"museum/indoor, clean_room, archive, art_gallery, locker_room",35027
119,2856,indoor,"clean_room, shower, museum/indoor, art_gallery, locker_room",35027
120,2880,indoor,"museum/indoor, clean_room, shower, art_gallery, dressing_room",35027
121,2904,indoor,"shower, clean_room, museum/indoor, elevator_lobby, art_gallery",35027
122,2928,indoor,"shower, clean_room, museum/indoor, locker_room, elevator_lobby",35027
123,2952,indoor,"clean_room, museum/indoor, shower, dressing_room, art_gallery",35027
124,2976,indoor,"clean_room, shower, museum/indoor, locker_room, dressing_room",35027
125,3000,indoor,"museum/indoor, clean_room, shower, art_gallery, dressing_room",35027
126,3024,indoor,"shower, museum/indoor, clean_room, dressing_room, locker_room",35027
127,3048,indoor,"shower, clean_room, bathroom, bow_window/indoor, server_room",35027
128,3072,indoor,"clean_room, shower, server_room, locker_room, utility_room",35027
129,3096,indoor,"art_gallery, shower, museum/indoor, clean_room, tower",35027
130,3120,indoor,"lake/natural, shower, server_room, clean_room, pond",35027
131,3144,outdoor,"lake/natural, ice_floe, pond, islet, marsh",35027
132,3168,outdoor,"ice_shelf, ice_floe, lake/natural, pond, iceberg",35027
133,3192,outdoor,"ice_floe, ice_shelf, iceberg, lake/natural, pond",35027
134,3216,indoor,"jewelry_shop, science_museum, underwater/ocean_deep, beauty_salon, ice_shelf",35027
135,3240,indoor,"server_room, science_museum, locker_room, underwater/ocean_deep, airport_terminal",35027
136,3264,outdoor,"underwater/ocean_deep, ice_shelf, airport_terminal, ice_floe, server_room",35027
137,3288,outdoor,"ice_floe, underwater/ocean_deep, pond, harbor, ice_shelf",35027
138,3312,outdoor,"ice_floe, ice_shelf, underwater/ocean_deep, lake/natural, iceberg",35027
139,3336,outdoor,"ice_floe, ice_shelf, underwater/ocean_deep, iceberg, lake/natural",35027
140,3360,outdoor,"skyscraper, harbor, underwater/ocean_deep, tower, office_building",35027
141,3384,outdoor,"underwater/ocean_deep, server_room, science_museum, ice_floe, skyscraper",35027
142,3408,indoor,"jewelry_shop, shower, server_room, underwater/ocean_deep, clean_room",35027
143,3432,indoor,"server_room, jewelry_shop, underwater/ocean_deep, airport_terminal, science_museum",35027
144,3456,indoor,"underwater/ocean_deep, server_room, science_museum, museum/indoor, chemistry_lab",35027
145,3480,indoor,"jewelry_shop, server_room, museum/indoor, clean_room, skyscraper",35027
146,3504,indoor,"jewelry_shop, museum/indoor, science_museum, underwater/ocean_deep, server_room",35027
147,3528,indoor,"museum/indoor, jewelry_shop, clean_room, server_room, ice_shelf",35027
148,3552,indoor,"jewelry_shop, museum/indoor, ice_floe, underwater/ocean_deep, chemistry_lab",35027
149,3576,indoor,"server_room, clean_room, jewelry_shop, science_museum, museum/indoor",35027
150,3600,indoor,"server_room, skyscraper, jewelry_shop, archive, locker_room",35027
151,3624,indoor,"server_room, jewelry_shop, museum/indoor, underwater/ocean_deep, science_museum",35027
152,3648,indoor,"museum/indoor, underwater/ocean_deep, jewelry_shop, chemistry_lab, art_gallery",35027
153,3672,indoor,"jewelry_shop, museum/indoor, art_gallery, server_room, archive",35027
154,3696,indoor,"server_room, clean_room, jewelry_shop, underwater/ocean_deep, museum/indoor",35027
155,3720,indoor,"server_room, jewelry_shop, underwater/ocean_deep, museum/indoor, skyscraper",35027
156,3744,indoor,"underwater/ocean_deep, jewelry_shop, museum/indoor, skyscraper, shower",35027
157,3768,indoor,"jewelry_shop, science_museum, underwater/ocean_deep, server_room, museum/indoor",35027
158,3792,indoor,"jewelry_shop, science_museum, physics_laboratory, server_room, museum/indoor",35027
159,3816,indoor,"jewelry_shop, art_gallery, museum/indoor, science_museum, underwater/ocean_deep",35027
160,3840,outdoor,"desert/sand, lake/natural, marsh, coast, ocean",35027
161,3864,outdoor,"desert/sand, lake/natural, marsh, pond, beach",35027
162,3888,outdoor,"lake/natural, marsh, desert/sand, beach, ocean",35027
163,3912,outdoor,"museum/indoor, art_gallery, pond, marsh, lake/natural",35027
164,3936,outdoor,"lake/natural, pond, marsh, iceberg, ocean",35027
165,3960,outdoor,"lake/natural, sky, tower, pond, iceberg",35027
166,3984,outdoor,"pond, lake/natural, marsh, museum/indoor, science_museum",35027
167,4008,outdoor,"mountain_snowy, sky, ice_shelf, ice_floe, lake/natural",35027
168,4032,outdoor,"lake/natural, tower, pond, marsh, harbor",35027
169,4056,indoor,"shower, pond, lake/natural, museum/indoor, science_museum",35027
170,4080,indoor,"shower, science_museum, museum/indoor, lake/natural, nursery",35027
171,4104,indoor,"shower, lake/natural, pond, discotheque, museum/indoor",35027
172,4128,outdoor,"shower, lake/natural, tower, discotheque, pond",35027
173,4152,indoor,"museum/indoor, science_museum, natural_history_museum, pond, lake/natural",35027
174,4176,indoor,"classroom, natural_history_museum, nursery, science_museum, chemistry_lab",35027
175,4200,indoor,"natural_history_museum, science_museum, pond, museum/indoor, underwater/ocean_deep",35027
176,4224,indoor,"jewelry_shop, museum/indoor, natural_history_museum, science_museum, pond",35027
177,4248,indoor,"science_museum, server_room, jewelry_shop, art_gallery, museum/indoor",35027
178,4272,indoor,"jewelry_shop, locker_room, shoe_shop, elevator_lobby, airport_terminal",35027
179,4296,indoor,"server_room, locker_room, airport_terminal, elevator_lobby, jewelry_shop",35027
180,4320,indoor,"locker_room, server_room, jewelry_shop, shoe_shop, airport_terminal",35027
181,4344,indoor,"server_room, locker_room, jewelry_shop, shoe_shop, archive",35027
182,4368,indoor,"server_room, locker_room, bank_vault, elevator_lobby, elevator/door",35027
183,4392,indoor,"server_room, locker_room, clean_room, shower, elevator_lobby",35027
184,4416,indoor,"server_room, shower, clean_room, bathroom, locker_room",35027
185,4440,indoor,"science_museum, server_room, jewelry_shop, art_gallery, clean_room",35027
186,4464,indoor,"art_gallery, jewelry_shop, shoe_shop, museum/indoor, science_museum",35027
187,4488,indoor,"clean_room, jewelry_shop, museum/indoor, art_gallery, server_room",35027
188,4512,indoor,"jewelry_shop, museum/indoor, science_museum, art_gallery, clean_room",35027
189,4536,indoor,"jewelry_shop, science_museum, server_room, museum/indoor, underwater/ocean_deep",35027
190,4560,outdoor,"ice_floe, pond, underwater/ocean_deep, lake/natural, iceberg",35027
191,4584,outdoor,"ice_floe, iceberg, underwater/ocean_deep, pond, lake/natural",35027
192,4608,outdoor,"ice_floe, underwater/ocean_deep, iceberg, ice_shelf, clean_room",35027
193,4632,indoor,"pond, chemistry_lab, lake/natural, jewelry_shop, science_museum",35027
194,4656,outdoor,"lake/natural, pond, science_museum, underwater/ocean_deep, ice_floe",35027
195,4680,outdoor,"lake/natural, pond, underwater/ocean_deep, fishpond, marsh",35027
196,4704,indoor,"server_room, science_museum, underwater/ocean_deep, lake/natural, museum/indoor",35027
197,4728,indoor,"server_room, science_museum, museum/indoor, physics_laboratory, jewelry_shop",35027
198,4752,indoor,"server_room, bank_vault, jewelry_shop, clean_room, science_museum",35027
199,4776,indoor,"clean_room, science_museum, museum/indoor, jewelry_shop, chemistry_lab",35027
200,4800,outdoor,"underwater/ocean_deep, skyscraper, science_museum, ice_floe, oilrig",35027
201,4824,outdoor,"ice_floe, clean_room, server_room, iceberg, ice_shelf",35027
202,4848,outdoor,"ice_floe, iceberg, pond, lake/natural, ice_shelf",35027
203,4872,outdoor,"lake/natural, pond, server_room, skyscraper, shower",35027
204,4896,indoor,"basement, lobby, art_gallery, desert/sand, elevator_lobby",35027
205,4920,outdoor,"desert/sand, lake/natural, beach, ocean, coast",35027
206,4944,outdoor,"desert/sand, beach, coast, ocean, lake/natural",35027
207,4968,outdoor,"desert/sand, lake/natural, beach, marsh, ocean",35027
208,4992,outdoor,"desert/sand, beach, lake/natural, sky, art_gallery",35027
209,5016,outdoor,"desert/sand, beach, art_gallery, sky, islet",35027
210,5040,outdoor,"desert/sand, ice_shelf, art_gallery, iceberg, sky",35027
211,5064,outdoor,"desert/sand, islet, iceberg, ice_shelf, lake/natural",35027
212,5088,outdoor,"harbor, islet, lake/natural, desert/sand, coast",35027
213,5112,outdoor,"desert/sand, tower, lake/natural, shower, oilrig",35027
214,5136,outdoor,"desert/sand, lake/natural, pond, marsh, river",35027
215,5160,outdoor,"desert/sand, lake/natural, tower, art_gallery, oilrig",35027
216,5184,indoor,"desert/sand, art_gallery, museum/indoor, natural_history_museum, gift_shop",35027
217,5208,outdoor,"desert/sand, marsh, museum/indoor, lake/natural, natural_history_museum",35027
218,5232,outdoor,"desert/sand, sky, lake/natural, museum/indoor, desert/vegetation",35027
219,5256,outdoor,"desert/sand, lake/natural, sky, marsh, pond",35027
220,5280,outdoor,"desert/sand, lake/natural, pond, marsh, art_gallery",35027
221,5304,outdoor,"desert/sand, art_gallery, lake/natural, sky, museum/indoor",35027
222,5328,outdoor,"lake/natural, pond, marsh, natural_history_museum, fishpond",35027
223,5352,indoor,"museum/indoor, art_gallery, underwater/ocean_deep, science_museum, iceberg",35027
224,5376,indoor,"shower, art_gallery, ice_floe, pond, museum/indoor",35027
225,5400,indoor,"bank_vault, corridor, elevator/door, jail_cell, hotel_room",35027
226,5424,outdoor,"oilrig, harbor, chemistry_lab, ocean, landing_deck",35027
227,5448,indoor,"chemistry_lab, oilrig, science_museum, physics_laboratory, clean_room",35027
228,5472,indoor,"chemistry_lab, oilrig, physics_laboratory, science_museum, skyscraper",35027
229,5496,outdoor,"oilrig, chemistry_lab, skyscraper, harbor, science_museum",35027
230,5520,indoor,"chemistry_lab, oilrig, science_museum, physics_laboratory, clean_room",35027
231,5544,indoor,"chemistry_lab, oilrig, skyscraper, clean_room, physics_laboratory",35027
232,5568,outdoor,"oilrig, skyscraper, harbor, chemistry_lab, ice_floe",35027
233,5592,outdoor,"oilrig, skyscraper, tower, chemistry_lab, harbor",35027
234,5616,outdoor,"skyscraper, tower, oilrig, chemistry_lab, harbor",35027
235,5640,indoor,"museum/indoor, elevator/door, art_gallery, natural_history_museum, clean_room",35027
236,5664,indoor,"clean_room, art_gallery, museum/indoor, natural_history_museum, dressing_room",35027
237,5688,indoor,"clean_room, locker_room, museum/indoor, art_gallery, archive",35027
238,5712,indoor,"museum/indoor, natural_history_museum, clean_room, art_gallery, science_museum",35027
239,5736,indoor,"clean_room, locker_room, museum/indoor, dressing_room, art_gallery",35027
240,5760,indoor,"clean_room, locker_room, dressing_room, natural_history_museum, museum/indoor",35027
241,5784,indoor,"clean_room, museum/indoor, art_gallery, natural_history_museum, iceberg",35027
242,5808,indoor,"museum/indoor, natural_history_museum, art_gallery, science_museum, clean_room",35027
243,5832,indoor,"locker_room, dressing_room, clean_room, museum/indoor, art_gallery",35027
244,5856,indoor,"locker_room, dressing_room, clean_room, shower, museum/indoor",35027
245,5880,indoor,"locker_room, clean_room, dressing_room, shower, museum/indoor",35027
246,5904,indoor,"locker_room, clean_room, dressing_room, archive, bank_vault",35027
247,5928,indoor,"clean_room, shower, dressing_room, museum/indoor, chemistry_lab",35027
248,5952,indoor,"dressing_room, clean_room, music_studio, stage/indoor, ballroom",35027
249,5976,indoor,"museum/indoor, clean_room, music_studio, stage/indoor, television_studio",35027
250,6000,indoor,"music_studio, clean_room, stage/indoor, museum/indoor, television_studio",35027
251,6024,indoor,"museum/indoor, clean_room, art_gallery, dressing_room, archive",35027
252,6048,indoor,"museum/indoor, clean_room, art_gallery, music_studio, stage/indoor",35027
253,6072,indoor,"museum/indoor, clean_room, music_studio, art_gallery, stage/indoor",35027
254,6096,indoor,"museum/indoor, stage/indoor, music_studio, clean_room, art_gallery",35027
255,6120,indoor,"museum/indoor, music_studio, dressing_room, clean_room, television_studio",35027
256,6144,indoor,"museum/indoor, clean_room, dressing_room, art_gallery, jewelry_shop",35027
257,6168,indoor,"clean_room, dressing_room, museum/indoor, art_studio, bow_window/indoor",35027
258,6192,indoor,"clean_room, archive, museum/indoor, dressing_room, clothing_store",35027
259,6216,indoor,"clean_room, locker_room, server_room, archive, dressing_room",35027
260,6240,indoor,"clean_room, locker_room, archive, server_room, dressing_room",35027
261,6264,indoor,"clean_room, locker_room, archive, server_room, dressing_room",35027
262,6288,indoor,"locker_room, clean_room, dressing_room, archive, server_room",35027
263,6312,indoor,"clean_room, archive, dressing_room, locker_room, museum/indoor",35027
264,6336,indoor,"clothing_store, dressing_room, closet, clean_room, beauty_salon",35027
265,6360,indoor,"clean_room, dressing_room, lobby, archive, office",35027
266,6384,indoor,"entrance_hall, museum/indoor, staircase, lobby, clothing_store",35027
267,6408,indoor,"museum/indoor, art_gallery, natural_history_museum, clean_room, science_museum",35027
268,6432,indoor,"museum/indoor, clean_room, art_gallery, clothing_store, artists_loft",35027
269,6456,indoor,"clean_room, museum/indoor, operating_room, art_gallery, clothing_store",35027
270,6480,indoor,"clean_room, museum/indoor, clothing_store, art_gallery, operating_room",35027
271,6504,indoor,"clean_room, shower, dressing_room, museum/indoor, clothing_store",35027
272,6528,indoor,"clean_room, museum/indoor, operating_room, dressing_room, clothing_store",35027
273,6552,indoor,"clean_room, operating_room, museum/indoor, hospital_room, beauty_salon",35027
274,6576,indoor,"clean_room, museum/indoor, operating_room, dressing_room, beauty_salon",35027
275,6600,indoor,"clean_room, museum/indoor, operating_room, dressing_room, music_studio",35027
276,6624,indoor,"clean_room, museum/indoor, operating_room, dressing_room, beauty_salon",35027
277,6648,indoor,"clean_room, museum/indoor, operating_room, dressing_room, beauty_salon",35027
278,6672,indoor,"clean_room, operating_room, museum/indoor, dressing_room, beauty_salon",35027
279,6696,indoor,"clean_room, operating_room, museum/indoor, dressing_room, beauty_salon",35027
280,6720,indoor,"clean_room, operating_room, dressing_room, museum/indoor, beauty_salon",35027
281,6744,indoor,"museum/indoor, clean_room, art_gallery, science_museum, clothing_store",35027
282,6768,indoor,"museum/indoor, clean_room, iceberg, art_gallery, ice_floe",35027
283,6792,indoor,"clean_room, museum/indoor, operating_room, chemistry_lab, physics_laboratory",35027
284,6816,indoor,"clean_room, music_studio, operating_room, physics_laboratory, television_studio",35027
285,6840,indoor,"music_studio, clean_room, physics_laboratory, television_studio, operating_room",35027
286,6864,indoor,"clean_room, dining_room, museum/indoor, physics_laboratory, science_museum",35027
287,6888,indoor,"dining_room, living_room, museum/indoor, throne_room, clean_room",35027
288,6912,indoor,"dining_room, clean_room, living_room, museum/indoor, physics_laboratory",35027
289,6936,indoor,"physics_laboratory, museum/indoor, clean_room, music_studio, television_studio",35027
290,6960,indoor,"clean_room, museum/indoor, dining_room, dressing_room, physics_laboratory",35027
291,6984,indoor,"clean_room, museum/indoor, dressing_room, physics_laboratory, music_studio",35027
292,7008,indoor,"dressing_room, nursery, bedroom, museum/indoor, music_studio",35027
293,7032,indoor,"dressing_room, nursery, living_room, bedroom, museum/indoor",35027
294,7056,indoor,"dressing_room, nursery, bedroom, living_room, clean_room",35027
295,7080,indoor,"living_room, dressing_room, museum/indoor, dorm_room, office",35027
296,7104,indoor,"archive, chemistry_lab, science_museum, clean_room, nursery",35027
297,7128,indoor,"shower, dressing_room, chemistry_lab, science_museum, discotheque",35027
298,7152,indoor,"shoe_shop, museum/indoor, bar, coffee_shop, chemistry_lab",35027
