,frame_num,environment,places,imdb_id
1704,40896,indoor,"clean_room, elevator/door, locker_room, elevator_lobby, bank_vault",64437
1705,40920,indoor,"clean_room, elevator/door, locker_room, elevator_lobby, bank_vault",64437
1706,40944,indoor,"clean_room, elevator/door, locker_room, elevator_lobby, archive",64437
1707,40968,indoor,"clean_room, elevator/door, locker_room, elevator_lobby, bank_vault",64437
1708,40992,indoor,"clean_room, elevator/door, museum/indoor, office, elevator_lobby",64437
1709,41016,indoor,"clean_room, elevator/door, elevator_lobby, archive, locker_room",64437
1710,41040,indoor,"clean_room, locker_room, elevator/door, elevator_lobby, server_room",64437
1711,41064,indoor,"clean_room, locker_room, elevator/door, server_room, archive",64437
1712,41088,indoor,"locker_room, clean_room, elevator/door, archive, elevator_lobby",64437
1713,41112,indoor,"clean_room, locker_room, elevator/door, archive, office",64437
1714,41136,indoor,"clean_room, elevator/door, locker_room, elevator_lobby, archive",64437
1715,41160,indoor,"clean_room, elevator/door, locker_room, elevator_lobby, archive",64437
1716,41184,indoor,"archive, museum/indoor, clean_room, locker_room, elevator/door",64437
1717,41208,indoor,"clean_room, archive, museum/indoor, science_museum, elevator/door",64437
1718,41232,indoor,"clean_room, archive, music_studio, locker_room, office",64437
1719,41256,indoor,"clean_room, museum/indoor, music_studio, archive, office",64437
1720,41280,indoor,"clean_room, museum/indoor, archive, music_studio, office",64437
1721,41304,indoor,"clean_room, archive, museum/indoor, locker_room, office",64437
1722,41328,indoor,"clean_room, locker_room, museum/indoor, archive, music_studio",64437
1723,41352,indoor,"clean_room, archive, locker_room, museum/indoor, office",64437
1724,41376,indoor,"clean_room, office, archive, museum/indoor, music_studio",64437
1725,41400,indoor,"beauty_salon, office, biology_laboratory, airplane_cabin, locker_room",64437
1726,41424,indoor,"dressing_room, clothing_store, beauty_salon, department_store, classroom",64437
1727,41448,indoor,"dressing_room, clothing_store, martial_arts_gym, beauty_salon, discotheque",64437
1728,41472,indoor,"dressing_room, martial_arts_gym, television_studio, discotheque, music_studio",64437
1729,41496,outdoor,"clothing_store, martial_arts_gym, mosque/outdoor, desert/sand, ice_shelf",64437
1730,41520,outdoor,"desert/sand, ice_shelf, clothing_store, campsite, igloo",64437
1731,41544,outdoor,"office_building, skyscraper, clothing_store, library/outdoor, courthouse",64437
1732,41568,outdoor,"aqueduct, arch, viaduct, bridge, dam",64437
1733,41592,outdoor,"viaduct, aqueduct, bridge, arch, dam",64437
1734,41616,indoor,"atrium/public, escalator/indoor, shopping_mall/indoor, elevator_shaft, staircase",64437
1735,41640,indoor,"escalator/indoor, staircase, atrium/public, entrance_hall, shopping_mall/indoor",64437
1736,41664,indoor,"escalator/indoor, atrium/public, entrance_hall, staircase, museum/indoor",64437
1737,41688,indoor,"escalator/indoor, atrium/public, staircase, elevator_shaft, clean_room",64437
1738,41712,indoor,"atrium/public, escalator/indoor, clean_room, shopping_mall/indoor, staircase",64437
1739,41736,indoor,"atrium/public, escalator/indoor, elevator_shaft, shopping_mall/indoor, clean_room",64437
1740,41760,indoor,"escalator/indoor, atrium/public, shopping_mall/indoor, elevator_shaft, airplane_cabin",64437
1741,41784,indoor,"escalator/indoor, staircase, laundromat, airplane_cabin, locker_room",64437
1742,41808,indoor,"escalator/indoor, airplane_cabin, elevator_shaft, bus_interior, car_interior",64437
1743,41832,indoor,"escalator/indoor, airplane_cabin, car_interior, laundromat, bus_interior",64437
1744,41856,indoor,"escalator/indoor, playground, airplane_cabin, staircase, locker_room",64437
1745,41880,indoor,"escalator/indoor, airplane_cabin, laundromat, train_interior, bus_interior",64437
1746,41904,indoor,"car_interior, airplane_cabin, escalator/indoor, bus_interior, dressing_room",64437
1747,41928,indoor,"dressing_room, music_studio, gymnasium/indoor, car_interior, playground",64437
1748,41952,indoor,"dressing_room, music_studio, playground, bus_interior, gymnasium/indoor",64437
1749,41976,indoor,"clothing_store, airplane_cabin, closet, dressing_room, fabric_store",64437
1750,42000,indoor,"jail_cell, locker_room, basement, shower, clean_room",64437
1751,42024,indoor,"shower, basement, jail_cell, bathroom, locker_room",64437
1752,42048,indoor,"elevator/door, elevator_lobby, closet, shower, locker_room",64437
1753,42072,indoor,"jail_cell, shower, bathroom, closet, locker_room",64437
1754,42096,indoor,"dressing_room, beauty_salon, locker_room, clean_room, hospital_room",64437
1755,42120,indoor,"dressing_room, phone_booth, chemistry_lab, shower, beauty_salon",64437
1756,42144,indoor,"dressing_room, physics_laboratory, museum/indoor, music_studio, beauty_salon",64437
1757,42168,indoor,"dressing_room, museum/indoor, beauty_salon, locker_room, music_studio",64437
1758,42192,indoor,"dressing_room, museum/indoor, beauty_salon, clean_room, clothing_store",64437
1759,42216,indoor,"dressing_room, museum/indoor, beauty_salon, archive, clean_room",64437
1760,42240,indoor,"dressing_room, clean_room, hospital_room, locker_room, archive",64437
1761,42264,indoor,"clean_room, dressing_room, hospital_room, operating_room, archive",64437
1762,42288,indoor,"dressing_room, clean_room, beauty_salon, museum/indoor, locker_room",64437
1763,42312,indoor,"dressing_room, museum/indoor, beauty_salon, archive, clean_room",64437
1764,42336,indoor,"dressing_room, clean_room, beauty_salon, hospital_room, locker_room",64437
1765,42360,indoor,"dressing_room, clean_room, museum/indoor, music_studio, beauty_salon",64437
1766,42384,indoor,"dressing_room, beauty_salon, clean_room, museum/indoor, locker_room",64437
1767,42408,indoor,"beauty_salon, dressing_room, archive, hospital_room, museum/indoor",64437
1768,42432,indoor,"hospital_room, clean_room, beauty_salon, operating_room, hospital",64437
1769,42456,indoor,"hospital_room, beauty_salon, dressing_room, clean_room, operating_room",64437
1770,42480,indoor,"dressing_room, bedroom, beauty_salon, hotel_room, hospital_room",64437
1771,42504,indoor,"dressing_room, clean_room, hospital_room, bedroom, beauty_salon",64437
1772,42528,indoor,"dressing_room, beauty_salon, clean_room, hospital_room, hotel_room",64437
1773,42552,indoor,"elevator/door, clean_room, server_room, art_gallery, shower",64437
1774,42576,indoor,"elevator/door, shower, dressing_room, elevator_lobby, locker_room",64437
1775,42600,indoor,"elevator/door, shower, dressing_room, elevator_lobby, phone_booth",64437
1776,42624,indoor,"dressing_room, clean_room, office, beauty_salon, locker_room",64437
1777,42648,indoor,"bow_window/indoor, elevator/door, dressing_room, archive, beauty_salon",64437
1778,42672,indoor,"archive, museum/indoor, beauty_salon, dressing_room, locker_room",64437
1779,42696,indoor,"archive, beauty_salon, office, shoe_shop, bookstore",64437
1780,42720,indoor,"beauty_salon, office, archive, television_studio, library/indoor",64437
1781,42744,indoor,"shower, dressing_room, ice_shelf, museum/indoor, beauty_salon",64437
1782,42768,indoor,"living_room, bedroom, dressing_room, shower, bow_window/indoor",64437
1783,42792,indoor,"dressing_room, museum/indoor, living_room, waiting_room, bedroom",64437
1784,42816,indoor,"ice_shelf, bedroom, living_room, hotel_room, balcony/interior",64437
1785,42840,indoor,"bedroom, living_room, ice_shelf, home_theater, balcony/interior",64437
1786,42864,outdoor,"ice_shelf, hot_spring, bedroom, dressing_room, ocean",64437
1787,42888,outdoor,"ice_shelf, bedroom, dressing_room, hot_spring, ocean",64437
1788,42912,indoor,"shoe_shop, beauty_salon, dressing_room, classroom, museum/indoor",64437
1789,42936,indoor,"beauty_salon, dressing_room, archive, shoe_shop, museum/indoor",64437
1790,42960,indoor,"beauty_salon, dressing_room, museum/indoor, archive, jewelry_shop",64437
1791,42984,indoor,"museum/indoor, dressing_room, locker_room, shoe_shop, shower",64437
1792,43008,indoor,"beauty_salon, dressing_room, archive, office, locker_room",64437
1793,43032,indoor,"airport_terminal, office, bow_window/indoor, clean_room, clothing_store",64437
1794,43056,indoor,"clean_room, physics_laboratory, dressing_room, army_base, museum/indoor",64437
1795,43080,indoor,"dressing_room, shower, elevator/door, clean_room, locker_room",64437
1796,43104,indoor,"shower, beauty_salon, dressing_room, bedroom, ice_shelf",64437
1797,43128,indoor,"bedroom, artists_loft, office, computer_room, living_room",64437
1798,43152,indoor,"bedroom, dressing_room, balcony/interior, bathroom, artists_loft",64437
1799,43176,indoor,"shoe_shop, locker_room, dressing_room, recreation_room, museum/indoor",64437
1800,43200,indoor,"shoe_shop, museum/indoor, volleyball_court/outdoor, boxing_ring, ice_shelf",64437
1801,43224,indoor,"museum/indoor, shoe_shop, beauty_salon, dressing_room, volleyball_court/outdoor",64437
1802,43248,indoor,"shoe_shop, shower, volleyball_court/outdoor, boxing_ring, ice_shelf",64437
1803,43272,indoor,"museum/indoor, classroom, shower, dressing_room, boxing_ring",64437
1804,43296,indoor,"museum/indoor, shower, dressing_room, beauty_salon, shoe_shop",64437
1805,43320,indoor,"dressing_room, shower, shoe_shop, beauty_salon, museum/indoor",64437
1806,43344,indoor,"shoe_shop, museum/indoor, ice_shelf, dressing_room, shower",64437
1807,43368,indoor,"shoe_shop, dressing_room, waiting_room, office, bedroom",64437
1808,43392,indoor,"dressing_room, shoe_shop, bedroom, artists_loft, living_room",64437
1809,43416,indoor,"dressing_room, artists_loft, shoe_shop, bow_window/indoor, living_room",64437
1810,43440,indoor,"ice_shelf, waiting_room, computer_room, living_room, office",64437
1811,43464,indoor,"ice_shelf, computer_room, waiting_room, office, living_room",64437
1812,43488,indoor,"office, dressing_room, classroom, music_studio, conference_center",64437
1813,43512,indoor,"office, classroom, dressing_room, office_cubicles, conference_center",64437
1814,43536,indoor,"office, dressing_room, classroom, office_cubicles, music_studio",64437
1815,43560,indoor,"dressing_room, classroom, office, locker_room, office_cubicles",64437
1816,43584,indoor,"volleyball_court/outdoor, dressing_room, shower, ocean, ballroom",64437
1817,43608,indoor,"volleyball_court/outdoor, stage/indoor, museum/indoor, boxing_ring, music_studio",64437
1818,43632,indoor,"volleyball_court/outdoor, stage/indoor, museum/indoor, music_studio, ballroom",64437
1819,43656,indoor,"volleyball_court/outdoor, museum/indoor, boxing_ring, martial_arts_gym, boat_deck",64437
1820,43680,indoor,"volleyball_court/outdoor, museum/indoor, martial_arts_gym, boxing_ring, dressing_room",64437
1821,43704,indoor,"volleyball_court/outdoor, museum/indoor, dressing_room, boxing_ring, shoe_shop",64437
1822,43728,indoor,"volleyball_court/outdoor, boxing_ring, beauty_salon, gymnasium/indoor, dressing_room",64437
1823,43752,indoor,"classroom, volleyball_court/outdoor, beauty_salon, conference_center, boxing_ring",64437
1824,43776,indoor,"shoe_shop, museum/indoor, archive, martial_arts_gym, locker_room",64437
1825,43800,indoor,"ice_shelf, museum/indoor, dressing_room, classroom, waiting_room",64437
1826,43824,indoor,"ice_shelf, museum/indoor, living_room, waiting_room, computer_room",64437
1827,43848,indoor,"dressing_room, locker_room, boxing_ring, ballroom, classroom",64437
1828,43872,indoor,"dressing_room, volleyball_court/outdoor, museum/indoor, classroom, stage/indoor",64437
1829,43896,indoor,"dressing_room, volleyball_court/outdoor, ballroom, stage/indoor, shower",64437
1830,43920,indoor,"museum/indoor, dressing_room, classroom, shoe_shop, archive",64437
1831,43944,indoor,"museum/indoor, dressing_room, classroom, archive, office",64437
1832,43968,indoor,"dressing_room, ballroom, beauty_salon, shower, bathroom",64437
1833,43992,indoor,"dressing_room, ballroom, volleyball_court/outdoor, martial_arts_gym, boxing_ring",64437
1834,44016,indoor,"dressing_room, locker_room, ballroom, shower, beauty_salon",64437
1835,44040,indoor,"dressing_room, locker_room, ballroom, shoe_shop, classroom",64437
1836,44064,indoor,"dressing_room, ballroom, shower, locker_room, volleyball_court/outdoor",64437
1837,44088,indoor,"dressing_room, volleyball_court/outdoor, locker_room, shower, ballroom",64437
1838,44112,indoor,"dressing_room, volleyball_court/outdoor, locker_room, shoe_shop, shower",64437
1839,44136,indoor,"dressing_room, shower, volleyball_court/outdoor, locker_room, ballroom",64437
1840,44160,indoor,"dressing_room, shower, ballroom, beauty_salon, locker_room",64437
1841,44184,indoor,"dressing_room, locker_room, beauty_salon, ballroom, museum/indoor",64437
1842,44208,indoor,"dressing_room, locker_room, museum/indoor, beauty_salon, shoe_shop",64437
1843,44232,indoor,"dressing_room, shower, locker_room, bathroom, ballroom",64437
1844,44256,indoor,"dressing_room, ballroom, shower, bedroom, bathroom",64437
1845,44280,indoor,"dressing_room, ballroom, locker_room, bedroom, classroom",64437
1846,44304,indoor,"dressing_room, locker_room, ballroom, beauty_salon, museum/indoor",64437
1847,44328,indoor,"dressing_room, locker_room, ballroom, beauty_salon, volleyball_court/outdoor",64437
1848,44352,indoor,"dressing_room, ballroom, shower, locker_room, beauty_salon",64437
1849,44376,indoor,"volleyball_court/outdoor, shower, dressing_room, ballroom, locker_room",64437
1850,44400,indoor,"volleyball_court/outdoor, shower, ballroom, boxing_ring, dressing_room",64437
1851,44424,indoor,"volleyball_court/outdoor, ballroom, shower, boxing_ring, dressing_room",64437
1852,44448,indoor,"shower, dressing_room, volleyball_court/outdoor, ballroom, bathroom",64437
1853,44472,indoor,"dressing_room, volleyball_court/outdoor, shower, ballroom, beauty_salon",64437
1854,44496,indoor,"dressing_room, volleyball_court/outdoor, shower, ballroom, locker_room",64437
1855,44520,indoor,"dressing_room, volleyball_court/outdoor, shower, locker_room, ballroom",64437
1856,44544,indoor,"dressing_room, shower, ballroom, classroom, volleyball_court/outdoor",64437
1857,44568,indoor,"volleyball_court/outdoor, shower, boxing_ring, martial_arts_gym, stage/indoor",64437
1858,44592,indoor,"dressing_room, shower, classroom, volleyball_court/outdoor, ballroom",64437
1859,44616,indoor,"dressing_room, shower, bathroom, ballroom, locker_room",64437
1860,44640,indoor,"shower, dressing_room, beauty_salon, boxing_ring, locker_room",64437
1861,44664,indoor,"volleyball_court/outdoor, shower, dressing_room, shoe_shop, beauty_salon",64437
1862,44688,indoor,"volleyball_court/outdoor, dressing_room, shower, museum/indoor, classroom",64437
1863,44712,indoor,"museum/indoor, volleyball_court/outdoor, dressing_room, shower, shoe_shop",64437
1864,44736,indoor,"boxing_ring, martial_arts_gym, volleyball_court/outdoor, museum/indoor, gymnasium/indoor",64437
1865,44760,indoor,"clean_room, locker_room, ice_shelf, hospital_room, dressing_room",64437
1866,44784,indoor,"dressing_room, beauty_salon, hospital_room, operating_room, locker_room",64437
1867,44808,indoor,"dressing_room, clean_room, locker_room, museum/indoor, beauty_salon",64437
1868,44832,indoor,"clean_room, airport_terminal, museum/indoor, phone_booth, office",64437
1869,44856,indoor,"dressing_room, clean_room, elevator/door, shower, locker_room",64437
1870,44880,indoor,"locker_room, elevator/door, clean_room, laundromat, dressing_room",64437
1871,44904,indoor,"dressing_room, clean_room, locker_room, hospital_room, beauty_salon",64437
1872,44928,indoor,"clean_room, dressing_room, hospital_room, locker_room, chemistry_lab",64437
1873,44952,indoor,"clean_room, museum/indoor, dressing_room, locker_room, physics_laboratory",64437
1874,44976,indoor,"clean_room, dressing_room, museum/indoor, locker_room, martial_arts_gym",64437
1875,45000,indoor,"clean_room, dressing_room, locker_room, hospital_room, shower",64437
1876,45024,indoor,"shower, dressing_room, ice_shelf, bathroom, clean_room",64437
1877,45048,indoor,"dressing_room, beauty_salon, clean_room, shower, art_gallery",64437
1878,45072,indoor,"dressing_room, beauty_salon, museum/indoor, clean_room, office",64437
1879,45096,indoor,"dressing_room, beauty_salon, clean_room, museum/indoor, television_studio",64437
1880,45120,indoor,"clean_room, dressing_room, office, phone_booth, office_cubicles",64437
1881,45144,indoor,"dressing_room, clean_room, elevator/door, closet, shower",64437
1882,45168,indoor,"clean_room, elevator/door, locker_room, dressing_room, shower",64437
1883,45192,indoor,"shower, dressing_room, elevator/door, bathroom, closet",64437
1884,45216,indoor,"dressing_room, bow_window/indoor, artists_loft, clean_room, bedroom",64437
1885,45240,indoor,"locker_room, clean_room, elevator/door, dressing_room, shower",64437
1886,45264,indoor,"dressing_room, bedroom, shower, closet, locker_room",64437
1887,45288,indoor,"dressing_room, museum/indoor, beauty_salon, art_gallery, science_museum",64437
1888,45312,indoor,"clean_room, pharmacy, hospital_room, chemistry_lab, hospital",64437
1889,45336,indoor,"dressing_room, clean_room, nursery, classroom, beauty_salon",64437
1890,45360,indoor,"dressing_room, clean_room, beauty_salon, classroom, office",64437
1891,45384,indoor,"dressing_room, beauty_salon, clean_room, classroom, office",64437
1892,45408,indoor,"dressing_room, clean_room, beauty_salon, chemistry_lab, classroom",64437
1893,45432,indoor,"dressing_room, clean_room, beauty_salon, classroom, locker_room",64437
1894,45456,indoor,"dressing_room, locker_room, beauty_salon, clean_room, chemistry_lab",64437
1895,45480,indoor,"dressing_room, beauty_salon, clothing_store, office, clean_room",64437
1896,45504,indoor,"dressing_room, clean_room, beauty_salon, hospital_room, locker_room",64437
1897,45528,indoor,"dressing_room, museum/indoor, beauty_salon, clean_room, hospital_room",64437
1898,45552,indoor,"beauty_salon, museum/indoor, hospital_room, kindergarden_classroom, clean_room",64437
1899,45576,indoor,"shower, volleyball_court/outdoor, dressing_room, discotheque, beauty_salon",64437
1900,45600,indoor,"shower, dressing_room, discotheque, hospital_room, beauty_salon",64437
1901,45624,indoor,"clean_room, dressing_room, discotheque, clothing_store, hospital_room",64437
1902,45648,indoor,"clean_room, discotheque, hospital_room, dressing_room, television_studio",64437
1903,45672,indoor,"hospital_room, clean_room, discotheque, dressing_room, beauty_salon",64437
1904,45696,indoor,"hospital_room, discotheque, dressing_room, shower, beauty_salon",64437
1905,45720,indoor,"dressing_room, shower, bathroom, hospital_room, clothing_store",64437
1906,45744,indoor,"dressing_room, museum/indoor, kindergarden_classroom, martial_arts_gym, clothing_store",64437
1907,45768,indoor,"dressing_room, kindergarden_classroom, museum/indoor, martial_arts_gym, playground",64437
1908,45792,indoor,"dressing_room, museum/indoor, shower, beauty_salon, kindergarden_classroom",64437
1909,45816,indoor,"dressing_room, beauty_salon, shower, museum/indoor, kindergarden_classroom",64437
1910,45840,indoor,"dressing_room, beauty_salon, shower, bathroom, museum/indoor",64437
1911,45864,indoor,"dressing_room, beauty_salon, kindergarden_classroom, discotheque, locker_room",64437
1912,45888,indoor,"dressing_room, beauty_salon, shower, chemistry_lab, bathroom",64437
1913,45912,indoor,"dressing_room, shower, locker_room, bathroom, beauty_salon",64437
1914,45936,indoor,"dressing_room, locker_room, beauty_salon, shower, playground",64437
1915,45960,indoor,"locker_room, dressing_room, ice_shelf, clothing_store, elevator/door",64437
1916,45984,indoor,"elevator/door, shower, dressing_room, bow_window/indoor, archive",64437
1917,46008,indoor,"beauty_salon, dressing_room, bow_window/indoor, shower, classroom",64437
1918,46032,indoor,"dressing_room, bow_window/indoor, shower, archive, beauty_salon",64437
1919,46056,indoor,"archive, museum/indoor, dressing_room, bow_window/indoor, beauty_salon",64437
1920,46080,indoor,"museum/indoor, archive, dressing_room, bow_window/indoor, locker_room",64437
1921,46104,indoor,"museum/indoor, bow_window/indoor, dressing_room, archive, beauty_salon",64437
1922,46128,indoor,"dressing_room, classroom, closet, bow_window/indoor, clean_room",64437
1923,46152,indoor,"shower, closet, dressing_room, clothing_store, museum/indoor",64437
1924,46176,indoor,"dressing_room, elevator/door, locker_room, clean_room, museum/indoor",64437
1925,46200,indoor,"classroom, lecture_room, office, conference_room, computer_room",64437
1926,46224,outdoor,"museum/indoor, martial_arts_gym, volleyball_court/outdoor, amusement_park, playground",64437
1927,46248,indoor,"ice_shelf, dressing_room, ice_floe, museum/indoor, martial_arts_gym",64437
1928,46272,indoor,"dressing_room, shower, beauty_salon, bathroom, hospital_room",64437
1929,46296,indoor,"dressing_room, hospital_room, clean_room, nursing_home, kindergarden_classroom",64437
1930,46320,outdoor,"museum/indoor, ice_shelf, clean_room, igloo, campsite",64437
1931,46344,outdoor,"ice_shelf, museum/indoor, clean_room, ice_floe, igloo",64437
1932,46368,indoor,"dressing_room, hospital_room, ice_cream_parlor, classroom, clean_room",64437
1933,46392,indoor,"volleyball_court/outdoor, martial_arts_gym, dressing_room, clean_room, museum/indoor",64437
1934,46416,indoor,"dressing_room, clean_room, ice_shelf, jewelry_shop, ice_floe",64437
1935,46440,indoor,"dressing_room, clean_room, kindergarden_classroom, ice_shelf, museum/indoor",64437
1936,46464,indoor,"kindergarden_classroom, nursery, museum/indoor, clean_room, ice_shelf",64437
1937,46488,indoor,"nursery, kindergarden_classroom, museum/indoor, ice_shelf, martial_arts_gym",64437
1938,46512,indoor,"dressing_room, ice_shelf, kindergarden_classroom, ice_floe, art_school",64437
1939,46536,indoor,"dressing_room, nursery, clean_room, classroom, ice_shelf",64437
1940,46560,outdoor,"ice_shelf, ice_floe, igloo, iceberg, clean_room",64437
1941,46584,indoor,"beauty_salon, ice_shelf, ice_floe, dressing_room, clean_room",64437
1942,46608,indoor,"dressing_room, clean_room, beauty_salon, hospital_room, chemistry_lab",64437
1943,46632,indoor,"clean_room, dressing_room, hospital_room, biology_laboratory, chemistry_lab",64437
1944,46656,indoor,"clean_room, dressing_room, archive, hospital_room, classroom",64437
1945,46680,indoor,"clean_room, hospital_room, dressing_room, operating_room, beauty_salon",64437
1946,46704,indoor,"dressing_room, clean_room, chemistry_lab, hospital_room, beauty_salon",64437
1947,46728,indoor,"hospital_room, clean_room, dressing_room, operating_room, nursing_home",64437
1948,46752,indoor,"dressing_room, beauty_salon, museum/indoor, hospital_room, clean_room",64437
1949,46776,indoor,"dressing_room, chemistry_lab, beauty_salon, biology_laboratory, clean_room",64437
1950,46800,indoor,"dressing_room, beauty_salon, clean_room, biology_laboratory, chemistry_lab",64437
1951,46824,indoor,"dressing_room, clean_room, biology_laboratory, clothing_store, beauty_salon",64437
1952,46848,indoor,"dressing_room, biology_laboratory, beauty_salon, chemistry_lab, gift_shop",64437
1953,46872,indoor,"dressing_room, beauty_salon, biology_laboratory, jewelry_shop, gift_shop",64437
1954,46896,indoor,"dressing_room, biology_laboratory, beauty_salon, chemistry_lab, jewelry_shop",64437
1955,46920,indoor,"biology_laboratory, ice_floe, chemistry_lab, iceberg, clean_room",64437
1956,46944,indoor,"shower, dressing_room, elevator/door, beauty_salon, music_studio",64437
1957,46968,indoor,"shower, locker_room, beauty_salon, dressing_room, elevator/door",64437
1958,46992,indoor,"shower, beauty_salon, clean_room, locker_room, dressing_room",64437
1959,47016,indoor,"shower, dressing_room, locker_room, beauty_salon, bathroom",64437
1960,47040,indoor,"shower, clean_room, locker_room, dressing_room, elevator/door",64437
1961,47064,indoor,"shower, locker_room, dressing_room, phone_booth, clean_room",64437
1962,47088,indoor,"dressing_room, shower, bathroom, beauty_salon, locker_room",64437
1963,47112,indoor,"shower, dressing_room, locker_room, clean_room, beauty_salon",64437
1964,47136,indoor,"shower, dressing_room, bathroom, sauna, beauty_salon",64437
1965,47160,indoor,"shower, locker_room, beauty_salon, phone_booth, bathroom",64437
1966,47184,indoor,"shower, beauty_salon, bathroom, locker_room, dressing_room",64437
1967,47208,indoor,"shower, dressing_room, bathroom, beauty_salon, discotheque",64437
1968,47232,indoor,"dressing_room, shower, beauty_salon, bathroom, locker_room",64437
1969,47256,indoor,"dressing_room, shower, beauty_salon, bathroom, clean_room",64437
1970,47280,indoor,"dressing_room, shower, discotheque, beauty_salon, locker_room",64437
1971,47304,indoor,"arch, cockpit, museum/indoor, science_museum, mosque/outdoor",64437
1972,47328,indoor,"cockpit, airplane_cabin, beauty_salon, igloo, amusement_arcade",64437
1973,47352,outdoor,"cockpit, igloo, arch, rock_arch, beauty_salon",64437
1974,47376,indoor,"cockpit, television_studio, amusement_arcade, amusement_park, recreation_room",64437
1975,47400,outdoor,"arch, ball_pit, amusement_park, igloo, campsite",64437
1976,47424,indoor,"television_studio, museum/indoor, hospital_room, recreation_room, arch",64437
1977,47448,indoor,"dressing_room, museum/indoor, beauty_salon, television_studio, martial_arts_gym",64437
1978,47472,indoor,"dressing_room, museum/indoor, volleyball_court/outdoor, martial_arts_gym, arch",64437
1979,47496,outdoor,"arch, igloo, museum/indoor, rock_arch, airfield",64437
1980,47520,indoor,"museum/indoor, dressing_room, runway, soccer_field, hospital_room",64437
1981,47544,indoor,"arch, museum/indoor, hospital_room, dressing_room, laundromat",64437
1982,47568,outdoor,"arch, museum/indoor, hospital_room, campsite, igloo",64437
1983,47592,indoor,"arch, campsite, cockpit, hospital_room, museum/indoor",64437
1984,47616,indoor,"arch, campsite, dressing_room, clothing_store, cockpit",64437
