,frame_num,environment,places
3689,88536,indoor,"clean_room, closet, dressing_room, bow_window/indoor, locker_room"
3690,88560,indoor,"dressing_room, clean_room, closet, locker_room, clothing_store"
3691,88584,indoor,"clean_room, operating_room, dressing_room, hospital_room, museum/indoor"
3692,88608,indoor,"clean_room, dressing_room, museum/indoor, archive, hospital_room"
3693,88632,indoor,"archive, clean_room, museum/indoor, library/indoor, atrium/public"
3694,88656,indoor,"clean_room, dressing_room, museum/indoor, archive, art_gallery"
3695,88680,indoor,"clean_room, dressing_room, museum/indoor, art_gallery, archive"
3696,88704,indoor,"dressing_room, locker_room, clean_room, office, elevator/door"
3697,88728,indoor,"locker_room, dressing_room, clean_room, shower, office"
3698,88752,indoor,"classroom, jail_cell, locker_room, office, chemistry_lab"
3699,88776,indoor,"laundromat, dressing_room, archive, clean_room, conference_room"
3700,88800,indoor,"conference_room, archive, conference_center, office, lecture_room"
3701,88824,indoor,"laundromat, conference_room, office_cubicles, office, airplane_cabin"
3702,88848,indoor,"dressing_room, museum/indoor, clean_room, clothing_store, art_gallery"
3703,88872,indoor,"dressing_room, museum/indoor, clean_room, clothing_store, hospital_room"
3704,88896,indoor,"museum/indoor, clean_room, dressing_room, art_gallery, clothing_store"
3705,88920,indoor,"clean_room, dressing_room, museum/indoor, clothing_store, operating_room"
3706,88944,indoor,"clean_room, museum/indoor, dressing_room, clothing_store, art_gallery"
3707,88968,indoor,"museum/indoor, clean_room, dressing_room, clothing_store, art_gallery"
3708,88992,indoor,"museum/indoor, clean_room, dressing_room, art_gallery, clothing_store"
3709,89016,indoor,"dressing_room, clean_room, museum/indoor, clothing_store, hospital_room"
3710,89040,indoor,"dressing_room, museum/indoor, clean_room, clothing_store, art_gallery"
3711,89064,indoor,"conference_room, office_cubicles, office, airplane_cabin, laundromat"
3712,89088,indoor,"conference_room, laundromat, archive, office_cubicles, dressing_room"
3713,89112,indoor,"conference_room, office, office_cubicles, laundromat, bow_window/indoor"
3714,89136,indoor,"office_cubicles, office, conference_room, airplane_cabin, laundromat"
3715,89160,indoor,"museum/indoor, dressing_room, clean_room, clothing_store, art_gallery"
3716,89184,indoor,"museum/indoor, dressing_room, clean_room, clothing_store, art_gallery"
3717,89208,indoor,"clean_room, dressing_room, museum/indoor, clothing_store, art_gallery"
3718,89232,indoor,"clean_room, dressing_room, museum/indoor, clothing_store, operating_room"
3719,89256,indoor,"clean_room, dressing_room, museum/indoor, clothing_store, art_gallery"
3720,89280,indoor,"conference_room, office, office_cubicles, bow_window/indoor, airplane_cabin"
3721,89304,indoor,"conference_room, office_cubicles, office, conference_center, bow_window/indoor"
3722,89328,indoor,"conference_room, office_cubicles, airplane_cabin, office, bow_window/indoor"
3723,89352,indoor,"conference_room, airplane_cabin, clean_room, office_cubicles, office"
3724,89376,indoor,"conference_room, office_cubicles, airplane_cabin, office, clean_room"
3725,89400,indoor,"shower, bathroom, jail_cell, locker_room, clean_room"
3726,89424,indoor,"shower, bathroom, locker_room, jail_cell, clean_room"
3727,89448,indoor,"shower, bathroom, locker_room, jail_cell, clean_room"
3728,89472,indoor,"shower, locker_room, bathroom, jail_cell, clean_room"
3729,89496,indoor,"shower, bathroom, clean_room, locker_room, jail_cell"
3730,89520,indoor,"bathroom, shower, locker_room, clean_room, bow_window/indoor"
3731,89544,indoor,"locker_room, clean_room, archive, sauna, dressing_room"
3732,89568,indoor,"locker_room, clean_room, dressing_room, shower, bathroom"
3733,89592,indoor,"clean_room, shower, locker_room, bow_window/indoor, jail_cell"
3734,89616,indoor,"clean_room, shower, bow_window/indoor, locker_room, bathroom"
3735,89640,indoor,"bow_window/indoor, clean_room, locker_room, office, shower"
3736,89664,indoor,"clean_room, utility_room, laundromat, locker_room, bow_window/indoor"
3737,89688,indoor,"clean_room, locker_room, office, bow_window/indoor, laundromat"
3738,89712,indoor,"office, clean_room, office_cubicles, locker_room, reception"
3739,89736,indoor,"clean_room, locker_room, laundromat, kitchen, hospital_room"
3740,89760,indoor,"clean_room, laundromat, bathroom, utility_room, locker_room"
3741,89784,indoor,"laundromat, clean_room, dressing_room, bathroom, locker_room"
3742,89808,indoor,"laundromat, clean_room, locker_room, dressing_room, utility_room"
3743,89832,indoor,"clean_room, dressing_room, nursing_home, nursery, office"
3744,89856,indoor,"clean_room, art_gallery, dressing_room, nursery, office"
3745,89880,indoor,"clean_room, dressing_room, art_gallery, art_studio, office"
3746,89904,indoor,"dressing_room, clean_room, locker_room, art_studio, art_gallery"
3747,89928,indoor,"dressing_room, clean_room, airplane_cabin, hospital_room, art_studio"
3748,89952,indoor,"dressing_room, clean_room, bathroom, hospital_room, operating_room"
3749,89976,indoor,"dressing_room, clean_room, locker_room, bathroom, airplane_cabin"
3750,90000,indoor,"dressing_room, clean_room, locker_room, airplane_cabin, hospital_room"
3751,90024,indoor,"dressing_room, clean_room, locker_room, airplane_cabin, art_studio"
3752,90048,indoor,"dressing_room, clean_room, locker_room, airplane_cabin, hospital_room"
3753,90072,indoor,"dressing_room, clean_room, locker_room, airplane_cabin, hospital_room"
3754,90096,indoor,"dressing_room, clean_room, airplane_cabin, locker_room, hospital_room"
3755,90120,indoor,"dressing_room, clean_room, airplane_cabin, locker_room, art_studio"
3756,90144,indoor,"dressing_room, airplane_cabin, clean_room, locker_room, hospital_room"
3757,90168,indoor,"dressing_room, clean_room, airplane_cabin, locker_room, art_studio"
3758,90192,indoor,"dressing_room, clean_room, locker_room, airplane_cabin, clothing_store"
3759,90216,indoor,"dressing_room, clean_room, art_studio, art_gallery, locker_room"
3760,90240,indoor,"atrium/public, campus, shopping_mall/indoor, beauty_salon, staircase"
3761,90264,indoor,"office, office_cubicles, bow_window/indoor, clean_room, dressing_room"
3762,90288,indoor,"bow_window/indoor, clean_room, office, archive, office_cubicles"
3763,90312,indoor,"museum/indoor, office, art_gallery, reception, dressing_room"
3764,90336,indoor,"museum/indoor, office, art_gallery, reception, dressing_room"
3765,90360,indoor,"office, museum/indoor, art_gallery, reception, office_cubicles"
3766,90384,indoor,"bow_window/indoor, clean_room, office, office_cubicles, locker_room"
3767,90408,indoor,"bow_window/indoor, closet, clean_room, office, archive"
3768,90432,indoor,"bow_window/indoor, office, office_cubicles, clean_room, dressing_room"
3769,90456,indoor,"museum/indoor, office, art_gallery, reception, office_cubicles"
3770,90480,indoor,"museum/indoor, office, art_gallery, dressing_room, reception"
3771,90504,indoor,"bow_window/indoor, office, dressing_room, clean_room, office_cubicles"
3772,90528,indoor,"bow_window/indoor, office, clean_room, office_cubicles, closet"
3773,90552,indoor,"bow_window/indoor, office, clean_room, dressing_room, office_cubicles"
3774,90576,indoor,"atrium/public, airplane_cabin, staircase, campus, shopping_mall/indoor"
3775,90600,indoor,"atrium/public, airplane_cabin, staircase, campus, shopping_mall/indoor"
3776,90624,indoor,"atrium/public, staircase, campus, airplane_cabin, museum/indoor"
3777,90648,indoor,"clean_room, office, office_cubicles, bow_window/indoor, dressing_room"
3778,90672,indoor,"clean_room, office, dressing_room, office_cubicles, bow_window/indoor"
3779,90696,indoor,"bow_window/indoor, clean_room, office, dressing_room, office_cubicles"
3780,90720,indoor,"clean_room, dressing_room, office, bow_window/indoor, office_cubicles"
3781,90744,indoor,"clean_room, bow_window/indoor, office, dressing_room, office_cubicles"
3782,90768,indoor,"bow_window/indoor, clean_room, office, dressing_room, office_cubicles"
3783,90792,indoor,"clean_room, bow_window/indoor, office, office_cubicles, dressing_room"
3784,90816,indoor,"museum/indoor, office, art_gallery, dressing_room, office_cubicles"
3785,90840,indoor,"clean_room, office, dressing_room, office_cubicles, bow_window/indoor"
3786,90864,indoor,"clean_room, office, bow_window/indoor, dressing_room, office_cubicles"
3787,90888,indoor,"office, museum/indoor, art_gallery, office_cubicles, reception"
3788,90912,indoor,"office, museum/indoor, art_gallery, reception, office_cubicles"
3789,90936,indoor,"bow_window/indoor, clean_room, office, office_cubicles, dressing_room"
3790,90960,indoor,"bow_window/indoor, office, archive, office_cubicles, clean_room"
3791,90984,indoor,"museum/indoor, office, art_gallery, reception, office_cubicles"
3792,91008,indoor,"bow_window/indoor, office, archive, office_cubicles, clean_room"
3793,91032,indoor,"bow_window/indoor, archive, clean_room, office, closet"
3794,91056,indoor,"bow_window/indoor, office, office_cubicles, clean_room, dressing_room"
3795,91080,indoor,"bow_window/indoor, office, archive, office_cubicles, closet"
3796,91104,indoor,"bow_window/indoor, office, office_cubicles, dressing_room, archive"
3797,91128,indoor,"museum/indoor, office, art_gallery, reception, dressing_room"
3798,91152,indoor,"art_gallery, museum/indoor, office, dressing_room, reception"
3799,91176,indoor,"staircase, atrium/public, airplane_cabin, entrance_hall, shopping_mall/indoor"
3800,91200,indoor,"art_gallery, museum/indoor, office, reception, dressing_room"
3801,91224,indoor,"dressing_room, gymnasium/indoor, music_studio, discotheque, boxing_ring"
3802,91248,indoor,"clean_room, dressing_room, art_gallery, hospital_room, locker_room"
3803,91272,indoor,"clean_room, dressing_room, nursery, laundromat, hospital_room"
3804,91296,indoor,"dressing_room, clean_room, airplane_cabin, art_gallery, office"
3805,91320,indoor,"dressing_room, clean_room, office, bathroom, hospital_room"
3806,91344,indoor,"dressing_room, bathroom, clean_room, office, shower"
3807,91368,indoor,"dressing_room, clean_room, hotel_room, office, beauty_salon"
3808,91392,indoor,"dining_room, bow_window/indoor, dressing_room, nursery, artists_loft"
3809,91416,indoor,"dressing_room, clean_room, nursery, bathroom, shower"
3810,91440,indoor,"dressing_room, clean_room, bathroom, shower, nursery"
3811,91464,indoor,"bathroom, shower, clean_room, dressing_room, nursery"
3812,91488,indoor,"bathroom, dressing_room, clean_room, shower, staircase"
3813,91512,indoor,"clean_room, bathroom, laundromat, shower, dressing_room"
3814,91536,indoor,"clean_room, archive, chemistry_lab, shower, atrium/public"
3815,91560,indoor,"clean_room, archive, hospital_room, operating_room, locker_room"
3816,91584,indoor,"clean_room, archive, locker_room, dressing_room, sauna"
3817,91608,indoor,"clean_room, archive, operating_room, hospital_room, dressing_room"
3818,91632,indoor,"clean_room, archive, gymnasium/indoor, museum/indoor, dressing_room"
3819,91656,indoor,"clean_room, archive, operating_room, hospital_room, museum/indoor"
3820,91680,indoor,"clean_room, laundromat, archive, dressing_room, locker_room"
3821,91704,indoor,"clean_room, laundromat, locker_room, utility_room, archive"
3822,91728,indoor,"clean_room, laundromat, clothing_store, utility_room, dressing_room"
3823,91752,indoor,"clean_room, laundromat, utility_room, gymnasium/indoor, locker_room"
3824,91776,indoor,"laundromat, clean_room, utility_room, archive, locker_room"
3825,91800,indoor,"clean_room, laundromat, archive, locker_room, dressing_room"
3826,91824,indoor,"conference_room, office_cubicles, office, reception, conference_center"
3827,91848,indoor,"conference_room, conference_center, waiting_room, office, office_cubicles"
3828,91872,indoor,"locker_room, laundromat, archive, clean_room, nursery"
3829,91896,indoor,"locker_room, dressing_room, clothing_store, clean_room, nursery"
3830,91920,indoor,"dressing_room, clothing_store, locker_room, clean_room, museum/indoor"
3831,91944,indoor,"clean_room, dressing_room, locker_room, clothing_store, archive"
3832,91968,indoor,"clean_room, dressing_room, clothing_store, museum/indoor, archive"
3833,91992,indoor,"staircase, entrance_hall, clean_room, museum/indoor, atrium/public"
3834,92016,indoor,"dressing_room, clean_room, clothing_store, locker_room, nursery"
3835,92040,indoor,"clean_room, archive, chemistry_lab, classroom, biology_laboratory"
3836,92064,indoor,"archive, clean_room, reception, chemistry_lab, library/indoor"
3837,92088,indoor,"archive, reception, clean_room, library/indoor, office"
3838,92112,indoor,"nursery, dressing_room, clothing_store, bow_window/indoor, beauty_salon"
3839,92136,indoor,"dressing_room, nursery, classroom, beauty_salon, archive"
3840,92160,indoor,"dressing_room, museum/indoor, television_studio, art_gallery, art_studio"
3841,92184,indoor,"dressing_room, clean_room, clothing_store, discotheque, locker_room"
3842,92208,indoor,"dressing_room, beauty_salon, reception, clothing_store, art_gallery"
3843,92232,indoor,"dressing_room, clothing_store, clean_room, beauty_salon, archive"
3844,92256,indoor,"dressing_room, clean_room, museum/indoor, art_gallery, clothing_store"
3845,92280,indoor,"entrance_hall, lobby, porch, staircase, atrium/public"
3846,92304,indoor,"entrance_hall, porch, lobby, atrium/public, staircase"
3847,92328,indoor,"entrance_hall, lobby, atrium/public, porch, shopping_mall/indoor"
3848,92352,indoor,"lobby, atrium/public, entrance_hall, shopping_mall/indoor, porch"
3849,92376,indoor,"entrance_hall, lobby, staircase, porch, atrium/public"
3850,92400,indoor,"lobby, entrance_hall, atrium/public, porch, shopping_mall/indoor"
3851,92424,indoor,"clean_room, airport_terminal, entrance_hall, lobby, escalator/indoor"
3852,92448,indoor,"entrance_hall, airport_terminal, lobby, bow_window/indoor, atrium/public"
3853,92472,indoor,"dressing_room, bow_window/indoor, jail_cell, locker_room, nursery"
3854,92496,indoor,"locker_room, jail_cell, dressing_room, clean_room, shower"
3855,92520,indoor,"dressing_room, locker_room, clean_room, jail_cell, closet"
3856,92544,indoor,"jail_cell, locker_room, archive, butchers_shop, boxing_ring"
3857,92568,indoor,"bow_window/indoor, dressing_room, nursery, classroom, clean_room"
3858,92592,indoor,"dressing_room, clean_room, hospital_room, archive, nursery"
3859,92616,indoor,"dressing_room, ballroom, clothing_store, shower, bedroom"
3860,92640,indoor,"dressing_room, clothing_store, museum/indoor, archive, art_gallery"
3861,92664,indoor,"clean_room, dressing_room, museum/indoor, art_gallery, archive"
3862,92688,indoor,"dressing_room, clothing_store, beauty_salon, clean_room, chemistry_lab"
3863,92712,indoor,"dressing_room, beauty_salon, clean_room, office, museum/indoor"
3864,92736,indoor,"dressing_room, discotheque, archive, bar, clean_room"
3865,92760,indoor,"dressing_room, locker_room, beauty_salon, archive, clothing_store"
3866,92784,indoor,"dressing_room, locker_room, clean_room, clothing_store, discotheque"
3867,92808,indoor,"dressing_room, locker_room, clothing_store, beauty_salon, office"
3868,92832,indoor,"dressing_room, locker_room, clean_room, archive, clothing_store"
3869,92856,indoor,"locker_room, dressing_room, archive, clean_room, clothing_store"
3870,92880,indoor,"dressing_room, clothing_store, locker_room, shower, beauty_salon"
3871,92904,indoor,"dressing_room, clothing_store, locker_room, department_store, clean_room"
3872,92928,indoor,"dressing_room, locker_room, clothing_store, archive, clean_room"
3873,92952,indoor,"dressing_room, clothing_store, archive, locker_room, clean_room"
3874,92976,indoor,"dressing_room, clothing_store, locker_room, clean_room, discotheque"
3875,93000,indoor,"dressing_room, clothing_store, locker_room, archive, discotheque"
3876,93024,indoor,"dressing_room, clothing_store, locker_room, shower, discotheque"
3877,93048,indoor,"dressing_room, clothing_store, locker_room, clean_room, department_store"
3878,93072,indoor,"dressing_room, clothing_store, locker_room, shower, closet"
3879,93096,indoor,"locker_room, dressing_room, clean_room, butchers_shop, art_gallery"
3880,93120,indoor,"locker_room, gymnasium/indoor, clean_room, dressing_room, archive"
3881,93144,indoor,"clean_room, locker_room, art_gallery, artists_loft, archive"
3882,93168,indoor,"locker_room, clean_room, dressing_room, clothing_store, chemistry_lab"
3883,93192,indoor,"dressing_room, clean_room, locker_room, clothing_store, discotheque"
3884,93216,indoor,"dressing_room, locker_room, clean_room, clothing_store, department_store"
3885,93240,indoor,"locker_room, dressing_room, clean_room, clothing_store, art_gallery"
3886,93264,indoor,"museum/indoor, clean_room, dressing_room, jewelry_shop, reception"
3887,93288,indoor,"dressing_room, clean_room, shower, locker_room, bathroom"
3888,93312,indoor,"dressing_room, clean_room, beauty_salon, locker_room, shower"
3889,93336,indoor,"dressing_room, clean_room, gymnasium/indoor, locker_room, beauty_salon"
3890,93360,indoor,"clean_room, dressing_room, archive, physics_laboratory, chemistry_lab"
3891,93384,indoor,"clean_room, dressing_room, archive, physics_laboratory, museum/indoor"
3892,93408,indoor,"clean_room, dressing_room, archive, physics_laboratory, nursery"
3893,93432,indoor,"dressing_room, beauty_salon, clean_room, wet_bar, chemistry_lab"
3894,93456,indoor,"dressing_room, clean_room, beauty_salon, locker_room, shower"
3895,93480,indoor,"clean_room, dressing_room, archive, nursery, museum/indoor"
3896,93504,indoor,"clean_room, dressing_room, archive, physics_laboratory, museum/indoor"
3897,93528,indoor,"clean_room, dressing_room, archive, museum/indoor, physics_laboratory"
3898,93552,indoor,"dressing_room, clean_room, locker_room, beauty_salon, shower"
3899,93576,indoor,"dressing_room, clean_room, beauty_salon, reception, jewelry_shop"
3900,93600,indoor,"dressing_room, jewelry_shop, reception, clean_room, beauty_salon"
3901,93624,indoor,"dressing_room, clean_room, jewelry_shop, reception, beauty_salon"
3902,93648,indoor,"clean_room, dressing_room, archive, physics_laboratory, chemistry_lab"
3903,93672,indoor,"clean_room, dressing_room, physics_laboratory, archive, museum/indoor"
3904,93696,indoor,"clean_room, dressing_room, archive, physics_laboratory, museum/indoor"
3905,93720,indoor,"clean_room, dressing_room, physics_laboratory, museum/indoor, archive"
3906,93744,indoor,"archive, clean_room, dressing_room, office_cubicles, office"
3907,93768,indoor,"dressing_room, clean_room, archive, reception, office"
3908,93792,indoor,"dressing_room, clean_room, reception, office, archive"
3909,93816,indoor,"dressing_room, clean_room, reception, beauty_salon, chemistry_lab"
3910,93840,indoor,"dressing_room, clean_room, beauty_salon, jewelry_shop, museum/indoor"
3911,93864,indoor,"clean_room, dressing_room, archive, physics_laboratory, museum/indoor"
3912,93888,indoor,"clean_room, dressing_room, archive, museum/indoor, physics_laboratory"
3913,93912,indoor,"dressing_room, clean_room, jewelry_shop, archive, beauty_salon"
3914,93936,indoor,"dressing_room, clean_room, archive, museum/indoor, beauty_salon"
3915,93960,indoor,"dressing_room, clean_room, shower, beauty_salon, jewelry_shop"
3916,93984,indoor,"dressing_room, beauty_salon, living_room, clean_room, office"
3917,94008,indoor,"dressing_room, beauty_salon, clean_room, chemistry_lab, office"
3918,94032,indoor,"dressing_room, clean_room, museum/indoor, jewelry_shop, beauty_salon"
3919,94056,indoor,"clean_room, beauty_salon, dressing_room, archive, museum/indoor"
3920,94080,indoor,"clean_room, dressing_room, beauty_salon, locker_room, shower"
3921,94104,indoor,"dressing_room, clean_room, archive, locker_room, closet"
3922,94128,indoor,"clean_room, museum/indoor, natural_history_museum, science_museum, jewelry_shop"
3923,94152,indoor,"museum/indoor, clean_room, jewelry_shop, science_museum, natural_history_museum"
3924,94176,indoor,"museum/indoor, clean_room, dressing_room, archive, locker_room"
3925,94200,indoor,"clean_room, dressing_room, museum/indoor, locker_room, archive"
3926,94224,indoor,"banquet_hall, dressing_room, restaurant, dining_hall, clean_room"
3927,94248,indoor,"beauty_salon, chemistry_lab, jewelry_shop, clean_room, biology_laboratory"
3928,94272,indoor,"jewelry_shop, chemistry_lab, beauty_salon, cafeteria, banquet_hall"
3929,94296,indoor,"dressing_room, beauty_salon, clean_room, clothing_store, office"
3930,94320,indoor,"dressing_room, beauty_salon, clean_room, clothing_store, closet"
3931,94344,indoor,"dressing_room, beauty_salon, clothing_store, clean_room, ice_cream_parlor"
3932,94368,indoor,"dressing_room, beauty_salon, restaurant, banquet_hall, bar"
3933,94392,indoor,"dressing_room, beauty_salon, restaurant, chemistry_lab, banquet_hall"
3934,94416,indoor,"dressing_room, clean_room, nursing_home, beauty_salon, banquet_hall"
3935,94440,indoor,"dressing_room, clean_room, nursing_home, beauty_salon, hospital_room"
3936,94464,indoor,"dressing_room, nursing_home, clean_room, hospital_room, beauty_salon"
3937,94488,indoor,"dressing_room, beauty_salon, restaurant, nursing_home, clean_room"
3938,94512,indoor,"dressing_room, beauty_salon, nursing_home, clean_room, restaurant"
3939,94536,indoor,"dressing_room, nursing_home, beauty_salon, office, reception"
3940,94560,indoor,"dressing_room, nursing_home, beauty_salon, office, reception"
3941,94584,indoor,"dressing_room, nursing_home, clean_room, beauty_salon, office"
3942,94608,indoor,"dressing_room, beauty_salon, clean_room, nursing_home, office"
3943,94632,indoor,"dressing_room, clean_room, beauty_salon, nursing_home, office"
3944,94656,indoor,"dressing_room, beauty_salon, clean_room, nursing_home, office"
3945,94680,indoor,"dressing_room, restaurant, beauty_salon, banquet_hall, ice_cream_parlor"
3946,94704,indoor,"dressing_room, beauty_salon, clean_room, nursing_home, restaurant"
3947,94728,indoor,"dressing_room, beauty_salon, nursing_home, restaurant, ice_cream_parlor"
3948,94752,indoor,"dressing_room, beauty_salon, discotheque, chemistry_lab, nursing_home"
3949,94776,indoor,"dressing_room, beauty_salon, clean_room, nursing_home, chemistry_lab"
3950,94800,indoor,"dressing_room, nursing_home, clean_room, reception, office"
3951,94824,indoor,"dressing_room, clean_room, nursing_home, beauty_salon, clothing_store"
3952,94848,indoor,"dressing_room, clean_room, nursing_home, beauty_salon, hospital_room"
3953,94872,indoor,"dressing_room, clean_room, nursing_home, beauty_salon, art_gallery"
3954,94896,indoor,"dressing_room, clean_room, beauty_salon, nursing_home, clothing_store"
3955,94920,indoor,"dressing_room, clean_room, beauty_salon, clothing_store, reception"
3956,94944,indoor,"dressing_room, clean_room, beauty_salon, reception, nursing_home"
3957,94968,indoor,"dressing_room, beauty_salon, clean_room, nursing_home, office"
3958,94992,indoor,"dressing_room, beauty_salon, restaurant, office, office_cubicles"
3959,95016,indoor,"dressing_room, beauty_salon, restaurant, chemistry_lab, clean_room"
3960,95040,indoor,"dressing_room, beauty_salon, clean_room, nursing_home, office"
3961,95064,indoor,"dressing_room, office, nursing_home, reception, beauty_salon"
3962,95088,indoor,"dressing_room, clean_room, nursing_home, beauty_salon, office"
3963,95112,indoor,"dressing_room, nursing_home, office, clean_room, reception"
3964,95136,indoor,"dressing_room, nursing_home, office, beauty_salon, reception"
3965,95160,indoor,"dressing_room, nursing_home, office, clean_room, reception"
3966,95184,indoor,"dressing_room, clean_room, nursing_home, beauty_salon, office"
3967,95208,indoor,"dressing_room, nursing_home, beauty_salon, office, clean_room"
3968,95232,indoor,"dressing_room, office, nursing_home, beauty_salon, reception"
3969,95256,indoor,"dressing_room, nursing_home, reception, clean_room, office"
3970,95280,indoor,"dressing_room, clean_room, nursing_home, beauty_salon, office"
3971,95304,indoor,"dressing_room, clean_room, nursing_home, beauty_salon, nursery"
3972,95328,indoor,"dressing_room, clean_room, nursing_home, beauty_salon, office"
3973,95352,indoor,"dressing_room, clean_room, beauty_salon, nursing_home, museum/indoor"
3974,95376,indoor,"dressing_room, clean_room, beauty_salon, nursing_home, museum/indoor"
3975,95400,indoor,"dressing_room, clean_room, beauty_salon, museum/indoor, nursing_home"
3976,95424,indoor,"dressing_room, clean_room, beauty_salon, nursing_home, office"
3977,95448,indoor,"dressing_room, clean_room, nursing_home, office, beauty_salon"
3978,95472,indoor,"dressing_room, nursing_home, beauty_salon, clean_room, office"
3979,95496,indoor,"dressing_room, beauty_salon, nursing_home, office, clean_room"
3980,95520,indoor,"dressing_room, clean_room, nursing_home, office, beauty_salon"
3981,95544,indoor,"dressing_room, clean_room, beauty_salon, nursing_home, reception"
3982,95568,indoor,"dressing_room, clean_room, beauty_salon, nursing_home, reception"
3983,95592,indoor,"dressing_room, clean_room, beauty_salon, nursing_home, clothing_store"
3984,95616,indoor,"dressing_room, clean_room, beauty_salon, nursing_home, reception"
3985,95640,indoor,"dressing_room, clean_room, beauty_salon, office, clothing_store"
3986,95664,indoor,"dressing_room, beauty_salon, office, clean_room, reception"
3987,95688,indoor,"dressing_room, clean_room, nursing_home, beauty_salon, reception"
3988,95712,indoor,"dressing_room, chemistry_lab, jewelry_shop, beauty_salon, clean_room"
3989,95736,indoor,"museum/indoor, clean_room, dressing_room, archive, physics_laboratory"
3990,95760,indoor,"clean_room, chemistry_lab, museum/indoor, beauty_salon, physics_laboratory"
3991,95784,indoor,"museum/indoor, clean_room, archive, natural_history_museum, dressing_room"
3992,95808,indoor,"clean_room, museum/indoor, natural_history_museum, archive, dressing_room"
3993,95832,indoor,"museum/indoor, clean_room, jewelry_shop, archive, natural_history_museum"
