,frame_num,environment,places
2503,60072,indoor,"clean_room, dressing_room, locker_room, nursery, chemistry_lab"
2504,60096,indoor,"museum/indoor, art_gallery, dressing_room, archive, clean_room"
2505,60120,indoor,"art_gallery, dressing_room, museum/indoor, clean_room, art_studio"
2506,60144,indoor,"dressing_room, art_gallery, museum/indoor, clean_room, beauty_salon"
2507,60168,indoor,"clean_room, dressing_room, operating_room, nursery, closet"
2508,60192,indoor,"clean_room, operating_room, doorway/outdoor, dressing_room, chemistry_lab"
2509,60216,indoor,"clean_room, operating_room, hospital_room, dressing_room, chemistry_lab"
2510,60240,indoor,"clean_room, operating_room, hospital_room, physics_laboratory, veterinarians_office"
2511,60264,indoor,"clean_room, operating_room, hospital_room, physics_laboratory, veterinarians_office"
2512,60288,indoor,"museum/indoor, dressing_room, art_gallery, clean_room, archive"
2513,60312,indoor,"art_gallery, dressing_room, museum/indoor, clean_room, archive"
2514,60336,indoor,"dressing_room, art_gallery, museum/indoor, beauty_salon, clean_room"
2515,60360,indoor,"dressing_room, art_gallery, museum/indoor, beauty_salon, clean_room"
2516,60384,indoor,"clean_room, dressing_room, museum/indoor, locker_room, archive"
2517,60408,indoor,"clean_room, dressing_room, museum/indoor, locker_room, archive"
2518,60432,indoor,"clean_room, dressing_room, museum/indoor, archive, locker_room"
2519,60456,indoor,"dressing_room, art_gallery, museum/indoor, clean_room, beauty_salon"
2520,60480,indoor,"dressing_room, clean_room, art_gallery, beauty_salon, nursing_home"
2521,60504,indoor,"dressing_room, clean_room, music_studio, beauty_salon, nursing_home"
2522,60528,indoor,"dressing_room, clean_room, nursing_home, art_gallery, museum/indoor"
2523,60552,indoor,"dressing_room, art_gallery, clean_room, museum/indoor, beauty_salon"
2524,60576,indoor,"dressing_room, art_gallery, clean_room, museum/indoor, beauty_salon"
2525,60600,indoor,"dressing_room, art_gallery, beauty_salon, clean_room, museum/indoor"
2526,60624,indoor,"clean_room, operating_room, hospital_room, dressing_room, veterinarians_office"
2527,60648,indoor,"clean_room, locker_room, dressing_room, hospital_room, operating_room"
2528,60672,indoor,"clean_room, entrance_hall, artists_loft, corridor, bow_window/indoor"
2529,60696,indoor,"clean_room, museum/indoor, operating_room, clothing_store, church/indoor"
2530,60720,indoor,"discotheque, museum/indoor, aquarium, science_museum, natural_history_museum"
2531,60744,indoor,"museum/indoor, clean_room, science_museum, discotheque, aquarium"
2532,60768,indoor,"discotheque, aquarium, museum/indoor, television_studio, music_studio"
2533,60792,indoor,"discotheque, aquarium, television_studio, music_studio, stage/indoor"
2534,60816,indoor,"discotheque, television_studio, museum/indoor, science_museum, aquarium"
2535,60840,indoor,"chemistry_lab, dressing_room, physics_laboratory, bar, operating_room"
2536,60864,indoor,"bar, restaurant, music_studio, chemistry_lab, physics_laboratory"
2537,60888,indoor,"chemistry_lab, operating_room, bar, physics_laboratory, music_studio"
2538,60912,indoor,"bar, chemistry_lab, restaurant, music_studio, physics_laboratory"
2539,60936,indoor,"chemistry_lab, physics_laboratory, bar, music_studio, restaurant"
2540,60960,indoor,"chemistry_lab, bar, operating_room, music_studio, physics_laboratory"
2541,60984,indoor,"operating_room, restaurant, bar, chemistry_lab, hospital_room"
2542,61008,indoor,"discotheque, museum/indoor, aquarium, stage/indoor, clean_room"
2543,61032,indoor,"discotheque, museum/indoor, aquarium, science_museum, natural_history_museum"
2544,61056,indoor,"discotheque, aquarium, science_museum, museum/indoor, natural_history_museum"
2545,61080,indoor,"discotheque, aquarium, museum/indoor, natural_history_museum, science_museum"
2546,61104,indoor,"discotheque, aquarium, stage/indoor, museum/indoor, music_studio"
2547,61128,indoor,"discotheque, aquarium, museum/indoor, natural_history_museum, science_museum"
2548,61152,indoor,"aquarium, discotheque, museum/indoor, natural_history_museum, science_museum"
2549,61176,indoor,"aquarium, museum/indoor, natural_history_museum, science_museum, discotheque"
2550,61200,indoor,"discotheque, aquarium, museum/indoor, clean_room, music_studio"
2551,61224,indoor,"restaurant, discotheque, dressing_room, bar, banquet_hall"
2552,61248,indoor,"discotheque, aquarium, museum/indoor, natural_history_museum, science_museum"
2553,61272,indoor,"museum/indoor, aquarium, natural_history_museum, science_museum, discotheque"
2554,61296,indoor,"discotheque, television_studio, clean_room, museum/indoor, music_studio"
2555,61320,indoor,"discotheque, aquarium, stage/indoor, music_studio, television_studio"
2556,61344,indoor,"discotheque, museum/indoor, stage/indoor, television_studio, science_museum"
2557,61368,indoor,"discotheque, aquarium, stage/indoor, music_studio, science_museum"
2558,61392,indoor,"discotheque, aquarium, music_studio, science_museum, stage/indoor"
2559,61416,indoor,"discotheque, dressing_room, restaurant, banquet_hall, bar"
2560,61440,indoor,"dressing_room, discotheque, restaurant, banquet_hall, bar"
2561,61464,indoor,"restaurant, dressing_room, discotheque, bar, banquet_hall"
2562,61488,indoor,"discotheque, restaurant, bar, dressing_room, stage/indoor"
2563,61512,indoor,"dressing_room, discotheque, restaurant, bar, music_studio"
2564,61536,indoor,"discotheque, restaurant, dressing_room, bar, stage/indoor"
2565,61560,indoor,"aquarium, discotheque, museum/indoor, science_museum, natural_history_museum"
2566,61584,indoor,"aquarium, discotheque, museum/indoor, science_museum, natural_history_museum"
2567,61608,indoor,"aquarium, discotheque, museum/indoor, natural_history_museum, science_museum"
2568,61632,indoor,"discotheque, restaurant, bar, music_studio, stage/indoor"
2569,61656,indoor,"discotheque, stage/indoor, dressing_room, music_studio, restaurant"
2570,61680,indoor,"restaurant, discotheque, bar, dressing_room, banquet_hall"
2571,61704,indoor,"discotheque, dressing_room, restaurant, bar, music_studio"
2572,61728,indoor,"discotheque, dressing_room, restaurant, banquet_hall, bar"
2573,61752,indoor,"discotheque, dressing_room, restaurant, stage/indoor, banquet_hall"
2574,61776,indoor,"discotheque, restaurant, dressing_room, bar, music_studio"
2575,61800,indoor,"discotheque, museum/indoor, aquarium, art_studio, television_studio"
2576,61824,indoor,"discotheque, aquarium, museum/indoor, stage/indoor, field/wild"
2577,61848,indoor,"discotheque, museum/indoor, aquarium, stage/indoor, art_studio"
2578,61872,indoor,"discotheque, museum/indoor, aquarium, stage/indoor, art_studio"
2579,61896,indoor,"discotheque, museum/indoor, aquarium, stage/indoor, shower"
2580,61920,indoor,"discotheque, museum/indoor, aquarium, shower, stage/indoor"
2581,61944,indoor,"museum/indoor, discotheque, aquarium, shower, natural_history_museum"
2582,61968,indoor,"discotheque, museum/indoor, aquarium, art_studio, shower"
2583,61992,indoor,"museum/indoor, discotheque, aquarium, natural_history_museum, art_studio"
2584,62016,indoor,"museum/indoor, discotheque, shower, music_studio, natural_history_museum"
2585,62040,indoor,"discotheque, restaurant, bar, dressing_room, stage/indoor"
2586,62064,indoor,"dressing_room, discotheque, restaurant, stage/indoor, banquet_hall"
2587,62088,indoor,"dressing_room, restaurant, discotheque, banquet_hall, bar"
2588,62112,indoor,"discotheque, dressing_room, restaurant, bar, banquet_hall"
2589,62136,indoor,"museum/indoor, science_museum, aquarium, natural_history_museum, clean_room"
2590,62160,indoor,"museum/indoor, discotheque, aquarium, clean_room, science_museum"
2591,62184,indoor,"discotheque, museum/indoor, aquarium, art_studio, science_museum"
2592,62208,indoor,"museum/indoor, discotheque, clean_room, science_museum, natural_history_museum"
2593,62232,indoor,"aquarium, museum/indoor, discotheque, science_museum, natural_history_museum"
2594,62256,indoor,"aquarium, discotheque, museum/indoor, science_museum, natural_history_museum"
2595,62280,indoor,"discotheque, aquarium, museum/indoor, natural_history_museum, science_museum"
2596,62304,indoor,"discotheque, aquarium, museum/indoor, science_museum, art_studio"
2597,62328,indoor,"dressing_room, discotheque, restaurant, bar, stage/indoor"
2598,62352,indoor,"discotheque, dressing_room, restaurant, bar, music_studio"
2599,62376,indoor,"banquet_hall, dining_hall, restaurant, cafeteria, bar"
2600,62400,indoor,"banquet_hall, dining_hall, restaurant, cafeteria, bar"
2601,62424,indoor,"banquet_hall, dining_hall, restaurant, cafeteria, bar"
2602,62448,indoor,"banquet_hall, dining_hall, restaurant, cafeteria, bar"
2603,62472,indoor,"banquet_hall, restaurant, dining_hall, cafeteria, dining_room"
2604,62496,indoor,"banquet_hall, dining_hall, restaurant, cafeteria, dining_room"
2605,62520,indoor,"auditorium, bar, restaurant, discotheque, boxing_ring"
2606,62544,indoor,"stage/indoor, discotheque, bar, archive, auditorium"
2607,62568,indoor,"dining_hall, restaurant, bar, banquet_hall, cafeteria"
2608,62592,indoor,"dining_hall, restaurant, banquet_hall, cafeteria, bar"
2609,62616,indoor,"cafeteria, dining_hall, restaurant, banquet_hall, bar"
2610,62640,indoor,"locker_room, stage/indoor, classroom, ballroom, discotheque"
2611,62664,indoor,"stage/indoor, banquet_hall, dining_hall, bar, restaurant"
2612,62688,indoor,"clean_room, operating_room, archive, locker_room, music_studio"
2613,62712,indoor,"bedroom, hotel_room, bedchamber, dorm_room, hospital_room"
2614,62736,indoor,"bedroom, hotel_room, bedchamber, dorm_room, hospital_room"
2615,62760,indoor,"bedroom, hotel_room, bedchamber, dorm_room, living_room"
2616,62784,indoor,"bedroom, hotel_room, bedchamber, living_room, dorm_room"
2617,62808,indoor,"bedroom, hotel_room, bedchamber, dorm_room, hospital_room"
2618,62832,indoor,"bedroom, hotel_room, bedchamber, youth_hostel, dorm_room"
2619,62856,indoor,"bedroom, hotel_room, bedchamber, dorm_room, hospital_room"
2620,62880,indoor,"bedroom, bedchamber, bow_window/indoor, hotel_room, youth_hostel"
2621,62904,indoor,"bedroom, bedchamber, bow_window/indoor, hotel_room, youth_hostel"
2622,62928,indoor,"bedroom, bedchamber, bow_window/indoor, hotel_room, youth_hostel"
2623,62952,indoor,"bedroom, bedchamber, bow_window/indoor, hotel_room, youth_hostel"
2624,62976,indoor,"bedroom, bedchamber, hotel_room, bow_window/indoor, youth_hostel"
2625,63000,indoor,"bedroom, hotel_room, bedchamber, bow_window/indoor, hospital_room"
2626,63024,indoor,"bedroom, bedchamber, hotel_room, bow_window/indoor, youth_hostel"
2627,63048,indoor,"bedroom, bedchamber, hotel_room, bow_window/indoor, youth_hostel"
2628,63072,indoor,"bedroom, hotel_room, bedchamber, bow_window/indoor, hospital_room"
2629,63096,indoor,"bedroom, hotel_room, bedchamber, youth_hostel, hospital_room"
2630,63120,indoor,"bedroom, bedchamber, hotel_room, bow_window/indoor, youth_hostel"
2631,63144,indoor,"bedroom, bedchamber, hotel_room, bow_window/indoor, youth_hostel"
2632,63168,indoor,"bedroom, bedchamber, hotel_room, bow_window/indoor, youth_hostel"
2633,63192,indoor,"bedroom, bedchamber, hotel_room, bow_window/indoor, youth_hostel"
2634,63216,indoor,"hospital_room, bedroom, hotel_room, clean_room, operating_room"
2635,63240,indoor,"hospital_room, bedroom, hotel_room, clean_room, operating_room"
2636,63264,indoor,"hospital_room, bedroom, hotel_room, nursing_home, operating_room"
2637,63288,indoor,"bedroom, hospital_room, hotel_room, bedchamber, clean_room"
2638,63312,indoor,"bedroom, bedchamber, bow_window/indoor, hotel_room, dorm_room"
2639,63336,indoor,"bedroom, bedchamber, hotel_room, dorm_room, hospital_room"
2640,63360,indoor,"bedroom, bedchamber, hotel_room, youth_hostel, closet"
2641,63384,indoor,"clean_room, hospital_room, clothing_store, dressing_room, locker_room"
2642,63408,indoor,"clean_room, dressing_room, museum/indoor, hospital_room, living_room"
2643,63432,indoor,"clean_room, dressing_room, shower, museum/indoor, bathroom"
2644,63456,indoor,"clean_room, chemistry_lab, shower, biology_laboratory, beauty_salon"
2645,63480,indoor,"shower, clean_room, bathroom, chemistry_lab, dressing_room"
2646,63504,indoor,"clean_room, dressing_room, nursery, closet, clothing_store"
2647,63528,indoor,"clean_room, dressing_room, nursery, clothing_store, bow_window/indoor"
2648,63552,outdoor,"oast_house, palace, castle, village, mausoleum"
2649,63576,outdoor,"oast_house, palace, castle, mausoleum, church/outdoor"
2650,63600,outdoor,"oast_house, palace, castle, mausoleum, church/outdoor"
2651,63624,indoor,"clean_room, dressing_room, nursery, clothing_store, museum/indoor"
2652,63648,indoor,"dressing_room, clean_room, museum/indoor, nursery, beauty_salon"
2653,63672,indoor,"shoe_shop, archive, natural_history_museum, hardware_store, locker_room"
2654,63696,indoor,"shoe_shop, archive, hardware_store, natural_history_museum, engine_room"
2655,63720,outdoor,"ticket_booth, phone_booth, booth/indoor, shopfront, kennel/outdoor"
2656,63744,indoor,"ticket_booth, phone_booth, loading_dock, booth/indoor, coffee_shop"
2657,63768,indoor,"ticket_booth, phone_booth, subway_station/platform, train_station/platform, loading_dock"
2658,63792,indoor,"ticket_booth, phone_booth, subway_station/platform, train_station/platform, bookstore"
2659,63816,indoor,"ticket_booth, phone_booth, subway_station/platform, train_station/platform, cemetery"
2660,63840,indoor,"ticket_booth, phone_booth, subway_station/platform, train_station/platform, cemetery"
2661,63864,outdoor,"ticket_booth, phone_booth, cemetery, kennel/outdoor, bookstore"
2662,63888,indoor,"clean_room, dressing_room, museum/indoor, hospital_room, shower"
2663,63912,indoor,"clean_room, dressing_room, hospital_room, shower, beauty_salon"
2664,63936,indoor,"clean_room, dressing_room, museum/indoor, clothing_store, shower"
2665,63960,indoor,"clean_room, dressing_room, museum/indoor, clothing_store, nursery"
2666,63984,outdoor,"palace, castle, oast_house, church/outdoor, temple/asia"
2667,64008,outdoor,"oast_house, palace, castle, mausoleum, church/outdoor"
2668,64032,indoor,"clean_room, dressing_room, museum/indoor, clothing_store, nursery"
2669,64056,indoor,"clean_room, dressing_room, nursery, museum/indoor, clothing_store"
2670,64080,indoor,"dressing_room, clean_room, nursery, beauty_salon, museum/indoor"
2671,64104,indoor,"dressing_room, clean_room, nursery, beauty_salon, museum/indoor"
2672,64128,indoor,"dressing_room, clean_room, clothing_store, museum/indoor, beauty_salon"
2673,64152,indoor,"clean_room, dressing_room, clothing_store, nursery, museum/indoor"
2674,64176,indoor,"clean_room, chemistry_lab, biology_laboratory, beauty_salon, dressing_room"
2675,64200,indoor,"clean_room, hospital_room, locker_room, youth_hostel, jail_cell"
2676,64224,indoor,"bedroom, hotel_room, bedchamber, bow_window/indoor, youth_hostel"
2677,64248,indoor,"bedroom, bedchamber, youth_hostel, hotel_room, hospital_room"
2678,64272,indoor,"bedroom, bedchamber, youth_hostel, hotel_room, hospital_room"
2679,64296,indoor,"bedroom, bedchamber, hotel_room, youth_hostel, dorm_room"
2680,64320,indoor,"bedroom, bedchamber, youth_hostel, hotel_room, dorm_room"
2681,64344,indoor,"bedroom, bedchamber, hotel_room, childs_room, youth_hostel"
2682,64368,indoor,"bedroom, bedchamber, childs_room, closet, hotel_room"
2683,64392,indoor,"bedroom, bedchamber, closet, childs_room, clean_room"
2684,64416,indoor,"bedroom, bedchamber, childs_room, hotel_room, closet"
2685,64440,outdoor,"ice_shelf, dam, cliff, trench, ice_floe"
2686,64464,outdoor,"ice_shelf, dam, cliff, trench, ice_floe"
2687,64488,outdoor,"ice_shelf, dam, boat_deck, trench, cliff"
2688,64512,outdoor,"ice_shelf, dam, lock_chamber, trench, cemetery"
2689,64536,outdoor,"trench, ice_shelf, archive, staircase, cemetery"
2690,64560,outdoor,"ice_shelf, ice_floe, archive, dam, ocean"
2691,64584,indoor,"patio, porch, dining_room, classroom, dining_hall"
2692,64608,outdoor,"pavilion, gazebo/exterior, fountain, porch, mausoleum"
2693,64632,outdoor,"porch, pavilion, gazebo/exterior, courtyard, patio"
2694,64656,outdoor,"pavilion, porch, gazebo/exterior, patio, bridge"
2695,64680,outdoor,"pavilion, gazebo/exterior, porch, bridge, patio"
2696,64704,outdoor,"pavilion, gazebo/exterior, porch, patio, courtyard"
2697,64728,outdoor,"pavilion, gazebo/exterior, porch, bridge, cemetery"
2698,64752,outdoor,"pavilion, gazebo/exterior, porch, bridge, arch"
2699,64776,indoor,"cemetery, archive, burial_chamber, dressing_room, museum/indoor"
2700,64800,indoor,"cemetery, burial_chamber, archive, ruin, museum/indoor"
2701,64824,outdoor,"cemetery, burial_chamber, mausoleum, archive, ruin"
2702,64848,indoor,"cemetery, archive, museum/indoor, burial_chamber, mausoleum"
2703,64872,outdoor,"cemetery, mausoleum, burial_chamber, archive, ruin"
2704,64896,outdoor,"cemetery, burial_chamber, ruin, mausoleum, ice_shelf"
2705,64920,indoor,"cemetery, mausoleum, archive, burial_chamber, museum/indoor"
2706,64944,outdoor,"cemetery, mausoleum, burial_chamber, ruin, archive"
2707,64968,outdoor,"cemetery, burial_chamber, archive, ruin, mausoleum"
2708,64992,indoor,"cemetery, archive, burial_chamber, museum/indoor, mausoleum"
2709,65016,indoor,"cemetery, archive, burial_chamber, museum/indoor, classroom"
2710,65040,indoor,"cemetery, archive, burial_chamber, museum/indoor, ruin"
2711,65064,indoor,"cemetery, burial_chamber, archive, museum/indoor, mausoleum"
2712,65088,indoor,"cemetery, burial_chamber, archive, mausoleum, museum/indoor"
2713,65112,outdoor,"cemetery, burial_chamber, mausoleum, archive, ruin"
2714,65136,outdoor,"cemetery, burial_chamber, mausoleum, ruin, archive"
2715,65160,outdoor,"cemetery, burial_chamber, archive, mausoleum, ruin"
2716,65184,indoor,"classroom, cemetery, archive, kindergarden_classroom, museum/indoor"
2717,65208,indoor,"museum/indoor, ice_shelf, burial_chamber, natural_history_museum, archive"
2718,65232,outdoor,"ice_shelf, cemetery, igloo, iceberg, museum/indoor"
2719,65256,outdoor,"ice_shelf, iceberg, natural_history_museum, igloo, museum/indoor"
2720,65280,outdoor,"ice_shelf, iceberg, igloo, ice_floe, campsite"
2721,65304,outdoor,"ice_shelf, iceberg, igloo, ice_floe, museum/indoor"
2722,65328,outdoor,"ice_shelf, iceberg, igloo, ice_floe, museum/indoor"
2723,65352,outdoor,"ice_shelf, iceberg, ice_floe, igloo, lake/natural"
2724,65376,outdoor,"ice_shelf, iceberg, ice_floe, museum/indoor, watering_hole"
2725,65400,indoor,"ice_shelf, ice_floe, art_studio, archive, art_school"
2726,65424,outdoor,"ice_shelf, lake/natural, ice_floe, dam, river"
2727,65448,outdoor,"coast, ocean, beach, lake/natural, promenade"
2728,65472,outdoor,"promenade, pier, coast, ocean, beach"
2729,65496,indoor,"museum/indoor, art_gallery, science_museum, natural_history_museum, archive"
2730,65520,indoor,"museum/indoor, art_gallery, science_museum, natural_history_museum, archive"
2731,65544,indoor,"museum/indoor, science_museum, art_gallery, archive, stage/indoor"
2732,65568,indoor,"museum/indoor, science_museum, art_gallery, archive, stage/indoor"
2733,65592,indoor,"museum/indoor, art_gallery, science_museum, natural_history_museum, archive"
2734,65616,indoor,"museum/indoor, art_gallery, science_museum, natural_history_museum, stage/indoor"
2735,65640,indoor,"museum/indoor, science_museum, art_gallery, natural_history_museum, stage/indoor"
2736,65664,indoor,"museum/indoor, art_gallery, stage/indoor, science_museum, discotheque"
2737,65688,indoor,"cemetery, ice_shelf, natural_history_museum, museum/indoor, burial_chamber"
2738,65712,indoor,"ice_shelf, museum/indoor, cemetery, aquarium, natural_history_museum"
2739,65736,outdoor,"ice_shelf, lake/natural, ice_floe, pond, dam"
2740,65760,outdoor,"lake/natural, beach, ocean, pond, ice_floe"
2741,65784,outdoor,"museum/indoor, ice_shelf, classroom, hot_spring, lake/natural"
2742,65808,outdoor,"museum/indoor, ice_shelf, lake/natural, slum, shower"
2743,65832,indoor,"museum/indoor, dressing_room, ice_shelf, slum, classroom"
2744,65856,outdoor,"museum/indoor, ice_shelf, lake/natural, ocean, art_studio"
2745,65880,outdoor,"ocean, beach, ice_shelf, coast, ice_floe"
2746,65904,outdoor,"lake/natural, pond, ocean, beach, coast"
2747,65928,outdoor,"lake/natural, pond, watering_hole, ocean, beach"
2748,65952,outdoor,"lake/natural, pond, watering_hole, ocean, aquarium"
2749,65976,outdoor,"lake/natural, museum/indoor, aquarium, ice_shelf, pond"
2750,66000,outdoor,"ice_shelf, ocean, museum/indoor, coast, lecture_room"
2751,66024,outdoor,"ice_shelf, museum/indoor, art_gallery, coast, ocean"
2752,66048,outdoor,"ice_shelf, ocean, coast, museum/indoor, cliff"
2753,66072,outdoor,"museum/indoor, ice_shelf, art_gallery, ocean, coast"
2754,66096,outdoor,"museum/indoor, ice_shelf, art_gallery, ocean, coast"
2755,66120,outdoor,"museum/indoor, ice_shelf, art_gallery, ocean, coast"
2756,66144,outdoor,"museum/indoor, ice_shelf, art_gallery, ocean, coast"
2757,66168,outdoor,"museum/indoor, ice_shelf, coast, ocean, art_gallery"
2758,66192,indoor,"museum/indoor, ice_shelf, burial_chamber, classroom, natural_history_museum"
2759,66216,indoor,"ice_shelf, museum/indoor, burial_chamber, natural_history_museum, classroom"
2760,66240,indoor,"ice_shelf, museum/indoor, burial_chamber, classroom, cliff"
2761,66264,outdoor,"ice_shelf, ocean, museum/indoor, beach, coast"
2762,66288,indoor,"ice_shelf, museum/indoor, cliff, burial_chamber, natural_history_museum"
2763,66312,outdoor,"ice_shelf, museum/indoor, lake/natural, cliff, natural_history_museum"
2764,66336,indoor,"museum/indoor, ice_shelf, natural_history_museum, dressing_room, slum"
2765,66360,outdoor,"museum/indoor, ice_shelf, iceberg, art_gallery, mosque/outdoor"
2766,66384,outdoor,"museum/indoor, ice_shelf, art_gallery, ocean, coast"
2767,66408,indoor,"ice_shelf, museum/indoor, lecture_room, office, art_gallery"
2768,66432,indoor,"ice_shelf, museum/indoor, art_gallery, ocean, office"
2769,66456,indoor,"museum/indoor, ice_shelf, chemistry_lab, tower, shower"
2770,66480,indoor,"museum/indoor, ice_shelf, art_gallery, archive, tower"
2771,66504,outdoor,"beach, ice_floe, ocean, ice_shelf, aquarium"
2772,66528,outdoor,"ice_shelf, ice_floe, ocean, beach, lake/natural"
2773,66552,indoor,"classroom, ice_shelf, museum/indoor, art_studio, slum"
2774,66576,indoor,"museum/indoor, shower, art_studio, natural_history_museum, aquarium"
2775,66600,indoor,"museum/indoor, natural_history_museum, science_museum, aquarium, art_studio"
2776,66624,outdoor,"watering_hole, lake/natural, pond, museum/indoor, natural_history_museum"
2777,66648,outdoor,"watering_hole, beach, lake/natural, aquarium, slum"
2778,66672,outdoor,"beach, ocean, watering_hole, lake/natural, coast"
2779,66696,outdoor,"ice_shelf, museum/indoor, iceberg, art_gallery, ice_floe"
2780,66720,indoor,"ice_shelf, museum/indoor, art_gallery, chemistry_lab, office"
2781,66744,indoor,"museum/indoor, ice_shelf, chemistry_lab, art_gallery, tower"
2782,66768,indoor,"museum/indoor, ice_shelf, art_gallery, chemistry_lab, office"
2783,66792,indoor,"museum/indoor, natural_history_museum, ice_shelf, archive, science_museum"
2784,66816,indoor,"museum/indoor, art_gallery, natural_history_museum, science_museum, dressing_room"
2785,66840,indoor,"museum/indoor, dressing_room, natural_history_museum, art_gallery, science_museum"
2786,66864,indoor,"museum/indoor, art_gallery, natural_history_museum, science_museum, dressing_room"
2787,66888,indoor,"museum/indoor, natural_history_museum, art_gallery, science_museum, dressing_room"
2788,66912,indoor,"museum/indoor, natural_history_museum, art_gallery, science_museum, art_studio"
2789,66936,indoor,"museum/indoor, art_gallery, natural_history_museum, science_museum, dressing_room"
2790,66960,indoor,"museum/indoor, dressing_room, art_gallery, natural_history_museum, art_studio"
2791,66984,indoor,"museum/indoor, dressing_room, discotheque, art_gallery, ice_shelf"
2792,67008,indoor,"dressing_room, discotheque, museum/indoor, shower, art_gallery"
2793,67032,indoor,"natural_history_museum, museum/indoor, aquarium, science_museum, dressing_room"
2794,67056,indoor,"discotheque, ice_shelf, museum/indoor, shower, aquarium"
2795,67080,outdoor,"museum/indoor, natural_history_museum, watering_hole, ice_floe, beach"
2796,67104,outdoor,"ice_shelf, museum/indoor, igloo, ice_floe, art_studio"
2797,67128,outdoor,"museum/indoor, ocean, beach, coast, sky"
2798,67152,indoor,"museum/indoor, classroom, ocean, art_gallery, lecture_room"
2799,67176,outdoor,"cemetery, ruin, burial_chamber, archive, mausoleum"
2800,67200,indoor,"museum/indoor, ocean, art_gallery, classroom, beach"
2801,67224,outdoor,"ocean, beach, museum/indoor, coast, art_gallery"
2802,67248,indoor,"cemetery, archive, ruin, burial_chamber, museum/indoor"
2803,67272,outdoor,"cemetery, archive, burial_chamber, ruin, ice_shelf"
2804,67296,indoor,"cemetery, archive, museum/indoor, mausoleum, burial_chamber"
2805,67320,outdoor,"cemetery, archive, schoolhouse, museum/indoor, mausoleum"
2806,67344,outdoor,"cemetery, ski_resort, ice_shelf, shed, mausoleum"
2807,67368,outdoor,"cemetery, ski_resort, ice_shelf, burial_chamber, mausoleum"
2808,67392,indoor,"bow_window/indoor, artists_loft, clean_room, entrance_hall, shower"
2809,67416,indoor,"clean_room, artists_loft, shower, bow_window/indoor, art_gallery"
2810,67440,indoor,"bow_window/indoor, clean_room, artists_loft, shower, museum/indoor"
2811,67464,indoor,"clean_room, shower, bow_window/indoor, museum/indoor, dressing_room"
2812,67488,indoor,"artists_loft, bow_window/indoor, entrance_hall, clean_room, shower"
2813,67512,indoor,"clean_room, dressing_room, hospital_room, archive, corridor"
2814,67536,indoor,"clean_room, locker_room, dressing_room, shower, bathroom"
2815,67560,indoor,"clean_room, locker_room, nursery, shower, dressing_room"
2816,67584,indoor,"clean_room, doorway/outdoor, closet, elevator/door, shower"
2817,67608,indoor,"shower, bathroom, locker_room, nursery, clean_room"
