,frame_num,environment,places,imdb_id
2280,54720,indoor,"clean_room, physics_laboratory, museum/indoor, server_room, science_museum",35027
2281,54744,indoor,"clean_room, server_room, physics_laboratory, chemistry_lab, music_studio",35027
2282,54768,indoor,"clean_room, music_studio, physics_laboratory, museum/indoor, chemistry_lab",35027
2283,54792,indoor,"clean_room, museum/indoor, music_studio, science_museum, physics_laboratory",35027
2284,54816,indoor,"clean_room, museum/indoor, server_room, science_museum, physics_laboratory",35027
2285,54840,indoor,"clean_room, museum/indoor, science_museum, music_studio, physics_laboratory",35027
2286,54864,indoor,"clean_room, music_studio, server_room, television_studio, museum/indoor",35027
2287,54888,indoor,"clean_room, physics_laboratory, museum/indoor, music_studio, server_room",35027
2288,54912,indoor,"clean_room, music_studio, chemistry_lab, physics_laboratory, biology_laboratory",35027
2289,54936,indoor,"music_studio, clean_room, television_studio, museum/indoor, physics_laboratory",35027
2290,54960,indoor,"clean_room, chemistry_lab, physics_laboratory, museum/indoor, science_museum",35027
2291,54984,indoor,"clean_room, museum/indoor, science_museum, physics_laboratory, chemistry_lab",35027
2292,55008,indoor,"clean_room, museum/indoor, chemistry_lab, science_museum, physics_laboratory",35027
2293,55032,indoor,"clean_room, museum/indoor, science_museum, art_gallery, chemistry_lab",35027
2294,55056,indoor,"clean_room, museum/indoor, physics_laboratory, science_museum, chemistry_lab",35027
2295,55080,indoor,"clean_room, museum/indoor, science_museum, physics_laboratory, chemistry_lab",35027
2296,55104,indoor,"clean_room, science_museum, physics_laboratory, chemistry_lab, museum/indoor",35027
2297,55128,indoor,"clean_room, physics_laboratory, operating_room, chemistry_lab, museum/indoor",35027
2298,55152,indoor,"museum/indoor, clean_room, physics_laboratory, server_room, science_museum",35027
2299,55176,indoor,"clean_room, museum/indoor, server_room, physics_laboratory, science_museum",35027
2300,55200,indoor,"clean_room, server_room, museum/indoor, physics_laboratory, science_museum",35027
2301,55224,indoor,"clean_room, server_room, museum/indoor, physics_laboratory, chemistry_lab",35027
2302,55248,indoor,"clean_room, museum/indoor, server_room, shower, science_museum",35027
2303,55272,indoor,"clean_room, museum/indoor, server_room, science_museum, art_gallery",35027
2304,55296,indoor,"clean_room, museum/indoor, server_room, art_gallery, science_museum",35027
2305,55320,indoor,"clean_room, museum/indoor, server_room, art_gallery, shower",35027
2306,55344,indoor,"bow_window/indoor, shower, alcove, nursery, museum/indoor",35027
2307,55368,indoor,"bow_window/indoor, shower, alcove, nursery, museum/indoor",35027
2308,55392,indoor,"shower, bow_window/indoor, clean_room, museum/indoor, bathroom",35027
2309,55416,indoor,"clean_room, bow_window/indoor, server_room, nursery, museum/indoor",35027
2310,55440,indoor,"clean_room, bow_window/indoor, museum/indoor, locker_room, corridor",35027
2311,55464,indoor,"shower, bow_window/indoor, clean_room, chemistry_lab, bathroom",35027
2312,55488,indoor,"shower, bow_window/indoor, clean_room, server_room, museum/indoor",35027
2313,55512,indoor,"bow_window/indoor, shower, museum/indoor, alcove, clean_room",35027
2314,55536,indoor,"shower, bow_window/indoor, clean_room, museum/indoor, bathroom",35027
2315,55560,indoor,"clean_room, chemistry_lab, physics_laboratory, biology_laboratory, operating_room",35027
2316,55584,indoor,"physics_laboratory, chemistry_lab, archive, clean_room, jewelry_shop",35027
2317,55608,indoor,"physics_laboratory, archive, jewelry_shop, music_studio, chemistry_lab",35027
2318,55632,indoor,"physics_laboratory, archive, library/indoor, office, music_studio",35027
2319,55656,indoor,"archive, physics_laboratory, music_studio, office, library/indoor",35027
2320,55680,indoor,"archive, physics_laboratory, library/indoor, office, music_studio",35027
2321,55704,indoor,"archive, physics_laboratory, library/indoor, office, home_office",35027
2322,55728,indoor,"physics_laboratory, archive, chemistry_lab, music_studio, office",35027
2323,55752,indoor,"archive, physics_laboratory, office, music_studio, home_office",35027
2324,55776,indoor,"physics_laboratory, archive, office, science_museum, chemistry_lab",35027
2325,55800,indoor,"physics_laboratory, music_studio, archive, chemistry_lab, office",35027
2326,55824,indoor,"archive, physics_laboratory, office, music_studio, home_office",35027
2327,55848,indoor,"archive, physics_laboratory, chemistry_lab, office, biology_laboratory",35027
2328,55872,indoor,"physics_laboratory, archive, music_studio, chemistry_lab, office",35027
2329,55896,indoor,"physics_laboratory, archive, music_studio, chemistry_lab, office",35027
2330,55920,indoor,"physics_laboratory, music_studio, archive, office, clean_room",35027
2331,55944,indoor,"archive, music_studio, physics_laboratory, clean_room, office",35027
2332,55968,indoor,"archive, music_studio, physics_laboratory, office, clean_room",35027
2333,55992,indoor,"archive, physics_laboratory, music_studio, clean_room, server_room",35027
2334,56016,indoor,"archive, office, physics_laboratory, music_studio, home_office",35027
2335,56040,indoor,"archive, physics_laboratory, office, music_studio, clean_room",35027
2336,56064,indoor,"archive, office, home_office, chemistry_lab, physics_laboratory",35027
2337,56088,indoor,"nursery, jewelry_shop, living_room, dining_room, bow_window/indoor",35027
2338,56112,indoor,"nursery, living_room, dining_room, bow_window/indoor, home_office",35027
2339,56136,indoor,"nursery, living_room, bow_window/indoor, archive, office",35027
2340,56160,indoor,"living_room, dining_room, bow_window/indoor, nursery, office",35027
2341,56184,indoor,"living_room, nursery, bow_window/indoor, waiting_room, lobby",35027
2342,56208,indoor,"nursery, living_room, childs_room, archive, home_office",35027
2343,56232,indoor,"nursery, living_room, bow_window/indoor, archive, childs_room",35027
2344,56256,indoor,"living_room, nursery, archive, library/indoor, home_office",35027
2345,56280,indoor,"living_room, nursery, bow_window/indoor, home_office, archive",35027
2346,56304,indoor,"living_room, home_office, nursery, archive, office",35027
2347,56328,indoor,"nursery, living_room, home_office, dining_room, office",35027
2348,56352,indoor,"nursery, home_office, dining_room, office, archive",35027
2349,56376,indoor,"music_studio, office, archive, physics_laboratory, home_office",35027
2350,56400,indoor,"music_studio, clean_room, physics_laboratory, archive, office",35027
2351,56424,indoor,"jewelry_shop, physics_laboratory, clean_room, archive, music_studio",35027
2352,56448,indoor,"archive, dining_room, office, clean_room, dressing_room",35027
2353,56472,indoor,"archive, physics_laboratory, office, music_studio, clean_room",35027
2354,56496,indoor,"archive, office, clean_room, physics_laboratory, music_studio",35027
2355,56520,indoor,"music_studio, physics_laboratory, archive, clean_room, office",35027
2356,56544,indoor,"archive, music_studio, physics_laboratory, clean_room, office",35027
2357,56568,indoor,"archive, office, home_office, clean_room, music_studio",35027
2358,56592,indoor,"archive, clean_room, physics_laboratory, music_studio, office",35027
2359,56616,indoor,"archive, physics_laboratory, music_studio, clean_room, office",35027
2360,56640,indoor,"music_studio, physics_laboratory, archive, chemistry_lab, office",35027
2361,56664,indoor,"music_studio, physics_laboratory, archive, office, chemistry_lab",35027
2362,56688,indoor,"archive, music_studio, physics_laboratory, office, clean_room",35027
2363,56712,indoor,"music_studio, archive, office, physics_laboratory, home_office",35027
2364,56736,indoor,"archive, physics_laboratory, office, music_studio, server_room",35027
2365,56760,indoor,"archive, office, library/indoor, home_office, physics_laboratory",35027
2366,56784,indoor,"office, home_office, music_studio, archive, physics_laboratory",35027
2367,56808,indoor,"archive, office, physics_laboratory, music_studio, clean_room",35027
2368,56832,indoor,"physics_laboratory, archive, clean_room, music_studio, office",35027
2369,56856,indoor,"server_room, corridor, bank_vault, entrance_hall, clean_room",35027
2370,56880,indoor,"corridor, server_room, entrance_hall, bank_vault, staircase",35027
2371,56904,indoor,"server_room, bank_vault, corridor, staircase, entrance_hall",35027
2372,56928,indoor,"entrance_hall, server_room, corridor, bank_vault, staircase",35027
2373,56952,indoor,"entrance_hall, music_studio, server_room, staircase, corridor",35027
2374,56976,indoor,"clean_room, music_studio, server_room, bank_vault, entrance_hall",35027
2375,57000,indoor,"art_gallery, museum/indoor, natural_history_museum, atrium/public, clean_room",35027
2376,57024,indoor,"art_gallery, artists_loft, atrium/public, office, museum/indoor",35027
2377,57048,indoor,"atrium/public, art_gallery, office_cubicles, office, clean_room",35027
2378,57072,indoor,"atrium/public, art_gallery, artists_loft, office, museum/indoor",35027
2379,57096,indoor,"artists_loft, corridor, bow_window/indoor, shower, alcove",35027
2380,57120,outdoor,"skyscraper, tower, office_building, water_tower, airplane_cabin",35027
2381,57144,outdoor,"airplane_cabin, hangar/outdoor, tower, skyscraper, sky",35027
2382,57168,outdoor,"tower, hangar/outdoor, water_tower, airplane_cabin, skyscraper",35027
2383,57192,outdoor,"oast_house, tower, skyscraper, museum/outdoor, sky",35027
2384,57216,indoor,"skyscraper, clothing_store, tower, museum/indoor, dressing_room",35027
2385,57240,indoor,"clothing_store, dressing_room, tower, skyscraper, bathroom",35027
2386,57264,indoor,"bathroom, skyscraper, tower, clothing_store, dressing_room",35027
2387,57288,outdoor,"bathroom, tower, skyscraper, mosque/outdoor, shower",35027
2388,57312,outdoor,"skyscraper, tower, oast_house, mosque/outdoor, clothing_store",35027
2389,57336,indoor,"entrance_hall, corridor, staircase, music_studio, bank_vault",35027
2390,57360,indoor,"corridor, entrance_hall, staircase, music_studio, server_room",35027
2391,57384,indoor,"entrance_hall, staircase, bank_vault, music_studio, corridor",35027
2392,57408,indoor,"server_room, corridor, entrance_hall, music_studio, elevator_lobby",35027
2393,57432,indoor,"entrance_hall, music_studio, television_studio, museum/indoor, staircase",35027
2394,57456,indoor,"entrance_hall, museum/indoor, clean_room, corridor, staircase",35027
2395,57480,indoor,"entrance_hall, corridor, staircase, bank_vault, elevator_lobby",35027
2396,57504,indoor,"entrance_hall, corridor, museum/indoor, clean_room, staircase",35027
2397,57528,indoor,"corridor, clean_room, music_studio, server_room, bank_vault",35027
2398,57552,indoor,"corridor, clean_room, bank_vault, server_room, museum/indoor",35027
2399,57576,indoor,"corridor, bank_vault, server_room, clean_room, entrance_hall",35027
2400,57600,indoor,"corridor, server_room, clean_room, bank_vault, music_studio",35027
2401,57624,indoor,"clean_room, archive, nursery, dressing_room, music_studio",35027
2402,57648,indoor,"archive, clean_room, music_studio, nursery, home_office",35027
2403,57672,indoor,"archive, office, clean_room, home_office, nursery",35027
2404,57696,indoor,"archive, clean_room, physics_laboratory, chemistry_lab, music_studio",35027
2405,57720,indoor,"archive, office, clean_room, library/indoor, physics_laboratory",35027
2406,57744,indoor,"clean_room, physics_laboratory, archive, chemistry_lab, biology_laboratory",35027
2407,57768,indoor,"archive, clean_room, dressing_room, physics_laboratory, dining_room",35027
2408,57792,indoor,"archive, clean_room, physics_laboratory, chemistry_lab, office",35027
2409,57816,indoor,"archive, chemistry_lab, physics_laboratory, clean_room, office",35027
2410,57840,indoor,"archive, physics_laboratory, chemistry_lab, biology_laboratory, clean_room",35027
2411,57864,indoor,"chemistry_lab, physics_laboratory, archive, biology_laboratory, clean_room",35027
2412,57888,indoor,"archive, chemistry_lab, physics_laboratory, office, library/indoor",35027
2413,57912,indoor,"archive, physics_laboratory, chemistry_lab, library/indoor, clean_room",35027
2414,57936,indoor,"archive, living_room, bow_window/indoor, home_office, dining_room",35027
2415,57960,indoor,"archive, office, home_office, dining_room, nursery",35027
2416,57984,indoor,"archive, library/indoor, office, living_room, home_office",35027
2417,58008,indoor,"archive, dining_room, living_room, home_office, office",35027
2418,58032,indoor,"archive, dining_room, living_room, office, home_office",35027
2419,58056,indoor,"server_room, corridor, clean_room, elevator_lobby, locker_room",35027
2420,58080,indoor,"corridor, elevator_lobby, server_room, clean_room, atrium/public",35027
2421,58104,indoor,"clean_room, shower, corridor, elevator_lobby, lobby",35027
2422,58128,indoor,"clean_room, locker_room, corridor, server_room, elevator_lobby",35027
2423,58152,indoor,"clean_room, shower, operating_room, server_room, hospital_room",35027
2424,58176,indoor,"server_room, locker_room, clean_room, corridor, sauna",35027
2425,58200,indoor,"server_room, clean_room, shower, locker_room, corridor",35027
2426,58224,indoor,"elevator/door, corridor, locker_room, clean_room, server_room",35027
2427,58248,indoor,"physics_laboratory, archive, chemistry_lab, biology_laboratory, clean_room",35027
2428,58272,indoor,"physics_laboratory, archive, chemistry_lab, clean_room, biology_laboratory",35027
2429,58296,indoor,"physics_laboratory, archive, chemistry_lab, clean_room, music_studio",35027
2430,58320,indoor,"physics_laboratory, archive, chemistry_lab, biology_laboratory, clean_room",35027
2431,58344,indoor,"archive, physics_laboratory, chemistry_lab, clean_room, biology_laboratory",35027
2432,58368,indoor,"archive, physics_laboratory, clean_room, chemistry_lab, office",35027
2433,58392,indoor,"archive, physics_laboratory, chemistry_lab, clean_room, office",35027
2434,58416,indoor,"dressing_room, bathroom, clean_room, hotel_room, dorm_room",35027
2435,58440,indoor,"dressing_room, kitchen, clean_room, nursery, dining_room",35027
2436,58464,indoor,"locker_room, closet, clean_room, dressing_room, server_room",35027
2437,58488,indoor,"server_room, locker_room, clean_room, closet, shower",35027
2438,58512,indoor,"clean_room, closet, locker_room, server_room, corridor",35027
2439,58536,indoor,"locker_room, clean_room, server_room, archive, bank_vault",35027
2440,58560,indoor,"locker_room, clean_room, archive, server_room, bank_vault",35027
2441,58584,indoor,"locker_room, clean_room, museum/indoor, archive, server_room",35027
2442,58608,indoor,"locker_room, clean_room, archive, server_room, corridor",35027
2443,58632,indoor,"locker_room, server_room, shower, closet, bank_vault",35027
2444,58656,indoor,"corridor, clean_room, server_room, locker_room, elevator_lobby",35027
2445,58680,indoor,"corridor, clean_room, server_room, museum/indoor, shower",35027
2446,58704,indoor,"clean_room, corridor, server_room, elevator_lobby, museum/indoor",35027
2447,58728,indoor,"clean_room, server_room, corridor, elevator_lobby, locker_room",35027
2448,58752,indoor,"clean_room, corridor, server_room, elevator_lobby, gymnasium/indoor",35027
2449,58776,indoor,"closet, locker_room, server_room, dressing_room, clean_room",35027
2450,58800,indoor,"locker_room, server_room, closet, bank_vault, shower",35027
2451,58824,indoor,"locker_room, closet, server_room, clean_room, dressing_room",35027
2452,58848,indoor,"server_room, shower, bank_vault, clean_room, locker_room",35027
2453,58872,indoor,"server_room, shower, bank_vault, locker_room, skyscraper",35027
2454,58896,indoor,"closet, shower, locker_room, clean_room, server_room",35027
2455,58920,indoor,"shower, closet, bow_window/indoor, attic, artists_loft",35027
2456,58944,indoor,"shower, locker_room, server_room, clean_room, closet",35027
2457,58968,indoor,"shower, server_room, elevator/door, skyscraper, locker_room",35027
2458,58992,indoor,"shower, server_room, locker_room, elevator/door, bank_vault",35027
2459,59016,indoor,"locker_room, server_room, storage_room, closet, bank_vault",35027
2460,59040,indoor,"locker_room, closet, server_room, dressing_room, shower",35027
2461,59064,indoor,"locker_room, server_room, closet, shower, clean_room",35027
2462,59088,indoor,"locker_room, shower, bathroom, closet, bank_vault",35027
2463,59112,indoor,"museum/indoor, shower, bank_vault, clothing_store, art_gallery",35027
2464,59136,indoor,"museum/indoor, clean_room, art_gallery, server_room, artists_loft",35027
2465,59160,indoor,"museum/indoor, art_gallery, clean_room, natural_history_museum, science_museum",35027
2466,59184,indoor,"server_room, clean_room, corridor, bank_vault, museum/indoor",35027
2467,59208,indoor,"bank_vault, server_room, clean_room, entrance_hall, museum/indoor",35027
2468,59232,indoor,"server_room, clean_room, bank_vault, shower, museum/indoor",35027
2469,59256,indoor,"elevator_lobby, server_room, lobby, locker_room, airport_terminal",35027
2470,59280,indoor,"lobby, corridor, elevator_lobby, reception, clean_room",35027
2471,59304,outdoor,"fire_escape, windmill, wind_farm, skyscraper, tower",35027
2472,59328,indoor,"basement, art_gallery, parking_garage/indoor, corridor, server_room",35027
2473,59352,indoor,"server_room, elevator_lobby, lobby, locker_room, corridor",35027
2474,59376,indoor,"clean_room, reception, conference_room, lobby, corridor",35027
2475,59400,outdoor,"skyscraper, tower, office_building, server_room, downtown",35027
2476,59424,outdoor,"stage/indoor, oilrig, skyscraper, tower, shower",35027
2477,59448,outdoor,"shower, skyscraper, tower, oilrig, stage/indoor",35027
2478,59472,outdoor,"oilrig, tower, skyscraper, stage/indoor, shower",35027
2479,59496,outdoor,"shower, stage/indoor, skyscraper, tower, oilrig",35027
2480,59520,indoor,"stage/indoor, shower, museum/indoor, oilrig, skyscraper",35027
2481,59544,indoor,"stage/indoor, shower, museum/indoor, skyscraper, tower",35027
2482,59568,outdoor,"skyscraper, tower, office_building, oilrig, underwater/ocean_deep",35027
2483,59592,indoor,"museum/indoor, stage/indoor, archive, chemistry_lab, discotheque",35027
2484,59616,outdoor,"museum/indoor, lake/natural, ice_shelf, art_gallery, ice_floe",35027
2485,59640,outdoor,"ice_floe, art_gallery, ice_shelf, museum/indoor, lake/natural",35027
2486,59664,indoor,"museum/indoor, archive, stage/indoor, shower, art_gallery",35027
2487,59688,indoor,"chemistry_lab, skyscraper, museum/indoor, tower, shower",35027
2488,59712,indoor,"chemistry_lab, childs_room, clean_room, museum/indoor, physics_laboratory",35027
2489,59736,indoor,"childs_room, stage/indoor, bedroom, archive, clean_room",35027
2490,59760,indoor,"museum/indoor, chemistry_lab, shower, archive, childs_room",35027
2491,59784,indoor,"stage/indoor, archive, museum/indoor, music_studio, chemistry_lab",35027
2492,59808,indoor,"art_gallery, lighthouse, museum/indoor, clean_room, tower",35027
2493,59832,outdoor,"aquarium, iceberg, ice_shelf, underwater/ocean_deep, elevator_lobby",35027
2494,59856,indoor,"shower, art_gallery, underwater/ocean_deep, natural_history_museum, museum/indoor",35027
2495,59880,indoor,"museum/indoor, stage/indoor, art_gallery, natural_history_museum, ice_shelf",35027
2496,59904,indoor,"natural_history_museum, museum/indoor, science_museum, aquarium, art_gallery",35027
2497,59928,indoor,"museum/indoor, natural_history_museum, science_museum, stage/indoor, ice_shelf",35027
2498,59952,indoor,"stage/indoor, natural_history_museum, museum/indoor, discotheque, science_museum",35027
2499,59976,indoor,"natural_history_museum, stage/indoor, museum/indoor, science_museum, art_gallery",35027
2500,60000,indoor,"natural_history_museum, museum/indoor, underwater/ocean_deep, stage/indoor, aquarium",35027
2501,60024,indoor,"museum/indoor, pond, natural_history_museum, underwater/ocean_deep, art_gallery",35027
2502,60048,indoor,"museum/indoor, natural_history_museum, stage/indoor, underwater/ocean_deep, pond",35027
2503,60072,indoor,"museum/indoor, stage/indoor, natural_history_museum, discotheque, underwater/ocean_deep",35027
2504,60096,indoor,"stage/indoor, arena/performance, discotheque, museum/indoor, natural_history_museum",35027
2505,60120,indoor,"stage/indoor, museum/indoor, discotheque, art_gallery, art_studio",35027
2506,60144,indoor,"museum/indoor, art_gallery, natural_history_museum, stage/indoor, science_museum",35027
2507,60168,indoor,"natural_history_museum, museum/indoor, science_museum, art_gallery, underwater/ocean_deep",35027
2508,60192,indoor,"museum/indoor, natural_history_museum, art_gallery, pond, underwater/ocean_deep",35027
2509,60216,indoor,"stage/indoor, museum/indoor, natural_history_museum, underwater/ocean_deep, arena/performance",35027
2510,60240,indoor,"museum/indoor, natural_history_museum, art_gallery, science_museum, aquarium",35027
2511,60264,indoor,"museum/indoor, natural_history_museum, art_gallery, science_museum, stage/indoor",35027
2512,60288,indoor,"museum/indoor, natural_history_museum, art_gallery, science_museum, pond",35027
2513,60312,indoor,"natural_history_museum, museum/indoor, art_gallery, science_museum, aquarium",35027
2514,60336,indoor,"museum/indoor, natural_history_museum, science_museum, art_gallery, underwater/ocean_deep",35027
2515,60360,indoor,"museum/indoor, natural_history_museum, stage/indoor, science_museum, underwater/ocean_deep",35027
2516,60384,indoor,"museum/indoor, natural_history_museum, art_gallery, science_museum, underwater/ocean_deep",35027
2517,60408,indoor,"museum/indoor, natural_history_museum, art_gallery, stage/indoor, science_museum",35027
2518,60432,indoor,"museum/indoor, natural_history_museum, art_gallery, science_museum, stage/indoor",35027
2519,60456,indoor,"museum/indoor, natural_history_museum, science_museum, underwater/ocean_deep, art_gallery",35027
2520,60480,indoor,"museum/indoor, natural_history_museum, stage/indoor, art_gallery, science_museum",35027
2521,60504,indoor,"museum/indoor, natural_history_museum, art_gallery, stage/indoor, science_museum",35027
2522,60528,indoor,"museum/indoor, natural_history_museum, art_gallery, science_museum, fountain",35027
2523,60552,indoor,"museum/indoor, natural_history_museum, art_gallery, science_museum, underwater/ocean_deep",35027
2524,60576,indoor,"museum/indoor, natural_history_museum, art_gallery, stage/indoor, science_museum",35027
2525,60600,indoor,"museum/indoor, natural_history_museum, art_gallery, shower, science_museum",35027
2526,60624,indoor,"museum/indoor, natural_history_museum, art_gallery, science_museum, shower",35027
2527,60648,indoor,"museum/indoor, natural_history_museum, stage/indoor, art_gallery, science_museum",35027
2528,60672,indoor,"clean_room, museum/indoor, shower, dressing_room, natural_history_museum",35027
2529,60696,indoor,"closet, clean_room, locker_room, shower, dressing_room",35027
2530,60720,indoor,"closet, locker_room, clean_room, shower, elevator/door",35027
2531,60744,indoor,"closet, locker_room, dressing_room, shower, clothing_store",35027
2532,60768,indoor,"clean_room, closet, locker_room, elevator/door, shower",35027
2533,60792,indoor,"clean_room, closet, locker_room, archive, dressing_room",35027
2534,60816,indoor,"museum/indoor, clean_room, clothing_store, dressing_room, art_gallery",35027
2535,60840,indoor,"museum/indoor, clean_room, dressing_room, art_gallery, clothing_store",35027
2536,60864,indoor,"museum/indoor, dressing_room, art_gallery, natural_history_museum, art_studio",35027
2537,60888,indoor,"museum/indoor, dressing_room, clothing_store, art_gallery, clean_room",35027
2538,60912,indoor,"museum/indoor, dressing_room, stage/indoor, clothing_store, art_gallery",35027
2539,60936,indoor,"museum/indoor, dressing_room, clothing_store, clean_room, art_gallery",35027
2540,60960,indoor,"museum/indoor, art_gallery, dressing_room, clothing_store, clean_room",35027
2541,60984,indoor,"museum/indoor, dressing_room, art_gallery, clothing_store, clean_room",35027
2542,61008,indoor,"museum/indoor, art_gallery, dressing_room, clothing_store, stage/indoor",35027
2543,61032,indoor,"museum/indoor, art_gallery, dressing_room, clothing_store, art_studio",35027
2544,61056,indoor,"museum/indoor, art_gallery, dressing_room, clothing_store, art_studio",35027
2545,61080,indoor,"museum/indoor, art_gallery, dressing_room, clothing_store, clean_room",35027
2546,61104,indoor,"museum/indoor, dressing_room, art_gallery, clothing_store, clean_room",35027
2547,61128,indoor,"museum/indoor, dressing_room, clothing_store, clean_room, art_gallery",35027
2548,61152,indoor,"museum/indoor, dressing_room, art_gallery, clothing_store, clean_room",35027
2549,61176,indoor,"museum/indoor, dressing_room, clean_room, clothing_store, art_gallery",35027
2550,61200,indoor,"museum/indoor, dressing_room, art_gallery, clean_room, clothing_store",35027
2551,61224,indoor,"museum/indoor, dressing_room, clothing_store, art_gallery, art_studio",35027
2552,61248,indoor,"museum/indoor, dressing_room, art_gallery, clothing_store, stage/indoor",35027
2553,61272,indoor,"museum/indoor, art_gallery, dressing_room, clothing_store, clean_room",35027
2554,61296,indoor,"museum/indoor, dressing_room, art_gallery, clothing_store, clean_room",35027
2555,61320,indoor,"museum/indoor, art_gallery, stage/indoor, dressing_room, art_studio",35027
2556,61344,indoor,"server_room, locker_room, clean_room, archive, operating_room",35027
2557,61368,indoor,"clean_room, operating_room, museum/indoor, dressing_room, science_museum",35027
2558,61392,indoor,"clean_room, operating_room, archive, museum/indoor, physics_laboratory",35027
2559,61416,indoor,"clean_room, museum/indoor, operating_room, archive, science_museum",35027
2560,61440,indoor,"museum/indoor, clean_room, stage/indoor, music_studio, science_museum",35027
2561,61464,indoor,"museum/indoor, stage/indoor, music_studio, television_studio, discotheque",35027
