,frame_num,environment,places
1269,30456,indoor,"museum/indoor, clean_room, music_studio, stage/indoor, science_museum"
1270,30480,indoor,"museum/indoor, clean_room, music_studio, stage/indoor, office"
1271,30504,indoor,"museum/indoor, music_studio, stage/indoor, clean_room, office"
1272,30528,indoor,"museum/indoor, clean_room, music_studio, stage/indoor, office"
1273,30552,indoor,"dressing_room, clean_room, locker_room, shower, archive"
1274,30576,indoor,"dressing_room, clean_room, locker_room, shower, bathroom"
1275,30600,indoor,"dressing_room, clean_room, shower, bathroom, locker_room"
1276,30624,indoor,"locker_room, dressing_room, shower, sauna, bathroom"
1277,30648,indoor,"dressing_room, locker_room, shower, bathroom, sauna"
1278,30672,indoor,"dressing_room, clean_room, bow_window/indoor, dining_room, clothing_store"
1279,30696,indoor,"bow_window/indoor, bedchamber, bedroom, hotel_room, childs_room"
1280,30720,indoor,"bow_window/indoor, bedroom, bedchamber, hotel_room, childs_room"
1281,30744,indoor,"bow_window/indoor, bedroom, bedchamber, hotel_room, childs_room"
1282,30768,indoor,"bow_window/indoor, bedroom, bedchamber, hotel_room, childs_room"
1283,30792,indoor,"museum/indoor, martial_arts_gym, zen_garden, clean_room, science_museum"
1284,30816,indoor,"museum/indoor, martial_arts_gym, zen_garden, clean_room, science_museum"
1285,30840,indoor,"bedroom, hospital_room, nursery, hotel_room, bedchamber"
1286,30864,indoor,"bedroom, hospital_room, nursery, hotel_room, bedchamber"
1287,30888,indoor,"bedroom, hospital_room, nursery, hotel_room, bedchamber"
1288,30912,indoor,"bedroom, hospital_room, nursery, hotel_room, bedchamber"
1289,30936,indoor,"hospital_room, bedroom, nursery, hotel_room, bedchamber"
1290,30960,indoor,"bow_window/indoor, doorway/outdoor, locker_room, barndoor, elevator/door"
1291,30984,indoor,"clean_room, locker_room, dressing_room, closet, archive"
1292,31008,indoor,"clean_room, museum/indoor, locker_room, shower, art_gallery"
1293,31032,indoor,"clean_room, locker_room, dressing_room, closet, shower"
1294,31056,indoor,"clean_room, hospital_room, operating_room, nursing_home, nursery"
1295,31080,indoor,"clean_room, hospital_room, operating_room, nursing_home, hospital"
1296,31104,indoor,"hospital_room, clean_room, operating_room, nursing_home, nursery"
1297,31128,indoor,"clean_room, operating_room, hospital_room, dressing_room, nursing_home"
1298,31152,indoor,"clean_room, operating_room, hospital_room, nursing_home, dressing_room"
1299,31176,indoor,"clean_room, operating_room, hospital_room, dressing_room, nursing_home"
1300,31200,indoor,"clean_room, operating_room, hospital_room, dressing_room, nursing_home"
1301,31224,indoor,"clean_room, operating_room, hospital_room, dressing_room, nursing_home"
1302,31248,indoor,"clean_room, operating_room, hospital_room, dressing_room, nursing_home"
1303,31272,indoor,"clean_room, operating_room, hospital_room, dressing_room, nursing_home"
1304,31296,indoor,"clean_room, operating_room, hospital_room, dressing_room, nursery"
1305,31320,indoor,"clean_room, dressing_room, hospital_room, operating_room, nursery"
1306,31344,indoor,"clean_room, dressing_room, operating_room, hospital_room, nursery"
1307,31368,indoor,"clean_room, dressing_room, operating_room, hospital_room, nursery"
1308,31392,indoor,"clean_room, dressing_room, operating_room, hospital_room, nursery"
1309,31416,indoor,"clean_room, dressing_room, operating_room, hospital_room, nursery"
1310,31440,indoor,"clean_room, dressing_room, operating_room, hospital_room, locker_room"
1311,31464,indoor,"clean_room, operating_room, hospital_room, dressing_room, nursing_home"
1312,31488,indoor,"clean_room, operating_room, hospital_room, dressing_room, nursing_home"
1313,31512,indoor,"clean_room, operating_room, hospital_room, dressing_room, nursing_home"
1314,31536,indoor,"clean_room, operating_room, hospital_room, dressing_room, nursing_home"
1315,31560,indoor,"clean_room, operating_room, dressing_room, hospital_room, nursing_home"
1316,31584,indoor,"clean_room, dressing_room, operating_room, hospital_room, nursing_home"
1317,31608,indoor,"clean_room, dressing_room, operating_room, hospital_room, nursing_home"
1318,31632,indoor,"clean_room, operating_room, dressing_room, hospital_room, nursing_home"
1319,31656,indoor,"clean_room, operating_room, dressing_room, hospital_room, nursing_home"
1320,31680,indoor,"clean_room, operating_room, hospital_room, dressing_room, nursing_home"
1321,31704,indoor,"clean_room, operating_room, hospital_room, dressing_room, nursing_home"
1322,31728,indoor,"clean_room, operating_room, dressing_room, hospital_room, nursing_home"
1323,31752,indoor,"clean_room, operating_room, hospital_room, dressing_room, nursing_home"
1324,31776,indoor,"clean_room, dressing_room, nursing_home, hospital_room, operating_room"
1325,31800,indoor,"clean_room, dressing_room, hospital_room, operating_room, nursery"
1326,31824,indoor,"clean_room, dressing_room, hospital_room, nursery, operating_room"
1327,31848,indoor,"nursery, bedroom, hospital_room, clean_room, childs_room"
1328,31872,indoor,"bow_window/indoor, living_room, nursery, alcove, waiting_room"
1329,31896,indoor,"bow_window/indoor, living_room, nursery, bedchamber, bedroom"
1330,31920,indoor,"bow_window/indoor, living_room, bedchamber, bedroom, nursery"
1331,31944,indoor,"bow_window/indoor, living_room, bedroom, bedchamber, childs_room"
1332,31968,indoor,"bow_window/indoor, living_room, nursery, bedchamber, bedroom"
1333,31992,indoor,"nursery, hospital_room, bedroom, hotel_room, clean_room"
1334,32016,indoor,"hospital_room, nursery, bedroom, hotel_room, bedchamber"
1335,32040,indoor,"nursery, bedroom, hospital_room, hotel_room, bedchamber"
1336,32064,indoor,"bedroom, nursery, hospital_room, hotel_room, bedchamber"
1337,32088,indoor,"nursery, bedroom, hospital_room, hotel_room, bedchamber"
1338,32112,indoor,"bedroom, nursery, hospital_room, hotel_room, bedchamber"
1339,32136,indoor,"clean_room, hospital_room, nursery, dressing_room, bedroom"
1340,32160,indoor,"bow_window/indoor, living_room, bedroom, nursery, childs_room"
1341,32184,indoor,"bow_window/indoor, living_room, nursery, childs_room, bedchamber"
1342,32208,indoor,"bow_window/indoor, living_room, dining_room, bedchamber, bedroom"
1343,32232,indoor,"bow_window/indoor, living_room, dining_room, artists_loft, bedroom"
1344,32256,indoor,"bow_window/indoor, dining_room, living_room, dining_hall, artists_loft"
1345,32280,indoor,"kennel/outdoor, stable, bullring, arena/rodeo, shower"
1346,32304,indoor,"shower, bathroom, gymnasium/indoor, playground, kennel/outdoor"
1347,32328,indoor,"aquarium, ice_shelf, discotheque, iceberg, shower"
1348,32352,indoor,"clean_room, locker_room, elevator/door, museum/indoor, dressing_room"
1349,32376,indoor,"clean_room, operating_room, locker_room, elevator/door, art_gallery"
1350,32400,indoor,"clean_room, operating_room, museum/indoor, art_gallery, locker_room"
1351,32424,indoor,"clean_room, elevator/door, art_gallery, museum/indoor, closet"
1352,32448,indoor,"bow_window/indoor, clean_room, museum/indoor, art_gallery, doorway/outdoor"
1353,32472,indoor,"museum/indoor, bow_window/indoor, clean_room, doorway/outdoor, art_gallery"
1354,32496,indoor,"museum/indoor, bow_window/indoor, art_gallery, alcove, doorway/outdoor"
1355,32520,indoor,"bow_window/indoor, museum/indoor, art_gallery, alcove, living_room"
1356,32544,indoor,"bow_window/indoor, museum/indoor, clean_room, art_gallery, doorway/outdoor"
1357,32568,indoor,"museum/indoor, bow_window/indoor, clean_room, art_gallery, alcove"
1358,32592,indoor,"bow_window/indoor, museum/indoor, clean_room, art_gallery, doorway/outdoor"
1359,32616,indoor,"bow_window/indoor, museum/indoor, clean_room, art_gallery, archive"
1360,32640,indoor,"bow_window/indoor, clean_room, museum/indoor, living_room, doorway/outdoor"
1361,32664,indoor,"bow_window/indoor, museum/indoor, clean_room, living_room, alcove"
1362,32688,indoor,"clean_room, bow_window/indoor, museum/indoor, doorway/outdoor, art_gallery"
1363,32712,indoor,"museum/indoor, bow_window/indoor, clean_room, art_gallery, archive"
1364,32736,indoor,"museum/indoor, clean_room, bow_window/indoor, art_gallery, doorway/outdoor"
1365,32760,indoor,"bow_window/indoor, clean_room, museum/indoor, doorway/outdoor, archive"
1366,32784,indoor,"clean_room, museum/indoor, bow_window/indoor, living_room, artists_loft"
1367,32808,indoor,"museum/indoor, clean_room, bow_window/indoor, archive, art_gallery"
1368,32832,indoor,"clean_room, bow_window/indoor, museum/indoor, archive, physics_laboratory"
1369,32856,indoor,"clean_room, bow_window/indoor, museum/indoor, archive, beauty_salon"
1370,32880,indoor,"bow_window/indoor, clean_room, museum/indoor, office, archive"
1371,32904,indoor,"clean_room, bow_window/indoor, nursing_home, archive, museum/indoor"
1372,32928,outdoor,"ski_slope, raceway, highway, crosswalk, driveway"
1373,32952,outdoor,"ski_slope, raceway, highway, crosswalk, driveway"
1374,32976,outdoor,"ski_slope, raceway, highway, crosswalk, driveway"
1375,33000,outdoor,"ski_slope, raceway, highway, driveway, ski_resort"
1376,33024,outdoor,"raceway, ski_slope, driveway, fire_station, ski_resort"
1377,33048,indoor,"raceway, auto_factory, amusement_park, assembly_line, train_station/platform"
1378,33072,outdoor,"playground, raceway, train_station/platform, ski_slope, railroad_track"
1379,33096,indoor,"auto_factory, engine_room, playground, railroad_track, assembly_line"
1380,33120,outdoor,"playground, amusement_park, auto_factory, railroad_track, engine_room"
1381,33144,indoor,"engine_room, auto_factory, playground, assembly_line, railroad_track"
1382,33168,outdoor,"courtyard, campus, picnic_area, patio, plaza"
1383,33192,outdoor,"courtyard, campus, picnic_area, patio, alley"
1384,33216,outdoor,"auto_factory, engine_room, railroad_track, playground, ski_slope"
1385,33240,indoor,"auto_factory, assembly_line, raceway, engine_room, ski_slope"
1386,33264,indoor,"playground, auto_factory, assembly_line, boxing_ring, raceway"
1387,33288,outdoor,"picnic_area, courtyard, campus, patio, plaza"
1388,33312,outdoor,"courtyard, patio, campus, street, porch"
1389,33336,outdoor,"campus, courtyard, street, plaza, hospital_room"
1390,33360,indoor,"fountain, ice_shelf, nursery, clean_room, hospital_room"
1391,33384,indoor,"banquet_hall, clean_room, hospital_room, nursing_home, dining_hall"
1392,33408,indoor,"clean_room, hospital_room, nursing_home, nursery, banquet_hall"
1393,33432,indoor,"clean_room, nursing_home, porch, hospital_room, nursery"
1394,33456,indoor,"clean_room, biology_laboratory, operating_room, hospital_room, veterinarians_office"
1395,33480,indoor,"clean_room, museum/indoor, biology_laboratory, chemistry_lab, operating_room"
1396,33504,indoor,"clean_room, veterinarians_office, operating_room, biology_laboratory, chemistry_lab"
1397,33528,outdoor,"cemetery, mausoleum, schoolhouse, slum, classroom"
1398,33552,outdoor,"cemetery, mausoleum, slum, schoolhouse, classroom"
1399,33576,outdoor,"cemetery, schoolhouse, shed, mausoleum, slum"
1400,33600,outdoor,"cemetery, schoolhouse, slum, mausoleum, classroom"
1401,33624,indoor,"slum, kindergarden_classroom, archive, classroom, cemetery"
1402,33648,indoor,"discotheque, slum, playground, kindergarden_classroom, bar"
1403,33672,indoor,"slum, kindergarden_classroom, discotheque, orchard, classroom"
1404,33696,indoor,"discotheque, kindergarden_classroom, slum, orchard, classroom"
1405,33720,outdoor,"discotheque, cemetery, orchard, slum, playground"
1406,33744,outdoor,"slum, cemetery, schoolhouse, discotheque, orchard"
1407,33768,indoor,"clean_room, operating_room, martial_arts_gym, museum/indoor, hospital_room"
1408,33792,outdoor,"clean_room, ice_floe, campsite, igloo, operating_room"
1409,33816,indoor,"clean_room, martial_arts_gym, pond, operating_room, ice_floe"
1410,33840,indoor,"clean_room, operating_room, biology_laboratory, chemistry_lab, campsite"
1411,33864,indoor,"clean_room, campsite, operating_room, hospital_room, veterinarians_office"
1412,33888,indoor,"clean_room, biology_laboratory, chemistry_lab, iceberg, ice_cream_parlor"
1413,33912,indoor,"clean_room, chemistry_lab, museum/indoor, science_museum, biology_laboratory"
1414,33936,outdoor,"clean_room, ice_floe, iceberg, operating_room, igloo"
1415,33960,outdoor,"clean_room, ice_floe, igloo, playground, ice_shelf"
1416,33984,outdoor,"clean_room, playground, campsite, ice_floe, igloo"
1417,34008,indoor,"slum, discotheque, shower, sauna, basement"
1418,34032,indoor,"slum, shower, discotheque, sauna, basement"
1419,34056,indoor,"slum, shower, discotheque, sauna, cemetery"
1420,34080,outdoor,"slum, cemetery, discotheque, shower, playground"
1421,34104,outdoor,"clean_room, martial_arts_gym, campsite, ice_floe, playground"
1422,34128,outdoor,"clean_room, ice_floe, martial_arts_gym, igloo, campsite"
1423,34152,outdoor,"clean_room, martial_arts_gym, ice_floe, igloo, campsite"
1424,34176,indoor,"clean_room, botanical_garden, nursing_home, martial_arts_gym, operating_room"
1425,34200,indoor,"clean_room, museum/indoor, martial_arts_gym, archive, nursing_home"
1426,34224,indoor,"clean_room, museum/indoor, operating_room, martial_arts_gym, dressing_room"
1427,34248,indoor,"dressing_room, museum/indoor, clean_room, nursing_home, operating_room"
1428,34272,indoor,"clean_room, dressing_room, nursing_home, hospital_room, operating_room"
1429,34296,indoor,"clean_room, dressing_room, operating_room, nursing_home, archive"
1430,34320,indoor,"clean_room, museum/indoor, operating_room, archive, nursing_home"
1431,34344,indoor,"clean_room, museum/indoor, operating_room, dressing_room, archive"
1432,34368,indoor,"clean_room, museum/indoor, dressing_room, operating_room, archive"
1433,34392,indoor,"clean_room, museum/indoor, dressing_room, archive, martial_arts_gym"
1434,34416,indoor,"clean_room, operating_room, museum/indoor, archive, dressing_room"
1435,34440,indoor,"clean_room, museum/indoor, archive, physics_laboratory, operating_room"
1436,34464,indoor,"museum/indoor, clean_room, archive, dressing_room, physics_laboratory"
1437,34488,indoor,"clean_room, archive, dressing_room, museum/indoor, operating_room"
1438,34512,indoor,"clean_room, museum/indoor, archive, dressing_room, hospital_room"
1439,34536,indoor,"clean_room, operating_room, dressing_room, museum/indoor, archive"
1440,34560,indoor,"clean_room, operating_room, museum/indoor, hospital_room, nursing_home"
1441,34584,indoor,"clean_room, nursing_home, operating_room, hospital_room, museum/indoor"
1442,34608,indoor,"clean_room, dressing_room, nursing_home, hospital_room, operating_room"
1443,34632,indoor,"clean_room, operating_room, hospital_room, nursing_home, dressing_room"
1444,34656,indoor,"porch, nursing_home, physics_laboratory, chemistry_lab, hospital_room"
1445,34680,indoor,"porch, nursing_home, hospital_room, clean_room, patio"
1446,34704,indoor,"clean_room, operating_room, martial_arts_gym, hospital_room, nursing_home"
1447,34728,indoor,"clean_room, operating_room, nursing_home, hospital_room, archive"
1448,34752,indoor,"clean_room, archive, nursing_home, operating_room, museum/indoor"
1449,34776,indoor,"clean_room, archive, chemistry_lab, biology_laboratory, computer_room"
1450,34800,indoor,"clean_room, operating_room, nursing_home, archive, television_studio"
1451,34824,indoor,"clean_room, archive, museum/indoor, nursing_home, martial_arts_gym"
1452,34848,indoor,"clean_room, nursing_home, archive, operating_room, hospital_room"
1453,34872,indoor,"clean_room, office, nursing_home, archive, hospital_room"
1454,34896,indoor,"clean_room, archive, chemistry_lab, office, nursing_home"
1455,34920,indoor,"clean_room, archive, chemistry_lab, pharmacy, biology_laboratory"
1456,34944,indoor,"clean_room, archive, office, dressing_room, nursing_home"
1457,34968,indoor,"dressing_room, clean_room, archive, beauty_salon, clothing_store"
1458,34992,indoor,"hospital_room, bedroom, hotel_room, operating_room, clean_room"
1459,35016,indoor,"bedroom, bedchamber, hospital_room, hotel_room, bow_window/indoor"
1460,35040,indoor,"bedroom, bedchamber, childs_room, hotel_room, bow_window/indoor"
1461,35064,indoor,"bedroom, bedchamber, childs_room, bow_window/indoor, hotel_room"
1462,35088,indoor,"bedroom, hospital_room, bedchamber, hotel_room, bow_window/indoor"
1463,35112,outdoor,"crosswalk, jewelry_shop, parking_lot, cemetery, physics_laboratory"
1464,35136,outdoor,"crosswalk, parking_lot, jewelry_shop, cemetery, auto_factory"
1465,35160,outdoor,"crosswalk, jewelry_shop, parking_lot, cemetery, physics_laboratory"
1466,35184,indoor,"clean_room, dressing_room, hospital_room, operating_room, nursery"
1467,35208,indoor,"clean_room, dressing_room, hospital_room, operating_room, nursing_home"
1468,35232,outdoor,"crosswalk, jewelry_shop, parking_lot, cemetery, runway"
1469,35256,outdoor,"crosswalk, runway, shoe_shop, landing_deck, parking_lot"
1470,35280,indoor,"hospital_room, bedroom, bedchamber, operating_room, childs_room"
1471,35304,indoor,"bedroom, bedchamber, bow_window/indoor, childs_room, hotel_room"
1472,35328,indoor,"hospital_room, bedroom, operating_room, clean_room, bedchamber"
1473,35352,indoor,"hospital_room, operating_room, clean_room, bedroom, bedchamber"
1474,35376,indoor,"hospital_room, operating_room, clean_room, bedroom, bedchamber"
1475,35400,indoor,"hospital_room, bedroom, operating_room, childs_room, bedchamber"
1476,35424,indoor,"hospital_room, operating_room, bedroom, youth_hostel, childs_room"
1477,35448,indoor,"hospital_room, operating_room, bedroom, childs_room, hotel_room"
1478,35472,indoor,"hospital_room, bedroom, youth_hostel, childs_room, hotel_room"
1479,35496,indoor,"hospital_room, operating_room, bedroom, childs_room, clean_room"
1480,35520,indoor,"hospital_room, operating_room, nursing_home, clean_room, bedroom"
1481,35544,indoor,"hospital_room, childs_room, bedroom, nursery, operating_room"
1482,35568,indoor,"hospital_room, bedroom, childs_room, operating_room, clean_room"
1483,35592,indoor,"hospital_room, clean_room, operating_room, nursery, nursing_home"
1484,35616,indoor,"clean_room, hospital_room, operating_room, nursing_home, bedroom"
1485,35640,indoor,"hospital_room, clean_room, operating_room, dressing_room, nursing_home"
1486,35664,indoor,"clean_room, operating_room, hospital_room, dressing_room, nursing_home"
1487,35688,indoor,"clean_room, operating_room, dressing_room, locker_room, hospital_room"
1488,35712,indoor,"clean_room, operating_room, archive, hospital_room, nursing_home"
1489,35736,indoor,"clean_room, locker_room, operating_room, dressing_room, archive"
1490,35760,indoor,"clean_room, dressing_room, operating_room, locker_room, shower"
1491,35784,indoor,"clean_room, dressing_room, operating_room, hospital_room, nursing_home"
1492,35808,indoor,"clean_room, dressing_room, locker_room, art_gallery, operating_room"
1493,35832,indoor,"clean_room, operating_room, shower, dressing_room, locker_room"
1494,35856,indoor,"clean_room, operating_room, hospital_room, nursing_home, museum/indoor"
1495,35880,indoor,"clean_room, operating_room, hospital_room, nursing_home, archive"
1496,35904,indoor,"clean_room, operating_room, hospital_room, nursing_home, archive"
1497,35928,indoor,"clean_room, locker_room, archive, dressing_room, jail_cell"
1498,35952,indoor,"clean_room, locker_room, dressing_room, archive, chemistry_lab"
1499,35976,indoor,"dressing_room, clean_room, beauty_salon, hospital_room, music_studio"
1500,36000,indoor,"clean_room, operating_room, hospital_room, archive, museum/indoor"
1501,36024,indoor,"clean_room, operating_room, hospital_room, archive, locker_room"
1502,36048,indoor,"clean_room, operating_room, archive, museum/indoor, hospital_room"
1503,36072,indoor,"clean_room, operating_room, nursery, archive, locker_room"
1504,36096,indoor,"clean_room, locker_room, operating_room, shower, hospital_room"
1505,36120,indoor,"shower, clean_room, dressing_room, sauna, bathroom"
1506,36144,indoor,"clean_room, dressing_room, locker_room, elevator/door, beauty_salon"
1507,36168,indoor,"clean_room, dressing_room, locker_room, elevator/door, shower"
1508,36192,indoor,"clean_room, dressing_room, hospital_room, operating_room, chemistry_lab"
1509,36216,indoor,"clean_room, dressing_room, operating_room, shower, chemistry_lab"
1510,36240,indoor,"clean_room, dressing_room, operating_room, shower, beauty_salon"
1511,36264,indoor,"clean_room, dressing_room, operating_room, chemistry_lab, archive"
1512,36288,indoor,"clean_room, dressing_room, museum/indoor, archive, chemistry_lab"
1513,36312,indoor,"clean_room, dressing_room, chemistry_lab, biology_laboratory, operating_room"
1514,36336,indoor,"dressing_room, clean_room, museum/indoor, beauty_salon, chemistry_lab"
1515,36360,indoor,"clean_room, dressing_room, biology_laboratory, chemistry_lab, operating_room"
1516,36384,indoor,"clean_room, dressing_room, operating_room, museum/indoor, chemistry_lab"
1517,36408,indoor,"clean_room, dressing_room, chemistry_lab, biology_laboratory, operating_room"
1518,36432,indoor,"clean_room, dressing_room, archive, museum/indoor, operating_room"
1519,36456,indoor,"clean_room, dressing_room, chemistry_lab, biology_laboratory, operating_room"
1520,36480,indoor,"clean_room, dressing_room, museum/indoor, beauty_salon, chemistry_lab"
1521,36504,indoor,"clean_room, dressing_room, operating_room, museum/indoor, biology_laboratory"
1522,36528,indoor,"clean_room, operating_room, dressing_room, hospital_room, archive"
1523,36552,indoor,"clean_room, operating_room, dressing_room, hospital_room, nursing_home"
1524,36576,indoor,"clean_room, operating_room, hospital_room, dressing_room, chemistry_lab"
1525,36600,indoor,"clean_room, operating_room, dressing_room, hospital_room, archive"
1526,36624,indoor,"dressing_room, clean_room, museum/indoor, beauty_salon, art_gallery"
1527,36648,indoor,"dressing_room, clean_room, museum/indoor, art_gallery, beauty_salon"
1528,36672,indoor,"dressing_room, museum/indoor, clean_room, art_gallery, office"
1529,36696,indoor,"dressing_room, clean_room, museum/indoor, beauty_salon, art_gallery"
1530,36720,indoor,"clean_room, operating_room, chemistry_lab, archive, physics_laboratory"
1531,36744,indoor,"clean_room, dressing_room, operating_room, clothing_store, nursery"
1532,36768,indoor,"clean_room, dressing_room, museum/indoor, nursery, operating_room"
1533,36792,indoor,"clean_room, dressing_room, museum/indoor, nursery, archive"
1534,36816,indoor,"clean_room, dressing_room, museum/indoor, nursery, operating_room"
1535,36840,indoor,"clean_room, dressing_room, nursery, operating_room, museum/indoor"
1536,36864,indoor,"clean_room, dressing_room, beauty_salon, chemistry_lab, nursery"
1537,36888,indoor,"dressing_room, clean_room, bow_window/indoor, beauty_salon, science_museum"
1538,36912,indoor,"dressing_room, clean_room, beauty_salon, bow_window/indoor, hospital_room"
1539,36936,indoor,"bow_window/indoor, dressing_room, beauty_salon, waiting_room, classroom"
1540,36960,indoor,"dressing_room, bow_window/indoor, beauty_salon, clean_room, shower"
1541,36984,indoor,"dressing_room, clean_room, science_museum, beauty_salon, chemistry_lab"
1542,37008,indoor,"dressing_room, locker_room, shower, closet, beauty_salon"
1543,37032,indoor,"dressing_room, locker_room, shower, clothing_store, closet"
1544,37056,indoor,"dressing_room, locker_room, shower, clothing_store, closet"
1545,37080,indoor,"dressing_room, locker_room, clothing_store, shower, closet"
1546,37104,indoor,"dressing_room, clean_room, shower, nursery, locker_room"
1547,37128,indoor,"dressing_room, clean_room, carrousel, locker_room, chemistry_lab"
1548,37152,indoor,"dressing_room, clean_room, beauty_salon, chemistry_lab, locker_room"
1549,37176,indoor,"dressing_room, clean_room, beauty_salon, chemistry_lab, science_museum"
1550,37200,indoor,"dressing_room, beauty_salon, locker_room, clean_room, shower"
1551,37224,indoor,"dressing_room, locker_room, beauty_salon, shower, clean_room"
1552,37248,indoor,"dressing_room, clean_room, science_museum, chemistry_lab, beauty_salon"
1553,37272,outdoor,"corn_field, dressing_room, wheat_field, carrousel, chemistry_lab"
1554,37296,indoor,"dressing_room, beauty_salon, bow_window/indoor, clean_room, playroom"
1555,37320,indoor,"nursery, bedroom, bedchamber, living_room, hospital_room"
1556,37344,indoor,"nursery, bedroom, bedchamber, childs_room, hospital_room"
1557,37368,indoor,"bedroom, nursery, bedchamber, hospital_room, childs_room"
1558,37392,indoor,"nursery, clean_room, bedroom, dressing_room, closet"
1559,37416,indoor,"bow_window/indoor, closet, nursery, dressing_room, alcove"
1560,37440,indoor,"clean_room, chemistry_lab, biology_laboratory, physics_laboratory, hospital_room"
1561,37464,indoor,"clean_room, dressing_room, chemistry_lab, hospital_room, locker_room"
1562,37488,indoor,"jail_cell, martial_arts_gym, shower, boxing_ring, locker_room"
1563,37512,indoor,"clean_room, dressing_room, operating_room, archive, museum/indoor"
1564,37536,indoor,"clean_room, shower, dressing_room, art_gallery, elevator/door"
1565,37560,indoor,"clean_room, dressing_room, locker_room, shower, sauna"
1566,37584,indoor,"clean_room, dressing_room, elevator/door, shower, locker_room"
1567,37608,indoor,"clean_room, dressing_room, beauty_salon, operating_room, museum/indoor"
1568,37632,indoor,"clean_room, dressing_room, elevator/door, art_gallery, operating_room"
1569,37656,indoor,"bow_window/indoor, shower, bathroom, dressing_room, nursery"
1570,37680,indoor,"clean_room, dressing_room, bow_window/indoor, shower, locker_room"
1571,37704,indoor,"clean_room, dressing_room, locker_room, sauna, shower"
1572,37728,indoor,"clean_room, nursing_home, hospital_room, nursery, operating_room"
1573,37752,indoor,"clean_room, hospital_room, nursery, operating_room, nursing_home"
1574,37776,indoor,"clean_room, nursery, operating_room, archive, museum/indoor"
1575,37800,indoor,"clean_room, operating_room, dressing_room, locker_room, nursery"
