,frame_num,environment,places
4175,100200,indoor,"nursery, hospital_room, bedroom, clean_room, hotel_room"
4176,100224,indoor,"nursery, bedroom, balcony/interior, porch, hospital_room"
4177,100248,indoor,"nursery, bedroom, hospital_room, childs_room, bedchamber"
4178,100272,indoor,"bedroom, nursery, childs_room, bedchamber, hospital_room"
4179,100296,indoor,"bedroom, nursery, childs_room, bedchamber, hospital_room"
4180,100320,indoor,"bedroom, nursery, bedchamber, childs_room, hotel_room"
4181,100344,indoor,"bedroom, nursery, hospital_room, bedchamber, childs_room"
4182,100368,indoor,"bedroom, nursery, hospital_room, bedchamber, childs_room"
4183,100392,indoor,"bedroom, nursery, bedchamber, hospital_room, childs_room"
4184,100416,indoor,"bedroom, nursery, bedchamber, hospital_room, childs_room"
4185,100440,indoor,"bedroom, nursery, bedchamber, childs_room, hospital_room"
4186,100464,indoor,"nursery, bedroom, childs_room, hospital_room, bedchamber"
4187,100488,indoor,"nursery, bedroom, childs_room, bedchamber, hospital_room"
4188,100512,indoor,"operating_room, clean_room, hospital_room, dressing_room, clothing_store"
4189,100536,indoor,"clean_room, operating_room, hospital_room, dressing_room, clothing_store"
4190,100560,indoor,"clean_room, hospital_room, operating_room, dressing_room, clothing_store"
4191,100584,indoor,"clean_room, hospital_room, operating_room, dressing_room, bedroom"
4192,100608,indoor,"clean_room, hospital_room, living_room, operating_room, dining_room"
4193,100632,indoor,"clean_room, dining_room, hospital_room, nursing_home, living_room"
4194,100656,indoor,"living_room, bow_window/indoor, clean_room, dining_room, hospital_room"
4195,100680,indoor,"bedroom, hospital_room, nursery, bedchamber, childs_room"
4196,100704,indoor,"nursery, hospital_room, bedroom, clean_room, childs_room"
4197,100728,indoor,"clean_room, nursery, hospital_room, bedroom, nursing_home"
4198,100752,indoor,"bedroom, dorm_room, childs_room, hospital_room, hotel_room"
4199,100776,indoor,"shower, locker_room, bathroom, clean_room, dressing_room"
4200,100800,indoor,"shower, closet, bow_window/indoor, dressing_room, locker_room"
4201,100824,indoor,"shower, bathroom, closet, bow_window/indoor, locker_room"
4202,100848,indoor,"shower, bathroom, closet, bow_window/indoor, locker_room"
4203,100872,indoor,"clean_room, museum/indoor, shower, dressing_room, locker_room"
4204,100896,indoor,"music_studio, discotheque, archive, stage/indoor, bookstore"
4205,100920,indoor,"archive, bookstore, physics_laboratory, music_studio, clean_room"
4206,100944,indoor,"archive, bookstore, kindergarden_classroom, music_studio, physics_laboratory"
4207,100968,indoor,"archive, classroom, kindergarden_classroom, library/indoor, bookstore"
4208,100992,indoor,"museum/indoor, clean_room, science_museum, natural_history_museum, playground"
4209,101016,indoor,"natural_history_museum, science_museum, museum/indoor, music_studio, chemistry_lab"
4210,101040,indoor,"nursery, locker_room, clean_room, kindergarden_classroom, dressing_room"
4211,101064,indoor,"locker_room, archive, clean_room, phone_booth, dressing_room"
4212,101088,indoor,"music_studio, natural_history_museum, clean_room, science_museum, locker_room"
4213,101112,indoor,"bar, clean_room, music_studio, shoe_shop, natural_history_museum"
4214,101136,indoor,"clean_room, engine_room, biology_laboratory, repair_shop, operating_room"
4215,101160,indoor,"clean_room, dressing_room, hospital_room, discotheque, office"
4216,101184,indoor,"atrium/public, clean_room, bow_window/indoor, archive, server_room"
4217,101208,indoor,"atrium/public, bow_window/indoor, shopping_mall/indoor, office_building, balcony/interior"
4218,101232,indoor,"bow_window/indoor, shower, elevator/door, server_room, atrium/public"
4219,101256,indoor,"atrium/public, server_room, elevator_shaft, skyscraper, corridor"
4220,101280,indoor,"server_room, elevator_shaft, archive, corridor, jail_cell"
4221,101304,indoor,"elevator_shaft, server_room, atrium/public, skyscraper, clean_room"
4222,101328,indoor,"elevator_shaft, atrium/public, clean_room, server_room, skyscraper"
4223,101352,indoor,"elevator_shaft, atrium/public, skyscraper, shower, server_room"
4224,101376,indoor,"elevator_shaft, server_room, atrium/public, shower, clean_room"
4225,101400,indoor,"elevator_shaft, server_room, atrium/public, clean_room, corridor"
4226,101424,indoor,"elevator_shaft, server_room, atrium/public, corridor, clean_room"
4227,101448,indoor,"elevator_shaft, server_room, corridor, elevator/door, clean_room"
4228,101472,indoor,"elevator_shaft, corridor, server_room, jail_cell, clean_room"
4229,101496,indoor,"corridor, elevator_shaft, server_room, jail_cell, archive"
4230,101520,outdoor,"shower, wheat_field, dam, rope_bridge, corn_field"
4231,101544,outdoor,"shower, dam, rope_bridge, fountain, waterfall"
4232,101568,outdoor,"shower, rope_bridge, dam, orchard, fountain"
4233,101592,outdoor,"shower, rope_bridge, dam, fountain, orchard"
4234,101616,indoor,"bow_window/indoor, clean_room, office, home_office, computer_room"
4235,101640,indoor,"bow_window/indoor, clean_room, living_room, nursery, office"
4236,101664,indoor,"bow_window/indoor, living_room, nursery, clean_room, dorm_room"
4237,101688,indoor,"bow_window/indoor, bedchamber, nursery, clean_room, living_room"
4238,101712,indoor,"bow_window/indoor, living_room, clean_room, porch, nursery"
4239,101736,indoor,"bow_window/indoor, clean_room, office, home_office, porch"
4240,101760,indoor,"bow_window/indoor, clean_room, living_room, bedchamber, porch"
4241,101784,indoor,"bow_window/indoor, living_room, home_office, office, dorm_room"
4242,101808,indoor,"bow_window/indoor, home_office, office, living_room, clean_room"
4243,101832,indoor,"bow_window/indoor, home_office, office, clean_room, living_room"
4244,101856,indoor,"bow_window/indoor, office, home_office, clean_room, living_room"
4245,101880,indoor,"bow_window/indoor, clean_room, archive, office, server_room"
4246,101904,indoor,"clean_room, archive, museum/indoor, dressing_room, art_gallery"
4247,101928,indoor,"clean_room, archive, museum/indoor, chemistry_lab, dressing_room"
4248,101952,indoor,"clean_room, museum/indoor, archive, alcove, physics_laboratory"
4249,101976,indoor,"clean_room, museum/indoor, physics_laboratory, archive, alcove"
4250,102000,indoor,"museum/indoor, clean_room, archive, physics_laboratory, entrance_hall"
4251,102024,indoor,"clean_room, museum/indoor, physics_laboratory, archive, music_studio"
4252,102048,indoor,"clean_room, museum/indoor, archive, physics_laboratory, alcove"
4253,102072,outdoor,"shower, wheat_field, fountain, bamboo_forest, rope_bridge"
4254,102096,outdoor,"rope_bridge, trench, forest_path, bamboo_forest, mountain_path"
4255,102120,outdoor,"trench, rope_bridge, forest_path, dam, canyon"
4256,102144,outdoor,"trench, sandbox, archaelogical_excavation, zen_garden, boardwalk"
4257,102168,outdoor,"trench, zen_garden, archaelogical_excavation, cemetery, sandbox"
4258,102192,indoor,"physics_laboratory, chemistry_lab, bar, kitchen, biology_laboratory"
4259,102216,indoor,"physics_laboratory, chemistry_lab, bar, coffee_shop, biology_laboratory"
4260,102240,indoor,"chemistry_lab, biology_laboratory, clean_room, coffee_shop, physics_laboratory"
4261,102264,indoor,"chemistry_lab, bathroom, biology_laboratory, clean_room, shower"
4262,102288,indoor,"clean_room, office, archive, nursery, hospital_room"
4263,102312,indoor,"clean_room, archive, chemistry_lab, beauty_salon, dressing_room"
4264,102336,indoor,"archive, bow_window/indoor, clean_room, library/indoor, living_room"
4265,102360,indoor,"clean_room, operating_room, locker_room, hospital_room, bathroom"
4266,102384,indoor,"clean_room, operating_room, locker_room, hospital_room, archive"
4267,102408,indoor,"clean_room, operating_room, locker_room, laundromat, hospital_room"
4268,102432,indoor,"clean_room, operating_room, hospital_room, locker_room, laundromat"
4269,102456,indoor,"clean_room, operating_room, hospital_room, locker_room, archive"
4270,102480,indoor,"clean_room, operating_room, locker_room, hospital_room, laundromat"
4271,102504,indoor,"clean_room, operating_room, locker_room, hospital_room, archive"
4272,102528,indoor,"clean_room, operating_room, hospital_room, locker_room, clothing_store"
4273,102552,indoor,"clean_room, bathroom, shower, locker_room, hospital_room"
4274,102576,indoor,"clean_room, bathroom, shower, kitchen, beauty_salon"
4275,102600,indoor,"clean_room, bathroom, operating_room, shower, hospital_room"
4276,102624,indoor,"clean_room, operating_room, hospital_room, beauty_salon, bathroom"
4277,102648,indoor,"clean_room, hospital_room, operating_room, bathroom, shower"
4278,102672,outdoor,"alley, forest_path, bamboo_forest, medina, forest_road"
4279,102696,outdoor,"alley, forest_path, bamboo_forest, medina, forest_road"
4280,102720,outdoor,"forest_path, bamboo_forest, alley, orchard, corn_field"
4281,102744,outdoor,"shower, bamboo_forest, corn_field, orchard, wheat_field"
4282,102768,outdoor,"bamboo_forest, forest_path, forest/broadleaf, forest_road, rainforest"
4283,102792,indoor,"clean_room, bathroom, butchers_shop, locker_room, clothing_store"
4284,102816,indoor,"clean_room, bathroom, butchers_shop, locker_room, laundromat"
4285,102840,indoor,"clean_room, bathroom, clothing_store, operating_room, pharmacy"
4286,102864,indoor,"clean_room, bathroom, locker_room, archive, pharmacy"
4287,102888,indoor,"clean_room, pharmacy, archive, chemistry_lab, biology_laboratory"
4288,102912,indoor,"archive, clean_room, locker_room, bank_vault, pharmacy"
4289,102936,indoor,"clean_room, chemistry_lab, operating_room, biology_laboratory, physics_laboratory"
4290,102960,indoor,"chemistry_lab, clean_room, biology_laboratory, kitchen, shower"
4291,102984,indoor,"clean_room, chemistry_lab, biology_laboratory, archive, physics_laboratory"
4292,103008,indoor,"clean_room, chemistry_lab, archive, biology_laboratory, physics_laboratory"
4293,103032,indoor,"clean_room, chemistry_lab, pharmacy, operating_room, biology_laboratory"
4294,103056,indoor,"clean_room, pharmacy, chemistry_lab, archive, drugstore"
4295,103080,indoor,"clean_room, archive, pharmacy, operating_room, drugstore"
4296,103104,indoor,"archive, pharmacy, clean_room, drugstore, library/indoor"
4297,103128,indoor,"clean_room, archive, beauty_salon, pharmacy, bathroom"
4298,103152,indoor,"clean_room, bathroom, shower, locker_room, operating_room"
4299,103176,indoor,"clean_room, bathroom, shower, hospital_room, operating_room"
4300,103200,indoor,"chemistry_lab, clean_room, biology_laboratory, beauty_salon, coffee_shop"
4301,103224,indoor,"chemistry_lab, biology_laboratory, clean_room, beauty_salon, physics_laboratory"
4302,103248,indoor,"chemistry_lab, clean_room, biology_laboratory, physics_laboratory, ice_cream_parlor"
4303,103272,indoor,"chemistry_lab, clean_room, biology_laboratory, physics_laboratory, beauty_salon"
4304,103296,indoor,"chemistry_lab, biology_laboratory, clean_room, physics_laboratory, bar"
4305,103320,indoor,"chemistry_lab, biology_laboratory, clean_room, physics_laboratory, beauty_salon"
4306,103344,indoor,"chemistry_lab, clean_room, biology_laboratory, physics_laboratory, beauty_salon"
4307,103368,indoor,"chemistry_lab, clean_room, biology_laboratory, physics_laboratory, beauty_salon"
4308,103392,indoor,"chemistry_lab, clean_room, biology_laboratory, physics_laboratory, ice_cream_parlor"
4309,103416,indoor,"chemistry_lab, biology_laboratory, clean_room, physics_laboratory, operating_room"
4310,103440,indoor,"clean_room, bathroom, locker_room, shower, hospital_room"
4311,103464,indoor,"clean_room, archive, bow_window/indoor, bathroom, hospital_room"
4312,103488,indoor,"archive, clean_room, pharmacy, office, chemistry_lab"
4313,103512,indoor,"archive, clean_room, pharmacy, operating_room, locker_room"
4314,103536,indoor,"archive, phone_booth, pharmacy, clean_room, bathroom"
4315,103560,indoor,"bathroom, alcove, shower, archive, bow_window/indoor"
4316,103584,indoor,"church/indoor, entrance_hall, throne_room, arcade, arch"
4317,103608,indoor,"church/indoor, throne_room, entrance_hall, museum/indoor, arcade"
4318,103632,indoor,"museum/indoor, church/indoor, bow_window/indoor, clean_room, alcove"
4319,103656,indoor,"entrance_hall, museum/indoor, doorway/outdoor, alcove, clean_room"
4320,103680,indoor,"clean_room, museum/indoor, entrance_hall, bow_window/indoor, archive"
4321,103704,indoor,"entrance_hall, archive, staircase, porch, clean_room"
4322,103728,indoor,"entrance_hall, archive, staircase, library/indoor, nursery"
4323,103752,outdoor,"ice_shelf, ice_floe, tree_farm, mountain_snowy, orchard"
4324,103776,outdoor,"ice_floe, ice_shelf, tree_farm, playground, orchard"
4325,103800,outdoor,"ice_shelf, ice_floe, tree_farm, playground, forest/broadleaf"
4326,103824,outdoor,"ice_shelf, ice_floe, tree_farm, orchard, yard"
4327,103848,outdoor,"ice_shelf, ice_floe, tree_farm, orchard, mountain_snowy"
4328,103872,outdoor,"ice_shelf, ice_floe, tree_farm, mountain_snowy, orchard"
4329,103896,indoor,"library/indoor, living_room, archive, bedchamber, bow_window/indoor"
4330,103920,indoor,"library/indoor, operating_room, living_room, archive, beauty_salon"
4331,103944,indoor,"operating_room, clean_room, archive, library/indoor, jewelry_shop"
4332,103968,indoor,"library/indoor, living_room, museum/indoor, archive, recreation_room"
4333,103992,indoor,"office, physics_laboratory, clean_room, library/indoor, operating_room"
4334,104016,indoor,"operating_room, clean_room, hospital_room, beauty_salon, archive"
4335,104040,indoor,"operating_room, clean_room, beauty_salon, hospital_room, library/indoor"
4336,104064,indoor,"operating_room, clean_room, beauty_salon, archive, library/indoor"
4337,104088,indoor,"operating_room, library/indoor, clean_room, archive, dining_hall"
4338,104112,indoor,"operating_room, archive, clean_room, banquet_hall, hospital_room"
4339,104136,indoor,"library/indoor, operating_room, banquet_hall, dining_hall, archive"
4340,104160,indoor,"operating_room, clean_room, hospital_room, beauty_salon, music_studio"
4341,104184,indoor,"chemistry_lab, clean_room, archive, biology_laboratory, bathroom"
4342,104208,indoor,"clean_room, museum/indoor, archive, shower, art_gallery"
4343,104232,indoor,"atrium/public, clean_room, bow_window/indoor, shower, archive"
4344,104256,indoor,"atrium/public, bow_window/indoor, shopping_mall/indoor, clean_room, elevator_shaft"
4345,104280,outdoor,"ski_slope, snowfield, ski_resort, mountain_snowy, ice_shelf"
4346,104304,outdoor,"ski_slope, snowfield, ski_resort, ice_shelf, mountain_snowy"
4347,104328,indoor,"atrium/public, bow_window/indoor, server_room, shopping_mall/indoor, elevator_shaft"
4348,104352,indoor,"cafeteria, restaurant, chemistry_lab, ice_cream_parlor, clean_room"
4349,104376,indoor,"archive, library/indoor, office, jewelry_shop, museum/indoor"
4350,104400,indoor,"library/indoor, archive, art_studio, office, museum/indoor"
4351,104424,indoor,"library/indoor, archive, office, home_office, living_room"
4352,104448,indoor,"library/indoor, home_office, living_room, office, archive"
4353,104472,indoor,"living_room, library/indoor, bow_window/indoor, dining_room, home_office"
4354,104496,outdoor,"doorway/outdoor, barndoor, elevator/door, mausoleum, bank_vault"
4355,104520,indoor,"doorway/outdoor, elevator/door, clean_room, barndoor, server_room"
4356,104544,indoor,"barndoor, clean_room, doorway/outdoor, museum/indoor, bow_window/indoor"
4357,104568,outdoor,"barndoor, doorway/outdoor, museum/indoor, archive, mausoleum"
4358,104592,outdoor,"barndoor, doorway/outdoor, museum/indoor, archive, mausoleum"
4359,104616,outdoor,"barndoor, doorway/outdoor, museum/indoor, archive, mausoleum"
4360,104640,indoor,"doorway/outdoor, bow_window/indoor, elevator/door, elevator_lobby, entrance_hall"
4361,104664,indoor,"bow_window/indoor, lobby, doorway/outdoor, entrance_hall, elevator_lobby"
4362,104688,indoor,"bow_window/indoor, lobby, doorway/outdoor, elevator_lobby, dining_room"
4363,104712,indoor,"clothing_store, bow_window/indoor, clean_room, closet, dressing_room"
4364,104736,indoor,"bow_window/indoor, clothing_store, dressing_room, clean_room, archive"
4365,104760,indoor,"bow_window/indoor, clothing_store, clean_room, doorway/outdoor, dressing_room"
4366,104784,indoor,"clean_room, clothing_store, dressing_room, locker_room, closet"
4367,104808,indoor,"clean_room, dressing_room, shower, sauna, clothing_store"
4368,104832,indoor,"clean_room, dressing_room, clothing_store, archive, closet"
4369,104856,indoor,"clean_room, dressing_room, clothing_store, museum/indoor, archive"
4370,104880,indoor,"clean_room, dressing_room, closet, clothing_store, archive"
4371,104904,indoor,"dressing_room, clean_room, closet, archive, nursery"
4372,104928,indoor,"dressing_room, church/indoor, alcove, museum/indoor, entrance_hall"
4373,104952,indoor,"dressing_room, church/indoor, alcove, museum/indoor, entrance_hall"
4374,104976,indoor,"church/indoor, dressing_room, clean_room, archive, arch"
4375,105000,indoor,"archive, museum/indoor, clean_room, music_studio, bar"
4376,105024,indoor,"archive, museum/indoor, clean_room, music_studio, nursing_home"
4377,105048,indoor,"archive, clean_room, nursing_home, museum/indoor, ballroom"
4378,105072,indoor,"dressing_room, sauna, clean_room, porch, bedroom"
4379,105096,indoor,"clean_room, museum/indoor, archive, hospital_room, nursing_home"
4380,105120,indoor,"clean_room, archive, hospital_room, museum/indoor, physics_laboratory"
4381,105144,indoor,"archive, museum/indoor, clean_room, chemistry_lab, bar"
4382,105168,indoor,"archive, museum/indoor, drugstore, beauty_salon, jewelry_shop"
4383,105192,indoor,"bow_window/indoor, elevator/door, server_room, shower, archive"
4384,105216,indoor,"bow_window/indoor, shower, elevator/door, doorway/outdoor, museum/indoor"
4385,105240,indoor,"dressing_room, bedroom, sauna, hotel_room, clean_room"
4386,105264,indoor,"dressing_room, bedroom, sauna, porch, bow_window/indoor"
4387,105288,indoor,"dressing_room, clean_room, bedroom, sauna, porch"
4388,105312,indoor,"dressing_room, clean_room, hospital_room, sauna, bedroom"
4389,105336,indoor,"clean_room, bow_window/indoor, clothing_store, closet, dressing_room"
4390,105360,indoor,"clean_room, archive, dressing_room, locker_room, clothing_store"
4391,105384,indoor,"clean_room, dressing_room, clothing_store, museum/indoor, shower"
4392,105408,indoor,"clean_room, chemistry_lab, operating_room, dressing_room, museum/indoor"
4393,105432,indoor,"discotheque, clean_room, chemistry_lab, dressing_room, stage/indoor"
4394,105456,indoor,"nursery, clean_room, dressing_room, staircase, laundromat"
4395,105480,indoor,"museum/indoor, clean_room, staircase, art_gallery, nursery"
4396,105504,indoor,"dressing_room, entrance_hall, clean_room, ballroom, bedchamber"
4397,105528,indoor,"clean_room, museum/indoor, operating_room, dressing_room, archive"
4398,105552,indoor,"clean_room, museum/indoor, archive, dressing_room, operating_room"
4399,105576,indoor,"clean_room, archive, museum/indoor, dressing_room, clothing_store"
4400,105600,indoor,"dressing_room, clean_room, beauty_salon, chemistry_lab, biology_laboratory"
4401,105624,indoor,"dressing_room, clean_room, beauty_salon, chemistry_lab, biology_laboratory"
4402,105648,indoor,"clean_room, dressing_room, beauty_salon, chemistry_lab, sauna"
4403,105672,indoor,"museum/indoor, clean_room, dressing_room, archive, nursery"
4404,105696,indoor,"museum/indoor, clean_room, nursery, archive, dressing_room"
4405,105720,indoor,"clean_room, museum/indoor, nursery, archive, operating_room"
4406,105744,indoor,"clean_room, dressing_room, operating_room, hospital_room, nursing_home"
4407,105768,indoor,"clean_room, nursery, nursing_home, dressing_room, hospital_room"
4408,105792,indoor,"clean_room, archive, nursery, office, dressing_room"
4409,105816,indoor,"bow_window/indoor, nursery, hospital_room, clean_room, classroom"
4410,105840,indoor,"clean_room, dressing_room, locker_room, chemistry_lab, bow_window/indoor"
4411,105864,indoor,"clean_room, dressing_room, operating_room, museum/indoor, martial_arts_gym"
4412,105888,indoor,"boxing_ring, discotheque, music_studio, clean_room, television_studio"
4413,105912,indoor,"clean_room, museum/indoor, dressing_room, science_museum, archive"
4414,105936,indoor,"archive, clean_room, bow_window/indoor, nursery, hospital_room"
4415,105960,indoor,"archive, clean_room, nursery, hospital_room, locker_room"
4416,105984,indoor,"clean_room, archive, locker_room, operating_room, dressing_room"
4417,106008,indoor,"clean_room, museum/indoor, archive, clothing_store, dressing_room"
4418,106032,indoor,"clean_room, operating_room, dressing_room, nursing_home, hospital_room"
4419,106056,indoor,"clean_room, museum/indoor, locker_room, dressing_room, clothing_store"
4420,106080,indoor,"clean_room, dressing_room, museum/indoor, locker_room, operating_room"
4421,106104,indoor,"clean_room, museum/indoor, locker_room, operating_room, dressing_room"
4422,106128,indoor,"clean_room, museum/indoor, archive, dressing_room, art_gallery"
4423,106152,indoor,"clean_room, archive, museum/indoor, library/indoor, bow_window/indoor"
4424,106176,indoor,"operating_room, entrance_hall, clean_room, hospital_room, dining_room"
4425,106200,indoor,"operating_room, clean_room, hospital_room, entrance_hall, museum/indoor"
4426,106224,indoor,"operating_room, clean_room, hospital_room, entrance_hall, dining_room"
4427,106248,indoor,"clean_room, operating_room, museum/indoor, dining_room, banquet_hall"
4428,106272,indoor,"clean_room, operating_room, dressing_room, museum/indoor, dining_room"
4429,106296,indoor,"clean_room, jewelry_shop, dressing_room, museum/indoor, banquet_hall"
4430,106320,indoor,"clean_room, operating_room, beauty_salon, archive, jewelry_shop"
4431,106344,indoor,"museum/indoor, jewelry_shop, clean_room, operating_room, archive"
4432,106368,indoor,"jewelry_shop, operating_room, nursery, clean_room, museum/indoor"
4433,106392,indoor,"nursery, clean_room, jewelry_shop, operating_room, museum/indoor"
4434,106416,indoor,"nursery, clean_room, museum/indoor, bedchamber, church/indoor"
4435,106440,indoor,"jewelry_shop, nursery, museum/indoor, clean_room, church/indoor"
4436,106464,indoor,"museum/indoor, dressing_room, clean_room, jewelry_shop, natural_history_museum"
4437,106488,indoor,"dressing_room, clean_room, nursery, bathroom, operating_room"
4438,106512,indoor,"dressing_room, dining_hall, banquet_hall, chemistry_lab, restaurant"
4439,106536,indoor,"museum/indoor, clean_room, operating_room, dressing_room, art_gallery"
4440,106560,indoor,"dressing_room, museum/indoor, art_studio, art_gallery, clean_room"
4441,106584,indoor,"clean_room, operating_room, hospital_room, nursing_home, locker_room"
4442,106608,indoor,"clean_room, operating_room, hospital_room, nursery, nursing_home"
4443,106632,indoor,"operating_room, clean_room, hospital_room, nursery, nursing_home"
4444,106656,indoor,"nursery, archive, nursing_home, living_room, clean_room"
4445,106680,indoor,"nursery, living_room, archive, nursing_home, hospital_room"
4446,106704,indoor,"nursery, nursing_home, hospital_room, archive, living_room"
4447,106728,indoor,"nursery, nursing_home, hospital_room, living_room, operating_room"
4448,106752,indoor,"nursing_home, hospital_room, living_room, nursery, operating_room"
4449,106776,indoor,"nursery, hospital_room, nursing_home, living_room, bedroom"
4450,106800,indoor,"living_room, nursery, nursing_home, hospital_room, childs_room"
4451,106824,indoor,"nursery, living_room, childs_room, bow_window/indoor, waiting_room"
4452,106848,indoor,"nursery, living_room, hospital_room, nursing_home, childs_room"
4453,106872,indoor,"nursery, childs_room, museum/indoor, living_room, clean_room"
4454,106896,indoor,"nursery, clean_room, living_room, nursing_home, childs_room"
4455,106920,indoor,"clean_room, dressing_room, nursing_home, hospital_room, beauty_salon"
4456,106944,indoor,"clean_room, dressing_room, beauty_salon, archive, chemistry_lab"
4457,106968,indoor,"clean_room, dressing_room, beauty_salon, archive, hospital_room"
4458,106992,indoor,"dressing_room, clean_room, beauty_salon, hospital_room, nursing_home"
4459,107016,indoor,"dressing_room, beauty_salon, clean_room, hospital_room, chemistry_lab"
4460,107040,indoor,"dressing_room, beauty_salon, hospital_room, clean_room, chemistry_lab"
4461,107064,indoor,"dressing_room, beauty_salon, hospital_room, shower, locker_room"
4462,107088,indoor,"dressing_room, beauty_salon, chemistry_lab, biology_laboratory, shower"
4463,107112,indoor,"dressing_room, beauty_salon, chemistry_lab, biology_laboratory, discotheque"
4464,107136,indoor,"clean_room, museum/indoor, archive, hospital_room, science_museum"
4465,107160,indoor,"clean_room, museum/indoor, archive, science_museum, hospital_room"
4466,107184,indoor,"clean_room, archive, museum/indoor, hospital_room, office"
4467,107208,indoor,"clean_room, archive, museum/indoor, office, hospital_room"
4468,107232,indoor,"clean_room, museum/indoor, archive, hospital_room, office"
4469,107256,indoor,"clean_room, museum/indoor, archive, hospital_room, office"
4470,107280,indoor,"clean_room, museum/indoor, archive, office, hospital_room"
4471,107304,indoor,"clean_room, museum/indoor, archive, science_museum, art_gallery"
4472,107328,indoor,"clean_room, museum/indoor, archive, science_museum, art_gallery"
4473,107352,indoor,"clean_room, archive, museum/indoor, science_museum, office"
4474,107376,indoor,"clean_room, museum/indoor, archive, science_museum, hospital_room"
4475,107400,indoor,"clean_room, archive, museum/indoor, office, hospital_room"
4476,107424,indoor,"clean_room, museum/indoor, archive, science_museum, physics_laboratory"
4477,107448,indoor,"dressing_room, beauty_salon, locker_room, chemistry_lab, biology_laboratory"
4478,107472,indoor,"dressing_room, beauty_salon, chemistry_lab, shower, biology_laboratory"
