,frame_num,environment,places,imdb_id
2294,55056,indoor,"archive, clean_room, music_studio, basement, drugstore",348369
2295,55080,indoor,"clean_room, archive, chemistry_lab, music_studio, drugstore",348369
2296,55104,indoor,"archive, locker_room, clean_room, bank_vault, jail_cell",348369
2297,55128,indoor,"archive, locker_room, clean_room, classroom, museum/indoor",348369
2298,55152,indoor,"archive, locker_room, clean_room, bank_vault, museum/indoor",348369
2299,55176,indoor,"locker_room, archive, clean_room, bank_vault, server_room",348369
2300,55200,indoor,"locker_room, archive, bank_vault, clean_room, museum/indoor",348369
2301,55224,indoor,"locker_room, archive, clean_room, server_room, bank_vault",348369
2302,55248,indoor,"clean_room, archive, museum/indoor, science_museum, locker_room",348369
2303,55272,indoor,"clean_room, archive, museum/indoor, locker_room, science_museum",348369
2304,55296,indoor,"clean_room, archive, server_room, art_gallery, science_museum",348369
2305,55320,indoor,"archive, server_room, clean_room, art_gallery, science_museum",348369
2306,55344,indoor,"clean_room, archive, server_room, elevator/door, elevator_lobby",348369
2307,55368,indoor,"server_room, archive, clean_room, bank_vault, locker_room",348369
2308,55392,indoor,"server_room, archive, elevator/door, bank_vault, elevator_lobby",348369
2309,55416,indoor,"jewelry_shop, bathroom, clean_room, chemistry_lab, shower",348369
2310,55440,indoor,"shower, clean_room, bathroom, locker_room, dressing_room",348369
2311,55464,indoor,"clean_room, shower, jewelry_shop, bathroom, locker_room",348369
2312,55488,indoor,"clean_room, bathroom, locker_room, jewelry_shop, shower",348369
2313,55512,indoor,"clean_room, reception, archive, office, locker_room",348369
2314,55536,indoor,"clean_room, archive, science_museum, reception, chemistry_lab",348369
2315,55560,indoor,"archive, museum/indoor, science_museum, clean_room, reception",348369
2316,55584,indoor,"elevator/door, hospital, elevator_lobby, pharmacy, art_gallery",348369
2317,55608,indoor,"elevator/door, elevator_lobby, hospital, reception, art_gallery",348369
2318,55632,indoor,"clean_room, archive, museum/indoor, science_museum, jewelry_shop",348369
2319,55656,indoor,"clean_room, science_museum, reception, art_gallery, natural_history_museum",348369
2320,55680,indoor,"clean_room, locker_room, chemistry_lab, operating_room, hospital_room",348369
2321,55704,indoor,"clean_room, locker_room, archive, bank_vault, operating_room",348369
2322,55728,indoor,"clean_room, locker_room, bank_vault, jail_cell, archive",348369
2323,55752,indoor,"locker_room, archive, clean_room, museum/indoor, bank_vault",348369
2324,55776,indoor,"locker_room, clean_room, archive, corridor, dressing_room",348369
2325,55800,indoor,"locker_room, clean_room, dressing_room, archive, natural_history_museum",348369
2326,55824,indoor,"locker_room, archive, jail_cell, bank_vault, dressing_room",348369
2327,55848,indoor,"clean_room, locker_room, archive, jail_cell, bank_vault",348369
2328,55872,indoor,"locker_room, archive, waiting_room, museum/indoor, corridor",348369
2329,55896,indoor,"locker_room, clean_room, archive, dressing_room, museum/indoor",348369
2330,55920,indoor,"clean_room, locker_room, dressing_room, nursery, laundromat",348369
2331,55944,indoor,"locker_room, clean_room, archive, dressing_room, jail_cell",348369
2332,55968,indoor,"clean_room, locker_room, bank_vault, corridor, jail_cell",348369
2333,55992,indoor,"locker_room, jail_cell, bank_vault, archive, corridor",348369
2334,56016,indoor,"locker_room, archive, bank_vault, jail_cell, museum/indoor",348369
2335,56040,indoor,"locker_room, archive, jail_cell, bank_vault, museum/indoor",348369
2336,56064,indoor,"locker_room, archive, bank_vault, jail_cell, clean_room",348369
2337,56088,indoor,"archive, classroom, lecture_room, conference_room, kindergarden_classroom",348369
2338,56112,indoor,"archive, classroom, conference_room, lecture_room, library/indoor",348369
2339,56136,indoor,"laundromat, archive, classroom, conference_room, lecture_room",348369
2340,56160,indoor,"archive, laundromat, classroom, lecture_room, museum/indoor",348369
2341,56184,indoor,"archive, classroom, lecture_room, conference_room, kindergarden_classroom",348369
2342,56208,indoor,"archive, classroom, kindergarden_classroom, lecture_room, library/indoor",348369
2343,56232,indoor,"archive, conference_room, dining_room, classroom, museum/indoor",348369
2344,56256,indoor,"archive, classroom, lecture_room, kindergarden_classroom, museum/indoor",348369
2345,56280,indoor,"archive, classroom, museum/indoor, kindergarden_classroom, lecture_room",348369
2346,56304,indoor,"archive, museum/indoor, classroom, lecture_room, library/indoor",348369
2347,56328,indoor,"archive, museum/indoor, conference_room, classroom, lecture_room",348369
2348,56352,indoor,"clean_room, science_museum, reception, archive, art_gallery",348369
2349,56376,indoor,"clean_room, dressing_room, archive, locker_room, art_gallery",348369
2350,56400,indoor,"clean_room, dressing_room, museum/indoor, locker_room, clothing_store",348369
2351,56424,indoor,"clean_room, dressing_room, locker_room, museum/indoor, clothing_store",348369
2352,56448,indoor,"clean_room, archive, dressing_room, locker_room, reception",348369
2353,56472,indoor,"clean_room, archive, dressing_room, reception, museum/indoor",348369
2354,56496,indoor,"museum/indoor, dressing_room, art_gallery, clean_room, stage/indoor",348369
2355,56520,indoor,"museum/indoor, dressing_room, clean_room, art_gallery, shower",348369
2356,56544,indoor,"dressing_room, museum/indoor, clean_room, art_gallery, shower",348369
2357,56568,indoor,"museum/indoor, art_gallery, clean_room, archive, natural_history_museum",348369
2358,56592,indoor,"museum/indoor, art_gallery, clean_room, archive, natural_history_museum",348369
2359,56616,indoor,"museum/indoor, art_gallery, clean_room, natural_history_museum, archive",348369
2360,56640,indoor,"museum/indoor, art_gallery, clean_room, archive, natural_history_museum",348369
2361,56664,indoor,"museum/indoor, art_gallery, clean_room, archive, natural_history_museum",348369
2362,56688,indoor,"museum/indoor, clean_room, art_gallery, archive, natural_history_museum",348369
2363,56712,indoor,"shower, art_gallery, locker_room, clean_room, archive",348369
2364,56736,indoor,"art_gallery, reception, museum/indoor, elevator/door, shower",348369
2365,56760,indoor,"reception, art_gallery, museum/indoor, elevator/door, ice_shelf",348369
2366,56784,indoor,"reception, art_gallery, museum/indoor, elevator/door, ice_shelf",348369
2367,56808,indoor,"museum/indoor, dressing_room, clean_room, art_gallery, natural_history_museum",348369
2368,56832,indoor,"museum/indoor, dressing_room, art_gallery, clean_room, music_studio",348369
2369,56856,indoor,"museum/indoor, pharmacy, hospital, art_gallery, cemetery",348369
2370,56880,indoor,"desert/sand, museum/indoor, art_gallery, pharmacy, hospital",348369
2371,56904,indoor,"museum/indoor, desert/sand, art_gallery, pharmacy, hospital",348369
2372,56928,indoor,"museum/indoor, desert/sand, art_gallery, pharmacy, hospital",348369
2373,56952,indoor,"desert/sand, museum/indoor, pharmacy, hospital, art_gallery",348369
2374,56976,indoor,"museum/indoor, art_gallery, clean_room, archive, natural_history_museum",348369
2375,57000,indoor,"museum/indoor, art_gallery, clean_room, archive, natural_history_museum",348369
2376,57024,indoor,"museum/indoor, art_gallery, clean_room, archive, natural_history_museum",348369
2377,57048,indoor,"museum/indoor, clean_room, art_gallery, archive, natural_history_museum",348369
2378,57072,indoor,"museum/indoor, art_gallery, clean_room, archive, natural_history_museum",348369
2379,57096,indoor,"museum/indoor, art_gallery, clean_room, archive, natural_history_museum",348369
2380,57120,indoor,"museum/indoor, art_gallery, clean_room, archive, natural_history_museum",348369
2381,57144,indoor,"museum/indoor, clean_room, art_gallery, natural_history_museum, archive",348369
2382,57168,indoor,"shower, discotheque, chemistry_lab, bathroom, museum/indoor",348369
2383,57192,indoor,"museum/indoor, clean_room, dressing_room, art_gallery, chemistry_lab",348369
2384,57216,indoor,"museum/indoor, clean_room, dressing_room, art_gallery, shower",348369
2385,57240,indoor,"museum/indoor, clean_room, dressing_room, chemistry_lab, shower",348369
2386,57264,indoor,"museum/indoor, clean_room, art_gallery, archive, art_studio",348369
2387,57288,indoor,"museum/indoor, art_gallery, clean_room, archive, art_studio",348369
2388,57312,indoor,"museum/indoor, art_gallery, clean_room, archive, art_studio",348369
2389,57336,indoor,"museum/indoor, art_gallery, clean_room, archive, natural_history_museum",348369
2390,57360,indoor,"museum/indoor, art_gallery, archive, clean_room, art_studio",348369
2391,57384,indoor,"discotheque, dressing_room, shower, music_studio, museum/indoor",348369
2392,57408,indoor,"dressing_room, museum/indoor, art_gallery, shower, clean_room",348369
2393,57432,indoor,"museum/indoor, art_gallery, clean_room, archive, natural_history_museum",348369
2394,57456,indoor,"museum/indoor, art_gallery, clean_room, archive, art_studio",348369
2395,57480,indoor,"museum/indoor, clean_room, art_gallery, archive, operating_room",348369
2396,57504,indoor,"archive, museum/indoor, clean_room, art_gallery, natural_history_museum",348369
2397,57528,indoor,"museum/indoor, archive, art_gallery, clean_room, natural_history_museum",348369
2398,57552,indoor,"archive, clean_room, science_museum, natural_history_museum, museum/indoor",348369
2399,57576,indoor,"basement, jail_cell, barndoor, shower, archive",348369
2400,57600,indoor,"archive, jail_cell, basement, slum, shower",348369
2401,57624,indoor,"slum, jail_cell, archive, shower, construction_site",348369
2402,57648,indoor,"shower, chemistry_lab, skyscraper, basement, art_gallery",348369
2403,57672,indoor,"stage/indoor, discotheque, chemistry_lab, shower, auditorium",348369
2404,57696,indoor,"museum/indoor, archive, stage/indoor, ballroom, classroom",348369
2405,57720,indoor,"schoolhouse, museum/indoor, porch, ballroom, archive",348369
2406,57744,outdoor,"schoolhouse, porch, bow_window/indoor, yard, ballroom",348369
2407,57768,outdoor,"porch, schoolhouse, bow_window/indoor, living_room, yard",348369
2408,57792,indoor,"museum/indoor, art_gallery, discotheque, dressing_room, stage/indoor",348369
2409,57816,indoor,"museum/indoor, art_gallery, stage/indoor, discotheque, dressing_room",348369
2410,57840,indoor,"dressing_room, museum/indoor, art_gallery, stage/indoor, discotheque",348369
2411,57864,indoor,"bow_window/indoor, museum/indoor, jail_cell, archive, alcove",348369
2412,57888,indoor,"clean_room, museum/indoor, art_gallery, science_museum, clothing_store",348369
2413,57912,indoor,"stage/indoor, discotheque, clean_room, museum/indoor, dressing_room",348369
2414,57936,indoor,"stage/indoor, museum/indoor, discotheque, music_studio, ballroom",348369
2415,57960,indoor,"stage/indoor, discotheque, museum/indoor, shower, chemistry_lab",348369
2416,57984,indoor,"stage/indoor, museum/indoor, music_studio, discotheque, archive",348369
2417,58008,indoor,"museum/indoor, stage/indoor, art_gallery, dressing_room, basement",348369
2418,58032,indoor,"museum/indoor, art_gallery, reception, art_studio, office",348369
2419,58056,indoor,"museum/indoor, entrance_hall, art_gallery, archive, artists_loft",348369
2420,58080,indoor,"dressing_room, discotheque, bar, basement, chemistry_lab",348369
2421,58104,indoor,"dressing_room, discotheque, basement, museum/indoor, stage/indoor",348369
2422,58128,indoor,"dressing_room, discotheque, bar, basement, museum/indoor",348369
2423,58152,indoor,"discotheque, corridor, dressing_room, bar, stage/indoor",348369
2424,58176,indoor,"shower, basement, art_gallery, attic, tower",348369
2425,58200,indoor,"discotheque, stage/indoor, classroom, ballroom, basement",348369
2426,58224,indoor,"shower, bow_window/indoor, jail_cell, dressing_room, bathroom",348369
2427,58248,indoor,"dressing_room, shower, beauty_salon, bow_window/indoor, bedroom",348369
2428,58272,indoor,"shower, art_gallery, clean_room, lighthouse, chemistry_lab",348369
2429,58296,indoor,"science_museum, museum/indoor, natural_history_museum, clean_room, archive",348369
2430,58320,indoor,"natural_history_museum, museum/indoor, science_museum, art_gallery, clean_room",348369
2431,58344,indoor,"museum/indoor, natural_history_museum, art_gallery, science_museum, clean_room",348369
2432,58368,indoor,"museum/indoor, natural_history_museum, art_gallery, science_museum, bank_vault",348369
2433,58392,indoor,"museum/indoor, natural_history_museum, art_gallery, science_museum, clean_room",348369
2434,58416,indoor,"chemistry_lab, archive, biology_laboratory, clean_room, classroom",348369
2435,58440,indoor,"archive, chemistry_lab, clean_room, museum/indoor, biology_laboratory",348369
2436,58464,indoor,"archive, classroom, museum/indoor, chemistry_lab, clean_room",348369
2437,58488,indoor,"archive, clean_room, museum/indoor, chemistry_lab, physics_laboratory",348369
2438,58512,indoor,"archive, chemistry_lab, physics_laboratory, clean_room, museum/indoor",348369
2439,58536,indoor,"chemistry_lab, physics_laboratory, archive, music_studio, classroom",348369
2440,58560,indoor,"archive, chemistry_lab, clean_room, museum/indoor, music_studio",348369
2441,58584,indoor,"archive, classroom, stage/indoor, museum/indoor, lecture_room",348369
2442,58608,indoor,"chemistry_lab, clean_room, archive, museum/indoor, music_studio",348369
2443,58632,indoor,"archive, museum/indoor, stage/indoor, music_studio, clean_room",348369
2444,58656,indoor,"music_studio, stage/indoor, archive, chemistry_lab, clean_room",348369
2445,58680,indoor,"music_studio, stage/indoor, clean_room, archive, chemistry_lab",348369
2446,58704,indoor,"museum/indoor, natural_history_museum, shower, art_gallery, archive",348369
2447,58728,indoor,"museum/indoor, art_gallery, natural_history_museum, stage/indoor, science_museum",348369
2448,58752,indoor,"museum/indoor, art_gallery, stage/indoor, natural_history_museum, science_museum",348369
2449,58776,indoor,"clean_room, operating_room, chemistry_lab, archive, museum/indoor",348369
2450,58800,indoor,"clean_room, music_studio, archive, operating_room, stage/indoor",348369
2451,58824,indoor,"classroom, archive, lecture_room, kindergarden_classroom, pharmacy",348369
2452,58848,indoor,"museum/indoor, archive, kindergarden_classroom, booth/indoor, natural_history_museum",348369
2453,58872,indoor,"museum/indoor, archive, kindergarden_classroom, booth/indoor, natural_history_museum",348369
2454,58896,indoor,"museum/indoor, archive, kindergarden_classroom, classroom, booth/indoor",348369
2455,58920,indoor,"museum/indoor, archive, kindergarden_classroom, booth/indoor, pharmacy",348369
2456,58944,indoor,"museum/indoor, archive, kindergarden_classroom, booth/indoor, classroom",348369
2457,58968,indoor,"museum/indoor, kindergarden_classroom, archive, classroom, booth/indoor",348369
2458,58992,indoor,"museum/indoor, archive, kindergarden_classroom, booth/indoor, classroom",348369
2459,59016,indoor,"museum/indoor, archive, kindergarden_classroom, booth/indoor, classroom",348369
2460,59040,indoor,"museum/indoor, archive, kindergarden_classroom, classroom, booth/indoor",348369
2461,59064,indoor,"museum/indoor, archive, kindergarden_classroom, classroom, booth/indoor",348369
2462,59088,indoor,"museum/indoor, art_gallery, stage/indoor, science_museum, natural_history_museum",348369
2463,59112,indoor,"museum/indoor, art_gallery, natural_history_museum, science_museum, stage/indoor",348369
2464,59136,indoor,"museum/indoor, art_gallery, natural_history_museum, science_museum, archive",348369
2465,59160,indoor,"clean_room, chemistry_lab, archive, operating_room, physics_laboratory",348369
2466,59184,indoor,"chemistry_lab, music_studio, archive, clean_room, physics_laboratory",348369
2467,59208,indoor,"archive, museum/indoor, bank_vault, locker_room, clean_room",348369
2468,59232,indoor,"museum/indoor, art_gallery, clean_room, bank_vault, natural_history_museum",348369
2469,59256,indoor,"museum/indoor, clean_room, bank_vault, archive, art_gallery",348369
2470,59280,indoor,"museum/indoor, clean_room, archive, locker_room, dressing_room",348369
2471,59304,indoor,"bank_vault, museum/indoor, clean_room, locker_room, shower",348369
2472,59328,indoor,"bank_vault, clean_room, locker_room, museum/indoor, archive",348369
2473,59352,indoor,"clean_room, dressing_room, museum/indoor, archive, martial_arts_gym",348369
2474,59376,indoor,"clean_room, dressing_room, museum/indoor, clothing_store, locker_room",348369
2475,59400,indoor,"clean_room, dressing_room, clothing_store, museum/indoor, art_gallery",348369
2476,59424,indoor,"clean_room, dressing_room, museum/indoor, art_gallery, science_museum",348369
2477,59448,indoor,"clean_room, dressing_room, museum/indoor, clothing_store, art_gallery",348369
2478,59472,indoor,"parking_garage/indoor, auto_showroom, museum/indoor, auto_factory, parking_lot",348369
2479,59496,indoor,"parking_garage/indoor, auto_showroom, museum/indoor, parking_lot, auto_factory",348369
2480,59520,indoor,"parking_garage/indoor, auto_showroom, parking_lot, museum/indoor, auto_factory",348369
2481,59544,indoor,"aquarium, natural_history_museum, stage/indoor, discotheque, science_museum",348369
2482,59568,indoor,"museum/indoor, natural_history_museum, clean_room, art_gallery, science_museum",348369
2483,59592,indoor,"museum/indoor, natural_history_museum, archive, art_gallery, entrance_hall",348369
2484,59616,indoor,"natural_history_museum, museum/indoor, art_gallery, science_museum, archive",348369
2485,59640,indoor,"museum/indoor, natural_history_museum, art_gallery, stage/indoor, clean_room",348369
2486,59664,indoor,"stage/indoor, museum/indoor, art_gallery, clean_room, natural_history_museum",348369
2487,59688,indoor,"natural_history_museum, art_gallery, museum/indoor, science_museum, archive",348369
2488,59712,indoor,"museum/indoor, clean_room, natural_history_museum, science_museum, archive",348369
2489,59736,indoor,"clean_room, museum/indoor, archive, science_museum, art_gallery",348369
2490,59760,indoor,"clean_room, museum/indoor, archive, natural_history_museum, science_museum",348369
2491,59784,indoor,"museum/indoor, natural_history_museum, stage/indoor, science_museum, clean_room",348369
2492,59808,indoor,"clean_room, museum/indoor, natural_history_museum, science_museum, archive",348369
2493,59832,indoor,"museum/indoor, natural_history_museum, science_museum, clean_room, art_gallery",348369
2494,59856,indoor,"natural_history_museum, museum/indoor, science_museum, clean_room, archive",348369
2495,59880,indoor,"natural_history_museum, museum/indoor, science_museum, archive, clean_room",348369
2496,59904,indoor,"museum/indoor, archive, natural_history_museum, clean_room, science_museum",348369
2497,59928,indoor,"museum/indoor, archive, clean_room, natural_history_museum, science_museum",348369
2498,59952,indoor,"shower, jewelry_shop, clean_room, natural_history_museum, bank_vault",348369
2499,59976,indoor,"dressing_room, museum/indoor, clean_room, natural_history_museum, stage/indoor",348369
2500,60000,indoor,"museum/indoor, art_gallery, natural_history_museum, science_museum, clean_room",348369
2501,60024,indoor,"museum/indoor, art_gallery, natural_history_museum, archive, clean_room",348369
2502,60048,indoor,"natural_history_museum, clean_room, shower, science_museum, museum/indoor",348369
2503,60072,indoor,"clean_room, museum/indoor, natural_history_museum, shower, archive",348369
2504,60096,indoor,"museum/indoor, clean_room, art_gallery, dressing_room, music_studio",348369
2505,60120,indoor,"museum/indoor, clean_room, natural_history_museum, archive, stage/indoor",348369
2506,60144,indoor,"museum/indoor, natural_history_museum, archive, stage/indoor, clean_room",348369
2507,60168,indoor,"archive, museum/indoor, natural_history_museum, clean_room, stage/indoor",348369
2508,60192,indoor,"science_museum, escalator/indoor, clean_room, chemistry_lab, physics_laboratory",348369
2509,60216,indoor,"museum/indoor, archive, natural_history_museum, art_gallery, science_museum",348369
2510,60240,indoor,"museum/indoor, natural_history_museum, art_gallery, science_museum, archive",348369
2511,60264,indoor,"museum/indoor, natural_history_museum, art_gallery, science_museum, archive",348369
2512,60288,indoor,"natural_history_museum, museum/indoor, science_museum, art_gallery, archive",348369
2513,60312,indoor,"natural_history_museum, museum/indoor, science_museum, art_gallery, archive",348369
2514,60336,indoor,"natural_history_museum, museum/indoor, science_museum, art_gallery, archive",348369
2515,60360,indoor,"museum/indoor, natural_history_museum, art_gallery, science_museum, archive",348369
2516,60384,indoor,"jail_cell, corridor, shower, locker_room, clean_room",348369
2517,60408,indoor,"clean_room, art_gallery, dressing_room, shower, museum/indoor",348369
2518,60432,indoor,"clean_room, dressing_room, museum/indoor, shower, locker_room",348369
2519,60456,indoor,"museum/indoor, natural_history_museum, art_gallery, science_museum, archive",348369
2520,60480,indoor,"museum/indoor, art_gallery, natural_history_museum, science_museum, archive",348369
2521,60504,indoor,"museum/indoor, natural_history_museum, art_gallery, archive, science_museum",348369
2522,60528,indoor,"museum/indoor, natural_history_museum, archive, art_gallery, science_museum",348369
2523,60552,indoor,"museum/indoor, natural_history_museum, clean_room, art_gallery, science_museum",348369
2524,60576,indoor,"clean_room, dressing_room, museum/indoor, artists_loft, hospital_room",348369
2525,60600,indoor,"clean_room, museum/indoor, dressing_room, dining_room, entrance_hall",348369
2526,60624,indoor,"natural_history_museum, museum/indoor, art_gallery, science_museum, ice_floe",348369
2527,60648,indoor,"natural_history_museum, museum/indoor, art_gallery, science_museum, archive",348369
2528,60672,indoor,"museum/indoor, art_gallery, stage/indoor, archive, art_studio",348369
2529,60696,indoor,"museum/indoor, stage/indoor, art_gallery, shower, dressing_room",348369
2530,60720,indoor,"museum/indoor, art_gallery, natural_history_museum, archive, science_museum",348369
2531,60744,indoor,"shower, clean_room, skyscraper, museum/indoor, tower",348369
2532,60768,indoor,"clean_room, chemistry_lab, operating_room, server_room, bank_vault",348369
2533,60792,indoor,"clean_room, museum/indoor, bank_vault, dressing_room, elevator/door",348369
2534,60816,indoor,"bank_vault, clean_room, museum/indoor, elevator/door, dressing_room",348369
2535,60840,indoor,"museum/indoor, natural_history_museum, clean_room, art_gallery, dressing_room",348369
2536,60864,indoor,"elevator/door, elevator_lobby, museum/indoor, bank_vault, corridor",348369
2537,60888,indoor,"nursery, clean_room, discotheque, museum/indoor, dressing_room",348369
2538,60912,indoor,"shower, dressing_room, closet, elevator/door, locker_room",348369
2539,60936,indoor,"locker_room, nursery, dressing_room, elevator/door, bathroom",348369
2540,60960,indoor,"locker_room, bank_vault, elevator/door, museum/indoor, nursery",348369
2541,60984,indoor,"locker_room, bank_vault, elevator/door, shower, bathroom",348369
2542,61008,indoor,"locker_room, elevator/door, bank_vault, shower, closet",348369
2543,61032,indoor,"museum/indoor, art_gallery, music_studio, stage/indoor, clean_room",348369
2544,61056,indoor,"museum/indoor, art_gallery, clean_room, music_studio, archive",348369
2545,61080,indoor,"museum/indoor, art_gallery, clean_room, music_studio, archive",348369
2546,61104,indoor,"museum/indoor, pharmacy, cemetery, art_gallery, archive",348369
2547,61128,indoor,"museum/indoor, cemetery, pharmacy, hospital, archive",348369
2548,61152,indoor,"museum/indoor, art_gallery, cemetery, pharmacy, archive",348369
2549,61176,indoor,"museum/indoor, cemetery, pharmacy, art_gallery, drugstore",348369
2550,61200,indoor,"museum/indoor, pharmacy, cemetery, art_gallery, drugstore",348369
2551,61224,indoor,"museum/indoor, cemetery, pharmacy, art_gallery, hospital",348369
2552,61248,indoor,"museum/indoor, cemetery, pharmacy, art_gallery, drugstore",348369
2553,61272,indoor,"museum/indoor, pharmacy, art_gallery, cemetery, archive",348369
2554,61296,indoor,"museum/indoor, natural_history_museum, art_gallery, science_museum, archive",348369
2555,61320,indoor,"museum/indoor, natural_history_museum, science_museum, art_gallery, archive",348369
2556,61344,indoor,"museum/indoor, clean_room, music_studio, stage/indoor, dressing_room",348369
2557,61368,indoor,"museum/indoor, clean_room, art_gallery, music_studio, dressing_room",348369
2558,61392,indoor,"museum/indoor, clean_room, art_gallery, archive, music_studio",348369
2559,61416,indoor,"museum/indoor, art_gallery, clean_room, archive, music_studio",348369
2560,61440,indoor,"museum/indoor, dressing_room, art_gallery, music_studio, stage/indoor",348369
2561,61464,indoor,"bank_vault, locker_room, elevator/door, server_room, phone_booth",348369
2562,61488,indoor,"clean_room, elevator/door, bank_vault, locker_room, dressing_room",348369
2563,61512,indoor,"shower, bathroom, elevator/door, locker_room, closet",348369
2564,61536,indoor,"clean_room, museum/indoor, art_gallery, archive, dressing_room",348369
2565,61560,indoor,"clean_room, museum/indoor, art_gallery, archive, dressing_room",348369
2566,61584,indoor,"clean_room, museum/indoor, dressing_room, archive, art_gallery",348369
2567,61608,indoor,"clean_room, museum/indoor, archive, art_gallery, locker_room",348369
2568,61632,indoor,"clean_room, museum/indoor, archive, art_gallery, locker_room",348369
2569,61656,indoor,"clean_room, elevator/door, locker_room, server_room, elevator_lobby",348369
2570,61680,indoor,"music_studio, museum/indoor, clean_room, archive, physics_laboratory",348369
