,frame_num,environment,places,imdb_id
3412,81888,indoor,"museum/indoor, television_studio, music_studio, stage/indoor, clean_room",348369
3413,81912,indoor,"museum/indoor, television_studio, music_studio, stage/indoor, clean_room",348369
3414,81936,indoor,"museum/indoor, stage/indoor, music_studio, clean_room, television_studio",348369
3415,81960,indoor,"museum/indoor, stage/indoor, music_studio, discotheque, clean_room",348369
3416,81984,indoor,"museum/indoor, clean_room, art_gallery, natural_history_museum, science_museum",348369
3417,82008,indoor,"museum/indoor, clean_room, natural_history_museum, art_gallery, stage/indoor",348369
3418,82032,indoor,"museum/indoor, clean_room, stage/indoor, discotheque, art_gallery",348369
3419,82056,indoor,"clean_room, dressing_room, nursery, closet, hospital_room",348369
3420,82080,indoor,"museum/indoor, stage/indoor, clean_room, dressing_room, discotheque",348369
3421,82104,indoor,"museum/indoor, stage/indoor, clean_room, discotheque, dressing_room",348369
3422,82128,indoor,"reception, art_gallery, museum/indoor, elevator/door, elevator_lobby",348369
3423,82152,indoor,"reception, art_gallery, museum/indoor, elevator/door, pharmacy",348369
3424,82176,indoor,"reception, art_gallery, museum/indoor, elevator/door, elevator_lobby",348369
3425,82200,indoor,"museum/indoor, stage/indoor, clean_room, archive, discotheque",348369
3426,82224,indoor,"clean_room, archive, office, office_cubicles, museum/indoor",348369
3427,82248,indoor,"clean_room, office, biology_laboratory, martial_arts_gym, physics_laboratory",348369
3428,82272,indoor,"music_studio, operating_room, clean_room, television_studio, office",348369
3429,82296,indoor,"operating_room, clean_room, hospital_room, biology_laboratory, office",348369
3430,82320,indoor,"clean_room, operating_room, office, conference_room, lecture_room",348369
3431,82344,indoor,"music_studio, television_studio, chemistry_lab, dressing_room, office",348369
3432,82368,indoor,"stage/indoor, music_studio, archive, museum/indoor, discotheque",348369
3433,82392,indoor,"clean_room, archive, stage/indoor, museum/indoor, dressing_room",348369
3434,82416,indoor,"museum/indoor, pharmacy, natural_history_museum, archive, drugstore",348369
3435,82440,indoor,"museum/indoor, natural_history_museum, pharmacy, archive, booth/indoor",348369
3436,82464,indoor,"museum/indoor, natural_history_museum, booth/indoor, pharmacy, archive",348369
3437,82488,indoor,"museum/indoor, pharmacy, natural_history_museum, archive, booth/indoor",348369
3438,82512,indoor,"museum/indoor, natural_history_museum, archive, pharmacy, booth/indoor",348369
3439,82536,indoor,"museum/indoor, pharmacy, natural_history_museum, archive, booth/indoor",348369
3440,82560,indoor,"museum/indoor, natural_history_museum, pharmacy, archive, booth/indoor",348369
3441,82584,indoor,"museum/indoor, archive, natural_history_museum, booth/indoor, pharmacy",348369
3442,82608,indoor,"museum/indoor, natural_history_museum, archive, pharmacy, booth/indoor",348369
3443,82632,indoor,"museum/indoor, natural_history_museum, pharmacy, archive, booth/indoor",348369
3444,82656,indoor,"museum/indoor, pharmacy, archive, natural_history_museum, booth/indoor",348369
3445,82680,indoor,"television_studio, music_studio, chemistry_lab, conference_center, ballroom",348369
3446,82704,indoor,"chemistry_lab, conference_center, clean_room, conference_room, music_studio",348369
3447,82728,indoor,"office, chemistry_lab, conference_center, music_studio, television_studio",348369
3448,82752,indoor,"operating_room, clean_room, chemistry_lab, music_studio, conference_center",348369
3449,82776,indoor,"clean_room, dressing_room, museum/indoor, stage/indoor, archive",348369
3450,82800,indoor,"dressing_room, clean_room, discotheque, chemistry_lab, archive",348369
3451,82824,indoor,"clean_room, archive, chemistry_lab, dressing_room, physics_laboratory",348369
3452,82848,indoor,"clean_room, chemistry_lab, archive, physics_laboratory, biology_laboratory",348369
3453,82872,indoor,"clean_room, museum/indoor, chemistry_lab, stage/indoor, music_studio",348369
3454,82896,indoor,"museum/indoor, archive, natural_history_museum, science_museum, kindergarden_classroom",348369
3455,82920,indoor,"museum/indoor, archive, kindergarden_classroom, natural_history_museum, science_museum",348369
3456,82944,indoor,"museum/indoor, archive, natural_history_museum, science_museum, kindergarden_classroom",348369
3457,82968,indoor,"museum/indoor, archive, science_museum, natural_history_museum, art_gallery",348369
3458,82992,indoor,"museum/indoor, archive, kindergarden_classroom, science_museum, natural_history_museum",348369
3459,83016,indoor,"museum/indoor, archive, science_museum, natural_history_museum, kindergarden_classroom",348369
3460,83040,indoor,"museum/indoor, archive, kindergarden_classroom, science_museum, natural_history_museum",348369
3461,83064,indoor,"museum/indoor, archive, science_museum, kindergarden_classroom, natural_history_museum",348369
3462,83088,indoor,"museum/indoor, archive, kindergarden_classroom, science_museum, natural_history_museum",348369
3463,83112,indoor,"museum/indoor, archive, kindergarden_classroom, science_museum, natural_history_museum",348369
3464,83136,indoor,"museum/indoor, archive, kindergarden_classroom, science_museum, natural_history_museum",348369
3465,83160,indoor,"museum/indoor, archive, kindergarden_classroom, science_museum, natural_history_museum",348369
3466,83184,indoor,"museum/indoor, archive, kindergarden_classroom, classroom, science_museum",348369
3467,83208,indoor,"dressing_room, clean_room, beauty_salon, stage/indoor, chemistry_lab",348369
3468,83232,indoor,"dressing_room, clean_room, clothing_store, beauty_salon, museum/indoor",348369
3469,83256,indoor,"clean_room, chemistry_lab, archive, music_studio, stage/indoor",348369
3470,83280,indoor,"clean_room, archive, dressing_room, museum/indoor, locker_room",348369
3471,83304,indoor,"clean_room, stage/indoor, museum/indoor, art_gallery, ballroom",348369
3472,83328,indoor,"discotheque, chemistry_lab, classroom, bowling_alley, music_studio",348369
3473,83352,indoor,"museum/indoor, chemistry_lab, discotheque, biology_laboratory, science_museum",348369
3474,83376,indoor,"discotheque, chemistry_lab, dressing_room, biology_laboratory, bar",348369
3475,83400,indoor,"dressing_room, discotheque, ballroom, chemistry_lab, banquet_hall",348369
3476,83424,indoor,"discotheque, stage/indoor, ballroom, dressing_room, chemistry_lab",348369
3477,83448,indoor,"aquarium, discotheque, science_museum, natural_history_museum, nursery",348369
3478,83472,indoor,"chemistry_lab, clean_room, discotheque, nursery, ballroom",348369
3479,83496,indoor,"dressing_room, clean_room, chemistry_lab, ballroom, nursery",348369
3480,83520,indoor,"dressing_room, clean_room, ballroom, chemistry_lab, banquet_hall",348369
3481,83544,indoor,"dressing_room, chemistry_lab, clean_room, discotheque, ballroom",348369
3482,83568,indoor,"dressing_room, discotheque, ballroom, clean_room, chemistry_lab",348369
3483,83592,indoor,"discotheque, ballroom, dressing_room, stage/indoor, chemistry_lab",348369
3484,83616,indoor,"discotheque, ballroom, stage/indoor, dressing_room, nursery",348369
3485,83640,indoor,"nursery, discotheque, clean_room, museum/indoor, dressing_room",348369
3486,83664,indoor,"nursery, clean_room, chemistry_lab, dressing_room, playroom",348369
3487,83688,indoor,"chemistry_lab, dressing_room, clean_room, ballroom, discotheque",348369
3488,83712,indoor,"dressing_room, ballroom, chemistry_lab, discotheque, clean_room",348369
3489,83736,indoor,"chemistry_lab, dressing_room, ballroom, banquet_hall, discotheque",348369
3490,83760,indoor,"dressing_room, ballroom, chemistry_lab, banquet_hall, discotheque",348369
3491,83784,indoor,"dressing_room, ballroom, discotheque, banquet_hall, clean_room",348369
3492,83808,indoor,"discotheque, stage/indoor, chemistry_lab, ballroom, music_studio",348369
3493,83832,indoor,"discotheque, chemistry_lab, stage/indoor, ballroom, bar",348369
3494,83856,indoor,"ballroom, discotheque, chemistry_lab, stage/indoor, dressing_room",348369
3495,83880,indoor,"ballroom, chemistry_lab, discotheque, nursery, clean_room",348369
3496,83904,indoor,"discotheque, stage/indoor, chemistry_lab, clean_room, museum/indoor",348369
3497,83928,indoor,"basement, shower, jail_cell, barndoor, alcove",348369
3498,83952,indoor,"alcove, basement, clean_room, artists_loft, living_room",348369
3499,83976,indoor,"clean_room, alcove, basement, artists_loft, art_studio",348369
3500,84000,indoor,"living_room, clean_room, alcove, dressing_room, bow_window/indoor",348369
3501,84024,indoor,"living_room, museum/indoor, dressing_room, clean_room, alcove",348369
3502,84048,indoor,"dressing_room, museum/indoor, living_room, alcove, clean_room",348369
3503,84072,indoor,"living_room, museum/indoor, dressing_room, clean_room, alcove",348369
3504,84096,indoor,"clean_room, dressing_room, museum/indoor, living_room, clothing_store",348369
3505,84120,indoor,"museum/indoor, living_room, alcove, clean_room, burial_chamber",348369
3506,84144,indoor,"stage/indoor, museum/indoor, music_studio, clean_room, martial_arts_gym",348369
3507,84168,indoor,"museum/indoor, dressing_room, art_gallery, clothing_store, natural_history_museum",348369
3508,84192,indoor,"museum/indoor, dressing_room, art_gallery, stage/indoor, clothing_store",348369
3509,84216,indoor,"museum/indoor, art_gallery, dressing_room, stage/indoor, clean_room",348369
3510,84240,indoor,"museum/indoor, art_gallery, dressing_room, nursery, clothing_store",348369
3511,84264,indoor,"museum/indoor, dressing_room, art_gallery, clothing_store, nursery",348369
3512,84288,indoor,"museum/indoor, dressing_room, clothing_store, art_gallery, clean_room",348369
3513,84312,indoor,"museum/indoor, art_gallery, dressing_room, clean_room, clothing_store",348369
3514,84336,indoor,"dressing_room, museum/indoor, shower, clothing_store, art_gallery",348369
3515,84360,indoor,"clean_room, museum/indoor, chemistry_lab, discotheque, art_gallery",348369
3516,84384,indoor,"discotheque, nursery, beauty_salon, museum/indoor, stage/indoor",348369
3517,84408,indoor,"clean_room, art_gallery, museum/indoor, discotheque, chemistry_lab",348369
3518,84432,indoor,"museum/indoor, art_gallery, discotheque, beauty_salon, clean_room",348369
3519,84456,indoor,"museum/indoor, discotheque, art_gallery, beauty_salon, nursery",348369
3520,84480,indoor,"archive, shower, museum/indoor, art_gallery, basement",348369
3521,84504,indoor,"shower, basement, jail_cell, bathroom, burial_chamber",348369
3522,84528,indoor,"museum/indoor, archive, art_gallery, natural_history_museum, clean_room",348369
3523,84552,indoor,"museum/indoor, art_gallery, stage/indoor, science_museum, archive",348369
3524,84576,indoor,"museum/indoor, ballroom, stage/indoor, music_studio, banquet_hall",348369
3525,84600,indoor,"ballroom, museum/indoor, music_studio, banquet_hall, nursing_home",348369
3526,84624,indoor,"ballroom, music_studio, stage/indoor, museum/indoor, banquet_hall",348369
3527,84648,indoor,"ballroom, music_studio, stage/indoor, orchestra_pit, discotheque",348369
3528,84672,indoor,"ballroom, nursing_home, stage/indoor, banquet_hall, dining_hall",348369
3529,84696,indoor,"nursery, classroom, natural_history_museum, ice_shelf, lecture_room",348369
3530,84720,indoor,"natural_history_museum, science_museum, art_gallery, museum/indoor, classroom",348369
3531,84744,indoor,"natural_history_museum, science_museum, ice_shelf, art_gallery, museum/indoor",348369
3532,84768,indoor,"natural_history_museum, science_museum, art_gallery, museum/indoor, ice_shelf",348369
3533,84792,indoor,"natural_history_museum, art_gallery, ice_shelf, science_museum, museum/indoor",348369
3534,84816,indoor,"museum/indoor, stage/indoor, ballroom, music_studio, orchestra_pit",348369
3535,84840,indoor,"ballroom, stage/indoor, museum/indoor, music_studio, discotheque",348369
3536,84864,indoor,"stage/indoor, music_studio, ballroom, orchestra_pit, museum/indoor",348369
3537,84888,indoor,"ballroom, stage/indoor, music_studio, museum/indoor, orchestra_pit",348369
3538,84912,indoor,"museum/indoor, stage/indoor, music_studio, ballroom, orchestra_pit",348369
3539,84936,indoor,"elevator/door, museum/indoor, elevator_lobby, hospital, art_gallery",348369
3540,84960,indoor,"elevator/door, museum/indoor, art_gallery, elevator_lobby, pharmacy",348369
3541,84984,indoor,"elevator/door, museum/indoor, elevator_lobby, art_gallery, reception",348369
3542,85008,indoor,"museum/indoor, stage/indoor, music_studio, ballroom, discotheque",348369
3543,85032,indoor,"bowling_alley, science_museum, aquarium, museum/indoor, igloo",348369
3544,85056,indoor,"bowling_alley, science_museum, shower, bank_vault, recreation_room",348369
3545,85080,indoor,"ballroom, museum/indoor, stage/indoor, music_studio, banquet_hall",348369
3546,85104,indoor,"museum/indoor, ballroom, stage/indoor, banquet_hall, chemistry_lab",348369
3547,85128,indoor,"museum/indoor, ballroom, stage/indoor, music_studio, discotheque",348369
3548,85152,indoor,"stage/indoor, museum/indoor, ballroom, music_studio, discotheque",348369
3549,85176,indoor,"stage/indoor, music_studio, ballroom, museum/indoor, orchestra_pit",348369
3550,85200,indoor,"ballroom, music_studio, stage/indoor, museum/indoor, orchestra_pit",348369
3551,85224,indoor,"ballroom, stage/indoor, museum/indoor, music_studio, orchestra_pit",348369
3552,85248,indoor,"music_studio, stage/indoor, ballroom, discotheque, orchestra_pit",348369
3553,85272,indoor,"ballroom, music_studio, stage/indoor, discotheque, museum/indoor",348369
3554,85296,indoor,"stage/indoor, discotheque, music_studio, ballroom, museum/indoor",348369
3555,85320,indoor,"museum/indoor, stage/indoor, music_studio, ballroom, archive",348369
3556,85344,indoor,"clean_room, operating_room, museum/indoor, hospital_room, dressing_room",348369
3557,85368,indoor,"clean_room, office, museum/indoor, archive, operating_room",348369
3558,85392,indoor,"office, clean_room, archive, office_cubicles, operating_room",348369
3559,85416,indoor,"office, clean_room, operating_room, archive, museum/indoor",348369
3560,85440,indoor,"office, clean_room, operating_room, archive, hospital_room",348369
3561,85464,indoor,"office, archive, clean_room, office_cubicles, lecture_room",348369
3562,85488,indoor,"museum/indoor, stage/indoor, archive, music_studio, ballroom",348369
3563,85512,indoor,"museum/indoor, stage/indoor, ballroom, archive, music_studio",348369
3564,85536,indoor,"ballroom, museum/indoor, nursing_home, banquet_hall, chemistry_lab",348369
3565,85560,indoor,"ballroom, music_studio, banquet_hall, nursing_home, museum/indoor",348369
3566,85584,indoor,"chemistry_lab, stage/indoor, music_studio, physics_laboratory, bar",348369
3567,85608,indoor,"museum/indoor, archive, booth/indoor, natural_history_museum, pharmacy",348369
3568,85632,indoor,"museum/indoor, archive, booth/indoor, natural_history_museum, lecture_room",348369
3569,85656,indoor,"museum/indoor, archive, booth/indoor, natural_history_museum, lecture_room",348369
3570,85680,indoor,"museum/indoor, archive, booth/indoor, natural_history_museum, pharmacy",348369
3571,85704,indoor,"museum/indoor, archive, booth/indoor, natural_history_museum, pharmacy",348369
3572,85728,indoor,"museum/indoor, archive, booth/indoor, natural_history_museum, pharmacy",348369
3573,85752,indoor,"museum/indoor, archive, booth/indoor, natural_history_museum, lecture_room",348369
3574,85776,indoor,"museum/indoor, archive, booth/indoor, natural_history_museum, lecture_room",348369
3575,85800,indoor,"museum/indoor, archive, booth/indoor, natural_history_museum, lecture_room",348369
3576,85824,indoor,"museum/indoor, archive, booth/indoor, natural_history_museum, lecture_room",348369
3577,85848,indoor,"museum/indoor, archive, booth/indoor, natural_history_museum, lecture_room",348369
3578,85872,indoor,"museum/indoor, archive, booth/indoor, natural_history_museum, lecture_room",348369
3579,85896,indoor,"stage/indoor, clean_room, archive, discotheque, museum/indoor",348369
3580,85920,indoor,"museum/indoor, stage/indoor, music_studio, ballroom, nursing_home",348369
3581,85944,indoor,"stage/indoor, discotheque, ballroom, music_studio, classroom",348369
3582,85968,indoor,"stage/indoor, chemistry_lab, lecture_room, ballroom, classroom",348369
3583,85992,indoor,"stage/indoor, discotheque, music_studio, ballroom, classroom",348369
3584,86016,indoor,"stage/indoor, discotheque, music_studio, chemistry_lab, ballroom",348369
3585,86040,indoor,"art_gallery, gift_shop, coffee_shop, bakery/shop, museum/indoor",348369
3586,86064,indoor,"gift_shop, art_gallery, coffee_shop, beauty_salon, art_studio",348369
3587,86088,indoor,"art_gallery, gift_shop, coffee_shop, beauty_salon, art_studio",348369
3588,86112,indoor,"art_gallery, gift_shop, coffee_shop, beauty_salon, jewelry_shop",348369
3589,86136,indoor,"art_gallery, coffee_shop, gift_shop, art_studio, museum/indoor",348369
3590,86160,indoor,"dressing_room, discotheque, clean_room, music_studio, stage/indoor",348369
3591,86184,indoor,"discotheque, stage/indoor, music_studio, museum/indoor, classroom",348369
3592,86208,indoor,"discotheque, stage/indoor, museum/indoor, chemistry_lab, music_studio",348369
3593,86232,indoor,"discotheque, stage/indoor, music_studio, museum/indoor, chemistry_lab",348369
3594,86256,indoor,"discotheque, stage/indoor, music_studio, clean_room, chemistry_lab",348369
3595,86280,indoor,"art_gallery, gift_shop, clothing_store, art_studio, department_store",348369
3596,86304,indoor,"art_gallery, gift_shop, museum/indoor, art_studio, artists_loft",348369
3597,86328,indoor,"art_gallery, art_studio, museum/indoor, gift_shop, artists_loft",348369
3598,86352,indoor,"shower, ice_shelf, discotheque, bathroom, hot_spring",348369
3599,86376,indoor,"shower, ice_shelf, bathroom, discotheque, ice_floe",348369
3600,86400,indoor,"ice_shelf, shower, igloo, discotheque, basement",348369
3601,86424,outdoor,"ice_shelf, shower, dam, ice_floe, waterfall",348369
3602,86448,outdoor,"ice_shelf, shower, dam, fountain, waterfall",348369
3603,86472,indoor,"discotheque, stage/indoor, music_studio, museum/indoor, dressing_room",348369
3604,86496,indoor,"stage/indoor, discotheque, music_studio, museum/indoor, clean_room",348369
3605,86520,indoor,"art_gallery, gift_shop, art_studio, museum/indoor, clothing_store",348369
3606,86544,outdoor,"igloo, arch, iceberg, burial_chamber, ice_shelf",348369
3607,86568,indoor,"sky, discotheque, nursery, shower, tower",348369
3608,86592,indoor,"discotheque, igloo, clean_room, stage/indoor, music_studio",348369
3609,86616,outdoor,"discotheque, igloo, hot_spring, ice_shelf, sky",348369
3610,86640,indoor,"igloo, discotheque, basement, ice_shelf, shower",348369
3611,86664,outdoor,"ice_shelf, discotheque, igloo, hot_spring, iceberg",348369
3612,86688,outdoor,"discotheque, ice_shelf, hot_spring, shower, igloo",348369
3613,86712,indoor,"discotheque, stage/indoor, music_studio, clean_room, chemistry_lab",348369
3614,86736,indoor,"discotheque, stage/indoor, music_studio, clean_room, chemistry_lab",348369
3615,86760,indoor,"stage/indoor, discotheque, music_studio, clean_room, museum/indoor",348369
3616,86784,indoor,"discotheque, clean_room, stage/indoor, chemistry_lab, dressing_room",348369
3617,86808,indoor,"discotheque, stage/indoor, dressing_room, chemistry_lab, nursing_home",348369
3618,86832,indoor,"stage/indoor, music_studio, discotheque, museum/indoor, television_studio",348369
3619,86856,indoor,"discotheque, dressing_room, clean_room, museum/indoor, stage/indoor",348369
3620,86880,indoor,"clean_room, dressing_room, discotheque, museum/indoor, nursing_home",348369
3621,86904,indoor,"discotheque, dressing_room, clean_room, stage/indoor, music_studio",348369
3622,86928,indoor,"discotheque, dressing_room, stage/indoor, museum/indoor, music_studio",348369
3623,86952,indoor,"clean_room, dressing_room, discotheque, music_studio, stage/indoor",348369
3624,86976,indoor,"clean_room, discotheque, stage/indoor, music_studio, nursing_home",348369
3625,87000,indoor,"archive, physics_laboratory, museum/indoor, clean_room, office",348369
3626,87024,indoor,"physics_laboratory, archive, clean_room, museum/indoor, office",348369
3627,87048,indoor,"archive, physics_laboratory, conference_room, chemistry_lab, museum/indoor",348369
3628,87072,indoor,"jewelry_shop, physics_laboratory, museum/indoor, clean_room, archive",348369
3629,87096,indoor,"clean_room, physics_laboratory, archive, museum/indoor, conference_room",348369
3630,87120,indoor,"clean_room, archive, conference_room, physics_laboratory, office",348369
3631,87144,indoor,"clean_room, physics_laboratory, museum/indoor, chemistry_lab, biology_laboratory",348369
3632,87168,indoor,"clean_room, physics_laboratory, chemistry_lab, conference_room, office",348369
3633,87192,indoor,"reception, office, conference_room, operating_room, clean_room",348369
3634,87216,indoor,"clean_room, chemistry_lab, physics_laboratory, biology_laboratory, museum/indoor",348369
3635,87240,indoor,"museum/indoor, physics_laboratory, music_studio, conference_center, archive",348369
3636,87264,indoor,"museum/indoor, music_studio, physics_laboratory, chemistry_lab, archive",348369
3637,87288,indoor,"music_studio, museum/indoor, physics_laboratory, archive, science_museum",348369
3638,87312,indoor,"chemistry_lab, physics_laboratory, science_museum, archive, clean_room",348369
3639,87336,indoor,"shower, bathroom, clean_room, chemistry_lab, discotheque",348369
3640,87360,indoor,"shower, basement, jail_cell, barndoor, closet",348369
3641,87384,indoor,"shower, basement, elevator/door, jail_cell, bow_window/indoor",348369
3642,87408,indoor,"corridor, highway, parking_garage/indoor, locker_room, elevator/door",348369
3643,87432,outdoor,"highway, forest_road, parking_lot, sky, street",348369
3644,87456,outdoor,"highway, forest_road, parking_lot, parking_garage/indoor, athletic_field/outdoor",348369
3645,87480,outdoor,"highway, parking_lot, crosswalk, sky, tower",348369
3646,87504,outdoor,"highway, forest_road, street, railroad_track, residential_neighborhood",348369
3647,87528,indoor,"natural_history_museum, archive, science_museum, jewelry_shop, shoe_shop",348369
3648,87552,indoor,"science_museum, natural_history_museum, museum/indoor, jewelry_shop, archive",348369
3649,87576,indoor,"clean_room, jewelry_shop, museum/indoor, chemistry_lab, dressing_room",348369
3650,87600,indoor,"clean_room, jewelry_shop, science_museum, museum/indoor, natural_history_museum",348369
3651,87624,indoor,"clean_room, archive, science_museum, jewelry_shop, chemistry_lab",348369
3652,87648,indoor,"clean_room, archive, science_museum, locker_room, shower",348369
3653,87672,outdoor,"parking_lot, highway, subway_station/platform, street, railroad_track",348369
3654,87696,indoor,"stage/indoor, subway_station/platform, ballroom, locker_room, gymnasium/indoor",348369
3655,87720,indoor,"elevator/door, forest_road, parking_garage/indoor, locker_room, sky",348369
3656,87744,indoor,"shower, basement, server_room, skyscraper, locker_room",348369
3657,87768,indoor,"museum/indoor, pharmacy, subway_station/platform, airport_terminal, reception",348369
3658,87792,indoor,"reception, museum/indoor, airport_terminal, subway_station/platform, pharmacy",348369
3659,87816,indoor,"reception, airport_terminal, museum/indoor, lobby, elevator/door",348369
3660,87840,indoor,"airport_terminal, subway_station/platform, museum/indoor, highway, reception",348369
3661,87864,indoor,"airport_terminal, highway, subway_station/platform, museum/indoor, pharmacy",348369
3662,87888,indoor,"airport_terminal, museum/indoor, pharmacy, reception, waiting_room",348369
3663,87912,indoor,"airport_terminal, reception, lobby, museum/indoor, pharmacy",348369
3664,87936,indoor,"clean_room, dressing_room, clothing_store, shower, museum/indoor",348369
3665,87960,indoor,"clean_room, museum/indoor, dressing_room, clothing_store, science_museum",348369
3666,87984,indoor,"clean_room, shower, igloo, jacuzzi/indoor, hospital_room",348369
3667,88008,indoor,"clean_room, museum/indoor, discotheque, dressing_room, art_gallery",348369
3668,88032,indoor,"clean_room, stage/indoor, martial_arts_gym, ballroom, museum/indoor",348369
3669,88056,indoor,"museum/indoor, clean_room, art_gallery, archive, natural_history_museum",348369
3670,88080,indoor,"clean_room, museum/indoor, art_gallery, martial_arts_gym, stage/indoor",348369
3671,88104,indoor,"museum/indoor, clean_room, art_gallery, stage/indoor, archive",348369
3672,88128,indoor,"museum/indoor, clean_room, art_gallery, stage/indoor, archive",348369
3673,88152,indoor,"museum/indoor, clean_room, stage/indoor, art_gallery, science_museum",348369
3674,88176,indoor,"clean_room, museum/indoor, stage/indoor, science_museum, art_gallery",348369
3675,88200,indoor,"museum/indoor, clean_room, iceberg, art_gallery, stage/indoor",348369
3676,88224,indoor,"clean_room, chemistry_lab, science_museum, biology_laboratory, physics_laboratory",348369
3677,88248,indoor,"clean_room, operating_room, chemistry_lab, biology_laboratory, museum/indoor",348369
3678,88272,indoor,"clean_room, igloo, discotheque, science_museum, museum/indoor",348369
3679,88296,indoor,"clean_room, stage/indoor, discotheque, music_studio, museum/indoor",348369
3680,88320,indoor,"clean_room, chemistry_lab, biology_laboratory, dressing_room, physics_laboratory",348369
3681,88344,indoor,"clean_room, museum/indoor, art_gallery, discotheque, dressing_room",348369
3682,88368,indoor,"clean_room, museum/indoor, chemistry_lab, art_gallery, stage/indoor",348369
3683,88392,indoor,"elevator/door, pharmacy, elevator_lobby, hospital, drugstore",348369
3684,88416,indoor,"elevator/door, pharmacy, hospital, elevator_lobby, drugstore",348369
3685,88440,indoor,"elevator/door, pharmacy, elevator_lobby, hospital, drugstore",348369
3686,88464,indoor,"elevator/door, elevator_lobby, pharmacy, hospital, museum/indoor",348369
