,frame_num,environment,places,imdb_id
1147,27528,outdoor,"wave, ocean, ice_shelf, ice_floe, igloo",348369
1148,27552,outdoor,"ice_shelf, wave, iceberg, ocean, ice_floe",348369
1149,27576,outdoor,"ocean, museum/indoor, ice_shelf, wave, ice_floe",348369
1150,27600,indoor,"ice_shelf, museum/indoor, ice_floe, discotheque, stage/indoor",348369
1151,27624,indoor,"museum/indoor, clean_room, ice_floe, natural_history_museum, art_gallery",348369
1152,27648,outdoor,"clean_room, museum/indoor, ice_floe, iceberg, field/wild",348369
1153,27672,indoor,"museum/indoor, clean_room, art_gallery, ice_shelf, ice_floe",348369
1154,27696,indoor,"museum/indoor, stage/indoor, arena/performance, discotheque, ballroom",348369
1155,27720,indoor,"stage/indoor, museum/indoor, auditorium, arena/performance, ballroom",348369
1156,27744,outdoor,"ice_shelf, wave, ocean, ice_floe, iceberg",348369
1157,27768,outdoor,"ice_floe, iceberg, museum/indoor, ice_shelf, clean_room",348369
1158,27792,outdoor,"ice_floe, iceberg, ice_shelf, museum/indoor, clean_room",348369
1159,27816,outdoor,"ice_floe, iceberg, museum/indoor, ice_shelf, clean_room",348369
1160,27840,indoor,"stage/indoor, discotheque, arena/performance, fountain, museum/indoor",348369
1161,27864,indoor,"stage/indoor, museum/indoor, arena/performance, ice_shelf, shower",348369
1162,27888,indoor,"stage/indoor, arena/performance, ballroom, discotheque, museum/indoor",348369
1163,27912,outdoor,"wave, ocean, beach, ice_floe, field/cultivated",348369
1164,27936,outdoor,"ocean, ice_shelf, wave, ice_floe, iceberg",348369
1165,27960,outdoor,"wave, ocean, coast, ice_floe, ice_shelf",348369
1166,27984,outdoor,"ice_floe, wheat_field, field/wild, iceberg, clean_room",348369
1167,28008,indoor,"clean_room, dressing_room, museum/indoor, art_gallery, clothing_store",348369
1168,28032,indoor,"clean_room, art_gallery, dressing_room, museum/indoor, operating_room",348369
1169,28056,indoor,"clean_room, museum/indoor, dressing_room, art_gallery, archive",348369
1170,28080,indoor,"clean_room, museum/indoor, archive, art_gallery, operating_room",348369
1171,28104,indoor,"clean_room, museum/indoor, archive, art_gallery, dressing_room",348369
1172,28128,indoor,"museum/indoor, archive, art_gallery, cemetery, elevator_lobby",348369
1173,28152,indoor,"museum/indoor, archive, cemetery, elevator_lobby, elevator/door",348369
1174,28176,indoor,"museum/indoor, archive, art_gallery, cemetery, pharmacy",348369
1175,28200,indoor,"museum/indoor, archive, art_gallery, pharmacy, elevator_lobby",348369
1176,28224,indoor,"museum/indoor, pharmacy, archive, cemetery, elevator/door",348369
1177,28248,indoor,"museum/indoor, cemetery, archive, pharmacy, art_gallery",348369
1178,28272,indoor,"museum/indoor, cemetery, archive, pharmacy, art_gallery",348369
1179,28296,indoor,"museum/indoor, archive, cemetery, art_gallery, pharmacy",348369
1180,28320,indoor,"clean_room, museum/indoor, art_gallery, archive, natural_history_museum",348369
1181,28344,indoor,"clean_room, museum/indoor, art_gallery, archive, art_studio",348369
1182,28368,indoor,"clean_room, museum/indoor, archive, art_gallery, natural_history_museum",348369
1183,28392,outdoor,"schoolhouse, ski_resort, shed, gas_station, clean_room",348369
1184,28416,outdoor,"schoolhouse, ski_resort, gas_station, shed, courthouse",348369
1185,28440,outdoor,"schoolhouse, ski_resort, shed, fire_station, railroad_track",348369
1186,28464,outdoor,"schoolhouse, ski_resort, shed, gas_station, fire_station",348369
1187,28488,indoor,"shower, locker_room, artists_loft, sauna, art_gallery",348369
1188,28512,indoor,"entrance_hall, museum/indoor, artists_loft, clean_room, art_gallery",348369
1189,28536,indoor,"art_gallery, museum/indoor, artists_loft, clean_room, entrance_hall",348369
1190,28560,indoor,"clean_room, entrance_hall, museum/indoor, locker_room, artists_loft",348369
1191,28584,indoor,"clean_room, artists_loft, entrance_hall, art_gallery, museum/indoor",348369
1192,28608,indoor,"clean_room, chemistry_lab, dressing_room, hospital_room, archive",348369
1193,28632,indoor,"museum/indoor, ice_cream_parlor, clean_room, art_gallery, candy_store",348369
1194,28656,indoor,"museum/indoor, cemetery, stage/indoor, fountain, ice_cream_parlor",348369
1195,28680,indoor,"ice_cream_parlor, museum/indoor, stage/indoor, ice_floe, fountain",348369
1196,28704,indoor,"clean_room, museum/indoor, art_gallery, artists_loft, art_studio",348369
1197,28728,indoor,"clean_room, bathroom, shower, locker_room, bow_window/indoor",348369
1198,28752,outdoor,"ice_shelf, iceberg, ocean, ice_floe, wave",348369
1199,28776,outdoor,"ice_shelf, stage/indoor, museum/indoor, ice_floe, boat_deck",348369
1200,28800,indoor,"ice_cream_parlor, museum/indoor, clean_room, stage/indoor, art_gallery",348369
1201,28824,indoor,"stage/indoor, museum/indoor, ice_cream_parlor, discotheque, clean_room",348369
1202,28848,indoor,"ice_cream_parlor, clean_room, stage/indoor, museum/indoor, discotheque",348369
1203,28872,indoor,"museum/indoor, stage/indoor, ice_cream_parlor, clean_room, art_gallery",348369
1204,28896,indoor,"museum/indoor, art_gallery, pharmacy, archive, elevator/door",348369
1205,28920,indoor,"museum/indoor, art_gallery, pharmacy, archive, elevator/door",348369
1206,28944,indoor,"museum/indoor, art_gallery, archive, pharmacy, elevator/door",348369
1207,28968,indoor,"museum/indoor, pharmacy, art_gallery, archive, drugstore",348369
1208,28992,indoor,"museum/indoor, art_gallery, pharmacy, archive, drugstore",348369
1209,29016,indoor,"museum/indoor, pharmacy, art_gallery, archive, drugstore",348369
1210,29040,indoor,"museum/indoor, art_gallery, pharmacy, archive, reception",348369
1211,29064,indoor,"museum/indoor, art_gallery, pharmacy, archive, elevator/door",348369
1212,29088,indoor,"dressing_room, museum/indoor, art_gallery, clean_room, shower",348369
1213,29112,indoor,"dressing_room, museum/indoor, art_gallery, clean_room, art_studio",348369
1214,29136,indoor,"dressing_room, museum/indoor, art_gallery, clean_room, discotheque",348369
1215,29160,indoor,"dressing_room, museum/indoor, art_gallery, stage/indoor, science_museum",348369
1216,29184,indoor,"museum/indoor, dressing_room, art_gallery, clean_room, art_studio",348369
1217,29208,indoor,"museum/indoor, stage/indoor, art_gallery, ice_cream_parlor, discotheque",348369
1218,29232,indoor,"museum/indoor, art_gallery, stage/indoor, dressing_room, clean_room",348369
1219,29256,outdoor,"ice_floe, museum/indoor, pond, lake/natural, art_gallery",348369
1220,29280,indoor,"museum/indoor, art_gallery, ice_floe, ice_cream_parlor, pond",348369
1221,29304,indoor,"stage/indoor, museum/indoor, discotheque, art_gallery, clean_room",348369
1222,29328,outdoor,"railroad_track, valley, mountain_snowy, train_station/platform, butte",348369
1223,29352,outdoor,"valley, butte, mountain_snowy, mountain, science_museum",348369
1224,29376,indoor,"igloo, museum/indoor, science_museum, ice_cream_parlor, natural_history_museum",348369
1225,29400,outdoor,"museum/indoor, science_museum, highway, desert_road, gas_station",348369
1226,29424,indoor,"hospital_room, nursery, bedroom, clean_room, museum/indoor",348369
1227,29448,indoor,"ice_cream_parlor, hospital_room, nursery, bedroom, clean_room",348369
1228,29472,indoor,"nursery, hospital_room, ice_cream_parlor, bedroom, museum/indoor",348369
1229,29496,indoor,"nursery, hospital_room, ice_cream_parlor, museum/indoor, bedroom",348369
1230,29520,indoor,"hospital_room, museum/indoor, nursery, clean_room, bedroom",348369
1231,29544,indoor,"sky, science_museum, shower, underwater/ocean_deep, discotheque",348369
1232,29568,outdoor,"sky, ice_shelf, shower, art_gallery, mountain_snowy",348369
1233,29592,outdoor,"ice_shelf, archive, museum/indoor, iceberg, mountain_snowy",348369
1234,29616,outdoor,"ice_shelf, sky, archive, science_museum, mountain_snowy",348369
1235,29640,indoor,"ice_shelf, science_museum, archive, natural_history_museum, art_gallery",348369
1236,29664,outdoor,"schoolhouse, ski_resort, courthouse, tower, hospital",348369
1237,29688,outdoor,"schoolhouse, ski_resort, fire_station, motel, construction_site",348369
1238,29712,outdoor,"schoolhouse, ski_resort, ski_slope, motel, fire_station",348369
1239,29736,indoor,"arena/rodeo, racecourse, arena/performance, museum/indoor, corral",348369
1240,29760,indoor,"museum/indoor, stage/indoor, arena/performance, racecourse, music_studio",348369
1241,29784,indoor,"racecourse, museum/indoor, arena/rodeo, arena/performance, stage/indoor",348369
1242,29808,outdoor,"museum/indoor, racecourse, corral, arena/rodeo, schoolhouse",348369
1243,29832,outdoor,"racecourse, ice_shelf, arena/rodeo, corral, desert/sand",348369
1244,29856,indoor,"museum/indoor, volleyball_court/outdoor, arena/rodeo, stage/indoor, desert/sand",348369
1245,29880,indoor,"nursery, museum/indoor, archive, bow_window/indoor, classroom",348369
1246,29904,indoor,"museum/indoor, archive, bow_window/indoor, nursery, corn_field",348369
1247,29928,indoor,"classroom, archive, nursery, museum/indoor, kindergarden_classroom",348369
1248,29952,indoor,"igloo, clean_room, museum/indoor, nursery, archive",348369
1249,29976,indoor,"hospital_room, clean_room, nursery, operating_room, ice_cream_parlor",348369
1250,30000,indoor,"nursery, hospital_room, museum/indoor, clean_room, ice_cream_parlor",348369
1251,30024,indoor,"nursery, waiting_room, bedroom, hospital_room, living_room",348369
1252,30048,indoor,"iceberg, hospital_room, nursery, wheat_field, museum/indoor",348369
1253,30072,indoor,"hospital_room, nursery, ice_cream_parlor, clean_room, museum/indoor",348369
1254,30096,indoor,"museum/indoor, runway, landing_deck, science_museum, auto_factory",348369
1255,30120,outdoor,"igloo, desert/sand, iceberg, science_museum, desert_road",348369
1256,30144,indoor,"banquet_hall, classroom, stage/indoor, dressing_room, museum/indoor",348369
1257,30168,indoor,"museum/indoor, classroom, stage/indoor, archive, lecture_room",348369
1258,30192,indoor,"discotheque, stage/indoor, nursery, museum/indoor, clean_room",348369
1259,30216,indoor,"classroom, museum/indoor, nursery, waiting_room, art_gallery",348369
1260,30240,indoor,"museum/indoor, ice_floe, ice_shelf, dining_room, art_gallery",348369
1261,30264,indoor,"museum/indoor, art_gallery, shower, art_studio, classroom",348369
1262,30288,outdoor,"ice_shelf, iceberg, museum/indoor, art_gallery, ice_floe",348369
1263,30312,indoor,"shower, art_gallery, museum/indoor, basement, classroom",348369
1264,30336,indoor,"shower, basement, jail_cell, bathroom, barndoor",348369
1265,30360,indoor,"clean_room, chemistry_lab, archive, biology_laboratory, physics_laboratory",348369
1266,30384,indoor,"clean_room, dressing_room, chemistry_lab, hospital_room, operating_room",348369
1267,30408,indoor,"clean_room, dressing_room, operating_room, chemistry_lab, hospital_room",348369
1268,30432,indoor,"clean_room, jewelry_shop, archive, attic, candy_store",348369
1269,30456,indoor,"jewelry_shop, archive, museum/indoor, music_studio, bookstore",348369
1270,30480,indoor,"jewelry_shop, archive, music_studio, museum/indoor, clean_room",348369
1271,30504,outdoor,"ice_shelf, ice_floe, hot_spring, shower, bedroom",348369
1272,30528,indoor,"clean_room, chemistry_lab, biology_laboratory, dressing_room, archive",348369
1273,30552,indoor,"clean_room, archive, shower, bathroom, museum/indoor",348369
1274,30576,indoor,"clean_room, archive, locker_room, dressing_room, shower",348369
1275,30600,indoor,"clean_room, dressing_room, locker_room, archive, shower",348369
1276,30624,indoor,"dressing_room, clean_room, locker_room, archive, beauty_salon",348369
1277,30648,indoor,"archive, clean_room, dressing_room, library/indoor, locker_room",348369
1278,30672,indoor,"bow_window/indoor, entrance_hall, dressing_room, living_room, clean_room",348369
1279,30696,indoor,"bow_window/indoor, entrance_hall, art_gallery, artists_loft, living_room",348369
1280,30720,indoor,"dressing_room, bow_window/indoor, entrance_hall, clean_room, art_gallery",348369
1281,30744,indoor,"dressing_room, entrance_hall, bow_window/indoor, clean_room, ballroom",348369
1282,30768,indoor,"dressing_room, entrance_hall, bow_window/indoor, closet, art_gallery",348369
1283,30792,indoor,"shower, ice_shelf, bow_window/indoor, ice_floe, aquarium",348369
1284,30816,indoor,"clean_room, operating_room, archive, shower, chemistry_lab",348369
1285,30840,indoor,"music_studio, discotheque, stage/indoor, shower, basement",348369
1286,30864,outdoor,"watering_hole, pond, lake/natural, ice_floe, corral",348369
1287,30888,indoor,"clean_room, corral, museum/indoor, shower, stage/indoor",348369
1288,30912,indoor,"clean_room, shower, museum/indoor, volleyball_court/outdoor, natural_history_museum",348369
1289,30936,indoor,"clean_room, music_studio, television_studio, stage/indoor, natural_history_museum",348369
1290,30960,indoor,"clean_room, museum/indoor, dressing_room, archive, clothing_store",348369
1291,30984,indoor,"archive, boxing_ring, museum/indoor, art_gallery, arena/rodeo",348369
1292,31008,indoor,"archive, clean_room, boxing_ring, operating_room, baseball_field",348369
1293,31032,indoor,"archive, jewelry_shop, nursery, museum/indoor, clean_room",348369
1294,31056,indoor,"archive, museum/indoor, nursery, classroom, shower",348369
1295,31080,indoor,"shower, gymnasium/indoor, archive, clean_room, boxing_ring",348369
1296,31104,indoor,"shower, bathroom, basement, locker_room, boxing_ring",348369
1297,31128,indoor,"archive, shoe_shop, stadium/baseball, airport_terminal, baseball_field",348369
1298,31152,indoor,"clean_room, volleyball_court/outdoor, shower, runway, archive",348369
1299,31176,indoor,"archive, classroom, balcony/interior, nursery, corral",348369
1300,31200,indoor,"archive, boxing_ring, supermarket, volleyball_court/outdoor, corral",348369
1301,31224,outdoor,"ice_floe, ice_shelf, iceberg, wave, ocean",348369
1302,31248,outdoor,"ice_floe, ice_shelf, iceberg, ocean, wave",348369
1303,31272,indoor,"balcony/interior, archive, airport_terminal, jewelry_shop, playground",348369
1304,31296,indoor,"archive, jewelry_shop, clean_room, chemistry_lab, department_store",348369
1305,31320,indoor,"archive, jewelry_shop, chemistry_lab, clean_room, shower",348369
1306,31344,indoor,"archive, chemistry_lab, jewelry_shop, biology_laboratory, museum/indoor",348369
1307,31368,indoor,"museum/indoor, clean_room, art_gallery, science_museum, archive",348369
1308,31392,indoor,"museum/indoor, clean_room, dressing_room, art_gallery, archive",348369
1309,31416,indoor,"clean_room, dressing_room, museum/indoor, archive, chemistry_lab",348369
1310,31440,indoor,"clean_room, museum/indoor, dressing_room, chemistry_lab, physics_laboratory",348369
1311,31464,indoor,"clean_room, museum/indoor, dressing_room, chemistry_lab, art_gallery",348369
1312,31488,indoor,"museum/indoor, clean_room, art_gallery, science_museum, chemistry_lab",348369
1313,31512,indoor,"clean_room, museum/indoor, dressing_room, art_gallery, archive",348369
1314,31536,indoor,"clean_room, dressing_room, nursing_home, museum/indoor, hospital_room",348369
1315,31560,indoor,"museum/indoor, clean_room, ice_floe, art_gallery, archive",348369
1316,31584,outdoor,"ice_floe, igloo, iceberg, corral, ice_shelf",348369
1317,31608,outdoor,"ice_floe, ice_shelf, shower, iceberg, corral",348369
1318,31632,indoor,"boxing_ring, shower, attic, corral, stable",348369
1319,31656,indoor,"pharmacy, drugstore, motel, archive, chemistry_lab",348369
1320,31680,indoor,"archive, pharmacy, snowfield, jewelry_shop, drugstore",348369
1321,31704,indoor,"archive, arena/rodeo, racecourse, motel, drugstore",348369
1322,31728,indoor,"chemistry_lab, pharmacy, jail_cell, classroom, archive",348369
1323,31752,indoor,"basement, jail_cell, shower, barndoor, archive",348369
1324,31776,indoor,"server_room, clean_room, art_gallery, archive, basement",348369
1325,31800,indoor,"clean_room, classroom, lecture_room, office, computer_room",348369
1326,31824,indoor,"clean_room, office_cubicles, biology_laboratory, lecture_room, classroom",348369
1327,31848,indoor,"clean_room, classroom, biology_laboratory, computer_room, office_cubicles",348369
1328,31872,indoor,"hospital_room, classroom, clean_room, biology_laboratory, computer_room",348369
1329,31896,indoor,"shower, closet, bow_window/indoor, elevator/door, alcove",348369
1330,31920,indoor,"museum/indoor, art_gallery, artists_loft, art_studio, clean_room",348369
1331,31944,indoor,"artists_loft, museum/indoor, art_gallery, corridor, basement",348369
1332,31968,indoor,"museum/indoor, art_gallery, artists_loft, clean_room, art_studio",348369
1333,31992,indoor,"museum/indoor, art_gallery, artists_loft, art_studio, bow_window/indoor",348369
1334,32016,indoor,"corridor, artists_loft, entrance_hall, bow_window/indoor, alcove",348369
1335,32040,indoor,"museum/indoor, natural_history_museum, discotheque, music_studio, stage/indoor",348369
1336,32064,indoor,"discotheque, stage/indoor, music_studio, museum/indoor, lecture_room",348369
1337,32088,indoor,"discotheque, stage/indoor, music_studio, museum/indoor, lecture_room",348369
1338,32112,indoor,"stage/indoor, music_studio, discotheque, arena/performance, orchestra_pit",348369
1339,32136,indoor,"science_museum, discotheque, natural_history_museum, sky, museum/indoor",348369
1340,32160,indoor,"museum/indoor, stage/indoor, art_gallery, discotheque, art_studio",348369
1341,32184,indoor,"museum/indoor, martial_arts_gym, clean_room, stage/indoor, art_gallery",348369
1342,32208,indoor,"museum/indoor, stage/indoor, art_gallery, art_studio, science_museum",348369
1343,32232,outdoor,"tower, sky, water_tower, science_museum, lighthouse",348369
1344,32256,indoor,"stage/indoor, discotheque, music_studio, museum/indoor, auditorium",348369
1345,32280,indoor,"stage/indoor, museum/indoor, discotheque, music_studio, natural_history_museum",348369
1346,32304,indoor,"stage/indoor, discotheque, music_studio, museum/indoor, archive",348369
1347,32328,indoor,"clean_room, classroom, hospital_room, biology_laboratory, dining_room",348369
1348,32352,indoor,"dining_room, cafeteria, restaurant, clean_room, patio",348369
1349,32376,indoor,"dining_room, cafeteria, classroom, computer_room, clean_room",348369
1350,32400,indoor,"dining_room, cafeteria, restaurant, office, dining_hall",348369
1351,32424,indoor,"cafeteria, classroom, clean_room, dining_room, restaurant",348369
1352,32448,indoor,"clean_room, cafeteria, biology_laboratory, restaurant, computer_room",348369
1353,32472,indoor,"clean_room, hospital_room, dressing_room, cafeteria, biology_laboratory",348369
1354,32496,indoor,"classroom, lecture_room, archive, music_studio, clean_room",348369
1355,32520,indoor,"clean_room, archive, classroom, lecture_room, hospital_room",348369
1356,32544,indoor,"discotheque, aquarium, clean_room, shower, elevator/door",348369
1357,32568,indoor,"clean_room, discotheque, shower, aquarium, chemistry_lab",348369
1358,32592,indoor,"aquarium, clean_room, shower, discotheque, dressing_room",348369
1359,32616,indoor,"discotheque, stage/indoor, dressing_room, bar, beauty_salon",348369
1360,32640,indoor,"discotheque, dressing_room, stage/indoor, bar, beauty_salon",348369
1361,32664,indoor,"museum/indoor, art_gallery, archive, cemetery, hospital",348369
1362,32688,indoor,"museum/indoor, art_gallery, archive, pharmacy, hospital",348369
1363,32712,indoor,"museum/indoor, art_gallery, archive, classroom, lecture_room",348369
1364,32736,indoor,"museum/indoor, art_gallery, archive, classroom, hospital",348369
1365,32760,indoor,"museum/indoor, art_gallery, archive, cemetery, pharmacy",348369
1366,32784,indoor,"museum/indoor, art_gallery, archive, classroom, lecture_room",348369
1367,32808,indoor,"museum/indoor, art_gallery, archive, cemetery, classroom",348369
1368,32832,indoor,"museum/indoor, art_gallery, archive, classroom, lecture_room",348369
1369,32856,indoor,"discotheque, dressing_room, aquarium, classroom, lecture_room",348369
1370,32880,indoor,"discotheque, dressing_room, shower, chemistry_lab, bathroom",348369
1371,32904,indoor,"elevator/door, pharmacy, hospital, elevator_lobby, drugstore",348369
1372,32928,indoor,"elevator/door, pharmacy, elevator_lobby, hospital, beauty_salon",348369
1373,32952,indoor,"elevator/door, pharmacy, hospital, elevator_lobby, beauty_salon",348369
1374,32976,indoor,"elevator/door, pharmacy, elevator_lobby, hospital, reception",348369
1375,33000,indoor,"hospital, pharmacy, elevator/door, drugstore, beauty_salon",348369
1376,33024,indoor,"elevator/door, pharmacy, hospital, elevator_lobby, drugstore",348369
1377,33048,indoor,"clean_room, shower, aquarium, dressing_room, museum/indoor",348369
1378,33072,indoor,"clean_room, dressing_room, shower, museum/indoor, aquarium",348369
1379,33096,indoor,"shower, discotheque, clean_room, dressing_room, aquarium",348369
1380,33120,indoor,"aquarium, shower, museum/indoor, discotheque, dressing_room",348369
1381,33144,indoor,"aquarium, clean_room, shower, dressing_room, science_museum",348369
1382,33168,indoor,"aquarium, shower, clean_room, discotheque, natural_history_museum",348369
1383,33192,indoor,"clean_room, aquarium, shower, dressing_room, chemistry_lab",348369
1384,33216,indoor,"dressing_room, banquet_hall, restaurant, clean_room, chemistry_lab",348369
1385,33240,outdoor,"igloo, ice_floe, banquet_hall, airport_terminal, iceberg",348369
1386,33264,indoor,"restaurant, discotheque, clean_room, airport_terminal, dressing_room",348369
1387,33288,indoor,"classroom, conference_center, lecture_room, banquet_hall, stage/indoor",348369
1388,33312,indoor,"classroom, lecture_room, cafeteria, restaurant, dining_hall",348369
1389,33336,indoor,"museum/indoor, food_court, restaurant, banquet_hall, science_museum",348369
1390,33360,indoor,"airport_terminal, food_court, cafeteria, classroom, lecture_room",348369
1391,33384,indoor,"ice_floe, museum/indoor, clean_room, art_gallery, ice_shelf",348369
1392,33408,outdoor,"museum/indoor, ice_floe, clean_room, watering_hole, pond",348369
1393,33432,indoor,"museum/indoor, science_museum, art_gallery, clean_room, natural_history_museum",348369
1394,33456,indoor,"museum/indoor, clean_room, natural_history_museum, art_gallery, ice_floe",348369
1395,33480,indoor,"clean_room, clothing_store, museum/indoor, dressing_room, art_gallery",348369
1396,33504,indoor,"museum/indoor, clothing_store, ice_floe, science_museum, ice_shelf",348369
1397,33528,indoor,"restaurant, dressing_room, cafeteria, dining_hall, banquet_hall",348369
1398,33552,indoor,"restaurant, cafeteria, food_court, dining_hall, banquet_hall",348369
1399,33576,indoor,"restaurant, banquet_hall, cafeteria, dining_hall, food_court",348369
1400,33600,indoor,"restaurant, clean_room, dressing_room, cafeteria, archive",348369
1401,33624,indoor,"clean_room, art_gallery, shower, museum/indoor, basement",348369
1402,33648,indoor,"discotheque, museum/indoor, stage/indoor, ice_shelf, archive",348369
1403,33672,indoor,"discotheque, museum/indoor, stage/indoor, archive, music_studio",348369
1404,33696,indoor,"museum/indoor, archive, ice_shelf, discotheque, iceberg",348369
1405,33720,indoor,"discotheque, stage/indoor, museum/indoor, archive, ballroom",348369
1406,33744,indoor,"discotheque, stage/indoor, museum/indoor, ballroom, art_gallery",348369
1407,33768,indoor,"museum/indoor, archive, stage/indoor, discotheque, music_studio",348369
1408,33792,indoor,"discotheque, stage/indoor, dressing_room, museum/indoor, ballroom",348369
1409,33816,indoor,"discotheque, museum/indoor, stage/indoor, archive, dressing_room",348369
1410,33840,indoor,"museum/indoor, discotheque, archive, stage/indoor, clean_room",348369
1411,33864,indoor,"discotheque, stage/indoor, museum/indoor, dressing_room, clean_room",348369
1412,33888,indoor,"discotheque, dressing_room, stage/indoor, museum/indoor, music_studio",348369
1413,33912,indoor,"discotheque, stage/indoor, music_studio, museum/indoor, dressing_room",348369
1414,33936,indoor,"stage/indoor, discotheque, music_studio, museum/indoor, clean_room",348369
1415,33960,indoor,"museum/indoor, stage/indoor, dressing_room, clean_room, discotheque",348369
1416,33984,indoor,"museum/indoor, stage/indoor, discotheque, clean_room, art_gallery",348369
1417,34008,indoor,"museum/indoor, elevator/door, pharmacy, hospital, elevator_lobby",348369
1418,34032,indoor,"museum/indoor, elevator/door, elevator_lobby, pharmacy, hospital",348369
1419,34056,indoor,"museum/indoor, elevator/door, elevator_lobby, pharmacy, archive",348369
1420,34080,indoor,"museum/indoor, elevator/door, elevator_lobby, pharmacy, hospital",348369
1421,34104,indoor,"museum/indoor, elevator/door, elevator_lobby, pharmacy, archive",348369
1422,34128,indoor,"museum/indoor, elevator/door, elevator_lobby, pharmacy, hospital",348369
1423,34152,indoor,"museum/indoor, elevator/door, pharmacy, hospital, elevator_lobby",348369
1424,34176,indoor,"archive, banquet_hall, airport_terminal, clean_room, restaurant",348369
1425,34200,indoor,"archive, banquet_hall, food_court, airport_terminal, office_cubicles",348369
1426,34224,indoor,"airport_terminal, archive, banquet_hall, museum/indoor, clean_room",348369
1427,34248,indoor,"airport_terminal, food_court, cafeteria, classroom, banquet_hall",348369
1428,34272,indoor,"airport_terminal, classroom, cafeteria, food_court, bowling_alley",348369
1429,34296,outdoor,"ice_shelf, ice_floe, iceberg, museum/indoor, childs_room",348369
1430,34320,indoor,"museum/indoor, stage/indoor, archive, dressing_room, clean_room",348369
1431,34344,indoor,"museum/indoor, stage/indoor, clean_room, archive, dressing_room",348369
1432,34368,indoor,"museum/indoor, stage/indoor, clean_room, dressing_room, archive",348369
1433,34392,indoor,"stage/indoor, museum/indoor, archive, music_studio, clean_room",348369
1434,34416,indoor,"museum/indoor, stage/indoor, archive, schoolhouse, clean_room",348369
1435,34440,indoor,"museum/indoor, archive, stage/indoor, dressing_room, schoolhouse",348369
