,frame_num,environment,places
0,0,outdoor,"desert/sand, sky, beach, lake/natural, marsh"
1,24,outdoor,"desert/sand, sky, beach, lake/natural, marsh"
2,48,indoor,"museum/indoor, iceberg, clothing_store, clean_room, art_gallery"
3,72,indoor,"museum/indoor, clean_room, iceberg, discotheque, art_gallery"
4,96,indoor,"clean_room, ballroom, museum/indoor, martial_arts_gym, art_gallery"
5,120,indoor,"bowling_alley, clean_room, staircase, clothing_store, museum/indoor"
6,144,indoor,"clean_room, airport_terminal, airplane_cabin, lobby, entrance_hall"
7,168,indoor,"clean_room, museum/indoor, clothing_store, nursery, staircase"
8,192,indoor,"airport_terminal, clean_room, airplane_cabin, lobby, entrance_hall"
9,216,indoor,"clean_room, museum/indoor, clothing_store, art_gallery, nursery"
10,240,indoor,"nursery, shower, locker_room, clean_room, museum/indoor"
11,264,outdoor,"desert/sand, ice_floe, lake/natural, ice_shelf, pond"
12,288,indoor,"science_museum, museum/indoor, physics_laboratory, clean_room, jewelry_shop"
13,312,indoor,"science_museum, physics_laboratory, clean_room, museum/indoor, jewelry_shop"
14,336,indoor,"science_museum, clean_room, physics_laboratory, museum/indoor, jewelry_shop"
15,360,indoor,"science_museum, clean_room, physics_laboratory, museum/indoor, jewelry_shop"
16,384,indoor,"science_museum, physics_laboratory, clean_room, museum/indoor, jewelry_shop"
17,408,indoor,"science_museum, clean_room, physics_laboratory, museum/indoor, jewelry_shop"
18,432,indoor,"science_museum, physics_laboratory, clean_room, museum/indoor, jewelry_shop"
19,456,indoor,"science_museum, clean_room, physics_laboratory, museum/indoor, jewelry_shop"
20,480,indoor,"science_museum, physics_laboratory, clean_room, museum/indoor, jewelry_shop"
21,504,indoor,"science_museum, physics_laboratory, clean_room, museum/indoor, jewelry_shop"
22,528,indoor,"science_museum, physics_laboratory, clean_room, museum/indoor, shower"
23,552,indoor,"science_museum, clean_room, physics_laboratory, museum/indoor, jewelry_shop"
24,576,indoor,"clean_room, science_museum, physics_laboratory, museum/indoor, jewelry_shop"
25,600,indoor,"clean_room, science_museum, jewelry_shop, museum/indoor, physics_laboratory"
26,624,indoor,"science_museum, physics_laboratory, museum/indoor, clean_room, boat_deck"
27,648,indoor,"science_museum, physics_laboratory, clean_room, museum/indoor, boat_deck"
28,672,indoor,"science_museum, clean_room, museum/indoor, physics_laboratory, jewelry_shop"
29,696,indoor,"science_museum, physics_laboratory, museum/indoor, clean_room, jewelry_shop"
30,720,indoor,"science_museum, physics_laboratory, clean_room, museum/indoor, boat_deck"
31,744,indoor,"science_museum, physics_laboratory, clean_room, museum/indoor, boat_deck"
32,768,indoor,"science_museum, clean_room, physics_laboratory, museum/indoor, boat_deck"
33,792,indoor,"science_museum, clean_room, physics_laboratory, museum/indoor, jewelry_shop"
34,816,indoor,"science_museum, clean_room, museum/indoor, physics_laboratory, shower"
35,840,indoor,"chemistry_lab, science_museum, physics_laboratory, museum/indoor, boat_deck"
36,864,indoor,"science_museum, museum/indoor, jewelry_shop, physics_laboratory, airport_terminal"
37,888,indoor,"jewelry_shop, science_museum, physics_laboratory, chemistry_lab, museum/indoor"
38,912,indoor,"science_museum, clean_room, museum/indoor, jewelry_shop, chemistry_lab"
39,936,indoor,"chemistry_lab, physics_laboratory, science_museum, jewelry_shop, coffee_shop"
40,960,indoor,"chemistry_lab, physics_laboratory, science_museum, jewelry_shop, bathroom"
41,984,indoor,"science_museum, chemistry_lab, jewelry_shop, physics_laboratory, bathroom"
42,1008,indoor,"science_museum, chemistry_lab, physics_laboratory, jewelry_shop, museum/indoor"
43,1032,indoor,"chemistry_lab, science_museum, physics_laboratory, jewelry_shop, bathroom"
44,1056,indoor,"staircase, corridor, porch, museum/indoor, stable"
45,1080,indoor,"staircase, stable, porch, sauna, mezzanine"
46,1104,indoor,"staircase, sauna, fire_escape, porch, escalator/indoor"
47,1128,indoor,"staircase, living_room, porch, lobby, entrance_hall"
48,1152,indoor,"atrium/public, lobby, museum/indoor, airplane_cabin, airport_terminal"
49,1176,indoor,"airplane_cabin, living_room, staircase, car_interior, lobby"
50,1200,indoor,"airplane_cabin, bathroom, clean_room, train_interior, car_interior"
51,1224,indoor,"bow_window/indoor, home_office, nursery, jewelry_shop, office"
52,1248,indoor,"bow_window/indoor, office, home_office, porch, living_room"
53,1272,indoor,"bow_window/indoor, jewelry_shop, clean_room, home_office, office"
54,1296,indoor,"bow_window/indoor, clean_room, museum/indoor, archive, nursery"
55,1320,indoor,"museum/indoor, art_gallery, dressing_room, archive, clean_room"
56,1344,indoor,"clean_room, dressing_room, archive, museum/indoor, bathroom"
57,1368,indoor,"clean_room, dressing_room, archive, clothing_store, science_museum"
58,1392,indoor,"museum/indoor, clean_room, science_museum, natural_history_museum, gift_shop"
59,1416,indoor,"museum/indoor, locker_room, clean_room, dressing_room, shower"
60,1440,indoor,"clean_room, museum/indoor, gymnasium/indoor, dressing_room, discotheque"
61,1464,indoor,"museum/indoor, ballroom, gymnasium/indoor, kindergarden_classroom, discotheque"
62,1488,indoor,"ballroom, gymnasium/indoor, museum/indoor, living_room, dressing_room"
63,1512,indoor,"museum/indoor, art_studio, ballroom, gymnasium/indoor, childs_room"
64,1536,indoor,"ballroom, museum/indoor, living_room, dining_room, art_studio"
65,1560,indoor,"museum/indoor, art_studio, nursery, playroom, childs_room"
66,1584,indoor,"dressing_room, clean_room, nursery, dining_room, living_room"
67,1608,indoor,"museum/indoor, clean_room, kindergarden_classroom, nursery, archive"
68,1632,indoor,"nursery, bow_window/indoor, dressing_room, living_room, clean_room"
69,1656,indoor,"nursery, bow_window/indoor, living_room, archive, dorm_room"
70,1680,indoor,"locker_room, bow_window/indoor, clean_room, nursery, bedroom"
71,1704,indoor,"bedroom, bedchamber, clean_room, closet, bow_window/indoor"
72,1728,indoor,"bedchamber, bedroom, clean_room, utility_room, locker_room"
73,1752,indoor,"bedroom, bedchamber, clean_room, utility_room, closet"
74,1776,indoor,"clean_room, bedchamber, nursery, bedroom, closet"
75,1800,indoor,"clean_room, archive, clothing_store, nursery, staircase"
76,1824,indoor,"clean_room, archive, arch, museum/indoor, alcove"
77,1848,indoor,"clean_room, hospital_room, dressing_room, operating_room, archive"
78,1872,indoor,"chemistry_lab, clean_room, biology_laboratory, physics_laboratory, bar"
79,1896,indoor,"clean_room, operating_room, airplane_cabin, hotel_room, hospital_room"
80,1920,indoor,"shower, bathroom, clean_room, chemistry_lab, engine_room"
81,1944,indoor,"clean_room, archive, museum/indoor, locker_room, jewelry_shop"
82,1968,indoor,"clean_room, bathroom, locker_room, nursery, dorm_room"
83,1992,indoor,"locker_room, closet, dressing_room, bathroom, clean_room"
84,2016,indoor,"clean_room, locker_room, bathroom, dressing_room, bedroom"
85,2040,indoor,"locker_room, bathroom, clean_room, closet, shower"
86,2064,indoor,"locker_room, bathroom, clean_room, shower, bank_vault"
87,2088,indoor,"locker_room, bathroom, shower, closet, clean_room"
88,2112,indoor,"locker_room, clean_room, shower, bathroom, closet"
89,2136,indoor,"clean_room, locker_room, bathroom, shower, closet"
90,2160,indoor,"clean_room, locker_room, shower, bathroom, bank_vault"
91,2184,indoor,"museum/indoor, archive, nursery, clean_room, natural_history_museum"
92,2208,indoor,"clean_room, archive, nursery, museum/indoor, hospital_room"
93,2232,indoor,"museum/indoor, clean_room, nursery, art_gallery, shower"
94,2256,indoor,"museum/indoor, archive, clean_room, science_museum, natural_history_museum"
95,2280,indoor,"museum/indoor, clean_room, office, art_gallery, artists_loft"
96,2304,indoor,"archive, clean_room, locker_room, dressing_room, office"
97,2328,indoor,"archive, clean_room, locker_room, nursery, office"
98,2352,indoor,"clean_room, museum/indoor, archive, art_gallery, dressing_room"
99,2376,indoor,"museum/indoor, clean_room, archive, art_gallery, natural_history_museum"
100,2400,indoor,"archive, clean_room, corridor, alcove, museum/indoor"
101,2424,indoor,"museum/indoor, clean_room, church/indoor, art_gallery, science_museum"
102,2448,indoor,"clean_room, shower, museum/indoor, archive, locker_room"
103,2472,indoor,"clean_room, museum/indoor, archive, church/indoor, physics_laboratory"
104,2496,indoor,"clean_room, museum/indoor, archive, operating_room, church/indoor"
105,2520,indoor,"museum/indoor, art_gallery, burial_chamber, science_museum, church/indoor"
106,2544,indoor,"museum/indoor, science_museum, art_gallery, natural_history_museum, clean_room"
107,2568,indoor,"dressing_room, clean_room, archive, office, music_studio"
108,2592,indoor,"dressing_room, clean_room, museum/indoor, nursery, living_room"
109,2616,indoor,"dressing_room, clean_room, museum/indoor, nursery, archive"
110,2640,indoor,"museum/indoor, clean_room, archive, dressing_room, art_gallery"
111,2664,indoor,"dressing_room, museum/indoor, clean_room, archive, art_gallery"
112,2688,indoor,"dressing_room, museum/indoor, clean_room, art_studio, art_gallery"
113,2712,indoor,"living_room, art_studio, dining_room, library/indoor, classroom"
114,2736,indoor,"living_room, artists_loft, art_studio, dining_room, museum/indoor"
115,2760,indoor,"living_room, dining_room, museum/indoor, artists_loft, art_studio"
116,2784,indoor,"living_room, artists_loft, dining_room, museum/indoor, entrance_hall"
117,2808,indoor,"museum/indoor, clean_room, archive, art_gallery, dressing_room"
118,2832,indoor,"museum/indoor, clean_room, art_gallery, church/indoor, art_studio"
119,2856,indoor,"bow_window/indoor, clean_room, bedchamber, dressing_room, bedroom"
120,2880,indoor,"clean_room, nursery, museum/indoor, dressing_room, bow_window/indoor"
121,2904,indoor,"nursery, museum/indoor, bow_window/indoor, dressing_room, archive"
122,2928,indoor,"nursery, dressing_room, bow_window/indoor, living_room, porch"
123,2952,indoor,"nursery, bow_window/indoor, clean_room, dressing_room, dining_room"
124,2976,indoor,"nursery, bow_window/indoor, living_room, dining_room, clean_room"
125,3000,indoor,"nursery, bow_window/indoor, dressing_room, clean_room, flea_market/indoor"
126,3024,indoor,"nursery, bow_window/indoor, clean_room, living_room, bathroom"
127,3048,indoor,"discotheque, shower, locker_room, basement, music_studio"
128,3072,indoor,"clean_room, physics_laboratory, music_studio, locker_room, chemistry_lab"
129,3096,indoor,"museum/indoor, music_studio, staircase, clean_room, playground"
130,3120,indoor,"clean_room, shower, bathroom, chemistry_lab, operating_room"
131,3144,indoor,"clean_room, music_studio, operating_room, locker_room, discotheque"
132,3168,indoor,"clean_room, locker_room, music_studio, bar, engine_room"
133,3192,indoor,"music_studio, chemistry_lab, repair_shop, biology_laboratory, bathroom"
134,3216,indoor,"music_studio, discotheque, clean_room, shower, chemistry_lab"
135,3240,indoor,"chemistry_lab, music_studio, clean_room, biology_laboratory, repair_shop"
136,3264,indoor,"music_studio, clean_room, repair_shop, chemistry_lab, physics_laboratory"
137,3288,indoor,"music_studio, chemistry_lab, discotheque, biology_laboratory, physics_laboratory"
138,3312,indoor,"music_studio, chemistry_lab, biology_laboratory, discotheque, physics_laboratory"
139,3336,indoor,"chemistry_lab, clean_room, laundromat, locker_room, music_studio"
140,3360,indoor,"discotheque, music_studio, chemistry_lab, shower, nursery"
141,3384,indoor,"clean_room, music_studio, chemistry_lab, nursery, discotheque"
142,3408,indoor,"music_studio, discotheque, television_studio, stage/indoor, clean_room"
143,3432,indoor,"music_studio, discotheque, clean_room, television_studio, stage/indoor"
144,3456,indoor,"clean_room, shower, nursery, discotheque, music_studio"
145,3480,indoor,"clean_room, discotheque, music_studio, physics_laboratory, operating_room"
146,3504,indoor,"clean_room, music_studio, discotheque, operating_room, chemistry_lab"
147,3528,indoor,"clean_room, chemistry_lab, shower, music_studio, physics_laboratory"
148,3552,outdoor,"parking_garage/indoor, parking_lot, crosswalk, runway, basement"
149,3576,outdoor,"parking_lot, crosswalk, runway, basement, parking_garage/indoor"
150,3600,outdoor,"ice_shelf, ice_floe, iceberg, desert/sand, basement"
151,3624,outdoor,"ice_floe, ice_shelf, runway, crosswalk, natural_history_museum"
152,3648,outdoor,"ice_shelf, snowfield, mountain_snowy, glacier, desert/sand"
153,3672,outdoor,"ice_shelf, desert/sand, snowfield, glacier, beach"
154,3696,outdoor,"ice_shelf, snowfield, mountain_snowy, desert/sand, glacier"
155,3720,indoor,"natural_history_museum, ice_floe, clothing_store, ice_shelf, clean_room"
156,3744,outdoor,"natural_history_museum, iceberg, clothing_store, ice_shelf, ice_floe"
157,3768,outdoor,"ice_floe, ice_shelf, iceberg, clean_room, runway"
158,3792,outdoor,"ice_shelf, ice_floe, iceberg, art_gallery, archive"
159,3816,outdoor,"ice_shelf, iceberg, ice_floe, igloo, glacier"
160,3840,outdoor,"ice_shelf, iceberg, ice_floe, archive, clean_room"
161,3864,outdoor,"ice_shelf, iceberg, ice_floe, archive, clean_room"
162,3888,indoor,"archive, ice_shelf, classroom, basement, iceberg"
163,3912,outdoor,"ice_shelf, iceberg, ice_floe, igloo, archive"
164,3936,indoor,"natural_history_museum, classroom, archive, iceberg, ice_shelf"
165,3960,outdoor,"ice_shelf, iceberg, igloo, natural_history_museum, ice_floe"
166,3984,outdoor,"ice_shelf, runway, igloo, classroom, basement"
167,4008,indoor,"ice_shelf, shower, basement, runway, archive"
168,4032,indoor,"classroom, ice_shelf, basement, runway, archive"
169,4056,outdoor,"runway, landing_deck, ice_shelf, hangar/indoor, basement"
170,4080,outdoor,"ice_shelf, iceberg, basement, classroom, runway"
171,4104,outdoor,"ice_shelf, runway, basement, landing_deck, iceberg"
172,4128,outdoor,"ice_shelf, iceberg, runway, landing_deck, shower"
173,4152,outdoor,"ice_shelf, shower, iceberg, basement, runway"
174,4176,indoor,"basement, runway, shower, archive, classroom"
175,4200,outdoor,"ice_shelf, iceberg, ice_floe, runway, basement"
176,4224,indoor,"aquarium, natural_history_museum, pond, underwater/ocean_deep, science_museum"
177,4248,outdoor,"ice_floe, iceberg, aquarium, pond, ice_shelf"
178,4272,outdoor,"aquarium, ice_floe, pond, iceberg, lake/natural"
179,4296,outdoor,"ice_shelf, ice_floe, iceberg, glacier, mountain_snowy"
180,4320,outdoor,"ice_shelf, ice_floe, glacier, iceberg, mountain_snowy"
181,4344,outdoor,"ice_shelf, ice_floe, iceberg, glacier, archaelogical_excavation"
182,4368,outdoor,"shower, tower, skyscraper, office_building, mausoleum"
183,4392,outdoor,"shower, tower, skyscraper, office_building, jail_cell"
184,4416,outdoor,"ice_floe, aquarium, natural_history_museum, ice_shelf, playground"
185,4440,indoor,"natural_history_museum, aquarium, science_museum, playground, shower"
186,4464,indoor,"natural_history_museum, aquarium, shoe_shop, boat_deck, playground"
187,4488,outdoor,"aquarium, ice_floe, natural_history_museum, boat_deck, pond"
188,4512,outdoor,"aquarium, boat_deck, ice_floe, underwater/ocean_deep, pond"
189,4536,indoor,"museum/indoor, art_gallery, natural_history_museum, science_museum, archive"
190,4560,indoor,"art_gallery, museum/indoor, ice_shelf, natural_history_museum, science_museum"
191,4584,indoor,"museum/indoor, art_gallery, science_museum, natural_history_museum, archive"
192,4608,indoor,"museum/indoor, science_museum, veterinarians_office, archive, ice_floe"
193,4632,indoor,"museum/indoor, archive, hot_spring, science_museum, chemistry_lab"
194,4656,outdoor,"ice_shelf, runway, basement, classroom, iceberg"
195,4680,indoor,"runway, ice_shelf, art_gallery, natural_history_museum, basement"
196,4704,indoor,"natural_history_museum, crosswalk, runway, archive, museum/indoor"
197,4728,indoor,"natural_history_museum, art_gallery, archive, ice_shelf, runway"
198,4752,outdoor,"runway, crosswalk, ice_shelf, parking_lot, archive"
199,4776,indoor,"ice_shelf, classroom, archive, iceberg, lecture_room"
200,4800,outdoor,"ice_shelf, iceberg, ice_floe, classroom, igloo"
201,4824,outdoor,"ice_shelf, iceberg, runway, classroom, landing_deck"
202,4848,outdoor,"igloo, ice_shelf, burial_chamber, ice_floe, basement"
203,4872,outdoor,"ice_shelf, iceberg, archive, ice_floe, shower"
204,4896,indoor,"ice_shelf, natural_history_museum, archive, ice_floe, museum/indoor"
205,4920,outdoor,"ice_shelf, ice_floe, iceberg, shoe_shop, natural_history_museum"
206,4944,outdoor,"shoe_shop, runway, crosswalk, ice_shelf, parking_lot"
207,4968,indoor,"shower, shoe_shop, ice_shelf, natural_history_museum, clothing_store"
208,4992,indoor,"art_gallery, art_studio, archive, classroom, natural_history_museum"
209,5016,outdoor,"ice_shelf, desert/sand, art_studio, ice_floe, shoe_shop"
210,5040,outdoor,"classroom, runway, ice_shelf, desert/sand, lecture_room"
211,5064,outdoor,"runway, natural_history_museum, ice_shelf, landing_deck, ice_floe"
212,5088,indoor,"ice_shelf, iceberg, shower, bathroom, art_gallery"
213,5112,indoor,"nursery, bedchamber, bedroom, childs_room, clean_room"
214,5136,indoor,"nursery, bedchamber, bedroom, childs_room, clean_room"
215,5160,indoor,"nursery, bedchamber, bedroom, childs_room, clean_room"
216,5184,indoor,"nursery, bedchamber, bedroom, clothing_store, childs_room"
217,5208,indoor,"nursery, bedroom, bedchamber, childs_room, dressing_room"
218,5232,indoor,"nursery, bedroom, childs_room, bedchamber, locker_room"
219,5256,indoor,"nursery, childs_room, locker_room, bedroom, bedchamber"
220,5280,indoor,"nursery, childs_room, clean_room, bedchamber, bedroom"
221,5304,indoor,"nursery, archive, clean_room, childs_room, bedroom"
222,5328,indoor,"clean_room, archive, dining_room, nursery, office"
223,5352,indoor,"archive, nursery, clean_room, bow_window/indoor, dressing_room"
224,5376,indoor,"clean_room, archive, chemistry_lab, museum/indoor, physics_laboratory"
225,5400,indoor,"clean_room, archive, museum/indoor, entrance_hall, dressing_room"
226,5424,indoor,"museum/indoor, archive, clean_room, entrance_hall, dressing_room"
227,5448,indoor,"entrance_hall, archive, museum/indoor, lobby, clean_room"
228,5472,indoor,"entrance_hall, museum/indoor, clean_room, archive, locker_room"
229,5496,indoor,"museum/indoor, dressing_room, clean_room, archive, alcove"
230,5520,indoor,"clean_room, museum/indoor, science_museum, art_gallery, natural_history_museum"
231,5544,indoor,"clean_room, science_museum, discotheque, museum/indoor, dressing_room"
232,5568,indoor,"jewelry_shop, dressing_room, nursery, clothing_store, clean_room"
233,5592,indoor,"museum/indoor, jewelry_shop, gift_shop, dressing_room, clothing_store"
234,5616,indoor,"clothing_store, gift_shop, museum/indoor, jewelry_shop, department_store"
235,5640,indoor,"museum/indoor, clothing_store, gift_shop, jewelry_shop, dressing_room"
236,5664,indoor,"museum/indoor, clothing_store, clean_room, gift_shop, archive"
237,5688,indoor,"museum/indoor, nursery, gift_shop, archive, clean_room"
238,5712,indoor,"clean_room, museum/indoor, clothing_store, gift_shop, nursery"
239,5736,indoor,"jewelry_shop, clean_room, clothing_store, dressing_room, chemistry_lab"
240,5760,indoor,"nursery, bedchamber, jewelry_shop, bedroom, dressing_room"
241,5784,indoor,"bedchamber, nursery, bedroom, jewelry_shop, childs_room"
242,5808,indoor,"bedchamber, nursery, jewelry_shop, bedroom, childs_room"
243,5832,indoor,"museum/indoor, shower, discotheque, dressing_room, clean_room"
244,5856,indoor,"museum/indoor, discotheque, dressing_room, clean_room, stage/indoor"
245,5880,indoor,"museum/indoor, shower, natural_history_museum, science_museum, dressing_room"
246,5904,indoor,"museum/indoor, shower, natural_history_museum, clean_room, art_gallery"
247,5928,indoor,"museum/indoor, natural_history_museum, science_museum, shower, igloo"
248,5952,indoor,"museum/indoor, science_museum, natural_history_museum, discotheque, clean_room"
249,5976,indoor,"museum/indoor, discotheque, natural_history_museum, shower, science_museum"
250,6000,outdoor,"ice_shelf, ice_floe, iceberg, desert/sand, runway"
251,6024,outdoor,"ice_shelf, ice_floe, iceberg, desert/sand, runway"
252,6048,outdoor,"ice_shelf, ice_floe, iceberg, beach, desert/sand"
253,6072,outdoor,"ice_shelf, ice_floe, iceberg, runway, desert/sand"
254,6096,outdoor,"ice_shelf, ice_floe, iceberg, desert/sand, runway"
255,6120,outdoor,"ice_shelf, ice_floe, iceberg, desert/sand, runway"
256,6144,outdoor,"ice_shelf, ice_floe, iceberg, runway, underwater/ocean_deep"
257,6168,indoor,"museum/indoor, discotheque, natural_history_museum, science_museum, stage/indoor"
258,6192,indoor,"museum/indoor, natural_history_museum, science_museum, clean_room, shower"
259,6216,indoor,"museum/indoor, natural_history_museum, science_museum, discotheque, shower"
260,6240,indoor,"museum/indoor, natural_history_museum, science_museum, shower, aquarium"
261,6264,indoor,"museum/indoor, natural_history_museum, science_museum, shower, discotheque"
262,6288,indoor,"museum/indoor, natural_history_museum, science_museum, shower, art_gallery"
263,6312,indoor,"museum/indoor, natural_history_museum, science_museum, art_gallery, discotheque"
264,6336,indoor,"museum/indoor, science_museum, natural_history_museum, discotheque, art_gallery"
265,6360,indoor,"science_museum, museum/indoor, shower, natural_history_museum, discotheque"
266,6384,indoor,"shower, museum/indoor, discotheque, chemistry_lab, stage/indoor"
267,6408,indoor,"stage/indoor, museum/indoor, auditorium, church/indoor, discotheque"
268,6432,indoor,"stage/indoor, discotheque, museum/indoor, archive, ballroom"
269,6456,indoor,"discotheque, stage/indoor, ballroom, museum/indoor, auditorium"
270,6480,indoor,"discotheque, stage/indoor, ballroom, nursery, museum/indoor"
271,6504,indoor,"discotheque, stage/indoor, ballroom, banquet_hall, auditorium"
272,6528,indoor,"discotheque, stage/indoor, banquet_hall, ballroom, nursery"
273,6552,indoor,"discotheque, stage/indoor, banquet_hall, ballroom, auditorium"
274,6576,indoor,"discotheque, stage/indoor, chemistry_lab, banquet_hall, ballroom"
275,6600,indoor,"chemistry_lab, banquet_hall, dining_hall, bar, library/indoor"
276,6624,indoor,"bar, stage/indoor, chemistry_lab, museum/indoor, ballroom"
277,6648,indoor,"chemistry_lab, museum/indoor, clean_room, bar, beauty_salon"
278,6672,indoor,"clean_room, museum/indoor, chemistry_lab, alcove, shower"
279,6696,indoor,"clean_room, archive, nursery, dressing_room, locker_room"
280,6720,indoor,"locker_room, clean_room, archive, dressing_room, nursery"
281,6744,indoor,"archive, clean_room, nursery, locker_room, classroom"
282,6768,indoor,"basement, nursery, attic, discotheque, archive"
283,6792,indoor,"ice_shelf, bow_window/indoor, natural_history_museum, aquarium, nursery"
284,6816,indoor,"nursery, locker_room, shower, bar, clean_room"
285,6840,indoor,"nursery, kindergarden_classroom, classroom, childs_room, schoolhouse"
286,6864,indoor,"nursery, childs_room, archive, museum/indoor, kindergarden_classroom"
287,6888,indoor,"natural_history_museum, museum/indoor, ice_floe, science_museum, igloo"
288,6912,indoor,"museum/indoor, clean_room, dressing_room, art_gallery, nursery"
289,6936,indoor,"museum/indoor, archive, clean_room, art_gallery, classroom"
290,6960,indoor,"museum/indoor, archive, locker_room, dressing_room, burial_chamber"
291,6984,indoor,"museum/indoor, archive, mausoleum, nursery, burial_chamber"
292,7008,indoor,"science_museum, physics_laboratory, museum/indoor, chemistry_lab, engine_room"
293,7032,indoor,"chemistry_lab, clean_room, shower, discotheque, biology_laboratory"
294,7056,indoor,"museum/indoor, archive, clean_room, sauna, shower"
295,7080,indoor,"museum/indoor, clean_room, archive, science_museum, art_gallery"
296,7104,indoor,"museum/indoor, clean_room, archive, art_gallery, science_museum"
297,7128,indoor,"museum/indoor, clean_room, archive, art_gallery, science_museum"
298,7152,indoor,"shoe_shop, basement, archive, shower, bathroom"
299,7176,indoor,"locker_room, archive, shoe_shop, natural_history_museum, clean_room"
300,7200,indoor,"staircase, basement, natural_history_museum, shower, chemistry_lab"
301,7224,outdoor,"crosswalk, cemetery, attic, igloo, desert/sand"
302,7248,indoor,"crosswalk, clean_room, natural_history_museum, science_museum, museum/indoor"
303,7272,indoor,"basement, staircase, server_room, archive, clean_room"
304,7296,indoor,"archive, classroom, basement, crosswalk, lecture_room"
305,7320,indoor,"staircase, clean_room, attic, basement, airplane_cabin"
306,7344,indoor,"clean_room, staircase, chemistry_lab, biology_laboratory, science_museum"
307,7368,indoor,"clean_room, natural_history_museum, music_studio, science_museum, nursery"
308,7392,indoor,"clean_room, natural_history_museum, museum/indoor, boat_deck, lake/natural"
309,7416,indoor,"clothing_store, hospital_room, clean_room, dressing_room, museum/indoor"
310,7440,indoor,"museum/indoor, clean_room, shower, clothing_store, beauty_salon"
311,7464,indoor,"museum/indoor, beauty_salon, clothing_store, elevator/door, booth/indoor"
312,7488,indoor,"museum/indoor, clothing_store, beauty_salon, booth/indoor, elevator/door"
313,7512,indoor,"museum/indoor, clothing_store, beauty_salon, booth/indoor, elevator/door"
314,7536,indoor,"museum/indoor, clothing_store, beauty_salon, booth/indoor, conference_center"
315,7560,indoor,"museum/indoor, clothing_store, beauty_salon, booth/indoor, conference_center"
316,7584,indoor,"museum/indoor, clothing_store, elevator/door, beauty_salon, elevator_lobby"
317,7608,indoor,"museum/indoor, clothing_store, booth/indoor, beauty_salon, elevator/door"
318,7632,indoor,"clothing_store, museum/indoor, beauty_salon, booth/indoor, conference_center"
319,7656,indoor,"nursery, hospital, hospital_room, pharmacy, clothing_store"
