,frame_num,environment,places,title,year,imdb_id
0,0,outdoor,"hot_spring, pond, field/wild, marsh, lake/natural",The Red Menace,1949,41791
1,24,outdoor,"kindergarden_classroom, pond, classroom, rice_paddy, lake/natural",The Red Menace,1949,41791
2,48,outdoor,"cemetery, motel, drugstore, pharmacy, gas_station",The Red Menace,1949,41791
3,72,outdoor,"motel, gas_station, cemetery, sky, drugstore",The Red Menace,1949,41791
4,96,outdoor,"motel, gas_station, sky, bowling_alley, pharmacy",The Red Menace,1949,41791
5,120,outdoor,"motel, gas_station, sky, bowling_alley, cemetery",The Red Menace,1949,41791
6,144,outdoor,"motel, gas_station, sky, bowling_alley, cemetery",The Red Menace,1949,41791
7,168,outdoor,"motel, gas_station, sky, bowling_alley, cemetery",The Red Menace,1949,41791
8,192,outdoor,"motel, gas_station, sky, bowling_alley, cemetery",The Red Menace,1949,41791
9,216,outdoor,"motel, sky, gas_station, bowling_alley, cemetery",The Red Menace,1949,41791
10,240,outdoor,"motel, sky, gas_station, bowling_alley, courthouse",The Red Menace,1949,41791
11,264,outdoor,"motel, sky, mosque/outdoor, cemetery, pharmacy",The Red Menace,1949,41791
12,288,indoor,"cemetery, hot_spring, discotheque, museum/indoor, classroom",The Red Menace,1949,41791
13,312,indoor,"classroom, kindergarden_classroom, nursery, locker_room, lecture_room",The Red Menace,1949,41791
14,336,indoor,"elevator/door, hospital, pharmacy, elevator_lobby, reception",The Red Menace,1949,41791
15,360,indoor,"pharmacy, hospital, drugstore, beauty_salon, elevator/door",The Red Menace,1949,41791
16,384,indoor,"pharmacy, drugstore, iceberg, beauty_salon, hospital",The Red Menace,1949,41791
17,408,outdoor,"iceberg, pharmacy, ice_shelf, ice_floe, drugstore",The Red Menace,1949,41791
18,432,outdoor,"pharmacy, iceberg, ice_shelf, drugstore, igloo",The Red Menace,1949,41791
19,456,outdoor,"pharmacy, iceberg, ice_floe, ice_shelf, hospital",The Red Menace,1949,41791
20,480,indoor,"pharmacy, clean_room, drugstore, beauty_salon, chemistry_lab",The Red Menace,1949,41791
21,504,outdoor,"florist_shop/indoor, botanical_garden, ice_floe, vegetable_garden, iceberg",The Red Menace,1949,41791
22,528,outdoor,"florist_shop/indoor, botanical_garden, field/wild, vegetable_garden, ice_floe",The Red Menace,1949,41791
23,552,indoor,"florist_shop/indoor, nursery, gift_shop, museum/indoor, drugstore",The Red Menace,1949,41791
24,576,indoor,"nursery, museum/indoor, natural_history_museum, florist_shop/indoor, childs_room",The Red Menace,1949,41791
25,600,indoor,"nursery, museum/indoor, florist_shop/indoor, natural_history_museum, coffee_shop",The Red Menace,1949,41791
26,624,indoor,"nursery, museum/indoor, florist_shop/indoor, natural_history_museum, coffee_shop",The Red Menace,1949,41791
27,648,indoor,"nursery, museum/indoor, florist_shop/indoor, natural_history_museum, coffee_shop",The Red Menace,1949,41791
28,672,indoor,"drugstore, pharmacy, beauty_salon, museum/indoor, ice_cream_parlor",The Red Menace,1949,41791
29,696,indoor,"museum/indoor, drugstore, science_museum, pharmacy, cemetery",The Red Menace,1949,41791
30,720,indoor,"museum/indoor, science_museum, cemetery, drugstore, archive",The Red Menace,1949,41791
31,744,indoor,"museum/indoor, science_museum, cemetery, drugstore, pharmacy",The Red Menace,1949,41791
32,768,indoor,"museum/indoor, science_museum, cemetery, drugstore, archive",The Red Menace,1949,41791
33,792,indoor,"museum/indoor, science_museum, cemetery, drugstore, pharmacy",The Red Menace,1949,41791
34,816,indoor,"museum/indoor, science_museum, cemetery, drugstore, pharmacy",The Red Menace,1949,41791
35,840,indoor,"museum/indoor, science_museum, cemetery, drugstore, archive",The Red Menace,1949,41791
36,864,indoor,"museum/indoor, science_museum, drugstore, cemetery, pharmacy",The Red Menace,1949,41791
37,888,indoor,"museum/indoor, science_museum, drugstore, cemetery, pharmacy",The Red Menace,1949,41791
38,912,indoor,"museum/indoor, science_museum, drugstore, cemetery, archive",The Red Menace,1949,41791
39,936,indoor,"museum/indoor, science_museum, drugstore, cemetery, pharmacy",The Red Menace,1949,41791
40,960,indoor,"museum/indoor, science_museum, cemetery, drugstore, archive",The Red Menace,1949,41791
41,984,indoor,"museum/indoor, science_museum, drugstore, cemetery, pharmacy",The Red Menace,1949,41791
42,1008,indoor,"museum/indoor, science_museum, cemetery, drugstore, pharmacy",The Red Menace,1949,41791
43,1032,indoor,"museum/indoor, science_museum, cemetery, drugstore, pharmacy",The Red Menace,1949,41791
44,1056,indoor,"museum/indoor, science_museum, archive, natural_history_museum, cemetery",The Red Menace,1949,41791
45,1080,indoor,"museum/indoor, science_museum, booth/indoor, natural_history_museum, cemetery",The Red Menace,1949,41791
46,1104,indoor,"booth/indoor, drugstore, ice_cream_parlor, museum/indoor, science_museum",The Red Menace,1949,41791
47,1128,indoor,"drugstore, booth/indoor, ice_cream_parlor, museum/indoor, science_museum",The Red Menace,1949,41791
48,1152,indoor,"booth/indoor, drugstore, ice_cream_parlor, museum/indoor, science_museum",The Red Menace,1949,41791
49,1176,indoor,"drugstore, booth/indoor, ice_cream_parlor, pharmacy, museum/indoor",The Red Menace,1949,41791
50,1200,indoor,"drugstore, booth/indoor, ice_cream_parlor, museum/indoor, pharmacy",The Red Menace,1949,41791
51,1224,indoor,"drugstore, booth/indoor, ice_cream_parlor, pharmacy, museum/indoor",The Red Menace,1949,41791
52,1248,indoor,"booth/indoor, drugstore, ice_cream_parlor, museum/indoor, pharmacy",The Red Menace,1949,41791
53,1272,indoor,"drugstore, booth/indoor, ice_cream_parlor, museum/indoor, pharmacy",The Red Menace,1949,41791
54,1296,indoor,"drugstore, booth/indoor, ice_cream_parlor, museum/indoor, pharmacy",The Red Menace,1949,41791
55,1320,indoor,"drugstore, booth/indoor, museum/indoor, pharmacy, science_museum",The Red Menace,1949,41791
56,1344,indoor,"museum/indoor, science_museum, booth/indoor, natural_history_museum, cemetery",The Red Menace,1949,41791
57,1368,indoor,"drugstore, pharmacy, beauty_salon, bakery/shop, gift_shop",The Red Menace,1949,41791
58,1392,indoor,"drugstore, pharmacy, beauty_salon, bakery/shop, gift_shop",The Red Menace,1949,41791
59,1416,indoor,"drugstore, pharmacy, beauty_salon, bakery/shop, gift_shop",The Red Menace,1949,41791
60,1440,indoor,"drugstore, pharmacy, beauty_salon, bakery/shop, gift_shop",The Red Menace,1949,41791
61,1464,indoor,"drugstore, pharmacy, beauty_salon, bakery/shop, gift_shop",The Red Menace,1949,41791
62,1488,indoor,"museum/indoor, pharmacy, booth/indoor, science_museum, drugstore",The Red Menace,1949,41791
63,1512,indoor,"museum/indoor, science_museum, booth/indoor, natural_history_museum, cemetery",The Red Menace,1949,41791
64,1536,indoor,"museum/indoor, science_museum, booth/indoor, drugstore, natural_history_museum",The Red Menace,1949,41791
65,1560,indoor,"museum/indoor, science_museum, booth/indoor, drugstore, natural_history_museum",The Red Menace,1949,41791
66,1584,indoor,"museum/indoor, science_museum, booth/indoor, drugstore, natural_history_museum",The Red Menace,1949,41791
67,1608,indoor,"museum/indoor, booth/indoor, science_museum, drugstore, natural_history_museum",The Red Menace,1949,41791
68,1632,indoor,"museum/indoor, science_museum, booth/indoor, drugstore, natural_history_museum",The Red Menace,1949,41791
69,1656,indoor,"museum/indoor, science_museum, booth/indoor, drugstore, natural_history_museum",The Red Menace,1949,41791
70,1680,indoor,"museum/indoor, science_museum, booth/indoor, drugstore, natural_history_museum",The Red Menace,1949,41791
71,1704,indoor,"museum/indoor, booth/indoor, science_museum, drugstore, natural_history_museum",The Red Menace,1949,41791
72,1728,indoor,"museum/indoor, booth/indoor, science_museum, drugstore, natural_history_museum",The Red Menace,1949,41791
73,1752,indoor,"museum/indoor, science_museum, booth/indoor, drugstore, natural_history_museum",The Red Menace,1949,41791
74,1776,indoor,"museum/indoor, booth/indoor, science_museum, drugstore, natural_history_museum",The Red Menace,1949,41791
75,1800,indoor,"museum/indoor, science_museum, booth/indoor, drugstore, natural_history_museum",The Red Menace,1949,41791
76,1824,indoor,"museum/indoor, science_museum, booth/indoor, drugstore, natural_history_museum",The Red Menace,1949,41791
77,1848,indoor,"booth/indoor, museum/indoor, drugstore, science_museum, natural_history_museum",The Red Menace,1949,41791
78,1872,indoor,"drugstore, pharmacy, museum/indoor, ice_cream_parlor, archive",The Red Menace,1949,41791
79,1896,indoor,"beauty_salon, drugstore, pharmacy, chemistry_lab, candy_store",The Red Menace,1949,41791
80,1920,indoor,"beauty_salon, drugstore, chemistry_lab, pharmacy, candy_store",The Red Menace,1949,41791
81,1944,indoor,"beauty_salon, drugstore, pharmacy, chemistry_lab, candy_store",The Red Menace,1949,41791
82,1968,indoor,"beauty_salon, drugstore, pharmacy, ice_cream_parlor, candy_store",The Red Menace,1949,41791
83,1992,indoor,"beauty_salon, drugstore, pharmacy, chemistry_lab, candy_store",The Red Menace,1949,41791
84,2016,indoor,"beauty_salon, drugstore, pharmacy, chemistry_lab, candy_store",The Red Menace,1949,41791
85,2040,indoor,"beauty_salon, drugstore, pharmacy, chemistry_lab, gift_shop",The Red Menace,1949,41791
86,2064,indoor,"hospital, pharmacy, beauty_salon, drugstore, hot_spring",The Red Menace,1949,41791
87,2088,indoor,"kindergarden_classroom, nursery, classroom, playroom, lecture_room",The Red Menace,1949,41791
88,2112,indoor,"kindergarden_classroom, classroom, playroom, nursery, discotheque",The Red Menace,1949,41791
89,2136,indoor,"aquarium, discotheque, airport_terminal, swimming_pool/indoor, shower",The Red Menace,1949,41791
90,2160,outdoor,"iceberg, aquarium, pond, ice_floe, lake/natural",The Red Menace,1949,41791
91,2184,outdoor,"aquarium, iceberg, swimming_pool/indoor, pond, underwater/ocean_deep",The Red Menace,1949,41791
92,2208,outdoor,"aquarium, iceberg, pond, ice_floe, lake/natural",The Red Menace,1949,41791
93,2232,outdoor,"pond, aquarium, lake/natural, fishpond, hot_spring",The Red Menace,1949,41791
94,2256,indoor,"aquarium, discotheque, underwater/ocean_deep, pond, swimming_pool/indoor",The Red Menace,1949,41791
95,2280,indoor,"clean_room, locker_room, bathroom, airport_terminal, shower",The Red Menace,1949,41791
96,2304,indoor,"swimming_pool/indoor, aquarium, bathroom, shower, jacuzzi/indoor",The Red Menace,1949,41791
97,2328,outdoor,"aquarium, pond, iceberg, fishpond, lake/natural",The Red Menace,1949,41791
98,2352,indoor,"clean_room, classroom, lecture_room, operating_room, office_cubicles",The Red Menace,1949,41791
99,2376,indoor,"clean_room, aquarium, chemistry_lab, biology_laboratory, discotheque",The Red Menace,1949,41791
100,2400,indoor,"clean_room, discotheque, aquarium, field/wild, chemistry_lab",The Red Menace,1949,41791
101,2424,indoor,"aquarium, discotheque, clean_room, chemistry_lab, natural_history_museum",The Red Menace,1949,41791
102,2448,indoor,"discotheque, aquarium, natural_history_museum, fishpond, pond",The Red Menace,1949,41791
103,2472,indoor,"aquarium, underwater/ocean_deep, pond, discotheque, natural_history_museum",The Red Menace,1949,41791
104,2496,indoor,"discotheque, pond, field/wild, clean_room, aquarium",The Red Menace,1949,41791
105,2520,indoor,"natural_history_museum, aquarium, discotheque, clean_room, field/wild",The Red Menace,1949,41791
106,2544,indoor,"discotheque, aquarium, pond, nursery, fishpond",The Red Menace,1949,41791
107,2568,outdoor,"aquarium, discotheque, pond, hot_spring, underwater/ocean_deep",The Red Menace,1949,41791
108,2592,indoor,"clean_room, aquarium, natural_history_museum, chemistry_lab, discotheque",The Red Menace,1949,41791
109,2616,outdoor,"pond, aquarium, fishpond, lake/natural, field/wild",The Red Menace,1949,41791
110,2640,indoor,"aquarium, pond, fishpond, discotheque, kindergarden_classroom",The Red Menace,1949,41791
111,2664,outdoor,"pond, aquarium, fishpond, lake/natural, field/wild",The Red Menace,1949,41791
112,2688,outdoor,"fishpond, aquarium, pond, lake/natural, natural_history_museum",The Red Menace,1949,41791
113,2712,outdoor,"pond, fishpond, aquarium, lake/natural, chemistry_lab",The Red Menace,1949,41791
114,2736,outdoor,"pond, aquarium, fishpond, discotheque, lake/natural",The Red Menace,1949,41791
115,2760,outdoor,"aquarium, fishpond, pond, lake/natural, field/wild",The Red Menace,1949,41791
116,2784,outdoor,"pond, aquarium, fishpond, natural_history_museum, lake/natural",The Red Menace,1949,41791
117,2808,outdoor,"aquarium, fishpond, pond, discotheque, lake/natural",The Red Menace,1949,41791
118,2832,outdoor,"aquarium, fishpond, pond, discotheque, lake/natural",The Red Menace,1949,41791
119,2856,outdoor,"aquarium, discotheque, pond, fishpond, iceberg",The Red Menace,1949,41791
120,2880,outdoor,"aquarium, pond, fishpond, lake/natural, field/wild",The Red Menace,1949,41791
121,2904,outdoor,"aquarium, discotheque, pond, underwater/ocean_deep, fishpond",The Red Menace,1949,41791
122,2928,outdoor,"discotheque, golf_course, pond, aquarium, soccer_field",The Red Menace,1949,41791
123,2952,outdoor,"aquarium, pond, fishpond, natural_history_museum, lake/natural",The Red Menace,1949,41791
124,2976,outdoor,"aquarium, pond, lake/natural, fishpond, natural_history_museum",The Red Menace,1949,41791
125,3000,outdoor,"aquarium, fishpond, pond, lake/natural, discotheque",The Red Menace,1949,41791
126,3024,outdoor,"aquarium, natural_history_museum, pond, lake/natural, fishpond",The Red Menace,1949,41791
127,3048,outdoor,"discotheque, aquarium, pond, fountain, lake/natural",The Red Menace,1949,41791
128,3072,outdoor,"aquarium, pond, lake/natural, field/wild, fishpond",The Red Menace,1949,41791
129,3096,outdoor,"aquarium, pond, underwater/ocean_deep, lake/natural, fishpond",The Red Menace,1949,41791
130,3120,indoor,"aquarium, discotheque, pond, lake/natural, clean_room",The Red Menace,1949,41791
131,3144,outdoor,"aquarium, pond, lake/natural, fishpond, marsh",The Red Menace,1949,41791
132,3168,indoor,"clean_room, classroom, discotheque, lecture_room, kindergarden_classroom",The Red Menace,1949,41791
133,3192,outdoor,"pond, aquarium, discotheque, lake/natural, marsh",The Red Menace,1949,41791
134,3216,outdoor,"aquarium, pond, lake/natural, iceberg, fishpond",The Red Menace,1949,41791
135,3240,indoor,"discotheque, aquarium, pond, fishpond, stage/indoor",The Red Menace,1949,41791
136,3264,indoor,"discotheque, music_studio, chemistry_lab, classroom, kindergarden_classroom",The Red Menace,1949,41791
137,3288,indoor,"discotheque, music_studio, classroom, science_museum, kindergarden_classroom",The Red Menace,1949,41791
138,3312,indoor,"discotheque, kindergarden_classroom, music_studio, classroom, science_museum",The Red Menace,1949,41791
139,3336,indoor,"kindergarden_classroom, classroom, discotheque, chemistry_lab, biology_laboratory",The Red Menace,1949,41791
140,3360,indoor,"discotheque, music_studio, classroom, baseball_field, kindergarden_classroom",The Red Menace,1949,41791
141,3384,indoor,"baseball_field, discotheque, kindergarden_classroom, golf_course, classroom",The Red Menace,1949,41791
142,3408,indoor,"discotheque, music_studio, classroom, science_museum, natural_history_museum",The Red Menace,1949,41791
143,3432,indoor,"baseball_field, discotheque, kindergarden_classroom, subway_station/platform, science_museum",The Red Menace,1949,41791
144,3456,indoor,"discotheque, classroom, science_museum, kindergarden_classroom, natural_history_museum",The Red Menace,1949,41791
145,3480,outdoor,"soccer_field, discotheque, baseball_field, stadium/football, field/wild",The Red Menace,1949,41791
146,3504,indoor,"discotheque, stage/indoor, music_studio, kindergarden_classroom, baseball_field",The Red Menace,1949,41791
147,3528,outdoor,"parking_garage/indoor, parking_lot, harbor, shower, runway",The Red Menace,1949,41791
148,3552,indoor,"shower, bathroom, jail_cell, basement, hot_spring",The Red Menace,1949,41791
149,3576,indoor,"attic, basement, oilrig, shower, jail_cell",The Red Menace,1949,41791
150,3600,indoor,"attic, corridor, basement, clean_room, mezzanine",The Red Menace,1949,41791
151,3624,indoor,"corridor, basement, shower, clean_room, elevator_lobby",The Red Menace,1949,41791
152,3648,indoor,"corridor, basement, lighthouse, jail_cell, wave",The Red Menace,1949,41791
153,3672,outdoor,"wave, hot_spring, ocean, beach, lake/natural",The Red Menace,1949,41791
154,3696,indoor,"clean_room, locker_room, archive, server_room, entrance_hall",The Red Menace,1949,41791
155,3720,indoor,"clean_room, server_room, locker_room, archive, bank_vault",The Red Menace,1949,41791
156,3744,indoor,"clean_room, archive, locker_room, server_room, library/indoor",The Red Menace,1949,41791
157,3768,indoor,"clean_room, archive, locker_room, chemistry_lab, dressing_room",The Red Menace,1949,41791
158,3792,indoor,"clean_room, library/indoor, archive, dining_room, locker_room",The Red Menace,1949,41791
159,3816,indoor,"clean_room, archive, chemistry_lab, library/indoor, biology_laboratory",The Red Menace,1949,41791
160,3840,indoor,"clean_room, chemistry_lab, archive, beauty_salon, biology_laboratory",The Red Menace,1949,41791
161,3864,indoor,"chemistry_lab, biology_laboratory, clean_room, bathroom, shower",The Red Menace,1949,41791
162,3888,indoor,"clean_room, biology_laboratory, chemistry_lab, operating_room, bathroom",The Red Menace,1949,41791
163,3912,indoor,"clean_room, biology_laboratory, chemistry_lab, operating_room, science_museum",The Red Menace,1949,41791
164,3936,indoor,"clean_room, biology_laboratory, chemistry_lab, science_museum, operating_room",The Red Menace,1949,41791
165,3960,indoor,"clean_room, biology_laboratory, chemistry_lab, operating_room, science_museum",The Red Menace,1949,41791
166,3984,indoor,"natural_history_museum, airplane_cabin, clean_room, biology_laboratory, laundromat",The Red Menace,1949,41791
167,4008,indoor,"natural_history_museum, bathroom, airplane_cabin, shower, clean_room",The Red Menace,1949,41791
168,4032,outdoor,"iceberg, lake/natural, pond, ice_floe, marsh",The Red Menace,1949,41791
169,4056,indoor,"natural_history_museum, discotheque, shower, aquarium, science_museum",The Red Menace,1949,41791
170,4080,outdoor,"natural_history_museum, pond, lake/natural, discotheque, hot_spring",The Red Menace,1949,41791
171,4104,indoor,"discotheque, shower, natural_history_museum, pond, operating_room",The Red Menace,1949,41791
172,4128,indoor,"discotheque, shower, pond, natural_history_museum, bathroom",The Red Menace,1949,41791
173,4152,indoor,"natural_history_museum, shower, discotheque, science_museum, museum/indoor",The Red Menace,1949,41791
174,4176,indoor,"natural_history_museum, discotheque, shower, science_museum, pond",The Red Menace,1949,41791
175,4200,indoor,"natural_history_museum, discotheque, shower, science_museum, pond",The Red Menace,1949,41791
176,4224,indoor,"discotheque, shower, clean_room, chemistry_lab, pond",The Red Menace,1949,41791
177,4248,outdoor,"pond, natural_history_museum, lake/natural, iceberg, discotheque",The Red Menace,1949,41791
178,4272,outdoor,"natural_history_museum, pond, lake/natural, science_museum, iceberg",The Red Menace,1949,41791
179,4296,indoor,"natural_history_museum, discotheque, pond, museum/indoor, science_museum",The Red Menace,1949,41791
180,4320,indoor,"natural_history_museum, science_museum, museum/indoor, airplane_cabin, chemistry_lab",The Red Menace,1949,41791
181,4344,indoor,"natural_history_museum, iceberg, chemistry_lab, clean_room, bowling_alley",The Red Menace,1949,41791
182,4368,indoor,"chemistry_lab, bowling_alley, discotheque, biology_laboratory, natural_history_museum",The Red Menace,1949,41791
183,4392,indoor,"airplane_cabin, bowling_alley, discotheque, chemistry_lab, clean_room",The Red Menace,1949,41791
184,4416,indoor,"shower, natural_history_museum, pond, discotheque, hot_spring",The Red Menace,1949,41791
185,4440,indoor,"natural_history_museum, shower, discotheque, pond, science_museum",The Red Menace,1949,41791
186,4464,indoor,"natural_history_museum, shower, discotheque, pond, science_museum",The Red Menace,1949,41791
187,4488,indoor,"natural_history_museum, shower, discotheque, museum/indoor, pond",The Red Menace,1949,41791
188,4512,indoor,"natural_history_museum, shower, museum/indoor, science_museum, discotheque",The Red Menace,1949,41791
189,4536,indoor,"natural_history_museum, museum/indoor, iceberg, science_museum, aquarium",The Red Menace,1949,41791
190,4560,indoor,"natural_history_museum, museum/indoor, science_museum, art_gallery, ice_cream_parlor",The Red Menace,1949,41791
191,4584,indoor,"aquarium, swimming_pool/indoor, ice_floe, airplane_cabin, cockpit",The Red Menace,1949,41791
192,4608,indoor,"aquarium, swimming_pool/indoor, discotheque, science_museum, natural_history_museum",The Red Menace,1949,41791
193,4632,indoor,"aquarium, swimming_pool/indoor, discotheque, natural_history_museum, science_museum",The Red Menace,1949,41791
194,4656,indoor,"aquarium, airplane_cabin, science_museum, natural_history_museum, discotheque",The Red Menace,1949,41791
195,4680,indoor,"aquarium, natural_history_museum, swimming_pool/indoor, science_museum, discotheque",The Red Menace,1949,41791
196,4704,indoor,"aquarium, swimming_pool/indoor, natural_history_museum, fishpond, science_museum",The Red Menace,1949,41791
197,4728,indoor,"aquarium, swimming_pool/indoor, fishpond, natural_history_museum, discotheque",The Red Menace,1949,41791
198,4752,indoor,"aquarium, swimming_pool/indoor, natural_history_museum, fishpond, ice_floe",The Red Menace,1949,41791
199,4776,indoor,"aquarium, natural_history_museum, science_museum, swimming_pool/indoor, airplane_cabin",The Red Menace,1949,41791
200,4800,indoor,"aquarium, swimming_pool/indoor, natural_history_museum, airplane_cabin, science_museum",The Red Menace,1949,41791
201,4824,indoor,"aquarium, airplane_cabin, natural_history_museum, science_museum, swimming_pool/indoor",The Red Menace,1949,41791
202,4848,indoor,"airplane_cabin, biology_laboratory, chemistry_lab, discotheque, natural_history_museum",The Red Menace,1949,41791
203,4872,indoor,"shower, clean_room, bathroom, dressing_room, discotheque",The Red Menace,1949,41791
204,4896,indoor,"biology_laboratory, chemistry_lab, bathroom, clean_room, shower",The Red Menace,1949,41791
205,4920,indoor,"biology_laboratory, clean_room, chemistry_lab, bathroom, shower",The Red Menace,1949,41791
206,4944,indoor,"biology_laboratory, chemistry_lab, clean_room, restaurant_kitchen, operating_room",The Red Menace,1949,41791
207,4968,indoor,"clean_room, biology_laboratory, chemistry_lab, restaurant_kitchen, operating_room",The Red Menace,1949,41791
208,4992,indoor,"clean_room, biology_laboratory, chemistry_lab, natural_history_museum, aquarium",The Red Menace,1949,41791
209,5016,indoor,"clean_room, biology_laboratory, chemistry_lab, bathroom, airplane_cabin",The Red Menace,1949,41791
210,5040,indoor,"clean_room, biology_laboratory, chemistry_lab, natural_history_museum, airplane_cabin",The Red Menace,1949,41791
211,5064,indoor,"clean_room, beauty_salon, natural_history_museum, jewelry_shop, office",The Red Menace,1949,41791
212,5088,indoor,"clean_room, nursery, dressing_room, archive, office",The Red Menace,1949,41791
213,5112,indoor,"clean_room, archive, office, office_cubicles, chemistry_lab",The Red Menace,1949,41791
214,5136,indoor,"clean_room, locker_room, elevator/door, biology_laboratory, office",The Red Menace,1949,41791
215,5160,indoor,"clean_room, locker_room, office, elevator/door, bathroom",The Red Menace,1949,41791
216,5184,indoor,"clean_room, locker_room, biology_laboratory, elevator/door, archive",The Red Menace,1949,41791
217,5208,indoor,"aquarium, swimming_pool/indoor, jacuzzi/indoor, discotheque, fountain",The Red Menace,1949,41791
218,5232,indoor,"aquarium, swimming_pool/indoor, natural_history_museum, jacuzzi/indoor, science_museum",The Red Menace,1949,41791
219,5256,indoor,"aquarium, swimming_pool/indoor, natural_history_museum, museum/indoor, science_museum",The Red Menace,1949,41791
220,5280,indoor,"aquarium, natural_history_museum, museum/indoor, science_museum, swimming_pool/indoor",The Red Menace,1949,41791
221,5304,indoor,"aquarium, natural_history_museum, science_museum, museum/indoor, airplane_cabin",The Red Menace,1949,41791
222,5328,indoor,"aquarium, natural_history_museum, science_museum, swimming_pool/indoor, airplane_cabin",The Red Menace,1949,41791
223,5352,indoor,"airplane_cabin, arch, shower, swimming_pool/indoor, aquarium",The Red Menace,1949,41791
224,5376,indoor,"clean_room, locker_room, elevator/door, office, office_cubicles",The Red Menace,1949,41791
225,5400,indoor,"clean_room, locker_room, archive, corridor, elevator/door",The Red Menace,1949,41791
226,5424,indoor,"clean_room, elevator/door, office, bathroom, chemistry_lab",The Red Menace,1949,41791
227,5448,indoor,"clean_room, airport_terminal, elevator/door, bank_vault, lobby",The Red Menace,1949,41791
228,5472,indoor,"clean_room, atrium/public, airport_terminal, office, archive",The Red Menace,1949,41791
229,5496,indoor,"clean_room, operating_room, atrium/public, elevator/door, natural_history_museum",The Red Menace,1949,41791
230,5520,indoor,"natural_history_museum, discotheque, aquarium, field/wild, pond",The Red Menace,1949,41791
231,5544,outdoor,"pond, lake/natural, marsh, hot_spring, aquarium",The Red Menace,1949,41791
232,5568,indoor,"natural_history_museum, aquarium, science_museum, field/wild, underwater/ocean_deep",The Red Menace,1949,41791
233,5592,outdoor,"field/wild, aquarium, natural_history_museum, marsh, pond",The Red Menace,1949,41791
234,5616,indoor,"discotheque, natural_history_museum, field/wild, science_museum, aquarium",The Red Menace,1949,41791
235,5640,indoor,"discotheque, chemistry_lab, biology_laboratory, music_studio, clean_room",The Red Menace,1949,41791
236,5664,outdoor,"discotheque, fishpond, pond, lake/natural, marsh",The Red Menace,1949,41791
