,frame_num,environment,places
5507,132168,indoor,"clean_room, banquet_hall, hospital_room, chemistry_lab, dining_hall"
5508,132192,indoor,"banquet_hall, dining_hall, clean_room, restaurant, dining_room"
5509,132216,indoor,"clean_room, banquet_hall, dining_hall, nursing_home, restaurant"
5510,132240,indoor,"banquet_hall, dining_hall, clean_room, restaurant, nursing_home"
5511,132264,indoor,"museum/indoor, dressing_room, stage/indoor, boxing_ring, sauna"
5512,132288,indoor,"dressing_room, museum/indoor, clean_room, archive, shower"
5513,132312,indoor,"dressing_room, bow_window/indoor, clean_room, bedroom, banquet_hall"
5514,132336,indoor,"bow_window/indoor, dressing_room, clean_room, banquet_hall, bedroom"
5515,132360,indoor,"bow_window/indoor, clean_room, dressing_room, jewelry_shop, office"
5516,132384,indoor,"bow_window/indoor, clean_room, dressing_room, jewelry_shop, banquet_hall"
5517,132408,indoor,"bow_window/indoor, dressing_room, clean_room, jewelry_shop, banquet_hall"
5518,132432,indoor,"clean_room, dressing_room, jewelry_shop, hospital_room, operating_room"
5519,132456,indoor,"dressing_room, clean_room, biology_laboratory, chemistry_lab, beauty_salon"
5520,132480,indoor,"biology_laboratory, clean_room, dressing_room, hospital_room, beauty_salon"
5521,132504,indoor,"dressing_room, clean_room, biology_laboratory, hospital_room, beauty_salon"
5522,132528,indoor,"clean_room, biology_laboratory, dressing_room, chemistry_lab, hospital_room"
5523,132552,indoor,"dressing_room, clean_room, hospital_room, operating_room, biology_laboratory"
5524,132576,indoor,"dressing_room, clean_room, hospital_room, biology_laboratory, operating_room"
5525,132600,indoor,"clean_room, hospital_room, biology_laboratory, dressing_room, operating_room"
5526,132624,indoor,"clean_room, hospital_room, biology_laboratory, dressing_room, operating_room"
5527,132648,indoor,"clean_room, dressing_room, hospital_room, biology_laboratory, operating_room"
5528,132672,indoor,"clean_room, hospital_room, dressing_room, biology_laboratory, operating_room"
5529,132696,indoor,"clean_room, hospital_room, dressing_room, operating_room, biology_laboratory"
5530,132720,indoor,"clean_room, biology_laboratory, hospital_room, dressing_room, operating_room"
5531,132744,indoor,"clean_room, hospital_room, biology_laboratory, operating_room, dressing_room"
5532,132768,indoor,"clean_room, dressing_room, biology_laboratory, hospital_room, nursing_home"
5533,132792,indoor,"dressing_room, biology_laboratory, clean_room, hospital_room, beauty_salon"
5534,132816,indoor,"biology_laboratory, dressing_room, clean_room, hospital_room, nursing_home"
5535,132840,indoor,"biology_laboratory, dressing_room, clean_room, hospital_room, nursing_home"
5536,132864,indoor,"dressing_room, nursery, classroom, restaurant, banquet_hall"
5537,132888,indoor,"dressing_room, classroom, nursery, lecture_room, archive"
5538,132912,indoor,"classroom, dressing_room, nursery, archive, lecture_room"
5539,132936,indoor,"dressing_room, classroom, nursery, archive, lecture_room"
5540,132960,indoor,"clean_room, nursing_home, dressing_room, chemistry_lab, banquet_hall"
5541,132984,indoor,"nursing_home, clean_room, dressing_room, operating_room, chemistry_lab"
5542,133008,indoor,"clean_room, nursing_home, dressing_room, operating_room, chemistry_lab"
5543,133032,indoor,"clean_room, nursing_home, dressing_room, chemistry_lab, operating_room"
5544,133056,indoor,"dressing_room, classroom, nursery, archive, lecture_room"
5545,133080,indoor,"nursery, classroom, dressing_room, archive, bow_window/indoor"
5546,133104,indoor,"nursing_home, clean_room, dressing_room, chemistry_lab, operating_room"
5547,133128,indoor,"nursing_home, clean_room, chemistry_lab, operating_room, dressing_room"
5548,133152,indoor,"clean_room, nursing_home, chemistry_lab, biology_laboratory, operating_room"
5549,133176,indoor,"dressing_room, chemistry_lab, classroom, hospital_room, bedroom"
5550,133200,indoor,"dressing_room, chemistry_lab, hospital_room, classroom, bedroom"
5551,133224,indoor,"dressing_room, chemistry_lab, classroom, hospital_room, archive"
5552,133248,indoor,"dressing_room, chemistry_lab, classroom, hospital_room, archive"
5553,133272,indoor,"dressing_room, chemistry_lab, classroom, hospital_room, bedroom"
5554,133296,indoor,"clean_room, dressing_room, hospital_room, operating_room, nursing_home"
5555,133320,indoor,"clean_room, dressing_room, hospital_room, beauty_salon, nursing_home"
5556,133344,indoor,"clean_room, dressing_room, beauty_salon, hospital_room, nursing_home"
5557,133368,indoor,"clean_room, dressing_room, ice_floe, ice_shelf, beauty_salon"
5558,133392,indoor,"clean_room, dressing_room, hospital_room, archive, nursing_home"
5559,133416,indoor,"dressing_room, bar, restaurant, chemistry_lab, pub/indoor"
5560,133440,indoor,"dressing_room, restaurant, bar, chemistry_lab, dining_room"
5561,133464,indoor,"dressing_room, clean_room, hospital_room, music_studio, bedroom"
5562,133488,indoor,"dressing_room, discotheque, clean_room, stage/indoor, hospital_room"
5563,133512,indoor,"ice_cream_parlor, dressing_room, clean_room, beauty_salon, chemistry_lab"
5564,133536,indoor,"dressing_room, beauty_salon, ice_cream_parlor, clean_room, hospital_room"
5565,133560,indoor,"dressing_room, clean_room, beauty_salon, ice_cream_parlor, hospital_room"
5566,133584,indoor,"clean_room, dressing_room, hospital_room, beauty_salon, office_cubicles"
5567,133608,indoor,"clean_room, museum/indoor, iceberg, ice_floe, art_gallery"
5568,133632,outdoor,"iceberg, clean_room, ice_floe, museum/indoor, ice_shelf"
5569,133656,outdoor,"iceberg, clean_room, ice_floe, museum/indoor, ice_shelf"
5570,133680,indoor,"museum/indoor, clean_room, dressing_room, ice_floe, iceberg"
5571,133704,outdoor,"clean_room, ice_floe, iceberg, museum/indoor, ice_shelf"
5572,133728,outdoor,"clean_room, iceberg, ice_floe, museum/indoor, ice_shelf"
5573,133752,indoor,"clean_room, ice_floe, iceberg, hospital_room, nursery"
5574,133776,indoor,"clean_room, dressing_room, nursing_home, discotheque, museum/indoor"
5575,133800,indoor,"clean_room, operating_room, hospital_room, dressing_room, nursing_home"
5576,133824,indoor,"clean_room, operating_room, hospital_room, dressing_room, nursing_home"
5577,133848,indoor,"clean_room, dressing_room, hospital_room, operating_room, nursing_home"
5578,133872,indoor,"clean_room, dressing_room, hospital_room, chemistry_lab, biology_laboratory"
5579,133896,indoor,"clean_room, dressing_room, chemistry_lab, hospital_room, biology_laboratory"
5580,133920,indoor,"clean_room, dressing_room, hospital_room, operating_room, nursery"
5581,133944,indoor,"dressing_room, hospital_room, bedroom, hotel_room, clean_room"
5582,133968,indoor,"hospital_room, coffee_shop, ice_cream_parlor, beauty_salon, bakery/shop"
5583,133992,indoor,"clean_room, hospital_room, operating_room, beauty_salon, biology_laboratory"
5584,134016,indoor,"living_room, dressing_room, clean_room, bow_window/indoor, bedroom"
5585,134040,indoor,"clean_room, dressing_room, nursery, hospital_room, archive"
5586,134064,indoor,"dressing_room, clean_room, museum/indoor, art_studio, clothing_store"
5587,134088,indoor,"clean_room, dressing_room, clothing_store, museum/indoor, locker_room"
5588,134112,indoor,"clean_room, dressing_room, museum/indoor, locker_room, shower"
5589,134136,indoor,"clean_room, museum/indoor, dressing_room, clothing_store, archive"
5590,134160,indoor,"clean_room, dressing_room, shower, museum/indoor, locker_room"
5591,134184,indoor,"clean_room, dressing_room, operating_room, locker_room, hospital_room"
5592,134208,indoor,"clean_room, dressing_room, clothing_store, locker_room, museum/indoor"
5593,134232,indoor,"clean_room, dressing_room, hospital_room, operating_room, beauty_salon"
5594,134256,indoor,"clean_room, operating_room, museum/indoor, hospital_room, dressing_room"
5595,134280,indoor,"clean_room, operating_room, hospital_room, physics_laboratory, chemistry_lab"
5596,134304,indoor,"clean_room, operating_room, museum/indoor, hospital_room, dressing_room"
5597,134328,indoor,"clean_room, operating_room, hospital_room, archive, chemistry_lab"
5598,134352,indoor,"clean_room, operating_room, dressing_room, hospital_room, archive"
5599,134376,indoor,"clean_room, operating_room, locker_room, dressing_room, physics_laboratory"
5600,134400,indoor,"clean_room, dressing_room, operating_room, art_gallery, museum/indoor"
5601,134424,indoor,"clean_room, museum/indoor, art_gallery, dressing_room, operating_room"
5602,134448,indoor,"clean_room, staircase, airplane_cabin, hospital_room, atrium/public"
5603,134472,indoor,"atrium/public, clean_room, shopping_mall/indoor, artists_loft, mezzanine"
5604,134496,indoor,"clean_room, dressing_room, locker_room, music_studio, physics_laboratory"
5605,134520,indoor,"clean_room, locker_room, dressing_room, jail_cell, stage/indoor"
5606,134544,indoor,"clean_room, dressing_room, physics_laboratory, chemistry_lab, office"
5607,134568,indoor,"museum/indoor, dressing_room, art_gallery, clean_room, bow_window/indoor"
5608,134592,indoor,"clean_room, dressing_room, laundromat, nursery, closet"
5609,134616,indoor,"clean_room, jewelry_shop, museum/indoor, clothing_store, archive"
5610,134640,indoor,"shower, locker_room, archive, bow_window/indoor, dressing_room"
5611,134664,indoor,"clean_room, chemistry_lab, dressing_room, bow_window/indoor, locker_room"
5612,134688,indoor,"locker_room, dressing_room, clean_room, chemistry_lab, archive"
5613,134712,indoor,"chemistry_lab, locker_room, dressing_room, archive, bar"
5614,134736,indoor,"clean_room, dressing_room, bow_window/indoor, archive, chemistry_lab"
5615,134760,indoor,"archive, clean_room, chemistry_lab, dressing_room, ballroom"
5616,134784,indoor,"dressing_room, clean_room, archive, shower, museum/indoor"
5617,134808,indoor,"clean_room, archive, chemistry_lab, dressing_room, hospital_room"
5618,134832,indoor,"clean_room, archive, dressing_room, chemistry_lab, office"
5619,134856,indoor,"banquet_hall, chemistry_lab, dining_hall, ballroom, dressing_room"
5620,134880,indoor,"chemistry_lab, banquet_hall, clean_room, church/indoor, archive"
5621,134904,indoor,"clean_room, locker_room, nursery, dressing_room, archive"
5622,134928,indoor,"clean_room, locker_room, nursery, dressing_room, archive"
5623,134952,indoor,"clean_room, locker_room, nursery, dressing_room, archive"
5624,134976,indoor,"clean_room, nursery, locker_room, dressing_room, closet"
5625,135000,indoor,"clean_room, nursery, locker_room, dressing_room, archive"
5626,135024,indoor,"clean_room, nursery, locker_room, dressing_room, closet"
5627,135048,indoor,"clean_room, locker_room, nursery, dressing_room, closet"
5628,135072,indoor,"clean_room, nursery, locker_room, dressing_room, closet"
5629,135096,indoor,"clean_room, dressing_room, shower, nursery, museum/indoor"
5630,135120,indoor,"dressing_room, nursery, clean_room, archive, locker_room"
5631,135144,indoor,"clean_room, dressing_room, nursery, museum/indoor, archive"
5632,135168,indoor,"dressing_room, clothing_store, closet, archive, clean_room"
5633,135192,indoor,"dressing_room, nursery, closet, clean_room, clothing_store"
5634,135216,indoor,"dressing_room, clean_room, nursery, closet, clothing_store"
5635,135240,indoor,"dressing_room, nursery, clean_room, clothing_store, closet"
5636,135264,indoor,"dressing_room, clean_room, nursery, clothing_store, closet"
5637,135288,indoor,"dressing_room, clean_room, nursery, archive, locker_room"
5638,135312,indoor,"dressing_room, clean_room, nursery, shower, museum/indoor"
5639,135336,indoor,"dressing_room, clean_room, locker_room, archive, clothing_store"
5640,135360,indoor,"clean_room, dressing_room, museum/indoor, shower, clothing_store"
5641,135384,indoor,"museum/indoor, clean_room, dressing_room, art_gallery, clothing_store"
5642,135408,indoor,"dressing_room, museum/indoor, clean_room, clothing_store, shower"
5643,135432,indoor,"dressing_room, museum/indoor, clean_room, nursery, clothing_store"
5644,135456,indoor,"clean_room, museum/indoor, dressing_room, nursery, clothing_store"
5645,135480,indoor,"dressing_room, clean_room, museum/indoor, nursery, clothing_store"
5646,135504,indoor,"museum/indoor, clean_room, dressing_room, clothing_store, nursery"
5647,135528,indoor,"museum/indoor, clean_room, dressing_room, nursery, clothing_store"
5648,135552,indoor,"dressing_room, clean_room, museum/indoor, art_gallery, shower"
5649,135576,indoor,"dressing_room, shower, clean_room, clothing_store, bathroom"
5650,135600,indoor,"dressing_room, locker_room, beauty_salon, shower, bathroom"
5651,135624,indoor,"dressing_room, beauty_salon, art_gallery, clean_room, shower"
5652,135648,indoor,"dressing_room, clean_room, art_gallery, clothing_store, shower"
5653,135672,indoor,"bow_window/indoor, office, dressing_room, clean_room, elevator/door"
5654,135696,indoor,"office, dressing_room, clean_room, office_cubicles, reception"
5655,135720,indoor,"office, dressing_room, reception, hospital_room, clean_room"
5656,135744,indoor,"office, dressing_room, clean_room, reception, hospital_room"
5657,135768,indoor,"office, dressing_room, bow_window/indoor, clean_room, shower"
5658,135792,indoor,"office, clean_room, bow_window/indoor, hospital_room, office_cubicles"
5659,135816,indoor,"dressing_room, clean_room, art_gallery, museum/indoor, art_studio"
5660,135840,indoor,"dressing_room, clean_room, beauty_salon, clothing_store, museum/indoor"
5661,135864,indoor,"dressing_room, clean_room, art_gallery, museum/indoor, shower"
5662,135888,indoor,"dressing_room, clean_room, beauty_salon, shower, museum/indoor"
5663,135912,indoor,"dressing_room, clean_room, beauty_salon, shower, clothing_store"
5664,135936,indoor,"dressing_room, clean_room, clothing_store, art_gallery, beauty_salon"
5665,135960,indoor,"dressing_room, art_gallery, clean_room, clothing_store, museum/indoor"
5666,135984,indoor,"dressing_room, clean_room, shower, clothing_store, art_gallery"
5667,136008,indoor,"dressing_room, clean_room, clothing_store, shower, art_gallery"
5668,136032,indoor,"dressing_room, clean_room, clothing_store, art_gallery, museum/indoor"
5669,136056,indoor,"dressing_room, clean_room, clothing_store, art_gallery, beauty_salon"
5670,136080,indoor,"dressing_room, clean_room, museum/indoor, art_gallery, clothing_store"
5671,136104,indoor,"bow_window/indoor, shower, elevator/door, elevator_lobby, office"
5672,136128,indoor,"bow_window/indoor, office, elevator/door, elevator_lobby, shower"
5673,136152,indoor,"bow_window/indoor, elevator/door, office, elevator_lobby, shower"
5674,136176,indoor,"dressing_room, clean_room, shower, museum/indoor, clothing_store"
5675,136200,indoor,"dressing_room, clean_room, art_gallery, clothing_store, museum/indoor"
5676,136224,indoor,"shower, dressing_room, bathroom, clean_room, art_gallery"
5677,136248,indoor,"clean_room, shower, bathroom, utility_room, dressing_room"
5678,136272,indoor,"shower, bathroom, clean_room, utility_room, elevator/door"
5679,136296,indoor,"bow_window/indoor, jail_cell, barndoor, elevator/door, office"
5680,136320,indoor,"bow_window/indoor, barndoor, jail_cell, elevator/door, office"
5681,136344,indoor,"bow_window/indoor, jail_cell, barndoor, elevator/door, office"
5682,136368,indoor,"bow_window/indoor, jail_cell, barndoor, elevator/door, archive"
5683,136392,indoor,"bow_window/indoor, jail_cell, barndoor, elevator/door, office"
5684,136416,indoor,"bow_window/indoor, barndoor, locker_room, shower, jail_cell"
5685,136440,indoor,"bow_window/indoor, jail_cell, barndoor, shower, elevator/door"
5686,136464,indoor,"shower, clean_room, bathroom, locker_room, bow_window/indoor"
5687,136488,indoor,"shower, clean_room, bathroom, locker_room, bow_window/indoor"
5688,136512,indoor,"shower, clean_room, bathroom, locker_room, bow_window/indoor"
5689,136536,indoor,"bow_window/indoor, atrium/public, shower, clean_room, locker_room"
5690,136560,indoor,"bow_window/indoor, clean_room, atrium/public, locker_room, archive"
5691,136584,indoor,"clean_room, bow_window/indoor, atrium/public, locker_room, dressing_room"
5692,136608,indoor,"shower, clean_room, closet, locker_room, bathroom"
5693,136632,indoor,"shower, bathroom, clean_room, dressing_room, bow_window/indoor"
5694,136656,indoor,"dressing_room, shower, clean_room, bow_window/indoor, museum/indoor"
5695,136680,indoor,"shower, clean_room, bathroom, museum/indoor, jewelry_shop"
5696,136704,indoor,"clean_room, jewelry_shop, museum/indoor, office, dressing_room"
5697,136728,indoor,"clean_room, shower, locker_room, dressing_room, bow_window/indoor"
5698,136752,indoor,"shower, bow_window/indoor, elevator/door, bathroom, bamboo_forest"
5699,136776,indoor,"shower, bow_window/indoor, elevator/door, bathroom, bamboo_forest"
5700,136800,indoor,"shower, bow_window/indoor, elevator/door, bathroom, locker_room"
5701,136824,indoor,"bow_window/indoor, clean_room, shower, dressing_room, atrium/public"
5702,136848,indoor,"clean_room, bow_window/indoor, museum/indoor, shower, atrium/public"
5703,136872,indoor,"bow_window/indoor, clean_room, office, office_cubicles, atrium/public"
5704,136896,indoor,"bow_window/indoor, clean_room, locker_room, shower, dressing_room"
5705,136920,indoor,"atrium/public, bow_window/indoor, shopping_mall/indoor, lobby, museum/indoor"
5706,136944,indoor,"bow_window/indoor, atrium/public, shower, bathroom, clean_room"
5707,136968,indoor,"museum/indoor, art_gallery, bow_window/indoor, clean_room, art_studio"
5708,136992,indoor,"museum/indoor, clean_room, art_gallery, dressing_room, art_studio"
5709,137016,indoor,"museum/indoor, clean_room, art_gallery, chemistry_lab, dressing_room"
5710,137040,indoor,"clean_room, operating_room, hospital_room, nursing_home, dressing_room"
5711,137064,indoor,"clean_room, operating_room, hospital_room, nursing_home, dressing_room"
5712,137088,indoor,"clean_room, operating_room, hospital_room, nursing_home, dressing_room"
5713,137112,indoor,"dressing_room, clean_room, chemistry_lab, beauty_salon, music_studio"
5714,137136,indoor,"clean_room, chemistry_lab, dressing_room, music_studio, art_studio"
5715,137160,indoor,"dressing_room, clean_room, hospital_room, locker_room, nursing_home"
5716,137184,indoor,"clean_room, dressing_room, hospital_room, locker_room, nursing_home"
5717,137208,indoor,"clean_room, hospital_room, dressing_room, nursing_home, operating_room"
5718,137232,indoor,"dressing_room, locker_room, clean_room, hospital_room, nursing_home"
5719,137256,indoor,"booth/indoor, museum/indoor, bookstore, pharmacy, archive"
5720,137280,indoor,"booth/indoor, museum/indoor, cemetery, archive, pharmacy"
5721,137304,indoor,"booth/indoor, museum/indoor, archive, pharmacy, cemetery"
5722,137328,indoor,"museum/indoor, art_gallery, artists_loft, dressing_room, entrance_hall"
5723,137352,indoor,"museum/indoor, art_gallery, entrance_hall, artists_loft, corridor"
5724,137376,indoor,"museum/indoor, art_gallery, artists_loft, clean_room, utility_room"
5725,137400,indoor,"bow_window/indoor, nursery, artists_loft, art_studio, beauty_salon"
5726,137424,indoor,"clean_room, archive, nursery, laundromat, hospital_room"
5727,137448,indoor,"art_studio, bow_window/indoor, nursery, art_gallery, clean_room"
5728,137472,indoor,"nursery, dressing_room, clothing_store, utility_room, closet"
5729,137496,indoor,"dressing_room, utility_room, clean_room, art_gallery, clothing_store"
5730,137520,indoor,"archive, museum/indoor, art_studio, kindergarden_classroom, art_gallery"
5731,137544,indoor,"museum/indoor, archive, art_studio, art_gallery, kindergarden_classroom"
5732,137568,indoor,"museum/indoor, archive, art_gallery, art_studio, art_school"
5733,137592,indoor,"museum/indoor, archive, art_gallery, art_studio, dressing_room"
5734,137616,indoor,"art_gallery, museum/indoor, artists_loft, art_studio, archive"
5735,137640,indoor,"art_gallery, museum/indoor, artists_loft, art_studio, archive"
5736,137664,indoor,"museum/indoor, art_gallery, clothing_store, jewelry_shop, dressing_room"
5737,137688,indoor,"dressing_room, clothing_store, archive, office, beauty_salon"
5738,137712,indoor,"nursing_home, dressing_room, clean_room, office, archive"
5739,137736,indoor,"dressing_room, clothing_store, clean_room, museum/indoor, art_studio"
5740,137760,indoor,"dressing_room, clean_room, museum/indoor, clothing_store, hospital_room"
5741,137784,indoor,"dressing_room, clothing_store, museum/indoor, art_gallery, clean_room"
5742,137808,indoor,"dressing_room, clothing_store, beauty_salon, clean_room, nursing_home"
5743,137832,indoor,"dressing_room, clean_room, museum/indoor, art_studio, clothing_store"
5744,137856,indoor,"dressing_room, museum/indoor, clothing_store, art_gallery, art_studio"
5745,137880,indoor,"dressing_room, clean_room, clothing_store, museum/indoor, hospital_room"
5746,137904,indoor,"dressing_room, clean_room, hospital_room, clothing_store, nursery"
5747,137928,indoor,"dressing_room, clean_room, clothing_store, hospital_room, museum/indoor"
5748,137952,indoor,"dressing_room, clean_room, museum/indoor, hospital_room, art_gallery"
5749,137976,indoor,"dressing_room, clean_room, museum/indoor, beauty_salon, art_gallery"
5750,138000,indoor,"dressing_room, clean_room, museum/indoor, art_gallery, nursing_home"
5751,138024,indoor,"dressing_room, clean_room, hospital_room, nursing_home, museum/indoor"
5752,138048,indoor,"dressing_room, clean_room, museum/indoor, nursing_home, art_gallery"
5753,138072,indoor,"dressing_room, art_gallery, clean_room, museum/indoor, art_studio"
5754,138096,indoor,"dressing_room, art_gallery, museum/indoor, clean_room, art_studio"
5755,138120,indoor,"jail_cell, locker_room, shower, dressing_room, hospital_room"
5756,138144,indoor,"jail_cell, clean_room, shower, dressing_room, locker_room"
5757,138168,indoor,"locker_room, jail_cell, shower, dressing_room, bathroom"
5758,138192,indoor,"jail_cell, locker_room, dressing_room, shower, clean_room"
5759,138216,indoor,"jail_cell, locker_room, shower, clean_room, dressing_room"
5760,138240,indoor,"locker_room, jail_cell, clean_room, dressing_room, discotheque"
5761,138264,indoor,"art_gallery, clean_room, museum/indoor, dressing_room, art_studio"
5762,138288,indoor,"dressing_room, museum/indoor, art_gallery, art_studio, clean_room"
5763,138312,indoor,"dressing_room, museum/indoor, art_studio, clean_room, art_gallery"
5764,138336,indoor,"dressing_room, clean_room, art_studio, art_gallery, museum/indoor"
5765,138360,indoor,"dressing_room, museum/indoor, clean_room, art_gallery, nursery"
5766,138384,indoor,"dressing_room, museum/indoor, clean_room, art_gallery, beauty_salon"
5767,138408,indoor,"dressing_room, art_gallery, museum/indoor, clean_room, art_studio"
5768,138432,indoor,"dressing_room, museum/indoor, art_gallery, clean_room, art_studio"
5769,138456,indoor,"clean_room, archive, office, coffee_shop, reception"
5770,138480,indoor,"clean_room, archive, restaurant_kitchen, office, coffee_shop"
5771,138504,indoor,"clean_room, archive, office, coffee_shop, restaurant_kitchen"
5772,138528,indoor,"clean_room, archive, office, office_cubicles, coffee_shop"
5773,138552,indoor,"office, clean_room, archive, office_cubicles, restaurant"
5774,138576,indoor,"clean_room, archive, office, office_cubicles, hospital_room"
5775,138600,indoor,"dressing_room, clean_room, archive, art_gallery, museum/indoor"
5776,138624,indoor,"dressing_room, clean_room, elevator/door, art_gallery, archive"
5777,138648,indoor,"dressing_room, art_gallery, clean_room, bathroom, shower"
5778,138672,indoor,"dressing_room, museum/indoor, clean_room, art_gallery, beauty_salon"
5779,138696,indoor,"dressing_room, museum/indoor, clean_room, art_gallery, art_studio"
5780,138720,indoor,"dressing_room, museum/indoor, clean_room, art_gallery, clothing_store"
5781,138744,indoor,"dressing_room, museum/indoor, art_gallery, clean_room, clothing_store"
5782,138768,indoor,"dressing_room, museum/indoor, art_gallery, clean_room, clothing_store"
5783,138792,indoor,"clean_room, museum/indoor, dressing_room, art_gallery, clothing_store"
5784,138816,indoor,"clean_room, museum/indoor, dressing_room, art_gallery, operating_room"
5785,138840,indoor,"dressing_room, museum/indoor, clean_room, art_gallery, locker_room"
5786,138864,indoor,"dressing_room, museum/indoor, clean_room, art_gallery, nursing_home"
5787,138888,indoor,"museum/indoor, dressing_room, art_gallery, clean_room, office"
5788,138912,indoor,"museum/indoor, dressing_room, art_gallery, clean_room, art_studio"
5789,138936,indoor,"dressing_room, museum/indoor, art_gallery, clean_room, art_studio"
5790,138960,indoor,"dressing_room, museum/indoor, art_gallery, clean_room, locker_room"
5791,138984,indoor,"dressing_room, museum/indoor, clean_room, art_gallery, clothing_store"
5792,139008,indoor,"dressing_room, museum/indoor, clean_room, art_gallery, nursing_home"
5793,139032,indoor,"shower, atrium/public, bathroom, crevasse, beauty_salon"
5794,139056,indoor,"shower, clean_room, museum/indoor, atrium/public, art_gallery"
5795,139080,indoor,"shower, clean_room, museum/indoor, crevasse, glacier"
5796,139104,outdoor,"shower, crevasse, glacier, clean_room, ice_floe"
5797,139128,indoor,"clean_room, dressing_room, art_gallery, museum/indoor, clothing_store"
5798,139152,indoor,"clean_room, dressing_room, museum/indoor, archive, locker_room"
5799,139176,indoor,"clean_room, dressing_room, museum/indoor, archive, art_gallery"
5800,139200,indoor,"clean_room, dressing_room, archive, museum/indoor, art_gallery"
5801,139224,indoor,"clean_room, dressing_room, museum/indoor, archive, art_gallery"
5802,139248,indoor,"clean_room, dressing_room, museum/indoor, archive, art_gallery"
5803,139272,indoor,"clean_room, dressing_room, museum/indoor, art_gallery, archive"
5804,139296,indoor,"clean_room, dressing_room, museum/indoor, archive, locker_room"
5805,139320,indoor,"clean_room, dressing_room, museum/indoor, clothing_store, archive"
5806,139344,indoor,"clean_room, dressing_room, archive, museum/indoor, art_gallery"
