,frame_num,environment,places,imdb_id
0,0,outdoor,"desert/sand, sky, beach, lake/natural, marsh",64437
1,24,indoor,"museum/indoor, booth/indoor, archive, science_museum, natural_history_museum",64437
2,48,indoor,"museum/indoor, booth/indoor, archive, science_museum, natural_history_museum",64437
3,72,indoor,"museum/indoor, booth/indoor, archive, science_museum, natural_history_museum",64437
4,96,indoor,"museum/indoor, booth/indoor, archive, science_museum, natural_history_museum",64437
5,120,indoor,"museum/indoor, booth/indoor, archive, science_museum, natural_history_museum",64437
6,144,indoor,"museum/indoor, booth/indoor, archive, science_museum, natural_history_museum",64437
7,168,indoor,"museum/indoor, booth/indoor, archive, science_museum, natural_history_museum",64437
8,192,indoor,"museum/indoor, booth/indoor, archive, science_museum, natural_history_museum",64437
9,216,indoor,"museum/indoor, booth/indoor, archive, science_museum, natural_history_museum",64437
10,240,indoor,"museum/indoor, booth/indoor, archive, science_museum, natural_history_museum",64437
11,264,indoor,"museum/indoor, archive, natural_history_museum, booth/indoor, science_museum",64437
12,288,indoor,"museum/indoor, booth/indoor, archive, science_museum, natural_history_museum",64437
13,312,indoor,"museum/indoor, booth/indoor, archive, science_museum, natural_history_museum",64437
14,336,indoor,"museum/indoor, archive, science_museum, natural_history_museum, booth/indoor",64437
15,360,indoor,"museum/indoor, booth/indoor, archive, natural_history_museum, science_museum",64437
16,384,indoor,"museum/indoor, archive, booth/indoor, natural_history_museum, science_museum",64437
17,408,indoor,"museum/indoor, booth/indoor, archive, natural_history_museum, science_museum",64437
18,432,indoor,"shower, jail_cell, basement, archive, bathroom",64437
19,456,indoor,"auto_factory, assembly_line, airplane_cabin, auto_showroom, parking_garage/indoor",64437
20,480,indoor,"airplane_cabin, escalator/indoor, parking_garage/indoor, atrium/public, car_interior",64437
21,504,indoor,"airplane_cabin, runway, parking_garage/indoor, hangar/indoor, bowling_alley",64437
22,528,indoor,"airplane_cabin, airport_terminal, clean_room, atrium/public, shower",64437
23,552,indoor,"airplane_cabin, clean_room, reception, elevator_lobby, hospital_room",64437
24,576,indoor,"clean_room, hospital_room, elevator/door, airport_terminal, laundromat",64437
25,600,indoor,"laundromat, airplane_cabin, subway_station/platform, hospital, clean_room",64437
26,624,indoor,"clean_room, subway_station/platform, laundromat, train_station/platform, airport_terminal",64437
27,648,indoor,"bow_window/indoor, bathroom, kitchen, restaurant, utility_room",64437
28,672,outdoor,"hospital, office_building, building_facade, hospital_room, courthouse",64437
29,696,outdoor,"hospital, archive, office_building, courthouse, hospital_room",64437
30,720,outdoor,"courthouse, hospital, office_building, campus, archive",64437
31,744,outdoor,"courthouse, campus, hospital, office_building, archive",64437
32,768,outdoor,"courthouse, office_building, library/outdoor, hospital, campus",64437
33,792,indoor,"corridor, elevator_lobby, lobby, elevator/door, clean_room",64437
34,816,indoor,"corridor, elevator_lobby, lobby, elevator/door, clean_room",64437
35,840,indoor,"corridor, elevator_lobby, airport_terminal, reception, elevator/door",64437
36,864,indoor,"airport_terminal, corridor, elevator_lobby, clean_room, reception",64437
37,888,indoor,"reception, clean_room, airport_terminal, corridor, elevator_lobby",64437
38,912,indoor,"corridor, elevator_lobby, lobby, clean_room, entrance_hall",64437
39,936,indoor,"corridor, elevator_lobby, entrance_hall, lobby, basement",64437
40,960,indoor,"corridor, elevator_lobby, entrance_hall, lobby, clean_room",64437
41,984,indoor,"elevator/door, jail_cell, shower, basement, corridor",64437
42,1008,indoor,"elevator/door, elevator_lobby, locker_room, bathroom, jail_cell",64437
43,1032,indoor,"clean_room, laundromat, utility_room, phone_booth, shower",64437
44,1056,indoor,"beauty_salon, bathroom, clean_room, shower, museum/indoor",64437
45,1080,indoor,"shower, bathroom, dressing_room, clean_room, beauty_salon",64437
46,1104,outdoor,"shower, ice_floe, iceberg, ice_shelf, dressing_room",64437
47,1128,indoor,"clean_room, corridor, conference_room, office_cubicles, dressing_room",64437
48,1152,indoor,"elevator_lobby, elevator/door, beauty_salon, reception, pharmacy",64437
49,1176,indoor,"elevator_lobby, corridor, server_room, clean_room, reception",64437
50,1200,indoor,"elevator_lobby, corridor, lobby, elevator/door, reception",64437
51,1224,indoor,"corridor, locker_room, clean_room, elevator_lobby, elevator/door",64437
52,1248,indoor,"corridor, clean_room, elevator_lobby, elevator/door, hospital_room",64437
53,1272,indoor,"corridor, locker_room, elevator_lobby, dressing_room, elevator/door",64437
54,1296,indoor,"corridor, locker_room, clean_room, elevator_lobby, basement",64437
55,1320,indoor,"clean_room, elevator/door, locker_room, dressing_room, elevator_lobby",64437
56,1344,indoor,"clean_room, dressing_room, discotheque, locker_room, martial_arts_gym",64437
57,1368,indoor,"shower, clothing_store, jail_cell, elevator/door, clean_room",64437
58,1392,indoor,"clean_room, corridor, atrium/public, elevator_lobby, lobby",64437
59,1416,indoor,"clean_room, atrium/public, corridor, airport_terminal, server_room",64437
60,1440,indoor,"clean_room, airport_terminal, atrium/public, corridor, server_room",64437
61,1464,indoor,"clean_room, atrium/public, airport_terminal, office, reception",64437
62,1488,indoor,"clean_room, hospital_room, dressing_room, locker_room, clothing_store",64437
63,1512,indoor,"clean_room, atrium/public, clothing_store, museum/indoor, hospital_room",64437
64,1536,indoor,"clean_room, hospital_room, operating_room, airplane_cabin, pharmacy",64437
65,1560,indoor,"clean_room, corridor, hospital_room, entrance_hall, locker_room",64437
66,1584,indoor,"clean_room, corridor, hospital_room, pharmacy, locker_room",64437
67,1608,indoor,"clean_room, corridor, locker_room, dressing_room, closet",64437
68,1632,indoor,"clean_room, locker_room, corridor, hospital_room, server_room",64437
69,1656,indoor,"clean_room, locker_room, hospital_room, corridor, operating_room",64437
70,1680,indoor,"clean_room, corridor, locker_room, dressing_room, clothing_store",64437
71,1704,indoor,"clean_room, locker_room, hospital_room, dressing_room, clothing_store",64437
72,1728,indoor,"clean_room, hospital_room, operating_room, locker_room, office",64437
73,1752,indoor,"clean_room, hospital_room, operating_room, pharmacy, nursery",64437
74,1776,indoor,"clean_room, dressing_room, hospital_room, nursery, chemistry_lab",64437
75,1800,indoor,"clean_room, dressing_room, chemistry_lab, nursery, martial_arts_gym",64437
76,1824,indoor,"clean_room, dressing_room, locker_room, clothing_store, hospital_room",64437
77,1848,indoor,"clean_room, hospital_room, pharmacy, biology_laboratory, operating_room",64437
78,1872,indoor,"clean_room, biology_laboratory, chemistry_lab, hospital_room, operating_room",64437
79,1896,indoor,"clean_room, hospital_room, biology_laboratory, operating_room, chemistry_lab",64437
80,1920,indoor,"clean_room, hospital_room, server_room, biology_laboratory, operating_room",64437
81,1944,indoor,"clean_room, hospital_room, server_room, biology_laboratory, operating_room",64437
82,1968,indoor,"clean_room, hospital_room, server_room, pharmacy, biology_laboratory",64437
83,1992,indoor,"clean_room, hospital_room, server_room, pharmacy, biology_laboratory",64437
84,2016,indoor,"clean_room, hospital_room, server_room, pharmacy, biology_laboratory",64437
85,2040,indoor,"clean_room, hospital_room, server_room, pharmacy, biology_laboratory",64437
86,2064,indoor,"clean_room, hospital_room, server_room, locker_room, assembly_line",64437
87,2088,indoor,"clean_room, hospital_room, server_room, locker_room, biology_laboratory",64437
88,2112,indoor,"clean_room, operating_room, dressing_room, hospital_room, biology_laboratory",64437
89,2136,indoor,"clean_room, dressing_room, museum/indoor, chemistry_lab, biology_laboratory",64437
90,2160,indoor,"clean_room, dressing_room, beauty_salon, hospital_room, operating_room",64437
91,2184,indoor,"clean_room, operating_room, dressing_room, hospital_room, restaurant_kitchen",64437
92,2208,indoor,"clean_room, operating_room, dressing_room, hospital_room, restaurant_kitchen",64437
93,2232,indoor,"clean_room, dressing_room, restaurant_kitchen, operating_room, hospital_room",64437
94,2256,indoor,"clean_room, operating_room, dressing_room, restaurant_kitchen, hospital_room",64437
95,2280,indoor,"clean_room, operating_room, hospital_room, restaurant_kitchen, biology_laboratory",64437
96,2304,indoor,"clean_room, operating_room, restaurant_kitchen, dressing_room, hospital_room",64437
97,2328,indoor,"clean_room, dressing_room, restaurant_kitchen, operating_room, hospital_room",64437
98,2352,indoor,"clean_room, operating_room, hospital_room, chemistry_lab, dressing_room",64437
99,2376,indoor,"clean_room, dressing_room, hospital_room, beauty_salon, operating_room",64437
100,2400,indoor,"clean_room, dressing_room, locker_room, beauty_salon, hospital_room",64437
101,2424,indoor,"clean_room, dressing_room, jewelry_shop, beauty_salon, locker_room",64437
102,2448,indoor,"clean_room, dressing_room, bathroom, locker_room, beauty_salon",64437
103,2472,indoor,"clean_room, dressing_room, bathroom, locker_room, shower",64437
104,2496,indoor,"clean_room, restaurant_kitchen, biology_laboratory, chemistry_lab, kitchen",64437
105,2520,indoor,"biology_laboratory, chemistry_lab, clean_room, dressing_room, bathroom",64437
106,2544,indoor,"clean_room, biology_laboratory, chemistry_lab, physics_laboratory, locker_room",64437
107,2568,indoor,"clean_room, dressing_room, beauty_salon, biology_laboratory, operating_room",64437
108,2592,indoor,"clean_room, dressing_room, locker_room, shower, bathroom",64437
109,2616,indoor,"clean_room, locker_room, dressing_room, elevator/door, chemistry_lab",64437
110,2640,indoor,"clean_room, locker_room, dressing_room, elevator/door, elevator_lobby",64437
111,2664,indoor,"clean_room, dressing_room, bathroom, hotel_room, shower",64437
112,2688,indoor,"clean_room, biology_laboratory, chemistry_lab, hospital_room, operating_room",64437
113,2712,indoor,"clean_room, bathroom, beauty_salon, shower, dressing_room",64437
114,2736,indoor,"clean_room, biology_laboratory, operating_room, hospital_room, chemistry_lab",64437
115,2760,indoor,"clean_room, locker_room, dressing_room, office, hospital_room",64437
116,2784,indoor,"clean_room, dressing_room, shower, bathroom, locker_room",64437
117,2808,indoor,"clean_room, locker_room, dressing_room, hospital_room, jail_cell",64437
118,2832,indoor,"dressing_room, locker_room, shower, bathroom, jail_cell",64437
119,2856,indoor,"clean_room, locker_room, dressing_room, physics_laboratory, science_museum",64437
120,2880,indoor,"clean_room, locker_room, physics_laboratory, dressing_room, science_museum",64437
121,2904,indoor,"clean_room, physics_laboratory, locker_room, science_museum, operating_room",64437
122,2928,indoor,"clean_room, locker_room, dressing_room, elevator/door, elevator_lobby",64437
123,2952,indoor,"clean_room, locker_room, elevator/door, dressing_room, shower",64437
124,2976,indoor,"ice_floe, museum/indoor, natural_history_museum, science_museum, ice_shelf",64437
125,3000,indoor,"clean_room, biology_laboratory, chemistry_lab, bowling_alley, hospital_room",64437
126,3024,indoor,"gymnasium/indoor, bow_window/indoor, dressing_room, living_room, playroom",64437
127,3048,indoor,"bow_window/indoor, porch, clean_room, gymnasium/indoor, archive",64437
128,3072,indoor,"clean_room, locker_room, gymnasium/indoor, archive, airport_terminal",64437
129,3096,indoor,"clean_room, archive, biology_laboratory, locker_room, chemistry_lab",64437
130,3120,indoor,"clean_room, locker_room, martial_arts_gym, gymnasium/indoor, airport_terminal",64437
131,3144,indoor,"bow_window/indoor, shower, porch, archive, dining_room",64437
132,3168,indoor,"bow_window/indoor, living_room, porch, office, home_office",64437
133,3192,indoor,"clean_room, closet, shower, bow_window/indoor, alcove",64437
134,3216,indoor,"clean_room, martial_arts_gym, dressing_room, archive, hospital_room",64437
135,3240,indoor,"clean_room, shower, locker_room, bathroom, dressing_room",64437
136,3264,indoor,"clean_room, dressing_room, shower, bathroom, locker_room",64437
137,3288,outdoor,"skyscraper, office_building, arch, tower, wind_farm",64437
138,3312,indoor,"stable, clean_room, closet, dressing_room, locker_room",64437
139,3336,indoor,"shower, bathroom, closet, alcove, utility_room",64437
140,3360,indoor,"nursery, ice_floe, childs_room, museum/indoor, ice_shelf",64437
141,3384,outdoor,"ice_floe, ice_shelf, iceberg, ocean, bedroom",64437
142,3408,outdoor,"balcony/interior, boat_deck, shower, ice_floe, clean_room",64437
143,3432,indoor,"chemistry_lab, clean_room, biology_laboratory, engine_room, physics_laboratory",64437
144,3456,indoor,"clean_room, dressing_room, bathroom, shower, beauty_salon",64437
145,3480,indoor,"dressing_room, museum/indoor, clothing_store, beauty_salon, locker_room",64437
146,3504,indoor,"dressing_room, museum/indoor, shower, bathroom, jewelry_shop",64437
147,3528,indoor,"dressing_room, museum/indoor, beauty_salon, bathroom, art_gallery",64437
148,3552,indoor,"dressing_room, museum/indoor, shower, art_studio, art_gallery",64437
149,3576,indoor,"museum/indoor, dressing_room, natural_history_museum, art_studio, science_museum",64437
150,3600,indoor,"clean_room, dressing_room, locker_room, gymnasium/indoor, music_studio",64437
151,3624,indoor,"dressing_room, shower, beauty_salon, bathroom, locker_room",64437
152,3648,indoor,"dressing_room, clean_room, museum/indoor, locker_room, shower",64437
153,3672,indoor,"clean_room, locker_room, elevator/door, shower, museum/indoor",64437
154,3696,indoor,"clean_room, museum/indoor, locker_room, dressing_room, physics_laboratory",64437
155,3720,indoor,"clean_room, dressing_room, biology_laboratory, beauty_salon, hospital_room",64437
156,3744,indoor,"clean_room, locker_room, dressing_room, shower, chemistry_lab",64437
157,3768,indoor,"gymnasium/indoor, beauty_salon, martial_arts_gym, clean_room, dressing_room",64437
158,3792,indoor,"clean_room, beauty_salon, museum/indoor, art_gallery, drugstore",64437
159,3816,indoor,"clean_room, chemistry_lab, beauty_salon, discotheque, pharmacy",64437
160,3840,indoor,"beauty_salon, dressing_room, office, computer_room, campus",64437
161,3864,indoor,"beauty_salon, locker_room, server_room, dressing_room, dorm_room",64437
162,3888,indoor,"dressing_room, dorm_room, locker_room, beauty_salon, youth_hostel",64437
163,3912,indoor,"dressing_room, dorm_room, bedroom, hospital_room, music_studio",64437
164,3936,indoor,"beauty_salon, music_studio, hospital_room, office, television_studio",64437
165,3960,indoor,"music_studio, beauty_salon, office, television_studio, hospital_room",64437
166,3984,indoor,"beauty_salon, hospital_room, pharmacy, office, hospital",64437
167,4008,indoor,"beauty_salon, hospital_room, pharmacy, dorm_room, server_room",64437
168,4032,indoor,"dorm_room, bedroom, nursery, server_room, hospital_room",64437
169,4056,indoor,"dorm_room, beauty_salon, youth_hostel, bedroom, server_room",64437
170,4080,indoor,"hotel_room, hospital_room, nursery, bedroom, clean_room",64437
171,4104,indoor,"hospital_room, clean_room, hotel_room, airplane_cabin, bedroom",64437
172,4128,indoor,"hospital_room, hotel_room, clean_room, airplane_cabin, bedroom",64437
173,4152,indoor,"hospital_room, clean_room, airplane_cabin, hospital, hotel_room",64437
174,4176,indoor,"hospital_room, clean_room, hotel_room, hospital, airplane_cabin",64437
175,4200,indoor,"hotel_room, hospital_room, bedroom, nursery, berth",64437
176,4224,indoor,"locker_room, dressing_room, bathroom, shower, closet",64437
177,4248,indoor,"locker_room, bathroom, dressing_room, dorm_room, shower",64437
178,4272,indoor,"dressing_room, shower, bathroom, beauty_salon, music_studio",64437
179,4296,indoor,"shower, bathroom, dressing_room, bow_window/indoor, jewelry_shop",64437
180,4320,indoor,"jewelry_shop, museum/indoor, science_museum, bathroom, reception",64437
181,4344,indoor,"museum/indoor, science_museum, art_gallery, natural_history_museum, shoe_shop",64437
182,4368,indoor,"dressing_room, bathroom, beauty_salon, living_room, shower",64437
183,4392,indoor,"dressing_room, bedroom, home_office, dorm_room, living_room",64437
184,4416,indoor,"beauty_salon, bedroom, dressing_room, clothing_store, shower",64437
185,4440,indoor,"hospital_room, locker_room, dressing_room, office, beauty_salon",64437
186,4464,indoor,"office, home_office, dressing_room, office_cubicles, hospital_room",64437
187,4488,indoor,"office, computer_room, dressing_room, office_cubicles, home_office",64437
188,4512,indoor,"hospital_room, bedroom, dressing_room, office, clean_room",64437
189,4536,indoor,"hospital_room, bedroom, martial_arts_gym, hotel_room, clean_room",64437
190,4560,indoor,"martial_arts_gym, clean_room, hospital_room, office, art_gallery",64437
191,4584,indoor,"hospital_room, martial_arts_gym, clean_room, office, bedroom",64437
192,4608,indoor,"hospital_room, clean_room, office, martial_arts_gym, bedroom",64437
193,4632,indoor,"hospital_room, clean_room, dorm_room, bedroom, nursery",64437
194,4656,indoor,"hospital_room, hotel_room, bedroom, dressing_room, martial_arts_gym",64437
195,4680,indoor,"dressing_room, martial_arts_gym, hospital_room, hotel_room, art_gallery",64437
196,4704,indoor,"dressing_room, bedroom, martial_arts_gym, hotel_room, hospital_room",64437
197,4728,indoor,"hotel_room, hospital_room, bedroom, clean_room, martial_arts_gym",64437
198,4752,indoor,"clean_room, hospital_room, computer_room, office, dorm_room",64437
199,4776,indoor,"clean_room, computer_room, office, television_room, hospital_room",64437
200,4800,indoor,"computer_room, office, clean_room, television_room, hospital_room",64437
201,4824,indoor,"hospital, drugstore, pharmacy, hospital_room, ice_shelf",64437
202,4848,indoor,"hospital, drugstore, pharmacy, hospital_room, ice_shelf",64437
203,4872,indoor,"computer_room, office, clean_room, television_room, home_office",64437
204,4896,indoor,"office, computer_room, martial_arts_gym, office_cubicles, hospital_room",64437
205,4920,indoor,"office, computer_room, home_office, office_cubicles, clean_room",64437
206,4944,indoor,"elevator/door, bow_window/indoor, balcony/interior, office, server_room",64437
207,4968,indoor,"server_room, elevator/door, archive, train_interior, closet",64437
208,4992,indoor,"clean_room, hospital_room, server_room, laundromat, elevator/door",64437
209,5016,indoor,"coffee_shop, biology_laboratory, clean_room, hospital_room, beauty_salon",64437
210,5040,indoor,"beauty_salon, clean_room, biology_laboratory, hospital_room, pharmacy",64437
211,5064,indoor,"hospital_room, beauty_salon, office, nursery, jewelry_shop",64437
212,5088,indoor,"hospital_room, clean_room, coffee_shop, ticket_booth, booth/indoor",64437
213,5112,indoor,"hospital_room, clean_room, nursery, ticket_booth, office",64437
214,5136,indoor,"clean_room, pharmacy, biology_laboratory, chemistry_lab, drugstore",64437
215,5160,indoor,"clean_room, dressing_room, phone_booth, laundromat, biology_laboratory",64437
216,5184,indoor,"clean_room, dressing_room, office, laundromat, biology_laboratory",64437
217,5208,indoor,"dressing_room, clean_room, hospital_room, beauty_salon, office",64437
218,5232,indoor,"dressing_room, beauty_salon, clean_room, bathroom, locker_room",64437
219,5256,indoor,"clean_room, dressing_room, locker_room, beauty_salon, office",64437
220,5280,indoor,"dressing_room, clean_room, locker_room, beauty_salon, office",64437
221,5304,indoor,"clean_room, locker_room, office, dressing_room, beauty_salon",64437
222,5328,indoor,"shoe_shop, clean_room, locker_room, dressing_room, phone_booth",64437
223,5352,indoor,"locker_room, dressing_room, clean_room, television_studio, gymnasium/indoor",64437
224,5376,indoor,"dressing_room, locker_room, office, beauty_salon, television_studio",64437
225,5400,indoor,"office, clean_room, beauty_salon, hospital_room, office_cubicles",64437
226,5424,indoor,"office, clean_room, computer_room, beauty_salon, office_cubicles",64437
227,5448,indoor,"dressing_room, shoe_shop, beauty_salon, locker_room, clean_room",64437
228,5472,indoor,"beauty_salon, dressing_room, locker_room, clean_room, chemistry_lab",64437
229,5496,indoor,"beauty_salon, dressing_room, locker_room, clean_room, hospital_room",64437
230,5520,indoor,"clean_room, locker_room, dressing_room, beauty_salon, martial_arts_gym",64437
231,5544,indoor,"music_studio, discotheque, chemistry_lab, shower, clean_room",64437
232,5568,indoor,"music_studio, shower, television_studio, locker_room, beauty_salon",64437
233,5592,indoor,"music_studio, television_studio, discotheque, stage/indoor, locker_room",64437
234,5616,indoor,"locker_room, shower, clean_room, museum/indoor, natural_history_museum",64437
235,5640,indoor,"locker_room, shower, music_studio, clean_room, hospital_room",64437
236,5664,indoor,"shower, locker_room, clean_room, music_studio, tower",64437
237,5688,indoor,"locker_room, shower, shoe_shop, clean_room, music_studio",64437
238,5712,indoor,"shower, clothing_store, science_museum, childs_room, gift_shop",64437
239,5736,indoor,"shower, museum/indoor, gift_shop, underwater/ocean_deep, aquarium",64437
240,5760,indoor,"museum/indoor, beauty_salon, stage/indoor, science_museum, discotheque",64437
241,5784,indoor,"stage/indoor, music_studio, beauty_salon, discotheque, museum/indoor",64437
242,5808,indoor,"stage/indoor, museum/indoor, pharmacy, discotheque, drugstore",64437
243,5832,indoor,"museum/indoor, clothing_store, stage/indoor, shower, shoe_shop",64437
244,5856,indoor,"dressing_room, shower, discotheque, beauty_salon, chemistry_lab",64437
245,5880,indoor,"dressing_room, martial_arts_gym, discotheque, chemistry_lab, clean_room",64437
246,5904,indoor,"dressing_room, shower, bathroom, locker_room, beauty_salon",64437
247,5928,indoor,"dressing_room, beauty_salon, bathroom, locker_room, youth_hostel",64437
248,5952,indoor,"dressing_room, clean_room, hospital_room, beauty_salon, chemistry_lab",64437
249,5976,indoor,"dressing_room, clean_room, hospital_room, beauty_salon, operating_room",64437
250,6000,indoor,"dressing_room, clean_room, hospital_room, beauty_salon, operating_room",64437
251,6024,indoor,"clean_room, dressing_room, hospital_room, operating_room, chemistry_lab",64437
252,6048,indoor,"dressing_room, clean_room, hospital_room, chemistry_lab, operating_room",64437
253,6072,indoor,"clean_room, dressing_room, laundromat, veterinarians_office, hospital_room",64437
254,6096,indoor,"dressing_room, closet, clothing_store, locker_room, shower",64437
255,6120,indoor,"clean_room, dressing_room, locker_room, hospital_room, beauty_salon",64437
256,6144,indoor,"dressing_room, clean_room, beauty_salon, hospital_room, locker_room",64437
257,6168,indoor,"clean_room, dressing_room, operating_room, hospital_room, shower",64437
258,6192,indoor,"clean_room, operating_room, hospital_room, biology_laboratory, dressing_room",64437
259,6216,indoor,"clean_room, operating_room, hospital_room, dressing_room, biology_laboratory",64437
260,6240,indoor,"clean_room, operating_room, hospital_room, biology_laboratory, chemistry_lab",64437
261,6264,indoor,"clean_room, dressing_room, operating_room, beauty_salon, clothing_store",64437
262,6288,indoor,"clean_room, dressing_room, hospital_room, beauty_salon, television_studio",64437
263,6312,indoor,"clean_room, discotheque, television_studio, music_studio, hospital_room",64437
264,6336,indoor,"clean_room, television_studio, beauty_salon, locker_room, hospital_room",64437
265,6360,indoor,"dressing_room, clean_room, locker_room, beauty_salon, shower",64437
266,6384,indoor,"dressing_room, clean_room, locker_room, beauty_salon, shower",64437
267,6408,indoor,"clean_room, dressing_room, phone_booth, locker_room, beauty_salon",64437
268,6432,indoor,"clean_room, dressing_room, locker_room, phone_booth, hospital_room",64437
269,6456,indoor,"clean_room, locker_room, dressing_room, hospital_room, television_studio",64437
270,6480,indoor,"dressing_room, clean_room, shower, locker_room, bathroom",64437
271,6504,indoor,"dressing_room, clean_room, shower, music_studio, locker_room",64437
272,6528,indoor,"music_studio, clean_room, television_studio, discotheque, locker_room",64437
273,6552,indoor,"television_studio, music_studio, clean_room, discotheque, locker_room",64437
274,6576,indoor,"television_studio, music_studio, clean_room, beauty_salon, discotheque",64437
275,6600,indoor,"clean_room, hospital_room, beauty_salon, pharmacy, drugstore",64437
276,6624,indoor,"discotheque, pharmacy, drugstore, ice_shelf, biology_laboratory",64437
277,6648,indoor,"clean_room, hospital_room, wind_farm, operating_room, bow_window/indoor",64437
278,6672,indoor,"clean_room, chemistry_lab, beauty_salon, clothing_store, biology_laboratory",64437
279,6696,indoor,"clean_room, clothing_store, art_gallery, museum/indoor, dressing_room",64437
280,6720,indoor,"chemistry_lab, clean_room, biology_laboratory, dressing_room, martial_arts_gym",64437
281,6744,indoor,"laundromat, clean_room, airplane_cabin, locker_room, operating_room",64437
282,6768,indoor,"beauty_salon, elevator/door, shower, dressing_room, clean_room",64437
283,6792,indoor,"television_studio, phone_booth, beauty_salon, amusement_arcade, music_studio",64437
284,6816,indoor,"discotheque, television_studio, music_studio, stage/indoor, beauty_salon",64437
285,6840,indoor,"television_studio, discotheque, beauty_salon, music_studio, hospital_room",64437
286,6864,indoor,"discotheque, television_studio, music_studio, beauty_salon, airplane_cabin",64437
