,frame_num,environment,places,imdb_id
1148,27552,indoor,"museum/indoor, martial_arts_gym, nursery, art_gallery, ballroom",20436
1149,27576,indoor,"museum/indoor, art_gallery, martial_arts_gym, natural_history_museum, discotheque",20436
1150,27600,indoor,"museum/indoor, art_gallery, martial_arts_gym, natural_history_museum, discotheque",20436
1151,27624,indoor,"museum/indoor, art_gallery, dressing_room, bathroom, clean_room",20436
1152,27648,indoor,"museum/indoor, art_gallery, boxing_ring, martial_arts_gym, sauna",20436
1153,27672,indoor,"museum/indoor, art_gallery, martial_arts_gym, shower, sauna",20436
1154,27696,indoor,"martial_arts_gym, museum/indoor, boxing_ring, discotheque, art_gallery",20436
1155,27720,indoor,"museum/indoor, nursery, martial_arts_gym, discotheque, art_gallery",20436
1156,27744,indoor,"discotheque, soccer_field, shower, stage/indoor, runway",20436
1157,27768,indoor,"discotheque, dressing_room, stage/indoor, museum/indoor, clean_room",20436
1158,27792,indoor,"museum/indoor, clean_room, art_gallery, basement, locker_room",20436
1159,27816,indoor,"museum/indoor, discotheque, clean_room, art_gallery, ice_floe",20436
1160,27840,indoor,"clean_room, museum/indoor, art_gallery, nursery, chemistry_lab",20436
1161,27864,indoor,"clean_room, museum/indoor, discotheque, swimming_pool/indoor, basement",20436
1162,27888,indoor,"clean_room, museum/indoor, discotheque, dressing_room, stage/indoor",20436
1163,27912,indoor,"clean_room, dressing_room, discotheque, ballroom, martial_arts_gym",20436
1164,27936,indoor,"museum/indoor, clean_room, discotheque, art_gallery, martial_arts_gym",20436
1165,27960,indoor,"discotheque, martial_arts_gym, stage/indoor, museum/indoor, boxing_ring",20436
1166,27984,indoor,"discotheque, dressing_room, museum/indoor, martial_arts_gym, art_gallery",20436
1167,28008,indoor,"discotheque, stage/indoor, museum/indoor, dressing_room, martial_arts_gym",20436
1168,28032,indoor,"discotheque, dressing_room, museum/indoor, stage/indoor, ballroom",20436
1169,28056,indoor,"discotheque, museum/indoor, dressing_room, art_gallery, stage/indoor",20436
1170,28080,indoor,"discotheque, museum/indoor, stage/indoor, art_gallery, shower",20436
1171,28104,indoor,"museum/indoor, art_gallery, martial_arts_gym, dressing_room, nursery",20436
1172,28128,indoor,"museum/indoor, art_gallery, discotheque, natural_history_museum, science_museum",20436
1173,28152,indoor,"museum/indoor, art_gallery, natural_history_museum, martial_arts_gym, discotheque",20436
1174,28176,indoor,"discotheque, martial_arts_gym, stage/indoor, museum/indoor, ballroom",20436
1175,28200,indoor,"museum/indoor, martial_arts_gym, art_gallery, discotheque, natural_history_museum",20436
1176,28224,indoor,"museum/indoor, art_gallery, discotheque, stage/indoor, science_museum",20436
1177,28248,indoor,"museum/indoor, art_gallery, recreation_room, living_room, playroom",20436
1178,28272,indoor,"museum/indoor, ballroom, banquet_hall, playroom, living_room",20436
1179,28296,indoor,"museum/indoor, living_room, recreation_room, playroom, nursery",20436
1180,28320,indoor,"museum/indoor, nursery, recreation_room, playroom, dressing_room",20436
1181,28344,indoor,"museum/indoor, martial_arts_gym, nursery, gymnasium/indoor, recreation_room",20436
1182,28368,indoor,"museum/indoor, nursery, martial_arts_gym, playroom, nursing_home",20436
1183,28392,indoor,"reception, pharmacy, elevator_lobby, elevator/door, art_gallery",20436
1184,28416,indoor,"hospital, pharmacy, museum/indoor, reception, drugstore",20436
1185,28440,indoor,"hospital, pharmacy, museum/indoor, reception, art_gallery",20436
1186,28464,indoor,"hospital, pharmacy, reception, drugstore, art_gallery",20436
1187,28488,indoor,"hospital, pharmacy, museum/indoor, reception, art_gallery",20436
1188,28512,indoor,"museum/indoor, martial_arts_gym, science_museum, stage/indoor, art_gallery",20436
1189,28536,indoor,"museum/indoor, martial_arts_gym, science_museum, clean_room, art_gallery",20436
1190,28560,indoor,"museum/indoor, natural_history_museum, science_museum, art_gallery, martial_arts_gym",20436
1191,28584,indoor,"museum/indoor, science_museum, natural_history_museum, art_gallery, martial_arts_gym",20436
1192,28608,indoor,"museum/indoor, science_museum, art_gallery, natural_history_museum, dressing_room",20436
1193,28632,indoor,"museum/indoor, science_museum, clean_room, dressing_room, art_gallery",20436
1194,28656,indoor,"museum/indoor, art_gallery, science_museum, clean_room, dressing_room",20436
1195,28680,indoor,"museum/indoor, science_museum, art_gallery, ballroom, stage/indoor",20436
1196,28704,indoor,"banquet_hall, ballroom, stage/indoor, dining_hall, museum/indoor",20436
1197,28728,indoor,"museum/indoor, ballroom, discotheque, dressing_room, stage/indoor",20436
1198,28752,indoor,"museum/indoor, science_museum, dressing_room, nursery, banquet_hall",20436
1199,28776,indoor,"hospital, pharmacy, drugstore, hospital_room, museum/indoor",20436
1200,28800,indoor,"hospital, pharmacy, museum/indoor, drugstore, art_gallery",20436
1201,28824,indoor,"pharmacy, hospital, reception, museum/indoor, drugstore",20436
1202,28848,indoor,"hospital, pharmacy, drugstore, museum/indoor, hospital_room",20436
1203,28872,indoor,"reception, pharmacy, lobby, drugstore, hospital",20436
1204,28896,indoor,"pharmacy, reception, drugstore, lobby, beauty_salon",20436
1205,28920,indoor,"hospital, pharmacy, museum/indoor, drugstore, reception",20436
1206,28944,indoor,"museum/indoor, science_museum, natural_history_museum, art_gallery, dressing_room",20436
1207,28968,indoor,"museum/indoor, science_museum, dressing_room, art_gallery, natural_history_museum",20436
1208,28992,indoor,"reception, hospital, museum/indoor, art_gallery, pharmacy",20436
1209,29016,indoor,"reception, art_gallery, lobby, museum/indoor, elevator_lobby",20436
1210,29040,indoor,"reception, museum/indoor, art_gallery, hospital, elevator_lobby",20436
1211,29064,indoor,"reception, museum/indoor, art_gallery, hospital, elevator_lobby",20436
1212,29088,indoor,"reception, art_gallery, museum/indoor, hospital, pharmacy",20436
1213,29112,indoor,"museum/indoor, science_museum, banquet_hall, jewelry_shop, dressing_room",20436
1214,29136,indoor,"museum/indoor, dressing_room, ballroom, science_museum, gift_shop",20436
1215,29160,indoor,"museum/indoor, science_museum, dressing_room, gift_shop, chemistry_lab",20436
1216,29184,indoor,"museum/indoor, science_museum, dressing_room, chemistry_lab, clean_room",20436
1217,29208,indoor,"museum/indoor, cemetery, natural_history_museum, pharmacy, drugstore",20436
1218,29232,indoor,"museum/indoor, natural_history_museum, archive, science_museum, pharmacy",20436
1219,29256,indoor,"museum/indoor, natural_history_museum, cemetery, pharmacy, archive",20436
1220,29280,indoor,"museum/indoor, natural_history_museum, archive, cemetery, science_museum",20436
1221,29304,indoor,"museum/indoor, natural_history_museum, pharmacy, drugstore, cemetery",20436
1222,29328,indoor,"museum/indoor, natural_history_museum, archive, cemetery, science_museum",20436
1223,29352,indoor,"museum/indoor, natural_history_museum, cemetery, pharmacy, archive",20436
1224,29376,indoor,"museum/indoor, natural_history_museum, cemetery, pharmacy, drugstore",20436
1225,29400,indoor,"museum/indoor, cemetery, natural_history_museum, pharmacy, booth/indoor",20436
1226,29424,indoor,"museum/indoor, cemetery, natural_history_museum, pharmacy, drugstore",20436
1227,29448,indoor,"museum/indoor, dressing_room, science_museum, banquet_hall, ballroom",20436
1228,29472,indoor,"museum/indoor, science_museum, jewelry_shop, gift_shop, dressing_room",20436
1229,29496,indoor,"museum/indoor, science_museum, natural_history_museum, jewelry_shop, art_gallery",20436
1230,29520,indoor,"museum/indoor, science_museum, natural_history_museum, clothing_store, dressing_room",20436
1231,29544,indoor,"museum/indoor, science_museum, natural_history_museum, ballroom, dressing_room",20436
1232,29568,indoor,"museum/indoor, pharmacy, hospital, natural_history_museum, art_gallery",20436
1233,29592,indoor,"museum/indoor, pharmacy, drugstore, hospital, natural_history_museum",20436
1234,29616,indoor,"museum/indoor, pharmacy, natural_history_museum, drugstore, hospital",20436
1235,29640,indoor,"museum/indoor, pharmacy, reception, natural_history_museum, hospital",20436
1236,29664,indoor,"museum/indoor, pharmacy, reception, drugstore, hospital",20436
1237,29688,indoor,"museum/indoor, pharmacy, reception, drugstore, natural_history_museum",20436
1238,29712,indoor,"museum/indoor, pharmacy, reception, drugstore, hospital",20436
1239,29736,indoor,"museum/indoor, pharmacy, reception, drugstore, hospital",20436
1240,29760,indoor,"museum/indoor, dressing_room, science_museum, ballroom, playroom",20436
1241,29784,indoor,"museum/indoor, clean_room, dressing_room, martial_arts_gym, banquet_hall",20436
1242,29808,indoor,"museum/indoor, clean_room, dressing_room, martial_arts_gym, nursery",20436
1243,29832,indoor,"reception, pharmacy, elevator/door, elevator_lobby, lobby",20436
1244,29856,indoor,"reception, hospital, pharmacy, ice_shelf, elevator_lobby",20436
1245,29880,indoor,"reception, pharmacy, ice_shelf, hospital, beauty_salon",20436
1246,29904,indoor,"museum/indoor, dressing_room, clean_room, clothing_store, art_gallery",20436
1247,29928,indoor,"museum/indoor, dressing_room, martial_arts_gym, nursery, ballroom",20436
1248,29952,indoor,"martial_arts_gym, museum/indoor, ballroom, stage/indoor, dressing_room",20436
1249,29976,indoor,"museum/indoor, martial_arts_gym, clean_room, art_gallery, nursery",20436
1250,30000,indoor,"museum/indoor, dressing_room, ballroom, martial_arts_gym, art_gallery",20436
1251,30024,indoor,"dressing_room, museum/indoor, clothing_store, ballroom, jewelry_shop",20436
1252,30048,indoor,"dressing_room, clean_room, museum/indoor, clothing_store, jewelry_shop",20436
1253,30072,indoor,"jewelry_shop, dressing_room, clothing_store, museum/indoor, department_store",20436
1254,30096,indoor,"hospital, pharmacy, museum/indoor, cemetery, drugstore",20436
1255,30120,indoor,"reception, museum/indoor, pharmacy, hospital, lobby",20436
1256,30144,indoor,"pharmacy, reception, museum/indoor, elevator_lobby, drugstore",20436
1257,30168,indoor,"hospital, museum/indoor, pharmacy, cemetery, drugstore",20436
1258,30192,indoor,"hospital, pharmacy, museum/indoor, reception, elevator_lobby",20436
1259,30216,indoor,"museum/indoor, hospital, pharmacy, desert/sand, drugstore",20436
1260,30240,indoor,"hospital, pharmacy, museum/indoor, drugstore, parking_lot",20436
1261,30264,indoor,"museum/indoor, hospital, pharmacy, reception, elevator_lobby",20436
1262,30288,indoor,"dressing_room, ballroom, clothing_store, museum/indoor, martial_arts_gym",20436
1263,30312,indoor,"clean_room, bow_window/indoor, museum/indoor, shower, bathroom",20436
1264,30336,indoor,"museum/indoor, bow_window/indoor, nursery, living_room, dressing_room",20436
1265,30360,indoor,"bathroom, dressing_room, jacuzzi/indoor, swimming_pool/indoor, bedroom",20436
1266,30384,indoor,"ballroom, museum/indoor, nursery, martial_arts_gym, dressing_room",20436
1267,30408,indoor,"ballroom, museum/indoor, martial_arts_gym, stage/indoor, discotheque",20436
1268,30432,indoor,"museum/indoor, science_museum, art_gallery, natural_history_museum, martial_arts_gym",20436
1269,30456,indoor,"discotheque, museum/indoor, clean_room, stage/indoor, shower",20436
1270,30480,indoor,"museum/indoor, martial_arts_gym, science_museum, dressing_room, boxing_ring",20436
1271,30504,indoor,"reception, pharmacy, elevator_lobby, elevator/door, drugstore",20436
1272,30528,indoor,"reception, pharmacy, elevator/door, elevator_lobby, art_gallery",20436
1273,30552,indoor,"pharmacy, hospital, reception, elevator/door, art_gallery",20436
1274,30576,indoor,"reception, pharmacy, art_gallery, museum/indoor, drugstore",20436
1275,30600,indoor,"reception, pharmacy, art_gallery, museum/indoor, hospital",20436
1276,30624,indoor,"museum/indoor, martial_arts_gym, discotheque, stage/indoor, dressing_room",20436
1277,30648,indoor,"museum/indoor, discotheque, stage/indoor, martial_arts_gym, science_museum",20436
1278,30672,indoor,"museum/indoor, martial_arts_gym, recreation_room, science_museum, gymnasium/indoor",20436
1279,30696,indoor,"museum/indoor, martial_arts_gym, science_museum, clean_room, natural_history_museum",20436
1280,30720,indoor,"museum/indoor, science_museum, natural_history_museum, martial_arts_gym, art_gallery",20436
1281,30744,indoor,"museum/indoor, martial_arts_gym, science_museum, dressing_room, ballroom",20436
1282,30768,indoor,"museum/indoor, martial_arts_gym, recreation_room, dressing_room, ballroom",20436
1283,30792,indoor,"museum/indoor, dressing_room, martial_arts_gym, science_museum, natural_history_museum",20436
1284,30816,indoor,"museum/indoor, science_museum, natural_history_museum, shower, martial_arts_gym",20436
1285,30840,indoor,"museum/indoor, nursery, martial_arts_gym, dressing_room, science_museum",20436
1286,30864,indoor,"museum/indoor, science_museum, shower, natural_history_museum, boxing_ring",20436
1287,30888,indoor,"martial_arts_gym, discotheque, ballroom, museum/indoor, dressing_room",20436
1288,30912,indoor,"discotheque, martial_arts_gym, classroom, museum/indoor, stage/indoor",20436
1289,30936,indoor,"museum/indoor, martial_arts_gym, nursery, science_museum, art_gallery",20436
1290,30960,indoor,"clean_room, museum/indoor, dressing_room, martial_arts_gym, art_gallery",20436
1291,30984,indoor,"museum/indoor, dressing_room, art_gallery, shower, martial_arts_gym",20436
1292,31008,indoor,"discotheque, martial_arts_gym, stage/indoor, shower, gymnasium/indoor",20436
1293,31032,indoor,"martial_arts_gym, museum/indoor, ballroom, stage/indoor, discotheque",20436
1294,31056,indoor,"museum/indoor, natural_history_museum, science_museum, martial_arts_gym, shower",20436
1295,31080,indoor,"museum/indoor, natural_history_museum, martial_arts_gym, science_museum, art_gallery",20436
1296,31104,indoor,"museum/indoor, art_gallery, clean_room, natural_history_museum, science_museum",20436
1297,31128,indoor,"museum/indoor, clean_room, natural_history_museum, science_museum, shower",20436
1298,31152,indoor,"museum/indoor, shower, clean_room, martial_arts_gym, dressing_room",20436
1299,31176,indoor,"martial_arts_gym, museum/indoor, natural_history_museum, science_museum, stage/indoor",20436
1300,31200,indoor,"martial_arts_gym, museum/indoor, natural_history_museum, shower, science_museum",20436
1301,31224,indoor,"shower, discotheque, museum/indoor, bathroom, science_museum",20436
1302,31248,indoor,"martial_arts_gym, museum/indoor, dressing_room, discotheque, boxing_ring",20436
1303,31272,indoor,"discotheque, martial_arts_gym, museum/indoor, stage/indoor, science_museum",20436
1304,31296,indoor,"museum/indoor, martial_arts_gym, discotheque, dressing_room, art_gallery",20436
1305,31320,indoor,"museum/indoor, dressing_room, discotheque, clean_room, martial_arts_gym",20436
1306,31344,indoor,"museum/indoor, dressing_room, discotheque, art_gallery, clean_room",20436
1307,31368,indoor,"dressing_room, museum/indoor, martial_arts_gym, ballroom, clean_room",20436
1308,31392,indoor,"museum/indoor, martial_arts_gym, dressing_room, art_gallery, ballroom",20436
1309,31416,indoor,"museum/indoor, dressing_room, art_gallery, martial_arts_gym, clean_room",20436
1310,31440,indoor,"museum/indoor, dressing_room, clean_room, art_gallery, martial_arts_gym",20436
1311,31464,indoor,"museum/indoor, clean_room, dressing_room, art_gallery, sauna",20436
1312,31488,indoor,"museum/indoor, dressing_room, art_gallery, clean_room, martial_arts_gym",20436
1313,31512,indoor,"museum/indoor, clean_room, science_museum, art_gallery, shower",20436
1314,31536,indoor,"museum/indoor, shower, martial_arts_gym, art_gallery, science_museum",20436
1315,31560,indoor,"museum/indoor, science_museum, natural_history_museum, art_gallery, martial_arts_gym",20436
1316,31584,indoor,"museum/indoor, art_gallery, science_museum, shower, natural_history_museum",20436
1317,31608,indoor,"museum/indoor, science_museum, shower, natural_history_museum, bathroom",20436
1318,31632,indoor,"museum/indoor, martial_arts_gym, science_museum, shower, dressing_room",20436
1319,31656,indoor,"museum/indoor, clean_room, science_museum, art_gallery, martial_arts_gym",20436
1320,31680,indoor,"museum/indoor, martial_arts_gym, art_gallery, discotheque, shower",20436
1321,31704,indoor,"museum/indoor, science_museum, art_gallery, dressing_room, natural_history_museum",20436
1322,31728,indoor,"museum/indoor, shower, science_museum, discotheque, natural_history_museum",20436
1323,31752,indoor,"museum/indoor, shower, discotheque, stage/indoor, martial_arts_gym",20436
1324,31776,indoor,"museum/indoor, discotheque, stage/indoor, science_museum, dressing_room",20436
1325,31800,indoor,"museum/indoor, stage/indoor, natural_history_museum, science_museum, ballroom",20436
1326,31824,indoor,"museum/indoor, natural_history_museum, science_museum, discotheque, wind_farm",20436
1327,31848,indoor,"museum/indoor, stage/indoor, dressing_room, martial_arts_gym, art_gallery",20436
1328,31872,indoor,"discotheque, museum/indoor, clean_room, dressing_room, clothing_store",20436
1329,31896,indoor,"museum/indoor, art_gallery, natural_history_museum, clean_room, science_museum",20436
1330,31920,indoor,"museum/indoor, dressing_room, art_gallery, natural_history_museum, discotheque",20436
1331,31944,indoor,"reception, art_gallery, lobby, hospital, museum/indoor",20436
1332,31968,indoor,"reception, art_gallery, hospital, museum/indoor, shower",20436
1333,31992,indoor,"reception, hospital, art_gallery, lobby, ice_shelf",20436
1334,32016,indoor,"reception, hospital, art_gallery, ice_shelf, lobby",20436
1335,32040,indoor,"museum/indoor, dressing_room, discotheque, art_gallery, ballroom",20436
1336,32064,indoor,"museum/indoor, dressing_room, art_gallery, discotheque, natural_history_museum",20436
1337,32088,indoor,"museum/indoor, dressing_room, discotheque, art_gallery, stage/indoor",20436
1338,32112,indoor,"museum/indoor, dressing_room, discotheque, ballroom, art_gallery",20436
1339,32136,indoor,"hospital, museum/indoor, cemetery, pharmacy, natural_history_museum",20436
1340,32160,indoor,"hospital, pharmacy, cemetery, museum/indoor, drugstore",20436
1341,32184,indoor,"hospital, pharmacy, cemetery, museum/indoor, hospital_room",20436
1342,32208,indoor,"museum/indoor, reception, hospital, pharmacy, natural_history_museum",20436
1343,32232,indoor,"hospital, museum/indoor, pharmacy, cemetery, hospital_room",20436
1344,32256,outdoor,"museum/indoor, hospital, cemetery, pharmacy, desert/sand",20436
1345,32280,indoor,"hospital, museum/indoor, cemetery, pharmacy, hospital_room",20436
1346,32304,indoor,"dressing_room, discotheque, ballroom, museum/indoor, stage/indoor",20436
1347,32328,indoor,"dressing_room, museum/indoor, discotheque, ballroom, stage/indoor",20436
1348,32352,indoor,"discotheque, dressing_room, museum/indoor, stage/indoor, ballroom",20436
1349,32376,indoor,"dressing_room, discotheque, museum/indoor, stage/indoor, ballroom",20436
1350,32400,indoor,"museum/indoor, hospital, art_gallery, pharmacy, natural_history_museum",20436
1351,32424,indoor,"museum/indoor, hospital, art_gallery, reception, pharmacy",20436
1352,32448,indoor,"museum/indoor, hospital, art_gallery, pharmacy, reception",20436
1353,32472,indoor,"hospital, museum/indoor, pharmacy, art_gallery, natural_history_museum",20436
1354,32496,indoor,"hospital, museum/indoor, pharmacy, art_gallery, reception",20436
1355,32520,indoor,"reception, art_gallery, lobby, elevator_lobby, museum/indoor",20436
1356,32544,indoor,"dressing_room, discotheque, sauna, museum/indoor, stage/indoor",20436
1357,32568,indoor,"discotheque, museum/indoor, dressing_room, stage/indoor, music_studio",20436
1358,32592,indoor,"dressing_room, discotheque, stage/indoor, locker_room, museum/indoor",20436
1359,32616,indoor,"dressing_room, discotheque, museum/indoor, stage/indoor, locker_room",20436
1360,32640,indoor,"museum/indoor, discotheque, dressing_room, stage/indoor, ballroom",20436
1361,32664,indoor,"discotheque, stage/indoor, museum/indoor, ballroom, dressing_room",20436
1362,32688,indoor,"discotheque, stage/indoor, dressing_room, museum/indoor, ballroom",20436
1363,32712,indoor,"discotheque, dressing_room, stage/indoor, museum/indoor, ballroom",20436
1364,32736,indoor,"dressing_room, discotheque, museum/indoor, stage/indoor, ballroom",20436
1365,32760,indoor,"dressing_room, discotheque, stage/indoor, museum/indoor, ballroom",20436
1366,32784,indoor,"dressing_room, discotheque, museum/indoor, ballroom, stage/indoor",20436
1367,32808,indoor,"dressing_room, discotheque, ballroom, stage/indoor, museum/indoor",20436
1368,32832,indoor,"dressing_room, museum/indoor, discotheque, stage/indoor, ballroom",20436
1369,32856,indoor,"dressing_room, discotheque, ballroom, stage/indoor, museum/indoor",20436
1370,32880,indoor,"dressing_room, museum/indoor, stage/indoor, discotheque, ballroom",20436
1371,32904,indoor,"dressing_room, discotheque, ballroom, stage/indoor, martial_arts_gym",20436
1372,32928,indoor,"dressing_room, ballroom, discotheque, sauna, beauty_salon",20436
1373,32952,indoor,"dressing_room, sauna, discotheque, shower, bathroom",20436
1374,32976,indoor,"museum/indoor, hospital, cemetery, pharmacy, natural_history_museum",20436
1375,33000,indoor,"museum/indoor, pharmacy, hospital, natural_history_museum, cemetery",20436
1376,33024,indoor,"museum/indoor, pharmacy, cemetery, hospital, natural_history_museum",20436
1377,33048,indoor,"museum/indoor, pharmacy, cemetery, natural_history_museum, hospital",20436
1378,33072,indoor,"museum/indoor, reception, pharmacy, art_gallery, drugstore",20436
1379,33096,indoor,"museum/indoor, pharmacy, hospital, cemetery, drugstore",20436
1380,33120,indoor,"museum/indoor, reception, art_gallery, pharmacy, natural_history_museum",20436
1381,33144,indoor,"museum/indoor, pharmacy, natural_history_museum, reception, hospital",20436
1382,33168,indoor,"reception, museum/indoor, lobby, office_cubicles, elevator_lobby",20436
1383,33192,indoor,"dressing_room, ballroom, discotheque, museum/indoor, jewelry_shop",20436
1384,33216,indoor,"dressing_room, ballroom, discotheque, clothing_store, museum/indoor",20436
1385,33240,indoor,"dressing_room, discotheque, ballroom, museum/indoor, clothing_store",20436
1386,33264,indoor,"museum/indoor, hospital, art_gallery, pharmacy, reception",20436
1387,33288,indoor,"museum/indoor, art_gallery, hospital, reception, natural_history_museum",20436
1388,33312,indoor,"hospital, museum/indoor, art_gallery, reception, pharmacy",20436
1389,33336,indoor,"museum/indoor, art_gallery, reception, pharmacy, hospital",20436
1390,33360,indoor,"art_gallery, reception, museum/indoor, hospital, natural_history_museum",20436
1391,33384,indoor,"museum/indoor, hospital, art_gallery, reception, natural_history_museum",20436
1392,33408,indoor,"dressing_room, museum/indoor, clothing_store, ballroom, art_gallery",20436
1393,33432,indoor,"discotheque, dressing_room, shower, ballroom, bathroom",20436
1394,33456,indoor,"discotheque, stage/indoor, ballroom, dressing_room, museum/indoor",20436
1395,33480,indoor,"discotheque, museum/indoor, stage/indoor, martial_arts_gym, boxing_ring",20436
1396,33504,indoor,"museum/indoor, art_gallery, stage/indoor, ballroom, discotheque",20436
1397,33528,indoor,"museum/indoor, natural_history_museum, pharmacy, art_gallery, ice_shelf",20436
1398,33552,outdoor,"museum/indoor, ice_shelf, cemetery, hospital, pharmacy",20436
1399,33576,indoor,"museum/indoor, cemetery, pharmacy, natural_history_museum, ice_shelf",20436
1400,33600,outdoor,"cemetery, museum/indoor, ice_shelf, pharmacy, hospital",20436
1401,33624,indoor,"museum/indoor, pharmacy, cemetery, ice_shelf, natural_history_museum",20436
1402,33648,indoor,"museum/indoor, pharmacy, reception, art_gallery, natural_history_museum",20436
1403,33672,indoor,"museum/indoor, pharmacy, ice_shelf, hospital, natural_history_museum",20436
1404,33696,indoor,"museum/indoor, pharmacy, natural_history_museum, art_gallery, ice_shelf",20436
1405,33720,indoor,"museum/indoor, art_gallery, stage/indoor, ballroom, discotheque",20436
1406,33744,indoor,"museum/indoor, discotheque, stage/indoor, art_gallery, ballroom",20436
1407,33768,indoor,"discotheque, dressing_room, stage/indoor, ballroom, martial_arts_gym",20436
1408,33792,indoor,"discotheque, stage/indoor, martial_arts_gym, museum/indoor, ballroom",20436
1409,33816,indoor,"dressing_room, shower, discotheque, bathroom, art_gallery",20436
1410,33840,indoor,"discotheque, dressing_room, art_gallery, shower, museum/indoor",20436
1411,33864,indoor,"hospital, pharmacy, museum/indoor, drugstore, art_gallery",20436
1412,33888,indoor,"hospital, museum/indoor, pharmacy, art_gallery, drugstore",20436
1413,33912,indoor,"hospital, museum/indoor, art_gallery, pharmacy, reception",20436
1414,33936,indoor,"hospital, museum/indoor, pharmacy, art_gallery, hospital_room",20436
1415,33960,indoor,"hospital, museum/indoor, pharmacy, art_gallery, natural_history_museum",20436
1416,33984,indoor,"hospital, museum/indoor, art_gallery, pharmacy, reception",20436
1417,34008,indoor,"hospital, museum/indoor, art_gallery, pharmacy, reception",20436
1418,34032,indoor,"hospital, museum/indoor, pharmacy, art_gallery, drugstore",20436
1419,34056,indoor,"hospital, pharmacy, museum/indoor, hospital_room, drugstore",20436
1420,34080,indoor,"dressing_room, discotheque, shower, sauna, bathroom",20436
1421,34104,indoor,"museum/indoor, art_gallery, dressing_room, shower, ballroom",20436
1422,34128,indoor,"museum/indoor, dressing_room, stage/indoor, ballroom, nursery",20436
1423,34152,indoor,"clean_room, museum/indoor, chemistry_lab, shower, bow_window/indoor",20436
1424,34176,indoor,"discotheque, museum/indoor, bowling_alley, clean_room, stage/indoor",20436
1425,34200,indoor,"discotheque, martial_arts_gym, stage/indoor, bowling_alley, ballroom",20436
