,frame_num,environment,places,title,year,imdb_id
3728,89472,indoor,"discotheque, classroom, chemistry_lab, basement, stage/indoor",The Red Menace,1949,41791
3729,89496,indoor,"drugstore, archive, pharmacy, classroom, bookstore",The Red Menace,1949,41791
3730,89520,indoor,"biology_laboratory, chemistry_lab, classroom, drugstore, mosque/outdoor",The Red Menace,1949,41791
3731,89544,indoor,"dressing_room, chemistry_lab, biology_laboratory, clean_room, beauty_salon",The Red Menace,1949,41791
3732,89568,indoor,"clean_room, chemistry_lab, biology_laboratory, music_studio, discotheque",The Red Menace,1949,41791
3733,89592,indoor,"clean_room, laundromat, corridor, office_cubicles, arch",The Red Menace,1949,41791
3734,89616,indoor,"office_cubicles, clean_room, office, waiting_room, coffee_shop",The Red Menace,1949,41791
3735,89640,indoor,"clean_room, office_cubicles, laundromat, dressing_room, coffee_shop",The Red Menace,1949,41791
3736,89664,indoor,"clean_room, laundromat, office_cubicles, waiting_room, dressing_room",The Red Menace,1949,41791
3737,89688,indoor,"clean_room, office_cubicles, dressing_room, laundromat, office",The Red Menace,1949,41791
3738,89712,indoor,"clean_room, dressing_room, laundromat, waiting_room, office_cubicles",The Red Menace,1949,41791
3739,89736,indoor,"dressing_room, ballroom, airport_terminal, discotheque, bowling_alley",The Red Menace,1949,41791
3740,89760,indoor,"clean_room, chemistry_lab, science_museum, museum/indoor, biology_laboratory",The Red Menace,1949,41791
3741,89784,indoor,"clean_room, chemistry_lab, biology_laboratory, discotheque, dressing_room",The Red Menace,1949,41791
3742,89808,indoor,"dressing_room, discotheque, music_studio, chemistry_lab, airplane_cabin",The Red Menace,1949,41791
3743,89832,indoor,"entrance_hall, ballroom, lobby, church/indoor, throne_room",The Red Menace,1949,41791
3744,89856,indoor,"entrance_hall, ballroom, lobby, throne_room, church/indoor",The Red Menace,1949,41791
3745,89880,indoor,"entrance_hall, ballroom, lobby, church/indoor, throne_room",The Red Menace,1949,41791
3746,89904,indoor,"entrance_hall, ballroom, lobby, church/indoor, throne_room",The Red Menace,1949,41791
3747,89928,indoor,"entrance_hall, ballroom, lobby, throne_room, church/indoor",The Red Menace,1949,41791
3748,89952,indoor,"entrance_hall, ballroom, lobby, throne_room, church/indoor",The Red Menace,1949,41791
3749,89976,indoor,"entrance_hall, ballroom, lobby, church/indoor, throne_room",The Red Menace,1949,41791
3750,90000,indoor,"entrance_hall, ballroom, lobby, throne_room, church/indoor",The Red Menace,1949,41791
3751,90024,indoor,"entrance_hall, ballroom, lobby, throne_room, church/indoor",The Red Menace,1949,41791
3752,90048,indoor,"entrance_hall, ballroom, throne_room, lobby, church/indoor",The Red Menace,1949,41791
3753,90072,indoor,"ballroom, clean_room, lobby, museum/indoor, mosque/outdoor",The Red Menace,1949,41791
3754,90096,indoor,"kindergarden_classroom, classroom, nursery, lecture_room, discotheque",The Red Menace,1949,41791
3755,90120,outdoor,"swimming_pool/indoor, hot_spring, discotheque, pond, lake/natural",The Red Menace,1949,41791
3756,90144,indoor,"chemistry_lab, bathroom, shower, clean_room, beauty_salon",The Red Menace,1949,41791
3757,90168,indoor,"chemistry_lab, discotheque, bathroom, shower, biology_laboratory",The Red Menace,1949,41791
3758,90192,indoor,"conference_room, office, conference_center, lecture_room, chemistry_lab",The Red Menace,1949,41791
3759,90216,indoor,"clean_room, dressing_room, jewelry_shop, bathroom, beauty_salon",The Red Menace,1949,41791
3760,90240,indoor,"dressing_room, clean_room, airplane_cabin, living_room, beauty_salon",The Red Menace,1949,41791
3761,90264,indoor,"airplane_cabin, dressing_room, clean_room, beauty_salon, living_room",The Red Menace,1949,41791
3762,90288,indoor,"dressing_room, beauty_salon, living_room, clean_room, airplane_cabin",The Red Menace,1949,41791
3763,90312,indoor,"airplane_cabin, clean_room, dressing_room, living_room, beauty_salon",The Red Menace,1949,41791
3764,90336,indoor,"clean_room, dressing_room, living_room, beauty_salon, hospital_room",The Red Menace,1949,41791
3765,90360,indoor,"clean_room, living_room, beauty_salon, dressing_room, nursery",The Red Menace,1949,41791
3766,90384,indoor,"clean_room, dressing_room, biology_laboratory, hospital_room, chemistry_lab",The Red Menace,1949,41791
3767,90408,indoor,"clean_room, living_room, dressing_room, nursery, hospital_room",The Red Menace,1949,41791
3768,90432,indoor,"clean_room, living_room, dressing_room, airplane_cabin, beauty_salon",The Red Menace,1949,41791
3769,90456,indoor,"living_room, nursery, clean_room, dressing_room, beauty_salon",The Red Menace,1949,41791
3770,90480,indoor,"living_room, clean_room, dressing_room, airplane_cabin, nursery",The Red Menace,1949,41791
3771,90504,indoor,"living_room, dining_room, nursery, beauty_salon, waiting_room",The Red Menace,1949,41791
3772,90528,indoor,"living_room, dining_room, waiting_room, clean_room, nursery",The Red Menace,1949,41791
3773,90552,indoor,"living_room, clean_room, dressing_room, dining_room, recreation_room",The Red Menace,1949,41791
3774,90576,indoor,"clean_room, dressing_room, office, bathroom, locker_room",The Red Menace,1949,41791
3775,90600,indoor,"clean_room, office, music_studio, office_cubicles, dressing_room",The Red Menace,1949,41791
3776,90624,indoor,"clean_room, office, office_cubicles, computer_room, dressing_room",The Red Menace,1949,41791
3777,90648,indoor,"clean_room, office, office_cubicles, dressing_room, music_studio",The Red Menace,1949,41791
3778,90672,indoor,"clean_room, office, dressing_room, office_cubicles, locker_room",The Red Menace,1949,41791
3779,90696,indoor,"clean_room, office, office_cubicles, dressing_room, music_studio",The Red Menace,1949,41791
3780,90720,indoor,"dressing_room, discotheque, ballroom, martial_arts_gym, clean_room",The Red Menace,1949,41791
3781,90744,indoor,"dressing_room, discotheque, ballroom, nursing_home, clean_room",The Red Menace,1949,41791
3782,90768,indoor,"dressing_room, ballroom, reception, museum/indoor, clean_room",The Red Menace,1949,41791
3783,90792,indoor,"discotheque, dressing_room, clean_room, ballroom, operating_room",The Red Menace,1949,41791
3784,90816,indoor,"clean_room, operating_room, dressing_room, music_studio, hospital_room",The Red Menace,1949,41791
3785,90840,indoor,"clean_room, hospital_room, operating_room, dressing_room, nursing_home",The Red Menace,1949,41791
3786,90864,indoor,"clean_room, dressing_room, operating_room, discotheque, hospital_room",The Red Menace,1949,41791
3787,90888,indoor,"clean_room, chemistry_lab, locker_room, dressing_room, nursery",The Red Menace,1949,41791
3788,90912,indoor,"clean_room, locker_room, dressing_room, chemistry_lab, operating_room",The Red Menace,1949,41791
3789,90936,indoor,"clean_room, locker_room, dressing_room, chemistry_lab, operating_room",The Red Menace,1949,41791
3790,90960,indoor,"clean_room, operating_room, locker_room, chemistry_lab, physics_laboratory",The Red Menace,1949,41791
3791,90984,indoor,"clean_room, locker_room, dressing_room, operating_room, shower",The Red Menace,1949,41791
3792,91008,indoor,"clean_room, locker_room, dressing_room, operating_room, shower",The Red Menace,1949,41791
3793,91032,indoor,"clean_room, locker_room, dressing_room, operating_room, nursing_home",The Red Menace,1949,41791
3794,91056,indoor,"clean_room, operating_room, dressing_room, locker_room, nursing_home",The Red Menace,1949,41791
3795,91080,indoor,"clean_room, dressing_room, discotheque, nursing_home, music_studio",The Red Menace,1949,41791
3796,91104,indoor,"clean_room, dressing_room, operating_room, discotheque, nursing_home",The Red Menace,1949,41791
3797,91128,indoor,"clean_room, operating_room, discotheque, dressing_room, chemistry_lab",The Red Menace,1949,41791
3798,91152,indoor,"clean_room, dressing_room, discotheque, ballroom, shower",The Red Menace,1949,41791
3799,91176,indoor,"clean_room, discotheque, dressing_room, operating_room, shower",The Red Menace,1949,41791
3800,91200,indoor,"clean_room, discotheque, ballroom, stage/indoor, music_studio",The Red Menace,1949,41791
3801,91224,indoor,"clean_room, discotheque, stage/indoor, dressing_room, ballroom",The Red Menace,1949,41791
3802,91248,indoor,"clean_room, museum/indoor, locker_room, operating_room, dressing_room",The Red Menace,1949,41791
3803,91272,indoor,"clean_room, chemistry_lab, shower, biology_laboratory, operating_room",The Red Menace,1949,41791
3804,91296,indoor,"clean_room, chemistry_lab, biology_laboratory, clothing_store, nursery",The Red Menace,1949,41791
3805,91320,indoor,"chemistry_lab, clean_room, biology_laboratory, bathroom, shower",The Red Menace,1949,41791
3806,91344,indoor,"clean_room, chemistry_lab, archive, museum/indoor, science_museum",The Red Menace,1949,41791
3807,91368,indoor,"clean_room, chemistry_lab, archive, biology_laboratory, physics_laboratory",The Red Menace,1949,41791
3808,91392,indoor,"clean_room, bank_vault, elevator/door, airport_terminal, elevator_lobby",The Red Menace,1949,41791
3809,91416,indoor,"clean_room, elevator_lobby, corridor, airport_terminal, art_gallery",The Red Menace,1949,41791
3810,91440,indoor,"clean_room, corridor, archive, elevator_lobby, office_cubicles",The Red Menace,1949,41791
3811,91464,indoor,"clean_room, office_cubicles, archive, office, corridor",The Red Menace,1949,41791
3812,91488,indoor,"clean_room, chemistry_lab, basement, server_room, office_cubicles",The Red Menace,1949,41791
3813,91512,indoor,"clean_room, chemistry_lab, shower, biology_laboratory, ice_floe",The Red Menace,1949,41791
3814,91536,indoor,"clean_room, biology_laboratory, chemistry_lab, operating_room, physics_laboratory",The Red Menace,1949,41791
3815,91560,indoor,"clean_room, biology_laboratory, chemistry_lab, operating_room, physics_laboratory",The Red Menace,1949,41791
3816,91584,indoor,"clean_room, biology_laboratory, chemistry_lab, operating_room, physics_laboratory",The Red Menace,1949,41791
3817,91608,indoor,"clean_room, biology_laboratory, chemistry_lab, operating_room, physics_laboratory",The Red Menace,1949,41791
3818,91632,indoor,"clean_room, biology_laboratory, chemistry_lab, operating_room, physics_laboratory",The Red Menace,1949,41791
3819,91656,indoor,"clean_room, biology_laboratory, chemistry_lab, physics_laboratory, operating_room",The Red Menace,1949,41791
3820,91680,indoor,"clean_room, biology_laboratory, chemistry_lab, physics_laboratory, computer_room",The Red Menace,1949,41791
3821,91704,indoor,"clean_room, chemistry_lab, biology_laboratory, physics_laboratory, computer_room",The Red Menace,1949,41791
3822,91728,indoor,"clean_room, biology_laboratory, chemistry_lab, operating_room, computer_room",The Red Menace,1949,41791
3823,91752,indoor,"clean_room, chemistry_lab, biology_laboratory, operating_room, physics_laboratory",The Red Menace,1949,41791
3824,91776,indoor,"clean_room, chemistry_lab, biology_laboratory, operating_room, physics_laboratory",The Red Menace,1949,41791
3825,91800,indoor,"clean_room, chemistry_lab, biology_laboratory, physics_laboratory, science_museum",The Red Menace,1949,41791
3826,91824,indoor,"clean_room, chemistry_lab, biology_laboratory, jewelry_shop, bathroom",The Red Menace,1949,41791
3827,91848,indoor,"clean_room, chemistry_lab, biology_laboratory, operating_room, jewelry_shop",The Red Menace,1949,41791
3828,91872,indoor,"clean_room, chemistry_lab, biology_laboratory, jewelry_shop, bathroom",The Red Menace,1949,41791
3829,91896,indoor,"clean_room, biology_laboratory, chemistry_lab, bathroom, jewelry_shop",The Red Menace,1949,41791
3830,91920,indoor,"clean_room, chemistry_lab, dressing_room, operating_room, biology_laboratory",The Red Menace,1949,41791
3831,91944,indoor,"clean_room, science_museum, operating_room, chemistry_lab, biology_laboratory",The Red Menace,1949,41791
3832,91968,indoor,"discotheque, dressing_room, clean_room, ballroom, chemistry_lab",The Red Menace,1949,41791
3833,91992,indoor,"restaurant, pub/indoor, clean_room, banquet_hall, chemistry_lab",The Red Menace,1949,41791
3834,92016,indoor,"chemistry_lab, restaurant, biology_laboratory, clean_room, bar",The Red Menace,1949,41791
3835,92040,indoor,"restaurant, bar, chemistry_lab, coffee_shop, dressing_room",The Red Menace,1949,41791
3836,92064,indoor,"chemistry_lab, dressing_room, biology_laboratory, restaurant, clean_room",The Red Menace,1949,41791
3837,92088,indoor,"banquet_hall, chemistry_lab, clean_room, ice_cream_parlor, restaurant",The Red Menace,1949,41791
3838,92112,indoor,"chemistry_lab, office, restaurant, clean_room, airplane_cabin",The Red Menace,1949,41791
3839,92136,indoor,"restaurant, chemistry_lab, airplane_cabin, office, coffee_shop",The Red Menace,1949,41791
3840,92160,indoor,"chemistry_lab, office, restaurant, clean_room, biology_laboratory",The Red Menace,1949,41791
3841,92184,indoor,"chemistry_lab, office, airplane_cabin, restaurant, dressing_room",The Red Menace,1949,41791
3842,92208,indoor,"chemistry_lab, airplane_cabin, restaurant, banquet_hall, ice_cream_parlor",The Red Menace,1949,41791
3843,92232,indoor,"chemistry_lab, clean_room, office, restaurant, banquet_hall",The Red Menace,1949,41791
3844,92256,indoor,"restaurant, chemistry_lab, ice_cream_parlor, coffee_shop, dressing_room",The Red Menace,1949,41791
3845,92280,indoor,"restaurant, chemistry_lab, bar, dressing_room, ice_cream_parlor",The Red Menace,1949,41791
3846,92304,indoor,"chemistry_lab, restaurant, dressing_room, bar, ice_cream_parlor",The Red Menace,1949,41791
3847,92328,indoor,"chemistry_lab, restaurant, bar, dressing_room, banquet_hall",The Red Menace,1949,41791
3848,92352,indoor,"chemistry_lab, restaurant, biology_laboratory, banquet_hall, cafeteria",The Red Menace,1949,41791
3849,92376,indoor,"chemistry_lab, biology_laboratory, dressing_room, restaurant, clean_room",The Red Menace,1949,41791
3850,92400,indoor,"chemistry_lab, clean_room, restaurant, biology_laboratory, office",The Red Menace,1949,41791
3851,92424,indoor,"clean_room, chemistry_lab, biology_laboratory, restaurant, office",The Red Menace,1949,41791
3852,92448,indoor,"chemistry_lab, clean_room, restaurant, dressing_room, biology_laboratory",The Red Menace,1949,41791
3853,92472,indoor,"chemistry_lab, clean_room, biology_laboratory, restaurant, office",The Red Menace,1949,41791
3854,92496,indoor,"chemistry_lab, clean_room, restaurant, biology_laboratory, dressing_room",The Red Menace,1949,41791
3855,92520,indoor,"chemistry_lab, clean_room, biology_laboratory, restaurant, office",The Red Menace,1949,41791
3856,92544,indoor,"chemistry_lab, biology_laboratory, clean_room, office, restaurant",The Red Menace,1949,41791
3857,92568,indoor,"chemistry_lab, office, conference_center, biology_laboratory, restaurant",The Red Menace,1949,41791
3858,92592,indoor,"chemistry_lab, office, clean_room, biology_laboratory, conference_center",The Red Menace,1949,41791
3859,92616,indoor,"chemistry_lab, biology_laboratory, clean_room, office, restaurant",The Red Menace,1949,41791
3860,92640,indoor,"chemistry_lab, biology_laboratory, conference_center, restaurant, clean_room",The Red Menace,1949,41791
3861,92664,indoor,"chemistry_lab, biology_laboratory, clean_room, restaurant, office",The Red Menace,1949,41791
3862,92688,indoor,"chemistry_lab, clean_room, biology_laboratory, conference_center, restaurant",The Red Menace,1949,41791
3863,92712,indoor,"chemistry_lab, clean_room, biology_laboratory, hospital_room, television_studio",The Red Menace,1949,41791
3864,92736,indoor,"clean_room, dressing_room, chemistry_lab, discotheque, biology_laboratory",The Red Menace,1949,41791
3865,92760,indoor,"dressing_room, chemistry_lab, clean_room, biology_laboratory, office",The Red Menace,1949,41791
3866,92784,indoor,"dressing_room, clean_room, chemistry_lab, biology_laboratory, beauty_salon",The Red Menace,1949,41791
3867,92808,indoor,"dressing_room, chemistry_lab, clean_room, biology_laboratory, beauty_salon",The Red Menace,1949,41791
3868,92832,indoor,"clean_room, chemistry_lab, dressing_room, office, biology_laboratory",The Red Menace,1949,41791
3869,92856,indoor,"clean_room, dressing_room, chemistry_lab, biology_laboratory, conference_center",The Red Menace,1949,41791
3870,92880,indoor,"clean_room, archive, computer_room, office, biology_laboratory",The Red Menace,1949,41791
3871,92904,indoor,"clean_room, biology_laboratory, chemistry_lab, archive, physics_laboratory",The Red Menace,1949,41791
3872,92928,indoor,"clean_room, chemistry_lab, operating_room, biology_laboratory, iceberg",The Red Menace,1949,41791
3873,92952,indoor,"clean_room, chemistry_lab, biology_laboratory, operating_room, computer_room",The Red Menace,1949,41791
3874,92976,indoor,"clean_room, chemistry_lab, biology_laboratory, archive, operating_room",The Red Menace,1949,41791
3875,93000,indoor,"clean_room, operating_room, chemistry_lab, biology_laboratory, archive",The Red Menace,1949,41791
3876,93024,indoor,"clean_room, chemistry_lab, biology_laboratory, operating_room, archive",The Red Menace,1949,41791
3877,93048,indoor,"clean_room, museum/indoor, archive, operating_room, chemistry_lab",The Red Menace,1949,41791
3878,93072,indoor,"clean_room, operating_room, chemistry_lab, archive, biology_laboratory",The Red Menace,1949,41791
3879,93096,indoor,"clean_room, operating_room, archive, chemistry_lab, biology_laboratory",The Red Menace,1949,41791
3880,93120,indoor,"clean_room, chemistry_lab, operating_room, biology_laboratory, archive",The Red Menace,1949,41791
3881,93144,indoor,"clean_room, chemistry_lab, operating_room, biology_laboratory, computer_room",The Red Menace,1949,41791
3882,93168,indoor,"clean_room, computer_room, archive, biology_laboratory, chemistry_lab",The Red Menace,1949,41791
3883,93192,indoor,"clean_room, archive, computer_room, operating_room, biology_laboratory",The Red Menace,1949,41791
3884,93216,indoor,"clean_room, chemistry_lab, biology_laboratory, operating_room, archive",The Red Menace,1949,41791
3885,93240,indoor,"clean_room, archive, operating_room, chemistry_lab, biology_laboratory",The Red Menace,1949,41791
3886,93264,indoor,"clean_room, chemistry_lab, iceberg, discotheque, museum/indoor",The Red Menace,1949,41791
3887,93288,indoor,"discotheque, dressing_room, ballroom, stage/indoor, bar",The Red Menace,1949,41791
3888,93312,indoor,"ballroom, natural_history_museum, museum/indoor, clothing_store, dressing_room",The Red Menace,1949,41791
3889,93336,indoor,"dressing_room, beauty_salon, discotheque, airplane_cabin, operating_room",The Red Menace,1949,41791
3890,93360,indoor,"dressing_room, beauty_salon, clothing_store, discotheque, bathroom",The Red Menace,1949,41791
3891,93384,indoor,"pharmacy, hospital, drugstore, archive, clean_room",The Red Menace,1949,41791
3892,93408,indoor,"pharmacy, hospital, drugstore, archive, clean_room",The Red Menace,1949,41791
3893,93432,indoor,"pharmacy, hospital, drugstore, archive, clean_room",The Red Menace,1949,41791
3894,93456,indoor,"pharmacy, hospital, drugstore, archive, clean_room",The Red Menace,1949,41791
3895,93480,indoor,"dressing_room, beauty_salon, clothing_store, discotheque, art_gallery",The Red Menace,1949,41791
3896,93504,indoor,"dressing_room, beauty_salon, shower, discotheque, music_studio",The Red Menace,1949,41791
3897,93528,indoor,"dressing_room, beauty_salon, discotheque, clothing_store, operating_room",The Red Menace,1949,41791
3898,93552,indoor,"dressing_room, beauty_salon, airplane_cabin, clothing_store, discotheque",The Red Menace,1949,41791
3899,93576,indoor,"beauty_salon, dressing_room, discotheque, clothing_store, airplane_cabin",The Red Menace,1949,41791
3900,93600,indoor,"discotheque, dressing_room, beauty_salon, shower, stage/indoor",The Red Menace,1949,41791
3901,93624,indoor,"shower, airplane_cabin, discotheque, dressing_room, beauty_salon",The Red Menace,1949,41791
3902,93648,indoor,"shower, discotheque, dressing_room, beauty_salon, clean_room",The Red Menace,1949,41791
3903,93672,indoor,"discotheque, banquet_hall, ballroom, airplane_cabin, dressing_room",The Red Menace,1949,41791
3904,93696,indoor,"banquet_hall, discotheque, ballroom, airplane_cabin, dressing_room",The Red Menace,1949,41791
3905,93720,indoor,"banquet_hall, discotheque, airplane_cabin, ballroom, dressing_room",The Red Menace,1949,41791
3906,93744,indoor,"airplane_cabin, discotheque, ballroom, banquet_hall, shower",The Red Menace,1949,41791
3907,93768,indoor,"discotheque, banquet_hall, ballroom, clean_room, airplane_cabin",The Red Menace,1949,41791
3908,93792,indoor,"banquet_hall, ballroom, discotheque, airplane_cabin, clean_room",The Red Menace,1949,41791
3909,93816,indoor,"discotheque, airplane_cabin, ballroom, banquet_hall, clean_room",The Red Menace,1949,41791
3910,93840,indoor,"airplane_cabin, banquet_hall, ballroom, discotheque, shower",The Red Menace,1949,41791
3911,93864,indoor,"discotheque, airplane_cabin, dressing_room, banquet_hall, ballroom",The Red Menace,1949,41791
3912,93888,indoor,"dressing_room, discotheque, ballroom, banquet_hall, clean_room",The Red Menace,1949,41791
3913,93912,indoor,"dressing_room, discotheque, ballroom, shower, banquet_hall",The Red Menace,1949,41791
3914,93936,indoor,"dressing_room, banquet_hall, discotheque, ballroom, shower",The Red Menace,1949,41791
3915,93960,indoor,"shower, dressing_room, airplane_cabin, bathroom, natural_history_museum",The Red Menace,1949,41791
3916,93984,indoor,"shower, bathroom, airplane_cabin, discotheque, beauty_salon",The Red Menace,1949,41791
3917,94008,indoor,"operating_room, chemistry_lab, bathroom, hotel_room, ballroom",The Red Menace,1949,41791
3918,94032,indoor,"clean_room, ballroom, banquet_hall, chemistry_lab, operating_room",The Red Menace,1949,41791
3919,94056,indoor,"chemistry_lab, banquet_hall, dining_room, ballroom, clean_room",The Red Menace,1949,41791
3920,94080,indoor,"dining_room, conference_room, chemistry_lab, banquet_hall, operating_room",The Red Menace,1949,41791
3921,94104,indoor,"clean_room, operating_room, dining_room, banquet_hall, dressing_room",The Red Menace,1949,41791
3922,94128,indoor,"banquet_hall, dining_room, conference_room, ballroom, restaurant",The Red Menace,1949,41791
3923,94152,indoor,"banquet_hall, dining_room, conference_room, ballroom, restaurant",The Red Menace,1949,41791
3924,94176,indoor,"banquet_hall, operating_room, chemistry_lab, dining_room, dining_hall",The Red Menace,1949,41791
3925,94200,indoor,"banquet_hall, dining_room, conference_room, restaurant, dining_hall",The Red Menace,1949,41791
3926,94224,indoor,"operating_room, banquet_hall, chemistry_lab, dining_room, clean_room",The Red Menace,1949,41791
3927,94248,indoor,"shower, clean_room, operating_room, dressing_room, attic",The Red Menace,1949,41791
3928,94272,indoor,"shower, bathroom, operating_room, clean_room, attic",The Red Menace,1949,41791
3929,94296,indoor,"bathroom, operating_room, chemistry_lab, clean_room, shower",The Red Menace,1949,41791
3930,94320,indoor,"shower, science_museum, clean_room, bathroom, nursery",The Red Menace,1949,41791
3931,94344,indoor,"shower, bathroom, airplane_cabin, clean_room, operating_room",The Red Menace,1949,41791
3932,94368,indoor,"clean_room, chemistry_lab, laundromat, office_cubicles, bathroom",The Red Menace,1949,41791
3933,94392,indoor,"clean_room, basement, art_gallery, corridor, airport_terminal",The Red Menace,1949,41791
3934,94416,indoor,"clean_room, art_gallery, museum/indoor, parking_garage/indoor, airport_terminal",The Red Menace,1949,41791
3935,94440,indoor,"clean_room, art_gallery, parking_garage/indoor, corridor, entrance_hall",The Red Menace,1949,41791
3936,94464,indoor,"clean_room, art_gallery, operating_room, corridor, parking_garage/indoor",The Red Menace,1949,41791
3937,94488,indoor,"clean_room, parking_garage/indoor, corridor, chemistry_lab, bank_vault",The Red Menace,1949,41791
3938,94512,indoor,"clean_room, operating_room, bank_vault, corridor, hospital_room",The Red Menace,1949,41791
3939,94536,indoor,"clean_room, operating_room, chemistry_lab, corridor, hospital_room",The Red Menace,1949,41791
3940,94560,indoor,"clean_room, art_gallery, corridor, chemistry_lab, operating_room",The Red Menace,1949,41791
3941,94584,indoor,"corridor, clean_room, dressing_room, elevator_lobby, elevator/door",The Red Menace,1949,41791
3942,94608,indoor,"clean_room, shower, corridor, art_gallery, museum/indoor",The Red Menace,1949,41791
3943,94632,indoor,"clean_room, office, corridor, art_gallery, chemistry_lab",The Red Menace,1949,41791
3944,94656,indoor,"corridor, clean_room, office, office_cubicles, airport_terminal",The Red Menace,1949,41791
3945,94680,indoor,"clean_room, chemistry_lab, biology_laboratory, operating_room, hospital_room",The Red Menace,1949,41791
3946,94704,indoor,"clean_room, biology_laboratory, chemistry_lab, pharmacy, corridor",The Red Menace,1949,41791
3947,94728,indoor,"clean_room, corridor, office, office_cubicles, hospital_room",The Red Menace,1949,41791
3948,94752,indoor,"clean_room, corridor, office_cubicles, office, elevator_lobby",The Red Menace,1949,41791
3949,94776,indoor,"clean_room, corridor, office_cubicles, office, elevator_lobby",The Red Menace,1949,41791
3950,94800,indoor,"clean_room, corridor, office, office_cubicles, elevator_lobby",The Red Menace,1949,41791
3951,94824,indoor,"clean_room, corridor, office, office_cubicles, elevator_lobby",The Red Menace,1949,41791
3952,94848,indoor,"clean_room, office, office_cubicles, corridor, elevator_lobby",The Red Menace,1949,41791
3953,94872,indoor,"clean_room, office_cubicles, office, corridor, elevator_lobby",The Red Menace,1949,41791
3954,94896,indoor,"clean_room, office_cubicles, office, corridor, elevator_lobby",The Red Menace,1949,41791
3955,94920,indoor,"clean_room, office, office_cubicles, corridor, elevator_lobby",The Red Menace,1949,41791
3956,94944,indoor,"clean_room, office, office_cubicles, corridor, elevator_lobby",The Red Menace,1949,41791
