,frame_num,environment,places,imdb_id
3195,76680,outdoor,"discotheque, dressing_room, ice_shelf, orchard, ice_floe",64437
3196,76704,indoor,"discotheque, dressing_room, ice_shelf, ice_floe, chemistry_lab",64437
3197,76728,indoor,"discotheque, dressing_room, ice_shelf, chemistry_lab, shower",64437
3198,76752,indoor,"discotheque, stage/indoor, dressing_room, music_studio, ice_shelf",64437
3199,76776,indoor,"discotheque, ice_shelf, playground, dressing_room, chemistry_lab",64437
3200,76800,indoor,"dressing_room, discotheque, shower, bathroom, hospital_room",64437
3201,76824,indoor,"dressing_room, discotheque, shower, hospital_room, bathroom",64437
3202,76848,indoor,"dressing_room, discotheque, shower, chemistry_lab, hospital_room",64437
3203,76872,indoor,"dressing_room, discotheque, clean_room, chemistry_lab, ice_floe",64437
3204,76896,outdoor,"discotheque, ice_shelf, ice_floe, dressing_room, carrousel",64437
3205,76920,outdoor,"amusement_park, carrousel, temple/asia, pagoda, ice_shelf",64437
3206,76944,outdoor,"ice_shelf, crevasse, glacier, mountain_snowy, ski_slope",64437
3207,76968,outdoor,"ice_shelf, mountain_snowy, snowfield, ski_slope, ice_floe",64437
3208,76992,outdoor,"ice_shelf, snowfield, ice_floe, mountain_snowy, ski_slope",64437
3209,77016,outdoor,"ski_resort, ice_shelf, ice_floe, chalet, mountain_snowy",64437
3210,77040,outdoor,"schoolhouse, ski_resort, residential_neighborhood, house, inn/outdoor",64437
3211,77064,outdoor,"schoolhouse, doorway/outdoor, house, cottage, chalet",64437
3212,77088,outdoor,"schoolhouse, doorway/outdoor, house, cottage, manufactured_home",64437
3213,77112,outdoor,"doorway/outdoor, porch, manufactured_home, schoolhouse, shed",64437
3214,77136,outdoor,"doorway/outdoor, manufactured_home, schoolhouse, porch, house",64437
3215,77160,outdoor,"doorway/outdoor, porch, manufactured_home, courthouse, bow_window/indoor",64437
3216,77184,outdoor,"doorway/outdoor, manufactured_home, porch, bow_window/indoor, schoolhouse",64437
3217,77208,outdoor,"doorway/outdoor, manufactured_home, porch, bow_window/indoor, shed",64437
3218,77232,outdoor,"doorway/outdoor, porch, bow_window/indoor, sauna, manufactured_home",64437
3219,77256,indoor,"doorway/outdoor, bow_window/indoor, archive, porch, sauna",64437
3220,77280,indoor,"doorway/outdoor, bow_window/indoor, sauna, closet, porch",64437
3221,77304,indoor,"bow_window/indoor, doorway/outdoor, closet, archive, sauna",64437
3222,77328,indoor,"archive, bow_window/indoor, clean_room, office, doorway/outdoor",64437
3223,77352,indoor,"archive, clean_room, bow_window/indoor, pharmacy, office",64437
3224,77376,indoor,"clean_room, bow_window/indoor, closet, shower, elevator/door",64437
3225,77400,indoor,"clean_room, bow_window/indoor, closet, dressing_room, clothing_store",64437
3226,77424,indoor,"clean_room, clothing_store, closet, dressing_room, bow_window/indoor",64437
3227,77448,indoor,"clean_room, dressing_room, closet, clothing_store, archive",64437
3228,77472,indoor,"clean_room, dressing_room, clothing_store, shower, closet",64437
3229,77496,indoor,"bow_window/indoor, closet, jail_cell, server_room, doorway/outdoor",64437
3230,77520,indoor,"bow_window/indoor, doorway/outdoor, elevator/door, corridor, server_room",64437
3231,77544,indoor,"bow_window/indoor, doorway/outdoor, corridor, elevator/door, clean_room",64437
3232,77568,indoor,"elevator/door, clean_room, elevator_lobby, closet, locker_room",64437
3233,77592,indoor,"elevator/door, elevator_lobby, closet, clean_room, locker_room",64437
3234,77616,indoor,"elevator/door, clean_room, elevator_lobby, closet, locker_room",64437
3235,77640,indoor,"clean_room, dressing_room, elevator/door, hospital_room, locker_room",64437
3236,77664,indoor,"dressing_room, beauty_salon, clean_room, martial_arts_gym, clothing_store",64437
3237,77688,outdoor,"igloo, aquarium, ice_floe, amusement_park, science_museum",64437
3238,77712,outdoor,"igloo, iceberg, science_museum, museum/indoor, ice_shelf",64437
3239,77736,indoor,"beauty_salon, waiting_room, office, dressing_room, clean_room",64437
3240,77760,indoor,"dining_room, home_office, artists_loft, living_room, office",64437
3241,77784,indoor,"dining_room, waiting_room, living_room, bow_window/indoor, balcony/interior",64437
3242,77808,indoor,"playground, gymnasium/indoor, waiting_room, bow_window/indoor, nursery",64437
3243,77832,indoor,"playground, gymnasium/indoor, nursery, waiting_room, bow_window/indoor",64437
3244,77856,indoor,"playground, waiting_room, nursery, gymnasium/indoor, bow_window/indoor",64437
3245,77880,indoor,"playground, waiting_room, nursery, gymnasium/indoor, balcony/interior",64437
3246,77904,indoor,"playground, waiting_room, nursery, gymnasium/indoor, balcony/interior",64437
3247,77928,indoor,"playground, waiting_room, gymnasium/indoor, nursery, bow_window/indoor",64437
3248,77952,indoor,"playground, waiting_room, nursery, gymnasium/indoor, balcony/interior",64437
3249,77976,indoor,"playground, waiting_room, balcony/interior, bow_window/indoor, staircase",64437
3250,78000,indoor,"playground, waiting_room, gymnasium/indoor, balcony/interior, nursery",64437
3251,78024,indoor,"playground, gymnasium/indoor, shower, waiting_room, jacuzzi/indoor",64437
3252,78048,indoor,"playground, gymnasium/indoor, shower, jacuzzi/indoor, waiting_room",64437
3253,78072,indoor,"playground, waiting_room, gymnasium/indoor, jacuzzi/indoor, shower",64437
3254,78096,indoor,"playground, shower, gymnasium/indoor, jacuzzi/indoor, nursery",64437
3255,78120,indoor,"playground, bow_window/indoor, waiting_room, shower, living_room",64437
3256,78144,indoor,"playground, waiting_room, jacuzzi/indoor, shower, gymnasium/indoor",64437
3257,78168,indoor,"playground, jacuzzi/indoor, shower, waiting_room, bow_window/indoor",64437
3258,78192,indoor,"waiting_room, jacuzzi/indoor, boat_deck, bow_window/indoor, playground",64437
3259,78216,indoor,"playground, bow_window/indoor, waiting_room, atrium/public, hotel_room",64437
3260,78240,indoor,"playground, waiting_room, jacuzzi/indoor, nursery, gymnasium/indoor",64437
3261,78264,indoor,"playground, shower, jacuzzi/indoor, waiting_room, gymnasium/indoor",64437
3262,78288,indoor,"playground, shower, jacuzzi/indoor, bow_window/indoor, nursery",64437
3263,78312,indoor,"playground, jacuzzi/indoor, shower, gymnasium/indoor, swimming_pool/indoor",64437
3264,78336,indoor,"playground, jacuzzi/indoor, waiting_room, shower, bow_window/indoor",64437
3265,78360,indoor,"playground, bow_window/indoor, shower, nursery, hotel_room",64437
3266,78384,indoor,"waiting_room, balcony/interior, bow_window/indoor, living_room, hotel_room",64437
3267,78408,indoor,"waiting_room, balcony/interior, bow_window/indoor, dining_room, playground",64437
3268,78432,indoor,"waiting_room, balcony/interior, bow_window/indoor, living_room, dining_room",64437
3269,78456,indoor,"waiting_room, balcony/interior, bow_window/indoor, living_room, dining_room",64437
3270,78480,indoor,"waiting_room, balcony/interior, conference_room, playground, recreation_room",64437
3271,78504,indoor,"waiting_room, balcony/interior, playground, conference_room, bow_window/indoor",64437
3272,78528,indoor,"waiting_room, office, reception, computer_room, home_office",64437
3273,78552,indoor,"hospital_room, hotel_room, nursery, living_room, dressing_room",64437
3274,78576,indoor,"dressing_room, clean_room, shower, discotheque, chemistry_lab",64437
3275,78600,indoor,"clean_room, dressing_room, shower, art_gallery, museum/indoor",64437
3276,78624,indoor,"clean_room, igloo, bedroom, alcove, iceberg",64437
3277,78648,indoor,"clean_room, bow_window/indoor, dressing_room, office, museum/indoor",64437
3278,78672,indoor,"clean_room, science_museum, museum/indoor, greenhouse/outdoor, bow_window/indoor",64437
3279,78696,indoor,"clean_room, museum/indoor, bow_window/indoor, science_museum, office",64437
3280,78720,indoor,"restaurant, dressing_room, dining_room, balcony/interior, patio",64437
3281,78744,indoor,"restaurant, patio, cafeteria, dining_room, waiting_room",64437
3282,78768,indoor,"waiting_room, patio, restaurant, dressing_room, dining_room",64437
3283,78792,indoor,"clean_room, museum/indoor, science_museum, operating_room, hospital_room",64437
3284,78816,indoor,"clean_room, museum/indoor, science_museum, operating_room, physics_laboratory",64437
3285,78840,indoor,"dining_room, restaurant, coffee_shop, dressing_room, cafeteria",64437
3286,78864,indoor,"dressing_room, gymnasium/indoor, museum/indoor, restaurant, cafeteria",64437
3287,78888,indoor,"gymnasium/indoor, waiting_room, shoe_shop, museum/indoor, playground",64437
3288,78912,indoor,"locker_room, gymnasium/indoor, dressing_room, shoe_shop, boat_deck",64437
3289,78936,indoor,"gymnasium/indoor, locker_room, playground, boat_deck, martial_arts_gym",64437
3290,78960,indoor,"gymnasium/indoor, playground, waiting_room, boat_deck, beauty_salon",64437
3291,78984,indoor,"dressing_room, gymnasium/indoor, waiting_room, boat_deck, shoe_shop",64437
3292,79008,indoor,"boat_deck, dressing_room, waiting_room, gymnasium/indoor, shoe_shop",64437
3293,79032,indoor,"beauty_salon, hospital_room, laundromat, waiting_room, chemistry_lab",64437
3294,79056,indoor,"clean_room, server_room, archive, art_gallery, locker_room",64437
3295,79080,indoor,"server_room, clean_room, elevator/door, locker_room, hospital_room",64437
3296,79104,indoor,"clean_room, server_room, hospital_room, archive, pharmacy",64437
3297,79128,indoor,"clean_room, server_room, hospital_room, hospital, archive",64437
3298,79152,indoor,"clean_room, server_room, office, hospital_room, pharmacy",64437
3299,79176,indoor,"clean_room, server_room, elevator/door, locker_room, hospital_room",64437
3300,79200,indoor,"server_room, clean_room, hospital_room, hospital, phone_booth",64437
3301,79224,indoor,"server_room, clean_room, hospital_room, hospital, phone_booth",64437
3302,79248,indoor,"clean_room, server_room, hospital_room, hospital, archive",64437
3303,79272,indoor,"clean_room, server_room, hospital_room, hospital, archive",64437
3304,79296,indoor,"clean_room, server_room, hospital_room, hospital, archive",64437
3305,79320,indoor,"clean_room, archive, server_room, beauty_salon, dressing_room",64437
3306,79344,indoor,"clean_room, elevator/door, server_room, locker_room, shower",64437
3307,79368,indoor,"clean_room, locker_room, server_room, shower, dressing_room",64437
3308,79392,indoor,"server_room, elevator/door, bow_window/indoor, locker_room, doorway/outdoor",64437
3309,79416,indoor,"dressing_room, locker_room, clean_room, hospital_room, beauty_salon",64437
3310,79440,indoor,"dressing_room, beauty_salon, clean_room, hospital_room, chemistry_lab",64437
3311,79464,indoor,"dressing_room, beauty_salon, shower, discotheque, nursery",64437
3312,79488,indoor,"dressing_room, locker_room, beauty_salon, gymnasium/indoor, shower",64437
3313,79512,indoor,"chemistry_lab, dressing_room, shower, bathroom, gymnasium/indoor",64437
3314,79536,indoor,"martial_arts_gym, gymnasium/indoor, locker_room, dressing_room, bowling_alley",64437
3315,79560,indoor,"dressing_room, shower, locker_room, museum/indoor, bathroom",64437
3316,79584,indoor,"shower, dressing_room, bathroom, clean_room, laundromat",64437
3317,79608,indoor,"dressing_room, shower, beauty_salon, discotheque, hospital_room",64437
3318,79632,indoor,"dressing_room, discotheque, beauty_salon, shower, bowling_alley",64437
3319,79656,indoor,"bathroom, shower, dressing_room, locker_room, bedroom",64437
3320,79680,indoor,"shower, bathroom, ice_floe, museum/indoor, aquarium",64437
3321,79704,indoor,"ice_floe, museum/indoor, ice_shelf, aquarium, shower",64437
3322,79728,indoor,"shower, ice_shelf, ice_floe, beauty_salon, aquarium",64437
3323,79752,indoor,"shower, bathroom, dressing_room, locker_room, sauna",64437
3324,79776,indoor,"shower, bathroom, dressing_room, locker_room, sauna",64437
3325,79800,indoor,"shower, dressing_room, locker_room, bathroom, discotheque",64437
3326,79824,indoor,"shower, bathroom, dressing_room, beauty_salon, museum/indoor",64437
3327,79848,indoor,"beauty_salon, shower, clean_room, aquarium, chemistry_lab",64437
3328,79872,indoor,"clean_room, hospital_room, shower, beauty_salon, dressing_room",64437
3329,79896,indoor,"clean_room, hospital_room, beauty_salon, shower, dressing_room",64437
3330,79920,indoor,"clean_room, hospital_room, museum/indoor, beauty_salon, shower",64437
3331,79944,indoor,"shower, beauty_salon, dressing_room, hospital_room, locker_room",64437
3332,79968,indoor,"beauty_salon, shower, aquarium, bathroom, clean_room",64437
3333,79992,indoor,"beauty_salon, shower, clean_room, dressing_room, museum/indoor",64437
3334,80016,indoor,"shower, dressing_room, bathroom, locker_room, sauna",64437
3335,80040,outdoor,"ice_shelf, ocean, beach, volleyball_court/outdoor, campsite",64437
3336,80064,outdoor,"ice_shelf, desert/sand, beach, ocean, volleyball_court/outdoor",64437
3337,80088,indoor,"shower, bathroom, dressing_room, jacuzzi/indoor, beauty_salon",64437
3338,80112,indoor,"shower, dressing_room, bathroom, locker_room, museum/indoor",64437
3339,80136,indoor,"shower, bathroom, dressing_room, locker_room, sauna",64437
3340,80160,indoor,"museum/indoor, shower, locker_room, science_museum, beauty_salon",64437
3341,80184,indoor,"shower, bathroom, science_museum, clean_room, museum/indoor",64437
3342,80208,indoor,"shower, bathroom, museum/indoor, beauty_salon, clean_room",64437
3343,80232,outdoor,"ice_shelf, volleyball_court/outdoor, desert/sand, beach, ocean",64437
3344,80256,outdoor,"ice_shelf, ocean, campsite, beach, desert/sand",64437
3345,80280,outdoor,"desert/sand, beach, ice_shelf, ocean, coast",64437
3346,80304,indoor,"shower, bathroom, museum/indoor, science_museum, natural_history_museum",64437
3347,80328,indoor,"shower, bathroom, jacuzzi/indoor, museum/indoor, dressing_room",64437
3348,80352,indoor,"shower, bathroom, sauna, dressing_room, jacuzzi/indoor",64437
3349,80376,indoor,"shower, sauna, locker_room, hospital_room, office",64437
3350,80400,indoor,"clean_room, hospital_room, office, sauna, beauty_salon",64437
3351,80424,indoor,"shower, locker_room, bathroom, laundromat, dressing_room",64437
3352,80448,indoor,"shower, dressing_room, bathroom, clean_room, beauty_salon",64437
3353,80472,indoor,"dressing_room, locker_room, laundromat, clean_room, beauty_salon",64437
3354,80496,indoor,"dressing_room, laundromat, shower, bathroom, locker_room",64437
3355,80520,indoor,"clean_room, laundromat, locker_room, beauty_salon, dressing_room",64437
3356,80544,indoor,"clean_room, locker_room, laundromat, beauty_salon, dressing_room",64437
3357,80568,indoor,"laundromat, clean_room, locker_room, beauty_salon, shower",64437
3358,80592,indoor,"clean_room, locker_room, beauty_salon, laundromat, dressing_room",64437
3359,80616,indoor,"locker_room, dressing_room, clean_room, beauty_salon, shower",64437
3360,80640,indoor,"dressing_room, locker_room, clean_room, beauty_salon, hospital_room",64437
3361,80664,indoor,"dressing_room, locker_room, beauty_salon, hospital_room, clean_room",64437
3362,80688,indoor,"dressing_room, beauty_salon, locker_room, shower, hospital_room",64437
3363,80712,indoor,"dressing_room, beauty_salon, hospital_room, locker_room, clean_room",64437
3364,80736,indoor,"dressing_room, beauty_salon, hospital_room, locker_room, clean_room",64437
3365,80760,indoor,"dressing_room, beauty_salon, discotheque, locker_room, ballroom",64437
3366,80784,indoor,"dressing_room, beauty_salon, locker_room, discotheque, martial_arts_gym",64437
3367,80808,indoor,"dressing_room, beauty_salon, martial_arts_gym, locker_room, discotheque",64437
3368,80832,indoor,"dressing_room, shower, beauty_salon, bathroom, clean_room",64437
3369,80856,indoor,"bathroom, shower, crevasse, ice_shelf, closet",64437
3370,80880,indoor,"beauty_salon, dressing_room, airplane_cabin, clothing_store, bus_interior",64437
3371,80904,outdoor,"dressing_room, ice_shelf, shoe_shop, ocean, volleyball_court/outdoor",64437
3372,80928,outdoor,"beach, desert/sand, ocean, ice_shelf, shoe_shop",64437
3373,80952,outdoor,"ice_shelf, beauty_salon, shoe_shop, ocean, iceberg",64437
3374,80976,indoor,"shoe_shop, ice_shelf, martial_arts_gym, iceberg, beauty_salon",64437
3375,81000,indoor,"dressing_room, bedroom, desert/sand, ice_floe, shoe_shop",64437
3376,81024,outdoor,"shoe_shop, ice_shelf, volleyball_court/outdoor, martial_arts_gym, ocean",64437
3377,81048,indoor,"boxing_ring, dressing_room, volleyball_court/outdoor, martial_arts_gym, gymnasium/indoor",64437
3378,81072,indoor,"boxing_ring, martial_arts_gym, volleyball_court/outdoor, dressing_room, runway",64437
3379,81096,outdoor,"ice_shelf, ocean, volleyball_court/outdoor, martial_arts_gym, dressing_room",64437
3380,81120,outdoor,"dressing_room, ocean, beach, volleyball_court/outdoor, shower",64437
3381,81144,outdoor,"ice_shelf, iceberg, ice_floe, ocean, shoe_shop",64437
3382,81168,outdoor,"dressing_room, ocean, volleyball_court/outdoor, beach, shower",64437
3383,81192,indoor,"dressing_room, shoe_shop, volleyball_court/outdoor, shower, boxing_ring",64437
3384,81216,outdoor,"dressing_room, volleyball_court/outdoor, ocean, ice_shelf, beauty_salon",64437
3385,81240,outdoor,"dressing_room, volleyball_court/outdoor, boxing_ring, ocean, beach",64437
3386,81264,outdoor,"dressing_room, beauty_salon, volleyball_court/outdoor, ocean, beach",64437
3387,81288,indoor,"dressing_room, shower, bedroom, boxing_ring, beauty_salon",64437
3388,81312,indoor,"boxing_ring, volleyball_court/outdoor, martial_arts_gym, iceberg, shower",64437
3389,81336,outdoor,"volleyball_court/outdoor, martial_arts_gym, boxing_ring, ice_shelf, iceberg",64437
3390,81360,outdoor,"dressing_room, ice_shelf, ice_floe, iceberg, shower",64437
3391,81384,outdoor,"dressing_room, shower, ice_floe, ice_shelf, volleyball_court/outdoor",64437
3392,81408,indoor,"dressing_room, shower, bedroom, beauty_salon, ocean",64437
3393,81432,indoor,"dressing_room, shower, bedroom, gymnasium/indoor, volleyball_court/outdoor",64437
3394,81456,indoor,"dressing_room, shower, ocean, beach, beauty_salon",64437
3395,81480,outdoor,"ocean, underwater/ocean_deep, ice_shelf, ice_floe, shower",64437
3396,81504,outdoor,"ocean, underwater/ocean_deep, ice_shelf, ice_floe, shower",64437
3397,81528,outdoor,"shower, ice_floe, ocean, ice_shelf, beach",64437
3398,81552,outdoor,"shower, ocean, ice_shelf, underwater/ocean_deep, beauty_salon",64437
3399,81576,outdoor,"shower, ocean, ice_shelf, ice_floe, beauty_salon",64437
3400,81600,outdoor,"dressing_room, shower, volleyball_court/outdoor, ocean, ice_shelf",64437
3401,81624,indoor,"dressing_room, volleyball_court/outdoor, boxing_ring, discotheque, shower",64437
3402,81648,indoor,"dressing_room, volleyball_court/outdoor, boxing_ring, discotheque, martial_arts_gym",64437
3403,81672,indoor,"dressing_room, volleyball_court/outdoor, martial_arts_gym, boxing_ring, gymnasium/indoor",64437
3404,81696,indoor,"volleyball_court/outdoor, dressing_room, martial_arts_gym, boxing_ring, shower",64437
3405,81720,indoor,"dressing_room, shower, volleyball_court/outdoor, beauty_salon, ocean",64437
3406,81744,outdoor,"ice_shelf, ice_floe, ocean, shower, dressing_room",64437
3407,81768,outdoor,"ice_shelf, ice_floe, ocean, iceberg, shower",64437
3408,81792,outdoor,"ice_shelf, ocean, underwater/ocean_deep, ice_floe, iceberg",64437
3409,81816,outdoor,"ice_shelf, ice_floe, ocean, shower, beach",64437
3410,81840,indoor,"auto_factory, assembly_line, parking_lot, boat_deck, auto_showroom",64437
3411,81864,indoor,"auto_factory, assembly_line, boat_deck, hangar/indoor, runway",64437
3412,81888,indoor,"airport_terminal, hangar/indoor, clean_room, parking_garage/indoor, auto_factory",64437
3413,81912,outdoor,"boat_deck, auto_factory, runway, raceway, parking_lot",64437
3414,81936,indoor,"boat_deck, car_interior, auto_factory, parking_lot, assembly_line",64437
3415,81960,indoor,"bathroom, car_interior, auto_factory, boat_deck, igloo",64437
3416,81984,outdoor,"igloo, parking_lot, raceway, car_interior, boat_deck",64437
3417,82008,indoor,"bathroom, igloo, shower, clean_room, ice_floe",64437
3418,82032,indoor,"shower, bathroom, clean_room, parking_lot, dam",64437
3419,82056,indoor,"boat_deck, airport_terminal, hangar/indoor, auto_factory, parking_garage/indoor",64437
3420,82080,indoor,"airport_terminal, parking_lot, parking_garage/indoor, hangar/indoor, train_station/platform",64437
3421,82104,outdoor,"airport_terminal, crosswalk, staircase, promenade, boardwalk",64437
3422,82128,outdoor,"drugstore, pharmacy, crosswalk, motel, stadium/baseball",64437
3423,82152,outdoor,"motel, gas_station, hospital, industrial_area, drugstore",64437
3424,82176,indoor,"auto_factory, assembly_line, parking_lot, auto_showroom, raceway",64437
3425,82200,indoor,"auto_factory, parking_lot, junkyard, assembly_line, car_interior",64437
3426,82224,indoor,"auto_factory, assembly_line, clean_room, bowling_alley, cafeteria",64437
3427,82248,indoor,"bowling_alley, assembly_line, clean_room, auto_factory, gymnasium/indoor",64437
3428,82272,outdoor,"amusement_park, crosswalk, auto_factory, carrousel, assembly_line",64437
3429,82296,indoor,"arcade, cafeteria, coffee_shop, dressing_room, clean_room",64437
3430,82320,indoor,"clean_room, entrance_hall, airport_terminal, escalator/indoor, atrium/public",64437
3431,82344,indoor,"airport_terminal, pharmacy, drugstore, airplane_cabin, hospital",64437
3432,82368,indoor,"laundromat, hospital, shopfront, beauty_salon, shoe_shop",64437
3433,82392,indoor,"laundromat, jewelry_shop, subway_station/platform, airplane_cabin, beauty_salon",64437
3434,82416,indoor,"museum/outdoor, laundromat, pharmacy, synagogue/outdoor, ice_cream_parlor",64437
3435,82440,indoor,"beauty_salon, dressing_room, hotel_room, ice_shelf, bathroom",64437
3436,82464,indoor,"beauty_salon, dressing_room, shower, bathroom, office",64437
3437,82488,indoor,"dressing_room, shower, bathroom, beauty_salon, office",64437
3438,82512,indoor,"dressing_room, beauty_salon, bathroom, shower, locker_room",64437
3439,82536,indoor,"beauty_salon, dressing_room, shower, bathroom, museum/indoor",64437
3440,82560,indoor,"dressing_room, beauty_salon, shower, bathroom, museum/indoor",64437
3441,82584,indoor,"dressing_room, beauty_salon, shower, bathroom, museum/indoor",64437
3442,82608,indoor,"dressing_room, shower, beauty_salon, bathroom, chemistry_lab",64437
3443,82632,indoor,"dressing_room, beauty_salon, shower, bathroom, clean_room",64437
3444,82656,indoor,"dressing_room, iceberg, beauty_salon, shower, clean_room",64437
3445,82680,indoor,"clean_room, dressing_room, beauty_salon, chemistry_lab, biology_laboratory",64437
3446,82704,indoor,"dressing_room, beauty_salon, television_studio, office, stage/indoor",64437
3447,82728,indoor,"dressing_room, beauty_salon, shower, bathroom, discotheque",64437
3448,82752,indoor,"dressing_room, beauty_salon, museum/indoor, shower, bathroom",64437
3449,82776,indoor,"dressing_room, beauty_salon, museum/indoor, shower, bathroom",64437
3450,82800,indoor,"dressing_room, beauty_salon, shower, museum/indoor, bathroom",64437
3451,82824,indoor,"dressing_room, beauty_salon, shower, museum/indoor, bathroom",64437
3452,82848,indoor,"dressing_room, beauty_salon, bathroom, shower, chemistry_lab",64437
3453,82872,indoor,"dressing_room, beauty_salon, shower, bathroom, office",64437
3454,82896,indoor,"dressing_room, beauty_salon, shower, bathroom, museum/indoor",64437
3455,82920,indoor,"dressing_room, beauty_salon, shower, bathroom, museum/indoor",64437
3456,82944,indoor,"dressing_room, beauty_salon, shower, bathroom, museum/indoor",64437
3457,82968,indoor,"dressing_room, beauty_salon, shower, bathroom, museum/indoor",64437
3458,82992,indoor,"dressing_room, beauty_salon, bathroom, shower, museum/indoor",64437
3459,83016,indoor,"dressing_room, shower, beauty_salon, bathroom, sauna",64437
3460,83040,indoor,"dressing_room, beauty_salon, shower, discotheque, bathroom",64437
3461,83064,indoor,"dressing_room, beauty_salon, shower, bathroom, locker_room",64437
3462,83088,indoor,"dressing_room, shower, beauty_salon, bathroom, discotheque",64437
3463,83112,indoor,"dressing_room, shower, bathroom, beauty_salon, museum/indoor",64437
3464,83136,outdoor,"ice_shelf, mountain_snowy, orchard, ski_slope, snowfield",64437
3465,83160,indoor,"ice_shelf, jewelry_shop, dressing_room, beauty_salon, ice_floe",64437
3466,83184,indoor,"dressing_room, hospital_room, bedroom, beauty_salon, dorm_room",64437
3467,83208,indoor,"hospital_room, bedroom, shower, clean_room, beauty_salon",64437
3468,83232,indoor,"corridor, elevator/door, elevator_lobby, airplane_cabin, airport_terminal",64437
3469,83256,indoor,"dressing_room, hotel_room, bow_window/indoor, corridor, bedroom",64437
3470,83280,indoor,"dressing_room, office, bathroom, elevator/door, shower",64437
3471,83304,indoor,"office, dressing_room, home_office, office_cubicles, reception",64437
3472,83328,indoor,"office, locker_room, dressing_room, office_cubicles, home_office",64437
3473,83352,indoor,"office, locker_room, dressing_room, office_cubicles, archive",64437
3474,83376,indoor,"office, home_office, office_cubicles, locker_room, dressing_room",64437
3475,83400,indoor,"office, locker_room, dressing_room, office_cubicles, home_office",64437
3476,83424,indoor,"elevator/door, jail_cell, elevator_lobby, locker_room, dressing_room",64437
3477,83448,indoor,"airplane_cabin, bathroom, shower, attic, clean_room",64437
3478,83472,indoor,"hotel_room, shower, bathroom, dressing_room, ice_shelf",64437
3479,83496,indoor,"dressing_room, beauty_salon, clothing_store, discotheque, chemistry_lab",64437
3480,83520,indoor,"dressing_room, clothing_store, beauty_salon, discotheque, airplane_cabin",64437
3481,83544,indoor,"dressing_room, clothing_store, beauty_salon, gift_shop, department_store",64437
3482,83568,indoor,"dressing_room, clothing_store, beauty_salon, gift_shop, discotheque",64437
3483,83592,indoor,"dressing_room, clothing_store, gift_shop, beauty_salon, museum/indoor",64437
