,frame_num,environment,places,title,year,imdb_id
1406,33744,indoor,"pharmacy, ticket_booth, shopfront, drugstore, diner/outdoor",The Red Menace,1949,41791
1407,33768,indoor,"ticket_booth, pharmacy, shopfront, general_store/outdoor, drugstore",The Red Menace,1949,41791
1408,33792,outdoor,"mosque/outdoor, courthouse, ticket_booth, hospital, museum/outdoor",The Red Menace,1949,41791
1409,33816,outdoor,"mosque/outdoor, ticket_booth, hangar/outdoor, hospital, runway",The Red Menace,1949,41791
1410,33840,outdoor,"mosque/outdoor, ticket_booth, hospital, hangar/outdoor, museum/outdoor",The Red Menace,1949,41791
1411,33864,outdoor,"mosque/outdoor, hospital, hangar/outdoor, ticket_booth, museum/outdoor",The Red Menace,1949,41791
1412,33888,outdoor,"mosque/outdoor, ticket_booth, courthouse, hospital, hangar/outdoor",The Red Menace,1949,41791
1413,33912,indoor,"clean_room, computer_room, drugstore, pharmacy, biology_laboratory",The Red Menace,1949,41791
1414,33936,indoor,"pharmacy, drugstore, mosque/outdoor, chemistry_lab, airport_terminal",The Red Menace,1949,41791
1415,33960,outdoor,"runway, igloo, playground, clean_room, hospital_room",The Red Menace,1949,41791
1416,33984,indoor,"clean_room, museum/indoor, hospital_room, science_museum, igloo",The Red Menace,1949,41791
1417,34008,indoor,"hospital_room, runway, playground, clean_room, museum/indoor",The Red Menace,1949,41791
1418,34032,indoor,"chemistry_lab, biology_laboratory, mosque/outdoor, shower, beauty_salon",The Red Menace,1949,41791
1419,34056,indoor,"beauty_salon, bathroom, chemistry_lab, biology_laboratory, airplane_cabin",The Red Menace,1949,41791
1420,34080,indoor,"discotheque, playground, beauty_salon, biology_laboratory, chemistry_lab",The Red Menace,1949,41791
1421,34104,indoor,"discotheque, beauty_salon, chemistry_lab, biology_laboratory, playground",The Red Menace,1949,41791
1422,34128,indoor,"pharmacy, shopfront, ticket_booth, drugstore, general_store/outdoor",The Red Menace,1949,41791
1423,34152,indoor,"pharmacy, ticket_booth, shopfront, drugstore, diner/outdoor",The Red Menace,1949,41791
1424,34176,indoor,"ticket_booth, pharmacy, diner/outdoor, ice_cream_parlor, phone_booth",The Red Menace,1949,41791
1425,34200,outdoor,"ticket_booth, courthouse, diner/outdoor, pharmacy, hospital",The Red Menace,1949,41791
1426,34224,indoor,"amusement_park, hospital_room, mosque/outdoor, beauty_salon, chemistry_lab",The Red Menace,1949,41791
1427,34248,indoor,"amusement_park, hospital_room, beauty_salon, ball_pit, playroom",The Red Menace,1949,41791
1428,34272,indoor,"hospital_room, amusement_park, beauty_salon, nursery, ball_pit",The Red Menace,1949,41791
1429,34296,indoor,"beauty_salon, pharmacy, ticket_booth, bar, coffee_shop",The Red Menace,1949,41791
1430,34320,indoor,"ticket_booth, laundromat, beauty_salon, pharmacy, shopfront",The Red Menace,1949,41791
1431,34344,indoor,"laundromat, classroom, beauty_salon, airport_terminal, lecture_room",The Red Menace,1949,41791
1432,34368,indoor,"beauty_salon, pharmacy, booth/indoor, shopfront, classroom",The Red Menace,1949,41791
1433,34392,indoor,"discotheque, nursery, beauty_salon, kindergarden_classroom, drugstore",The Red Menace,1949,41791
1434,34416,indoor,"discotheque, classroom, beauty_salon, dressing_room, kindergarden_classroom",The Red Menace,1949,41791
1435,34440,indoor,"clean_room, beauty_salon, discotheque, drugstore, locker_room",The Red Menace,1949,41791
1436,34464,indoor,"clean_room, drugstore, pharmacy, laundromat, beauty_salon",The Red Menace,1949,41791
1437,34488,indoor,"beauty_salon, drugstore, pharmacy, clean_room, locker_room",The Red Menace,1949,41791
1438,34512,indoor,"clean_room, dressing_room, locker_room, beauty_salon, operating_room",The Red Menace,1949,41791
1439,34536,indoor,"discotheque, dressing_room, beauty_salon, bowling_alley, kindergarden_classroom",The Red Menace,1949,41791
1440,34560,indoor,"airplane_cabin, dressing_room, clean_room, bus_interior, train_interior",The Red Menace,1949,41791
1441,34584,indoor,"dressing_room, airplane_cabin, clean_room, locker_room, classroom",The Red Menace,1949,41791
1442,34608,indoor,"clean_room, dressing_room, hospital_room, operating_room, chemistry_lab",The Red Menace,1949,41791
1443,34632,indoor,"office_cubicles, airport_terminal, classroom, clean_room, assembly_line",The Red Menace,1949,41791
1444,34656,indoor,"clean_room, operating_room, hospital_room, dressing_room, office_cubicles",The Red Menace,1949,41791
1445,34680,indoor,"airport_terminal, classroom, clean_room, cafeteria, food_court",The Red Menace,1949,41791
1446,34704,indoor,"clean_room, airport_terminal, cafeteria, dressing_room, hospital_room",The Red Menace,1949,41791
1447,34728,indoor,"clean_room, dressing_room, hospital_room, chemistry_lab, office_cubicles",The Red Menace,1949,41791
1448,34752,indoor,"airport_terminal, office_cubicles, clean_room, waiting_room, cafeteria",The Red Menace,1949,41791
1449,34776,indoor,"auto_factory, parking_garage/indoor, engine_room, assembly_line, clean_room",The Red Menace,1949,41791
1450,34800,indoor,"auto_factory, parking_lot, clean_room, assembly_line, airplane_cabin",The Red Menace,1949,41791
1451,34824,indoor,"auto_factory, parking_lot, airplane_cabin, clean_room, parking_garage/indoor",The Red Menace,1949,41791
1452,34848,indoor,"auto_factory, parking_garage/indoor, assembly_line, engine_room, airplane_cabin",The Red Menace,1949,41791
1453,34872,indoor,"airplane_cabin, auto_factory, clean_room, parking_garage/indoor, auto_showroom",The Red Menace,1949,41791
1454,34896,indoor,"parking_lot, auto_factory, crosswalk, parking_garage/indoor, auto_showroom",The Red Menace,1949,41791
1455,34920,indoor,"bus_interior, parking_lot, car_interior, auto_factory, parking_garage/indoor",The Red Menace,1949,41791
1456,34944,indoor,"parking_lot, auto_factory, beauty_salon, parking_garage/indoor, crosswalk",The Red Menace,1949,41791
1457,34968,indoor,"television_studio, music_studio, auto_factory, clean_room, beauty_salon",The Red Menace,1949,41791
1458,34992,indoor,"auto_showroom, parking_garage/indoor, television_studio, auto_factory, crosswalk",The Red Menace,1949,41791
1459,35016,indoor,"parking_garage/indoor, auto_showroom, parking_lot, crosswalk, auto_factory",The Red Menace,1949,41791
1460,35040,indoor,"auto_showroom, parking_garage/indoor, auto_factory, parking_lot, assembly_line",The Red Menace,1949,41791
1461,35064,indoor,"clean_room, auto_factory, auto_showroom, parking_garage/indoor, hospital_room",The Red Menace,1949,41791
1462,35088,indoor,"airplane_cabin, airport_terminal, hospital_room, operating_room, clean_room",The Red Menace,1949,41791
1463,35112,indoor,"classroom, lecture_room, laundromat, archive, clean_room",The Red Menace,1949,41791
1464,35136,indoor,"bus_interior, waiting_room, classroom, airport_terminal, airplane_cabin",The Red Menace,1949,41791
1465,35160,indoor,"discotheque, kindergarden_classroom, classroom, bar, bowling_alley",The Red Menace,1949,41791
1466,35184,indoor,"bowling_alley, airport_terminal, shower, clean_room, hospital_room",The Red Menace,1949,41791
1467,35208,indoor,"clean_room, discotheque, airport_terminal, bowling_alley, classroom",The Red Menace,1949,41791
1468,35232,indoor,"clean_room, discotheque, airplane_cabin, hospital_room, operating_room",The Red Menace,1949,41791
1469,35256,indoor,"locker_room, discotheque, airport_terminal, classroom, hospital_room",The Red Menace,1949,41791
1470,35280,outdoor,"balcony/interior, courtyard, restaurant_patio, patio, slum",The Red Menace,1949,41791
1471,35304,outdoor,"patio, balcony/interior, courtyard, restaurant_patio, cafeteria",The Red Menace,1949,41791
1472,35328,outdoor,"patio, balcony/interior, restaurant_patio, courtyard, porch",The Red Menace,1949,41791
1473,35352,indoor,"dressing_room, airplane_cabin, clothing_store, airport_terminal, beauty_salon",The Red Menace,1949,41791
1474,35376,indoor,"dressing_room, clean_room, clothing_store, airplane_cabin, discotheque",The Red Menace,1949,41791
1475,35400,indoor,"clean_room, dressing_room, hospital_room, operating_room, clothing_store",The Red Menace,1949,41791
1476,35424,outdoor,"restaurant_patio, crosswalk, patio, balcony/interior, cafeteria",The Red Menace,1949,41791
1477,35448,outdoor,"crosswalk, street, restaurant_patio, slum, courtyard",The Red Menace,1949,41791
1478,35472,outdoor,"gas_station, crosswalk, phone_booth, train_station/platform, restaurant_patio",The Red Menace,1949,41791
1479,35496,outdoor,"slum, bazaar/outdoor, crosswalk, alley, gas_station",The Red Menace,1949,41791
1480,35520,outdoor,"slum, crosswalk, bazaar/outdoor, street, motel",The Red Menace,1949,41791
1481,35544,outdoor,"slum, bazaar/outdoor, crosswalk, motel, gas_station",The Red Menace,1949,41791
1482,35568,outdoor,"crosswalk, slum, bazaar/outdoor, gas_station, motel",The Red Menace,1949,41791
1483,35592,outdoor,"gas_station, motel, coffee_shop, restaurant_patio, crosswalk",The Red Menace,1949,41791
1484,35616,indoor,"ticket_booth, server_room, phone_booth, bank_vault, doorway/outdoor",The Red Menace,1949,41791
1485,35640,indoor,"ticket_booth, airport_terminal, phone_booth, ice_cream_parlor, coffee_shop",The Red Menace,1949,41791
1486,35664,indoor,"pharmacy, drugstore, ticket_booth, bookstore, hardware_store",The Red Menace,1949,41791
1487,35688,indoor,"food_court, airport_terminal, cafeteria, bookstore, drugstore",The Red Menace,1949,41791
1488,35712,indoor,"airport_terminal, food_court, cafeteria, coffee_shop, supermarket",The Red Menace,1949,41791
1489,35736,indoor,"amusement_park, food_court, cafeteria, playground, hardware_store",The Red Menace,1949,41791
1490,35760,indoor,"clean_room, atrium/public, boat_deck, chemistry_lab, carrousel",The Red Menace,1949,41791
1491,35784,indoor,"atrium/public, bus_interior, clean_room, escalator/indoor, engine_room",The Red Menace,1949,41791
1492,35808,indoor,"escalator/indoor, atrium/public, airport_terminal, shopping_mall/indoor, engine_room",The Red Menace,1949,41791
1493,35832,indoor,"clean_room, atrium/public, engine_room, chemistry_lab, auto_factory",The Red Menace,1949,41791
1494,35856,indoor,"clean_room, engine_room, chemistry_lab, physics_laboratory, bus_interior",The Red Menace,1949,41791
1495,35880,indoor,"atrium/public, escalator/indoor, fire_escape, elevator_shaft, staircase",The Red Menace,1949,41791
1496,35904,indoor,"atrium/public, elevator_shaft, clean_room, engine_room, shopping_mall/indoor",The Red Menace,1949,41791
1497,35928,indoor,"clean_room, engine_room, atrium/public, boat_deck, chemistry_lab",The Red Menace,1949,41791
1498,35952,indoor,"clean_room, assembly_line, boat_deck, chemistry_lab, auto_factory",The Red Menace,1949,41791
1499,35976,outdoor,"amusement_park, playground, boat_deck, clean_room, chemistry_lab",The Red Menace,1949,41791
1500,36000,indoor,"clean_room, chemistry_lab, engine_room, boat_deck, physics_laboratory",The Red Menace,1949,41791
1501,36024,indoor,"boat_deck, clean_room, chemistry_lab, engine_room, harbor",The Red Menace,1949,41791
1502,36048,indoor,"clean_room, chemistry_lab, boat_deck, physics_laboratory, assembly_line",The Red Menace,1949,41791
1503,36072,indoor,"clean_room, chemistry_lab, physics_laboratory, boat_deck, assembly_line",The Red Menace,1949,41791
1504,36096,indoor,"clean_room, assembly_line, operating_room, auto_factory, biology_laboratory",The Red Menace,1949,41791
1505,36120,indoor,"clean_room, auto_factory, elevator_shaft, engine_room, physics_laboratory",The Red Menace,1949,41791
1506,36144,indoor,"elevator_shaft, atrium/public, clean_room, airport_terminal, construction_site",The Red Menace,1949,41791
1507,36168,indoor,"dressing_room, beauty_salon, chemistry_lab, clean_room, museum/indoor",The Red Menace,1949,41791
1508,36192,indoor,"museum/indoor, fountain, ballroom, music_studio, dressing_room",The Red Menace,1949,41791
1509,36216,indoor,"dressing_room, music_studio, museum/indoor, stage/indoor, beauty_salon",The Red Menace,1949,41791
1510,36240,indoor,"stage/indoor, music_studio, museum/indoor, television_studio, discotheque",The Red Menace,1949,41791
1511,36264,indoor,"chemistry_lab, music_studio, physics_laboratory, conference_center, museum/indoor",The Red Menace,1949,41791
1512,36288,indoor,"banquet_hall, restaurant, conference_center, dining_hall, chemistry_lab",The Red Menace,1949,41791
1513,36312,indoor,"computer_room, clean_room, music_studio, office, conference_center",The Red Menace,1949,41791
1514,36336,indoor,"clean_room, chemistry_lab, locker_room, dressing_room, biology_laboratory",The Red Menace,1949,41791
1515,36360,indoor,"dressing_room, clean_room, restaurant, chemistry_lab, train_interior",The Red Menace,1949,41791
1516,36384,indoor,"clean_room, archive, locker_room, library/indoor, chemistry_lab",The Red Menace,1949,41791
1517,36408,indoor,"restaurant, cafeteria, dining_hall, waiting_room, pub/indoor",The Red Menace,1949,41791
1518,36432,indoor,"clean_room, restaurant, cafeteria, chemistry_lab, dressing_room",The Red Menace,1949,41791
1519,36456,indoor,"cafeteria, restaurant, clean_room, dining_hall, banquet_hall",The Red Menace,1949,41791
1520,36480,indoor,"computer_room, conference_room, biology_laboratory, lecture_room, clean_room",The Red Menace,1949,41791
1521,36504,indoor,"dressing_room, museum/indoor, art_gallery, shower, clothing_store",The Red Menace,1949,41791
1522,36528,indoor,"dressing_room, museum/indoor, art_gallery, shower, stage/indoor",The Red Menace,1949,41791
1523,36552,indoor,"dressing_room, museum/indoor, stage/indoor, art_gallery, shower",The Red Menace,1949,41791
1524,36576,indoor,"dressing_room, music_studio, art_gallery, stage/indoor, shower",The Red Menace,1949,41791
1525,36600,indoor,"dressing_room, museum/indoor, art_gallery, shower, music_studio",The Red Menace,1949,41791
1526,36624,indoor,"dressing_room, music_studio, art_gallery, museum/indoor, stage/indoor",The Red Menace,1949,41791
1527,36648,indoor,"music_studio, dressing_room, stage/indoor, shower, chemistry_lab",The Red Menace,1949,41791
1528,36672,indoor,"dressing_room, music_studio, shower, stage/indoor, discotheque",The Red Menace,1949,41791
1529,36696,indoor,"banquet_hall, dining_hall, conference_room, dressing_room, dining_room",The Red Menace,1949,41791
1530,36720,indoor,"clean_room, conference_room, office, archive, dining_room",The Red Menace,1949,41791
1531,36744,indoor,"clean_room, locker_room, biology_laboratory, chemistry_lab, dressing_room",The Red Menace,1949,41791
1532,36768,indoor,"chemistry_lab, biology_laboratory, clean_room, dressing_room, classroom",The Red Menace,1949,41791
1533,36792,indoor,"chemistry_lab, clean_room, biology_laboratory, restaurant, dining_room",The Red Menace,1949,41791
1534,36816,indoor,"chemistry_lab, clean_room, archive, physics_laboratory, biology_laboratory",The Red Menace,1949,41791
1535,36840,indoor,"chemistry_lab, clean_room, biology_laboratory, physics_laboratory, archive",The Red Menace,1949,41791
1536,36864,indoor,"chemistry_lab, clean_room, biology_laboratory, physics_laboratory, archive",The Red Menace,1949,41791
1537,36888,indoor,"parking_garage/indoor, parking_lot, auto_factory, crosswalk, assembly_line",The Red Menace,1949,41791
1538,36912,indoor,"parking_garage/indoor, parking_lot, auto_factory, auto_showroom, assembly_line",The Red Menace,1949,41791
1539,36936,indoor,"parking_lot, parking_garage/indoor, auto_factory, auto_showroom, beauty_salon",The Red Menace,1949,41791
1540,36960,indoor,"chemistry_lab, archive, clean_room, biology_laboratory, operating_room",The Red Menace,1949,41791
1541,36984,indoor,"chemistry_lab, clean_room, archive, biology_laboratory, physics_laboratory",The Red Menace,1949,41791
1542,37008,indoor,"clean_room, chemistry_lab, biology_laboratory, archive, physics_laboratory",The Red Menace,1949,41791
1543,37032,indoor,"chemistry_lab, clean_room, biology_laboratory, archive, physics_laboratory",The Red Menace,1949,41791
1544,37056,indoor,"clean_room, chemistry_lab, biology_laboratory, physics_laboratory, operating_room",The Red Menace,1949,41791
1545,37080,indoor,"chemistry_lab, clean_room, biology_laboratory, archive, physics_laboratory",The Red Menace,1949,41791
1546,37104,indoor,"clean_room, chemistry_lab, biology_laboratory, archive, physics_laboratory",The Red Menace,1949,41791
1547,37128,indoor,"chemistry_lab, clean_room, biology_laboratory, archive, physics_laboratory",The Red Menace,1949,41791
1548,37152,indoor,"chemistry_lab, clean_room, biology_laboratory, physics_laboratory, archive",The Red Menace,1949,41791
1549,37176,indoor,"chemistry_lab, classroom, biology_laboratory, clean_room, computer_room",The Red Menace,1949,41791
1550,37200,indoor,"archive, clean_room, library/indoor, chemistry_lab, restaurant",The Red Menace,1949,41791
1551,37224,indoor,"restaurant, cafeteria, food_court, biology_laboratory, chemistry_lab",The Red Menace,1949,41791
1552,37248,indoor,"conference_room, clean_room, chemistry_lab, library/indoor, hospital_room",The Red Menace,1949,41791
1553,37272,indoor,"clean_room, chemistry_lab, biology_laboratory, restaurant, airport_terminal",The Red Menace,1949,41791
1554,37296,indoor,"clean_room, classroom, archive, computer_room, chemistry_lab",The Red Menace,1949,41791
1555,37320,indoor,"dressing_room, music_studio, classroom, museum/indoor, chemistry_lab",The Red Menace,1949,41791
1556,37344,indoor,"museum/indoor, dressing_room, waiting_room, living_room, beauty_salon",The Red Menace,1949,41791
1557,37368,indoor,"dressing_room, television_studio, museum/indoor, beauty_salon, living_room",The Red Menace,1949,41791
1558,37392,indoor,"dressing_room, museum/indoor, television_studio, art_gallery, music_studio",The Red Menace,1949,41791
1559,37416,indoor,"museum/indoor, dressing_room, archive, ballroom, beauty_salon",The Red Menace,1949,41791
1560,37440,indoor,"museum/indoor, dressing_room, music_studio, stage/indoor, art_gallery",The Red Menace,1949,41791
1561,37464,indoor,"clean_room, airport_terminal, biology_laboratory, office_cubicles, chemistry_lab",The Red Menace,1949,41791
1562,37488,indoor,"chemistry_lab, dressing_room, office, physics_laboratory, biology_laboratory",The Red Menace,1949,41791
1563,37512,indoor,"playground, classroom, waiting_room, airport_terminal, physics_laboratory",The Red Menace,1949,41791
1564,37536,indoor,"office, computer_room, classroom, office_cubicles, music_studio",The Red Menace,1949,41791
1565,37560,indoor,"chemistry_lab, biology_laboratory, clean_room, airport_terminal, bowling_alley",The Red Menace,1949,41791
1566,37584,indoor,"airport_terminal, shower, waiting_room, bathroom, bowling_alley",The Red Menace,1949,41791
1567,37608,indoor,"airport_terminal, swimming_pool/indoor, gymnasium/indoor, bowling_alley, laundromat",The Red Menace,1949,41791
1568,37632,indoor,"boxing_ring, music_studio, gymnasium/indoor, bowling_alley, classroom",The Red Menace,1949,41791
1569,37656,indoor,"office, computer_room, office_cubicles, gymnasium/indoor, classroom",The Red Menace,1949,41791
1570,37680,indoor,"dressing_room, music_studio, beauty_salon, shower, discotheque",The Red Menace,1949,41791
1571,37704,indoor,"classroom, airport_terminal, car_interior, coffee_shop, dressing_room",The Red Menace,1949,41791
1572,37728,indoor,"dressing_room, music_studio, beauty_salon, stage/indoor, shower",The Red Menace,1949,41791
1573,37752,outdoor,"dressing_room, playground, beauty_salon, athletic_field/outdoor, soccer_field",The Red Menace,1949,41791
1574,37776,indoor,"dressing_room, music_studio, beauty_salon, stage/indoor, museum/indoor",The Red Menace,1949,41791
1575,37800,indoor,"dressing_room, shower, ice_cream_parlor, carrousel, beauty_salon",The Red Menace,1949,41791
1576,37824,indoor,"dressing_room, music_studio, shower, stage/indoor, museum/indoor",The Red Menace,1949,41791
1577,37848,indoor,"dressing_room, shower, stage/indoor, music_studio, museum/indoor",The Red Menace,1949,41791
1578,37872,indoor,"dressing_room, museum/indoor, art_gallery, stage/indoor, shower",The Red Menace,1949,41791
1579,37896,indoor,"dressing_room, shower, music_studio, stage/indoor, discotheque",The Red Menace,1949,41791
1580,37920,indoor,"dressing_room, clothing_store, beauty_salon, bowling_alley, art_gallery",The Red Menace,1949,41791
1581,37944,indoor,"airport_terminal, classroom, playground, bowling_alley, phone_booth",The Red Menace,1949,41791
1582,37968,indoor,"classroom, coffee_shop, waiting_room, bowling_alley, airport_terminal",The Red Menace,1949,41791
1583,37992,indoor,"classroom, clean_room, bowling_alley, chemistry_lab, boxing_ring",The Red Menace,1949,41791
1584,38016,indoor,"cafeteria, food_court, bowling_alley, classroom, airport_terminal",The Red Menace,1949,41791
1585,38040,indoor,"airport_terminal, bowling_alley, car_interior, waiting_room, office_cubicles",The Red Menace,1949,41791
1586,38064,indoor,"archive, museum/indoor, conference_room, conference_center, lecture_room",The Red Menace,1949,41791
1587,38088,indoor,"museum/indoor, conference_center, dressing_room, conference_room, lecture_room",The Red Menace,1949,41791
1588,38112,indoor,"museum/indoor, conference_room, art_gallery, archive, dressing_room",The Red Menace,1949,41791
1589,38136,indoor,"restaurant, cafeteria, banquet_hall, dining_hall, food_court",The Red Menace,1949,41791
1590,38160,indoor,"museum/indoor, conference_room, archive, conference_center, office",The Red Menace,1949,41791
1591,38184,indoor,"banquet_hall, conference_center, conference_room, discotheque, lecture_room",The Red Menace,1949,41791
1592,38208,indoor,"museum/indoor, dressing_room, archive, art_gallery, clean_room",The Red Menace,1949,41791
1593,38232,indoor,"clean_room, discotheque, nursery, cafeteria, bowling_alley",The Red Menace,1949,41791
1594,38256,indoor,"dressing_room, clean_room, restaurant, airplane_cabin, hospital_room",The Red Menace,1949,41791
1595,38280,indoor,"dressing_room, clean_room, locker_room, airplane_cabin, beauty_salon",The Red Menace,1949,41791
1596,38304,indoor,"clean_room, hospital_room, chemistry_lab, classroom, dressing_room",The Red Menace,1949,41791
1597,38328,indoor,"classroom, chemistry_lab, coffee_shop, bar, music_studio",The Red Menace,1949,41791
1598,38352,indoor,"restaurant, coffee_shop, ice_cream_parlor, cafeteria, biology_laboratory",The Red Menace,1949,41791
1599,38376,indoor,"coffee_shop, clean_room, food_court, cafeteria, restaurant",The Red Menace,1949,41791
1600,38400,indoor,"music_studio, dressing_room, coffee_shop, classroom, office",The Red Menace,1949,41791
1601,38424,indoor,"clean_room, restaurant, chemistry_lab, biology_laboratory, dressing_room",The Red Menace,1949,41791
1602,38448,indoor,"conference_center, television_studio, lecture_room, museum/indoor, conference_room",The Red Menace,1949,41791
1603,38472,indoor,"television_studio, chemistry_lab, conference_center, music_studio, archive",The Red Menace,1949,41791
1604,38496,indoor,"museum/indoor, dressing_room, living_room, ballroom, television_studio",The Red Menace,1949,41791
1605,38520,indoor,"music_studio, television_studio, dressing_room, conference_center, stage/indoor",The Red Menace,1949,41791
1606,38544,indoor,"clean_room, dressing_room, locker_room, sauna, living_room",The Red Menace,1949,41791
1607,38568,indoor,"dressing_room, clean_room, locker_room, music_studio, basement",The Red Menace,1949,41791
1608,38592,indoor,"locker_room, clean_room, corridor, dressing_room, elevator_lobby",The Red Menace,1949,41791
1609,38616,indoor,"locker_room, clean_room, dressing_room, discotheque, martial_arts_gym",The Red Menace,1949,41791
1610,38640,indoor,"clean_room, hospital_room, nursery, dressing_room, locker_room",The Red Menace,1949,41791
1611,38664,indoor,"clean_room, locker_room, hospital_room, nursery, chemistry_lab",The Red Menace,1949,41791
1612,38688,indoor,"clean_room, locker_room, martial_arts_gym, nursery, jail_cell",The Red Menace,1949,41791
1613,38712,indoor,"clean_room, locker_room, jail_cell, nursery, hospital_room",The Red Menace,1949,41791
1614,38736,indoor,"clean_room, locker_room, nursery, operating_room, archive",The Red Menace,1949,41791
1615,38760,indoor,"nursery, locker_room, clean_room, dressing_room, jail_cell",The Red Menace,1949,41791
1616,38784,indoor,"clean_room, locker_room, nursery, archive, jail_cell",The Red Menace,1949,41791
1617,38808,indoor,"clean_room, locker_room, archive, jail_cell, nursery",The Red Menace,1949,41791
1618,38832,indoor,"clean_room, locker_room, nursery, jail_cell, hospital_room",The Red Menace,1949,41791
1619,38856,indoor,"clean_room, locker_room, dressing_room, hospital_room, chemistry_lab",The Red Menace,1949,41791
1620,38880,indoor,"clean_room, hospital_room, operating_room, locker_room, corridor",The Red Menace,1949,41791
1621,38904,indoor,"dressing_room, clean_room, nursery, hospital_room, locker_room",The Red Menace,1949,41791
1622,38928,indoor,"clean_room, nursery, locker_room, dressing_room, discotheque",The Red Menace,1949,41791
1623,38952,indoor,"locker_room, clean_room, jail_cell, hospital_room, nursery",The Red Menace,1949,41791
1624,38976,indoor,"locker_room, dressing_room, clean_room, sauna, basement",The Red Menace,1949,41791
1625,39000,indoor,"dressing_room, clean_room, locker_room, hospital_room, music_studio",The Red Menace,1949,41791
1626,39024,indoor,"clean_room, dressing_room, nursery, music_studio, discotheque",The Red Menace,1949,41791
1627,39048,indoor,"dressing_room, clean_room, locker_room, hospital_room, chemistry_lab",The Red Menace,1949,41791
1628,39072,indoor,"dressing_room, clean_room, locker_room, hospital_room, chemistry_lab",The Red Menace,1949,41791
1629,39096,indoor,"dressing_room, clean_room, locker_room, chemistry_lab, hospital_room",The Red Menace,1949,41791
1630,39120,outdoor,"pond, marsh, hot_spring, lake/natural, field/wild",The Red Menace,1949,41791
1631,39144,indoor,"basement, discotheque, reception, locker_room, classroom",The Red Menace,1949,41791
1632,39168,indoor,"basement, corridor, clean_room, locker_room, art_gallery",The Red Menace,1949,41791
