,frame_num,environment,places,imdb_id
2274,54576,indoor,"ice_shelf, chemistry_lab, museum/indoor, clean_room, runway",20436
2275,54600,outdoor,"ice_shelf, chemistry_lab, clean_room, igloo, iceberg",20436
2276,54624,indoor,"ice_shelf, clean_room, mountain_snowy, museum/indoor, chemistry_lab",20436
2277,54648,outdoor,"ice_shelf, iceberg, runway, museum/indoor, mountain_snowy",20436
2278,54672,indoor,"ice_shelf, museum/indoor, chemistry_lab, clean_room, runway",20436
2279,54696,indoor,"clean_room, ice_shelf, museum/indoor, chemistry_lab, runway",20436
2280,54720,outdoor,"ice_shelf, runway, clean_room, chemistry_lab, landing_deck",20436
2281,54744,indoor,"ice_shelf, chemistry_lab, clean_room, runway, bow_window/indoor",20436
2282,54768,indoor,"ice_shelf, chemistry_lab, clean_room, museum/indoor, iceberg",20436
2283,54792,outdoor,"ice_shelf, iceberg, runway, chemistry_lab, clean_room",20436
2284,54816,indoor,"ice_shelf, museum/indoor, clean_room, chemistry_lab, runway",20436
2285,54840,indoor,"ice_shelf, chemistry_lab, clean_room, museum/indoor, runway",20436
2286,54864,indoor,"ice_shelf, chemistry_lab, clean_room, beauty_salon, runway",20436
2287,54888,indoor,"museum/indoor, archive, clean_room, science_museum, discotheque",20436
2288,54912,indoor,"museum/indoor, natural_history_museum, science_museum, dressing_room, art_gallery",20436
2289,54936,indoor,"stage/indoor, museum/indoor, discotheque, music_studio, ballroom",20436
2290,54960,indoor,"museum/indoor, stage/indoor, discotheque, music_studio, art_gallery",20436
2291,54984,indoor,"stage/indoor, museum/indoor, music_studio, natural_history_museum, discotheque",20436
2292,55008,indoor,"museum/indoor, stage/indoor, discotheque, art_gallery, natural_history_museum",20436
2293,55032,indoor,"museum/indoor, stage/indoor, natural_history_museum, art_gallery, science_museum",20436
2294,55056,indoor,"museum/indoor, stage/indoor, art_gallery, discotheque, natural_history_museum",20436
2295,55080,indoor,"museum/indoor, natural_history_museum, art_gallery, stage/indoor, science_museum",20436
2296,55104,indoor,"dressing_room, museum/indoor, chemistry_lab, beauty_salon, clean_room",20436
2297,55128,indoor,"museum/indoor, dressing_room, ice_shelf, gymnasium/indoor, martial_arts_gym",20436
2298,55152,indoor,"gymnasium/indoor, bowling_alley, martial_arts_gym, dressing_room, museum/indoor",20436
2299,55176,indoor,"gymnasium/indoor, clothing_store, museum/indoor, bowling_alley, department_store",20436
2300,55200,indoor,"clothing_store, dressing_room, department_store, museum/indoor, lobby",20436
2301,55224,indoor,"clothing_store, gymnasium/indoor, museum/indoor, dressing_room, martial_arts_gym",20436
2302,55248,indoor,"museum/indoor, dressing_room, art_gallery, clothing_store, corridor",20436
2303,55272,indoor,"museum/indoor, art_gallery, dressing_room, clothing_store, artists_loft",20436
2304,55296,indoor,"museum/indoor, stage/indoor, gymnasium/indoor, music_studio, art_gallery",20436
2305,55320,indoor,"museum/indoor, stage/indoor, art_gallery, music_studio, clean_room",20436
2306,55344,indoor,"museum/indoor, stage/indoor, art_gallery, natural_history_museum, archive",20436
2307,55368,indoor,"museum/indoor, stage/indoor, natural_history_museum, music_studio, art_gallery",20436
2308,55392,indoor,"museum/indoor, stage/indoor, gymnasium/indoor, natural_history_museum, art_gallery",20436
2309,55416,indoor,"museum/indoor, stage/indoor, gymnasium/indoor, music_studio, clean_room",20436
2310,55440,indoor,"gymnasium/indoor, museum/indoor, music_studio, clean_room, locker_room",20436
2311,55464,indoor,"gymnasium/indoor, museum/indoor, music_studio, stage/indoor, clean_room",20436
2312,55488,indoor,"stage/indoor, museum/indoor, discotheque, music_studio, art_gallery",20436
2313,55512,indoor,"museum/indoor, stage/indoor, gymnasium/indoor, music_studio, art_gallery",20436
2314,55536,indoor,"museum/indoor, stage/indoor, gymnasium/indoor, music_studio, clean_room",20436
2315,55560,indoor,"museum/indoor, gymnasium/indoor, stage/indoor, dressing_room, clean_room",20436
2316,55584,indoor,"museum/indoor, clean_room, dressing_room, music_studio, stage/indoor",20436
2317,55608,indoor,"museum/indoor, stage/indoor, gymnasium/indoor, music_studio, archive",20436
2318,55632,indoor,"museum/indoor, natural_history_museum, music_studio, clean_room, stage/indoor",20436
2319,55656,indoor,"museum/indoor, clean_room, natural_history_museum, dressing_room, science_museum",20436
2320,55680,indoor,"gymnasium/indoor, clean_room, museum/indoor, music_studio, locker_room",20436
2321,55704,indoor,"museum/indoor, stage/indoor, art_gallery, music_studio, discotheque",20436
2322,55728,indoor,"museum/indoor, clean_room, natural_history_museum, dressing_room, art_gallery",20436
2323,55752,indoor,"museum/indoor, natural_history_museum, art_gallery, stage/indoor, racecourse",20436
2324,55776,indoor,"museum/indoor, stage/indoor, gymnasium/indoor, locker_room, natural_history_museum",20436
2325,55800,indoor,"museum/indoor, natural_history_museum, art_gallery, science_museum, stage/indoor",20436
2326,55824,indoor,"museum/indoor, stage/indoor, art_gallery, dressing_room, gymnasium/indoor",20436
2327,55848,indoor,"stage/indoor, museum/indoor, discotheque, clean_room, art_gallery",20436
2328,55872,indoor,"museum/indoor, banquet_hall, dressing_room, chemistry_lab, bar",20436
2329,55896,indoor,"museum/indoor, clean_room, archive, art_gallery, dressing_room",20436
2330,55920,indoor,"museum/indoor, science_museum, clean_room, gymnasium/indoor, bowling_alley",20436
2331,55944,indoor,"corridor, museum/indoor, clean_room, bowling_alley, art_gallery",20436
2332,55968,indoor,"museum/indoor, corridor, clean_room, art_gallery, archive",20436
2333,55992,indoor,"corridor, museum/indoor, beauty_salon, alcove, art_gallery",20436
2334,56016,indoor,"museum/indoor, art_gallery, artists_loft, clean_room, lighthouse",20436
2335,56040,indoor,"museum/indoor, art_gallery, artists_loft, clean_room, alcove",20436
2336,56064,indoor,"discotheque, stage/indoor, museum/indoor, shower, soccer_field",20436
2337,56088,indoor,"discotheque, museum/indoor, shower, stage/indoor, kindergarden_classroom",20436
2338,56112,indoor,"discotheque, stage/indoor, shower, museum/indoor, ball_pit",20436
2339,56136,indoor,"alcove, corridor, art_gallery, staircase, museum/indoor",20436
2340,56160,indoor,"pharmacy, reception, drugstore, hospital, beauty_salon",20436
2341,56184,indoor,"pharmacy, reception, hospital, drugstore, beauty_salon",20436
2342,56208,indoor,"pharmacy, hospital, reception, drugstore, museum/indoor",20436
2343,56232,indoor,"pharmacy, reception, hospital, drugstore, museum/indoor",20436
2344,56256,indoor,"pharmacy, reception, hospital, drugstore, beauty_salon",20436
2345,56280,outdoor,"corridor, arch, gazebo/exterior, mausoleum, alcove",20436
2346,56304,indoor,"alcove, corridor, staircase, bathroom, museum/indoor",20436
2347,56328,indoor,"corridor, museum/indoor, alcove, arch, clean_room",20436
2348,56352,indoor,"museum/indoor, clean_room, dressing_room, art_gallery, nursery",20436
2349,56376,indoor,"clean_room, dressing_room, martial_arts_gym, nursery, hospital_room",20436
2350,56400,indoor,"pharmacy, museum/indoor, hospital, reception, drugstore",20436
2351,56424,indoor,"pharmacy, museum/indoor, hospital, drugstore, reception",20436
2352,56448,indoor,"pharmacy, museum/indoor, hospital, reception, drugstore",20436
2353,56472,indoor,"pharmacy, museum/indoor, hospital, drugstore, reception",20436
2354,56496,indoor,"pharmacy, museum/indoor, hospital, drugstore, reception",20436
2355,56520,indoor,"pharmacy, hospital, drugstore, museum/indoor, reception",20436
2356,56544,indoor,"clean_room, dressing_room, operating_room, martial_arts_gym, museum/indoor",20436
2357,56568,indoor,"clean_room, dressing_room, operating_room, nursery, museum/indoor",20436
2358,56592,indoor,"art_gallery, museum/indoor, clean_room, clothing_store, elevator_lobby",20436
2359,56616,indoor,"reception, pharmacy, ice_shelf, drugstore, hospital",20436
2360,56640,indoor,"reception, pharmacy, ice_shelf, beauty_salon, hospital",20436
2361,56664,indoor,"reception, pharmacy, ice_shelf, hospital, beauty_salon",20436
2362,56688,indoor,"reception, pharmacy, shower, ice_shelf, hospital",20436
2363,56712,indoor,"clean_room, art_gallery, museum/indoor, clothing_store, dressing_room",20436
2364,56736,indoor,"clean_room, dressing_room, hospital_room, nursery, operating_room",20436
2365,56760,indoor,"clean_room, dressing_room, nursery, hospital_room, operating_room",20436
2366,56784,indoor,"clean_room, dressing_room, museum/indoor, art_gallery, operating_room",20436
2367,56808,indoor,"clean_room, dressing_room, beauty_salon, museum/indoor, art_gallery",20436
2368,56832,indoor,"pharmacy, museum/indoor, hospital, art_gallery, reception",20436
2369,56856,indoor,"pharmacy, museum/indoor, art_gallery, reception, hospital",20436
2370,56880,indoor,"pharmacy, museum/indoor, art_gallery, hospital, reception",20436
2371,56904,indoor,"museum/indoor, pharmacy, reception, art_gallery, hospital",20436
2372,56928,indoor,"pharmacy, museum/indoor, hospital, art_gallery, reception",20436
2373,56952,indoor,"museum/indoor, pharmacy, hospital, art_gallery, reception",20436
2374,56976,indoor,"clean_room, dressing_room, beauty_salon, hospital_room, operating_room",20436
2375,57000,indoor,"clean_room, museum/indoor, art_gallery, lighthouse, discotheque",20436
2376,57024,indoor,"clean_room, museum/indoor, art_gallery, clothing_store, dressing_room",20436
2377,57048,indoor,"clean_room, art_gallery, museum/indoor, dressing_room, shower",20436
2378,57072,indoor,"pharmacy, hospital, museum/indoor, reception, elevator/door",20436
2379,57096,indoor,"pharmacy, hospital, museum/indoor, drugstore, reception",20436
2380,57120,indoor,"museum/indoor, pharmacy, art_gallery, hospital, reception",20436
2381,57144,indoor,"pharmacy, museum/indoor, art_gallery, hospital, reception",20436
2382,57168,indoor,"pharmacy, museum/indoor, hospital, reception, art_gallery",20436
2383,57192,indoor,"pharmacy, hospital, reception, museum/indoor, art_gallery",20436
2384,57216,indoor,"pharmacy, hospital, reception, museum/indoor, drugstore",20436
2385,57240,indoor,"museum/indoor, art_gallery, clean_room, clothing_store, dressing_room",20436
2386,57264,indoor,"museum/indoor, art_gallery, science_museum, clean_room, natural_history_museum",20436
2387,57288,indoor,"museum/indoor, art_gallery, clean_room, science_museum, natural_history_museum",20436
2388,57312,indoor,"museum/indoor, art_gallery, clean_room, science_museum, natural_history_museum",20436
2389,57336,indoor,"clean_room, dressing_room, art_gallery, museum/indoor, operating_room",20436
2390,57360,indoor,"clean_room, dressing_room, art_gallery, operating_room, beauty_salon",20436
2391,57384,indoor,"reception, pharmacy, art_gallery, hospital, ice_shelf",20436
2392,57408,indoor,"reception, pharmacy, art_gallery, elevator/door, museum/indoor",20436
2393,57432,indoor,"reception, pharmacy, art_gallery, elevator/door, elevator_lobby",20436
2394,57456,indoor,"reception, pharmacy, art_gallery, museum/indoor, hospital",20436
2395,57480,indoor,"reception, pharmacy, art_gallery, museum/indoor, hospital",20436
2396,57504,indoor,"reception, pharmacy, art_gallery, drugstore, elevator_lobby",20436
2397,57528,indoor,"clean_room, dressing_room, beauty_salon, operating_room, art_gallery",20436
2398,57552,indoor,"clean_room, dressing_room, art_gallery, museum/indoor, clothing_store",20436
2399,57576,indoor,"clean_room, dressing_room, operating_room, chemistry_lab, hospital_room",20436
2400,57600,indoor,"clean_room, dressing_room, nursery, operating_room, hospital_room",20436
2401,57624,indoor,"museum/indoor, clean_room, art_gallery, science_museum, water_tower",20436
2402,57648,indoor,"clean_room, museum/indoor, art_gallery, clothing_store, science_museum",20436
2403,57672,indoor,"reception, ice_shelf, pharmacy, nursery, hospital",20436
2404,57696,indoor,"reception, ice_shelf, pharmacy, nursery, beauty_salon",20436
2405,57720,indoor,"reception, ice_shelf, pharmacy, nursery, clean_room",20436
2406,57744,indoor,"clean_room, museum/indoor, art_gallery, science_museum, natural_history_museum",20436
2407,57768,indoor,"museum/indoor, art_gallery, clean_room, dressing_room, clothing_store",20436
2408,57792,indoor,"museum/indoor, art_gallery, clean_room, stage/indoor, clothing_store",20436
2409,57816,indoor,"museum/indoor, art_gallery, clean_room, subway_station/platform, clothing_store",20436
2410,57840,indoor,"discotheque, stage/indoor, ball_pit, museum/indoor, auditorium",20436
2411,57864,indoor,"discotheque, ball_pit, shower, stage/indoor, museum/indoor",20436
2412,57888,indoor,"ball_pit, discotheque, shower, museum/indoor, stage/indoor",20436
2413,57912,indoor,"clean_room, museum/indoor, martial_arts_gym, art_gallery, stage/indoor",20436
2414,57936,indoor,"clean_room, museum/indoor, art_gallery, clothing_store, martial_arts_gym",20436
2415,57960,indoor,"museum/indoor, art_gallery, clean_room, dressing_room, clothing_store",20436
2416,57984,indoor,"museum/indoor, clean_room, art_gallery, dressing_room, clothing_store",20436
2417,58008,indoor,"museum/indoor, clean_room, art_gallery, clothing_store, science_museum",20436
2418,58032,indoor,"museum/indoor, clean_room, art_gallery, clothing_store, subway_station/platform",20436
2419,58056,indoor,"museum/indoor, clean_room, art_gallery, clothing_store, science_museum",20436
2420,58080,indoor,"museum/indoor, art_gallery, clean_room, clothing_store, dressing_room",20436
2421,58104,indoor,"museum/indoor, clean_room, art_gallery, science_museum, clothing_store",20436
2422,58128,indoor,"museum/indoor, hospital, art_gallery, pharmacy, desert/sand",20436
2423,58152,indoor,"museum/indoor, art_gallery, reception, pharmacy, desert/sand",20436
2424,58176,indoor,"museum/indoor, art_gallery, reception, pharmacy, hospital",20436
2425,58200,indoor,"museum/indoor, art_gallery, hospital, pharmacy, desert/sand",20436
2426,58224,indoor,"museum/indoor, art_gallery, reception, pharmacy, hospital",20436
2427,58248,indoor,"museum/indoor, clean_room, art_gallery, arch, alcove",20436
2428,58272,indoor,"corridor, museum/indoor, arch, staircase, art_gallery",20436
2429,58296,indoor,"corridor, museum/indoor, alcove, clean_room, arch",20436
2430,58320,indoor,"clean_room, corridor, museum/indoor, art_gallery, elevator/door",20436
2431,58344,indoor,"museum/indoor, art_gallery, corridor, staircase, alcove",20436
2432,58368,indoor,"museum/indoor, art_gallery, gymnasium/indoor, martial_arts_gym, stage/indoor",20436
2433,58392,indoor,"museum/indoor, art_gallery, subway_station/platform, sauna, staircase",20436
2434,58416,indoor,"museum/indoor, art_gallery, clean_room, science_museum, art_studio",20436
2435,58440,indoor,"museum/indoor, art_gallery, science_museum, staircase, corridor",20436
2436,58464,indoor,"museum/indoor, pharmacy, drugstore, art_gallery, reception",20436
2437,58488,indoor,"museum/indoor, pharmacy, drugstore, natural_history_museum, hospital",20436
2438,58512,indoor,"museum/indoor, pharmacy, drugstore, hospital, art_gallery",20436
2439,58536,indoor,"museum/indoor, pharmacy, drugstore, hospital, art_gallery",20436
2440,58560,indoor,"museum/indoor, pharmacy, hospital, natural_history_museum, drugstore",20436
2441,58584,indoor,"museum/indoor, pharmacy, hospital, drugstore, natural_history_museum",20436
2442,58608,indoor,"museum/indoor, pharmacy, art_gallery, drugstore, natural_history_museum",20436
2443,58632,indoor,"museum/indoor, pharmacy, drugstore, art_gallery, hospital",20436
2444,58656,indoor,"museum/indoor, pharmacy, art_gallery, drugstore, hospital",20436
2445,58680,indoor,"museum/indoor, art_gallery, clean_room, corridor, science_museum",20436
2446,58704,indoor,"museum/indoor, art_gallery, science_museum, clean_room, natural_history_museum",20436
2447,58728,indoor,"museum/indoor, clean_room, art_gallery, pier, science_museum",20436
2448,58752,indoor,"museum/indoor, clean_room, art_gallery, dressing_room, corridor",20436
2449,58776,indoor,"reception, ice_shelf, art_gallery, shower, pharmacy",20436
2450,58800,indoor,"reception, ice_shelf, art_gallery, iceberg, museum/indoor",20436
2451,58824,indoor,"reception, ice_shelf, art_gallery, iceberg, museum/indoor",20436
2452,58848,indoor,"reception, ice_shelf, art_gallery, iceberg, museum/indoor",20436
2453,58872,indoor,"museum/indoor, art_gallery, corridor, clean_room, science_museum",20436
2454,58896,indoor,"museum/indoor, art_gallery, corridor, clean_room, staircase",20436
2455,58920,indoor,"museum/indoor, clean_room, art_gallery, science_museum, corridor",20436
2456,58944,indoor,"museum/indoor, clean_room, art_gallery, science_museum, corridor",20436
2457,58968,indoor,"museum/indoor, art_gallery, alcove, science_museum, martial_arts_gym",20436
2458,58992,indoor,"shower, museum/indoor, art_gallery, clean_room, bathroom",20436
2459,59016,indoor,"museum/indoor, clean_room, igloo, archive, art_gallery",20436
2460,59040,indoor,"clean_room, archive, sauna, museum/indoor, art_gallery",20436
2461,59064,indoor,"sauna, shower, museum/indoor, clean_room, nursery",20436
2462,59088,indoor,"nursery, clean_room, hospital_room, operating_room, museum/indoor",20436
2463,59112,indoor,"pharmacy, museum/indoor, drugstore, natural_history_museum, hospital",20436
2464,59136,indoor,"pharmacy, drugstore, museum/indoor, reception, elevator_lobby",20436
2465,59160,indoor,"pharmacy, drugstore, museum/indoor, natural_history_museum, elevator_lobby",20436
2466,59184,indoor,"pharmacy, drugstore, museum/indoor, reception, beauty_salon",20436
2467,59208,indoor,"pharmacy, museum/indoor, drugstore, elevator_lobby, natural_history_museum",20436
2468,59232,indoor,"pharmacy, drugstore, museum/indoor, elevator_lobby, reception",20436
2469,59256,indoor,"pharmacy, drugstore, museum/indoor, elevator_lobby, reception",20436
2470,59280,indoor,"pharmacy, drugstore, museum/indoor, hospital, natural_history_museum",20436
2471,59304,indoor,"nursery, clean_room, museum/indoor, bowling_alley, art_gallery",20436
2472,59328,indoor,"museum/indoor, clean_room, sauna, archive, art_gallery",20436
2473,59352,indoor,"museum/indoor, art_gallery, clean_room, stage/indoor, martial_arts_gym",20436
2474,59376,indoor,"reception, pharmacy, ice_shelf, elevator/door, museum/indoor",20436
2475,59400,indoor,"reception, pharmacy, museum/indoor, art_gallery, elevator/door",20436
2476,59424,indoor,"pharmacy, reception, museum/indoor, ice_shelf, elevator/door",20436
2477,59448,indoor,"reception, pharmacy, museum/indoor, ice_shelf, art_gallery",20436
2478,59472,indoor,"reception, pharmacy, museum/indoor, art_gallery, elevator/door",20436
2479,59496,indoor,"pharmacy, reception, museum/indoor, art_gallery, ice_shelf",20436
2480,59520,indoor,"museum/indoor, clean_room, art_gallery, martial_arts_gym, stage/indoor",20436
2481,59544,indoor,"museum/indoor, clean_room, art_gallery, martial_arts_gym, nursery",20436
2482,59568,indoor,"clean_room, museum/indoor, art_gallery, archive, nursery",20436
2483,59592,indoor,"museum/indoor, art_gallery, archive, clean_room, stage/indoor",20436
2484,59616,indoor,"reception, ice_shelf, lobby, conference_room, art_gallery",20436
2485,59640,indoor,"reception, ice_shelf, art_gallery, lobby, elevator/door",20436
2486,59664,indoor,"reception, ice_shelf, art_gallery, pharmacy, elevator/door",20436
2487,59688,indoor,"clean_room, bowling_alley, nursery, discotheque, museum/indoor",20436
2488,59712,indoor,"alcove, arch, burial_chamber, corridor, entrance_hall",20436
2489,59736,indoor,"alcove, entrance_hall, museum/indoor, corridor, lobby",20436
2490,59760,indoor,"museum/indoor, art_gallery, corridor, burial_chamber, entrance_hall",20436
2491,59784,indoor,"museum/indoor, art_gallery, burial_chamber, corridor, alcove",20436
2492,59808,indoor,"museum/indoor, art_gallery, corridor, arch, alcove",20436
2493,59832,indoor,"museum/indoor, art_gallery, artists_loft, clean_room, art_studio",20436
2494,59856,indoor,"museum/indoor, art_gallery, clean_room, science_museum, art_studio",20436
2495,59880,indoor,"museum/indoor, art_gallery, corridor, clean_room, stage/indoor",20436
2496,59904,indoor,"museum/indoor, shower, art_gallery, clean_room, natural_history_museum",20436
2497,59928,indoor,"clean_room, museum/indoor, stage/indoor, art_gallery, discotheque",20436
2498,59952,indoor,"museum/indoor, nursery, art_gallery, science_museum, staircase",20436
2499,59976,indoor,"clean_room, shower, alcove, sauna, nursery",20436
2500,60000,indoor,"clean_room, museum/indoor, sauna, art_gallery, alcove",20436
2501,60024,indoor,"museum/indoor, clean_room, art_gallery, alcove, burial_chamber",20436
2502,60048,indoor,"museum/indoor, burial_chamber, clean_room, alcove, nursery",20436
2503,60072,indoor,"clean_room, museum/indoor, art_gallery, burial_chamber, alcove",20436
2504,60096,indoor,"discotheque, stage/indoor, ball_pit, auditorium, field/cultivated",20436
2505,60120,indoor,"discotheque, stage/indoor, auditorium, ball_pit, martial_arts_gym",20436
2506,60144,indoor,"museum/indoor, clean_room, art_gallery, dressing_room, clothing_store",20436
2507,60168,indoor,"playground, shower, subway_station/platform, sauna, bridge",20436
2508,60192,indoor,"shower, bathroom, ice_shelf, jacuzzi/indoor, bow_window/indoor",20436
2509,60216,outdoor,"iceberg, art_gallery, ice_floe, ice_shelf, museum/indoor",20436
2510,60240,indoor,"clean_room, art_gallery, iceberg, shower, museum/indoor",20436
2511,60264,indoor,"clean_room, hospital_room, dressing_room, operating_room, museum/indoor",20436
2512,60288,indoor,"clean_room, alcove, martial_arts_gym, sauna, pharmacy",20436
2513,60312,indoor,"museum/indoor, art_gallery, alcove, burial_chamber, arch",20436
2514,60336,indoor,"museum/indoor, art_gallery, clean_room, alcove, burial_chamber",20436
2515,60360,indoor,"museum/indoor, alcove, burial_chamber, arch, art_gallery",20436
2516,60384,indoor,"museum/indoor, alcove, burial_chamber, arch, art_gallery",20436
2517,60408,indoor,"alcove, arch, burial_chamber, museum/indoor, bow_window/indoor",20436
2518,60432,indoor,"museum/indoor, clean_room, art_gallery, martial_arts_gym, dressing_room",20436
2519,60456,indoor,"museum/indoor, art_gallery, dressing_room, clean_room, alcove",20436
2520,60480,indoor,"museum/indoor, clean_room, art_gallery, dressing_room, clothing_store",20436
2521,60504,indoor,"museum/indoor, clean_room, dressing_room, art_gallery, stage/indoor",20436
2522,60528,indoor,"museum/indoor, clean_room, art_gallery, stage/indoor, dressing_room",20436
2523,60552,indoor,"pharmacy, reception, hospital, drugstore, elevator/door",20436
2524,60576,indoor,"pharmacy, reception, drugstore, hospital, elevator/door",20436
2525,60600,indoor,"pharmacy, reception, drugstore, museum/indoor, elevator/door",20436
2526,60624,indoor,"pharmacy, drugstore, reception, ice_shelf, museum/indoor",20436
2527,60648,indoor,"pharmacy, hospital, drugstore, reception, elevator/door",20436
2528,60672,indoor,"museum/indoor, clean_room, art_gallery, stage/indoor, dressing_room",20436
2529,60696,indoor,"clean_room, museum/indoor, art_gallery, stage/indoor, discotheque",20436
2530,60720,indoor,"clean_room, museum/indoor, art_gallery, ice_cream_parlor, science_museum",20436
2531,60744,indoor,"clean_room, museum/indoor, art_gallery, science_museum, dressing_room",20436
2532,60768,indoor,"clean_room, museum/indoor, art_gallery, science_museum, dressing_room",20436
2533,60792,indoor,"pharmacy, museum/indoor, drugstore, reception, beauty_salon",20436
2534,60816,indoor,"pharmacy, museum/indoor, drugstore, reception, natural_history_museum",20436
2535,60840,indoor,"pharmacy, drugstore, museum/indoor, beauty_salon, reception",20436
2536,60864,indoor,"pharmacy, drugstore, museum/indoor, reception, beauty_salon",20436
2537,60888,indoor,"pharmacy, museum/indoor, drugstore, reception, beauty_salon",20436
2538,60912,indoor,"pharmacy, drugstore, museum/indoor, beauty_salon, reception",20436
2539,60936,indoor,"pharmacy, museum/indoor, drugstore, reception, beauty_salon",20436
2540,60960,indoor,"clean_room, museum/indoor, chemistry_lab, science_museum, art_gallery",20436
2541,60984,indoor,"museum/indoor, clean_room, art_gallery, art_studio, science_museum",20436
2542,61008,indoor,"clean_room, museum/indoor, art_gallery, science_museum, art_studio",20436
2543,61032,indoor,"clean_room, museum/indoor, science_museum, chemistry_lab, art_gallery",20436
2544,61056,indoor,"museum/indoor, clean_room, art_gallery, science_museum, ice_cream_parlor",20436
2545,61080,indoor,"reception, ice_shelf, art_gallery, conference_room, office",20436
2546,61104,indoor,"reception, ice_shelf, art_gallery, conference_room, living_room",20436
2547,61128,indoor,"reception, ice_shelf, art_gallery, conference_room, living_room",20436
2548,61152,indoor,"reception, ice_shelf, art_gallery, conference_room, iceberg",20436
2549,61176,indoor,"clean_room, museum/indoor, art_gallery, science_museum, chemistry_lab",20436
2550,61200,indoor,"clean_room, museum/indoor, art_gallery, dressing_room, science_museum",20436
2551,61224,indoor,"clean_room, museum/indoor, science_museum, art_gallery, discotheque",20436
2552,61248,indoor,"clean_room, museum/indoor, art_gallery, science_museum, stage/indoor",20436
2553,61272,indoor,"museum/indoor, clean_room, art_gallery, stage/indoor, science_museum",20436
2554,61296,indoor,"clean_room, museum/indoor, art_gallery, science_museum, chemistry_lab",20436
2555,61320,indoor,"pharmacy, ice_shelf, drugstore, reception, hospital",20436
2556,61344,indoor,"pharmacy, ice_shelf, hospital, drugstore, reception",20436
2557,61368,indoor,"pharmacy, reception, ice_shelf, drugstore, hospital",20436
2558,61392,indoor,"pharmacy, ice_shelf, hospital, reception, drugstore",20436
2559,61416,indoor,"pharmacy, ice_shelf, reception, hospital, drugstore",20436
2560,61440,indoor,"pharmacy, hospital, drugstore, reception, museum/indoor",20436
