,frame_num,environment,places,imdb_id
4612,110688,outdoor,"shower, underwater/ocean_deep, iceberg, lake/natural, rice_paddy",64437
4613,110712,indoor,"shower, jail_cell, basement, locker_room, bathroom",64437
4614,110736,indoor,"jail_cell, locker_room, basement, shower, archive",64437
4615,110760,indoor,"jail_cell, basement, shower, locker_room, bathroom",64437
4616,110784,indoor,"basement, jail_cell, shower, locker_room, bathroom",64437
4617,110808,indoor,"jail_cell, basement, shower, locker_room, bathroom",64437
4618,110832,outdoor,"tower, canal/natural, bridge, industrial_area, water_tower",64437
4619,110856,indoor,"locker_room, jail_cell, basement, shower, server_room",64437
4620,110880,outdoor,"canal/natural, tower, bridge, water_tower, skyscraper",64437
4621,110904,indoor,"jail_cell, locker_room, basement, shower, server_room",64437
4622,110928,indoor,"basement, jail_cell, locker_room, archive, shower",64437
4623,110952,indoor,"clean_room, dressing_room, chemistry_lab, bathroom, biology_laboratory",64437
4624,110976,indoor,"clean_room, dressing_room, chemistry_lab, biology_laboratory, bathroom",64437
4625,111000,indoor,"clean_room, dressing_room, chemistry_lab, bathroom, biology_laboratory",64437
4626,111024,outdoor,"ice_shelf, ice_floe, clean_room, iceberg, nursery",64437
4627,111048,indoor,"discotheque, ice_shelf, clean_room, nursery, beauty_salon",64437
4628,111072,indoor,"beauty_salon, clean_room, discotheque, nursery, biology_laboratory",64437
4629,111096,indoor,"clean_room, beauty_salon, discotheque, biology_laboratory, hospital_room",64437
4630,111120,indoor,"clean_room, ice_shelf, discotheque, nursery, beauty_salon",64437
4631,111144,outdoor,"ice_shelf, ice_floe, iceberg, clean_room, discotheque",64437
4632,111168,indoor,"clean_room, ice_shelf, discotheque, beauty_salon, nursery",64437
4633,111192,outdoor,"ice_shelf, clean_room, ice_floe, iceberg, nursery",64437
4634,111216,indoor,"ice_shelf, clean_room, discotheque, beauty_salon, ice_floe",64437
4635,111240,indoor,"ice_shelf, clean_room, ice_floe, beauty_salon, nursery",64437
4636,111264,indoor,"discotheque, stage/indoor, music_studio, arena/performance, underwater/ocean_deep",64437
4637,111288,indoor,"crevasse, discotheque, underwater/ocean_deep, clean_room, stage/indoor",64437
4638,111312,outdoor,"ice_floe, ice_shelf, iceberg, dressing_room, clean_room",64437
4639,111336,outdoor,"ice_floe, clean_room, ice_shelf, dressing_room, iceberg",64437
4640,111360,indoor,"clean_room, discotheque, ice_shelf, beauty_salon, nursery",64437
4641,111384,indoor,"clean_room, ice_shelf, ice_floe, discotheque, nursery",64437
4642,111408,outdoor,"ice_shelf, clean_room, discotheque, ice_floe, iceberg",64437
4643,111432,outdoor,"dressing_room, ice_floe, ice_shelf, clean_room, iceberg",64437
4644,111456,indoor,"discotheque, stage/indoor, arena/performance, clean_room, music_studio",64437
4645,111480,indoor,"stage/indoor, discotheque, music_studio, arena/performance, television_studio",64437
4646,111504,indoor,"ice_shelf, discotheque, ice_floe, clean_room, nursery",64437
4647,111528,outdoor,"ice_shelf, iceberg, ice_floe, clean_room, discotheque",64437
4648,111552,outdoor,"iceberg, ice_floe, ice_shelf, crevasse, clean_room",64437
4649,111576,indoor,"discotheque, clean_room, stage/indoor, dressing_room, hospital_room",64437
4650,111600,indoor,"stage/indoor, discotheque, arena/performance, clean_room, music_studio",64437
4651,111624,indoor,"discotheque, stage/indoor, arena/performance, sky, crevasse",64437
4652,111648,indoor,"discotheque, stage/indoor, arena/performance, sky, music_studio",64437
4653,111672,indoor,"discotheque, stage/indoor, arena/performance, music_studio, sky",64437
4654,111696,indoor,"discotheque, stage/indoor, shower, sky, dressing_room",64437
4655,111720,indoor,"discotheque, aquarium, crevasse, underwater/ocean_deep, shower",64437
4656,111744,indoor,"clean_room, chemistry_lab, biology_laboratory, bathroom, beauty_salon",64437
4657,111768,indoor,"clean_room, chemistry_lab, biology_laboratory, beauty_salon, bathroom",64437
4658,111792,indoor,"clean_room, chemistry_lab, biology_laboratory, bathroom, beauty_salon",64437
4659,111816,indoor,"clean_room, chemistry_lab, biology_laboratory, beauty_salon, bathroom",64437
4660,111840,outdoor,"tower, water_tower, science_museum, mosque/outdoor, bridge",64437
4661,111864,outdoor,"water_tower, tower, science_museum, hospital, ice_shelf",64437
4662,111888,outdoor,"tower, science_museum, water_tower, mosque/outdoor, hospital",64437
4663,111912,outdoor,"tower, water_tower, bridge, canal/natural, ice_shelf",64437
4664,111936,outdoor,"tower, water_tower, bridge, museum/indoor, mosque/outdoor",64437
4665,111960,outdoor,"tower, water_tower, bridge, skyscraper, canal/natural",64437
4666,111984,outdoor,"tower, water_tower, wind_farm, bridge, skyscraper",64437
4667,112008,outdoor,"tower, lighthouse, bathroom, water_tower, shower",64437
4668,112032,indoor,"airplane_cabin, clean_room, server_room, hospital_room, sky",64437
4669,112056,outdoor,"ice_shelf, clean_room, sky, iceberg, hospital",64437
4670,112080,outdoor,"igloo, crevasse, ice_shelf, ski_slope, ice_floe",64437
4671,112104,indoor,"clean_room, museum/indoor, science_museum, art_gallery, stage/indoor",64437
4672,112128,outdoor,"ice_shelf, iceberg, ice_floe, crevasse, glacier",64437
4673,112152,outdoor,"ice_shelf, iceberg, ice_floe, crevasse, shower",64437
4674,112176,indoor,"clean_room, hospital_room, biology_laboratory, clothing_store, iceberg",64437
4675,112200,indoor,"clean_room, dressing_room, stage/indoor, chemistry_lab, biology_laboratory",64437
4676,112224,indoor,"dressing_room, clean_room, stage/indoor, museum/indoor, clothing_store",64437
4677,112248,indoor,"clean_room, dressing_room, martial_arts_gym, biology_laboratory, chemistry_lab",64437
4678,112272,indoor,"dressing_room, clean_room, chemistry_lab, locker_room, clothing_store",64437
4679,112296,indoor,"clean_room, dressing_room, chemistry_lab, biology_laboratory, stage/indoor",64437
4680,112320,indoor,"clean_room, dressing_room, clothing_store, stage/indoor, chemistry_lab",64437
4681,112344,indoor,"clean_room, dressing_room, clothing_store, stage/indoor, chemistry_lab",64437
4682,112368,indoor,"clean_room, dressing_room, stage/indoor, clothing_store, museum/indoor",64437
4683,112392,indoor,"clean_room, dressing_room, clothing_store, stage/indoor, martial_arts_gym",64437
4684,112416,indoor,"shower, server_room, bank_vault, bathroom, elevator/door",64437
4685,112440,outdoor,"skyscraper, downtown, office_building, tower, water_tower",64437
4686,112464,outdoor,"skyscraper, server_room, office_building, downtown, airplane_cabin",64437
4687,112488,indoor,"shower, bathroom, elevator/door, locker_room, server_room",64437
4688,112512,indoor,"locker_room, elevator/door, server_room, elevator_lobby, airport_terminal",64437
4689,112536,indoor,"shower, basement, bathroom, jail_cell, locker_room",64437
4690,112560,indoor,"drugstore, museum/indoor, pharmacy, tower, airplane_cabin",64437
4691,112584,indoor,"ice_shelf, igloo, clean_room, discotheque, chemistry_lab",64437
4692,112608,indoor,"clean_room, hospital_room, ice_shelf, clothing_store, hospital",64437
4693,112632,outdoor,"ice_shelf, clean_room, igloo, hospital_room, crevasse",64437
4694,112656,indoor,"ice_shelf, hospital_room, operating_room, airplane_cabin, igloo",64437
4695,112680,indoor,"ice_shelf, clean_room, operating_room, hospital_room, airplane_cabin",64437
4696,112704,indoor,"ice_shelf, clean_room, hospital_room, operating_room, campsite",64437
4697,112728,indoor,"ice_shelf, hospital_room, clean_room, operating_room, airplane_cabin",64437
4698,112752,indoor,"clean_room, ice_shelf, hospital_room, operating_room, campsite",64437
4699,112776,indoor,"hospital_room, clean_room, operating_room, ice_shelf, campsite",64437
4700,112800,indoor,"clean_room, hospital_room, ice_shelf, operating_room, igloo",64437
4701,112824,outdoor,"ice_floe, iceberg, igloo, museum/indoor, shower",64437
4702,112848,indoor,"bathroom, shower, hotel_room, bedroom, art_gallery",64437
4703,112872,indoor,"closet, basement, elevator/door, jail_cell, alcove",64437
4704,112896,indoor,"auto_factory, parking_lot, airport_terminal, parking_garage/indoor, highway",64437
4705,112920,indoor,"locker_room, ice_shelf, science_museum, discotheque, office",64437
4706,112944,indoor,"bow_window/indoor, elevator/door, locker_room, skyscraper, tower",64437
4707,112968,indoor,"elevator/door, bow_window/indoor, clean_room, elevator_lobby, server_room",64437
4708,112992,indoor,"bow_window/indoor, alcove, atrium/public, hotel_room, courthouse",64437
4709,113016,indoor,"clean_room, hotel_room, hospital_room, dressing_room, beauty_salon",64437
4710,113040,indoor,"hotel_room, bedroom, hospital_room, dressing_room, bedchamber",64437
4711,113064,indoor,"hotel_room, bedroom, bedchamber, dorm_room, hospital_room",64437
4712,113088,indoor,"hospital_room, hotel_room, bedroom, clean_room, dorm_room",64437
4713,113112,indoor,"hospital_room, clean_room, operating_room, pharmacy, hospital",64437
4714,113136,indoor,"stage/indoor, discotheque, aquarium, music_studio, underwater/ocean_deep",64437
4715,113160,indoor,"museum/indoor, discotheque, underwater/ocean_deep, stage/indoor, natural_history_museum",64437
4716,113184,indoor,"art_studio, dressing_room, shower, natural_history_museum, nursery",64437
4717,113208,outdoor,"underwater/ocean_deep, discotheque, rice_paddy, ice_shelf, music_studio",64437
4718,113232,indoor,"dressing_room, art_studio, nursery, classroom, shower",64437
4719,113256,indoor,"museum/indoor, ice_shelf, dressing_room, art_studio, discotheque",64437
4720,113280,indoor,"museum/indoor, art_studio, natural_history_museum, science_museum, dressing_room",64437
4721,113304,indoor,"dressing_room, natural_history_museum, museum/indoor, shower, ice_shelf",64437
4722,113328,indoor,"dressing_room, natural_history_museum, museum/indoor, aquarium, shower",64437
4723,113352,indoor,"underwater/ocean_deep, museum/indoor, natural_history_museum, science_museum, stage/indoor",64437
4724,113376,indoor,"dressing_room, underwater/ocean_deep, rice_paddy, natural_history_museum, museum/indoor",64437
4725,113400,indoor,"underwater/ocean_deep, discotheque, museum/indoor, aquarium, volleyball_court/outdoor",64437
4726,113424,indoor,"underwater/ocean_deep, discotheque, museum/indoor, aquarium, volleyball_court/outdoor",64437
4727,113448,outdoor,"rice_paddy, underwater/ocean_deep, aquarium, volleyball_court/outdoor, dressing_room",64437
4728,113472,outdoor,"underwater/ocean_deep, discotheque, aquarium, ice_shelf, rice_paddy",64437
4729,113496,indoor,"underwater/ocean_deep, aquarium, rice_paddy, dressing_room, museum/indoor",64437
4730,113520,indoor,"museum/indoor, science_museum, clean_room, natural_history_museum, igloo",64437
4731,113544,indoor,"museum/indoor, ice_floe, clean_room, art_gallery, iceberg",64437
4732,113568,indoor,"museum/indoor, natural_history_museum, science_museum, clean_room, art_gallery",64437
4733,113592,indoor,"museum/indoor, natural_history_museum, science_museum, clean_room, art_gallery",64437
4734,113616,indoor,"museum/indoor, natural_history_museum, science_museum, clean_room, art_gallery",64437
4735,113640,indoor,"museum/indoor, natural_history_museum, science_museum, clean_room, art_gallery",64437
4736,113664,indoor,"museum/indoor, clean_room, science_museum, natural_history_museum, stage/indoor",64437
4737,113688,indoor,"museum/indoor, science_museum, clean_room, natural_history_museum, gift_shop",64437
4738,113712,indoor,"museum/indoor, science_museum, clean_room, natural_history_museum, stage/indoor",64437
4739,113736,indoor,"museum/indoor, natural_history_museum, science_museum, clean_room, art_gallery",64437
4740,113760,indoor,"museum/indoor, natural_history_museum, science_museum, clean_room, art_gallery",64437
4741,113784,indoor,"museum/indoor, natural_history_museum, science_museum, clean_room, art_gallery",64437
4742,113808,indoor,"museum/indoor, natural_history_museum, science_museum, clean_room, art_gallery",64437
4743,113832,indoor,"discotheque, shower, stage/indoor, clothing_store, ice_shelf",64437
4744,113856,indoor,"discotheque, dressing_room, stage/indoor, clothing_store, shower",64437
4745,113880,indoor,"discotheque, stage/indoor, dressing_room, clothing_store, museum/indoor",64437
4746,113904,indoor,"dressing_room, clothing_store, stage/indoor, discotheque, shower",64437
4747,113928,indoor,"discotheque, stage/indoor, shower, ice_shelf, ice_floe",64437
4748,113952,outdoor,"ice_floe, shower, ice_shelf, museum/indoor, iceberg",64437
4749,113976,indoor,"shower, discotheque, ice_floe, ice_shelf, stage/indoor",64437
4750,114000,indoor,"discotheque, shower, ice_shelf, boxing_ring, stage/indoor",64437
4751,114024,indoor,"discotheque, stage/indoor, boxing_ring, ballroom, music_studio",64437
4752,114048,indoor,"ice_floe, ice_shelf, dressing_room, ballroom, hotel_room",64437
4753,114072,indoor,"ballroom, dressing_room, bedroom, hotel_room, ice_shelf",64437
4754,114096,indoor,"ice_shelf, iceberg, clean_room, archive, museum/indoor",64437
4755,114120,outdoor,"ice_shelf, clean_room, iceberg, discotheque, crevasse",64437
4756,114144,indoor,"dressing_room, discotheque, clean_room, chemistry_lab, stage/indoor",64437
4757,114168,indoor,"clean_room, stage/indoor, nursing_home, martial_arts_gym, discotheque",64437
4758,114192,indoor,"clean_room, dressing_room, hospital_room, operating_room, nursing_home",64437
4759,114216,indoor,"television_studio, discotheque, clean_room, stage/indoor, music_studio",64437
4760,114240,indoor,"discotheque, television_studio, stage/indoor, clean_room, chemistry_lab",64437
4761,114264,indoor,"discotheque, stage/indoor, dressing_room, clean_room, ballroom",64437
4762,114288,indoor,"discotheque, clean_room, stage/indoor, museum/indoor, television_studio",64437
4763,114312,indoor,"discotheque, stage/indoor, martial_arts_gym, ballroom, television_studio",64437
4764,114336,indoor,"clean_room, natural_history_museum, science_museum, hospital_room, museum/indoor",64437
4765,114360,outdoor,"iceberg, ice_floe, ice_shelf, museum/indoor, clean_room",64437
4766,114384,outdoor,"iceberg, ice_floe, ice_shelf, clean_room, museum/indoor",64437
4767,114408,outdoor,"iceberg, ice_floe, museum/indoor, ice_shelf, clean_room",64437
4768,114432,outdoor,"iceberg, ice_floe, clean_room, ice_shelf, museum/indoor",64437
4769,114456,outdoor,"iceberg, ice_floe, ice_shelf, clean_room, museum/indoor",64437
4770,114480,outdoor,"iceberg, clean_room, ice_floe, ice_shelf, museum/indoor",64437
4771,114504,outdoor,"iceberg, ice_floe, ice_shelf, clean_room, museum/indoor",64437
4772,114528,outdoor,"clean_room, iceberg, ice_shelf, ice_floe, clothing_store",64437
4773,114552,indoor,"clean_room, iceberg, chemistry_lab, biology_laboratory, ice_shelf",64437
4774,114576,outdoor,"ice_shelf, iceberg, ice_floe, glacier, clean_room",64437
4775,114600,outdoor,"iceberg, ice_shelf, ice_floe, igloo, clean_room",64437
4776,114624,outdoor,"clean_room, iceberg, ice_shelf, clothing_store, glacier",64437
4777,114648,outdoor,"iceberg, ice_shelf, ice_floe, mountain_snowy, glacier",64437
4778,114672,outdoor,"iceberg, museum/indoor, ice_shelf, clean_room, ice_floe",64437
4779,114696,indoor,"clothing_store, clean_room, ice_shelf, discotheque, museum/indoor",64437
4780,114720,indoor,"dressing_room, clothing_store, beauty_salon, wheat_field, nursery",64437
4781,114744,indoor,"clean_room, ice_shelf, discotheque, iceberg, biology_laboratory",64437
4782,114768,outdoor,"iceberg, ice_shelf, clean_room, discotheque, glacier",64437
4783,114792,indoor,"clean_room, science_museum, chemistry_lab, hospital_room, biology_laboratory",64437
4784,114816,indoor,"hospital_room, clean_room, hospital, ice_shelf, airport_terminal",64437
4785,114840,indoor,"biology_laboratory, gift_shop, clothing_store, iceberg, clean_room",64437
4786,114864,indoor,"clothing_store, gift_shop, nursery, science_museum, museum/indoor",64437
4787,114888,indoor,"clothing_store, museum/indoor, gift_shop, clean_room, natural_history_museum",64437
4788,114912,indoor,"natural_history_museum, clothing_store, museum/indoor, science_museum, arch",64437
4789,114936,indoor,"clothing_store, museum/indoor, gift_shop, natural_history_museum, dressing_room",64437
4790,114960,indoor,"clothing_store, skyscraper, museum/indoor, office_building, shower",64437
4791,114984,indoor,"clothing_store, shower, dressing_room, museum/indoor, gift_shop",64437
4792,115008,indoor,"clothing_store, clean_room, museum/indoor, dressing_room, iceberg",64437
4793,115032,indoor,"discotheque, museum/indoor, music_studio, stage/indoor, hospital_room",64437
4794,115056,indoor,"nursery, hospital_room, museum/indoor, archive, clean_room",64437
4795,115080,indoor,"clean_room, lobby, reception, art_gallery, nursery",64437
4796,115104,indoor,"classroom, office, locker_room, lecture_room, archive",64437
4797,115128,indoor,"locker_room, jail_cell, airport_terminal, clean_room, hospital_room",64437
4798,115152,indoor,"clean_room, science_museum, museum/indoor, clothing_store, stage/indoor",64437
4799,115176,indoor,"museum/indoor, clean_room, clothing_store, archive, science_museum",64437
4800,115200,indoor,"hospital_room, beauty_salon, museum/indoor, science_museum, discotheque",64437
4801,115224,indoor,"discotheque, hospital_room, conference_center, classroom, locker_room",64437
4802,115248,indoor,"classroom, hospital_room, discotheque, locker_room, conference_center",64437
4803,115272,indoor,"dressing_room, classroom, lecture_room, shower, conference_center",64437
4804,115296,indoor,"hospital_room, beauty_salon, conference_center, clean_room, hospital",64437
4805,115320,indoor,"clean_room, hospital_room, biology_laboratory, chemistry_lab, conference_center",64437
4806,115344,indoor,"clothing_store, clean_room, science_museum, museum/indoor, ice_shelf",64437
4807,115368,outdoor,"clothing_store, skyscraper, hospital, pharmacy, tower",64437
4808,115392,indoor,"closet, skyscraper, clothing_store, tower, clean_room",64437
4809,115416,outdoor,"discotheque, tower, skyscraper, water_tower, jail_cell",64437
4810,115440,indoor,"locker_room, airport_terminal, conference_room, dressing_room, water_tower",64437
4811,115464,indoor,"locker_room, beauty_salon, hospital, ice_shelf, hospital_room",64437
4812,115488,indoor,"ice_shelf, discotheque, iceberg, stage/indoor, beauty_salon",64437
4813,115512,indoor,"discotheque, stage/indoor, airplane_cabin, airport_terminal, clean_room",64437
4814,115536,indoor,"clean_room, clothing_store, science_museum, department_store, biology_laboratory",64437
4815,115560,indoor,"clean_room, dressing_room, clothing_store, nursery, closet",64437
4816,115584,indoor,"clean_room, clothing_store, biology_laboratory, department_store, science_museum",64437
4817,115608,indoor,"clean_room, clothing_store, science_museum, department_store, biology_laboratory",64437
4818,115632,indoor,"clean_room, clothing_store, dressing_room, biology_laboratory, department_store",64437
4819,115656,indoor,"clean_room, clothing_store, dressing_room, department_store, nursery",64437
4820,115680,indoor,"clean_room, clothing_store, discotheque, dressing_room, department_store",64437
4821,115704,indoor,"clean_room, clothing_store, discotheque, dressing_room, department_store",64437
4822,115728,indoor,"dressing_room, clean_room, clothing_store, nursery, discotheque",64437
4823,115752,indoor,"dressing_room, clean_room, clothing_store, discotheque, martial_arts_gym",64437
4824,115776,indoor,"nursery, clean_room, discotheque, shower, biology_laboratory",64437
4825,115800,indoor,"shower, clean_room, bow_window/indoor, atrium/public, art_gallery",64437
4826,115824,indoor,"shower, clothing_store, skyscraper, closet, airplane_cabin",64437
4827,115848,indoor,"dressing_room, clean_room, clothing_store, hotel_room, chemistry_lab",64437
4828,115872,indoor,"dressing_room, clean_room, nursery, clothing_store, hotel_room",64437
4829,115896,indoor,"hospital_room, clean_room, hotel_room, bedroom, dressing_room",64437
4830,115920,indoor,"clean_room, hospital_room, hotel_room, dressing_room, operating_room",64437
4831,115944,indoor,"hotel_room, hospital_room, clean_room, dressing_room, bedroom",64437
4832,115968,indoor,"hospital_room, hotel_room, clean_room, youth_hostel, bedroom",64437
4833,115992,indoor,"hotel_room, hospital_room, clean_room, bedroom, dressing_room",64437
4834,116016,outdoor,"iceberg, ice_floe, museum/indoor, clean_room, ice_shelf",64437
4835,116040,indoor,"museum/indoor, clean_room, dressing_room, art_gallery, ice_floe",64437
4836,116064,indoor,"clean_room, museum/indoor, dressing_room, ice_floe, art_gallery",64437
4837,116088,indoor,"dressing_room, clean_room, museum/indoor, stage/indoor, discotheque",64437
4838,116112,indoor,"stage/indoor, museum/indoor, discotheque, music_studio, dressing_room",64437
4839,116136,indoor,"dressing_room, museum/indoor, clean_room, clothing_store, science_museum",64437
4840,116160,indoor,"dressing_room, nursery, clothing_store, classroom, museum/indoor",64437
4841,116184,indoor,"jail_cell, archive, chemistry_lab, playground, music_studio",64437
4842,116208,indoor,"science_museum, escalator/indoor, airport_terminal, clean_room, dressing_room",64437
4843,116232,indoor,"clean_room, martial_arts_gym, biology_laboratory, science_museum, chemistry_lab",64437
4844,116256,indoor,"clean_room, martial_arts_gym, dressing_room, art_gallery, locker_room",64437
4845,116280,indoor,"clean_room, martial_arts_gym, biology_laboratory, chemistry_lab, operating_room",64437
4846,116304,indoor,"martial_arts_gym, dressing_room, clean_room, biology_laboratory, clothing_store",64437
4847,116328,indoor,"martial_arts_gym, clean_room, biology_laboratory, dressing_room, chemistry_lab",64437
4848,116352,indoor,"dressing_room, music_studio, television_studio, stage/indoor, ballroom",64437
4849,116376,indoor,"dressing_room, clean_room, clothing_store, biology_laboratory, martial_arts_gym",64437
4850,116400,indoor,"discotheque, stage/indoor, ballroom, shower, music_studio",64437
4851,116424,indoor,"discotheque, dressing_room, bathroom, shower, airplane_cabin",64437
4852,116448,outdoor,"igloo, rainforest, discotheque, shower, mosque/outdoor",64437
4853,116472,indoor,"archive, museum/indoor, clean_room, natural_history_museum, clothing_store",64437
4854,116496,indoor,"dressing_room, bedroom, hotel_room, discotheque, iceberg",64437
4855,116520,indoor,"museum/indoor, clothing_store, dressing_room, clean_room, ice_shelf",64437
4856,116544,indoor,"clean_room, nursery, florist_shop/indoor, clothing_store, hospital_room",64437
4857,116568,indoor,"martial_arts_gym, dressing_room, boxing_ring, clothing_store, hospital_room",64437
4858,116592,indoor,"dressing_room, martial_arts_gym, beauty_salon, office, biology_laboratory",64437
4859,116616,indoor,"martial_arts_gym, clean_room, dressing_room, locker_room, operating_room",64437
4860,116640,indoor,"martial_arts_gym, clean_room, clothing_store, dressing_room, operating_room",64437
4861,116664,indoor,"clean_room, martial_arts_gym, operating_room, dressing_room, hospital_room",64437
4862,116688,indoor,"martial_arts_gym, clean_room, stage/indoor, clothing_store, operating_room",64437
4863,116712,indoor,"clean_room, locker_room, dressing_room, music_studio, chemistry_lab",64437
4864,116736,indoor,"dressing_room, clean_room, martial_arts_gym, biology_laboratory, chemistry_lab",64437
4865,116760,indoor,"clean_room, martial_arts_gym, biology_laboratory, chemistry_lab, clothing_store",64437
4866,116784,indoor,"clean_room, biology_laboratory, chemistry_lab, martial_arts_gym, archive",64437
4867,116808,indoor,"martial_arts_gym, clean_room, chemistry_lab, biology_laboratory, ice_skating_rink/indoor",64437
4868,116832,indoor,"martial_arts_gym, chemistry_lab, clean_room, science_museum, biology_laboratory",64437
4869,116856,indoor,"clean_room, museum/indoor, science_museum, art_gallery, martial_arts_gym",64437
4870,116880,indoor,"museum/indoor, discotheque, stage/indoor, martial_arts_gym, natural_history_museum",64437
4871,116904,indoor,"discotheque, ice_cream_parlor, iceberg, aquarium, ice_floe",64437
4872,116928,indoor,"clean_room, archive, nursery, hospital_room, iceberg",64437
4873,116952,indoor,"nursery, dorm_room, ice_shelf, natural_history_museum, bedroom",64437
4874,116976,indoor,"natural_history_museum, science_museum, archive, clean_room, office_cubicles",64437
4875,117000,indoor,"clean_room, hospital_room, operating_room, veterinarians_office, nursery",64437
4876,117024,indoor,"clean_room, martial_arts_gym, operating_room, hospital_room, biology_laboratory",64437
4877,117048,indoor,"hospital_room, clean_room, operating_room, beauty_salon, dressing_room",64437
4878,117072,indoor,"clean_room, hospital_room, operating_room, archive, biology_laboratory",64437
4879,117096,indoor,"science_museum, clean_room, natural_history_museum, clothing_store, archive",64437
4880,117120,indoor,"clean_room, martial_arts_gym, clothing_store, science_museum, archive",64437
4881,117144,indoor,"clean_room, clothing_store, archive, shoe_shop, dressing_room",64437
4882,117168,indoor,"biology_laboratory, clean_room, operating_room, chemistry_lab, science_museum",64437
4883,117192,indoor,"biology_laboratory, clean_room, chemistry_lab, science_museum, iceberg",64437
4884,117216,indoor,"science_museum, natural_history_museum, museum/indoor, art_gallery, clean_room",64437
4885,117240,indoor,"clean_room, biology_laboratory, chemistry_lab, operating_room, iceberg",64437
4886,117264,indoor,"biology_laboratory, clean_room, chemistry_lab, operating_room, art_studio",64437
4887,117288,indoor,"shower, clean_room, biology_laboratory, crevasse, ice_shelf",64437
4888,117312,indoor,"biology_laboratory, clean_room, chemistry_lab, science_museum, iceberg",64437
4889,117336,indoor,"biology_laboratory, clean_room, chemistry_lab, operating_room, ice_floe",64437
