,frame_num,environment,places,imdb_id
3708,88992,indoor,"dressing_room, discotheque, clean_room, nursery, museum/indoor",20436
3709,89016,indoor,"nursery, museum/indoor, bathroom, art_gallery, bedroom",20436
3710,89040,indoor,"nursery, bedroom, museum/indoor, art_gallery, bathroom",20436
3711,89064,indoor,"nursery, bedroom, museum/indoor, art_gallery, hotel_room",20436
3712,89088,indoor,"nursery, museum/indoor, bedroom, art_gallery, bathroom",20436
3713,89112,indoor,"dressing_room, discotheque, clean_room, nursery, bathroom",20436
3714,89136,indoor,"dressing_room, discotheque, ballroom, bathroom, clean_room",20436
3715,89160,indoor,"dressing_room, discotheque, clean_room, music_studio, ballroom",20436
3716,89184,indoor,"dressing_room, discotheque, clean_room, ballroom, nursing_home",20436
3717,89208,indoor,"dressing_room, discotheque, clean_room, museum/indoor, art_gallery",20436
3718,89232,indoor,"museum/indoor, stage/indoor, art_gallery, music_studio, discotheque",20436
3719,89256,indoor,"museum/indoor, stage/indoor, art_gallery, music_studio, discotheque",20436
3720,89280,indoor,"reception, pharmacy, elevator/door, beauty_salon, ice_shelf",20436
3721,89304,indoor,"reception, pharmacy, beauty_salon, ice_shelf, drugstore",20436
3722,89328,indoor,"reception, pharmacy, beauty_salon, elevator/door, ice_shelf",20436
3723,89352,indoor,"dressing_room, discotheque, clean_room, museum/indoor, music_studio",20436
3724,89376,indoor,"dressing_room, clean_room, museum/indoor, discotheque, art_gallery",20436
3725,89400,indoor,"dressing_room, clean_room, museum/indoor, discotheque, music_studio",20436
3726,89424,indoor,"dressing_room, clean_room, discotheque, museum/indoor, art_gallery",20436
3727,89448,indoor,"dressing_room, discotheque, clean_room, music_studio, museum/indoor",20436
3728,89472,indoor,"dressing_room, discotheque, clean_room, museum/indoor, art_gallery",20436
3729,89496,indoor,"dressing_room, discotheque, ballroom, museum/indoor, art_gallery",20436
3730,89520,indoor,"dressing_room, discotheque, ballroom, music_studio, television_studio",20436
3731,89544,indoor,"dressing_room, discotheque, clean_room, music_studio, museum/indoor",20436
3732,89568,indoor,"dressing_room, discotheque, ballroom, stage/indoor, classroom",20436
3733,89592,indoor,"dressing_room, discotheque, clean_room, music_studio, museum/indoor",20436
3734,89616,indoor,"dressing_room, music_studio, discotheque, museum/indoor, clean_room",20436
3735,89640,indoor,"dressing_room, discotheque, music_studio, museum/indoor, television_studio",20436
3736,89664,indoor,"dressing_room, discotheque, music_studio, museum/indoor, ballroom",20436
3737,89688,indoor,"clean_room, dressing_room, archive, operating_room, hospital_room",20436
3738,89712,indoor,"clean_room, archive, dressing_room, office, classroom",20436
3739,89736,indoor,"clean_room, archive, classroom, office, operating_room",20436
3740,89760,indoor,"clean_room, dressing_room, operating_room, hospital_room, office",20436
3741,89784,indoor,"clean_room, dressing_room, operating_room, hospital_room, archive",20436
3742,89808,indoor,"clean_room, dressing_room, operating_room, hospital_room, archive",20436
3743,89832,indoor,"dressing_room, banquet_hall, dining_hall, office, dining_room",20436
3744,89856,indoor,"classroom, office, clean_room, lecture_room, chemistry_lab",20436
3745,89880,indoor,"classroom, lecture_room, clean_room, archive, office",20436
3746,89904,indoor,"classroom, dressing_room, lecture_room, clean_room, office",20436
3747,89928,indoor,"clean_room, dressing_room, archive, beauty_salon, office",20436
3748,89952,indoor,"clean_room, dressing_room, operating_room, hospital_room, beauty_salon",20436
3749,89976,indoor,"clean_room, dressing_room, operating_room, hospital_room, beauty_salon",20436
3750,90000,indoor,"clean_room, dressing_room, classroom, operating_room, office",20436
3751,90024,indoor,"dressing_room, clean_room, operating_room, hospital_room, classroom",20436
3752,90048,indoor,"dressing_room, clean_room, archive, office, classroom",20436
3753,90072,indoor,"dressing_room, clean_room, beauty_salon, office, archive",20436
3754,90096,indoor,"dressing_room, clean_room, operating_room, beauty_salon, office",20436
3755,90120,indoor,"dressing_room, clean_room, beauty_salon, operating_room, hospital_room",20436
3756,90144,indoor,"dressing_room, clean_room, hospital_room, operating_room, beauty_salon",20436
3757,90168,indoor,"dressing_room, clean_room, operating_room, hospital_room, beauty_salon",20436
3758,90192,indoor,"classroom, lecture_room, conference_room, banquet_hall, dining_hall",20436
3759,90216,indoor,"clean_room, dressing_room, hospital_room, nursing_home, living_room",20436
3760,90240,indoor,"clean_room, operating_room, dressing_room, hospital_room, beauty_salon",20436
3761,90264,indoor,"bow_window/indoor, shower, jail_cell, bathroom, dressing_room",20436
3762,90288,indoor,"bow_window/indoor, shower, jail_cell, museum/indoor, elevator/door",20436
3763,90312,indoor,"shower, dressing_room, bow_window/indoor, museum/indoor, art_gallery",20436
3764,90336,indoor,"dressing_room, museum/indoor, elevator/door, art_gallery, locker_room",20436
3765,90360,indoor,"dressing_room, corridor, locker_room, elevator/door, archive",20436
3766,90384,indoor,"dressing_room, archive, museum/indoor, chemistry_lab, clean_room",20436
3767,90408,indoor,"corridor, locker_room, dressing_room, museum/indoor, art_gallery",20436
3768,90432,indoor,"dressing_room, locker_room, elevator/door, museum/indoor, clean_room",20436
3769,90456,indoor,"dressing_room, art_gallery, elevator/door, archive, elevator_lobby",20436
3770,90480,indoor,"pharmacy, museum/indoor, drugstore, hospital, archive",20436
3771,90504,indoor,"pharmacy, museum/indoor, drugstore, archive, hospital",20436
3772,90528,indoor,"pharmacy, museum/indoor, drugstore, archive, art_gallery",20436
3773,90552,indoor,"pharmacy, museum/indoor, drugstore, archive, hospital",20436
3774,90576,indoor,"pharmacy, museum/indoor, drugstore, archive, hospital",20436
3775,90600,indoor,"pharmacy, museum/indoor, drugstore, archive, hospital",20436
3776,90624,indoor,"pharmacy, museum/indoor, drugstore, hospital, archive",20436
3777,90648,indoor,"pharmacy, museum/indoor, drugstore, archive, hospital",20436
3778,90672,indoor,"pharmacy, museum/indoor, drugstore, hospital, archive",20436
3779,90696,indoor,"pharmacy, museum/indoor, drugstore, archive, hospital",20436
3780,90720,indoor,"pharmacy, museum/indoor, drugstore, archive, hospital",20436
3781,90744,indoor,"museum/indoor, pharmacy, drugstore, archive, art_gallery",20436
3782,90768,indoor,"pharmacy, museum/indoor, drugstore, archive, hospital",20436
3783,90792,indoor,"dressing_room, art_gallery, museum/indoor, clean_room, archive",20436
3784,90816,indoor,"museum/indoor, art_gallery, archive, dressing_room, clean_room",20436
3785,90840,indoor,"museum/indoor, stage/indoor, art_gallery, discotheque, music_studio",20436
3786,90864,indoor,"museum/indoor, stage/indoor, art_gallery, music_studio, discotheque",20436
3787,90888,indoor,"ice_shelf, reception, iceberg, art_gallery, pharmacy",20436
3788,90912,indoor,"reception, ice_shelf, beauty_salon, lobby, art_gallery",20436
3789,90936,indoor,"reception, ice_shelf, iceberg, art_gallery, office",20436
3790,90960,indoor,"reception, ice_shelf, iceberg, art_gallery, beauty_salon",20436
3791,90984,indoor,"reception, ice_shelf, iceberg, art_gallery, beauty_salon",20436
3792,91008,indoor,"museum/indoor, stage/indoor, art_gallery, art_studio, discotheque",20436
3793,91032,indoor,"museum/indoor, stage/indoor, art_gallery, discotheque, science_museum",20436
3794,91056,indoor,"art_gallery, museum/indoor, dressing_room, archive, art_studio",20436
3795,91080,indoor,"museum/indoor, art_gallery, archive, dressing_room, art_studio",20436
3796,91104,indoor,"pharmacy, museum/indoor, drugstore, reception, natural_history_museum",20436
3797,91128,indoor,"pharmacy, museum/indoor, drugstore, reception, natural_history_museum",20436
3798,91152,indoor,"pharmacy, museum/indoor, drugstore, reception, beauty_salon",20436
3799,91176,indoor,"pharmacy, museum/indoor, drugstore, reception, beauty_salon",20436
3800,91200,indoor,"pharmacy, museum/indoor, drugstore, reception, beauty_salon",20436
3801,91224,indoor,"pharmacy, museum/indoor, drugstore, reception, natural_history_museum",20436
3802,91248,indoor,"pharmacy, museum/indoor, drugstore, reception, beauty_salon",20436
3803,91272,indoor,"museum/indoor, art_gallery, archive, dressing_room, art_studio",20436
3804,91296,indoor,"dressing_room, art_gallery, museum/indoor, clean_room, archive",20436
3805,91320,indoor,"art_gallery, museum/indoor, archive, dressing_room, art_studio",20436
3806,91344,indoor,"museum/indoor, stage/indoor, art_gallery, discotheque, science_museum",20436
3807,91368,indoor,"museum/indoor, stage/indoor, art_gallery, archive, discotheque",20436
3808,91392,indoor,"museum/indoor, stage/indoor, art_gallery, science_museum, discotheque",20436
3809,91416,indoor,"museum/indoor, art_gallery, stage/indoor, archive, art_studio",20436
3810,91440,indoor,"museum/indoor, stage/indoor, art_gallery, music_studio, discotheque",20436
3811,91464,indoor,"museum/indoor, stage/indoor, art_gallery, discotheque, music_studio",20436
3812,91488,indoor,"pharmacy, reception, ice_shelf, drugstore, elevator/door",20436
3813,91512,indoor,"pharmacy, reception, drugstore, ice_shelf, elevator/door",20436
3814,91536,indoor,"pharmacy, reception, drugstore, elevator/door, elevator_lobby",20436
3815,91560,indoor,"reception, pharmacy, drugstore, elevator/door, ice_shelf",20436
3816,91584,indoor,"reception, pharmacy, elevator/door, drugstore, art_gallery",20436
3817,91608,indoor,"pharmacy, reception, drugstore, elevator/door, elevator_lobby",20436
3818,91632,indoor,"museum/indoor, stage/indoor, art_gallery, music_studio, discotheque",20436
3819,91656,indoor,"museum/indoor, stage/indoor, art_gallery, discotheque, music_studio",20436
3820,91680,indoor,"art_gallery, museum/indoor, archive, dressing_room, art_studio",20436
3821,91704,indoor,"dressing_room, art_gallery, museum/indoor, archive, art_studio",20436
3822,91728,indoor,"art_gallery, dressing_room, museum/indoor, archive, clean_room",20436
3823,91752,indoor,"art_gallery, museum/indoor, archive, clean_room, art_studio",20436
3824,91776,indoor,"pharmacy, beauty_salon, ice_shelf, reception, drugstore",20436
3825,91800,indoor,"alcove, reception, elevator/door, beauty_salon, ice_shelf",20436
3826,91824,indoor,"museum/indoor, art_gallery, dressing_room, archive, clean_room",20436
3827,91848,indoor,"museum/indoor, art_gallery, clean_room, archive, dressing_room",20436
3828,91872,indoor,"jail_cell, shower, bow_window/indoor, stage/indoor, bathroom",20436
3829,91896,indoor,"jail_cell, lake/natural, closet, shower, elevator/door",20436
3830,91920,indoor,"shower, bathroom, elevator/door, closet, hot_spring",20436
3831,91944,indoor,"shower, bathroom, jail_cell, basement, closet",20436
3832,91968,indoor,"shower, bathroom, jail_cell, basement, alcove",20436
3833,91992,outdoor,"shower, sky, ice_floe, iceberg, art_gallery",20436
3834,92016,outdoor,"ice_floe, shower, ice_shelf, iceberg, sky",20436
3835,92040,outdoor,"ice_floe, shower, ice_shelf, iceberg, sky",20436
3836,92064,outdoor,"ice_floe, shower, ice_shelf, iceberg, igloo",20436
3837,92088,outdoor,"ice_floe, shower, ice_shelf, iceberg, sky",20436
3838,92112,indoor,"museum/indoor, clean_room, dressing_room, art_gallery, science_museum",20436
3839,92136,indoor,"clean_room, museum/indoor, art_gallery, science_museum, natural_history_museum",20436
3840,92160,indoor,"museum/indoor, art_gallery, clean_room, natural_history_museum, science_museum",20436
3841,92184,indoor,"museum/indoor, clean_room, science_museum, art_gallery, natural_history_museum",20436
3842,92208,indoor,"museum/indoor, clean_room, stage/indoor, discotheque, art_gallery",20436
3843,92232,indoor,"museum/indoor, clean_room, martial_arts_gym, art_gallery, nursery",20436
3844,92256,indoor,"museum/indoor, science_museum, art_gallery, natural_history_museum, nursery",20436
3845,92280,indoor,"clean_room, museum/indoor, dressing_room, discotheque, nursery",20436
3846,92304,indoor,"museum/indoor, clean_room, nursery, art_gallery, dressing_room",20436
3847,92328,indoor,"museum/indoor, clean_room, discotheque, dressing_room, art_gallery",20436
3848,92352,indoor,"clean_room, dressing_room, museum/indoor, nursery, art_gallery",20436
3849,92376,indoor,"clean_room, museum/indoor, dressing_room, discotheque, martial_arts_gym",20436
3850,92400,outdoor,"shower, ice_floe, aquarium, iceberg, ice_shelf",20436
3851,92424,indoor,"shower, ice_floe, sky, art_gallery, aquarium",20436
3852,92448,indoor,"shower, ball_pit, ice_floe, aquarium, sky",20436
3853,92472,indoor,"shower, sky, ice_floe, ball_pit, aquarium",20436
3854,92496,outdoor,"sky, shower, ice_floe, aquarium, wheat_field",20436
3855,92520,indoor,"clean_room, museum/indoor, art_gallery, martial_arts_gym, science_museum",20436
3856,92544,indoor,"museum/indoor, clean_room, art_gallery, archive, stage/indoor",20436
3857,92568,indoor,"clean_room, museum/indoor, science_museum, toyshop, discotheque",20436
3858,92592,indoor,"clean_room, museum/indoor, dressing_room, art_gallery, science_museum",20436
3859,92616,indoor,"museum/indoor, art_gallery, clean_room, science_museum, artists_loft",20436
3860,92640,indoor,"clean_room, museum/indoor, discotheque, science_museum, airport_terminal",20436
3861,92664,indoor,"museum/indoor, clean_room, science_museum, art_gallery, gymnasium/indoor",20436
3862,92688,indoor,"museum/indoor, clean_room, science_museum, art_gallery, discotheque",20436
3863,92712,indoor,"dressing_room, clean_room, clothing_store, locker_room, operating_room",20436
3864,92736,indoor,"clean_room, dressing_room, nursery, locker_room, operating_room",20436
3865,92760,indoor,"dressing_room, clean_room, nursery, chemistry_lab, museum/indoor",20436
3866,92784,indoor,"dressing_room, clean_room, locker_room, operating_room, hospital_room",20436
3867,92808,indoor,"clean_room, dressing_room, locker_room, museum/indoor, clothing_store",20436
3868,92832,indoor,"dressing_room, clean_room, boxing_ring, operating_room, martial_arts_gym",20436
3869,92856,indoor,"clean_room, operating_room, chemistry_lab, hospital_room, dressing_room",20436
3870,92880,indoor,"pharmacy, museum/indoor, ice_shelf, art_gallery, desert/sand",20436
3871,92904,outdoor,"ice_shelf, pharmacy, iceberg, desert/sand, museum/indoor",20436
3872,92928,outdoor,"ice_shelf, pharmacy, desert/sand, iceberg, museum/indoor",20436
3873,92952,indoor,"pharmacy, reception, ice_shelf, drugstore, museum/indoor",20436
3874,92976,outdoor,"ice_shelf, iceberg, pharmacy, desert/sand, museum/indoor",20436
3875,93000,indoor,"pharmacy, museum/indoor, ice_shelf, reception, art_gallery",20436
3876,93024,indoor,"clean_room, dressing_room, locker_room, operating_room, archive",20436
3877,93048,indoor,"clean_room, operating_room, dressing_room, museum/indoor, chemistry_lab",20436
3878,93072,indoor,"clean_room, dressing_room, locker_room, museum/indoor, operating_room",20436
3879,93096,indoor,"ice_shelf, iceberg, reception, alcove, elevator/door",20436
3880,93120,indoor,"ice_shelf, iceberg, alcove, elevator/door, reception",20436
3881,93144,outdoor,"ice_shelf, iceberg, desert/sand, alcove, elevator/door",20436
3882,93168,indoor,"clean_room, dressing_room, locker_room, museum/indoor, nursery",20436
3883,93192,indoor,"dressing_room, clean_room, nursery, hospital_room, operating_room",20436
3884,93216,indoor,"museum/indoor, clean_room, art_gallery, nursery, dressing_room",20436
3885,93240,indoor,"clean_room, nursery, hospital_room, dressing_room, discotheque",20436
3886,93264,indoor,"discotheque, dressing_room, stage/indoor, ballroom, chemistry_lab",20436
3887,93288,indoor,"museum/indoor, pharmacy, natural_history_museum, drugstore, hospital",20436
3888,93312,indoor,"museum/indoor, pharmacy, drugstore, natural_history_museum, art_gallery",20436
3889,93336,indoor,"museum/indoor, pharmacy, drugstore, reception, art_gallery",20436
3890,93360,indoor,"museum/indoor, pharmacy, drugstore, natural_history_museum, beauty_salon",20436
3891,93384,indoor,"museum/indoor, pharmacy, drugstore, natural_history_museum, art_gallery",20436
3892,93408,indoor,"museum/indoor, pharmacy, drugstore, natural_history_museum, art_gallery",20436
3893,93432,indoor,"museum/indoor, pharmacy, drugstore, natural_history_museum, reception",20436
3894,93456,indoor,"museum/indoor, pharmacy, natural_history_museum, drugstore, elevator/door",20436
3895,93480,indoor,"clean_room, dressing_room, operating_room, nursery, hospital_room",20436
3896,93504,indoor,"dressing_room, clean_room, nursery, discotheque, ballroom",20436
3897,93528,indoor,"clean_room, dressing_room, chemistry_lab, discotheque, biology_laboratory",20436
3898,93552,indoor,"museum/indoor, pharmacy, art_gallery, reception, ice_shelf",20436
3899,93576,indoor,"museum/indoor, pharmacy, ice_shelf, art_gallery, drugstore",20436
3900,93600,indoor,"museum/indoor, pharmacy, art_gallery, ice_shelf, reception",20436
3901,93624,indoor,"museum/indoor, pharmacy, reception, art_gallery, drugstore",20436
3902,93648,indoor,"pharmacy, museum/indoor, ice_shelf, art_gallery, drugstore",20436
3903,93672,indoor,"museum/indoor, pharmacy, art_gallery, ice_shelf, reception",20436
3904,93696,indoor,"dressing_room, clean_room, nursery, discotheque, locker_room",20436
3905,93720,indoor,"discotheque, nursery, clean_room, music_studio, stage/indoor",20436
3906,93744,indoor,"dressing_room, museum/indoor, nursery, clean_room, art_gallery",20436
3907,93768,indoor,"clean_room, nursery, discotheque, hospital_room, dressing_room",20436
3908,93792,indoor,"dressing_room, clean_room, nursery, operating_room, hospital_room",20436
3909,93816,indoor,"reception, ice_shelf, art_gallery, pharmacy, beauty_salon",20436
3910,93840,indoor,"reception, ice_shelf, art_gallery, pharmacy, beauty_salon",20436
3911,93864,indoor,"reception, ice_shelf, art_gallery, pharmacy, beauty_salon",20436
3912,93888,indoor,"reception, ice_shelf, art_gallery, beauty_salon, pharmacy",20436
3913,93912,indoor,"reception, ice_shelf, art_gallery, pharmacy, lobby",20436
3914,93936,indoor,"nursery, museum/indoor, dressing_room, discotheque, clean_room",20436
3915,93960,indoor,"dressing_room, clean_room, discotheque, nursery, operating_room",20436
3916,93984,indoor,"iceberg, discotheque, clean_room, chemistry_lab, science_museum",20436
3917,94008,indoor,"nursery, dressing_room, clean_room, chemistry_lab, museum/indoor",20436
3918,94032,indoor,"nursery, iceberg, ice_floe, shower, aquarium",20436
3919,94056,indoor,"clean_room, museum/indoor, natural_history_museum, dressing_room, nursery",20436
3920,94080,indoor,"discotheque, dressing_room, clean_room, nursery, stage/indoor",20436
3921,94104,indoor,"dressing_room, nursery, clean_room, ballroom, discotheque",20436
3922,94128,indoor,"nursery, music_studio, clean_room, discotheque, hospital_room",20436
3923,94152,indoor,"discotheque, music_studio, clean_room, chemistry_lab, dressing_room",20436
3924,94176,indoor,"clean_room, dressing_room, chemistry_lab, discotheque, nursery",20436
3925,94200,indoor,"clean_room, dressing_room, discotheque, nursery, ballroom",20436
3926,94224,indoor,"iceberg, ice_floe, clean_room, aquarium, natural_history_museum",20436
3927,94248,indoor,"nursery, ice_cream_parlor, clean_room, dressing_room, natural_history_museum",20436
3928,94272,indoor,"nursery, dressing_room, clean_room, boxing_ring, hospital_room",20436
3929,94296,indoor,"dressing_room, boxing_ring, shower, chemistry_lab, clean_room",20436
3930,94320,indoor,"clean_room, chemistry_lab, iceberg, discotheque, aquarium",20436
3931,94344,indoor,"museum/indoor, natural_history_museum, science_museum, clean_room, art_gallery",20436
3932,94368,indoor,"clean_room, nursery, museum/indoor, bowling_alley, boxing_ring",20436
3933,94392,indoor,"clean_room, hospital_room, operating_room, nursery, museum/indoor",20436
3934,94416,indoor,"clean_room, operating_room, hospital_room, nursery, recreation_room",20436
3935,94440,indoor,"clean_room, museum/indoor, bow_window/indoor, home_theater, art_gallery",20436
3936,94464,indoor,"nursery, bow_window/indoor, living_room, bedroom, clean_room",20436
3937,94488,indoor,"television_studio, classroom, museum/indoor, home_theater, clean_room",20436
3938,94512,indoor,"museum/indoor, natural_history_museum, science_museum, archive, cemetery",20436
3939,94536,indoor,"museum/indoor, natural_history_museum, science_museum, archive, cemetery",20436
3940,94560,indoor,"museum/indoor, natural_history_museum, science_museum, archive, cemetery",20436
3941,94584,indoor,"museum/indoor, natural_history_museum, science_museum, archive, cemetery",20436
3942,94608,indoor,"museum/indoor, natural_history_museum, science_museum, archive, cemetery",20436
3943,94632,indoor,"museum/indoor, natural_history_museum, science_museum, archive, cemetery",20436
3944,94656,indoor,"museum/indoor, natural_history_museum, science_museum, archive, cemetery",20436
3945,94680,indoor,"museum/indoor, natural_history_museum, science_museum, archive, cemetery",20436
3946,94704,indoor,"museum/indoor, natural_history_museum, science_museum, archive, cemetery",20436
3947,94728,indoor,"museum/indoor, natural_history_museum, science_museum, archive, cemetery",20436
3948,94752,indoor,"museum/indoor, natural_history_museum, science_museum, archive, cemetery",20436
3949,94776,indoor,"museum/indoor, natural_history_museum, science_museum, archive, cemetery",20436
3950,94800,indoor,"home_theater, bow_window/indoor, living_room, bedroom, art_gallery",20436
3951,94824,indoor,"home_theater, bow_window/indoor, art_gallery, clean_room, television_studio",20436
3952,94848,indoor,"bow_window/indoor, clean_room, home_theater, living_room, nursery",20436
3953,94872,indoor,"pharmacy, reception, elevator/door, museum/indoor, hospital",20436
3954,94896,indoor,"pharmacy, reception, museum/indoor, elevator/door, drugstore",20436
3955,94920,indoor,"pharmacy, museum/indoor, reception, hospital, drugstore",20436
3956,94944,indoor,"pharmacy, museum/indoor, hospital, elevator/door, art_gallery",20436
3957,94968,indoor,"pharmacy, reception, museum/indoor, hospital, elevator/door",20436
3958,94992,indoor,"clean_room, bow_window/indoor, nursery, home_theater, hospital_room",20436
3959,95016,indoor,"clean_room, nursery, bow_window/indoor, hospital_room, operating_room",20436
3960,95040,indoor,"clean_room, home_theater, bow_window/indoor, living_room, hospital_room",20436
3961,95064,indoor,"home_theater, bedroom, bow_window/indoor, living_room, clean_room",20436
3962,95088,indoor,"living_room, art_gallery, bedroom, museum/indoor, nursery",20436
3963,95112,indoor,"museum/indoor, nursery, clean_room, living_room, television_studio",20436
3964,95136,indoor,"clean_room, museum/indoor, science_museum, art_gallery, ice_cream_parlor",20436
3965,95160,indoor,"museum/indoor, pharmacy, reception, natural_history_museum, drugstore",20436
3966,95184,indoor,"museum/indoor, pharmacy, reception, drugstore, art_gallery",20436
3967,95208,indoor,"museum/indoor, pharmacy, reception, drugstore, natural_history_museum",20436
3968,95232,indoor,"museum/indoor, pharmacy, reception, drugstore, art_gallery",20436
3969,95256,indoor,"museum/indoor, pharmacy, reception, drugstore, natural_history_museum",20436
3970,95280,indoor,"museum/indoor, pharmacy, reception, drugstore, art_gallery",20436
3971,95304,indoor,"museum/indoor, pharmacy, drugstore, reception, hospital",20436
3972,95328,indoor,"shower, museum/indoor, dressing_room, bathroom, clean_room",20436
3973,95352,indoor,"stage/indoor, discotheque, museum/indoor, clean_room, ballroom",20436
3974,95376,indoor,"museum/indoor, chemistry_lab, clean_room, biology_laboratory, coffee_shop",20436
3975,95400,indoor,"museum/indoor, natural_history_museum, pharmacy, art_gallery, drugstore",20436
3976,95424,indoor,"museum/indoor, natural_history_museum, pharmacy, archive, science_museum",20436
3977,95448,indoor,"museum/indoor, natural_history_museum, pharmacy, art_gallery, drugstore",20436
3978,95472,indoor,"museum/indoor, natural_history_museum, pharmacy, archive, art_gallery",20436
3979,95496,indoor,"museum/indoor, natural_history_museum, pharmacy, drugstore, art_gallery",20436
3980,95520,indoor,"museum/indoor, natural_history_museum, archive, pharmacy, art_gallery",20436
3981,95544,indoor,"museum/indoor, natural_history_museum, pharmacy, art_gallery, archive",20436
3982,95568,indoor,"museum/indoor, natural_history_museum, pharmacy, archive, science_museum",20436
3983,95592,indoor,"museum/indoor, natural_history_museum, pharmacy, archive, drugstore",20436
3984,95616,indoor,"museum/indoor, clean_room, nursery, art_studio, art_gallery",20436
3985,95640,indoor,"nursery, clean_room, museum/indoor, art_gallery, bow_window/indoor",20436
3986,95664,indoor,"clean_room, museum/indoor, nursery, science_museum, television_studio",20436
3987,95688,indoor,"television_studio, clean_room, home_theater, living_room, office",20436
3988,95712,indoor,"clean_room, television_studio, museum/indoor, nursery, office_cubicles",20436
3989,95736,indoor,"museum/indoor, clean_room, nursery, art_gallery, bow_window/indoor",20436
3990,95760,indoor,"clean_room, museum/indoor, nursery, science_museum, television_studio",20436
3991,95784,indoor,"clean_room, nursery, living_room, art_gallery, home_theater",20436
3992,95808,indoor,"clean_room, nursery, living_room, bedroom, home_theater",20436
3993,95832,indoor,"clean_room, museum/indoor, office_cubicles, art_gallery, office",20436
3994,95856,indoor,"museum/indoor, clean_room, nursery, art_gallery, art_studio",20436
3995,95880,indoor,"home_theater, living_room, nursery, bathroom, bow_window/indoor",20436
3996,95904,indoor,"bathroom, sauna, alcove, art_gallery, shower",20436
3997,95928,indoor,"bathroom, home_theater, bow_window/indoor, art_gallery, shower",20436
