,frame_num,environment,places,imdb_id
0,0,indoor,"locker_room, elevator/door, closet, basement, archive",348369
1,24,indoor,"archive, slum, basement, classroom, jail_cell",348369
2,48,indoor,"natural_history_museum, museum/indoor, archive, science_museum, drugstore",348369
3,72,indoor,"natural_history_museum, museum/indoor, archive, science_museum, booth/indoor",348369
4,96,indoor,"natural_history_museum, museum/indoor, science_museum, booth/indoor, archive",348369
5,120,indoor,"natural_history_museum, museum/indoor, booth/indoor, science_museum, archive",348369
6,144,indoor,"natural_history_museum, museum/indoor, science_museum, archive, booth/indoor",348369
7,168,indoor,"natural_history_museum, museum/indoor, archive, science_museum, booth/indoor",348369
8,192,indoor,"natural_history_museum, museum/indoor, archive, science_museum, booth/indoor",348369
9,216,indoor,"museum/indoor, natural_history_museum, archive, lecture_room, science_museum",348369
10,240,indoor,"museum/indoor, archive, natural_history_museum, science_museum, booth/indoor",348369
11,264,indoor,"museum/indoor, archive, discotheque, natural_history_museum, lecture_room",348369
12,288,indoor,"discotheque, museum/indoor, bar, archive, cemetery",348369
13,312,indoor,"discotheque, museum/indoor, bar, stage/indoor, archive",348369
14,336,indoor,"museum/indoor, archive, science_museum, booth/indoor, natural_history_museum",348369
15,360,indoor,"museum/indoor, archive, science_museum, booth/indoor, drugstore",348369
16,384,indoor,"museum/indoor, archive, science_museum, drugstore, natural_history_museum",348369
17,408,indoor,"archive, museum/indoor, science_museum, booth/indoor, drugstore",348369
18,432,indoor,"museum/indoor, archive, science_museum, natural_history_museum, drugstore",348369
19,456,indoor,"museum/indoor, archive, science_museum, natural_history_museum, booth/indoor",348369
20,480,indoor,"archive, museum/indoor, drugstore, science_museum, pharmacy",348369
21,504,indoor,"museum/indoor, archive, science_museum, drugstore, natural_history_museum",348369
22,528,indoor,"archive, museum/indoor, drugstore, pharmacy, booth/indoor",348369
23,552,indoor,"museum/indoor, archive, science_museum, drugstore, natural_history_museum",348369
24,576,indoor,"archive, museum/indoor, science_museum, natural_history_museum, booth/indoor",348369
25,600,indoor,"museum/indoor, archive, science_museum, drugstore, natural_history_museum",348369
26,624,indoor,"museum/indoor, archive, science_museum, booth/indoor, natural_history_museum",348369
27,648,indoor,"museum/indoor, archive, science_museum, drugstore, natural_history_museum",348369
28,672,indoor,"museum/indoor, archive, science_museum, drugstore, natural_history_museum",348369
29,696,indoor,"museum/indoor, archive, science_museum, drugstore, natural_history_museum",348369
30,720,indoor,"museum/indoor, archive, drugstore, pharmacy, science_museum",348369
31,744,indoor,"museum/indoor, archive, science_museum, booth/indoor, natural_history_museum",348369
32,768,indoor,"archive, museum/indoor, science_museum, drugstore, natural_history_museum",348369
33,792,indoor,"museum/indoor, archive, science_museum, drugstore, natural_history_museum",348369
34,816,indoor,"museum/indoor, archive, science_museum, natural_history_museum, booth/indoor",348369
35,840,indoor,"museum/indoor, archive, science_museum, drugstore, natural_history_museum",348369
36,864,indoor,"archive, museum/indoor, science_museum, drugstore, natural_history_museum",348369
37,888,indoor,"archive, museum/indoor, science_museum, booth/indoor, drugstore",348369
38,912,indoor,"museum/indoor, archive, science_museum, natural_history_museum, drugstore",348369
39,936,indoor,"archive, museum/indoor, science_museum, booth/indoor, natural_history_museum",348369
40,960,indoor,"archive, museum/indoor, science_museum, drugstore, booth/indoor",348369
41,984,indoor,"museum/indoor, archive, science_museum, drugstore, natural_history_museum",348369
42,1008,indoor,"archive, museum/indoor, science_museum, booth/indoor, natural_history_museum",348369
43,1032,indoor,"archive, museum/indoor, booth/indoor, lecture_room, classroom",348369
44,1056,indoor,"archive, museum/indoor, booth/indoor, lecture_room, classroom",348369
45,1080,indoor,"booth/indoor, kindergarden_classroom, classroom, lecture_room, museum/indoor",348369
46,1104,indoor,"pharmacy, motel, drugstore, hospital, laundromat",348369
47,1128,indoor,"pharmacy, drugstore, motel, laundromat, hospital",348369
48,1152,indoor,"pharmacy, motel, drugstore, laundromat, hospital",348369
49,1176,indoor,"pharmacy, laundromat, motel, drugstore, hospital",348369
50,1200,indoor,"pharmacy, drugstore, motel, laundromat, hospital",348369
51,1224,indoor,"pharmacy, motel, laundromat, drugstore, hospital",348369
52,1248,indoor,"pharmacy, laundromat, motel, airport_terminal, drugstore",348369
53,1272,indoor,"pharmacy, drugstore, beauty_salon, airport_terminal, clothing_store",348369
54,1296,indoor,"pharmacy, drugstore, beauty_salon, hospital, cemetery",348369
55,1320,indoor,"pharmacy, drugstore, beauty_salon, ice_shelf, hospital",348369
56,1344,indoor,"pharmacy, drugstore, beauty_salon, ice_shelf, hospital",348369
57,1368,indoor,"pharmacy, drugstore, clothing_store, ice_shelf, beauty_salon",348369
58,1392,indoor,"pharmacy, drugstore, ice_shelf, beauty_salon, clothing_store",348369
59,1416,indoor,"pharmacy, drugstore, ice_shelf, beauty_salon, clothing_store",348369
60,1440,indoor,"pharmacy, drugstore, ice_shelf, beauty_salon, clothing_store",348369
61,1464,indoor,"pharmacy, drugstore, ice_shelf, beauty_salon, hospital",348369
62,1488,indoor,"drugstore, pharmacy, beauty_salon, ice_shelf, clothing_store",348369
63,1512,indoor,"pharmacy, drugstore, ice_shelf, beauty_salon, hospital",348369
64,1536,indoor,"pharmacy, drugstore, beauty_salon, ice_shelf, hospital",348369
65,1560,indoor,"pharmacy, drugstore, beauty_salon, clean_room, hospital",348369
66,1584,indoor,"basement, shower, jail_cell, lake/natural, ice_shelf",348369
67,1608,indoor,"basement, jail_cell, barndoor, shower, slum",348369
68,1632,outdoor,"iceberg, ice_shelf, mountain_snowy, ice_floe, glacier",348369
69,1656,outdoor,"iceberg, ice_shelf, ice_floe, glacier, mountain_snowy",348369
70,1680,outdoor,"iceberg, ice_shelf, ice_floe, mountain_snowy, glacier",348369
71,1704,outdoor,"iceberg, ice_shelf, ice_floe, igloo, glacier",348369
72,1728,outdoor,"iceberg, ice_shelf, ice_floe, igloo, mountain_snowy",348369
73,1752,outdoor,"iceberg, ice_floe, ice_shelf, igloo, glacier",348369
74,1776,outdoor,"iceberg, ice_shelf, ice_floe, igloo, rock_arch",348369
75,1800,outdoor,"iceberg, ice_shelf, ice_floe, igloo, rock_arch",348369
76,1824,outdoor,"iceberg, ice_shelf, ice_floe, igloo, glacier",348369
77,1848,outdoor,"iceberg, ice_shelf, ice_floe, igloo, mountain_snowy",348369
78,1872,outdoor,"ice_floe, ice_shelf, orchard, snowfield, tree_farm",348369
79,1896,outdoor,"ice_shelf, ice_floe, orchard, snowfield, lake/natural",348369
80,1920,outdoor,"ice_shelf, ice_floe, iceberg, lake/natural, ocean",348369
81,1944,outdoor,"ice_shelf, ice_floe, orchard, snowfield, lake/natural",348369
82,1968,outdoor,"ice_shelf, ice_floe, snowfield, lake/natural, coast",348369
83,1992,outdoor,"ice_shelf, ice_floe, snowfield, coast, ocean",348369
84,2016,outdoor,"ice_shelf, ice_floe, iceberg, lake/natural, ocean",348369
85,2040,outdoor,"ice_floe, ice_shelf, lake/natural, snowfield, iceberg",348369
86,2064,outdoor,"iceberg, ice_shelf, ice_floe, ocean, lake/natural",348369
87,2088,outdoor,"iceberg, ice_shelf, ice_floe, sky, lake/natural",348369
88,2112,indoor,"clean_room, museum/indoor, nursery, dressing_room, natural_history_museum",348369
89,2136,indoor,"clean_room, museum/indoor, stage/indoor, operating_room, natural_history_museum",348369
90,2160,indoor,"clean_room, discotheque, stage/indoor, dressing_room, chemistry_lab",348369
91,2184,indoor,"museum/indoor, clean_room, stage/indoor, discotheque, natural_history_museum",348369
92,2208,indoor,"clean_room, discotheque, stage/indoor, museum/indoor, martial_arts_gym",348369
93,2232,indoor,"discotheque, clean_room, stage/indoor, museum/indoor, music_studio",348369
94,2256,indoor,"museum/indoor, archive, art_gallery, science_museum, drugstore",348369
95,2280,indoor,"museum/indoor, science_museum, art_gallery, archive, cemetery",348369
96,2304,indoor,"museum/indoor, science_museum, drugstore, art_gallery, archive",348369
97,2328,indoor,"museum/indoor, drugstore, science_museum, art_gallery, archive",348369
98,2352,indoor,"museum/indoor, art_gallery, science_museum, archive, drugstore",348369
99,2376,indoor,"museum/indoor, cemetery, art_gallery, science_museum, archive",348369
100,2400,indoor,"museum/indoor, art_gallery, archive, science_museum, drugstore",348369
101,2424,indoor,"museum/indoor, art_gallery, archive, drugstore, science_museum",348369
102,2448,indoor,"museum/indoor, cemetery, archive, art_gallery, science_museum",348369
103,2472,indoor,"museum/indoor, art_gallery, archive, cemetery, science_museum",348369
104,2496,indoor,"museum/indoor, art_gallery, science_museum, archive, drugstore",348369
105,2520,indoor,"museum/indoor, cemetery, archive, art_gallery, science_museum",348369
106,2544,indoor,"ice_cream_parlor, museum/indoor, clean_room, art_gallery, science_museum",348369
107,2568,indoor,"discotheque, clean_room, ice_cream_parlor, music_studio, stage/indoor",348369
108,2592,indoor,"stage/indoor, discotheque, music_studio, clean_room, corn_field",348369
109,2616,indoor,"discotheque, stage/indoor, music_studio, clean_room, museum/indoor",348369
110,2640,indoor,"clean_room, discotheque, iceberg, aquarium, shower",348369
111,2664,indoor,"museum/indoor, cemetery, pharmacy, drugstore, natural_history_museum",348369
112,2688,indoor,"museum/indoor, cemetery, pharmacy, drugstore, hospital",348369
113,2712,indoor,"museum/indoor, cemetery, natural_history_museum, pharmacy, art_gallery",348369
114,2736,indoor,"museum/indoor, pharmacy, natural_history_museum, hospital, cemetery",348369
115,2760,indoor,"museum/indoor, cemetery, hospital, pharmacy, natural_history_museum",348369
116,2784,indoor,"museum/indoor, natural_history_museum, pharmacy, art_gallery, cemetery",348369
117,2808,indoor,"museum/indoor, pharmacy, cemetery, natural_history_museum, drugstore",348369
118,2832,indoor,"museum/indoor, pharmacy, hospital, natural_history_museum, art_gallery",348369
119,2856,indoor,"museum/indoor, cemetery, pharmacy, hospital, natural_history_museum",348369
120,2880,indoor,"museum/indoor, army_base, cemetery, nursery, art_gallery",348369
121,2904,indoor,"museum/indoor, nursery, ice_cream_parlor, childs_room, art_gallery",348369
122,2928,indoor,"museum/indoor, clean_room, coffee_shop, art_gallery, nursery",348369
123,2952,indoor,"clean_room, museum/indoor, ice_floe, iceberg, ice_cream_parlor",348369
124,2976,indoor,"clean_room, museum/indoor, discotheque, chemistry_lab, ice_cream_parlor",348369
125,3000,indoor,"discotheque, ice_cream_parlor, clean_room, ice_floe, museum/indoor",348369
126,3024,indoor,"clean_room, museum/indoor, stage/indoor, wheat_field, discotheque",348369
127,3048,indoor,"clean_room, chemistry_lab, biology_laboratory, candy_store, discotheque",348369
128,3072,outdoor,"highway, runway, railroad_track, forest_road, field_road",348369
129,3096,outdoor,"railroad_track, highway, mountain_snowy, ski_slope, desert_road",348369
130,3120,outdoor,"railroad_track, ski_slope, mountain_snowy, snowfield, highway",348369
131,3144,outdoor,"railroad_track, highway, ski_slope, desert_road, snowfield",348369
132,3168,outdoor,"railroad_track, highway, ski_slope, mountain_snowy, field_road",348369
133,3192,outdoor,"highway, railroad_track, ski_slope, mountain_snowy, field_road",348369
134,3216,indoor,"clean_room, shower, playroom, hospital_room, dressing_room",348369
135,3240,indoor,"clean_room, locker_room, dressing_room, elevator/door, hospital_room",348369
136,3264,indoor,"clean_room, locker_room, dressing_room, nursery, kindergarden_classroom",348369
137,3288,indoor,"museum/indoor, science_museum, natural_history_museum, art_gallery, archive",348369
138,3312,indoor,"museum/indoor, science_museum, art_gallery, natural_history_museum, beauty_salon",348369
139,3336,indoor,"museum/indoor, science_museum, natural_history_museum, art_gallery, discotheque",348369
140,3360,indoor,"museum/indoor, science_museum, natural_history_museum, art_gallery, archive",348369
141,3384,indoor,"museum/indoor, science_museum, natural_history_museum, art_gallery, beauty_salon",348369
142,3408,indoor,"museum/indoor, science_museum, art_gallery, natural_history_museum, beauty_salon",348369
143,3432,indoor,"museum/indoor, science_museum, art_gallery, natural_history_museum, discotheque",348369
144,3456,indoor,"museum/indoor, science_museum, natural_history_museum, art_gallery, beauty_salon",348369
145,3480,indoor,"museum/indoor, science_museum, natural_history_museum, art_gallery, discotheque",348369
146,3504,indoor,"museum/indoor, science_museum, natural_history_museum, art_gallery, discotheque",348369
147,3528,indoor,"museum/indoor, science_museum, art_gallery, natural_history_museum, beauty_salon",348369
148,3552,indoor,"museum/indoor, science_museum, art_gallery, natural_history_museum, archive",348369
149,3576,indoor,"museum/indoor, science_museum, natural_history_museum, art_gallery, archive",348369
150,3600,indoor,"locker_room, clean_room, dressing_room, shower, museum/indoor",348369
151,3624,indoor,"clean_room, shower, natural_history_museum, bathroom, locker_room",348369
152,3648,indoor,"dressing_room, clean_room, shower, art_gallery, locker_room",348369
153,3672,indoor,"natural_history_museum, clean_room, science_museum, art_gallery, museum/indoor",348369
154,3696,indoor,"dressing_room, shower, clean_room, locker_room, elevator/door",348369
155,3720,indoor,"clean_room, locker_room, dressing_room, shower, elevator/door",348369
156,3744,indoor,"locker_room, dressing_room, shower, elevator/door, closet",348369
157,3768,outdoor,"railroad_track, highway, mountain_snowy, ski_slope, train_station/platform",348369
158,3792,outdoor,"railroad_track, mountain_snowy, ski_slope, highway, snowfield",348369
159,3816,outdoor,"railroad_track, mountain_snowy, viaduct, bridge, ice_shelf",348369
160,3840,outdoor,"railroad_track, mountain_snowy, ice_shelf, snowfield, glacier",348369
161,3864,outdoor,"snowfield, ski_slope, mountain_snowy, ski_resort, highway",348369
162,3888,outdoor,"snowfield, ski_slope, ice_shelf, mountain_snowy, ski_resort",348369
163,3912,outdoor,"ski_slope, snowfield, ski_resort, mountain_snowy, ice_shelf",348369
164,3936,outdoor,"snowfield, ski_slope, ski_resort, ice_shelf, mountain_snowy",348369
165,3960,outdoor,"ice_floe, ice_shelf, ocean, snowfield, harbor",348369
166,3984,outdoor,"ski_resort, ski_slope, snowfield, mountain_snowy, chalet",348369
167,4008,outdoor,"ski_slope, ski_resort, snowfield, alley, ice_shelf",348369
168,4032,outdoor,"gas_station, shed, industrial_area, railroad_track, classroom",348369
169,4056,indoor,"clean_room, museum/indoor, dressing_room, ice_cream_parlor, chemistry_lab",348369
170,4080,indoor,"clean_room, dressing_room, museum/indoor, discotheque, shower",348369
171,4104,outdoor,"sky, water_tower, ice_floe, runway, windmill",348369
172,4128,outdoor,"runway, landing_deck, motel, oilrig, industrial_area",348369
173,4152,outdoor,"industrial_area, ice_floe, gas_station, oilrig, runway",348369
174,4176,indoor,"shower, dressing_room, bathroom, elevator/door, locker_room",348369
175,4200,indoor,"clean_room, operating_room, hospital_room, museum/indoor, archive",348369
176,4224,indoor,"clean_room, museum/indoor, dressing_room, shower, bathroom",348369
177,4248,indoor,"clean_room, nursery, operating_room, hospital_room, dressing_room",348369
178,4272,indoor,"clean_room, nursery, museum/indoor, ice_cream_parlor, operating_room",348369
179,4296,indoor,"clean_room, dressing_room, museum/indoor, operating_room, nursery",348369
180,4320,indoor,"natural_history_museum, museum/indoor, science_museum, watering_hole, pond",348369
181,4344,indoor,"ice_shelf, stage/indoor, museum/indoor, ice_floe, natural_history_museum",348369
182,4368,indoor,"museum/indoor, arena/performance, stage/indoor, racecourse, natural_history_museum",348369
183,4392,indoor,"museum/indoor, stage/indoor, arena/performance, ice_shelf, underwater/ocean_deep",348369
184,4416,outdoor,"cemetery, hospital, pharmacy, drugstore, motel",348369
185,4440,indoor,"pharmacy, hospital, cemetery, drugstore, elevator/door",348369
186,4464,indoor,"cemetery, hospital, pharmacy, drugstore, elevator/door",348369
187,4488,indoor,"cemetery, hospital, pharmacy, drugstore, museum/indoor",348369
188,4512,indoor,"pharmacy, hospital, cemetery, drugstore, elevator/door",348369
189,4536,indoor,"cemetery, pharmacy, hospital, elevator/door, drugstore",348369
190,4560,indoor,"hospital, pharmacy, elevator/door, drugstore, cemetery",348369
191,4584,indoor,"stage/indoor, music_studio, museum/indoor, racecourse, clean_room",348369
192,4608,indoor,"stage/indoor, ballroom, museum/indoor, arena/performance, music_studio",348369
193,4632,indoor,"stage/indoor, museum/indoor, arena/performance, ballroom, racecourse",348369
194,4656,indoor,"museum/indoor, stage/indoor, field/wild, racecourse, natural_history_museum",348369
195,4680,indoor,"stage/indoor, discotheque, arena/performance, museum/indoor, field/wild",348369
196,4704,indoor,"pharmacy, hospital, drugstore, beauty_salon, cemetery",348369
197,4728,indoor,"hospital, pharmacy, drugstore, beauty_salon, ice_shelf",348369
198,4752,indoor,"pharmacy, drugstore, hospital, beauty_salon, ice_shelf",348369
199,4776,indoor,"pharmacy, drugstore, hospital, beauty_salon, ice_shelf",348369
200,4800,indoor,"pharmacy, drugstore, hospital, beauty_salon, ice_shelf",348369
201,4824,indoor,"stage/indoor, museum/indoor, ballroom, discotheque, music_studio",348369
202,4848,indoor,"stage/indoor, museum/indoor, discotheque, clean_room, music_studio",348369
203,4872,indoor,"stage/indoor, discotheque, museum/indoor, ballroom, sky",348369
204,4896,indoor,"stage/indoor, discotheque, museum/indoor, shower, sky",348369
205,4920,indoor,"stage/indoor, museum/indoor, dressing_room, ballroom, art_gallery",348369
206,4944,indoor,"stage/indoor, ballroom, museum/indoor, dressing_room, arena/performance",348369
207,4968,indoor,"stage/indoor, museum/indoor, arena/performance, ballroom, music_studio",348369
208,4992,indoor,"stage/indoor, discotheque, museum/indoor, martial_arts_gym, arena/performance",348369
209,5016,outdoor,"museum/indoor, watering_hole, ice_shelf, ice_floe, ice_skating_rink/outdoor",348369
210,5040,indoor,"museum/indoor, stage/indoor, discotheque, natural_history_museum, art_gallery",348369
211,5064,outdoor,"ski_resort, schoolhouse, residential_neighborhood, inn/outdoor, mansion",348369
212,5088,outdoor,"ski_resort, schoolhouse, residential_neighborhood, house, mansion",348369
213,5112,outdoor,"ski_resort, schoolhouse, fire_station, residential_neighborhood, mansion",348369
214,5136,outdoor,"ski_resort, schoolhouse, mansion, residential_neighborhood, courthouse",348369
215,5160,outdoor,"ski_resort, schoolhouse, residential_neighborhood, fire_station, house",348369
216,5184,outdoor,"ski_resort, schoolhouse, residential_neighborhood, fire_station, mansion",348369
217,5208,outdoor,"industrial_area, oilrig, ski_resort, construction_site, fire_station",348369
218,5232,indoor,"chemistry_lab, archive, classroom, drugstore, pharmacy",348369
219,5256,indoor,"classroom, archive, kindergarden_classroom, library/indoor, clean_room",348369
220,5280,indoor,"classroom, kindergarden_classroom, archive, library/indoor, lecture_room",348369
221,5304,indoor,"kindergarden_classroom, classroom, archive, library/indoor, lecture_room",348369
222,5328,indoor,"archive, classroom, kindergarden_classroom, library/indoor, clean_room",348369
223,5352,indoor,"classroom, kindergarden_classroom, archive, clean_room, chemistry_lab",348369
224,5376,indoor,"clean_room, living_room, nursery, server_room, hospital_room",348369
225,5400,indoor,"server_room, living_room, basement, clean_room, nursery",348369
226,5424,indoor,"clean_room, server_room, living_room, nursery, basement",348369
227,5448,indoor,"archive, clean_room, museum/indoor, classroom, natural_history_museum",348369
228,5472,indoor,"archive, natural_history_museum, science_museum, museum/indoor, clean_room",348369
229,5496,indoor,"natural_history_museum, museum/indoor, science_museum, archive, classroom",348369
230,5520,indoor,"natural_history_museum, museum/indoor, science_museum, archive, lecture_room",348369
231,5544,indoor,"natural_history_museum, science_museum, museum/indoor, archive, booth/indoor",348369
232,5568,indoor,"natural_history_museum, science_museum, museum/indoor, archive, lecture_room",348369
233,5592,indoor,"natural_history_museum, science_museum, museum/indoor, archive, lecture_room",348369
234,5616,indoor,"natural_history_museum, museum/indoor, science_museum, archive, lecture_room",348369
235,5640,indoor,"natural_history_museum, museum/indoor, science_museum, archive, lecture_room",348369
236,5664,indoor,"natural_history_museum, museum/indoor, science_museum, archive, booth/indoor",348369
237,5688,indoor,"museum/indoor, natural_history_museum, science_museum, archive, lecture_room",348369
238,5712,indoor,"natural_history_museum, museum/indoor, science_museum, archive, lecture_room",348369
239,5736,indoor,"natural_history_museum, museum/indoor, science_museum, archive, lecture_room",348369
240,5760,indoor,"natural_history_museum, museum/indoor, science_museum, archive, classroom",348369
241,5784,indoor,"natural_history_museum, museum/indoor, science_museum, archive, classroom",348369
242,5808,indoor,"natural_history_museum, museum/indoor, science_museum, archive, lecture_room",348369
243,5832,indoor,"natural_history_museum, museum/indoor, science_museum, archive, lecture_room",348369
244,5856,indoor,"natural_history_museum, museum/indoor, science_museum, archive, lecture_room",348369
245,5880,indoor,"natural_history_museum, museum/indoor, science_museum, archive, lecture_room",348369
246,5904,indoor,"natural_history_museum, science_museum, museum/indoor, archive, lecture_room",348369
247,5928,indoor,"archive, clean_room, classroom, chemistry_lab, biology_laboratory",348369
248,5952,indoor,"classroom, archive, lecture_room, clean_room, office",348369
249,5976,indoor,"elevator/door, shower, nursery, bank_vault, bathroom",348369
250,6000,indoor,"elevator/door, shower, nursery, art_gallery, elevator_lobby",348369
251,6024,indoor,"shower, sky, elevator/door, nursery, hot_spring",348369
252,6048,outdoor,"shower, ice_shelf, hot_spring, sky, nursery",348369
253,6072,indoor,"clean_room, dressing_room, office, office_cubicles, chemistry_lab",348369
254,6096,indoor,"hospital_room, nursery, dressing_room, clean_room, office_cubicles",348369
255,6120,indoor,"clean_room, office, dressing_room, office_cubicles, archive",348369
256,6144,indoor,"dressing_room, clean_room, office, art_studio, office_cubicles",348369
257,6168,indoor,"clean_room, dressing_room, locker_room, archive, shower",348369
258,6192,indoor,"clean_room, dressing_room, chemistry_lab, shower, operating_room",348369
259,6216,indoor,"clean_room, shower, locker_room, operating_room, chemistry_lab",348369
260,6240,indoor,"clean_room, dressing_room, locker_room, shower, chemistry_lab",348369
261,6264,outdoor,"boat_deck, railroad_track, water_tower, clean_room, engine_room",348369
262,6288,outdoor,"water_tower, railroad_track, industrial_area, oilrig, physics_laboratory",348369
263,6312,indoor,"clean_room, engine_room, bank_vault, fire_station, science_museum",348369
264,6336,outdoor,"mosque/outdoor, swimming_pool/indoor, chemistry_lab, fountain, industrial_area",348369
265,6360,outdoor,"parking_garage/indoor, parking_lot, raceway, sky, desert/sand",348369
266,6384,outdoor,"parking_garage/indoor, parking_lot, raceway, gas_station, highway",348369
267,6408,outdoor,"raceway, crosswalk, highway, parking_lot, desert_road",348369
268,6432,outdoor,"hot_spring, cemetery, crosswalk, sky, ice_floe",348369
269,6456,indoor,"bar, archive, music_studio, physics_laboratory, chemistry_lab",348369
270,6480,indoor,"clean_room, museum/indoor, stage/indoor, locker_room, archive",348369
271,6504,indoor,"clean_room, museum/indoor, stage/indoor, art_gallery, martial_arts_gym",348369
272,6528,indoor,"clean_room, hospital_room, dressing_room, operating_room, archive",348369
273,6552,indoor,"clean_room, locker_room, classroom, dressing_room, biology_laboratory",348369
274,6576,outdoor,"ballroom, bridge, conference_room, wind_farm, mosque/outdoor",348369
275,6600,indoor,"ballroom, conference_room, bridge, stage/indoor, conference_center",348369
276,6624,indoor,"chemistry_lab, museum/indoor, mosque/outdoor, water_tower, gymnasium/indoor",348369
277,6648,outdoor,"wind_farm, bridge, conference_room, ballroom, windmill",348369
278,6672,indoor,"bow_window/indoor, shower, museum/indoor, staircase, entrance_hall",348369
279,6696,outdoor,"ballroom, bridge, stage/indoor, mosque/outdoor, wind_farm",348369
280,6720,indoor,"ballroom, gymnasium/indoor, chemistry_lab, boxing_ring, conference_room",348369
281,6744,indoor,"elevator/door, sauna, bow_window/indoor, shower, staircase",348369
282,6768,indoor,"nursery, dressing_room, clean_room, bow_window/indoor, living_room",348369
283,6792,indoor,"entrance_hall, gymnasium/indoor, dressing_room, staircase, nursery",348369
284,6816,indoor,"music_studio, gymnasium/indoor, dressing_room, entrance_hall, clean_room",348369
285,6840,indoor,"gymnasium/indoor, music_studio, waiting_room, clean_room, entrance_hall",348369
286,6864,indoor,"beauty_salon, office, clean_room, music_studio, reception",348369
287,6888,outdoor,"railroad_track, mountain_snowy, ski_slope, snowfield, highway",348369
288,6912,outdoor,"mountain_snowy, ski_slope, railroad_track, snowfield, highway",348369
