,frame_num,environment,places,imdb_id
1431,34344,indoor,"clean_room, dressing_room, discotheque, chemistry_lab, shower",29682
1432,34368,indoor,"clean_room, dressing_room, chemistry_lab, shower, beauty_salon",29682
1433,34392,indoor,"discotheque, stage/indoor, music_studio, dressing_room, locker_room",29682
1434,34416,indoor,"discotheque, music_studio, clean_room, stage/indoor, dressing_room",29682
1435,34440,indoor,"stage/indoor, discotheque, museum/indoor, music_studio, art_gallery",29682
1436,34464,indoor,"discotheque, stage/indoor, music_studio, television_studio, shower",29682
1437,34488,indoor,"dressing_room, museum/indoor, art_gallery, shower, wheat_field",29682
1438,34512,outdoor,"shower, wheat_field, aquarium, ocean, iceberg",29682
1439,34536,indoor,"playground, museum/indoor, dressing_room, shower, music_studio",29682
1440,34560,indoor,"music_studio, dressing_room, television_studio, archive, office",29682
1441,34584,indoor,"archive, dressing_room, museum/indoor, music_studio, discotheque",29682
1442,34608,indoor,"museum/indoor, music_studio, clean_room, stage/indoor, art_gallery",29682
1443,34632,indoor,"museum/indoor, art_gallery, clean_room, archive, science_museum",29682
1444,34656,indoor,"museum/indoor, art_gallery, science_museum, natural_history_museum, stage/indoor",29682
1445,34680,indoor,"museum/indoor, art_gallery, discotheque, stage/indoor, music_studio",29682
1446,34704,indoor,"discotheque, stage/indoor, music_studio, museum/indoor, ballroom",29682
1447,34728,outdoor,"ice_shelf, ice_floe, iceberg, art_gallery, archive",29682
1448,34752,outdoor,"ice_shelf, ice_floe, iceberg, archive, mountain_snowy",29682
1449,34776,indoor,"television_studio, music_studio, stage/indoor, discotheque, museum/indoor",29682
1450,34800,indoor,"shower, art_gallery, museum/indoor, clean_room, wheat_field",29682
1451,34824,indoor,"playground, clean_room, museum/indoor, nursery, hospital_room",29682
1452,34848,outdoor,"shower, dressing_room, playground, ocean, balcony/interior",29682
1453,34872,indoor,"wheat_field, shower, dressing_room, playground, clean_room",29682
1454,34896,indoor,"museum/indoor, art_gallery, campus, music_studio, dressing_room",29682
1455,34920,indoor,"dressing_room, music_studio, stage/indoor, museum/indoor, discotheque",29682
1456,34944,indoor,"clean_room, dressing_room, museum/indoor, music_studio, discotheque",29682
1457,34968,indoor,"clean_room, museum/indoor, dressing_room, art_gallery, hospital_room",29682
1458,34992,indoor,"museum/indoor, clean_room, archive, art_gallery, shoe_shop",29682
1459,35016,indoor,"museum/indoor, art_gallery, clean_room, shoe_shop, science_museum",29682
1460,35040,indoor,"clean_room, museum/indoor, archive, art_gallery, office",29682
1461,35064,indoor,"museum/indoor, art_gallery, clean_room, science_museum, shoe_shop",29682
1462,35088,indoor,"museum/indoor, clean_room, archive, science_museum, art_gallery",29682
1463,35112,indoor,"clean_room, museum/indoor, art_gallery, dressing_room, science_museum",29682
1464,35136,indoor,"clean_room, museum/indoor, music_studio, discotheque, stage/indoor",29682
1465,35160,indoor,"discotheque, music_studio, stage/indoor, museum/indoor, television_studio",29682
1466,35184,indoor,"clean_room, museum/indoor, television_studio, stage/indoor, science_museum",29682
1467,35208,indoor,"discotheque, stage/indoor, dressing_room, museum/indoor, clean_room",29682
1468,35232,indoor,"discotheque, clean_room, music_studio, television_studio, museum/indoor",29682
1469,35256,indoor,"museum/indoor, stage/indoor, clean_room, music_studio, art_gallery",29682
1470,35280,indoor,"museum/indoor, clean_room, operating_room, art_gallery, music_studio",29682
1471,35304,indoor,"shower, discotheque, aquarium, dressing_room, museum/indoor",29682
1472,35328,indoor,"museum/indoor, art_gallery, science_museum, natural_history_museum, nursery",29682
1473,35352,outdoor,"clean_room, music_studio, wheat_field, playground, corn_field",29682
1474,35376,indoor,"museum/indoor, art_gallery, science_museum, natural_history_museum, aquarium",29682
1475,35400,indoor,"museum/indoor, art_gallery, natural_history_museum, science_museum, shower",29682
1476,35424,indoor,"art_gallery, museum/indoor, clean_room, shower, art_studio",29682
1477,35448,indoor,"art_gallery, museum/indoor, science_museum, shower, clean_room",29682
1478,35472,outdoor,"forest/broadleaf, bamboo_forest, swamp, forest_path, rainforest",29682
1479,35496,outdoor,"forest/broadleaf, hot_spring, ice_shelf, bow_window/indoor, swamp",29682
1480,35520,outdoor,"forest/broadleaf, swamp, ice_shelf, bamboo_forest, rainforest",29682
1481,35544,outdoor,"forest/broadleaf, swamp, rainforest, fountain, bamboo_forest",29682
1482,35568,outdoor,"ice_shelf, ice_floe, iceberg, wave, underwater/ocean_deep",29682
1483,35592,outdoor,"ice_shelf, underwater/ocean_deep, iceberg, ice_floe, aquarium",29682
1484,35616,outdoor,"ice_shelf, iceberg, underwater/ocean_deep, ice_floe, aquarium",29682
1485,35640,indoor,"museum/indoor, archive, kindergarden_classroom, aquarium, slum",29682
1486,35664,indoor,"museum/indoor, kindergarden_classroom, archive, slum, aquarium",29682
1487,35688,indoor,"museum/indoor, archive, slum, kindergarden_classroom, aquarium",29682
1488,35712,indoor,"museum/indoor, archive, slum, clean_room, kindergarden_classroom",29682
1489,35736,indoor,"museum/indoor, archive, clean_room, slum, kindergarden_classroom",29682
1490,35760,indoor,"slum, archive, museum/indoor, kindergarden_classroom, aquarium",29682
1491,35784,indoor,"archive, slum, museum/indoor, clean_room, kindergarden_classroom",29682
1492,35808,indoor,"archive, slum, clean_room, museum/indoor, kindergarden_classroom",29682
1493,35832,indoor,"clean_room, slum, archive, museum/indoor, aquarium",29682
1494,35856,indoor,"kindergarden_classroom, archive, museum/indoor, clean_room, operating_room",29682
1495,35880,indoor,"kindergarden_classroom, museum/indoor, archive, classroom, clean_room",29682
1496,35904,indoor,"museum/indoor, archive, kindergarden_classroom, clean_room, classroom",29682
1497,35928,indoor,"museum/indoor, aquarium, archive, kindergarden_classroom, clean_room",29682
1498,35952,indoor,"archive, museum/indoor, kindergarden_classroom, slum, classroom",29682
1499,35976,indoor,"museum/indoor, kindergarden_classroom, archive, clean_room, aquarium",29682
1500,36000,indoor,"museum/indoor, archive, aquarium, kindergarden_classroom, clean_room",29682
1501,36024,indoor,"clean_room, museum/indoor, aquarium, archive, kindergarden_classroom",29682
1502,36048,indoor,"museum/indoor, kindergarden_classroom, archive, clean_room, aquarium",29682
1503,36072,indoor,"aquarium, slum, museum/indoor, archive, kindergarden_classroom",29682
1504,36096,indoor,"museum/indoor, archive, clean_room, slum, aquarium",29682
1505,36120,indoor,"museum/indoor, archive, kindergarden_classroom, classroom, clean_room",29682
1506,36144,outdoor,"pond, tree_farm, burial_chamber, cemetery, rice_paddy",29682
1507,36168,outdoor,"picnic_area, pond, tree_farm, cemetery, yard",29682
1508,36192,outdoor,"cemetery, burial_chamber, tree_farm, museum/indoor, orchard",29682
1509,36216,outdoor,"pond, ice_shelf, fountain, lake/natural, rainforest",29682
1510,36240,outdoor,"ice_shelf, archive, rice_paddy, museum/indoor, trench",29682
1511,36264,indoor,"archive, cemetery, museum/indoor, art_studio, burial_chamber",29682
1512,36288,indoor,"museum/indoor, archive, burial_chamber, cemetery, archaelogical_excavation",29682
1513,36312,indoor,"museum/indoor, burial_chamber, cemetery, archive, tree_farm",29682
1514,36336,indoor,"ice_shelf, museum/indoor, archive, tree_farm, burial_chamber",29682
1515,36360,outdoor,"archive, tree_farm, museum/indoor, ice_shelf, campsite",29682
1516,36384,outdoor,"archive, museum/indoor, ice_shelf, tree_farm, rice_paddy",29682
1517,36408,outdoor,"tree_farm, archive, pond, vegetable_garden, yard",29682
1518,36432,outdoor,"tree_farm, ice_shelf, archive, pond, ice_floe",29682
1519,36456,outdoor,"pond, ice_shelf, archive, tree_farm, yard",29682
1520,36480,outdoor,"ice_shelf, ice_floe, pond, archive, iceberg",29682
1521,36504,outdoor,"tree_farm, ice_shelf, archive, pond, museum/indoor",29682
1522,36528,outdoor,"ice_shelf, archive, tree_farm, museum/indoor, orchard",29682
1523,36552,outdoor,"ice_shelf, museum/indoor, archive, tree_farm, cemetery",29682
1524,36576,outdoor,"ice_shelf, archive, dressing_room, tree_farm, orchard",29682
1525,36600,indoor,"ice_shelf, archive, museum/indoor, tree_farm, dressing_room",29682
1526,36624,indoor,"museum/indoor, archive, ice_shelf, dressing_room, tree_farm",29682
1527,36648,indoor,"museum/indoor, archive, ice_shelf, dressing_room, tree_farm",29682
1528,36672,indoor,"ice_shelf, tree_farm, archive, dressing_room, museum/indoor",29682
1529,36696,indoor,"museum/indoor, archive, ice_shelf, dressing_room, tree_farm",29682
1530,36720,indoor,"museum/indoor, archive, kindergarden_classroom, art_gallery, dressing_room",29682
1531,36744,indoor,"museum/indoor, archive, ice_shelf, dressing_room, art_gallery",29682
1532,36768,indoor,"museum/indoor, tree_farm, archive, kindergarden_classroom, pond",29682
1533,36792,indoor,"museum/indoor, archive, tree_farm, art_gallery, pond",29682
1534,36816,indoor,"museum/indoor, archive, tree_farm, art_gallery, ice_shelf",29682
1535,36840,indoor,"museum/indoor, archive, art_gallery, tree_farm, ice_shelf",29682
1536,36864,indoor,"museum/indoor, archive, ice_shelf, tree_farm, art_gallery",29682
1537,36888,outdoor,"museum/indoor, tree_farm, archive, pond, orchard",29682
1538,36912,outdoor,"museum/indoor, tree_farm, pond, archive, ice_shelf",29682
1539,36936,outdoor,"museum/indoor, pond, tree_farm, ice_shelf, archive",29682
1540,36960,outdoor,"museum/indoor, tree_farm, pond, archive, ice_shelf",29682
1541,36984,outdoor,"museum/indoor, pond, tree_farm, archive, lake/natural",29682
1542,37008,outdoor,"museum/indoor, archive, pond, tree_farm, ice_shelf",29682
1543,37032,outdoor,"ice_shelf, museum/indoor, pond, tree_farm, archive",29682
1544,37056,outdoor,"ice_shelf, pond, museum/indoor, archive, tree_farm",29682
1545,37080,outdoor,"museum/indoor, ice_shelf, archive, pond, tree_farm",29682
1546,37104,outdoor,"museum/indoor, archive, ice_shelf, pond, tree_farm",29682
1547,37128,outdoor,"museum/indoor, ice_shelf, pond, archive, tree_farm",29682
1548,37152,indoor,"museum/indoor, archive, tree_farm, ice_shelf, kindergarden_classroom",29682
1549,37176,outdoor,"museum/indoor, tree_farm, archive, pond, yard",29682
1550,37200,outdoor,"museum/indoor, archive, tree_farm, pond, ice_shelf",29682
1551,37224,outdoor,"museum/indoor, archive, tree_farm, pond, ice_shelf",29682
1552,37248,outdoor,"museum/indoor, archive, tree_farm, ice_shelf, pond",29682
1553,37272,outdoor,"museum/indoor, archive, tree_farm, ice_shelf, pond",29682
1554,37296,indoor,"museum/indoor, archive, slum, aquarium, clean_room",29682
1555,37320,indoor,"museum/indoor, archive, slum, kindergarden_classroom, clean_room",29682
1556,37344,outdoor,"museum/indoor, tree_farm, archive, pond, orchard",29682
1557,37368,outdoor,"tree_farm, pond, museum/indoor, orchard, vegetable_garden",29682
1558,37392,outdoor,"tree_farm, japanese_garden, trench, pond, orchard",29682
1559,37416,outdoor,"tree_farm, trench, archive, pond, museum/indoor",29682
1560,37440,outdoor,"tree_farm, trench, pond, rope_bridge, archive",29682
1561,37464,outdoor,"tree_farm, orchard, trench, archive, museum/indoor",29682
1562,37488,outdoor,"tree_farm, museum/indoor, orchard, archive, botanical_garden",29682
1563,37512,outdoor,"tree_farm, museum/indoor, orchard, archive, trench",29682
1564,37536,outdoor,"archive, museum/indoor, pond, tree_farm, orchard",29682
1565,37560,outdoor,"tree_farm, archive, orchard, museum/indoor, trench",29682
1566,37584,outdoor,"tree_farm, museum/indoor, orchard, pond, trench",29682
1567,37608,outdoor,"tree_farm, orchard, museum/indoor, vegetable_garden, trench",29682
1568,37632,outdoor,"museum/indoor, tree_farm, archive, vegetable_garden, orchard",29682
1569,37656,outdoor,"museum/indoor, tree_farm, archive, pond, botanical_garden",29682
1570,37680,outdoor,"museum/indoor, ice_shelf, archive, tree_farm, pond",29682
1571,37704,outdoor,"tree_farm, pond, museum/indoor, trench, vegetable_garden",29682
1572,37728,outdoor,"tree_farm, pond, orchard, museum/indoor, botanical_garden",29682
1573,37752,outdoor,"museum/indoor, archive, tree_farm, pond, japanese_garden",29682
1574,37776,outdoor,"museum/indoor, ice_shelf, tree_farm, pond, archive",29682
1575,37800,indoor,"museum/indoor, archive, tree_farm, orchard, dressing_room",29682
1576,37824,indoor,"museum/indoor, archive, tree_farm, orchard, dressing_room",29682
1577,37848,outdoor,"tree_farm, archive, orchard, museum/indoor, sandbox",29682
1578,37872,outdoor,"tree_farm, orchard, yard, archive, pond",29682
1579,37896,outdoor,"tree_farm, orchard, archive, yard, museum/indoor",29682
1580,37920,outdoor,"tree_farm, orchard, archive, yard, museum/indoor",29682
1581,37944,outdoor,"tree_farm, yard, orchard, archive, museum/indoor",29682
1582,37968,indoor,"museum/indoor, archive, martial_arts_gym, boxing_ring, yard",29682
1583,37992,outdoor,"tree_farm, orchard, yard, museum/indoor, martial_arts_gym",29682
1584,38016,outdoor,"tree_farm, orchard, yard, martial_arts_gym, boxing_ring",29682
1585,38040,outdoor,"tree_farm, yard, orchard, boxing_ring, martial_arts_gym",29682
1586,38064,outdoor,"tree_farm, yard, orchard, vegetable_garden, trench",29682
1587,38088,outdoor,"tree_farm, yard, orchard, rope_bridge, trench",29682
1588,38112,outdoor,"tree_farm, orchard, boxing_ring, yard, museum/indoor",29682
1589,38136,outdoor,"boxing_ring, tree_farm, rope_bridge, orchard, yard",29682
1590,38160,outdoor,"yard, pond, orchard, tree_farm, corral",29682
1591,38184,outdoor,"tree_farm, orchard, pond, museum/indoor, yard",29682
1592,38208,outdoor,"museum/indoor, tree_farm, archive, orchard, yard",29682
1593,38232,outdoor,"tree_farm, yard, archive, orchard, cemetery",29682
1594,38256,outdoor,"yard, tree_farm, archive, museum/indoor, orchard",29682
1595,38280,outdoor,"tree_farm, orchard, yard, pond, ice_shelf",29682
1596,38304,outdoor,"museum/indoor, tree_farm, archive, ice_shelf, yard",29682
1597,38328,outdoor,"tree_farm, museum/indoor, archive, ice_shelf, yard",29682
1598,38352,outdoor,"tree_farm, yard, museum/indoor, archive, orchard",29682
1599,38376,outdoor,"tree_farm, yard, orchard, museum/indoor, pond",29682
1600,38400,indoor,"museum/indoor, yard, tree_farm, archive, boxing_ring",29682
1601,38424,outdoor,"museum/indoor, archive, yard, tree_farm, ice_shelf",29682
1602,38448,outdoor,"museum/indoor, archive, ice_shelf, yard, tree_farm",29682
1603,38472,outdoor,"museum/indoor, archive, yard, tree_farm, ice_shelf",29682
1604,38496,outdoor,"museum/indoor, archive, yard, tree_farm, ice_shelf",29682
1605,38520,outdoor,"yard, tree_farm, ice_shelf, archive, museum/indoor",29682
1606,38544,outdoor,"archive, museum/indoor, yard, tree_farm, ice_shelf",29682
1607,38568,outdoor,"archive, museum/indoor, yard, tree_farm, ice_shelf",29682
1608,38592,outdoor,"archive, museum/indoor, ice_shelf, tree_farm, yard",29682
1609,38616,outdoor,"yard, archive, museum/indoor, orchard, tree_farm",29682
1610,38640,outdoor,"tree_farm, yard, orchard, archive, pond",29682
1611,38664,outdoor,"archive, museum/indoor, yard, tree_farm, orchard",29682
1612,38688,outdoor,"archive, museum/indoor, yard, tree_farm, pond",29682
1613,38712,outdoor,"yard, archive, tree_farm, museum/indoor, orchard",29682
1614,38736,outdoor,"museum/indoor, yard, tree_farm, archive, orchard",29682
1615,38760,outdoor,"museum/indoor, ice_shelf, tree_farm, pond, archive",29682
1616,38784,outdoor,"museum/indoor, archive, ice_shelf, pond, tree_farm",29682
1617,38808,outdoor,"tree_farm, pond, ice_shelf, museum/indoor, archive",29682
1618,38832,outdoor,"museum/indoor, tree_farm, ice_shelf, yard, archive",29682
1619,38856,outdoor,"tree_farm, museum/indoor, yard, orchard, archive",29682
1620,38880,outdoor,"tree_farm, yard, museum/indoor, archive, pond",29682
1621,38904,outdoor,"museum/indoor, archive, ice_shelf, tree_farm, cemetery",29682
1622,38928,outdoor,"ice_shelf, museum/indoor, tree_farm, archive, yard",29682
1623,38952,outdoor,"museum/indoor, ice_shelf, tree_farm, botanical_garden, pond",29682
1624,38976,indoor,"museum/indoor, archive, ice_shelf, boxing_ring, dressing_room",29682
1625,39000,outdoor,"museum/indoor, ice_shelf, archive, tree_farm, cemetery",29682
1626,39024,outdoor,"museum/indoor, ice_shelf, archive, pond, tree_farm",29682
1627,39048,outdoor,"tree_farm, museum/indoor, cemetery, archive, japanese_garden",29682
1628,39072,outdoor,"tree_farm, museum/indoor, cemetery, japanese_garden, botanical_garden",29682
1629,39096,outdoor,"cemetery, ice_shelf, museum/indoor, archive, japanese_garden",29682
1630,39120,outdoor,"ice_shelf, museum/indoor, cemetery, tree_farm, archive",29682
1631,39144,outdoor,"museum/indoor, archive, ice_shelf, cemetery, tree_farm",29682
1632,39168,outdoor,"ice_shelf, museum/indoor, archive, cemetery, pond",29682
1633,39192,outdoor,"ice_shelf, museum/indoor, archive, cemetery, tree_farm",29682
1634,39216,outdoor,"ice_shelf, museum/indoor, archive, cemetery, tree_farm",29682
1635,39240,outdoor,"ice_shelf, museum/indoor, tree_farm, archive, botanical_garden",29682
1636,39264,outdoor,"ice_shelf, museum/indoor, archive, tree_farm, pond",29682
1637,39288,outdoor,"ice_shelf, museum/indoor, cemetery, archive, tree_farm",29682
1638,39312,outdoor,"cemetery, museum/indoor, archive, ice_shelf, tree_farm",29682
1639,39336,outdoor,"ice_shelf, museum/indoor, cemetery, archive, tree_farm",29682
1640,39360,outdoor,"archive, ice_shelf, tree_farm, yard, museum/indoor",29682
1641,39384,outdoor,"ice_shelf, museum/indoor, tree_farm, archive, ice_floe",29682
1642,39408,outdoor,"museum/indoor, archive, cemetery, ice_shelf, tree_farm",29682
1643,39432,outdoor,"yard, ice_shelf, museum/indoor, tree_farm, archive",29682
1644,39456,outdoor,"tree_farm, archive, museum/indoor, yard, pond",29682
1645,39480,outdoor,"tree_farm, pond, yard, archive, museum/indoor",29682
1646,39504,outdoor,"museum/indoor, archive, cemetery, tree_farm, pond",29682
1647,39528,outdoor,"yard, tree_farm, pond, orchard, museum/indoor",29682
1648,39552,outdoor,"yard, tree_farm, pond, orchard, archive",29682
1649,39576,outdoor,"yard, tree_farm, pond, orchard, botanical_garden",29682
1650,39600,outdoor,"tree_farm, pond, yard, orchard, botanical_garden",29682
1651,39624,outdoor,"tree_farm, yard, pond, orchard, botanical_garden",29682
1652,39648,outdoor,"tree_farm, yard, orchard, pond, museum/indoor",29682
1653,39672,outdoor,"tree_farm, yard, orchard, pond, museum/indoor",29682
1654,39696,outdoor,"tree_farm, pond, ice_shelf, yard, orchard",29682
1655,39720,outdoor,"tree_farm, yard, pond, orchard, ice_shelf",29682
1656,39744,outdoor,"tree_farm, museum/indoor, archive, yard, ice_shelf",29682
1657,39768,outdoor,"tree_farm, yard, ice_shelf, archive, museum/indoor",29682
1658,39792,outdoor,"tree_farm, yard, ice_shelf, orchard, archive",29682
1659,39816,outdoor,"tree_farm, yard, ice_shelf, orchard, archive",29682
1660,39840,outdoor,"tree_farm, yard, orchard, ice_shelf, archive",29682
1661,39864,outdoor,"tree_farm, archive, ice_shelf, yard, cemetery",29682
1662,39888,outdoor,"tree_farm, yard, orchard, pond, ice_shelf",29682
1663,39912,outdoor,"tree_farm, pond, ice_shelf, yard, lake/natural",29682
1664,39936,outdoor,"ice_shelf, pond, tree_farm, lake/natural, archive",29682
1665,39960,outdoor,"ice_shelf, pond, lake/natural, ice_floe, hot_spring",29682
1666,39984,outdoor,"ice_shelf, pond, bow_window/indoor, hot_spring, lake/natural",29682
1667,40008,outdoor,"ice_shelf, hot_spring, glacier, pond, ice_floe",29682
1668,40032,outdoor,"ice_shelf, pond, lake/natural, ice_floe, hot_spring",29682
1669,40056,outdoor,"pond, ice_shelf, lake/natural, hot_spring, ice_floe",29682
1670,40080,outdoor,"pond, ice_shelf, lake/natural, hot_spring, bow_window/indoor",29682
1671,40104,outdoor,"pond, tree_farm, ice_shelf, lake/natural, yard",29682
1672,40128,outdoor,"pond, ice_shelf, tree_farm, lake/natural, ice_floe",29682
1673,40152,outdoor,"ice_shelf, pond, ice_floe, tree_farm, lake/natural",29682
1674,40176,indoor,"archive, art_gallery, ice_shelf, museum/indoor, lake/natural",29682
1675,40200,outdoor,"archive, hospital, skyscraper, museum/indoor, tower",29682
1676,40224,indoor,"museum/indoor, shower, art_gallery, chemistry_lab, science_museum",29682
1677,40248,indoor,"entrance_hall, lobby, museum/indoor, atrium/public, corridor",29682
1678,40272,indoor,"entrance_hall, museum/indoor, lobby, clothing_store, atrium/public",29682
1679,40296,indoor,"clean_room, museum/indoor, atrium/public, entrance_hall, corridor",29682
1680,40320,indoor,"clean_room, atrium/public, museum/indoor, corridor, art_gallery",29682
1681,40344,indoor,"clean_room, museum/indoor, dressing_room, art_gallery, elevator_lobby",29682
1682,40368,indoor,"museum/indoor, clean_room, art_gallery, elevator_lobby, artists_loft",29682
1683,40392,indoor,"dressing_room, clean_room, museum/indoor, beauty_salon, bathroom",29682
1684,40416,indoor,"museum/indoor, bow_window/indoor, lobby, clean_room, entrance_hall",29682
1685,40440,indoor,"museum/indoor, dining_room, artists_loft, living_room, bow_window/indoor",29682
1686,40464,indoor,"clean_room, bow_window/indoor, nursery, bathroom, living_room",29682
1687,40488,indoor,"living_room, alcove, bow_window/indoor, nursery, museum/indoor",29682
1688,40512,indoor,"living_room, clean_room, nursery, alcove, museum/indoor",29682
1689,40536,indoor,"alcove, living_room, dining_room, bow_window/indoor, nursery",29682
1690,40560,indoor,"living_room, bow_window/indoor, nursery, alcove, clean_room",29682
1691,40584,indoor,"living_room, bow_window/indoor, alcove, nursery, clean_room",29682
1692,40608,indoor,"nursery, bow_window/indoor, living_room, clean_room, childs_room",29682
1693,40632,indoor,"nursery, clean_room, living_room, bow_window/indoor, alcove",29682
1694,40656,indoor,"living_room, nursery, childs_room, alcove, bow_window/indoor",29682
1695,40680,indoor,"living_room, dining_room, bow_window/indoor, alcove, museum/indoor",29682
1696,40704,indoor,"clean_room, nursery, dressing_room, nursing_home, hospital_room",29682
1697,40728,indoor,"dressing_room, clean_room, nursery, hospital_room, nursing_home",29682
1698,40752,indoor,"clean_room, dressing_room, nursery, hospital_room, locker_room",29682
1699,40776,indoor,"clean_room, dressing_room, hospital_room, nursery, beauty_salon",29682
1700,40800,indoor,"dressing_room, clean_room, nursery, clothing_store, beauty_salon",29682
1701,40824,indoor,"dressing_room, clean_room, discotheque, beauty_salon, locker_room",29682
1702,40848,indoor,"dressing_room, clean_room, nursery, hospital_room, nursing_home",29682
1703,40872,indoor,"nursery, dressing_room, clean_room, nursing_home, hospital_room",29682
1704,40896,indoor,"dressing_room, clean_room, nursery, bow_window/indoor, hospital_room",29682
1705,40920,indoor,"dressing_room, clean_room, clothing_store, locker_room, discotheque",29682
1706,40944,indoor,"dressing_room, clean_room, clothing_store, nursery, beauty_salon",29682
1707,40968,indoor,"dressing_room, clean_room, nursery, bathroom, beauty_salon",29682
1708,40992,indoor,"dressing_room, clean_room, nursery, beauty_salon, jewelry_shop",29682
1709,41016,indoor,"clean_room, dressing_room, nursery, bathroom, clothing_store",29682
1710,41040,indoor,"clean_room, dressing_room, nursery, bathroom, chemistry_lab",29682
1711,41064,indoor,"clean_room, dressing_room, nursery, hospital_room, chemistry_lab",29682
1712,41088,indoor,"dressing_room, clean_room, nursery, bathroom, clothing_store",29682
1713,41112,indoor,"dressing_room, clean_room, nursery, beauty_salon, bathroom",29682
1714,41136,indoor,"clean_room, dressing_room, nursery, hospital_room, nursing_home",29682
1715,41160,indoor,"clean_room, dressing_room, nursery, hospital_room, office",29682
1716,41184,indoor,"dressing_room, clean_room, beauty_salon, hospital_room, bow_window/indoor",29682
1717,41208,indoor,"dressing_room, clean_room, hospital_room, bow_window/indoor, beauty_salon",29682
1718,41232,indoor,"clean_room, dressing_room, hospital_room, beauty_salon, bow_window/indoor",29682
1719,41256,indoor,"living_room, dining_room, alcove, entrance_hall, museum/indoor",29682
1720,41280,indoor,"living_room, alcove, dining_room, entrance_hall, museum/indoor",29682
1721,41304,indoor,"living_room, dining_room, alcove, entrance_hall, museum/indoor",29682
1722,41328,indoor,"living_room, alcove, dining_room, entrance_hall, museum/indoor",29682
1723,41352,indoor,"living_room, dining_room, alcove, museum/indoor, entrance_hall",29682
1724,41376,indoor,"clean_room, dressing_room, clothing_store, beauty_salon, discotheque",29682
1725,41400,indoor,"clean_room, dressing_room, hospital_room, operating_room, nursery",29682
1726,41424,indoor,"dressing_room, hospital_room, clean_room, nursery, operating_room",29682
1727,41448,indoor,"dressing_room, clean_room, hospital_room, operating_room, beauty_salon",29682
1728,41472,indoor,"dressing_room, clean_room, hospital_room, nursery, beauty_salon",29682
1729,41496,indoor,"dressing_room, clean_room, hospital_room, nursery, beauty_salon",29682
1730,41520,indoor,"dressing_room, clean_room, hospital_room, beauty_salon, nursery",29682
1731,41544,indoor,"dressing_room, clean_room, hospital_room, beauty_salon, nursery",29682
1732,41568,indoor,"dressing_room, clean_room, hospital_room, nursery, beauty_salon",29682
1733,41592,indoor,"dressing_room, clean_room, hospital_room, nursery, beauty_salon",29682
1734,41616,indoor,"dressing_room, clean_room, hospital_room, nursery, beauty_salon",29682
1735,41640,indoor,"dressing_room, clean_room, hospital_room, operating_room, beauty_salon",29682
1736,41664,indoor,"dressing_room, clean_room, hospital_room, beauty_salon, nursery",29682
1737,41688,indoor,"dressing_room, clean_room, hospital_room, beauty_salon, locker_room",29682
