,frame_num,environment,places,imdb_id
0,0,outdoor,"desert/sand, sky, beach, lake/natural, marsh",29682
1,24,indoor,"museum/indoor, natural_history_museum, science_museum, art_gallery, archive",29682
2,48,indoor,"museum/indoor, natural_history_museum, art_gallery, science_museum, gift_shop",29682
3,72,indoor,"museum/indoor, natural_history_museum, art_gallery, science_museum, archive",29682
4,96,indoor,"museum/indoor, art_gallery, natural_history_museum, science_museum, gift_shop",29682
5,120,indoor,"museum/indoor, art_gallery, natural_history_museum, science_museum, gift_shop",29682
6,144,indoor,"museum/indoor, natural_history_museum, science_museum, art_gallery, gift_shop",29682
7,168,indoor,"museum/indoor, natural_history_museum, science_museum, art_gallery, gift_shop",29682
8,192,indoor,"museum/indoor, natural_history_museum, science_museum, art_gallery, gift_shop",29682
9,216,indoor,"museum/indoor, natural_history_museum, science_museum, art_gallery, gift_shop",29682
10,240,outdoor,"desert/sand, beach, sky, lake/natural, marsh",29682
11,264,indoor,"mosque/outdoor, tower, art_gallery, chemistry_lab, shower",29682
12,288,indoor,"locker_room, hospital, elevator/door, archive, server_room",29682
13,312,indoor,"hospital, archive, server_room, ticket_booth, drugstore",29682
14,336,indoor,"hospital, server_room, archive, ticket_booth, booth/indoor",29682
15,360,indoor,"hospital, server_room, archive, ticket_booth, booth/indoor",29682
16,384,indoor,"hospital, server_room, archive, drugstore, hospital_room",29682
17,408,indoor,"hospital, server_room, elevator/door, archive, booth/indoor",29682
18,432,indoor,"elevator/door, server_room, hospital, locker_room, hospital_room",29682
19,456,indoor,"elevator/door, hospital, server_room, locker_room, booth/indoor",29682
20,480,indoor,"hospital, server_room, locker_room, elevator/door, booth/indoor",29682
21,504,indoor,"locker_room, booth/indoor, hospital, gas_station, clothing_store",29682
22,528,indoor,"elevator/door, locker_room, beauty_salon, hospital, server_room",29682
23,552,indoor,"locker_room, elevator/door, beauty_salon, clothing_store, elevator_lobby",29682
24,576,indoor,"drugstore, beauty_salon, pharmacy, clothing_store, jewelry_shop",29682
25,600,indoor,"drugstore, locker_room, beauty_salon, pharmacy, jewelry_shop",29682
26,624,indoor,"drugstore, pharmacy, beauty_salon, coffee_shop, jewelry_shop",29682
27,648,indoor,"beauty_salon, jewelry_shop, coffee_shop, drugstore, pharmacy",29682
28,672,indoor,"shower, beauty_salon, server_room, clothing_store, hospital",29682
29,696,indoor,"shower, server_room, elevator_shaft, hospital, locker_room",29682
30,720,indoor,"hospital, pharmacy, drugstore, server_room, archive",29682
31,744,indoor,"hospital, archive, server_room, drugstore, pharmacy",29682
32,768,indoor,"archive, hospital, beauty_salon, server_room, elevator/door",29682
33,792,indoor,"hospital, elevator/door, server_room, archive, hospital_room",29682
34,816,indoor,"hospital, server_room, elevator/door, archive, drugstore",29682
35,840,indoor,"server_room, hospital, elevator/door, archive, locker_room",29682
36,864,indoor,"booth/indoor, archive, server_room, hospital, elevator/door",29682
37,888,indoor,"booth/indoor, archive, museum/indoor, hospital, server_room",29682
38,912,indoor,"booth/indoor, archive, museum/indoor, science_museum, hospital",29682
39,936,indoor,"elevator/door, hospital, locker_room, drugstore, archive",29682
40,960,indoor,"elevator/door, locker_room, hospital, archive, elevator_lobby",29682
41,984,indoor,"locker_room, elevator/door, archive, server_room, hospital",29682
42,1008,indoor,"archive, hospital, locker_room, server_room, museum/indoor",29682
43,1032,indoor,"hospital, elevator/door, archive, booth/indoor, beauty_salon",29682
44,1056,indoor,"hospital, elevator/door, shower, locker_room, hospital_room",29682
45,1080,indoor,"hospital, server_room, archive, elevator/door, pharmacy",29682
46,1104,indoor,"hospital, server_room, archive, drugstore, elevator/door",29682
47,1128,indoor,"hospital, drugstore, pharmacy, hospital_room, archive",29682
48,1152,indoor,"hospital, archive, elevator/door, drugstore, ticket_booth",29682
49,1176,indoor,"hospital, hospital_room, office_building, server_room, archive",29682
50,1200,indoor,"hospital, server_room, archive, hospital_room, elevator_shaft",29682
51,1224,indoor,"hospital, archive, server_room, pharmacy, hospital_room",29682
52,1248,indoor,"hospital, pharmacy, archive, drugstore, museum/indoor",29682
53,1272,indoor,"archive, hospital, drugstore, pharmacy, museum/indoor",29682
54,1296,indoor,"archive, drugstore, museum/indoor, booth/indoor, hospital",29682
55,1320,indoor,"archive, museum/indoor, server_room, hospital, elevator/door",29682
56,1344,indoor,"archive, elevator/door, server_room, hospital, drugstore",29682
57,1368,indoor,"archive, server_room, elevator/door, hospital, museum/indoor",29682
58,1392,indoor,"archive, server_room, museum/indoor, elevator/door, hospital",29682
59,1416,indoor,"archive, server_room, elevator/door, booth/indoor, office",29682
60,1440,indoor,"archive, server_room, booth/indoor, elevator/door, office",29682
61,1464,indoor,"archive, booth/indoor, server_room, hospital, office",29682
62,1488,indoor,"archive, server_room, booth/indoor, hospital, elevator/door",29682
63,1512,indoor,"archive, server_room, booth/indoor, hospital, elevator/door",29682
64,1536,indoor,"archive, server_room, booth/indoor, hospital, elevator/door",29682
65,1560,indoor,"archive, server_room, booth/indoor, hospital, elevator/door",29682
66,1584,indoor,"archive, server_room, booth/indoor, elevator/door, hospital",29682
67,1608,indoor,"archive, server_room, booth/indoor, hospital, elevator/door",29682
68,1632,indoor,"server_room, archive, booth/indoor, elevator/door, science_museum",29682
69,1656,outdoor,"tower, clean_room, wind_farm, skyscraper, shower",29682
70,1680,outdoor,"desert/sand, beach, lake/natural, marsh, sky",29682
71,1704,outdoor,"ice_shelf, ice_floe, art_gallery, museum/indoor, iceberg",29682
72,1728,outdoor,"ice_shelf, ice_floe, iceberg, lake/natural, pond",29682
73,1752,outdoor,"ice_floe, ice_shelf, iceberg, lake/natural, ocean",29682
74,1776,outdoor,"pond, lake/natural, ice_floe, ice_shelf, ocean",29682
75,1800,outdoor,"pond, lake/natural, botanical_garden, swamp, river",29682
76,1824,outdoor,"alley, parking_lot, parking_garage/indoor, boardwalk, canal/urban",29682
77,1848,outdoor,"raceway, parking_lot, landing_deck, driveway, parking_garage/indoor",29682
78,1872,outdoor,"raceway, auto_factory, runway, ice_shelf, ice_floe",29682
79,1896,indoor,"chemistry_lab, shower, museum/indoor, science_museum, physics_laboratory",29682
80,1920,indoor,"shower, stage/indoor, chemistry_lab, discotheque, fountain",29682
81,1944,indoor,"chemistry_lab, discotheque, shower, stage/indoor, museum/indoor",29682
82,1968,indoor,"stage/indoor, fountain, chemistry_lab, discotheque, shower",29682
83,1992,indoor,"museum/indoor, fountain, chemistry_lab, shower, science_museum",29682
84,2016,indoor,"fountain, museum/indoor, chemistry_lab, art_gallery, ice_floe",29682
85,2040,indoor,"fountain, museum/indoor, chemistry_lab, shower, art_gallery",29682
86,2064,outdoor,"fountain, tower, museum/indoor, skyscraper, chemistry_lab",29682
87,2088,indoor,"fountain, chemistry_lab, museum/indoor, art_gallery, biology_laboratory",29682
88,2112,indoor,"museum/indoor, chemistry_lab, fountain, art_gallery, physics_laboratory",29682
89,2136,indoor,"museum/indoor, chemistry_lab, science_museum, stage/indoor, fountain",29682
90,2160,indoor,"fountain, museum/indoor, stage/indoor, tower, chemistry_lab",29682
91,2184,indoor,"museum/indoor, chemistry_lab, fountain, art_gallery, stage/indoor",29682
92,2208,indoor,"museum/indoor, fountain, chemistry_lab, stage/indoor, art_gallery",29682
93,2232,indoor,"fountain, stage/indoor, museum/indoor, discotheque, chemistry_lab",29682
94,2256,indoor,"chemistry_lab, stage/indoor, ice_floe, ice_shelf, museum/indoor",29682
95,2280,indoor,"fountain, chemistry_lab, stage/indoor, discotheque, ice_floe",29682
96,2304,indoor,"stage/indoor, discotheque, fountain, ice_shelf, chemistry_lab",29682
97,2328,indoor,"stage/indoor, discotheque, music_studio, chemistry_lab, arena/performance",29682
98,2352,indoor,"stage/indoor, music_studio, orchestra_pit, discotheque, physics_laboratory",29682
99,2376,outdoor,"stage/indoor, tower, fountain, skyscraper, discotheque",29682
100,2400,outdoor,"fountain, ice_shelf, stage/indoor, museum/indoor, ice_floe",29682
101,2424,outdoor,"fountain, museum/indoor, stage/indoor, ice_shelf, ice_floe",29682
102,2448,indoor,"museum/indoor, stage/indoor, chemistry_lab, art_gallery, physics_laboratory",29682
103,2472,indoor,"museum/indoor, chemistry_lab, physics_laboratory, science_museum, art_gallery",29682
104,2496,indoor,"chemistry_lab, physics_laboratory, museum/indoor, biology_laboratory, science_museum",29682
105,2520,indoor,"chemistry_lab, stage/indoor, museum/indoor, music_studio, physics_laboratory",29682
106,2544,indoor,"chemistry_lab, museum/indoor, stage/indoor, science_museum, art_gallery",29682
107,2568,indoor,"stage/indoor, fountain, chemistry_lab, museum/indoor, discotheque",29682
108,2592,indoor,"fountain, museum/indoor, stage/indoor, chemistry_lab, art_gallery",29682
109,2616,indoor,"museum/indoor, fountain, stage/indoor, chemistry_lab, science_museum",29682
110,2640,indoor,"museum/indoor, fountain, art_gallery, ice_floe, physics_laboratory",29682
111,2664,indoor,"museum/indoor, fountain, art_gallery, stage/indoor, science_museum",29682
112,2688,indoor,"stage/indoor, museum/indoor, chemistry_lab, ice_floe, discotheque",29682
113,2712,indoor,"stage/indoor, discotheque, museum/indoor, arena/performance, landing_deck",29682
114,2736,indoor,"stage/indoor, fountain, museum/indoor, discotheque, arena/performance",29682
115,2760,indoor,"stage/indoor, fountain, museum/indoor, chemistry_lab, music_studio",29682
116,2784,indoor,"fountain, museum/indoor, stage/indoor, science_museum, shower",29682
117,2808,indoor,"museum/indoor, fountain, stage/indoor, art_gallery, science_museum",29682
118,2832,indoor,"fountain, stage/indoor, museum/indoor, arena/performance, chemistry_lab",29682
119,2856,indoor,"museum/indoor, chemistry_lab, science_museum, physics_laboratory, art_gallery",29682
120,2880,indoor,"chemistry_lab, science_museum, museum/indoor, biology_laboratory, physics_laboratory",29682
121,2904,indoor,"chemistry_lab, physics_laboratory, biology_laboratory, museum/indoor, science_museum",29682
122,2928,indoor,"museum/indoor, chemistry_lab, art_gallery, jewelry_shop, science_museum",29682
123,2952,indoor,"chemistry_lab, art_gallery, museum/indoor, physics_laboratory, science_museum",29682
124,2976,indoor,"stage/indoor, shower, chemistry_lab, museum/indoor, fountain",29682
125,3000,indoor,"fountain, museum/indoor, chemistry_lab, science_museum, aquarium",29682
126,3024,indoor,"museum/indoor, fountain, stage/indoor, shower, art_gallery",29682
127,3048,indoor,"museum/indoor, chemistry_lab, science_museum, fountain, physics_laboratory",29682
128,3072,indoor,"physics_laboratory, shower, chemistry_lab, museum/indoor, science_museum",29682
129,3096,indoor,"museum/indoor, chemistry_lab, science_museum, physics_laboratory, shower",29682
130,3120,indoor,"chemistry_lab, shower, bathroom, biology_laboratory, physics_laboratory",29682
131,3144,indoor,"chemistry_lab, shower, physics_laboratory, biology_laboratory, music_studio",29682
132,3168,indoor,"chemistry_lab, shower, bathroom, museum/indoor, physics_laboratory",29682
133,3192,indoor,"shower, wind_farm, bathroom, chemistry_lab, museum/indoor",29682
134,3216,indoor,"museum/indoor, art_gallery, science_museum, shower, chemistry_lab",29682
135,3240,indoor,"museum/indoor, science_museum, natural_history_museum, stage/indoor, art_gallery",29682
136,3264,outdoor,"museum/indoor, fountain, natural_history_museum, ice_shelf, ice_floe",29682
137,3288,outdoor,"fountain, museum/indoor, ice_shelf, ice_floe, science_museum",29682
138,3312,indoor,"fountain, museum/indoor, stage/indoor, chemistry_lab, skyscraper",29682
139,3336,indoor,"fountain, chemistry_lab, shower, museum/indoor, tower",29682
140,3360,indoor,"chemistry_lab, stage/indoor, museum/indoor, biology_laboratory, music_studio",29682
141,3384,indoor,"museum/indoor, chemistry_lab, science_museum, art_gallery, stage/indoor",29682
142,3408,indoor,"museum/indoor, science_museum, stage/indoor, chemistry_lab, art_gallery",29682
143,3432,indoor,"shower, museum/indoor, chemistry_lab, science_museum, physics_laboratory",29682
144,3456,indoor,"shower, chemistry_lab, bathroom, science_museum, tower",29682
145,3480,indoor,"shower, art_gallery, museum/indoor, science_museum, bathroom",29682
146,3504,indoor,"fountain, chemistry_lab, shower, museum/indoor, art_gallery",29682
147,3528,indoor,"fountain, museum/indoor, ice_floe, shower, art_gallery",29682
148,3552,indoor,"fountain, shower, museum/indoor, art_gallery, stage/indoor",29682
149,3576,outdoor,"fountain, chemistry_lab, pond, shower, ice_floe",29682
150,3600,outdoor,"landing_deck, raceway, runway, heliport, lake/natural",29682
151,3624,outdoor,"lake/natural, pond, ocean, coast, marsh",29682
152,3648,outdoor,"lake/natural, parking_lot, pond, river, harbor",29682
153,3672,outdoor,"iceberg, ice_floe, pond, lake/natural, corridor",29682
154,3696,indoor,"museum/indoor, bank_vault, shower, clothing_store, elevator/door",29682
155,3720,indoor,"coffee_shop, synagogue/outdoor, ice_cream_parlor, museum/indoor, art_gallery",29682
156,3744,indoor,"synagogue/outdoor, coffee_shop, ice_cream_parlor, museum/indoor, motel",29682
157,3768,indoor,"coffee_shop, bow_window/indoor, alcove, museum/indoor, ice_cream_parlor",29682
158,3792,indoor,"staircase, atrium/public, entrance_hall, bow_window/indoor, shopping_mall/indoor",29682
159,3816,indoor,"atrium/public, shopping_mall/indoor, bow_window/indoor, attic, mezzanine",29682
160,3840,indoor,"clean_room, bow_window/indoor, entrance_hall, elevator/door, corridor",29682
161,3864,indoor,"bow_window/indoor, entrance_hall, clean_room, alcove, ballroom",29682
162,3888,indoor,"bow_window/indoor, entrance_hall, lobby, elevator_lobby, living_room",29682
163,3912,indoor,"bow_window/indoor, entrance_hall, living_room, lobby, elevator_lobby",29682
164,3936,indoor,"bow_window/indoor, entrance_hall, dressing_room, living_room, corridor",29682
165,3960,indoor,"bow_window/indoor, dressing_room, living_room, entrance_hall, elevator_lobby",29682
166,3984,indoor,"bow_window/indoor, dressing_room, living_room, conference_room, office",29682
167,4008,indoor,"bow_window/indoor, dressing_room, ballroom, living_room, entrance_hall",29682
168,4032,indoor,"bow_window/indoor, living_room, office, alcove, dining_room",29682
169,4056,indoor,"bow_window/indoor, living_room, dining_room, office, conference_room",29682
170,4080,indoor,"bow_window/indoor, dining_room, living_room, alcove, artists_loft",29682
171,4104,indoor,"bow_window/indoor, office, artists_loft, alcove, dining_room",29682
172,4128,indoor,"bow_window/indoor, office, artists_loft, living_room, reception",29682
173,4152,indoor,"bow_window/indoor, artists_loft, lobby, living_room, office",29682
174,4176,indoor,"bow_window/indoor, museum/indoor, artists_loft, entrance_hall, natural_history_museum",29682
175,4200,indoor,"bow_window/indoor, museum/indoor, living_room, artists_loft, art_gallery",29682
176,4224,indoor,"bow_window/indoor, office, conference_room, home_office, living_room",29682
177,4248,indoor,"bathroom, shower, bow_window/indoor, dressing_room, sauna",29682
178,4272,indoor,"clean_room, hospital_room, dressing_room, beauty_salon, bow_window/indoor",29682
179,4296,indoor,"bow_window/indoor, shower, sauna, dressing_room, bathroom",29682
180,4320,indoor,"shower, bow_window/indoor, bathroom, sauna, dressing_room",29682
181,4344,indoor,"bow_window/indoor, clean_room, office, shower, dressing_room",29682
182,4368,indoor,"dressing_room, beauty_salon, dining_room, living_room, clean_room",29682
183,4392,indoor,"dressing_room, museum/indoor, dining_room, beauty_salon, archive",29682
184,4416,indoor,"archive, dressing_room, museum/indoor, art_studio, artists_loft",29682
185,4440,indoor,"office, art_studio, artists_loft, archive, dining_room",29682
186,4464,indoor,"archive, dining_room, library/indoor, office, restaurant",29682
187,4488,indoor,"archive, library/indoor, office, classroom, dining_room",29682
188,4512,indoor,"dining_room, library/indoor, restaurant, office, coffee_shop",29682
189,4536,indoor,"dining_room, office, living_room, coffee_shop, restaurant",29682
190,4560,indoor,"dining_room, office, living_room, restaurant, coffee_shop",29682
191,4584,indoor,"dressing_room, beauty_salon, artists_loft, dining_room, museum/indoor",29682
192,4608,indoor,"dining_room, office, archive, library/indoor, dressing_room",29682
193,4632,indoor,"office, dining_room, library/indoor, archive, conference_room",29682
194,4656,indoor,"dining_room, archive, office, library/indoor, restaurant",29682
195,4680,indoor,"archive, dressing_room, office, library/indoor, classroom",29682
196,4704,indoor,"beauty_salon, dressing_room, archive, office, coffee_shop",29682
197,4728,indoor,"dressing_room, museum/indoor, dining_room, beauty_salon, archive",29682
198,4752,indoor,"museum/indoor, dressing_room, clean_room, television_studio, music_studio",29682
199,4776,indoor,"dressing_room, clean_room, museum/indoor, clothing_store, beauty_salon",29682
200,4800,indoor,"dressing_room, museum/indoor, art_gallery, clothing_store, clean_room",29682
201,4824,indoor,"dressing_room, museum/indoor, clean_room, art_gallery, television_studio",29682
202,4848,indoor,"museum/indoor, clean_room, dressing_room, music_studio, archive",29682
203,4872,indoor,"dressing_room, museum/indoor, clean_room, clothing_store, archive",29682
204,4896,indoor,"dressing_room, museum/indoor, clothing_store, clean_room, beauty_salon",29682
205,4920,indoor,"classroom, lecture_room, dressing_room, archive, music_studio",29682
206,4944,indoor,"dressing_room, music_studio, lecture_room, stage/indoor, classroom",29682
207,4968,indoor,"dressing_room, beauty_salon, clean_room, operating_room, music_studio",29682
208,4992,indoor,"dressing_room, clean_room, operating_room, hospital_room, beauty_salon",29682
209,5016,indoor,"dressing_room, television_studio, clean_room, music_studio, lecture_room",29682
210,5040,indoor,"dressing_room, beauty_salon, lecture_room, classroom, discotheque",29682
211,5064,indoor,"dressing_room, beauty_salon, lecture_room, music_studio, classroom",29682
212,5088,indoor,"dressing_room, lecture_room, beauty_salon, classroom, banquet_hall",29682
213,5112,indoor,"lecture_room, dressing_room, classroom, cafeteria, dining_hall",29682
214,5136,indoor,"clean_room, dressing_room, stage/indoor, television_studio, music_studio",29682
215,5160,indoor,"lecture_room, classroom, hospital_room, clean_room, nursing_home",29682
216,5184,indoor,"lecture_room, clean_room, classroom, science_museum, locker_room",29682
217,5208,indoor,"clean_room, dressing_room, stage/indoor, lecture_room, chemistry_lab",29682
218,5232,indoor,"banquet_hall, stage/indoor, lecture_room, auditorium, conference_center",29682
219,5256,indoor,"stage/indoor, orchestra_pit, lecture_room, banquet_hall, auditorium",29682
220,5280,indoor,"orchestra_pit, stage/indoor, auditorium, music_studio, ballroom",29682
221,5304,indoor,"clean_room, lecture_room, classroom, stage/indoor, museum/indoor",29682
222,5328,indoor,"stage/indoor, classroom, lecture_room, clean_room, museum/indoor",29682
223,5352,indoor,"stage/indoor, clean_room, lecture_room, classroom, martial_arts_gym",29682
224,5376,indoor,"stage/indoor, auditorium, clean_room, music_studio, discotheque",29682
225,5400,indoor,"stage/indoor, auditorium, music_studio, lecture_room, clean_room",29682
226,5424,indoor,"auditorium, stage/indoor, dining_hall, lecture_room, banquet_hall",29682
227,5448,indoor,"stage/indoor, music_studio, ballroom, discotheque, auditorium",29682
228,5472,indoor,"dining_hall, banquet_hall, cafeteria, restaurant, conference_center",29682
229,5496,indoor,"banquet_hall, dining_hall, cafeteria, restaurant, food_court",29682
230,5520,indoor,"banquet_hall, dining_hall, archive, cafeteria, restaurant",29682
231,5544,indoor,"banquet_hall, dining_hall, cafeteria, archive, restaurant",29682
232,5568,indoor,"clean_room, chemistry_lab, dressing_room, banquet_hall, science_museum",29682
233,5592,indoor,"banquet_hall, dining_hall, restaurant, lecture_room, chemistry_lab",29682
234,5616,indoor,"dressing_room, chemistry_lab, beauty_salon, banquet_hall, bar",29682
235,5640,indoor,"banquet_hall, restaurant, dining_hall, cafeteria, chemistry_lab",29682
236,5664,indoor,"chemistry_lab, biology_laboratory, banquet_hall, dressing_room, clean_room",29682
237,5688,indoor,"dressing_room, bathroom, beauty_salon, clean_room, sauna",29682
238,5712,indoor,"chemistry_lab, dressing_room, restaurant, beauty_salon, banquet_hall",29682
239,5736,indoor,"chemistry_lab, biology_laboratory, bar, banquet_hall, dressing_room",29682
240,5760,indoor,"chemistry_lab, dressing_room, restaurant, banquet_hall, clean_room",29682
241,5784,indoor,"dressing_room, banquet_hall, restaurant, ice_cream_parlor, chemistry_lab",29682
242,5808,indoor,"banquet_hall, restaurant, dining_hall, cafeteria, ice_cream_parlor",29682
243,5832,indoor,"banquet_hall, restaurant, dining_hall, cafeteria, chemistry_lab",29682
244,5856,indoor,"banquet_hall, restaurant, dining_hall, cafeteria, dining_room",29682
245,5880,indoor,"dressing_room, chemistry_lab, clean_room, operating_room, martial_arts_gym",29682
246,5904,indoor,"dressing_room, chemistry_lab, banquet_hall, restaurant, biology_laboratory",29682
247,5928,indoor,"chemistry_lab, dressing_room, biology_laboratory, clean_room, beauty_salon",29682
248,5952,indoor,"dressing_room, chemistry_lab, beauty_salon, biology_laboratory, clean_room",29682
249,5976,indoor,"dressing_room, clean_room, bathroom, banquet_hall, science_museum",29682
250,6000,indoor,"clean_room, dressing_room, operating_room, chemistry_lab, banquet_hall",29682
251,6024,indoor,"dressing_room, chemistry_lab, clean_room, operating_room, ballroom",29682
252,6048,indoor,"dressing_room, chemistry_lab, operating_room, banquet_hall, biology_laboratory",29682
253,6072,indoor,"dressing_room, beauty_salon, clean_room, bathroom, chemistry_lab",29682
254,6096,indoor,"dressing_room, bathroom, shower, beauty_salon, locker_room",29682
255,6120,indoor,"clean_room, beauty_salon, operating_room, dressing_room, music_studio",29682
256,6144,indoor,"dressing_room, beauty_salon, clean_room, bathroom, operating_room",29682
257,6168,indoor,"dressing_room, chemistry_lab, clean_room, music_studio, physics_laboratory",29682
258,6192,indoor,"dressing_room, clean_room, chemistry_lab, biology_laboratory, music_studio",29682
259,6216,indoor,"stage/indoor, discotheque, auditorium, music_studio, lecture_room",29682
260,6240,indoor,"stage/indoor, clean_room, music_studio, auditorium, discotheque",29682
261,6264,indoor,"stage/indoor, museum/indoor, clean_room, martial_arts_gym, art_gallery",29682
262,6288,indoor,"martial_arts_gym, stage/indoor, clean_room, museum/indoor, boxing_ring",29682
263,6312,indoor,"museum/indoor, stage/indoor, clean_room, nursing_home, archive",29682
264,6336,indoor,"clean_room, museum/indoor, stage/indoor, martial_arts_gym, operating_room",29682
265,6360,indoor,"martial_arts_gym, stage/indoor, museum/indoor, clean_room, television_studio",29682
266,6384,indoor,"martial_arts_gym, clean_room, museum/indoor, stage/indoor, schoolhouse",29682
267,6408,indoor,"martial_arts_gym, museum/indoor, clean_room, stage/indoor, nursery",29682
268,6432,indoor,"martial_arts_gym, stage/indoor, museum/indoor, clean_room, ballroom",29682
269,6456,indoor,"museum/indoor, stage/indoor, clean_room, ballroom, auditorium",29682
270,6480,indoor,"museum/indoor, stage/indoor, ballroom, auditorium, throne_room",29682
271,6504,indoor,"museum/indoor, stage/indoor, auditorium, schoolhouse, ballroom",29682
272,6528,indoor,"museum/indoor, clean_room, stage/indoor, courthouse, schoolhouse",29682
273,6552,indoor,"clean_room, chemistry_lab, restaurant, beauty_salon, biology_laboratory",29682
274,6576,indoor,"clean_room, atrium/public, chemistry_lab, shopping_mall/indoor, cafeteria",29682
275,6600,indoor,"clean_room, chemistry_lab, biology_laboratory, banquet_hall, physics_laboratory",29682
276,6624,indoor,"clean_room, restaurant, cafeteria, dining_hall, banquet_hall",29682
277,6648,indoor,"clean_room, museum/indoor, operating_room, dressing_room, music_studio",29682
278,6672,indoor,"clean_room, museum/indoor, chemistry_lab, banquet_hall, ballroom",29682
279,6696,indoor,"clean_room, museum/indoor, dressing_room, locker_room, chemistry_lab",29682
280,6720,indoor,"clean_room, museum/indoor, dressing_room, operating_room, physics_laboratory",29682
281,6744,indoor,"clean_room, museum/indoor, dressing_room, operating_room, chemistry_lab",29682
282,6768,indoor,"attic, clean_room, bow_window/indoor, museum/indoor, alcove",29682
283,6792,indoor,"clean_room, attic, museum/indoor, greenhouse/outdoor, entrance_hall",29682
284,6816,indoor,"clean_room, attic, operating_room, hospital_room, physics_laboratory",29682
285,6840,indoor,"clean_room, greenhouse/outdoor, attic, museum/indoor, schoolhouse",29682
286,6864,indoor,"clean_room, attic, greenhouse/outdoor, museum/indoor, hospital_room",29682
287,6888,indoor,"clean_room, greenhouse/outdoor, museum/indoor, attic, science_museum",29682
288,6912,indoor,"clean_room, greenhouse/outdoor, attic, museum/indoor, greenhouse/indoor",29682
289,6936,indoor,"clean_room, greenhouse/outdoor, attic, operating_room, hospital_room",29682
290,6960,indoor,"clean_room, attic, greenhouse/outdoor, nursery, museum/indoor",29682
291,6984,indoor,"clean_room, attic, museum/indoor, greenhouse/outdoor, bow_window/indoor",29682
