,frame_num,environment,places,imdb_id
2911,69864,indoor,"clean_room, beauty_salon, dressing_room, dining_room, kitchen",29682
2912,69888,indoor,"clean_room, dining_room, beauty_salon, restaurant, operating_room",29682
2913,69912,indoor,"clean_room, butchers_shop, operating_room, museum/indoor, hospital_room",29682
2914,69936,indoor,"clean_room, clothing_store, department_store, butchers_shop, supermarket",29682
2915,69960,indoor,"clean_room, clothing_store, butchers_shop, department_store, dressing_room",29682
2916,69984,indoor,"archive, art_studio, office, clean_room, dressing_room",29682
2917,70008,indoor,"archive, art_studio, clean_room, office, home_office",29682
2918,70032,indoor,"archive, art_studio, dressing_room, office, artists_loft",29682
2919,70056,indoor,"archive, clean_room, beauty_salon, dressing_room, office",29682
2920,70080,indoor,"archive, clean_room, dressing_room, art_studio, beauty_salon",29682
2921,70104,indoor,"dressing_room, archive, art_studio, bathroom, beauty_salon",29682
2922,70128,indoor,"archive, clean_room, dressing_room, museum/indoor, art_studio",29682
2923,70152,indoor,"archive, art_studio, dressing_room, beauty_salon, artists_loft",29682
2924,70176,indoor,"archive, dressing_room, art_studio, beauty_salon, art_school",29682
2925,70200,indoor,"clean_room, archive, art_studio, beauty_salon, dressing_room",29682
2926,70224,indoor,"archive, lobby, art_gallery, dressing_room, museum/indoor",29682
2927,70248,indoor,"museum/indoor, art_gallery, dressing_room, beauty_salon, clean_room",29682
2928,70272,indoor,"dressing_room, beauty_salon, artists_loft, art_studio, clean_room",29682
2929,70296,indoor,"living_room, dressing_room, artists_loft, beauty_salon, lobby",29682
2930,70320,indoor,"beauty_salon, dressing_room, living_room, clean_room, hospital_room",29682
2931,70344,indoor,"clean_room, hospital_room, beauty_salon, operating_room, dressing_room",29682
2932,70368,indoor,"clean_room, beauty_salon, dressing_room, hospital_room, operating_room",29682
2933,70392,indoor,"beauty_salon, dressing_room, clean_room, bathroom, hospital_room",29682
2934,70416,indoor,"beauty_salon, dressing_room, bathroom, clean_room, shower",29682
2935,70440,indoor,"dressing_room, beauty_salon, clean_room, living_room, hospital_room",29682
2936,70464,indoor,"beauty_salon, clean_room, dressing_room, hospital_room, operating_room",29682
2937,70488,indoor,"clean_room, hospital_room, dressing_room, beauty_salon, operating_room",29682
2938,70512,indoor,"beauty_salon, dressing_room, clean_room, bathroom, operating_room",29682
2939,70536,indoor,"beauty_salon, clean_room, dressing_room, hospital_room, living_room",29682
2940,70560,indoor,"dressing_room, beauty_salon, clean_room, hospital_room, living_room",29682
2941,70584,indoor,"beauty_salon, clean_room, dressing_room, hospital_room, operating_room",29682
2942,70608,indoor,"beauty_salon, office, clean_room, living_room, dressing_room",29682
2943,70632,indoor,"beauty_salon, clean_room, dressing_room, hospital_room, living_room",29682
2944,70656,indoor,"chemistry_lab, shoe_shop, archive, clean_room, bar",29682
2945,70680,indoor,"chemistry_lab, bar, clean_room, archive, music_studio",29682
2946,70704,indoor,"chemistry_lab, clean_room, archive, bar, jewelry_shop",29682
2947,70728,indoor,"locker_room, bar, music_studio, beauty_salon, television_studio",29682
2948,70752,indoor,"clean_room, dressing_room, art_gallery, museum/indoor, corridor",29682
2949,70776,indoor,"clean_room, shower, bathroom, art_gallery, clothing_store",29682
2950,70800,indoor,"clean_room, office, office_cubicles, archive, dressing_room",29682
2951,70824,indoor,"clean_room, dressing_room, archive, beauty_salon, museum/indoor",29682
2952,70848,indoor,"clean_room, archive, dressing_room, office_cubicles, office",29682
2953,70872,indoor,"clean_room, clothing_store, dressing_room, archive, museum/indoor",29682
2954,70896,indoor,"clean_room, dressing_room, butchers_shop, archive, museum/indoor",29682
2955,70920,indoor,"museum/indoor, clothing_store, clean_room, art_gallery, dressing_room",29682
2956,70944,indoor,"clothing_store, clean_room, dressing_room, museum/indoor, art_gallery",29682
2957,70968,indoor,"museum/indoor, clean_room, dressing_room, clothing_store, beauty_salon",29682
2958,70992,indoor,"clean_room, corridor, beauty_salon, elevator_lobby, elevator/door",29682
2959,71016,indoor,"clean_room, shower, bow_window/indoor, closet, art_gallery",29682
2960,71040,indoor,"beauty_salon, dining_room, living_room, clean_room, coffee_shop",29682
2961,71064,indoor,"beauty_salon, clean_room, living_room, nursery, dining_room",29682
2962,71088,indoor,"beauty_salon, dining_room, living_room, coffee_shop, nursery",29682
2963,71112,indoor,"clean_room, beauty_salon, chemistry_lab, nursery, hospital_room",29682
2964,71136,indoor,"clean_room, beauty_salon, chemistry_lab, biology_laboratory, operating_room",29682
2965,71160,indoor,"clean_room, beauty_salon, operating_room, chemistry_lab, biology_laboratory",29682
2966,71184,indoor,"clean_room, beauty_salon, museum/indoor, dressing_room, operating_room",29682
2967,71208,indoor,"clean_room, beauty_salon, dressing_room, museum/indoor, archive",29682
2968,71232,indoor,"clean_room, beauty_salon, operating_room, hospital_room, dressing_room",29682
2969,71256,indoor,"clean_room, beauty_salon, operating_room, hospital_room, museum/indoor",29682
2970,71280,indoor,"clean_room, museum/indoor, music_studio, beauty_salon, operating_room",29682
2971,71304,indoor,"clean_room, archive, operating_room, museum/indoor, hospital_room",29682
2972,71328,indoor,"clean_room, hospital_room, operating_room, archive, beauty_salon",29682
2973,71352,indoor,"clean_room, museum/indoor, archive, operating_room, hospital_room",29682
2974,71376,indoor,"clean_room, museum/indoor, beauty_salon, archive, music_studio",29682
2975,71400,indoor,"clean_room, museum/indoor, archive, music_studio, operating_room",29682
2976,71424,indoor,"clean_room, archive, museum/indoor, operating_room, hospital_room",29682
2977,71448,indoor,"clean_room, museum/indoor, operating_room, archive, beauty_salon",29682
2978,71472,indoor,"clean_room, beauty_salon, museum/indoor, archive, music_studio",29682
2979,71496,indoor,"clean_room, beauty_salon, museum/indoor, archive, hospital_room",29682
2980,71520,indoor,"clean_room, beauty_salon, dressing_room, museum/indoor, archive",29682
2981,71544,indoor,"clean_room, beauty_salon, museum/indoor, archive, dressing_room",29682
2982,71568,indoor,"clean_room, beauty_salon, museum/indoor, dressing_room, archive",29682
2983,71592,indoor,"clean_room, beauty_salon, dressing_room, archive, shoe_shop",29682
2984,71616,indoor,"clean_room, museum/indoor, beauty_salon, archive, dressing_room",29682
2985,71640,indoor,"clean_room, museum/indoor, beauty_salon, archive, dressing_room",29682
2986,71664,indoor,"clean_room, museum/indoor, television_studio, beauty_salon, archive",29682
2987,71688,indoor,"clean_room, museum/indoor, archive, locker_room, television_studio",29682
2988,71712,indoor,"clean_room, museum/indoor, archive, beauty_salon, television_studio",29682
2989,71736,indoor,"clean_room, archive, museum/indoor, beauty_salon, television_studio",29682
2990,71760,indoor,"clean_room, museum/indoor, archive, beauty_salon, dressing_room",29682
2991,71784,indoor,"clean_room, museum/indoor, archive, television_studio, beauty_salon",29682
2992,71808,indoor,"museum/indoor, clean_room, archive, beauty_salon, television_studio",29682
2993,71832,indoor,"clean_room, museum/indoor, archive, waiting_room, beauty_salon",29682
2994,71856,indoor,"clean_room, museum/indoor, archive, beauty_salon, dressing_room",29682
2995,71880,indoor,"clean_room, museum/indoor, archive, beauty_salon, waiting_room",29682
2996,71904,indoor,"clean_room, museum/indoor, beauty_salon, television_studio, archive",29682
2997,71928,indoor,"clean_room, beauty_salon, archive, museum/indoor, waiting_room",29682
2998,71952,indoor,"clean_room, beauty_salon, dressing_room, archive, museum/indoor",29682
2999,71976,indoor,"clean_room, beauty_salon, archive, dressing_room, operating_room",29682
3000,72000,indoor,"clean_room, archive, beauty_salon, dressing_room, museum/indoor",29682
3001,72024,indoor,"clean_room, archive, locker_room, operating_room, museum/indoor",29682
3002,72048,indoor,"clean_room, archive, beauty_salon, dressing_room, waiting_room",29682
3003,72072,indoor,"clean_room, hospital_room, beauty_salon, dressing_room, operating_room",29682
3004,72096,indoor,"clean_room, beauty_salon, archive, dressing_room, hospital_room",29682
3005,72120,indoor,"clean_room, beauty_salon, archive, dressing_room, museum/indoor",29682
3006,72144,indoor,"television_studio, clean_room, museum/indoor, beauty_salon, dressing_room",29682
3007,72168,indoor,"clean_room, beauty_salon, dressing_room, locker_room, server_room",29682
3008,72192,indoor,"clean_room, museum/indoor, television_studio, archive, beauty_salon",29682
3009,72216,indoor,"shower, bathroom, jail_cell, locker_room, art_gallery",29682
3010,72240,indoor,"locker_room, shower, clean_room, bathroom, jail_cell",29682
3011,72264,indoor,"shower, locker_room, clean_room, bathroom, jail_cell",29682
3012,72288,indoor,"shower, bathroom, jail_cell, sauna, atrium/public",29682
3013,72312,indoor,"living_room, lobby, corridor, entrance_hall, artists_loft",29682
3014,72336,indoor,"living_room, lobby, corridor, entrance_hall, artists_loft",29682
3015,72360,indoor,"living_room, lobby, corridor, entrance_hall, artists_loft",29682
3016,72384,indoor,"living_room, lobby, entrance_hall, dining_room, corridor",29682
3017,72408,indoor,"living_room, lobby, corridor, entrance_hall, dining_room",29682
3018,72432,indoor,"living_room, lobby, reception, dining_room, artists_loft",29682
3019,72456,indoor,"living_room, lobby, corridor, entrance_hall, reception",29682
3020,72480,indoor,"living_room, lobby, corridor, entrance_hall, artists_loft",29682
3021,72504,indoor,"living_room, lobby, entrance_hall, corridor, artists_loft",29682
3022,72528,indoor,"living_room, lobby, corridor, entrance_hall, artists_loft",29682
3023,72552,indoor,"living_room, lobby, corridor, entrance_hall, artists_loft",29682
3024,72576,indoor,"living_room, lobby, reception, artists_loft, corridor",29682
3025,72600,indoor,"living_room, lobby, corridor, reception, artists_loft",29682
3026,72624,indoor,"living_room, lobby, reception, corridor, artists_loft",29682
3027,72648,indoor,"living_room, lobby, corridor, entrance_hall, reception",29682
3028,72672,indoor,"living_room, lobby, corridor, artists_loft, reception",29682
3029,72696,indoor,"living_room, lobby, corridor, reception, artists_loft",29682
3030,72720,indoor,"living_room, lobby, corridor, entrance_hall, artists_loft",29682
3031,72744,indoor,"living_room, lobby, entrance_hall, reception, corridor",29682
3032,72768,indoor,"living_room, lobby, corridor, reception, artists_loft",29682
3033,72792,indoor,"shower, atrium/public, museum/indoor, entrance_hall, bathroom",29682
3034,72816,indoor,"archive, sauna, shower, bow_window/indoor, art_gallery",29682
3035,72840,indoor,"shower, bathroom, archive, clean_room, pantry",29682
3036,72864,indoor,"archive, pharmacy, library/indoor, office, clean_room",29682
3037,72888,indoor,"kitchen, dining_room, coffee_shop, clean_room, beauty_salon",29682
3038,72912,indoor,"hospital_room, living_room, nursing_home, clean_room, lobby",29682
3039,72936,indoor,"museum/indoor, clean_room, art_gallery, living_room, archive",29682
3040,72960,indoor,"clean_room, museum/indoor, archive, hospital_room, physics_laboratory",29682
3041,72984,indoor,"clean_room, beauty_salon, museum/indoor, dressing_room, archive",29682
3042,73008,indoor,"beauty_salon, museum/indoor, dressing_room, clean_room, living_room",29682
3043,73032,indoor,"beauty_salon, museum/indoor, clean_room, art_gallery, hospital_room",29682
3044,73056,indoor,"museum/indoor, beauty_salon, living_room, gymnasium/indoor, artists_loft",29682
3045,73080,indoor,"beauty_salon, clean_room, dressing_room, living_room, archive",29682
3046,73104,indoor,"beauty_salon, living_room, dining_room, clean_room, office",29682
3047,73128,indoor,"clean_room, dining_room, hospital_room, living_room, operating_room",29682
3048,73152,indoor,"dining_room, office, living_room, home_office, dressing_room",29682
3049,73176,indoor,"clean_room, operating_room, museum/indoor, archive, office",29682
3050,73200,indoor,"clean_room, beauty_salon, operating_room, museum/indoor, hospital_room",29682
3051,73224,indoor,"clean_room, operating_room, beauty_salon, hospital_room, dressing_room",29682
3052,73248,indoor,"clean_room, operating_room, beauty_salon, hospital_room, dressing_room",29682
3053,73272,indoor,"clean_room, beauty_salon, dressing_room, archive, operating_room",29682
3054,73296,indoor,"clean_room, archive, dressing_room, locker_room, operating_room",29682
3055,73320,indoor,"clean_room, archive, locker_room, dressing_room, museum/indoor",29682
3056,73344,indoor,"clean_room, museum/indoor, archive, science_museum, clothing_store",29682
3057,73368,indoor,"clean_room, museum/indoor, archive, science_museum, art_studio",29682
3058,73392,indoor,"archive, clean_room, dressing_room, hospital_room, locker_room",29682
3059,73416,indoor,"clean_room, archive, locker_room, dressing_room, beauty_salon",29682
3060,73440,indoor,"museum/indoor, clean_room, archive, locker_room, dressing_room",29682
3061,73464,indoor,"locker_room, clean_room, archive, museum/indoor, dressing_room",29682
3062,73488,indoor,"locker_room, clean_room, dressing_room, archive, sauna",29682
3063,73512,indoor,"clean_room, archive, butchers_shop, classroom, operating_room",29682
3064,73536,indoor,"clean_room, operating_room, chemistry_lab, archive, biology_laboratory",29682
3065,73560,indoor,"clean_room, shower, dressing_room, bathroom, server_room",29682
3066,73584,indoor,"clean_room, shower, bathroom, dressing_room, utility_room",29682
3067,73608,indoor,"clean_room, dressing_room, bathroom, shower, museum/indoor",29682
3068,73632,indoor,"dressing_room, clean_room, shower, bathroom, museum/indoor",29682
3069,73656,indoor,"clean_room, shower, dressing_room, bathroom, museum/indoor",29682
3070,73680,indoor,"dressing_room, locker_room, bathroom, shower, clean_room",29682
3071,73704,indoor,"clean_room, dressing_room, artists_loft, museum/indoor, art_gallery",29682
3072,73728,indoor,"dressing_room, clean_room, artists_loft, beauty_salon, clothing_store",29682
3073,73752,indoor,"dressing_room, clothing_store, clean_room, art_gallery, artists_loft",29682
3074,73776,indoor,"clean_room, dressing_room, clothing_store, locker_room, art_gallery",29682
3075,73800,indoor,"artists_loft, clean_room, dressing_room, art_gallery, elevator_lobby",29682
3076,73824,indoor,"clean_room, dressing_room, artists_loft, reception, clothing_store",29682
3077,73848,indoor,"dressing_room, clean_room, artists_loft, clothing_store, beauty_salon",29682
3078,73872,indoor,"dressing_room, clean_room, clothing_store, artists_loft, beauty_salon",29682
3079,73896,indoor,"dressing_room, clean_room, clothing_store, bathroom, artists_loft",29682
3080,73920,indoor,"beauty_salon, reception, dorm_room, dressing_room, artists_loft",29682
3081,73944,indoor,"reception, beauty_salon, dorm_room, hotel_room, alcove",29682
3082,73968,indoor,"dressing_room, artists_loft, clean_room, art_gallery, reception",29682
3083,73992,indoor,"clean_room, dressing_room, hospital_room, artists_loft, reception",29682
3084,74016,indoor,"clean_room, dressing_room, artists_loft, clothing_store, reception",29682
3085,74040,indoor,"clean_room, dressing_room, artists_loft, clothing_store, hospital_room",29682
3086,74064,indoor,"clean_room, dressing_room, artists_loft, hospital_room, reception",29682
3087,74088,indoor,"clean_room, dressing_room, artists_loft, reception, hospital_room",29682
3088,74112,indoor,"clean_room, dressing_room, clothing_store, artists_loft, locker_room",29682
3089,74136,indoor,"clean_room, dressing_room, artists_loft, clothing_store, reception",29682
3090,74160,indoor,"clean_room, dressing_room, artists_loft, hospital_room, reception",29682
3091,74184,indoor,"clean_room, dressing_room, reception, hospital_room, artists_loft",29682
3092,74208,indoor,"clean_room, dressing_room, artists_loft, hospital_room, clothing_store",29682
3093,74232,indoor,"clean_room, dressing_room, clothing_store, artists_loft, art_gallery",29682
3094,74256,indoor,"clean_room, dressing_room, clothing_store, artists_loft, locker_room",29682
3095,74280,indoor,"clean_room, elevator_lobby, dressing_room, hospital_room, artists_loft",29682
3096,74304,indoor,"elevator_lobby, clean_room, elevator/door, artists_loft, dressing_room",29682
3097,74328,indoor,"elevator_lobby, artists_loft, elevator/door, clean_room, art_gallery",29682
3098,74352,indoor,"elevator_lobby, artists_loft, elevator/door, bank_vault, clean_room",29682
3099,74376,indoor,"elevator_lobby, artists_loft, elevator/door, clean_room, art_gallery",29682
3100,74400,indoor,"elevator_lobby, artists_loft, clean_room, museum/indoor, elevator/door",29682
3101,74424,indoor,"artists_loft, elevator_lobby, art_gallery, elevator/door, museum/indoor",29682
3102,74448,indoor,"elevator_lobby, artists_loft, elevator/door, art_gallery, clean_room",29682
3103,74472,indoor,"clean_room, elevator_lobby, artists_loft, museum/indoor, elevator/door",29682
3104,74496,indoor,"elevator_lobby, artists_loft, elevator/door, clean_room, art_gallery",29682
3105,74520,indoor,"dressing_room, art_gallery, artists_loft, clean_room, museum/indoor",29682
3106,74544,indoor,"artists_loft, elevator_lobby, elevator/door, art_gallery, clean_room",29682
3107,74568,indoor,"clean_room, shower, bathroom, artists_loft, elevator_lobby",29682
3108,74592,indoor,"artists_loft, clean_room, elevator_lobby, alcove, elevator/door",29682
3109,74616,indoor,"artists_loft, clean_room, alcove, elevator_lobby, shower",29682
3110,74640,indoor,"clean_room, clothing_store, artists_loft, dressing_room, locker_room",29682
3111,74664,indoor,"artists_loft, clean_room, shower, art_gallery, alcove",29682
3112,74688,indoor,"shower, dressing_room, bathroom, locker_room, sauna",29682
3113,74712,indoor,"staircase, entrance_hall, attic, mezzanine, artists_loft",29682
3114,74736,indoor,"entrance_hall, staircase, artists_loft, beauty_salon, corridor",29682
3115,74760,indoor,"staircase, entrance_hall, artists_loft, lobby, clean_room",29682
3116,74784,indoor,"staircase, entrance_hall, artists_loft, clean_room, lobby",29682
3117,74808,indoor,"staircase, entrance_hall, artists_loft, clean_room, dressing_room",29682
3118,74832,indoor,"artists_loft, entrance_hall, staircase, lobby, art_gallery",29682
3119,74856,indoor,"entrance_hall, artists_loft, staircase, dressing_room, lobby",29682
3120,74880,indoor,"entrance_hall, staircase, artists_loft, lobby, beauty_salon",29682
3121,74904,indoor,"entrance_hall, staircase, artists_loft, art_gallery, lobby",29682
3122,74928,indoor,"entrance_hall, staircase, artists_loft, art_gallery, lobby",29682
3123,74952,indoor,"entrance_hall, staircase, artists_loft, beauty_salon, dressing_room",29682
3124,74976,indoor,"entrance_hall, artists_loft, staircase, corridor, art_gallery",29682
3125,75000,indoor,"entrance_hall, artists_loft, staircase, corridor, art_gallery",29682
3126,75024,indoor,"entrance_hall, artists_loft, staircase, dressing_room, art_gallery",29682
3127,75048,indoor,"entrance_hall, beauty_salon, dressing_room, staircase, artists_loft",29682
3128,75072,indoor,"entrance_hall, staircase, artists_loft, lobby, beauty_salon",29682
3129,75096,indoor,"artists_loft, entrance_hall, staircase, beauty_salon, dressing_room",29682
3130,75120,indoor,"entrance_hall, staircase, artists_loft, clean_room, beauty_salon",29682
3131,75144,indoor,"entrance_hall, staircase, museum/indoor, dressing_room, artists_loft",29682
3132,75168,indoor,"entrance_hall, museum/indoor, clean_room, archive, staircase",29682
3133,75192,indoor,"archive, clean_room, pharmacy, museum/indoor, atrium/public",29682
3134,75216,indoor,"museum/indoor, clothing_store, lobby, art_gallery, reception",29682
3135,75240,indoor,"reception, dressing_room, beauty_salon, jewelry_shop, clean_room",29682
3136,75264,indoor,"reception, beauty_salon, living_room, entrance_hall, office",29682
3137,75288,indoor,"living_room, dressing_room, beauty_salon, entrance_hall, museum/indoor",29682
3138,75312,indoor,"beauty_salon, artists_loft, art_gallery, clean_room, reception",29682
3139,75336,indoor,"artists_loft, art_studio, beauty_salon, art_gallery, office",29682
3140,75360,indoor,"beauty_salon, reception, clean_room, kitchen, office",29682
3141,75384,indoor,"office, lobby, living_room, reception, beauty_salon",29682
3142,75408,indoor,"living_room, dining_room, beauty_salon, office, lobby",29682
3143,75432,indoor,"dining_room, living_room, library/indoor, lobby, artists_loft",29682
3144,75456,indoor,"museum/indoor, staircase, art_gallery, entrance_hall, artists_loft",29682
3145,75480,indoor,"museum/indoor, staircase, art_gallery, entrance_hall, artists_loft",29682
3146,75504,indoor,"living_room, museum/indoor, dressing_room, artists_loft, entrance_hall",29682
3147,75528,indoor,"staircase, museum/indoor, entrance_hall, living_room, lobby",29682
3148,75552,indoor,"clean_room, dressing_room, archive, beauty_salon, hospital_room",29682
3149,75576,indoor,"clean_room, beauty_salon, operating_room, archive, hospital_room",29682
3150,75600,indoor,"clean_room, beauty_salon, museum/indoor, dressing_room, operating_room",29682
3151,75624,indoor,"clean_room, museum/indoor, beauty_salon, operating_room, archive",29682
3152,75648,indoor,"clean_room, museum/indoor, archive, operating_room, beauty_salon",29682
3153,75672,indoor,"clean_room, museum/indoor, archive, operating_room, dressing_room",29682
3154,75696,indoor,"clean_room, museum/indoor, archive, beauty_salon, operating_room",29682
3155,75720,indoor,"clean_room, beauty_salon, museum/indoor, operating_room, dressing_room",29682
3156,75744,indoor,"clean_room, dressing_room, archive, beauty_salon, museum/indoor",29682
3157,75768,indoor,"beauty_salon, office, clean_room, dressing_room, dining_room",29682
3158,75792,indoor,"archive, clean_room, art_gallery, dressing_room, museum/indoor",29682
3159,75816,indoor,"archive, reception, clean_room, jewelry_shop, art_gallery",29682
3160,75840,indoor,"archive, jewelry_shop, clean_room, reception, art_gallery",29682
3161,75864,indoor,"clean_room, reception, art_gallery, archive, jewelry_shop",29682
3162,75888,indoor,"clean_room, archive, reception, museum/indoor, art_gallery",29682
3163,75912,indoor,"reception, archive, jewelry_shop, clean_room, art_gallery",29682
3164,75936,indoor,"clean_room, elevator_lobby, elevator/door, entrance_hall, lobby",29682
3165,75960,indoor,"lobby, entrance_hall, corridor, clean_room, locker_room",29682
3166,75984,indoor,"clean_room, shower, wet_bar, server_room, bathroom",29682
3167,76008,indoor,"clean_room, shower, bathroom, chemistry_lab, dressing_room",29682
3168,76032,indoor,"clean_room, bow_window/indoor, bathroom, shower, chemistry_lab",29682
3169,76056,indoor,"chemistry_lab, clean_room, biology_laboratory, classroom, kitchen",29682
3170,76080,indoor,"bathroom, shower, bow_window/indoor, chemistry_lab, clean_room",29682
3171,76104,indoor,"shower, bathroom, jacuzzi/indoor, sauna, bow_window/indoor",29682
3172,76128,indoor,"shower, bathroom, clean_room, beauty_salon, jacuzzi/indoor",29682
3173,76152,indoor,"clean_room, bathroom, shower, chemistry_lab, physics_laboratory",29682
3174,76176,indoor,"shower, bathroom, clean_room, jacuzzi/indoor, bow_window/indoor",29682
3175,76200,indoor,"bathroom, shower, bow_window/indoor, clean_room, jacuzzi/indoor",29682
3176,76224,indoor,"shower, bathroom, clean_room, dressing_room, wet_bar",29682
3177,76248,indoor,"bathroom, shower, clean_room, dressing_room, wet_bar",29682
3178,76272,indoor,"bathroom, shower, clean_room, bow_window/indoor, wet_bar",29682
3179,76296,indoor,"clean_room, operating_room, chemistry_lab, television_studio, music_studio",29682
3180,76320,indoor,"clean_room, operating_room, hospital_room, music_studio, nursing_home",29682
3181,76344,indoor,"clean_room, operating_room, hospital_room, chemistry_lab, nursing_home",29682
3182,76368,indoor,"clean_room, operating_room, chemistry_lab, hospital_room, biology_laboratory",29682
3183,76392,indoor,"clean_room, operating_room, hospital_room, chemistry_lab, physics_laboratory",29682
3184,76416,indoor,"clean_room, operating_room, hospital_room, chemistry_lab, physics_laboratory",29682
3185,76440,indoor,"clean_room, operating_room, chemistry_lab, hospital_room, dressing_room",29682
3186,76464,indoor,"clean_room, operating_room, hospital_room, chemistry_lab, physics_laboratory",29682
3187,76488,indoor,"clean_room, operating_room, hospital_room, chemistry_lab, biology_laboratory",29682
3188,76512,indoor,"clean_room, hospital_room, operating_room, shower, dressing_room",29682
3189,76536,indoor,"clean_room, music_studio, dressing_room, shower, chemistry_lab",29682
3190,76560,indoor,"dressing_room, clean_room, music_studio, archive, chemistry_lab",29682
3191,76584,indoor,"dressing_room, clean_room, music_studio, hospital_room, archive",29682
3192,76608,indoor,"clean_room, dressing_room, archive, music_studio, hospital_room",29682
3193,76632,indoor,"clean_room, chemistry_lab, dressing_room, archive, music_studio",29682
3194,76656,indoor,"clean_room, chemistry_lab, archive, lecture_room, nursing_home",29682
3195,76680,indoor,"clean_room, music_studio, archive, dressing_room, chemistry_lab",29682
3196,76704,indoor,"clean_room, music_studio, archive, dressing_room, chemistry_lab",29682
3197,76728,indoor,"clean_room, music_studio, dressing_room, chemistry_lab, archive",29682
3198,76752,indoor,"clean_room, music_studio, dressing_room, chemistry_lab, archive",29682
3199,76776,indoor,"clean_room, music_studio, dressing_room, archive, chemistry_lab",29682
