,frame_num,environment,places
1261,30264,outdoor,"ice_floe, ice_shelf, iceberg, desert/sand, igloo"
1262,30288,outdoor,"sky, lake/natural, ocean, marsh, ice_shelf"
1263,30312,outdoor,"ocean, lake/natural, sky, beach, marsh"
1264,30336,outdoor,"lake/natural, ocean, marsh, sky, beach"
1265,30360,outdoor,"ocean, lake/natural, marsh, beach, sky"
1266,30384,outdoor,"lake/natural, ocean, marsh, pond, sky"
1267,30408,outdoor,"ocean, lake/natural, ice_shelf, marsh, sky"
1268,30432,outdoor,"ice_floe, ice_shelf, iceberg, desert/sand, igloo"
1269,30456,outdoor,"ice_floe, ice_shelf, igloo, desert/sand, iceberg"
1270,30480,outdoor,"ice_floe, ice_shelf, iceberg, igloo, desert/sand"
1271,30504,outdoor,"ice_floe, ice_shelf, iceberg, igloo, desert/sand"
1272,30528,outdoor,"ice_floe, ice_shelf, igloo, iceberg, desert/sand"
1273,30552,outdoor,"ice_floe, iceberg, ice_shelf, pond, desert/sand"
1274,30576,outdoor,"corn_field, orchard, pond, cemetery, rice_paddy"
1275,30600,outdoor,"corn_field, pond, orchard, rice_paddy, ice_shelf"
1276,30624,outdoor,"iceberg, ice_shelf, ocean, ice_floe, sky"
1277,30648,outdoor,"iceberg, ice_shelf, ocean, ice_floe, coast"
1278,30672,outdoor,"lake/natural, ice_floe, pond, raft, river"
1279,30696,outdoor,"ice_shelf, ice_floe, field/cultivated, shower, beach"
1280,30720,indoor,"museum/indoor, cemetery, archive, field/cultivated, auditorium"
1281,30744,indoor,"museum/indoor, archive, cemetery, field/cultivated, stage/indoor"
1282,30768,indoor,"museum/indoor, stadium/baseball, archive, baseball_field, stage/indoor"
1283,30792,outdoor,"museum/indoor, archive, schoolhouse, cemetery, field/cultivated"
1284,30816,indoor,"museum/indoor, archive, schoolhouse, stage/indoor, cemetery"
1285,30840,indoor,"museum/indoor, schoolhouse, archive, stage/indoor, cemetery"
1286,30864,indoor,"museum/indoor, archive, schoolhouse, cemetery, stage/indoor"
1287,30888,indoor,"museum/indoor, archive, schoolhouse, stage/indoor, cemetery"
1288,30912,indoor,"museum/indoor, archive, schoolhouse, cemetery, stage/indoor"
1289,30936,indoor,"museum/indoor, archive, schoolhouse, cemetery, stage/indoor"
1290,30960,outdoor,"iceberg, ice_shelf, ice_floe, lake/natural, hot_spring"
1291,30984,outdoor,"iceberg, ice_shelf, ice_floe, lake/natural, hot_spring"
1292,31008,outdoor,"ice_shelf, iceberg, ice_floe, lake/natural, ocean"
1293,31032,outdoor,"corn_field, orchard, wheat_field, field/wild, field/cultivated"
1294,31056,outdoor,"corn_field, orchard, wheat_field, jewelry_shop, field/wild"
1295,31080,outdoor,"corn_field, orchard, wheat_field, jewelry_shop, desert/sand"
1296,31104,outdoor,"corn_field, orchard, wheat_field, field/wild, field/cultivated"
1297,31128,indoor,"museum/indoor, archive, cemetery, schoolhouse, clean_room"
1298,31152,indoor,"museum/indoor, schoolhouse, archive, cemetery, clean_room"
1299,31176,indoor,"museum/indoor, cemetery, archive, schoolhouse, stage/indoor"
1300,31200,indoor,"museum/indoor, cemetery, archive, schoolhouse, stage/indoor"
1301,31224,indoor,"museum/indoor, cemetery, archive, schoolhouse, stage/indoor"
1302,31248,indoor,"museum/indoor, cemetery, archive, schoolhouse, burial_chamber"
1303,31272,indoor,"museum/indoor, cemetery, archive, schoolhouse, stage/indoor"
1304,31296,indoor,"museum/indoor, cemetery, archive, schoolhouse, stage/indoor"
1305,31320,outdoor,"cemetery, museum/indoor, archive, schoolhouse, field/cultivated"
1306,31344,outdoor,"cemetery, museum/indoor, archive, field/cultivated, schoolhouse"
1307,31368,outdoor,"cemetery, museum/indoor, archive, field/cultivated, schoolhouse"
1308,31392,outdoor,"archive, museum/indoor, cemetery, bullring, field/cultivated"
1309,31416,outdoor,"cemetery, archive, museum/indoor, field/cultivated, rice_paddy"
1310,31440,outdoor,"cemetery, museum/indoor, field/cultivated, archive, rice_paddy"
1311,31464,indoor,"museum/indoor, archive, cemetery, field/cultivated, auditorium"
1312,31488,outdoor,"museum/indoor, archive, cemetery, field/cultivated, bullring"
1313,31512,outdoor,"ice_shelf, ice_floe, clean_room, igloo, iceberg"
1314,31536,outdoor,"ice_shelf, ice_floe, archive, iceberg, clean_room"
1315,31560,outdoor,"ice_shelf, ice_floe, iceberg, archive, clean_room"
1316,31584,outdoor,"ice_shelf, ice_floe, iceberg, igloo, clean_room"
1317,31608,outdoor,"ice_floe, ice_shelf, clean_room, archive, igloo"
1318,31632,outdoor,"ice_shelf, ice_floe, igloo, iceberg, clean_room"
1319,31656,indoor,"zen_garden, jewelry_shop, cemetery, shower, museum/indoor"
1320,31680,outdoor,"zen_garden, jewelry_shop, cemetery, ice_shelf, shower"
1321,31704,indoor,"shower, jewelry_shop, zen_garden, cemetery, museum/indoor"
1322,31728,outdoor,"zen_garden, cemetery, jewelry_shop, museum/indoor, ice_shelf"
1323,31752,outdoor,"lake/natural, marsh, ice_shelf, pond, ocean"
1324,31776,outdoor,"ice_shelf, lake/natural, marsh, pond, hot_spring"
1325,31800,outdoor,"ice_shelf, lake/natural, marsh, ocean, pond"
1326,31824,outdoor,"lake/natural, ice_shelf, marsh, pond, hot_spring"
1327,31848,outdoor,"lake/natural, ice_shelf, marsh, pond, hot_spring"
1328,31872,outdoor,"ice_shelf, lake/natural, marsh, pond, ocean"
1329,31896,outdoor,"ice_shelf, lake/natural, marsh, hot_spring, ice_floe"
1330,31920,outdoor,"cemetery, shower, zen_garden, museum/indoor, ice_shelf"
1331,31944,outdoor,"cemetery, shower, zen_garden, orchard, jewelry_shop"
1332,31968,outdoor,"shower, cemetery, zen_garden, ice_shelf, orchard"
1333,31992,outdoor,"archive, cemetery, rice_paddy, pond, corn_field"
1334,32016,outdoor,"archive, cemetery, orchard, rice_paddy, pond"
1335,32040,outdoor,"archive, cemetery, pond, lake/natural, rice_paddy"
1336,32064,outdoor,"archive, pond, cemetery, rice_paddy, lake/natural"
1337,32088,outdoor,"archive, pond, rice_paddy, lake/natural, cemetery"
1338,32112,outdoor,"ice_shelf, ocean, iceberg, lake/natural, hot_spring"
1339,32136,outdoor,"ocean, lake/natural, ice_shelf, iceberg, pond"
1340,32160,outdoor,"ice_shelf, iceberg, ocean, lake/natural, pond"
1341,32184,outdoor,"ocean, iceberg, ice_shelf, lake/natural, marsh"
1342,32208,indoor,"archive, cemetery, museum/indoor, pond, natural_history_museum"
1343,32232,outdoor,"archive, cemetery, museum/indoor, lake/natural, pond"
1344,32256,outdoor,"archive, cemetery, pond, rice_paddy, orchard"
1345,32280,outdoor,"archive, corn_field, rice_paddy, orchard, field/cultivated"
1346,32304,outdoor,"archive, corn_field, cemetery, rice_paddy, field/cultivated"
1347,32328,outdoor,"archive, cemetery, rice_paddy, corn_field, museum/indoor"
1348,32352,outdoor,"archive, cemetery, orchard, rice_paddy, corn_field"
1349,32376,outdoor,"archive, cemetery, orchard, corn_field, rice_paddy"
1350,32400,outdoor,"archive, cemetery, rice_paddy, field/cultivated, corn_field"
1351,32424,outdoor,"ice_shelf, desert/sand, lake/natural, marsh, pond"
1352,32448,outdoor,"ice_shelf, lake/natural, marsh, desert/sand, pond"
1353,32472,outdoor,"lake/natural, marsh, ice_shelf, pond, hot_spring"
1354,32496,outdoor,"lake/natural, marsh, ice_shelf, sky, pond"
1355,32520,outdoor,"marsh, sky, lake/natural, pond, ice_shelf"
1356,32544,outdoor,"lake/natural, marsh, sky, pond, ice_shelf"
1357,32568,outdoor,"lake/natural, marsh, ice_shelf, pond, sky"
1358,32592,outdoor,"cemetery, archive, pond, orchard, archaelogical_excavation"
1359,32616,outdoor,"archive, rice_paddy, cemetery, orchard, lake/natural"
1360,32640,outdoor,"archive, rice_paddy, lake/natural, pond, cemetery"
1361,32664,outdoor,"archive, cemetery, rice_paddy, field/cultivated, archaelogical_excavation"
1362,32688,outdoor,"orchard, field/wild, corn_field, shower, wheat_field"
1363,32712,outdoor,"orchard, field/wild, wheat_field, shower, corn_field"
1364,32736,outdoor,"ocean, ice_shelf, iceberg, hot_spring, lake/natural"
1365,32760,outdoor,"iceberg, ice_shelf, ocean, ice_floe, lake/natural"
1366,32784,outdoor,"iceberg, ocean, ice_shelf, lake/natural, hot_spring"
1367,32808,outdoor,"iceberg, ocean, ice_shelf, lake/natural, hot_spring"
1368,32832,outdoor,"iceberg, ice_shelf, ocean, hot_spring, lake/natural"
1369,32856,outdoor,"cemetery, archaelogical_excavation, archive, rice_paddy, field/cultivated"
1370,32880,outdoor,"cemetery, pond, lake/natural, rice_paddy, archive"
1371,32904,outdoor,"pond, rice_paddy, lake/natural, marsh, cemetery"
1372,32928,outdoor,"pond, lake/natural, marsh, field/cultivated, cemetery"
1373,32952,outdoor,"ice_shelf, hot_spring, iceberg, desert/sand, ocean"
1374,32976,outdoor,"ice_shelf, ocean, iceberg, hot_spring, lake/natural"
1375,33000,outdoor,"ice_shelf, iceberg, ocean, hot_spring, coast"
1376,33024,outdoor,"ice_shelf, iceberg, ocean, hot_spring, pond"
1377,33048,outdoor,"lake/natural, pond, marsh, cemetery, rice_paddy"
1378,33072,outdoor,"cemetery, lake/natural, pond, archive, orchard"
1379,33096,outdoor,"archive, cemetery, field/cultivated, rice_paddy, marsh"
1380,33120,outdoor,"rice_paddy, pond, marsh, field/cultivated, lake/natural"
1381,33144,outdoor,"orchard, cemetery, pond, lake/natural, marsh"
1382,33168,outdoor,"ice_floe, pond, lake/natural, ice_shelf, ocean"
1383,33192,outdoor,"ice_floe, pond, ice_shelf, lake/natural, ocean"
1384,33216,outdoor,"ice_floe, ice_shelf, archaelogical_excavation, archive, beach"
1385,33240,outdoor,"ice_floe, archaelogical_excavation, ice_shelf, archive, harbor"
1386,33264,outdoor,"ice_floe, ice_shelf, harbor, pond, ocean"
1387,33288,outdoor,"ice_floe, archaelogical_excavation, ice_shelf, beach, pond"
1388,33312,outdoor,"ice_floe, ice_shelf, archaelogical_excavation, raft, ocean"
1389,33336,outdoor,"ice_floe, ice_shelf, ocean, pond, archaelogical_excavation"
1390,33360,outdoor,"ice_floe, pond, ice_shelf, lake/natural, ocean"
1391,33384,outdoor,"ice_floe, ice_shelf, lake/natural, pond, ocean"
1392,33408,outdoor,"watering_hole, lake/natural, pond, ice_floe, marsh"
1393,33432,outdoor,"ocean, lake/natural, beach, coast, ice_floe"
1394,33456,outdoor,"ice_floe, ice_shelf, ocean, beach, iceberg"
1395,33480,outdoor,"lake/natural, beach, ocean, ice_floe, marsh"
1396,33504,outdoor,"marsh, lake/natural, pond, sky, ice_floe"
1397,33528,outdoor,"ice_shelf, ice_floe, underwater/ocean_deep, forest/broadleaf, botanical_garden"
1398,33552,outdoor,"ice_shelf, ice_floe, underwater/ocean_deep, ocean, lake/natural"
1399,33576,outdoor,"ice_shelf, underwater/ocean_deep, ice_floe, forest/broadleaf, botanical_garden"
1400,33600,outdoor,"ice_shelf, ice_floe, underwater/ocean_deep, botanical_garden, forest/broadleaf"
1401,33624,outdoor,"ice_shelf, underwater/ocean_deep, ice_floe, forest/broadleaf, botanical_garden"
1402,33648,outdoor,"ice_shelf, ice_floe, underwater/ocean_deep, ocean, botanical_garden"
1403,33672,outdoor,"ice_floe, ice_shelf, underwater/ocean_deep, ocean, lake/natural"
1404,33696,outdoor,"ice_shelf, ice_floe, pond, lake/natural, snowfield"
1405,33720,outdoor,"ice_shelf, ice_floe, lake/natural, underwater/ocean_deep, pond"
1406,33744,indoor,"clean_room, beauty_salon, hospital_room, operating_room, veterinarians_office"
1407,33768,indoor,"butchers_shop, clean_room, hospital_room, alcove, bedroom"
1408,33792,indoor,"clean_room, operating_room, hospital_room, butchers_shop, dressing_room"
1409,33816,indoor,"clean_room, operating_room, hospital_room, dressing_room, veterinarians_office"
1410,33840,indoor,"clean_room, beauty_salon, hospital_room, operating_room, bedroom"
1411,33864,indoor,"dressing_room, bedroom, clean_room, childs_room, nursery"
1412,33888,indoor,"bedroom, beauty_salon, dressing_room, hospital_room, hotel_room"
1413,33912,indoor,"utility_room, bedroom, bathroom, shower, hospital_room"
1414,33936,indoor,"dressing_room, shower, museum/indoor, art_gallery, stage/indoor"
1415,33960,indoor,"shower, dressing_room, clean_room, bathroom, museum/indoor"
1416,33984,indoor,"dressing_room, shower, museum/indoor, clean_room, bathroom"
1417,34008,indoor,"dressing_room, shower, museum/indoor, stage/indoor, music_studio"
1418,34032,indoor,"elevator/door, shower, closet, elevator_lobby, barndoor"
1419,34056,indoor,"elevator/door, closet, shower, elevator_lobby, locker_room"
1420,34080,indoor,"elevator/door, closet, shower, elevator_lobby, barndoor"
1421,34104,indoor,"shower, dressing_room, chemistry_lab, stage/indoor, clean_room"
1422,34128,indoor,"shower, chemistry_lab, music_studio, clean_room, dressing_room"
1423,34152,indoor,"shower, dressing_room, stage/indoor, music_studio, locker_room"
1424,34176,indoor,"shower, dressing_room, stage/indoor, clean_room, chemistry_lab"
1425,34200,indoor,"shower, dressing_room, locker_room, chemistry_lab, museum/indoor"
1426,34224,indoor,"shower, stage/indoor, music_studio, dressing_room, chemistry_lab"
1427,34248,indoor,"shower, stage/indoor, dressing_room, music_studio, museum/indoor"
1428,34272,outdoor,"ice_shelf, desert/sand, ice_floe, sky, museum/indoor"
1429,34296,outdoor,"ice_shelf, desert/sand, ice_floe, sky, museum/indoor"
1430,34320,outdoor,"ice_shelf, desert/sand, ice_floe, sky, iceberg"
1431,34344,outdoor,"ice_shelf, desert/sand, ice_floe, museum/indoor, iceberg"
1432,34368,outdoor,"ice_shelf, desert/sand, ice_floe, sky, iceberg"
1433,34392,outdoor,"ice_shelf, desert/sand, ice_floe, sky, iceberg"
1434,34416,outdoor,"ice_shelf, ice_floe, desert/sand, sky, iceberg"
1435,34440,outdoor,"ice_shelf, desert/sand, ice_floe, sky, iceberg"
1436,34464,outdoor,"ice_shelf, desert/sand, ice_floe, museum/indoor, sky"
1437,34488,outdoor,"ice_shelf, desert/sand, ice_floe, sky, museum/indoor"
1438,34512,indoor,"shower, dressing_room, stage/indoor, music_studio, clean_room"
1439,34536,indoor,"shower, music_studio, stage/indoor, dressing_room, chemistry_lab"
1440,34560,indoor,"shower, stage/indoor, music_studio, dressing_room, natural_history_museum"
1441,34584,indoor,"shower, stage/indoor, music_studio, dressing_room, chemistry_lab"
1442,34608,indoor,"museum/indoor, throne_room, kasbah, burial_chamber, art_gallery"
1443,34632,indoor,"museum/indoor, kasbah, burial_chamber, throne_room, science_museum"
1444,34656,indoor,"museum/indoor, burial_chamber, kasbah, art_gallery, science_museum"
1445,34680,indoor,"museum/indoor, kasbah, throne_room, burial_chamber, art_gallery"
1446,34704,indoor,"museum/indoor, natural_history_museum, science_museum, kasbah, banquet_hall"
1447,34728,indoor,"museum/indoor, science_museum, kasbah, natural_history_museum, banquet_hall"
1448,34752,indoor,"museum/indoor, science_museum, kasbah, natural_history_museum, banquet_hall"
1449,34776,indoor,"museum/indoor, science_museum, natural_history_museum, kasbah, burial_chamber"
1450,34800,indoor,"museum/indoor, kasbah, natural_history_museum, science_museum, burial_chamber"
1451,34824,indoor,"beauty_salon, drugstore, museum/indoor, ice_shelf, pharmacy"
1452,34848,indoor,"beauty_salon, ice_shelf, drugstore, museum/indoor, jewelry_shop"
1453,34872,indoor,"beauty_salon, ice_shelf, drugstore, museum/indoor, pharmacy"
1454,34896,indoor,"ice_shelf, beauty_salon, drugstore, museum/indoor, ice_floe"
1455,34920,indoor,"ice_shelf, beauty_salon, drugstore, museum/indoor, pharmacy"
1456,34944,indoor,"beauty_salon, ice_shelf, drugstore, museum/indoor, pharmacy"
1457,34968,indoor,"beauty_salon, ice_shelf, drugstore, museum/indoor, pharmacy"
1458,34992,indoor,"beauty_salon, drugstore, ice_shelf, museum/indoor, pharmacy"
1459,35016,indoor,"beauty_salon, drugstore, ice_shelf, museum/indoor, pharmacy"
1460,35040,indoor,"ice_shelf, beauty_salon, drugstore, museum/indoor, ice_floe"
1461,35064,indoor,"beauty_salon, drugstore, ice_shelf, museum/indoor, jewelry_shop"
1462,35088,indoor,"beauty_salon, drugstore, ice_shelf, museum/indoor, jewelry_shop"
1463,35112,indoor,"beauty_salon, drugstore, museum/indoor, pharmacy, jewelry_shop"
1464,35136,indoor,"flea_market/indoor, museum/indoor, jewelry_shop, gift_shop, dining_room"
1465,35160,indoor,"museum/indoor, flea_market/indoor, dining_room, jewelry_shop, gift_shop"
1466,35184,indoor,"museum/indoor, jewelry_shop, flea_market/indoor, gift_shop, dining_room"
1467,35208,indoor,"dining_room, museum/indoor, flea_market/indoor, living_room, throne_room"
1468,35232,indoor,"flea_market/indoor, jewelry_shop, gift_shop, dining_room, museum/indoor"
1469,35256,indoor,"flea_market/indoor, dining_room, museum/indoor, jewelry_shop, living_room"
1470,35280,indoor,"dining_room, flea_market/indoor, banquet_hall, dining_hall, museum/indoor"
1471,35304,indoor,"museum/indoor, flea_market/indoor, dining_room, natural_history_museum, jewelry_shop"
1472,35328,outdoor,"hardware_store, archive, office_building, building_facade, hospital"
1473,35352,outdoor,"building_facade, office_building, hospital, hardware_store, aqueduct"
1474,35376,indoor,"hardware_store, archive, corn_field, arena/performance, cemetery"
1475,35400,outdoor,"aqueduct, construction_site, office_building, building_facade, bridge"
1476,35424,outdoor,"cemetery, office_building, building_facade, skyscraper, church/outdoor"
1477,35448,outdoor,"archive, office_building, cemetery, building_facade, hospital"
1478,35472,outdoor,"office_building, cemetery, hospital, building_facade, skyscraper"
1479,35496,outdoor,"cemetery, office_building, skyscraper, tower, hardware_store"
1480,35520,outdoor,"cemetery, office_building, building_facade, archive, hospital"
1481,35544,outdoor,"cemetery, church/outdoor, archive, mosque/outdoor, ski_resort"
1482,35568,outdoor,"office_building, building_facade, pharmacy, hotel/outdoor, archive"
1483,35592,indoor,"jewelry_shop, museum/indoor, science_museum, natural_history_museum, ballroom"
1484,35616,indoor,"jewelry_shop, museum/indoor, science_museum, natural_history_museum, art_gallery"
1485,35640,indoor,"jewelry_shop, museum/indoor, science_museum, natural_history_museum, art_gallery"
1486,35664,indoor,"jewelry_shop, museum/indoor, science_museum, department_store, natural_history_museum"
1487,35688,indoor,"jewelry_shop, museum/indoor, science_museum, natural_history_museum, department_store"
1488,35712,indoor,"jewelry_shop, museum/indoor, science_museum, natural_history_museum, gift_shop"
1489,35736,indoor,"jewelry_shop, museum/indoor, science_museum, natural_history_museum, gift_shop"
1490,35760,indoor,"jewelry_shop, museum/indoor, science_museum, natural_history_museum, art_gallery"
1491,35784,indoor,"shower, museum/indoor, jewelry_shop, art_gallery, dressing_room"
1492,35808,indoor,"shower, corn_field, museum/indoor, dressing_room, bamboo_forest"
1493,35832,indoor,"shower, museum/indoor, dressing_room, natural_history_museum, art_studio"
1494,35856,outdoor,"swamp, lake/natural, marsh, pond, ice_shelf"
1495,35880,outdoor,"lake/natural, swamp, marsh, pond, beach"
1496,35904,outdoor,"swamp, lake/natural, rice_paddy, marsh, corn_field"
1497,35928,outdoor,"landfill, beach, lake/natural, ski_slope, arena/rodeo"
1498,35952,outdoor,"barndoor, lake/natural, yard, desert/sand, beach"
1499,35976,indoor,"museum/indoor, nursery, natural_history_museum, art_gallery, jewelry_shop"
1500,36000,indoor,"museum/indoor, art_gallery, bow_window/indoor, art_studio, jewelry_shop"
1501,36024,indoor,"museum/indoor, art_gallery, jewelry_shop, art_studio, bow_window/indoor"
1502,36048,indoor,"museum/indoor, art_gallery, jewelry_shop, art_studio, dressing_room"
1503,36072,outdoor,"desert/sand, ice_shelf, beach, trench, slum"
1504,36096,outdoor,"ice_shelf, wind_farm, slum, ocean, railroad_track"
1505,36120,outdoor,"trench, ice_shelf, slum, landfill, archive"
1506,36144,outdoor,"trench, landfill, wind_farm, ice_shelf, corn_field"
1507,36168,outdoor,"trench, landfill, beach, coast, ocean"
1508,36192,outdoor,"landfill, trench, slum, schoolhouse, beach"
1509,36216,outdoor,"archive, landfill, ice_shelf, schoolhouse, boat_deck"
1510,36240,indoor,"museum/indoor, jewelry_shop, gift_shop, nursery, science_museum"
1511,36264,indoor,"museum/indoor, gift_shop, jewelry_shop, science_museum, natural_history_museum"
1512,36288,indoor,"museum/indoor, science_museum, gift_shop, natural_history_museum, jewelry_shop"
1513,36312,indoor,"clean_room, dressing_room, shower, chemistry_lab, natural_history_museum"
1514,36336,indoor,"clean_room, shower, chemistry_lab, dressing_room, ice_floe"
1515,36360,indoor,"clean_room, dressing_room, chemistry_lab, railroad_track, ice_floe"
1516,36384,indoor,"museum/indoor, art_gallery, bow_window/indoor, art_studio, shower"
1517,36408,indoor,"museum/indoor, art_gallery, art_studio, jewelry_shop, bow_window/indoor"
1518,36432,outdoor,"iceberg, ice_shelf, sky, harbor, ocean"
1519,36456,indoor,"museum/indoor, bow_window/indoor, nursery, art_gallery, art_studio"
1520,36480,indoor,"museum/indoor, nursery, bow_window/indoor, art_gallery, natural_history_museum"
1521,36504,indoor,"clean_room, dressing_room, ice_floe, ice_shelf, natural_history_museum"
1522,36528,indoor,"archive, natural_history_museum, shower, science_museum, clean_room"
1523,36552,outdoor,"ice_floe, clean_room, ice_shelf, igloo, art_gallery"
1524,36576,outdoor,"iceberg, ice_shelf, ocean, ice_floe, desert/sand"
1525,36600,outdoor,"landfill, oilrig, boat_deck, ocean, slum"
1526,36624,outdoor,"oilrig, boat_deck, desert/sand, landfill, ocean"
1527,36648,outdoor,"oilrig, landfill, slum, desert/sand, harbor"
1528,36672,outdoor,"ice_shelf, wheat_field, jewelry_shop, ice_floe, pond"
1529,36696,outdoor,"ice_shelf, jewelry_shop, ice_floe, iceberg, pond"
1530,36720,outdoor,"ice_floe, ice_shelf, iceberg, jewelry_shop, glacier"
1531,36744,indoor,"science_museum, booth/indoor, kindergarden_classroom, ice_cream_parlor, beauty_salon"
1532,36768,indoor,"beauty_salon, drugstore, jewelry_shop, kindergarden_classroom, science_museum"
1533,36792,indoor,"kindergarden_classroom, classroom, museum/indoor, booth/indoor, science_museum"
1534,36816,indoor,"beauty_salon, jewelry_shop, drugstore, ice_cream_parlor, kindergarden_classroom"
1535,36840,indoor,"beauty_salon, kindergarden_classroom, jewelry_shop, drugstore, museum/indoor"
1536,36864,indoor,"kindergarden_classroom, archive, museum/indoor, ice_shelf, classroom"
1537,36888,indoor,"kindergarden_classroom, museum/indoor, booth/indoor, science_museum, archive"
1538,36912,indoor,"kindergarden_classroom, booth/indoor, science_museum, museum/indoor, archive"
1539,36936,indoor,"kindergarden_classroom, science_museum, museum/indoor, booth/indoor, drugstore"
1540,36960,indoor,"kindergarden_classroom, science_museum, museum/indoor, drugstore, booth/indoor"
1541,36984,indoor,"kindergarden_classroom, science_museum, museum/indoor, booth/indoor, archive"
1542,37008,outdoor,"fishpond, pond, underwater/ocean_deep, sky, hot_spring"
1543,37032,indoor,"natural_history_museum, jewelry_shop, science_museum, museum/indoor, ballroom"
1544,37056,indoor,"jewelry_shop, department_store, natural_history_museum, museum/indoor, science_museum"
1545,37080,indoor,"natural_history_museum, jewelry_shop, department_store, museum/indoor, gift_shop"
1546,37104,indoor,"banquet_hall, jewelry_shop, ballroom, department_store, natural_history_museum"
1547,37128,indoor,"jewelry_shop, department_store, natural_history_museum, gift_shop, museum/indoor"
1548,37152,indoor,"natural_history_museum, jewelry_shop, museum/indoor, science_museum, department_store"
1549,37176,indoor,"natural_history_museum, science_museum, museum/indoor, jewelry_shop, art_gallery"
1550,37200,indoor,"natural_history_museum, jewelry_shop, science_museum, museum/indoor, department_store"
1551,37224,indoor,"banquet_hall, natural_history_museum, jewelry_shop, science_museum, ballroom"
1552,37248,indoor,"natural_history_museum, science_museum, museum/indoor, desert/sand, canyon"
1553,37272,indoor,"chemistry_lab, biology_laboratory, science_museum, natural_history_museum, clean_room"
1554,37296,indoor,"natural_history_museum, science_museum, museum/indoor, art_gallery, gift_shop"
1555,37320,indoor,"natural_history_museum, museum/indoor, science_museum, shower, dressing_room"
1556,37344,indoor,"museum/indoor, natural_history_museum, science_museum, art_gallery, dressing_room"
1557,37368,indoor,"museum/indoor, natural_history_museum, science_museum, art_gallery, desert/sand"
1558,37392,indoor,"natural_history_museum, museum/indoor, science_museum, art_gallery, sauna"
1559,37416,indoor,"natural_history_museum, museum/indoor, science_museum, art_gallery, desert/sand"
1560,37440,indoor,"museum/indoor, natural_history_museum, burial_chamber, dressing_room, kasbah"
1561,37464,indoor,"canyon, museum/indoor, art_studio, natural_history_museum, art_gallery"
1562,37488,indoor,"museum/indoor, natural_history_museum, science_museum, art_gallery, burial_chamber"
1563,37512,indoor,"museum/indoor, art_gallery, natural_history_museum, science_museum, burial_chamber"
1564,37536,indoor,"dressing_room, desert/sand, jewelry_shop, museum/indoor, shower"
1565,37560,indoor,"museum/indoor, art_gallery, sauna, art_studio, canyon"
1566,37584,indoor,"museum/indoor, science_museum, natural_history_museum, burial_chamber, art_gallery"
1567,37608,indoor,"burial_chamber, museum/indoor, desert/sand, art_gallery, canyon"
1568,37632,indoor,"museum/indoor, corn_field, desert/sand, dressing_room, art_studio"
1569,37656,indoor,"art_studio, art_school, corn_field, museum/indoor, jewelry_shop"
1570,37680,indoor,"jewelry_shop, museum/indoor, corn_field, art_studio, art_school"
1571,37704,indoor,"museum/indoor, corn_field, art_studio, natural_history_museum, jewelry_shop"
1572,37728,indoor,"museum/indoor, corn_field, jewelry_shop, natural_history_museum, art_studio"
1573,37752,indoor,"museum/indoor, art_studio, art_school, art_gallery, corn_field"
1574,37776,indoor,"museum/indoor, jewelry_shop, corn_field, art_studio, natural_history_museum"
1575,37800,indoor,"museum/indoor, jewelry_shop, banquet_hall, natural_history_museum, corn_field"
1576,37824,indoor,"jewelry_shop, museum/indoor, corn_field, natural_history_museum, gift_shop"
1577,37848,indoor,"jewelry_shop, museum/indoor, natural_history_museum, corn_field, gift_shop"
1578,37872,indoor,"museum/indoor, jewelry_shop, natural_history_museum, art_studio, dressing_room"
1579,37896,indoor,"museum/indoor, jewelry_shop, natural_history_museum, corn_field, dressing_room"
