,frame_num,environment,places
3459,83016,indoor,"shower, fountain, jewelry_shop, museum/indoor, natural_history_museum"
3460,83040,outdoor,"shower, corn_field, wheat_field, fountain, catacomb"
3461,83064,outdoor,"corn_field, wheat_field, catacomb, cemetery, church/indoor"
3462,83088,outdoor,"catacomb, corn_field, burial_chamber, wheat_field, forest/broadleaf"
3463,83112,outdoor,"catacomb, corn_field, wheat_field, cemetery, forest/broadleaf"
3464,83136,outdoor,"corn_field, wheat_field, cemetery, catacomb, museum/indoor"
3465,83160,outdoor,"corn_field, wheat_field, field/wild, field/cultivated, cemetery"
3466,83184,outdoor,"shower, wheat_field, corn_field, botanical_garden, fountain"
3467,83208,outdoor,"shower, fountain, ice_floe, bathroom, water_tower"
3468,83232,outdoor,"shower, lake/natural, pond, marsh, jewelry_shop"
3469,83256,outdoor,"desert/sand, igloo, glacier, ice_floe, iceberg"
3470,83280,outdoor,"desert/sand, natural_history_museum, iceberg, ice_floe, science_museum"
3471,83304,outdoor,"desert/sand, iceberg, canyon, natural_history_museum, rock_arch"
3472,83328,outdoor,"igloo, desert/sand, glacier, crevasse, iceberg"
3473,83352,outdoor,"canyon, kasbah, natural_history_museum, museum/indoor, butte"
3474,83376,indoor,"kasbah, museum/indoor, desert/sand, natural_history_museum, shoe_shop"
3475,83400,outdoor,"kasbah, museum/indoor, desert/sand, medina, shoe_shop"
3476,83424,indoor,"natural_history_museum, museum/indoor, shower, science_museum, art_gallery"
3477,83448,indoor,"dressing_room, shower, desert/sand, bathroom, natural_history_museum"
3478,83472,indoor,"natural_history_museum, dressing_room, art_gallery, museum/indoor, desert/sand"
3479,83496,indoor,"shower, dressing_room, bathroom, art_gallery, museum/indoor"
3480,83520,indoor,"museum/indoor, dressing_room, art_studio, art_gallery, shower"
3481,83544,indoor,"dressing_room, shower, art_studio, art_gallery, bathroom"
3482,83568,indoor,"museum/indoor, ice_shelf, nursery, science_museum, natural_history_museum"
3483,83592,indoor,"museum/indoor, ice_shelf, science_museum, natural_history_museum, nursery"
3484,83616,indoor,"museum/indoor, science_museum, ice_shelf, natural_history_museum, nursery"
3485,83640,indoor,"museum/indoor, science_museum, ice_shelf, natural_history_museum, nursery"
3486,83664,indoor,"museum/indoor, science_museum, ice_shelf, natural_history_museum, nursery"
3487,83688,indoor,"museum/indoor, science_museum, ice_shelf, natural_history_museum, nursery"
3488,83712,indoor,"museum/indoor, science_museum, ice_shelf, natural_history_museum, nursery"
3489,83736,indoor,"museum/indoor, ice_shelf, science_museum, nursery, natural_history_museum"
3490,83760,indoor,"museum/indoor, ice_shelf, science_museum, natural_history_museum, nursery"
3491,83784,indoor,"museum/indoor, ice_shelf, science_museum, nursery, natural_history_museum"
3492,83808,outdoor,"kasbah, waiting_room, patio, desert/sand, dining_room"
3493,83832,outdoor,"kasbah, waiting_room, museum/indoor, desert/sand, patio"
3494,83856,indoor,"kasbah, museum/indoor, waiting_room, desert/sand, dining_room"
3495,83880,indoor,"kasbah, museum/indoor, waiting_room, locker_room, patio"
3496,83904,indoor,"kasbah, museum/indoor, nursery, waiting_room, dining_room"
3497,83928,outdoor,"kasbah, patio, mausoleum, courtyard, museum/indoor"
3498,83952,outdoor,"kasbah, museum/indoor, patio, waiting_room, desert/sand"
3499,83976,indoor,"natural_history_museum, museum/indoor, desert/sand, burial_chamber, science_museum"
3500,84000,indoor,"desert/sand, museum/indoor, natural_history_museum, art_gallery, hotel_room"
3501,84024,indoor,"museum/indoor, natural_history_museum, desert/sand, art_gallery, science_museum"
3502,84048,indoor,"desert/sand, natural_history_museum, museum/indoor, art_gallery, burial_chamber"
3503,84072,indoor,"art_gallery, natural_history_museum, museum/indoor, science_museum, jewelry_shop"
3504,84096,indoor,"museum/indoor, natural_history_museum, burial_chamber, desert/sand, medina"
3505,84120,indoor,"museum/indoor, desert/sand, art_gallery, natural_history_museum, science_museum"
3506,84144,indoor,"museum/indoor, natural_history_museum, desert/sand, art_gallery, science_museum"
3507,84168,indoor,"museum/indoor, natural_history_museum, desert/sand, art_gallery, burial_chamber"
3508,84192,indoor,"museum/indoor, natural_history_museum, art_gallery, desert/sand, science_museum"
3509,84216,indoor,"desert/sand, museum/indoor, igloo, art_gallery, natural_history_museum"
3510,84240,outdoor,"desert/sand, museum/indoor, igloo, natural_history_museum, campsite"
3511,84264,indoor,"museum/indoor, natural_history_museum, desert/sand, art_gallery, science_museum"
3512,84288,indoor,"museum/indoor, art_gallery, natural_history_museum, science_museum, desert/sand"
3513,84312,indoor,"natural_history_museum, museum/indoor, desert/sand, science_museum, art_gallery"
3514,84336,indoor,"natural_history_museum, museum/indoor, art_gallery, desert/sand, science_museum"
3515,84360,indoor,"museum/indoor, natural_history_museum, art_gallery, burial_chamber, science_museum"
3516,84384,indoor,"natural_history_museum, museum/indoor, science_museum, art_gallery, desert/sand"
3517,84408,indoor,"natural_history_museum, museum/indoor, art_gallery, science_museum, desert/sand"
3518,84432,indoor,"natural_history_museum, museum/indoor, desert/sand, burial_chamber, igloo"
3519,84456,indoor,"art_gallery, natural_history_museum, museum/indoor, science_museum, art_studio"
3520,84480,indoor,"art_gallery, natural_history_museum, museum/indoor, science_museum, art_studio"
3521,84504,indoor,"museum/indoor, natural_history_museum, art_gallery, science_museum, jewelry_shop"
3522,84528,indoor,"natural_history_museum, science_museum, museum/indoor, jewelry_shop, art_gallery"
3523,84552,indoor,"natural_history_museum, science_museum, museum/indoor, jewelry_shop, art_gallery"
3524,84576,indoor,"natural_history_museum, science_museum, museum/indoor, jewelry_shop, locker_room"
3525,84600,outdoor,"ice_shelf, drugstore, ice_floe, sky, pharmacy"
3526,84624,outdoor,"ice_shelf, drugstore, ice_floe, museum/indoor, sky"
3527,84648,outdoor,"ice_shelf, ice_floe, drugstore, sky, iceberg"
3528,84672,indoor,"ice_shelf, drugstore, ice_floe, pharmacy, museum/indoor"
3529,84696,outdoor,"ice_shelf, drugstore, ice_floe, sky, museum/indoor"
3530,84720,outdoor,"ice_shelf, sky, ice_floe, drugstore, iceberg"
3531,84744,outdoor,"ice_shelf, drugstore, ice_floe, sky, pharmacy"
3532,84768,indoor,"ice_shelf, drugstore, ice_floe, pharmacy, beauty_salon"
3533,84792,outdoor,"ice_shelf, drugstore, ice_floe, sky, museum/indoor"
3534,84816,indoor,"natural_history_museum, museum/indoor, science_museum, locker_room, jewelry_shop"
3535,84840,indoor,"museum/indoor, natural_history_museum, science_museum, locker_room, television_studio"
3536,84864,indoor,"museum/indoor, natural_history_museum, science_museum, jewelry_shop, archive"
3537,84888,indoor,"natural_history_museum, science_museum, museum/indoor, archive, television_studio"
3538,84912,outdoor,"ice_shelf, ice_floe, snowfield, drugstore, iceberg"
3539,84936,outdoor,"ice_shelf, ice_floe, snowfield, drugstore, museum/indoor"
3540,84960,outdoor,"ice_shelf, ice_floe, snowfield, drugstore, museum/indoor"
3541,84984,outdoor,"ice_shelf, ice_floe, snowfield, drugstore, museum/indoor"
3542,85008,indoor,"ice_shelf, museum/indoor, jewelry_shop, beauty_salon, science_museum"
3543,85032,indoor,"beauty_salon, kindergarden_classroom, drugstore, archive, science_museum"
3544,85056,indoor,"beauty_salon, drugstore, kindergarden_classroom, office_cubicles, booth/indoor"
3545,85080,indoor,"beauty_salon, kindergarden_classroom, drugstore, archive, office_cubicles"
3546,85104,indoor,"beauty_salon, kindergarden_classroom, archive, drugstore, jewelry_shop"
3547,85128,indoor,"beauty_salon, kindergarden_classroom, archive, drugstore, jewelry_shop"
3548,85152,indoor,"beauty_salon, kindergarden_classroom, archive, drugstore, science_museum"
3549,85176,indoor,"beauty_salon, kindergarden_classroom, drugstore, jewelry_shop, office_cubicles"
3550,85200,indoor,"beauty_salon, kindergarden_classroom, drugstore, archive, jewelry_shop"
3551,85224,indoor,"natural_history_museum, science_museum, museum/indoor, shoe_shop, art_gallery"
3552,85248,indoor,"natural_history_museum, science_museum, museum/indoor, television_studio, art_gallery"
3553,85272,indoor,"natural_history_museum, science_museum, museum/indoor, television_studio, music_studio"
3554,85296,indoor,"natural_history_museum, science_museum, canyon, desert/sand, museum/indoor"
3555,85320,outdoor,"desert/sand, canyon, science_museum, butte, natural_history_museum"
3556,85344,indoor,"canyon, natural_history_museum, museum/indoor, science_museum, desert/sand"
3557,85368,indoor,"natural_history_museum, museum/indoor, science_museum, canyon, desert/sand"
3558,85392,indoor,"locker_room, clean_room, museum/indoor, dressing_room, archive"
3559,85416,indoor,"museum/indoor, science_museum, natural_history_museum, locker_room, bank_vault"
3560,85440,indoor,"museum/indoor, science_museum, natural_history_museum, locker_room, bank_vault"
3561,85464,indoor,"museum/indoor, locker_room, science_museum, natural_history_museum, bank_vault"
3562,85488,indoor,"natural_history_museum, science_museum, museum/indoor, locker_room, clothing_store"
3563,85512,indoor,"natural_history_museum, canyon, museum/indoor, science_museum, butte"
3564,85536,outdoor,"canyon, museum/indoor, butte, natural_history_museum, rock_arch"
3565,85560,outdoor,"canyon, butte, museum/indoor, kasbah, natural_history_museum"
3566,85584,outdoor,"canyon, butte, natural_history_museum, museum/indoor, desert/sand"
3567,85608,indoor,"pharmacy, ice_shelf, museum/indoor, iceberg, drugstore"
3568,85632,indoor,"ice_shelf, museum/indoor, pharmacy, nursery, hospital"
3569,85656,indoor,"museum/indoor, ice_shelf, pharmacy, natural_history_museum, iceberg"
3570,85680,indoor,"museum/indoor, ice_shelf, pharmacy, natural_history_museum, nursery"
3571,85704,indoor,"ice_shelf, pharmacy, hospital, drugstore, museum/indoor"
3572,85728,indoor,"ice_shelf, museum/indoor, pharmacy, natural_history_museum, hospital"
3573,85752,indoor,"museum/indoor, ice_shelf, pharmacy, natural_history_museum, iceberg"
3574,85776,indoor,"ice_shelf, pharmacy, museum/indoor, hospital, drugstore"
3575,85800,outdoor,"canyon, butte, museum/indoor, kasbah, natural_history_museum"
3576,85824,outdoor,"canyon, butte, natural_history_museum, desert/sand, rock_arch"
3577,85848,outdoor,"canyon, museum/indoor, butte, natural_history_museum, rock_arch"
3578,85872,indoor,"canyon, natural_history_museum, museum/indoor, butte, science_museum"
3579,85896,outdoor,"canyon, butte, natural_history_museum, desert/sand, rock_arch"
3580,85920,outdoor,"canyon, museum/indoor, butte, natural_history_museum, kasbah"
3581,85944,indoor,"canyon, museum/indoor, natural_history_museum, science_museum, butte"
3582,85968,outdoor,"canyon, butte, museum/indoor, natural_history_museum, rock_arch"
3583,85992,outdoor,"ice_floe, marsh, pond, watering_hole, field/wild"
3584,86016,outdoor,"ice_floe, watering_hole, marsh, pond, lake/natural"
3585,86040,outdoor,"ice_floe, marsh, watering_hole, pond, lake/natural"
3586,86064,outdoor,"ice_floe, watering_hole, marsh, pond, lake/natural"
3587,86088,outdoor,"cemetery, archive, fountain, ice_shelf, museum/indoor"
3588,86112,outdoor,"shower, bamboo_forest, playground, fountain, cemetery"
3589,86136,outdoor,"shower, cemetery, fountain, playground, museum/indoor"
3590,86160,indoor,"museum/indoor, ice_shelf, pharmacy, reception, iceberg"
3591,86184,indoor,"museum/indoor, reception, ice_shelf, pharmacy, hospital"
3592,86208,indoor,"museum/indoor, reception, hospital, ice_shelf, pharmacy"
3593,86232,outdoor,"museum/indoor, ice_shelf, desert/sand, hospital, reception"
3594,86256,indoor,"museum/indoor, reception, hospital, ice_shelf, art_gallery"
3595,86280,indoor,"jewelry_shop, cemetery, clothing_store, gift_shop, orchard"
3596,86304,indoor,"jewelry_shop, gift_shop, cemetery, orchard, clothing_store"
3597,86328,indoor,"jewelry_shop, gift_shop, museum/indoor, natural_history_museum, clothing_store"
3598,86352,indoor,"jewelry_shop, orchard, cemetery, museum/indoor, clothing_store"
3599,86376,indoor,"jewelry_shop, gift_shop, cemetery, natural_history_museum, museum/indoor"
3600,86400,outdoor,"jewelry_shop, cemetery, pond, botanical_garden, orchard"
3601,86424,indoor,"jewelry_shop, cemetery, natural_history_museum, pond, museum/indoor"
3602,86448,outdoor,"cemetery, orchard, botanical_garden, museum/indoor, corn_field"
3603,86472,outdoor,"cemetery, jewelry_shop, museum/indoor, botanical_garden, orchard"
3604,86496,indoor,"jewelry_shop, clothing_store, cemetery, gift_shop, shoe_shop"
3605,86520,indoor,"kindergarden_classroom, booth/indoor, ice_cream_parlor, beauty_salon, office_cubicles"
3606,86544,indoor,"kindergarden_classroom, booth/indoor, ice_cream_parlor, beauty_salon, jewelry_shop"
3607,86568,indoor,"kindergarden_classroom, booth/indoor, ice_cream_parlor, beauty_salon, jewelry_shop"
3608,86592,indoor,"kindergarden_classroom, booth/indoor, ice_cream_parlor, beauty_salon, jewelry_shop"
3609,86616,indoor,"kindergarden_classroom, booth/indoor, ice_cream_parlor, beauty_salon, jewelry_shop"
3610,86640,indoor,"booth/indoor, kindergarden_classroom, ice_cream_parlor, beauty_salon, jewelry_shop"
3611,86664,indoor,"kindergarden_classroom, booth/indoor, ice_cream_parlor, beauty_salon, jewelry_shop"
3612,86688,indoor,"kindergarden_classroom, booth/indoor, ice_cream_parlor, beauty_salon, jewelry_shop"
3613,86712,indoor,"booth/indoor, kindergarden_classroom, ice_cream_parlor, beauty_salon, jewelry_shop"
3614,86736,indoor,"booth/indoor, kindergarden_classroom, ice_cream_parlor, beauty_salon, jewelry_shop"
3615,86760,indoor,"booth/indoor, kindergarden_classroom, ice_cream_parlor, beauty_salon, jewelry_shop"
3616,86784,indoor,"booth/indoor, kindergarden_classroom, beauty_salon, ice_cream_parlor, jewelry_shop"
3617,86808,outdoor,"orchard, cemetery, bamboo_forest, corn_field, botanical_garden"
3618,86832,outdoor,"cemetery, orchard, corn_field, botanical_garden, bamboo_forest"
3619,86856,outdoor,"orchard, cemetery, corn_field, botanical_garden, tree_farm"
3620,86880,outdoor,"orchard, cemetery, bamboo_forest, botanical_garden, corn_field"
3621,86904,outdoor,"cemetery, orchard, discotheque, campsite, ice_shelf"
3622,86928,indoor,"natural_history_museum, shower, museum/indoor, jewelry_shop, dressing_room"
3623,86952,indoor,"natural_history_museum, museum/indoor, nursery, kindergarden_classroom, chemistry_lab"
3624,86976,indoor,"dressing_room, nursery, kindergarden_classroom, art_studio, museum/indoor"
3625,87000,indoor,"natural_history_museum, museum/indoor, archive, chemistry_lab, science_museum"
3626,87024,indoor,"beauty_salon, archive, office_cubicles, museum/indoor, natural_history_museum"
3627,87048,indoor,"beauty_salon, archive, museum/indoor, natural_history_museum, jewelry_shop"
3628,87072,indoor,"beauty_salon, archive, museum/indoor, natural_history_museum, office_cubicles"
3629,87096,indoor,"beauty_salon, archive, museum/indoor, natural_history_museum, jewelry_shop"
3630,87120,indoor,"beauty_salon, archive, museum/indoor, natural_history_museum, jewelry_shop"
3631,87144,indoor,"beauty_salon, jewelry_shop, archive, museum/indoor, office_cubicles"
3632,87168,indoor,"beauty_salon, archive, office_cubicles, museum/indoor, jewelry_shop"
3633,87192,indoor,"beauty_salon, archive, museum/indoor, office_cubicles, natural_history_museum"
3634,87216,indoor,"beauty_salon, archive, jewelry_shop, museum/indoor, office_cubicles"
3635,87240,indoor,"beauty_salon, archive, jewelry_shop, office_cubicles, museum/indoor"
3636,87264,indoor,"beauty_salon, jewelry_shop, archive, museum/indoor, office_cubicles"
3637,87288,indoor,"beauty_salon, archive, jewelry_shop, office_cubicles, museum/indoor"
3638,87312,indoor,"natural_history_museum, museum/indoor, archive, science_museum, nursery"
3639,87336,indoor,"museum/indoor, natural_history_museum, archive, science_museum, kindergarden_classroom"
3640,87360,indoor,"chemistry_lab, biology_laboratory, dressing_room, clean_room, kindergarden_classroom"
3641,87384,outdoor,"orchard, cemetery, igloo, vineyard, tree_farm"
3642,87408,outdoor,"orchard, shower, cemetery, bamboo_forest, discotheque"
3643,87432,outdoor,"cemetery, orchard, forest/broadleaf, corn_field, archive"
3644,87456,outdoor,"corn_field, bamboo_forest, orchard, cemetery, botanical_garden"
3645,87480,outdoor,"ice_shelf, desert/sand, iceberg, art_gallery, reception"
3646,87504,outdoor,"ice_shelf, iceberg, art_gallery, desert/sand, reception"
3647,87528,outdoor,"ice_shelf, reception, iceberg, art_gallery, desert/sand"
3648,87552,outdoor,"orchard, bamboo_forest, corn_field, tree_farm, botanical_garden"
3649,87576,outdoor,"orchard, botanical_garden, corn_field, field/wild, tree_farm"
3650,87600,outdoor,"bamboo_forest, orchard, corn_field, botanical_garden, park"
3651,87624,outdoor,"orchard, corn_field, yard, bamboo_forest, tree_farm"
3652,87648,outdoor,"orchard, bamboo_forest, botanical_garden, tree_farm, forest_path"
3653,87672,indoor,"hospital, pharmacy, museum/indoor, reception, ice_shelf"
3654,87696,indoor,"hospital, museum/indoor, reception, ice_shelf, pharmacy"
3655,87720,indoor,"hospital, museum/indoor, reception, pharmacy, ice_shelf"
3656,87744,indoor,"hospital, museum/indoor, pharmacy, reception, ice_shelf"
3657,87768,outdoor,"orchard, cemetery, forest/broadleaf, bamboo_forest, tree_farm"
3658,87792,outdoor,"orchard, cemetery, bamboo_forest, forest/broadleaf, botanical_garden"
3659,87816,outdoor,"orchard, botanical_garden, bamboo_forest, corn_field, tree_farm"
3660,87840,outdoor,"orchard, corn_field, botanical_garden, jewelry_shop, cemetery"
3661,87864,indoor,"jewelry_shop, corn_field, orchard, bar, discotheque"
3662,87888,indoor,"jewelry_shop, clothing_store, cemetery, gift_shop, discotheque"
3663,87912,outdoor,"cemetery, corn_field, jewelry_shop, orchard, botanical_garden"
3664,87936,outdoor,"jewelry_shop, cemetery, clothing_store, corn_field, orchard"
3665,87960,indoor,"jewelry_shop, cemetery, discotheque, clothing_store, corn_field"
3666,87984,outdoor,"cemetery, corn_field, jewelry_shop, botanical_garden, clothing_store"
3667,88008,indoor,"corn_field, bamboo_forest, discotheque, clothing_store, shower"
3668,88032,indoor,"discotheque, shower, dressing_room, bar, chemistry_lab"
3669,88056,indoor,"shower, discotheque, chemistry_lab, jewelry_shop, bathroom"
3670,88080,indoor,"shower, bathroom, clean_room, museum/indoor, bar"
3671,88104,outdoor,"ice_shelf, museum/indoor, iceberg, hot_spring, hospital"
3672,88128,outdoor,"ice_shelf, museum/indoor, iceberg, hot_spring, natural_history_museum"
3673,88152,outdoor,"ice_shelf, museum/indoor, iceberg, hot_spring, natural_history_museum"
3674,88176,outdoor,"ice_shelf, museum/indoor, iceberg, hot_spring, art_gallery"
3675,88200,outdoor,"ice_shelf, museum/indoor, hot_spring, iceberg, natural_history_museum"
3676,88224,outdoor,"ice_shelf, museum/indoor, iceberg, hot_spring, natural_history_museum"
3677,88248,outdoor,"ice_shelf, museum/indoor, iceberg, hot_spring, natural_history_museum"
3678,88272,indoor,"discotheque, shower, dressing_room, bar, escalator/indoor"
3679,88296,indoor,"discotheque, shower, dressing_room, chemistry_lab, staircase"
3680,88320,indoor,"discotheque, bar, dressing_room, shower, staircase"
3681,88344,indoor,"discotheque, shower, staircase, dressing_room, bar"
3682,88368,indoor,"shower, staircase, dressing_room, museum/indoor, clean_room"
3683,88392,indoor,"clean_room, chemistry_lab, biology_laboratory, dressing_room, discotheque"
3684,88416,indoor,"staircase, discotheque, escalator/indoor, chemistry_lab, dressing_room"
3685,88440,indoor,"discotheque, shower, dressing_room, staircase, escalator/indoor"
3686,88464,indoor,"escalator/indoor, discotheque, staircase, shower, music_studio"
3687,88488,indoor,"shower, chemistry_lab, discotheque, biology_laboratory, dressing_room"
3688,88512,indoor,"dressing_room, chemistry_lab, discotheque, biology_laboratory, jewelry_shop"
3689,88536,outdoor,"ice_floe, ice_shelf, snowfield, ski_slope, desert/sand"
3690,88560,outdoor,"ice_floe, ice_shelf, snowfield, ski_slope, desert/sand"
3691,88584,outdoor,"ice_floe, ice_shelf, igloo, desert/sand, iceberg"
3692,88608,outdoor,"ice_floe, ice_shelf, desert/sand, snowfield, igloo"
3693,88632,outdoor,"ice_floe, ice_shelf, snowfield, ski_slope, beach"
3694,88656,outdoor,"ice_floe, beach, ocean, ice_shelf, coast"
3695,88680,outdoor,"ice_floe, beach, ice_shelf, desert/sand, snowfield"
3696,88704,outdoor,"ice_floe, ice_shelf, beach, desert/sand, pond"
3697,88728,outdoor,"ice_floe, ice_shelf, desert/sand, snowfield, beach"
3698,88752,indoor,"dining_hall, cafeteria, banquet_hall, restaurant, classroom"
3699,88776,indoor,"banquet_hall, dining_hall, jewelry_shop, cafeteria, restaurant"
3700,88800,indoor,"dining_hall, banquet_hall, restaurant, cafeteria, dining_room"
3701,88824,indoor,"cafeteria, dining_hall, restaurant, dining_room, banquet_hall"
3702,88848,indoor,"dining_hall, restaurant, banquet_hall, classroom, cafeteria"
3703,88872,indoor,"classroom, cafeteria, dining_hall, food_court, restaurant"
3704,88896,indoor,"dining_hall, cafeteria, restaurant, banquet_hall, food_court"
3705,88920,outdoor,"butte, kasbah, canyon, desert/sand, mountain"
3706,88944,outdoor,"canyon, butte, kasbah, desert/sand, mountain"
3707,88968,outdoor,"canyon, butte, desert/sand, mountain, rock_arch"
3708,88992,outdoor,"canyon, butte, desert/sand, rock_arch, mountain"
3709,89016,outdoor,"canyon, butte, desert/sand, mountain, kasbah"
3710,89040,outdoor,"canyon, butte, desert/sand, mountain, rock_arch"
3711,89064,outdoor,"canyon, butte, desert/sand, kasbah, mountain"
3712,89088,indoor,"reception, museum/indoor, hospital, nursery, pharmacy"
3713,89112,indoor,"reception, museum/indoor, pharmacy, nursery, hospital"
3714,89136,indoor,"hospital, reception, nursery, museum/indoor, pharmacy"
3715,89160,indoor,"museum/indoor, reception, hospital, nursery, pharmacy"
3716,89184,indoor,"hospital, reception, museum/indoor, nursery, pharmacy"
3717,89208,indoor,"discotheque, childs_room, playroom, nursery, stage/indoor"
3718,89232,outdoor,"canyon, butte, desert/sand, rock_arch, mountain"
3719,89256,outdoor,"kasbah, butte, canyon, desert/sand, mountain"
3720,89280,outdoor,"desert/sand, canyon, kasbah, butte, mountain"
3721,89304,outdoor,"canyon, desert/sand, butte, kasbah, rock_arch"
3722,89328,outdoor,"canyon, butte, rock_arch, desert/sand, mountain"
3723,89352,outdoor,"desert/sand, canyon, natural_history_museum, butte, rock_arch"
3724,89376,outdoor,"desert/sand, butte, canyon, kasbah, rock_arch"
3725,89400,outdoor,"shower, natural_history_museum, botanical_garden, fountain, playground"
3726,89424,outdoor,"pond, fishpond, lake/natural, natural_history_museum, marsh"
3727,89448,indoor,"museum/indoor, ice_shelf, natural_history_museum, jewelry_shop, pond"
3728,89472,indoor,"museum/indoor, gift_shop, nursery, art_gallery, natural_history_museum"
3729,89496,indoor,"museum/indoor, nursery, gift_shop, natural_history_museum, art_gallery"
3730,89520,indoor,"museum/indoor, nursery, gift_shop, art_gallery, ice_shelf"
3731,89544,indoor,"museum/indoor, nursery, gift_shop, art_gallery, natural_history_museum"
3732,89568,indoor,"museum/indoor, nursery, gift_shop, ice_shelf, natural_history_museum"
3733,89592,indoor,"museum/indoor, nursery, gift_shop, art_gallery, natural_history_museum"
3734,89616,indoor,"museum/indoor, gift_shop, nursery, art_gallery, natural_history_museum"
3735,89640,indoor,"museum/indoor, nursery, gift_shop, bakery/shop, natural_history_museum"
3736,89664,indoor,"museum/indoor, nursery, gift_shop, art_gallery, jewelry_shop"
3737,89688,outdoor,"pond, lake/natural, ice_floe, fishpond, ice_shelf"
3738,89712,outdoor,"fountain, pond, shower, lake/natural, botanical_garden"
3739,89736,outdoor,"shower, rope_bridge, jewelry_shop, botanical_garden, forest/broadleaf"
3740,89760,outdoor,"bow_window/indoor, mausoleum, museum/indoor, cemetery, fountain"
3741,89784,indoor,"bow_window/indoor, mausoleum, nursery, museum/indoor, cemetery"
3742,89808,indoor,"porch, bow_window/indoor, doorway/outdoor, nursery, clean_room"
3743,89832,indoor,"clean_room, bow_window/indoor, archive, museum/indoor, office"
3744,89856,indoor,"museum/indoor, archive, clean_room, bow_window/indoor, dining_room"
3745,89880,indoor,"bow_window/indoor, clean_room, banquet_hall, nursery, entrance_hall"
3746,89904,outdoor,"music_studio, orchard, playground, schoolhouse, yard"
3747,89928,outdoor,"playground, music_studio, cemetery, orchard, archive"
3748,89952,outdoor,"playground, orchard, music_studio, cemetery, yard"
3749,89976,outdoor,"playground, music_studio, cemetery, orchard, ice_shelf"
3750,90000,outdoor,"playground, cemetery, orchard, music_studio, yard"
3751,90024,outdoor,"playground, cemetery, orchard, music_studio, yard"
3752,90048,outdoor,"playground, music_studio, cemetery, orchard, archive"
3753,90072,outdoor,"music_studio, playground, orchard, cemetery, archive"
3754,90096,outdoor,"playground, music_studio, orchard, cemetery, archive"
3755,90120,indoor,"patio, restaurant, dining_room, picnic_area, coffee_shop"
3756,90144,outdoor,"ice_shelf, ocean, ice_floe, fountain, orchard"
3757,90168,outdoor,"ice_shelf, ice_floe, fountain, orchard, corn_field"
3758,90192,outdoor,"ice_shelf, ice_floe, orchard, fountain, shower"
3759,90216,outdoor,"jewelry_shop, corn_field, forest/broadleaf, cemetery, ice_shelf"
3760,90240,outdoor,"jewelry_shop, cemetery, corn_field, bamboo_forest, banquet_hall"
3761,90264,outdoor,"orchard, shower, ice_shelf, fountain, tree_farm"
3762,90288,outdoor,"orchard, ice_shelf, shower, fountain, tree_farm"
3763,90312,outdoor,"orchard, tree_farm, vineyard, botanical_garden, corn_field"
3764,90336,outdoor,"orchard, tree_farm, vineyard, botanical_garden, fountain"
