,frame_num,environment,places
0,0,indoor,"natural_history_museum, museum/indoor, hospital, hospital_room, drugstore"
1,24,indoor,"natural_history_museum, museum/indoor, drugstore, hospital, pharmacy"
2,48,indoor,"natural_history_museum, museum/indoor, drugstore, hospital_room, hospital"
3,72,indoor,"natural_history_museum, museum/indoor, drugstore, hospital, hospital_room"
4,96,indoor,"natural_history_museum, museum/indoor, hospital_room, hospital, drugstore"
5,120,indoor,"natural_history_museum, museum/indoor, drugstore, hospital_room, hospital"
6,144,indoor,"natural_history_museum, museum/indoor, hospital_room, drugstore, hospital"
7,168,indoor,"natural_history_museum, museum/indoor, hospital_room, drugstore, hospital"
8,192,indoor,"hospital, hospital_room, pharmacy, drugstore, museum/indoor"
9,216,indoor,"hospital, reception, pharmacy, hospital_room, drugstore"
10,240,indoor,"hospital, reception, pharmacy, hospital_room, drugstore"
11,264,indoor,"hospital, pharmacy, reception, hospital_room, drugstore"
12,288,indoor,"hospital, pharmacy, reception, hospital_room, drugstore"
13,312,indoor,"hospital, drugstore, pharmacy, parking_lot, airport_terminal"
14,336,indoor,"hospital, drugstore, airport_terminal, parking_lot, pharmacy"
15,360,outdoor,"hospital, parking_lot, pharmacy, gas_station, motel"
16,384,outdoor,"hospital, pharmacy, industrial_area, drugstore, parking_lot"
17,408,outdoor,"hospital, gas_station, industrial_area, motel, pharmacy"
18,432,outdoor,"hospital, motel, gas_station, pharmacy, industrial_area"
19,456,outdoor,"hospital, gas_station, motel, pharmacy, industrial_area"
20,480,indoor,"hospital, pharmacy, hospital_room, drugstore, motel"
21,504,indoor,"hospital, pharmacy, hospital_room, drugstore, motel"
22,528,indoor,"hospital, pharmacy, hospital_room, drugstore, motel"
23,552,indoor,"hospital, pharmacy, hospital_room, drugstore, motel"
24,576,indoor,"hospital, pharmacy, hospital_room, drugstore, motel"
25,600,indoor,"hospital, pharmacy, hospital_room, drugstore, motel"
26,624,indoor,"hospital, pharmacy, hospital_room, drugstore, motel"
27,648,indoor,"hospital, pharmacy, hospital_room, drugstore, motel"
28,672,indoor,"hospital, pharmacy, hospital_room, drugstore, beauty_salon"
29,696,indoor,"hospital, pharmacy, hospital_room, drugstore, beauty_salon"
30,720,indoor,"hospital, pharmacy, hospital_room, drugstore, beauty_salon"
31,744,indoor,"hospital, pharmacy, hospital_room, drugstore, beauty_salon"
32,768,indoor,"hospital, pharmacy, hospital_room, drugstore, motel"
33,792,indoor,"hospital, pharmacy, hospital_room, drugstore, motel"
34,816,indoor,"hospital, pharmacy, hospital_room, drugstore, motel"
35,840,indoor,"hospital, pharmacy, hospital_room, drugstore, motel"
36,864,indoor,"hospital, pharmacy, hospital_room, drugstore, motel"
37,888,indoor,"hospital, pharmacy, hospital_room, motel, drugstore"
38,912,indoor,"hospital, pharmacy, hospital_room, drugstore, motel"
39,936,indoor,"hospital, pharmacy, hospital_room, drugstore, motel"
40,960,indoor,"hospital, pharmacy, hospital_room, drugstore, beauty_salon"
41,984,indoor,"hospital, pharmacy, hospital_room, drugstore, beauty_salon"
42,1008,indoor,"hospital, pharmacy, hospital_room, drugstore, motel"
43,1032,indoor,"hospital, pharmacy, hospital_room, motel, drugstore"
44,1056,indoor,"hospital, pharmacy, hospital_room, drugstore, motel"
45,1080,indoor,"hospital, pharmacy, hospital_room, drugstore, motel"
46,1104,indoor,"hospital, pharmacy, hospital_room, motel, drugstore"
47,1128,indoor,"hospital, pharmacy, drugstore, hospital_room, gas_station"
48,1152,indoor,"hospital, pharmacy, drugstore, hospital_room, gas_station"
49,1176,indoor,"hospital, pharmacy, drugstore, hospital_room, parking_lot"
50,1200,indoor,"hospital, pharmacy, drugstore, hospital_room, gas_station"
51,1224,indoor,"hospital, pharmacy, hospital_room, drugstore, beauty_salon"
52,1248,indoor,"hospital, pharmacy, hospital_room, drugstore, beauty_salon"
53,1272,indoor,"hospital, pharmacy, hospital_room, drugstore, beauty_salon"
54,1296,indoor,"hospital, pharmacy, hospital_room, drugstore, motel"
55,1320,indoor,"hospital, pharmacy, hospital_room, drugstore, beauty_salon"
56,1344,outdoor,"corn_field, orchard, wheat_field, tree_farm, desert/sand"
57,1368,indoor,"museum/indoor, science_museum, natural_history_museum, jewelry_shop, clothing_store"
58,1392,indoor,"jewelry_shop, museum/indoor, science_museum, clothing_store, clean_room"
59,1416,indoor,"jewelry_shop, physics_laboratory, museum/indoor, clean_room, science_museum"
60,1440,indoor,"jewelry_shop, clothing_store, clean_room, music_studio, dressing_room"
61,1464,indoor,"jewelry_shop, clothing_store, music_studio, museum/indoor, science_museum"
62,1488,indoor,"shower, dressing_room, clean_room, locker_room, corridor"
63,1512,indoor,"jewelry_shop, museum/indoor, natural_history_museum, science_museum, dressing_room"
64,1536,indoor,"barndoor, sky, elevator/door, locker_room, jail_cell"
65,1560,outdoor,"jewelry_shop, corn_field, museum/indoor, orchard, forest/broadleaf"
66,1584,outdoor,"jewelry_shop, orchard, corn_field, forest/broadleaf, yard"
67,1608,indoor,"jewelry_shop, museum/indoor, corn_field, gift_shop, orchard"
68,1632,indoor,"jewelry_shop, museum/indoor, corn_field, orchard, natural_history_museum"
69,1656,indoor,"natural_history_museum, science_museum, museum/indoor, ice_shelf, nursery"
70,1680,indoor,"museum/indoor, natural_history_museum, science_museum, ice_shelf, nursery"
71,1704,indoor,"ice_shelf, museum/indoor, science_museum, natural_history_museum, ice_floe"
72,1728,indoor,"ice_shelf, museum/indoor, natural_history_museum, ice_floe, science_museum"
73,1752,indoor,"natural_history_museum, science_museum, ice_shelf, museum/indoor, ice_floe"
74,1776,outdoor,"ice_shelf, natural_history_museum, ice_floe, museum/indoor, iceberg"
75,1800,outdoor,"ice_shelf, ice_floe, museum/indoor, science_museum, iceberg"
76,1824,indoor,"ice_shelf, natural_history_museum, museum/indoor, science_museum, ice_floe"
77,1848,indoor,"natural_history_museum, ice_shelf, science_museum, museum/indoor, ice_floe"
78,1872,outdoor,"shower, bamboo_forest, rice_paddy, slum, corn_field"
79,1896,indoor,"shower, music_studio, discotheque, dressing_room, bathroom"
80,1920,indoor,"shower, corn_field, wheat_field, art_studio, art_gallery"
81,1944,indoor,"natural_history_museum, museum/indoor, corn_field, shower, wheat_field"
82,1968,indoor,"shower, corn_field, wheat_field, art_gallery, natural_history_museum"
83,1992,indoor,"science_museum, bakery/shop, natural_history_museum, sushi_bar, pond"
84,2016,outdoor,"science_museum, skyscraper, natural_history_museum, tower, downtown"
85,2040,indoor,"science_museum, tower, skyscraper, natural_history_museum, chemistry_lab"
86,2064,outdoor,"tower, science_museum, skyscraper, natural_history_museum, harbor"
87,2088,indoor,"science_museum, natural_history_museum, tower, skyscraper, museum/indoor"
88,2112,outdoor,"ice_shelf, ice_floe, iceberg, museum/indoor, igloo"
89,2136,indoor,"ice_shelf, natural_history_museum, ice_floe, museum/indoor, science_museum"
90,2160,indoor,"ice_shelf, ice_floe, natural_history_museum, museum/indoor, science_museum"
91,2184,outdoor,"ice_shelf, ice_floe, museum/indoor, natural_history_museum, iceberg"
92,2208,outdoor,"ice_shelf, ice_floe, iceberg, natural_history_museum, museum/indoor"
93,2232,indoor,"ice_shelf, natural_history_museum, ice_floe, museum/indoor, science_museum"
94,2256,outdoor,"ice_shelf, ice_floe, museum/indoor, iceberg, igloo"
95,2280,indoor,"ice_shelf, ice_floe, museum/indoor, natural_history_museum, science_museum"
96,2304,outdoor,"ice_shelf, ice_floe, iceberg, natural_history_museum, igloo"
97,2328,outdoor,"ice_shelf, ice_floe, iceberg, igloo, museum/indoor"
98,2352,outdoor,"ice_shelf, ice_floe, iceberg, natural_history_museum, museum/indoor"
99,2376,outdoor,"ice_shelf, ice_floe, iceberg, natural_history_museum, museum/indoor"
100,2400,outdoor,"orchard, botanical_garden, museum/indoor, nursery, ice_shelf"
101,2424,indoor,"orchard, botanical_garden, nursery, museum/indoor, jewelry_shop"
102,2448,outdoor,"botanical_garden, orchard, corn_field, museum/indoor, playground"
103,2472,outdoor,"corn_field, orchard, museum/indoor, botanical_garden, nursery"
104,2496,outdoor,"orchard, corn_field, museum/indoor, botanical_garden, wheat_field"
105,2520,indoor,"orchard, museum/indoor, botanical_garden, jewelry_shop, nursery"
106,2544,indoor,"art_gallery, museum/indoor, science_museum, natural_history_museum, art_studio"
107,2568,indoor,"museum/indoor, art_gallery, science_museum, natural_history_museum, clean_room"
108,2592,indoor,"art_gallery, museum/indoor, science_museum, clean_room, natural_history_museum"
109,2616,indoor,"museum/indoor, art_gallery, science_museum, clean_room, natural_history_museum"
110,2640,indoor,"museum/indoor, art_gallery, science_museum, natural_history_museum, reception"
111,2664,indoor,"bedroom, fabric_store, nursery, bow_window/indoor, living_room"
112,2688,indoor,"fabric_store, bow_window/indoor, bedroom, living_room, childs_room"
113,2712,indoor,"fabric_store, nursery, bedroom, jewelry_shop, ice_floe"
114,2736,indoor,"fabric_store, bow_window/indoor, nursery, bedroom, living_room"
115,2760,indoor,"bow_window/indoor, fabric_store, jewelry_shop, nursery, living_room"
116,2784,outdoor,"jewelry_shop, corn_field, bamboo_forest, clothing_store, wheat_field"
117,2808,outdoor,"lake/natural, pond, swamp, museum/indoor, pier"
118,2832,indoor,"jewelry_shop, clothing_store, shower, ice_shelf, dressing_room"
119,2856,outdoor,"pond, lake/natural, bamboo_forest, ice_floe, ice_shelf"
120,2880,indoor,"ice_shelf, iceberg, museum/indoor, natural_history_museum, science_museum"
121,2904,outdoor,"iceberg, ice_shelf, natural_history_museum, ice_floe, science_museum"
122,2928,outdoor,"ice_shelf, iceberg, natural_history_museum, ice_floe, science_museum"
123,2952,outdoor,"natural_history_museum, ice_shelf, iceberg, science_museum, ice_floe"
124,2976,indoor,"natural_history_museum, ice_shelf, science_museum, iceberg, museum/indoor"
125,3000,outdoor,"ice_shelf, iceberg, ice_floe, natural_history_museum, nursery"
126,3024,outdoor,"natural_history_museum, ice_shelf, iceberg, science_museum, ice_floe"
127,3048,indoor,"natural_history_museum, science_museum, museum/indoor, ice_shelf, nursery"
128,3072,outdoor,"ice_shelf, iceberg, natural_history_museum, ice_floe, science_museum"
129,3096,outdoor,"ice_shelf, iceberg, ice_floe, natural_history_museum, drugstore"
130,3120,outdoor,"ice_shelf, natural_history_museum, iceberg, science_museum, ice_floe"
131,3144,outdoor,"cemetery, museum/indoor, ice_shelf, park, botanical_garden"
132,3168,outdoor,"ice_shelf, cemetery, ice_floe, museum/indoor, botanical_garden"
133,3192,indoor,"museum/indoor, natural_history_museum, cemetery, botanical_garden, ballroom"
134,3216,indoor,"museum/indoor, natural_history_museum, botanical_garden, science_museum, ice_shelf"
135,3240,indoor,"science_museum, natural_history_museum, lake/natural, pond, aquarium"
136,3264,indoor,"science_museum, natural_history_museum, clean_room, runway, chemistry_lab"
137,3288,outdoor,"pond, pier, lake/natural, harbor, science_museum"
138,3312,outdoor,"ice_shelf, ice_floe, ocean, corn_field, lake/natural"
139,3336,outdoor,"ice_floe, ice_shelf, corn_field, rice_paddy, archive"
140,3360,outdoor,"ice_floe, ice_shelf, rice_paddy, corn_field, archive"
141,3384,outdoor,"rice_paddy, corn_field, ice_floe, field/cultivated, ice_shelf"
142,3408,outdoor,"ice_shelf, ice_floe, pond, corn_field, lake/natural"
143,3432,outdoor,"corn_field, orchard, field/cultivated, ice_floe, botanical_garden"
144,3456,outdoor,"corn_field, ice_shelf, field/cultivated, orchard, rice_paddy"
145,3480,outdoor,"corn_field, orchard, rice_paddy, field/cultivated, wheat_field"
146,3504,outdoor,"corn_field, ice_shelf, orchard, rice_paddy, pond"
147,3528,outdoor,"corn_field, orchard, ice_shelf, pond, lake/natural"
148,3552,indoor,"science_museum, museum/indoor, natural_history_museum, archive, drugstore"
149,3576,indoor,"science_museum, archive, museum/indoor, natural_history_museum, cemetery"
150,3600,indoor,"science_museum, museum/indoor, natural_history_museum, archive, drugstore"
151,3624,indoor,"science_museum, archive, museum/indoor, natural_history_museum, drugstore"
152,3648,indoor,"science_museum, archive, natural_history_museum, museum/indoor, drugstore"
153,3672,indoor,"science_museum, archive, natural_history_museum, museum/indoor, drugstore"
154,3696,indoor,"science_museum, archive, natural_history_museum, museum/indoor, drugstore"
155,3720,indoor,"science_museum, archive, museum/indoor, natural_history_museum, drugstore"
156,3744,indoor,"science_museum, archive, museum/indoor, natural_history_museum, drugstore"
157,3768,indoor,"science_museum, museum/indoor, natural_history_museum, archive, drugstore"
158,3792,indoor,"science_museum, archive, museum/indoor, natural_history_museum, drugstore"
159,3816,indoor,"science_museum, archive, natural_history_museum, museum/indoor, cemetery"
160,3840,indoor,"science_museum, natural_history_museum, museum/indoor, archive, drugstore"
161,3864,indoor,"science_museum, archive, natural_history_museum, museum/indoor, booth/indoor"
162,3888,indoor,"science_museum, natural_history_museum, museum/indoor, archive, drugstore"
163,3912,indoor,"science_museum, natural_history_museum, archive, museum/indoor, drugstore"
164,3936,outdoor,"corn_field, wheat_field, orchard, field/wild, rice_paddy"
165,3960,outdoor,"corn_field, wheat_field, orchard, rice_paddy, field/wild"
166,3984,outdoor,"corn_field, wheat_field, orchard, field/cultivated, field/wild"
167,4008,indoor,"natural_history_museum, museum/indoor, science_museum, art_gallery, archive"
168,4032,indoor,"museum/indoor, natural_history_museum, science_museum, art_gallery, archive"
169,4056,indoor,"nursery, museum/indoor, clean_room, dressing_room, jewelry_shop"
170,4080,indoor,"art_gallery, museum/indoor, jewelry_shop, science_museum, art_studio"
171,4104,indoor,"museum/indoor, art_gallery, science_museum, clean_room, art_studio"
172,4128,outdoor,"corn_field, wheat_field, orchard, field/wild, rice_paddy"
173,4152,outdoor,"corn_field, wheat_field, orchard, field/wild, field/cultivated"
174,4176,outdoor,"corn_field, wheat_field, orchard, field/wild, field/cultivated"
175,4200,outdoor,"corn_field, wheat_field, field/wild, orchard, field/cultivated"
176,4224,indoor,"dining_room, museum/indoor, banquet_hall, patio, dining_hall"
177,4248,indoor,"banquet_hall, dining_room, museum/indoor, dining_hall, patio"
178,4272,indoor,"patio, museum/indoor, dining_room, banquet_hall, dining_hall"
179,4296,indoor,"museum/indoor, banquet_hall, dining_room, dining_hall, patio"
180,4320,indoor,"museum/indoor, natural_history_museum, cemetery, patio, banquet_hall"
181,4344,indoor,"natural_history_museum, art_gallery, science_museum, museum/indoor, childs_room"
182,4368,indoor,"science_museum, natural_history_museum, art_gallery, museum/indoor, art_studio"
183,4392,indoor,"science_museum, natural_history_museum, art_gallery, museum/indoor, art_studio"
184,4416,indoor,"patio, banquet_hall, dining_hall, museum/indoor, dining_room"
185,4440,indoor,"patio, banquet_hall, museum/indoor, dining_hall, pavilion"
186,4464,outdoor,"orchard, corn_field, archive, ice_shelf, ice_floe"
187,4488,outdoor,"ice_shelf, museum/indoor, ice_floe, fountain, banquet_hall"
188,4512,indoor,"museum/indoor, shower, banquet_hall, gift_shop, jewelry_shop"
189,4536,indoor,"museum/indoor, orchard, cemetery, banquet_hall, shower"
190,4560,indoor,"ice_shelf, ice_floe, archive, banquet_hall, dining_room"
191,4584,outdoor,"patio, porch, banquet_hall, dining_room, balcony/interior"
192,4608,indoor,"patio, porch, banquet_hall, museum/indoor, ballroom"
193,4632,indoor,"chemistry_lab, discotheque, natural_history_museum, gift_shop, jewelry_shop"
194,4656,indoor,"discotheque, natural_history_museum, aquarium, museum/indoor, jewelry_shop"
195,4680,indoor,"aquarium, discotheque, pond, lake/natural, natural_history_museum"
196,4704,indoor,"natural_history_museum, aquarium, museum/indoor, gift_shop, underwater/ocean_deep"
197,4728,indoor,"dressing_room, discotheque, shower, lake/natural, pond"
198,4752,outdoor,"shower, lake/natural, pond, fishpond, swamp"
199,4776,outdoor,"lake/natural, pond, shower, fishpond, marsh"
200,4800,indoor,"shower, jewelry_shop, bathroom, dressing_room, chemistry_lab"
201,4824,outdoor,"lake/natural, pond, shower, fishpond, rainforest"
202,4848,outdoor,"lake/natural, fishpond, pond, marsh, swamp"
203,4872,outdoor,"lake/natural, pond, fishpond, marsh, swamp"
204,4896,indoor,"aquarium, shower, natural_history_museum, fishpond, underwater/ocean_deep"
205,4920,outdoor,"aquarium, fishpond, pond, underwater/ocean_deep, lake/natural"
206,4944,outdoor,"fishpond, aquarium, pond, underwater/ocean_deep, lake/natural"
207,4968,outdoor,"fishpond, pond, aquarium, lake/natural, marsh"
208,4992,outdoor,"fishpond, pond, aquarium, lake/natural, underwater/ocean_deep"
209,5016,indoor,"nursery, church/indoor, mausoleum, jail_cell, entrance_hall"
210,5040,indoor,"nursery, entrance_hall, doorway/outdoor, church/indoor, porch"
211,5064,indoor,"nursery, archive, entrance_hall, clean_room, bank_vault"
212,5088,indoor,"nursery, clean_room, bank_vault, entrance_hall, jail_cell"
213,5112,indoor,"nursery, entrance_hall, staircase, mausoleum, porch"
214,5136,outdoor,"ice_floe, corn_field, ice_shelf, wheat_field, rice_paddy"
215,5160,outdoor,"ice_floe, marsh, lake/natural, pond, ice_shelf"
216,5184,outdoor,"ice_floe, ice_shelf, pond, lake/natural, marsh"
217,5208,outdoor,"ice_floe, ice_shelf, wheat_field, ocean, corn_field"
218,5232,outdoor,"ice_floe, ice_shelf, wheat_field, corn_field, iceberg"
219,5256,outdoor,"ice_floe, ice_shelf, iceberg, wheat_field, corn_field"
220,5280,outdoor,"wheat_field, corn_field, ice_floe, marsh, rice_paddy"
221,5304,outdoor,"corn_field, ice_floe, wheat_field, ice_shelf, iceberg"
222,5328,outdoor,"corn_field, wheat_field, ice_floe, marsh, rice_paddy"
223,5352,outdoor,"corn_field, wheat_field, rice_paddy, field/cultivated, ice_floe"
224,5376,outdoor,"ice_floe, marsh, wheat_field, museum/indoor, lake/natural"
225,5400,outdoor,"wheat_field, rice_paddy, corn_field, marsh, ice_floe"
226,5424,outdoor,"corn_field, wheat_field, rice_paddy, museum/indoor, marsh"
227,5448,indoor,"pavilion, greenhouse/indoor, gazebo/exterior, bow_window/indoor, banquet_hall"
228,5472,outdoor,"pavilion, gazebo/exterior, picnic_area, greenhouse/indoor, banquet_hall"
229,5496,outdoor,"pavilion, gazebo/exterior, picnic_area, greenhouse/indoor, banquet_hall"
230,5520,outdoor,"pavilion, picnic_area, gazebo/exterior, beer_garden, cemetery"
231,5544,outdoor,"cemetery, pavilion, harbor, plaza, bridge"
232,5568,outdoor,"cemetery, plaza, harbor, beer_garden, courtyard"
233,5592,outdoor,"skyscraper, lake/natural, tower, ocean, coast"
234,5616,indoor,"science_museum, art_gallery, aquarium, natural_history_museum, shower"
235,5640,indoor,"art_gallery, natural_history_museum, science_museum, lake/natural, ocean"
236,5664,outdoor,"tower, skyscraper, lake/natural, harbor, oilrig"
237,5688,outdoor,"swimming_pool/indoor, canal/urban, lake/natural, harbor, pier"
238,5712,indoor,"playground, staircase, jail_cell, corridor, server_room"
239,5736,outdoor,"playground, locker_room, alley, pier, nursery"
240,5760,outdoor,"patio, balcony/interior, playground, shower, porch"
241,5784,outdoor,"porch, balcony/interior, patio, bow_window/indoor, doorway/outdoor"
242,5808,indoor,"jewelry_shop, science_museum, drugstore, museum/indoor, archive"
243,5832,indoor,"beauty_salon, drugstore, science_museum, booth/indoor, archive"
244,5856,indoor,"science_museum, archive, beauty_salon, drugstore, office_cubicles"
245,5880,indoor,"science_museum, archive, drugstore, beauty_salon, museum/indoor"
246,5904,indoor,"science_museum, drugstore, archive, booth/indoor, museum/indoor"
247,5928,indoor,"science_museum, archive, beauty_salon, drugstore, booth/indoor"
248,5952,indoor,"science_museum, archive, drugstore, booth/indoor, museum/indoor"
249,5976,indoor,"science_museum, archive, jewelry_shop, beauty_salon, museum/indoor"
250,6000,indoor,"science_museum, archive, drugstore, beauty_salon, museum/indoor"
251,6024,indoor,"science_museum, archive, drugstore, jewelry_shop, booth/indoor"
252,6048,indoor,"archive, science_museum, booth/indoor, office_cubicles, jewelry_shop"
253,6072,indoor,"booth/indoor, science_museum, archive, drugstore, jewelry_shop"
254,6096,indoor,"science_museum, beauty_salon, drugstore, archive, museum/indoor"
255,6120,indoor,"science_museum, archive, beauty_salon, drugstore, jewelry_shop"
256,6144,outdoor,"bamboo_forest, wheat_field, corn_field, rice_paddy, forest/broadleaf"
257,6168,indoor,"bamboo_forest, wheat_field, locker_room, jail_cell, music_studio"
258,6192,outdoor,"bamboo_forest, wheat_field, corn_field, jail_cell, barndoor"
259,6216,outdoor,"bamboo_forest, wheat_field, corn_field, elevator_shaft, forest/broadleaf"
260,6240,outdoor,"bamboo_forest, wheat_field, corn_field, rice_paddy, forest/broadleaf"
261,6264,outdoor,"hot_spring, iceberg, sky, lake/natural, ice_shelf"
262,6288,outdoor,"hot_spring, ice_floe, lake/natural, pond, ice_shelf"
263,6312,outdoor,"hot_spring, ice_shelf, ice_floe, iceberg, lake/natural"
264,6336,outdoor,"hot_spring, lake/natural, pond, ice_floe, ice_shelf"
265,6360,outdoor,"hot_spring, ice_shelf, ice_floe, lake/natural, iceberg"
266,6384,outdoor,"wheat_field, bamboo_forest, corn_field, rice_paddy, shower"
267,6408,outdoor,"bamboo_forest, jail_cell, wheat_field, barndoor, elevator_shaft"
268,6432,indoor,"bamboo_forest, jail_cell, barndoor, bank_vault, elevator_shaft"
269,6456,indoor,"bamboo_forest, barndoor, elevator_shaft, jail_cell, bank_vault"
270,6480,outdoor,"bamboo_forest, wheat_field, jail_cell, corn_field, elevator_shaft"
271,6504,indoor,"clean_room, shower, locker_room, bamboo_forest, wheat_field"
272,6528,indoor,"jewelry_shop, clean_room, bamboo_forest, corn_field, chemistry_lab"
273,6552,indoor,"clean_room, jewelry_shop, hospital_room, bamboo_forest, clothing_store"
274,6576,indoor,"nursery, clothing_store, jewelry_shop, fabric_store, gift_shop"
275,6600,indoor,"nursery, jewelry_shop, bow_window/indoor, tree_house, childs_room"
276,6624,indoor,"nursery, shower, bow_window/indoor, jewelry_shop, clothing_store"
277,6648,indoor,"nursery, clean_room, bedchamber, shower, jewelry_shop"
278,6672,indoor,"nursery, bow_window/indoor, clean_room, bedchamber, bedroom"
279,6696,indoor,"jewelry_shop, kindergarden_classroom, archive, museum/indoor, banquet_hall"
280,6720,indoor,"nursery, jewelry_shop, archive, locker_room, kindergarden_classroom"
281,6744,indoor,"jewelry_shop, clean_room, locker_room, server_room, cemetery"
282,6768,indoor,"jewelry_shop, nursery, cemetery, kindergarden_classroom, office_cubicles"
283,6792,outdoor,"cemetery, jewelry_shop, pond, yard, kindergarden_classroom"
284,6816,indoor,"cemetery, pond, kindergarden_classroom, archive, jewelry_shop"
285,6840,indoor,"kindergarden_classroom, nursery, classroom, locker_room, server_room"
286,6864,indoor,"nursery, locker_room, jewelry_shop, kindergarden_classroom, clean_room"
287,6888,outdoor,"pond, marsh, lake/natural, cemetery, swamp"
288,6912,indoor,"corn_field, museum/indoor, stage/indoor, greenhouse/indoor, natural_history_museum"
289,6936,indoor,"corn_field, museum/indoor, discotheque, natural_history_museum, aquarium"
290,6960,indoor,"corn_field, museum/indoor, bamboo_forest, natural_history_museum, shower"
291,6984,outdoor,"museum/indoor, corn_field, bamboo_forest, natural_history_museum, wheat_field"
292,7008,outdoor,"ice_floe, bedroom, corn_field, ice_shelf, banquet_hall"
293,7032,indoor,"ice_floe, bedroom, ice_shelf, nursery, bedchamber"
294,7056,outdoor,"corn_field, ice_floe, greenhouse/indoor, ice_shelf, bedroom"
295,7080,indoor,"jewelry_shop, corn_field, rice_paddy, banquet_hall, nursery"
296,7104,outdoor,"orchard, jewelry_shop, ice_floe, corn_field, nursery"
297,7128,indoor,"corn_field, orchard, gift_shop, nursery, jewelry_shop"
298,7152,outdoor,"corn_field, orchard, wheat_field, discotheque, beer_hall"
299,7176,outdoor,"corn_field, orchard, ice_shelf, jewelry_shop, ice_floe"
300,7200,indoor,"kindergarden_classroom, discotheque, classroom, playroom, nursery"
301,7224,indoor,"jewelry_shop, clean_room, chemistry_lab, physics_laboratory, nursing_home"
302,7248,indoor,"jewelry_shop, chemistry_lab, biology_laboratory, orchard, pond"
303,7272,indoor,"jewelry_shop, clean_room, nursery, banquet_hall, dressing_room"
304,7296,outdoor,"ski_slope, ski_resort, ice_shelf, banquet_hall, ballroom"
305,7320,indoor,"banquet_hall, jewelry_shop, clean_room, cemetery, archive"
306,7344,outdoor,"jewelry_shop, ice_floe, ice_shelf, ski_slope, ski_resort"
307,7368,indoor,"jewelry_shop, banquet_hall, dining_hall, ballroom, marsh"
308,7392,outdoor,"jewelry_shop, marsh, archive, harbor, pond"
309,7416,outdoor,"jewelry_shop, ski_slope, ice_shelf, ice_floe, snowfield"
310,7440,outdoor,"jewelry_shop, corn_field, ice_shelf, ski_slope, ice_floe"
311,7464,indoor,"shower, bamboo_forest, jewelry_shop, clean_room, corn_field"
312,7488,indoor,"bamboo_forest, shower, corn_field, elevator_shaft, church/indoor"
313,7512,indoor,"bamboo_forest, corn_field, greenhouse/indoor, shower, elevator_shaft"
314,7536,indoor,"bamboo_forest, shower, elevator_shaft, church/indoor, engine_room"
315,7560,indoor,"bamboo_forest, corn_field, airport_terminal, church/indoor, elevator_shaft"
316,7584,indoor,"elevator_shaft, bamboo_forest, shower, corn_field, church/indoor"
317,7608,indoor,"corn_field, bamboo_forest, elevator_shaft, church/indoor, engine_room"
318,7632,outdoor,"corn_field, bamboo_forest, elevator_shaft, wheat_field, greenhouse/indoor"
319,7656,outdoor,"bamboo_forest, corn_field, elevator_shaft, wheat_field, greenhouse/indoor"
320,7680,outdoor,"corn_field, bamboo_forest, wheat_field, elevator_shaft, greenhouse/indoor"
