,frame_num,environment,places
2477,59448,indoor,"natural_history_museum, bathroom, shower, science_museum, beauty_salon"
2478,59472,indoor,"chemistry_lab, natural_history_museum, shower, bathroom, physics_laboratory"
2479,59496,indoor,"natural_history_museum, science_museum, shower, bathroom, jewelry_shop"
2480,59520,indoor,"clean_room, locker_room, gymnasium/indoor, bank_vault, chemistry_lab"
2481,59544,indoor,"clean_room, locker_room, gymnasium/indoor, bank_vault, server_room"
2482,59568,indoor,"clean_room, engine_room, physics_laboratory, operating_room, chemistry_lab"
2483,59592,indoor,"clean_room, museum/indoor, science_museum, physics_laboratory, engine_room"
2484,59616,indoor,"clean_room, auto_factory, engine_room, locker_room, bank_vault"
2485,59640,indoor,"clean_room, museum/indoor, locker_room, archive, science_museum"
2486,59664,indoor,"clothing_store, dressing_room, locker_room, clean_room, department_store"
2487,59688,indoor,"locker_room, clean_room, clothing_store, archive, physics_laboratory"
2488,59712,indoor,"physics_laboratory, archive, locker_room, engine_room, clean_room"
2489,59736,indoor,"physics_laboratory, locker_room, clean_room, engine_room, archive"
2490,59760,indoor,"locker_room, clean_room, engine_room, physics_laboratory, archive"
2491,59784,indoor,"clean_room, shower, chemistry_lab, bathroom, operating_room"
2492,59808,indoor,"clean_room, chemistry_lab, bathroom, biology_laboratory, shower"
2493,59832,indoor,"gift_shop, jewelry_shop, shoe_shop, childs_room, flea_market/indoor"
2494,59856,outdoor,"ice_shelf, iceberg, ocean, hot_spring, ice_floe"
2495,59880,outdoor,"ice_shelf, iceberg, hot_spring, ice_floe, ocean"
2496,59904,outdoor,"ice_shelf, iceberg, ocean, hot_spring, ice_floe"
2497,59928,indoor,"clean_room, dressing_room, chemistry_lab, physics_laboratory, shower"
2498,59952,indoor,"jewelry_shop, clean_room, shoe_shop, gift_shop, chemistry_lab"
2499,59976,indoor,"bathroom, locker_room, shower, shoe_shop, chemistry_lab"
2500,60000,indoor,"chemistry_lab, biology_laboratory, shoe_shop, ice_cream_parlor, coffee_shop"
2501,60024,indoor,"shoe_shop, chemistry_lab, bathroom, biology_laboratory, shower"
2502,60048,indoor,"natural_history_museum, shoe_shop, clean_room, bathroom, science_museum"
2503,60072,indoor,"jewelry_shop, dressing_room, clothing_store, gift_shop, clean_room"
2504,60096,indoor,"jewelry_shop, dressing_room, shoe_shop, clothing_store, gift_shop"
2505,60120,indoor,"jewelry_shop, clean_room, dressing_room, clothing_store, shoe_shop"
2506,60144,indoor,"jewelry_shop, clean_room, dressing_room, clothing_store, gift_shop"
2507,60168,indoor,"clean_room, museum/indoor, jewelry_shop, dressing_room, gift_shop"
2508,60192,outdoor,"ocean, ice_shelf, sky, desert/sand, coast"
2509,60216,outdoor,"ocean, ice_shelf, sky, desert/sand, iceberg"
2510,60240,outdoor,"ice_shelf, ocean, sky, desert/sand, iceberg"
2511,60264,outdoor,"ice_shelf, ocean, sky, desert/sand, iceberg"
2512,60288,outdoor,"ocean, ice_shelf, sky, desert/sand, iceberg"
2513,60312,indoor,"clean_room, jewelry_shop, dressing_room, clothing_store, bathroom"
2514,60336,indoor,"clean_room, jewelry_shop, museum/indoor, dressing_room, gift_shop"
2515,60360,indoor,"shower, bathroom, aquarium, science_museum, natural_history_museum"
2516,60384,indoor,"shower, bathroom, dressing_room, beauty_salon, chemistry_lab"
2517,60408,indoor,"shower, science_museum, chemistry_lab, bathroom, biology_laboratory"
2518,60432,indoor,"shower, bathroom, art_studio, natural_history_museum, dressing_room"
2519,60456,indoor,"shower, natural_history_museum, science_museum, art_gallery, bathroom"
2520,60480,outdoor,"ice_shelf, ocean, sky, iceberg, desert/sand"
2521,60504,outdoor,"ice_shelf, iceberg, sky, ocean, desert/sand"
2522,60528,outdoor,"ice_shelf, iceberg, ocean, sky, desert/sand"
2523,60552,indoor,"clean_room, jewelry_shop, dressing_room, clothing_store, gift_shop"
2524,60576,indoor,"clean_room, dressing_room, locker_room, jewelry_shop, clothing_store"
2525,60600,indoor,"clean_room, natural_history_museum, jewelry_shop, dressing_room, gift_shop"
2526,60624,indoor,"clean_room, jewelry_shop, natural_history_museum, dressing_room, gift_shop"
2527,60648,indoor,"natural_history_museum, clean_room, jewelry_shop, dressing_room, gift_shop"
2528,60672,indoor,"clean_room, dressing_room, natural_history_museum, museum/indoor, science_museum"
2529,60696,indoor,"jewelry_shop, clean_room, museum/indoor, natural_history_museum, gift_shop"
2530,60720,indoor,"jewelry_shop, natural_history_museum, clean_room, science_museum, gift_shop"
2531,60744,indoor,"natural_history_museum, clean_room, museum/indoor, clothing_store, science_museum"
2532,60768,indoor,"locker_room, shower, server_room, bank_vault, clean_room"
2533,60792,outdoor,"sky, ice_shelf, iceberg, ocean, desert/sand"
2534,60816,outdoor,"ice_shelf, iceberg, sky, ocean, coast"
2535,60840,outdoor,"ice_shelf, iceberg, sky, ocean, desert/sand"
2536,60864,outdoor,"canyon, volcano, mountain, desert/sand, butte"
2537,60888,indoor,"desert/sand, museum/indoor, natural_history_museum, science_museum, iceberg"
2538,60912,indoor,"museum/indoor, stage/indoor, natural_history_museum, desert/sand, science_museum"
2539,60936,indoor,"museum/indoor, desert/sand, science_museum, natural_history_museum, art_gallery"
2540,60960,indoor,"stage/indoor, museum/indoor, desert/sand, science_museum, natural_history_museum"
2541,60984,indoor,"stage/indoor, art_gallery, museum/indoor, arena/performance, ballroom"
2542,61008,indoor,"museum/indoor, jewelry_shop, science_museum, art_gallery, stage/indoor"
2543,61032,indoor,"stage/indoor, arena/performance, museum/indoor, ballroom, science_museum"
2544,61056,indoor,"museum/indoor, art_gallery, natural_history_museum, science_museum, artists_loft"
2545,61080,indoor,"museum/indoor, stage/indoor, science_museum, natural_history_museum, arena/performance"
2546,61104,indoor,"museum/indoor, natural_history_museum, science_museum, art_gallery, stage/indoor"
2547,61128,indoor,"museum/indoor, natural_history_museum, science_museum, art_gallery, art_studio"
2548,61152,outdoor,"wheat_field, art_gallery, museum/indoor, desert/sand, iceberg"
2549,61176,outdoor,"canyon, museum/indoor, butte, desert/sand, natural_history_museum"
2550,61200,indoor,"museum/indoor, canyon, stage/indoor, art_gallery, desert/sand"
2551,61224,outdoor,"desert/sand, ice_shelf, sky, hospital, museum/indoor"
2552,61248,outdoor,"desert/sand, sky, ice_shelf, hospital, museum/indoor"
2553,61272,outdoor,"desert/sand, sky, ice_shelf, hospital, ocean"
2554,61296,outdoor,"ice_shelf, desert/sand, sky, ocean, iceberg"
2555,61320,outdoor,"ice_shelf, desert/sand, sky, ocean, iceberg"
2556,61344,outdoor,"ice_shelf, desert/sand, sky, iceberg, ocean"
2557,61368,outdoor,"desert/sand, ice_shelf, sky, hospital, pharmacy"
2558,61392,outdoor,"canyon, museum/indoor, art_gallery, butte, kasbah"
2559,61416,outdoor,"museum/indoor, art_gallery, canyon, desert/sand, butte"
2560,61440,indoor,"museum/indoor, art_gallery, natural_history_museum, canyon, science_museum"
2561,61464,outdoor,"canyon, mountain, butte, badlands, volcano"
2562,61488,indoor,"museum/indoor, art_gallery, jewelry_shop, natural_history_museum, science_museum"
2563,61512,outdoor,"canyon, desert/sand, butte, museum/indoor, volcano"
2564,61536,indoor,"museum/indoor, art_gallery, canyon, science_museum, stage/indoor"
2565,61560,indoor,"music_studio, discotheque, ballroom, stage/indoor, bar"
2566,61584,outdoor,"canyon, igloo, butte, desert/sand, iceberg"
2567,61608,indoor,"discotheque, stage/indoor, ballroom, igloo, natural_history_museum"
2568,61632,outdoor,"ice_shelf, marsh, desert/sand, hot_spring, lake/natural"
2569,61656,outdoor,"ice_shelf, marsh, hot_spring, lake/natural, pond"
2570,61680,outdoor,"ice_shelf, hot_spring, marsh, iceberg, desert/sand"
2571,61704,outdoor,"ice_shelf, hot_spring, marsh, desert/sand, ocean"
2572,61728,outdoor,"ice_shelf, hot_spring, marsh, pond, lake/natural"
2573,61752,outdoor,"ice_shelf, marsh, hot_spring, pond, iceberg"
2574,61776,outdoor,"ice_shelf, hot_spring, iceberg, marsh, pond"
2575,61800,indoor,"discotheque, music_studio, stage/indoor, basement, igloo"
2576,61824,indoor,"stage/indoor, discotheque, music_studio, ballroom, basement"
2577,61848,indoor,"discotheque, igloo, stage/indoor, music_studio, basement"
2578,61872,indoor,"music_studio, archive, clean_room, art_studio, bedroom"
2579,61896,indoor,"natural_history_museum, museum/indoor, science_museum, arena/performance, art_gallery"
2580,61920,indoor,"museum/indoor, natural_history_museum, science_museum, jewelry_shop, art_gallery"
2581,61944,indoor,"stage/indoor, arena/performance, orchestra_pit, music_studio, television_studio"
2582,61968,indoor,"clothing_store, museum/indoor, science_museum, dressing_room, stage/indoor"
2583,61992,outdoor,"ice_shelf, iceberg, desert/sand, hot_spring, ocean"
2584,62016,outdoor,"ice_shelf, iceberg, desert/sand, hot_spring, ocean"
2585,62040,outdoor,"ice_shelf, iceberg, desert/sand, ice_floe, ocean"
2586,62064,outdoor,"ice_shelf, iceberg, desert/sand, ice_floe, ocean"
2587,62088,outdoor,"ice_shelf, iceberg, desert/sand, ice_floe, ocean"
2588,62112,outdoor,"ice_shelf, iceberg, desert/sand, hot_spring, ocean"
2589,62136,outdoor,"ice_shelf, iceberg, desert/sand, ocean, hot_spring"
2590,62160,indoor,"clothing_store, television_studio, stage/indoor, museum/indoor, arena/performance"
2591,62184,indoor,"television_studio, museum/indoor, arena/performance, stage/indoor, music_studio"
2592,62208,indoor,"science_museum, museum/indoor, natural_history_museum, arena/performance, stage/indoor"
2593,62232,indoor,"music_studio, natural_history_museum, science_museum, stage/indoor, television_studio"
2594,62256,indoor,"orchestra_pit, stage/indoor, television_studio, music_studio, arena/performance"
2595,62280,indoor,"museum/indoor, science_museum, natural_history_museum, art_gallery, jewelry_shop"
2596,62304,indoor,"museum/indoor, natural_history_museum, science_museum, art_gallery, clothing_store"
2597,62328,indoor,"museum/indoor, clean_room, natural_history_museum, science_museum, art_gallery"
2598,62352,indoor,"jewelry_shop, clothing_store, music_studio, discotheque, stage/indoor"
2599,62376,indoor,"jewelry_shop, clean_room, music_studio, clothing_store, stage/indoor"
2600,62400,indoor,"jewelry_shop, stage/indoor, clothing_store, music_studio, discotheque"
2601,62424,indoor,"stage/indoor, jewelry_shop, clothing_store, discotheque, music_studio"
2602,62448,indoor,"clothing_store, jewelry_shop, dressing_room, stage/indoor, discotheque"
2603,62472,indoor,"jewelry_shop, clothing_store, dressing_room, beauty_salon, discotheque"
2604,62496,indoor,"clothing_store, jewelry_shop, dressing_room, stage/indoor, beauty_salon"
2605,62520,indoor,"clothing_store, jewelry_shop, dressing_room, beauty_salon, stage/indoor"
2606,62544,indoor,"jewelry_shop, clothing_store, dressing_room, beauty_salon, gift_shop"
2607,62568,indoor,"jewelry_shop, clothing_store, clean_room, stage/indoor, department_store"
2608,62592,outdoor,"ocean, ice_shelf, desert/sand, sky, beach"
2609,62616,outdoor,"ice_shelf, ocean, beach, sky, desert/sand"
2610,62640,outdoor,"ocean, ice_shelf, beach, sky, desert/sand"
2611,62664,outdoor,"ice_shelf, ocean, lake/natural, ice_floe, beach"
2612,62688,outdoor,"ice_shelf, ocean, ice_floe, lake/natural, beach"
2613,62712,outdoor,"ice_shelf, ocean, beach, lake/natural, ice_floe"
2614,62736,indoor,"jewelry_shop, music_studio, discotheque, bar, stage/indoor"
2615,62760,indoor,"jewelry_shop, science_museum, natural_history_museum, museum/indoor, gift_shop"
2616,62784,indoor,"childs_room, canyon, discotheque, stage/indoor, art_studio"
2617,62808,indoor,"childs_room, stage/indoor, discotheque, art_studio, igloo"
2618,62832,indoor,"stage/indoor, discotheque, igloo, music_studio, arena/performance"
2619,62856,indoor,"stage/indoor, childs_room, discotheque, iceberg, sky"
2620,62880,outdoor,"childs_room, igloo, bakery/shop, ice_shelf, iceberg"
2621,62904,outdoor,"desert/sand, corn_field, desert/vegetation, field/cultivated, wheat_field"
2622,62928,outdoor,"desert/sand, corn_field, desert/vegetation, field/cultivated, botanical_garden"
2623,62952,outdoor,"desert/sand, corn_field, desert/vegetation, canyon, field/cultivated"
2624,62976,outdoor,"desert/sand, corn_field, desert/vegetation, canyon, field/cultivated"
2625,63000,outdoor,"desert/sand, corn_field, desert/vegetation, field/cultivated, orchard"
2626,63024,outdoor,"desert/sand, corn_field, canyon, kasbah, orchard"
2627,63048,outdoor,"volcano, desert/sand, mountain, sky, canyon"
2628,63072,indoor,"museum/indoor, kasbah, stage/indoor, catacomb, canyon"
2629,63096,indoor,"catacomb, museum/indoor, burial_chamber, natural_history_museum, science_museum"
2630,63120,outdoor,"ice_shelf, desert/sand, ocean, iceberg, islet"
2631,63144,outdoor,"ice_shelf, ocean, iceberg, islet, desert/sand"
2632,63168,outdoor,"ice_shelf, iceberg, ocean, islet, ice_floe"
2633,63192,outdoor,"ice_shelf, iceberg, ocean, islet, ice_floe"
2634,63216,outdoor,"ice_shelf, iceberg, ocean, islet, desert/sand"
2635,63240,indoor,"stage/indoor, science_museum, natural_history_museum, museum/indoor, catacomb"
2636,63264,indoor,"science_museum, natural_history_museum, museum/indoor, stage/indoor, art_gallery"
2637,63288,indoor,"stage/indoor, natural_history_museum, science_museum, museum/indoor, canyon"
2638,63312,indoor,"canyon, museum/indoor, catacomb, burial_chamber, stage/indoor"
2639,63336,outdoor,"desert/sand, sky, canyon, ski_slope, ice_shelf"
2640,63360,outdoor,"desert/sand, ski_slope, ice_shelf, sky, canyon"
2641,63384,outdoor,"desert/sand, corn_field, ice_shelf, sky, volcano"
2642,63408,outdoor,"desert/sand, ski_slope, ice_shelf, corn_field, sky"
2643,63432,outdoor,"ice_shelf, volcano, desert/sand, ice_floe, canyon"
2644,63456,outdoor,"volcano, ice_shelf, desert/sand, art_school, canyon"
2645,63480,outdoor,"ice_shelf, jewelry_shop, corn_field, desert/sand, canyon"
2646,63504,outdoor,"ice_shelf, iceberg, sky, ocean, ice_floe"
2647,63528,outdoor,"ice_shelf, iceberg, sky, ocean, desert/sand"
2648,63552,outdoor,"desert/sand, ice_shelf, art_school, art_gallery, corn_field"
2649,63576,outdoor,"desert/sand, ice_shelf, art_school, canyon, corn_field"
2650,63600,outdoor,"canyon, desert/sand, butte, ice_shelf, volcano"
2651,63624,outdoor,"desert/sand, sky, corn_field, volcano, ski_slope"
2652,63648,outdoor,"desert/sand, sky, corn_field, igloo, ski_slope"
2653,63672,indoor,"barndoor, fountain, sauna, throne_room, stage/indoor"
2654,63696,indoor,"barndoor, fountain, sauna, shower, throne_room"
2655,63720,indoor,"barndoor, elevator/door, sauna, fountain, throne_room"
2656,63744,indoor,"barndoor, stage/indoor, sauna, stable, ballroom"
2657,63768,outdoor,"barndoor, loading_dock, stable, shed, elevator/door"
2658,63792,outdoor,"ice_shelf, iceberg, sky, desert/sand, ocean"
2659,63816,outdoor,"ice_shelf, iceberg, ocean, sky, hot_spring"
2660,63840,outdoor,"ice_shelf, ocean, iceberg, sky, lake/natural"
2661,63864,outdoor,"ice_shelf, iceberg, ocean, ice_floe, hot_spring"
2662,63888,outdoor,"hot_spring, marsh, field/wild, lake/natural, pond"
2663,63912,outdoor,"canyon, catacomb, mountain, volcano, cliff"
2664,63936,outdoor,"catacomb, canyon, viaduct, basement, arch"
2665,63960,outdoor,"canyon, catacomb, mountain, mountain_path, volcano"
2666,63984,outdoor,"canyon, wind_farm, catacomb, volcano, mountain"
2667,64008,outdoor,"canyon, volcano, butte, mountain, discotheque"
2668,64032,outdoor,"canyon, volcano, butte, mountain, desert/sand"
2669,64056,outdoor,"canyon, volcano, butte, desert/sand, tundra"
2670,64080,outdoor,"canyon, volcano, butte, mountain, desert/sand"
2671,64104,indoor,"discotheque, stage/indoor, arena/performance, campsite, canyon"
2672,64128,indoor,"canyon, stage/indoor, arena/performance, discotheque, auditorium"
2673,64152,indoor,"arena/performance, stage/indoor, discotheque, stage/outdoor, auditorium"
2674,64176,indoor,"arena/performance, discotheque, stage/indoor, canyon, volcano"
2675,64200,indoor,"stage/indoor, canyon, campsite, arena/performance, discotheque"
2676,64224,indoor,"arena/performance, discotheque, stage/indoor, canyon, volcano"
2677,64248,indoor,"canyon, discotheque, stage/indoor, arena/performance, desert/sand"
2678,64272,outdoor,"canyon, desert/sand, mountain, discotheque, arena/performance"
2679,64296,outdoor,"campsite, discotheque, canyon, stage/indoor, volcano"
2680,64320,indoor,"discotheque, stage/indoor, arena/performance, campsite, gift_shop"
2681,64344,outdoor,"canyon, tundra, desert/sand, volcano, butte"
2682,64368,outdoor,"canyon, desert/sand, tundra, volcano, badlands"
2683,64392,outdoor,"canyon, desert/sand, volcano, butte, kasbah"
2684,64416,outdoor,"canyon, volcano, sky, mountain, butte"
2685,64440,outdoor,"catacomb, canyon, volcano, sky, mountain"
2686,64464,outdoor,"canyon, catacomb, volcano, grotto, mountain"
2687,64488,outdoor,"catacomb, volcano, canyon, grotto, mountain"
2688,64512,outdoor,"catacomb, canyon, windmill, volcano, sky"
2689,64536,outdoor,"catacomb, canyon, sky, volcano, ruin"
2690,64560,outdoor,"canyon, catacomb, desert/sand, volcano, grotto"
2691,64584,outdoor,"catacomb, canyon, desert/sand, volcano, forest_path"
2692,64608,outdoor,"catacomb, canyon, desert/sand, grotto, slum"
2693,64632,outdoor,"volcano, canyon, desert/sand, catacomb, arena/performance"
2694,64656,outdoor,"canyon, desert/sand, volcano, catacomb, forest_path"
2695,64680,outdoor,"forest_path, mountain_path, canyon, sky, catacomb"
2696,64704,outdoor,"sky, volcano, valley, ocean, mountain"
2697,64728,outdoor,"volcano, sky, lake/natural, pagoda, pond"
2698,64752,outdoor,"ice_shelf, iceberg, ice_floe, hot_spring, museum/indoor"
2699,64776,outdoor,"ice_shelf, iceberg, ice_floe, nursery, hot_spring"
2700,64800,outdoor,"ice_shelf, iceberg, ice_floe, hot_spring, sky"
2701,64824,outdoor,"ice_shelf, iceberg, ice_floe, hot_spring, sky"
2702,64848,outdoor,"ice_shelf, iceberg, ice_floe, nursery, hot_spring"
2703,64872,outdoor,"ice_shelf, iceberg, ice_floe, nursery, field/wild"
2704,64896,indoor,"jewelry_shop, department_store, science_museum, music_studio, dressing_room"
2705,64920,indoor,"jewelry_shop, science_museum, bakery/shop, gift_shop, ice_cream_parlor"
2706,64944,outdoor,"discotheque, stage/indoor, hot_spring, pond, lake/natural"
2707,64968,outdoor,"sky, volcano, lake/natural, pagoda, temple/asia"
2708,64992,outdoor,"forest/broadleaf, corn_field, catacomb, rainforest, orchard"
2709,65016,outdoor,"forest/broadleaf, catacomb, canyon, corn_field, rainforest"
2710,65040,outdoor,"forest/broadleaf, catacomb, canyon, grotto, rainforest"
2711,65064,outdoor,"corn_field, catacomb, canyon, forest/broadleaf, grotto"
2712,65088,outdoor,"corn_field, canyon, catacomb, forest/broadleaf, grotto"
2713,65112,outdoor,"canyon, catacomb, forest/broadleaf, grotto, corn_field"
2714,65136,outdoor,"canyon, forest/broadleaf, catacomb, grotto, mountain"
2715,65160,outdoor,"forest/broadleaf, canyon, catacomb, rainforest, grotto"
2716,65184,outdoor,"forest/broadleaf, canyon, orchard, catacomb, rainforest"
2717,65208,outdoor,"forest/broadleaf, corn_field, orchard, canyon, catacomb"
2718,65232,indoor,"stage/indoor, arena/performance, corn_field, canyon, catacomb"
2719,65256,outdoor,"corn_field, orchard, vineyard, stage/indoor, forest/broadleaf"
2720,65280,outdoor,"corn_field, forest/broadleaf, botanical_garden, catacomb, orchard"
2721,65304,outdoor,"corn_field, forest/broadleaf, orchard, catacomb, botanical_garden"
2722,65328,outdoor,"orchard, forest/broadleaf, botanical_garden, cemetery, rainforest"
2723,65352,outdoor,"orchard, forest/broadleaf, botanical_garden, cemetery, rainforest"
2724,65376,outdoor,"forest/broadleaf, botanical_garden, cemetery, orchard, rainforest"
2725,65400,outdoor,"forest/broadleaf, orchard, botanical_garden, rainforest, canyon"
2726,65424,outdoor,"forest/broadleaf, orchard, botanical_garden, rainforest, cemetery"
2727,65448,outdoor,"sky, windmill, orchard, forest/broadleaf, wind_farm"
2728,65472,outdoor,"orchard, canyon, sky, botanical_garden, forest/broadleaf"
2729,65496,outdoor,"forest/broadleaf, lake/natural, pond, swamp, orchard"
2730,65520,outdoor,"orchard, canyon, forest/broadleaf, botanical_garden, lake/natural"
2731,65544,outdoor,"canyon, orchard, forest/broadleaf, mountain, volcano"
2732,65568,outdoor,"canyon, volcano, mountain, sky, forest/broadleaf"
2733,65592,outdoor,"canyon, orchard, forest/broadleaf, mountain, volcano"
2734,65616,outdoor,"forest/broadleaf, canyon, catacomb, orchard, grotto"
2735,65640,outdoor,"lake/natural, volcano, forest/broadleaf, pond, sky"
2736,65664,outdoor,"volcano, sky, lake/natural, canyon, forest/broadleaf"
2737,65688,outdoor,"volcano, sky, lake/natural, forest/broadleaf, pond"
2738,65712,outdoor,"volcano, fishpond, lake/natural, pond, mountain"
2739,65736,outdoor,"fishpond, discotheque, pond, lake/natural, stage/indoor"
2740,65760,outdoor,"fishpond, pond, discotheque, lake/natural, stage/indoor"
2741,65784,outdoor,"fishpond, pond, lake/natural, discotheque, marsh"
2742,65808,outdoor,"fishpond, lake/natural, pond, volcano, discotheque"
2743,65832,outdoor,"pond, fishpond, lake/natural, volcano, ice_floe"
2744,65856,outdoor,"pond, lake/natural, stage/indoor, discotheque, volcano"
2745,65880,outdoor,"volcano, lake/natural, pond, mountain, canyon"
2746,65904,outdoor,"fishpond, lake/natural, pond, marsh, volcano"
2747,65928,indoor,"basement, locker_room, slum, jail_cell, shower"
2748,65952,outdoor,"iceberg, ice_shelf, sky, ocean, islet"
2749,65976,outdoor,"iceberg, ice_shelf, sky, ocean, islet"
2750,66000,indoor,"elevator_shaft, sauna, elevator/door, staircase, closet"
2751,66024,indoor,"elevator/door, elevator_shaft, sauna, elevator_lobby, barndoor"
2752,66048,indoor,"elevator_shaft, sauna, elevator/door, staircase, closet"
2753,66072,indoor,"living_room, waiting_room, nursery, alcove, stage/indoor"
2754,66096,outdoor,"desert/sand, volcano, canyon, sky, mountain"
2755,66120,outdoor,"desert/sand, kasbah, catacomb, canyon, volcano"
2756,66144,indoor,"stage/indoor, discotheque, music_studio, museum/indoor, art_gallery"
2757,66168,indoor,"stage/indoor, music_studio, discotheque, arena/performance, museum/indoor"
2758,66192,indoor,"stage/indoor, music_studio, discotheque, arena/performance, dressing_room"
2759,66216,indoor,"childs_room, kindergarden_classroom, playroom, art_school, art_studio"
2760,66240,indoor,"childs_room, art_school, playroom, kindergarden_classroom, art_studio"
2761,66264,indoor,"childs_room, kindergarden_classroom, art_school, playroom, art_studio"
2762,66288,indoor,"stage/indoor, music_studio, discotheque, dressing_room, shower"
2763,66312,indoor,"stage/indoor, music_studio, discotheque, dressing_room, shower"
2764,66336,indoor,"stage/indoor, music_studio, discotheque, dressing_room, ballroom"
2765,66360,indoor,"stage/indoor, dressing_room, music_studio, shower, discotheque"
2766,66384,indoor,"stage/indoor, music_studio, discotheque, ballroom, arena/performance"
2767,66408,indoor,"stage/indoor, music_studio, discotheque, dressing_room, ballroom"
2768,66432,indoor,"stage/indoor, music_studio, dressing_room, discotheque, shower"
2769,66456,indoor,"stage/indoor, music_studio, discotheque, ballroom, dressing_room"
2770,66480,indoor,"stage/indoor, music_studio, discotheque, ballroom, arena/performance"
2771,66504,indoor,"stage/indoor, music_studio, discotheque, ballroom, dressing_room"
2772,66528,indoor,"stage/indoor, ballroom, discotheque, dressing_room, music_studio"
2773,66552,indoor,"stage/indoor, ballroom, discotheque, music_studio, arena/performance"
2774,66576,indoor,"stage/indoor, music_studio, discotheque, arena/performance, ballroom"
2775,66600,indoor,"stage/indoor, music_studio, discotheque, arena/performance, ballroom"
2776,66624,indoor,"stage/indoor, music_studio, discotheque, arena/performance, shower"
2777,66648,indoor,"dressing_room, shower, art_gallery, museum/indoor, science_museum"
2778,66672,indoor,"dressing_room, shower, art_gallery, museum/indoor, natural_history_museum"
2779,66696,outdoor,"iceberg, ice_shelf, sky, ocean, islet"
2780,66720,outdoor,"iceberg, ice_shelf, sky, ocean, islet"
2781,66744,outdoor,"clothing_store, canyon, butchers_shop, medina, fire_escape"
2782,66768,outdoor,"medina, kasbah, burial_chamber, clothing_store, canyon"
2783,66792,indoor,"clothing_store, stage/indoor, burial_chamber, canyon, throne_room"
2784,66816,outdoor,"medina, clothing_store, burial_chamber, kasbah, canyon"
2785,66840,indoor,"burial_chamber, medina, clothing_store, throne_room, stage/indoor"
2786,66864,indoor,"clothing_store, burial_chamber, canyon, medina, stage/indoor"
2787,66888,outdoor,"burial_chamber, kasbah, medina, cemetery, clothing_store"
2788,66912,indoor,"stage/indoor, discotheque, art_gallery, art_studio, burial_chamber"
2789,66936,indoor,"stage/indoor, discotheque, art_gallery, museum/indoor, art_studio"
2790,66960,indoor,"stage/indoor, discotheque, art_gallery, museum/indoor, dressing_room"
2791,66984,indoor,"stage/indoor, museum/indoor, art_gallery, art_studio, discotheque"
2792,67008,indoor,"butchers_shop, clothing_store, bazaar/outdoor, flea_market/indoor, department_store"
2793,67032,outdoor,"kasbah, bazaar/outdoor, bedchamber, canyon, butchers_shop"
2794,67056,indoor,"kasbah, bedchamber, butchers_shop, clothing_store, bedroom"
2795,67080,indoor,"kasbah, bedchamber, bedroom, clothing_store, bazaar/outdoor"
2796,67104,outdoor,"kasbah, canyon, bazaar/outdoor, corral, junkyard"
2797,67128,indoor,"bedchamber, bedroom, kasbah, bazaar/outdoor, flea_market/indoor"
2798,67152,indoor,"bazaar/outdoor, butchers_shop, kasbah, bedchamber, flea_market/indoor"
2799,67176,outdoor,"kasbah, bedchamber, bazaar/outdoor, canyon, bedroom"
2800,67200,outdoor,"stage/indoor, arena/performance, kasbah, stage/outdoor, slum"
2801,67224,outdoor,"bazaar/outdoor, stage/indoor, arena/performance, kasbah, stage/outdoor"
