,frame_num,environment,places,imdb_id
6633,159192,indoor,"basement, engine_room, clean_room, storage_room, corridor",52424
6634,159216,indoor,"corridor, basement, locker_room, parking_garage/indoor, bank_vault",52424
6635,159240,indoor,"clean_room, locker_room, department_store, clothing_store, dressing_room",52424
6636,159264,indoor,"bank_vault, clean_room, locker_room, engine_room, lobby",52424
6637,159288,indoor,"corridor, clothing_store, basement, staircase, lobby",52424
6638,159312,indoor,"food_court, cafeteria, restaurant_kitchen, restaurant, clean_room",52424
6639,159336,indoor,"clean_room, restaurant_kitchen, engine_room, assembly_line, restaurant",52424
6640,159360,indoor,"engine_room, clean_room, science_museum, bowling_alley, basement",52424
6641,159384,outdoor,"hot_spring, discotheque, fountain, stage/indoor, fire_station",52424
6642,159408,indoor,"chemistry_lab, discotheque, shower, museum/indoor, sauna",52424
6643,159432,indoor,"chemistry_lab, biology_laboratory, shower, stage/indoor, discotheque",52424
6644,159456,indoor,"chemistry_lab, biology_laboratory, clean_room, restaurant_kitchen, mosque/outdoor",52424
6645,159480,indoor,"chemistry_lab, biology_laboratory, restaurant_kitchen, clean_room, bar",52424
6646,159504,indoor,"chemistry_lab, restaurant_kitchen, biology_laboratory, clean_room, mosque/outdoor",52424
6647,159528,indoor,"restaurant_kitchen, chemistry_lab, clean_room, biology_laboratory, kitchen",52424
6648,159552,indoor,"restaurant_kitchen, conference_center, stage/indoor, chemistry_lab, television_studio",52424
6649,159576,indoor,"chemistry_lab, fountain, biology_laboratory, discotheque, bar",52424
6650,159600,indoor,"restaurant_kitchen, chemistry_lab, clean_room, fountain, hot_spring",52424
6651,159624,indoor,"chemistry_lab, biology_laboratory, restaurant_kitchen, clean_room, bar",52424
6652,159648,indoor,"chemistry_lab, biology_laboratory, restaurant_kitchen, bar, fountain",52424
6653,159672,indoor,"chemistry_lab, restaurant_kitchen, biology_laboratory, bar, restaurant",52424
6654,159696,indoor,"chemistry_lab, restaurant_kitchen, music_studio, biology_laboratory, clean_room",52424
6655,159720,indoor,"chemistry_lab, discotheque, biology_laboratory, stage/indoor, bar",52424
6656,159744,outdoor,"hot_spring, fountain, mosque/outdoor, mausoleum, museum/indoor",52424
6657,159768,outdoor,"hot_spring, lake/natural, marsh, swamp, pond",52424
6658,159792,indoor,"clean_room, chemistry_lab, physics_laboratory, museum/indoor, dressing_room",52424
6659,159816,indoor,"dressing_room, museum/indoor, clean_room, shower, chemistry_lab",52424
6660,159840,indoor,"museum/indoor, clean_room, chemistry_lab, natural_history_museum, bar",52424
6661,159864,indoor,"basement, chemistry_lab, bank_vault, burial_chamber, engine_room",52424
6662,159888,indoor,"locker_room, elevator/door, bank_vault, jail_cell, bathroom",52424
6663,159912,indoor,"locker_room, bank_vault, bathroom, chemistry_lab, shower",52424
6664,159936,indoor,"discotheque, subway_station/platform, martial_arts_gym, music_studio, classroom",52424
6665,159960,indoor,"music_studio, discotheque, stage/indoor, dressing_room, classroom",52424
6666,159984,indoor,"clean_room, chemistry_lab, biology_laboratory, physics_laboratory, music_studio",52424
6667,160008,indoor,"clean_room, chemistry_lab, discotheque, biology_laboratory, stage/indoor",52424
6668,160032,indoor,"dressing_room, elevator/door, closet, shower, locker_room",52424
6669,160056,indoor,"discotheque, ballroom, stage/indoor, music_studio, bar",52424
6670,160080,outdoor,"hot_spring, discotheque, fire_station, bowling_alley, gas_station",52424
6671,160104,indoor,"clean_room, chemistry_lab, bank_vault, archive, locker_room",52424
6672,160128,indoor,"church/indoor, alcove, dressing_room, museum/indoor, art_gallery",52424
6673,160152,indoor,"shower, burial_chamber, museum/indoor, art_gallery, church/indoor",52424
6674,160176,indoor,"television_studio, stage/indoor, arena/performance, ballroom, music_studio",52424
6675,160200,indoor,"conference_center, television_studio, stage/outdoor, music_studio, airplane_cabin",52424
6676,160224,indoor,"clean_room, chemistry_lab, shower, stage/indoor, physics_laboratory",52424
6677,160248,outdoor,"tower, mosque/outdoor, ruin, fountain, water_tower",52424
6678,160272,outdoor,"burial_chamber, fountain, mausoleum, mosque/outdoor, church/indoor",52424
6679,160296,outdoor,"burial_chamber, tower, mausoleum, ruin, mosque/outdoor",52424
6680,160320,indoor,"art_gallery, alcove, burial_chamber, dressing_room, shower",52424
6681,160344,indoor,"burial_chamber, mosque/outdoor, church/indoor, mausoleum, museum/indoor",52424
6682,160368,indoor,"art_gallery, clean_room, escalator/indoor, artists_loft, museum/indoor",52424
6683,160392,indoor,"clean_room, art_gallery, escalator/indoor, museum/indoor, elevator/door",52424
6684,160416,indoor,"art_gallery, art_studio, clean_room, artists_loft, church/indoor",52424
6685,160440,indoor,"art_gallery, clean_room, museum/indoor, staircase, escalator/indoor",52424
6686,160464,indoor,"staircase, entrance_hall, church/indoor, mezzanine, art_gallery",52424
6687,160488,indoor,"staircase, entrance_hall, corridor, mezzanine, art_gallery",52424
6688,160512,indoor,"clean_room, locker_room, classroom, television_studio, lobby",52424
6689,160536,indoor,"chemistry_lab, clean_room, martial_arts_gym, biology_laboratory, stage/indoor",52424
6690,160560,indoor,"dressing_room, restaurant_kitchen, biology_laboratory, chemistry_lab, clean_room",52424
6691,160584,indoor,"clean_room, restaurant_kitchen, engine_room, physics_laboratory, airplane_cabin",52424
6692,160608,indoor,"television_studio, conference_center, clean_room, martial_arts_gym, office",52424
6693,160632,indoor,"escalator/indoor, music_studio, bank_vault, gymnasium/indoor, subway_station/platform",52424
6694,160656,indoor,"elevator_lobby, bank_vault, clean_room, entrance_hall, lobby",52424
6695,160680,indoor,"elevator_lobby, lobby, entrance_hall, clean_room, bank_vault",52424
6696,160704,indoor,"mezzanine, jail_cell, staircase, balcony/exterior, fire_escape",52424
6697,160728,indoor,"mezzanine, staircase, atrium/public, shopping_mall/indoor, balcony/exterior",52424
6698,160752,indoor,"mezzanine, staircase, balcony/exterior, atrium/public, jail_cell",52424
6699,160776,indoor,"mezzanine, staircase, atrium/public, balcony/exterior, shopping_mall/indoor",52424
6700,160800,indoor,"mezzanine, staircase, balcony/exterior, attic, atrium/public",52424
6701,160824,indoor,"mezzanine, staircase, atrium/public, entrance_hall, jail_cell",52424
6702,160848,indoor,"mezzanine, jail_cell, staircase, museum/indoor, atrium/public",52424
6703,160872,indoor,"mezzanine, staircase, jail_cell, pet_shop, atrium/public",52424
6704,160896,indoor,"mezzanine, jail_cell, staircase, basement, pet_shop",52424
6705,160920,indoor,"mezzanine, jail_cell, staircase, atrium/public, pet_shop",52424
6706,160944,indoor,"mezzanine, staircase, jail_cell, atrium/public, shopping_mall/indoor",52424
6707,160968,outdoor,"cemetery, igloo, residential_neighborhood, plaza, ski_resort",52424
6708,160992,outdoor,"cemetery, igloo, residential_neighborhood, ski_resort, ski_slope",52424
6709,161016,outdoor,"cemetery, playground, igloo, bridge, ski_slope",52424
6710,161040,indoor,"basement, shower, natural_history_museum, sauna, lobby",52424
6711,161064,indoor,"arena/rodeo, subway_station/platform, basement, stable, parking_garage/indoor",52424
6712,161088,indoor,"shower, bathroom, aquarium, igloo, natural_history_museum",52424
6713,161112,indoor,"igloo, airplane_cabin, chemistry_lab, basement, science_museum",52424
6714,161136,indoor,"archive, basement, jail_cell, bank_vault, clean_room",52424
6715,161160,indoor,"bank_vault, server_room, clean_room, elevator/door, elevator_lobby",52424
6716,161184,indoor,"server_room, clean_room, archive, sauna, elevator/door",52424
6717,161208,indoor,"clean_room, server_room, bank_vault, archive, locker_room",52424
6718,161232,indoor,"igloo, science_museum, museum/indoor, art_gallery, clean_room",52424
6719,161256,indoor,"clean_room, museum/indoor, art_gallery, chemistry_lab, shower",52424
6720,161280,indoor,"clean_room, igloo, artists_loft, museum/indoor, hotel_room",52424
6721,161304,indoor,"clean_room, museum/indoor, art_gallery, dressing_room, artists_loft",52424
6722,161328,indoor,"clean_room, art_gallery, artists_loft, museum/indoor, shower",52424
6723,161352,indoor,"clean_room, music_studio, discotheque, artists_loft, hotel_room",52424
6724,161376,indoor,"clean_room, music_studio, dressing_room, discotheque, art_gallery",52424
6725,161400,indoor,"clean_room, dressing_room, science_museum, chemistry_lab, natural_history_museum",52424
6726,161424,indoor,"clean_room, chemistry_lab, science_museum, biology_laboratory, natural_history_museum",52424
6727,161448,indoor,"clean_room, chemistry_lab, biology_laboratory, television_studio, museum/indoor",52424
6728,161472,indoor,"clean_room, chemistry_lab, museum/indoor, biology_laboratory, science_museum",52424
6729,161496,indoor,"clean_room, television_studio, stage/indoor, museum/indoor, chemistry_lab",52424
6730,161520,indoor,"clean_room, television_studio, chemistry_lab, biology_laboratory, reception",52424
6731,161544,indoor,"clean_room, chemistry_lab, biology_laboratory, discotheque, dressing_room",52424
6732,161568,indoor,"clean_room, chemistry_lab, science_museum, biology_laboratory, natural_history_museum",52424
6733,161592,indoor,"clean_room, television_studio, elevator/door, elevator_lobby, reception",52424
6734,161616,indoor,"clean_room, television_studio, elevator/door, conference_center, reception",52424
6735,161640,indoor,"discotheque, chemistry_lab, clean_room, dressing_room, biology_laboratory",52424
6736,161664,indoor,"chemistry_lab, music_studio, biology_laboratory, discotheque, clean_room",52424
6737,161688,indoor,"discotheque, clean_room, chemistry_lab, stage/indoor, music_studio",52424
6738,161712,indoor,"chemistry_lab, clean_room, discotheque, music_studio, stage/indoor",52424
6739,161736,indoor,"clean_room, chemistry_lab, biology_laboratory, jewelry_shop, science_museum",52424
6740,161760,indoor,"clean_room, chemistry_lab, biology_laboratory, science_museum, natural_history_museum",52424
6741,161784,indoor,"clean_room, natural_history_museum, chemistry_lab, biology_laboratory, science_museum",52424
6742,161808,indoor,"clean_room, chemistry_lab, biology_laboratory, stage/indoor, discotheque",52424
6743,161832,indoor,"clean_room, chemistry_lab, biology_laboratory, science_museum, natural_history_museum",52424
6744,161856,indoor,"clean_room, chemistry_lab, biology_laboratory, discotheque, science_museum",52424
6745,161880,indoor,"clean_room, chemistry_lab, biology_laboratory, restaurant_kitchen, discotheque",52424
6746,161904,indoor,"clean_room, chemistry_lab, biology_laboratory, dressing_room, discotheque",52424
6747,161928,indoor,"clean_room, chemistry_lab, biology_laboratory, science_museum, shower",52424
6748,161952,indoor,"clean_room, chemistry_lab, biology_laboratory, jewelry_shop, science_museum",52424
6749,161976,indoor,"chemistry_lab, biology_laboratory, office, clean_room, jewelry_shop",52424
6750,162000,indoor,"discotheque, chemistry_lab, biology_laboratory, beauty_salon, dressing_room",52424
6751,162024,indoor,"chemistry_lab, discotheque, biology_laboratory, beauty_salon, office",52424
6752,162048,indoor,"chemistry_lab, biology_laboratory, office, music_studio, beauty_salon",52424
6753,162072,indoor,"chemistry_lab, biology_laboratory, discotheque, beauty_salon, dressing_room",52424
6754,162096,indoor,"chemistry_lab, biology_laboratory, clean_room, discotheque, conference_center",52424
6755,162120,indoor,"chemistry_lab, biology_laboratory, conference_center, office, dressing_room",52424
6756,162144,indoor,"chemistry_lab, biology_laboratory, dressing_room, music_studio, discotheque",52424
6757,162168,indoor,"chemistry_lab, biology_laboratory, music_studio, physics_laboratory, clean_room",52424
6758,162192,indoor,"chemistry_lab, biology_laboratory, discotheque, physics_laboratory, dressing_room",52424
6759,162216,indoor,"chemistry_lab, biology_laboratory, office, music_studio, clean_room",52424
6760,162240,indoor,"chemistry_lab, biology_laboratory, clean_room, physics_laboratory, discotheque",52424
6761,162264,indoor,"chemistry_lab, biology_laboratory, physics_laboratory, clean_room, office",52424
6762,162288,outdoor,"fishpond, pond, lake/natural, aquarium, chemistry_lab",52424
6763,162312,outdoor,"pond, fishpond, discotheque, aquarium, lake/natural",52424
6764,162336,indoor,"chemistry_lab, discotheque, biology_laboratory, dressing_room, office",52424
6765,162360,indoor,"chemistry_lab, biology_laboratory, discotheque, beauty_salon, bar",52424
6766,162384,indoor,"chemistry_lab, biology_laboratory, discotheque, music_studio, office",52424
6767,162408,indoor,"chemistry_lab, biology_laboratory, office, clean_room, physics_laboratory",52424
6768,162432,indoor,"chemistry_lab, discotheque, biology_laboratory, dressing_room, beauty_salon",52424
6769,162456,indoor,"dressing_room, chemistry_lab, office, discotheque, beauty_salon",52424
6770,162480,indoor,"chemistry_lab, dressing_room, discotheque, biology_laboratory, office",52424
6771,162504,indoor,"chemistry_lab, dressing_room, biology_laboratory, office, clean_room",52424
6772,162528,indoor,"chemistry_lab, biology_laboratory, beauty_salon, clean_room, office",52424
6773,162552,indoor,"dressing_room, chemistry_lab, beauty_salon, discotheque, office",52424
6774,162576,indoor,"chemistry_lab, beauty_salon, dressing_room, discotheque, office",52424
6775,162600,indoor,"chemistry_lab, biology_laboratory, office, clean_room, beauty_salon",52424
6776,162624,indoor,"chemistry_lab, biology_laboratory, office, music_studio, office_cubicles",52424
6777,162648,indoor,"chemistry_lab, biology_laboratory, office, beauty_salon, office_cubicles",52424
6778,162672,indoor,"chemistry_lab, biology_laboratory, office, clean_room, physics_laboratory",52424
6779,162696,indoor,"chemistry_lab, biology_laboratory, clean_room, office, discotheque",52424
6780,162720,indoor,"chemistry_lab, biology_laboratory, music_studio, discotheque, science_museum",52424
6781,162744,indoor,"chemistry_lab, biology_laboratory, office, clean_room, office_cubicles",52424
6782,162768,indoor,"chemistry_lab, biology_laboratory, music_studio, dressing_room, discotheque",52424
6783,162792,indoor,"chemistry_lab, biology_laboratory, discotheque, music_studio, office",52424
6784,162816,indoor,"chemistry_lab, biology_laboratory, office, clean_room, physics_laboratory",52424
6785,162840,indoor,"chemistry_lab, office, biology_laboratory, office_cubicles, music_studio",52424
6786,162864,indoor,"chemistry_lab, biology_laboratory, beauty_salon, office, discotheque",52424
6787,162888,indoor,"chemistry_lab, biology_laboratory, office, beauty_salon, office_cubicles",52424
6788,162912,indoor,"chemistry_lab, biology_laboratory, discotheque, beauty_salon, office",52424
6789,162936,indoor,"chemistry_lab, biology_laboratory, clean_room, discotheque, office",52424
6790,162960,indoor,"chemistry_lab, discotheque, music_studio, biology_laboratory, stage/indoor",52424
6791,162984,indoor,"chemistry_lab, biology_laboratory, discotheque, music_studio, stage/indoor",52424
6792,163008,indoor,"chemistry_lab, biology_laboratory, discotheque, music_studio, office",52424
6793,163032,indoor,"chemistry_lab, biology_laboratory, discotheque, music_studio, bar",52424
6794,163056,indoor,"chemistry_lab, biology_laboratory, discotheque, music_studio, bar",52424
6795,163080,indoor,"chemistry_lab, biology_laboratory, discotheque, clean_room, science_museum",52424
6796,163104,indoor,"discotheque, art_gallery, artists_loft, ballroom, stage/indoor",52424
6797,163128,indoor,"discotheque, art_gallery, igloo, stage/indoor, museum/indoor",52424
6798,163152,indoor,"discotheque, shower, art_gallery, clean_room, aquarium",52424
6799,163176,indoor,"clean_room, shower, basement, elevator/door, bank_vault",52424
6800,163200,indoor,"basement, clean_room, oilrig, art_gallery, shower",52424
6801,163224,indoor,"discotheque, stage/indoor, shower, music_studio, hot_spring",52424
6802,163248,indoor,"clean_room, art_gallery, discotheque, shower, museum/indoor",52424
6803,163272,indoor,"museum/indoor, clean_room, art_gallery, archive, elevator_lobby",52424
6804,163296,indoor,"discotheque, basement, clean_room, shower, lobby",52424
6805,163320,indoor,"museum/indoor, science_museum, shower, airport_terminal, clean_room",52424
6806,163344,indoor,"elevator_lobby, elevator/door, lobby, airport_terminal, locker_room",52424
6807,163368,indoor,"clean_room, bank_vault, elevator/door, elevator_lobby, shower",52424
6808,163392,indoor,"jail_cell, archive, elevator/door, elevator_lobby, bank_vault",52424
6809,163416,indoor,"music_studio, clean_room, shower, discotheque, construction_site",52424
6810,163440,indoor,"tower, skyscraper, chemistry_lab, discotheque, bar",52424
6811,163464,indoor,"clean_room, chemistry_lab, biology_laboratory, restaurant_kitchen, physics_laboratory",52424
6812,163488,indoor,"clean_room, restaurant_kitchen, chemistry_lab, construction_site, assembly_line",52424
6813,163512,indoor,"clean_room, chemistry_lab, restaurant_kitchen, biology_laboratory, science_museum",52424
6814,163536,indoor,"clean_room, chemistry_lab, physics_laboratory, basement, music_studio",52424
6815,163560,indoor,"chemistry_lab, clean_room, basement, discotheque, music_studio",52424
6816,163584,indoor,"clean_room, science_museum, chemistry_lab, music_studio, discotheque",52424
6817,163608,indoor,"clean_room, chemistry_lab, science_museum, hospital_room, physics_laboratory",52424
6818,163632,indoor,"clean_room, discotheque, chemistry_lab, music_studio, bar",52424
6819,163656,indoor,"discotheque, music_studio, clean_room, stage/indoor, science_museum",52424
6820,163680,indoor,"discotheque, music_studio, science_museum, clean_room, chemistry_lab",52424
6821,163704,indoor,"discotheque, clean_room, chemistry_lab, music_studio, stage/indoor",52424
6822,163728,indoor,"clean_room, chemistry_lab, museum/indoor, science_museum, music_studio",52424
6823,163752,indoor,"clean_room, chemistry_lab, science_museum, operating_room, biology_laboratory",52424
6824,163776,indoor,"clean_room, igloo, playground, basement, chemistry_lab",52424
6825,163800,indoor,"clean_room, chemistry_lab, discotheque, physics_laboratory, ice_cream_parlor",52424
6826,163824,indoor,"clean_room, chemistry_lab, physics_laboratory, restaurant_kitchen, discotheque",52424
6827,163848,indoor,"clean_room, chemistry_lab, restaurant_kitchen, operating_room, biology_laboratory",52424
6828,163872,indoor,"chemistry_lab, clean_room, engine_room, biology_laboratory, physics_laboratory",52424
6829,163896,indoor,"igloo, clean_room, science_museum, museum/indoor, chemistry_lab",52424
6830,163920,indoor,"igloo, clean_room, chemistry_lab, discotheque, science_museum",52424
6831,163944,indoor,"chemistry_lab, clean_room, department_store, discotheque, science_museum",52424
6832,163968,indoor,"chemistry_lab, clean_room, gift_shop, science_museum, igloo",52424
6833,163992,indoor,"chemistry_lab, clean_room, science_museum, gift_shop, igloo",52424
6834,164016,indoor,"clean_room, chemistry_lab, igloo, science_museum, gift_shop",52424
6835,164040,indoor,"chemistry_lab, igloo, clean_room, discotheque, science_museum",52424
6836,164064,indoor,"clean_room, chemistry_lab, igloo, biology_laboratory, science_museum",52424
6837,164088,indoor,"clean_room, igloo, chemistry_lab, discotheque, biology_laboratory",52424
6838,164112,indoor,"clean_room, chemistry_lab, igloo, biology_laboratory, science_museum",52424
6839,164136,indoor,"clean_room, chemistry_lab, igloo, biology_laboratory, science_museum",52424
6840,164160,indoor,"clean_room, igloo, chemistry_lab, biology_laboratory, science_museum",52424
6841,164184,indoor,"clean_room, igloo, chemistry_lab, biology_laboratory, science_museum",52424
6842,164208,indoor,"clean_room, igloo, chemistry_lab, biology_laboratory, science_museum",52424
6843,164232,indoor,"clean_room, chemistry_lab, igloo, biology_laboratory, science_museum",52424
6844,164256,indoor,"clean_room, chemistry_lab, igloo, biology_laboratory, science_museum",52424
6845,164280,indoor,"igloo, clean_room, chemistry_lab, biology_laboratory, banquet_hall",52424
6846,164304,indoor,"igloo, clean_room, chemistry_lab, biology_laboratory, science_museum",52424
6847,164328,indoor,"clean_room, igloo, chemistry_lab, biology_laboratory, science_museum",52424
6848,164352,indoor,"clean_room, igloo, chemistry_lab, biology_laboratory, discotheque",52424
6849,164376,indoor,"clean_room, igloo, chemistry_lab, biology_laboratory, science_museum",52424
6850,164400,indoor,"clean_room, igloo, chemistry_lab, biology_laboratory, discotheque",52424
6851,164424,indoor,"clean_room, igloo, chemistry_lab, discotheque, science_museum",52424
6852,164448,indoor,"igloo, clean_room, chemistry_lab, science_museum, discotheque",52424
6853,164472,indoor,"clean_room, igloo, chemistry_lab, biology_laboratory, physics_laboratory",52424
6854,164496,indoor,"clean_room, igloo, chemistry_lab, banquet_hall, biology_laboratory",52424
6855,164520,indoor,"airplane_cabin, discotheque, department_store, chemistry_lab, office_cubicles",52424
6856,164544,indoor,"airplane_cabin, jewelry_shop, discotheque, chemistry_lab, clothing_store",52424
6857,164568,indoor,"airplane_cabin, jewelry_shop, chemistry_lab, clothing_store, discotheque",52424
6858,164592,indoor,"restaurant_kitchen, restaurant, kitchen, pub/indoor, ice_cream_parlor",52424
6859,164616,indoor,"clean_room, chemistry_lab, biology_laboratory, assembly_line, physics_laboratory",52424
6860,164640,indoor,"clean_room, igloo, restaurant_kitchen, chemistry_lab, biology_laboratory",52424
6861,164664,indoor,"clean_room, banquet_hall, restaurant, chemistry_lab, cafeteria",52424
6862,164688,indoor,"greenhouse/outdoor, bank_vault, clean_room, greenhouse/indoor, entrance_hall",52424
6863,164712,indoor,"bank_vault, clean_room, basement, greenhouse/outdoor, entrance_hall",52424
6864,164736,indoor,"entrance_hall, clean_room, basement, bank_vault, staircase",52424
6865,164760,indoor,"burial_chamber, igloo, clean_room, artists_loft, alcove",52424
6866,164784,indoor,"clean_room, artists_loft, bedchamber, attic, museum/indoor",52424
6867,164808,indoor,"clean_room, igloo, burial_chamber, artists_loft, museum/indoor",52424
6868,164832,indoor,"burial_chamber, igloo, alcove, museum/indoor, catacomb",52424
6869,164856,indoor,"burial_chamber, igloo, alcove, museum/indoor, artists_loft",52424
6870,164880,indoor,"burial_chamber, igloo, alcove, artists_loft, bedchamber",52424
6871,164904,indoor,"burial_chamber, clothing_store, bedchamber, bedroom, clean_room",52424
6872,164928,indoor,"bedchamber, bedroom, hotel_room, clothing_store, clean_room",52424
6873,164952,indoor,"attic, artists_loft, living_room, burial_chamber, igloo",52424
6874,164976,indoor,"burial_chamber, igloo, attic, museum/indoor, catacomb",52424
6875,165000,indoor,"burial_chamber, igloo, alcove, attic, artists_loft",52424
6876,165024,indoor,"burial_chamber, igloo, catacomb, alcove, museum/indoor",52424
6877,165048,indoor,"clean_room, staircase, escalator/indoor, museum/indoor, science_museum",52424
6878,165072,indoor,"music_studio, chemistry_lab, engine_room, boxing_ring, discotheque",52424
6879,165096,indoor,"science_museum, engine_room, chemistry_lab, museum/indoor, gymnasium/indoor",52424
6880,165120,indoor,"shower, bathroom, dressing_room, sauna, clean_room",52424
6881,165144,indoor,"bathroom, shower, kitchen, dressing_room, clean_room",52424
6882,165168,indoor,"bathroom, shower, kitchen, wet_bar, restaurant_kitchen",52424
6883,165192,indoor,"shower, bathroom, clean_room, restaurant_kitchen, chemistry_lab",52424
6884,165216,indoor,"clean_room, chemistry_lab, biology_laboratory, dressing_room, shower",52424
6885,165240,indoor,"dressing_room, shower, clean_room, locker_room, clothing_store",52424
6886,165264,indoor,"bathroom, shower, jacuzzi/indoor, art_gallery, bow_window/indoor",52424
6887,165288,indoor,"clean_room, chemistry_lab, department_store, science_museum, atrium/public",52424
6888,165312,indoor,"banquet_hall, clean_room, chemistry_lab, science_museum, restaurant",52424
6889,165336,indoor,"banquet_hall, chemistry_lab, clean_room, restaurant, science_museum",52424
6890,165360,indoor,"clean_room, chemistry_lab, department_store, biology_laboratory, banquet_hall",52424
6891,165384,indoor,"clean_room, chemistry_lab, department_store, banquet_hall, biology_laboratory",52424
6892,165408,indoor,"clean_room, chemistry_lab, banquet_hall, department_store, science_museum",52424
6893,165432,indoor,"clean_room, banquet_hall, chemistry_lab, science_museum, department_store",52424
6894,165456,indoor,"clean_room, chemistry_lab, banquet_hall, department_store, science_museum",52424
6895,165480,indoor,"clean_room, chemistry_lab, banquet_hall, department_store, science_museum",52424
6896,165504,indoor,"airplane_cabin, clothing_store, dressing_room, office_cubicles, clean_room",52424
6897,165528,indoor,"airplane_cabin, clothing_store, office_cubicles, dressing_room, jewelry_shop",52424
6898,165552,indoor,"airplane_cabin, office_cubicles, conference_room, conference_center, office",52424
6899,165576,indoor,"airplane_cabin, conference_center, office_cubicles, conference_room, airport_terminal",52424
6900,165600,indoor,"airplane_cabin, discotheque, wind_farm, conference_center, stage/indoor",52424
6901,165624,indoor,"discotheque, stage/indoor, attic, igloo, dressing_room",52424
6902,165648,indoor,"chemistry_lab, discotheque, biology_laboratory, music_studio, bar",52424
6903,165672,indoor,"chemistry_lab, discotheque, basement, biology_laboratory, airplane_cabin",52424
6904,165696,indoor,"restaurant_kitchen, kitchen, galley, restaurant, bathroom",52424
6905,165720,indoor,"restaurant_kitchen, galley, airplane_cabin, chemistry_lab, kitchen",52424
