,frame_num,environment,places,imdb_id
0,0,indoor,"kindergarden_classroom, nursery, playroom, childs_room, classroom",52424
1,24,indoor,"kindergarden_classroom, nursery, hospital_room, playroom, classroom",52424
2,48,outdoor,"sky, hot_spring, hayfield, wheat_field, valley",52424
3,72,outdoor,"sky, wheat_field, field/wild, pasture, corn_field",52424
4,96,outdoor,"sky, wheat_field, field/wild, pasture, hot_spring",52424
5,120,outdoor,"sky, wheat_field, hot_spring, pasture, field/wild",52424
6,144,outdoor,"sky, wheat_field, field/wild, pasture, wind_farm",52424
7,168,outdoor,"sky, wheat_field, field/wild, pasture, forest/broadleaf",52424
8,192,outdoor,"sky, wheat_field, field/wild, pasture, forest/broadleaf",52424
9,216,outdoor,"sky, wheat_field, field/wild, pasture, forest/broadleaf",52424
10,240,outdoor,"sky, wheat_field, field/wild, forest/broadleaf, pasture",52424
11,264,outdoor,"sky, wheat_field, field/wild, pasture, tree_farm",52424
12,288,outdoor,"sky, wheat_field, field/wild, pasture, tree_farm",52424
13,312,outdoor,"sky, wheat_field, field/wild, wind_farm, tree_farm",52424
14,336,outdoor,"sky, wheat_field, field/wild, pasture, tree_farm",52424
15,360,outdoor,"sky, wheat_field, wind_farm, orchard, amusement_park",52424
16,384,outdoor,"sky, wheat_field, amusement_park, tower, wind_farm",52424
17,408,outdoor,"sky, wind_farm, wheat_field, mosque/outdoor, amusement_park",52424
18,432,outdoor,"sky, tree_farm, orchard, wheat_field, rainforest",52424
19,456,outdoor,"sky, wheat_field, hot_spring, wind_farm, mosque/outdoor",52424
20,480,outdoor,"discotheque, igloo, sky, hot_spring, attic",52424
21,504,indoor,"basement, discotheque, hot_spring, igloo, aquarium",52424
22,528,indoor,"discotheque, igloo, martial_arts_gym, jail_cell, hot_spring",52424
23,552,indoor,"discotheque, stage/indoor, clean_room, chemistry_lab, music_studio",52424
24,576,indoor,"stage/indoor, lighthouse, arena/performance, discotheque, conference_center",52424
25,600,indoor,"desert/sand, staircase, art_gallery, parking_garage/indoor, museum/indoor",52424
26,624,indoor,"parking_garage/indoor, staircase, art_gallery, parking_lot, desert/sand",52424
27,648,indoor,"elevator/door, bank_vault, elevator_lobby, locker_room, shower",52424
28,672,indoor,"booth/indoor, elevator/door, coffee_shop, museum/indoor, drugstore",52424
29,696,indoor,"cemetery, booth/indoor, burial_chamber, museum/indoor, coffee_shop",52424
30,720,indoor,"cemetery, booth/indoor, coffee_shop, drugstore, museum/indoor",52424
31,744,outdoor,"sky, iceberg, ice_floe, ice_shelf, igloo",52424
32,768,outdoor,"igloo, sky, ice_floe, iceberg, ice_shelf",52424
33,792,outdoor,"iceberg, ice_shelf, ice_floe, igloo, desert/sand",52424
34,816,outdoor,"wheat_field, field/wild, pasture, hayfield, field/cultivated",52424
35,840,outdoor,"wheat_field, field/wild, pasture, water_tower, field/cultivated",52424
36,864,outdoor,"wheat_field, field/wild, field/cultivated, pasture, farm",52424
37,888,outdoor,"wheat_field, field/wild, oast_house, wind_farm, watering_hole",52424
38,912,outdoor,"desert/sand, desert_road, sky, beach, wheat_field",52424
39,936,outdoor,"cemetery, fountain, hot_spring, igloo, mosque/outdoor",52424
40,960,outdoor,"igloo, cemetery, ice_floe, ice_shelf, fountain",52424
41,984,outdoor,"hot_spring, igloo, ice_floe, fountain, cemetery",52424
42,1008,outdoor,"ice_floe, igloo, ice_shelf, hot_spring, watering_hole",52424
43,1032,outdoor,"discotheque, chemistry_lab, wind_farm, mosque/outdoor, igloo",52424
44,1056,indoor,"discotheque, chemistry_lab, aquarium, biology_laboratory, fountain",52424
45,1080,outdoor,"cemetery, burial_chamber, badlands, hot_spring, igloo",52424
46,1104,indoor,"elevator/door, cemetery, elevator_lobby, booth/indoor, pharmacy",52424
47,1128,outdoor,"sky, hot_spring, rainforest, wheat_field, waterfall",52424
48,1152,outdoor,"sky, wheat_field, field/wild, pasture, hayfield",52424
49,1176,outdoor,"sky, wheat_field, field/wild, pasture, desert/sand",52424
50,1200,outdoor,"sky, wheat_field, field/wild, hot_spring, pasture",52424
51,1224,outdoor,"sky, wheat_field, field/wild, pasture, orchard",52424
52,1248,outdoor,"sky, wheat_field, field/wild, hot_spring, pasture",52424
53,1272,outdoor,"sky, wheat_field, hayfield, field/wild, pasture",52424
54,1296,outdoor,"sky, valley, wheat_field, hayfield, hot_spring",52424
55,1320,outdoor,"sky, desert/sand, mountain_snowy, valley, hayfield",52424
56,1344,indoor,"nursery, kindergarden_classroom, hospital, childs_room, industrial_area",52424
57,1368,outdoor,"manufactured_home, yard, shed, cottage, house",52424
58,1392,outdoor,"schoolhouse, house, cottage, manufactured_home, yard",52424
59,1416,outdoor,"courtyard, yard, chemistry_lab, shower, beer_garden",52424
60,1440,indoor,"beauty_salon, chemistry_lab, hospital_room, jewelry_shop, nursery",52424
61,1464,indoor,"chemistry_lab, beauty_salon, jewelry_shop, biology_laboratory, hospital_room",52424
62,1488,indoor,"chemistry_lab, beauty_salon, biology_laboratory, jewelry_shop, pharmacy",52424
63,1512,indoor,"chemistry_lab, biology_laboratory, jewelry_shop, beauty_salon, gift_shop",52424
64,1536,indoor,"coffee_shop, beauty_salon, restaurant, reception, conference_center",52424
65,1560,indoor,"jacuzzi/indoor, swimming_pool/indoor, hot_spring, discotheque, chemistry_lab",52424
66,1584,indoor,"discotheque, conference_center, stage/indoor, swimming_pool/indoor, music_studio",52424
67,1608,indoor,"conference_center, discotheque, arena/performance, stage/indoor, ballroom",52424
68,1632,indoor,"arena/performance, discotheque, conference_center, ballroom, stage/indoor",52424
69,1656,indoor,"arena/performance, discotheque, conference_center, bar, ballroom",52424
70,1680,indoor,"arena/performance, museum/indoor, ballroom, stage/indoor, conference_center",52424
71,1704,indoor,"arena/performance, discotheque, conference_center, ballroom, museum/indoor",52424
72,1728,indoor,"arena/performance, stage/indoor, museum/indoor, conference_center, discotheque",52424
73,1752,indoor,"arena/performance, stage/indoor, ballroom, discotheque, conference_center",52424
74,1776,indoor,"jewelry_shop, arena/performance, ballroom, conference_center, beauty_salon",52424
75,1800,indoor,"arena/performance, conference_center, museum/indoor, ballroom, stage/indoor",52424
76,1824,indoor,"conference_center, arena/performance, jewelry_shop, stage/indoor, discotheque",52424
77,1848,indoor,"jewelry_shop, conference_center, arena/performance, stage/indoor, banquet_hall",52424
78,1872,indoor,"jewelry_shop, conference_center, arena/performance, museum/indoor, stage/indoor",52424
79,1896,indoor,"conference_center, arena/performance, jewelry_shop, stage/indoor, museum/indoor",52424
80,1920,indoor,"arena/performance, conference_center, stage/indoor, music_studio, discotheque",52424
81,1944,indoor,"conference_center, arena/performance, jewelry_shop, stage/indoor, music_studio",52424
82,1968,indoor,"conference_center, jewelry_shop, arena/performance, museum/indoor, bar",52424
83,1992,indoor,"conference_center, arena/performance, museum/indoor, jewelry_shop, stage/indoor",52424
84,2016,indoor,"conference_center, arena/performance, stage/indoor, museum/indoor, jewelry_shop",52424
85,2040,indoor,"arena/performance, conference_center, stage/indoor, music_studio, museum/indoor",52424
86,2064,indoor,"arena/performance, conference_center, stage/indoor, music_studio, television_studio",52424
87,2088,indoor,"conference_center, jewelry_shop, arena/performance, television_studio, music_studio",52424
88,2112,indoor,"conference_center, museum/indoor, arena/performance, jewelry_shop, music_studio",52424
89,2136,indoor,"conference_center, arena/performance, music_studio, museum/indoor, stage/indoor",52424
90,2160,indoor,"arena/performance, conference_center, music_studio, stage/indoor, museum/indoor",52424
91,2184,indoor,"arena/performance, music_studio, stage/indoor, conference_center, museum/indoor",52424
92,2208,indoor,"arena/performance, conference_center, stage/indoor, music_studio, museum/indoor",52424
93,2232,indoor,"arena/performance, conference_center, stage/indoor, music_studio, museum/indoor",52424
94,2256,indoor,"arena/performance, conference_center, stage/indoor, museum/indoor, music_studio",52424
95,2280,indoor,"arena/performance, conference_center, museum/indoor, stage/indoor, music_studio",52424
96,2304,indoor,"arena/performance, conference_center, stage/indoor, museum/indoor, music_studio",52424
97,2328,indoor,"arena/performance, stage/indoor, museum/indoor, music_studio, conference_center",52424
98,2352,indoor,"arena/performance, conference_center, stage/indoor, museum/indoor, music_studio",52424
99,2376,indoor,"arena/performance, conference_center, stage/indoor, music_studio, museum/indoor",52424
100,2400,indoor,"arena/performance, conference_center, stage/indoor, music_studio, discotheque",52424
101,2424,indoor,"arena/performance, conference_center, stage/indoor, music_studio, discotheque",52424
102,2448,indoor,"arena/performance, conference_center, stage/indoor, music_studio, museum/indoor",52424
103,2472,indoor,"arena/performance, conference_center, stage/indoor, museum/indoor, music_studio",52424
104,2496,indoor,"arena/performance, conference_center, stage/indoor, music_studio, museum/indoor",52424
105,2520,indoor,"arena/performance, conference_center, stage/indoor, museum/indoor, discotheque",52424
106,2544,indoor,"arena/performance, conference_center, stage/indoor, television_studio, music_studio",52424
107,2568,indoor,"conference_center, arena/performance, stage/indoor, television_studio, music_studio",52424
108,2592,indoor,"arena/performance, conference_center, stage/indoor, music_studio, discotheque",52424
109,2616,indoor,"arena/performance, conference_center, stage/indoor, discotheque, music_studio",52424
110,2640,indoor,"discotheque, stage/indoor, music_studio, bar, television_studio",52424
111,2664,indoor,"discotheque, music_studio, bar, conference_center, stage/indoor",52424
112,2688,indoor,"discotheque, bar, music_studio, conference_center, stage/indoor",52424
113,2712,indoor,"discotheque, conference_center, bar, chemistry_lab, music_studio",52424
114,2736,indoor,"discotheque, bar, chemistry_lab, conference_center, music_studio",52424
115,2760,indoor,"discotheque, bar, chemistry_lab, music_studio, conference_center",52424
116,2784,indoor,"discotheque, bar, music_studio, chemistry_lab, conference_center",52424
117,2808,indoor,"discotheque, bar, music_studio, chemistry_lab, stage/indoor",52424
118,2832,indoor,"discotheque, bar, chemistry_lab, music_studio, conference_center",52424
119,2856,indoor,"discotheque, bar, music_studio, television_studio, beauty_salon",52424
120,2880,indoor,"discotheque, bar, music_studio, television_studio, pub/indoor",52424
121,2904,indoor,"discotheque, bar, music_studio, conference_center, chemistry_lab",52424
122,2928,indoor,"beauty_salon, discotheque, music_studio, bar, television_studio",52424
123,2952,indoor,"bar, discotheque, television_studio, beauty_salon, conference_center",52424
124,2976,indoor,"bar, discotheque, music_studio, beauty_salon, conference_center",52424
125,3000,indoor,"bar, discotheque, beauty_salon, music_studio, chemistry_lab",52424
126,3024,indoor,"discotheque, bar, chemistry_lab, beauty_salon, music_studio",52424
127,3048,indoor,"discotheque, bar, music_studio, chemistry_lab, television_studio",52424
128,3072,indoor,"discotheque, music_studio, bar, beauty_salon, television_studio",52424
129,3096,indoor,"discotheque, chemistry_lab, bar, music_studio, stage/indoor",52424
130,3120,indoor,"discotheque, music_studio, chemistry_lab, science_museum, bar",52424
131,3144,indoor,"discotheque, music_studio, bar, chemistry_lab, science_museum",52424
132,3168,indoor,"bar, discotheque, chemistry_lab, conference_center, nursing_home",52424
133,3192,indoor,"chemistry_lab, discotheque, music_studio, conference_center, bar",52424
134,3216,indoor,"music_studio, conference_center, discotheque, bar, jewelry_shop",52424
135,3240,indoor,"music_studio, discotheque, conference_center, bar, jewelry_shop",52424
136,3264,indoor,"music_studio, conference_center, discotheque, jewelry_shop, chemistry_lab",52424
137,3288,indoor,"music_studio, conference_center, discotheque, television_studio, physics_laboratory",52424
138,3312,indoor,"conference_center, discotheque, music_studio, bar, chemistry_lab",52424
139,3336,indoor,"conference_center, music_studio, discotheque, chemistry_lab, bar",52424
140,3360,indoor,"chemistry_lab, discotheque, bar, conference_center, music_studio",52424
141,3384,indoor,"conference_center, chemistry_lab, physics_laboratory, bar, television_studio",52424
142,3408,indoor,"conference_center, chemistry_lab, physics_laboratory, bar, beauty_salon",52424
143,3432,indoor,"discotheque, bar, music_studio, chemistry_lab, conference_center",52424
144,3456,indoor,"beauty_salon, dressing_room, television_studio, conference_center, music_studio",52424
145,3480,indoor,"television_studio, beauty_salon, music_studio, art_gallery, physics_laboratory",52424
146,3504,indoor,"beauty_salon, television_studio, music_studio, art_gallery, dressing_room",52424
147,3528,indoor,"music_studio, television_studio, beauty_salon, conference_center, discotheque",52424
148,3552,indoor,"restaurant, cafeteria, chemistry_lab, coffee_shop, food_court",52424
149,3576,indoor,"restaurant, chemistry_lab, cafeteria, food_court, bar",52424
150,3600,indoor,"restaurant, chemistry_lab, jewelry_shop, cafeteria, sushi_bar",52424
151,3624,indoor,"chemistry_lab, restaurant, jewelry_shop, reception, cafeteria",52424
152,3648,indoor,"restaurant, chemistry_lab, reception, jewelry_shop, office",52424
153,3672,indoor,"chemistry_lab, jewelry_shop, reception, office, restaurant",52424
154,3696,indoor,"chemistry_lab, reception, jewelry_shop, office, restaurant",52424
155,3720,indoor,"reception, chemistry_lab, office, restaurant, jewelry_shop",52424
156,3744,indoor,"chemistry_lab, reception, office, restaurant, biology_laboratory",52424
157,3768,indoor,"restaurant, cafeteria, coffee_shop, chemistry_lab, jewelry_shop",52424
158,3792,indoor,"restaurant, cafeteria, coffee_shop, food_court, jewelry_shop",52424
159,3816,indoor,"art_gallery, dressing_room, music_studio, shower, museum/indoor",52424
160,3840,indoor,"art_gallery, dressing_room, music_studio, museum/indoor, physics_laboratory",52424
161,3864,indoor,"art_gallery, dressing_room, music_studio, television_studio, museum/indoor",52424
162,3888,indoor,"music_studio, art_gallery, dressing_room, museum/indoor, television_studio",52424
163,3912,indoor,"art_gallery, music_studio, dressing_room, museum/indoor, physics_laboratory",52424
164,3936,indoor,"art_gallery, music_studio, dressing_room, museum/indoor, art_studio",52424
165,3960,indoor,"art_gallery, dressing_room, museum/indoor, music_studio, art_studio",52424
166,3984,indoor,"art_gallery, dressing_room, museum/indoor, music_studio, art_studio",52424
167,4008,indoor,"art_gallery, dressing_room, museum/indoor, jewelry_shop, art_studio",52424
168,4032,indoor,"art_gallery, dressing_room, art_studio, museum/indoor, music_studio",52424
169,4056,indoor,"restaurant, coffee_shop, chemistry_lab, jewelry_shop, restaurant_kitchen",52424
170,4080,indoor,"coffee_shop, restaurant, chemistry_lab, jewelry_shop, food_court",52424
171,4104,indoor,"coffee_shop, restaurant, jewelry_shop, food_court, restaurant_kitchen",52424
172,4128,indoor,"coffee_shop, restaurant, food_court, chemistry_lab, biology_laboratory",52424
173,4152,indoor,"coffee_shop, restaurant, food_court, restaurant_kitchen, ice_cream_parlor",52424
174,4176,indoor,"art_gallery, museum/indoor, dressing_room, shower, music_studio",52424
175,4200,indoor,"art_gallery, music_studio, dressing_room, museum/indoor, shower",52424
176,4224,indoor,"art_gallery, museum/indoor, dressing_room, music_studio, art_studio",52424
177,4248,indoor,"art_gallery, music_studio, dressing_room, museum/indoor, beauty_salon",52424
178,4272,indoor,"art_gallery, jewelry_shop, music_studio, dressing_room, museum/indoor",52424
179,4296,indoor,"music_studio, art_gallery, dressing_room, jewelry_shop, museum/indoor",52424
180,4320,indoor,"art_gallery, music_studio, dressing_room, museum/indoor, art_studio",52424
181,4344,indoor,"art_gallery, museum/indoor, music_studio, television_studio, art_studio",52424
182,4368,indoor,"art_gallery, music_studio, museum/indoor, television_studio, physics_laboratory",52424
183,4392,indoor,"restaurant, coffee_shop, food_court, cafeteria, restaurant_kitchen",52424
184,4416,indoor,"coffee_shop, restaurant, food_court, cafeteria, chemistry_lab",52424
185,4440,indoor,"restaurant, coffee_shop, food_court, cafeteria, restaurant_kitchen",52424
186,4464,indoor,"restaurant, sushi_bar, coffee_shop, cafeteria, office",52424
187,4488,indoor,"chemistry_lab, biology_laboratory, science_museum, jewelry_shop, restaurant_kitchen",52424
188,4512,indoor,"restaurant, coffee_shop, cafeteria, bar, ice_cream_parlor",52424
189,4536,indoor,"chemistry_lab, bar, restaurant, sushi_bar, coffee_shop",52424
190,4560,indoor,"chemistry_lab, restaurant, bar, biology_laboratory, restaurant_kitchen",52424
191,4584,indoor,"chemistry_lab, restaurant, restaurant_kitchen, biology_laboratory, bar",52424
192,4608,indoor,"chemistry_lab, restaurant, bar, biology_laboratory, beer_hall",52424
193,4632,indoor,"chemistry_lab, restaurant, bar, biology_laboratory, restaurant_kitchen",52424
194,4656,indoor,"chemistry_lab, restaurant, biology_laboratory, restaurant_kitchen, bar",52424
195,4680,indoor,"art_gallery, art_studio, museum/indoor, dressing_room, jewelry_shop",52424
196,4704,indoor,"art_gallery, museum/indoor, art_studio, dressing_room, jewelry_shop",52424
197,4728,indoor,"dressing_room, art_gallery, music_studio, television_studio, shower",52424
198,4752,indoor,"art_gallery, dressing_room, music_studio, museum/indoor, television_studio",52424
199,4776,indoor,"dressing_room, art_gallery, music_studio, museum/indoor, shower",52424
200,4800,indoor,"discotheque, music_studio, conference_center, stage/indoor, biology_laboratory",52424
201,4824,indoor,"conference_center, music_studio, discotheque, science_museum, chemistry_lab",52424
202,4848,indoor,"conference_center, legislative_chamber, bar, music_studio, discotheque",52424
203,4872,indoor,"conference_center, music_studio, nursing_home, discotheque, stage/indoor",52424
204,4896,indoor,"conference_center, legislative_chamber, stage/indoor, music_studio, discotheque",52424
205,4920,indoor,"music_studio, conference_center, jewelry_shop, chemistry_lab, bar",52424
206,4944,indoor,"conference_center, legislative_chamber, nursing_home, jewelry_shop, music_studio",52424
207,4968,indoor,"music_studio, conference_center, jewelry_shop, bar, discotheque",52424
208,4992,indoor,"conference_center, music_studio, stage/indoor, discotheque, bar",52424
209,5016,indoor,"conference_center, music_studio, jewelry_shop, bar, nursing_home",52424
210,5040,indoor,"conference_center, jewelry_shop, bar, music_studio, sushi_bar",52424
211,5064,indoor,"nursing_home, jewelry_shop, music_studio, conference_center, chemistry_lab",52424
212,5088,indoor,"restaurant_kitchen, chemistry_lab, restaurant, jewelry_shop, biology_laboratory",52424
213,5112,indoor,"conference_center, nursing_home, banquet_hall, legislative_chamber, jewelry_shop",52424
214,5136,indoor,"chemistry_lab, beauty_salon, museum/indoor, biology_laboratory, pub/indoor",52424
215,5160,indoor,"chemistry_lab, museum/indoor, jewelry_shop, swimming_pool/indoor, biology_laboratory",52424
216,5184,indoor,"jewelry_shop, chemistry_lab, banquet_hall, biology_laboratory, restaurant",52424
217,5208,indoor,"jewelry_shop, beauty_salon, pub/indoor, banquet_hall, discotheque",52424
218,5232,indoor,"discotheque, ballroom, swimming_pool/indoor, pub/indoor, banquet_hall",52424
219,5256,indoor,"chemistry_lab, swimming_pool/indoor, museum/indoor, conference_center, discotheque",52424
220,5280,indoor,"chemistry_lab, biology_laboratory, swimming_pool/indoor, jacuzzi/indoor, pub/indoor",52424
221,5304,indoor,"swimming_pool/indoor, jacuzzi/indoor, hot_spring, pub/indoor, chemistry_lab",52424
222,5328,indoor,"jewelry_shop, reception, restaurant, jacuzzi/indoor, bar",52424
223,5352,indoor,"jewelry_shop, reception, kitchen, chemistry_lab, restaurant",52424
224,5376,indoor,"jewelry_shop, reception, television_studio, restaurant, ice_cream_parlor",52424
225,5400,indoor,"jewelry_shop, reception, restaurant, television_studio, jacuzzi/indoor",52424
226,5424,indoor,"jewelry_shop, reception, jacuzzi/indoor, television_studio, restaurant",52424
227,5448,indoor,"jewelry_shop, reception, jacuzzi/indoor, restaurant, television_studio",52424
228,5472,indoor,"jewelry_shop, jacuzzi/indoor, reception, restaurant, bathroom",52424
229,5496,indoor,"jewelry_shop, reception, jacuzzi/indoor, television_studio, restaurant",52424
230,5520,indoor,"jewelry_shop, reception, jacuzzi/indoor, science_museum, television_studio",52424
231,5544,indoor,"jewelry_shop, reception, jacuzzi/indoor, restaurant, television_studio",52424
232,5568,indoor,"jewelry_shop, reception, science_museum, jacuzzi/indoor, museum/indoor",52424
233,5592,indoor,"reception, jewelry_shop, television_studio, conference_center, science_museum",52424
234,5616,indoor,"jewelry_shop, reception, science_museum, television_studio, jacuzzi/indoor",52424
235,5640,indoor,"jacuzzi/indoor, reception, science_museum, restaurant, television_studio",52424
236,5664,indoor,"museum/indoor, science_museum, reception, jewelry_shop, television_studio",52424
237,5688,indoor,"kindergarden_classroom, nursery, playroom, childs_room, classroom",52424
238,5712,indoor,"oilrig, chemistry_lab, art_gallery, music_studio, television_studio",52424
239,5736,indoor,"chemistry_lab, physics_laboratory, bar, biology_laboratory, restaurant_kitchen",52424
240,5760,indoor,"clean_room, lobby, chemistry_lab, restaurant_kitchen, biology_laboratory",52424
241,5784,indoor,"chemistry_lab, jewelry_shop, biology_laboratory, clean_room, physics_laboratory",52424
242,5808,indoor,"chemistry_lab, physics_laboratory, jewelry_shop, museum/indoor, clean_room",52424
243,5832,indoor,"chemistry_lab, biology_laboratory, jewelry_shop, physics_laboratory, shower",52424
244,5856,indoor,"chemistry_lab, biology_laboratory, shower, physics_laboratory, museum/indoor",52424
245,5880,indoor,"chemistry_lab, biology_laboratory, clean_room, jail_cell, shower",52424
246,5904,indoor,"chemistry_lab, jewelry_shop, biology_laboratory, bathroom, shower",52424
247,5928,indoor,"bank_vault, medina, basement, museum/indoor, shed",52424
248,5952,indoor,"bank_vault, basement, museum/indoor, science_museum, medina",52424
249,5976,indoor,"basement, burial_chamber, alcove, bank_vault, entrance_hall",52424
250,6000,indoor,"greenhouse/outdoor, bank_vault, greenhouse/indoor, shed, science_museum",52424
251,6024,indoor,"doorway/outdoor, bank_vault, shower, bathroom, elevator/door",52424
252,6048,outdoor,"staircase, greenhouse/outdoor, yard, courtyard, patio",52424
253,6072,outdoor,"greenhouse/outdoor, museum/indoor, doorway/outdoor, patio, museum/outdoor",52424
254,6096,outdoor,"greenhouse/outdoor, yard, patio, museum/outdoor, topiary_garden",52424
255,6120,indoor,"patio, yard, clothing_store, museum/indoor, dressing_room",52424
256,6144,outdoor,"campus, greenhouse/outdoor, elevator_lobby, shed, yard",52424
257,6168,indoor,"elevator_lobby, patio, shower, bow_window/indoor, greenhouse/outdoor",52424
258,6192,outdoor,"patio, elevator_lobby, campus, courtyard, porch",52424
259,6216,outdoor,"patio, elevator_lobby, campus, lobby, courtyard",52424
260,6240,indoor,"clean_room, chemistry_lab, biology_laboratory, office, shower",52424
261,6264,indoor,"dressing_room, chemistry_lab, clean_room, restaurant_kitchen, science_museum",52424
262,6288,indoor,"museum/indoor, clean_room, sauna, art_gallery, science_museum",52424
263,6312,indoor,"museum/indoor, art_gallery, clean_room, physics_laboratory, science_museum",52424
264,6336,indoor,"museum/indoor, art_gallery, science_museum, clean_room, physics_laboratory",52424
265,6360,indoor,"biology_laboratory, chemistry_lab, clean_room, restaurant, bar",52424
266,6384,indoor,"restaurant, hot_spring, sushi_bar, sauna, bowling_alley",52424
267,6408,indoor,"science_museum, museum/indoor, clean_room, natural_history_museum, art_gallery",52424
268,6432,indoor,"museum/indoor, science_museum, locker_room, bank_vault, dressing_room",52424
269,6456,indoor,"jewelry_shop, science_museum, museum/indoor, bank_vault, natural_history_museum",52424
270,6480,indoor,"jewelry_shop, bathroom, bar, bank_vault, wet_bar",52424
271,6504,indoor,"bathroom, jewelry_shop, bank_vault, shower, dressing_room",52424
272,6528,indoor,"bathroom, jewelry_shop, bank_vault, shower, locker_room",52424
273,6552,indoor,"bathroom, bank_vault, jewelry_shop, shower, wet_bar",52424
274,6576,indoor,"bank_vault, bathroom, shower, jewelry_shop, wet_bar",52424
275,6600,indoor,"bathroom, bank_vault, shower, locker_room, wet_bar",52424
276,6624,indoor,"museum/indoor, art_gallery, archive, clean_room, dressing_room",52424
277,6648,indoor,"shower, hot_spring, discotheque, fountain, dressing_room",52424
278,6672,indoor,"burial_chamber, jail_cell, basement, catacomb, museum/indoor",52424
279,6696,indoor,"burial_chamber, museum/indoor, igloo, bank_vault, basement",52424
280,6720,indoor,"burial_chamber, museum/indoor, igloo, bank_vault, jail_cell",52424
281,6744,indoor,"clean_room, shower, museum/indoor, jewelry_shop, science_museum",52424
282,6768,indoor,"clean_room, shower, museum/indoor, chemistry_lab, jewelry_shop",52424
283,6792,indoor,"shower, clean_room, chemistry_lab, science_museum, natural_history_museum",52424
284,6816,indoor,"discotheque, stage/indoor, chemistry_lab, music_studio, shower",52424
285,6840,indoor,"discotheque, stage/indoor, arena/performance, science_museum, aquarium",52424
286,6864,indoor,"discotheque, arena/performance, stage/indoor, ballroom, music_studio",52424
