,frame_num,environment,places,imdb_id
2229,53496,indoor,"elevator/door, elevator_lobby, museum/indoor, jewelry_shop, art_gallery",52424
2230,53520,indoor,"elevator_lobby, elevator/door, museum/indoor, art_gallery, legislative_chamber",52424
2231,53544,indoor,"museum/indoor, elevator_lobby, legislative_chamber, elevator/door, office",52424
2232,53568,indoor,"elevator/door, elevator_lobby, physics_laboratory, bank_vault, legislative_chamber",52424
2233,53592,indoor,"elevator/door, elevator_lobby, physics_laboratory, museum/indoor, office",52424
2234,53616,indoor,"elevator/door, elevator_lobby, art_gallery, museum/indoor, jewelry_shop",52424
2235,53640,indoor,"elevator/door, elevator_lobby, army_base, museum/indoor, art_gallery",52424
2236,53664,indoor,"elevator/door, elevator_lobby, museum/indoor, art_gallery, army_base",52424
2237,53688,indoor,"elevator_lobby, elevator/door, museum/indoor, art_gallery, office",52424
2238,53712,indoor,"chemistry_lab, jewelry_shop, art_gallery, physics_laboratory, biology_laboratory",52424
2239,53736,indoor,"clean_room, chemistry_lab, restaurant_kitchen, bank_vault, physics_laboratory",52424
2240,53760,indoor,"clean_room, chemistry_lab, biology_laboratory, museum/indoor, physics_laboratory",52424
2241,53784,indoor,"chemistry_lab, biology_laboratory, pharmacy, art_gallery, clean_room",52424
2242,53808,indoor,"restaurant_kitchen, chemistry_lab, clean_room, science_museum, bar",52424
2243,53832,indoor,"bank_vault, engine_room, restaurant_kitchen, science_museum, chemistry_lab",52424
2244,53856,indoor,"basement, jail_cell, igloo, engine_room, chemistry_lab",52424
2245,53880,indoor,"basement, medina, bank_vault, igloo, jail_cell",52424
2246,53904,indoor,"bank_vault, alcove, medina, basement, museum/indoor",52424
2247,53928,indoor,"alcove, medina, basement, bank_vault, jail_cell",52424
2248,53952,indoor,"alcove, medina, basement, igloo, bank_vault",52424
2249,53976,indoor,"medina, alcove, bank_vault, basement, igloo",52424
2250,54000,indoor,"medina, alcove, pizzeria, basement, igloo",52424
2251,54024,indoor,"medina, burial_chamber, bank_vault, art_gallery, alley",52424
2252,54048,indoor,"chemistry_lab, phone_booth, biology_laboratory, beauty_salon, physics_laboratory",52424
2253,54072,indoor,"chemistry_lab, phone_booth, shower, music_studio, bar",52424
2254,54096,indoor,"chemistry_lab, phone_booth, bar, music_studio, shower",52424
2255,54120,indoor,"chemistry_lab, bar, phone_booth, biology_laboratory, physics_laboratory",52424
2256,54144,indoor,"bar, chemistry_lab, airplane_cabin, music_studio, phone_booth",52424
2257,54168,indoor,"bar, chemistry_lab, music_studio, airplane_cabin, discotheque",52424
2258,54192,indoor,"chemistry_lab, bar, beauty_salon, music_studio, physics_laboratory",52424
2259,54216,indoor,"chemistry_lab, bar, music_studio, discotheque, beauty_salon",52424
2260,54240,indoor,"beauty_salon, bar, music_studio, chemistry_lab, airplane_cabin",52424
2261,54264,indoor,"chemistry_lab, beauty_salon, bar, music_studio, airplane_cabin",52424
2262,54288,indoor,"chemistry_lab, bar, beauty_salon, biology_laboratory, physics_laboratory",52424
2263,54312,indoor,"chemistry_lab, bar, beauty_salon, biology_laboratory, server_room",52424
2264,54336,indoor,"chemistry_lab, beauty_salon, shower, dressing_room, biology_laboratory",52424
2265,54360,indoor,"chemistry_lab, beauty_salon, shower, dressing_room, biology_laboratory",52424
2266,54384,indoor,"chemistry_lab, shower, beauty_salon, dressing_room, clean_room",52424
2267,54408,indoor,"beauty_salon, chemistry_lab, shower, television_studio, physics_laboratory",52424
2268,54432,indoor,"beauty_salon, chemistry_lab, shower, physics_laboratory, television_studio",52424
2269,54456,indoor,"chemistry_lab, beauty_salon, physics_laboratory, television_studio, shower",52424
2270,54480,indoor,"beauty_salon, chemistry_lab, shower, dressing_room, television_studio",52424
2271,54504,indoor,"chemistry_lab, beauty_salon, dressing_room, shower, biology_laboratory",52424
2272,54528,indoor,"chemistry_lab, beauty_salon, biology_laboratory, bar, music_studio",52424
2273,54552,indoor,"chemistry_lab, biology_laboratory, beauty_salon, bar, music_studio",52424
2274,54576,indoor,"chemistry_lab, beauty_salon, biology_laboratory, bar, physics_laboratory",52424
2275,54600,indoor,"chemistry_lab, beauty_salon, bar, biology_laboratory, phone_booth",52424
2276,54624,indoor,"chemistry_lab, biology_laboratory, physics_laboratory, music_studio, beauty_salon",52424
2277,54648,indoor,"shower, beauty_salon, chemistry_lab, bathroom, dressing_room",52424
2278,54672,indoor,"chemistry_lab, beauty_salon, physics_laboratory, shower, television_studio",52424
2279,54696,indoor,"chemistry_lab, beauty_salon, shower, physics_laboratory, biology_laboratory",52424
2280,54720,indoor,"beauty_salon, chemistry_lab, shower, television_studio, physics_laboratory",52424
2281,54744,indoor,"beauty_salon, chemistry_lab, shower, television_studio, biology_laboratory",52424
2282,54768,indoor,"beauty_salon, chemistry_lab, shower, biology_laboratory, dressing_room",52424
2283,54792,indoor,"chemistry_lab, biology_laboratory, beauty_salon, physics_laboratory, archive",52424
2284,54816,indoor,"chemistry_lab, biology_laboratory, shower, beauty_salon, music_studio",52424
2285,54840,indoor,"chemistry_lab, beauty_salon, music_studio, biology_laboratory, bar",52424
2286,54864,indoor,"chemistry_lab, bar, music_studio, discotheque, beauty_salon",52424
2287,54888,indoor,"chemistry_lab, biology_laboratory, music_studio, beauty_salon, discotheque",52424
2288,54912,indoor,"chemistry_lab, discotheque, beauty_salon, music_studio, bar",52424
2289,54936,indoor,"chemistry_lab, discotheque, bar, beauty_salon, music_studio",52424
2290,54960,indoor,"chemistry_lab, discotheque, bar, shower, beauty_salon",52424
2291,54984,indoor,"chemistry_lab, discotheque, biology_laboratory, beauty_salon, music_studio",52424
2292,55008,indoor,"beauty_salon, shower, chemistry_lab, dressing_room, television_studio",52424
2293,55032,indoor,"beauty_salon, shower, chemistry_lab, dressing_room, television_studio",52424
2294,55056,indoor,"beauty_salon, chemistry_lab, dressing_room, shower, television_studio",52424
2295,55080,indoor,"beauty_salon, chemistry_lab, television_studio, dressing_room, biology_laboratory",52424
2296,55104,indoor,"beauty_salon, dressing_room, chemistry_lab, shower, television_studio",52424
2297,55128,indoor,"chemistry_lab, beauty_salon, shower, dressing_room, biology_laboratory",52424
2298,55152,indoor,"beauty_salon, shower, chemistry_lab, dressing_room, television_studio",52424
2299,55176,indoor,"beauty_salon, chemistry_lab, television_studio, dressing_room, biology_laboratory",52424
2300,55200,indoor,"beauty_salon, chemistry_lab, television_studio, dressing_room, shower",52424
2301,55224,indoor,"beauty_salon, chemistry_lab, television_studio, bar, dressing_room",52424
2302,55248,indoor,"chemistry_lab, biology_laboratory, clean_room, archive, physics_laboratory",52424
2303,55272,indoor,"chemistry_lab, discotheque, music_studio, bar, beauty_salon",52424
2304,55296,indoor,"chemistry_lab, beauty_salon, biology_laboratory, bar, music_studio",52424
2305,55320,indoor,"beauty_salon, chemistry_lab, bar, biology_laboratory, music_studio",52424
2306,55344,indoor,"chemistry_lab, beauty_salon, bar, discotheque, shower",52424
2307,55368,indoor,"art_gallery, art_studio, museum/indoor, igloo, clean_room",52424
2308,55392,indoor,"art_studio, art_gallery, igloo, medina, clean_room",52424
2309,55416,indoor,"igloo, art_studio, medina, art_gallery, clean_room",52424
2310,55440,indoor,"igloo, medina, art_studio, art_gallery, clean_room",52424
2311,55464,indoor,"igloo, clean_room, art_gallery, museum/indoor, art_studio",52424
2312,55488,indoor,"igloo, museum/indoor, art_gallery, art_studio, medina",52424
2313,55512,indoor,"pub/indoor, bar, basement, art_studio, restaurant_kitchen",52424
2314,55536,indoor,"physics_laboratory, art_gallery, art_studio, museum/indoor, chemistry_lab",52424
2315,55560,indoor,"science_museum, museum/indoor, bank_vault, art_gallery, elevator_lobby",52424
2316,55584,indoor,"museum/indoor, jewelry_shop, art_gallery, reception, clean_room",52424
2317,55608,indoor,"art_gallery, museum/indoor, science_museum, reception, chemistry_lab",52424
2318,55632,indoor,"clean_room, museum/indoor, science_museum, archive, chemistry_lab",52424
2319,55656,indoor,"art_gallery, clean_room, museum/indoor, science_museum, jewelry_shop",52424
2320,55680,indoor,"museum/indoor, art_gallery, science_museum, natural_history_museum, archive",52424
2321,55704,indoor,"museum/indoor, art_gallery, science_museum, natural_history_museum, archive",52424
2322,55728,indoor,"museum/indoor, art_gallery, clean_room, science_museum, archive",52424
2323,55752,indoor,"museum/indoor, clean_room, art_gallery, science_museum, archive",52424
2324,55776,indoor,"museum/indoor, clean_room, science_museum, art_gallery, natural_history_museum",52424
2325,55800,indoor,"museum/indoor, clean_room, science_museum, chemistry_lab, archive",52424
2326,55824,indoor,"museum/indoor, science_museum, clean_room, chemistry_lab, natural_history_museum",52424
2327,55848,indoor,"museum/indoor, clean_room, art_gallery, natural_history_museum, science_museum",52424
2328,55872,indoor,"museum/indoor, clean_room, art_gallery, science_museum, natural_history_museum",52424
2329,55896,indoor,"museum/indoor, clean_room, art_gallery, science_museum, natural_history_museum",52424
2330,55920,indoor,"museum/indoor, clean_room, science_museum, natural_history_museum, chemistry_lab",52424
2331,55944,indoor,"museum/indoor, science_museum, clean_room, natural_history_museum, chemistry_lab",52424
2332,55968,indoor,"museum/indoor, jail_cell, bank_vault, clean_room, locker_room",52424
2333,55992,indoor,"chemistry_lab, bar, biology_laboratory, beauty_salon, coffee_shop",52424
2334,56016,indoor,"chemistry_lab, bar, art_gallery, biology_laboratory, art_studio",52424
2335,56040,indoor,"art_gallery, artists_loft, chemistry_lab, art_studio, bar",52424
2336,56064,indoor,"art_gallery, artists_loft, museum/indoor, chemistry_lab, bar",52424
2337,56088,indoor,"artists_loft, art_gallery, beauty_salon, bar, clean_room",52424
2338,56112,indoor,"art_gallery, artists_loft, museum/indoor, bar, chemistry_lab",52424
2339,56136,indoor,"chemistry_lab, art_gallery, artists_loft, clean_room, bar",52424
2340,56160,indoor,"museum/indoor, chemistry_lab, art_gallery, bar, clean_room",52424
2341,56184,indoor,"bar, coffee_shop, pub/indoor, restaurant, sushi_bar",52424
2342,56208,indoor,"elevator_lobby, museum/indoor, chemistry_lab, dressing_room, elevator/door",52424
2343,56232,indoor,"art_gallery, museum/indoor, dressing_room, elevator_lobby, jewelry_shop",52424
2344,56256,indoor,"art_gallery, museum/indoor, bank_vault, jail_cell, basement",52424
2345,56280,indoor,"dressing_room, art_gallery, bathroom, chemistry_lab, shower",52424
2346,56304,outdoor,"bar, chemistry_lab, industrial_area, tower, oilrig",52424
2347,56328,indoor,"art_gallery, museum/indoor, elevator_lobby, elevator/door, art_studio",52424
2348,56352,indoor,"elevator_lobby, elevator/door, dressing_room, museum/indoor, science_museum",52424
2349,56376,indoor,"museum/indoor, bank_vault, art_gallery, elevator_lobby, alcove",52424
2350,56400,indoor,"shower, science_museum, art_gallery, discotheque, dressing_room",52424
2351,56424,indoor,"shower, discotheque, dressing_room, art_gallery, aquarium",52424
2352,56448,indoor,"shower, science_museum, museum/indoor, natural_history_museum, art_gallery",52424
2353,56472,indoor,"shower, dressing_room, art_gallery, science_museum, museum/indoor",52424
2354,56496,indoor,"shower, science_museum, art_gallery, dressing_room, museum/indoor",52424
2355,56520,indoor,"shower, discotheque, aquarium, art_gallery, dressing_room",52424
2356,56544,indoor,"chemistry_lab, clean_room, dressing_room, jewelry_shop, biology_laboratory",52424
2357,56568,indoor,"chemistry_lab, dressing_room, jewelry_shop, biology_laboratory, clean_room",52424
2358,56592,indoor,"dressing_room, bathroom, bank_vault, museum/indoor, beauty_salon",52424
2359,56616,indoor,"dressing_room, locker_room, jewelry_shop, classroom, museum/indoor",52424
2360,56640,indoor,"shower, discotheque, stage/indoor, skyscraper, dressing_room",52424
2361,56664,indoor,"shower, discotheque, wheat_field, stage/indoor, dressing_room",52424
2362,56688,indoor,"shower, discotheque, wheat_field, art_gallery, stage/indoor",52424
2363,56712,indoor,"shower, discotheque, dressing_room, stage/indoor, wheat_field",52424
2364,56736,indoor,"restaurant, lobby, dining_room, bar, coffee_shop",52424
2365,56760,indoor,"coffee_shop, bar, throne_room, restaurant, lobby",52424
2366,56784,outdoor,"arch, attic, igloo, promenade, subway_station/platform",52424
2367,56808,indoor,"subway_station/platform, hangar/outdoor, desert/sand, arena/rodeo, train_station/platform",52424
2368,56832,outdoor,"oast_house, fountain, igloo, tree_farm, playground",52424
2369,56856,outdoor,"hot_spring, fountain, tree_farm, orchard, volcano",52424
2370,56880,outdoor,"fountain, playground, hot_spring, yard, water_park",52424
2371,56904,outdoor,"fountain, mosque/outdoor, natural_history_museum, arch, science_museum",52424
2372,56928,outdoor,"greenhouse/outdoor, shower, gazebo/exterior, arch, clothing_store",52424
2373,56952,indoor,"shower, greenhouse/outdoor, elevator_lobby, entrance_hall, arch",52424
2374,56976,outdoor,"shower, greenhouse/outdoor, arch, entrance_hall, fountain",52424
2375,57000,indoor,"natural_history_museum, fountain, shower, entrance_hall, lobby",52424
2376,57024,indoor,"fountain, shower, lobby, entrance_hall, natural_history_museum",52424
2377,57048,outdoor,"fountain, shower, natural_history_museum, botanical_garden, desert/vegetation",52424
2378,57072,outdoor,"fountain, shower, museum/indoor, campus, botanical_garden",52424
2379,57096,outdoor,"tree_farm, hot_spring, fountain, army_base, botanical_garden",52424
2380,57120,outdoor,"tree_farm, igloo, desert/sand, oast_house, ski_slope",52424
2381,57144,outdoor,"subway_station/platform, train_station/platform, hangar/outdoor, bridge, arch",52424
2382,57168,outdoor,"train_station/platform, playground, arch, bridge, campus",52424
2383,57192,indoor,"restaurant, bar, cafeteria, pub/indoor, dining_hall",52424
2384,57216,indoor,"bar, chemistry_lab, restaurant, coffee_shop, ballroom",52424
2385,57240,indoor,"discotheque, biology_laboratory, bar, chemistry_lab, music_studio",52424
2386,57264,indoor,"discotheque, chemistry_lab, biology_laboratory, beauty_salon, bar",52424
2387,57288,indoor,"discotheque, bar, chemistry_lab, pub/indoor, beer_garden",52424
2388,57312,indoor,"discotheque, chemistry_lab, pub/indoor, biology_laboratory, bar",52424
2389,57336,indoor,"discotheque, bar, pub/indoor, music_studio, stage/indoor",52424
2390,57360,indoor,"chemistry_lab, biology_laboratory, office, physics_laboratory, bar",52424
2391,57384,indoor,"chemistry_lab, biology_laboratory, bar, office, physics_laboratory",52424
2392,57408,indoor,"chemistry_lab, bar, biology_laboratory, beauty_salon, restaurant",52424
2393,57432,indoor,"chemistry_lab, bar, beauty_salon, restaurant, pub/indoor",52424
2394,57456,indoor,"chemistry_lab, bar, beauty_salon, coffee_shop, kitchen",52424
2395,57480,indoor,"chemistry_lab, beauty_salon, bar, biology_laboratory, kitchen",52424
2396,57504,indoor,"chemistry_lab, beauty_salon, bar, kitchen, biology_laboratory",52424
2397,57528,indoor,"beauty_salon, chemistry_lab, bar, coffee_shop, music_studio",52424
2398,57552,indoor,"chemistry_lab, bar, biology_laboratory, dressing_room, kitchen",52424
2399,57576,indoor,"dressing_room, bar, beauty_salon, restaurant, reception",52424
2400,57600,indoor,"chemistry_lab, dressing_room, beauty_salon, coffee_shop, music_studio",52424
2401,57624,indoor,"beauty_salon, dressing_room, television_studio, chemistry_lab, coffee_shop",52424
2402,57648,indoor,"television_studio, beauty_salon, stage/indoor, bar, clothing_store",52424
2403,57672,indoor,"television_studio, stage/indoor, beauty_salon, chemistry_lab, bar",52424
2404,57696,indoor,"television_studio, chemistry_lab, beauty_salon, bar, stage/indoor",52424
2405,57720,indoor,"bar, beauty_salon, chemistry_lab, coffee_shop, music_studio",52424
2406,57744,indoor,"chemistry_lab, bar, beer_hall, pub/indoor, coffee_shop",52424
2407,57768,indoor,"chemistry_lab, biology_laboratory, pub/indoor, bar, beauty_salon",52424
2408,57792,indoor,"chemistry_lab, bar, pub/indoor, biology_laboratory, beauty_salon",52424
2409,57816,indoor,"chemistry_lab, bar, beer_hall, pub/indoor, biology_laboratory",52424
2410,57840,indoor,"chemistry_lab, kitchen, restaurant_kitchen, bar, biology_laboratory",52424
2411,57864,indoor,"chemistry_lab, biology_laboratory, bar, restaurant_kitchen, kitchen",52424
2412,57888,indoor,"chemistry_lab, restaurant_kitchen, kitchen, biology_laboratory, bar",52424
2413,57912,indoor,"chemistry_lab, bar, dressing_room, kitchen, pub/indoor",52424
2414,57936,indoor,"chemistry_lab, bar, pub/indoor, physics_laboratory, biology_laboratory",52424
2415,57960,indoor,"chemistry_lab, bar, biology_laboratory, dressing_room, beauty_salon",52424
2416,57984,indoor,"chemistry_lab, television_studio, beauty_salon, bar, dressing_room",52424
2417,58008,indoor,"beauty_salon, discotheque, biology_laboratory, ice_cream_parlor, chemistry_lab",52424
2418,58032,indoor,"hot_spring, beauty_salon, aquarium, discotheque, pond",52424
2419,58056,indoor,"hot_spring, discotheque, beauty_salon, aquarium, pond",52424
2420,58080,indoor,"hot_spring, discotheque, ice_floe, beauty_salon, swimming_pool/indoor",52424
2421,58104,indoor,"beauty_salon, biology_laboratory, ice_floe, hot_spring, discotheque",52424
2422,58128,indoor,"discotheque, beauty_salon, chemistry_lab, beer_garden, biology_laboratory",52424
2423,58152,indoor,"chemistry_lab, biology_laboratory, beauty_salon, discotheque, bar",52424
2424,58176,indoor,"biology_laboratory, chemistry_lab, discotheque, bar, beauty_salon",52424
2425,58200,indoor,"discotheque, music_studio, bar, chemistry_lab, beauty_salon",52424
2426,58224,indoor,"discotheque, music_studio, bar, arena/performance, stage/indoor",52424
2427,58248,indoor,"discotheque, music_studio, beauty_salon, bar, pub/indoor",52424
2428,58272,indoor,"discotheque, beer_garden, biology_laboratory, chemistry_lab, restaurant",52424
2429,58296,indoor,"biology_laboratory, airplane_cabin, chemistry_lab, beauty_salon, repair_shop",52424
2430,58320,indoor,"airplane_cabin, beauty_salon, restaurant, dressing_room, biology_laboratory",52424
2431,58344,indoor,"conference_room, restaurant, conference_center, biology_laboratory, cafeteria",52424
2432,58368,indoor,"airplane_cabin, office, television_studio, conference_room, biology_laboratory",52424
2433,58392,indoor,"music_studio, beauty_salon, chemistry_lab, clean_room, television_studio",52424
2434,58416,indoor,"beauty_salon, chemistry_lab, music_studio, biology_laboratory, clean_room",52424
2435,58440,indoor,"music_studio, chemistry_lab, beauty_salon, nursing_home, biology_laboratory",52424
2436,58464,indoor,"music_studio, chemistry_lab, beauty_salon, television_studio, dressing_room",52424
2437,58488,indoor,"chemistry_lab, music_studio, biology_laboratory, beauty_salon, bar",52424
2438,58512,indoor,"music_studio, chemistry_lab, beauty_salon, nursing_home, kitchen",52424
2439,58536,indoor,"chemistry_lab, kitchen, restaurant_kitchen, biology_laboratory, beauty_salon",52424
2440,58560,indoor,"music_studio, chemistry_lab, physics_laboratory, television_studio, bar",52424
2441,58584,indoor,"music_studio, chemistry_lab, bar, television_studio, coffee_shop",52424
2442,58608,indoor,"music_studio, chemistry_lab, television_studio, bar, dining_room",52424
2443,58632,indoor,"music_studio, television_studio, chemistry_lab, physics_laboratory, bar",52424
2444,58656,indoor,"music_studio, television_studio, chemistry_lab, bar, physics_laboratory",52424
2445,58680,indoor,"chemistry_lab, music_studio, biology_laboratory, bar, coffee_shop",52424
2446,58704,indoor,"chemistry_lab, bar, music_studio, biology_laboratory, coffee_shop",52424
2447,58728,indoor,"chemistry_lab, music_studio, physics_laboratory, biology_laboratory, bar",52424
2448,58752,indoor,"science_museum, biology_laboratory, lobby, reception, chemistry_lab",52424
2449,58776,indoor,"lobby, reception, science_museum, airplane_cabin, television_studio",52424
2450,58800,indoor,"lobby, science_museum, reception, airplane_cabin, biology_laboratory",52424
2451,58824,indoor,"biology_laboratory, science_museum, chemistry_lab, lobby, reception",52424
2452,58848,indoor,"airplane_cabin, science_museum, restaurant, biology_laboratory, television_studio",52424
2453,58872,indoor,"airplane_cabin, office, reception, conference_room, lobby",52424
2454,58896,indoor,"office, airplane_cabin, television_studio, reception, conference_room",52424
2455,58920,indoor,"office, airplane_cabin, reception, conference_room, legislative_chamber",52424
2456,58944,indoor,"airplane_cabin, office, reception, legislative_chamber, conference_room",52424
2457,58968,indoor,"airplane_cabin, reception, legislative_chamber, office, lobby",52424
2458,58992,indoor,"office, airplane_cabin, reception, legislative_chamber, conference_room",52424
2459,59016,indoor,"office, reception, legislative_chamber, airplane_cabin, conference_room",52424
2460,59040,indoor,"reception, legislative_chamber, office, airplane_cabin, conference_room",52424
2461,59064,indoor,"legislative_chamber, reception, office, lobby, conference_center",52424
2462,59088,indoor,"biology_laboratory, science_museum, clean_room, chemistry_lab, physics_laboratory",52424
2463,59112,indoor,"discotheque, stage/outdoor, chemistry_lab, stage/indoor, biology_laboratory",52424
2464,59136,indoor,"discotheque, biology_laboratory, chemistry_lab, hot_spring, beer_garden",52424
2465,59160,indoor,"discotheque, chemistry_lab, biology_laboratory, beer_garden, hot_spring",52424
2466,59184,indoor,"discotheque, chemistry_lab, biology_laboratory, ballroom, banquet_hall",52424
2467,59208,indoor,"discotheque, chemistry_lab, biology_laboratory, hot_spring, ballroom",52424
2468,59232,indoor,"biology_laboratory, airplane_cabin, physics_laboratory, office, science_museum",52424
2469,59256,indoor,"airplane_cabin, television_studio, science_museum, biology_laboratory, office",52424
2470,59280,indoor,"biology_laboratory, science_museum, television_studio, office, physics_laboratory",52424
2471,59304,indoor,"biology_laboratory, office, airplane_cabin, conference_center, television_studio",52424
2472,59328,indoor,"biology_laboratory, television_studio, office, airplane_cabin, physics_laboratory",52424
2473,59352,indoor,"legislative_chamber, airplane_cabin, conference_center, office, lobby",52424
2474,59376,indoor,"airplane_cabin, legislative_chamber, restaurant, conference_center, conference_room",52424
2475,59400,indoor,"beauty_salon, airplane_cabin, office, lobby, dressing_room",52424
2476,59424,indoor,"biology_laboratory, office, chemistry_lab, airplane_cabin, restaurant",52424
2477,59448,indoor,"office, office_cubicles, biology_laboratory, home_office, science_museum",52424
2478,59472,indoor,"office, science_museum, biology_laboratory, office_cubicles, beauty_salon",52424
2479,59496,indoor,"biology_laboratory, chemistry_lab, office, restaurant, beauty_salon",52424
2480,59520,indoor,"biology_laboratory, office, jewelry_shop, chemistry_lab, conference_center",52424
2481,59544,indoor,"discotheque, beer_garden, biology_laboratory, music_studio, bar",52424
2482,59568,indoor,"discotheque, biology_laboratory, chemistry_lab, music_studio, beer_garden",52424
2483,59592,indoor,"biology_laboratory, discotheque, chemistry_lab, music_studio, stage/indoor",52424
2484,59616,indoor,"discotheque, biology_laboratory, martial_arts_gym, chemistry_lab, restaurant_kitchen",52424
2485,59640,indoor,"discotheque, biology_laboratory, chemistry_lab, stadium/baseball, bowling_alley",52424
2486,59664,indoor,"discotheque, biology_laboratory, hot_spring, chemistry_lab, beer_garden",52424
2487,59688,indoor,"discotheque, stage/indoor, stage/outdoor, arena/performance, music_studio",52424
2488,59712,indoor,"conference_center, airplane_cabin, biology_laboratory, office, chemistry_lab",52424
2489,59736,indoor,"conference_center, legislative_chamber, television_studio, airplane_cabin, office",52424
2490,59760,indoor,"conference_center, legislative_chamber, airplane_cabin, television_studio, office",52424
2491,59784,indoor,"airplane_cabin, legislative_chamber, conference_center, office, television_studio",52424
2492,59808,indoor,"airplane_cabin, legislative_chamber, conference_center, office, television_studio",52424
2493,59832,indoor,"airplane_cabin, conference_center, legislative_chamber, office, television_studio",52424
2494,59856,indoor,"airplane_cabin, conference_center, legislative_chamber, television_studio, office",52424
2495,59880,indoor,"airplane_cabin, legislative_chamber, conference_center, television_studio, reception",52424
2496,59904,indoor,"discotheque, stage/outdoor, arena/performance, stage/indoor, music_studio",52424
2497,59928,indoor,"discotheque, stage/indoor, stage/outdoor, aquarium, chemistry_lab",52424
2498,59952,indoor,"discotheque, biology_laboratory, chemistry_lab, aquarium, stage/indoor",52424
2499,59976,indoor,"discotheque, biology_laboratory, chemistry_lab, arena/performance, music_studio",52424
2500,60000,indoor,"discotheque, hot_spring, biology_laboratory, chemistry_lab, music_studio",52424
2501,60024,indoor,"discotheque, stage/outdoor, stage/indoor, music_studio, arena/performance",52424
2502,60048,indoor,"legislative_chamber, conference_center, lobby, television_studio, reception",52424
2503,60072,indoor,"legislative_chamber, conference_center, lobby, airplane_cabin, television_studio",52424
2504,60096,indoor,"legislative_chamber, conference_center, airplane_cabin, television_studio, office",52424
