,frame_num,environment,places,imdb_id
4424,106176,indoor,"shower, bathroom, art_gallery, elevator/door, dressing_room",52424
4425,106200,indoor,"shower, bathroom, art_gallery, art_studio, museum/indoor",52424
4426,106224,indoor,"shower, bathroom, art_gallery, museum/indoor, art_studio",52424
4427,106248,indoor,"shower, art_gallery, bathroom, museum/indoor, aquarium",52424
4428,106272,indoor,"basement, nursery, kindergarden_classroom, shower, playroom",52424
4429,106296,indoor,"discotheque, oilrig, hot_spring, chemistry_lab, stage/indoor",52424
4430,106320,indoor,"jewelry_shop, chemistry_lab, clean_room, reception, television_studio",52424
4431,106344,indoor,"jewelry_shop, television_studio, museum/indoor, chemistry_lab, reception",52424
4432,106368,indoor,"jewelry_shop, museum/indoor, television_studio, chemistry_lab, discotheque",52424
4433,106392,indoor,"museum/indoor, science_museum, television_studio, stage/indoor, conference_center",52424
4434,106416,indoor,"museum/indoor, clean_room, science_museum, chemistry_lab, art_gallery",52424
4435,106440,indoor,"museum/indoor, science_museum, television_studio, clean_room, chemistry_lab",52424
4436,106464,indoor,"television_studio, museum/indoor, stage/indoor, music_studio, discotheque",52424
4437,106488,indoor,"museum/indoor, television_studio, science_museum, art_gallery, music_studio",52424
4438,106512,indoor,"television_studio, reception, conference_center, music_studio, museum/indoor",52424
4439,106536,indoor,"television_studio, stage/indoor, museum/indoor, discotheque, arena/performance",52424
4440,106560,indoor,"arena/performance, discotheque, stage/indoor, television_studio, ballroom",52424
4441,106584,indoor,"discotheque, television_studio, stage/indoor, arena/performance, conference_center",52424
4442,106608,indoor,"television_studio, arena/performance, stage/indoor, music_studio, discotheque",52424
4443,106632,indoor,"stage/indoor, arena/performance, discotheque, television_studio, music_studio",52424
4444,106656,indoor,"stage/indoor, arena/performance, stage/outdoor, conference_center, television_studio",52424
4445,106680,indoor,"discotheque, stage/indoor, arena/performance, ballroom, music_studio",52424
4446,106704,indoor,"discotheque, banquet_hall, stage/indoor, bar, beer_hall",52424
4447,106728,indoor,"discotheque, stage/indoor, music_studio, banquet_hall, arena/performance",52424
4448,106752,indoor,"stage/indoor, discotheque, conference_center, music_studio, television_studio",52424
4449,106776,indoor,"stage/indoor, arena/performance, conference_center, discotheque, music_studio",52424
4450,106800,indoor,"discotheque, arena/performance, stage/indoor, ballroom, music_studio",52424
4451,106824,indoor,"banquet_hall, ballroom, museum/indoor, arena/performance, stage/indoor",52424
4452,106848,indoor,"stage/outdoor, stage/indoor, arena/performance, discotheque, music_studio",52424
4453,106872,indoor,"stage/indoor, stage/outdoor, chemistry_lab, arena/performance, television_studio",52424
4454,106896,indoor,"stage/indoor, arena/performance, television_studio, auditorium, stage/outdoor",52424
4455,106920,indoor,"stage/indoor, arena/performance, stage/outdoor, discotheque, auditorium",52424
4456,106944,indoor,"stage/indoor, music_studio, arena/performance, television_studio, chemistry_lab",52424
4457,106968,indoor,"clean_room, museum/indoor, chemistry_lab, stage/indoor, science_museum",52424
4458,106992,indoor,"museum/indoor, jewelry_shop, cemetery, throne_room, chemistry_lab",52424
4459,107016,indoor,"museum/indoor, chemistry_lab, clean_room, physics_laboratory, science_museum",52424
4460,107040,indoor,"museum/indoor, chemistry_lab, physics_laboratory, bar, science_museum",52424
4461,107064,indoor,"museum/indoor, science_museum, clean_room, chemistry_lab, physics_laboratory",52424
4462,107088,indoor,"museum/indoor, science_museum, banquet_hall, church/indoor, chemistry_lab",52424
4463,107112,indoor,"museum/indoor, science_museum, church/indoor, banquet_hall, clean_room",52424
4464,107136,indoor,"bar, museum/indoor, chemistry_lab, banquet_hall, science_museum",52424
4465,107160,outdoor,"oilrig, harbor, hot_spring, bridge, clean_room",52424
4466,107184,outdoor,"hot_spring, clean_room, fountain, iceberg, ice_shelf",52424
4467,107208,indoor,"clean_room, jewelry_shop, chemistry_lab, museum/indoor, dressing_room",52424
4468,107232,indoor,"museum/indoor, art_gallery, nursery, science_museum, classroom",52424
4469,107256,indoor,"discotheque, museum/indoor, stage/indoor, industrial_area, nursery",52424
4470,107280,indoor,"museum/indoor, art_gallery, stage/indoor, classroom, art_studio",52424
4471,107304,indoor,"museum/indoor, stage/indoor, discotheque, industrial_area, oilrig",52424
4472,107328,outdoor,"oilrig, stage/indoor, industrial_area, bridge, discotheque",52424
4473,107352,indoor,"bowling_alley, classroom, stage/indoor, airport_terminal, discotheque",52424
4474,107376,indoor,"stage/indoor, discotheque, basement, music_studio, igloo",52424
4475,107400,indoor,"stage/indoor, discotheque, basement, igloo, music_studio",52424
4476,107424,indoor,"stage/indoor, discotheque, basement, igloo, music_studio",52424
4477,107448,outdoor,"hot_spring, mosque/outdoor, discotheque, tower, stage/indoor",52424
4478,107472,indoor,"discotheque, hot_spring, stage/indoor, bowling_alley, basement",52424
4479,107496,indoor,"basement, clean_room, airport_terminal, server_room, parking_garage/indoor",52424
4480,107520,outdoor,"discotheque, oilrig, tower, lighthouse, stage/indoor",52424
4481,107544,indoor,"hot_spring, discotheque, shower, basement, igloo",52424
4482,107568,indoor,"discotheque, stage/indoor, dressing_room, music_studio, ballroom",52424
4483,107592,indoor,"discotheque, hot_spring, stage/indoor, sky, aquarium",52424
4484,107616,indoor,"discotheque, stage/indoor, escalator/indoor, music_studio, conference_center",52424
4485,107640,indoor,"discotheque, aquarium, hot_spring, arena/performance, stage/indoor",52424
4486,107664,indoor,"music_studio, art_gallery, discotheque, dressing_room, television_studio",52424
4487,107688,indoor,"museum/indoor, discotheque, shower, science_museum, clean_room",52424
4488,107712,indoor,"discotheque, museum/indoor, stage/indoor, chemistry_lab, science_museum",52424
4489,107736,indoor,"discotheque, stage/indoor, arena/performance, conference_center, wind_farm",52424
4490,107760,indoor,"discotheque, stage/indoor, arena/performance, museum/indoor, conference_center",52424
4491,107784,indoor,"clean_room, art_gallery, basement, museum/indoor, shower",52424
4492,107808,indoor,"discotheque, music_studio, stage/indoor, basement, chemistry_lab",52424
4493,107832,indoor,"discotheque, stage/indoor, music_studio, stage/outdoor, basement",52424
4494,107856,indoor,"discotheque, music_studio, stage/indoor, stage/outdoor, television_studio",52424
4495,107880,indoor,"discotheque, stage/indoor, music_studio, stage/outdoor, arena/performance",52424
4496,107904,indoor,"discotheque, stage/indoor, music_studio, arena/performance, television_studio",52424
4497,107928,indoor,"discotheque, stage/indoor, music_studio, arena/performance, television_studio",52424
4498,107952,indoor,"discotheque, stage/indoor, music_studio, stage/outdoor, hot_spring",52424
4499,107976,indoor,"stage/indoor, discotheque, music_studio, stage/outdoor, basement",52424
4500,108000,indoor,"shower, discotheque, bathroom, chemistry_lab, clean_room",52424
4501,108024,indoor,"shower, conference_center, discotheque, bathroom, reception",52424
4502,108048,indoor,"conference_center, shower, stage/indoor, arena/performance, discotheque",52424
4503,108072,indoor,"shower, discotheque, museum/indoor, bathroom, stage/indoor",52424
4504,108096,indoor,"discotheque, music_studio, stage/indoor, basement, clean_room",52424
4505,108120,indoor,"discotheque, stage/indoor, music_studio, television_studio, arena/performance",52424
4506,108144,indoor,"discotheque, stage/indoor, music_studio, basement, television_studio",52424
4507,108168,indoor,"discotheque, stage/indoor, music_studio, arena/performance, basement",52424
4508,108192,indoor,"discotheque, stage/indoor, music_studio, basement, stage/outdoor",52424
4509,108216,indoor,"discotheque, stage/indoor, music_studio, basement, television_studio",52424
4510,108240,indoor,"discotheque, stage/indoor, music_studio, basement, television_studio",52424
4511,108264,indoor,"discotheque, stage/indoor, music_studio, basement, art_gallery",52424
4512,108288,indoor,"discotheque, stage/indoor, music_studio, television_studio, basement",52424
4513,108312,indoor,"discotheque, music_studio, stage/indoor, basement, television_studio",52424
4514,108336,indoor,"discotheque, stage/indoor, music_studio, basement, television_studio",52424
4515,108360,indoor,"discotheque, stage/indoor, music_studio, television_studio, basement",52424
4516,108384,indoor,"discotheque, music_studio, stage/indoor, basement, television_studio",52424
4517,108408,indoor,"discotheque, music_studio, stage/indoor, basement, clean_room",52424
4518,108432,indoor,"discotheque, shower, museum/indoor, bathroom, clean_room",52424
4519,108456,indoor,"bathroom, discotheque, shower, reception, museum/indoor",52424
4520,108480,indoor,"discotheque, stage/indoor, music_studio, basement, clean_room",52424
4521,108504,indoor,"discotheque, stage/indoor, music_studio, basement, television_studio",52424
4522,108528,indoor,"discotheque, stage/indoor, music_studio, basement, television_studio",52424
4523,108552,indoor,"discotheque, stage/indoor, music_studio, basement, television_studio",52424
4524,108576,indoor,"discotheque, stage/indoor, music_studio, basement, clean_room",52424
4525,108600,indoor,"discotheque, stage/indoor, basement, music_studio, attic",52424
4526,108624,indoor,"discotheque, basement, stage/indoor, music_studio, attic",52424
4527,108648,indoor,"discotheque, basement, stage/indoor, attic, music_studio",52424
4528,108672,indoor,"discotheque, music_studio, basement, stage/indoor, clean_room",52424
4529,108696,indoor,"discotheque, music_studio, basement, stage/indoor, attic",52424
4530,108720,indoor,"discotheque, basement, stage/indoor, music_studio, attic",52424
4531,108744,indoor,"discotheque, music_studio, stage/indoor, basement, attic",52424
4532,108768,indoor,"basement, clean_room, discotheque, art_gallery, music_studio",52424
4533,108792,indoor,"discotheque, clean_room, basement, art_gallery, stage/indoor",52424
4534,108816,indoor,"art_gallery, hot_spring, basement, catacomb, igloo",52424
4535,108840,indoor,"elevator/door, elevator_lobby, doorway/outdoor, bank_vault, elevator_shaft",52424
4536,108864,indoor,"chemistry_lab, discotheque, bar, biology_laboratory, music_studio",52424
4537,108888,indoor,"clean_room, museum/indoor, elevator/door, music_studio, science_museum",52424
4538,108912,indoor,"conference_center, clean_room, lecture_room, chemistry_lab, discotheque",52424
4539,108936,indoor,"discotheque, shower, swimming_pool/indoor, bathroom, hot_spring",52424
4540,108960,indoor,"discotheque, stage/indoor, chemistry_lab, dressing_room, basement",52424
4541,108984,indoor,"art_gallery, museum/indoor, basement, art_studio, dressing_room",52424
4542,109008,indoor,"discotheque, art_gallery, dressing_room, chemistry_lab, shower",52424
4543,109032,indoor,"discotheque, hot_spring, stage/indoor, igloo, ballroom",52424
4544,109056,indoor,"discotheque, stage/indoor, hot_spring, ballroom, igloo",52424
4545,109080,indoor,"discotheque, stage/indoor, hot_spring, igloo, arena/performance",52424
4546,109104,indoor,"clean_room, shower, discotheque, chemistry_lab, science_museum",52424
4547,109128,indoor,"locker_room, elevator/door, clean_room, server_room, elevator_lobby",52424
4548,109152,indoor,"art_gallery, museum/indoor, shower, science_museum, clean_room",52424
4549,109176,indoor,"chemistry_lab, science_museum, clean_room, archive, shower",52424
4550,109200,indoor,"chemistry_lab, discotheque, shower, clean_room, biology_laboratory",52424
4551,109224,indoor,"stage/indoor, discotheque, hot_spring, ballroom, shower",52424
4552,109248,indoor,"lighthouse, jail_cell, igloo, art_gallery, burial_chamber",52424
4553,109272,indoor,"stage/indoor, discotheque, music_studio, arena/performance, television_studio",52424
4554,109296,indoor,"discotheque, stage/indoor, music_studio, arena/performance, television_studio",52424
4555,109320,indoor,"stage/indoor, music_studio, television_studio, arena/performance, discotheque",52424
4556,109344,indoor,"stage/indoor, arena/performance, music_studio, discotheque, television_studio",52424
4557,109368,indoor,"stage/indoor, music_studio, discotheque, arena/performance, television_studio",52424
4558,109392,indoor,"stage/indoor, music_studio, discotheque, arena/performance, ballroom",52424
4559,109416,indoor,"dressing_room, music_studio, archive, museum/indoor, locker_room",52424
4560,109440,indoor,"music_studio, archive, dressing_room, television_studio, stage/indoor",52424
4561,109464,indoor,"stage/indoor, discotheque, music_studio, television_studio, arena/performance",52424
4562,109488,indoor,"discotheque, stage/indoor, music_studio, arena/performance, television_studio",52424
4563,109512,indoor,"stage/indoor, music_studio, discotheque, television_studio, arena/performance",52424
4564,109536,indoor,"music_studio, discotheque, dressing_room, stage/indoor, television_studio",52424
4565,109560,indoor,"music_studio, discotheque, dressing_room, television_studio, stage/indoor",52424
4566,109584,indoor,"dressing_room, discotheque, music_studio, beauty_salon, shower",52424
4567,109608,indoor,"stage/indoor, discotheque, music_studio, arena/performance, television_studio",52424
4568,109632,indoor,"stage/indoor, arena/performance, music_studio, discotheque, ballroom",52424
4569,109656,indoor,"discotheque, clean_room, chemistry_lab, music_studio, stage/indoor",52424
4570,109680,indoor,"discotheque, stage/indoor, arena/performance, music_studio, clean_room",52424
4571,109704,indoor,"discotheque, music_studio, basement, clean_room, stage/indoor",52424
4572,109728,indoor,"dressing_room, music_studio, discotheque, stage/indoor, sauna",52424
4573,109752,outdoor,"hot_spring, discotheque, igloo, fountain, stage/indoor",52424
4574,109776,indoor,"igloo, discotheque, stage/indoor, arena/performance, hot_spring",52424
4575,109800,indoor,"stage/indoor, discotheque, clean_room, chemistry_lab, music_studio",52424
4576,109824,indoor,"discotheque, stage/indoor, fountain, music_studio, aquarium",52424
4577,109848,indoor,"discotheque, stage/indoor, hot_spring, music_studio, arena/performance",52424
4578,109872,indoor,"discotheque, stage/indoor, music_studio, stage/outdoor, arena/performance",52424
4579,109896,indoor,"discotheque, stage/indoor, music_studio, stage/outdoor, television_studio",52424
4580,109920,indoor,"music_studio, discotheque, shower, stage/indoor, chemistry_lab",52424
4581,109944,indoor,"discotheque, music_studio, hot_spring, shower, stage/indoor",52424
4582,109968,indoor,"discotheque, music_studio, chemistry_lab, stage/indoor, bar",52424
4583,109992,indoor,"hot_spring, discotheque, aquarium, pond, shower",52424
4584,110016,indoor,"bathroom, music_studio, museum/indoor, shower, art_gallery",52424
4585,110040,indoor,"stage/indoor, discotheque, music_studio, museum/indoor, conference_center",52424
4586,110064,indoor,"discotheque, shower, stage/indoor, airplane_cabin, chemistry_lab",52424
4587,110088,indoor,"discotheque, stage/indoor, conference_center, music_studio, shower",52424
4588,110112,indoor,"discotheque, stage/indoor, music_studio, arena/performance, conference_center",52424
4589,110136,indoor,"discotheque, stage/indoor, music_studio, chemistry_lab, airplane_cabin",52424
4590,110160,indoor,"music_studio, dressing_room, discotheque, television_studio, stage/indoor",52424
4591,110184,indoor,"music_studio, discotheque, stage/indoor, dressing_room, television_studio",52424
4592,110208,indoor,"discotheque, music_studio, stage/indoor, shower, chemistry_lab",52424
4593,110232,indoor,"discotheque, music_studio, stage/indoor, arena/performance, hot_spring",52424
4594,110256,indoor,"discotheque, stage/indoor, music_studio, museum/indoor, chemistry_lab",52424
4595,110280,outdoor,"bridge, arch, pond, hot_spring, viaduct",52424
4596,110304,outdoor,"fountain, shower, pond, sky, aquarium",52424
4597,110328,indoor,"music_studio, discotheque, dressing_room, museum/indoor, stage/indoor",52424
4598,110352,indoor,"music_studio, discotheque, dressing_room, stage/indoor, television_studio",52424
4599,110376,indoor,"hot_spring, shower, discotheque, stage/indoor, fountain",52424
4600,110400,indoor,"discotheque, shower, wind_farm, stage/indoor, aquarium",52424
4601,110424,indoor,"aquarium, science_museum, discotheque, bowling_alley, stage/indoor",52424
4602,110448,indoor,"martial_arts_gym, airport_terminal, shower, bathroom, discotheque",52424
4603,110472,indoor,"shower, bathroom, chemistry_lab, museum/indoor, ballroom",52424
4604,110496,indoor,"shower, chemistry_lab, bathroom, ballroom, clean_room",52424
4605,110520,indoor,"chemistry_lab, clean_room, shower, discotheque, science_museum",52424
4606,110544,indoor,"clean_room, basement, dressing_room, art_gallery, corridor",52424
4607,110568,indoor,"clean_room, bank_vault, basement, burial_chamber, locker_room",52424
4608,110592,indoor,"clean_room, burial_chamber, basement, bank_vault, chemistry_lab",52424
4609,110616,indoor,"clean_room, burial_chamber, chemistry_lab, basement, museum/indoor",52424
4610,110640,indoor,"clean_room, burial_chamber, basement, chemistry_lab, living_room",52424
4611,110664,indoor,"clean_room, burial_chamber, lobby, living_room, throne_room",52424
4612,110688,indoor,"clean_room, chemistry_lab, museum/indoor, artists_loft, lobby",52424
4613,110712,indoor,"clean_room, museum/indoor, chemistry_lab, burial_chamber, lobby",52424
4614,110736,indoor,"clean_room, museum/indoor, chemistry_lab, burial_chamber, engine_room",52424
4615,110760,indoor,"clean_room, museum/indoor, chemistry_lab, physics_laboratory, science_museum",52424
4616,110784,indoor,"clean_room, museum/indoor, art_gallery, artists_loft, chemistry_lab",52424
4617,110808,indoor,"clean_room, museum/indoor, art_gallery, artists_loft, art_studio",52424
4618,110832,indoor,"museum/indoor, clean_room, art_gallery, burial_chamber, artists_loft",52424
4619,110856,indoor,"museum/indoor, artists_loft, lobby, clean_room, art_gallery",52424
4620,110880,indoor,"museum/indoor, lobby, artists_loft, clean_room, art_gallery",52424
4621,110904,indoor,"museum/indoor, lobby, artists_loft, basement, living_room",52424
4622,110928,indoor,"clean_room, museum/indoor, chemistry_lab, music_studio, artists_loft",52424
4623,110952,indoor,"clean_room, chemistry_lab, basement, museum/indoor, music_studio",52424
4624,110976,indoor,"clean_room, chemistry_lab, basement, engine_room, music_studio",52424
4625,111000,indoor,"shower, hot_spring, bathroom, discotheque, sauna",52424
4626,111024,indoor,"shower, discotheque, bathroom, locker_room, sauna",52424
4627,111048,indoor,"shower, hot_spring, discotheque, igloo, bathroom",52424
4628,111072,indoor,"television_studio, museum/indoor, conference_center, airplane_cabin, art_gallery",52424
4629,111096,indoor,"airplane_cabin, locker_room, conference_center, dressing_room, clean_room",52424
4630,111120,indoor,"airplane_cabin, clean_room, locker_room, television_studio, conference_center",52424
4631,111144,indoor,"airplane_cabin, clean_room, locker_room, television_studio, dressing_room",52424
4632,111168,indoor,"television_studio, music_studio, airplane_cabin, locker_room, dressing_room",52424
4633,111192,indoor,"dressing_room, television_studio, music_studio, locker_room, stage/indoor",52424
4634,111216,indoor,"television_studio, music_studio, airplane_cabin, dressing_room, conference_center",52424
4635,111240,indoor,"airplane_cabin, locker_room, television_studio, conference_center, dressing_room",52424
4636,111264,indoor,"airplane_cabin, television_studio, music_studio, conference_center, train_interior",52424
4637,111288,indoor,"television_studio, airplane_cabin, conference_center, locker_room, music_studio",52424
4638,111312,indoor,"dressing_room, music_studio, airplane_cabin, discotheque, television_studio",52424
4639,111336,indoor,"chemistry_lab, music_studio, discotheque, dressing_room, biology_laboratory",52424
4640,111360,indoor,"music_studio, stage/indoor, discotheque, dressing_room, shower",52424
4641,111384,indoor,"shower, dressing_room, bathroom, stage/indoor, elevator/door",52424
4642,111408,indoor,"shower, dressing_room, bathroom, locker_room, elevator/door",52424
4643,111432,indoor,"shower, bathroom, dressing_room, elevator/door, martial_arts_gym",52424
4644,111456,indoor,"shower, bathroom, dressing_room, music_studio, chemistry_lab",52424
4645,111480,indoor,"shower, bathroom, elevator/door, music_studio, stage/indoor",52424
4646,111504,indoor,"shower, bathroom, martial_arts_gym, clothing_store, elevator/door",52424
4647,111528,indoor,"elevator_lobby, dressing_room, elevator/door, shower, clothing_store",52424
4648,111552,indoor,"clean_room, elevator/door, dressing_room, locker_room, airport_terminal",52424
4649,111576,indoor,"clean_room, elevator/door, dressing_room, shower, bank_vault",52424
4650,111600,indoor,"elevator_lobby, locker_room, dressing_room, elevator/door, clean_room",52424
4651,111624,indoor,"elevator_lobby, locker_room, elevator/door, stage/indoor, shower",52424
4652,111648,indoor,"clean_room, dressing_room, chemistry_lab, stage/indoor, shower",52424
4653,111672,indoor,"clean_room, chemistry_lab, dressing_room, bathroom, shower",52424
4654,111696,indoor,"dressing_room, escalator/indoor, television_studio, stage/indoor, music_studio",52424
4655,111720,indoor,"office, television_studio, conference_center, music_studio, office_cubicles",52424
4656,111744,indoor,"television_studio, conference_center, discotheque, music_studio, office",52424
4657,111768,indoor,"discotheque, television_studio, music_studio, stage/indoor, conference_center",52424
4658,111792,indoor,"discotheque, television_studio, dressing_room, music_studio, stage/indoor",52424
4659,111816,indoor,"dressing_room, discotheque, beauty_salon, television_studio, airplane_cabin",52424
4660,111840,indoor,"airplane_cabin, discotheque, dressing_room, chemistry_lab, music_studio",52424
4661,111864,indoor,"discotheque, airplane_cabin, television_studio, music_studio, chemistry_lab",52424
4662,111888,indoor,"discotheque, music_studio, airplane_cabin, television_studio, bar",52424
4663,111912,indoor,"discotheque, airplane_cabin, conference_center, television_studio, bar",52424
4664,111936,indoor,"discotheque, television_studio, music_studio, stage/indoor, conference_center",52424
4665,111960,indoor,"discotheque, television_studio, airplane_cabin, music_studio, conference_center",52424
4666,111984,indoor,"discotheque, airplane_cabin, television_studio, escalator/indoor, music_studio",52424
4667,112008,indoor,"discotheque, dressing_room, bar, pub/indoor, airplane_cabin",52424
4668,112032,indoor,"discotheque, dressing_room, airplane_cabin, martial_arts_gym, car_interior",52424
4669,112056,indoor,"discotheque, dressing_room, airplane_cabin, television_studio, chemistry_lab",52424
4670,112080,indoor,"dressing_room, discotheque, music_studio, beauty_salon, chemistry_lab",52424
4671,112104,indoor,"music_studio, dressing_room, beauty_salon, discotheque, airplane_cabin",52424
4672,112128,indoor,"airplane_cabin, music_studio, dressing_room, discotheque, beauty_salon",52424
4673,112152,indoor,"music_studio, dressing_room, airplane_cabin, discotheque, television_studio",52424
4674,112176,indoor,"dressing_room, discotheque, television_studio, music_studio, airplane_cabin",52424
4675,112200,indoor,"airplane_cabin, discotheque, office, beauty_salon, car_interior",52424
4676,112224,indoor,"discotheque, television_studio, music_studio, stage/indoor, airplane_cabin",52424
4677,112248,indoor,"discotheque, airplane_cabin, escalator/indoor, television_studio, car_interior",52424
4678,112272,indoor,"airplane_cabin, discotheque, television_studio, music_studio, beauty_salon",52424
4679,112296,indoor,"television_studio, discotheque, music_studio, conference_center, airplane_cabin",52424
4680,112320,indoor,"discotheque, television_studio, music_studio, airplane_cabin, conference_center",52424
4681,112344,indoor,"dressing_room, discotheque, television_studio, music_studio, elevator_lobby",52424
4682,112368,indoor,"discotheque, dressing_room, music_studio, television_studio, conference_center",52424
4683,112392,indoor,"chemistry_lab, museum/indoor, clean_room, physics_laboratory, science_museum",52424
4684,112416,indoor,"art_studio, museum/indoor, clean_room, gift_shop, chemistry_lab",52424
4685,112440,indoor,"clean_room, museum/indoor, chemistry_lab, science_museum, physics_laboratory",52424
4686,112464,indoor,"science_museum, clean_room, museum/indoor, chemistry_lab, physics_laboratory",52424
4687,112488,indoor,"museum/indoor, science_museum, clean_room, chemistry_lab, bank_vault",52424
4688,112512,indoor,"discotheque, stage/indoor, stage/outdoor, arena/performance, music_studio",52424
4689,112536,indoor,"discotheque, stage/indoor, dressing_room, basement, music_studio",52424
4690,112560,indoor,"stage/indoor, discotheque, music_studio, auditorium, bar",52424
4691,112584,indoor,"discotheque, stage/indoor, music_studio, ballroom, dressing_room",52424
4692,112608,indoor,"stage/indoor, discotheque, music_studio, television_studio, elevator/door",52424
4693,112632,indoor,"stage/indoor, discotheque, television_studio, ballroom, elevator/door",52424
4694,112656,indoor,"stage/indoor, discotheque, music_studio, ballroom, television_studio",52424
4695,112680,indoor,"stage/indoor, discotheque, music_studio, television_studio, arena/performance",52424
4696,112704,indoor,"stage/indoor, discotheque, ballroom, elevator/door, television_studio",52424
