,frame_num,environment,places
0,0,outdoor,"desert/sand, sky, beach, lake/natural, marsh"
1,24,indoor,"jewelry_shop, gift_shop, nursery, bakery/shop, museum/indoor"
2,48,indoor,"jewelry_shop, gift_shop, nursery, candy_store, elevator/door"
3,72,indoor,"jewelry_shop, gift_shop, nursery, candy_store, beauty_salon"
4,96,indoor,"jewelry_shop, gift_shop, candy_store, nursery, beauty_salon"
5,120,indoor,"beauty_salon, ice_cream_parlor, motel, candy_store, nursery"
6,144,indoor,"stage/indoor, museum/indoor, schoolhouse, auditorium, music_studio"
7,168,indoor,"museum/indoor, classroom, schoolhouse, ice_shelf, bow_window/indoor"
8,192,indoor,"museum/indoor, archive, schoolhouse, kindergarden_classroom, classroom"
9,216,indoor,"ice_shelf, museum/indoor, discotheque, classroom, archive"
10,240,indoor,"drugstore, pharmacy, bookstore, bar, candy_store"
11,264,indoor,"drugstore, pharmacy, bookstore, candy_store, beauty_salon"
12,288,indoor,"pharmacy, drugstore, beauty_salon, bookstore, shopfront"
13,312,indoor,"beauty_salon, pharmacy, bookstore, drugstore, general_store/outdoor"
14,336,indoor,"clean_room, bow_window/indoor, operating_room, chemistry_lab, gas_station"
15,360,indoor,"bow_window/indoor, museum/indoor, clean_room, artists_loft, shower"
16,384,indoor,"drugstore, beauty_salon, ice_cream_parlor, coffee_shop, motel"
17,408,indoor,"motel, coffee_shop, drugstore, shoe_shop, bowling_alley"
18,432,indoor,"motel, drugstore, coffee_shop, shoe_shop, bowling_alley"
19,456,indoor,"motel, drugstore, shoe_shop, coffee_shop, bowling_alley"
20,480,indoor,"motel, drugstore, coffee_shop, shoe_shop, bowling_alley"
21,504,indoor,"ice_cream_parlor, coffee_shop, motel, beauty_salon, bakery/shop"
22,528,indoor,"booth/indoor, beauty_salon, museum/indoor, drugstore, pharmacy"
23,552,outdoor,"ice_shelf, booth/indoor, iceberg, museum/indoor, hospital"
24,576,outdoor,"ice_shelf, booth/indoor, museum/indoor, iceberg, hospital"
25,600,outdoor,"ice_shelf, booth/indoor, iceberg, museum/indoor, hospital"
26,624,outdoor,"ice_shelf, booth/indoor, museum/indoor, iceberg, hospital"
27,648,indoor,"booth/indoor, ice_shelf, museum/indoor, beauty_salon, hospital"
28,672,indoor,"museum/indoor, booth/indoor, kindergarden_classroom, cemetery, hospital"
29,696,indoor,"booth/indoor, kindergarden_classroom, museum/indoor, ice_cream_parlor, hospital"
30,720,indoor,"kindergarden_classroom, booth/indoor, ice_cream_parlor, museum/indoor, beauty_salon"
31,744,indoor,"kindergarden_classroom, booth/indoor, ice_cream_parlor, beauty_salon, museum/indoor"
32,768,indoor,"booth/indoor, kindergarden_classroom, ice_cream_parlor, beauty_salon, pharmacy"
33,792,indoor,"kindergarden_classroom, booth/indoor, ice_cream_parlor, beauty_salon, nursery"
34,816,indoor,"kindergarden_classroom, booth/indoor, ice_cream_parlor, beauty_salon, museum/indoor"
35,840,indoor,"booth/indoor, kindergarden_classroom, museum/indoor, ice_cream_parlor, lecture_room"
36,864,indoor,"booth/indoor, museum/indoor, archive, lecture_room, kindergarden_classroom"
37,888,indoor,"booth/indoor, museum/indoor, archive, lecture_room, science_museum"
38,912,indoor,"booth/indoor, museum/indoor, archive, lecture_room, science_museum"
39,936,indoor,"booth/indoor, museum/indoor, lecture_room, archive, conference_center"
40,960,indoor,"booth/indoor, museum/indoor, archive, lecture_room, conference_center"
41,984,indoor,"booth/indoor, museum/indoor, archive, lecture_room, conference_center"
42,1008,indoor,"booth/indoor, museum/indoor, lecture_room, archive, conference_center"
43,1032,indoor,"booth/indoor, museum/indoor, lecture_room, archive, conference_center"
44,1056,indoor,"booth/indoor, museum/indoor, archive, lecture_room, conference_center"
45,1080,indoor,"booth/indoor, museum/indoor, lecture_room, archive, conference_center"
46,1104,indoor,"booth/indoor, museum/indoor, lecture_room, archive, conference_center"
47,1128,indoor,"booth/indoor, museum/indoor, lecture_room, archive, kindergarden_classroom"
48,1152,indoor,"kindergarden_classroom, booth/indoor, coffee_shop, ice_cream_parlor, beauty_salon"
49,1176,indoor,"beauty_salon, nursery, booth/indoor, kindergarden_classroom, coffee_shop"
50,1200,indoor,"beauty_salon, coffee_shop, nursery, booth/indoor, kindergarden_classroom"
51,1224,indoor,"beauty_salon, nursery, booth/indoor, coffee_shop, kindergarden_classroom"
52,1248,indoor,"beauty_salon, pharmacy, booth/indoor, ice_cream_parlor, drugstore"
53,1272,indoor,"drugstore, pharmacy, beauty_salon, ice_cream_parlor, coffee_shop"
54,1296,indoor,"pharmacy, drugstore, beauty_salon, clothing_store, water_tower"
55,1320,indoor,"pharmacy, drugstore, beauty_salon, clothing_store, museum/indoor"
56,1344,indoor,"pharmacy, drugstore, clothing_store, beauty_salon, gift_shop"
57,1368,indoor,"pharmacy, drugstore, beauty_salon, clothing_store, gift_shop"
58,1392,indoor,"pharmacy, drugstore, beauty_salon, motel, clothing_store"
59,1416,outdoor,"desert/sand, lake/natural, beach, marsh, pond"
60,1440,outdoor,"desert/sand, lake/natural, marsh, beach, pond"
61,1464,outdoor,"ice_floe, iceberg, ice_shelf, beach, lake/natural"
62,1488,outdoor,"ice_floe, pond, marsh, lake/natural, shower"
63,1512,outdoor,"ice_floe, pond, marsh, lake/natural, greenhouse/indoor"
64,1536,outdoor,"ice_floe, ocean, marsh, wind_farm, corn_field"
65,1560,outdoor,"ice_floe, snowfield, ocean, ice_shelf, tree_farm"
66,1584,outdoor,"ice_floe, ice_shelf, snowfield, glacier, iceberg"
67,1608,outdoor,"ice_floe, greenhouse/indoor, corn_field, tree_farm, ice_shelf"
68,1632,outdoor,"ice_floe, greenhouse/indoor, ice_shelf, wind_farm, shower"
69,1656,outdoor,"ice_floe, igloo, sky, iceberg, ice_shelf"
70,1680,outdoor,"ice_floe, igloo, ice_shelf, pond, iceberg"
71,1704,outdoor,"ice_floe, igloo, ice_shelf, pond, discotheque"
72,1728,outdoor,"ice_floe, ice_shelf, aquarium, iceberg, igloo"
73,1752,outdoor,"ice_floe, ice_shelf, iceberg, igloo, hot_spring"
74,1776,indoor,"chemistry_lab, discotheque, clean_room, igloo, shower"
75,1800,indoor,"discotheque, dressing_room, clean_room, shower, chemistry_lab"
76,1824,indoor,"discotheque, clean_room, clothing_store, igloo, shower"
77,1848,indoor,"discotheque, chemistry_lab, clean_room, biology_laboratory, shower"
78,1872,indoor,"clean_room, chemistry_lab, discotheque, ice_floe, igloo"
79,1896,outdoor,"clean_room, ice_floe, iceberg, chemistry_lab, igloo"
80,1920,indoor,"discotheque, clean_room, chemistry_lab, ice_floe, stage/indoor"
81,1944,indoor,"discotheque, stage/indoor, chemistry_lab, clean_room, iceberg"
82,1968,indoor,"discotheque, stage/indoor, chemistry_lab, clean_room, music_studio"
83,1992,indoor,"clean_room, chemistry_lab, discotheque, ice_floe, iceberg"
84,2016,outdoor,"iceberg, discotheque, ice_floe, clean_room, ice_shelf"
85,2040,indoor,"discotheque, shower, chemistry_lab, clean_room, corn_field"
86,2064,indoor,"discotheque, shower, skyscraper, chemistry_lab, ice_floe"
87,2088,indoor,"discotheque, skyscraper, shower, chemistry_lab, clean_room"
88,2112,outdoor,"sky, igloo, iceberg, ice_floe, ice_shelf"
89,2136,outdoor,"sky, iceberg, ice_floe, igloo, ice_shelf"
90,2160,outdoor,"sky, igloo, ice_floe, wheat_field, discotheque"
91,2184,outdoor,"sky, wheat_field, ice_floe, desert/sand, iceberg"
92,2208,outdoor,"sky, wheat_field, discotheque, desert/sand, shower"
93,2232,indoor,"discotheque, chemistry_lab, ice_floe, biology_laboratory, iceberg"
94,2256,outdoor,"ice_floe, slum, landfill, snowfield, corn_field"
95,2280,outdoor,"corn_field, ice_floe, shower, oilrig, playground"
96,2304,outdoor,"ice_floe, shower, underwater/ocean_deep, chemistry_lab, ice_shelf"
97,2328,outdoor,"shower, ice_floe, aquarium, sky, wind_farm"
98,2352,outdoor,"corn_field, wheat_field, shower, greenhouse/indoor, tree_farm"
99,2376,indoor,"shower, clean_room, greenhouse/indoor, corn_field, aquarium"
100,2400,indoor,"shower, corn_field, discotheque, greenhouse/indoor, wheat_field"
101,2424,indoor,"discotheque, stage/indoor, corn_field, shower, chemistry_lab"
102,2448,indoor,"discotheque, shower, stage/indoor, clean_room, chemistry_lab"
103,2472,indoor,"discotheque, ballroom, dressing_room, stage/indoor, shower"
104,2496,indoor,"discotheque, chemistry_lab, clean_room, shower, dressing_room"
105,2520,indoor,"archive, chemistry_lab, assembly_line, beer_hall, auto_factory"
106,2544,indoor,"archive, assembly_line, beer_hall, auto_factory, chemistry_lab"
107,2568,indoor,"archive, beer_hall, assembly_line, clean_room, chemistry_lab"
108,2592,indoor,"archive, chemistry_lab, beer_hall, assembly_line, auto_factory"
109,2616,indoor,"archive, beer_hall, assembly_line, chemistry_lab, banquet_hall"
110,2640,indoor,"assembly_line, auto_factory, archive, clean_room, engine_room"
111,2664,indoor,"assembly_line, archive, auto_factory, chemistry_lab, supermarket"
112,2688,indoor,"discotheque, shower, stage/indoor, clean_room, chemistry_lab"
113,2712,indoor,"discotheque, igloo, shower, ball_pit, clean_room"
114,2736,indoor,"discotheque, stage/indoor, ballroom, shower, arena/performance"
115,2760,indoor,"discotheque, ballroom, stage/indoor, museum/indoor, banquet_hall"
116,2784,indoor,"discotheque, banquet_hall, ballroom, stage/indoor, chemistry_lab"
117,2808,indoor,"discotheque, stage/indoor, banquet_hall, ice_shelf, ice_floe"
118,2832,outdoor,"ice_floe, iceberg, ice_shelf, clean_room, igloo"
119,2856,indoor,"discotheque, stage/indoor, clean_room, music_studio, chemistry_lab"
120,2880,indoor,"discotheque, stage/indoor, clean_room, ballroom, chemistry_lab"
121,2904,indoor,"clean_room, biology_laboratory, chemistry_lab, physics_laboratory, operating_room"
122,2928,indoor,"clean_room, chemistry_lab, physics_laboratory, biology_laboratory, science_museum"
123,2952,indoor,"clean_room, chemistry_lab, physics_laboratory, dressing_room, music_studio"
124,2976,indoor,"clean_room, physics_laboratory, music_studio, television_studio, science_museum"
125,3000,indoor,"clean_room, discotheque, operating_room, hospital_room, museum/indoor"
126,3024,indoor,"clean_room, operating_room, museum/indoor, hospital_room, discotheque"
127,3048,indoor,"clean_room, discotheque, museum/indoor, stage/indoor, shower"
128,3072,indoor,"clean_room, operating_room, museum/indoor, discotheque, stage/indoor"
129,3096,indoor,"clean_room, discotheque, stage/indoor, music_studio, museum/indoor"
130,3120,indoor,"clean_room, discotheque, museum/indoor, stage/indoor, music_studio"
131,3144,indoor,"clean_room, operating_room, discotheque, chemistry_lab, hospital_room"
132,3168,indoor,"clean_room, operating_room, museum/indoor, discotheque, hospital_room"
133,3192,indoor,"clean_room, discotheque, operating_room, stage/indoor, music_studio"
134,3216,indoor,"clean_room, operating_room, discotheque, chemistry_lab, hospital_room"
135,3240,indoor,"clean_room, chemistry_lab, hospital_room, discotheque, kindergarden_classroom"
136,3264,indoor,"clean_room, discotheque, chemistry_lab, hospital_room, operating_room"
137,3288,indoor,"clean_room, operating_room, chemistry_lab, biology_laboratory, hospital_room"
138,3312,indoor,"clean_room, discotheque, dressing_room, ice_cream_parlor, chemistry_lab"
139,3336,indoor,"clean_room, dressing_room, nursery, hospital_room, ice_cream_parlor"
140,3360,indoor,"clean_room, ice_cream_parlor, nursery, dressing_room, chemistry_lab"
141,3384,indoor,"clean_room, ice_cream_parlor, chemistry_lab, discotheque, nursery"
142,3408,indoor,"clean_room, dressing_room, ice_cream_parlor, nursery, discotheque"
143,3432,indoor,"clean_room, discotheque, dressing_room, shower, chemistry_lab"
144,3456,indoor,"clean_room, dressing_room, nursery, ice_cream_parlor, hospital_room"
145,3480,indoor,"clean_room, ice_cream_parlor, nursery, museum/indoor, discotheque"
146,3504,indoor,"clean_room, ice_cream_parlor, dressing_room, discotheque, nursery"
147,3528,indoor,"clean_room, ice_cream_parlor, dressing_room, nursery, museum/indoor"
148,3552,outdoor,"clean_room, igloo, ice_floe, iceberg, discotheque"
149,3576,outdoor,"igloo, ice_floe, iceberg, ice_shelf, field/wild"
150,3600,outdoor,"clean_room, igloo, ice_floe, iceberg, chemistry_lab"
151,3624,outdoor,"clean_room, igloo, iceberg, ice_floe, chemistry_lab"
152,3648,indoor,"clean_room, ice_cream_parlor, nursery, dressing_room, hospital_room"
153,3672,indoor,"ice_cream_parlor, nursery, clean_room, museum/indoor, igloo"
154,3696,indoor,"clean_room, nursery, dressing_room, discotheque, igloo"
155,3720,indoor,"clean_room, ice_cream_parlor, discotheque, dressing_room, nursery"
156,3744,indoor,"clean_room, dressing_room, nursery, discotheque, ice_cream_parlor"
157,3768,indoor,"clean_room, operating_room, hospital_room, chemistry_lab, archive"
158,3792,indoor,"clean_room, operating_room, hospital_room, physics_laboratory, chemistry_lab"
159,3816,indoor,"clean_room, shower, discotheque, dressing_room, hospital_room"
160,3840,indoor,"clean_room, hospital_room, operating_room, discotheque, chemistry_lab"
161,3864,indoor,"clean_room, operating_room, archive, music_studio, physics_laboratory"
162,3888,indoor,"stage/indoor, ice_shelf, discotheque, clean_room, corn_field"
163,3912,outdoor,"ice_floe, ice_shelf, iceberg, igloo, discotheque"
164,3936,outdoor,"iceberg, ice_shelf, ice_floe, clean_room, chemistry_lab"
165,3960,outdoor,"ice_floe, ice_shelf, iceberg, hot_spring, ocean"
166,3984,outdoor,"fountain, ice_shelf, ice_floe, shower, iceberg"
167,4008,indoor,"archive, locker_room, playground, clean_room, phone_booth"
168,4032,indoor,"playground, archive, phone_booth, clean_room, nursery"
169,4056,indoor,"archive, schoolhouse, igloo, nursery, clean_room"
170,4080,indoor,"archive, schoolhouse, playground, nursery, kindergarden_classroom"
171,4104,indoor,"playground, archive, ice_skating_rink/outdoor, martial_arts_gym, ice_skating_rink/indoor"
172,4128,indoor,"clean_room, playground, archive, gymnasium/indoor, discotheque"
173,4152,indoor,"archive, schoolhouse, nursery, clean_room, playground"
174,4176,indoor,"playground, discotheque, clean_room, schoolhouse, archive"
175,4200,indoor,"nursery, dressing_room, martial_arts_gym, playground, locker_room"
176,4224,indoor,"playground, nursery, ballroom, martial_arts_gym, gymnasium/indoor"
177,4248,indoor,"ballroom, entrance_hall, martial_arts_gym, playground, archive"
178,4272,indoor,"bow_window/indoor, locker_room, dressing_room, archive, plaza"
179,4296,indoor,"playground, bow_window/indoor, nursery, hospital_room, locker_room"
180,4320,indoor,"playground, locker_room, dressing_room, nursery, kindergarden_classroom"
181,4344,indoor,"locker_room, archive, dressing_room, playground, kindergarden_classroom"
182,4368,indoor,"playground, locker_room, dressing_room, hospital_room, clean_room"
183,4392,indoor,"playground, archive, dressing_room, nursery, biology_laboratory"
184,4416,indoor,"playground, gymnasium/indoor, locker_room, dressing_room, martial_arts_gym"
185,4440,indoor,"dressing_room, ballroom, nursery, archive, classroom"
186,4464,indoor,"playground, nursery, archive, dressing_room, classroom"
187,4488,indoor,"dressing_room, playground, archive, discotheque, chemistry_lab"
188,4512,indoor,"nursery, discotheque, clothing_store, martial_arts_gym, dressing_room"
189,4536,indoor,"playground, nursery, dressing_room, discotheque, hospital_room"
190,4560,indoor,"dressing_room, discotheque, nursery, playground, beauty_salon"
191,4584,indoor,"boxing_ring, clean_room, operating_room, assembly_line, engine_room"
192,4608,indoor,"clean_room, boxing_ring, operating_room, assembly_line, engine_room"
193,4632,indoor,"clean_room, assembly_line, auto_factory, operating_room, engine_room"
194,4656,indoor,"clean_room, assembly_line, boxing_ring, auto_factory, chemistry_lab"
195,4680,indoor,"assembly_line, clean_room, auto_factory, chemistry_lab, engine_room"
196,4704,indoor,"dressing_room, beauty_salon, clean_room, discotheque, art_gallery"
197,4728,indoor,"dressing_room, clean_room, beauty_salon, bathroom, art_gallery"
198,4752,indoor,"museum/indoor, dressing_room, art_gallery, clean_room, discotheque"
199,4776,indoor,"clean_room, dressing_room, clothing_store, beauty_salon, art_studio"
200,4800,indoor,"clean_room, dressing_room, chemistry_lab, museum/indoor, beauty_salon"
201,4824,indoor,"clean_room, museum/indoor, chemistry_lab, discotheque, dressing_room"
202,4848,indoor,"clean_room, chemistry_lab, dressing_room, discotheque, biology_laboratory"
203,4872,indoor,"dressing_room, clean_room, chemistry_lab, clothing_store, beauty_salon"
204,4896,indoor,"dressing_room, clean_room, discotheque, beauty_salon, chemistry_lab"
205,4920,indoor,"dressing_room, beauty_salon, discotheque, restaurant, bar"
206,4944,indoor,"dressing_room, bathroom, shower, discotheque, beauty_salon"
207,4968,indoor,"dressing_room, beauty_salon, chemistry_lab, clean_room, restaurant"
208,4992,indoor,"dressing_room, beauty_salon, clean_room, chemistry_lab, bathroom"
209,5016,indoor,"clean_room, dressing_room, bathroom, shower, chemistry_lab"
210,5040,indoor,"dressing_room, sauna, shower, clean_room, bathroom"
211,5064,indoor,"dressing_room, beauty_salon, bathroom, discotheque, clean_room"
212,5088,indoor,"dressing_room, beauty_salon, clean_room, bathroom, locker_room"
213,5112,indoor,"dressing_room, clean_room, locker_room, bathroom, art_gallery"
214,5136,indoor,"clean_room, dressing_room, museum/indoor, locker_room, art_gallery"
215,5160,indoor,"dressing_room, clean_room, art_gallery, museum/indoor, archive"
216,5184,indoor,"dressing_room, clean_room, art_gallery, museum/indoor, locker_room"
217,5208,indoor,"dressing_room, art_gallery, clean_room, museum/indoor, locker_room"
218,5232,indoor,"clean_room, museum/indoor, archive, dressing_room, art_gallery"
219,5256,indoor,"dressing_room, locker_room, clean_room, art_gallery, museum/indoor"
220,5280,indoor,"dressing_room, museum/indoor, art_gallery, clean_room, locker_room"
221,5304,indoor,"dressing_room, locker_room, elevator/door, shower, clean_room"
222,5328,indoor,"archive, office, office_cubicles, jail_cell, locker_room"
223,5352,indoor,"archive, locker_room, office, elevator/door, office_cubicles"
224,5376,indoor,"archive, locker_room, office, elevator/door, clean_room"
225,5400,indoor,"locker_room, archive, elevator/door, clean_room, dressing_room"
226,5424,indoor,"archive, locker_room, dressing_room, elevator/door, museum/indoor"
227,5448,indoor,"clean_room, chemistry_lab, biology_laboratory, drugstore, beauty_salon"
228,5472,indoor,"chemistry_lab, clean_room, biology_laboratory, physics_laboratory, archive"
229,5496,indoor,"chemistry_lab, clean_room, physics_laboratory, biology_laboratory, auto_factory"
230,5520,indoor,"dressing_room, archive, clean_room, locker_room, office"
231,5544,indoor,"dressing_room, archive, locker_room, clean_room, elevator/door"
232,5568,indoor,"dressing_room, elevator/door, shower, bathroom, locker_room"
233,5592,indoor,"dressing_room, office, archive, office_cubicles, reception"
234,5616,indoor,"dressing_room, elevator/door, office, bathroom, locker_room"
235,5640,indoor,"dressing_room, elevator/door, shower, bathroom, beauty_salon"
236,5664,indoor,"elevator/door, locker_room, clean_room, dressing_room, office"
237,5688,indoor,"discotheque, stage/indoor, chemistry_lab, ballroom, martial_arts_gym"
238,5712,indoor,"nursery, ice_floe, playground, dressing_room, clean_room"
239,5736,outdoor,"ice_floe, chemistry_lab, iceberg, clean_room, ice_shelf"
240,5760,outdoor,"clean_room, ice_floe, iceberg, ice_shelf, igloo"
241,5784,outdoor,"clean_room, ice_floe, iceberg, ice_shelf, igloo"
242,5808,outdoor,"clean_room, igloo, ice_floe, iceberg, ice_shelf"
243,5832,outdoor,"clean_room, ice_floe, igloo, iceberg, construction_site"
244,5856,outdoor,"clean_room, igloo, ice_floe, ball_pit, construction_site"
245,5880,indoor,"clean_room, hospital_room, nursery, chemistry_lab, shower"
246,5904,indoor,"clean_room, discotheque, dressing_room, chemistry_lab, shower"
247,5928,indoor,"discotheque, clean_room, stage/indoor, music_studio, archive"
248,5952,indoor,"clean_room, discotheque, stage/indoor, operating_room, hospital_room"
249,5976,indoor,"discotheque, clean_room, banquet_hall, stage/indoor, ballroom"
250,6000,indoor,"clean_room, discotheque, operating_room, hospital_room, chemistry_lab"
251,6024,indoor,"discotheque, stage/indoor, clean_room, ballroom, dressing_room"
252,6048,indoor,"ice_floe, discotheque, clean_room, hospital_room, nursery"
253,6072,indoor,"clean_room, discotheque, operating_room, hospital_room, ice_floe"
254,6096,outdoor,"ice_floe, clean_room, igloo, discotheque, ice_shelf"
255,6120,outdoor,"ice_floe, clean_room, iceberg, igloo, ice_shelf"
256,6144,outdoor,"ice_floe, iceberg, igloo, playground, clean_room"
257,6168,outdoor,"iceberg, ice_floe, clean_room, igloo, ice_shelf"
258,6192,outdoor,"ice_floe, iceberg, florist_shop/indoor, chemistry_lab, pond"
259,6216,outdoor,"ice_floe, iceberg, pond, florist_shop/indoor, chemistry_lab"
260,6240,indoor,"discotheque, beauty_salon, ice_cream_parlor, shower, coffee_shop"
261,6264,indoor,"beauty_salon, discotheque, ice_cream_parlor, coffee_shop, shower"
262,6288,indoor,"coffee_shop, ice_cream_parlor, beauty_salon, shower, discotheque"
263,6312,indoor,"dressing_room, beauty_salon, airplane_cabin, discotheque, chemistry_lab"
264,6336,indoor,"dressing_room, beauty_salon, airplane_cabin, clean_room, discotheque"
265,6360,indoor,"dressing_room, beauty_salon, discotheque, chemistry_lab, airplane_cabin"
266,6384,indoor,"dressing_room, beauty_salon, airplane_cabin, discotheque, clean_room"
267,6408,indoor,"dressing_room, beauty_salon, chemistry_lab, discotheque, clean_room"
268,6432,indoor,"dressing_room, beauty_salon, chemistry_lab, discotheque, clean_room"
269,6456,indoor,"discotheque, shower, beauty_salon, ice_cream_parlor, coffee_shop"
270,6480,indoor,"discotheque, shower, beauty_salon, nursery, bathroom"
271,6504,indoor,"discotheque, shower, ice_cream_parlor, beauty_salon, coffee_shop"
272,6528,outdoor,"ice_floe, pond, chemistry_lab, clean_room, playground"
273,6552,outdoor,"ice_floe, iceberg, pond, florist_shop/indoor, lake/natural"
274,6576,outdoor,"iceberg, ice_floe, pond, florist_shop/indoor, lake/natural"
275,6600,outdoor,"iceberg, ice_floe, florist_shop/indoor, ice_shelf, pond"
276,6624,outdoor,"iceberg, ice_floe, florist_shop/indoor, ice_shelf, pond"
277,6648,outdoor,"ice_floe, iceberg, pond, ice_shelf, lake/natural"
278,6672,outdoor,"ice_floe, iceberg, florist_shop/indoor, pond, botanical_garden"
279,6696,outdoor,"florist_shop/indoor, ice_floe, botanical_garden, iceberg, playground"
280,6720,indoor,"beauty_salon, dressing_room, discotheque, chemistry_lab, clean_room"
281,6744,indoor,"beauty_salon, discotheque, dressing_room, chemistry_lab, clean_room"
282,6768,indoor,"beauty_salon, discotheque, dressing_room, chemistry_lab, bathroom"
283,6792,indoor,"beauty_salon, discotheque, chemistry_lab, dressing_room, airplane_cabin"
284,6816,indoor,"playground, beauty_salon, coffee_shop, shower, aquarium"
285,6840,indoor,"beauty_salon, coffee_shop, shower, playground, aquarium"
286,6864,indoor,"beauty_salon, dressing_room, chemistry_lab, clean_room, discotheque"
287,6888,indoor,"beauty_salon, dressing_room, clean_room, hospital_room, bathroom"
288,6912,indoor,"dressing_room, beauty_salon, clean_room, airplane_cabin, chemistry_lab"
289,6936,indoor,"dressing_room, airplane_cabin, beauty_salon, clean_room, chemistry_lab"
290,6960,indoor,"discotheque, dressing_room, chemistry_lab, shower, bar"
291,6984,outdoor,"ice_floe, playground, aquarium, sandbox, nursery"
292,7008,indoor,"clean_room, dressing_room, discotheque, nursery, sauna"
293,7032,indoor,"clean_room, dressing_room, discotheque, operating_room, chemistry_lab"
294,7056,indoor,"clean_room, operating_room, martial_arts_gym, discotheque, hospital_room"
295,7080,indoor,"clean_room, dressing_room, discotheque, chemistry_lab, operating_room"
296,7104,indoor,"clean_room, martial_arts_gym, operating_room, nursery, hospital_room"
297,7128,indoor,"clean_room, hospital_room, chemistry_lab, operating_room, discotheque"
298,7152,indoor,"clean_room, operating_room, discotheque, dressing_room, martial_arts_gym"
299,7176,indoor,"clean_room, dressing_room, operating_room, hospital_room, chemistry_lab"
300,7200,indoor,"clean_room, banquet_hall, dressing_room, operating_room, hospital_room"
301,7224,indoor,"clean_room, operating_room, dressing_room, museum/indoor, hospital_room"
302,7248,indoor,"dressing_room, discotheque, clean_room, banquet_hall, ballroom"
303,7272,indoor,"clean_room, operating_room, chemistry_lab, hospital_room, dressing_room"
304,7296,indoor,"clean_room, operating_room, chemistry_lab, biology_laboratory, hospital_room"
305,7320,indoor,"clean_room, chemistry_lab, biology_laboratory, discotheque, operating_room"
306,7344,indoor,"clean_room, operating_room, hospital_room, dressing_room, biology_laboratory"
307,7368,indoor,"clean_room, operating_room, hospital_room, dressing_room, chemistry_lab"
308,7392,indoor,"clean_room, operating_room, hospital_room, nursery, chemistry_lab"
309,7416,indoor,"clean_room, chemistry_lab, operating_room, biology_laboratory, banquet_hall"
310,7440,indoor,"clean_room, operating_room, dressing_room, chemistry_lab, hospital_room"
311,7464,indoor,"dressing_room, discotheque, pub/indoor, chemistry_lab, restaurant"
312,7488,indoor,"dressing_room, discotheque, chemistry_lab, nursery, playroom"
313,7512,indoor,"dressing_room, chemistry_lab, discotheque, biology_laboratory, clean_room"
314,7536,indoor,"dressing_room, discotheque, chemistry_lab, beauty_salon, shower"
315,7560,indoor,"dressing_room, chemistry_lab, biology_laboratory, beauty_salon, discotheque"
316,7584,indoor,"clean_room, operating_room, chemistry_lab, hospital_room, biology_laboratory"
317,7608,indoor,"clean_room, operating_room, chemistry_lab, hospital_room, dressing_room"
318,7632,indoor,"clean_room, operating_room, dressing_room, chemistry_lab, biology_laboratory"
319,7656,indoor,"clean_room, operating_room, hospital_room, chemistry_lab, biology_laboratory"
