,frame_num,environment,places
3365,80760,outdoor,"airport_terminal, escalator/indoor, runway, landing_deck, campsite"
3366,80784,indoor,"airport_terminal, escalator/indoor, runway, landing_deck, airplane_cabin"
3367,80808,indoor,"airport_terminal, escalator/indoor, runway, landing_deck, airplane_cabin"
3368,80832,indoor,"nursery, hospital_room, balcony/interior, bowling_alley, bedroom"
3369,80856,indoor,"nursery, hospital_room, childs_room, balcony/interior, bedroom"
3370,80880,indoor,"nursery, balcony/interior, childs_room, bedroom, hospital_room"
3371,80904,indoor,"nursery, balcony/interior, hospital_room, pier, bedroom"
3372,80928,indoor,"nursery, boxing_ring, bowling_alley, clean_room, hospital_room"
3373,80952,indoor,"boxing_ring, nursery, bowling_alley, dressing_room, discotheque"
3374,80976,outdoor,"nursery, pier, balcony/interior, boardwalk, bowling_alley"
3375,81000,indoor,"nursery, bowling_alley, dressing_room, balcony/interior, hospital_room"
3376,81024,outdoor,"nursery, balcony/interior, boardwalk, bowling_alley, pier"
3377,81048,indoor,"nursery, dressing_room, clean_room, hospital_room, archive"
3378,81072,indoor,"nursery, dressing_room, bowling_alley, hospital_room, boxing_ring"
3379,81096,indoor,"nursery, dressing_room, bowling_alley, discotheque, hospital_room"
3380,81120,indoor,"nursery, dressing_room, discotheque, clean_room, bowling_alley"
3381,81144,outdoor,"nursery, pier, balcony/interior, ice_floe, boardwalk"
3382,81168,outdoor,"nursery, balcony/interior, pier, ice_floe, bedroom"
3383,81192,indoor,"nursery, boxing_ring, hospital_room, dressing_room, racecourse"
3384,81216,indoor,"nursery, dressing_room, hospital_room, bowling_alley, boxing_ring"
3385,81240,indoor,"nursery, dressing_room, bowling_alley, discotheque, balcony/interior"
3386,81264,indoor,"nursery, discotheque, boxing_ring, bowling_alley, dressing_room"
3387,81288,indoor,"nursery, dressing_room, discotheque, clean_room, bowling_alley"
3388,81312,indoor,"nursery, dressing_room, clean_room, hospital_room, discotheque"
3389,81336,indoor,"nursery, dressing_room, clean_room, hospital_room, discotheque"
3390,81360,indoor,"nursery, dressing_room, hospital_room, bowling_alley, balcony/interior"
3391,81384,indoor,"nursery, dressing_room, balcony/interior, hospital_room, bowling_alley"
3392,81408,indoor,"nursery, balcony/interior, pier, bowling_alley, dressing_room"
3393,81432,indoor,"nursery, dressing_room, balcony/interior, archive, bowling_alley"
3394,81456,indoor,"nursery, dressing_room, archive, bowling_alley, discotheque"
3395,81480,indoor,"nursery, dressing_room, hospital_room, bowling_alley, discotheque"
3396,81504,indoor,"nursery, dressing_room, hospital_room, clean_room, discotheque"
3397,81528,indoor,"nursery, dressing_room, clean_room, hospital_room, discotheque"
3398,81552,indoor,"nursery, hospital_room, dressing_room, racecourse, clean_room"
3399,81576,indoor,"nursery, dressing_room, hospital_room, bowling_alley, discotheque"
3400,81600,indoor,"nursery, dressing_room, bowling_alley, hospital_room, clean_room"
3401,81624,indoor,"nursery, dressing_room, boxing_ring, hospital_room, bowling_alley"
3402,81648,indoor,"clean_room, discotheque, bowling_alley, nursery, boxing_ring"
3403,81672,indoor,"shower, bathroom, clean_room, chemistry_lab, beauty_salon"
3404,81696,outdoor,"runway, ice_shelf, ice_floe, landing_deck, desert/sand"
3405,81720,indoor,"clean_room, runway, ice_shelf, shower, hospital_room"
3406,81744,outdoor,"snowfield, sky, ice_floe, underwater/ocean_deep, pond"
3407,81768,outdoor,"ice_floe, pond, lake/natural, marsh, ice_shelf"
3408,81792,outdoor,"ski_slope, ice_floe, snowfield, sky, pond"
3409,81816,outdoor,"ski_slope, sky, snowfield, ice_floe, airfield"
3410,81840,indoor,"cockpit, airplane_cabin, car_interior, clean_room, laundromat"
3411,81864,indoor,"cockpit, airplane_cabin, clean_room, operating_room, physics_laboratory"
3412,81888,indoor,"bank_vault, bathroom, clean_room, shower, chemistry_lab"
3413,81912,indoor,"bathroom, clean_room, shower, bank_vault, chemistry_lab"
3414,81936,indoor,"clean_room, bathroom, operating_room, shower, hospital_room"
3415,81960,indoor,"clean_room, shower, bathroom, operating_room, bank_vault"
3416,81984,indoor,"clean_room, bathroom, shower, museum/indoor, operating_room"
3417,82008,outdoor,"ice_floe, snowfield, ice_shelf, glacier, igloo"
3418,82032,outdoor,"snowfield, ice_floe, igloo, glacier, shower"
3419,82056,outdoor,"shower, tower, sky, underwater/ocean_deep, bathroom"
3420,82080,outdoor,"ice_floe, underwater/ocean_deep, glacier, crevasse, iceberg"
3421,82104,outdoor,"snowfield, sky, ice_floe, glacier, mountain_snowy"
3422,82128,outdoor,"sky, snowfield, shower, ice_floe, glacier"
3423,82152,outdoor,"crevasse, glacier, ice_floe, snowfield, mountain_snowy"
3424,82176,indoor,"clean_room, bathroom, shower, bank_vault, locker_room"
3425,82200,indoor,"clean_room, shower, bathroom, locker_room, museum/indoor"
3426,82224,indoor,"clean_room, operating_room, shower, museum/indoor, science_museum"
3427,82248,indoor,"clean_room, shower, operating_room, bathroom, museum/indoor"
3428,82272,outdoor,"snowfield, ice_floe, glacier, crevasse, mountain_snowy"
3429,82296,outdoor,"ice_floe, sky, wind_farm, snowfield, ice_shelf"
3430,82320,outdoor,"ice_shelf, ice_floe, shower, fountain, burial_chamber"
3431,82344,indoor,"shower, burial_chamber, ice_shelf, crevasse, elevator_shaft"
3432,82368,indoor,"shower, elevator_shaft, burial_chamber, ice_shelf, bathroom"
3433,82392,outdoor,"crevasse, glacier, rope_bridge, sky, ice_floe"
3434,82416,outdoor,"ice_skating_rink/outdoor, ice_skating_rink/indoor, playground, shower, ski_slope"
3435,82440,indoor,"clean_room, bank_vault, chemistry_lab, shower, physics_laboratory"
3436,82464,indoor,"shower, clean_room, museum/indoor, bathroom, locker_room"
3437,82488,indoor,"shower, clean_room, bathroom, bank_vault, locker_room"
3438,82512,indoor,"shower, clean_room, bathroom, chemistry_lab, science_museum"
3439,82536,indoor,"clean_room, engine_room, science_museum, chemistry_lab, auto_factory"
3440,82560,indoor,"clean_room, operating_room, gymnasium/indoor, auto_factory, assembly_line"
3441,82584,indoor,"cockpit, airplane_cabin, clean_room, engine_room, physics_laboratory"
3442,82608,indoor,"clean_room, airplane_cabin, cockpit, operating_room, physics_laboratory"
3443,82632,indoor,"clean_room, martial_arts_gym, hospital_room, nursery, arch"
3444,82656,indoor,"clean_room, hospital_room, chemistry_lab, nursery, operating_room"
3445,82680,indoor,"clean_room, martial_arts_gym, operating_room, museum/indoor, science_museum"
3446,82704,indoor,"clean_room, martial_arts_gym, locker_room, boxing_ring, hospital_room"
3447,82728,indoor,"clean_room, hospital_room, operating_room, science_museum, airport_terminal"
3448,82752,indoor,"clean_room, locker_room, martial_arts_gym, shower, bathroom"
3449,82776,indoor,"clean_room, banquet_hall, atrium/public, airport_terminal, museum/indoor"
3450,82800,indoor,"bathroom, bank_vault, clean_room, shower, elevator/door"
3451,82824,indoor,"clean_room, operating_room, bathroom, shower, hospital_room"
3452,82848,indoor,"clean_room, operating_room, bathroom, shower, bank_vault"
3453,82872,indoor,"clean_room, operating_room, bathroom, hospital_room, shower"
3454,82896,indoor,"shower, igloo, discotheque, dressing_room, clothing_store"
3455,82920,indoor,"shower, clothing_store, dressing_room, discotheque, museum/indoor"
3456,82944,outdoor,"ice_shelf, ice_floe, iceberg, shower, museum/indoor"
3457,82968,outdoor,"museum/indoor, iceberg, shower, ice_floe, igloo"
3458,82992,outdoor,"iceberg, ice_shelf, ice_floe, shower, igloo"
3459,83016,outdoor,"shower, igloo, ice_floe, water_tower, arch"
3460,83040,indoor,"clean_room, entrance_hall, waiting_room, nursery, staircase"
3461,83064,indoor,"clean_room, chemistry_lab, assembly_line, physics_laboratory, auto_factory"
3462,83088,indoor,"clean_room, locker_room, clothing_store, martial_arts_gym, shoe_shop"
3463,83112,indoor,"clean_room, martial_arts_gym, locker_room, chemistry_lab, archive"
3464,83136,indoor,"clean_room, gymnasium/indoor, boxing_ring, chemistry_lab, archive"
3465,83160,indoor,"clean_room, gymnasium/indoor, archive, martial_arts_gym, operating_room"
3466,83184,indoor,"clean_room, bank_vault, shower, bathroom, elevator/door"
3467,83208,indoor,"clean_room, operating_room, bathroom, shower, hospital_room"
3468,83232,indoor,"clean_room, shower, bathroom, operating_room, hospital_room"
3469,83256,indoor,"clean_room, engine_room, chemistry_lab, physics_laboratory, biology_laboratory"
3470,83280,indoor,"clean_room, chemistry_lab, biology_laboratory, operating_room, museum/indoor"
3471,83304,indoor,"clean_room, science_museum, operating_room, museum/indoor, natural_history_museum"
3472,83328,indoor,"clean_room, museum/indoor, physics_laboratory, engine_room, science_museum"
3473,83352,indoor,"clean_room, museum/indoor, science_museum, physics_laboratory, engine_room"
3474,83376,indoor,"shower, clean_room, discotheque, music_studio, bathroom"
3475,83400,indoor,"shower, discotheque, clean_room, igloo, ice_floe"
3476,83424,indoor,"clean_room, shower, underwater/ocean_deep, shoe_shop, discotheque"
3477,83448,indoor,"clean_room, operating_room, discotheque, shower, music_studio"
3478,83472,indoor,"clean_room, auto_factory, assembly_line, chemistry_lab, gymnasium/indoor"
3479,83496,indoor,"clean_room, gymnasium/indoor, auto_factory, physics_laboratory, museum/indoor"
3480,83520,indoor,"clean_room, operating_room, locker_room, hospital_room, dressing_room"
3481,83544,indoor,"clean_room, airplane_cabin, physics_laboratory, cockpit, operating_room"
3482,83568,indoor,"clean_room, museum/indoor, science_museum, operating_room, archive"
3483,83592,indoor,"clean_room, museum/indoor, science_museum, natural_history_museum, operating_room"
3484,83616,indoor,"clean_room, science_museum, natural_history_museum, engine_room, operating_room"
3485,83640,indoor,"airplane_cabin, clean_room, cockpit, physics_laboratory, operating_room"
3486,83664,indoor,"clean_room, airplane_cabin, laundromat, operating_room, physics_laboratory"
3487,83688,indoor,"airplane_cabin, clean_room, cockpit, laundromat, physics_laboratory"
3488,83712,outdoor,"airfield, sky, runway, landing_deck, ice_floe"
3489,83736,outdoor,"airfield, sky, runway, wind_farm, landing_deck"
3490,83760,outdoor,"windmill, wind_farm, airfield, sky, runway"
3491,83784,outdoor,"windmill, wind_farm, airfield, sky, runway"
3492,83808,outdoor,"runway, ice_floe, landing_deck, airfield, windmill"
3493,83832,outdoor,"runway, landing_deck, airfield, hangar/outdoor, heliport"
3494,83856,outdoor,"runway, landing_deck, airfield, hangar/outdoor, heliport"
3495,83880,outdoor,"runway, landing_deck, airfield, heliport, hangar/outdoor"
3496,83904,outdoor,"runway, landing_deck, ice_shelf, hangar/indoor, airfield"
3497,83928,indoor,"clean_room, bathroom, shower, bank_vault, operating_room"
3498,83952,indoor,"clean_room, shower, bathroom, operating_room, laundromat"
3499,83976,indoor,"clean_room, shower, bathroom, igloo, science_museum"
3500,84000,indoor,"bathroom, shower, clean_room, airplane_cabin, operating_room"
3501,84024,indoor,"bathroom, shower, clean_room, operating_room, laundromat"
3502,84048,indoor,"shower, bathroom, clean_room, laundromat, operating_room"
3503,84072,indoor,"bathroom, shower, clean_room, operating_room, laundromat"
3504,84096,outdoor,"hangar/outdoor, ski_resort, snowfield, ice_floe, chalet"
3505,84120,outdoor,"hangar/outdoor, ice_shelf, igloo, ski_resort, ice_floe"
3506,84144,outdoor,"hangar/outdoor, runway, landing_deck, ice_floe, igloo"
3507,84168,outdoor,"igloo, ski_resort, runway, ice_floe, hangar/outdoor"
3508,84192,indoor,"bathroom, shower, clean_room, igloo, natural_history_museum"
3509,84216,indoor,"bathroom, shower, clean_room, laundromat, engine_room"
3510,84240,outdoor,"schoolhouse, runway, hangar/outdoor, igloo, ice_floe"
3511,84264,outdoor,"runway, landing_deck, ice_floe, boat_deck, racecourse"
3512,84288,outdoor,"runway, desert/sand, campsite, landing_deck, ice_floe"
3513,84312,outdoor,"runway, desert/sand, ice_floe, landing_deck, campsite"
3514,84336,outdoor,"runway, playground, railroad_track, campsite, ice_floe"
3515,84360,outdoor,"volleyball_court/outdoor, schoolhouse, clean_room, archive, baseball_field"
3516,84384,outdoor,"clean_room, schoolhouse, ice_floe, runway, archive"
3517,84408,indoor,"clean_room, archive, stage/indoor, operating_room, runway"
3518,84432,indoor,"clean_room, archive, operating_room, dressing_room, schoolhouse"
3519,84456,indoor,"clean_room, archive, operating_room, runway, stage/indoor"
3520,84480,indoor,"clean_room, archive, museum/indoor, schoolhouse, operating_room"
3521,84504,indoor,"clean_room, operating_room, archive, ice_floe, rice_paddy"
3522,84528,indoor,"clean_room, martial_arts_gym, archive, operating_room, army_base"
3523,84552,indoor,"clean_room, archive, stage/indoor, museum/indoor, schoolhouse"
3524,84576,indoor,"clean_room, dressing_room, operating_room, hospital_room, runway"
3525,84600,indoor,"clean_room, operating_room, schoolhouse, archive, hospital_room"
3526,84624,indoor,"clean_room, operating_room, martial_arts_gym, archive, hospital_room"
3527,84648,indoor,"clean_room, operating_room, archive, dressing_room, hospital_room"
3528,84672,indoor,"schoolhouse, clean_room, operating_room, archive, hospital_room"
3529,84696,indoor,"clean_room, martial_arts_gym, operating_room, dressing_room, hospital_room"
3530,84720,indoor,"clean_room, operating_room, hospital_room, archive, dressing_room"
3531,84744,outdoor,"runway, clean_room, schoolhouse, ice_shelf, campsite"
3532,84768,outdoor,"schoolhouse, racecourse, runway, martial_arts_gym, landing_deck"
3533,84792,outdoor,"desert/sand, lake/natural, beach, marsh, pond"
3534,84816,outdoor,"desert/sand, lake/natural, beach, marsh, pond"
3535,84840,outdoor,"sky, cemetery, ice_floe, tower, igloo"
3536,84864,outdoor,"cemetery, sky, igloo, tower, oast_house"
3537,84888,outdoor,"cemetery, sky, igloo, tower, mausoleum"
3538,84912,outdoor,"cemetery, sky, tower, igloo, oast_house"
3539,84936,outdoor,"cemetery, sky, igloo, tower, oast_house"
3540,84960,indoor,"clean_room, hospital_room, operating_room, bedchamber, dressing_room"
3541,84984,indoor,"clean_room, bedchamber, hospital_room, dressing_room, bedroom"
3542,85008,indoor,"clean_room, dressing_room, operating_room, hospital_room, clothing_store"
3543,85032,indoor,"clean_room, dressing_room, hospital_room, operating_room, bedchamber"
3544,85056,indoor,"clean_room, dressing_room, bedchamber, bedroom, living_room"
3545,85080,indoor,"hospital_room, clean_room, operating_room, nursing_home, bedchamber"
3546,85104,indoor,"clean_room, hospital_room, operating_room, youth_hostel, dressing_room"
3547,85128,indoor,"bedroom, clean_room, bedchamber, dressing_room, hospital_room"
3548,85152,indoor,"discotheque, dressing_room, stage/indoor, clean_room, music_studio"
3549,85176,outdoor,"ice_floe, ice_shelf, iceberg, runway, ocean"
3550,85200,outdoor,"ice_shelf, ice_floe, iceberg, ocean, desert/sand"
3551,85224,outdoor,"ice_shelf, ice_floe, iceberg, desert/sand, ocean"
3552,85248,indoor,"clean_room, operating_room, hospital_room, dressing_room, nursery"
3553,85272,indoor,"clean_room, hotel_room, bedroom, bedchamber, hospital_room"
3554,85296,indoor,"clean_room, bedchamber, bedroom, attic, nursery"
3555,85320,indoor,"clean_room, hospital_room, operating_room, hotel_room, dressing_room"
3556,85344,indoor,"bedroom, hospital_room, hotel_room, bedchamber, youth_hostel"
3557,85368,indoor,"clean_room, hospital_room, operating_room, bedroom, dressing_room"
3558,85392,indoor,"clean_room, nursery, bedroom, hospital_room, hotel_room"
3559,85416,indoor,"bedroom, hotel_room, dressing_room, clean_room, hospital_room"
3560,85440,indoor,"clean_room, hospital_room, operating_room, hotel_room, airplane_cabin"
3561,85464,indoor,"hospital_room, clean_room, operating_room, hotel_room, bedroom"
3562,85488,indoor,"hospital_room, bedroom, hotel_room, bedchamber, dressing_room"
3563,85512,indoor,"clean_room, hospital_room, dressing_room, bedroom, nursery"
3564,85536,indoor,"clean_room, airplane_cabin, hospital_room, restaurant, dressing_room"
3565,85560,indoor,"clean_room, hospital_room, operating_room, bedroom, dressing_room"
3566,85584,indoor,"clean_room, hospital_room, operating_room, dressing_room, airplane_cabin"
3567,85608,indoor,"hospital_room, operating_room, clean_room, bedchamber, bedroom"
3568,85632,indoor,"hospital_room, operating_room, clean_room, bedchamber, bedroom"
3569,85656,indoor,"hospital_room, operating_room, clean_room, bedchamber, nursery"
3570,85680,indoor,"hospital_room, slum, clean_room, chemistry_lab, discotheque"
3571,85704,outdoor,"wind_farm, soccer_field, football_field, windmill, racecourse"
3572,85728,outdoor,"soccer_field, racecourse, football_field, wind_farm, corn_field"
3573,85752,outdoor,"soccer_field, corn_field, football_field, racecourse, wind_farm"
3574,85776,outdoor,"desert/sand, bullring, racecourse, arena/rodeo, ice_shelf"
3575,85800,outdoor,"desert/sand, racecourse, desert_road, bullring, ice_shelf"
3576,85824,outdoor,"desert/sand, racecourse, desert_road, raceway, campsite"
3577,85848,outdoor,"desert/sand, desert_road, ice_shelf, ski_slope, mountain_snowy"
3578,85872,outdoor,"desert/sand, racecourse, raceway, desert_road, bullring"
3579,85896,outdoor,"desert/sand, desert_road, racecourse, valley, mountain_snowy"
3580,85920,outdoor,"soccer_field, corn_field, wind_farm, football_field, racecourse"
3581,85944,outdoor,"soccer_field, football_field, corn_field, athletic_field/outdoor, racecourse"
3582,85968,outdoor,"soccer_field, corn_field, football_field, athletic_field/outdoor, playground"
3583,85992,outdoor,"soccer_field, corn_field, athletic_field/outdoor, playground, rice_paddy"
3584,86016,outdoor,"cemetery, sky, tower, wind_farm, windmill"
3585,86040,outdoor,"cemetery, sky, wind_farm, tower, windmill"
3586,86064,indoor,"discotheque, clean_room, dressing_room, locker_room, clothing_store"
3587,86088,indoor,"clean_room, discotheque, dressing_room, locker_room, clothing_store"
3588,86112,indoor,"clean_room, discotheque, dressing_room, locker_room, clothing_store"
3589,86136,outdoor,"ice_shelf, desert/sand, snowfield, ski_slope, mountain_snowy"
3590,86160,outdoor,"ice_shelf, desert/sand, snowfield, racecourse, ski_slope"
3591,86184,outdoor,"soccer_field, football_field, racecourse, athletic_field/outdoor, corn_field"
3592,86208,outdoor,"soccer_field, football_field, racecourse, athletic_field/outdoor, playground"
3593,86232,outdoor,"soccer_field, athletic_field/outdoor, racecourse, playground, football_field"
3594,86256,outdoor,"soccer_field, racecourse, football_field, athletic_field/outdoor, rice_paddy"
3595,86280,outdoor,"wind_farm, windmill, corn_field, rice_paddy, wheat_field"
3596,86304,outdoor,"ice_shelf, desert/sand, wind_farm, ocean, ice_floe"
3597,86328,outdoor,"ice_shelf, desert/sand, wind_farm, desert_road, ice_floe"
3598,86352,outdoor,"ice_shelf, desert/sand, wind_farm, racecourse, runway"
3599,86376,outdoor,"ice_shelf, desert/sand, racecourse, ice_floe, runway"
3600,86400,outdoor,"ice_shelf, wind_farm, desert/sand, runway, racecourse"
3601,86424,outdoor,"ice_shelf, desert/sand, racecourse, runway, field/cultivated"
3602,86448,outdoor,"ice_shelf, desert/sand, ice_floe, snowfield, runway"
3603,86472,indoor,"discotheque, clean_room, stage/indoor, music_studio, ballroom"
3604,86496,indoor,"discotheque, clean_room, stage/indoor, music_studio, airplane_cabin"
3605,86520,indoor,"discotheque, stage/indoor, music_studio, clean_room, shower"
3606,86544,indoor,"discotheque, stage/indoor, ballroom, airplane_cabin, clean_room"
3607,86568,indoor,"discotheque, locker_room, dressing_room, clean_room, airplane_cabin"
3608,86592,outdoor,"ice_shelf, iceberg, mountain_snowy, glacier, valley"
3609,86616,outdoor,"ice_shelf, iceberg, mountain_snowy, valley, desert/sand"
3610,86640,outdoor,"ice_shelf, iceberg, mountain_snowy, valley, glacier"
3611,86664,outdoor,"ice_shelf, iceberg, mountain_snowy, glacier, igloo"
3612,86688,outdoor,"ice_shelf, iceberg, mountain_snowy, desert/sand, glacier"
3613,86712,outdoor,"ice_shelf, iceberg, mountain_snowy, glacier, desert/sand"
3614,86736,indoor,"archive, ice_shelf, dressing_room, classroom, discotheque"
3615,86760,indoor,"archive, ice_shelf, classroom, dressing_room, discotheque"
3616,86784,indoor,"car_interior, airplane_cabin, discotheque, clean_room, orchard"
3617,86808,indoor,"discotheque, car_interior, orchard, dressing_room, airplane_cabin"
3618,86832,indoor,"airplane_cabin, car_interior, discotheque, dressing_room, clean_room"
3619,86856,outdoor,"ice_shelf, runway, ice_floe, desert/sand, snowfield"
3620,86880,outdoor,"ice_shelf, wind_farm, windmill, desert/sand, snowfield"
3621,86904,outdoor,"ice_shelf, wind_farm, desert/sand, runway, windmill"
3622,86928,indoor,"discotheque, dressing_room, stage/indoor, music_studio, clean_room"
3623,86952,indoor,"discotheque, clean_room, dressing_room, chemistry_lab, ballroom"
3624,86976,indoor,"clean_room, airplane_cabin, discotheque, locker_room, museum/indoor"
3625,87000,indoor,"dressing_room, ballroom, clean_room, discotheque, museum/indoor"
3626,87024,outdoor,"igloo, iceberg, glacier, campsite, oast_house"
3627,87048,outdoor,"campsite, wheat_field, corn_field, orchard, igloo"
3628,87072,outdoor,"campsite, wheat_field, racecourse, discotheque, corn_field"
3629,87096,outdoor,"campsite, racecourse, wheat_field, oast_house, desert/sand"
3630,87120,outdoor,"campsite, wheat_field, oast_house, desert/sand, racecourse"
3631,87144,outdoor,"campsite, wheat_field, desert/sand, oast_house, corn_field"
3632,87168,outdoor,"campsite, wheat_field, iceberg, glacier, corn_field"
3633,87192,outdoor,"campsite, dressing_room, desert/sand, oast_house, wheat_field"
3634,87216,outdoor,"campsite, wheat_field, desert/sand, oast_house, canyon"
3635,87240,outdoor,"campsite, oast_house, desert/sand, discotheque, glacier"
3636,87264,outdoor,"campsite, oast_house, clothing_store, orchard, dressing_room"
3637,87288,indoor,"discotheque, dressing_room, campsite, shower, ballroom"
3638,87312,outdoor,"crevasse, iceberg, igloo, glacier, ice_shelf"
3639,87336,indoor,"clean_room, discotheque, iceberg, museum/indoor, ice_shelf"
3640,87360,indoor,"clean_room, operating_room, discotheque, dressing_room, hospital_room"
3641,87384,indoor,"clean_room, dressing_room, discotheque, operating_room, hospital_room"
3642,87408,indoor,"clean_room, dressing_room, discotheque, operating_room, hospital_room"
3643,87432,indoor,"discotheque, clean_room, stage/indoor, dressing_room, music_studio"
3644,87456,indoor,"discotheque, clean_room, stage/indoor, music_studio, dressing_room"
3645,87480,indoor,"clean_room, discotheque, operating_room, museum/indoor, hospital_room"
3646,87504,indoor,"clean_room, discotheque, dressing_room, operating_room, museum/indoor"
3647,87528,indoor,"discotheque, clean_room, stage/indoor, chemistry_lab, basement"
3648,87552,indoor,"clean_room, discotheque, museum/indoor, iceberg, stage/indoor"
3649,87576,indoor,"clean_room, discotheque, dressing_room, iceberg, hospital_room"
3650,87600,indoor,"discotheque, stage/indoor, ballroom, bar, museum/indoor"
3651,87624,indoor,"discotheque, clean_room, stage/indoor, ballroom, chemistry_lab"
3652,87648,indoor,"discotheque, clean_room, stage/indoor, chemistry_lab, ballroom"
3653,87672,indoor,"discotheque, stage/indoor, museum/indoor, ballroom, music_studio"
3654,87696,indoor,"discotheque, stage/indoor, ballroom, chemistry_lab, bar"
3655,87720,indoor,"discotheque, clean_room, stage/indoor, banquet_hall, chemistry_lab"
3656,87744,indoor,"campsite, clean_room, discotheque, hospital_room, stage/indoor"
3657,87768,indoor,"campsite, clean_room, hospital_room, airplane_cabin, discotheque"
3658,87792,indoor,"campsite, clean_room, hospital_room, clothing_store, wind_farm"
3659,87816,indoor,"clean_room, igloo, campsite, discotheque, nursery"
3660,87840,indoor,"classroom, schoolhouse, runway, kindergarden_classroom, archive"
3661,87864,indoor,"discotheque, stage/indoor, campsite, ballroom, locker_room"
3662,87888,outdoor,"discotheque, stage/indoor, ice_shelf, campsite, schoolhouse"
3663,87912,indoor,"clean_room, dressing_room, clothing_store, discotheque, hospital_room"
3664,87936,outdoor,"campsite, igloo, glacier, crevasse, greenhouse/outdoor"
3665,87960,indoor,"courtyard, clean_room, hospital_room, classroom, atrium/public"
3666,87984,indoor,"gymnasium/indoor, auto_factory, jail_cell, entrance_hall, assembly_line"
3667,88008,indoor,"gymnasium/indoor, playground, entrance_hall, staircase, auto_factory"
3668,88032,indoor,"gymnasium/indoor, auto_factory, playground, jail_cell, archive"
3669,88056,indoor,"gymnasium/indoor, playground, auto_factory, clean_room, jail_cell"
3670,88080,indoor,"staircase, entrance_hall, escalator/indoor, playground, mezzanine"
3671,88104,indoor,"staircase, entrance_hall, mezzanine, artists_loft, church/indoor"
3672,88128,indoor,"clean_room, staircase, laundromat, playground, entrance_hall"
3673,88152,indoor,"entrance_hall, staircase, jail_cell, basement, corridor"
3674,88176,indoor,"arena/rodeo, stable, classroom, ballroom, hangar/indoor"
3675,88200,indoor,"ballroom, stage/indoor, music_studio, museum/indoor, shower"
3676,88224,indoor,"ballroom, stage/indoor, music_studio, stable, clean_room"
3677,88248,indoor,"stable, arena/rodeo, ballroom, schoolhouse, kindergarden_classroom"
3678,88272,indoor,"entrance_hall, mezzanine, staircase, auditorium, waiting_room"
3679,88296,indoor,"gymnasium/indoor, entrance_hall, mezzanine, staircase, playground"
3680,88320,indoor,"entrance_hall, gymnasium/indoor, mezzanine, staircase, playground"
3681,88344,indoor,"entrance_hall, gymnasium/indoor, mezzanine, playground, staircase"
3682,88368,indoor,"entrance_hall, staircase, gymnasium/indoor, mezzanine, playground"
3683,88392,indoor,"entrance_hall, staircase, mezzanine, gymnasium/indoor, playground"
