,frame_num,environment,places
1235,29640,indoor,"discotheque, shower, clean_room, locker_room, jail_cell"
1236,29664,indoor,"discotheque, stage/indoor, airplane_cabin, bowling_alley, basement"
1237,29688,indoor,"discotheque, airplane_cabin, bowling_alley, shower, bathroom"
1238,29712,indoor,"discotheque, airplane_cabin, bowling_alley, clean_room, basement"
1239,29736,indoor,"discotheque, airplane_cabin, basement, bowling_alley, bar"
1240,29760,indoor,"discotheque, basement, airplane_cabin, archive, locker_room"
1241,29784,indoor,"clean_room, discotheque, shower, archive, locker_room"
1242,29808,indoor,"clean_room, archive, locker_room, shower, discotheque"
1243,29832,indoor,"discotheque, dressing_room, bar, stage/indoor, shower"
1244,29856,indoor,"discotheque, dressing_room, stage/indoor, bar, shower"
1245,29880,indoor,"discotheque, dressing_room, stage/indoor, bar, locker_room"
1246,29904,indoor,"discotheque, dressing_room, stage/indoor, clean_room, music_studio"
1247,29928,indoor,"discotheque, dressing_room, stage/indoor, basement, music_studio"
1248,29952,indoor,"dressing_room, discotheque, basement, stage/indoor, shower"
1249,29976,indoor,"discotheque, dressing_room, stage/indoor, music_studio, basement"
1250,30000,indoor,"discotheque, dressing_room, stage/indoor, clean_room, shower"
1251,30024,indoor,"discotheque, dressing_room, stage/indoor, basement, music_studio"
1252,30048,indoor,"discotheque, airplane_cabin, bowling_alley, ballroom, attic"
1253,30072,indoor,"discotheque, airplane_cabin, bowling_alley, bar, ballroom"
1254,30096,indoor,"discotheque, airplane_cabin, stage/indoor, ballroom, bar"
1255,30120,indoor,"discotheque, bar, bowling_alley, airplane_cabin, restaurant"
1256,30144,indoor,"discotheque, bar, stage/indoor, bowling_alley, ballroom"
1257,30168,indoor,"discotheque, bar, stage/indoor, music_studio, reception"
1258,30192,indoor,"discotheque, bar, reception, airplane_cabin, ballroom"
1259,30216,indoor,"discotheque, bar, basement, art_gallery, ballroom"
1260,30240,indoor,"clean_room, dressing_room, hospital_room, library/indoor, dining_room"
1261,30264,indoor,"clean_room, dressing_room, archive, library/indoor, office_cubicles"
1262,30288,indoor,"corridor, entrance_hall, dressing_room, locker_room, clean_room"
1263,30312,indoor,"airport_terminal, lobby, crosswalk, parking_garage/indoor, reception"
1264,30336,indoor,"crosswalk, airport_terminal, parking_garage/indoor, street, bowling_alley"
1265,30360,indoor,"crosswalk, airport_terminal, swimming_pool/indoor, bowling_alley, bar"
1266,30384,indoor,"parking_garage/indoor, auto_factory, parking_lot, entrance_hall, hangar/indoor"
1267,30408,indoor,"parking_garage/indoor, auto_factory, auto_showroom, entrance_hall, parking_lot"
1268,30432,indoor,"auto_factory, parking_garage/indoor, entrance_hall, garage/indoor, auto_showroom"
1269,30456,indoor,"airport_terminal, lobby, hospital_room, library/indoor, swimming_pool/indoor"
1270,30480,indoor,"airport_terminal, clean_room, archive, locker_room, lobby"
1271,30504,indoor,"parking_garage/indoor, airport_terminal, office_cubicles, lobby, reception"
1272,30528,outdoor,"parking_garage/indoor, airport_terminal, pond, fishpond, lake/natural"
1273,30552,outdoor,"desert/sand, sky, beach, marsh, lake/natural"
1274,30576,outdoor,"desert/sand, sky, beach, lake/natural, marsh"
1275,30600,indoor,"crevasse, glacier, shower, elevator/door, elevator_shaft"
1276,30624,indoor,"pharmacy, drugstore, hospital, booth/indoor, hospital_room"
1277,30648,indoor,"drugstore, pharmacy, hospital, clean_room, ice_shelf"
1278,30672,indoor,"pharmacy, hospital, drugstore, cemetery, clean_room"
1279,30696,indoor,"booth/indoor, hospital, pharmacy, archive, drugstore"
1280,30720,indoor,"booth/indoor, archive, hospital, drugstore, pharmacy"
1281,30744,indoor,"booth/indoor, archive, hospital, drugstore, pharmacy"
1282,30768,indoor,"booth/indoor, archive, drugstore, pharmacy, bookstore"
1283,30792,indoor,"booth/indoor, archive, pharmacy, bookstore, drugstore"
1284,30816,indoor,"booth/indoor, pharmacy, drugstore, archive, hospital"
1285,30840,indoor,"archive, drugstore, nursery, pharmacy, bookstore"
1286,30864,outdoor,"ice_floe, ice_shelf, lake/natural, ski_slope, ice_skating_rink/outdoor"
1287,30888,outdoor,"ice_floe, driveway, bow_window/indoor, ice_shelf, barndoor"
1288,30912,indoor,"shower, bedroom, ice_floe, bow_window/indoor, museum/indoor"
1289,30936,outdoor,"doorway/outdoor, barndoor, alcove, shed, garage/outdoor"
1290,30960,indoor,"boxing_ring, shower, martial_arts_gym, volleyball_court/outdoor, bathroom"
1291,30984,indoor,"discotheque, stage/indoor, tower, skyscraper, music_studio"
1292,31008,indoor,"airplane_cabin, clean_room, living_room, discotheque, dressing_room"
1293,31032,indoor,"airplane_cabin, living_room, clean_room, bus_interior, discotheque"
1294,31056,indoor,"airplane_cabin, clean_room, living_room, discotheque, bus_interior"
1295,31080,indoor,"airplane_cabin, living_room, clean_room, discotheque, bus_interior"
1296,31104,indoor,"discotheque, airplane_cabin, dressing_room, clean_room, stage/indoor"
1297,31128,indoor,"airplane_cabin, discotheque, dressing_room, clean_room, stage/indoor"
1298,31152,indoor,"clean_room, dressing_room, chemistry_lab, beauty_salon, biology_laboratory"
1299,31176,indoor,"clean_room, chemistry_lab, biology_laboratory, beauty_salon, bathroom"
1300,31200,indoor,"clean_room, chemistry_lab, shower, bathroom, biology_laboratory"
1301,31224,indoor,"clean_room, bathroom, dressing_room, shower, airplane_cabin"
1302,31248,indoor,"clean_room, shower, bathroom, shoe_shop, childs_room"
1303,31272,indoor,"shower, clean_room, bathroom, utility_room, laundromat"
1304,31296,indoor,"clean_room, shower, bathroom, chemistry_lab, kitchen"
1305,31320,indoor,"clean_room, utility_room, bathroom, shower, laundromat"
1306,31344,indoor,"utility_room, laundromat, shower, bathroom, clean_room"
1307,31368,indoor,"utility_room, laundromat, kitchen, shower, bathroom"
1308,31392,indoor,"clean_room, laundromat, waiting_room, artists_loft, dining_room"
1309,31416,indoor,"dressing_room, clean_room, bowling_alley, classroom, chemistry_lab"
1310,31440,indoor,"dressing_room, runway, discotheque, airplane_cabin, airport_terminal"
1311,31464,indoor,"clean_room, biology_laboratory, chemistry_lab, dressing_room, archive"
1312,31488,indoor,"clean_room, chemistry_lab, biology_laboratory, dressing_room, hospital_room"
1313,31512,indoor,"chemistry_lab, clean_room, biology_laboratory, shower, bathroom"
1314,31536,indoor,"chemistry_lab, clean_room, biology_laboratory, shower, ball_pit"
1315,31560,indoor,"clean_room, chemistry_lab, nursery, childs_room, ball_pit"
1316,31584,indoor,"clean_room, chemistry_lab, playroom, nursery, childs_room"
1317,31608,indoor,"dressing_room, discotheque, nursing_home, clean_room, archive"
1318,31632,indoor,"clean_room, banquet_hall, archive, nursing_home, dressing_room"
1319,31656,indoor,"clean_room, operating_room, banquet_hall, chemistry_lab, hospital_room"
1320,31680,indoor,"clean_room, chemistry_lab, archive, operating_room, biology_laboratory"
1321,31704,indoor,"clean_room, chemistry_lab, dressing_room, archive, biology_laboratory"
1322,31728,indoor,"clean_room, chemistry_lab, dressing_room, archive, biology_laboratory"
1323,31752,indoor,"clean_room, nursing_home, archive, dressing_room, chemistry_lab"
1324,31776,indoor,"clean_room, archive, nursing_home, chemistry_lab, biology_laboratory"
1325,31800,indoor,"iceberg, martial_arts_gym, museum/indoor, ice_floe, clean_room"
1326,31824,indoor,"iceberg, martial_arts_gym, museum/indoor, clean_room, dressing_room"
1327,31848,indoor,"martial_arts_gym, iceberg, museum/indoor, dressing_room, clean_room"
1328,31872,indoor,"museum/indoor, clean_room, iceberg, dressing_room, clothing_store"
1329,31896,indoor,"museum/indoor, dressing_room, martial_arts_gym, iceberg, clean_room"
1330,31920,indoor,"museum/indoor, dressing_room, iceberg, clean_room, operating_room"
1331,31944,indoor,"museum/indoor, dressing_room, beauty_salon, iceberg, clean_room"
1332,31968,indoor,"computer_room, classroom, office, office_cubicles, hospital_room"
1333,31992,indoor,"clean_room, banquet_hall, archive, martial_arts_gym, chemistry_lab"
1334,32016,indoor,"clean_room, archive, chemistry_lab, biology_laboratory, operating_room"
1335,32040,indoor,"clean_room, archive, chemistry_lab, biology_laboratory, pharmacy"
1336,32064,indoor,"clean_room, chemistry_lab, biology_laboratory, banquet_hall, archive"
1337,32088,indoor,"clean_room, banquet_hall, chemistry_lab, archive, office"
1338,32112,indoor,"classroom, computer_room, hospital_room, office, lecture_room"
1339,32136,indoor,"computer_room, office, classroom, airplane_cabin, office_cubicles"
1340,32160,indoor,"computer_room, office, home_office, classroom, office_cubicles"
1341,32184,indoor,"computer_room, classroom, office, hospital_room, home_office"
1342,32208,indoor,"clean_room, hospital_room, computer_room, classroom, office"
1343,32232,indoor,"classroom, hospital_room, computer_room, office, clean_room"
1344,32256,indoor,"computer_room, hospital_room, classroom, office, archive"
1345,32280,indoor,"hospital_room, computer_room, classroom, office, airplane_cabin"
1346,32304,indoor,"bathroom, clean_room, laundromat, shower, utility_room"
1347,32328,indoor,"clean_room, bathroom, museum/indoor, shower, laundromat"
1348,32352,indoor,"shower, bathroom, jacuzzi/indoor, kitchen, swimming_pool/indoor"
1349,32376,indoor,"clean_room, shower, museum/indoor, childs_room, ice_cream_parlor"
1350,32400,indoor,"clean_room, shower, museum/indoor, jacuzzi/indoor, bathroom"
1351,32424,indoor,"clean_room, shower, museum/indoor, childs_room, jacuzzi/indoor"
1352,32448,indoor,"clean_room, shower, jacuzzi/indoor, gymnasium/indoor, childs_room"
1353,32472,indoor,"clean_room, chemistry_lab, physics_laboratory, shower, childs_room"
1354,32496,indoor,"clean_room, shower, chemistry_lab, childs_room, jacuzzi/indoor"
1355,32520,indoor,"shower, clean_room, bathroom, chemistry_lab, biology_laboratory"
1356,32544,indoor,"clean_room, dressing_room, music_studio, hospital_room, operating_room"
1357,32568,indoor,"clean_room, dressing_room, hospital_room, hotel_room, operating_room"
1358,32592,indoor,"clean_room, dressing_room, hospital_room, hotel_room, locker_room"
1359,32616,indoor,"boxing_ring, stage/indoor, dressing_room, martial_arts_gym, volleyball_court/outdoor"
1360,32640,indoor,"boxing_ring, dressing_room, stage/indoor, volleyball_court/outdoor, martial_arts_gym"
1361,32664,indoor,"boxing_ring, stage/indoor, dressing_room, martial_arts_gym, volleyball_court/outdoor"
1362,32688,indoor,"clean_room, dressing_room, music_studio, hospital_room, operating_room"
1363,32712,indoor,"boxing_ring, dressing_room, stage/indoor, martial_arts_gym, gymnasium/indoor"
1364,32736,indoor,"boxing_ring, martial_arts_gym, stage/indoor, volleyball_court/outdoor, dressing_room"
1365,32760,indoor,"boxing_ring, stage/indoor, dressing_room, martial_arts_gym, music_studio"
1366,32784,indoor,"dressing_room, boxing_ring, stage/indoor, music_studio, clothing_store"
1367,32808,indoor,"clean_room, operating_room, laundromat, chemistry_lab, archive"
1368,32832,indoor,"clean_room, operating_room, laundromat, chemistry_lab, dressing_room"
1369,32856,indoor,"clean_room, museum/indoor, locker_room, dressing_room, science_museum"
1370,32880,indoor,"clean_room, museum/indoor, archive, operating_room, ballroom"
1371,32904,indoor,"clean_room, museum/indoor, archive, operating_room, physics_laboratory"
1372,32928,indoor,"clean_room, museum/indoor, archive, operating_room, science_museum"
1373,32952,indoor,"museum/indoor, clean_room, archive, operating_room, physics_laboratory"
1374,32976,indoor,"museum/indoor, clean_room, science_museum, archive, operating_room"
1375,33000,indoor,"clean_room, science_museum, archive, museum/indoor, physics_laboratory"
1376,33024,indoor,"clean_room, operating_room, archive, science_museum, physics_laboratory"
1377,33048,indoor,"clean_room, museum/indoor, operating_room, archive, science_museum"
1378,33072,indoor,"clean_room, operating_room, museum/indoor, archive, science_museum"
1379,33096,indoor,"clean_room, museum/indoor, archive, operating_room, science_museum"
1380,33120,indoor,"clean_room, operating_room, dressing_room, chemistry_lab, science_museum"
1381,33144,indoor,"dressing_room, clothing_store, clean_room, museum/indoor, discotheque"
1382,33168,indoor,"dressing_room, clean_room, museum/indoor, clothing_store, chemistry_lab"
1383,33192,indoor,"dressing_room, museum/indoor, discotheque, clean_room, bowling_alley"
1384,33216,indoor,"dressing_room, clean_room, museum/indoor, archive, clothing_store"
1385,33240,indoor,"dressing_room, clean_room, museum/indoor, archive, shower"
1386,33264,indoor,"clean_room, dressing_room, museum/indoor, clothing_store, chemistry_lab"
1387,33288,indoor,"clean_room, dressing_room, museum/indoor, chemistry_lab, biology_laboratory"
1388,33312,indoor,"clean_room, dressing_room, museum/indoor, operating_room, clothing_store"
1389,33336,indoor,"clean_room, dressing_room, museum/indoor, clothing_store, chemistry_lab"
1390,33360,indoor,"clean_room, dressing_room, clothing_store, museum/indoor, operating_room"
1391,33384,indoor,"clean_room, dressing_room, chemistry_lab, operating_room, biology_laboratory"
1392,33408,indoor,"dressing_room, clean_room, beauty_salon, chemistry_lab, archive"
1393,33432,indoor,"airplane_cabin, dressing_room, discotheque, beauty_salon, clothing_store"
1394,33456,indoor,"discotheque, dressing_room, airplane_cabin, locker_room, bowling_alley"
1395,33480,indoor,"dressing_room, discotheque, beauty_salon, locker_room, clothing_store"
1396,33504,indoor,"discotheque, dressing_room, locker_room, airplane_cabin, pub/indoor"
1397,33528,indoor,"airplane_cabin, dressing_room, discotheque, clothing_store, locker_room"
1398,33552,indoor,"discotheque, airplane_cabin, dressing_room, airport_terminal, lobby"
1399,33576,indoor,"clean_room, dressing_room, museum/indoor, archive, chemistry_lab"
1400,33600,indoor,"dressing_room, clean_room, museum/indoor, office, archive"
1401,33624,indoor,"dressing_room, clean_room, archive, museum/indoor, clothing_store"
1402,33648,indoor,"archive, dressing_room, clean_room, office, music_studio"
1403,33672,indoor,"dressing_room, clean_room, archive, museum/indoor, sauna"
1404,33696,indoor,"dressing_room, clean_room, archive, museum/indoor, music_studio"
1405,33720,indoor,"dressing_room, clean_room, archive, museum/indoor, beauty_salon"
1406,33744,indoor,"dressing_room, clean_room, museum/indoor, archive, art_gallery"
1407,33768,indoor,"clean_room, dressing_room, museum/indoor, clothing_store, archive"
1408,33792,indoor,"clean_room, dressing_room, museum/indoor, archive, clothing_store"
1409,33816,indoor,"dressing_room, clean_room, museum/indoor, archive, locker_room"
1410,33840,indoor,"dressing_room, airplane_cabin, coffee_shop, office, beauty_salon"
1411,33864,indoor,"dressing_room, clean_room, airplane_cabin, office, beauty_salon"
1412,33888,indoor,"dressing_room, office, beauty_salon, clean_room, coffee_shop"
1413,33912,indoor,"airplane_cabin, discotheque, dressing_room, beauty_salon, bar"
1414,33936,indoor,"airplane_cabin, discotheque, dressing_room, bowling_alley, locker_room"
1415,33960,indoor,"dressing_room, discotheque, locker_room, airplane_cabin, beauty_salon"
1416,33984,indoor,"dressing_room, discotheque, airplane_cabin, beauty_salon, clothing_store"
1417,34008,indoor,"discotheque, dressing_room, ballroom, boxing_ring, clothing_store"
1418,34032,indoor,"dressing_room, airplane_cabin, discotheque, lobby, beauty_salon"
1419,34056,indoor,"discotheque, airplane_cabin, dressing_room, beauty_salon, locker_room"
1420,34080,indoor,"discotheque, dressing_room, airplane_cabin, pub/indoor, ballroom"
1421,34104,indoor,"clean_room, dressing_room, museum/indoor, archive, clothing_store"
1422,34128,indoor,"dressing_room, clean_room, museum/indoor, archive, clothing_store"
1423,34152,indoor,"dressing_room, discotheque, locker_room, clean_room, archive"
1424,34176,indoor,"clean_room, dressing_room, museum/indoor, archive, clothing_store"
1425,34200,indoor,"clean_room, museum/indoor, dressing_room, archive, office"
1426,34224,indoor,"dressing_room, clean_room, clothing_store, museum/indoor, chemistry_lab"
1427,34248,indoor,"museum/indoor, clean_room, dressing_room, shower, stage/indoor"
1428,34272,indoor,"dressing_room, clean_room, museum/indoor, discotheque, shower"
1429,34296,indoor,"dressing_room, airplane_cabin, office, computer_room, office_cubicles"
1430,34320,indoor,"clean_room, hospital_room, shower, chemistry_lab, locker_room"
1431,34344,indoor,"clean_room, shower, bathroom, jewelry_shop, biology_laboratory"
1432,34368,indoor,"clean_room, physics_laboratory, operating_room, biology_laboratory, chemistry_lab"
1433,34392,indoor,"clean_room, physics_laboratory, locker_room, shower, biology_laboratory"
1434,34416,indoor,"clean_room, shower, physics_laboratory, locker_room, jewelry_shop"
1435,34440,indoor,"clean_room, physics_laboratory, locker_room, museum/indoor, biology_laboratory"
1436,34464,indoor,"clean_room, archive, server_room, clothing_store, jewelry_shop"
1437,34488,indoor,"clean_room, locker_room, archive, dressing_room, shower"
1438,34512,indoor,"clean_room, jewelry_shop, beauty_salon, biology_laboratory, physics_laboratory"
1439,34536,indoor,"clean_room, jewelry_shop, server_room, elevator/door, shoe_shop"
1440,34560,indoor,"office, reception, chemistry_lab, biology_laboratory, physics_laboratory"
1441,34584,indoor,"office, chemistry_lab, physics_laboratory, biology_laboratory, reception"
1442,34608,indoor,"office, biology_laboratory, physics_laboratory, chemistry_lab, classroom"
1443,34632,indoor,"elevator/door, elevator_lobby, airport_terminal, clean_room, lobby"
1444,34656,indoor,"clean_room, locker_room, shower, beauty_salon, waiting_room"
1445,34680,indoor,"locker_room, clean_room, archive, laundromat, utility_room"
1446,34704,indoor,"clean_room, elevator/door, locker_room, archive, server_room"
1447,34728,indoor,"shower, bank_vault, beauty_salon, bathroom, jewelry_shop"
1448,34752,indoor,"beauty_salon, shower, bathroom, bank_vault, coffee_shop"
1449,34776,indoor,"clean_room, elevator/door, server_room, archive, locker_room"
1450,34800,indoor,"clean_room, server_room, archive, elevator/door, locker_room"
1451,34824,indoor,"clean_room, archive, elevator/door, locker_room, pharmacy"
1452,34848,indoor,"clean_room, chemistry_lab, hospital_room, martial_arts_gym, nursing_home"
1453,34872,indoor,"discotheque, martial_arts_gym, chemistry_lab, hospital_room, ballroom"
1454,34896,indoor,"discotheque, clean_room, ballroom, hospital_room, chemistry_lab"
1455,34920,indoor,"clean_room, chemistry_lab, hospital_room, discotheque, beauty_salon"
1456,34944,indoor,"clean_room, archive, elevator/door, locker_room, museum/indoor"
1457,34968,indoor,"clean_room, elevator/door, shower, archive, locker_room"
1458,34992,indoor,"clean_room, elevator/door, shower, elevator_lobby, locker_room"
1459,35016,indoor,"clean_room, elevator/door, server_room, locker_room, elevator_lobby"
1460,35040,indoor,"martial_arts_gym, discotheque, boxing_ring, hospital_room, chemistry_lab"
1461,35064,indoor,"martial_arts_gym, clean_room, chemistry_lab, locker_room, biology_laboratory"
1462,35088,indoor,"clean_room, chemistry_lab, physics_laboratory, biology_laboratory, science_museum"
1463,35112,indoor,"clean_room, museum/indoor, chemistry_lab, physics_laboratory, science_museum"
1464,35136,indoor,"clean_room, archive, museum/indoor, locker_room, art_gallery"
1465,35160,indoor,"clean_room, shower, museum/indoor, phone_booth, elevator/door"
1466,35184,indoor,"clean_room, chemistry_lab, biology_laboratory, beauty_salon, operating_room"
1467,35208,indoor,"chemistry_lab, beauty_salon, coffee_shop, clean_room, biology_laboratory"
1468,35232,indoor,"clean_room, archive, office, physics_laboratory, home_office"
1469,35256,indoor,"banquet_hall, restaurant, chemistry_lab, cafeteria, dining_hall"
1470,35280,indoor,"banquet_hall, museum/indoor, jewelry_shop, dining_hall, nursery"
1471,35304,indoor,"banquet_hall, operating_room, restaurant, dining_hall, clean_room"
1472,35328,indoor,"banquet_hall, restaurant, dining_hall, dining_room, chemistry_lab"
1473,35352,indoor,"banquet_hall, restaurant, dining_hall, dining_room, bathroom"
1474,35376,indoor,"banquet_hall, dining_hall, restaurant, dining_room, cafeteria"
1475,35400,indoor,"banquet_hall, restaurant, dining_hall, dining_room, conference_room"
1476,35424,indoor,"banquet_hall, restaurant, dining_hall, dining_room, cafeteria"
1477,35448,indoor,"banquet_hall, dining_hall, restaurant, dining_room, cafeteria"
1478,35472,indoor,"chemistry_lab, biology_laboratory, banquet_hall, dining_hall, restaurant"
1479,35496,indoor,"chemistry_lab, biology_laboratory, physics_laboratory, jewelry_shop, clean_room"
1480,35520,indoor,"chemistry_lab, biology_laboratory, physics_laboratory, clean_room, classroom"
1481,35544,indoor,"banquet_hall, dining_hall, chemistry_lab, restaurant, cafeteria"
1482,35568,indoor,"chemistry_lab, clean_room, biology_laboratory, conference_center, physics_laboratory"
1483,35592,indoor,"banquet_hall, chemistry_lab, restaurant, dining_hall, cafeteria"
1484,35616,indoor,"clean_room, chemistry_lab, biology_laboratory, physics_laboratory, dressing_room"
1485,35640,indoor,"clean_room, archive, chemistry_lab, physics_laboratory, operating_room"
1486,35664,indoor,"clean_room, museum/indoor, office, physics_laboratory, archive"
1487,35688,indoor,"clean_room, museum/indoor, archive, art_gallery, dressing_room"
1488,35712,indoor,"clean_room, museum/indoor, archive, art_gallery, science_museum"
1489,35736,indoor,"archive, museum/indoor, kindergarden_classroom, clean_room, nursery"
1490,35760,indoor,"archive, clean_room, kindergarden_classroom, classroom, library/indoor"
1491,35784,indoor,"clean_room, museum/indoor, shower, bow_window/indoor, artists_loft"
1492,35808,indoor,"clean_room, shower, archive, bathroom, dressing_room"
1493,35832,indoor,"auto_factory, archive, library/indoor, assembly_line, repair_shop"
1494,35856,indoor,"auto_factory, assembly_line, auto_showroom, beauty_salon, coffee_shop"
1495,35880,indoor,"auto_factory, assembly_line, raceway, auto_showroom, engine_room"
1496,35904,indoor,"auto_factory, assembly_line, raceway, archive, hangar/indoor"
1497,35928,indoor,"auto_factory, assembly_line, raceway, auto_showroom, coffee_shop"
1498,35952,indoor,"auto_factory, assembly_line, archive, clean_room, science_museum"
1499,35976,indoor,"auto_factory, assembly_line, raceway, coffee_shop, archive"
1500,36000,indoor,"coffee_shop, laundromat, auto_factory, beauty_salon, assembly_line"
1501,36024,indoor,"auto_factory, assembly_line, coffee_shop, laundromat, airport_terminal"
1502,36048,indoor,"clean_room, ice_cream_parlor, bow_window/indoor, hospital_room, coffee_shop"
1503,36072,indoor,"clean_room, hospital_room, archive, ice_cream_parlor, coffee_shop"
1504,36096,indoor,"clean_room, ice_cream_parlor, nursery, coffee_shop, archive"
1505,36120,indoor,"clean_room, chemistry_lab, hospital_room, archive, ice_cream_parlor"
1506,36144,indoor,"clean_room, assembly_line, ice_cream_parlor, biology_laboratory, hospital_room"
1507,36168,indoor,"clean_room, archive, physics_laboratory, hospital_room, music_studio"
1508,36192,indoor,"clean_room, hospital_room, ice_cream_parlor, operating_room, chemistry_lab"
1509,36216,indoor,"clean_room, archive, library/indoor, bow_window/indoor, hospital_room"
1510,36240,indoor,"clean_room, chemistry_lab, archive, biology_laboratory, pharmacy"
1511,36264,indoor,"shower, bathroom, clean_room, dressing_room, sauna"
1512,36288,indoor,"clean_room, dressing_room, archive, shower, bathroom"
1513,36312,indoor,"clean_room, dressing_room, archive, jewelry_shop, art_gallery"
1514,36336,indoor,"clean_room, dressing_room, shower, jewelry_shop, bathroom"
1515,36360,indoor,"clean_room, shower, bathroom, sauna, server_room"
1516,36384,indoor,"dressing_room, archive, clean_room, nursing_home, office"
1517,36408,indoor,"dressing_room, clean_room, archive, beauty_salon, locker_room"
1518,36432,indoor,"dressing_room, archive, clean_room, beauty_salon, office"
1519,36456,indoor,"chemistry_lab, clean_room, biology_laboratory, dressing_room, bar"
1520,36480,indoor,"chemistry_lab, clean_room, biology_laboratory, martial_arts_gym, dressing_room"
1521,36504,indoor,"archive, museum/indoor, clean_room, art_gallery, classroom"
1522,36528,indoor,"dressing_room, clean_room, museum/indoor, archive, art_gallery"
1523,36552,indoor,"dressing_room, clean_room, archive, chemistry_lab, museum/indoor"
1524,36576,indoor,"clean_room, chemistry_lab, hospital_room, lecture_room, dressing_room"
1525,36600,indoor,"clean_room, hospital_room, dressing_room, nursery, operating_room"
1526,36624,indoor,"clean_room, dressing_room, hospital_room, chemistry_lab, beauty_salon"
1527,36648,indoor,"clean_room, hospital_room, operating_room, chemistry_lab, dressing_room"
1528,36672,indoor,"clean_room, dressing_room, chemistry_lab, music_studio, hospital_room"
1529,36696,indoor,"clean_room, hospital_room, chemistry_lab, dressing_room, boxing_ring"
1530,36720,indoor,"clean_room, hospital_room, dressing_room, chemistry_lab, operating_room"
1531,36744,indoor,"clean_room, chemistry_lab, hospital_room, music_studio, office"
1532,36768,indoor,"clean_room, music_studio, locker_room, museum/indoor, ballroom"
1533,36792,indoor,"clean_room, museum/indoor, music_studio, ballroom, martial_arts_gym"
1534,36816,indoor,"clean_room, ballroom, music_studio, museum/indoor, locker_room"
1535,36840,indoor,"chemistry_lab, biology_laboratory, cafeteria, clean_room, food_court"
1536,36864,indoor,"clean_room, operating_room, chemistry_lab, biology_laboratory, hospital_room"
1537,36888,indoor,"clean_room, biology_laboratory, restaurant, chemistry_lab, cafeteria"
1538,36912,indoor,"biology_laboratory, chemistry_lab, classroom, office, archive"
