,frame_num,environment,places
1230,29520,outdoor,"tower, skyscraper, construction_site, downtown, office_building"
1231,29544,outdoor,"oilrig, tower, construction_site, skyscraper, amusement_park"
1232,29568,outdoor,"construction_site, tower, skyscraper, oilrig, bow_window/indoor"
1233,29592,outdoor,"bow_window/indoor, skyscraper, tower, shower, sky"
1234,29616,outdoor,"skyscraper, tower, downtown, office_building, sky"
1235,29640,outdoor,"tower, skyscraper, downtown, office_building, construction_site"
1236,29664,outdoor,"skyscraper, tower, office_building, downtown, construction_site"
1237,29688,outdoor,"tower, skyscraper, oilrig, sky, office_building"
1238,29712,outdoor,"oilrig, tower, skyscraper, construction_site, industrial_area"
1239,29736,outdoor,"skyscraper, tower, oilrig, jail_cell, construction_site"
1240,29760,outdoor,"tower, skyscraper, oilrig, industrial_area, construction_site"
1241,29784,indoor,"bow_window/indoor, chemistry_lab, clean_room, stage/indoor, science_museum"
1242,29808,outdoor,"oilrig, tower, skyscraper, construction_site, museum/indoor"
1243,29832,outdoor,"skyscraper, tower, sky, shower, office_building"
1244,29856,outdoor,"bow_window/indoor, ice_shelf, ice_floe, skyscraper, iceberg"
1245,29880,outdoor,"underwater/ocean_deep, ice_shelf, sky, iceberg, aquarium"
1246,29904,outdoor,"iceberg, underwater/ocean_deep, sky, aquarium, ice_shelf"
1247,29928,outdoor,"sky, volcano, wind_farm, runway, ice_shelf"
1248,29952,outdoor,"sky, volcano, hot_spring, oilrig, runway"
1249,29976,outdoor,"sky, wind_farm, tower, windmill, skyscraper"
1250,30000,indoor,"nursery, clean_room, shower, sky, discotheque"
1251,30024,indoor,"shower, discotheque, locker_room, bathroom, bow_window/indoor"
1252,30048,indoor,"clean_room, chemistry_lab, biology_laboratory, physics_laboratory, discotheque"
1253,30072,indoor,"clean_room, chemistry_lab, science_museum, shower, art_gallery"
1254,30096,indoor,"clean_room, discotheque, locker_room, music_studio, server_room"
1255,30120,indoor,"clean_room, discotheque, chemistry_lab, music_studio, stage/indoor"
1256,30144,indoor,"clean_room, discotheque, music_studio, stage/indoor, server_room"
1257,30168,indoor,"clean_room, music_studio, discotheque, server_room, chemistry_lab"
1258,30192,indoor,"shower, clean_room, bathroom, discotheque, locker_room"
1259,30216,indoor,"discotheque, clean_room, chemistry_lab, stage/indoor, skyscraper"
1260,30240,indoor,"clean_room, discotheque, chemistry_lab, stage/indoor, music_studio"
1261,30264,indoor,"discotheque, shower, stage/indoor, clean_room, chemistry_lab"
1262,30288,indoor,"discotheque, shower, clean_room, chemistry_lab, dressing_room"
1263,30312,indoor,"clean_room, discotheque, shower, stage/indoor, arena/performance"
1264,30336,indoor,"clean_room, discotheque, shower, arena/performance, science_museum"
1265,30360,indoor,"clean_room, discotheque, arena/performance, science_museum, stage/indoor"
1266,30384,indoor,"clean_room, chemistry_lab, discotheque, biology_laboratory, shower"
1267,30408,indoor,"clean_room, arena/performance, discotheque, television_studio, stage/indoor"
1268,30432,indoor,"clean_room, chemistry_lab, television_studio, discotheque, biology_laboratory"
1269,30456,indoor,"clean_room, chemistry_lab, shower, biology_laboratory, discotheque"
1270,30480,indoor,"clean_room, discotheque, chemistry_lab, science_museum, biology_laboratory"
1271,30504,indoor,"clean_room, discotheque, stage/indoor, arena/performance, science_museum"
1272,30528,indoor,"clean_room, chemistry_lab, discotheque, biology_laboratory, office"
1273,30552,indoor,"clean_room, shower, server_room, chemistry_lab, hospital_room"
1274,30576,indoor,"shower, clean_room, bathroom, dressing_room, hospital_room"
1275,30600,indoor,"clean_room, server_room, chemistry_lab, office, art_gallery"
1276,30624,indoor,"clean_room, television_studio, stage/indoor, conference_center, arena/performance"
1277,30648,indoor,"clean_room, server_room, television_studio, conference_center, arena/performance"
1278,30672,indoor,"clean_room, television_studio, arena/performance, server_room, stage/indoor"
1279,30696,indoor,"clean_room, television_studio, stage/indoor, arena/performance, chemistry_lab"
1280,30720,indoor,"clean_room, arena/performance, stage/indoor, television_studio, chemistry_lab"
1281,30744,indoor,"clean_room, stage/indoor, discotheque, arena/performance, television_studio"
1282,30768,indoor,"stage/indoor, discotheque, arena/performance, television_studio, music_studio"
1283,30792,indoor,"clean_room, discotheque, chemistry_lab, stage/indoor, biology_laboratory"
1284,30816,indoor,"clean_room, arena/performance, discotheque, stage/indoor, television_studio"
1285,30840,indoor,"clean_room, stage/indoor, discotheque, science_museum, arena/performance"
1286,30864,indoor,"clean_room, arena/performance, stage/indoor, television_studio, discotheque"
1287,30888,indoor,"clean_room, stage/indoor, arena/performance, television_studio, discotheque"
1288,30912,indoor,"clean_room, arena/performance, stage/indoor, television_studio, discotheque"
1289,30936,indoor,"clean_room, chemistry_lab, biology_laboratory, physics_laboratory, discotheque"
1290,30960,indoor,"clean_room, chemistry_lab, biology_laboratory, discotheque, physics_laboratory"
1291,30984,indoor,"clean_room, chemistry_lab, biology_laboratory, physics_laboratory, art_studio"
1292,31008,indoor,"clean_room, chemistry_lab, biology_laboratory, physics_laboratory, television_studio"
1293,31032,indoor,"clean_room, chemistry_lab, biology_laboratory, physics_laboratory, office"
1294,31056,indoor,"clean_room, chemistry_lab, biology_laboratory, physics_laboratory, office"
1295,31080,indoor,"clean_room, chemistry_lab, biology_laboratory, physics_laboratory, television_studio"
1296,31104,indoor,"clean_room, chemistry_lab, biology_laboratory, art_studio, physics_laboratory"
1297,31128,indoor,"clean_room, chemistry_lab, biology_laboratory, physics_laboratory, jewelry_shop"
1298,31152,indoor,"clean_room, chemistry_lab, office, biology_laboratory, physics_laboratory"
1299,31176,indoor,"clean_room, chemistry_lab, biology_laboratory, physics_laboratory, jewelry_shop"
1300,31200,indoor,"clean_room, office, office_cubicles, conference_center, art_gallery"
1301,31224,indoor,"clean_room, office, conference_center, discotheque, stage/indoor"
1302,31248,indoor,"clean_room, chemistry_lab, biology_laboratory, office, art_studio"
1303,31272,indoor,"clean_room, chemistry_lab, biology_laboratory, physics_laboratory, jewelry_shop"
1304,31296,indoor,"clean_room, chemistry_lab, biology_laboratory, physics_laboratory, jewelry_shop"
1305,31320,indoor,"clean_room, chemistry_lab, biology_laboratory, stage/indoor, conference_center"
1306,31344,indoor,"clean_room, stage/indoor, chemistry_lab, conference_center, arena/performance"
1307,31368,indoor,"clean_room, conference_center, chemistry_lab, television_studio, biology_laboratory"
1308,31392,indoor,"clean_room, chemistry_lab, biology_laboratory, stage/indoor, arena/performance"
1309,31416,indoor,"clean_room, chemistry_lab, stage/indoor, television_studio, biology_laboratory"
1310,31440,indoor,"clean_room, chemistry_lab, biology_laboratory, physics_laboratory, stage/indoor"
1311,31464,indoor,"clean_room, chemistry_lab, biology_laboratory, physics_laboratory, stage/indoor"
1312,31488,indoor,"clean_room, chemistry_lab, biology_laboratory, physics_laboratory, conference_center"
1313,31512,indoor,"clean_room, chemistry_lab, biology_laboratory, conference_center, office"
1314,31536,indoor,"clean_room, chemistry_lab, office, biology_laboratory, conference_center"
1315,31560,indoor,"clean_room, office, chemistry_lab, art_gallery, jewelry_shop"
1316,31584,indoor,"clean_room, conference_center, chemistry_lab, television_studio, biology_laboratory"
1317,31608,indoor,"clean_room, chemistry_lab, biology_laboratory, physics_laboratory, television_studio"
1318,31632,indoor,"clean_room, conference_center, television_studio, server_room, office"
1319,31656,indoor,"clean_room, chemistry_lab, biology_laboratory, shower, server_room"
1320,31680,indoor,"clean_room, stage/indoor, discotheque, television_studio, arena/performance"
1321,31704,indoor,"clean_room, conference_center, television_studio, stage/indoor, office"
1322,31728,indoor,"discotheque, stage/indoor, music_studio, clean_room, chemistry_lab"
1323,31752,indoor,"clean_room, shower, chemistry_lab, bathroom, discotheque"
1324,31776,indoor,"clean_room, discotheque, shower, stage/indoor, dressing_room"
1325,31800,indoor,"clean_room, elevator/door, server_room, corridor, art_gallery"
1326,31824,indoor,"clean_room, dressing_room, shower, bathroom, jewelry_shop"
1327,31848,indoor,"clean_room, elevator/door, shower, jewelry_shop, bathroom"
1328,31872,indoor,"clean_room, dressing_room, shower, locker_room, beauty_salon"
1329,31896,indoor,"clean_room, conference_center, office, conference_room, television_studio"
1330,31920,indoor,"conference_center, biology_laboratory, clean_room, chemistry_lab, office"
1331,31944,indoor,"conference_center, clean_room, office, conference_room, legislative_chamber"
1332,31968,indoor,"conference_center, conference_room, television_studio, office, clean_room"
1333,31992,indoor,"clean_room, television_studio, conference_center, office, conference_room"
1334,32016,indoor,"clean_room, jewelry_shop, office, museum/indoor, conference_center"
1335,32040,indoor,"clean_room, jewelry_shop, television_studio, museum/indoor, conference_center"
1336,32064,indoor,"clean_room, television_studio, jewelry_shop, conference_center, office"
1337,32088,indoor,"clean_room, television_studio, conference_center, jewelry_shop, office"
1338,32112,indoor,"clean_room, television_studio, conference_center, music_studio, office"
1339,32136,indoor,"clean_room, television_studio, conference_center, biology_laboratory, office"
1340,32160,indoor,"clean_room, television_studio, beauty_salon, jewelry_shop, dressing_room"
1341,32184,indoor,"clean_room, television_studio, biology_laboratory, chemistry_lab, beauty_salon"
1342,32208,indoor,"clean_room, television_studio, beauty_salon, biology_laboratory, dressing_room"
1343,32232,indoor,"clean_room, television_studio, jewelry_shop, biology_laboratory, office"
1344,32256,indoor,"clean_room, conference_center, office, television_studio, conference_room"
1345,32280,indoor,"dressing_room, clean_room, jewelry_shop, museum/indoor, television_studio"
1346,32304,indoor,"clean_room, office, dressing_room, locker_room, server_room"
1347,32328,indoor,"clean_room, locker_room, dressing_room, biology_laboratory, server_room"
1348,32352,indoor,"clean_room, office, dressing_room, beauty_salon, server_room"
1349,32376,indoor,"clean_room, server_room, office, elevator/door, dressing_room"
1350,32400,indoor,"clean_room, dressing_room, elevator/door, closet, bow_window/indoor"
1351,32424,indoor,"clean_room, shower, locker_room, dressing_room, server_room"
1352,32448,indoor,"clean_room, chemistry_lab, server_room, biology_laboratory, dressing_room"
1353,32472,indoor,"clean_room, chemistry_lab, biology_laboratory, beauty_salon, jewelry_shop"
1354,32496,indoor,"clean_room, chemistry_lab, biology_laboratory, beauty_salon, science_museum"
1355,32520,indoor,"clean_room, office, beauty_salon, server_room, office_cubicles"
1356,32544,indoor,"clean_room, office_cubicles, discotheque, iceberg, biology_laboratory"
1357,32568,indoor,"discotheque, clean_room, stage/indoor, hot_spring, chemistry_lab"
1358,32592,indoor,"clean_room, jewelry_shop, dressing_room, living_room, office"
1359,32616,indoor,"clean_room, chemistry_lab, archive, museum/indoor, office"
1360,32640,indoor,"clean_room, museum/indoor, archive, living_room, nursery"
1361,32664,indoor,"clean_room, museum/indoor, archive, nursery, childs_room"
1362,32688,indoor,"clean_room, living_room, archive, chemistry_lab, beauty_salon"
1363,32712,indoor,"dressing_room, clean_room, beauty_salon, discotheque, stage/indoor"
1364,32736,indoor,"clean_room, television_studio, server_room, conference_center, office"
1365,32760,indoor,"clean_room, museum/indoor, science_museum, dressing_room, clothing_store"
1366,32784,indoor,"clean_room, museum/indoor, jewelry_shop, science_museum, natural_history_museum"
1367,32808,indoor,"clean_room, museum/indoor, science_museum, art_gallery, jewelry_shop"
1368,32832,indoor,"clean_room, museum/indoor, science_museum, beauty_salon, clothing_store"
1369,32856,indoor,"clean_room, operating_room, dressing_room, biology_laboratory, chemistry_lab"
1370,32880,indoor,"clean_room, physics_laboratory, biology_laboratory, chemistry_lab, operating_room"
1371,32904,indoor,"clean_room, physics_laboratory, chemistry_lab, biology_laboratory, beauty_salon"
1372,32928,indoor,"clean_room, physics_laboratory, biology_laboratory, chemistry_lab, television_studio"
1373,32952,indoor,"clean_room, physics_laboratory, biology_laboratory, chemistry_lab, server_room"
1374,32976,indoor,"clean_room, biology_laboratory, chemistry_lab, dressing_room, locker_room"
1375,33000,indoor,"clean_room, clothing_store, dressing_room, biology_laboratory, chemistry_lab"
1376,33024,indoor,"clean_room, chemistry_lab, biology_laboratory, server_room, physics_laboratory"
1377,33048,indoor,"clean_room, chemistry_lab, server_room, archive, jewelry_shop"
1378,33072,indoor,"clean_room, chemistry_lab, locker_room, server_room, biology_laboratory"
1379,33096,indoor,"clean_room, beauty_salon, chemistry_lab, biology_laboratory, server_room"
1380,33120,indoor,"clean_room, chemistry_lab, biology_laboratory, locker_room, physics_laboratory"
1381,33144,indoor,"clean_room, dressing_room, beauty_salon, jewelry_shop, television_studio"
1382,33168,indoor,"clean_room, jewelry_shop, beauty_salon, museum/indoor, dressing_room"
1383,33192,indoor,"clean_room, museum/indoor, jewelry_shop, dressing_room, physics_laboratory"
1384,33216,indoor,"clean_room, jewelry_shop, museum/indoor, biology_laboratory, physics_laboratory"
1385,33240,indoor,"clean_room, jewelry_shop, physics_laboratory, chemistry_lab, museum/indoor"
1386,33264,indoor,"clean_room, dressing_room, beauty_salon, chemistry_lab, discotheque"
1387,33288,indoor,"server_room, elevator/door, clean_room, elevator_lobby, discotheque"
1388,33312,indoor,"server_room, elevator_lobby, clean_room, elevator/door, locker_room"
1389,33336,outdoor,"wind_farm, ice_shelf, bridge, clean_room, shower"
1390,33360,indoor,"wind_farm, conference_center, shower, stage/indoor, clean_room"
1391,33384,indoor,"clean_room, wind_farm, discotheque, shower, skyscraper"
1392,33408,indoor,"stage/indoor, discotheque, music_studio, wind_farm, stage/outdoor"
1393,33432,indoor,"hospital_room, waiting_room, nursery, beauty_salon, clean_room"
1394,33456,indoor,"hospital_room, beauty_salon, operating_room, clean_room, waiting_room"
1395,33480,indoor,"hospital_room, clean_room, operating_room, nursery, beauty_salon"
1396,33504,indoor,"nursery, living_room, clean_room, home_office, childs_room"
1397,33528,indoor,"clean_room, locker_room, server_room, hospital_room, bow_window/indoor"
1398,33552,indoor,"clean_room, server_room, locker_room, bow_window/indoor, jail_cell"
1399,33576,indoor,"clean_room, locker_room, archive, jail_cell, art_gallery"
1400,33600,indoor,"clean_room, hospital_room, office, server_room, operating_room"
1401,33624,indoor,"hospital_room, clean_room, operating_room, beauty_salon, nursery"
1402,33648,indoor,"hospital_room, nursery, beauty_salon, clean_room, operating_room"
1403,33672,indoor,"hospital_room, clean_room, nursery, operating_room, beauty_salon"
1404,33696,indoor,"hospital_room, clean_room, operating_room, nursery, waiting_room"
1405,33720,indoor,"hospital_room, clean_room, operating_room, nursery, beauty_salon"
1406,33744,indoor,"hospital_room, clean_room, operating_room, nursery, waiting_room"
1407,33768,indoor,"nursery, clean_room, hospital_room, childs_room, living_room"
1408,33792,indoor,"clean_room, beauty_salon, dressing_room, hospital_room, operating_room"
1409,33816,indoor,"clean_room, hospital_room, operating_room, biology_laboratory, airplane_cabin"
1410,33840,indoor,"clean_room, operating_room, hospital_room, dining_room, chemistry_lab"
1411,33864,indoor,"clean_room, hospital_room, biology_laboratory, chemistry_lab, office"
1412,33888,indoor,"clean_room, dining_room, conference_room, hospital_room, dining_hall"
1413,33912,indoor,"bathroom, clean_room, shower, ice_floe, igloo"
1414,33936,indoor,"bathroom, clean_room, shower, beauty_salon, dressing_room"
1415,33960,indoor,"bathroom, shower, clean_room, ice_shelf, ice_floe"
1416,33984,indoor,"clean_room, operating_room, iceberg, boat_deck, hospital_room"
1417,34008,indoor,"clean_room, museum/indoor, operating_room, hospital_room, iceberg"
1418,34032,outdoor,"clean_room, ice_floe, iceberg, oilrig, harbor"
1419,34056,indoor,"clean_room, discotheque, chemistry_lab, stage/indoor, wind_farm"
1420,34080,indoor,"clean_room, shower, bathroom, beauty_salon, chemistry_lab"
1421,34104,indoor,"server_room, clean_room, television_studio, office, music_studio"
1422,34128,indoor,"clean_room, server_room, biology_laboratory, chemistry_lab, music_studio"
1423,34152,indoor,"clean_room, biology_laboratory, chemistry_lab, physics_laboratory, server_room"
1424,34176,indoor,"clean_room, biology_laboratory, chemistry_lab, jewelry_shop, operating_room"
1425,34200,indoor,"clean_room, biology_laboratory, chemistry_lab, jewelry_shop, physics_laboratory"
1426,34224,indoor,"clean_room, biology_laboratory, chemistry_lab, jewelry_shop, pharmacy"
1427,34248,indoor,"clean_room, biology_laboratory, chemistry_lab, server_room, operating_room"
1428,34272,indoor,"clean_room, biology_laboratory, chemistry_lab, jewelry_shop, operating_room"
1429,34296,indoor,"clean_room, biology_laboratory, server_room, chemistry_lab, office"
1430,34320,indoor,"clean_room, biology_laboratory, chemistry_lab, server_room, physics_laboratory"
1431,34344,indoor,"clean_room, biology_laboratory, chemistry_lab, physics_laboratory, operating_room"
1432,34368,indoor,"clean_room, biology_laboratory, chemistry_lab, server_room, physics_laboratory"
1433,34392,indoor,"clean_room, biology_laboratory, chemistry_lab, physics_laboratory, operating_room"
1434,34416,indoor,"clean_room, biology_laboratory, chemistry_lab, physics_laboratory, operating_room"
1435,34440,indoor,"clean_room, biology_laboratory, chemistry_lab, physics_laboratory, science_museum"
1436,34464,indoor,"clean_room, biology_laboratory, chemistry_lab, server_room, physics_laboratory"
1437,34488,indoor,"clean_room, biology_laboratory, chemistry_lab, server_room, television_studio"
1438,34512,indoor,"clean_room, biology_laboratory, chemistry_lab, server_room, physics_laboratory"
1439,34536,indoor,"clean_room, biology_laboratory, art_gallery, museum/indoor, atrium/public"
1440,34560,indoor,"clean_room, biology_laboratory, chemistry_lab, server_room, atrium/public"
1441,34584,indoor,"clean_room, biology_laboratory, chemistry_lab, server_room, physics_laboratory"
1442,34608,indoor,"clean_room, biology_laboratory, chemistry_lab, server_room, physics_laboratory"
1443,34632,indoor,"clean_room, biology_laboratory, chemistry_lab, server_room, physics_laboratory"
1444,34656,indoor,"clean_room, server_room, biology_laboratory, chemistry_lab, physics_laboratory"
1445,34680,indoor,"clean_room, chemistry_lab, biology_laboratory, server_room, physics_laboratory"
1446,34704,indoor,"clean_room, biology_laboratory, chemistry_lab, server_room, archive"
1447,34728,indoor,"clean_room, biology_laboratory, server_room, chemistry_lab, archive"
1448,34752,indoor,"clean_room, biology_laboratory, chemistry_lab, server_room, physics_laboratory"
1449,34776,indoor,"clean_room, biology_laboratory, chemistry_lab, jewelry_shop, server_room"
1450,34800,indoor,"clean_room, server_room, chemistry_lab, biology_laboratory, television_studio"
1451,34824,indoor,"clean_room, biology_laboratory, server_room, chemistry_lab, hospital_room"
1452,34848,indoor,"clean_room, pharmacy, skyscraper, biology_laboratory, chemistry_lab"
1453,34872,indoor,"clean_room, chemistry_lab, biology_laboratory, shower, pharmacy"
1454,34896,indoor,"clean_room, television_studio, music_studio, skyscraper, office"
1455,34920,indoor,"clean_room, chemistry_lab, biology_laboratory, discotheque, pharmacy"
1456,34944,indoor,"clean_room, skyscraper, shower, stage/indoor, discotheque"
1457,34968,indoor,"clean_room, stage/indoor, music_studio, discotheque, television_studio"
1458,34992,indoor,"clean_room, music_studio, stage/indoor, television_studio, discotheque"
1459,35016,indoor,"clean_room, music_studio, stage/indoor, television_studio, shower"
1460,35040,indoor,"clean_room, server_room, music_studio, operating_room, beauty_salon"
1461,35064,indoor,"clean_room, music_studio, server_room, physics_laboratory, chemistry_lab"
1462,35088,indoor,"clean_room, chemistry_lab, biology_laboratory, music_studio, server_room"
1463,35112,indoor,"clean_room, office, server_room, music_studio, chemistry_lab"
1464,35136,indoor,"clean_room, chemistry_lab, biology_laboratory, dressing_room, beauty_salon"
1465,35160,indoor,"clean_room, pharmacy, skyscraper, shower, drugstore"
1466,35184,indoor,"clean_room, skyscraper, pharmacy, hospital, drugstore"
1467,35208,indoor,"clean_room, hospital, shower, music_studio, discotheque"
1468,35232,indoor,"clean_room, shower, skyscraper, tower, art_gallery"
1469,35256,indoor,"clean_room, shower, server_room, bow_window/indoor, music_studio"
1470,35280,indoor,"clean_room, discotheque, dressing_room, skyscraper, nursery"
1471,35304,indoor,"clean_room, iceberg, discotheque, chemistry_lab, dressing_room"
1472,35328,indoor,"clean_room, dining_room, nursery, chemistry_lab, dressing_room"
1473,35352,indoor,"clean_room, dining_room, chemistry_lab, dressing_room, living_room"
1474,35376,indoor,"clean_room, beauty_salon, biology_laboratory, chemistry_lab, hospital_room"
1475,35400,indoor,"clean_room, chemistry_lab, hospital_room, biology_laboratory, beauty_salon"
1476,35424,indoor,"clean_room, beauty_salon, office, biology_laboratory, chemistry_lab"
1477,35448,indoor,"clean_room, living_room, nursery, hospital_room, biology_laboratory"
1478,35472,indoor,"clean_room, living_room, computer_room, biology_laboratory, chemistry_lab"
1479,35496,indoor,"clean_room, office, computer_room, chemistry_lab, server_room"
1480,35520,indoor,"clean_room, biology_laboratory, chemistry_lab, office, server_room"
1481,35544,indoor,"clean_room, server_room, hospital_room, chemistry_lab, office"
1482,35568,indoor,"clean_room, office, chemistry_lab, biology_laboratory, computer_room"
1483,35592,indoor,"clean_room, office, server_room, computer_room, home_office"
1484,35616,indoor,"clean_room, server_room, computer_room, office, biology_laboratory"
1485,35640,indoor,"clean_room, computer_room, office, office_cubicles, biology_laboratory"
1486,35664,indoor,"clean_room, office, server_room, computer_room, hospital_room"
1487,35688,indoor,"clean_room, office, server_room, hospital_room, computer_room"
1488,35712,indoor,"clean_room, biology_laboratory, office, chemistry_lab, server_room"
1489,35736,indoor,"clean_room, chemistry_lab, biology_laboratory, office, hospital_room"
1490,35760,indoor,"clean_room, office, computer_room, biology_laboratory, chemistry_lab"
1491,35784,indoor,"clean_room, server_room, office, hospital_room, computer_room"
1492,35808,indoor,"clean_room, office, computer_room, home_office, office_cubicles"
1493,35832,indoor,"clean_room, office, computer_room, server_room, biology_laboratory"
1494,35856,indoor,"clean_room, server_room, computer_room, office, biology_laboratory"
1495,35880,indoor,"office, clean_room, biology_laboratory, chemistry_lab, computer_room"
1496,35904,indoor,"clean_room, biology_laboratory, office, computer_room, chemistry_lab"
1497,35928,indoor,"clean_room, office, computer_room, biology_laboratory, chemistry_lab"
1498,35952,indoor,"discotheque, chemistry_lab, biology_laboratory, dressing_room, clean_room"
1499,35976,indoor,"discotheque, chemistry_lab, dressing_room, biology_laboratory, stage/indoor"
1500,36000,indoor,"discotheque, chemistry_lab, shower, biology_laboratory, dressing_room"
1501,36024,indoor,"conference_center, discotheque, chemistry_lab, lecture_room, biology_laboratory"
1502,36048,indoor,"clean_room, biology_laboratory, chemistry_lab, computer_room, hospital_room"
1503,36072,indoor,"clean_room, biology_laboratory, chemistry_lab, computer_room, hospital_room"
1504,36096,indoor,"clean_room, biology_laboratory, chemistry_lab, classroom, nursery"
1505,36120,indoor,"clean_room, biology_laboratory, chemistry_lab, banquet_hall, bakery/shop"
1506,36144,indoor,"clean_room, biology_laboratory, chemistry_lab, nursery, bakery/shop"
1507,36168,indoor,"clean_room, chemistry_lab, computer_room, biology_laboratory, skyscraper"
1508,36192,indoor,"clean_room, chemistry_lab, biology_laboratory, office, computer_room"
1509,36216,indoor,"conference_center, discotheque, dressing_room, stage/indoor, clean_room"
1510,36240,indoor,"dressing_room, discotheque, stage/indoor, music_studio, clean_room"
1511,36264,indoor,"clean_room, biology_laboratory, chemistry_lab, physics_laboratory, office"
1512,36288,indoor,"clean_room, biology_laboratory, chemistry_lab, physics_laboratory, office"
1513,36312,indoor,"clean_room, conference_center, office, music_studio, biology_laboratory"
1514,36336,indoor,"clean_room, office, conference_center, music_studio, computer_room"
1515,36360,indoor,"clean_room, music_studio, office, conference_center, stage/indoor"
1516,36384,indoor,"clean_room, chemistry_lab, biology_laboratory, operating_room, hospital_room"
1517,36408,indoor,"clean_room, server_room, chemistry_lab, physics_laboratory, office"
1518,36432,indoor,"clean_room, chemistry_lab, server_room, biology_laboratory, conference_center"
1519,36456,indoor,"clean_room, chemistry_lab, biology_laboratory, conference_center, physics_laboratory"
