,frame_num,environment,places
0,0,outdoor,"ice_shelf, ice_floe, iceberg, underwater/ocean_deep, sky"
1,24,indoor,"drugstore, pharmacy, cemetery, hospital, ice_cream_parlor"
2,48,outdoor,"cemetery, ice_shelf, sky, pharmacy, drugstore"
3,72,outdoor,"cemetery, ice_shelf, sky, hot_spring, pharmacy"
4,96,outdoor,"cemetery, sky, ice_shelf, hot_spring, pharmacy"
5,120,outdoor,"cemetery, ice_shelf, sky, hot_spring, pharmacy"
6,144,outdoor,"cemetery, sky, ice_shelf, hot_spring, pharmacy"
7,168,outdoor,"cemetery, ice_shelf, pharmacy, hospital, drugstore"
8,192,indoor,"nursery, drugstore, ice_shelf, pharmacy, hospital_room"
9,216,indoor,"nursery, drugstore, ice_shelf, pharmacy, hospital_room"
10,240,indoor,"drugstore, nursery, pharmacy, beauty_salon, ice_shelf"
11,264,indoor,"drugstore, nursery, pharmacy, beauty_salon, ice_shelf"
12,288,indoor,"drugstore, nursery, beauty_salon, pharmacy, ice_shelf"
13,312,indoor,"nursery, drugstore, beauty_salon, pharmacy, hospital_room"
14,336,indoor,"nursery, drugstore, beauty_salon, pharmacy, ice_shelf"
15,360,indoor,"nursery, ice_shelf, hospital_room, clean_room, beauty_salon"
16,384,indoor,"pharmacy, hospital, drugstore, hospital_room, nursery"
17,408,indoor,"hospital, pharmacy, drugstore, ice_shelf, hospital_room"
18,432,indoor,"hospital, pharmacy, drugstore, ice_shelf, hospital_room"
19,456,indoor,"pharmacy, drugstore, hospital, ice_shelf, hospital_room"
20,480,indoor,"pharmacy, hospital, drugstore, ice_shelf, hospital_room"
21,504,indoor,"pharmacy, hospital, drugstore, ice_shelf, hospital_room"
22,528,indoor,"pharmacy, hospital, drugstore, ice_shelf, hospital_room"
23,552,indoor,"museum/indoor, ice_shelf, cemetery, kindergarden_classroom, booth/indoor"
24,576,outdoor,"ice_shelf, cemetery, ice_floe, drugstore, hot_spring"
25,600,outdoor,"ice_shelf, ice_floe, cemetery, hot_spring, ocean"
26,624,outdoor,"ice_shelf, ice_floe, cemetery, hot_spring, ocean"
27,648,outdoor,"ice_shelf, ice_floe, cemetery, hot_spring, ocean"
28,672,outdoor,"ice_shelf, ice_floe, cemetery, hot_spring, ocean"
29,696,outdoor,"ice_shelf, ice_floe, hot_spring, ocean, cemetery"
30,720,outdoor,"ice_shelf, ice_floe, hot_spring, ocean, cemetery"
31,744,outdoor,"ice_shelf, ice_floe, hot_spring, cemetery, ocean"
32,768,outdoor,"ice_shelf, ice_floe, cemetery, hot_spring, ocean"
33,792,outdoor,"ice_shelf, ice_floe, cemetery, ocean, hot_spring"
34,816,outdoor,"ice_shelf, cemetery, ice_floe, drugstore, pharmacy"
35,840,indoor,"kindergarden_classroom, ice_shelf, cemetery, classroom, museum/indoor"
36,864,outdoor,"ice_shelf, sky, pharmacy, drugstore, hospital"
37,888,outdoor,"ice_shelf, sky, pharmacy, drugstore, hospital"
38,912,outdoor,"ice_shelf, sky, pharmacy, drugstore, hospital"
39,936,outdoor,"ice_shelf, sky, pharmacy, drugstore, hospital"
40,960,outdoor,"ice_shelf, sky, pharmacy, drugstore, hospital"
41,984,indoor,"booth/indoor, kindergarden_classroom, classroom, museum/indoor, lecture_room"
42,1008,indoor,"museum/indoor, archive, cemetery, science_museum, drugstore"
43,1032,indoor,"museum/indoor, archive, cemetery, science_museum, booth/indoor"
44,1056,indoor,"museum/indoor, archive, cemetery, science_museum, drugstore"
45,1080,indoor,"museum/indoor, archive, cemetery, science_museum, drugstore"
46,1104,indoor,"museum/indoor, cemetery, archive, science_museum, drugstore"
47,1128,indoor,"museum/indoor, archive, cemetery, science_museum, drugstore"
48,1152,indoor,"museum/indoor, archive, cemetery, science_museum, drugstore"
49,1176,indoor,"museum/indoor, cemetery, archive, science_museum, drugstore"
50,1200,indoor,"museum/indoor, archive, cemetery, science_museum, drugstore"
51,1224,indoor,"museum/indoor, cemetery, archive, science_museum, drugstore"
52,1248,indoor,"museum/indoor, cemetery, archive, science_museum, drugstore"
53,1272,indoor,"museum/indoor, archive, cemetery, science_museum, drugstore"
54,1296,indoor,"museum/indoor, archive, cemetery, science_museum, drugstore"
55,1320,indoor,"museum/indoor, archive, cemetery, science_museum, drugstore"
56,1344,indoor,"museum/indoor, cemetery, archive, science_museum, drugstore"
57,1368,indoor,"cemetery, museum/indoor, archive, drugstore, booth/indoor"
58,1392,indoor,"booth/indoor, museum/indoor, cemetery, science_museum, archive"
59,1416,indoor,"booth/indoor, museum/indoor, ice_shelf, science_museum, cemetery"
60,1440,indoor,"ice_shelf, museum/indoor, booth/indoor, science_museum, cemetery"
61,1464,indoor,"ice_shelf, booth/indoor, museum/indoor, science_museum, cemetery"
62,1488,indoor,"ice_shelf, booth/indoor, museum/indoor, science_museum, archive"
63,1512,indoor,"museum/indoor, ice_shelf, science_museum, booth/indoor, cemetery"
64,1536,indoor,"ice_shelf, booth/indoor, museum/indoor, science_museum, cemetery"
65,1560,indoor,"ice_shelf, booth/indoor, museum/indoor, science_museum, cemetery"
66,1584,indoor,"ice_shelf, museum/indoor, booth/indoor, science_museum, archive"
67,1608,indoor,"ice_shelf, museum/indoor, booth/indoor, science_museum, archive"
68,1632,indoor,"museum/indoor, ice_shelf, booth/indoor, science_museum, cemetery"
69,1656,indoor,"museum/indoor, ice_shelf, booth/indoor, science_museum, cemetery"
70,1680,indoor,"museum/indoor, booth/indoor, ice_shelf, science_museum, cemetery"
71,1704,indoor,"museum/indoor, booth/indoor, ice_shelf, science_museum, cemetery"
72,1728,indoor,"booth/indoor, museum/indoor, lecture_room, classroom, kindergarden_classroom"
73,1752,indoor,"pharmacy, drugstore, hospital, nursery, hospital_room"
74,1776,indoor,"pharmacy, hospital, drugstore, hospital_room, beauty_salon"
75,1800,indoor,"pharmacy, hospital, drugstore, beauty_salon, hospital_room"
76,1824,indoor,"pharmacy, hospital, drugstore, hospital_room, beauty_salon"
77,1848,indoor,"pharmacy, drugstore, hospital, beauty_salon, hospital_room"
78,1872,indoor,"pharmacy, drugstore, hospital, hospital_room, ice_shelf"
79,1896,indoor,"pharmacy, drugstore, hospital, nursery, hospital_room"
80,1920,indoor,"pharmacy, hospital, nursery, drugstore, hospital_room"
81,1944,indoor,"pharmacy, hospital, nursery, drugstore, hospital_room"
82,1968,indoor,"pharmacy, hospital, nursery, drugstore, hospital_room"
83,1992,indoor,"pharmacy, hospital, nursery, drugstore, hospital_room"
84,2016,indoor,"pharmacy, hospital, drugstore, nursery, hospital_room"
85,2040,indoor,"pharmacy, hospital, drugstore, hospital_room, ice_shelf"
86,2064,indoor,"ice_shelf, pharmacy, iceberg, drugstore, discotheque"
87,2088,outdoor,"pharmacy, sky, drugstore, ice_shelf, hospital"
88,2112,indoor,"pharmacy, drugstore, hospital, ice_shelf, beauty_salon"
89,2136,indoor,"pharmacy, reception, drugstore, beauty_salon, hospital"
90,2160,outdoor,"ice_shelf, sky, iceberg, mountain_snowy, snowfield"
91,2184,outdoor,"sky, hot_spring, ice_shelf, volcano, iceberg"
92,2208,outdoor,"sky, shower, server_room, hot_spring, skyscraper"
93,2232,indoor,"server_room, locker_room, bow_window/indoor, shower, elevator/door"
94,2256,indoor,"server_room, stage/indoor, conference_center, shower, locker_room"
95,2280,indoor,"stage/indoor, conference_center, music_studio, beauty_salon, conference_room"
96,2304,outdoor,"skyscraper, industrial_area, clean_room, tower, downtown"
97,2328,indoor,"discotheque, stage/indoor, clean_room, classroom, chemistry_lab"
98,2352,indoor,"office, conference_center, office_cubicles, television_studio, music_studio"
99,2376,indoor,"office, dressing_room, beauty_salon, home_office, office_cubicles"
100,2400,indoor,"conference_center, chemistry_lab, office, biology_laboratory, jewelry_shop"
101,2424,indoor,"conference_center, office, jewelry_shop, music_studio, lecture_room"
102,2448,indoor,"music_studio, conference_center, beauty_salon, chemistry_lab, office"
103,2472,indoor,"music_studio, jewelry_shop, beauty_salon, conference_center, stage/indoor"
104,2496,indoor,"music_studio, jewelry_shop, office, chemistry_lab, conference_center"
105,2520,indoor,"music_studio, stage/indoor, dressing_room, beauty_salon, conference_center"
106,2544,indoor,"stage/indoor, dressing_room, music_studio, beauty_salon, chemistry_lab"
107,2568,indoor,"dressing_room, stage/indoor, music_studio, beauty_salon, shower"
108,2592,indoor,"stage/indoor, dressing_room, music_studio, ballroom, shower"
109,2616,indoor,"dressing_room, stage/indoor, music_studio, beauty_salon, ballroom"
110,2640,indoor,"clean_room, lecture_room, music_studio, stage/indoor, office"
111,2664,indoor,"clean_room, lecture_room, art_studio, classroom, office"
112,2688,indoor,"clean_room, lecture_room, music_studio, classroom, office"
113,2712,indoor,"clean_room, lecture_room, office, music_studio, classroom"
114,2736,indoor,"clean_room, music_studio, lecture_room, office, living_room"
115,2760,indoor,"clean_room, music_studio, lecture_room, office, stage/indoor"
116,2784,indoor,"clean_room, lecture_room, music_studio, classroom, office"
117,2808,indoor,"clean_room, music_studio, office, lecture_room, living_room"
118,2832,indoor,"lecture_room, classroom, auditorium, kindergarden_classroom, conference_center"
119,2856,indoor,"auditorium, lecture_room, classroom, conference_center, movie_theater/indoor"
120,2880,indoor,"auditorium, lecture_room, classroom, conference_center, kindergarden_classroom"
121,2904,indoor,"auditorium, lecture_room, classroom, conference_center, kindergarden_classroom"
122,2928,indoor,"auditorium, lecture_room, classroom, conference_center, kindergarden_classroom"
123,2952,indoor,"ballroom, stage/indoor, conference_center, music_studio, television_studio"
124,2976,indoor,"stage/indoor, music_studio, orchestra_pit, ballroom, television_studio"
125,3000,indoor,"music_studio, stage/indoor, ballroom, orchestra_pit, television_studio"
126,3024,indoor,"ballroom, stage/indoor, music_studio, orchestra_pit, television_studio"
127,3048,indoor,"ballroom, music_studio, stage/indoor, orchestra_pit, television_studio"
128,3072,indoor,"ballroom, stage/indoor, music_studio, orchestra_pit, television_studio"
129,3096,indoor,"stage/indoor, music_studio, orchestra_pit, ballroom, television_studio"
130,3120,indoor,"music_studio, ballroom, stage/indoor, television_studio, orchestra_pit"
131,3144,indoor,"ballroom, music_studio, stage/indoor, clothing_store, orchestra_pit"
132,3168,indoor,"ballroom, stage/indoor, music_studio, orchestra_pit, clothing_store"
133,3192,indoor,"ballroom, television_studio, stage/indoor, clothing_store, lobby"
134,3216,indoor,"ballroom, stage/indoor, clothing_store, television_studio, entrance_hall"
135,3240,indoor,"stage/indoor, clean_room, ballroom, clothing_store, television_studio"
136,3264,indoor,"clothing_store, ballroom, entrance_hall, nursery, museum/indoor"
137,3288,indoor,"clothing_store, dressing_room, ballroom, stage/indoor, entrance_hall"
138,3312,indoor,"stage/indoor, ballroom, clothing_store, dressing_room, bow_window/indoor"
139,3336,indoor,"dressing_room, clothing_store, clean_room, ballroom, entrance_hall"
140,3360,indoor,"dressing_room, clean_room, clothing_store, bow_window/indoor, stage/indoor"
141,3384,indoor,"clean_room, dressing_room, locker_room, nursery, clothing_store"
142,3408,indoor,"dressing_room, clean_room, locker_room, nursery, shower"
143,3432,indoor,"dressing_room, clean_room, locker_room, shower, clothing_store"
144,3456,indoor,"dressing_room, clean_room, locker_room, shower, elevator/door"
145,3480,indoor,"dressing_room, clean_room, locker_room, sauna, stage/indoor"
146,3504,indoor,"dressing_room, locker_room, clean_room, shower, elevator/door"
147,3528,indoor,"dressing_room, clean_room, shower, locker_room, sauna"
148,3552,indoor,"clean_room, dressing_room, beauty_salon, nursery, bedchamber"
149,3576,indoor,"dressing_room, nursery, clean_room, beauty_salon, music_studio"
150,3600,indoor,"clean_room, dressing_room, music_studio, stage/indoor, beauty_salon"
151,3624,indoor,"reception, conference_center, office_cubicles, computer_room, office"
152,3648,indoor,"reception, computer_room, office_cubicles, conference_center, office"
153,3672,indoor,"reception, conference_center, computer_room, office_cubicles, office"
154,3696,indoor,"reception, computer_room, conference_center, office_cubicles, office"
155,3720,indoor,"reception, office_cubicles, computer_room, office, conference_center"
156,3744,indoor,"clean_room, chemistry_lab, jewelry_shop, dressing_room, beauty_salon"
157,3768,indoor,"clean_room, chemistry_lab, music_studio, beauty_salon, television_studio"
158,3792,indoor,"clean_room, jewelry_shop, chemistry_lab, beauty_salon, clothing_store"
159,3816,indoor,"shower, dressing_room, clean_room, beauty_salon, bathroom"
160,3840,indoor,"discotheque, beauty_salon, music_studio, dressing_room, stage/indoor"
161,3864,indoor,"discotheque, dressing_room, shower, beauty_salon, music_studio"
162,3888,indoor,"discotheque, music_studio, stage/indoor, jewelry_shop, arena/performance"
163,3912,indoor,"discotheque, music_studio, jewelry_shop, stage/indoor, dressing_room"
164,3936,indoor,"discotheque, music_studio, stage/indoor, dressing_room, jewelry_shop"
165,3960,indoor,"music_studio, discotheque, dressing_room, stage/indoor, shower"
166,3984,indoor,"dressing_room, shower, jewelry_shop, bathroom, discotheque"
167,4008,indoor,"shower, dressing_room, discotheque, music_studio, stage/indoor"
168,4032,indoor,"dressing_room, shower, discotheque, music_studio, beauty_salon"
169,4056,indoor,"dressing_room, jewelry_shop, beauty_salon, clothing_store, shower"
170,4080,indoor,"dressing_room, jewelry_shop, clothing_store, shower, beauty_salon"
171,4104,indoor,"dressing_room, beauty_salon, jewelry_shop, clothing_store, discotheque"
172,4128,indoor,"dressing_room, beauty_salon, jewelry_shop, clothing_store, discotheque"
173,4152,indoor,"dressing_room, jewelry_shop, beauty_salon, clothing_store, discotheque"
174,4176,indoor,"dressing_room, jewelry_shop, beauty_salon, discotheque, clothing_store"
175,4200,indoor,"jewelry_shop, discotheque, dressing_room, shower, beauty_salon"
176,4224,indoor,"dressing_room, shower, discotheque, beauty_salon, clothing_store"
177,4248,indoor,"dressing_room, shower, discotheque, beauty_salon, clothing_store"
178,4272,indoor,"dressing_room, shower, discotheque, beauty_salon, clothing_store"
179,4296,indoor,"dressing_room, shower, discotheque, beauty_salon, bathroom"
180,4320,indoor,"dressing_room, shower, beauty_salon, discotheque, clothing_store"
181,4344,indoor,"dressing_room, shower, beauty_salon, jewelry_shop, clothing_store"
182,4368,indoor,"dressing_room, discotheque, shower, beauty_salon, stage/indoor"
183,4392,indoor,"dressing_room, discotheque, shower, music_studio, beauty_salon"
184,4416,indoor,"jewelry_shop, dressing_room, discotheque, shower, beauty_salon"
185,4440,indoor,"dressing_room, jewelry_shop, discotheque, music_studio, shower"
186,4464,indoor,"dressing_room, jewelry_shop, shower, discotheque, beauty_salon"
187,4488,indoor,"dressing_room, shower, jewelry_shop, beauty_salon, music_studio"
188,4512,indoor,"dressing_room, shower, beauty_salon, music_studio, discotheque"
189,4536,indoor,"dressing_room, discotheque, shower, music_studio, stage/indoor"
190,4560,indoor,"shower, bathroom, dressing_room, elevator/door, elevator_lobby"
191,4584,indoor,"shower, bathroom, elevator_lobby, hotel_room, dressing_room"
192,4608,indoor,"shower, bathroom, elevator_lobby, dressing_room, elevator/door"
193,4632,indoor,"shower, bathroom, dressing_room, hotel_room, elevator_lobby"
194,4656,indoor,"shower, bathroom, elevator_lobby, dressing_room, elevator/door"
195,4680,indoor,"shower, hotel_room, dressing_room, bathroom, sauna"
196,4704,indoor,"shower, dressing_room, bathroom, hotel_room, elevator_lobby"
197,4728,indoor,"shower, dressing_room, bathroom, elevator_lobby, hotel_room"
198,4752,indoor,"shower, dressing_room, bathroom, elevator_lobby, elevator/door"
199,4776,indoor,"dressing_room, shower, bathroom, clean_room, locker_room"
200,4800,indoor,"dressing_room, shower, bathroom, locker_room, elevator_lobby"
201,4824,indoor,"shower, bathroom, dressing_room, elevator/door, elevator_lobby"
202,4848,indoor,"dressing_room, shower, clean_room, bathroom, bow_window/indoor"
203,4872,indoor,"shower, dressing_room, clean_room, bathroom, locker_room"
204,4896,indoor,"dressing_room, shower, stage/indoor, clean_room, elevator/door"
205,4920,indoor,"dressing_room, clean_room, nursery, shower, music_studio"
206,4944,indoor,"conference_center, office, television_studio, music_studio, conference_room"
207,4968,indoor,"conference_center, music_studio, television_studio, office, clean_room"
208,4992,indoor,"conference_center, conference_room, music_studio, office, television_studio"
209,5016,indoor,"conference_center, music_studio, office, television_studio, conference_room"
210,5040,indoor,"conference_center, music_studio, television_studio, office, conference_room"
211,5064,indoor,"conference_center, music_studio, office, conference_room, television_studio"
212,5088,indoor,"conference_center, music_studio, conference_room, office, television_studio"
213,5112,indoor,"conference_center, music_studio, office, television_studio, conference_room"
214,5136,indoor,"conference_center, music_studio, television_studio, conference_room, office"
215,5160,indoor,"conference_center, music_studio, office, conference_room, television_studio"
216,5184,indoor,"biology_laboratory, chemistry_lab, conference_center, office, television_studio"
217,5208,indoor,"biology_laboratory, chemistry_lab, airplane_cabin, discotheque, science_museum"
218,5232,indoor,"airplane_cabin, biology_laboratory, conference_center, chemistry_lab, discotheque"
219,5256,indoor,"stage/indoor, discotheque, dressing_room, television_studio, beauty_salon"
220,5280,indoor,"stage/indoor, discotheque, clean_room, dressing_room, ice_cream_parlor"
221,5304,indoor,"discotheque, stage/indoor, conference_center, music_studio, television_studio"
222,5328,indoor,"clean_room, music_studio, museum/indoor, office, stage/indoor"
223,5352,indoor,"music_studio, clean_room, office, living_room, dressing_room"
224,5376,indoor,"clean_room, music_studio, office, museum/indoor, living_room"
225,5400,indoor,"clean_room, music_studio, office, television_studio, living_room"
226,5424,indoor,"clean_room, music_studio, jewelry_shop, office, dressing_room"
227,5448,indoor,"clean_room, music_studio, jewelry_shop, office, stage/indoor"
228,5472,indoor,"clean_room, office, conference_center, music_studio, biology_laboratory"
229,5496,indoor,"conference_center, office, conference_room, clean_room, television_studio"
230,5520,indoor,"conference_center, office, television_studio, conference_room, music_studio"
231,5544,indoor,"conference_center, music_studio, office, television_studio, conference_room"
232,5568,indoor,"conference_center, office, television_studio, music_studio, computer_room"
233,5592,indoor,"conference_center, television_studio, office, music_studio, clean_room"
234,5616,indoor,"television_studio, conference_center, music_studio, clean_room, office"
235,5640,indoor,"discotheque, chemistry_lab, hospital_room, clean_room, biology_laboratory"
236,5664,indoor,"clean_room, hospital_room, hot_spring, discotheque, nursery"
237,5688,indoor,"discotheque, conference_center, clean_room, hospital_room, office"
238,5712,indoor,"conference_center, discotheque, television_studio, stage/indoor, office"
239,5736,indoor,"clean_room, hospital_room, conference_center, biology_laboratory, office"
240,5760,indoor,"nursery, hospital_room, clean_room, beauty_salon, conference_center"
241,5784,indoor,"biology_laboratory, television_studio, discotheque, chemistry_lab, science_museum"
242,5808,indoor,"television_studio, biology_laboratory, discotheque, chemistry_lab, conference_center"
243,5832,indoor,"discotheque, television_studio, conference_center, biology_laboratory, office"
244,5856,outdoor,"discotheque, hot_spring, sky, iceberg, nursery"
245,5880,indoor,"conference_center, discotheque, stage/indoor, sky, wind_farm"
246,5904,indoor,"discotheque, wind_farm, nursery, hot_spring, stage/indoor"
247,5928,outdoor,"discotheque, iceberg, sky, clean_room, hot_spring"
248,5952,outdoor,"hot_spring, sky, discotheque, iceberg, wind_farm"
249,5976,outdoor,"hot_spring, beauty_salon, discotheque, iceberg, ice_shelf"
250,6000,indoor,"hot_spring, conference_center, beauty_salon, discotheque, hospital_room"
251,6024,indoor,"hospital_room, discotheque, beauty_salon, clean_room, conference_center"
252,6048,indoor,"discotheque, conference_center, beauty_salon, chemistry_lab, hospital_room"
253,6072,indoor,"hot_spring, conference_center, discotheque, sky, stage/indoor"
254,6096,indoor,"discotheque, hot_spring, stage/indoor, conference_center, sky"
255,6120,indoor,"clean_room, conference_center, office, biology_laboratory, music_studio"
256,6144,indoor,"conference_center, conference_room, office, music_studio, television_studio"
257,6168,indoor,"conference_center, conference_room, office, television_studio, music_studio"
258,6192,indoor,"conference_center, biology_laboratory, music_studio, conference_room, chemistry_lab"
259,6216,indoor,"conference_center, conference_room, television_studio, office, music_studio"
260,6240,indoor,"conference_center, clean_room, biology_laboratory, music_studio, television_studio"
261,6264,indoor,"conference_center, office, television_studio, conference_room, physics_laboratory"
262,6288,indoor,"conference_center, office, physics_laboratory, clean_room, conference_room"
263,6312,indoor,"conference_center, office, music_studio, television_studio, conference_room"
264,6336,indoor,"conference_center, office, music_studio, television_studio, conference_room"
265,6360,indoor,"clean_room, entrance_hall, stage/indoor, ballroom, museum/indoor"
266,6384,indoor,"clean_room, ballroom, throne_room, entrance_hall, museum/indoor"
267,6408,indoor,"clean_room, clothing_store, ballroom, throne_room, museum/indoor"
268,6432,indoor,"ballroom, music_studio, clean_room, stage/indoor, beauty_salon"
269,6456,indoor,"ballroom, music_studio, stage/indoor, orchestra_pit, clean_room"
270,6480,indoor,"music_studio, stage/indoor, orchestra_pit, ballroom, television_studio"
271,6504,indoor,"office, biology_laboratory, clean_room, conference_center, music_studio"
272,6528,indoor,"clean_room, conference_center, biology_laboratory, television_studio, physics_laboratory"
273,6552,indoor,"conference_center, television_studio, music_studio, conference_room, office"
274,6576,indoor,"conference_center, television_studio, music_studio, conference_room, office"
275,6600,indoor,"conference_center, music_studio, television_studio, stage/indoor, discotheque"
276,6624,indoor,"conference_center, music_studio, television_studio, office, legislative_chamber"
277,6648,indoor,"conference_center, music_studio, television_studio, office, legislative_chamber"
278,6672,indoor,"conference_center, television_studio, music_studio, office, conference_room"
279,6696,indoor,"conference_center, television_studio, music_studio, office, legislative_chamber"
280,6720,indoor,"conference_center, music_studio, television_studio, conference_room, office"
281,6744,indoor,"conference_center, music_studio, television_studio, conference_room, office"
282,6768,indoor,"conference_center, television_studio, music_studio, clean_room, biology_laboratory"
283,6792,indoor,"chemistry_lab, biology_laboratory, conference_center, clean_room, music_studio"
284,6816,indoor,"music_studio, clean_room, stage/indoor, office, television_studio"
285,6840,indoor,"music_studio, stage/indoor, clean_room, conference_center, lecture_room"
286,6864,indoor,"clean_room, biology_laboratory, chemistry_lab, music_studio, lecture_room"
287,6888,indoor,"clean_room, music_studio, lecture_room, stage/indoor, office"
288,6912,indoor,"lecture_room, stage/indoor, classroom, music_studio, conference_center"
289,6936,indoor,"lecture_room, classroom, beauty_salon, conference_center, office"
290,6960,indoor,"clean_room, beauty_salon, stage/indoor, nursery, ice_cream_parlor"
291,6984,indoor,"clean_room, hangar/outdoor, airport_terminal, iceberg, hospital_room"
292,7008,indoor,"airport_terminal, wind_farm, drugstore, pharmacy, industrial_area"
293,7032,indoor,"ice_shelf, chemistry_lab, ice_floe, drugstore, clean_room"
294,7056,outdoor,"ice_shelf, ice_floe, iceberg, science_museum, chemistry_lab"
295,7080,outdoor,"iceberg, ice_shelf, clean_room, chemistry_lab, ice_floe"
296,7104,outdoor,"iceberg, ice_shelf, clean_room, chemistry_lab, ice_floe"
297,7128,indoor,"pharmacy, discotheque, clean_room, drugstore, chemistry_lab"
298,7152,outdoor,"discotheque, sky, igloo, iceberg, aquarium"
299,7176,outdoor,"discotheque, iceberg, ice_shelf, crevasse, sky"
300,7200,indoor,"discotheque, chemistry_lab, aquarium, biology_laboratory, stage/indoor"
301,7224,outdoor,"wind_farm, discotheque, sky, iceberg, ice_floe"
302,7248,indoor,"discotheque, chemistry_lab, underwater/ocean_deep, biology_laboratory, stage/indoor"
303,7272,indoor,"chemistry_lab, biology_laboratory, clean_room, discotheque, physics_laboratory"
304,7296,outdoor,"iceberg, discotheque, sky, igloo, aquarium"
305,7320,outdoor,"discotheque, iceberg, aquarium, igloo, ice_shelf"
306,7344,indoor,"discotheque, chemistry_lab, aquarium, biology_laboratory, stage/indoor"
307,7368,indoor,"discotheque, aquarium, iceberg, igloo, chemistry_lab"
308,7392,indoor,"pharmacy, drugstore, nursery, hospital, discotheque"
309,7416,indoor,"hospital_room, pharmacy, nursery, hospital, drugstore"
310,7440,indoor,"chemistry_lab, discotheque, jewelry_shop, clean_room, biology_laboratory"
311,7464,indoor,"shower, clean_room, chemistry_lab, bathroom, igloo"
312,7488,outdoor,"discotheque, sky, igloo, iceberg, underwater/ocean_deep"
313,7512,outdoor,"discotheque, sky, iceberg, ice_shelf, aquarium"
314,7536,outdoor,"discotheque, sky, stage/indoor, iceberg, igloo"
315,7560,indoor,"discotheque, sky, iceberg, chemistry_lab, stage/indoor"
316,7584,indoor,"jewelry_shop, discotheque, nursery, gift_shop, candy_store"
