,frame_num,environment,places
3285,78840,indoor,"clean_room, nursery, dressing_room, locker_room, beauty_salon"
3286,78864,indoor,"beauty_salon, dressing_room, nursery, clean_room, jewelry_shop"
3287,78888,indoor,"clean_room, jewelry_shop, chemistry_lab, dressing_room, biology_laboratory"
3288,78912,indoor,"clean_room, biology_laboratory, locker_room, chemistry_lab, dressing_room"
3289,78936,indoor,"clean_room, dressing_room, clothing_store, locker_room, jewelry_shop"
3290,78960,indoor,"clean_room, dressing_room, clothing_store, locker_room, jewelry_shop"
3291,78984,indoor,"clean_room, nursery, jewelry_shop, dressing_room, chemistry_lab"
3292,79008,indoor,"jewelry_shop, dressing_room, clean_room, biology_laboratory, beauty_salon"
3293,79032,indoor,"dressing_room, jewelry_shop, nursery, locker_room, clean_room"
3294,79056,indoor,"dressing_room, locker_room, jewelry_shop, nursery, clean_room"
3295,79080,indoor,"clean_room, dressing_room, nursery, locker_room, beauty_salon"
3296,79104,indoor,"dressing_room, locker_room, clean_room, beauty_salon, nursery"
3297,79128,indoor,"clean_room, beauty_salon, dressing_room, nursery, locker_room"
3298,79152,indoor,"clean_room, dressing_room, locker_room, beauty_salon, nursery"
3299,79176,indoor,"clean_room, office, biology_laboratory, chemistry_lab, operating_room"
3300,79200,indoor,"clean_room, office, biology_laboratory, operating_room, chemistry_lab"
3301,79224,indoor,"clean_room, office, biology_laboratory, chemistry_lab, operating_room"
3302,79248,indoor,"clean_room, locker_room, server_room, elevator/door, chemistry_lab"
3303,79272,indoor,"chemistry_lab, clean_room, biology_laboratory, beauty_salon, discotheque"
3304,79296,indoor,"clean_room, nursery, chemistry_lab, science_museum, clothing_store"
3305,79320,indoor,"clean_room, chemistry_lab, biology_laboratory, beauty_salon, music_studio"
3306,79344,indoor,"clean_room, chemistry_lab, biology_laboratory, music_studio, physics_laboratory"
3307,79368,indoor,"chemistry_lab, clean_room, biology_laboratory, music_studio, physics_laboratory"
3308,79392,indoor,"clean_room, chemistry_lab, biology_laboratory, operating_room, physics_laboratory"
3309,79416,indoor,"clean_room, chemistry_lab, biology_laboratory, music_studio, operating_room"
3310,79440,indoor,"clean_room, chemistry_lab, biology_laboratory, music_studio, server_room"
3311,79464,indoor,"clean_room, chemistry_lab, music_studio, biology_laboratory, physics_laboratory"
3312,79488,indoor,"clean_room, chemistry_lab, biology_laboratory, conference_center, physics_laboratory"
3313,79512,indoor,"clean_room, chemistry_lab, biology_laboratory, physics_laboratory, music_studio"
3314,79536,indoor,"clean_room, biology_laboratory, conference_center, operating_room, chemistry_lab"
3315,79560,indoor,"clean_room, biology_laboratory, chemistry_lab, operating_room, physics_laboratory"
3316,79584,indoor,"clean_room, biology_laboratory, chemistry_lab, operating_room, physics_laboratory"
3317,79608,indoor,"clean_room, chemistry_lab, biology_laboratory, operating_room, physics_laboratory"
3318,79632,indoor,"clean_room, chemistry_lab, biology_laboratory, music_studio, operating_room"
3319,79656,indoor,"clean_room, biology_laboratory, chemistry_lab, science_museum, operating_room"
3320,79680,indoor,"clean_room, chemistry_lab, biology_laboratory, jewelry_shop, conference_center"
3321,79704,indoor,"clean_room, chemistry_lab, physics_laboratory, office, conference_center"
3322,79728,indoor,"clean_room, chemistry_lab, physics_laboratory, office, biology_laboratory"
3323,79752,indoor,"clean_room, physics_laboratory, chemistry_lab, elevator/door, office"
3324,79776,indoor,"clean_room, server_room, physics_laboratory, office, elevator_lobby"
3325,79800,indoor,"clean_room, airplane_cabin, chemistry_lab, physics_laboratory, office"
3326,79824,indoor,"clean_room, physics_laboratory, chemistry_lab, office, conference_center"
3327,79848,indoor,"clean_room, conference_center, office, chemistry_lab, physics_laboratory"
3328,79872,indoor,"office, conference_center, clean_room, physics_laboratory, reception"
3329,79896,indoor,"conference_center, office, clean_room, physics_laboratory, chemistry_lab"
3330,79920,indoor,"office, clean_room, conference_center, physics_laboratory, biology_laboratory"
3331,79944,indoor,"clean_room, office, conference_center, physics_laboratory, biology_laboratory"
3332,79968,indoor,"clean_room, biology_laboratory, conference_center, physics_laboratory, chemistry_lab"
3333,79992,indoor,"clean_room, biology_laboratory, chemistry_lab, physics_laboratory, music_studio"
3334,80016,indoor,"clean_room, science_museum, jewelry_shop, biology_laboratory, natural_history_museum"
3335,80040,indoor,"clean_room, science_museum, biology_laboratory, conference_center, chemistry_lab"
3336,80064,indoor,"conference_center, clean_room, science_museum, lecture_room, music_studio"
3337,80088,indoor,"conference_center, biology_laboratory, clean_room, physics_laboratory, lecture_room"
3338,80112,indoor,"conference_center, lecture_room, science_museum, office, conference_room"
3339,80136,indoor,"conference_center, lecture_room, science_museum, clean_room, music_studio"
3340,80160,indoor,"clean_room, biology_laboratory, chemistry_lab, science_museum, conference_center"
3341,80184,indoor,"clean_room, biology_laboratory, chemistry_lab, science_museum, conference_center"
3342,80208,indoor,"clean_room, conference_center, science_museum, lecture_room, biology_laboratory"
3343,80232,indoor,"clean_room, biology_laboratory, science_museum, office, chemistry_lab"
3344,80256,indoor,"biology_laboratory, conference_center, office, clean_room, chemistry_lab"
3345,80280,indoor,"clean_room, biology_laboratory, chemistry_lab, lecture_room, office"
3346,80304,indoor,"clean_room, biology_laboratory, chemistry_lab, conference_center, office"
3347,80328,indoor,"biology_laboratory, chemistry_lab, conference_center, music_studio, science_museum"
3348,80352,indoor,"biology_laboratory, chemistry_lab, conference_center, science_museum, clean_room"
3349,80376,indoor,"clean_room, biology_laboratory, chemistry_lab, clothing_store, music_studio"
3350,80400,indoor,"clean_room, chemistry_lab, biology_laboratory, music_studio, operating_room"
3351,80424,indoor,"clean_room, conference_center, office, lecture_room, biology_laboratory"
3352,80448,indoor,"clean_room, science_museum, music_studio, chemistry_lab, museum/indoor"
3353,80472,indoor,"clean_room, biology_laboratory, chemistry_lab, physics_laboratory, beauty_salon"
3354,80496,indoor,"discotheque, stage/indoor, science_museum, wind_farm, chemistry_lab"
3355,80520,outdoor,"skyscraper, server_room, downtown, office_building, tower"
3356,80544,outdoor,"skyscraper, office_building, downtown, science_museum, server_room"
3357,80568,outdoor,"skyscraper, office_building, downtown, science_museum, museum/indoor"
3358,80592,outdoor,"skyscraper, science_museum, museum/indoor, downtown, industrial_area"
3359,80616,outdoor,"skyscraper, science_museum, museum/indoor, office_building, downtown"
3360,80640,outdoor,"skyscraper, office_building, science_museum, museum/indoor, downtown"
3361,80664,outdoor,"skyscraper, office_building, downtown, science_museum, tower"
3362,80688,outdoor,"skyscraper, office_building, museum/indoor, downtown, science_museum"
3363,80712,indoor,"skyscraper, museum/indoor, science_museum, office_building, server_room"
3364,80736,indoor,"skyscraper, museum/indoor, science_museum, office_building, drugstore"
3365,80760,indoor,"skyscraper, museum/indoor, science_museum, office_building, drugstore"
3366,80784,outdoor,"skyscraper, downtown, ice_shelf, office_building, industrial_area"
3367,80808,outdoor,"skyscraper, server_room, hospital, downtown, industrial_area"
3368,80832,indoor,"booth/indoor, reception, home_theater, lecture_room, science_museum"
3369,80856,indoor,"reception, nursery, jewelry_shop, booth/indoor, bakery/shop"
3370,80880,indoor,"jewelry_shop, science_museum, nursery, booth/indoor, museum/indoor"
3371,80904,outdoor,"skyscraper, office_building, tower, shower, server_room"
3372,80928,outdoor,"skyscraper, tower, downtown, office_building, industrial_area"
3373,80952,outdoor,"skyscraper, stage/indoor, tower, sky, music_studio"
3374,80976,indoor,"conference_center, sky, office, hangar/outdoor, conference_room"
3375,81000,indoor,"stage/indoor, arena/performance, conference_center, sky, auditorium"
3376,81024,indoor,"stage/indoor, arena/performance, conference_center, stage/outdoor, sky"
3377,81048,indoor,"stage/indoor, arena/performance, conference_center, music_studio, sky"
3378,81072,outdoor,"sky, wind_farm, stage/indoor, tower, harbor"
3379,81096,indoor,"stage/indoor, conference_center, sky, martial_arts_gym, arena/performance"
3380,81120,outdoor,"sky, martial_arts_gym, stage/indoor, igloo, skyscraper"
3381,81144,indoor,"stage/indoor, arena/performance, sky, discotheque, movie_theater/indoor"
3382,81168,indoor,"stage/indoor, arena/performance, discotheque, stage/outdoor, sky"
3383,81192,outdoor,"skyscraper, tower, office_building, sky, stage/indoor"
3384,81216,indoor,"stage/indoor, arena/performance, discotheque, sky, movie_theater/indoor"
3385,81240,indoor,"stage/indoor, arena/performance, discotheque, movie_theater/indoor, sky"
3386,81264,indoor,"stage/indoor, arena/performance, sky, movie_theater/indoor, discotheque"
3387,81288,outdoor,"sky, tower, wind_farm, stage/indoor, harbor"
3388,81312,outdoor,"sky, stage/indoor, wind_farm, skyscraper, tower"
3389,81336,indoor,"stage/indoor, conference_center, music_studio, skyscraper, auditorium"
3390,81360,outdoor,"skyscraper, tower, sky, office_building, downtown"
3391,81384,outdoor,"sky, pagoda, airfield, runway, volcano"
3392,81408,indoor,"stage/indoor, sky, discotheque, arena/performance, auditorium"
3393,81432,indoor,"stage/indoor, sky, arena/performance, conference_center, discotheque"
3394,81456,indoor,"stage/indoor, arena/performance, conference_center, sky, auditorium"
3395,81480,indoor,"arena/performance, stage/indoor, conference_center, sky, auditorium"
3396,81504,indoor,"arena/performance, stage/indoor, sky, conference_center, auditorium"
3397,81528,indoor,"arena/performance, stage/indoor, sky, auditorium, conference_center"
3398,81552,indoor,"arena/performance, stage/indoor, conference_center, sky, auditorium"
3399,81576,indoor,"arena/performance, stage/indoor, conference_center, auditorium, lecture_room"
3400,81600,indoor,"arena/performance, stage/indoor, conference_center, wind_farm, auditorium"
3401,81624,outdoor,"sky, wind_farm, windmill, tower, skyscraper"
3402,81648,outdoor,"tower, skyscraper, wind_farm, sky, stage/indoor"
3403,81672,outdoor,"skyscraper, tower, office_building, windmill, downtown"
3404,81696,outdoor,"skyscraper, server_room, tower, office_building, art_gallery"
3405,81720,indoor,"server_room, stage/indoor, music_studio, shower, skyscraper"
3406,81744,indoor,"server_room, skyscraper, tower, archive, art_gallery"
3407,81768,indoor,"server_room, conference_center, stage/indoor, music_studio, lecture_room"
3408,81792,indoor,"stage/indoor, reception, stage/outdoor, arena/performance, playroom"
3409,81816,outdoor,"fishpond, oilrig, lake/natural, islet, pond"
3410,81840,outdoor,"oilrig, sky, lake/natural, fishpond, pond"
3411,81864,outdoor,"arena/performance, stage/indoor, oilrig, industrial_area, wind_farm"
3412,81888,outdoor,"skyscraper, office_building, downtown, industrial_area, hospital"
3413,81912,outdoor,"skyscraper, office_building, downtown, tower, lake/natural"
3414,81936,indoor,"clean_room, chemistry_lab, stage/indoor, music_studio, science_museum"
3415,81960,indoor,"clean_room, chemistry_lab, music_studio, science_museum, shower"
3416,81984,indoor,"clean_room, chemistry_lab, science_museum, music_studio, biology_laboratory"
3417,82008,indoor,"clean_room, chemistry_lab, science_museum, biology_laboratory, archive"
3418,82032,indoor,"science_museum, skyscraper, music_studio, stage/indoor, art_gallery"
3419,82056,indoor,"clean_room, museum/indoor, reception, office, archive"
3420,82080,outdoor,"islet, aquarium, sky, iceberg, science_museum"
3421,82104,outdoor,"pond, lake/natural, islet, iceberg, underwater/ocean_deep"
3422,82128,outdoor,"discotheque, wind_farm, sky, pond, windmill"
3423,82152,outdoor,"iceberg, ice_shelf, igloo, ice_floe, windmill"
3424,82176,outdoor,"skyscraper, industrial_area, office_building, clean_room, tower"
3425,82200,indoor,"skyscraper, art_gallery, reception, artists_loft, hospital"
3426,82224,indoor,"art_gallery, artists_loft, skyscraper, museum/indoor, drugstore"
3427,82248,indoor,"skyscraper, art_gallery, server_room, corridor, artists_loft"
3428,82272,indoor,"drugstore, pharmacy, beauty_salon, server_room, clean_room"
3429,82296,indoor,"artists_loft, bathroom, art_gallery, clean_room, shower"
3430,82320,indoor,"clean_room, beauty_salon, chemistry_lab, pharmacy, drugstore"
3431,82344,indoor,"clean_room, pharmacy, chemistry_lab, drugstore, beauty_salon"
3432,82368,indoor,"stage/indoor, conference_center, discotheque, office, reception"
3433,82392,indoor,"conference_center, office, stage/indoor, television_studio, reception"
3434,82416,indoor,"conference_center, office, reception, office_cubicles, conference_room"
3435,82440,indoor,"conference_center, office, office_cubicles, conference_room, stage/indoor"
3436,82464,indoor,"conference_center, office, stage/indoor, television_studio, office_cubicles"
3437,82488,indoor,"conference_center, office, office_cubicles, television_studio, beauty_salon"
3438,82512,indoor,"conference_center, office, conference_room, office_cubicles, television_studio"
3439,82536,indoor,"conference_center, office, reception, legislative_chamber, office_cubicles"
3440,82560,indoor,"conference_center, office, conference_room, television_studio, reception"
3441,82584,indoor,"conference_center, office, reception, office_cubicles, conference_room"
3442,82608,indoor,"conference_center, office, legislative_chamber, conference_room, reception"
3443,82632,indoor,"conference_center, office, legislative_chamber, television_studio, reception"
3444,82656,indoor,"conference_center, office, conference_room, reception, television_studio"
3445,82680,indoor,"conference_center, television_studio, office, conference_room, beauty_salon"
3446,82704,indoor,"conference_center, office, reception, television_studio, conference_room"
3447,82728,indoor,"conference_center, office, television_studio, reception, office_cubicles"
3448,82752,indoor,"conference_center, office, television_studio, reception, office_cubicles"
3449,82776,indoor,"conference_center, office, television_studio, reception, office_cubicles"
3450,82800,indoor,"conference_center, office, reception, office_cubicles, conference_room"
3451,82824,indoor,"conference_center, office, conference_room, legislative_chamber, reception"
3452,82848,indoor,"discotheque, stage/indoor, sky, hot_spring, aquarium"
3453,82872,indoor,"discotheque, stage/indoor, shower, aquarium, sky"
3454,82896,indoor,"discotheque, stage/indoor, aquarium, arena/performance, shower"
3455,82920,indoor,"discotheque, stage/indoor, beauty_salon, aquarium, arena/performance"
3456,82944,indoor,"discotheque, stage/indoor, arena/performance, music_studio, dressing_room"
3457,82968,indoor,"discotheque, stage/indoor, beauty_salon, shower, chemistry_lab"
3458,82992,indoor,"discotheque, stage/indoor, music_studio, television_studio, beauty_salon"
3459,83016,indoor,"discotheque, sky, hot_spring, stage/indoor, aquarium"
3460,83040,indoor,"discotheque, stage/indoor, music_studio, arena/performance, beauty_salon"
3461,83064,indoor,"discotheque, stage/indoor, arena/performance, sky, beauty_salon"
3462,83088,indoor,"discotheque, stage/indoor, arena/performance, sky, beauty_salon"
3463,83112,indoor,"discotheque, stage/indoor, music_studio, shower, chemistry_lab"
3464,83136,indoor,"discotheque, stage/indoor, arena/performance, chemistry_lab, television_studio"
3465,83160,indoor,"discotheque, stage/indoor, arena/performance, television_studio, hot_spring"
3466,83184,indoor,"discotheque, stage/indoor, beauty_salon, arena/performance, shower"
3467,83208,indoor,"discotheque, stage/indoor, music_studio, television_studio, hot_spring"
3468,83232,indoor,"discotheque, aquarium, sky, hot_spring, beauty_salon"
3469,83256,indoor,"discotheque, aquarium, sky, hot_spring, shower"
3470,83280,indoor,"discotheque, arena/performance, stage/indoor, hot_spring, underwater/ocean_deep"
3471,83304,indoor,"stage/indoor, discotheque, conference_center, television_studio, arena/performance"
3472,83328,indoor,"conference_center, stage/indoor, discotheque, arena/performance, sky"
3473,83352,indoor,"arena/performance, stage/indoor, discotheque, conference_center, sky"
3474,83376,indoor,"discotheque, stage/indoor, conference_center, arena/performance, sky"
3475,83400,indoor,"discotheque, stage/indoor, conference_center, arena/performance, sky"
3476,83424,indoor,"conference_center, discotheque, stage/indoor, arena/performance, television_studio"
3477,83448,indoor,"stage/indoor, arena/performance, discotheque, conference_center, sky"
3478,83472,indoor,"discotheque, stage/indoor, sky, arena/performance, aquarium"
3479,83496,indoor,"discotheque, stage/indoor, arena/performance, aquarium, sky"
3480,83520,indoor,"discotheque, stage/indoor, beauty_salon, dressing_room, music_studio"
3481,83544,indoor,"discotheque, stage/indoor, arena/performance, music_studio, sky"
3482,83568,indoor,"discotheque, stage/indoor, arena/performance, sky, hot_spring"
3483,83592,indoor,"discotheque, stage/indoor, arena/performance, television_studio, sky"
3484,83616,indoor,"discotheque, arena/performance, stage/indoor, sky, hot_spring"
3485,83640,indoor,"discotheque, stage/indoor, arena/performance, conference_center, hot_spring"
3486,83664,indoor,"discotheque, sky, stage/indoor, hot_spring, conference_center"
3487,83688,indoor,"discotheque, conference_center, stage/indoor, sky, television_studio"
3488,83712,indoor,"discotheque, stage/indoor, sky, hot_spring, conference_center"
3489,83736,indoor,"conference_center, office, television_studio, conference_room, legislative_chamber"
3490,83760,indoor,"conference_center, office, conference_room, legislative_chamber, television_studio"
3491,83784,indoor,"conference_center, television_studio, stage/indoor, office, beauty_salon"
3492,83808,indoor,"conference_center, television_studio, office, conference_room, stage/indoor"
3493,83832,indoor,"conference_center, stage/indoor, auditorium, legislative_chamber, television_studio"
3494,83856,indoor,"conference_center, television_studio, office, stage/indoor, conference_room"
3495,83880,indoor,"conference_center, television_studio, stage/indoor, office, conference_room"
3496,83904,indoor,"conference_center, office, television_studio, legislative_chamber, stage/indoor"
3497,83928,indoor,"conference_center, office, reception, television_studio, conference_room"
3498,83952,indoor,"conference_center, office, television_studio, conference_room, reception"
3499,83976,indoor,"conference_center, office, conference_room, stage/indoor, reception"
3500,84000,indoor,"conference_center, office, stage/indoor, television_studio, legislative_chamber"
3501,84024,indoor,"conference_center, stage/indoor, office, reception, office_cubicles"
3502,84048,indoor,"conference_center, office, reception, stage/indoor, conference_room"
3503,84072,indoor,"conference_center, stage/indoor, office, television_studio, conference_room"
3504,84096,indoor,"conference_center, office, television_studio, beauty_salon, conference_room"
3505,84120,indoor,"conference_center, television_studio, stage/indoor, office, conference_room"
3506,84144,indoor,"conference_center, stage/indoor, office, reception, office_cubicles"
3507,84168,indoor,"conference_center, office, reception, conference_room, stage/indoor"
3508,84192,indoor,"conference_center, office, television_studio, stage/indoor, beauty_salon"
3509,84216,indoor,"conference_center, office, television_studio, stage/indoor, beauty_salon"
3510,84240,indoor,"conference_center, office, beauty_salon, stage/indoor, television_studio"
3511,84264,indoor,"conference_center, stage/indoor, television_studio, office, beauty_salon"
3512,84288,indoor,"conference_center, office, conference_room, television_studio, reception"
3513,84312,indoor,"conference_center, office, television_studio, conference_room, reception"
3514,84336,indoor,"conference_center, television_studio, office, stage/indoor, reception"
3515,84360,indoor,"conference_center, office, television_studio, stage/indoor, beauty_salon"
3516,84384,indoor,"conference_center, office, conference_room, television_studio, reception"
3517,84408,indoor,"conference_center, television_studio, office, conference_room, stage/indoor"
3518,84432,indoor,"conference_center, office, television_studio, conference_room, legislative_chamber"
3519,84456,indoor,"conference_center, office, legislative_chamber, conference_room, stage/indoor"
3520,84480,indoor,"server_room, archive, clean_room, pharmacy, music_studio"
3521,84504,indoor,"clean_room, archive, server_room, nursery, music_studio"
3522,84528,indoor,"clean_room, server_room, pharmacy, drugstore, archive"
3523,84552,indoor,"server_room, clean_room, art_gallery, artists_loft, staircase"
3524,84576,indoor,"server_room, clean_room, staircase, basement, mezzanine"
3525,84600,indoor,"server_room, staircase, archive, music_studio, beauty_salon"
3526,84624,indoor,"conference_center, music_studio, office, discotheque, clean_room"
3527,84648,indoor,"discotheque, stage/indoor, chemistry_lab, music_studio, skyscraper"
3528,84672,indoor,"shower, clean_room, bathroom, chemistry_lab, ice_shelf"
3529,84696,indoor,"discotheque, shower, bathroom, jacuzzi/indoor, hot_spring"
3530,84720,indoor,"childs_room, nursery, bedroom, ice_floe, bathroom"
3531,84744,indoor,"nursery, childs_room, jewelry_shop, shower, bathroom"
3532,84768,indoor,"reception, iceberg, ice_shelf, office, conference_room"
3533,84792,indoor,"discotheque, music_studio, physics_laboratory, science_museum, clean_room"
3534,84816,indoor,"clean_room, jewelry_shop, shower, chemistry_lab, discotheque"
3535,84840,indoor,"clean_room, jewelry_shop, physics_laboratory, chemistry_lab, music_studio"
3536,84864,indoor,"clean_room, science_museum, music_studio, museum/indoor, office"
3537,84888,indoor,"childs_room, nursery, clean_room, science_museum, museum/indoor"
3538,84912,indoor,"museum/indoor, nursery, clean_room, playroom, music_studio"
3539,84936,indoor,"clean_room, playroom, discotheque, nursery, science_museum"
3540,84960,indoor,"playroom, nursery, childs_room, clean_room, science_museum"
3541,84984,indoor,"science_museum, nursery, playroom, kindergarden_classroom, museum/indoor"
3542,85008,indoor,"science_museum, natural_history_museum, nursery, aquarium, kindergarden_classroom"
3543,85032,outdoor,"nursery, sky, water_tower, windmill, tower"
3544,85056,indoor,"sky, elevator/door, stage/indoor, tower, discotheque"
3545,85080,indoor,"stage/indoor, sky, pond, nursery, arena/performance"
3546,85104,indoor,"conference_center, locker_room, lecture_room, server_room, conference_room"
3547,85128,indoor,"stage/indoor, server_room, elevator/door, music_studio, discotheque"
3548,85152,indoor,"nursery, server_room, locker_room, music_studio, shower"
3549,85176,indoor,"music_studio, nursery, locker_room, server_room, dressing_room"
3550,85200,indoor,"music_studio, server_room, stage/indoor, locker_room, science_museum"
3551,85224,indoor,"music_studio, server_room, stage/indoor, office, clean_room"
3552,85248,indoor,"locker_room, server_room, music_studio, clean_room, stage/indoor"
3553,85272,indoor,"music_studio, clean_room, locker_room, server_room, dressing_room"
3554,85296,indoor,"jewelry_shop, music_studio, locker_room, clean_room, dressing_room"
3555,85320,indoor,"music_studio, jewelry_shop, locker_room, dressing_room, clean_room"
3556,85344,indoor,"locker_room, music_studio, clean_room, server_room, dressing_room"
3557,85368,indoor,"music_studio, stage/indoor, conference_center, television_studio, server_room"
3558,85392,indoor,"nursery, jewelry_shop, science_museum, natural_history_museum, music_studio"
3559,85416,indoor,"nursery, museum/indoor, art_gallery, clean_room, jewelry_shop"
3560,85440,indoor,"server_room, clean_room, shower, archive, nursery"
3561,85464,indoor,"nursery, archive, jewelry_shop, booth/indoor, art_gallery"
3562,85488,indoor,"archive, booth/indoor, nursery, lecture_room, museum/indoor"
3563,85512,indoor,"nursery, jewelry_shop, archive, booth/indoor, office"
3564,85536,indoor,"nursery, museum/indoor, bow_window/indoor, art_gallery, booth/indoor"
3565,85560,indoor,"jewelry_shop, museum/indoor, clean_room, art_gallery, chemistry_lab"
3566,85584,indoor,"museum/indoor, jewelry_shop, nursery, art_gallery, booth/indoor"
3567,85608,indoor,"nursery, booth/indoor, archive, museum/indoor, bow_window/indoor"
3568,85632,indoor,"chemistry_lab, biology_laboratory, drugstore, skyscraper, discotheque"
3569,85656,outdoor,"pagoda, tower, temple/asia, mosque/outdoor, sky"
3570,85680,indoor,"clean_room, closet, shower, bow_window/indoor, nursery"
3571,85704,indoor,"locker_room, server_room, childs_room, shower, clean_room"
3572,85728,indoor,"childs_room, server_room, playroom, shower, clean_room"
3573,85752,indoor,"childs_room, playroom, tower, art_gallery, shower"
3574,85776,indoor,"server_room, shower, clean_room, skyscraper, childs_room"
3575,85800,indoor,"playroom, childs_room, locker_room, shower, clean_room"
3576,85824,indoor,"childs_room, playroom, shower, nursery, locker_room"
3577,85848,indoor,"childs_room, nursery, playroom, shower, clean_room"
3578,85872,indoor,"childs_room, playroom, nursery, bow_window/indoor, shower"
3579,85896,indoor,"childs_room, playroom, nursery, clean_room, jewelry_shop"
3580,85920,indoor,"playroom, aquarium, nursery, server_room, childs_room"
3581,85944,indoor,"oilrig, childs_room, sushi_bar, fishpond, bakery/shop"
